Sheet: Sheet1
A1: AGGREGATE Function
A3: Result | B3: of:=AND([.B8:.B95]) -> true
A7: Sheet | B7: Result | C7: Description
A8: 1 | B8: of:=AND([Sheet2.C2:.C92]) -> true | C8: Simple AGGREGATE formulas with local references and values
B9: of:=AND([winfrieds_testCase.C13:.C292]) -> true | C9: Complete variations of AGGREGATE formulas with local references and values

Sheet: Sheet2
A1: Function | B1: Expected | C1: Correct | D1: FunctionString | E1: Comment | J1: #DIV/0! | K1: 82 | O1: ColumnOne | P1: ColumnTwo | Q1: ColumnThree
A2: of:=COM.MICROSOFT.AGGREGATE(4; 6; [.J2:.J12]) -> 96 | B2: 96 | C2: of:=[.A2]=[.B2] -> true | D2: of:=FORMULA([.A2]) -> =AGGREGATE(4, 6, J2:J12) | J2: 72 | K2: 65 | O2: 34 | P2: 11 | Q2: 12
A3: of:=COM.MICROSOFT.AGGREGATE(14; 6; [.J2:.J12]; 3) -> 72 | B3: 72 | C3: of:=[.A3]=[.B3] -> true | D3: of:=FORMULA([.A3]) -> =AGGREGATE(14, 6, J2:J12, 3) | J3: 30 | K3: 95 | O3: 10 | P3: 56 | Q3: 35 | S3: 13
A4: of:=COM.MICROSOFT.AGGREGATE(15; 6; [.J2:.J12]) ->  | B4: error | C4: of:=ISERROR([.A4]) -> true | D4: of:=FORMULA([.A4]) -> =AGGREGATE(15, 6, J2:J12) | J4: #NUM! | K4: 63 | O4: #DIV/0! | P4: 5 | Q4: 3
A5: of:=COM.MICROSOFT.AGGREGATE(4;1;[.O2:.O9]) -> 34 | B5: 34 | C5: of:=[.A5]=[.B5] -> true | D5: of:=FORMULA([.A5]) -> =AGGREGATE(4,1,O2:O9) | J5: 31 | K5: 53 | O5: 20 | P5: 8 | Q5: 1 | S5: 5
A6: of:=COM.MICROSOFT.AGGREGATE(9;5;[.O5:.Q5]) -> 29 | B6: 29 | C6: of:=[.A6]=[.B6] -> true | D6: of:=FORMULA([.A6]) -> =AGGREGATE(9,5,O5:Q5) | J6: 96 | K6: 71 | O6: 0 | P6: 8 | Q6: 9
A7: of:=COM.MICROSOFT.AGGREGATE(9;5;[.P2:.P9]) -> 115 | B7: 115 | C7: of:=[.A7]=[.B7] -> true | D7: of:=FORMULA([.A7]) -> =AGGREGATE(9,5,P2:P9) | J7: 32 | K7: 55 | O7: #VALUE! | P7: 20 | Q7: 21
A8: of:=COM.MICROSOFT.AGGREGATE(13;5;[.P2:.P9]) -> 8 | B8: 8 | C8: of:=[.A8]=[.B8] -> true | D8: of:=FORMULA([.A8]) -> =AGGREGATE(13,5,P2:P9) | J8: 81 | K8: 83 | O8: 5 | P8: 7 | Q8: 8
A9: of:=COM.MICROSOFT.AGGREGATE(1;5;[.P2:.P9]) -> 14.375 | B9: 14.375 | C9: of:=[.A9]=[.B9] -> true | D9: of:=FORMULA([.A9]) -> =AGGREGATE(1,5,P2:P9) | J9: 33 | K9: 100 | O9: 14 | P9: 0 | Q9: 5
A10: of:=COM.MICROSOFT.AGGREGATE(2;5;[.P2:.P9]) -> 8 | B10: 8 | C10: of:=[.A10]=[.B10] -> true | D10: of:=FORMULA([.A10]) -> =AGGREGATE(2,5,P2:P9) | J10: 53 | K10: 91
A11: of:=COM.MICROSOFT.AGGREGATE(3;5;[.P2:.P9]) -> 8 | B11: 8 | C11: of:=[.A11]=[.B11] -> true | D11: of:=FORMULA([.A11]) -> =AGGREGATE(3,5,P2:P9) | J11: 34 | K11: 89
A12: of:=COM.MICROSOFT.AGGREGATE(4;5;[.P2:.P9]) -> 56 | B12: 56 | C12: of:=[.A12]=[.B12] -> true | D12: of:=FORMULA([.A12]) -> =AGGREGATE(4,5,P2:P9)
A13: of:=COM.MICROSOFT.AGGREGATE(5;5;[.P2:.P9]) -> 0 | B13: 0 | C13: of:=[.A13]=[.B13] -> true | D13: of:=FORMULA([.A13]) -> =AGGREGATE(5,5,P2:P9)
A14: of:=COM.MICROSOFT.AGGREGATE(6;5;[.P2:.P9]) -> 0 | B14: 0 | C14: of:=[.A14]=[.B14] -> true | D14: of:=FORMULA([.A14]) -> =AGGREGATE(6,5,P2:P9)
A15: of:=COM.MICROSOFT.AGGREGATE(7;5;[.P2:.P9]) -> 17.7517604760767 | B15: 17.7517604760767 | C15: of:=[.A15]=[.B15] -> true | D15: of:=FORMULA([.A15]) -> =AGGREGATE(7,5,P2:P9)
A16: of:=COM.MICROSOFT.AGGREGATE(8;5;[.P2:.P9]) -> 16.6052514283886 | B16: 16.6052514283886 | C16: of:=[.A16]=[.B16] -> true | D16: of:=FORMULA([.A16]) -> =AGGREGATE(8,5,P2:P9)
A17: of:=COM.MICROSOFT.AGGREGATE(9;5;[.P2:.P9]) -> 115 | B17: 115 | C17: of:=[.A17]=[.B17] -> true | D17: of:=FORMULA([.A17]) -> =AGGREGATE(9,5,P2:P9)
A18: of:=COM.MICROSOFT.AGGREGATE(10;5;[.P2:.P9]) -> 315.125 | B18: 315.125 | C18: of:=[.A18]=[.B18] -> true | D18: of:=FORMULA([.A18]) -> =AGGREGATE(10,5,P2:P9) | J18: Function index | K18: Function applied | M18: Option index | N18: Option applied
A19: of:=COM.MICROSOFT.AGGREGATE(11;5;[.P2:.P9]) -> 275.734375 | B19: 275.734375 | C19: of:=[.A19]=[.B19] -> true | D19: of:=FORMULA([.A19]) -> =AGGREGATE(11,5,P2:P9) | J19: 1 | K19: AVERAGE | M19: 0 | N19: Ignore only nested SUBTOTAL and AGGREGATE functions
A20: of:=COM.MICROSOFT.AGGREGATE(12;5;[.P2:.P9]) -> 8 | B20: 8 | C20: of:=[.A20]=[.B20] -> true | D20: of:=FORMULA([.A20]) -> =AGGREGATE(12,5,P2:P9) | J20: 2 | K20: COUNT | M20: 1 | N20: Ignore only hidden rows, nested SUBTOTAL and AGGREGATE functions
A21: of:=COM.MICROSOFT.AGGREGATE(14;5;[.P2:.P9]) ->  | B21: error | C21: of:=ISERROR([.A21]) -> true | D21: of:=FORMULA([.A21]) -> =AGGREGATE(14,5,P2:P9) | J21: 3 | K21: COUNTA | M21: 2 | N21: Ignore only errors, nested SUBTOTAL and AGGREGATE functions
A22: of:=COM.MICROSOFT.AGGREGATE(15;5;[.P2:.P9]) ->  | B22: error | C22: of:=ISERROR([.A22]) -> true | D22: of:=FORMULA([.A22]) -> =AGGREGATE(15,5,P2:P9) | J22: 4 | K22: MAX | M22: 3 | N22: Ignore hidden rows, errors, nested SUBTOTAL and AGGREGATE functions
A23: of:=COM.MICROSOFT.AGGREGATE(16;5;[.P2:.P9]) ->  | B23: error | C23: of:=ISERROR([.A23]) -> true | D23: of:=FORMULA([.A23]) -> =AGGREGATE(16,5,P2:P9) | J23: 5 | K23: MIN | M23: 4 | N23: Ignore nothing
A24: of:=COM.MICROSOFT.AGGREGATE(17;5;[.P2:.P9]) ->  | B24: error | C24: of:=ISERROR([.A24]) -> true | D24: of:=FORMULA([.A24]) -> =AGGREGATE(17,5,P2:P9) | J24: 6 | K24: PRODUCT | M24: 5 | N24: Ignore only hidden rows
A25: of:=COM.MICROSOFT.AGGREGATE(18;5;[.P2:.P9]) ->  | B25: error | C25: of:=ISERROR([.A25]) -> true | D25: of:=FORMULA([.A25]) -> =AGGREGATE(18,5,P2:P9) | J25: 7 | K25: STDEV.S | M25: 6 | N25: Ignore only errors
A26: of:=COM.MICROSOFT.AGGREGATE(19;5;[.P2:.P9]) ->  | B26: error | C26: of:=ISERROR([.A26]) -> true | D26: of:=FORMULA([.A26]) -> =AGGREGATE(19,5,P2:P9) | J26: 8 | K26: STDEV.P | M26: 7 | N26: Ignore only hidden rows and errors
A27: of:=COM.MICROSOFT.AGGREGATE(4;5;[.O2:.O9]) -> 34 | B27: 34 | C27: of:=[.A27]=[.B27] -> true | D27: of:=FORMULA([.A27]) -> =AGGREGATE(4,5,O2:O9) | J27: 9 | K27: SUM
A28: of:=COM.MICROSOFT.AGGREGATE(2;2;[.O2:.O9]) -> 6 | B28: 6 | C28: of:=[.A28]=[.B28] -> true | D28: of:=FORMULA([.A28]) -> =AGGREGATE(2,2,O2:O9) | J28: 10 | K28: VAR.S
A29: of:=COM.MICROSOFT.AGGREGATE(2;0;[.O2:.O9]) -> 6 | B29: 6 | C29: of:=[.A29]=[.B29] -> true | D29: of:=FORMULA([.A29]) -> =AGGREGATE(2,0,O2:O9) | J29: 11 | K29: VAR.P
A30: of:=COM.MICROSOFT.AGGREGATE(2;1;[.O2:.O9]) -> 6 | B30: 6 | C30: of:=[.A30]=[.B30] -> true | D30: of:=FORMULA([.A30]) -> =AGGREGATE(2,1,O2:O9) | J30: 12 | K30: MEDIAN
A31: of:=COM.MICROSOFT.AGGREGATE(2;3;[.O2:.O9]) -> 6 | B31: 6 | C31: of:=[.A31]=[.B31] -> true | D31: of:=FORMULA([.A31]) -> =AGGREGATE(2,3,O2:O9) | J31: 13 | K31: MODE.SNGL
A32: of:=COM.MICROSOFT.AGGREGATE(2;4;[.O2:.O9]) -> 6 | B32: 6 | C32: of:=[.A32]=[.B32] -> true | D32: of:=FORMULA([.A32]) -> =AGGREGATE(2,4,O2:O9) | J32: 14 | K32: LARGE
A33: of:=COM.MICROSOFT.AGGREGATE(2;5;[.O2:.O9]) -> 6 | B33: 6 | C33: of:=[.A33]=[.B33] -> true | D33: of:=FORMULA([.A33]) -> =AGGREGATE(2,5,O2:O9) | J33: 15 | K33: SMALL
A34: of:=COM.MICROSOFT.AGGREGATE(2;6;[.O2:.O9]) -> 6 | B34: 6 | C34: of:=[.A34]=[.B34] -> true | D34: of:=FORMULA([.A34]) -> =AGGREGATE(2,6,O2:O9) | J34: 16 | K34: PERCENTILE.INC
A35: of:=COM.MICROSOFT.AGGREGATE(2;7;[.O2:.O9]) -> 6 | B35: 6 | C35: of:=[.A35]=[.B35] -> true | D35: of:=FORMULA([.A35]) -> =AGGREGATE(2,7,O2:O9) | J35: 17 | K35: QUARTILE.INC
A36: of:=COM.MICROSOFT.AGGREGATE(2;8;[.O2:.O9]) ->  | B36: error | C36: of:=ISERROR([.A36]) -> true | D36: of:=FORMULA([.A36]) -> =AGGREGATE(2,8,O2:O9) | J36: 18 | K36: PERCENTILE.EXC
A37: of:=COM.MICROSOFT.AGGREGATE([.O2:.O9]) ->  | B37: error | C37: of:=ISERROR([.A37]) -> true | D37: of:=FORMULA([.A37]) -> =AGGREGATE(O2:O9) | J37: 19 | K37: QUARTILE.EXC

Sheet: winfrieds_testCase
C1: of:=1/0 ->  | D1: 82 | H1: Testcase from Bug 73148 - Add Excel 2010 function AGGREGATE
C2: 72 | D2: 65
C3: 30 | D3: 95
C4: of:=SUM("a";2) ->  | D4: 63
C5: 31 | D5: -55555
C6: 96 | D6: 71
C7: 33 | D7: 55
C8: of:=COM.MICROSOFT.AGGREGATE(1;4;[.H1:.H11]) ->  | D8: 83
C9: of:=SUBTOTAL(4;[.H1:.H11]) -> 0 | D9: 100
C10: 53 | D10: 91
C11: 34 | D11: 89
A13: of:=COM.MICROSOFT.AGGREGATE( [.K$13];[.$J17];[.$C$1:.$C$11]) ->  | B13: error | C13: of:=ISERROR([.A13]) -> true | D13: of:=FORMULA([.A13]) -> =AGGREGATE( K$13,$J17,$C$1:$C$11) | J13: func.num | K13: 1 | L13: 2 | M13: 3 | N13: 4 | O13: 5 | P13: 6 | Q13: 7 | R13: 8 | S13: 9 | T13: 10 | U13: 11 | V13: 12 | W13: 13 | X13: 14 | Y13: 15 | Z13: 16 | AA13: 17 | AB13: 18 | AC13: 19
A14: of:=COM.MICROSOFT.AGGREGATE( [.K$13];[.$J18];[.$C$1:.$C$11]) ->  | B14: error | C14: of:=ISERROR([.A14]) -> true | D14: of:=FORMULA([.A14]) -> =AGGREGATE( K$13,$J18,$C$1:$C$11) | J14: func.name | K14: AVERAGE | L14: COUNT | M14: COUNTA | N14: MAX | O14: MIN | P14: PRODUCT | Q14: STDEV.S | R14: STDEV.P | S14: SUM | T14: VAR.S | U14: VAR.P | V14: MEDIAN | W14: MODE.SNGL | X14: LARGE | Y14: SMALL | Z14: PERCENTILE.INC | AA14: QUARTILE.INC | AB14: PERCENTILE.EXC | AC14: QUARTILE.EXC
A15: of:=COM.MICROSOFT.AGGREGATE( [.K$13];[.$J19];[.$C$1:.$C$11]) ->  | B15: error | C15: of:=ISERROR([.A15]) -> true | D15: of:=FORMULA([.A15]) -> =AGGREGATE( K$13,$J19,$C$1:$C$11)
A16: of:=COM.MICROSOFT.AGGREGATE( [.K$13];[.$J20];[.$C$1:.$C$11]) -> 49.8571428571429 | B16: 49.8571428571429 | C16: of:=[.A16]=[.B16] -> true | D16: of:=FORMULA([.A16]) -> =AGGREGATE( K$13,$J20,$C$1:$C$11) | J16: option | K16: behaviour
A17: of:=COM.MICROSOFT.AGGREGATE( [.K$13];[.$J21];[.$C$1:.$C$11]) -> 42.1666666666667 | B17: 42.1666666666667 | C17: of:=[.A17]=[.B17] -> true | D17: of:=FORMULA([.A17]) -> =AGGREGATE( K$13,$J21,$C$1:$C$11) | K17: ignore nested SUBTOTAL/AGGREGATE
A18: of:=COM.MICROSOFT.AGGREGATE( [.K$13];[.$J22];[.$C$1:.$C$11]) ->  | B18: error | C18: of:=ISERROR([.A18]) -> true | D18: of:=FORMULA([.A18]) -> =AGGREGATE( K$13,$J22,$C$1:$C$11) | J18: 0 | K18: ignore nested SUBTOTAL/AGGREGATE
A19: of:=COM.MICROSOFT.AGGREGATE( [.K$13];[.$J23];[.$C$1:.$C$11]) ->  | B19: error | C19: of:=ISERROR([.A19]) -> true | D19: of:=FORMULA([.A19]) -> =AGGREGATE( K$13,$J23,$C$1:$C$11) | J19: 1 | K19: ignore hidden rows, nested SUBTOTAL/AGGREGATE
A20: of:=COM.MICROSOFT.AGGREGATE( [.K$13];[.$J24];[.$C$1:.$C$11]) -> 43.625 | B20: 43.625 | C20: of:=[.A20]=[.B20] -> true | D20: of:=FORMULA([.A20]) -> =AGGREGATE( K$13,$J24,$C$1:$C$11) | J20: 2 | K20: ignore error values, nested SUBTOTAL/AGGREGATE
A21: of:=COM.MICROSOFT.AGGREGATE( [.K$13];[.$J25];[.$C$1:.$C$11]) -> 36.1428571428571 | B21: 36.1428571428571 | C21: of:=[.A21]=[.B21] -> true | D21: of:=FORMULA([.A21]) -> =AGGREGATE( K$13,$J25,$C$1:$C$11) | J21: 3 | K21: ignore hidden rows, error values, nested SUBTOTAL/AGGREGATE
A22: of:=COM.MICROSOFT.AGGREGATE( [.L$13];[.$J17];[.$C$1:.$C$11]) -> 7 | B22: 7 | C22: of:=[.A22]=[.B22] -> true | D22: of:=FORMULA([.A22]) -> =AGGREGATE( L$13,$J17,$C$1:$C$11) | J22: 4 | K22: ignore nothing
A23: of:=COM.MICROSOFT.AGGREGATE( [.L$13];[.$J18];[.$C$1:.$C$11]) -> 7 | B23: 7 | C23: of:=[.A23]=[.B23] -> true | D23: of:=FORMULA([.A23]) -> =AGGREGATE( L$13,$J18,$C$1:$C$11) | J23: 5 | K23: ignore hidden rows
A24: of:=COM.MICROSOFT.AGGREGATE( [.L$13];[.$J19];[.$C$1:.$C$11]) -> 6 | B24: 6 | C24: of:=[.A24]=[.B24] -> true | D24: of:=FORMULA([.A24]) -> =AGGREGATE( L$13,$J19,$C$1:$C$11) | J24: 6 | K24: ignore error values
A25: of:=COM.MICROSOFT.AGGREGATE( [.L$13];[.$J20];[.$C$1:.$C$11]) -> 7 | B25: 7 | C25: of:=[.A25]=[.B25] -> true | D25: of:=FORMULA([.A25]) -> =AGGREGATE( L$13,$J20,$C$1:$C$11) | J25: 7 | K25: ignore hidden rows, error values
A26: of:=COM.MICROSOFT.AGGREGATE( [.L$13];[.$J21];[.$C$1:.$C$11]) -> 6 | B26: 6 | C26: of:=[.A26]=[.B26] -> true | D26: of:=FORMULA([.A26]) -> =AGGREGATE( L$13,$J21,$C$1:$C$11)
A27: of:=COM.MICROSOFT.AGGREGATE( [.L$13];[.$J22];[.$C$1:.$C$11]) -> 8 | B27: 8 | C27: of:=[.A27]=[.B27] -> true | D27: of:=FORMULA([.A27]) -> =AGGREGATE( L$13,$J22,$C$1:$C$11)
A28: of:=COM.MICROSOFT.AGGREGATE( [.L$13];[.$J23];[.$C$1:.$C$11]) -> 7 | B28: 7 | C28: of:=[.A28]=[.B28] -> true | D28: of:=FORMULA([.A28]) -> =AGGREGATE( L$13,$J23,$C$1:$C$11)
A29: of:=COM.MICROSOFT.AGGREGATE( [.L$13];[.$J24];[.$C$1:.$C$11]) -> 8 | B29: 8 | C29: of:=[.A29]=[.B29] -> true | D29: of:=FORMULA([.A29]) -> =AGGREGATE( L$13,$J24,$C$1:$C$11)
A30: of:=COM.MICROSOFT.AGGREGATE( [.L$13];[.$J25];[.$C$1:.$C$11]) -> 7 | B30: 7 | C30: of:=[.A30]=[.B30] -> true | D30: of:=FORMULA([.A30]) -> =AGGREGATE( L$13,$J25,$C$1:$C$11)
A31: of:=COM.MICROSOFT.AGGREGATE( [.M$13];[.$J17];[.$C$1:.$C$11]) -> 9 | B31: 9 | C31: of:=[.A31]=[.B31] -> true | D31: of:=FORMULA([.A31]) -> =AGGREGATE( M$13,$J17,$C$1:$C$11)
A32: of:=COM.MICROSOFT.AGGREGATE( [.M$13];[.$J18];[.$C$1:.$C$11]) -> 9 | B32: 9 | C32: of:=[.A32]=[.B32] -> true | D32: of:=FORMULA([.A32]) -> =AGGREGATE( M$13,$J18,$C$1:$C$11)
A33: of:=COM.MICROSOFT.AGGREGATE( [.M$13];[.$J19];[.$C$1:.$C$11]) -> 8 | B33: 8 | C33: of:=[.A33]=[.B33] -> true | D33: of:=FORMULA([.A33]) -> =AGGREGATE( M$13,$J19,$C$1:$C$11)
A34: of:=COM.MICROSOFT.AGGREGATE( [.M$13];[.$J20];[.$C$1:.$C$11]) -> 7 | B34: 7 | C34: of:=[.A34]=[.B34] -> true | D34: of:=FORMULA([.A34]) -> =AGGREGATE( M$13,$J20,$C$1:$C$11)
A35: of:=COM.MICROSOFT.AGGREGATE( [.M$13];[.$J21];[.$C$1:.$C$11]) -> 6 | B35: 6 | C35: of:=[.A35]=[.B35] -> true | D35: of:=FORMULA([.A35]) -> =AGGREGATE( M$13,$J21,$C$1:$C$11)
A36: of:=COM.MICROSOFT.AGGREGATE( [.M$13];[.$J22];[.$C$1:.$C$11]) -> 11 | B36: 11 | C36: of:=[.A36]=[.B36] -> true | D36: of:=FORMULA([.A36]) -> =AGGREGATE( M$13,$J22,$C$1:$C$11)
A37: of:=COM.MICROSOFT.AGGREGATE( [.M$13];[.$J23];[.$C$1:.$C$11]) -> 10 | B37: 10 | C37: of:=[.A37]=[.B37] -> true | D37: of:=FORMULA([.A37]) -> =AGGREGATE( M$13,$J23,$C$1:$C$11)
A38: of:=COM.MICROSOFT.AGGREGATE( [.M$13];[.$J24];[.$C$1:.$C$11]) -> 8 | B38: 8 | C38: of:=[.A38]=[.B38] -> true | D38: of:=FORMULA([.A38]) -> =AGGREGATE( M$13,$J24,$C$1:$C$11)
A39: of:=COM.MICROSOFT.AGGREGATE( [.M$13];[.$J25];[.$C$1:.$C$11]) -> 7 | B39: 7 | C39: of:=[.A39]=[.B39] -> true | D39: of:=FORMULA([.A39]) -> =AGGREGATE( M$13,$J25,$C$1:$C$11)
A40: of:=COM.MICROSOFT.AGGREGATE( [.N$13];[.$J17];[.$C$1:.$C$11]) ->  | B40: error | C40: of:=ISERROR([.A40]) -> true | D40: of:=FORMULA([.A40]) -> =AGGREGATE( N$13,$J17,$C$1:$C$11)
A41: of:=COM.MICROSOFT.AGGREGATE( [.N$13];[.$J18];[.$C$1:.$C$11]) ->  | B41: error | C41: of:=ISERROR([.A41]) -> true | D41: of:=FORMULA([.A41]) -> =AGGREGATE( N$13,$J18,$C$1:$C$11)
A42: of:=COM.MICROSOFT.AGGREGATE( [.N$13];[.$J19];[.$C$1:.$C$11]) ->  | B42: error | C42: of:=ISERROR([.A42]) -> true | D42: of:=FORMULA([.A42]) -> =AGGREGATE( N$13,$J19,$C$1:$C$11)
A43: of:=COM.MICROSOFT.AGGREGATE( [.N$13];[.$J20];[.$C$1:.$C$11]) -> 96 | B43: 96 | C43: of:=[.A43]=[.B43] -> true | D43: of:=FORMULA([.A43]) -> =AGGREGATE( N$13,$J20,$C$1:$C$11)
A44: of:=COM.MICROSOFT.AGGREGATE( [.N$13];[.$J21];[.$C$1:.$C$11]) -> 72 | B44: 72 | C44: of:=[.A44]=[.B44] -> true | D44: of:=FORMULA([.A44]) -> =AGGREGATE( N$13,$J21,$C$1:$C$11)
A45: of:=COM.MICROSOFT.AGGREGATE( [.N$13];[.$J22];[.$C$1:.$C$11]) ->  | B45: error | C45: of:=ISERROR([.A45]) -> true | D45: of:=FORMULA([.A45]) -> =AGGREGATE( N$13,$J22,$C$1:$C$11)
A46: of:=COM.MICROSOFT.AGGREGATE( [.N$13];[.$J23];[.$C$1:.$C$11]) ->  | B46: error | C46: of:=ISERROR([.A46]) -> true | D46: of:=FORMULA([.A46]) -> =AGGREGATE( N$13,$J23,$C$1:$C$11)
A47: of:=COM.MICROSOFT.AGGREGATE( [.N$13];[.$J24];[.$C$1:.$C$11]) -> 96 | B47: 96 | C47: of:=[.A47]=[.B47] -> true | D47: of:=FORMULA([.A47]) -> =AGGREGATE( N$13,$J24,$C$1:$C$11)
A48: of:=COM.MICROSOFT.AGGREGATE( [.N$13];[.$J25];[.$C$1:.$C$11]) -> 72 | B48: 72 | C48: of:=[.A48]=[.B48] -> true | D48: of:=FORMULA([.A48]) -> =AGGREGATE( N$13,$J25,$C$1:$C$11)
A49: of:=COM.MICROSOFT.AGGREGATE( [.O$13];[.$J17];[.$C$1:.$C$11]) ->  | B49: error | C49: of:=ISERROR([.A49]) -> true | D49: of:=FORMULA([.A49]) -> =AGGREGATE( O$13,$J17,$C$1:$C$11)
A50: of:=COM.MICROSOFT.AGGREGATE( [.O$13];[.$J18];[.$C$1:.$C$11]) ->  | B50: error | C50: of:=ISERROR([.A50]) -> true | D50: of:=FORMULA([.A50]) -> =AGGREGATE( O$13,$J18,$C$1:$C$11)
A51: of:=COM.MICROSOFT.AGGREGATE( [.O$13];[.$J19];[.$C$1:.$C$11]) ->  | B51: error | C51: of:=ISERROR([.A51]) -> true | D51: of:=FORMULA([.A51]) -> =AGGREGATE( O$13,$J19,$C$1:$C$11)
A52: of:=COM.MICROSOFT.AGGREGATE( [.O$13];[.$J20];[.$C$1:.$C$11]) -> 30 | B52: 30 | C52: of:=[.A52]=[.B52] -> true | D52: of:=FORMULA([.A52]) -> =AGGREGATE( O$13,$J20,$C$1:$C$11)
A53: of:=COM.MICROSOFT.AGGREGATE( [.O$13];[.$J21];[.$C$1:.$C$11]) -> 30 | B53: 30 | C53: of:=[.A53]=[.B53] -> true | D53: of:=FORMULA([.A53]) -> =AGGREGATE( O$13,$J21,$C$1:$C$11)
A54: of:=COM.MICROSOFT.AGGREGATE( [.O$13];[.$J22];[.$C$1:.$C$11]) ->  | B54: error | C54: of:=ISERROR([.A54]) -> true | D54: of:=FORMULA([.A54]) -> =AGGREGATE( O$13,$J22,$C$1:$C$11)
A55: of:=COM.MICROSOFT.AGGREGATE( [.O$13];[.$J23];[.$C$1:.$C$11]) ->  | B55: error | C55: of:=ISERROR([.A55]) -> true | D55: of:=FORMULA([.A55]) -> =AGGREGATE( O$13,$J23,$C$1:$C$11)
A56: of:=COM.MICROSOFT.AGGREGATE( [.O$13];[.$J24];[.$C$1:.$C$11]) -> 0 | B56: 0 | C56: of:=[.A56]=[.B56] -> true | D56: of:=FORMULA([.A56]) -> =AGGREGATE( O$13,$J24,$C$1:$C$11)
A57: of:=COM.MICROSOFT.AGGREGATE( [.O$13];[.$J25];[.$C$1:.$C$11]) -> 0 | B57: 0 | C57: of:=[.A57]=[.B57] -> true | D57: of:=FORMULA([.A57]) -> =AGGREGATE( O$13,$J25,$C$1:$C$11)
A58: of:=COM.MICROSOFT.AGGREGATE( [.P$13];[.$J17];[.$C$1:.$C$11]) ->  | B58: error | C58: of:=ISERROR([.A58]) -> true | D58: of:=FORMULA([.A58]) -> =AGGREGATE( P$13,$J17,$C$1:$C$11)
A59: of:=COM.MICROSOFT.AGGREGATE( [.P$13];[.$J18];[.$C$1:.$C$11]) ->  | B59: error | C59: of:=ISERROR([.A59]) -> true | D59: of:=FORMULA([.A59]) -> =AGGREGATE( P$13,$J18,$C$1:$C$11)
A60: of:=COM.MICROSOFT.AGGREGATE( [.P$13];[.$J19];[.$C$1:.$C$11]) ->  | B60: error | C60: of:=ISERROR([.A60]) -> true | D60: of:=FORMULA([.A60]) -> =AGGREGATE( P$13,$J19,$C$1:$C$11)
A61: of:=COM.MICROSOFT.AGGREGATE( [.P$13];[.$J20];[.$C$1:.$C$11]) -> 382256962560 | B61: 382256962560 | C61: of:=[.A61]=[.B61] -> true | D61: of:=FORMULA([.A61]) -> =AGGREGATE( P$13,$J20,$C$1:$C$11)
A62: of:=COM.MICROSOFT.AGGREGATE( [.P$13];[.$J21];[.$C$1:.$C$11]) -> 3981843360 | B62: 3981843360 | C62: of:=[.A62]=[.B62] -> true | D62: of:=FORMULA([.A62]) -> =AGGREGATE( P$13,$J21,$C$1:$C$11)
A63: of:=COM.MICROSOFT.AGGREGATE( [.P$13];[.$J22];[.$C$1:.$C$11]) ->  | B63: error | C63: of:=ISERROR([.A63]) -> true | D63: of:=FORMULA([.A63]) -> =AGGREGATE( P$13,$J22,$C$1:$C$11)
A64: of:=COM.MICROSOFT.AGGREGATE( [.P$13];[.$J23];[.$C$1:.$C$11]) ->  | B64: error | C64: of:=ISERROR([.A64]) -> true | D64: of:=FORMULA([.A64]) -> =AGGREGATE( P$13,$J23,$C$1:$C$11)
A65: of:=COM.MICROSOFT.AGGREGATE( [.P$13];[.$J24];[.$C$1:.$C$11]) -> 0 | B65: 0 | C65: of:=[.A65]=[.B65] -> true | D65: of:=FORMULA([.A65]) -> =AGGREGATE( P$13,$J24,$C$1:$C$11)
A66: of:=COM.MICROSOFT.AGGREGATE( [.P$13];[.$J25];[.$C$1:.$C$11]) -> 0 | B66: 0 | C66: of:=[.A66]=[.B66] -> true | D66: of:=FORMULA([.A66]) -> =AGGREGATE( P$13,$J25,$C$1:$C$11)
A67: of:=COM.MICROSOFT.AGGREGATE( [.Q$13];[.$J17];[.$C$1:.$C$11]) ->  | B67: error | C67: of:=ISERROR([.A67]) -> true | D67: of:=FORMULA([.A67]) -> =AGGREGATE( Q$13,$J17,$C$1:$C$11)
A68: of:=COM.MICROSOFT.AGGREGATE( [.Q$13];[.$J18];[.$C$1:.$C$11]) ->  | B68: error | C68: of:=ISERROR([.A68]) -> true | D68: of:=FORMULA([.A68]) -> =AGGREGATE( Q$13,$J18,$C$1:$C$11)
A69: of:=COM.MICROSOFT.AGGREGATE( [.Q$13];[.$J19];[.$C$1:.$C$11]) ->  | B69: error | C69: of:=ISERROR([.A69]) -> true | D69: of:=FORMULA([.A69]) -> =AGGREGATE( Q$13,$J19,$C$1:$C$11)
A70: of:=COM.MICROSOFT.AGGREGATE( [.Q$13];[.$J20];[.$C$1:.$C$11]) -> 25.5436134968448 | B70: 25.5436134968448 | C70: of:=[.A70]=[.B70] -> true | D70: of:=FORMULA([.A70]) -> =AGGREGATE( Q$13,$J20,$C$1:$C$11)
A71: of:=COM.MICROSOFT.AGGREGATE( [.Q$13];[.$J21];[.$C$1:.$C$11]) -> 16.9164614109058 | B71: 16.9164614109058 | C71: of:=[.A71]=[.B71] -> true | D71: of:=FORMULA([.A71]) -> =AGGREGATE( Q$13,$J21,$C$1:$C$11)
A72: of:=COM.MICROSOFT.AGGREGATE( [.Q$13];[.$J22];[.$C$1:.$C$11]) ->  | B72: error | C72: of:=ISERROR([.A72]) -> true | D72: of:=FORMULA([.A72]) -> =AGGREGATE( Q$13,$J22,$C$1:$C$11)
A73: of:=COM.MICROSOFT.AGGREGATE( [.Q$13];[.$J23];[.$C$1:.$C$11]) ->  | B73: error | C73: of:=ISERROR([.A73]) -> true | D73: of:=FORMULA([.A73]) -> =AGGREGATE( Q$13,$J23,$C$1:$C$11)
A74: of:=COM.MICROSOFT.AGGREGATE( [.Q$13];[.$J24];[.$C$1:.$C$11]) -> 29.4954596990307 | B74: 29.4954596990307 | C74: of:=[.A74]=[.B74] -> true | D74: of:=FORMULA([.A74]) -> =AGGREGATE( Q$13,$J24,$C$1:$C$11)
A75: of:=COM.MICROSOFT.AGGREGATE( [.Q$13];[.$J25];[.$C$1:.$C$11]) -> 22.1918045790826 | B75: 22.1918045790826 | C75: of:=[.A75]=[.B75] -> true | D75: of:=FORMULA([.A75]) -> =AGGREGATE( Q$13,$J25,$C$1:$C$11)
A76: of:=COM.MICROSOFT.AGGREGATE( [.R$13];[.$J17];[.$C$1:.$C$11]) ->  | B76: error | C76: of:=ISERROR([.A76]) -> true | D76: of:=FORMULA([.A76]) -> =AGGREGATE( R$13,$J17,$C$1:$C$11) | E76: STDEV.P | F76: empty second parameter
A77: of:=COM.MICROSOFT.AGGREGATE( [.R$13];[.$J18];[.$C$1:.$C$11]) ->  | B77: error | C77: of:=ISERROR([.A77]) -> true | D77: of:=FORMULA([.A77]) -> =AGGREGATE( R$13,$J18,$C$1:$C$11) | E77: Tdf#100753
A78: of:=COM.MICROSOFT.AGGREGATE( [.R$13];[.$J19];[.$C$1:.$C$11]) ->  | B78: error | C78: of:=ISERROR([.A78]) -> true | D78: of:=FORMULA([.A78]) -> =AGGREGATE( R$13,$J19,$C$1:$C$11) | J78: YELLOW ROWS THROWS ERROR IN EXCEL
A79: of:=COM.MICROSOFT.AGGREGATE( [.R$13];[.$J20];[.$C$1:.$C$11]) -> 23.6487907962003 | B79: 23.6487907962003 | C79: of:=[.A79]=[.B79] -> true | D79: of:=FORMULA([.A79]) -> =AGGREGATE( R$13,$J20,$C$1:$C$11)
A80: of:=COM.MICROSOFT.AGGREGATE( [.R$13];[.$J21];[.$C$1:.$C$11]) -> 15.4425458465313 | B80: 15.4425458465313 | C80: of:=[.A80]=[.B80] -> true | D80: of:=FORMULA([.A80]) -> =AGGREGATE( R$13,$J21,$C$1:$C$11)
A81: of:=COM.MICROSOFT.AGGREGATE( [.R$13];[.$J22];[.$C$1:.$C$11]) ->  | B81: error | C81: of:=ISERROR([.A81]) -> true | D81: of:=FORMULA([.A81]) -> =AGGREGATE( R$13,$J22,$C$1:$C$11)
A82: of:=COM.MICROSOFT.AGGREGATE( [.R$13];[.$J23];[.$C$1:.$C$11]) ->  | B82: error | C82: of:=ISERROR([.A82]) -> true | D82: of:=FORMULA([.A82]) -> =AGGREGATE( R$13,$J23,$C$1:$C$11)
A83: of:=COM.MICROSOFT.AGGREGATE( [.R$13];[.$J24];[.$C$1:.$C$11]) -> 27.5904761647928 | B83: 27.5904761647928 | C83: of:=[.A83]=[.B83] -> true | D83: of:=FORMULA([.A83]) -> =AGGREGATE( R$13,$J24,$C$1:$C$11)
A84: of:=COM.MICROSOFT.AGGREGATE( [.R$13];[.$J25];[.$C$1:.$C$11]) -> 20.5456187295392 | B84: 20.5456187295392 | C84: of:=[.A84]=[.B84] -> true | D84: of:=FORMULA([.A84]) -> =AGGREGATE( R$13,$J25,$C$1:$C$11)
A85: of:=COM.MICROSOFT.AGGREGATE( [.S$13];[.$J17];[.$C$1:.$C$11]) ->  | B85: error | C85: of:=ISERROR([.A85]) -> true | D85: of:=FORMULA([.A85]) -> =AGGREGATE( S$13,$J17,$C$1:$C$11)
A86: of:=COM.MICROSOFT.AGGREGATE( [.S$13];[.$J18];[.$C$1:.$C$11]) ->  | B86: error | C86: of:=ISERROR([.A86]) -> true | D86: of:=FORMULA([.A86]) -> =AGGREGATE( S$13,$J18,$C$1:$C$11)
A87: of:=COM.MICROSOFT.AGGREGATE( [.S$13];[.$J19];[.$C$1:.$C$11]) ->  | B87: error | C87: of:=ISERROR([.A87]) -> true | D87: of:=FORMULA([.A87]) -> =AGGREGATE( S$13,$J19,$C$1:$C$11)
A88: of:=COM.MICROSOFT.AGGREGATE( [.S$13];[.$J20];[.$C$1:.$C$11]) -> 349 | B88: 349 | C88: of:=[.A88]=[.B88] -> true | D88: of:=FORMULA([.A88]) -> =AGGREGATE( S$13,$J20,$C$1:$C$11)
A89: of:=COM.MICROSOFT.AGGREGATE( [.S$13];[.$J21];[.$C$1:.$C$11]) -> 253 | B89: 253 | C89: of:=[.A89]=[.B89] -> true | D89: of:=FORMULA([.A89]) -> =AGGREGATE( S$13,$J21,$C$1:$C$11)
A90: of:=COM.MICROSOFT.AGGREGATE( [.S$13];[.$J22];[.$C$1:.$C$11]) ->  | B90: error | C90: of:=ISERROR([.A90]) -> true | D90: of:=FORMULA([.A90]) -> =AGGREGATE( S$13,$J22,$C$1:$C$11)
A91: of:=COM.MICROSOFT.AGGREGATE( [.S$13];[.$J23];[.$C$1:.$C$11]) ->  | B91: error | C91: of:=ISERROR([.A91]) -> true | D91: of:=FORMULA([.A91]) -> =AGGREGATE( S$13,$J23,$C$1:$C$11)
A92: of:=COM.MICROSOFT.AGGREGATE( [.S$13];[.$J24];[.$C$1:.$C$11]) -> 349 | B92: 349 | C92: of:=[.A92]=[.B92] -> true | D92: of:=FORMULA([.A92]) -> =AGGREGATE( S$13,$J24,$C$1:$C$11)
A93: of:=COM.MICROSOFT.AGGREGATE( [.S$13];[.$J25];[.$C$1:.$C$11]) -> 253 | B93: 253 | C93: of:=[.A93]=[.B93] -> true | D93: of:=FORMULA([.A93]) -> =AGGREGATE( S$13,$J25,$C$1:$C$11)
A94: of:=COM.MICROSOFT.AGGREGATE( [.T$13];[.$J17];[.$C$1:.$C$11]) ->  | B94: error | C94: of:=ISERROR([.A94]) -> true | D94: of:=FORMULA([.A94]) -> =AGGREGATE( T$13,$J17,$C$1:$C$11)
A95: of:=COM.MICROSOFT.AGGREGATE( [.T$13];[.$J18];[.$C$1:.$C$11]) ->  | B95: error | C95: of:=ISERROR([.A95]) -> true | D95: of:=FORMULA([.A95]) -> =AGGREGATE( T$13,$J18,$C$1:$C$11)
A96: of:=COM.MICROSOFT.AGGREGATE( [.T$13];[.$J19];[.$C$1:.$C$11]) ->  | B96: error | C96: of:=ISERROR([.A96]) -> true | D96: of:=FORMULA([.A96]) -> =AGGREGATE( T$13,$J19,$C$1:$C$11)
A97: of:=COM.MICROSOFT.AGGREGATE( [.T$13];[.$J20];[.$C$1:.$C$11]) -> 652.476190476191 | B97: 652.476190476191 | C97: of:=[.A97]=[.B97] -> true | D97: of:=FORMULA([.A97]) -> =AGGREGATE( T$13,$J20,$C$1:$C$11)
A98: of:=COM.MICROSOFT.AGGREGATE( [.T$13];[.$J21];[.$C$1:.$C$11]) -> 286.166666666667 | B98: 286.166666666667 | C98: of:=[.A98]=[.B98] -> true | D98: of:=FORMULA([.A98]) -> =AGGREGATE( T$13,$J21,$C$1:$C$11)
A99: of:=COM.MICROSOFT.AGGREGATE( [.T$13];[.$J22];[.$C$1:.$C$11]) ->  | B99: error | C99: of:=ISERROR([.A99]) -> true | D99: of:=FORMULA([.A99]) -> =AGGREGATE( T$13,$J22,$C$1:$C$11)
A100: of:=COM.MICROSOFT.AGGREGATE( [.T$13];[.$J23];[.$C$1:.$C$11]) ->  | B100: error | C100: of:=ISERROR([.A100]) -> true | D100: of:=FORMULA([.A100]) -> =AGGREGATE( T$13,$J23,$C$1:$C$11)
A101: of:=COM.MICROSOFT.AGGREGATE( [.T$13];[.$J24];[.$C$1:.$C$11]) -> 869.982142857143 | B101: 869.982142857143 | C101: of:=[.A101]=[.B101] -> true | D101: of:=FORMULA([.A101]) -> =AGGREGATE( T$13,$J24,$C$1:$C$11)
A102: of:=COM.MICROSOFT.AGGREGATE( [.T$13];[.$J25];[.$C$1:.$C$11]) -> 492.476190476191 | B102: 492.476190476191 | C102: of:=[.A102]=[.B102] -> true | D102: of:=FORMULA([.A102]) -> =AGGREGATE( T$13,$J25,$C$1:$C$11)
A103: of:=COM.MICROSOFT.AGGREGATE( [.U$13];[.$J17];[.$C$1:.$C$11]) ->  | B103: error | C103: of:=ISERROR([.A103]) -> true | D103: of:=FORMULA([.A103]) -> =AGGREGATE( U$13,$J17,$C$1:$C$11) | E103: VAR.P | F103: of:=COM.MICROSOFT.VAR.P([.$C$1:.$C$11]) -> 
A104: of:=COM.MICROSOFT.AGGREGATE( [.U$13];[.$J18];[.$C$1:.$C$11]) ->  | B104: error | C104: of:=ISERROR([.A104]) -> true | D104: of:=FORMULA([.A104]) -> =AGGREGATE( U$13,$J18,$C$1:$C$11)
A105: of:=COM.MICROSOFT.AGGREGATE( [.U$13];[.$J19];[.$C$1:.$C$11]) ->  | B105: error | C105: of:=ISERROR([.A105]) -> true | D105: of:=FORMULA([.A105]) -> =AGGREGATE( U$13,$J19,$C$1:$C$11)
A106: of:=COM.MICROSOFT.AGGREGATE( [.U$13];[.$J20];[.$C$1:.$C$11]) -> 559.265306122449 | B106: 559.265306122449 | C106: of:=[.A106]=[.B106] -> true | D106: of:=FORMULA([.A106]) -> =AGGREGATE( U$13,$J20,$C$1:$C$11)
A107: of:=COM.MICROSOFT.AGGREGATE( [.U$13];[.$J21];[.$C$1:.$C$11]) -> 238.472222222222 | B107: 238.472222222222 | C107: of:=[.A107]=[.B107] -> true | D107: of:=FORMULA([.A107]) -> =AGGREGATE( U$13,$J21,$C$1:$C$11)
A108: of:=COM.MICROSOFT.AGGREGATE( [.U$13];[.$J22];[.$C$1:.$C$11]) ->  | B108: error | C108: of:=ISERROR([.A108]) -> true | D108: of:=FORMULA([.A108]) -> =AGGREGATE( U$13,$J22,$C$1:$C$11)
A109: of:=COM.MICROSOFT.AGGREGATE( [.U$13];[.$J23];[.$C$1:.$C$11]) ->  | B109: error | C109: of:=ISERROR([.A109]) -> true | D109: of:=FORMULA([.A109]) -> =AGGREGATE( U$13,$J23,$C$1:$C$11)
A110: of:=COM.MICROSOFT.AGGREGATE( [.U$13];[.$J24];[.$C$1:.$C$11]) -> 761.234375 | B110: 761.234375 | C110: of:=[.A110]=[.B110] -> true | D110: of:=FORMULA([.A110]) -> =AGGREGATE( U$13,$J24,$C$1:$C$11)
A111: of:=COM.MICROSOFT.AGGREGATE( [.U$13];[.$J25];[.$C$1:.$C$11]) -> 422.122448979592 | B111: 422.122448979592 | C111: of:=[.A111]=[.B111] -> true | D111: of:=FORMULA([.A111]) -> =AGGREGATE( U$13,$J25,$C$1:$C$11)
A112: of:=COM.MICROSOFT.AGGREGATE( [.V$13];[.$J17];[.$C$1:.$C$11]) ->  | B112: error | C112: of:=ISERROR([.A112]) -> true | D112: of:=FORMULA([.A112]) -> =AGGREGATE( V$13,$J17,$C$1:$C$11)
A113: of:=COM.MICROSOFT.AGGREGATE( [.V$13];[.$J18];[.$C$1:.$C$11]) ->  | B113: error | C113: of:=ISERROR([.A113]) -> true | D113: of:=FORMULA([.A113]) -> =AGGREGATE( V$13,$J18,$C$1:$C$11)
A114: of:=COM.MICROSOFT.AGGREGATE( [.V$13];[.$J19];[.$C$1:.$C$11]) ->  | B114: error | C114: of:=ISERROR([.A114]) -> true | D114: of:=FORMULA([.A114]) -> =AGGREGATE( V$13,$J19,$C$1:$C$11)
A115: of:=COM.MICROSOFT.AGGREGATE( [.V$13];[.$J20];[.$C$1:.$C$11]) -> 34 | B115: 34 | C115: of:=[.A115]=[.B115] -> true | D115: of:=FORMULA([.A115]) -> =AGGREGATE( V$13,$J20,$C$1:$C$11)
A116: of:=COM.MICROSOFT.AGGREGATE( [.V$13];[.$J21];[.$C$1:.$C$11]) -> 33.5 | B116: 33.5 | C116: of:=[.A116]=[.B116] -> true | D116: of:=FORMULA([.A116]) -> =AGGREGATE( V$13,$J21,$C$1:$C$11)
A117: of:=COM.MICROSOFT.AGGREGATE( [.V$13];[.$J22];[.$C$1:.$C$11]) ->  | B117: error | C117: of:=ISERROR([.A117]) -> true | D117: of:=FORMULA([.A117]) -> =AGGREGATE( V$13,$J22,$C$1:$C$11)
A118: of:=COM.MICROSOFT.AGGREGATE( [.V$13];[.$J23];[.$C$1:.$C$11]) ->  | B118: error | C118: of:=ISERROR([.A118]) -> true | D118: of:=FORMULA([.A118]) -> =AGGREGATE( V$13,$J23,$C$1:$C$11)
A119: of:=COM.MICROSOFT.AGGREGATE( [.V$13];[.$J24];[.$C$1:.$C$11]) -> 33.5 | B119: 33.5 | C119: of:=[.A119]=[.B119] -> true | D119: of:=FORMULA([.A119]) -> =AGGREGATE( V$13,$J24,$C$1:$C$11)
A120: of:=COM.MICROSOFT.AGGREGATE( [.V$13];[.$J25];[.$C$1:.$C$11]) -> 33 | B120: 33 | C120: of:=[.A120]=[.B120] -> true | D120: of:=FORMULA([.A120]) -> =AGGREGATE( V$13,$J25,$C$1:$C$11)
A121: of:=COM.MICROSOFT.AGGREGATE( [.W$13];[.$J17];[.$C$1:.$C$11]) ->  | B121: error | C121: of:=ISERROR([.A121]) -> true | D121: of:=FORMULA([.A121]) -> =AGGREGATE( W$13,$J17,$C$1:$C$11)
A122: of:=COM.MICROSOFT.AGGREGATE( [.W$13];[.$J18];[.$C$1:.$C$11]) ->  | B122: error | C122: of:=ISERROR([.A122]) -> true | D122: of:=FORMULA([.A122]) -> =AGGREGATE( W$13,$J18,$C$1:$C$11)
A123: of:=COM.MICROSOFT.AGGREGATE( [.W$13];[.$J19];[.$C$1:.$C$11]) ->  | B123: error | C123: of:=ISERROR([.A123]) -> true | D123: of:=FORMULA([.A123]) -> =AGGREGATE( W$13,$J19,$C$1:$C$11)
A124: of:=COM.MICROSOFT.AGGREGATE( [.W$13];[.$J20];[.$C$1:.$C$11]) ->  | B124: error | C124: of:=ISERROR([.A124]) -> true | D124: of:=FORMULA([.A124]) -> =AGGREGATE( W$13,$J20,$C$1:$C$11)
A125: of:=COM.MICROSOFT.AGGREGATE( [.W$13];[.$J21];[.$C$1:.$C$11]) ->  | B125: error | C125: of:=ISERROR([.A125]) -> true | D125: of:=FORMULA([.A125]) -> =AGGREGATE( W$13,$J21,$C$1:$C$11)
A126: of:=COM.MICROSOFT.AGGREGATE( [.W$13];[.$J22];[.$C$1:.$C$11]) ->  | B126: error | C126: of:=ISERROR([.A126]) -> true | D126: of:=FORMULA([.A126]) -> =AGGREGATE( W$13,$J22,$C$1:$C$11)
A127: of:=COM.MICROSOFT.AGGREGATE( [.W$13];[.$J23];[.$C$1:.$C$11]) ->  | B127: error | C127: of:=ISERROR([.A127]) -> true | D127: of:=FORMULA([.A127]) -> =AGGREGATE( W$13,$J23,$C$1:$C$11)
A128: of:=COM.MICROSOFT.AGGREGATE( [.W$13];[.$J24];[.$C$1:.$C$11]) ->  | B128: error | C128: of:=ISERROR([.A128]) -> true | D128: of:=FORMULA([.A128]) -> =AGGREGATE( W$13,$J24,$C$1:$C$11)
A129: of:=COM.MICROSOFT.AGGREGATE( [.W$13];[.$J25];[.$C$1:.$C$11]) ->  | B129: error | C129: of:=ISERROR([.A129]) -> true | D129: of:=FORMULA([.A129]) -> =AGGREGATE( W$13,$J25,$C$1:$C$11)
A130: of:=COM.MICROSOFT.AGGREGATE( [.X$13];[.$J17];[.$C$1:.$C$11];2) ->  | B130: error | C130: of:=ISERROR([.A130]) -> true | D130: of:=FORMULA([.A130]) -> =AGGREGATE( X$13,$J17,$C$1:$C$11,2)
A131: of:=COM.MICROSOFT.AGGREGATE( [.X$13];[.$J18];[.$C$1:.$C$11];2) ->  | B131: error | C131: of:=ISERROR([.A131]) -> true | D131: of:=FORMULA([.A131]) -> =AGGREGATE( X$13,$J18,$C$1:$C$11,2)
A132: of:=COM.MICROSOFT.AGGREGATE( [.X$13];[.$J19];[.$C$1:.$C$11];2) ->  | B132: error | C132: of:=ISERROR([.A132]) -> true | D132: of:=FORMULA([.A132]) -> =AGGREGATE( X$13,$J19,$C$1:$C$11,2)
A133: of:=COM.MICROSOFT.AGGREGATE( [.X$13];[.$J20];[.$C$1:.$C$11];2) -> 72 | B133: 72 | C133: of:=[.A133]=[.B133] -> true | D133: of:=FORMULA([.A133]) -> =AGGREGATE( X$13,$J20,$C$1:$C$11,2)
A134: of:=COM.MICROSOFT.AGGREGATE( [.X$13];[.$J21];[.$C$1:.$C$11];2) -> 53 | B134: 53 | C134: of:=[.A134]=[.B134] -> true | D134: of:=FORMULA([.A134]) -> =AGGREGATE( X$13,$J21,$C$1:$C$11,2)
A135: of:=COM.MICROSOFT.AGGREGATE( [.X$13];[.$J22];[.$C$1:.$C$11];2) ->  | B135: error | C135: of:=ISERROR([.A135]) -> true | D135: of:=FORMULA([.A135]) -> =AGGREGATE( X$13,$J22,$C$1:$C$11,2)
A136: of:=COM.MICROSOFT.AGGREGATE( [.X$13];[.$J23];[.$C$1:.$C$11];2) ->  | B136: error | C136: of:=ISERROR([.A136]) -> true | D136: of:=FORMULA([.A136]) -> =AGGREGATE( X$13,$J23,$C$1:$C$11,2)
A137: of:=COM.MICROSOFT.AGGREGATE( [.X$13];[.$J24];[.$C$1:.$C$11];2) -> 72 | B137: 72 | C137: of:=[.A137]=[.B137] -> true | D137: of:=FORMULA([.A137]) -> =AGGREGATE( X$13,$J24,$C$1:$C$11,2)
A138: of:=COM.MICROSOFT.AGGREGATE( [.X$13];[.$J25];[.$C$1:.$C$11];2) -> 53 | B138: 53 | C138: of:=[.A138]=[.B138] -> true | D138: of:=FORMULA([.A138]) -> =AGGREGATE( X$13,$J25,$C$1:$C$11,2)
A139: of:=COM.MICROSOFT.AGGREGATE( [.Y$13];[.$J17];[.$C$1:.$C$11];2) ->  | B139: error | C139: of:=ISERROR([.A139]) -> true | D139: of:=FORMULA([.A139]) -> =AGGREGATE( Y$13,$J17,$C$1:$C$11,2)
A140: of:=COM.MICROSOFT.AGGREGATE( [.Y$13];[.$J18];[.$C$1:.$C$11];2) ->  | B140: error | C140: of:=ISERROR([.A140]) -> true | D140: of:=FORMULA([.A140]) -> =AGGREGATE( Y$13,$J18,$C$1:$C$11,2)
A141: of:=COM.MICROSOFT.AGGREGATE( [.Y$13];[.$J19];[.$C$1:.$C$11];2) ->  | B141: error | C141: of:=ISERROR([.A141]) -> true | D141: of:=FORMULA([.A141]) -> =AGGREGATE( Y$13,$J19,$C$1:$C$11,2)
A142: of:=COM.MICROSOFT.AGGREGATE( [.Y$13];[.$J20];[.$C$1:.$C$11];2) -> 31 | B142: 31 | C142: of:=[.A142]=[.B142] -> true | D142: of:=FORMULA([.A142]) -> =AGGREGATE( Y$13,$J20,$C$1:$C$11,2)
A143: of:=COM.MICROSOFT.AGGREGATE( [.Y$13];[.$J21];[.$C$1:.$C$11];2) -> 31 | B143: 31 | C143: of:=[.A143]=[.B143] -> true | D143: of:=FORMULA([.A143]) -> =AGGREGATE( Y$13,$J21,$C$1:$C$11,2)
A144: of:=COM.MICROSOFT.AGGREGATE( [.Y$13];[.$J22];[.$C$1:.$C$11];2) ->  | B144: error | C144: of:=ISERROR([.A144]) -> true | D144: of:=FORMULA([.A144]) -> =AGGREGATE( Y$13,$J22,$C$1:$C$11,2)
A145: of:=COM.MICROSOFT.AGGREGATE( [.Y$13];[.$J23];[.$C$1:.$C$11];2) ->  | B145: error | C145: of:=ISERROR([.A145]) -> true | D145: of:=FORMULA([.A145]) -> =AGGREGATE( Y$13,$J23,$C$1:$C$11,2)
A146: of:=COM.MICROSOFT.AGGREGATE( [.Y$13];[.$J24];[.$C$1:.$C$11];2) -> 30 | B146: 30 | C146: of:=[.A146]=[.B146] -> true | D146: of:=FORMULA([.A146]) -> =AGGREGATE( Y$13,$J24,$C$1:$C$11,2)
A147: of:=COM.MICROSOFT.AGGREGATE( [.Y$13];[.$J25];[.$C$1:.$C$11];2) -> 30 | B147: 30 | C147: of:=[.A147]=[.B147] -> true | D147: of:=FORMULA([.A147]) -> =AGGREGATE( Y$13,$J25,$C$1:$C$11,2)
A148: of:=COM.MICROSOFT.AGGREGATE( [.Z$13];[.$J17];[.$C$1:.$C$11];0) ->  | B148: error | C148: of:=ISERROR([.A148]) -> true | D148: of:=FORMULA([.A148]) -> =AGGREGATE( Z$13,$J17,$C$1:$C$11,0)
A149: of:=COM.MICROSOFT.AGGREGATE( [.Z$13];[.$J18];[.$C$1:.$C$11];0) ->  | B149: error | C149: of:=ISERROR([.A149]) -> true | D149: of:=FORMULA([.A149]) -> =AGGREGATE( Z$13,$J18,$C$1:$C$11,0)
A150: of:=COM.MICROSOFT.AGGREGATE( [.Z$13];[.$J19];[.$C$1:.$C$11];0) ->  | B150: error | C150: of:=ISERROR([.A150]) -> true | D150: of:=FORMULA([.A150]) -> =AGGREGATE( Z$13,$J19,$C$1:$C$11,0)
A151: of:=COM.MICROSOFT.AGGREGATE( [.Z$13];[.$J20];[.$C$1:.$C$11];0) -> 30 | B151: 30 | C151: of:=[.A151]=[.B151] -> true | D151: of:=FORMULA([.A151]) -> =AGGREGATE( Z$13,$J20,$C$1:$C$11,0)
A152: of:=COM.MICROSOFT.AGGREGATE( [.Z$13];[.$J21];[.$C$1:.$C$11];0) -> 30 | B152: 30 | C152: of:=[.A152]=[.B152] -> true | D152: of:=FORMULA([.A152]) -> =AGGREGATE( Z$13,$J21,$C$1:$C$11,0)
A153: of:=COM.MICROSOFT.AGGREGATE( [.Z$13];[.$J22];[.$C$1:.$C$11];0) ->  | B153: error | C153: of:=ISERROR([.A153]) -> true | D153: of:=FORMULA([.A153]) -> =AGGREGATE( Z$13,$J22,$C$1:$C$11,0)
A154: of:=COM.MICROSOFT.AGGREGATE( [.Z$13];[.$J23];[.$C$1:.$C$11];0) ->  | B154: error | C154: of:=ISERROR([.A154]) -> true | D154: of:=FORMULA([.A154]) -> =AGGREGATE( Z$13,$J23,$C$1:$C$11,0)
A155: of:=COM.MICROSOFT.AGGREGATE( [.Z$13];[.$J24];[.$C$1:.$C$11];0) -> 0 | B155: 0 | C155: of:=[.A155]=[.B155] -> true | D155: of:=FORMULA([.A155]) -> =AGGREGATE( Z$13,$J24,$C$1:$C$11,0)
A156: of:=COM.MICROSOFT.AGGREGATE( [.Z$13];[.$J25];[.$C$1:.$C$11];0) -> 0 | B156: 0 | C156: of:=[.A156]=[.B156] -> true | D156: of:=FORMULA([.A156]) -> =AGGREGATE( Z$13,$J25,$C$1:$C$11,0)
A157: of:=COM.MICROSOFT.AGGREGATE( [.AA$13];[.$J17];[.$C$1:.$C$11];2) ->  | B157: error | C157: of:=ISERROR([.A157]) -> true | D157: of:=FORMULA([.A157]) -> =AGGREGATE( AA$13,$J17,$C$1:$C$11,2)
A158: of:=COM.MICROSOFT.AGGREGATE( [.AA$13];[.$J18];[.$C$1:.$C$11];2) ->  | B158: error | C158: of:=ISERROR([.A158]) -> true | D158: of:=FORMULA([.A158]) -> =AGGREGATE( AA$13,$J18,$C$1:$C$11,2)
A159: of:=COM.MICROSOFT.AGGREGATE( [.AA$13];[.$J19];[.$C$1:.$C$11];2) ->  | B159: error | C159: of:=ISERROR([.A159]) -> true | D159: of:=FORMULA([.A159]) -> =AGGREGATE( AA$13,$J19,$C$1:$C$11,2)
A160: of:=COM.MICROSOFT.AGGREGATE( [.AA$13];[.$J20];[.$C$1:.$C$11];2) -> 34 | B160: 34 | C160: of:=[.A160]=[.B160] -> true | D160: of:=FORMULA([.A160]) -> =AGGREGATE( AA$13,$J20,$C$1:$C$11,2)
A161: of:=COM.MICROSOFT.AGGREGATE( [.AA$13];[.$J21];[.$C$1:.$C$11];2) -> 33.5 | B161: 33.5 | C161: of:=[.A161]=[.B161] -> true | D161: of:=FORMULA([.A161]) -> =AGGREGATE( AA$13,$J21,$C$1:$C$11,2)
A162: of:=COM.MICROSOFT.AGGREGATE( [.AA$13];[.$J22];[.$C$1:.$C$11];2) ->  | B162: error | C162: of:=ISERROR([.A162]) -> true | D162: of:=FORMULA([.A162]) -> =AGGREGATE( AA$13,$J22,$C$1:$C$11,2)
A163: of:=COM.MICROSOFT.AGGREGATE( [.AA$13];[.$J23];[.$C$1:.$C$11];2) ->  | B163: error | C163: of:=ISERROR([.A163]) -> true | D163: of:=FORMULA([.A163]) -> =AGGREGATE( AA$13,$J23,$C$1:$C$11,2)
A164: of:=COM.MICROSOFT.AGGREGATE( [.AA$13];[.$J24];[.$C$1:.$C$11];2) -> 33.5 | B164: 33.5 | C164: of:=[.A164]=[.B164] -> true | D164: of:=FORMULA([.A164]) -> =AGGREGATE( AA$13,$J24,$C$1:$C$11,2)
A165: of:=COM.MICROSOFT.AGGREGATE( [.AA$13];[.$J25];[.$C$1:.$C$11];2) -> 33 | B165: 33 | C165: of:=[.A165]=[.B165] -> true | D165: of:=FORMULA([.A165]) -> =AGGREGATE( AA$13,$J25,$C$1:$C$11,2)
A166: of:=COM.MICROSOFT.AGGREGATE( [.AB$13];[.$J17];[.$C$1:.$C$11];0.3) ->  | B166: error | C166: of:=ISERROR([.A166]) -> true | D166: of:=FORMULA([.A166]) -> =AGGREGATE( AB$13,$J17,$C$1:$C$11,0.3)
A167: of:=COM.MICROSOFT.AGGREGATE( [.AB$13];[.$J18];[.$C$1:.$C$11];0.3) ->  | B167: error | C167: of:=ISERROR([.A167]) -> true | D167: of:=FORMULA([.A167]) -> =AGGREGATE( AB$13,$J18,$C$1:$C$11,0.3)
A168: of:=COM.MICROSOFT.AGGREGATE( [.AB$13];[.$J19];[.$C$1:.$C$11];0.3) ->  | B168: error | C168: of:=ISERROR([.A168]) -> true | D168: of:=FORMULA([.A168]) -> =AGGREGATE( AB$13,$J19,$C$1:$C$11,0.3)
A169: of:=COM.MICROSOFT.AGGREGATE( [.AB$13];[.$J20];[.$C$1:.$C$11];0.3) -> 31.8 | B169: 31.8 | C169: of:=[.A169]=[.B169] -> true | D169: of:=FORMULA([.A169]) -> =AGGREGATE( AB$13,$J20,$C$1:$C$11,0.3)
A170: of:=COM.MICROSOFT.AGGREGATE( [.AB$13];[.$J21];[.$C$1:.$C$11];0.3) -> 31.2 | B170: 31.2 | C170: of:=[.A170]=[.B170] -> true | D170: of:=FORMULA([.A170]) -> =AGGREGATE( AB$13,$J21,$C$1:$C$11,0.3)
A171: of:=COM.MICROSOFT.AGGREGATE( [.AB$13];[.$J22];[.$C$1:.$C$11];0.3) ->  | B171: error | C171: of:=ISERROR([.A171]) -> true | D171: of:=FORMULA([.A171]) -> =AGGREGATE( AB$13,$J22,$C$1:$C$11,0.3)
A172: of:=COM.MICROSOFT.AGGREGATE( [.AB$13];[.$J23];[.$C$1:.$C$11];0.3) ->  | B172: error | C172: of:=ISERROR([.A172]) -> true | D172: of:=FORMULA([.A172]) -> =AGGREGATE( AB$13,$J23,$C$1:$C$11,0.3)
A173: of:=COM.MICROSOFT.AGGREGATE( [.AB$13];[.$J24];[.$C$1:.$C$11];0.3) -> 30.7 | B173: 30.7 | C173: of:=[.A173]=[.B173] -> true | D173: of:=FORMULA([.A173]) -> =AGGREGATE( AB$13,$J24,$C$1:$C$11,0.3)
A174: of:=COM.MICROSOFT.AGGREGATE( [.AB$13];[.$J25];[.$C$1:.$C$11];0.3) -> 30.4 | B174: 30.4 | C174: of:=[.A174]=[.B174] -> true | D174: of:=FORMULA([.A174]) -> =AGGREGATE( AB$13,$J25,$C$1:$C$11,0.3)
A175: of:=COM.MICROSOFT.AGGREGATE( [.AC$13];[.$J17];[.$C$1:.$C$11];2) ->  | B175: error | C175: of:=ISERROR([.A175]) -> true | D175: of:=FORMULA([.A175]) -> =AGGREGATE( AC$13,$J17,$C$1:$C$11,2)
A176: of:=COM.MICROSOFT.AGGREGATE( [.AC$13];[.$J18];[.$C$1:.$C$11];2) ->  | B176: error | C176: of:=ISERROR([.A176]) -> true | D176: of:=FORMULA([.A176]) -> =AGGREGATE( AC$13,$J18,$C$1:$C$11,2)
A177: of:=COM.MICROSOFT.AGGREGATE( [.AC$13];[.$J19];[.$C$1:.$C$11];2) ->  | B177: error | C177: of:=ISERROR([.A177]) -> true | D177: of:=FORMULA([.A177]) -> =AGGREGATE( AC$13,$J19,$C$1:$C$11,2)
A178: of:=COM.MICROSOFT.AGGREGATE( [.AC$13];[.$J20];[.$C$1:.$C$11];2) -> 34 | B178: 34 | C178: of:=[.A178]=[.B178] -> true | D178: of:=FORMULA([.A178]) -> =AGGREGATE( AC$13,$J20,$C$1:$C$11,2)
A179: of:=COM.MICROSOFT.AGGREGATE( [.AC$13];[.$J21];[.$C$1:.$C$11];2) -> 33.5 | B179: 33.5 | C179: of:=[.A179]=[.B179] -> true | D179: of:=FORMULA([.A179]) -> =AGGREGATE( AC$13,$J21,$C$1:$C$11,2)
A180: of:=COM.MICROSOFT.AGGREGATE( [.AC$13];[.$J22];[.$C$1:.$C$11];2) ->  | B180: error | C180: of:=ISERROR([.A180]) -> true | D180: of:=FORMULA([.A180]) -> =AGGREGATE( AC$13,$J22,$C$1:$C$11,2)
A181: of:=COM.MICROSOFT.AGGREGATE( [.AC$13];[.$J23];[.$C$1:.$C$11];2) ->  | B181: error | C181: of:=ISERROR([.A181]) -> true | D181: of:=FORMULA([.A181]) -> =AGGREGATE( AC$13,$J23,$C$1:$C$11,2)
A182: of:=COM.MICROSOFT.AGGREGATE( [.AC$13];[.$J24];[.$C$1:.$C$11];2) -> 33.5 | B182: 33.5 | C182: of:=[.A182]=[.B182] -> true | D182: of:=FORMULA([.A182]) -> =AGGREGATE( AC$13,$J24,$C$1:$C$11,2)
A183: of:=COM.MICROSOFT.AGGREGATE( [.AC$13];[.$J25];[.$C$1:.$C$11];2) -> 33 | B183: 33 | C183: of:=[.A183]=[.B183] -> true | D183: of:=FORMULA([.A183]) -> =AGGREGATE( AC$13,$J25,$C$1:$C$11,2)

Sheet: 'file:///home/zdenek/Dokumenty/LO/sc-unit-test/Project%20Calc%20functions%20tests/fods/aggregate.fods/aggregate.fods/aggregate.fods/aggregate.fods/acoth.fods/acosh.fods/acos.fods/abs.fods/abs.fods/xor.fods/xor.fods/not.fods/ifna.fods/ifna.fods/iferror.fods/iferror.fods/if.fods/and.fods/and.fods/and.fods/and.fods/type.fods/isna.fods/isna.fods/islogical.fods/isformula.fods/iserr.fods/isblank.fods/info.fods/formula.fods/formula.fods/current.fods/cell.fods/cell.fods/minute.fods/minute.fods/year.fods/function_based_test_Example.fods/function_based_test_Example_reference.fods'#Sheet2
H3: 4

Sheet: 'file:///home/zdenek/Dokumenty/LO/sc-unit-test/Project%20Calc%20functions%20tests/fods/aggregate.fods/aggregate.fods/aggregate.fods/aggregate.fods/acoth.fods/acosh.fods/acos.fods/abs.fods/abs.fods/xor.fods/xor.fods/not.fods/ifna.fods/ifna.fods/iferror.fods/iferror.fods/if.fods/and.fods/and.fods/and.fods/and.fods/type.fods/isna.fods/isna.fods/islogical.fods/isformula.fods/sc-unit-test/information-functions.ods'#Information
O7: O5