Sheet: Sheet1
A1: MOD Function
A3: Result | B3: of:=AND([.B8:.B95]) -> true
A7: Sheet | B7: Result | C7: Description
A8: 1 | B8: of:=AND([Sheet2.C2:.C92]) -> true | C8: Simple MOD formulas with local references and values
B9: of:=AND([tdf86219.A22:.A92]) -> true | C9: Simple MOD formulas with local references and values

Sheet: Sheet2
A1: Function | B1: Expected | C1: Correct | D1: FunctionString | E1: Comment
A2: of:=MOD(22;3) -> 1 | B2: 1 | C2: of:=ROUND([Sheet2.A2];12)=ROUND([Sheet2.B2];12) -> true | D2: of:=FORMULA([Sheet2.A2]) -> =MOD(22,3)
A3: of:=MOD(11.25;2.5) -> 1.25 | B3: 1.25 | C3: of:=ROUND([Sheet2.A3];12)=ROUND([Sheet2.B3];12) -> true | D3: of:=FORMULA([Sheet2.A3]) -> =MOD(11.25,2.5)
A4: of:=MOD(3; 2) -> 1 | B4: 1 | C4: of:=ROUND([Sheet2.A4];12)=ROUND([Sheet2.B4];12) -> true | D4: of:=FORMULA([Sheet2.A4]) -> =MOD(3, 2)
A5: of:=MOD(-3; 2) -> 1 | B5: 1 | C5: of:=ROUND([Sheet2.A5];12)=ROUND([Sheet2.B5];12) -> true | D5: of:=FORMULA([Sheet2.A5]) -> =MOD(-3, 2)
A6: of:=MOD(3; -2) -> -1 | B6: -1 | C6: of:=ROUND([Sheet2.A6];12)=ROUND([Sheet2.B6];12) -> true | D6: of:=FORMULA([Sheet2.A6]) -> =MOD(3, -2)
A7: of:=MOD(-3; -2) -> -1 | B7: -1 | C7: of:=ROUND([Sheet2.A7];12)=ROUND([Sheet2.B7];12) -> true | D7: of:=FORMULA([Sheet2.A7]) -> =MOD(-3, -2)
A8: of:=MOD((3^31)-1;2) -> 0 | B8: 0 | C8: of:=ROUND([Sheet2.A8];12)=ROUND([Sheet2.B8];12) -> true | D8: of:=FORMULA([Sheet2.A8]) -> =MOD((3^31)-1,2) | E8: AOO#12446
A9: of:=MOD([Sheet2.F9]*1000;5) -> 0 | B9: 0 | C9: of:=ROUND([Sheet2.A9];12)=ROUND([Sheet2.B9];12) -> true | D9: of:=FORMULA([Sheet2.A9]) -> =MOD(Sheet2.F9*1000,5) | E9: AOO#54529 | F9: 1.41
A10: of:=MOD([Sheet2.F10]*1000;5) -> 0 | B10: 0 | C10: of:=ROUND([Sheet2.A10];12)=ROUND([Sheet2.B10];12) -> true | D10: of:=FORMULA([Sheet2.A10]) -> =MOD(Sheet2.F10*1000,5) | F10: 1.575
A11: of:=MOD([Sheet2.F11]*1000;5) -> 0 | B11: 0 | C11: of:=ROUND([Sheet2.A11];12)=ROUND([Sheet2.B11];12) -> true | D11: of:=FORMULA([Sheet2.A11]) -> =MOD(Sheet2.F11*1000,5) | F11: 1.485
A12: of:=MOD([Sheet2.F12]*1000;5) -> 0 | B12: 0 | C12: of:=ROUND([Sheet2.A12];12)=ROUND([Sheet2.B12];12) -> true | D12: of:=FORMULA([Sheet2.A12]) -> =MOD(Sheet2.F12*1000,5) | F12: 1.555
A13: of:=MOD([Sheet2.F13]*1000;5) -> 0 | B13: 0 | C13: of:=ROUND([Sheet2.A13];12)=ROUND([Sheet2.B13];12) -> true | D13: of:=FORMULA([Sheet2.A13]) -> =MOD(Sheet2.F13*1000,5) | F13: 64.555
A14: of:=MOD(COLUMN([Sheet2.I13:.N13]);2) -> 1 | B14: 1 | C14: of:=ROUND([Sheet2.A14];12)=ROUND([Sheet2.B14];12) -> true | D14: of:=FORMULA([Sheet2.A14]) -> =MOD(COLUMN(Sheet2.I13:N13),2) | E14: AOO#19765
A15: of:=MOD(COLUMN([Sheet2.N13]);2) -> 0 | B15: 0 | C15: of:=ROUND([Sheet2.A15];12)=ROUND([Sheet2.B15];12) -> true | D15: of:=FORMULA([Sheet2.A15]) -> =MOD(COLUMN(Sheet2.N13),2)
A16: of:=MOD(26^15;77) -> 0 | D16: of:=FORMULA([Sheet2.A16]) -> =MOD(26^15,77) | E16: Tdf#44117, wontfix, value is too large for exact calculation
A17: of:=MOD([Sheet2.F17]*100; 10) -> 0 | B17: 0 | C17: of:=ROUND([Sheet2.A17];12)=ROUND([Sheet2.B17];12) -> true | D17: of:=FORMULA([Sheet2.A17]) -> =MOD(Sheet2.F17*100, 10) | E17: Tdf#50299 | F17: 0
A18: of:=MOD([Sheet2.F18]*100; 10) -> 0 | B18: 0 | C18: of:=ROUND([Sheet2.A18];12)=ROUND([Sheet2.B18];12) -> true | D18: of:=FORMULA([Sheet2.A18]) -> =MOD(Sheet2.F18*100, 10) | F18: 0.1
A19: of:=MOD([Sheet2.F19]*100; 10) -> 0 | B19: 0 | C19: of:=ROUND([Sheet2.A19];12)=ROUND([Sheet2.B19];12) -> true | D19: of:=FORMULA([Sheet2.A19]) -> =MOD(Sheet2.F19*100, 10) | F19: 0.2
A20: of:=MOD([Sheet2.F20]*100; 10) -> 0 | B20: 0 | C20: of:=ROUND([Sheet2.A20];12)=ROUND([Sheet2.B20];12) -> true | D20: of:=FORMULA([Sheet2.A20]) -> =MOD(Sheet2.F20*100, 10) | F20: 0.3
A21: of:=MOD([Sheet2.F21]*100; 10) -> 0 | B21: 0 | C21: of:=ROUND([Sheet2.A21];12)=ROUND([Sheet2.B21];12) -> true | D21: of:=FORMULA([Sheet2.A21]) -> =MOD(Sheet2.F21*100, 10) | F21: 0.4
A22: of:=MOD([Sheet2.F22]*100; 10) -> 0 | B22: 0 | C22: of:=ROUND([Sheet2.A22];12)=ROUND([Sheet2.B22];12) -> true | D22: of:=FORMULA([Sheet2.A22]) -> =MOD(Sheet2.F22*100, 10) | F22: 0.5
A23: of:=MOD([Sheet2.F23]*100; 10) -> 0 | B23: 0 | C23: of:=ROUND([Sheet2.A23];12)=ROUND([Sheet2.B23];12) -> true | D23: of:=FORMULA([Sheet2.A23]) -> =MOD(Sheet2.F23*100, 10) | F23: 0.6
A24: of:=MOD([Sheet2.F24]*100; 10) -> 0 | B24: 0 | C24: of:=ROUND([Sheet2.A24];12)=ROUND([Sheet2.B24];12) -> true | D24: of:=FORMULA([Sheet2.A24]) -> =MOD(Sheet2.F24*100, 10) | F24: 0.7
A25: of:=MOD([Sheet2.F25]*100; 10) -> 0 | B25: 0 | C25: of:=ROUND([Sheet2.A25];12)=ROUND([Sheet2.B25];12) -> true | D25: of:=FORMULA([Sheet2.A25]) -> =MOD(Sheet2.F25*100, 10) | F25: 0.8
A26: of:=MOD([Sheet2.F26]*100; 10) -> 0 | B26: 0 | C26: of:=ROUND([Sheet2.A26];12)=ROUND([Sheet2.B26];12) -> true | D26: of:=FORMULA([Sheet2.A26]) -> =MOD(Sheet2.F26*100, 10) | F26: 0.9
A27: of:=MOD([Sheet2.F27]*100; 10) -> 0 | B27: 0 | C27: of:=ROUND([Sheet2.A27];12)=ROUND([Sheet2.B27];12) -> true | D27: of:=FORMULA([Sheet2.A27]) -> =MOD(Sheet2.F27*100, 10) | F27: 1
A28: of:=MOD((3^31);14) -> 3 | B28: 3 | C28: of:=ROUND([Sheet2.A28];12)=ROUND([Sheet2.B28];12) -> true | D28: of:=FORMULA([Sheet2.A28]) -> =MOD((3^31),14) | E28: Variation of AOO#12446, less than 2^53, Should work?
A29: of:=MOD((3^31)-1;14) -> 2 | B29: 2 | C29: of:=ROUND([Sheet2.A29];12)=ROUND([Sheet2.B29];12) -> true | D29: of:=FORMULA([Sheet2.A29]) -> =MOD((3^31)-1,14)
A30: of:=MOD((3^31)-2;14) -> 1 | B30: 1 | C30: of:=ROUND([Sheet2.A30];12)=ROUND([Sheet2.B30];12) -> true | D30: of:=FORMULA([Sheet2.A30]) -> =MOD((3^31)-2,14)
A31: of:=MOD((3^31)-3;14) -> 0 | B31: 0 | C31: of:=ROUND([Sheet2.A31];12)=ROUND([Sheet2.B31];12) -> true | D31: of:=FORMULA([Sheet2.A31]) -> =MOD((3^31)-3,14)
A32: of:=MOD(5310866044487;128) -> 71 | B32: 71 | C32: of:=ROUND([Sheet2.A32];12)=ROUND([Sheet2.B32];12) -> true | D32: of:=FORMULA([Sheet2.A32]) -> =MOD(5310866044487,128) | E32: Tdf#71131
A33: of:=MOD(40595547922587;128) -> 27 | B33: 27 | C33: of:=ROUND([Sheet2.A33];12)=ROUND([Sheet2.B33];12) -> true | D33: of:=FORMULA([Sheet2.A33]) -> =MOD(40595547922587,128)
A34: of:=MOD(7;2.1) -> 0.699999999999999 | B34: 0.7 | C34: of:=ROUND([Sheet2.A34];12)=ROUND([Sheet2.B34];12) -> true | D34: of:=FORMULA([Sheet2.A34]) -> =MOD(7,2.1)
A35: of:=MOD(2;7.1) -> 2 | B35: 2 | C35: of:=ROUND([Sheet2.A35];12)=ROUND([Sheet2.B35];12) -> true | D35: of:=FORMULA([Sheet2.A35]) -> =MOD(2,7.1)
A36: of:=MOD(25.4;0) ->  | B36: Err502 | C36: of:=ISERROR([.A36]) -> true | D36: of:=FORMULA([Sheet2.A36]) -> =MOD(25.4,0)
E41: Tdf#86219 is about arrays as argument, see sheet tdf86219

Sheet: tdf86219
A1: MOD(array;array) | F1: MOD(scalar;scalar) to see expected results | K1: Other functions fails also
C3: 2 | D3: 3 | G3: 2 | H3: 3 | L3: 2 | M3: 3
B4: 7 | C4: of:=MOD([.B4:.B6];[.C3:.D3]) -> 1 | D4: 1 | F4: 7 | G4: of:=MOD([.$F4];[.G$3]) -> 1 | H4: of:=MOD([.$F4];[.H$3]) -> 1 | J4: CEILING | K4: 7 | L4: of:=CEILING([.K4:.K6];[.L3:.M3]) -> 8 | M4: 9
B5: 8 | C5: 0 | D5: 2 | F5: 8 | G5: of:=MOD([.$F5];[.G$3]) -> 0 | H5: of:=MOD([.$F5];[.H$3]) -> 2 | K5: 8 | L5: 8 | M5: 9
B6: 9 | C6: 1 | D6: 0 | F6: 9 | G6: of:=MOD([.$F6];[.G$3]) -> 1 | H6: of:=MOD([.$F6];[.H$3]) -> 0 | K6: 9 | L6: 10 | M6: 9
A8: MOD(array;scalar) | F8: Workaround with INT() | L8: 2 | M8: 3
C9: 2 | G9: 2 | H9: 3 | J9: FLOOR | K9: 7 | L9: of:=FLOOR([.K9:.K11];[.L8:.M8]) -> 6 | M9: 6
B10: 7 | C10: of:=MOD([.B10:.B12];[.C9]) -> 1 | F10: 7 | G10: of:=[.F10:.F12]-[.G9:.H9]*INT([.F10:.F12]/[.G9:.H9]) -> 1 | H10: 1 | K10: 8 | L10: 8 | M10: 6
B11: 8 | C11: 0 | F11: 8 | G11: 0 | H11: 2 | K11: 9 | L11: 8 | M11: 9
B12: 9 | C12: 1 | F12: 9 | G12: 1 | H12: 0
L13: 2 | M13: 3
A14: MOD(scalar;array) | J14: QUOTIENT | K14: 7 | L14: of:=QUOTIENT([.K14:.K16];[.L13:.M13]) -> 3 | M14: 2
C15: 2 | D15: 3 | K15: 8 | L15: 4 | M15: 2
B16: 8 | C16: of:=MOD([.B16];[.C15:.D15]) -> 0 | D16: 2 | K16: 9 | L16: 4 | M16: 3
K18: Non-exaustive list…
A21: Correct
A22: of:=[.C4]=[.C22] -> true | C22: 1 | D22: 1
A23: of:=[.C5]=[.C23] -> true | C23: 0 | D23: 2
A24: of:=[.C6]=[.C24] -> true | C24: 1 | D24: 0
A25: of:=[.D4]=[.D22] -> true
A26: of:=[.D5]=[.D23] -> true | C26: 1
A27: of:=[.D6]=[.D24] -> true | C27: 0
A28: of:=[.C10]=[.C26] -> true | C28: 1
A29: of:=[.C11]=[.C27] -> true
A30: of:=[.C12]=[.C28] -> true
A31: of:=[.C22]=[.G4] -> true
A32: of:=[.C23]=[.G5] -> true
A33: of:=[.C24]=[.G6] -> true
A34: of:=[.D22]=[.H4] -> true
A35: of:=[.D23]=[.H5] -> true
A36: of:=[.D24]=[.H6] -> true
A37: of:=[.C22]=[.G10] -> true
A38: of:=[.C23]=[.G11] -> true
A39: of:=[.C24]=[.G12] -> true
A40: of:=[.D22]=[.H10] -> true
A41: of:=[.D23]=[.H11] -> true
A42: of:=[.D24]=[.H12] -> true
A43: of:=[.C43]=[.L4] -> true | C43: 8 | D43: 9
A44: of:=[.C44]=[.L5] -> true | C44: 8 | D44: 9
A45: of:=[.C45]=[.L6] -> true | C45: 10 | D45: 9
A46: of:=[.D43]=[.M4] -> true
A47: of:=[.D44]=[.M5] -> true
A48: of:=[.D45]=[.M6] -> true
A49: of:=[.C49]=[.L9] -> true | C49: 6 | D49: 6
A50: of:=[.C50]=[.L10] -> true | C50: 8 | D50: 6
A51: of:=[.C51]=[.L11] -> true | C51: 8 | D51: 9
A52: of:=[.D49]=[.M9] -> true
A53: of:=[.D50]=[.M10] -> true
A54: of:=[.D51]=[.M11] -> true
A55: of:=[.C55]=[.L14] -> true | C55: 3 | D55: 2
A56: of:=[.C56]=[.L15] -> true | C56: 4 | D56: 2
A57: of:=[.C57]=[.L16] -> true | C57: 4 | D57: 3
A58: of:=[.D55]=[.M14] -> true
A59: of:=[.D56]=[.M15] -> true
A60: of:=[.D57]=[.M16] -> true

Sheet: 'file:///home/zdenek/Dokumenty/LO/sc-unit-test/Project%20Calc%20functions%20tests/fods/mod.fods/mod.fods/log10.fods/log.fods/ln.fods/bitxor.fods/bitxor.fods/bitor.fods/bitand.fods/bitand.fods/atan.fods/asinh.fods/asin.fods/acos.fods/abs.fods/abs.fods/xor.fods/xor.fods/not.fods/ifna.fods/ifna.fods/iferror.fods/iferror.fods/if.fods/and.fods/and.fods/and.fods/and.fods/type.fods/isna.fods/isna.fods/islogical.fods/isformula.fods/iserr.fods/isblank.fods/info.fods/formula.fods/formula.fods/current.fods/cell.fods/cell.fods/minute.fods/minute.fods/year.fods/function_based_test_Example.fods/function_based_test_Example_reference.fods'#Sheet2
H3: 4

Sheet: 'file:///home/zdenek/Dokumenty/LO/sc-unit-test/Project%20Calc%20functions%20tests/fods/mod.fods/mod.fods/log10.fods/log.fods/ln.fods/bitxor.fods/bitxor.fods/bitor.fods/bitand.fods/bitand.fods/atan.fods/asinh.fods/asin.fods/acos.fods/abs.fods/abs.fods/xor.fods/xor.fods/not.fods/ifna.fods/ifna.fods/iferror.fods/iferror.fods/if.fods/and.fods/and.fods/and.fods/and.fods/type.fods/isna.fods/isna.fods/islogical.fods/isformula.fods/sc-unit-test/information-functions.ods'#Information
O7: O5