Sheet: Sheet1
A1: SUM Function
A3: Result | B3: of:=AND([.B8:.B95]) -> true
A7: Sheet | B7: Result | C7: Description
A8: 1 | B8: of:=AND([Sheet2.C2:.C92]) -> true | C8: Simple SUM formulas with local references and values

Sheet: Sheet2
A1: Function | B1: Expected | C1: Correct | D1: FunctionString | E1: Comment
A2: of:=SUM([.J2:.J4]) -> 6 | B2: 6 | C2: of:=ROUND([.A2];12)=ROUND([.B2];12) -> true | D2: of:=FORMULA([.A2]) -> =SUM(J2:J4) | J2: 1 | K2: 4
A3: of:=SUM([.J2];[.J3];[.J4]) -> 6 | B3: 6 | C3: of:=ROUND([.A3];12)=ROUND([.B3];12) -> true | D3: of:=FORMULA([.A3]) -> =SUM(J2;J3;J4) | J3: 2 | K3: 5
A4: of:=SUM({1;2;3}) -> 6 | B4: 6 | C4: of:=ROUND([.A4];12)=ROUND([.B4];12) -> true | D4: of:=FORMULA([.A4]) -> =SUM({1.2.3}) | J4: 3 | K4: 6
A5: of:=SUM([.J2:.J4];{1;2};3) -> 12 | B5: 12 | C5: of:=ROUND([.A5];12)=ROUND([.B5];12) -> true | D5: of:=FORMULA([.A5]) -> =SUM(J2:J4;{1.2};3)
A6: of:=SUM([.J3:.J5];[.J10:.J11]) -> 8 | B6: 8 | C6: of:=ROUND([.A6];12)=ROUND([.B6];12) -> true | D6: of:=FORMULA([.A6]) -> =SUM(J3:J5;J10:J11)
A7: of:=SUM(range) -> 6 | B7: 6 | C7: of:=ROUND([.A7];12)=ROUND([.B7];12) -> true | D7: of:=FORMULA([.A7]) -> =SUM(range) | J7: 5
A8: of:=SUM([.J7:.J9]) ->  | B8: of:#N/A ->  | C8: of:=ISERROR([.A8]) -> true | D8: of:=FORMULA([.A8]) -> =SUM(J7:J9) | J8: of:=NA() -> 
A9: of:=SUM([.J2:.K4]) -> 21 | B9: 21 | C9: of:=ROUND([.A9];12)=ROUND([.B9];12) -> true | D9: of:=FORMULA([.A9]) -> =SUM(J2:K4) | E9: multi-column | J9: 10
A10: of:=SUM([.J2:.L5]) -> 21 | B10: 21 | C10: of:=ROUND([.A10];12)=ROUND([.B10];12) -> true | D10: of:=FORMULA([.A10]) -> =SUM(J2:L5) | E10: empty cells | J10: 3
A11: of:=SUM(ABS(MUNIT(2))) -> 2 | B11: 2 | C11: of:=ROUND([.A11];12)=ROUND([.B11];12) -> true | D11: of:=FORMULA([.A11]) -> =SUM(ABS(MUNIT(2)))
A12: of:=SUM(ABS(MUNIT(2)*-1)) -> 2 | B12: 2 | C12: of:=ROUND([.A12];12)=ROUND([.B12];12) -> true | D12: of:=FORMULA([.A12]) -> =SUM(ABS(MUNIT(2)*-1))

Sheet: 'file:///home/seli/zdenek/Dokumenty/LO/sc-unit-test/Project%20Calc%20functions%20tests/fods/subtotal.fods/sqrtpi.fods/sqrt.fods/sinh.fods/sin.fods/cos.fods/cos.fods/atan.fods/asinh.fods/asin.fods/acos.fods/abs.fods/abs.fods/xor.fods/xor.fods/not.fods/ifna.fods/ifna.fods/iferror.fods/iferror.fods/if.fods/and.fods/and.fods/and.fods/and.fods/type.fods/isna.fods/isna.fods/islogical.fods/isformula.fods/iserr.fods/isblank.fods/info.fods/formula.fods/formula.fods/current.fods/cell.fods/cell.fods/minute.fods/minute.fods/year.fods/function_based_test_Example.fods/function_based_test_Example_reference.fods'#Sheet2
H3: 4

Sheet: 'file:///home/seli/zdenek/Dokumenty/LO/sc-unit-test/Project%20Calc%20functions%20tests/fods/subtotal.fods/sqrtpi.fods/sqrt.fods/sinh.fods/sin.fods/cos.fods/cos.fods/atan.fods/asinh.fods/asin.fods/acos.fods/abs.fods/abs.fods/xor.fods/xor.fods/not.fods/ifna.fods/ifna.fods/iferror.fods/iferror.fods/if.fods/and.fods/and.fods/and.fods/and.fods/type.fods/isna.fods/isna.fods/islogical.fods/isformula.fods/sc-unit-test/information-functions.ods'#Information
O7: O5