Sheet: Sheet1
A1: SUMIF Function
A3: Result | B3: of:=AND([.B8:.B95]) -> true
A7: Sheet | B7: Result | C7: Description
A8: 1 | B8: of:=AND([Sheet2.C2:.C91]) -> true | C8: Simple SUMIF formulas with local references and values

Sheet: Sheet2
A1: Function | B1: Expected | C1: Correct | D1: FunctionString | E1: Comment | H1: 1 | I1: Paid | K1: 1 | L1: 10 | M1: a | N1: a | R1: Property Value | S1: Commission | T1: Data | V1: Category | W1: Food | X1: Sales
A2: of:=SUMIF([.I1:.I5];"unpaid";[.H1:.H5]) -> 6 | B2: 6 | C2: of:=ROUND([.A2];12)=ROUND([.B2];12) -> true | D2: of:=FORMULA([.A2]) -> =SUMIF(I1:I5;"unpaid";H1:H5) | H2: 2 | I2: Unpaid | K2: 2 | L2: 20 | M2: 20 | N2: x | O2: x | P2: x | R2: 100000 | S2: 7000 | T2: 250000 | V2: Vegetables | W2: Tomatoes | X2: 2300 | AA2: 1
A3: of:=SUMIF([.L1:.L11];10;[.K1:.K11]) -> 26 | B3: 26 | C3: of:=ROUND([.A3];12)=ROUND([.B3];12) -> true | D3: of:=FORMULA([.A3]) -> =SUMIF(L1:L11;10;K1:K11) | H3: 3 | I3: Paid | K3: 3 | L3: 20 | M3: 20 | N3: x | O3: x | P3: x | R3: 200000 | S3: 14000 | V3: Vegetables | W3: Celery | X3: 5500 | Z3: A | AA3: 10
A4: of:=SUMIF([.M1:.M11];"a";[.K1:.K11]) -> 26 | B4: 26 | C4: of:=ROUND([.A4];12)=ROUND([.B4];12) -> true | D4: of:=FORMULA([.A4]) -> =SUMIF(M1:M11;"a";K1:K11) | H4: 4 | I4: Unpaid | K4: 4 | L4: 10 | M4: a | N4: a | R4: 300000 | S4: 21000 | V4: Fruits | W4: Oranges | X4: 800 | Z4: B | AA4: 100
A5: of:=SUMIF([.N1:.N11];"a";[.K1:.K11]) -> 26 | B5: 26 | C5: of:=ROUND([.A5];12)=ROUND([.B5];12) -> true | D5: of:=FORMULA([.A5]) -> =SUMIF(N1:N11;"a";K1:K11) | H5: 5 | I5: Paid | K5: 5 | L5: 11 | M5: 11 | N5: x | O5: x | P5: x | R5: 400000 | S5: 28000 | W5: Butter | X5: 400 | Z5: C | AA5: 1000
A6: of:=SUMIF([.O1:.O11];"";[.K1:.K11]) -> 26 | B6: 26 | C6: of:=ROUND([.A6];12)=ROUND([.B6];12) -> true | D6: of:=FORMULA([.A6]) -> =SUMIF(O1:O11;"";K1:K11) | H6: -3 | K6: 6 | L6: 21 | M6: 21 | N6: x | O6: x | P6: x | R6: Formula | S6: Description | T6: Result | V6: Vegetables | W6: Carrots | X6: 4200 | AA6: 10000
A7: of:=SUMIF([.P1:.P11];" ";[.K1:.K11]) -> 26 | B7: 26 | C7: of:=ROUND([.A7];12)=ROUND([.B7];12) -> true | D7: of:=FORMULA([.A7]) -> =SUMIF(P1:P11;" ";K1:K11) | H7: -2 | K7: 7 | L7: 20 | M7: 20 | N7: x | O7: x | P7: x | S7: Sum of the commissions for property values over 160,000. | T7: $ 63,000.00 | V7: Fruits | W7: Apples | X7: 1200
A8: of:=SUMIF([.O1:.O11];"=";[.K1:.K11]) -> 26 | B8: 26 | C8: of:=ROUND([.A8];12)=ROUND([.B8];12) -> true | D8: of:=FORMULA([.A8]) -> =SUMIF(O1:O11;"=";K1:K11) | K8: 8 | L8: 11 | M8: 11 | N8: x | O8: x | P8: x | S8: Sum of the property values over 160,000. | T8: $ 900,000.00 | V8: Formula | W8: Description | X8: Result
A9: of:=SUMIF([.O1:.O11];"<>";[.K1:.K11]) -> 40 | B9: 40 | C9: of:=ROUND([.A9];12)=ROUND([.B9];12) -> true | D9: of:=FORMULA([.A9]) -> =SUMIF(O1:O11;"<>";K1:K11) | K9: 9 | L9: 12 | M9: 12 | N9: x | O9: x | P9: x | S9: Sum of the commissions for property values equal to 300,000. | T9: $ 21,000.00 | W9: Sum of the sales of all foods in the "Fruits" category. | X9: $ 2,000.00
A10: of:=SUMIF([.R2:.R5];">160000";[.S2:.S5]) -> 63000 | B10: 63000 | C10: of:=ROUND([.A10];12)=ROUND([.B10];12) -> true | D10: of:=FORMULA([.A10]) -> =SUMIF(R2:R5;">160000";S2:S5) | K10: 10 | L10: 10 | M10: a | N10: a | S10: Sum of the commissions for property values greater than the value in C2. | T10: $ 49,000.00 | W10: Sum of the sales of all foods in the "Vegetables" category. | X10: $ 12,000.00
A11: of:=SUMIF([.R2:.R5];">160000") -> 900000 | B11: 900000 | C11: of:=ROUND([.A11];12)=ROUND([.B11];12) -> true | D11: of:=FORMULA([.A11]) -> =SUMIF(R2:R5;">160000") | K11: 11 | L11: 10 | M11: a | N11: a
A12: of:=SUMIF([.R2:.R5];300000;[.S2:.S5]) -> 21000 | B12: 21000 | C12: of:=ROUND([.A12];12)=ROUND([.B12];12) -> true | D12: of:=FORMULA([.A12]) -> =SUMIF(R2:R5;300000;S2:S5) | W12: Sum of the sales of all foods that do not have a category specified. | X12: $ 400.00
A13: of:=SUMIF([.R2:.R5];">" & [.T2];[.S2:.S5]) -> 49000 | B13: 49000 | C13: of:=ROUND([.A13];12)=ROUND([.B13];12) -> true | D13: of:=FORMULA([.A13]) -> =SUMIF(R2:R5;">" & T2;S2:S5)
A14: of:=SUMIF([.V2:.V7];"Fruits";[.X2:.X7]) -> 2000 | B14: 2000 | C14: of:=ROUND([.A14];12)=ROUND([.B14];12) -> true | D14: of:=FORMULA([.A14]) -> =SUMIF(V2:V7;"Fruits";X2:X7)
A15: of:=SUMIF([.V2:.V7];"Vegetables";[.X2:.X7]) -> 12000 | B15: 12000 | C15: of:=ROUND([.A15];12)=ROUND([.B15];12) -> true | D15: of:=FORMULA([.A15]) -> =SUMIF(V2:V7;"Vegetables";X2:X7)
A16: of:=SUMIF([.V2:.V7];"";[.X2:.X7]) -> 400 | B16: 400 | C16: of:=ROUND([.A16];12)=ROUND([.B16];12) -> true | D16: of:=FORMULA([.A16]) -> =SUMIF(V2:V7;"";X2:X7)
A17: of:=SUMIF([.H1:.H7];"<0") -> -5 | B17: -5 | C17: of:=ROUND([.A17];12)=ROUND([.B17];12) -> true | D17: of:=FORMULA([.A17]) -> =SUMIF(H1:H7;"<0")
A18: of:=SUMIF([.H2:.H8]) ->  | B18: Err:511 | C18: of:=ISERROR([.A18]) -> true | D18: of:=FORMULA([.A18]) -> =SUMIF(H2:H8)
A19: of:=SUMIF([.Z2:.Z6];"=B";[.AA2:.AA6]) -> 100 | B19: 100 | C19: of:=[.A19]=[.B19] -> true | D19: of:=FORMULA([.A19]) -> =SUMIF(Z2:Z6;"=B";AA2:AA6)
A20: of:=SUMIF([.Z2:.Z6];"<>B";[.AA2:.AA6]) -> 11011 | B20: 11011 | C20: of:=[.A20]=[.B20] -> true | D20: of:=FORMULA([.A20]) -> =SUMIF(Z2:Z6;"<>B";AA2:AA6)
A21: of:=SUMIF([.Z2:.Z6];"<B";[.AA2:.AA6]) -> 10 | B21: 10 | C21: of:=[.A21]=[.B21] -> true | D21: of:=FORMULA([.A21]) -> =SUMIF(Z2:Z6;"<B";AA2:AA6)
A22: of:=SUMIF([.Z2:.Z6];">B";[.AA2:.AA6]) -> 1000 | B22: 1000 | C22: of:=[.A22]=[.B22] -> true | D22: of:=FORMULA([.A22]) -> =SUMIF(Z2:Z6;">B";AA2:AA6)
A23: of:=SUMIF([.Z2:.Z6];"<=B";[.AA2:.AA6]) -> 110 | B23: 110 | C23: of:=[.A23]=[.B23] -> true | D23: of:=FORMULA([.A23]) -> =SUMIF(Z2:Z6;"<=B";AA2:AA6)
A24: of:=SUMIF([.Z2:.Z6];">=B";[.AA2:.AA6]) -> 1100 | B24: 1100 | C24: of:=[.A24]=[.B24] -> true | D24: of:=FORMULA([.A24]) -> =SUMIF(Z2:Z6;">=B";AA2:AA6)
A25: of:=SUMIF([.Z2:.Z6];"=";[.AA2:.AA6]) -> 10001 | B25: 10001 | C25: of:=[.A25]=[.B25] -> true | D25: of:=FORMULA([.A25]) -> =SUMIF(Z2:Z6;"=";AA2:AA6)
A26: of:=SUMIF([.Z2:.Z6];"<>";[.AA2:.AA6]) -> 1110 | B26: 1110 | C26: of:=[.A26]=[.B26] -> true | D26: of:=FORMULA([.A26]) -> =SUMIF(Z2:Z6;"<>";AA2:AA6)
A27: of:=SUMIF([.Z2:.Z6];"<";[.AA2:.AA6]) -> 0 | B27: 0 | C27: of:=[.A27]=[.B27] -> true | D27: of:=FORMULA([.A27]) -> =SUMIF(Z2:Z6;"<";AA2:AA6)
A28: of:=SUMIF([.Z2:.Z6];">";[.AA2:.AA6]) -> 1110 | B28: 1110 | C28: of:=[.A28]=[.B28] -> true | D28: of:=FORMULA([.A28]) -> =SUMIF(Z2:Z6;">";AA2:AA6)
A29: of:=SUMIF([.Z2:.Z6];"<=";[.AA2:.AA6]) -> 0 | B29: 0 | C29: of:=[.A29]=[.B29] -> true | D29: of:=FORMULA([.A29]) -> =SUMIF(Z2:Z6;"<=";AA2:AA6)
A30: of:=SUMIF([.Z2:.Z6];">=";[.AA2:.AA6]) -> 1110 | B30: 1110 | C30: of:=[.A30]=[.B30] -> true | D30: of:=FORMULA([.A30]) -> =SUMIF(Z2:Z6;">=";AA2:AA6)

Sheet: 'file:///tmp/sumif.fods/sum.fods/sum.fods/subtotal.fods/sqrtpi.fods/sqrt.fods/sinh.fods/sin.fods/cos.fods/cos.fods/atan.fods/asinh.fods/asin.fods/acos.fods/abs.fods/abs.fods/xor.fods/xor.fods/not.fods/ifna.fods/ifna.fods/iferror.fods/iferror.fods/if.fods/and.fods/and.fods/and.fods/and.fods/type.fods/isna.fods/isna.fods/islogical.fods/isformula.fods/iserr.fods/isblank.fods/info.fods/formula.fods/formula.fods/current.fods/cell.fods/cell.fods/minute.fods/minute.fods/year.fods/function_based_test_Example.fods/function_based_test_Example_reference.fods'#Sheet2
H3: 4

Sheet: 'file:///tmp/sumif.fods/sum.fods/sum.fods/subtotal.fods/sqrtpi.fods/sqrt.fods/sinh.fods/sin.fods/cos.fods/cos.fods/atan.fods/asinh.fods/asin.fods/acos.fods/abs.fods/abs.fods/xor.fods/xor.fods/not.fods/ifna.fods/ifna.fods/iferror.fods/iferror.fods/if.fods/and.fods/and.fods/and.fods/and.fods/type.fods/isna.fods/isna.fods/islogical.fods/isformula.fods/sc-unit-test/information-functions.ods'#Information
O7: O5

Sheet: 'file:///tmp/sumif.fods/sumif.fods/external_refs/sumif_references.fods'#Sheet1
C6: yes | D6: 1
C7: no | D7: 2
C8: yes | D8: 3