Sheet: Sheet1
A1: ABS Function
A3: Result | B3: of:=AND([.B8:.B95]) -> true
A7: Sheet | B7: Result | C7: Description
A8: 1 | B8: of:=AND([Sheet2.C2:.C92]) -> true | C8: Simple ABS formulas with local references and values

Sheet: Sheet2
A1: Function | B1: Expected | C1: Correct | D1: FunctionString | E1: Comment
A2: of:=ABS(0) -> 0 | B2: 0 | C2: of:=[.A2]=[.B2] -> true | D2: of:=FORMULA([.A2]) -> =ABS(0) | J2: of:=1/0 ->  | K2: AA
A3: of:=ABS(1) -> 1 | B3: 1 | C3: of:=[.A3]=[.B3] -> true | D3: of:=FORMULA([.A3]) -> =ABS(1) | J3: 13 | K3: AA
A4: of:=ABS(-10) -> 10 | B4: 10 | C4: of:=[.A4]=[.B4] -> true | D4: of:=FORMULA([.A4]) -> =ABS(-10)
A5: of:=ABS([.J2]) ->  | B5: error | C5: of:=ISERROR([.A5]) -> true | D5: of:=FORMULA([.A5]) -> =ABS(J2)
A6: of:=ABS([.J3]) -> 13 | B6: 13 | C6: of:=[.A6]=[.B6] -> true | D6: of:=FORMULA([.A6]) -> =ABS(J3) | J6: of:=TRUE() -> true
A7: of:=ABS([.J6]) -> 1 | B7: 1 | C7: of:=[.A7]=[.B7] -> true | D7: of:=FORMULA([.A7]) -> =ABS(J6) | J7: of:=FALSE() -> false
A8: of:=ABS([.K2]) ->  | B8: error | C8: of:=ISERROR([.A8]) -> true | D8: of:=FORMULA([.A8]) -> =ABS(K2)
A9: of:=ABS() ->  | B9: error | C9: of:=ISERROR([.A9]) -> true | D9: of:=FORMULA([.A9]) -> =ABS() | J9: 1
A10: of:=ABS([.J3];0) ->  | B10: error | C10: of:=ISERROR([.A10]) -> true | D10: of:=FORMULA([.A10]) -> =ABS(J3,0) | J10: of:=NA() -> 
J11: of:=PI() -> 3.14159265358979

Sheet: 'file:///home/zdenek/Dokumenty/LO/sc-unit-test/Project%20Calc%20functions%20tests/fods/abs.fods/xor.fods/xor.fods/not.fods/ifna.fods/ifna.fods/iferror.fods/iferror.fods/if.fods/and.fods/and.fods/and.fods/and.fods/type.fods/isna.fods/isna.fods/islogical.fods/isformula.fods/iserr.fods/isblank.fods/info.fods/formula.fods/formula.fods/current.fods/cell.fods/cell.fods/minute.fods/minute.fods/year.fods/function_based_test_Example.fods/function_based_test_Example_reference.fods'#Sheet2
H3: 4

Sheet: 'file:///home/zdenek/Dokumenty/LO/sc-unit-test/Project%20Calc%20functions%20tests/fods/abs.fods/xor.fods/xor.fods/not.fods/ifna.fods/ifna.fods/iferror.fods/iferror.fods/if.fods/and.fods/and.fods/and.fods/and.fods/type.fods/isna.fods/isna.fods/islogical.fods/isformula.fods/sc-unit-test/information-functions.ods'#Information
O7: O5