Sheet: Sheet1
A1: ACOT Function
A3: Result | B3: of:=AND([.B8:.B95]) -> true
A7: Sheet | B7: Result | C7: Description
A8: 1 | B8: of:=AND([Sheet2.C2:.C92]) -> true | C8: Simple ACOT formulas with local references and values

Sheet: Sheet2
A1: Function | B1: Expected | C1: Correct | D1: FunctionString | E1: Comment
A2: of:=ACOT(0)/PI() -> 0.5 | B2: 0.5 | C2: of:=[.A2]=[.B2] -> true | D2: of:=FORMULA([.A2]) -> =ACOT(0)/PI() | J2: of:=1/0 ->  | K2: AA
A3: of:=ACOT(1) -> 0.785398163397448 | B3: 0.785398163397448 | C3: of:=[.A3]=[.B3] -> true | D3: of:=FORMULA([.A3]) -> =ACOT(1) | J3: 13 | K3: AA
A4: of:=ACOT(-1)/PI() -> 0.75 | B4: 0.75 | C4: of:=[.A4]=[.B4] -> true | D4: of:=FORMULA([.A4]) -> =ACOT(-1)/PI()
A5: of:=ACOT(1-[.K20]/[.J18]) -> 2.35619449019234 | B5: 2.35619449019234 | C5: of:=ROUND([.A5];12)=ROUND([.B5];12) -> true | D5: of:=FORMULA([.A5]) -> =ACOT(1-K20/J18)
A6: of:=ACOT(-0.5) -> 2.0344439357957 | B6: 2.0344439357957 | C6: of:=ROUND([.A6];12)=ROUND([.B6];12) -> true | D6: of:=FORMULA([.A6]) -> =ACOT(-0,5) | J6: of:=TRUE() -> true
A7: of:=ACOT(-0.5)*180/PI() -> 116.565051177078 | B7: 116.565051177078 | C7: of:=ROUND([.A7];12)=ROUND([.B7];12) -> true | D7: of:=FORMULA([.A7]) -> =ACOT(-0,5)*180/PI() | J7: of:=FALSE() -> false
A8: of:=DEGREES(ACOT(-0.5)) -> 116.565051177078 | B8: 116.565051177078 | C8: of:=ROUND([.A8];12)=ROUND([.B8];12) -> true | D8: of:=FORMULA([.A8]) -> =DEGREES(ACOT(-0,5))
A9: of:=ACOT([.J2]) ->  | B9: error | C9: of:=ISERROR([.A9]) -> true | D9: of:=FORMULA([.A9]) -> =ACOT(J2) | J9: 1
A10: of:=ACOT([.J6]) -> 0.785398163397448 | B10: 0.785398163397448 | C10: of:=[.A10]=[.B10] -> true | D10: of:=FORMULA([.A10]) -> =ACOT(J6) | J10: of:=NA() -> 
A11: of:=ACOT([.K2]) ->  | B11: error | C11: of:=ISERROR([.A11]) -> true | D11: of:=FORMULA([.A11]) -> =ACOT(K2) | J11: of:=PI() -> 3.14159265358979
A12: of:=ACOT([.F1]) -> 1.5707963267949 | B12: 1.5707963267949 | C12: of:=ROUND([.A12];12)=ROUND([.B12];12) -> true | D12: of:=FORMULA([.A12]) -> =ACOT(F1)
A13: of:=ACOT(1-[.K19]/[.J18]) -> 2.35619449019234 | B13: 2.35619449019234 | C13: of:=ROUND([.A13];12)=ROUND([.B13];12) -> true | D13: of:=FORMULA([.A13]) -> =ACOT(1-K19/J18) | E13: Tdf#93408
A14: of:=ACOT(2) -> 0.463647609000806 | B14: 0.463647609000806 | C14: of:=ROUND([.A14];12)=ROUND([.B14];12) -> true | D14: of:=FORMULA([.A14]) -> =ACOT(2)
A15: of:=ACOT(-1)/PI() -> 0.75 | B15: 0.75 | C15: of:=[.A15]=[.B15] -> true | D15: of:=FORMULA([.A15]) -> =ACOT(-1)/PI()
A16: of:=ACOT(1)/PI() -> 0.25 | B16: 0.25 | C16: of:=[.A16]=[.B16] -> true | D16: of:=FORMULA([.A16]) -> =ACOT(1)/PI()
J18: 1.15
J19: 2.2 | K19: of:=[.J19]+0.1 -> 2.3
K20: 2.3

Sheet: 'file:///home/zdenek/Dokumenty/LO/sc-unit-test/Project%20Calc%20functions%20tests/fods/acot.fods/acot.fods/acos.fods/abs.fods/abs.fods/xor.fods/xor.fods/not.fods/ifna.fods/ifna.fods/iferror.fods/iferror.fods/if.fods/and.fods/and.fods/and.fods/and.fods/type.fods/isna.fods/isna.fods/islogical.fods/isformula.fods/iserr.fods/isblank.fods/info.fods/formula.fods/formula.fods/current.fods/cell.fods/cell.fods/minute.fods/minute.fods/year.fods/function_based_test_Example.fods/function_based_test_Example_reference.fods'#Sheet2
H3: 4

Sheet: 'file:///home/zdenek/Dokumenty/LO/sc-unit-test/Project%20Calc%20functions%20tests/fods/acot.fods/acot.fods/acos.fods/abs.fods/abs.fods/xor.fods/xor.fods/not.fods/ifna.fods/ifna.fods/iferror.fods/iferror.fods/if.fods/and.fods/and.fods/and.fods/and.fods/type.fods/isna.fods/isna.fods/islogical.fods/isformula.fods/sc-unit-test/information-functions.ods'#Information
O7: O5