Sheet: Sheet1
A1: ATANH Function
A3: Result | B3: of:=AND([.B8:.B95]) -> true
A7: Sheet | B7: Result | C7: Description
A8: 1 | B8: of:=AND([Sheet2.C2:.C87]) -> true | C8: Simple ATANH formulas with local references and values

Sheet: Sheet2
A1: Function | B1: Expected | C1: Correct | D1: FunctionString | E1: Comment
A2: of:=ATANH(0)/PI() -> 0 | B2: 0 | C2: of:=[.A2]=[.B2] -> true | D2: of:=FORMULA([.A2]) -> =ATANH(0)/PI() | J2: of:=1/0 ->  | K2: AA
A3: of:=ATANH(1) ->  | B3: error | C3: of:=ISERROR([.A3]) -> true | D3: of:=FORMULA([.A3]) -> =ATANH(1) | J3: 13 | K3: AA
A4: of:=ATANH(-1)/PI() ->  | B4: error | C4: of:=ISERROR([.A4]) -> true | D4: of:=FORMULA([.A4]) -> =ATANH(-1)/PI()
A5: of:=ATANH(1-[.K20]/[.J18]) ->  | B5: error | C5: of:=ISERROR([.A5]) -> true | D5: of:=FORMULA([.A5]) -> =ATANH(1-K20/J18)
A6: of:=ATANH(-0.5) -> -0.549306144334055 | B6: of:=ATANH(-0.5) -> -0.549306144334055 | C6: of:=[.A6]=[.B6] -> true | D6: of:=FORMULA([.A6]) -> =ATANH(-0.5) | J6: of:=TRUE() -> true
A7: of:=ATANH(-0.5)*180/PI() -> -31.4729237309454 | B7: of:=ATANH(-0.5)*180/PI() -> -31.4729237309454 | C7: of:=[.A7]=[.B7] -> true | D7: of:=FORMULA([.A7]) -> =ATANH(-0.5)*180/PI() | J7: of:=FALSE() -> false
A8: of:=DEGREES(ATANH(-0.5)) -> -31.4729237309454 | B8: of:=DEGREES(ATANH(-0.5)) -> -31.4729237309454 | C8: of:=[.A8]=[.B8] -> true | D8: of:=FORMULA([.A8]) -> =DEGREES(ATANH(-0.5))
A9: of:=ATANH([.J2]) ->  | B9: error | C9: of:=ISERROR([.A9]) -> true | D9: of:=FORMULA([.A9]) -> =ATANH(J2) | J9: 1
A10: of:=ATANH([.J6]) ->  | B10: error | C10: of:=ISERROR([.A10]) -> true | D10: of:=FORMULA([.A10]) -> =ATANH(J6) | J10: of:=NA() -> 
A11: of:=ATANH([.K2]) ->  | B11: error | C11: of:=ISERROR([.A11]) -> true | D11: of:=FORMULA([.A11]) -> =ATANH(K2) | J11: of:=PI() -> 3.14159265358979
A12: of:=ATANH([.F1]) -> 0 | B12: 0 | C12: of:=[.A12]=[.B12] -> true | D12: of:=FORMULA([.A12]) -> =ATANH(F1)
A13: of:=ATANH([.J13]) ->  | B13: error | C13: of:=ISERROR([.A13]) -> true | D13: of:=FORMULA([.A13]) -> =ATANH(J13) | J13: 1.4E+154
A14: of:=ATANH([.F14]) -> -1.47221948958322 | B14: -1.47221948958322 | C14: of:=ROUND([.A14];15)=ROUND([.B14];15) -> true | D14: of:=FORMULA([.A14]) -> =ATANH(F14) | F14: -0.9
A15: of:=ATANH([.F15]) -> -1.09861228866811 | B15: -1.09861228866811 | C15: of:=ROUND([.A15];15)=ROUND([.B15];15) -> true | D15: of:=FORMULA([.A15]) -> =ATANH(F15) | F15: -0.8
A16: of:=ATANH([.F16]) -> -0.867300527694053 | B16: -0.867300527694053 | C16: of:=ROUND([.A16];15)=ROUND([.B16];15) -> true | D16: of:=FORMULA([.A16]) -> =ATANH(F16) | F16: -0.7
A17: of:=ATANH([.F17]) -> -0.693147180559946 | B17: -0.693147180559945 | C17: of:=ROUND([.A17];15)=ROUND([.B17];15) -> true | D17: of:=FORMULA([.A17]) -> =ATANH(F17) | F17: -0.6
A18: of:=ATANH([.F18]) -> -0.549306144334055 | B18: -0.549306144334055 | C18: of:=ROUND([.A18];15)=ROUND([.B18];15) -> true | D18: of:=FORMULA([.A18]) -> =ATANH(F18) | F18: -0.5 | J18: 1.15
A19: of:=ATANH([.F19]) -> -0.423648930193602 | B19: -0.423648930193602 | C19: of:=ROUND([.A19];15)=ROUND([.B19];15) -> true | D19: of:=FORMULA([.A19]) -> =ATANH(F19) | F19: -0.4 | J19: 2.2 | K19: of:=[.J19]+0.1 -> 2.3
A20: of:=ATANH([.F20]) -> -0.309519604203112 | B20: -0.309519604203112 | C20: of:=ROUND([.A20];15)=ROUND([.B20];15) -> true | D20: of:=FORMULA([.A20]) -> =ATANH(F20) | F20: -0.3 | K20: 2.3
A21: of:=ATANH([.F21]) -> -0.202732554054082 | B21: -0.202732554054082 | C21: of:=ROUND([.A21];15)=ROUND([.B21];15) -> true | D21: of:=FORMULA([.A21]) -> =ATANH(F21) | F21: -0.2
A22: of:=ATANH([.F22]) -> -0.100335347731076 | B22: -0.100335347731076 | C22: of:=ROUND([.A22];15)=ROUND([.B22];15) -> true | D22: of:=FORMULA([.A22]) -> =ATANH(F22) | F22: -0.1
A23: of:=ATANH([.F23]) -> 0 | B23: 0 | C23: of:=ROUND([.A23];15)=ROUND([.B23];15) -> true | D23: of:=FORMULA([.A23]) -> =ATANH(F23) | F23: 0
A24: of:=ATANH([.F24]) -> 0.100335347731076 | B24: 0.100335347731076 | C24: of:=ROUND([.A24];15)=ROUND([.B24];15) -> true | D24: of:=FORMULA([.A24]) -> =ATANH(F24) | F24: 0.1
A25: of:=ATANH([.F25]) -> 0.202732554054082 | B25: 0.202732554054082 | C25: of:=ROUND([.A25];15)=ROUND([.B25];15) -> true | D25: of:=FORMULA([.A25]) -> =ATANH(F25) | F25: 0.2
A26: of:=ATANH([.F26]) -> 0.309519604203112 | B26: 0.309519604203112 | C26: of:=ROUND([.A26];15)=ROUND([.B26];15) -> true | D26: of:=FORMULA([.A26]) -> =ATANH(F26) | F26: 0.3
A27: of:=ATANH([.F27]) -> 0.423648930193602 | B27: 0.423648930193602 | C27: of:=ROUND([.A27];15)=ROUND([.B27];15) -> true | D27: of:=FORMULA([.A27]) -> =ATANH(F27) | F27: 0.4
A28: of:=ATANH([.F28]) -> 0.549306144334055 | B28: 0.549306144334055 | C28: of:=ROUND([.A28];15)=ROUND([.B28];15) -> true | D28: of:=FORMULA([.A28]) -> =ATANH(F28) | F28: 0.5
A29: of:=ATANH([.F29]) -> 0.693147180559946 | B29: 0.693147180559945 | C29: of:=ROUND([.A29];15)=ROUND([.B29];15) -> true | D29: of:=FORMULA([.A29]) -> =ATANH(F29) | F29: 0.6
A30: of:=ATANH([.F30]) -> 0.867300527694053 | B30: 0.867300527694053 | C30: of:=ROUND([.A30];15)=ROUND([.B30];15) -> true | D30: of:=FORMULA([.A30]) -> =ATANH(F30) | F30: 0.7
A31: of:=ATANH([.F31]) -> 1.09861228866811 | B31: 1.09861228866811 | C31: of:=ROUND([.A31];15)=ROUND([.B31];15) -> true | D31: of:=FORMULA([.A31]) -> =ATANH(F31) | F31: 0.8
A32: of:=ATANH([.F32]) -> 1.47221948958322 | B32: 1.47221948958322 | C32: of:=ROUND([.A32];15)=ROUND([.B32];15) -> true | D32: of:=FORMULA([.A32]) -> =ATANH(F32) | F32: 0.9
A33: of:=ATANH([.F33]) -> 0 | B33: 0 | C33: of:=ROUND([.A33];15)=ROUND([.B33];15) -> true | D33: of:=FORMULA([.A33]) -> =ATANH(F33) | F33: 0
A34: of:=ATANH([.F34]) -> 2E-015 | B34: 2E-015 | C34: of:=ROUND([.A34];15)=ROUND([.B34];15) -> true | D34: of:=FORMULA([.A34]) -> =ATANH(F34) | F34: 2E-015
A35: of:=ATANH([.F35]) -> 0.00000000000005 | B35: 0.00000000000005 | C35: of:=ROUND([.A35];15)=ROUND([.B35];15) -> true | D35: of:=FORMULA([.A35]) -> =ATANH(F35) | F35: 0.00000000000005
A36: of:=ATANH([.F36]) -> 0.0000000000009 | B36: 0.0000000000009 | C36: of:=ROUND([.A36];15)=ROUND([.B36];15) -> true | D36: of:=FORMULA([.A36]) -> =ATANH(F36) | F36: 0.0000000000009
A37: of:=ATANH([.F37]) -> 0.000000000002 | B37: 0.000000000002 | C37: of:=ROUND([.A37];15)=ROUND([.B37];15) -> true | D37: of:=FORMULA([.A37]) -> =ATANH(F37) | F37: 0.000000000002
A38: of:=ATANH([.F38]) -> 0.00000000005 | B38: 0.00000000005 | C38: of:=ROUND([.A38];15)=ROUND([.B38];15) -> true | D38: of:=FORMULA([.A38]) -> =ATANH(F38) | F38: 0.00000000005
A39: of:=ATANH([.F39]) -> 0.0000000009 | B39: 0.0000000009 | C39: of:=ROUND([.A39];15)=ROUND([.B39];15) -> true | D39: of:=FORMULA([.A39]) -> =ATANH(F39) | F39: 0.0000000009
A40: of:=ATANH([.F40]) -> 0.000000002 | B40: 0.000000002 | C40: of:=ROUND([.A40];15)=ROUND([.B40];15) -> true | D40: of:=FORMULA([.A40]) -> =ATANH(F40) | F40: 0.000000002
A41: of:=ATANH([.F41]) -> 0.00000005 | B41: 0.00000005 | C41: of:=ROUND([.A41];15)=ROUND([.B41];15) -> true | D41: of:=FORMULA([.A41]) -> =ATANH(F41) | F41: 0.00000005
A42: of:=ATANH([.F42]) -> 0.000000900000000000243 | B42: 0.000000900000000000243 | C42: of:=ROUND([.A42];15)=ROUND([.B42];15) -> true | D42: of:=FORMULA([.A42]) -> =ATANH(F42) | F42: 0.0000009
A43: of:=ATANH([.F43]) -> 0.00000200000000000267 | B43: 0.00000200000000000267 | C43: of:=ROUND([.A43];15)=ROUND([.B43];15) -> true | D43: of:=FORMULA([.A43]) -> =ATANH(F43) | F43: 0.000002
A44: of:=ATANH([.F44]) -> 0.0000500000000416667 | B44: 0.0000500000000416667 | C44: of:=ROUND([.A44];15)=ROUND([.B44];15) -> true | D44: of:=FORMULA([.A44]) -> =ATANH(F44) | F44: 0.00005
A45: of:=ATANH([.F45]) -> 0.000900000243000118 | B45: 0.000900000243000118 | C45: of:=ROUND([.A45];15)=ROUND([.B45];15) -> true | D45: of:=FORMULA([.A45]) -> =ATANH(F45) | F45: 0.0009
A46: of:=ATANH([.F46]) -> 0.00200000266667307 | B46: 0.00200000266667307 | C46: of:=ROUND([.A46];15)=ROUND([.B46];15) -> true | D46: of:=FORMULA([.A46]) -> =ATANH(F46) | F46: 0.002
A47: of:=ATANH([.F47]) -> 0.0030000090000486 | B47: 0.0030000090000486 | C47: of:=ROUND([.A47];15)=ROUND([.B47];15) -> true | D47: of:=FORMULA([.A47]) -> =ATANH(F47) | F47: 0.003
A48: of:=ATANH([.F48]) -> 0.00700011433669485 | B48: 0.00700011433669485 | C48: of:=ROUND([.A48];15)=ROUND([.B48];15) -> true | D48: of:=FORMULA([.A48]) -> =ATANH(F48) | F48: 0.007
A49: of:=ATANH([.F49]) -> 0.0100003333533348 | B49: 0.0100003333533348 | C49: of:=ROUND([.A49];15)=ROUND([.B49];15) -> true | D49: of:=FORMULA([.A49]) -> =ATANH(F49) | F49: 0.01
A50: of:=ATANH([.F50]) -> 0.0160013655430869 | B50: 0.0160013655430869 | C50: of:=ROUND([.A50];15)=ROUND([.B50];15) -> true | D50: of:=FORMULA([.A50]) -> =ATANH(F50) | F50: of:=0.016 -> 0.016
A51: of:=ATANH([.F51]) -> 0.0500417292784913 | B51: 0.0500417292784913 | C51: of:=ROUND([.A51];15)=ROUND([.B51];15) -> true | D51: of:=FORMULA([.A51]) -> =ATANH(F51) | F51: 0.05
A52: of:=ATANH([.F52]) -> 0.0902441878561468 | B52: 0.0902441878561468 | C52: of:=ROUND([.A52];15)=ROUND([.B52];15) -> true | D52: of:=FORMULA([.A52]) -> =ATANH(F52) | F52: 0.09
A53: of:=ATANH([.F53]) -> 0.000000000987 | B53: 0.000000000987 | C53: of:=ROUND([.A53];15)=ROUND([.B53];15) -> true | D53: of:=FORMULA([.A53]) -> =ATANH(F53) | F53: 0.000000000987
A54: of:=ATANH([.F54]) -> 9.87E-015 | B54: 9.87E-015 | C54: of:=ROUND([.A54];15)=ROUND([.B54];15) -> true | D54: of:=FORMULA([.A54]) -> =ATANH(F54) | F54: 9.87E-015
A55: of:=ATANH([.F55]) -> 9.87E-016 | B55: 9.87E-016 | C55: of:=ROUND([.A55];15)=ROUND([.B55];15) -> true | D55: of:=FORMULA([.A55]) -> =ATANH(F55) | F55: 9.87E-016
A56: of:=ATANH([.F56]) -> 9.87E-017 | B56: 9.87E-017 | C56: of:=ROUND([.A56];15)=ROUND([.B56];15) -> true | D56: of:=FORMULA([.A56]) -> =ATANH(F56) | F56: 9.87E-017
A57: of:=ATANH([.F57]) -> 9.87E-018 | B57: 9.87E-018 | C57: of:=ROUND([.A57];15)=ROUND([.B57];15) -> true | D57: of:=FORMULA([.A57]) -> =ATANH(F57) | F57: 9.87E-018
A58: of:=ATANH([.F58]) -> 9.87E-050 | B58: 9.87E-050 | C58: of:=ROUND([.A58];15)=ROUND([.B58];15) -> true | D58: of:=FORMULA([.A58]) -> =ATANH(F58) | F58: 9.87E-050
A59: of:=ATANH([.F59]) -> 9.87E-100 | B59: 9.87E-100 | C59: of:=ROUND([.A59];15)=ROUND([.B59];15) -> true | D59: of:=FORMULA([.A59]) -> =ATANH(F59) | F59: 9.87E-100
A60: of:=ATANH([.F60]) -> 9.87E-300 | B60: 9.87E-300 | C60: of:=ROUND([.A60];15)=ROUND([.B60];15) -> true | D60: of:=FORMULA([.A60]) -> =ATANH(F60) | F60: 9.87E-300
A61: of:=ATANH([.F61]) -> 0 | B61: of:=[.B33] -> 0 | C61: of:=ROUND([.A61];15)=ROUND([.B61];15) -> true | D61: of:=FORMULA([.A61]) -> =ATANH(F61) | F61: of:=0 -> 0
A62: of:=ATANH([.F62]) -> -2E-015 | B62: of:=(-1)*[.B34] -> -2E-015 | C62: of:=ROUND([.A62];15)=ROUND([.B62];15) -> true | D62: of:=FORMULA([.A62]) -> =ATANH(F62) | F62: of:=(-1)*[.F34] -> -2E-015
A63: of:=ATANH([.F63]) -> -0.00000000000005 | B63: of:=(-1)*[.B35] -> -0.00000000000005 | C63: of:=ROUND([.A63];15)=ROUND([.B63];15) -> true | D63: of:=FORMULA([.A63]) -> =ATANH(F63) | F63: of:=(-1)*[.F35] -> -0.00000000000005
A64: of:=ATANH([.F64]) -> -0.0000000000009 | B64: of:=(-1)*[.B36] -> -0.0000000000009 | C64: of:=ROUND([.A64];15)=ROUND([.B64];15) -> true | D64: of:=FORMULA([.A64]) -> =ATANH(F64) | F64: of:=(-1)*[.F36] -> -0.0000000000009
A65: of:=ATANH([.F65]) -> -0.000000000002 | B65: of:=(-1)*[.B37] -> -0.000000000002 | C65: of:=ROUND([.A65];15)=ROUND([.B65];15) -> true | D65: of:=FORMULA([.A65]) -> =ATANH(F65) | F65: of:=(-1)*[.F37] -> -0.000000000002
A66: of:=ATANH([.F66]) -> -0.00000000005 | B66: of:=(-1)*[.B38] -> -0.00000000005 | C66: of:=ROUND([.A66];15)=ROUND([.B66];15) -> true | D66: of:=FORMULA([.A66]) -> =ATANH(F66) | F66: of:=(-1)*[.F38] -> -0.00000000005
A67: of:=ATANH([.F67]) -> -0.0000000009 | B67: of:=(-1)*[.B39] -> -0.0000000009 | C67: of:=ROUND([.A67];15)=ROUND([.B67];15) -> true | D67: of:=FORMULA([.A67]) -> =ATANH(F67) | F67: of:=(-1)*[.F39] -> -0.0000000009
A68: of:=ATANH([.F68]) -> -0.000000002 | B68: of:=(-1)*[.B40] -> -0.000000002 | C68: of:=ROUND([.A68];15)=ROUND([.B68];15) -> true | D68: of:=FORMULA([.A68]) -> =ATANH(F68) | F68: of:=(-1)*[.F40] -> -0.000000002
A69: of:=ATANH([.F69]) -> -0.00000005 | B69: of:=(-1)*[.B41] -> -0.00000005 | C69: of:=ROUND([.A69];15)=ROUND([.B69];15) -> true | D69: of:=FORMULA([.A69]) -> =ATANH(F69) | F69: of:=(-1)*[.F41] -> -0.00000005
A70: of:=ATANH([.F70]) -> -0.000000900000000000243 | B70: of:=(-1)*[.B42] -> -0.000000900000000000243 | C70: of:=ROUND([.A70];15)=ROUND([.B70];15) -> true | D70: of:=FORMULA([.A70]) -> =ATANH(F70) | F70: of:=(-1)*[.F42] -> -0.0000009
A71: of:=ATANH([.F71]) -> -0.00000200000000000267 | B71: of:=(-1)*[.B43] -> -0.00000200000000000267 | C71: of:=ROUND([.A71];15)=ROUND([.B71];15) -> true | D71: of:=FORMULA([.A71]) -> =ATANH(F71) | F71: of:=(-1)*[.F43] -> -0.000002
A72: of:=ATANH([.F72]) -> -0.0000500000000416667 | B72: of:=(-1)*[.B44] -> -0.0000500000000416667 | C72: of:=ROUND([.A72];15)=ROUND([.B72];15) -> true | D72: of:=FORMULA([.A72]) -> =ATANH(F72) | F72: of:=(-1)*[.F44] -> -0.00005
A73: of:=ATANH([.F73]) -> -0.000900000243000118 | B73: of:=(-1)*[.B45] -> -0.000900000243000118 | C73: of:=ROUND([.A73];15)=ROUND([.B73];15) -> true | D73: of:=FORMULA([.A73]) -> =ATANH(F73) | F73: of:=(-1)*[.F45] -> -0.0009
A74: of:=ATANH([.F74]) -> -0.00200000266667307 | B74: of:=(-1)*[.B46] -> -0.00200000266667307 | C74: of:=ROUND([.A74];15)=ROUND([.B74];15) -> true | D74: of:=FORMULA([.A74]) -> =ATANH(F74) | F74: of:=(-1)*[.F46] -> -0.002
A75: of:=ATANH([.F75]) -> -0.0030000090000486 | B75: of:=(-1)*[.B47] -> -0.0030000090000486 | C75: of:=ROUND([.A75];15)=ROUND([.B75];15) -> true | D75: of:=FORMULA([.A75]) -> =ATANH(F75) | F75: of:=(-1)*[.F47] -> -0.003
A76: of:=ATANH([.F76]) -> -0.00700011433669485 | B76: of:=(-1)*[.B48] -> -0.00700011433669485 | C76: of:=ROUND([.A76];15)=ROUND([.B76];15) -> true | D76: of:=FORMULA([.A76]) -> =ATANH(F76) | F76: of:=(-1)*[.F48] -> -0.007
A77: of:=ATANH([.F77]) -> -0.0100003333533348 | B77: of:=(-1)*[.B49] -> -0.0100003333533348 | C77: of:=ROUND([.A77];15)=ROUND([.B77];15) -> true | D77: of:=FORMULA([.A77]) -> =ATANH(F77) | F77: of:=(-1)*[.F49] -> -0.01
A78: of:=ATANH([.F78]) -> -0.0160013655430869 | B78: of:=(-1)*[.B50] -> -0.0160013655430869 | C78: of:=ROUND([.A78];15)=ROUND([.B78];15) -> true | D78: of:=FORMULA([.A78]) -> =ATANH(F78) | F78: of:=(-1)*[.F50] -> -0.016
A79: of:=ATANH([.F79]) -> -0.0500417292784913 | B79: of:=(-1)*[.B51] -> -0.0500417292784913 | C79: of:=ROUND([.A79];15)=ROUND([.B79];15) -> true | D79: of:=FORMULA([.A79]) -> =ATANH(F79) | F79: of:=(-1)*[.F51] -> -0.05
A80: of:=ATANH([.F80]) -> -0.0902441878561468 | B80: of:=(-1)*[.B52] -> -0.0902441878561468 | C80: of:=ROUND([.A80];15)=ROUND([.B80];15) -> true | D80: of:=FORMULA([.A80]) -> =ATANH(F80) | F80: of:=(-1)*[.F52] -> -0.09
A81: of:=ATANH([.F81]) -> -0.000000000987 | B81: of:=(-1)*[.B53] -> -0.000000000987 | C81: of:=ROUND([.A81];15)=ROUND([.B81];15) -> true | D81: of:=FORMULA([.A81]) -> =ATANH(F81) | F81: of:=(-1)*[.F53] -> -0.000000000987
A82: of:=ATANH([.F82]) -> -9.87E-015 | B82: of:=(-1)*[.B54] -> -9.87E-015 | C82: of:=ROUND([.A82];15)=ROUND([.B82];15) -> true | D82: of:=FORMULA([.A82]) -> =ATANH(F82) | F82: of:=(-1)*[.F54] -> -9.87E-015
A83: of:=ATANH([.F83]) -> -9.87E-016 | B83: of:=(-1)*[.B55] -> -9.87E-016 | C83: of:=ROUND([.A83];15)=ROUND([.B83];15) -> true | D83: of:=FORMULA([.A83]) -> =ATANH(F83) | F83: of:=(-1)*[.F55] -> -9.87E-016
A84: of:=ATANH([.F84]) -> -9.87E-017 | B84: of:=(-1)*[.B56] -> -9.87E-017 | C84: of:=ROUND([.A84];15)=ROUND([.B84];15) -> true | D84: of:=FORMULA([.A84]) -> =ATANH(F84) | F84: of:=(-1)*[.F56] -> -9.87E-017
A85: of:=ATANH([.F85]) -> -9.87E-018 | B85: of:=(-1)*[.B57] -> -9.87E-018 | C85: of:=ROUND([.A85];15)=ROUND([.B85];15) -> true | D85: of:=FORMULA([.A85]) -> =ATANH(F85) | F85: of:=(-1)*[.F57] -> -9.87E-018
A86: of:=ATANH([.F86]) -> -9.87E-050 | B86: of:=(-1)*[.B58] -> -9.87E-050 | C86: of:=ROUND([.A86];15)=ROUND([.B86];15) -> true | D86: of:=FORMULA([.A86]) -> =ATANH(F86) | F86: of:=(-1)*[.F58] -> -9.87E-050
A87: of:=ATANH([.F87]) -> -9.87E-100 | B87: of:=(-1)*[.B59] -> -9.87E-100 | C87: of:=ROUND([.A87];15)=ROUND([.B87];15) -> true | D87: of:=FORMULA([.A87]) -> =ATANH(F87) | F87: of:=(-1)*[.F59] -> -9.87E-100
A88: of:=ATANH([.F88]) -> -9.87E-300 | B88: of:=(-1)*[.B60] -> -9.87E-300 | C88: of:=ROUND([.A88];15)=ROUND([.B88];15) -> true | D88: of:=FORMULA([.A88]) -> =ATANH(F88) | F88: of:=(-1)*[.F60] -> -9.87E-300

Sheet: 'file:///home/zdenek/Dokumenty/LO/sc-unit-test/Project%20Calc%20functions%20tests/fods/atanh.fods/atan.fods/asinh.fods/asin.fods/acos.fods/abs.fods/abs.fods/xor.fods/xor.fods/not.fods/ifna.fods/ifna.fods/iferror.fods/iferror.fods/if.fods/and.fods/and.fods/and.fods/and.fods/type.fods/isna.fods/isna.fods/islogical.fods/isformula.fods/iserr.fods/isblank.fods/info.fods/formula.fods/formula.fods/current.fods/cell.fods/cell.fods/minute.fods/minute.fods/year.fods/function_based_test_Example.fods/function_based_test_Example_reference.fods'#Sheet2
H3: 4

Sheet: 'file:///home/zdenek/Dokumenty/LO/sc-unit-test/Project%20Calc%20functions%20tests/fods/atanh.fods/atan.fods/asinh.fods/asin.fods/acos.fods/abs.fods/abs.fods/xor.fods/xor.fods/not.fods/ifna.fods/ifna.fods/iferror.fods/iferror.fods/if.fods/and.fods/and.fods/and.fods/and.fods/type.fods/isna.fods/isna.fods/islogical.fods/isformula.fods/sc-unit-test/information-functions.ods'#Information
O7: O5