Sheet: Sheet1
A1: AVERAGEIF Function
A3: Result | B3: of:=AND([.B8:.B95]) -> true
A7: Sheet | B7: Result | C7: Description
A8: 1 | B8: of:=AND([Sheet2.C2:.C349]) -> true | C8: Simple AVERAGEIF formulas with local references and values

Sheet: Sheet2
A1: Function | B1: Expected | C1: Correct | D1: FunctionString | E1: Comment | J1: Product Name | K1: Sales | L1: Revenue | M1: book | O1: Property Value | P1: Commission
A2: of:=AVERAGEIF([.K2:.K6];"<35") -> 19 | B2: 19 | C2: of:=ROUND([.A2];12)=ROUND([.B2];12) -> true | D2: of:=FORMULA([.A2]) -> =AVERAGEIF(K2:K6,"<35") | J2: pencil | K2: 20 | L2: 65 | M2: 35 | O2: 100000 | P2: 7000
A3: of:=AVERAGEIF([.K2:.K6];"<"&MAX([.K2:.K6])) -> 19 | B3: 19 | C3: of:=ROUND([.A3];12)=ROUND([.B3];12) -> true | D3: of:=FORMULA([.A3]) -> =AVERAGEIF(K2:K6,"<"&MAX(K2:K6)) | J3: pen | K3: 35 | L3: 85 | O3: 200000 | P3: 14000
A4: of:=AVERAGEIF([.K2:.K6];">"&SMALL([.K2:.K6];1)) -> 25 | B4: 25 | C4: of:=ROUND([.A4];12)=ROUND([.B4];12) -> true | D4: of:=FORMULA([.A4]) -> =AVERAGEIF(K2:K6,">"&SMALL(K2:K6,1)) | J4: notebook | K4: 20 | L4: 190 | O4: 300000 | P4: 21000
A5: of:=AVERAGEIF([.K2:.K6];"<35";[.L2:.L6]) -> 145 | B5: 145 | C5: of:=ROUND([.A5];12)=ROUND([.B5];12) -> true | D5: of:=FORMULA([.A5]) -> =AVERAGEIF(K2:K6,"<35",L2:L6) | J5: book | K5: 17 | L5: 180 | O5: 400000 | P5: 28000
A6: of:=AVERAGEIF([.K2:.K6];">"&MIN([.K2:.K6]);[.L2:.L6]) -> 113.333333333333 | B6: 113.333333333333 | C6: of:=ROUND([.A6];12)=ROUND([.B6];12) -> true | D6: of:=FORMULA([.A6]) -> =AVERAGEIF(K2:K6,">"&MIN(K2:K6),L2:L6) | J6: pencil-case | K6: not | L6: not
A7: of:=AVERAGEIF([.K2:.K6];"<"&LARGE([.K2:.K6];2);[.L2:.L6]) -> 180 | B7: 180 | C7: of:=ROUND([.A7];12)=ROUND([.B7];12) -> true | D7: of:=FORMULA([.A7]) -> =AVERAGEIF(K2:K6,"<"&LARGE(K2:K6,2),L2:L6)
A8: of:=AVERAGEIF([.J2:.J6];"pen";[.K2:.K6]) -> 35 | B8: 35 | C8: of:=ROUND([.A8];12)=ROUND([.B8];12) -> true | D8: of:=FORMULA([.A8]) -> =AVERAGEIF(J2:J6,"pen",K2:K6)
A9: of:=AVERAGEIF([.J2:.J6];"pen.*";[.K2:.K6]) -> 27.5 | B9: 27.5 | C9: of:=ROUND([.A9];12)=ROUND([.B9];12) -> true | D9: of:=FORMULA([.A9]) -> =AVERAGEIF(J2:J6,"pen.*",K2:K6)
A10: of:=AVERAGEIF([.J2:.J6];".*book.*";[.K2:.K6]) -> 18.5 | B10: 18.5 | C10: of:=ROUND([.A10];12)=ROUND([.B10];12) -> true | D10: of:=FORMULA([.A10]) -> =AVERAGEIF(J2:J6,".*book.*",K2:K6)
A11: of:=AVERAGEIF([.J2:.J6];".*"&[.M1]&".*";[.K2:.K6]) -> 18.5 | B11: 18.5 | C11: of:=ROUND([.A11];12)=ROUND([.B11];12) -> true | D11: of:=FORMULA([.A11]) -> =AVERAGEIF(J2:J6,".*"&M1&".*",K2:K6)
A12: of:=AVERAGEIF([.K2:.K6];"<"&[.M2];[.L2:.L6]) -> 145 | B12: 145 | C12: of:=ROUND([.A12];12)=ROUND([.B12];12) -> true | D12: of:=FORMULA([.A12]) -> =AVERAGEIF(K2:K6,"<"&M2,L2:L6)
A13: of:=AVERAGEIF([.P2:.P5];"<23000") -> 14000 | B13: 14000 | C13: of:=ROUND([.A13];12)=ROUND([.B13];12) -> true | D13: of:=FORMULA([.A13]) -> =AVERAGEIF(P2:P5,"<23000") | K13: A | L13: B
A14: of:=AVERAGEIF([.O2:.O5];"<250000") -> 150000 | B14: 150000 | C14: of:=ROUND([.A14];12)=ROUND([.B14];12) -> true | D14: of:=FORMULA([.A14]) -> =AVERAGEIF(O2:O5,"<250000") | J14: 1 with leading ' (cell standard) | K14: 1 | L14: 2
A15: of:=AVERAGEIF([.O2:.O5];"<95000") ->  | B15: #DIV/0! | C15: of:=ISERROR([.A15]) -> true | D15: of:=FORMULA([.A15]) -> =AVERAGEIF(O2:O5,"<95000") | J15: numeric 1 (cell standard) | K15: 1 | L15: 1
A16: of:=AVERAGEIF([.O2:.O5];">250000";[.P2:.P5]) -> 24500 | B16: 24500 | C16: of:=ROUND([.A16];12)=ROUND([.B16];12) -> true | D16: of:=FORMULA([.A16]) -> =AVERAGEIF(O2:O5,">250000",P2:P5) | J16: 1 in cell formatted as text | K16: 1 | L16: 3
J17: cell as text with numeric 1 | K17: 1 | L17: 4
A24: of:=SUMIF([.K14:.K17];1;[.L14:.L17]) -> 5 | D24: of:=FORMULA([.A24]) -> =SUMIF(K14:K17,1,L14:L17) | E24: Tdf#96923
A25: of:=SUMIF([.K14:.K17];"1";[.L14:.L17]) -> 10 | D25: of:=FORMULA([.A25]) -> =SUMIF(K14:K17,"1",L14:L17)

Sheet: 'file:///home/zdenek/Dokumenty/LO/sc-unit-test/Project%20Calc%20functions%20tests/fods/function_based_test_Example.fods/function_based_test_Example_reference.fods'#Sheet2
H3: 4