Sheet: Sheet1
A1: BETADIST Function
A3: Result | B3: of:=AND([.B8:.B95]) -> true
A7: Sheet | B7: Result | C7: Description
A8: 1 | B8: of:=AND([Sheet2.C2:.C349]) -> true | C8: Simple BETADIST formulas with local references and values

Sheet: Sheet2
A1: Function | B1: Expected | C1: Correct | D1: FunctionString | E1: Comment | I1: Data | J1: Description | AA1: year | AB1: month | AC1: day | AD1: value
A2: of:=BETADIST(0.75;3;4) -> 0.96240234375 | B2: 0.96240234375 | C2: of:=ROUND([.A2];12)=ROUND([.B2];12) -> true | D2: of:=FORMULA([.A2]) -> =BETADIST(0.75,3,4) | I2: 2 | J2: Value at which to evaluate the function | AA2: 2012 | AB2: 12 | AC2: 15 | AD2: 6
A3: of:=BETADIST(1;5;3;-2;4;FALSE()) -> 0.2734375 | B3: 0.2734375 | C3: of:=ROUND([.A3];12)=ROUND([.B3];12) -> true | D3: of:=FORMULA([.A3]) -> =BETADIST(1,5,3,-2,4,FALSE()) | I3: 8 | J3: Parameter of the distribution | AA3: 2012 | AB3: 4 | AC3: 1 | AD3: 10.4
A4: of:=BETADIST(0.2;0.7;4;0;1;FALSE()) -> 1.64407702930289 | B4: 1.64407702930289 | C4: of:=ROUND([.A4];12)=ROUND([.B4];12) -> true | D4: of:=FORMULA([.A4]) -> =BETADIST(0.2,0.7,4,0,1,FALSE()) | I4: 10 | J4: Parameter of the distribution | AA4: 2013 | AB4: 8 | AC4: 15 | AD4: 7
A5: of:=BETADIST(1;1;0.5;0;1;FALSE()) ->  | B5: Err:502 | C5: of:=ISERROR([.A5]) -> true | D5: of:=FORMULA([.A5]) -> =BETADIST(1,1,0.5,0,1,FALSE()) | I5: 1 | J5: Lower bound | AA5: 2011 | AB5: 11 | AC5: 1 | AD5: 12
A6: of:=BETADIST(1.1;1;0.5;0;1;FALSE()) -> 0 | B6: 0 | C6: of:=ROUND([.A6];12)=ROUND([.B6];12) -> true | D6: of:=FORMULA([.A6]) -> =BETADIST(1.1,1,0.5,0,1,FALSE()) | I6: 3 | J6: Upper bound | AA6: 2011 | AB6: 2 | AC6: 14 | AD6: 8
A7: of:=BETADIST(1;5;3;-2;4;TRUE()) -> 0.2265625 | B7: 0.2265625 | C7: of:=ROUND([.A7];12)=ROUND([.B7];12) -> true | D7: of:=FORMULA([.A7]) -> =BETADIST(1,5,3,-2,4,TRUE()) | AA7: 2010 | AB7: 6 | AC7: 1 | AD7: 15
A8: of:=BETADIST(0.2;0.7;4;0;1;TRUE()) -> 0.71794309318323 | B8: 0.71794309318323 | C8: of:=ROUND([.A8];12)=ROUND([.B8];12) -> true | D8: of:=FORMULA([.A8]) -> =BETADIST(0.2,0.7,4,0,1,TRUE())
A9: of:=BETADIST(0.2;0.7;4) -> 0.71794309318323 | B9: 0.71794309318323 | C9: of:=ROUND([.A9];12)=ROUND([.B9];12) -> true | D9: of:=FORMULA([.A9]) -> =BETADIST(0.2,0.7,4)
A10: of:=BETADIST(1.1;1;0.5;0;1;TRUE()) -> 1 | B10: 1 | C10: of:=ROUND([.A10];12)=ROUND([.B10];12) -> true | D10: of:=FORMULA([.A10]) -> =BETADIST(1.1,1,0.5,0,1,TRUE())
A11: of:=BETADIST(1.1;1;0.5;0;1) -> 1 | B11: 1 | C11: of:=ROUND([.A11];12)=ROUND([.B11];12) -> true | D11: of:=FORMULA([.A11]) -> =BETADIST(1.1,1,0.5,0,1) | E11: ODF: If Cumulative is TRUE(), BETADIST returns 0 if x < a, 1 if x > b
A12: of:=BETADIST([.I2];[.I3];[.I4];[.I5];[.I6]) -> 0.685470581054688 | B12: 0.685470581054688 | C12: of:=ROUND([.A12];12)=ROUND([.B12];12) -> true | D12: of:=FORMULA([.A12]) -> =BETADIST(I2,I3,I4,I5,I6)
A13: of:=BETADIST(3; 7.5; 9; 1; 4) -> 0.960370937542132 | B13: 0.960370937542132 | C13: of:=ROUND([.A13];12)=ROUND([.B13];12) -> true | D13: of:=FORMULA([.A13]) -> =BETADIST(3, 7.5, 9, 1, 4) | J13: 0.2
A14: of:=BETADIST(7.5; 8; 9; 5; 10) -> 0.598190307617188 | B14: 0.598190307617188 | C14: of:=ROUND([.A14];12)=ROUND([.B14];12) -> true | D14: of:=FORMULA([.A14]) -> =BETADIST(7.5, 8, 9, 5, 10) | J14: 0.3
A15: of:=BETADIST([.I16];[.$J$13];[.$J$14];0;1;FALSE()) -> 0.876624590753515 | B15: 0.876624590753515 | C15: of:=ROUND([.A15];12)=ROUND([.B15];12) -> true | D15: of:=FORMULA([.A15]) -> =BETADIST(I16,$J$13,$J$14,0,1,FALSE())
A16: of:=BETADIST([.I17];[.$J$13];[.$J$14];0;1;FALSE()) -> 0.546759601543739 | B16: 0.546759601543739 | C16: of:=ROUND([.A16];12)=ROUND([.B16];12) -> true | D16: of:=FORMULA([.A16]) -> =BETADIST(I17,$J$13,$J$14,0,1,FALSE()) | I16: 0.1
A17: of:=BETADIST([.I18];[.$J$13];[.$J$14];0;1;FALSE()) -> 0.434028026357426 | B17: 0.434028026357426 | C17: of:=ROUND([.A17];12)=ROUND([.B17];12) -> true | D17: of:=FORMULA([.A17]) -> =BETADIST(I18,$J$13,$J$14,0,1,FALSE()) | I17: 0.2
A18: of:=BETADIST([.I19];[.$J$13];[.$J$14];0;1;FALSE()) -> 0.384086937534851 | B18: 0.384086937534851 | C18: of:=ROUND([.A18];12)=ROUND([.B18];12) -> true | D18: of:=FORMULA([.A18]) -> =BETADIST(I19,$J$13,$J$14,0,1,FALSE()) | I18: 0.3
A19: of:=BETADIST([.I20];[.$J$13];[.$J$14];0;1;FALSE()) -> 0.365029866220961 | B19: 0.365029866220961 | C19: of:=ROUND([.A19];12)=ROUND([.B19];12) -> true | D19: of:=FORMULA([.A19]) -> =BETADIST(I20,$J$13,$J$14,0,1,FALSE()) | I19: 0.4
A20: of:=BETADIST([.I21];[.$J$13];[.$J$14];0;1;FALSE()) -> 0.368825051332716 | B20: 0.368825051332716 | C20: of:=ROUND([.A20];12)=ROUND([.B20];12) -> true | D20: of:=FORMULA([.A20]) -> =BETADIST(I21,$J$13,$J$14,0,1,FALSE()) | I20: 0.5
A21: of:=BETADIST([.I22];[.$J$13];[.$J$14];0;1;FALSE()) -> 0.398767812057121 | B21: 0.398767812057121 | C21: of:=ROUND([.A21];12)=ROUND([.B21];12) -> true | D21: of:=FORMULA([.A21]) -> =BETADIST(I22,$J$13,$J$14,0,1,FALSE()) | I21: 0.6
A22: of:=BETADIST([.I23];[.$J$13];[.$J$14];0;1;FALSE()) -> 0.475981879111466 | B22: 0.475981879111466 | C22: of:=ROUND([.A22];12)=ROUND([.B22];12) -> true | D22: of:=FORMULA([.A22]) -> =BETADIST(I23,$J$13,$J$14,0,1,FALSE()) | I22: 0.7
A23: of:=BETADIST([.I24];[.$J$13];[.$J$14];0;1;FALSE()) -> 0.7037029930589 | B23: 0.7037029930589 | C23: of:=ROUND([.A23];12)=ROUND([.B23];12) -> true | D23: of:=FORMULA([.A23]) -> =BETADIST(I24,$J$13,$J$14,0,1,FALSE()) | I23: 0.8
A24: of:=BETADIST([.I25];[.$J$13];[.$J$14];0;1;FALSE()) -> 5.35903263757101E+238 | B24: 5.35903263757101E+238 | C24: of:=ROUND([.A24];12)=ROUND([.B24];12) -> true | D24: of:=FORMULA([.A24]) -> =BETADIST(I25,$J$13,$J$14,0,1,FALSE()) | I24: 0.9
A25: of:=BETADIST([.I26];[.$J$13];[.$J$14];0;1;FALSE()) -> 7.41240958948945E+158 | B25: 7.41240958948945E+158 | C25: of:=ROUND([.A25];12)=ROUND([.B25];12) -> true | D25: of:=FORMULA([.A25]) -> =BETADIST(I26,$J$13,$J$14,0,1,FALSE()) | I25: 3E-300
A26: of:=BETADIST([.I27];[.$J$13];[.$J$14];0;1;FALSE()) -> 1.29057546870231E+079 | B26: 1.29057546870231E+079 | C26: of:=ROUND([.A26];12)=ROUND([.B26];12) -> true | D26: of:=FORMULA([.A26]) -> =BETADIST(I27,$J$13,$J$14,0,1,FALSE()) | I26: 2E-200
A27: of:=BETADIST([.I28];[.$J$13];[.$J$14];0;1;FALSE()) -> 3.56129050904556E+038 | B27: 3.56129050904556E+038 | C27: of:=ROUND([.A27];12)=ROUND([.B27];12) -> true | D27: of:=FORMULA([.A27]) -> =BETADIST(I28,$J$13,$J$14,0,1,FALSE()) | I27: 1E-100
A28: of:=BETADIST([.I29];[.$J$13];[.$J$14];0;1;FALSE()) -> 3077955.98886927 | B28: 3077955.98886927 | C28: of:=ROUND([.A28];12)=ROUND([.B28];12) -> true | D28: of:=FORMULA([.A28]) -> =BETADIST(I29,$J$13,$J$14,0,1,FALSE()) | I28: 5E-050
A29: of:=BETADIST([.I30];[.$J$13];[.$J$14];0;1;FALSE()) -> 272.098567215959 | B29: 272.098567215959 | C29: of:=ROUND([.A29];12)=ROUND([.B29];12) -> true | D29: of:=FORMULA([.A29]) -> =BETADIST(I30,$J$13,$J$14,0,1,FALSE()) | I29: 0.0000000006
A30: of:=BETADIST([.I31];[.$J$13];[.$J$14];0;1;FALSE()) -> 1.03195304539888 | B30: 1.03195304539888 | C30: of:=ROUND([.A30];12)=ROUND([.B30];12) -> true | D30: of:=FORMULA([.A30]) -> =BETADIST(I31,$J$13,$J$14,0,1,FALSE()) | I30: 0.00007
A31: of:=BETADIST([.I32];[.$J$13];[.$J$14];0;1;FALSE()) -> 0.7037029930589 | B31: 0.7037029930589 | C31: of:=ROUND([.A31];12)=ROUND([.B31];12) -> true | D31: of:=FORMULA([.A31]) -> =BETADIST(I32,$J$13,$J$14,0,1,FALSE()) | I31: 0.08
A32: of:=BETADIST([.I33];[.$J$13];[.$J$14];0;1;FALSE()) -> 16.2603921489461 | B32: 16.2603921489461 | C32: of:=ROUND([.A32];12)=ROUND([.B32];12) -> true | D32: of:=FORMULA([.A32]) -> =BETADIST(I33,$J$13,$J$14,0,1,FALSE()) | I32: 0.9
A33: of:=BETADIST([.I34];[.$J$13];[.$J$14];0;1;FALSE()) -> 408.119062300925 | B33: 408.119062300925 | C33: of:=ROUND([.A33];12)=ROUND([.B33];12) -> true | D33: of:=FORMULA([.A33]) -> =BETADIST(I34,$J$13,$J$14,0,1,FALSE()) | I33: 0.999
A34: of:=BETADIST([.I35];[.$J$13];[.$J$14];0;1;FALSE()) -> 10251.4061542503 | B34: 10251.4061542503 | C34: of:=ROUND([.A34];12)=ROUND([.B34];12) -> true | D34: of:=FORMULA([.A34]) -> =BETADIST(I35,$J$13,$J$14,0,1,FALSE()) | I34: 0.99999
A35: of:=BETADIST([.I36];[.$J$13];[.$J$14];0;1;FALSE()) -> 257503.665036393 | B35: 257503.665036393 | C35: of:=ROUND([.A35];12)=ROUND([.B35];12) -> true | D35: of:=FORMULA([.A35]) -> =BETADIST(I36,$J$13,$J$14,0,1,FALSE()) | I35: 0.9999999
A36: of:=BETADIST([.I37];[.$J$13];[.$J$14];0;1;FALSE()) -> 6468148.8473596 | B36: 6468148.8473596 | C36: of:=ROUND([.A36];12)=ROUND([.B36];12) -> true | D36: of:=FORMULA([.A36]) -> =BETADIST(I37,$J$13,$J$14,0,1,FALSE()) | I36: 0.999999999
A37: of:=BETADIST([.I38];[.$J$13];[.$J$14];0;1;FALSE()) -> 162564790.351024 | B37: 162564790.351024 | C37: of:=ROUND([.A37];12)=ROUND([.B37];12) -> true | D37: of:=FORMULA([.A37]) -> =BETADIST(I38,$J$13,$J$14,0,1,FALSE()) | I37: 0.99999999999
A38: of:=BETADIST([.I39];[.$J$13];[.$J$14];0;1;FALSE()) -> 4434383544.877 | B38: 4434383544.877 | C38: of:=ROUND([.A38];12)=ROUND([.B38];12) -> true | D38: of:=FORMULA([.A38]) -> =BETADIST(I39,$J$13,$J$14,0,1,FALSE()) | I38: 0.9999999999999
A39: of:=BETADIST([.I40];[.$J$13];[.$J$14];0;1;FALSE()) -> 19010618424.4271 | B39: 19010618424.4271 | C39: of:=ROUND([.A39];12)=ROUND([.B39];12) -> true | D39: of:=FORMULA([.A39]) -> =BETADIST(I40,$J$13,$J$14,0,1,FALSE()) | I39: 0.999999999999999
A40: of:=BETADIST([.I42];[.$J$40];[.$J$41];0;1;FALSE()) -> 0.0171825731639175 | B40: 0.0171825731639175 | C40: of:=ROUND([.A40];12)=ROUND([.B40];12) -> true | D40: of:=FORMULA([.A40]) -> =BETADIST(I42,$J$40,$J$41,0,1,FALSE()) | I40: of:=1-1E-016 -> 1 | J40: 0.2
A41: of:=BETADIST([.I43];[.$J$40];[.$J$41];0;1;FALSE()) -> 0.0000307461403537809 | B41: 0.0000307461403537809 | C41: of:=ROUND([.A41];12)=ROUND([.B41];12) -> true | D41: of:=FORMULA([.A41]) -> =BETADIST(I43,$J$40,$J$41,0,1,FALSE()) | J41: 50
A42: of:=BETADIST([.I44];[.$J$40];[.$J$41];0;1;FALSE()) -> 0.0000000320119548891565 | B42: 0.0000000320119548891565 | C42: of:=ROUND([.A42];12)=ROUND([.B42];12) -> true | D42: of:=FORMULA([.A42]) -> =BETADIST(I44,$J$40,$J$41,0,1,FALSE()) | I42: 0.1
A43: of:=BETADIST([.I45];[.$J$40];[.$J$41];0;1;FALSE()) -> 0.0000000000133342475961122 | B43: 0.0000000000133342475961122 | C43: of:=ROUND([.A43];12)=ROUND([.B43];12) -> true | D43: of:=FORMULA([.A43]) -> =BETADIST(I45,$J$40,$J$41,0,1,FALSE()) | I43: 0.2
A44: of:=BETADIST([.I46];[.$J$40];[.$J$41];0;1;FALSE()) -> 1.47081973442293E-015 | B44: 1.47081973442293E-015 | C44: of:=ROUND([.A44];12)=ROUND([.B44];12) -> true | D44: of:=FORMULA([.A44]) -> =BETADIST(I46,$J$40,$J$41,0,1,FALSE()) | I44: 0.3
A45: of:=BETADIST([.I47];[.$J$40];[.$J$41];0;1;FALSE()) -> 2.26789954593594E-020 | B45: 2.26789954593594E-020 | C45: of:=ROUND([.A45];12)=ROUND([.B45];12) -> true | D45: of:=FORMULA([.A45]) -> =BETADIST(I47,$J$40,$J$41,0,1,FALSE()) | I45: 0.4
A46: of:=BETADIST([.I48];[.$J$40];[.$J$41];0;1;FALSE()) -> 1.51379925981479E-026 | B46: 1.51379925981479E-026 | C46: of:=ROUND([.A46];12)=ROUND([.B46];12) -> true | D46: of:=FORMULA([.A46]) -> =BETADIST(I48,$J$40,$J$41,0,1,FALSE()) | I46: 0.5
A47: of:=BETADIST([.I49];[.$J$40];[.$J$41];0;1;FALSE()) -> 3.20039097644436E-035 | B47: 3.20039097644436E-035 | C47: of:=ROUND([.A47];12)=ROUND([.B47];12) -> true | D47: of:=FORMULA([.A47]) -> =BETADIST(I49,$J$40,$J$41,0,1,FALSE()) | I47: 0.6
A48: of:=BETADIST([.I50];[.$J$40];[.$J$41];0;1;FALSE()) -> 5.17381900456755E-050 | B48: 5.17381900456755E-050 | C48: of:=ROUND([.A48];12)=ROUND([.B48];12) -> true | D48: of:=FORMULA([.A48]) -> =BETADIST(I50,$J$40,$J$41,0,1,FALSE()) | I48: 0.7
A49: of:=BETADIST([.I51];[.$J$40];[.$J$41];0;1;FALSE()) -> 0 | B49: 0 | C49: of:=ROUND([.A49];12)=ROUND([.B49];12) -> true | D49: of:=FORMULA([.A49]) -> =BETADIST(I51,$J$40,$J$41,0,1,FALSE()) | I49: 0.8
A50: of:=BETADIST([.I52];[.$J$40];[.$J$41];0;1;FALSE()) -> 1.9747323258816E+239 | B50: 1.9747323258816E+239 | C50: of:=ROUND([.A50];12)=ROUND([.B50];12) -> true | D50: of:=FORMULA([.A50]) -> =BETADIST(I52,$J$40,$J$41,0,1,FALSE()) | I50: 0.9
A51: of:=BETADIST([.I53];[.$J$40];[.$J$41];0;1;FALSE()) -> 2.73137445113117E+159 | B51: 2.73137445113117E+159 | C51: of:=ROUND([.A51];12)=ROUND([.B51];12) -> true | D51: of:=FORMULA([.A51]) -> =BETADIST(I53,$J$40,$J$41,0,1,FALSE()) | I51: 1
A52: of:=BETADIST([.I54];[.$J$40];[.$J$41];0;1;FALSE()) -> 4.75559913400972E+079 | B52: 4.75559913400972E+079 | C52: of:=ROUND([.A52];12)=ROUND([.B52];12) -> true | D52: of:=FORMULA([.A52]) -> =BETADIST(I54,$J$40,$J$41,0,1,FALSE()) | I52: 3E-300
A53: of:=BETADIST([.I55];[.$J$40];[.$J$41];0;1;FALSE()) -> 1.31228823664249E+039 | B53: 1.31228823664249E+039 | C53: of:=ROUND([.A53];12)=ROUND([.B53];12) -> true | D53: of:=FORMULA([.A53]) -> =BETADIST(I55,$J$40,$J$41,0,1,FALSE()) | I53: 2E-200
A54: of:=BETADIST([.I56];[.$J$40];[.$J$41];0;1;FALSE()) -> 11341858.5380473 | B54: 11341858.5380473 | C54: of:=ROUND([.A54];12)=ROUND([.B54];12) -> true | D54: of:=FORMULA([.A54]) -> =BETADIST(I56,$J$40,$J$41,0,1,FALSE()) | I54: 1E-100
A55: of:=BETADIST([.I57];[.$J$40];[.$J$41];0;1;FALSE()) -> 999.164798578344 | B55: 999.164798578344 | C55: of:=ROUND([.A55];12)=ROUND([.B55];12) -> true | D55: of:=FORMULA([.A55]) -> =BETADIST(I57,$J$40,$J$41,0,1,FALSE()) | I55: 5E-050
A56: of:=BETADIST([.I58];[.$J$40];[.$J$41];0;1;FALSE()) -> 0.0603027044306949 | B56: 0.0603027044306949 | C56: of:=ROUND([.A56];12)=ROUND([.B56];12) -> true | D56: of:=FORMULA([.A56]) -> =BETADIST(I58,$J$40,$J$41,0,1,FALSE()) | I56: 0.0000000006
A57: of:=BETADIST([.I59];[.$J$40];[.$J$41];0;1;FALSE()) -> 5.17381900456755E-050 | B57: 5.17381900456755E-050 | C57: of:=ROUND([.A57];12)=ROUND([.B57];12) -> true | D57: of:=FORMULA([.A57]) -> =BETADIST(I59,$J$40,$J$41,0,1,FALSE()) | I57: 0.00007
A58: of:=BETADIST([.I60];[.$J$40];[.$J$41];0;1;FALSE()) -> 4.75940704054726E-148 | B58: 4.75940704054726E-148 | C58: of:=ROUND([.A58];12)=ROUND([.B58];12) -> true | D58: of:=FORMULA([.A58]) -> =BETADIST(I60,$J$40,$J$41,0,1,FALSE()) | I58: 0.08
A59: of:=BETADIST([.I61];[.$J$40];[.$J$41];0;1;FALSE()) -> 4.75563717808464E-246 | B59: 4.75563717808464E-246 | C59: of:=ROUND([.A59];12)=ROUND([.B59];12) -> true | D59: of:=FORMULA([.A59]) -> =BETADIST(I61,$J$40,$J$41,0,1,FALSE()) | I59: 0.9
A60: of:=BETADIST([.I62];[.$J$40];[.$J$41];0;1;FALSE()) -> 0 | B60: 0 | C60: of:=ROUND([.A60];12)=ROUND([.B60];12) -> true | D60: of:=FORMULA([.A60]) -> =BETADIST(I62,$J$40,$J$41,0,1,FALSE()) | I60: 0.999
A61: of:=BETADIST([.I63];[.$J$40];[.$J$41];0;1;FALSE()) -> 0 | B61: 0 | C61: of:=ROUND([.A61];12)=ROUND([.B61];12) -> true | D61: of:=FORMULA([.A61]) -> =BETADIST(I63,$J$40,$J$41,0,1,FALSE()) | I61: 0.99999
A62: of:=BETADIST([.I64];[.$J$40];[.$J$41];0;1;FALSE()) -> 0 | B62: 0 | C62: of:=ROUND([.A62];12)=ROUND([.B62];12) -> true | D62: of:=FORMULA([.A62]) -> =BETADIST(I64,$J$40,$J$41,0,1,FALSE()) | I62: 0.9999999
A63: of:=BETADIST([.I65];[.$J$40];[.$J$41];0;1;FALSE()) -> 0 | B63: 0 | C63: of:=ROUND([.A63];12)=ROUND([.B63];12) -> true | D63: of:=FORMULA([.A63]) -> =BETADIST(I65,$J$40,$J$41,0,1,FALSE()) | I63: 0.999999999
A64: of:=BETADIST([.I66];[.$J$40];[.$J$41];0;1;FALSE()) -> 0 | B64: 0 | C64: of:=ROUND([.A64];12)=ROUND([.B64];12) -> true | D64: of:=FORMULA([.A64]) -> =BETADIST(I66,$J$40,$J$41,0,1,FALSE()) | I64: 0.99999999999
A65: of:=BETADIST([.I67];[.$J$40];[.$J$41];0;1;FALSE()) -> 0 | B65: 0 | C65: of:=ROUND([.A65];12)=ROUND([.B65];12) -> true | D65: of:=FORMULA([.A65]) -> =BETADIST(I67,$J$40,$J$41,0,1,FALSE()) | I65: 0.9999999999999
A66: of:=BETADIST([.I68];[.$J$40];[.$J$41];0;1;FALSE()) -> 0 | B66: 0 | C66: of:=ROUND([.A66];12)=ROUND([.B66];12) -> true | D66: of:=FORMULA([.A66]) -> =BETADIST(I68,$J$40,$J$41,0,1,FALSE()) | I66: 0.999999999999999
A67: of:=BETADIST([.I70];[.$J$68];[.$J$69];0;1;FALSE()) -> 1.22691858111198E-059 | B67: 1.22691858111198E-059 | C67: of:=ROUND([.A67];12)=ROUND([.B67];12) -> true | D67: of:=FORMULA([.A67]) -> =BETADIST(I70,$J$68,$J$69,0,1,FALSE()) | I67: of:=1-1E-016 -> 1
A68: of:=BETADIST([.I71];[.$J$68];[.$J$69];0;1;FALSE()) -> 7.68054881246347E-042 | B68: 7.68054881246347E-042 | C68: of:=ROUND([.A68];12)=ROUND([.B68];12) -> true | D68: of:=FORMULA([.A68]) -> =BETADIST(I71,$J$68,$J$69,0,1,FALSE()) | I68: 1 | J68: 60
A69: of:=BETADIST([.I72];[.$J$68];[.$J$69];0;1;FALSE()) -> 2.06714480699469E-031 | B69: 2.06714480699469E-031 | C69: of:=ROUND([.A69];12)=ROUND([.B69];12) -> true | D69: of:=FORMULA([.A69]) -> =BETADIST(I72,$J$68,$J$69,0,1,FALSE()) | J69: 0.3
A70: of:=BETADIST([.I73];[.$J$68];[.$J$69];0;1;FALSE()) -> 5.4152575108696E-024 | B70: 5.4152575108696E-024 | C70: of:=ROUND([.A70];12)=ROUND([.B70];12) -> true | D70: of:=FORMULA([.A70]) -> =BETADIST(I73,$J$68,$J$69,0,1,FALSE()) | I70: 0.1
A71: of:=BETADIST([.I74];[.$J$68];[.$J$69];0;1;FALSE()) -> 3.21171317371748E-018 | B71: 3.21171317371748E-018 | C71: of:=ROUND([.A71];12)=ROUND([.B71];12) -> true | D71: of:=FORMULA([.A71]) -> =BETADIST(I74,$J$68,$J$69,0,1,FALSE()) | I71: 0.2
A72: of:=BETADIST([.I75];[.$J$68];[.$J$69];0;1;FALSE()) -> 0.000000000000176306075778211 | B72: 0.000000000000176306075778211 | C72: of:=ROUND([.A72];12)=ROUND([.B72];12) -> true | D72: of:=FORMULA([.A72]) -> =BETADIST(I75,$J$68,$J$69,0,1,FALSE()) | I72: 0.3
A73: of:=BETADIST([.I76];[.$J$68];[.$J$69];0;1;FALSE()) -> 0.00000000192125487656783 | B73: 0.00000000192125487656783 | C73: of:=ROUND([.A73];12)=ROUND([.B73];12) -> true | D73: of:=FORMULA([.A73]) -> =BETADIST(I76,$J$68,$J$69,0,1,FALSE()) | I73: 0.4
A74: of:=BETADIST([.I77];[.$J$68];[.$J$69];0;1;FALSE()) -> 0.00000673556041418975 | B74: 0.00000673556041418975 | C74: of:=ROUND([.A74];12)=ROUND([.B74];12) -> true | D74: of:=FORMULA([.A74]) -> =BETADIST(I77,$J$68,$J$69,0,1,FALSE()) | I74: 0.5
A75: of:=BETADIST([.I78];[.$J$68];[.$J$69];0;1;FALSE()) -> 0.0114049545059397 | B75: 0.0114049545059397 | C75: of:=ROUND([.A75];12)=ROUND([.B75];12) -> true | D75: of:=FORMULA([.A75]) -> =BETADIST(I78,$J$68,$J$69,0,1,FALSE()) | I75: 0.6
A76: of:=BETADIST([.I79];[.$J$68];[.$J$69];0;1;FALSE()) -> 8.27163081240875E-246 | B76: 8.27163081240875E-246 | C76: of:=ROUND([.A76];12)=ROUND([.B76];12) -> true | D76: of:=FORMULA([.A76]) -> =BETADIST(I79,$J$68,$J$69,0,1,FALSE()) | I76: 0.7
A77: of:=BETADIST([.I80];[.$J$68];[.$J$69];0;1;FALSE()) -> 2.31442575596251E-065 | B77: 2.31442575596251E-065 | C77: of:=ROUND([.A77];12)=ROUND([.B77];12) -> true | D77: of:=FORMULA([.A77]) -> =BETADIST(I80,$J$68,$J$69,0,1,FALSE()) | I77: 0.8
A78: of:=BETADIST([.I81];[.$J$68];[.$J$69];0;1;FALSE()) -> 0.0114049545059397 | B78: 0.0114049545059397 | C78: of:=ROUND([.A78];12)=ROUND([.B78];12) -> true | D78: of:=FORMULA([.A78]) -> =BETADIST(I81,$J$68,$J$69,0,1,FALSE()) | I78: 0.9
A79: of:=BETADIST([.I82];[.$J$68];[.$J$69];0;1;FALSE()) -> 135.253747069861 | B79: 135.253747069861 | C79: of:=ROUND([.A79];12)=ROUND([.B79];12) -> true | D79: of:=FORMULA([.A79]) -> =BETADIST(I82,$J$68,$J$69,0,1,FALSE()) | I79: 0.00007
A80: of:=BETADIST([.I83];[.$J$68];[.$J$69];0;1;FALSE()) -> 3601.88021136246 | B80: 3601.88021136246 | C80: of:=ROUND([.A80];12)=ROUND([.B80];12) -> true | D80: of:=FORMULA([.A80]) -> =BETADIST(I83,$J$68,$J$69,0,1,FALSE()) | I80: 0.08
A81: of:=BETADIST([.I84];[.$J$68];[.$J$69];0;1;FALSE()) -> 90528.0025044751 | B81: 90528.0025044751 | C81: of:=ROUND([.A81];12)=ROUND([.B81];12) -> true | D81: of:=FORMULA([.A81]) -> =BETADIST(I84,$J$68,$J$69,0,1,FALSE()) | I81: 0.9
A82: of:=BETADIST([.I85];[.$J$68];[.$J$69];0;1;FALSE()) -> 2273973.93981802 | B82: 2273973.93981802 | C82: of:=ROUND([.A82];12)=ROUND([.B82];12) -> true | D82: of:=FORMULA([.A82]) -> =BETADIST(I85,$J$68,$J$69,0,1,FALSE()) | I82: 0.999
A83: of:=BETADIST([.I86];[.$J$68];[.$J$69];0;1;FALSE()) -> 57119197.8430585 | B83: 57119197.8430585 | C83: of:=ROUND([.A83];12)=ROUND([.B83];12) -> true | D83: of:=FORMULA([.A83]) -> =BETADIST(I86,$J$68,$J$69,0,1,FALSE()) | I83: 0.99999
A84: of:=BETADIST([.I87];[.$J$68];[.$J$69];0;1;FALSE()) -> 1435583912.33735 | B84: 1435583912.33735 | C84: of:=ROUND([.A84];12)=ROUND([.B84];12) -> true | D84: of:=FORMULA([.A84]) -> =BETADIST(I87,$J$68,$J$69,0,1,FALSE()) | I84: 0.9999999
A85: of:=BETADIST([.I88];[.$J$68];[.$J$69];0;1;FALSE()) -> 39159338651.6891 | B85: 39159338651.6891 | C85: of:=ROUND([.A85];12)=ROUND([.B85];12) -> true | D85: of:=FORMULA([.A85]) -> =BETADIST(I88,$J$68,$J$69,0,1,FALSE()) | I85: 0.999999999
A86: of:=BETADIST([.I89];[.$J$68];[.$J$69];0;1;FALSE()) -> 167879759909.416 | B86: 167879759909.416 | C86: of:=ROUND([.A86];12)=ROUND([.B86];12) -> true | D86: of:=FORMULA([.A86]) -> =BETADIST(I89,$J$68,$J$69,0,1,FALSE()) | I86: 0.99999999999
A87: of:=BETADIST([.I91];[.$J$89];[.$J$90];0;1;FALSE()) -> 0 | B87: 0 | C87: of:=ROUND([.A87];12)=ROUND([.B87];12) -> true | D87: of:=FORMULA([.A87]) -> =BETADIST(I91,$J$89,$J$90,0,1,FALSE()) | I87: 0.9999999999999
A88: of:=BETADIST([.I92];[.$J$89];[.$J$90];0;1;FALSE()) -> 1.33923132 | B88: 1.33923132 | C88: of:=ROUND([.A88];12)=ROUND([.B88];12) -> true | D88: of:=FORMULA([.A88]) -> =BETADIST(I92,$J$89,$J$90,0,1,FALSE()) | I88: 0.999999999999999
A89: of:=BETADIST([.I93];[.$J$89];[.$J$90];0;1;FALSE()) -> 2.64241152 | B89: 2.64241152 | C89: of:=ROUND([.A89];12)=ROUND([.B89];12) -> true | D89: of:=FORMULA([.A89]) -> =BETADIST(I93,$J$89,$J$90,0,1,FALSE()) | I89: of:=1-1E-016 -> 1 | J89: 3
A90: of:=BETADIST([.I94];[.$J$89];[.$J$90];0;1;FALSE()) -> 2.66827932 | B90: 2.66827932 | C90: of:=ROUND([.A90];12)=ROUND([.B90];12) -> true | D90: of:=FORMULA([.A90]) -> =BETADIST(I94,$J$89,$J$90,0,1,FALSE()) | J90: 7
A91: of:=BETADIST([.I95];[.$J$89];[.$J$90];0;1;FALSE()) -> 1.88116992 | B91: 1.88116992 | C91: of:=ROUND([.A91];12)=ROUND([.B91];12) -> true | D91: of:=FORMULA([.A91]) -> =BETADIST(I95,$J$89,$J$90,0,1,FALSE()) | I91: 0
A92: of:=BETADIST([.I96];[.$J$89];[.$J$90];0;1;FALSE()) -> 0.984375 | B92: 0.984375 | C92: of:=ROUND([.A92];12)=ROUND([.B92];12) -> true | D92: of:=FORMULA([.A92]) -> =BETADIST(I96,$J$89,$J$90,0,1,FALSE()) | I92: 0.1
A93: of:=BETADIST([.I97];[.$J$89];[.$J$90];0;1;FALSE()) -> 0.37158912 | B93: 0.37158912 | C93: of:=ROUND([.A93];12)=ROUND([.B93];12) -> true | D93: of:=FORMULA([.A93]) -> =BETADIST(I97,$J$89,$J$90,0,1,FALSE()) | I93: 0.2
A94: of:=BETADIST([.I98];[.$J$89];[.$J$90];0;1;FALSE()) -> 0.0900169199999999 | B94: 0.0900169199999999 | C94: of:=ROUND([.A94];12)=ROUND([.B94];12) -> true | D94: of:=FORMULA([.A94]) -> =BETADIST(I98,$J$89,$J$90,0,1,FALSE()) | I94: 0.3
A95: of:=BETADIST([.I99];[.$J$89];[.$J$90];0;1;FALSE()) -> 0.01032192 | B95: 0.01032192 | C95: of:=ROUND([.A95];12)=ROUND([.B95];12) -> true | D95: of:=FORMULA([.A95]) -> =BETADIST(I99,$J$89,$J$90,0,1,FALSE()) | I95: 0.4
A96: of:=BETADIST([.I100];[.$J$89];[.$J$90];0;1;FALSE()) -> 0.00020412 | B96: 0.00020412 | C96: of:=ROUND([.A96];12)=ROUND([.B96];12) -> true | D96: of:=FORMULA([.A96]) -> =BETADIST(I100,$J$89,$J$90,0,1,FALSE()) | I96: 0.5
A97: of:=BETADIST([.I101];[.$J$89];[.$J$90];0;1;FALSE()) -> 0 | B97: 0 | C97: of:=ROUND([.A97];12)=ROUND([.B97];12) -> true | D97: of:=FORMULA([.A97]) -> =BETADIST(I101,$J$89,$J$90,0,1,FALSE()) | I97: 0.6
A98: of:=BETADIST([.I102];[.$J$89];[.$J$90];0;1;FALSE()) -> 0 | B98: 0 | C98: of:=ROUND([.A98];12)=ROUND([.B98];12) -> true | D98: of:=FORMULA([.A98]) -> =BETADIST(I102,$J$89,$J$90,0,1,FALSE()) | I98: 0.7
A99: of:=BETADIST([.I103];[.$J$89];[.$J$90];0;1;FALSE()) -> 0 | B99: 0 | C99: of:=ROUND([.A99];12)=ROUND([.B99];12) -> true | D99: of:=FORMULA([.A99]) -> =BETADIST(I103,$J$89,$J$90,0,1,FALSE()) | I99: 0.8
A100: of:=BETADIST([.I104];[.$J$89];[.$J$90];0;1;FALSE()) -> 2.52E-198 | B100: 2.52E-198 | C100: of:=ROUND([.A100];12)=ROUND([.B100];12) -> true | D100: of:=FORMULA([.A100]) -> =BETADIST(I104,$J$89,$J$90,0,1,FALSE()) | I100: 0.9
A101: of:=BETADIST([.I105];[.$J$89];[.$J$90];0;1;FALSE()) -> 6.3E-097 | B101: 6.3E-097 | C101: of:=ROUND([.A101];12)=ROUND([.B101];12) -> true | D101: of:=FORMULA([.A101]) -> =BETADIST(I105,$J$89,$J$90,0,1,FALSE()) | I101: 1
A102: of:=BETADIST([.I106];[.$J$89];[.$J$90];0;1;FALSE()) -> 9.0719999673408E-017 | B102: 9.0719999673408E-017 | C102: of:=ROUND([.A102];12)=ROUND([.B102];12) -> true | D102: of:=FORMULA([.A102]) -> =BETADIST(I106,$J$89,$J$90,0,1,FALSE()) | I102: 3E-300
A103: of:=BETADIST([.I107];[.$J$89];[.$J$90];0;1;FALSE()) -> 0.00000123428147474933 | B103: 0.00000123428147474933 | C103: of:=ROUND([.A103];12)=ROUND([.B103];12) -> true | D103: of:=FORMULA([.A103]) -> =BETADIST(I107,$J$89,$J$90,0,1,FALSE()) | I103: 2E-200
A104: of:=BETADIST([.I108];[.$J$89];[.$J$90];0;1;FALSE()) -> 0.977929346167603 | B104: 0.977929346167603 | C104: of:=ROUND([.A104];12)=ROUND([.B104];12) -> true | D104: of:=FORMULA([.A104]) -> =BETADIST(I108,$J$89,$J$90,0,1,FALSE()) | I104: 1E-100
A105: of:=BETADIST([.I109];[.$J$89];[.$J$90];0;1;FALSE()) -> 0.00020412 | B105: 0.00020412 | C105: of:=ROUND([.A105];12)=ROUND([.B105];12) -> true | D105: of:=FORMULA([.A105]) -> =BETADIST(I109,$J$89,$J$90,0,1,FALSE()) | I105: 5E-050
A106: of:=BETADIST([.I110];[.$J$89];[.$J$90];0;1;FALSE()) -> 2.51496252000001E-016 | B106: 2.51496252000001E-016 | C106: of:=ROUND([.A106];12)=ROUND([.B106];12) -> true | D106: of:=FORMULA([.A106]) -> =BETADIST(I110,$J$89,$J$90,0,1,FALSE()) | I106: 0.0000000006
A107: of:=BETADIST([.I111];[.$J$89];[.$J$90];0;1;FALSE()) -> 2.51994960018319E-028 | B107: 2.51994960018319E-028 | C107: of:=ROUND([.A107];12)=ROUND([.B107];12) -> true | D107: of:=FORMULA([.A107]) -> =BETADIST(I111,$J$89,$J$90,0,1,FALSE()) | I107: 0.00007
A108: of:=BETADIST([.I112];[.$J$89];[.$J$90];0;1;FALSE()) -> 2.5199995048281E-040 | B108: 2.5199995048281E-040 | C108: of:=ROUND([.A108];12)=ROUND([.B108];12) -> true | D108: of:=FORMULA([.A108]) -> =BETADIST(I112,$J$89,$J$90,0,1,FALSE()) | I108: 0.08
A109: of:=BETADIST([.I113];[.$J$89];[.$J$90];0;1;FALSE()) -> 2.51999956733723E-052 | B109: 2.51999956733723E-052 | C109: of:=ROUND([.A109];12)=ROUND([.B109];12) -> true | D109: of:=FORMULA([.A109]) -> =BETADIST(I113,$J$89,$J$90,0,1,FALSE()) | I109: 0.9
A110: of:=BETADIST([.I114];[.$J$89];[.$J$90];0;1;FALSE()) -> 2.52016912143431E-064 | B110: 2.52016912143431E-064 | C110: of:=ROUND([.A110];12)=ROUND([.B110];12) -> true | D110: of:=FORMULA([.A110]) -> =BETADIST(I114,$J$89,$J$90,0,1,FALSE()) | I110: 0.999
A111: of:=BETADIST([.I115];[.$J$89];[.$J$90];0;1;FALSE()) -> 2.50793904172239E-076 | B111: 2.50793904172239E-076 | C111: of:=ROUND([.A111];12)=ROUND([.B111];12) -> true | D111: of:=FORMULA([.A111]) -> =BETADIST(I115,$J$89,$J$90,0,1,FALSE()) | I111: 0.99999
A112: of:=BETADIST([.I116];[.$J$89];[.$J$90];0;1;FALSE()) -> 1.23709155325503E-088 | B112: 1.23709155325503E-088 | C112: of:=ROUND([.A112];12)=ROUND([.B112];12) -> true | D112: of:=FORMULA([.A112]) -> =BETADIST(I116,$J$89,$J$90,0,1,FALSE()) | I112: 0.9999999
A113: of:=BETADIST([.I117];[.$J$89];[.$J$90];0;1;FALSE()) -> 4.71912976552974E-094 | B113: 4.71912976552974E-094 | C113: of:=ROUND([.A113];12)=ROUND([.B113];12) -> true | D113: of:=FORMULA([.A113]) -> =BETADIST(I117,$J$89,$J$90,0,1,FALSE()) | I113: 0.999999999
A114: of:=BETADIST([.I118];[.$J$89];[.$J$90];0;1;FALSE()) -> 0 | B114: 0 | C114: of:=ROUND([.A114];12)=ROUND([.B114];12) -> true | D114: of:=FORMULA([.A114]) -> =BETADIST(I118,$J$89,$J$90,0,1,FALSE()) | I114: 0.99999999999
A115: of:=BETADIST([.I120];[.$J$118];[.$J$119];0;1;FALSE()) -> 0 | B115: 0 | C115: of:=ROUND([.A115];12)=ROUND([.B115];12) -> true | D115: of:=FORMULA([.A115]) -> =BETADIST(I120,$J$118,$J$119,0,1,FALSE()) | I115: 0.9999999999999
A116: of:=BETADIST([.I121];[.$J$118];[.$J$119];0;1;FALSE()) -> 0.000000000000166200213599109 | B116: 0.000000000000166200213599109 | C116: of:=ROUND([.A116];12)=ROUND([.B116];12) -> true | D116: of:=FORMULA([.A116]) -> =BETADIST(I121,$J$118,$J$119,0,1,FALSE()) | I116: 0.999999999999999
A117: of:=BETADIST([.I122];[.$J$118];[.$J$119];0;1;FALSE()) -> 3.17470115754559E-037 | B117: 3.17470115754559E-037 | C117: of:=ROUND([.A117];12)=ROUND([.B117];12) -> true | D117: of:=FORMULA([.A117]) -> =BETADIST(I122,$J$118,$J$119,0,1,FALSE()) | I117: of:=1-1E-016 -> 1
A118: of:=BETADIST([.I123];[.$J$118];[.$J$119];0;1;FALSE()) -> 4.17127538659272E-065 | B118: 4.17127538659272E-065 | C118: of:=ROUND([.A118];12)=ROUND([.B118];12) -> true | D118: of:=FORMULA([.A118]) -> =BETADIST(I123,$J$118,$J$119,0,1,FALSE()) | I118: 1 | J118: 7
A119: of:=BETADIST([.I124];[.$J$118];[.$J$119];0;1;FALSE()) -> 9.19291525916191E-098 | B119: 9.19291525916191E-098 | C119: of:=ROUND([.A119];12)=ROUND([.B119];12) -> true | D119: of:=FORMULA([.A119]) -> =BETADIST(I124,$J$118,$J$119,0,1,FALSE()) | J119: 500
A120: of:=BETADIST([.I125];[.$J$118];[.$J$119];0;1;FALSE()) -> 1.08011887912289E-136 | B120: 1.08011887912289E-136 | C120: of:=ROUND([.A120];12)=ROUND([.B120];12) -> true | D120: of:=FORMULA([.A120]) -> =BETADIST(I125,$J$118,$J$119,0,1,FALSE()) | I120: 0
A121: of:=BETADIST([.I126];[.$J$118];[.$J$119];0;1;FALSE()) -> 1.41404275937475E-184 | B121: 1.41404275937475E-184 | C121: of:=ROUND([.A121];12)=ROUND([.B121];12) -> true | D121: of:=FORMULA([.A121]) -> =BETADIST(I126,$J$118,$J$119,0,1,FALSE()) | I121: 0.1
A122: of:=BETADIST([.I127];[.$J$118];[.$J$119];0;1;FALSE()) -> 1.61329472047363E-246 | B122: 1.61329472047363E-246 | C122: of:=ROUND([.A122];12)=ROUND([.B122];12) -> true | D122: of:=FORMULA([.A122]) -> =BETADIST(I127,$J$118,$J$119,0,1,FALSE()) | I122: 0.2
A123: of:=BETADIST([.I128];[.$J$118];[.$J$119];0;1;FALSE()) -> 0 | B123: 0 | C123: of:=ROUND([.A123];12)=ROUND([.B123];12) -> true | D123: of:=FORMULA([.A123]) -> =BETADIST(I128,$J$118,$J$119,0,1,FALSE()) | I123: 0.3
A124: of:=BETADIST([.I129];[.$J$118];[.$J$119];0;1;FALSE()) -> 0 | B124: 0 | C124: of:=ROUND([.A124];12)=ROUND([.B124];12) -> true | D124: of:=FORMULA([.A124]) -> =BETADIST(I129,$J$118,$J$119,0,1,FALSE()) | I124: 0.4
A125: of:=BETADIST([.I130];[.$J$118];[.$J$119];0;1;FALSE()) -> 0 | B125: 0 | C125: of:=ROUND([.A125];12)=ROUND([.B125];12) -> true | D125: of:=FORMULA([.A125]) -> =BETADIST(I130,$J$118,$J$119,0,1,FALSE()) | I125: 0.5
A126: of:=BETADIST([.I131];[.$J$118];[.$J$119];0;1;FALSE()) -> 0 | B126: 0 | C126: of:=ROUND([.A126];12)=ROUND([.B126];12) -> true | D126: of:=FORMULA([.A126]) -> =BETADIST(I131,$J$118,$J$119,0,1,FALSE()) | I126: 0.6
A127: of:=BETADIST([.I132];[.$J$118];[.$J$119];0;1;FALSE()) -> 0 | B127: 0 | C127: of:=ROUND([.A127];12)=ROUND([.B127];12) -> true | D127: of:=FORMULA([.A127]) -> =BETADIST(I132,$J$118,$J$119,0,1,FALSE()) | I127: 0.7
A128: of:=BETADIST([.I133];[.$J$118];[.$J$119];0;1;FALSE()) -> 0 | B128: 0 | C128: of:=ROUND([.A128];12)=ROUND([.B128];12) -> true | D128: of:=FORMULA([.A128]) -> =BETADIST(I133,$J$118,$J$119,0,1,FALSE()) | I128: 0.8
A129: of:=BETADIST([.I134];[.$J$118];[.$J$119];0;1;FALSE()) -> 1.76782549716609E-280 | B129: 1.76782549716609E-280 | C129: of:=ROUND([.A129];12)=ROUND([.B129];12) -> true | D129: of:=FORMULA([.A129]) -> =BETADIST(I134,$J$118,$J$119,0,1,FALSE()) | I129: 0.9
A130: of:=BETADIST([.I135];[.$J$118];[.$J$119];0;1;FALSE()) -> 5.27869706888772E-040 | B130: 5.27869706888772E-040 | C130: of:=ROUND([.A130];12)=ROUND([.B130];12) -> true | D130: of:=FORMULA([.A130]) -> =BETADIST(I135,$J$118,$J$119,0,1,FALSE()) | I130: 1
A131: of:=BETADIST([.I136];[.$J$118];[.$J$119];0;1;FALSE()) -> 0.00000000128539666929823 | B131: 0.00000000128539666929823 | C131: of:=ROUND([.A131];12)=ROUND([.B131];12) -> true | D131: of:=FORMULA([.A131]) -> =BETADIST(I136,$J$118,$J$119,0,1,FALSE()) | I131: 3E-300
A132: of:=BETADIST([.I137];[.$J$118];[.$J$119];0;1;FALSE()) -> 0.00000000252513810033322 | B132: 0.00000000252513810033322 | C132: of:=ROUND([.A132];12)=ROUND([.B132];12) -> true | D132: of:=FORMULA([.A132]) -> =BETADIST(I137,$J$118,$J$119,0,1,FALSE()) | I132: 2E-200
A133: of:=BETADIST([.I138];[.$J$118];[.$J$119];0;1;FALSE()) -> 0 | B133: 0 | C133: of:=ROUND([.A133];12)=ROUND([.B133];12) -> true | D133: of:=FORMULA([.A133]) -> =BETADIST(I138,$J$118,$J$119,0,1,FALSE()) | I133: 1E-100
A134: of:=BETADIST([.I139];[.$J$118];[.$J$119];0;1;FALSE()) -> 0 | B134: 0 | C134: of:=ROUND([.A134];12)=ROUND([.B134];12) -> true | D134: of:=FORMULA([.A134]) -> =BETADIST(I139,$J$118,$J$119,0,1,FALSE()) | I134: 5E-050
A135: of:=BETADIST([.I140];[.$J$118];[.$J$119];0;1;FALSE()) -> 0 | B135: 0 | C135: of:=ROUND([.A135];12)=ROUND([.B135];12) -> true | D135: of:=FORMULA([.A135]) -> =BETADIST(I140,$J$118,$J$119,0,1,FALSE()) | I135: 0.0000000006
A136: of:=BETADIST([.I141];[.$J$118];[.$J$119];0;1;FALSE()) -> 0 | B136: 0 | C136: of:=ROUND([.A136];12)=ROUND([.B136];12) -> true | D136: of:=FORMULA([.A136]) -> =BETADIST(I141,$J$118,$J$119,0,1,FALSE()) | I136: 0.00007
A137: of:=BETADIST([.I142];[.$J$118];[.$J$119];0;1;FALSE()) -> 0 | B137: 0 | C137: of:=ROUND([.A137];12)=ROUND([.B137];12) -> true | D137: of:=FORMULA([.A137]) -> =BETADIST(I142,$J$118,$J$119,0,1,FALSE()) | I137: 0.08
A138: of:=BETADIST([.I143];[.$J$118];[.$J$119];0;1;FALSE()) -> 0 | B138: 0 | C138: of:=ROUND([.A138];12)=ROUND([.B138];12) -> true | D138: of:=FORMULA([.A138]) -> =BETADIST(I143,$J$118,$J$119,0,1,FALSE()) | I138: 0.9
A139: of:=BETADIST([.I144];[.$J$118];[.$J$119];0;1;FALSE()) -> 0 | B139: 0 | C139: of:=ROUND([.A139];12)=ROUND([.B139];12) -> true | D139: of:=FORMULA([.A139]) -> =BETADIST(I144,$J$118,$J$119,0,1,FALSE()) | I139: 0.999
A140: of:=BETADIST([.I145];[.$J$118];[.$J$119];0;1;FALSE()) -> 0 | B140: 0 | C140: of:=ROUND([.A140];12)=ROUND([.B140];12) -> true | D140: of:=FORMULA([.A140]) -> =BETADIST(I145,$J$118,$J$119,0,1,FALSE()) | I140: 0.99999
A141: of:=BETADIST([.I146];[.$J$118];[.$J$119];0;1;FALSE()) -> 0 | B141: 0 | C141: of:=ROUND([.A141];12)=ROUND([.B141];12) -> true | D141: of:=FORMULA([.A141]) -> =BETADIST(I146,$J$118,$J$119,0,1,FALSE()) | I141: 0.9999999
A142: of:=BETADIST([.I147];[.$J$118];[.$J$119];0;1;FALSE()) -> 0 | B142: 0 | C142: of:=ROUND([.A142];12)=ROUND([.B142];12) -> true | D142: of:=FORMULA([.A142]) -> =BETADIST(I147,$J$118,$J$119,0,1,FALSE()) | I142: 0.999999999
I143: 0.99999999999
I144: 0.9999999999999
I145: 0.999999999999999
I146: of:=1-1E-016 -> 1
I147: 1

Sheet: 'file:///home/zdenek/Dokumenty/LO/sc-unit-test/Project%20Calc%20functions%20tests/fods/function_based_test_Example.fods/function_based_test_Example_reference.fods'#Sheet2
H3: 4