Sheet: Sheet1
A1: BINOM.DIST Function
A3: Result | B3: of:=AND([.B8:.B95]) -> true
A7: Sheet | B7: Result | C7: Description
A8: 1 | B8: of:=AND([Sheet2.C2:.C349]) -> true | C8: Simple BINOM.DIST formulas with local references and values

Sheet: Sheet2
A1: Function | B1: Expected | C1: Correct | D1: FunctionString | E1: Comment | F1: 4 | I1: Data | J1: Description | AA1: year | AB1: month | AC1: day | AD1: value
A2: of:=COM.MICROSOFT.BINOM.DIST([.F1];12;0.5;0) -> 0.120849609375 | B2: 0.120849609375 | C2: of:=ROUND([.A2];12)=ROUND([.B2];12) -> true | D2: of:=FORMULA([.A2]) -> =BINOM.DIST(F1,12,0.5,0) | I2: 6 | J2: Number of successes in trials | AA2: 2012 | AB2: 12 | AC2: 15 | AD2: 6
A3: of:=COM.MICROSOFT.BINOM.DIST([.F1];12;0.5;1) -> 0.19384765625 | B3: 0.19384765625 | C3: of:=ROUND([.A3];12)=ROUND([.B3];12) -> true | D3: of:=FORMULA([.A3]) -> =BINOM.DIST(F1,12,0.5,1) | I3: 10 | J3: Number of independent trials | AA3: 2012 | AB3: 4 | AC3: 1 | AD3: 10.4
A4: of:=COM.MICROSOFT.BINOM.DIST(3; 8; 0.35; 1) -> 0.706399436132812 | B4: 0.706399436132812 | C4: of:=ROUND([.A4];12)=ROUND([.B4];12) -> true | D4: of:=FORMULA([.A4]) -> =BINOM.DIST(3, 8, 0.35, 1) | I4: 0.5 | J4: Probability of success on each trial | AA4: 2013 | AB4: 8 | AC4: 15 | AD4: 7
A5: of:=COM.MICROSOFT.BINOM.DIST(3; 8; 0.35; 0) -> 0.2785857790625 | B5: 0.2785857790625 | C5: of:=ROUND([.A5];12)=ROUND([.B5];12) -> true | D5: of:=FORMULA([.A5]) -> =BINOM.DIST(3, 8, 0.35, 0) | AA5: 2011 | AB5: 11 | AC5: 1 | AD5: 12
A6: of:=COM.MICROSOFT.BINOM.DIST(50; 125; 0.4; 1) -> 0.538748204875451 | B6: 0.538748204875451 | C6: of:=ROUND([.A6];12)=ROUND([.B6];12) -> true | D6: of:=FORMULA([.A6]) -> =BINOM.DIST(50, 125, 0.4, 1) | AA6: 2011 | AB6: 2 | AC6: 14 | AD6: 8
A7: of:=COM.MICROSOFT.BINOM.DIST([.I2];[.I3];[.I4];0) -> 0.205078125 | B7: 0.205078125 | C7: of:=ROUND([.A7];12)=ROUND([.B7];12) -> true | D7: of:=FORMULA([.A7]) -> =BINOM.DIST(I2,I3,I4,0) | AA7: 2010 | AB7: 6 | AC7: 1 | AD7: 15
A8: of:=COM.MICROSOFT.BINOM.DIST([.F1];12;0.5;2) -> 0.19384765625 | B8: 0.19384765625 | C8: of:=ROUND([.A8];12)=ROUND([.B8];12) -> true | D8: of:=FORMULA([.A8]) -> =BINOM.DIST(F1,12,0.5,2)
A9: of:=COM.MICROSOFT.BINOM.DIST(0; 125; 0.4; 1) -> 1.85740366414241E-028 | B9: 1.85740366414241E-028 | C9: of:=ROUND([.A9];12)=ROUND([.B9];12) -> true | D9: of:=FORMULA([.A9]) -> =BINOM.DIST(0, 125, 0.4, 1)
A10: of:=COM.MICROSOFT.BINOM.DIST(-50; 125; 0.4; 1) ->  | B10: Err:502 | C10: of:=ISERROR([.A10]) -> true | D10: of:=FORMULA([.A10]) -> =BINOM.DIST(-50, 125, 0.4, 1)
A11: of:=COM.MICROSOFT.BINOM.DIST(150; 125; 0.4; 1) ->  | B11: Err:502 | C11: of:=ISERROR([.A11]) -> true | D11: of:=FORMULA([.A11]) -> =BINOM.DIST(150, 125, 0.4, 1)
A12: of:=COM.MICROSOFT.BINOM.DIST(50; 125;- 0.4; 1) ->  | B12: Err:502 | C12: of:=ISERROR([.A12]) -> true | D12: of:=FORMULA([.A12]) -> =BINOM.DIST(50, 125,- 0.4, 1)
A13: of:=COM.MICROSOFT.BINOM.DIST(50; 125; 1.4; 1) ->  | B13: Err:502 | C13: of:=ISERROR([.A13]) -> true | D13: of:=FORMULA([.A13]) -> =BINOM.DIST(50, 125, 1.4, 1)

Sheet: 'file:///home/zdenek/Dokumenty/LO/sc-unit-test/Project%20Calc%20functions%20tests/fods/function_based_test_Example.fods/function_based_test_Example_reference.fods'#Sheet2
H3: 4