Sheet: Sheet1
A1: CELL Function
A3: Result | B3: of:=AND([.B8:.B95]) -> true
A7: Sheet | B7: Result | C7: Description
A8: 1 | B8: of:=AND([Sheet2.C2:.C93]) -> true | C8: Simple CELL formulas with local references and values

Sheet: Sheet2
A1: Function | B1: Expected | C1: Correct | D1: FunctionString | E1: Comment
A2: of:=CELL("COL";[.AA14]) -> 27 | B2: 27 | C2: of:=[.A2]=[.B2] -> true | D2: of:=FORMULA([.A2]) -> =CELL("COL";AA14)
A3: of:=CELL("ROW";[.AA14]) -> 14 | B3: 14 | C3: of:=[.A3]=[.B3] -> true | D3: of:=FORMULA([.A3]) -> =CELL("ROW";AA14)
A4: of:=CELL("SHEET"; [.A2]) -> 2 | B4: 2 | C4: of:=[.A4]=[.B4] -> true | D4: of:=FORMULA([.A4]) -> =CELL("SHEET"; A2)
A5: of:=CELL("Address"; [.A6]) -> $A$6 | B5: $A$6 | C5: of:=[.A5]=[.B5] -> true | D5: of:=FORMULA([.A5]) -> =CELL("Address"; A6)
A6: of:=CELL("COORD"; [.D2]) -> $B:$D$2 | B6: $B:$D$2 | C6: of:=[.A6]=[.B6] -> true | D6: of:=FORMULA([.A6]) -> =CELL("COORD"; D2) | E6: Returns the complete cell address in Lotus(TM) notation.
A7: of:=CELL("COORD"; [Sheet2.D2]) -> $B:$D$2 | B7: $B:$D$2 | C7: of:=[.A7]=[.B7] -> true | D7: of:=FORMULA([.A7]) -> =CELL("COORD"; Sheet2.D2)
A8: of:=CELL("CONTENTS"; [.I1]) -> 0 | B8: 0 | C8: of:=[.A8]=[.B8] -> true | D8: of:=FORMULA([.A8]) -> =CELL("CONTENTS"; I1)
A9: of:=CELL("CONTENTS";[.A4]) -> 2 | B9: 2 | C9: of:=[.A9]=[.B9] -> true | D9: of:=FORMULA([.A9]) -> =CELL("CONTENTS";A4) | J9: left
A10: of:=CELL("TYPE"; [.AA14]) -> b | B10: b | C10: of:=[.A10]=[.B10] -> true | D10: of:=FORMULA([.A10]) -> =CELL("TYPE"; AA14) | J10: right
A11: of:=CELL("TYPE";[.A2]) -> v | B11: v | C11: of:=[.A11]=[.B11] -> true | D11: of:=FORMULA([.A11]) -> =CELL("TYPE";A2) | J11: middle
A12: of:=CELL("TYPE";[.A5]) -> l | B12: l | C12: of:=[.A12]=[.B12] -> true | D12: of:=FORMULA([.A12]) -> =CELL("TYPE";A5) | J12: repeating
A13: of:=CELL("width";[.A5]) -> 12 | B13: 12 | C13: of:=[.A13]=[.B13] -> true | D13: of:=FORMULA([.A13]) -> =CELL("width";A5) | J13: protected
A14: of:=CELL("PREFIX";[.J9]) -> ' | B14: ' | C14: of:=[.A14]=[.B14] -> true | D14: of:=FORMULA([.A14]) -> =CELL("PREFIX";J9) | J14: unprotected
A15: of:=CELL("PREFIX";[.J10]) -> " | B15: " | C15: of:=[.A15]=[.B15] -> true | D15: of:=FORMULA([.A15]) -> =CELL("PREFIX";J10)
A16: of:=CELL("PREFIX";[.J11]) -> ^ | B16: ^ | C16: of:=[.A16]=[.B16] -> true | D16: of:=FORMULA([.A16]) -> =CELL("PREFIX";J11)
A17: of:=CELL("PROTECT";[.J13]) -> 1 | B17: 1 | C17: of:=[.A17]=[.B17] -> true | D17: of:=FORMULA([.A17]) -> =CELL("PROTECT";J13)
A18: of:=CELL("PROTECT";[.J14]) -> 0 | B18: 0 | C18: of:=[.A18]=[.B18] -> true | D18: of:=FORMULA([.A18]) -> =CELL("PROTECT";J14)
A19: of:=CELL("FORMAT";[.J19]) -> ,0 | B19: ,0 | C19: of:=[.A19]=[.B19] -> true | D19: of:=FORMULA([.A19]) -> =CELL("FORMAT";J19) | E19: , = number with thousands separator | J19: 1000000
A20: of:=CELL("FORMAT";[.J20]) -> F0 | B20: F0 | C20: of:=[.A20]=[.B20] -> true | D20: of:=FORMULA([.A20]) -> =CELL("FORMAT";J20) | E20: F = number without thousands separator | J20: 1000000
A21: of:=CELL("FORMAT";[.J21]) -> C2- | B21: C2- | C21: of:=[.A21]=[.B21] -> true | D21: of:=FORMULA([.A21]) -> =CELL("FORMAT";J21) | E21: C = currency format | J21: 1000000
A22: of:=CELL("FORMAT";[.J22]) -> S2 | B22: S2 | C22: of:=[.A22]=[.B22] -> true | D22: of:=FORMULA([.A22]) -> =CELL("FORMAT";J22) | E22: S = exponential representation, for example, 1.234+E56 | J22: 1.2E+061
A23: of:=CELL("FORMAT";[.J23]) -> P2 | B23: P2 | C23: of:=[.A23]=[.B23] -> true | D23: of:=FORMULA([.A23]) -> =CELL("FORMAT";J23) | E23: P = percentage | J23: 0.8
A24: of:=CELL("FORMAT";[.J24]) -> D5 | B24: D5 | C24: of:=[.A24]=[.B24] -> true | D24: of:=FORMULA([.A24]) -> =CELL("FORMAT";J24) | E24: D5 = MM-DD | J24: 1903-01-15
A25: of:=CELL("FORMAT";[.J25]) -> D6 | B25: D6 | C25: of:=[.A25]=[.B25] -> true | D25: of:=FORMULA([.A25]) -> =CELL("FORMAT";J25) | E25: D6 = HH:MM:SS AM/PM | J25: PT12H22M22S
A26: of:=CELL("FORMAT";[.J26]) -> D7 | B26: D7 | C26: of:=[.A26]=[.B26] -> true | D26: of:=FORMULA([.A26]) -> =CELL("FORMAT";J26) | E26: D7 = HH:MM AM/PM | J26: PT15H33M00S
A27: of:=CELL("FORMAT";[.J27]) -> D8 | B27: D8 | C27: of:=[.A27]=[.B27] -> true | D27: of:=FORMULA([.A27]) -> =CELL("FORMAT";J27) | E27: D8 = HH:MM:SS | J27: PT11H44M44S
A28: of:=CELL("FORMAT";[.J28]) -> D9 | B28: D9 | C28: of:=[.A28]=[.B28] -> true | D28: of:=FORMULA([.A28]) -> =CELL("FORMAT";J28) | E28: D9 = HH:MM | J28: PT10H33M00S
A29: of:=CELL("FORMAT";[.J29]) -> G | B29: G | C29: of:=[.A29]=[.B29] -> true | D29: of:=FORMULA([.A29]) -> =CELL("FORMAT";J29) | E29: G = All other formats | J29: of:=TRUE() -> true
A30: of:=CELL("FORMAT";) ->  | B30: #ref | C30: of:=ISERROR([.A30]) -> true | D30: of:=FORMULA([.A30]) -> =CELL("FORMAT";)
A31: of:=CELL("hello";[.J1]) ->  | B31: error | C31: of:=ISERROR([.A31]) -> true | D31: of:=FORMULA([.A31]) -> =CELL("hello";J1)
A32: of:=CELL([.J2]) ->  | B32: error | C32: of:=ISERROR([.A32]) -> true | D32: of:=FORMULA([.A32]) -> =CELL(J2)
A33: of:=CELL("address";[Sheet1.A1]) -> $Sheet1.$A$1 | B33: $Sheet1.$A$1 | C33: of:=[.A33]=[.B33] -> true | D33: of:=FORMULA([.A33]) -> =CELL("address";Sheet1.A1)
A34: of:=CELL("color";[.J19]) -> 0 | B34: 0 | C34: of:=[.A34]=[.B34] -> true | D34: of:=FORMULA([.A34]) -> =CELL("color";J19)
A35: of:=CELL("color";[.J21]) -> 1 | B35: 1 | C35: of:=[.A35]=[.B35] -> true | D35: of:=FORMULA([.A35]) -> =CELL("color";J21)
A36: of:=CELL("PARENTHESES";[.J22]) -> 0 | B36: 0 | C36: of:=[.A36]=[.B36] -> true | D36: of:=FORMULA([.A36]) -> =CELL("PARENTHESES";J22)
A37: of:=CELL("PARENTHESES";[.J37]) -> 1 | B37: 1 | C37: of:=[.A37]=[.B37] -> true | D37: of:=FORMULA([.A37]) -> =CELL("PARENTHESES";J37) | J37: 11
A38: of:=CELL("Address"; [Sheet2.A2]) -> $A$2 | B38: $A$2 | C38: of:=[.A38]=[.B38] -> true | D38: of:=FORMULA([.A38]) -> =CELL("Address"; Sheet2.A2) | E38: Tdf#100461 Returns the absolute address of the cell. The sheet name is included if given in the reference.
E43: Tdf#88490
E44: Bug 43534 - EDITING: CELL doesn't support external references.

Sheet: 'file:///home/zdenek/Dokumenty/LO/sc-unit-test/Project%20Calc%20functions%20tests/fods/cell.fods/cell.fods/cell.fods/cell.fods/minute.fods/minute.fods/year.fods/function_based_test_Example.fods/function_based_test_Example_reference.fods'#Sheet2
H3: 4