Sheet: Sheet1
A1: CODE Function
A3: Result | B3: of:=AND([.B8:.B95]) -> true
A7: Sheet | B7: Result | C7: Description
A8: 1 | B8: of:=AND([Sheet2.C2:.C100]) -> true | C8: Simple CODE formulas with local references and values

Sheet: Sheet2
A1: Function | B1: Expected | C1: Correct | D1: FunctionString | E1: Comment
A2: of:=CODE([.I2]) -> 33 | B2: 33 | C2: of:=[.A2]=[.B2] -> true | D2: of:=FORMULA([.A2]) -> =CODE(I2) | I2: !
A3: of:=CODE([.I3]) -> 34 | B3: 34 | C3: of:=[.A3]=[.B3] -> true | D3: of:=FORMULA([.A3]) -> =CODE(I3) | I3: "
A4: of:=CODE([.I4]) -> 35 | B4: 35 | C4: of:=[.A4]=[.B4] -> true | D4: of:=FORMULA([.A4]) -> =CODE(I4) | I4: #
A5: of:=CODE([.I5]) -> 36 | B5: 36 | C5: of:=[.A5]=[.B5] -> true | D5: of:=FORMULA([.A5]) -> =CODE(I5) | I5: $
A6: of:=CODE([.I6]) -> 37 | B6: 37 | C6: of:=[.A6]=[.B6] -> true | D6: of:=FORMULA([.A6]) -> =CODE(I6) | I6: %
A7: of:=CODE([.I7]) -> 38 | B7: 38 | C7: of:=[.A7]=[.B7] -> true | D7: of:=FORMULA([.A7]) -> =CODE(I7) | I7: &
A8: of:=CODE([.I8]) -> 39 | B8: 39 | C8: of:=[.A8]=[.B8] -> true | D8: of:=FORMULA([.A8]) -> =CODE(I8) | I8: '
A9: of:=CODE([.I9]) -> 40 | B9: 40 | C9: of:=[.A9]=[.B9] -> true | D9: of:=FORMULA([.A9]) -> =CODE(I9) | I9: (
A10: of:=CODE([.I10]) -> 41 | B10: 41 | C10: of:=[.A10]=[.B10] -> true | D10: of:=FORMULA([.A10]) -> =CODE(I10) | I10: )
A11: of:=CODE([.I11]) -> 42 | B11: 42 | C11: of:=[.A11]=[.B11] -> true | D11: of:=FORMULA([.A11]) -> =CODE(I11) | I11: *
A12: of:=CODE([.I12]) -> 43 | B12: 43 | C12: of:=[.A12]=[.B12] -> true | D12: of:=FORMULA([.A12]) -> =CODE(I12) | I12: +
A13: of:=CODE([.I13]) -> 44 | B13: 44 | C13: of:=[.A13]=[.B13] -> true | D13: of:=FORMULA([.A13]) -> =CODE(I13) | I13: ,
A14: of:=CODE([.I14]) -> 45 | B14: 45 | C14: of:=[.A14]=[.B14] -> true | D14: of:=FORMULA([.A14]) -> =CODE(I14) | I14: -
A15: of:=CODE([.I15]) -> 46 | B15: 46 | C15: of:=[.A15]=[.B15] -> true | D15: of:=FORMULA([.A15]) -> =CODE(I15) | I15: .
A16: of:=CODE([.I16]) -> 47 | B16: 47 | C16: of:=[.A16]=[.B16] -> true | D16: of:=FORMULA([.A16]) -> =CODE(I16) | I16: /
A17: of:=CODE([.I17]) -> 48 | B17: 48 | C17: of:=[.A17]=[.B17] -> true | D17: of:=FORMULA([.A17]) -> =CODE(I17) | I17: 0
A18: of:=CODE([.I18]) -> 49 | B18: 49 | C18: of:=[.A18]=[.B18] -> true | D18: of:=FORMULA([.A18]) -> =CODE(I18) | I18: 1
A19: of:=CODE([.I19]) -> 50 | B19: 50 | C19: of:=[.A19]=[.B19] -> true | D19: of:=FORMULA([.A19]) -> =CODE(I19) | I19: 2
A20: of:=CODE([.I20]) -> 51 | B20: 51 | C20: of:=[.A20]=[.B20] -> true | D20: of:=FORMULA([.A20]) -> =CODE(I20) | I20: 3
A21: of:=CODE([.I21]) -> 52 | B21: 52 | C21: of:=[.A21]=[.B21] -> true | D21: of:=FORMULA([.A21]) -> =CODE(I21) | I21: 4
A22: of:=CODE([.I22]) -> 53 | B22: 53 | C22: of:=[.A22]=[.B22] -> true | D22: of:=FORMULA([.A22]) -> =CODE(I22) | I22: 5
A23: of:=CODE([.I23]) -> 54 | B23: 54 | C23: of:=[.A23]=[.B23] -> true | D23: of:=FORMULA([.A23]) -> =CODE(I23) | I23: 6
A24: of:=CODE([.I24]) -> 55 | B24: 55 | C24: of:=[.A24]=[.B24] -> true | D24: of:=FORMULA([.A24]) -> =CODE(I24) | I24: 7
A25: of:=CODE([.I25]) -> 56 | B25: 56 | C25: of:=[.A25]=[.B25] -> true | D25: of:=FORMULA([.A25]) -> =CODE(I25) | I25: 8
A26: of:=CODE([.I26]) -> 57 | B26: 57 | C26: of:=[.A26]=[.B26] -> true | D26: of:=FORMULA([.A26]) -> =CODE(I26) | I26: 9
A27: of:=CODE([.I27]) -> 58 | B27: 58 | C27: of:=[.A27]=[.B27] -> true | D27: of:=FORMULA([.A27]) -> =CODE(I27) | I27: :
A28: of:=CODE([.I28]) -> 59 | B28: 59 | C28: of:=[.A28]=[.B28] -> true | D28: of:=FORMULA([.A28]) -> =CODE(I28) | I28: ;
A29: of:=CODE([.I29]) -> 60 | B29: 60 | C29: of:=[.A29]=[.B29] -> true | D29: of:=FORMULA([.A29]) -> =CODE(I29) | I29: <
A30: of:=CODE([.I30]) -> 61 | B30: 61 | C30: of:=[.A30]=[.B30] -> true | D30: of:=FORMULA([.A30]) -> =CODE(I30) | I30: =
A31: of:=CODE([.I31]) -> 62 | B31: 62 | C31: of:=[.A31]=[.B31] -> true | D31: of:=FORMULA([.A31]) -> =CODE(I31) | I31: >
A32: of:=CODE([.I32]) -> 63 | B32: 63 | C32: of:=[.A32]=[.B32] -> true | D32: of:=FORMULA([.A32]) -> =CODE(I32) | I32: ?
A33: of:=CODE([.I33]) -> 64 | B33: 64 | C33: of:=[.A33]=[.B33] -> true | D33: of:=FORMULA([.A33]) -> =CODE(I33) | I33: @
A34: of:=CODE([.I34]) -> 65 | B34: 65 | C34: of:=[.A34]=[.B34] -> true | D34: of:=FORMULA([.A34]) -> =CODE(I34) | I34: A
A35: of:=CODE([.I35]) -> 66 | B35: 66 | C35: of:=[.A35]=[.B35] -> true | D35: of:=FORMULA([.A35]) -> =CODE(I35) | I35: B
A36: of:=CODE([.I36]) -> 67 | B36: 67 | C36: of:=[.A36]=[.B36] -> true | D36: of:=FORMULA([.A36]) -> =CODE(I36) | I36: C
A37: of:=CODE([.I37]) -> 68 | B37: 68 | C37: of:=[.A37]=[.B37] -> true | D37: of:=FORMULA([.A37]) -> =CODE(I37) | I37: D
A38: of:=CODE([.I38]) -> 69 | B38: 69 | C38: of:=[.A38]=[.B38] -> true | D38: of:=FORMULA([.A38]) -> =CODE(I38) | I38: E
A39: of:=CODE([.I39]) -> 70 | B39: 70 | C39: of:=[.A39]=[.B39] -> true | D39: of:=FORMULA([.A39]) -> =CODE(I39) | I39: F
A40: of:=CODE([.I40]) -> 71 | B40: 71 | C40: of:=[.A40]=[.B40] -> true | D40: of:=FORMULA([.A40]) -> =CODE(I40) | I40: G
A41: of:=CODE([.I41]) -> 72 | B41: 72 | C41: of:=[.A41]=[.B41] -> true | D41: of:=FORMULA([.A41]) -> =CODE(I41) | I41: H
A42: of:=CODE([.I42]) -> 73 | B42: 73 | C42: of:=[.A42]=[.B42] -> true | D42: of:=FORMULA([.A42]) -> =CODE(I42) | I42: I
A43: of:=CODE([.I43]) -> 74 | B43: 74 | C43: of:=[.A43]=[.B43] -> true | D43: of:=FORMULA([.A43]) -> =CODE(I43) | I43: J
A44: of:=CODE([.I44]) -> 75 | B44: 75 | C44: of:=[.A44]=[.B44] -> true | D44: of:=FORMULA([.A44]) -> =CODE(I44) | I44: K
A45: of:=CODE([.I45]) -> 76 | B45: 76 | C45: of:=[.A45]=[.B45] -> true | D45: of:=FORMULA([.A45]) -> =CODE(I45) | I45: L
A46: of:=CODE([.I46]) -> 77 | B46: 77 | C46: of:=[.A46]=[.B46] -> true | D46: of:=FORMULA([.A46]) -> =CODE(I46) | I46: M
A47: of:=CODE([.I47]) -> 78 | B47: 78 | C47: of:=[.A47]=[.B47] -> true | D47: of:=FORMULA([.A47]) -> =CODE(I47) | I47: N
A48: of:=CODE([.I48]) -> 79 | B48: 79 | C48: of:=[.A48]=[.B48] -> true | D48: of:=FORMULA([.A48]) -> =CODE(I48) | I48: O
A49: of:=CODE([.I49]) -> 80 | B49: 80 | C49: of:=[.A49]=[.B49] -> true | D49: of:=FORMULA([.A49]) -> =CODE(I49) | I49: P
A50: of:=CODE([.I50]) -> 81 | B50: 81 | C50: of:=[.A50]=[.B50] -> true | D50: of:=FORMULA([.A50]) -> =CODE(I50) | I50: Q
A51: of:=CODE([.I51]) -> 82 | B51: 82 | C51: of:=[.A51]=[.B51] -> true | D51: of:=FORMULA([.A51]) -> =CODE(I51) | I51: R
A52: of:=CODE([.I52]) -> 83 | B52: 83 | C52: of:=[.A52]=[.B52] -> true | D52: of:=FORMULA([.A52]) -> =CODE(I52) | I52: S
A53: of:=CODE([.I53]) -> 84 | B53: 84 | C53: of:=[.A53]=[.B53] -> true | D53: of:=FORMULA([.A53]) -> =CODE(I53) | I53: T
A54: of:=CODE([.I54]) -> 85 | B54: 85 | C54: of:=[.A54]=[.B54] -> true | D54: of:=FORMULA([.A54]) -> =CODE(I54) | I54: U
A55: of:=CODE([.I55]) -> 86 | B55: 86 | C55: of:=[.A55]=[.B55] -> true | D55: of:=FORMULA([.A55]) -> =CODE(I55) | I55: V
A56: of:=CODE([.I56]) -> 87 | B56: 87 | C56: of:=[.A56]=[.B56] -> true | D56: of:=FORMULA([.A56]) -> =CODE(I56) | I56: W
A57: of:=CODE([.I57]) -> 88 | B57: 88 | C57: of:=[.A57]=[.B57] -> true | D57: of:=FORMULA([.A57]) -> =CODE(I57) | I57: X
A58: of:=CODE([.I58]) -> 89 | B58: 89 | C58: of:=[.A58]=[.B58] -> true | D58: of:=FORMULA([.A58]) -> =CODE(I58) | I58: Y
A59: of:=CODE([.I59]) -> 90 | B59: 90 | C59: of:=[.A59]=[.B59] -> true | D59: of:=FORMULA([.A59]) -> =CODE(I59) | I59: Z
A60: of:=CODE([.I60]) -> 91 | B60: 91 | C60: of:=[.A60]=[.B60] -> true | D60: of:=FORMULA([.A60]) -> =CODE(I60) | I60: [
A61: of:=CODE([.I61]) -> 92 | B61: 92 | C61: of:=[.A61]=[.B61] -> true | D61: of:=FORMULA([.A61]) -> =CODE(I61) | I61: \
A62: of:=CODE([.I62]) -> 93 | B62: 93 | C62: of:=[.A62]=[.B62] -> true | D62: of:=FORMULA([.A62]) -> =CODE(I62) | I62: ]
A63: of:=CODE([.I63]) -> 94 | B63: 94 | C63: of:=[.A63]=[.B63] -> true | D63: of:=FORMULA([.A63]) -> =CODE(I63) | I63: ^
A64: of:=CODE([.I64]) -> 95 | B64: 95 | C64: of:=[.A64]=[.B64] -> true | D64: of:=FORMULA([.A64]) -> =CODE(I64) | I64: _
A65: of:=CODE([.I65]) -> 96 | B65: 96 | C65: of:=[.A65]=[.B65] -> true | D65: of:=FORMULA([.A65]) -> =CODE(I65) | I65: `
A66: of:=CODE([.I66]) -> 97 | B66: 97 | C66: of:=[.A66]=[.B66] -> true | D66: of:=FORMULA([.A66]) -> =CODE(I66) | I66: a
A67: of:=CODE([.I67]) -> 98 | B67: 98 | C67: of:=[.A67]=[.B67] -> true | D67: of:=FORMULA([.A67]) -> =CODE(I67) | I67: b
A68: of:=CODE([.I68]) -> 99 | B68: 99 | C68: of:=[.A68]=[.B68] -> true | D68: of:=FORMULA([.A68]) -> =CODE(I68) | I68: c
A69: of:=CODE([.I69]) -> 100 | B69: 100 | C69: of:=[.A69]=[.B69] -> true | D69: of:=FORMULA([.A69]) -> =CODE(I69) | I69: d
A70: of:=CODE([.I70]) -> 101 | B70: 101 | C70: of:=[.A70]=[.B70] -> true | D70: of:=FORMULA([.A70]) -> =CODE(I70) | I70: e
A71: of:=CODE([.I71]) -> 102 | B71: 102 | C71: of:=[.A71]=[.B71] -> true | D71: of:=FORMULA([.A71]) -> =CODE(I71) | I71: f
A72: of:=CODE([.I72]) -> 103 | B72: 103 | C72: of:=[.A72]=[.B72] -> true | D72: of:=FORMULA([.A72]) -> =CODE(I72) | I72: g
A73: of:=CODE([.I73]) -> 104 | B73: 104 | C73: of:=[.A73]=[.B73] -> true | D73: of:=FORMULA([.A73]) -> =CODE(I73) | I73: h
A74: of:=CODE([.I74]) -> 105 | B74: 105 | C74: of:=[.A74]=[.B74] -> true | D74: of:=FORMULA([.A74]) -> =CODE(I74) | I74: i
A75: of:=CODE([.I75]) -> 106 | B75: 106 | C75: of:=[.A75]=[.B75] -> true | D75: of:=FORMULA([.A75]) -> =CODE(I75) | I75: j
A76: of:=CODE([.I76]) -> 107 | B76: 107 | C76: of:=[.A76]=[.B76] -> true | D76: of:=FORMULA([.A76]) -> =CODE(I76) | I76: k
A77: of:=CODE([.I77]) -> 108 | B77: 108 | C77: of:=[.A77]=[.B77] -> true | D77: of:=FORMULA([.A77]) -> =CODE(I77) | I77: l
A78: of:=CODE([.I78]) -> 109 | B78: 109 | C78: of:=[.A78]=[.B78] -> true | D78: of:=FORMULA([.A78]) -> =CODE(I78) | I78: m
A79: of:=CODE([.I79]) -> 110 | B79: 110 | C79: of:=[.A79]=[.B79] -> true | D79: of:=FORMULA([.A79]) -> =CODE(I79) | I79: n
A80: of:=CODE([.I80]) -> 111 | B80: 111 | C80: of:=[.A80]=[.B80] -> true | D80: of:=FORMULA([.A80]) -> =CODE(I80) | I80: o
A81: of:=CODE([.I81]) -> 112 | B81: 112 | C81: of:=[.A81]=[.B81] -> true | D81: of:=FORMULA([.A81]) -> =CODE(I81) | I81: p
A82: of:=CODE([.I82]) -> 113 | B82: 113 | C82: of:=[.A82]=[.B82] -> true | D82: of:=FORMULA([.A82]) -> =CODE(I82) | I82: q
A83: of:=CODE([.I83]) -> 114 | B83: 114 | C83: of:=[.A83]=[.B83] -> true | D83: of:=FORMULA([.A83]) -> =CODE(I83) | I83: r
A84: of:=CODE([.I84]) -> 115 | B84: 115 | C84: of:=[.A84]=[.B84] -> true | D84: of:=FORMULA([.A84]) -> =CODE(I84) | I84: s
A85: of:=CODE([.I85]) -> 116 | B85: 116 | C85: of:=[.A85]=[.B85] -> true | D85: of:=FORMULA([.A85]) -> =CODE(I85) | I85: t
A86: of:=CODE([.I86]) -> 117 | B86: 117 | C86: of:=[.A86]=[.B86] -> true | D86: of:=FORMULA([.A86]) -> =CODE(I86) | I86: u
A87: of:=CODE([.I87]) -> 118 | B87: 118 | C87: of:=[.A87]=[.B87] -> true | D87: of:=FORMULA([.A87]) -> =CODE(I87) | I87: v
A88: of:=CODE([.I88]) -> 119 | B88: 119 | C88: of:=[.A88]=[.B88] -> true | D88: of:=FORMULA([.A88]) -> =CODE(I88) | I88: w
A89: of:=CODE([.I89]) -> 120 | B89: 120 | C89: of:=[.A89]=[.B89] -> true | D89: of:=FORMULA([.A89]) -> =CODE(I89) | I89: x
A90: of:=CODE([.I90]) -> 121 | B90: 121 | C90: of:=[.A90]=[.B90] -> true | D90: of:=FORMULA([.A90]) -> =CODE(I90) | I90: y
A91: of:=CODE([.I91]) -> 122 | B91: 122 | C91: of:=[.A91]=[.B91] -> true | D91: of:=FORMULA([.A91]) -> =CODE(I91) | I91: z
A92: of:=CODE([.I92]) -> 123 | B92: 123 | C92: of:=[.A92]=[.B92] -> true | D92: of:=FORMULA([.A92]) -> =CODE(I92) | I92: {
A93: of:=CODE([.I93]) -> 124 | B93: 124 | C93: of:=[.A93]=[.B93] -> true | D93: of:=FORMULA([.A93]) -> =CODE(I93) | I93: |
A94: of:=CODE([.I94]) -> 125 | B94: 125 | C94: of:=[.A94]=[.B94] -> true | D94: of:=FORMULA([.A94]) -> =CODE(I94) | I94: }
A95: of:=CODE([.I95]) -> 126 | B95: 126 | C95: of:=[.A95]=[.B95] -> true | D95: of:=FORMULA([.A95]) -> =CODE(I95) | I95: ~
A96: of:=CODE([.I96]) -> 127 | B96: 127 | C96: of:=[.A96]=[.B96] -> true | D96: of:=FORMULA([.A96]) -> =CODE(I96) | I96: 
A97: of:=CODE([.I97]) -> 72 | B97: 72 | C97: of:=[.A97]=[.B97] -> true | D97: of:=FORMULA([.A97]) -> =CODE(I97) | I97: Hello
A98: of:=CODE([.I98]) -> 72 | B98: 72 | C98: of:=[.A98]=[.B98] -> true | D98: of:=FORMULA([.A98]) -> =CODE(I98) | I98: Hello
A99: of:=CODE("Hello") -> 72 | B99: 72 | C99: of:=[.A99]=[.B99] -> true | D99: of:=FORMULA([.A99]) -> =CODE("Hello")

Sheet: 'file:///home/zdenek/Dokumenty/LO/sc-unit-test/Project%20Calc%20functions%20tests/fods/clean.fods/clean.fods/clean.fods/clean.fods/char.fods/char.fods/base.fods/base.fods/asc.fods/arabic.fods/vlookup.fods/hlookup.fods/dstdevp.fods/dstdevp.fods/function_based_test_Example.fods/function_based_test_Example_reference.fods'#Sheet2
H3: 4