Sheet: Sheet1
A1: CORREL Function
A3: Result | B3: of:=AND([.B8:.B95]) -> true
A7: Sheet | B7: Result | C7: Description
A8: 1 | B8: of:=AND([Sheet2.C2:.C349]) -> true | C8: Simple CORREL formulas with local references and values

Sheet: Sheet2
A1: Function | B1: Expected | C1: Correct | D1: FunctionString | E1: Comment | J1: 1 | K1: 2 | M1: Data1 | N1: Data2 | P1: I | Q1: X | R1: Y | X1: X
A2: of:=CORREL([.J1:.J50];[.K1:.K50]) -> 1 | B2: 1 | C2: of:=ROUND([.A2];12)=ROUND([.B2];12) -> true | D2: of:=FORMULA([.A2]) -> =CORREL(J1:J50,K1:K50) | J2: 2 | K2: 3 | M2: 3 | N2: 9 | P2: 1 | X2: 900000000
A3: of:=CORREL([.M2:.M6];[.N2:.N6]) -> 0.997054485501582 | B3: 0.997054485501582 | C3: of:=ROUND([.A3];12)=ROUND([.B3];12) -> true | D3: of:=FORMULA([.A3]) -> =CORREL(M2:M6,N2:N6) | J3: 3 | K3: 4 | M3: 2 | N3: 7 | P3: 2 | Q3: of:=[.$X$2]+[.P3] -> 900000002 | R3: of:=[.$X$2]-[.P3] -> 899999998
A4: of:=CORREL([.Q2:.Q101];[.R2:.R101]) -> -0.99844495050475 | B4: -0.99844495050475 | C4: of:=ROUND([.A4];12)=ROUND([.B4];12) -> true | D4: of:=FORMULA([.A4]) -> =CORREL(Q2:Q101,R2:R101) | J4: 4 | K4: 5 | M4: 4 | N4: 12 | P4: 3 | Q4: of:=[.$X$2]+[.P4] -> 900000003 | R4: of:=[.$X$2]-[.P4] -> 899999997
A5: of:=CORREL({1;2.3;3};{7;16.8;77}) -> 0.844340040960749 | B5: 0.844340040960749 | C5: of:=ROUND([.A5];12)=ROUND([.B5];12) -> true | D5: of:=FORMULA([.A5]) -> =CORREL({1,2.3,3},{7,16.8,77}) | J5: 5 | K5: 6 | M5: 5 | N5: 15 | P5: 4 | Q5: of:=[.$X$2]+[.P5] -> 900000004 | R5: of:=[.$X$2]-[.P5] -> 899999996
J6: 6 | K6: 7 | M6: 6 | N6: 17 | P6: 5 | Q6: of:=[.$X$2]+[.P6] -> 900000005 | R6: of:=[.$X$2]-[.P6] -> 899999995
J7: 7 | K7: 8 | P7: 6 | Q7: of:=[.$X$2]+15 -> 900000015 | R7: of:=[.$X$2]-[.P7] -> 899999994
J8: 8 | K8: 9 | P8: 7 | Q8: of:=[.$X$2]+[.P8] -> 900000007 | R8: of:=[.$X$2]-[.P8] -> 899999993
J9: 9 | K9: 10 | P9: 8 | Q9: of:=[.$X$2]+[.P9] -> 900000008 | R9: of:=[.$X$2]-[.P9] -> 899999992
J10: 10 | K10: 11 | P10: 9 | Q10: of:=[.$X$2]+[.P10] -> 900000009 | R10: of:=[.$X$2]-[.P10] -> 899999991
J11: 11 | K11: 12 | P11: 10 | Q11: of:=[.$X$2]+[.P11] -> 900000010 | R11: of:=[.$X$2]-[.P11] -> 899999990
J12: 12 | K12: 13 | P12: 11 | Q12: of:=[.$X$2]+[.P12] -> 900000011 | R12: of:=[.$X$2]-[.P12] -> 899999989
J13: 13 | K13: 14 | P13: 12 | Q13: of:=[.$X$2]+[.P13] -> 900000012 | R13: of:=[.$X$2]-[.P13] -> 899999988
J14: 14 | K14: 15 | P14: 13 | Q14: of:=[.$X$2]+[.P14] -> 900000013 | R14: of:=[.$X$2]-[.P14] -> 899999987
J15: 15 | K15: 16 | P15: 14 | Q15: of:=[.$X$2]+[.P15] -> 900000014 | R15: of:=[.$X$2]-[.P15] -> 899999986
J16: 16 | K16: 17 | P16: 15 | Q16: of:=[.$X$2]+[.P16] -> 900000015 | R16: of:=[.$X$2]-[.P16] -> 899999985
J17: 17 | K17: 18 | P17: 16 | Q17: of:=[.$X$2]+[.P17] -> 900000016 | R17: of:=[.$X$2]-[.P17] -> 899999984
J18: 18 | K18: 19 | P18: 17 | Q18: of:=[.$X$2]+[.P18] -> 900000017 | R18: of:=[.$X$2]-[.P18] -> 899999983
J19: 19 | K19: 20 | P19: 18 | Q19: of:=[.$X$2]+[.P19] -> 900000018 | R19: of:=[.$X$2]-[.P19] -> 899999982
J20: 20 | K20: 21 | P20: 19 | Q20: of:=[.$X$2]+[.P20] -> 900000019 | R20: of:=[.$X$2]-[.P20] -> 899999981
J21: 21 | K21: 22 | P21: 20 | Q21: of:=[.$X$2]+[.P21] -> 900000020 | R21: of:=[.$X$2]-[.P21] -> 899999980
J22: 22 | K22: 23 | P22: 21 | Q22: of:=[.$X$2]+[.P22] -> 900000021 | R22: of:=[.$X$2]-[.P22] -> 899999979
J23: 23 | K23: 24 | P23: 22 | Q23: of:=[.$X$2]+[.P23] -> 900000022 | R23: of:=[.$X$2]-[.P23] -> 899999978
J24: 24 | K24: 25 | P24: 23 | Q24: of:=[.$X$2]+[.P24] -> 900000023 | R24: of:=[.$X$2]-[.P24] -> 899999977
J25: 25 | K25: 26 | P25: 24 | Q25: of:=[.$X$2]+[.P25] -> 900000024 | R25: of:=[.$X$2]-[.P25] -> 899999976
J26: 26 | K26: 27 | P26: 25 | Q26: of:=[.$X$2]+[.P26] -> 900000025 | R26: of:=[.$X$2]-[.P26] -> 899999975
J27: 27 | K27: 28 | P27: 26 | Q27: of:=[.$X$2]+[.P27] -> 900000026 | R27: of:=[.$X$2]-[.P27] -> 899999974
J28: 28 | K28: 29 | P28: 27 | Q28: of:=[.$X$2]+[.P28] -> 900000027 | R28: of:=[.$X$2]-40 -> 899999960
J29: 29 | K29: 30 | P29: 28 | Q29: of:=[.$X$2]+[.P29] -> 900000028 | R29: of:=[.$X$2]-[.P29] -> 899999972
J30: 30 | K30: 31 | P30: 29 | Q30: of:=[.$X$2]+[.P30] -> 900000029 | R30: of:=[.$X$2]-[.P30] -> 899999971
J31: 31 | K31: 32 | P31: 30 | Q31: of:=[.$X$2]+[.P31] -> 900000030 | R31: of:=[.$X$2]-[.P31] -> 899999970
J32: 32 | K32: 33 | P32: 31 | Q32: of:=[.$X$2]+[.P32] -> 900000031 | R32: of:=[.$X$2]-[.P32] -> 899999969
J33: 33 | K33: 34 | P33: 32 | Q33: of:=[.$X$2]+[.P33] -> 900000032 | R33: of:=[.$X$2]-[.P33] -> 899999968
J34: 34 | K34: 35 | P34: 33 | Q34: of:=[.$X$2]+[.P34] -> 900000033 | R34: of:=[.$X$2]-[.P34] -> 899999967
J35: 35 | K35: 36 | P35: 34 | Q35: of:=[.$X$2]+[.P35] -> 900000034 | R35: of:=[.$X$2]-[.P35] -> 899999966
J36: 36 | K36: 37 | P36: 35 | Q36: of:=[.$X$2]+[.P36] -> 900000035 | R36: of:=[.$X$2]-[.P36] -> 899999965
J37: 37 | K37: 38 | P37: 36 | Q37: of:=[.$X$2]+[.P37] -> 900000036 | R37: of:=[.$X$2]-[.P37] -> 899999964
J38: 38 | K38: 39 | P38: 37 | Q38: of:=[.$X$2]+[.P38] -> 900000037 | R38: of:=[.$X$2]-[.P38] -> 899999963
J39: 39 | K39: 40 | P39: 38 | Q39: of:=[.$X$2]+[.P39] -> 900000038 | R39: of:=[.$X$2]-[.P39] -> 899999962
J40: 40 | K40: 41 | P40: 39 | Q40: of:=[.$X$2]+[.P40] -> 900000039 | R40: of:=[.$X$2]-[.P40] -> 899999961
J41: 41 | K41: 42 | P41: 40 | Q41: of:=[.$X$2]+[.P41] -> 900000040 | R41: of:=[.$X$2]-[.P41] -> 899999960
J42: 42 | K42: 43 | P42: 41 | Q42: of:=[.$X$2]+[.P42] -> 900000041 | R42: of:=[.$X$2]-[.P42] -> 899999959
J43: 43 | K43: 44 | P43: 42 | Q43: of:=[.$X$2]+[.P43] -> 900000042 | R43: of:=[.$X$2]-[.P43] -> 899999958
J44: 44 | K44: 45 | P44: 43 | Q44: of:=[.$X$2]+[.P44] -> 900000043 | R44: of:=[.$X$2]-[.P44] -> 899999957
J45: 45 | K45: 46 | P45: 44 | Q45: of:=[.$X$2]+[.P45] -> 900000044 | R45: of:=[.$X$2]-[.P45] -> 899999956
J46: 46 | K46: 47 | P46: 45 | Q46: of:=[.$X$2]+[.P46] -> 900000045 | R46: of:=[.$X$2]-[.P46] -> 899999955
J47: 47 | K47: 48 | P47: 46 | Q47: of:=[.$X$2]+[.P47] -> 900000046 | R47: of:=[.$X$2]-[.P47] -> 899999954
J48: 48 | K48: 49 | P48: 47 | Q48: of:=[.$X$2]+[.P48] -> 900000047 | R48: of:=[.$X$2]-[.P48] -> 899999953
J49: 49 | K49: 50 | P49: 48 | Q49: of:=[.$X$2]+[.P49] -> 900000048 | R49: of:=[.$X$2]-[.P49] -> 899999952
J50: 50 | K50: 51 | P50: 49 | Q50: of:=[.$X$2]+[.P50] -> 900000049 | R50: of:=[.$X$2]-[.P50] -> 899999951
P51: 50 | Q51: of:=[.$X$2]+[.P51] -> 900000050 | R51: of:=[.$X$2]-[.P51] -> 899999950
P52: 51 | Q52: of:=[.$X$2]+[.P52] -> 900000051 | R52: of:=[.$X$2]-[.P52] -> 899999949
P53: 52 | Q53: of:=[.$X$2]+[.P53] -> 900000052 | R53: of:=[.$X$2]-[.P53] -> 899999948
P54: 53 | Q54: of:=[.$X$2]+[.P54] -> 900000053 | R54: of:=[.$X$2]-[.P54] -> 899999947
P55: 54 | Q55: of:=[.$X$2]+[.P55] -> 900000054 | R55: of:=[.$X$2]-[.P55] -> 899999946
P56: 55 | Q56: of:=[.$X$2]+[.P56] -> 900000055 | R56: of:=[.$X$2]-[.P56] -> 899999945
P57: 56 | Q57: of:=[.$X$2]+[.P57] -> 900000056 | R57: of:=[.$X$2]-[.P57] -> 899999944
P58: 57 | Q58: of:=[.$X$2]+[.P58] -> 900000057 | R58: of:=[.$X$2]-[.P58] -> 899999943
P59: 58 | Q59: of:=[.$X$2]+[.P59] -> 900000058 | R59: of:=[.$X$2]-[.P59] -> 899999942
P60: 59 | Q60: of:=[.$X$2]+[.P60] -> 900000059 | R60: of:=[.$X$2]-[.P60] -> 899999941
P61: 60 | Q61: of:=[.$X$2]+[.P61] -> 900000060 | R61: of:=[.$X$2]-[.P61] -> 899999940
P62: 61 | Q62: of:=[.$X$2]+[.P62] -> 900000061 | R62: of:=[.$X$2]-[.P62] -> 899999939
P63: 62 | Q63: of:=[.$X$2]+[.P63] -> 900000062 | R63: of:=[.$X$2]-[.P63] -> 899999938
P64: 63 | Q64: of:=[.$X$2]+[.P64] -> 900000063 | R64: of:=[.$X$2]-[.P64] -> 899999937
P65: 64 | Q65: of:=[.$X$2]+[.P65] -> 900000064 | R65: of:=[.$X$2]-[.P65] -> 899999936
P66: 65 | Q66: of:=[.$X$2]+[.P66] -> 900000065 | R66: of:=[.$X$2]-[.P66] -> 899999935
P67: 66 | Q67: of:=[.$X$2]+[.P67] -> 900000066 | R67: of:=[.$X$2]-[.P67] -> 899999934
P68: 67 | Q68: of:=[.$X$2]+[.P68] -> 900000067 | R68: of:=[.$X$2]-[.P68] -> 899999933
P69: 68 | Q69: of:=[.$X$2]+[.P69] -> 900000068 | R69: of:=[.$X$2]-[.P69] -> 899999932
P70: 69 | Q70: of:=[.$X$2]+[.P70] -> 900000069 | R70: of:=[.$X$2]-[.P70] -> 899999931
P71: 70 | Q71: of:=[.$X$2]+[.P71] -> 900000070 | R71: of:=[.$X$2]-[.P71] -> 899999930
P72: 71 | Q72: of:=[.$X$2]+[.P72] -> 900000071 | R72: of:=[.$X$2]-[.P72] -> 899999929
P73: 72 | Q73: of:=[.$X$2]+[.P73] -> 900000072 | R73: of:=[.$X$2]-[.P73] -> 899999928
P74: 73 | Q74: of:=[.$X$2]+[.P74] -> 900000073 | R74: of:=[.$X$2]-[.P74] -> 899999927
P75: 74 | Q75: of:=[.$X$2]+[.P75] -> 900000074 | R75: of:=[.$X$2]-[.P75] -> 899999926
P76: 75 | Q76: of:=[.$X$2]+[.P76] -> 900000075 | R76: of:=[.$X$2]-[.P76] -> 899999925
P77: 76 | Q77: of:=[.$X$2]+[.P77] -> 900000076 | R77: of:=[.$X$2]-[.P77] -> 899999924
P78: 77 | Q78: of:=[.$X$2]+[.P78] -> 900000077 | R78: of:=[.$X$2]-[.P78] -> 899999923
P79: 78 | Q79: of:=[.$X$2]+[.P79] -> 900000078 | R79: of:=[.$X$2]-[.P79] -> 899999922
P80: 79 | Q80: of:=[.$X$2]+[.P80] -> 900000079 | R80: of:=[.$X$2]-[.P80] -> 899999921
P81: 80 | Q81: of:=[.$X$2]+[.P81] -> 900000080 | R81: of:=[.$X$2]-[.P81] -> 899999920
P82: 81 | Q82: of:=[.$X$2]+[.P82] -> 900000081 | R82: of:=[.$X$2]-[.P82] -> 899999919
P83: 82 | Q83: of:=[.$X$2]+[.P83] -> 900000082 | R83: of:=[.$X$2]-[.P83] -> 899999918
P84: 83 | Q84: of:=[.$X$2]+[.P84] -> 900000083 | R84: of:=[.$X$2]-[.P84] -> 899999917
P85: 84 | Q85: of:=[.$X$2]+[.P85] -> 900000084 | R85: of:=[.$X$2]-[.P85] -> 899999916
P86: 85 | Q86: of:=[.$X$2]+[.P86] -> 900000085 | R86: of:=[.$X$2]-[.P86] -> 899999915
P87: 86 | Q87: of:=[.$X$2]+[.P87] -> 900000086 | R87: of:=[.$X$2]-[.P87] -> 899999914
P88: 87 | Q88: of:=[.$X$2]+[.P88] -> 900000087 | R88: of:=[.$X$2]-[.P88] -> 899999913
P89: 88 | Q89: of:=[.$X$2]+[.P89] -> 900000088 | R89: of:=[.$X$2]-[.P89] -> 899999912
P90: 89 | Q90: of:=[.$X$2]+[.P90] -> 900000089 | R90: of:=[.$X$2]-[.P90] -> 899999911
P91: 90 | Q91: of:=[.$X$2]+[.P91] -> 900000090 | R91: of:=[.$X$2]-[.P91] -> 899999910
P92: 91 | Q92: of:=[.$X$2]+[.P92] -> 900000091 | R92: of:=[.$X$2]-[.P92] -> 899999909
P93: 92 | Q93: of:=[.$X$2]+[.P93] -> 900000092 | R93: of:=[.$X$2]-[.P93] -> 899999908
P94: 93 | Q94: of:=[.$X$2]+[.P94] -> 900000093 | R94: of:=[.$X$2]-[.P94] -> 899999907
P95: 94 | Q95: of:=[.$X$2]+[.P95] -> 900000094 | R95: of:=[.$X$2]-[.P95] -> 899999906
P96: 95 | Q96: of:=[.$X$2]+[.P96] -> 900000095 | R96: of:=[.$X$2]-[.P96] -> 899999905
P97: 96 | Q97: of:=[.$X$2]+[.P97] -> 900000096 | R97: of:=[.$X$2]-[.P97] -> 899999904
P98: 97 | Q98: of:=[.$X$2]+[.P98] -> 900000097 | R98: of:=[.$X$2]-[.P98] -> 899999903
P99: 98 | Q99: of:=[.$X$2]+[.P99] -> 900000098 | R99: of:=[.$X$2]-[.P99] -> 899999902
P100: 99 | Q100: of:=[.$X$2]+[.P100] -> 900000099 | R100: of:=[.$X$2]-[.P100] -> 899999901
P101: 100 | Q101: of:=[.$X$2]+[.P101] -> 900000100 | R101: of:=[.$X$2]-[.P101] -> 899999900

Sheet: 'file:///home/zdenek/Dokumenty/LO/sc-unit-test/Project%20Calc%20functions%20tests/fods/function_based_test_Example.fods/function_based_test_Example_reference.fods'#Sheet2
H3: 4