Sheet: Sheet1
A1: CUMPRINC Function
A3: Result | B3: of:=AND([.B8:.B95]) -> true
A7: Sheet | B7: Result | C7: Description
A8: 1 | B8: of:=AND([Sheet2.C2:.C49]) -> true | C8: Simple CUMPRINC formulas with local references and values

Sheet: Sheet2
A1: Function | B1: Expected | C1: Correct | D1: FunctionString | E1: Comment | G1: 0 | I1: Data | J1: Description
A2: of:=CUMPRINC(0.055/12;24;5000;4;6;1) -> -600.875855808337 | B2: -600.875855808337 | C2: of:=ROUND([.A2];12)=ROUND([.B2];12) -> true | D2: of:=FORMULA([.A2]) -> =CUMPRINC(0.055/12,24,5000,4,6,1) | G2: 1 | I2: 0.09 | J2: Annual interest rate
A3: of:=CUMPRINC(0.055/12;24;5000;4;6;1) -> -600.875855808337 | B3: -600.875855808337 | C3: of:=ROUND([.A3];12)=ROUND([.B3];12) -> true | D3: of:=FORMULA([.A3]) -> =CUMPRINC(0.055/12,24,5000,4,6,1) | G3: 0.97 | I3: 30 | J3: Years of the loan
A4: of:=CUMPRINC([.I2]/12;[.I3]*12;[.I4];13;24;0) -> -934.107123420898 | B4: -934.107123420898 | C4: of:=ROUND([.A4];12)=ROUND([.B4];12) -> true | D4: of:=FORMULA([.A4]) -> =CUMPRINC(I2/12,I3*12,I4,13,24,0) | I4: 125000 | J4: Present value
A5: of:=CUMPRINC([.I2]/12;[.I3]*12;[.I4];1;1;0) -> -68.2782711809783 | B5: -68.2782711809783 | C5: of:=ROUND([.A5];12)=ROUND([.B5];12) -> true | D5: of:=FORMULA([.A5]) -> =CUMPRINC(I2/12,I3*12,I4,1,1,0)
A6: of:=CUMPRINC(0.055/12;24;-5000;4;6;1) ->  | B6: error | C6: of:=ISERROR([.A6]) -> true | D6: of:=FORMULA([.A6]) -> =CUMPRINC(0.055/12,24,-5000,4,6,1)
A7: of:=CUMPRINC(0.055/12;24;5000;-4;6;1) ->  | B7: error | C7: of:=ISERROR([.A7]) -> true | D7: of:=FORMULA([.A7]) -> =CUMPRINC(0.055/12,24,5000,-4,6,1)
A8: of:=CUMPRINC(0.055/12;24;5000;4;-6;1) ->  | B8: error | C8: of:=ISERROR([.A8]) -> true | D8: of:=FORMULA([.A8]) -> =CUMPRINC(0.055/12,24,5000,4,-6,1)
A9: of:=CUMPRINC(0.055/12;24;5000;4;6;-1) ->  | B9: error | C9: of:=ISERROR([.A9]) -> true | D9: of:=FORMULA([.A9]) -> =CUMPRINC(0.055/12,24,5000,4,6,-1) | E9: type can by 0 or 1 ; tdf100559
A10: of:=CUMPRINC(0.055/12;24;5000;4;6;0) -> -603.629870147459 | B10: -603.629870147459 | C10: of:=ROUND([.A10];12)=ROUND([.B10];12) -> true | D10: of:=FORMULA([.A10]) -> =CUMPRINC(0.055/12,24,5000,4,6,0)
A11: of:=CUMPRINC(0.055/12;24;5000;4;6;) ->  | B11: error | C11: of:=ISERROR([.A11]) -> true | D11: of:=FORMULA([.A11]) -> =CUMPRINC(0.055/12,24,5000,4,6,) | E11: last parametr missing, not allowed; tdf #100559
A12: of:=CUMPRINC(0.055/12;24;5000;4;0;1) ->  | B12: error | C12: of:=ISERROR([.A12]) -> true | D12: of:=FORMULA([.A12]) -> =CUMPRINC(0.055/12,24,5000,4,0,1)
A13: of:=CUMPRINC(0;24;5000;4;6;1) ->  | B13: error | C13: of:=ISERROR([.A13]) -> true | D13: of:=FORMULA([.A13]) -> =CUMPRINC(0,24,5000,4,6,1)
A14: of:=CUMPRINC(0.055/12;0;5000;4;6;1) ->  | B14: error | C14: of:=ISERROR([.A14]) -> true | D14: of:=FORMULA([.A14]) -> =CUMPRINC(0.055/12,0,5000,4,6,1)
A15: of:=CUMPRINC(0.055/12;24;0;4;6;1) ->  | B15: error | C15: of:=ISERROR([.A15]) -> true | D15: of:=FORMULA([.A15]) -> =CUMPRINC(0.055/12,24,0,4,6,1)
A16: of:=CUMPRINC(0.003755;217;50136.32;[.I3];[.I3]+1;0)/2 -> -167.499362412745 | B16: -167.499362412745 | C16: of:=ROUND([.A16];12)=ROUND([.B16];12) -> true | D16: of:=FORMULA([.A16]) -> =CUMPRINC(0.003755,217,50136.32,I3,I3+1,0)/2
A17: of:=CUMPRINC(0.055/12;24;5000;4;6;) ->  | B17: of:=#N/A ->  | C17: of:=ISERROR([.A17]) -> true | D17: of:=FORMULA([.A17]) -> =CUMPRINC(0.055/12,24,5000,4,6,)
A18: of:=CUMPRINC(0.055/12;24;5000;4;6;0) -> -603.629870147459 | B18: -603.629870147459 | C18: of:=ROUND([.A18];12)=ROUND([.B18];12) -> true | D18: of:=FORMULA([.A18]) -> =CUMPRINC(0.055/12,24,5000,4,6,0)
A19: of:=CUMPRINC(0.055/12;24;5000;4;6;1) -> -600.875855808337 | B19: -600.875855808337 | C19: of:=ROUND([.A19];12)=ROUND([.B19];12) -> true | D19: of:=FORMULA([.A19]) -> =CUMPRINC(0.055/12,24,5000,4,6,1)
A20: of:=CUMPRINC(0.055/12;24;5000;4;6;-1) ->  | B20: of:=#NUM! ->  | C20: of:=ISERROR([.A20]) -> true | D20: of:=FORMULA([.A20]) -> =CUMPRINC(0.055/12,24,5000,4,6,-1)
A21: of:=CUMPRINC(0.055/12;24;5000;4;6;[.H25]) -> -603.629870147459 | B21: -603.629870147459 | C21: of:=ROUND([.A21];12)=ROUND([.B21];12) -> true | D21: of:=FORMULA([.A21]) -> =CUMPRINC(0.055/12,24,5000,4,6,H25)
A22: of:=CUMPRINC(0.055/12;24;5000;4;6;[.G1]) -> -603.629870147459 | B22: -603.629870147459 | C22: of:=ROUND([.A22];12)=ROUND([.B22];12) -> true | D22: of:=FORMULA([.A22]) -> =CUMPRINC(0.055/12,24,5000,4,6,G1)
A23: of:=CUMPRINC(0.055/12;24;5000;4;6;[.G2]) -> -600.875855808337 | B23: -600.875855808337 | C23: of:=ROUND([.A23];12)=ROUND([.B23];12) -> true | D23: of:=FORMULA([.A23]) -> =CUMPRINC(0.055/12,24,5000,4,6,G2)
A24: of:=CUMPRINC(0.055/12;24;5000;4;6;[.G3]) ->  | B24: of:=#NUM! ->  | C24: of:=ISERROR([.A24]) -> true | D24: of:=FORMULA([.A24]) -> =CUMPRINC(0.055/12,24,5000,4,6,G3)
E28: CUMPRINC Summary: Calculates a cumulative principal payment. Syntax: CUMPRINC( Number rate ; Number periods ; Number value ; Integer start ; Integer end ; Integer type ) Returns: Currency Constraints: type is one of the following values: 0 , 1

Sheet: 'file:///home/zdenek/Dokumenty/LO/sc-unit-test/Project%20Calc%20functions%20tests/fods/cumprinc.fods/cumprinc.fods/function_based_test_Example.fods/function_based_test_Example_reference.fods'#Sheet2
H3: 4