Sheet: Sheet1
A1: DATEDIF Function
A3: Result | B3: of:=AND([.B8:.B95]) -> true
A7: Sheet | B7: Result | C7: Description
A8: 1 | B8: of:=AND([Sheet2.C2:.C200]) -> true | C8: Simple DATEDIF formulas with local references and values

Sheet: Sheet2
A1: Function | B1: Expected | C1: Correct | D1: FunctionString | E1: Comment | K1: d | L1: m | M1: y | N1: ym | O1: md | P1: yd
A2: of:=DATEDIF([.$K2];[.$L2];[.K$1]) -> 365 | B2: 365 | C2: of:=[.A2]=[.B2] -> true | D2: =DATEDIF($K2;$L2;K$1) | K2: 2011-02-01 | L2: 2012-02-01
A3: of:=DATEDIF([.$K3];[.$L3];[.K$1]) -> 29 | B3: 29 | C3: of:=[.A3]=[.B3] -> true | D3: =DATEDIF($K3;$L3;K$1) | K3: 2012-02-01 | L3: 2012-03-01
A4: of:=DATEDIF([.$K4];[.$L4];[.K$1]) -> 365 | B4: 365 | C4: of:=[.A4]=[.B4] -> true | D4: =DATEDIF($K4;$L4;K$1) | K4: 2012-03-28 | L4: 2013-03-28
A5: of:=DATEDIF([.$K5];[.$L5];[.K$1]) -> 366 | B5: 366 | C5: of:=[.A5]=[.B5] -> true | D5: =DATEDIF($K5;$L5;K$1) | K5: 2012-03-28 | L5: 2013-03-29
A6: of:=DATEDIF([.$K6];[.$L6];[.K$1]) -> 364 | B6: 364 | C6: of:=[.A6]=[.B6] -> true | D6: =DATEDIF($K6;$L6;K$1) | K6: 2012-03-29 | L6: 2013-03-28
A7: of:=DATEDIF([.$K7];[.$L7];[.K$1]) -> 365 | B7: 365 | C7: of:=[.A7]=[.B7] -> true | D7: of:=FORMULA([.A7]) -> =DATEDIF($K7;$L7;K$1) | K7: 2012-02-29 | L7: 2013-02-28
A8: of:=DATEDIF([.$K8];[.$L8];[.K$1]) -> 366 | B8: 366 | C8: of:=[.A8]=[.B8] -> true | D8: of:=FORMULA([.A8]) -> =DATEDIF($K8;$L8;K$1) | K8: 2012-02-29 | L8: 2013-03-01
A9: of:=DATEDIF([.$K9];[.$L9];[.K$1]) -> 366 | B9: 366 | C9: of:=[.A9]=[.B9] -> true | D9: of:=FORMULA([.A9]) -> =DATEDIF($K9;$L9;K$1) | K9: 2011-02-28 | L9: 2012-02-29
A10: of:=DATEDIF([.$K10];[.$L10];[.K$1]) -> 367 | B10: 367 | C10: of:=[.A10]=[.B10] -> true | D10: of:=FORMULA([.A10]) -> =DATEDIF($K10;$L10;K$1) | K10: 2011-02-28 | L10: 2012-03-01
A11: of:=DATEDIF([.$K11];[.$L11];[.K$1]) -> 32 | B11: 32 | C11: of:=[.A11]=[.B11] -> true | D11: of:=FORMULA([.A11]) -> =DATEDIF($K11;$L11;K$1) | K11: 2011-01-28 | L11: 2011-03-01
A12: of:=DATEDIF([.$K12];[.$L12];[.K$1]) -> 31 | B12: 31 | C12: of:=[.A12]=[.B12] -> true | D12: of:=FORMULA([.A12]) -> =DATEDIF($K12;$L12;K$1) | K12: 2011-01-29 | L12: 2011-03-01
A13: of:=DATEDIF([.$K13];[.$L13];[.K$1]) -> 426 | B13: 426 | C13: of:=[.A13]=[.B13] -> true | D13: of:=FORMULA([.A13]) -> =DATEDIF($K13;$L13;K$1) | K13: 2001-01-01 | L13: 2002-03-03
A14: of:=DATEDIF([.$K14];[.$L14];[.K$1]) -> 700 | B14: 700 | C14: of:=[.A14]=[.B14] -> true | D14: of:=FORMULA([.A14]) -> =DATEDIF($K14;$L14;K$1) | K14: 2001-06-05 | L14: 2003-05-06
A15: of:=DATEDIF([.$K15];[.$L15];[.K$1]) -> 304 | B15: 304 | C15: of:=[.A15]=[.B15] -> true | D15: of:=FORMULA([.A15]) -> =DATEDIF($K15;$L15;K$1) | K15: 2001-03-03 | L15: 2002-01-01
A16: of:=DATEDIF([.$K16];[.$L16];[.K$1]) -> 760 | B16: 760 | C16: of:=[.A16]=[.B16] -> true | D16: of:=FORMULA([.A16]) -> =DATEDIF($K16;$L16;K$1) | K16: 2001-05-06 | L16: 2003-06-05
A17: of:=DATEDIF([.$K17];[.$L17];[.K$1]) -> 8724 | B17: 8724 | C17: of:=[.A17]=[.B17] -> true | D17: of:=FORMULA([.A17]) -> =DATEDIF($K17;$L17;K$1) | K17: 1988-06-22 | L17: 2012-05-11
A18: of:=DATEDIF([.$K2];[.$L2];[.L$1]) -> 12 | B18: 12 | C18: of:=[.A18]=[.B18] -> true | D18: of:=FORMULA([.A18]) -> =DATEDIF($K2;$L2;L$1)
A19: of:=DATEDIF([.$K3];[.$L3];[.L$1]) -> 1 | B19: 1 | C19: of:=[.A19]=[.B19] -> true | D19: of:=FORMULA([.A19]) -> =DATEDIF($K3;$L3;L$1)
A20: of:=DATEDIF([.$K4];[.$L4];[.L$1]) -> 12 | B20: 12 | C20: of:=[.A20]=[.B20] -> true | D20: of:=FORMULA([.A20]) -> =DATEDIF($K4;$L4;L$1)
A21: of:=DATEDIF([.$K5];[.$L5];[.L$1]) -> 12 | B21: 12 | C21: of:=[.A21]=[.B21] -> true | D21: of:=FORMULA([.A21]) -> =DATEDIF($K5;$L5;L$1)
A22: of:=DATEDIF([.$K6];[.$L6];[.L$1]) -> 11 | B22: 11 | C22: of:=[.A22]=[.B22] -> true | D22: of:=FORMULA([.A22]) -> =DATEDIF($K6;$L6;L$1)
A23: of:=DATEDIF([.$K7];[.$L7];[.L$1]) -> 11 | B23: 11 | C23: of:=[.A23]=[.B23] -> true | D23: of:=FORMULA([.A23]) -> =DATEDIF($K7;$L7;L$1)
A24: of:=DATEDIF([.$K8];[.$L8];[.L$1]) -> 12 | B24: 12 | C24: of:=[.A24]=[.B24] -> true | D24: of:=FORMULA([.A24]) -> =DATEDIF($K8;$L8;L$1)
A25: of:=DATEDIF([.$K9];[.$L9];[.L$1]) -> 12 | B25: 12 | C25: of:=[.A25]=[.B25] -> true | D25: of:=FORMULA([.A25]) -> =DATEDIF($K9;$L9;L$1)
A26: of:=DATEDIF([.$K10];[.$L10];[.L$1]) -> 12 | B26: 12 | C26: of:=[.A26]=[.B26] -> true | D26: of:=FORMULA([.A26]) -> =DATEDIF($K10;$L10;L$1)
A27: of:=DATEDIF([.$K11];[.$L11];[.L$1]) -> 1 | B27: 1 | C27: of:=[.A27]=[.B27] -> true | D27: of:=FORMULA([.A27]) -> =DATEDIF($K11;$L11;L$1)
A28: of:=DATEDIF([.$K12];[.$L12];[.L$1]) -> 1 | B28: 1 | C28: of:=[.A28]=[.B28] -> true | D28: of:=FORMULA([.A28]) -> =DATEDIF($K12;$L12;L$1)
A29: of:=DATEDIF([.$K13];[.$L13];[.L$1]) -> 14 | B29: 14 | C29: of:=[.A29]=[.B29] -> true | D29: of:=FORMULA([.A29]) -> =DATEDIF($K13;$L13;L$1)
A30: of:=DATEDIF([.$K14];[.$L14];[.L$1]) -> 23 | B30: 23 | C30: of:=[.A30]=[.B30] -> true | D30: of:=FORMULA([.A30]) -> =DATEDIF($K14;$L14;L$1)
A31: of:=DATEDIF([.$K15];[.$L15];[.L$1]) -> 9 | B31: 9 | C31: of:=[.A31]=[.B31] -> true | D31: of:=FORMULA([.A31]) -> =DATEDIF($K15;$L15;L$1)
A32: of:=DATEDIF([.$K16];[.$L16];[.L$1]) -> 24 | B32: 24 | C32: of:=[.A32]=[.B32] -> true | D32: of:=FORMULA([.A32]) -> =DATEDIF($K16;$L16;L$1)
A33: of:=DATEDIF([.$K17];[.$L17];[.L$1]) -> 286 | B33: 286 | C33: of:=[.A33]=[.B33] -> true | D33: of:=FORMULA([.A33]) -> =DATEDIF($K17;$L17;L$1)
A34: of:=DATEDIF([.$K2];[.$L2];[.M$1]) -> 1 | B34: 1 | C34: of:=[.A34]=[.B34] -> true | D34: of:=FORMULA([.A34]) -> =DATEDIF($K2;$L2;M$1)
A35: of:=DATEDIF([.$K3];[.$L3];[.M$1]) -> 0 | B35: 0 | C35: of:=[.A35]=[.B35] -> true | D35: of:=FORMULA([.A35]) -> =DATEDIF($K3;$L3;M$1)
A36: of:=DATEDIF([.$K4];[.$L4];[.M$1]) -> 1 | B36: 1 | C36: of:=[.A36]=[.B36] -> true | D36: of:=FORMULA([.A36]) -> =DATEDIF($K4;$L4;M$1)
A37: of:=DATEDIF([.$K5];[.$L5];[.M$1]) -> 1 | B37: 1 | C37: of:=[.A37]=[.B37] -> true | D37: of:=FORMULA([.A37]) -> =DATEDIF($K5;$L5;M$1)
A38: of:=DATEDIF([.$K6];[.$L6];[.M$1]) -> 0 | B38: 0 | C38: of:=[.A38]=[.B38] -> true | D38: of:=FORMULA([.A38]) -> =DATEDIF($K6;$L6;M$1)
A39: of:=DATEDIF([.$K7];[.$L7];[.M$1]) -> 0 | B39: 0 | C39: of:=[.A39]=[.B39] -> true | D39: of:=FORMULA([.A39]) -> =DATEDIF($K7;$L7;M$1)
A40: of:=DATEDIF([.$K8];[.$L8];[.M$1]) -> 1 | B40: 1 | C40: of:=[.A40]=[.B40] -> true | D40: of:=FORMULA([.A40]) -> =DATEDIF($K8;$L8;M$1)
A41: of:=DATEDIF([.$K9];[.$L9];[.M$1]) -> 1 | B41: 1 | C41: of:=[.A41]=[.B41] -> true | D41: of:=FORMULA([.A41]) -> =DATEDIF($K9;$L9;M$1)
A42: of:=DATEDIF([.$K10];[.$L10];[.M$1]) -> 1 | B42: 1 | C42: of:=[.A42]=[.B42] -> true | D42: of:=FORMULA([.A42]) -> =DATEDIF($K10;$L10;M$1)
A43: of:=DATEDIF([.$K11];[.$L11];[.M$1]) -> 0 | B43: 0 | C43: of:=[.A43]=[.B43] -> true | D43: of:=FORMULA([.A43]) -> =DATEDIF($K11;$L11;M$1)
A44: of:=DATEDIF([.$K12];[.$L12];[.M$1]) -> 0 | B44: 0 | C44: of:=[.A44]=[.B44] -> true | D44: of:=FORMULA([.A44]) -> =DATEDIF($K12;$L12;M$1)
A45: of:=DATEDIF([.$K13];[.$L13];[.M$1]) -> 1 | B45: 1 | C45: of:=[.A45]=[.B45] -> true | D45: of:=FORMULA([.A45]) -> =DATEDIF($K13;$L13;M$1)
A46: of:=DATEDIF([.$K14];[.$L14];[.M$1]) -> 1 | B46: 1 | C46: of:=[.A46]=[.B46] -> true | D46: of:=FORMULA([.A46]) -> =DATEDIF($K14;$L14;M$1)
A47: of:=DATEDIF([.$K15];[.$L15];[.M$1]) -> 0 | B47: 0 | C47: of:=[.A47]=[.B47] -> true | D47: of:=FORMULA([.A47]) -> =DATEDIF($K15;$L15;M$1)
A48: of:=DATEDIF([.$K16];[.$L16];[.M$1]) -> 2 | B48: 2 | C48: of:=[.A48]=[.B48] -> true | D48: of:=FORMULA([.A48]) -> =DATEDIF($K16;$L16;M$1)
A49: of:=DATEDIF([.$K17];[.$L17];[.M$1]) -> 23 | B49: 23 | C49: of:=[.A49]=[.B49] -> true | D49: of:=FORMULA([.A49]) -> =DATEDIF($K17;$L17;M$1)
A50: of:=DATEDIF([.$K2];[.$L2];[.N$1]) -> 0 | B50: 0 | C50: of:=[.A50]=[.B50] -> true | D50: of:=FORMULA([.A50]) -> =DATEDIF($K2;$L2;N$1)
A51: of:=DATEDIF([.$K3];[.$L3];[.N$1]) -> 1 | B51: 1 | C51: of:=[.A51]=[.B51] -> true | D51: of:=FORMULA([.A51]) -> =DATEDIF($K3;$L3;N$1)
A52: of:=DATEDIF([.$K4];[.$L4];[.N$1]) -> 0 | B52: 0 | C52: of:=[.A52]=[.B52] -> true | D52: of:=FORMULA([.A52]) -> =DATEDIF($K4;$L4;N$1)
A53: of:=DATEDIF([.$K5];[.$L5];[.N$1]) -> 0 | B53: 0 | C53: of:=[.A53]=[.B53] -> true | D53: of:=FORMULA([.A53]) -> =DATEDIF($K5;$L5;N$1)
A54: of:=DATEDIF([.$K6];[.$L6];[.N$1]) -> 11 | B54: 11 | C54: of:=[.A54]=[.B54] -> true | D54: of:=FORMULA([.A54]) -> =DATEDIF($K6;$L6;N$1)
A55: of:=DATEDIF([.$K7];[.$L7];[.N$1]) -> 11 | B55: 11 | C55: of:=[.A55]=[.B55] -> true | D55: of:=FORMULA([.A55]) -> =DATEDIF($K7;$L7;N$1)
A56: of:=DATEDIF([.$K8];[.$L8];[.N$1]) -> 0 | B56: 0 | C56: of:=[.A56]=[.B56] -> true | D56: of:=FORMULA([.A56]) -> =DATEDIF($K8;$L8;N$1)
A57: of:=DATEDIF([.$K9];[.$L9];[.N$1]) -> 0 | B57: 0 | C57: of:=[.A57]=[.B57] -> true | D57: of:=FORMULA([.A57]) -> =DATEDIF($K9;$L9;N$1)
A58: of:=DATEDIF([.$K10];[.$L10];[.N$1]) -> 0 | B58: 0 | C58: of:=[.A58]=[.B58] -> true | D58: of:=FORMULA([.A58]) -> =DATEDIF($K10;$L10;N$1)
A59: of:=DATEDIF([.$K11];[.$L11];[.N$1]) -> 1 | B59: 1 | C59: of:=[.A59]=[.B59] -> true | D59: of:=FORMULA([.A59]) -> =DATEDIF($K11;$L11;N$1)
A60: of:=DATEDIF([.$K12];[.$L12];[.N$1]) -> 1 | B60: 1 | C60: of:=[.A60]=[.B60] -> true | D60: of:=FORMULA([.A60]) -> =DATEDIF($K12;$L12;N$1)
A61: of:=DATEDIF([.$K13];[.$L13];[.N$1]) -> 2 | B61: 2 | C61: of:=[.A61]=[.B61] -> true | D61: of:=FORMULA([.A61]) -> =DATEDIF($K13;$L13;N$1)
A62: of:=DATEDIF([.$K14];[.$L14];[.N$1]) -> 11 | B62: 11 | C62: of:=[.A62]=[.B62] -> true | D62: of:=FORMULA([.A62]) -> =DATEDIF($K14;$L14;N$1)
A63: of:=DATEDIF([.$K15];[.$L15];[.N$1]) -> 9 | B63: 9 | C63: of:=[.A63]=[.B63] -> true | D63: of:=FORMULA([.A63]) -> =DATEDIF($K15;$L15;N$1)
A64: of:=DATEDIF([.$K16];[.$L16];[.N$1]) -> 0 | B64: 0 | C64: of:=[.A64]=[.B64] -> true | D64: of:=FORMULA([.A64]) -> =DATEDIF($K16;$L16;N$1)
A65: of:=DATEDIF([.$K17];[.$L17];[.N$1]) -> 10 | B65: 10 | C65: of:=[.A65]=[.B65] -> true | D65: of:=FORMULA([.A65]) -> =DATEDIF($K17;$L17;N$1)
A66: of:=DATEDIF([.$K2];[.$L2];[.O$1]) -> 0 | B66: 0 | C66: of:=[.A66]=[.B66] -> true | D66: of:=FORMULA([.A66]) -> =DATEDIF($K2;$L2;O$1)
A67: of:=DATEDIF([.$K3];[.$L3];[.O$1]) -> 0 | B67: 0 | C67: of:=[.A67]=[.B67] -> true | D67: of:=FORMULA([.A67]) -> =DATEDIF($K3;$L3;O$1)
A68: of:=DATEDIF([.$K4];[.$L4];[.O$1]) -> 0 | B68: 0 | C68: of:=[.A68]=[.B68] -> true | D68: of:=FORMULA([.A68]) -> =DATEDIF($K4;$L4;O$1)
A69: of:=DATEDIF([.$K5];[.$L5];[.O$1]) -> 1 | B69: 1 | C69: of:=[.A69]=[.B69] -> true | D69: of:=FORMULA([.A69]) -> =DATEDIF($K5;$L5;O$1)
A70: of:=DATEDIF([.$K6];[.$L6];[.O$1]) -> 27 | B70: 27 | C70: of:=[.A70]=[.B70] -> true | D70: of:=FORMULA([.A70]) -> =DATEDIF($K6;$L6;O$1)
A71: of:=DATEDIF([.$K7];[.$L7];[.O$1]) -> 30 | B71: 30 | C71: of:=[.A71]=[.B71] -> true | D71: of:=FORMULA([.A71]) -> =DATEDIF($K7;$L7;O$1)
A72: of:=DATEDIF([.$K8];[.$L8];[.O$1]) -> 0 | B72: 0 | C72: of:=[.A72]=[.B72] -> true | D72: of:=FORMULA([.A72]) -> =DATEDIF($K8;$L8;O$1)
A73: of:=DATEDIF([.$K9];[.$L9];[.O$1]) -> 1 | B73: 1 | C73: of:=[.A73]=[.B73] -> true | D73: of:=FORMULA([.A73]) -> =DATEDIF($K9;$L9;O$1)
A74: of:=DATEDIF([.$K10];[.$L10];[.O$1]) -> 2 | B74: 2 | C74: of:=[.A74]=[.B74] -> true | D74: of:=FORMULA([.A74]) -> =DATEDIF($K10;$L10;O$1)
A75: of:=DATEDIF([.$K11];[.$L11];[.O$1]) -> 1 | B75: 1 | C75: of:=[.A75]=[.B75] -> true | D75: of:=FORMULA([.A75]) -> =DATEDIF($K11;$L11;O$1)
A76: of:=DATEDIF([.$K12];[.$L12];[.O$1]) -> 0 | B76: 0 | C76: of:=[.A76]=[.B76] -> true | D76: of:=FORMULA([.A76]) -> =DATEDIF($K12;$L12;O$1)
A77: of:=DATEDIF([.$K13];[.$L13];[.O$1]) -> 2 | B77: 2 | C77: of:=[.A77]=[.B77] -> true | D77: of:=FORMULA([.A77]) -> =DATEDIF($K13;$L13;O$1)
A78: of:=DATEDIF([.$K14];[.$L14];[.O$1]) -> 1 | B78: 1 | C78: of:=[.A78]=[.B78] -> true | D78: of:=FORMULA([.A78]) -> =DATEDIF($K14;$L14;O$1)
A79: of:=DATEDIF([.$K15];[.$L15];[.O$1]) -> 29 | B79: 29 | C79: of:=[.A79]=[.B79] -> true | D79: of:=FORMULA([.A79]) -> =DATEDIF($K15;$L15;O$1)
A80: of:=DATEDIF([.$K16];[.$L16];[.O$1]) -> 30 | B80: 30 | C80: of:=[.A80]=[.B80] -> true | D80: of:=FORMULA([.A80]) -> =DATEDIF($K16;$L16;O$1)
A81: of:=DATEDIF([.$K17];[.$L17];[.O$1]) -> 19 | B81: 19 | C81: of:=[.A81]=[.B81] -> true | D81: of:=FORMULA([.A81]) -> =DATEDIF($K17;$L17;O$1)
A82: of:=DATEDIF([.$K2];[.$L2];[.P$1]) -> 0 | B82: 0 | C82: of:=[.A82]=[.B82] -> true | D82: of:=FORMULA([.A82]) -> =DATEDIF($K2;$L2;P$1)
A83: of:=DATEDIF([.$K3];[.$L3];[.P$1]) -> 29 | B83: 29 | C83: of:=[.A83]=[.B83] -> true | D83: of:=FORMULA([.A83]) -> =DATEDIF($K3;$L3;P$1)
A84: of:=DATEDIF([.$K4];[.$L4];[.P$1]) -> 0 | B84: 0 | C84: of:=[.A84]=[.B84] -> true | D84: of:=FORMULA([.A84]) -> =DATEDIF($K4;$L4;P$1)
A85: of:=DATEDIF([.$K5];[.$L5];[.P$1]) -> 1 | B85: 1 | C85: of:=[.A85]=[.B85] -> true | D85: of:=FORMULA([.A85]) -> =DATEDIF($K5;$L5;P$1)
A86: of:=DATEDIF([.$K6];[.$L6];[.P$1]) -> 364 | B86: 364 | C86: of:=[.A86]=[.B86] -> true | D86: of:=FORMULA([.A86]) -> =DATEDIF($K6;$L6;P$1)
A87: of:=DATEDIF([.$K7];[.$L7];[.P$1]) -> 365 | B87: 365 | C87: of:=[.A87]=[.B87] -> true | D87: of:=FORMULA([.A87]) -> =DATEDIF($K7;$L7;P$1)
A88: of:=DATEDIF([.$K8];[.$L8];[.P$1]) -> 0 | B88: 0 | C88: of:=[.A88]=[.B88] -> true | D88: of:=FORMULA([.A88]) -> =DATEDIF($K8;$L8;P$1)
A89: of:=DATEDIF([.$K9];[.$L9];[.P$1]) -> 1 | B89: 1 | C89: of:=[.A89]=[.B89] -> true | D89: of:=FORMULA([.A89]) -> =DATEDIF($K9;$L9;P$1)
A90: of:=DATEDIF([.$K10];[.$L10];[.P$1]) -> 2 | B90: 2 | C90: of:=[.A90]=[.B90] -> true | D90: of:=FORMULA([.A90]) -> =DATEDIF($K10;$L10;P$1)
A91: of:=DATEDIF([.$K11];[.$L11];[.P$1]) -> 32 | B91: 32 | C91: of:=[.A91]=[.B91] -> true | D91: of:=FORMULA([.A91]) -> =DATEDIF($K11;$L11;P$1)
A92: of:=DATEDIF([.$K12];[.$L12];[.P$1]) -> 31 | B92: 31 | C92: of:=[.A92]=[.B92] -> true | D92: of:=FORMULA([.A92]) -> =DATEDIF($K12;$L12;P$1)
A93: of:=DATEDIF([.$K13];[.$L13];[.P$1]) -> 61 | B93: 61 | C93: of:=[.A93]=[.B93] -> true | D93: of:=FORMULA([.A93]) -> =DATEDIF($K13;$L13;P$1)
A94: of:=DATEDIF([.$K14];[.$L14];[.P$1]) -> 335 | B94: 335 | C94: of:=[.A94]=[.B94] -> true | D94: of:=FORMULA([.A94]) -> =DATEDIF($K14;$L14;P$1)
A95: of:=DATEDIF([.$K15];[.$L15];[.P$1]) -> 304 | B95: 304 | C95: of:=[.A95]=[.B95] -> true | D95: of:=FORMULA([.A95]) -> =DATEDIF($K15;$L15;P$1)
A96: of:=DATEDIF([.$K16];[.$L16];[.P$1]) -> 30 | B96: 30 | C96: of:=[.A96]=[.B96] -> true | D96: of:=FORMULA([.A96]) -> =DATEDIF($K16;$L16;P$1)
A97: of:=DATEDIF([.$K17];[.$L17];[.P$1]) -> 324 | B97: 324 | C97: of:=[.A97]=[.B97] -> true | D97: of:=FORMULA([.A97]) -> =DATEDIF($K17;$L17;P$1)
A98: of:=DATEDIF([.F98];[.G98];[.H98]) -> 9 | B98: 9 | C98: of:=[.A98]=[.B98] -> true | D98: of:=FORMULA([.A98]) -> =DATEDIF(F98;G98;H98) | F98: 2007-01-01 | G98: 2007-01-10 | H98: d
A99: of:=DATEDIF([.F99];[.G99];[.H99]) -> 0 | B99: 0 | C99: of:=[.A99]=[.B99] -> true | D99: of:=FORMULA([.A99]) -> =DATEDIF(F99;G99;H99) | F99: 2007-01-01 | G99: 2007-01-31 | H99: m
A100: of:=DATEDIF([.F100];[.G100];[.H100]) -> 1 | B100: 1 | C100: of:=[.A100]=[.B100] -> true | D100: of:=FORMULA([.A100]) -> =DATEDIF(F100;G100;H100) | F100: 2007-01-01 | G100: 2007-02-01 | H100: m
A101: of:=DATEDIF([.F101];[.G101];[.H101]) -> 1 | B101: 1 | C101: of:=[.A101]=[.B101] -> true | D101: of:=FORMULA([.A101]) -> =DATEDIF(F101;G101;H101) | F101: 2007-01-01 | G101: 2007-02-28 | H101: m
A102: of:=DATEDIF([.F102];[.G102];[.H102]) -> 364 | B102: 364 | C102: of:=[.A102]=[.B102] -> true | D102: of:=FORMULA([.A102]) -> =DATEDIF(F102;G102;H102) | F102: 2007-01-01 | G102: 2007-12-31 | H102: d
A103: of:=DATEDIF([.F103];[.G103];[.H103]) -> 0 | B103: 0 | C103: of:=[.A103]=[.B103] -> true | D103: of:=FORMULA([.A103]) -> =DATEDIF(F103;G103;H103) | F103: 2007-01-01 | G103: 2007-01-31 | H103: y
A104: of:=DATEDIF([.F104];[.G104];[.H104]) -> 547 | B104: 547 | C104: of:=[.A104]=[.B104] -> true | D104: of:=FORMULA([.A104]) -> =DATEDIF(F104;G104;H104) | F104: 2007-01-01 | G104: 2008-07-01 | H104: d
A105: of:=DATEDIF([.F105];[.G105];[.H105]) -> 18 | B105: 18 | C105: of:=[.A105]=[.B105] -> true | D105: of:=FORMULA([.A105]) -> =DATEDIF(F105;G105;H105) | F105: 2007-01-01 | G105: 2008-07-01 | H105: m
A106: of:=DATEDIF([.F106];[.G106];[.H106]) -> 6 | B106: 6 | C106: of:=[.A106]=[.B106] -> true | D106: of:=FORMULA([.A106]) -> =DATEDIF(F106;G106;H106) | F106: 2007-01-01 | G106: 2008-07-01 | H106: ym
A107: of:=DATEDIF([.F107];[.G107];[.H107]) -> 182 | B107: 182 | C107: of:=[.A107]=[.B107] -> true | D107: of:=FORMULA([.A107]) -> =DATEDIF(F107;G107;H107) | F107: 2007-01-01 | G107: 2008-07-01 | H107: yd
A108: of:=DATEDIF([.F108];[.G108];[.H108]) -> 181 | B108: 181 | C108: of:=[.A108]=[.B108] -> true | D108: of:=FORMULA([.A108]) -> =DATEDIF(F108;G108;H108) | F108: 2008-01-01 | G108: 2009-07-01 | H108: yd
A109: of:=DATEDIF([.F109];[.G109];[.H109]) -> 30 | B109: 30 | C109: of:=[.A109]=[.B109] -> true | D109: of:=FORMULA([.A109]) -> =DATEDIF(F109;G109;H109) | F109: 2007-01-01 | G109: 2007-01-31 | H109: md
A110: of:=DATEDIF([.F110];[.G110];[.H110]) -> 0 | B110: 0 | C110: of:=[.A110]=[.B110] -> true | D110: of:=FORMULA([.A110]) -> =DATEDIF(F110;G110;H110) | F110: 2007-02-01 | G110: 2009-03-01 | H110: md
A111: of:=DATEDIF([.F111];[.G111];[.H111]) -> 0 | B111: 0 | C111: of:=[.A111]=[.B111] -> true | D111: of:=FORMULA([.A111]) -> =DATEDIF(F111;G111;H111) | F111: 2008-02-01 | G111: 2009-03-01 | H111: md
A112: of:=DATEDIF([.F112];[.G112];[.H112]) -> 2 | B112: 2 | C112: of:=[.A112]=[.B112] -> true | D112: of:=FORMULA([.A112]) -> =DATEDIF(F112;G112;H112) | E112: tdf#105548 | F112: 2017-01-01T08:00:00 | G112: 2017-01-03T07:00:00 | H112: d

Sheet: 'file:///home/zdenek/Dokumenty/LO/sc-unit-test/Project%20Calc%20functions%20tests/fods/function_based_test_Example.fods/function_based_test_Example_reference.fods'#Sheet2
H3: 4