Sheet: Sheet1
A1: DAYSINMONTH Function
A3: Result | B3: of:=AND([.B8:.B95]) -> 
A7: Sheet | B7: Result | C7: Description
A8: 1 | B8: of:=AND([Sheet2.C2:.C199]) ->  | C8: Simple DAYSINMONTH formulas with local references and values

Sheet: Sheet2
A1: Function | B1: Expected | C1: Correct | D1: FunctionString | E1: Comment
A2: of:=ORG.OPENOFFICE.DAYSINMONTH("1990-01-01") -> 31 | B2: 31 | C2: of:=[.A2]=[.B2] -> true | D2: of:=FORMULA([.A2]) -> =DAYSINMONTH("1990-01-01")
A3: of:=ORG.OPENOFFICE.DAYSINMONTH([.J4]) -> 30 | B3: 30 | C3: of:=[.A3]=[.B3] -> true | D3: of:=FORMULA([.A3]) -> =DAYSINMONTH(J4)
A4: of:=ORG.OPENOFFICE.DAYSINMONTH(date1) -> 30 | B4: 30 | C4: of:=[.A4]=[.B4] -> true | D4: of:=FORMULA([.A4]) -> =DAYSINMONTH(date1) | J4: 2004-09-04T11:40:00
A5: of:=ORG.OPENOFFICE.DAYSINMONTH("Jan1, 2015") ->  | B5: 31 | C5: of:=[.A5]=[.B5] ->  | D5: of:=FORMULA([.A5]) -> =DAYSINMONTH("Jan1, 2015") | E5: locale dependent
A6: of:=ORG.OPENOFFICE.DAYSINMONTH(0) -> 31 | B6: 31 | C6: of:=[.A6]=[.B6] -> true | D6: of:=FORMULA([.A6]) -> =DAYSINMONTH(0)
A7: of:=ORG.OPENOFFICE.DAYSINMONTH("a") ->  | B7: #VALUE! | C7: of:=ISERROR([.A7]) -> true | D7: of:=FORMULA([.A7]) -> =DAYSINMONTH("a")
A8: of:=ORG.OPENOFFICE.DAYSINMONTH([.J8]) -> 31 | B8: 31 | C8: of:=[.A8]=[.B8] -> true | D8: of:=FORMULA([.A8]) -> =DAYSINMONTH(J8) | J8: 0.2
A9: of:=ORG.OPENOFFICE.DAYSINMONTH([.J9]) -> 31 | B9: 31 | C9: of:=[.A9]=[.B9] -> true | D9: of:=FORMULA([.A9]) -> =DAYSINMONTH(J9) | E9: AOO #114061 | J9: 9999-12-31

Sheet: 'file:///home/zdenek/Dokumenty/LO/sc-unit-test/Project%20Calc%20functions%20tests/fods/daysinmonth.fods/daysinmonth.fods/daysinmonth.fods/function_based_test_Example.fods/function_based_test_Example_reference.fods'#Sheet2
H3: 4