Sheet: Sheet1
A1: DAYS360 Function
A3: Result | B3: of:=AND([.B8:.B95]) -> true
A7: Sheet | B7: Result | C7: Description
A8: 1 | B8: of:=AND([Sheet2.C2:.C2]) -> true | C8: Simple DAYS360 formulas with local references and values

Sheet: Sheet2
A1: Function | B1: Expected | C1: Correct | D1: FunctionString | E1: Comment | G1: 2007-02-28 | H1: 2008-02-28 | I1: 2008-02-29 | J1: 2008-04-30
A2: of:=DAYS360([.G$1];[.G$2]) -> 28 | B2: 28 | C2: of:=[.A2]=[.B2] -> true | D2: DAYS360(G$1;G$2) | G2: 2007-03-28 | H2: 2008-03-28 | I2: 2008-03-29 | J2: 2008-05-30
A3: of:=DAYS360([.G$1];[.G$2];0) -> 28 | B3: 28 | C3: of:=[.A3]=[.B3] -> true | D3: DAYS360(G$1;G$2;0)
A4: of:=DAYS360([.G$1];[.G$2];1) -> 30 | B4: 30 | C4: of:=[.A4]=[.B4] -> true | D4: DAYS360(G$1;G$2;1)
A5: of:=DAYS360([.H$1];[.H$2]) -> 30 | B5: 30 | C5: of:=[.A5]=[.B5] -> true | D5: DAYS360(H$1;H$2)
A6: of:=DAYS360([.H$1];[.H$2];0) -> 30 | B6: 30 | C6: of:=[.A6]=[.B6] -> true | D6: DAYS360(H$1;H$2;0)
A7: of:=DAYS360([.H$1];[.H$2];1) -> 30 | B7: 30 | C7: of:=[.A7]=[.B7] -> true | D7: DAYS360(H$1;H$2;1)
A8: of:=DAYS360([.I$1];[.I$2]) -> 29 | B8: 29 | C8: of:=[.A8]=[.B8] -> true | D8: DAYS360(I$1;I$2)
A9: of:=DAYS360([.I$1];[.I$2];0) -> 29 | B9: 29 | C9: of:=[.A9]=[.B9] -> true | D9: DAYS360(I$1;I$2;0)
A10: of:=DAYS360([.I$1];[.I$2];1) -> 30 | B10: 30 | C10: of:=[.A10]=[.B10] -> true | D10: DAYS360(I$1;I$2;1)
A11: of:=DAYS360([.J$1];[.J$2]) -> 30 | B11: 30 | C11: of:=[.A11]=[.B11] -> true | D11: DAYS360(J$1;J$2)
A12: of:=DAYS360([.J$1];[.J$2];0) -> 30 | B12: 30 | C12: of:=[.A12]=[.B12] -> true | D12: DAYS360(J$1;J$2;0)
A13: of:=DAYS360([.J$1];[.J$2];1) -> 30 | B13: 30 | C13: of:=[.A13]=[.B13] -> true | D13: DAYS360(J$1;J$2;1)
A14: of:=DAYS360([.J$1];[.J$2];3) -> 30 | B14: 30 | C14: of:=[.A14]=[.B14] -> true | D14: DAYS360(J$1;J$2;3) | E14: Eike question https://lists.oasis-open.org/archives/office-comment/201605/msg00002.html
A15: of:=DAYS360(date1;date2) -> 28 | B15: 28 | C15: of:=[.A15]=[.B15] -> true | D15: DAYS360(date1;date2)
A16: of:=DAYS360([.J$1];[.J$2];TRUE()) -> 30 | B16: 30 | C16: of:=[.A16]=[.B16] -> true | D16: DAYS360(J$1;J$2;TRUE())

Sheet: 'file:///home/zdenek/Dokumenty/LO/sc-unit-test/Project%20Calc%20functions%20tests/fods/days360.fods/days360.fods/function_based_test_Example.fods/function_based_test_Example_reference.fods'#Sheet2
H3: 4