Sheet: Sheet1
A1: DDB Function
A3: Result | B3: of:=AND([.B8:.B95]) -> true
A7: Sheet | B7: Result | C7: Description
A8: 1 | B8: of:=AND([Sheet2.C2:.C49]) -> true | C8: Simple DDB formulas with local references and values

Sheet: Sheet2
A1: Function | B1: Expected | C1: Correct | D1: FunctionString | E1: Comment | I1: Data | J1: Description
A2: of:=DDB(25000;1000;36;1;6) -> 4166.66666666666 | B2: 4166.66666666666 | C2: of:=[.A2]=[.B2] -> true | D2: of:=FORMULA([.A2]) -> =DDB(25000;1000;36;1;6) | I2: 1000000 | J2: Initial cost
A3: of:=DDB([.I2];[.I3];[.I4];1;7) -> 900000 | B3: 900000 | C3: of:=[.A3]=[.B3] -> true | D3: of:=FORMULA([.A3]) -> =DDB(I2;I3;I4;1;7) | I3: 100000 | J3: Salvage value
A4: of:=DDB([.I2];[.I3];[.I4];2;7) -> 0 | B4: 0 | C4: of:=[.A4]=[.B4] -> true | D4: of:=FORMULA([.A4]) -> =DDB(I2;I3;I4;2;7) | I4: 6 | J4: Lifetime in years
A5: of:=DDB([.I2];[.I3];[.I4];3;7) -> 0 | B5: 0 | C5: of:=[.A5]=[.B5] -> true | D5: of:=FORMULA([.A5]) -> =DDB(I2;I3;I4;3;7)
A6: of:=DDB([.I2];[.I3];[.I4];4;7) -> 0 | B6: 0 | C6: of:=[.A6]=[.B6] -> true | D6: of:=FORMULA([.A6]) -> =DDB(I2;I3;I4;4;7)
A7: of:=DDB([.I2];[.I3];[.I4];5;7) -> 0 | B7: 0 | C7: of:=[.A7]=[.B7] -> true | D7: of:=FORMULA([.A7]) -> =DDB(I2;I3;I4;5;7)
A8: of:=DDB([.I2];[.I3];[.I4];6;7) -> 0 | B8: 0 | C8: of:=[.A8]=[.B8] -> true | D8: of:=FORMULA([.A8]) -> =DDB(I2;I3;I4;6;7)
A9: of:=DDB([.I2];[.I3];[.I4];7;7) ->  | B9: error | C9: of:=ISERROR([.A9]) -> true | D9: of:=FORMULA([.A9]) -> =DDB(I2;I3;I4;7;7)
A10: of:=DDB(-25000;1000;36;1;6) ->  | B10: error | C10: of:=ISERROR([.A10]) -> true | D10: of:=FORMULA([.A10]) -> =DDB(-25000;1000;36;1;6)
A11: of:=DDB(25000;-1000;36;1;6) ->  | B11: error | C11: of:=ISERROR([.A11]) -> true | D11: of:=FORMULA([.A11]) -> =DDB(25000;-1000;36;1;6)
A12: of:=DDB(25000;0;36;1;6) -> 4166.66666666666 | B12: 4166.66666666666 | C12: of:=ROUND([.A12];10)=ROUND([.B12];10) -> true | D12: of:=FORMULA([.A12]) -> =DDB(25000;0;36;1;6)
A13: of:=DDB(25000;1000;0;1;6) ->  | B13: error | C13: of:=ISERROR([.A13]) -> true | D13: of:=FORMULA([.A13]) -> =DDB(25000;1000;0;1;6)
A14: of:=DDB(25000;1000;-1;1;6) ->  | B14: error | C14: of:=ISERROR([.A14]) -> true | D14: of:=FORMULA([.A14]) -> =DDB(25000;1000;-1;1;6)
A15: of:=DDB(25000;1000;36;0;6) ->  | B15: error | C15: of:=ISERROR([.A15]) -> true | D15: of:=FORMULA([.A15]) -> =DDB(25000;1000;36;0;6)
A16: of:=DDB(25000;1000;36;-1;6) ->  | B16: error | C16: of:=ISERROR([.A16]) -> true | D16: of:=FORMULA([.A16]) -> =DDB(25000;1000;36;-1;6)
A17: of:=DDB(25000;1000;36;1;0) ->  | B17: error | C17: of:=ISERROR([.A17]) -> true | D17: of:=FORMULA([.A17]) -> =DDB(25000;1000;36;1;0)
A18: of:=DDB(25000;1000;36;1;13) -> 9027.77777777778 | B18: 9027.77777777778 | C18: of:=[.A18]=[.B18] -> true | D18: of:=FORMULA([.A18]) -> =DDB(25000;1000;36;1;13)
A19: of:=DDB(25000;1000;36;1;-1) ->  | B19: error | C19: of:=ISERROR([.A19]) -> true | D19: of:=FORMULA([.A19]) -> =DDB(25000;1000;36;1;-1)
A20: of:=DDB(75000;1;60;12;2) -> 1721.80586824866 | B20: 1721.80586824866 | C20: of:=ROUND([.A20];4)=ROUND([.B20];4) -> true | D20: of:=FORMULA([.A20]) -> =DDB(75000;1;60;12;2)
A21: of:=DDB(75000;1;60;12;0) ->  | B21: error | C21: of:=ISERROR([.A21]) -> true | D21: of:=FORMULA([.A21]) -> =DDB(75000;1;60;12;0)
A22: of:=DDB(0;1;60;12;2) ->  | B22: error | C22: of:=ISERROR([.A22]) -> true | D22: of:=FORMULA([.A22]) -> =DDB(0;1;60;12;2) | E22: salvage <= cost,
A23: of:=DDB(25000;1;60;12;) ->  | B23: error | C23: of:=ISERROR([.A23]) -> true | D23: of:=FORMULA([.A23]) -> =DDB(25000;1;60;12;) | E23: [ ; Number declinationFactor = 2 ]
A24: of:=DDB(25000;1;60;12) -> 573.935289416218 | B24: 573.935289416218 | C24: of:=[.A24]=[.B24] -> true | D24: of:=FORMULA([.A24]) -> =DDB(25000;1;60;12) | E24: [ ; Number declinationFactor = 2 ]
E28: DDB Summary: Compute the amount of depreciation at a given period of time. Syntax: DDB( Number cost ; Number salvage ; Number lifeTime ; Number period [ ; Number declinationFactor = 2 ] ) Returns: Currency Constraints: cost >= 0, salvage >= 0, salvage <= cost, 1 <= period <= lifeTime, declinationFactor > 0

Sheet: 'file:///home/zdenek/Dokumenty/LO/sc-unit-test/Project%20Calc%20functions%20tests/fods/function_based_test_Example.fods/function_based_test_Example_reference.fods'#Sheet2
H3: 4