Sheet: Sheet1
A1: F.TEST Function
A3: Result | B3: of:=AND([.B8:.B95]) -> 1
A7: Sheet | B7: Result | C7: Description
A8: 1 | B8: of:=AND([$Sheet2.C2:.C349]) -> 1 | C8: Simple F.TEST formulas with local references and values

Sheet: Sheet2
A1: Function | B1: Expected | C1: Correct | D1: FunctionString | E1: Comment | I1: Data1 | J1: Data2 | L1: 0.0000000001 | M1: 1.1
A2: of:=COM.MICROSOFT.F.TEST([.I2:.I6];[.J2:.J6]) -> 0.648317846786175 | B2: 0.648317846786175 | C2: of:=ROUND([.A2];12)=ROUND([.B2];12) -> 1 | D2: of:=FORMULA([.A2]) -> =F.TEST(I2:I6,J2:J6) | I2: 6 | J2: 20 | L2: 0.0000000002 | M2: 1.2
A3: of:=COM.MICROSOFT.F.TEST([.L1:.L29];[.M1:.M29]) -> 4.01165999999994E-245 | B3: 4.0116600000001E-245 | C3: of:=ROUND([.A3];12)=ROUND([.B3];12) -> 1 | D3: of:=FORMULA([.A3]) -> =F.TEST(L1:L29,M1:M29) | I3: 7 | J3: 28 | L3: 0.0000000003 | M3: 1.3
A4: of:=COM.MICROSOFT.F.TEST([.I10:.I12];[.J10:.J12]) -> 0.0625 | B4: 0.0625 | C4: of:=ROUND([.A4];12)=ROUND([.B4];12) -> 1 | D4: of:=FORMULA([.A4]) -> =F.TEST(I10:I12,J10:J12) | I4: 9 | J4: 31 | L4: 0.0000000004 | M4: 1.4
A5: of:=COM.MICROSOFT.F.TEST({5;9;12};{45;56;18}) -> 0.0625 | B5: 0.0625 | C5: of:=ROUND([.A5];12)=ROUND([.B5];12) -> 1 | D5: of:=FORMULA([.A5]) -> =F.TEST({5,9,12},{45,56,18}) | I5: 15 | J5: 38 | L5: 0.0000000005 | M5: 1.5
A6: of:=COM.MICROSOFT.F.TEST(ra1a;ra1b) -> 0.0625 | B6: 0.0625 | C6: of:=ROUND([.A6];12)=ROUND([.B6];12) -> 1 | D6: of:=FORMULA([.A6]) -> =F.TEST(ra1a,ra1b) | I6: 21 | J6: 40 | L6: 0.0000000006 | M6: 1.6
A7: of:=COM.MICROSOFT.F.TEST([.I15:.I17];[.J15:.J17]) ->  | B7: #VALUE! | C7: of:=ISERROR([.A7]) -> 1 | D7: of:=FORMULA([.A7]) -> =F.TEST(I15:I17,J15:J17) | L7: 0.0000000007 | M7: 1.7
A8: of:=COM.MICROSOFT.F.TEST([.I20:.I22];[.J20:.J22]) ->  | B8: #VALUE! | C8: of:=ISERROR([.A8]) -> 1 | D8: of:=FORMULA([.A8]) -> =F.TEST(I20:I22,J20:J22) | L8: 0.0000000008 | M8: 1.8
L9: 0.0000000009 | M9: 1.9
I10: 5 | J10: 45 | L10: 0.000000001 | M10: 2
I11: 9 | J11: 56 | L11: 0.0000000011 | M11: 2.1
I12: 12 | J12: 18 | L12: 0.0000000012 | M12: 2.2
L13: 0.0000000013 | M13: 2.3
L14: 0.0000000014 | M14: 2.4
I15: 0 | J15: 0 | L15: 0.0000000015 | M15: 2.5
I16: 0 | J16: 0 | L16: 0.0000000016 | M16: 2.6
I17: 0 | J17: 0 | L17: 0.0000000017 | M17: 2.7
L18: 0.0000000018 | M18: 2.8
L19: 0.0000000019 | M19: 2.9
I20: 1 | J20: 1 | L20: 0.000000002 | M20: 3
I21: 1 | J21: 1 | L21: 0.0000000021 | M21: 3.1
I22: 1 | J22: 1 | L22: 0.0000000022 | M22: 3.2
L23: 0.0000000023 | M23: 3.3
L24: 0.0000000024 | M24: 3.4
L25: 0.0000000025 | M25: 3.5
L26: 0.0000000026 | M26: 3.6
L27: 0.0000000027 | M27: 3.7
L28: 0.0000000028 | M28: 3.8
L29: 0.0000000029 | M29: 3.9