Sheet: Sheet1
A1: FLOOR.PRECISE Function
A3: Result | B3: of:=AND([.B8:.B95]) -> true
A7: Sheet | B7: Result | C7: Description
A8: 1 | B8: of:=AND([Sheet2.C2:.C81]) -> true | C8: Simple FLOOR.PRECISE formulas with local references and values

Sheet: Sheet2
A1: Function | B1: Expected | C1: Correct | D1: FunctionString | E1: Comment
A2: of:=COM.MICROSOFT.FLOOR.PRECISE(-11;-2) -> -12 | B2: -12 | C2: of:=[.A2]=[.B2] -> true | D2: of:=FORMULA([.A2]) -> =FLOOR.PRECISE(-11,-2)
A3: of:=COM.MICROSOFT.FLOOR.PRECISE(2.5; 1) -> 2 | B3: 2 | C3: of:=[.A3]=[.B3] -> true | D3: of:=FORMULA([.A3]) -> =FLOOR.PRECISE(2.5, 1) | J3: 25
A4: of:=COM.MICROSOFT.FLOOR.PRECISE(-2.5; -2) -> -4 | B4: -4 | C4: of:=[.A4]=[.B4] -> true | D4: of:=FORMULA([.A4]) -> =FLOOR.PRECISE(-2.5, -2)
A5: of:=COM.MICROSOFT.FLOOR.PRECISE(-2.5; 2) -> -4 | B5: -4 | C5: of:=[.A5]=[.B5] -> true | D5: of:=FORMULA([.A5]) -> =FLOOR.PRECISE(-2.5, 2)
A6: of:=COM.MICROSOFT.FLOOR.PRECISE(1.5; 0.1) -> 1.5 | B6: 1.5 | C6: of:=[.A6]=[.B6] -> true | D6: of:=FORMULA([.A6]) -> =FLOOR.PRECISE(1.5, 0.1)
A7: of:=COM.MICROSOFT.FLOOR.PRECISE(0.234; 0.01) -> 0.23 | B7: 0.23 | C7: of:=[.A7]=[.B7] -> true | D7: of:=FORMULA([.A7]) -> =FLOOR.PRECISE(0.234, 0.01)
A8: of:=COM.MICROSOFT.FLOOR.PRECISE([.J$10]) -> 23 | B8: 23 | C8: of:=[.A8]=[.B8] -> true | D8: of:=FORMULA([.A8]) -> =FLOOR.PRECISE(J$10)
A9: of:=COM.MICROSOFT.FLOOR.PRECISE([.J$10];[.$L10]) -> 23 | B9: 23 | C9: of:=[.A9]=[.B9] -> true | D9: of:=FORMULA([.A9]) -> =FLOOR.PRECISE(J$10,$L10)
A10: of:=COM.MICROSOFT.FLOOR.PRECISE([.J$10];[.$L11]) -> 0 | B10: 0 | C10: of:=[.A10]=[.B10] -> true | D10: of:=FORMULA([.A10]) -> =FLOOR.PRECISE(J$10,$L11) | J10: 23.5 | K10: -23.5 | L10: 1
A11: of:=COM.MICROSOFT.FLOOR.PRECISE([.J$10];[.$L10];0) ->  | B11: error | C11: of:=ISERROR([.A11]) -> true | D11: of:=FORMULA([.A11]) -> =FLOOR.PRECISE(J$10,$L10,0) | L11: 0
A12: of:=COM.MICROSOFT.FLOOR.PRECISE([.J$10];[.$L11];0) ->  | B12: error | C12: of:=ISERROR([.A12]) -> true | D12: of:=FORMULA([.A12]) -> =FLOOR.PRECISE(J$10,$L11,0) | L12: -1
A13: of:=COM.MICROSOFT.FLOOR.PRECISE([.J$10];[.$L10];1) ->  | B13: error | C13: of:=ISERROR([.A13]) -> true | D13: of:=FORMULA([.A13]) -> =FLOOR.PRECISE(J$10,$L10,1)
A14: of:=COM.MICROSOFT.FLOOR.PRECISE([.J$10];[.$L11];1) ->  | B14: error | C14: of:=ISERROR([.A14]) -> true | D14: of:=FORMULA([.A14]) -> =FLOOR.PRECISE(J$10,$L11,1)
A15: of:=COM.MICROSOFT.FLOOR.PRECISE([.K$10]) -> -24 | B15: -24 | C15: of:=[.A15]=[.B15] -> true | D15: of:=FORMULA([.A15]) -> =FLOOR.PRECISE(K$10)
A16: of:=COM.MICROSOFT.FLOOR.PRECISE([.K$10];[.$L11]) -> 0 | B16: 0 | C16: of:=[.A16]=[.B16] -> true | D16: of:=FORMULA([.A16]) -> =FLOOR.PRECISE(K$10,$L11)
A17: of:=COM.MICROSOFT.FLOOR.PRECISE([.K$10];[.$L12]) -> -24 | B17: -24 | C17: of:=[.A17]=[.B17] -> true | D17: of:=FORMULA([.A17]) -> =FLOOR.PRECISE(K$10,$L12)
A18: of:=COM.MICROSOFT.FLOOR.PRECISE([.K$10];[.$L10]) -> -24 | B18: -24 | C18: of:=[.A18]=[.B18] -> true | D18: of:=FORMULA([.A18]) -> =FLOOR.PRECISE(K$10,$L10)
A19: of:=COM.MICROSOFT.FLOOR.PRECISE([.J$10];[.$L12]) -> 23 | B19: 23 | C19: of:=[.A19]=[.B19] -> true | D19: of:=FORMULA([.A19]) -> =FLOOR.PRECISE(J$10,$L12)
A20: of:=COM.MICROSOFT.FLOOR.PRECISE(24.3;5) -> 20 | B20: 20 | C20: of:=[.A20]=[.B20] -> true | D20: of:=FORMULA([.A20]) -> =FLOOR.PRECISE(24.3,5)
A21: of:=COM.MICROSOFT.FLOOR.PRECISE(6.7) -> 6 | B21: 6 | C21: of:=[.A21]=[.B21] -> true | D21: of:=FORMULA([.A21]) -> =FLOOR.PRECISE(6.7)
A22: of:=COM.MICROSOFT.FLOOR.PRECISE(-8.1;2) -> -10 | B22: -10 | C22: of:=[.A22]=[.B22] -> true | D22: of:=FORMULA([.A22]) -> =FLOOR.PRECISE(-8.1,2)
A23: of:=COM.MICROSOFT.FLOOR.PRECISE(4.3) -> 4 | B23: 4 | C23: of:=[.A23]=[.B23] -> true | D23: of:=FORMULA([.A23]) -> =FLOOR.PRECISE(4.3)
A24: of:=COM.MICROSOFT.FLOOR.PRECISE(-4.3) -> -5 | B24: -5 | C24: of:=[.A24]=[.B24] -> true | D24: of:=FORMULA([.A24]) -> =FLOOR.PRECISE(-4.3)
A25: of:=COM.MICROSOFT.FLOOR.PRECISE(4.3;2) -> 4 | B25: 4 | C25: of:=[.A25]=[.B25] -> true | D25: of:=FORMULA([.A25]) -> =FLOOR.PRECISE(4.3,2)
A26: of:=COM.MICROSOFT.FLOOR.PRECISE(4.3;-2) -> 4 | B26: 4 | C26: of:=[.A26]=[.B26] -> true | D26: of:=FORMULA([.A26]) -> =FLOOR.PRECISE(4.3,-2)
A27: of:=COM.MICROSOFT.FLOOR.PRECISE(-4.3;2) -> -6 | B27: -6 | C27: of:=[.A27]=[.B27] -> true | D27: of:=FORMULA([.A27]) -> =FLOOR.PRECISE(-4.3,2)
A28: of:=COM.MICROSOFT.FLOOR.PRECISE(-4.3;-2) -> -6 | B28: -6 | C28: of:=[.A28]=[.B28] -> true | D28: of:=FORMULA([.A28]) -> =FLOOR.PRECISE(-4.3,-2)

Sheet: 'file:///home/zdenek/Dokumenty/LO/sc-unit-test/Project%20Calc%20functions%20tests/fods/ceiling.precise.fods/ceiling.precise.fods/ceiling.math.fods/ceiling.math.fods/ceiling.fods/ceiling.fods/bitor.fods/bitand.fods/bitand.fods/atan.fods/asinh.fods/asin.fods/acos.fods/abs.fods/abs.fods/xor.fods/xor.fods/not.fods/ifna.fods/ifna.fods/iferror.fods/iferror.fods/if.fods/and.fods/and.fods/and.fods/and.fods/type.fods/isna.fods/isna.fods/islogical.fods/isformula.fods/iserr.fods/isblank.fods/info.fods/formula.fods/formula.fods/current.fods/cell.fods/cell.fods/minute.fods/minute.fods/year.fods/function_based_test_Example.fods/function_based_test_Example_reference.fods'#Sheet2
H3: 4

Sheet: 'file:///home/zdenek/Dokumenty/LO/sc-unit-test/Project%20Calc%20functions%20tests/fods/ceiling.precise.fods/ceiling.precise.fods/ceiling.math.fods/ceiling.math.fods/ceiling.fods/ceiling.fods/bitor.fods/bitand.fods/bitand.fods/atan.fods/asinh.fods/asin.fods/acos.fods/abs.fods/abs.fods/xor.fods/xor.fods/not.fods/ifna.fods/ifna.fods/iferror.fods/iferror.fods/if.fods/and.fods/and.fods/and.fods/and.fods/type.fods/isna.fods/isna.fods/islogical.fods/isformula.fods/sc-unit-test/information-functions.ods'#Information
O7: O5