Sheet: Sheet1
A1: Excel2016 functions
A3: result | B3: of:=AND([.B8:.B95]) -> true
A7: sheetNo (starting with 0) | B7: result | C7: description
A8: 1 | B8: of:=AND([Sheet2.C14:.C17]) -> true | C8: CONCAT
A9: 1 | B9: of:=AND([Sheet2.C18:.C21]) -> true | C9: TEXTJOIN
A10: 1 | B10: of:=AND([Sheet2.C22];[.C33]) -> true | C10: IFS
A11: 1 | B11: of:=AND([Sheet2.C34:.C60]) -> true | C11: SWITCH
A12: 1 | B12: of:=AND([Sheet2.C2:.C7]) -> true | C12: MINIFS
A13: 1 | B13: of:=AND([Sheet2.C8:.C13]) -> true | C13: MAXIFS
C15: FORECAST.ETS functions not included in test document because of different forecasting algorithms in Excel and Calc

Sheet: Sheet2
A1: Function | B1: Expected | C1: Correct | D1: FunctionString | E1: Comment
A2: of:=COM.MICROSOFT.MINIFS([$data.A1:.A6];[$data.B1:.B6];1) -> 88 | B2: 88 | C2: of:=([$Sheet2.A2]=[$Sheet2.B2]) -> 1 | D2: =MINIFS($data.A1:A6;$data.B1:B6;1)
A3: of:=COM.MICROSOFT.MINIFS([$data.A8:.A12];[$data.B9:.B13];"a") -> 1 | B3: 1 | C3: of:=([$Sheet2.A3]=[$Sheet2.B3]) -> 1 | D3: =MINIFS($data.A8:A12;$data.B9:B13;"a")
A4: of:=COM.MICROSOFT.MINIFS([$data.A15:.A20];[$data.B15:.B20];"b";[$data.D15:.D20];">100") -> 13 | B4: 13 | C4: of:=([$Sheet2.A4]=[$Sheet2.B4]) -> 1 | D4: =MINIFS($data.A15:A20;$data.B15:B20;"b";$data.D15:D20;">100")
A5: of:=COM.MICROSOFT.MINIFS([$data.A22:.A27];[$data.B22:.B27];"b";[$data.D22:.D27];[$data.A28]) -> 1 | B5: 1 | C5: of:=IFERROR([$Sheet2.A5];1) -> 1 | D5: =MINIFS($data.A22:A27;$data.B22:B27;"b";$data.D22:D27;$data.A28)
A6: of:=COM.MICROSOFT.MINIFS([$data.A29:.A33];[$data.B29:.C34];"a") ->  | B6: #VALUE! | C6: of:=IF(ISERROR([$Sheet2.A6]);1;0) -> 1 | D6: =MINIFS($data.A29:A33;$data.B29:C34;"a")
A7: of:=COM.MICROSOFT.MINIFS([$data.A36:.A40];[$data.B36:.B40];"a";[$data.D36:.D40];">200") -> 0 | B7: 0 | C7: of:=([$Sheet2.A7]=[$Sheet2.B7]) -> 1 | D7: =MINIFS($data.A36:A40;$data.B36:B40;"a";$data.D36:D40;">200")
A8: of:=COM.MICROSOFT.MAXIFS([$data.A1:.A6];[$data.B1:.B6];1) -> 91 | B8: 91 | C8: of:=([$Sheet2.A8]=[$Sheet2.B8]) -> 1 | D8: =MAXIFS($data.A1:A6;$data.B1:B6;1)
A9: of:=COM.MICROSOFT.MAXIFS([$data.C8:.C12];[$data.B9:.B13];"a") -> 10 | B9: 10 | C9: of:=([$Sheet2.A9]=[$Sheet2.B9]) -> 1 | D9: =MAXIFS($data.C8:C12;$data.B9:B13;"a")
A10: of:=COM.MICROSOFT.MAXIFS([$data.A43:.A48];[$data.B43:.B48];"b";[$data.D43:.D48];">100") -> 50 | B10: 50 | C10: of:=([$Sheet2.A10]=[$Sheet2.B10]) -> 1 | D10: =MAXIFS($data.A43:A48;$data.B43:B48;"b";$data.D43:D48;">100")
A11: of:=COM.MICROSOFT.MAXIFS([$data.A50:.A55];[$data.B50:.B55];"b";[$data.D50:.D55];[$data.A28]) -> 12 | B11: 12 | C11: of:=([$Sheet2.A11]=[$Sheet2.B11]) -> 1 | D11: =MAXIFS($data.A50:A55;$data.B50:B55;"b";$data.D50:D55;$data.A28)
A12: of:=COM.MICROSOFT.MAXIFS([$data.A29:.A33];[$data.B29:.C34];"a") ->  | B12: #VALUE! | C12: of:=IF(ISERROR([$Sheet2.A12]);1;0) -> 1 | D12: =MAXIFS($data.A29:A33;$data.B29:C34;"a")
A13: of:=COM.MICROSOFT.MAXIFS([$data.A36:.A40];[$data.B36:.B40];"a";[$data.D36:.D40];">200") -> 0 | B13: 0 | C13: of:=([$Sheet2.A13]=[$Sheet2.B13]) -> 1 | D13: =MAXIFS($data.A36:A40;$data.B36:B40;"a";$data.D36:D40;">200")
A14: of:=COM.MICROSOFT.CONCAT([$data.H11:.I13]) -> a1bc3 | B14: a1bc3 | C14: of:=([$Sheet2.A14]=[$Sheet2.B14]) -> 1 | D14: =CONCAT($data.H11:I13)
A15: of:=COM.MICROSOFT.CONCAT([$data.H$1:.H$1048576]) -> abcdelast_row_but_onelast_row | B15: abcdelast_row_but_onelast_row | C15: of:=([$Sheet2.A15]=[$Sheet2.B15]) -> 1 | D15: =CONCAT($data.H:H)
A16: of:=COM.MICROSOFT.CONCAT([$data.I$1:.I$1048576]) -> 1345 | B16: 1345 | C16: of:=([$Sheet2.A16]=[$Sheet2.B16]) -> 1 | D16: =CONCAT($data.I:I)
A17: of:=COM.MICROSOFT.CONCAT([$data.H$1:.I$1048576]) -> a1bc3d4e5last_row_but_onelast_row | B17: a1bc3d4e5last_row_but_onelast_row | C17: of:=([$Sheet2.A17]=[$Sheet2.B17]) -> 1 | D17: =CONCAT($data.H:I)
A18: of:=COM.MICROSOFT.TEXTJOIN("-";1;[$data.H11:.I13]) -> a-1-b-c-3 | B18: a-1-b-c-3 | C18: of:=([$Sheet2.A18]=[$Sheet2.B18]) -> 1 | D18: =TEXTJOIN("-";1;$data.H11:I13)
A19: of:=COM.MICROSOFT.TEXTJOIN("-";0;[$data.H11:.I13]) -> a-1-b--c-3 | B19: a-1-b--c-3 | C19: of:=([$Sheet2.A19]=[$Sheet2.B19]) -> 1 | D19: =TEXTJOIN("-";0;$data.H11:I13)
A20: of:=COM.MICROSOFT.TEXTJOIN(".";1;[$data.H$1:.H$1048576]) -> a.b.c.d.e.last_row_but_one.last_row | B20: a.b.c.d.e.last_row_but_one.last_row | C20: of:=([$Sheet2.A20]=[$Sheet2.B20]) -> 1 | D20: =TEXTJOIN(".";1;$data.H:H)
A21: of:=COM.MICROSOFT.TEXTJOIN([$data.F11:.G12];1;[$data.H11:.I15]) -> a-1:b;c,3-d:4;e,5 | B21: a-1:b;c,3-d:4;e,5 | C21: of:=([$Sheet2.A21]=[$Sheet2.B21]) -> 1 | D21: =TEXTJOIN($data.F11:G12;1;$data.H11:I15)
A22: of:=COM.MICROSOFT.IFS([$data.F17]>89;"A";[$data.F17]>79;"B";[$data.F17]>69;"C";[$data.F17]>59;"D";1;"F") -> B | B22: B | C22: of:=([$Sheet2.A22]=[$Sheet2.B22]) -> 1 | D22: =IFS($data.F17>89;"A";$data.F17>79;"B";$data.F17>69;"C";$data.F17>59;"D";1;"F")
A23: of:=COM.MICROSOFT.IFS([$data.F18]>89;"A";[$data.F18]>79;"B";[$data.F18]>69;"C";[$data.F18]>59;"D";1;"F") -> A | B23: A | C23: of:=([$Sheet2.A23]=[$Sheet2.B23]) -> 1 | D23: =IFS($data.F18>89;"A";$data.F18>79;"B";$data.F18>69;"C";$data.F18>59;"D";1;"F")
A24: of:=COM.MICROSOFT.IFS([$data.F19]>89;"A";[$data.F19]>79;"B";[$data.F19]>69;"C";[$data.F19]>59;"D";1;"F") -> D | B24: D | C24: of:=([$Sheet2.A24]=[$Sheet2.B24]) -> 1 | D24: =IFS($data.F19>89;"A";$data.F19>79;"B";$data.F19>69;"C";$data.F19>59;"D";1;"F")
A25: of:=COM.MICROSOFT.IFS([$data.F20]>89;"A";[$data.F20]>79;"B";[$data.F20]>69;"C";[$data.F20]>59;"D";1;"F") -> C | B25: C | C25: of:=([$Sheet2.A25]=[$Sheet2.B25]) -> 1 | D25: =IFS($data.F20>89;"A";$data.F20>79;"B";$data.F20>69;"C";$data.F20>59;"D";1;"F")
A26: of:=COM.MICROSOFT.IFS([$data.F21]>89;"A";[$data.F21]>79;"B";[$data.F21]>69;"C";[$data.F21]>59;"D";1=1;"F") -> F | B26: F | C26: of:=([$Sheet2.A26]=[$Sheet2.B26]) -> 1 | D26: =IFS($data.F21>89;"A";$data.F21>79;"B";$data.F21>69;"C";$data.F21>59;"D";1=1;"F")
A27: of:=COM.MICROSOFT.IFS([$data.F22]>89;"A";[$data.F22]>79;"B";[$data.F22]>69;"C";[$data.F22]>59;"D";1;"F") -> F | B27: F | C27: of:=([$Sheet2.A27]=[$Sheet2.B27]) -> 1 | D27: =IFS($data.F22>89;"A";$data.F22>79;"B";$data.F22>69;"C";$data.F22>59;"D";1;"F")
A28: of:=COM.MICROSOFT.IFS([$data.G30]=1;[$data.F29];[$data.G30]=2;[$data.F30];[$data.G30]=3;[$data.F31];[$data.G30]=4;[$data.F32];[$data.G30]=5;[$data.F33];[$data.G30]=6;[$data.F34];[$data.G30]=7;[$data.F35]) -> Sunday | B28: Sunday | C28: of:=([$Sheet2.A28]=[$Sheet2.B28]) -> 1 | D28: =IFS($data.G30=1;$data.F29;$data.G30=2;$data.F30;$data.G30=3;$data.F31;$data.G30=4;$data.F32;$data.G30=5;$data.F33;$data.G30=6;$data.F34;$data.G30=7;$data.F35)
A29: of:=COM.MICROSOFT.IFS([$data.F24]>4;"Ok";[$data.F25]>4;"Ok";[$data.F26]>4;"Ok") ->  | B29: of:=#N/A ->  | C29: of:=IF(ISNA([$Sheet2.A29]);1;0) -> 1 | D29: =IFS($data.F24>4;"Ok";$data.F25>4;"Ok";$data.F26>4;"Ok")
A30: of:=COM.MICROSOFT.IFS(0;1/0;10;2) -> 2 | B30: 2 | C30: of:=([$Sheet2.A30]=[$Sheet2.B30]) -> 1 | D30: =IFS(0;1/0;10;2)
A31: of:=COM.MICROSOFT.IFS(1/0;1/0;1;2) ->  | B31: of:=#DIV/0! ->  | C31: of:=IF(ISERROR([$Sheet2.A31]);1;0) -> 1 | D31: =IFS(1/0;1/0;1;2)
A32: of:=COM.MICROSOFT.IFS(0;1/0;1/0;2) ->  | B32: of:=#DIV/0! ->  | C32: of:=IF(ISERROR([$Sheet2.A32]);1;0) -> 1 | D32: =IFS(0;1/0;1/0;2)
A33: of:=1+COM.MICROSOFT.IFS(0;3;1;11;1/0;40;TRUE();99) -> 12 | B33: 12 | C33: of:=([$Sheet2.A33]=[$Sheet2.B33]) -> 1 | D33: =1+IFS(0;3;1;11;1/0;40;TRUE();99)
A34: of:=COM.MICROSOFT.SWITCH(0;1/0;2;0;4) ->  | B34: of:=#DIV/0! ->  | C34: of:=IF(ISERROR([$Sheet2.A34]);1;0) -> 1 | D34: =SWITCH(0;1/0;2;0;4)
A35: of:=COM.MICROSOFT.SWITCH(0;1/0;20;1/0;4) ->  | B35: of:=#DIV/0! ->  | C35: of:=IF(ISERROR([$Sheet2.A35]);1;0) -> 1 | D35: =SWITCH(0;1/0;20;1/0;4)
A36: of:=COM.MICROSOFT.SWITCH(0;1/0;20;1/0;40;5) ->  | B36: of:=#DIV/0! ->  | C36: of:=IF(ISERROR([$Sheet2.A36]);1;0) -> 1 | D36: =SWITCH(0;1/0;20;1/0;40;5)
A37: of:=COM.MICROSOFT.SWITCH(1;1;11;1/0;22) -> 11 | B37: 11 | C37: of:=([$Sheet2.A37]=[$Sheet2.B37]) -> 1 | D37: =SWITCH(1;1;11;1/0;22)
A38: of:=1+COM.MICROSOFT.SWITCH(2;1;11;2;22;3;33;44) -> 23 | B38: 23 | C38: of:=([$Sheet2.A38]=[$Sheet2.B38]) -> 1 | D38: =1+SWITCH(2;1;11;2;22;3;33;44)
A39: of:=COM.MICROSOFT.SWITCH([$data.F43];1;"Sunday";2;"Monday";3;"Tuesday";4;"Wednesday") ->  | B39: of:=#DIV/0! ->  | C39: of:=IF(ISERROR([$Sheet2.A39]);1;0) -> 1 | D39: =SWITCH($data.F43;1;"Sunday";2;"Monday";3;"Tuesday";4;"Wednesday")
A40: of:=COM.MICROSOFT.SWITCH([$data.F44];1;"Sunday";2;"Monday";3;"Tuesday";4;"Wednesday";"No match") -> No match | B40: No match | C40: of:=([$Sheet2.A40]=[$Sheet2.B40]) -> 1 | D40: =SWITCH($data.F44;1;"Sunday";2;"Monday";3;"Tuesday";4;"Wednesday";"No match")
A41: of:=COM.MICROSOFT.SWITCH([$data.F45];1;"Sunday";7;"Saturday";"weekday") -> weekday | B41: weekday | C41: of:=([$Sheet2.A41]=[$Sheet2.B41]) -> 1 | D41: =SWITCH($data.F45;1;"Sunday";7;"Saturday";"weekday")
A42: of:=COM.MICROSOFT.SWITCH([$data.F46];1;"Sunday";2;"Monday";3;"Tuesday";4;"Wednesday";"No match") -> Tuesday | B42: Tuesday | C42: of:=([$Sheet2.A42]=[$Sheet2.B42]) -> 1 | D42: =SWITCH($data.F46;1;"Sunday";2;"Monday";3;"Tuesday";4;"Wednesday";"No match")
A43: of:=COM.MICROSOFT.SWITCH("x";1;"x1";"other") -> other | B43: other | C43: of:=([$Sheet2.A43]=[$Sheet2.B43]) -> 1 | D43: =SWITCH("x";1;"x1";"other")
A44: of:=COM.MICROSOFT.SWITCH("B";"A";"hit0";"B";"hit2";"not found") -> hit2 | B44: hit2 | C44: of:=([$Sheet2.A44]=[$Sheet2.B44]) -> 1 | D44: =SWITCH("B";"A";"hit0";"B";"hit2";"not found")
A45: of:=COM.MICROSOFT.SWITCH([$data.F40];[$data.F37];"one";[$data.F38];"two";[$data.F39];"three";"no luck") -> two | B45: two | C45: of:=([$Sheet2.A45]=[$Sheet2.B45]) -> 1 | D45: =SWITCH($data.F40;$data.F37;"one";$data.F38;"two";$data.F39;"three";"no luck")
A46: of:=COM.MICROSOFT.SWITCH([$data.F38];[$data.F37];1;[$data.F40];2;[$data.F39];3;"not found") -> 2 | B46: 2 | C46: of:=([$Sheet2.A46]=[$Sheet2.B46]) -> 1 | D46: =SWITCH($data.F38;$data.F37;1;$data.F40;2;$data.F39;3;"not found")
A47: of:=COM.MICROSOFT.SWITCH(2;[$data.F37];"one";[$data.F38];2;[$data.F38];-SQRT(16);FALSE()) -> 2 | B47: 2 | C47: of:=([$Sheet2.A47]=[$Sheet2.B47]) -> 1 | D47: =SWITCH(2;$data.F37;"one";$data.F38;2;$data.F38;-SQRT(16);FALSE())
A48: of:=COM.MICROSOFT.SWITCH([$Sheet2.G55];[$Sheet2.G48:.G54];[$Sheet2.H48:.H54]) ->  | B48: of:=#N/A ->  | C48: of:=IF(ISNA([$Sheet2.A48]);1;0) -> 1 | D48: =SWITCH($Sheet2.E53;$Sheet2.E46:E52;$Sheet2.F46:F52) | G48: 1 | H48: sun | I48: These rows must be kept together because of intersection tests
A49: of:=COM.MICROSOFT.SWITCH([$Sheet2.G55];[$Sheet2.G48:.G54];[$Sheet2.H48:.H54]) ->  | B49: of:=#N/A ->  | C49: of:=IF(ISNA([$Sheet2.A49]);1;0) -> 1 | D49: =SWITCH($Sheet2.E53;$Sheet2.E46:E52;$Sheet2.F46:F52) | G49: 2 | H49: mon
A50: of:=COM.MICROSOFT.SWITCH([$Sheet2.G55];[$Sheet2.G48:.G54];[$Sheet2.H48:.H54]) -> tue | B50: tue | C50: of:=([$Sheet2.A50]=[$Sheet2.B50]) -> 1 | D50: =SWITCH($Sheet2.E53;$Sheet2.E46:E52;$Sheet2.F46:F52) | G50: 3 | H50: tue
A51: of:=COM.MICROSOFT.SWITCH([$Sheet2.E56];[$Sheet2.G49:.G55];[$Sheet2.H49:.H55]) ->  | B51: of:=#N/A ->  | C51: of:=IF(ISNA([$Sheet2.A51]);1;0) -> 1 | D51: =SWITCH($Sheet2.E54;$Sheet2.E47:E53;$Sheet2.F47:F53) | G51: 4 | H51: wed
A52: of:=COM.MICROSOFT.SWITCH([$Sheet2.E57];[$Sheet2.E50:.E56];[$Sheet2.F50:.F56]) -> 0 | B52: 0 | C52: of:=([$Sheet2.A52]=[$Sheet2.B52]) -> 1 | D52: =SWITCH($Sheet2.E55;$Sheet2.E48:E54;$Sheet2.F48:F54) | G52: 5 | H52: thu
A53: of:=COM.MICROSOFT.SWITCH([$Sheet2.E58];[$Sheet2.E51:.E57];[$Sheet2.F51:.F57]) -> 0 | B53: 0 | C53: of:=([$Sheet2.A53]=[$Sheet2.B53]) -> 1 | D53: =SWITCH($Sheet2.E56;$Sheet2.E49:E55;$Sheet2.F49:F55) | G53: 6 | H53: fri
A54: of:=COM.MICROSOFT.SWITCH([$Sheet2.E59];[$Sheet2.E52:.E58];[$Sheet2.F52:.F58]) -> 0 | B54: 0 | C54: of:=([$Sheet2.A54]=[$Sheet2.B54]) -> 1 | D54: =SWITCH($Sheet2.E57;$Sheet2.E50:E56;$Sheet2.F50:F56) | G54: 7 | H54: sat
A55: of:=COM.MICROSOFT.SWITCH("A";"a";"OK";"NOK") -> OK | B55: OK | C55: of:=([$Sheet2.A55]=[$Sheet2.B55]) -> 1 | D55: =SWITCH("A";"a";"OK";"NOK") | G55: 3
A56: of:=COM.MICROSOFT.SWITCH([.G56];"a";"OK";"NOK") -> OK | B56: OK | C56: of:=([$Sheet2.A56]=[$Sheet2.B56]) -> 1 | D56: =SWITCH(G54;"a";"OK";"NOK") | G56: a
A57: of:=COM.MICROSOFT.SWITCH("A";[.G57];"OK";"NOK") -> OK | B57: OK | C57: of:=([$Sheet2.A57]=[$Sheet2.B57]) -> 1 | D57: =SWITCH("A";G55;"OK";"NOK") | G57: A
A58: of:=COM.MICROSOFT.SWITCH(IF(2>4;1;2);1;"NOK";2;"OK") -> OK | B58: OK | C58: of:=([$Sheet2.A58]=[$Sheet2.B58]) -> 1 | D58: =SWITCH(IF(2>4;1;2);1;"NOK";2;"OK")
A59: of:=COM.MICROSOFT.SWITCH(1;IF(2>4;1;2);"NOK";1;"OK";"other") -> OK | B59: OK | C59: of:=([$Sheet2.A59]=[$Sheet2.B59]) -> 1 | D59: =SWITCH(1;IF(2>4;1;2);"NOK";1;"OK";"other")
A60: of:=COM.MICROSOFT.SWITCH([.F60];[.H58:.H60];[.I58:.I60]) -> 0 | B60: 0 | C60: of:=([$Sheet2.A60]=[$Sheet2.B60]) -> 1 | D60: =SWITCH(F58;H56:H58;I56:I58)

Sheet: data
A1: 89 | B1: 1
A2: 93 | B2: 2
A3: 96 | B3: 2
A4: 85 | B4: 3
A5: 91 | B5: 1
A6: 88 | B6: 1
A8: 10 | B8: b | C8: 10
A9: 11 | B9: a | C9: 1
A10: 100 | B10: a | C10: 100
A11: 111 | B11: b | C11: 1 | F11: - | G11: : | H11: a | I11: 1
A12: 1 | B12: a | C12: 1 | F12: ; | G12: , | H12: b
A13: 1 | B13: a | C13: 1 | H13: c | I13: 3
H14: d | I14: 4
A15: 10 | B15: b | C15: Business | D15: 100 | H15: e | I15: 5
A16: 11 | B16: a | C16: Technical | D16: 100
A17: 12 | B17: a | C17: Business | D17: 200 | F17: 89
A18: 13 | B18: b | C18: Technical | D18: 300 | F18: 93
A19: 14 | B19: b | C19: Technical | D19: 300 | F19: 60
A20: 15 | B20: b | C20: Business | D20: 400 | F20: 71
F21: 58
A22: 10 | B22: b | C22: Business | D22: 8 | F22: 58
A23: 1 | B23: a | C23: Technical | D23: 8
A24: 100 | B24: a | C24: Business | D24: 8 | F24: 1
A25: 11 | B25: b | C25: Technical | D25: 0 | F25: 2
A26: 1 | B26: a | C26: Technical | D26: 8 | F26: 3
A27: 1 | B27: b | C27: Business | D27: 0
A29: 10 | B29: b | F29: Sunday
A30: 1 | B30: a | F30: Monday | G30: 1
A31: 100 | B31: a | F31: Tuesday
A32: 1 | B32: b | F32: Wednesday
A33: 1 | B33: a | F33: Thursday
A34: 1 | B34: a | F34: Friday
F35: Saturday
A36: 10 | B36: b | C36: Business | D36: 100
A37: 1 | B37: a | C37: Technical | D37: 100 | F37: 1
A38: 100 | B38: a | C38: Business | D38: 200 | F38: 2
A39: 1 | B39: b | C39: Technical | D39: 300 | F39: 3
A40: 1 | B40: a | C40: Technical | D40: 100 | F40: of:=SQRT(4) -> 2
A41: 1 | B41: a | C41: Business | D41: 400
A43: 10 | B43: b | C43: Business | D43: 100 | F43: 99
A44: 1 | B44: a | C44: Technical | D44: 100 | F44: 99
A45: 100 | B45: a | C45: Business | D45: 200 | F45: 2
A46: 1 | B46: b | C46: Technical | D46: 300 | F46: 3
A47: 1 | B47: a | C47: Technical | D47: 100
A48: 50 | B48: b | C48: Business | D48: 400
A50: 10 | B50: b | C50: Business | D50: 8
A51: 1 | B51: a | C51: Technical | D51: 8
A52: 100 | B52: a | C52: Business | D52: 8
A53: 11 | B53: b | C53: Technical | D53: 0
A54: 1 | B54: a | C54: Technical | D54: 8
A55: 12 | B55: b | C55: Business | D55: 0
H1048575: last_row_but_one
H1048576: last_row