Sheet: Sheet1
A1: FV Function
A3: Result | B3: of:=AND([.B8:.B95]) -> true
A7: Sheet | B7: Result | C7: Description
A8: 1 | B8: of:=AND([Sheet2.C2:.C49]) -> true | C8: Simple FV formulas with local references and values

Sheet: Sheet2
A1: Function | B1: Expected | C1: Correct | D1: FunctionString | E1: Comment | I1: Data | J1: Description | L1: Data | M1: Description | O1: Data | P1: Description | R1: Data | S1: Description
A2: of:=ABS(FV(0.1;12;-100;100)-1824.59)<0.01 -> true | B2: 1 | C2: of:=ROUND([.A2];10)=ROUND([.B2];10) -> true | D2: of:=FORMULA([.A2]) -> =ABS(FV(0.1,12,-100,100)-1824.59)<0.01 | I2: 0.06 | J2: Annual interest rate | L2: 0.12 | M2: Annual interest rate | O2: 0.11 | P2: Annual interest rate | R2: 0.06 | S2: Annual interest rate
A3: of:=FV(0.04;2;750;2500) -> -4234 | B3: -4234 | C3: of:=ROUND([.A3];10)=ROUND([.B3];10) -> true | D3: of:=FORMULA([.A3]) -> =FV(0.04,2,750,2500) | I3: 10 | J3: Number of payments | L3: 12 | M3: Number of payments | O3: 35 | P3: Number of payments | R3: 12 | S3: Number of payments
A4: of:=FV(0.075/12; 2*12; -250; -5000 ;1) -> 12298.4638198035 | B4: 12298.4638198035 | C4: of:=ROUND([.A4];10)=ROUND([.B4];10) -> true | D4: of:=FORMULA([.A4]) -> =FV(0.075/12, 2*12, -250, -5000 ,1) | I4: -200 | J4: Amount of the payment | L4: -1000 | M4: Amount of the payment | O4: -2000 | P4: Amount of the payment | R4: -100 | S4: Amount of the payment
A5: of:=FV(0.06/52; 4*52; -50; -8000; 0) -> 21915.0949710678 | B5: 21915.0949710678 | C5: of:=ROUND([.A5];10)=ROUND([.B5];10) -> true | D5: of:=FORMULA([.A5]) -> =FV(0.06/52, 4*52, -50, -8000, 0) | I5: -500 | J5: Present value | O5: 1 | P5: Payment is due at the beginning of the year (0 indicates end of year) | R5: -1000 | S5: Present value
A6: of:=FV(0.0525/1; 10*1; -100; -6500; 0) -> 12115.1879428082 | B6: 12115.1879428082 | C6: of:=ROUND([.A6];10)=ROUND([.B6];10) -> true | D6: of:=FORMULA([.A6]) -> =FV(0.0525/1, 10*1, -100, -6500, 0) | I6: 1 | J6: Payment is due at the beginning of the period (0 indicates payment is due at end of period) | R6: 1 | S6: Payment is due at the beginning of the year (0 indicates end of year)
A7: of:=FV(0.0525/1; 10*1; -100; -6500; 1) -> 12181.9975443941 | B7: 12181.9975443941 | C7: of:=ROUND([.A7];10)=ROUND([.B7];10) -> true | D7: of:=FORMULA([.A7]) -> =FV(0.0525/1, 10*1, -100, -6500, 1)
A8: of:=FV(0.0525/1; 10*1; -100; -6500; 2) -> 12181.9975443941 | B8: 12181.9975443941 | C8: of:=ROUND([.A8];10)=ROUND([.B8];10) -> true | D8: of:=FORMULA([.A8]) -> =FV(0.0525/1, 10*1, -100, -6500, 2) | E8: PayType: the type of payment, defaults to 0. It is 0 if payments are due at the end of the period; 1 if they are due at the beginning of the period.
A9: of:=FV(0.0525/1; 10*1; -100; -6500; -2) -> 12181.9975443941 | B9: 12181.9975443941 | C9: of:=ROUND([.A9];10)=ROUND([.B9];10) -> true | D9: of:=FORMULA([.A9]) -> =FV(0.0525/1, 10*1, -100, -6500, -2) | E9: PayType should be Logical, not Number. Excel and Gnumeric do the same. https://lists.oasis-open.org/archives/office-comment/201607/msg00004.html
A10: of:=FV(0.0525/1; 10*1; -100; -6500; ) -> 12115.1879428082 | B10: 12115.1879428082 | C10: of:=ROUND([.A10];10)=ROUND([.B10];10) -> true | D10: of:=FORMULA([.A10]) -> =FV(0.0525/1, 10*1, -100, -6500, )
A11: of:=FV(0.0525/1; 10*1; -100; -6500) -> 12115.1879428082 | B11: 12115.1879428082 | C11: of:=ROUND([.A11];10)=ROUND([.B11];10) -> true | D11: of:=FORMULA([.A11]) -> =FV(0.0525/1, 10*1, -100, -6500)
A12: of:=FV(0.0525/1; 10*1; -100; ) -> 1272.56383972991 | B12: 1272.56383972991 | C12: of:=ROUND([.A12];10)=ROUND([.B12];10) -> true | D12: of:=FORMULA([.A12]) -> =FV(0.0525/1, 10*1, -100, )
A13: of:=FV(0.0525/1; 10*1; -100;0;0 ) -> 1272.56383972991 | B13: 1272.56383972991 | C13: of:=ROUND([.A13];10)=ROUND([.B13];10) -> true | D13: of:=FORMULA([.A13]) -> =FV(0.0525/1, 10*1, -100,0,0 )
A14: of:=FV(0.0525/1; 10*1; -100 ) -> 1272.56383972991 | B14: 1272.56383972991 | C14: of:=ROUND([.A14];10)=ROUND([.B14];10) -> true | D14: of:=FORMULA([.A14]) -> =FV(0.0525/1, 10*1, -100 )
A15: of:=FV(0.0525/1; 10*1; -100; ; 0) -> 1272.56383972991 | B15: 1272.56383972991 | C15: of:=ROUND([.A15];10)=ROUND([.B15];10) -> true | D15: of:=FORMULA([.A15]) -> =FV(0.0525/1, 10*1, -100, , 0)
A16: of:=FV([.I2]/12; [.I3]; [.I4]; [.I5]; [.I6]) -> 2581.40337406014 | B16: 2581.40337406014 | C16: of:=ROUND([.A16];10)=ROUND([.B16];10) -> true | D16: of:=FORMULA([.A16]) -> =FV(I2/12, I3, I4, I5, I6)
A17: of:=FV([.L2]/12;[.L3]; [.L4]) -> 12682.503013197 | B17: 12682.503013197 | C17: of:=ROUND([.A17];10)=ROUND([.B17];10) -> true | D17: of:=FORMULA([.A17]) -> =FV(L2/12,L3, L4)
A18: of:=FV([.O2]/12; [.O3]; [.O4];; [.O5]) -> 82846.2463719006 | B18: 82846.2463719006 | C18: of:=ROUND([.A18];10)=ROUND([.B18];10) -> true | D18: of:=FORMULA([.A18]) -> =FV(O2/12, O3, O4,, O5)
A19: of:=FV([.R2]/12; [.R3]; [.R4]; [.R5]; [.R6]) -> 2301.40183034091 | B19: 2301.40183034091 | C19: of:=ROUND([.A19];10)=ROUND([.B19];10) -> true | D19: of:=FORMULA([.A19]) -> =FV(R2/12, R3, R4, R5, R6)
E20: FV Summary: Compute the future value (FV) of an investment. Syntax: FV( Number Rate ; Number Nper ; Number Payment [ ; [ Number Pv = 0 ] [ ; Number PayType = 0 ] ] ) Returns: Currency Constraints: None. Semantics: Computes the future value of an investment. The parameters are: Rate: the interest rate per period. Nper: the total number of payment periods. Payment: the payment made in each period. Pv: the present value; default is 0. PayType: the type of payment, defaults to 0. It is 0 if payments are due at the end of the period; 1 if they are due at the beginning of the period.

Sheet: 'file:///home/zdenek/Dokumenty/LO/sc-unit-test/Project%20Calc%20functions%20tests/fods/fv.fods/fv.fods/function_based_test_Example.fods/function_based_test_Example_reference.fods'#Sheet2
H3: 4