Sheet: Sheet1
A1: HOUR Function
A3: Result | B3: of:=AND([.B8:.B95]) -> true
A7: Sheet | B7: Result | C7: Description
A8: 1 | B8: of:=AND([Sheet2.C2:.C49]) -> true | C8: Simple HOUR formulas with local references and values
C13: https://help.libreoffice.org/Calc/HOUR

Sheet: Sheet2
A1: Function | B1: Expected | C1: Correct | D1: FunctionString | E1: Comment
A2: of:=HOUR([.J3]) -> 17 | B2: 17 | C2: of:=[.A2]=[.B2] -> true | D2: of:=FORMULA([.A2]) -> =HOUR(J3)
A3: of:=HOUR([.J4]) -> 9 | B3: 9 | C3: of:=[.A3]=[.B3] -> true | D3: of:=FORMULA([.A3]) -> =HOUR(J4) | J3: PT17H20M00S
A4: of:=HOUR("17:20:00") -> 17 | B4: 17 | C4: of:=[.A4]=[.B4] -> true | D4: of:=FORMULA([.A4]) -> =HOUR("17:20:00") | J4: 0.4
A5: of:=HOUR([.J6]) -> 12 | B5: 12 | C5: of:=[.A5]=[.B5] -> true | D5: of:=FORMULA([.A5]) -> =HOUR(J6)
A6: of:=HOUR(year2) -> 0 | B6: 0 | C6: of:=[.A6]=[.B6] -> true | D6: of:=FORMULA([.A6]) -> =HOUR(year2) | J6: 1999-01-01T12:30:01
A7: of:=HOUR([.J8]) -> 1 | B7: 1 | C7: of:=[.A7]=[.B7] -> true | D7: of:=FORMULA([.A7]) -> =HOUR(J8)
C8: of:=AND(['AOO #117989'.D2:.D26]) -> true | D8: BASISODATETIME(G2) | E8: Sheet AOO #117989 – own macro function | J8: PT25H39M00S
J9: 2000
J18: 2000
J19: 2001
J20: 2002
J27: 2173-10-13

Sheet: AOO #117989
A1: macro function | B1: convert date to number | C1: expected value | D1: Correct
A2: of:=BASISODATETIME([.G2]) -> 1899-12-26 12:00:00 | B2: of:=DATEVALUE([.A2]) -> -4 | C2: -4 | D2: of:=[.B2]=[.C2] -> true | F2: of:=[.G2] -> 1899-12-26T12:00:00 | G2: -3.5
A3: of:=BASISODATETIME([.G3]) -> 1899-12-26 18:00:00 | B3: of:=DATEVALUE([.A3]) -> -4 | C3: -4 | D3: of:=[.B3]=[.C3] -> true | F3: of:=[.G3] -> 1899-12-26T18:00:00 | G3: -3.25
A4: of:=BASISODATETIME([.G4]) -> 1899-12-27 00:00:00 | B4: of:=DATEVALUE([.A4]) -> -3 | C4: -3 | D4: of:=[.B4]=[.C4] -> true | F4: of:=[.G4] -> 1899-12-27 | G4: -3
A5: of:=BASISODATETIME([.G5]) -> 1899-12-27 06:00:00 | B5: of:=DATEVALUE([.A5]) -> -3 | C5: -3 | D5: of:=[.B5]=[.C5] -> true | F5: of:=[.G5] -> 1899-12-27T06:00:00 | G5: -2.75
A6: of:=BASISODATETIME([.G6]) -> 1899-12-27 12:00:00 | B6: of:=DATEVALUE([.A6]) -> -3 | C6: -3 | D6: of:=[.B6]=[.C6] -> true | F6: of:=[.G6] -> 1899-12-27T12:00:00 | G6: -2.5
A7: of:=BASISODATETIME([.G7]) -> 1899-12-27 18:00:00 | B7: of:=DATEVALUE([.A7]) -> -3 | C7: -3 | D7: of:=[.B7]=[.C7] -> true | F7: of:=[.G7] -> 1899-12-27T18:00:00 | G7: -2.25
A8: of:=BASISODATETIME([.G8]) -> 1899-12-28 00:00:00 | B8: of:=DATEVALUE([.A8]) -> -2 | C8: -2 | D8: of:=[.B8]=[.C8] -> true | F8: of:=[.G8] -> 1899-12-28 | G8: -2
A9: of:=BASISODATETIME([.G9]) -> 1899-12-28 06:00:00 | B9: of:=DATEVALUE([.A9]) -> -2 | C9: -2 | D9: of:=[.B9]=[.C9] -> true | F9: of:=[.G9] -> 1899-12-28T06:00:00 | G9: -1.75
A10: of:=BASISODATETIME([.G10]) -> 1899-12-28 12:00:00 | B10: of:=DATEVALUE([.A10]) -> -2 | C10: -2 | D10: of:=[.B10]=[.C10] -> true | F10: of:=[.G10] -> 1899-12-28T12:00:00 | G10: -1.5
A11: of:=BASISODATETIME([.G11]) -> 1899-12-28 18:00:00 | B11: of:=DATEVALUE([.A11]) -> -2 | C11: -2 | D11: of:=[.B11]=[.C11] -> true | F11: of:=[.G11] -> 1899-12-28T18:00:00 | G11: -1.25
A12: of:=BASISODATETIME([.G12]) -> 1899-12-29 00:00:00 | B12: of:=DATEVALUE([.A12]) -> -1 | C12: -1 | D12: of:=[.B12]=[.C12] -> true | F12: of:=[.G12] -> 1899-12-29 | G12: -1
A13: of:=BASISODATETIME([.G13]) -> 1899-12-29 06:00:00 | B13: of:=DATEVALUE([.A13]) -> -1 | C13: -1 | D13: of:=[.B13]=[.C13] -> true | F13: of:=[.G13] -> 1899-12-29T06:00:00 | G13: -0.75
A14: of:=BASISODATETIME([.G14]) -> 1899-12-29 12:00:00 | B14: of:=DATEVALUE([.A14]) -> -1 | C14: -1 | D14: of:=[.B14]=[.C14] -> true | F14: of:=[.G14] -> 1899-12-29T12:00:00 | G14: -0.5
A15: of:=BASISODATETIME([.G15]) -> 1899-12-29 18:00:00 | B15: of:=DATEVALUE([.A15]) -> -1 | C15: -1 | D15: of:=[.B15]=[.C15] -> true | F15: of:=[.G15] -> 1899-12-29T18:00:00 | G15: -0.25
A16: of:=BASISODATETIME([.G16]) -> 1899-12-30 00:00:00 | B16: of:=DATEVALUE([.A16]) -> 0 | C16: 0 | D16: of:=[.B16]=[.C16] -> true | F16: of:=[.G16] -> 1899-12-30 | G16: 0
A17: of:=BASISODATETIME([.G17]) -> 1899-12-30 06:00:00 | B17: of:=DATEVALUE([.A17]) -> 0 | C17: 0 | D17: of:=[.B17]=[.C17] -> true | F17: of:=[.G17] -> 1899-12-30T06:00:00 | G17: 0.25
A18: of:=BASISODATETIME([.G18]) -> 1899-12-30 12:00:00 | B18: of:=DATEVALUE([.A18]) -> 0 | C18: 0 | D18: of:=[.B18]=[.C18] -> true | F18: of:=[.G18] -> 1899-12-30T12:00:00 | G18: 0.5
A19: of:=BASISODATETIME([.G19]) -> 1899-12-30 18:00:00 | B19: of:=DATEVALUE([.A19]) -> 0 | C19: 0 | D19: of:=[.B19]=[.C19] -> true | F19: of:=[.G19] -> 1899-12-30T18:00:00 | G19: 0.75
A20: of:=BASISODATETIME([.G20]) -> 1899-12-31 00:00:00 | B20: of:=DATEVALUE([.A20]) -> 1 | C20: 1 | D20: of:=[.B20]=[.C20] -> true | F20: of:=[.G20] -> 1899-12-31 | G20: 1
A21: of:=BASISODATETIME([.G21]) -> 1899-12-31 06:00:00 | B21: of:=DATEVALUE([.A21]) -> 1 | C21: 1 | D21: of:=[.B21]=[.C21] -> true | F21: of:=[.G21] -> 1899-12-31T06:00:00 | G21: 1.25
A22: of:=BASISODATETIME([.G22]) -> 1899-12-31 12:00:00 | B22: of:=DATEVALUE([.A22]) -> 1 | C22: 1 | D22: of:=[.B22]=[.C22] -> true | F22: of:=[.G22] -> 1899-12-31T12:00:00 | G22: 1.5
A23: of:=BASISODATETIME([.G23]) -> 1899-12-31 18:00:00 | B23: of:=DATEVALUE([.A23]) -> 1 | C23: 1 | D23: of:=[.B23]=[.C23] -> true | F23: of:=[.G23] -> 1899-12-31T18:00:00 | G23: 1.75
A24: of:=BASISODATETIME([.G24]) -> 1900-01-01 00:00:00 | B24: of:=DATEVALUE([.A24]) -> 2 | C24: 2 | D24: of:=[.B24]=[.C24] -> true | F24: of:=[.G24] -> 1900-01-01 | G24: 2
A25: of:=BASISODATETIME([.G25]) -> 1900-01-01 06:00:00 | B25: of:=DATEVALUE([.A25]) -> 2 | C25: 2 | D25: of:=[.B25]=[.C25] -> true | F25: of:=[.G25] -> 1900-01-01T06:00:00 | G25: 2.25
A26: of:=BASISODATETIME([.G26]) -> 1900-01-01 12:00:00 | B26: of:=DATEVALUE([.A26]) -> 2 | C26: 2 | D26: of:=[.B26]=[.C26] -> true | F26: of:=[.G26] -> 1900-01-01T12:00:00 | G26: 2.5

Sheet: 'file:///home/zdenek/Dokumenty/LO/sc-unit-test/Project%20Calc%20functions%20tests/fods/function_based_test_Example.fods/function_based_test_Example_reference.fods'#Sheet2
H3: 4