Sheet: Sheet1
A1: MIRR Function
A3: Result | B3: of:=AND([.B8:.B95]) -> true
A7: Sheet | B7: Result | C7: Description
A8: 1 | B8: of:=AND([Sheet2.C2:.C49]) -> true | C8: Simple MIRR formulas with local references and values

Sheet: Sheet2
A1: Function | B1: Expected | C1: Correct | D1: FunctionString | E1: Comment | F1: -5 | G1: 5 | H1: -5 | I1: -7500 | J1: -10000
A2: of:=MIRR([.I1:.I5]; 0.05; 0.08) -> 0.187362250932837 | B2: 0.187362250932837 | C2: of:=ROUND([.A2];12)=ROUND([.B2];12) -> true | D2: of:=FORMULA([.A2]) -> =MIRR(I1:I5, 0.05, 0.08) | F2: -10 | G2: 10 | H2: 10 | I2: 3000 | J2: 3400
A3: of:=MIRR([.J1:.J4]; 0.065; 0.1) -> 0.0703949396602768 | B3: 0.0703949396602768 | C3: of:=ROUND([.A3];12)=ROUND([.B3];12) -> true | D3: of:=FORMULA([.A3]) -> =MIRR(J1:J4, 0.065, 0.1) | F3: -15 | G3: 15 | H3: 15 | I3: 5000 | J3: 6500
A4: of:=MIRR([.J1:.J4]; ; 0.1) -> 0.0703949396602768 | B4: 0.0703949396602768 | C4: of:=ROUND([.A4];12)=ROUND([.B4];12) -> true | D4: of:=FORMULA([.A4]) -> =MIRR(J1:J4, , 0.1) | F4: -8 | G4: 8 | H4: 8 | I4: 1200 | J4: 1000
A5: of:=MIRR([.J1:.J4]; 0.065; ) -> 0.0291424665715065 | B5: 0.0291424665715065 | C5: of:=ROUND([.A5];12)=ROUND([.B5];12) -> true | D5: of:=FORMULA([.A5]) -> =MIRR(J1:J4, 0.065, ) | I5: 4000
A6: of:=MIRR([.J1:.J4]; 0.065; [.F6]) -> 0.0291424665715065 | B6: 0.0291424665715065 | C6: of:=ROUND([.A6];12)=ROUND([.B6];12) -> true | D6: of:=FORMULA([.A6]) -> =MIRR(J1:J4, 0.065, F6)
A7: of:=MIRR([.J1:.J4]; -0.065;0.1 ) -> 0.0703949396602768 | B7: 0.0703949396602768 | C7: of:=ROUND([.A7];12)=ROUND([.B7];12) -> true | D7: of:=FORMULA([.A7]) -> =MIRR(J1:J4, -0.065,0.1 )
A8: of:=MIRR([.J1:.J4]; 0.065; -0.1) -> -0.0133781775109151 | B8: -0.0133781775109151 | C8: of:=ROUND([.A8];12)=ROUND([.B8];12) -> true | D8: of:=FORMULA([.A8]) -> =MIRR(J1:J4, 0.065, -0.1)
A9: of:=MIRR([.H1:.H4];0.5;0.1) -> 0.941647376706893 | B9: 0.941647376706893 | C9: of:=ROUND([.A9];12)=ROUND([.B9];12) -> true | D9: of:=FORMULA([.A9]) -> =MIRR(H1:H4,0.5,0.1)
A10: of:=MIRR(; 0.065; 0.1) ->  | B10: error | C10: of:=ISERROR([.A10]) -> true | D10: of:=FORMULA([.A10]) -> =MIRR(, 0.065, 0.1)
A11: of:=MIRR([.H1:.H4]) ->  | B11: error | C11: of:=ISERROR([.A11]) -> true | D11: of:=FORMULA([.A11]) -> =MIRR(H1:H4)
A12: of:=MIRR([.H1:.H4];0.5) ->  | B12: error | C12: of:=ISERROR([.A12]) -> true | D12: of:=FORMULA([.A12]) -> =MIRR(H1:H4,0.5)
A13: of:=MIRR([.G1:.G4];0.51;0.1) ->  | B13: error | C13: of:=ISERROR([.A13]) -> true | D13: of:=FORMULA([.A13]) -> =MIRR(G1:G4,0.51,0.1) | E13: Values shall contain at least one positive value and at least one negative value.
A14: of:=MIRR([.F1:.F4];0.51;0.1) ->  | B14: error | C14: of:=ISERROR([.A14]) -> true | D14: of:=FORMULA([.A14]) -> =MIRR(F1:F4,0.51,0.1) | E14: Tdf#100767 Values shall contain at least one positive value and at least one negative value.
A15: of:=MIRR({-10000|3400|6500|1000}; 0.065; 0.1) -> 0.0703949396602768 | B15: 0.0703949396602768 | C15: of:=ROUND([.A15];12)=ROUND([.B15];12) -> true | D15: of:=FORMULA([.A15]) -> =MIRR({-10000;3400;6500;1000}, 0.065, 0.1) | E15: Tdf#58585

Sheet: 'file:///home/zdenek/Dokumenty/LO/sc-unit-test/Project%20Calc%20functions%20tests/fods/mirr.fods/mirr.fods/mirr.fods/mirr.fods/mirr.fods/function_based_test_Example.fods/function_based_test_Example_reference.fods'#Sheet2
H3: 4