Sheet: Sheet1
A1: MONTHS Function
A3: Result | B3: of:=AND([.B8:.B95]) -> true
A7: Sheet | B7: Result | C7: Description
A8: 1 | B8: of:=AND([Sheet2.C2:.C99]) -> true | C8: Simple MONTHS formulas with local references and values

Sheet: Sheet2
A1: Function | B1: Expected | C1: Correct | D1: FunctionString | E1: Comment
A2: of:=ORG.OPENOFFICE.MONTHS("2010-04-03"; "2011-06-17"; 0) -> 14 | B2: 14 | C2: of:=[.A2]=[.B2] -> true | D2: of:=FORMULA([.A2]) -> =MONTHS("2010-04-03", "2011-06-17", 0)
A3: of:=ORG.OPENOFFICE.MONTHS("2010-03-31"; "2010-04-30"; 0) -> 0 | B3: 0 | C3: of:=[.A3]=[.B3] -> true | D3: of:=FORMULA([.A3]) -> =MONTHS("2010-03-31", "2010-04-30", 0) | J3: 33333.33
A4: of:=ORG.OPENOFFICE.MONTHS("2010-03-31"; "2010-06-30"; 0) -> 2 | B4: 2 | C4: of:=[.A4]=[.B4] -> true | D4: of:=FORMULA([.A4]) -> =MONTHS("2010-03-31", "2010-06-30", 0) | K4: 1
A5: of:=ORG.OPENOFFICE.MONTHS("2010-04-03"; "2011-06-17"; 1) -> 14 | B5: 14 | C5: of:=[.A5]=[.B5] -> true | D5: of:=FORMULA([.A5]) -> =MONTHS("2010-04-03", "2011-06-17", 1)
A6: of:=ORG.OPENOFFICE.MONTHS("2010-03-31"; "2010-04-01"; 1) -> 1 | B6: 1 | C6: of:=[.A6]=[.B6] -> true | D6: of:=FORMULA([.A6]) -> =MONTHS("2010-03-31", "2010-04-01", 1)
A7: of:=ORG.OPENOFFICE.MONTHS([.J7]; [.K7]; 1) -> 1 | B7: 1 | C7: of:=[.A7]=[.B7] -> true | D7: of:=FORMULA([.A7]) -> =MONTHS(J7, K7, 1) | J7: 2010-03-31 | K7: 2010-04-01
A8: of:=ORG.OPENOFFICE.MONTHS(day1; day2; 1) -> 1 | B8: 1 | C8: of:=[.A8]=[.B8] -> true | D8: of:=FORMULA([.A8]) -> =MONTHS(day1, day2, 1)
A9: of:=ORG.OPENOFFICE.MONTHS(day1; day2; 8999) ->  | B9: error | C9: of:=ISERROR([.A9]) -> true | D9: of:=FORMULA([.A9]) -> =MONTHS(day1, day2, 8999) | E9: Tdf#100440
O58: Age

Sheet: 'file:///home/zdenek/Dokumenty/LO/sc-unit-test/Project%20Calc%20functions%20tests/fods/months.fods/months.fods/months.fods/months.fods/months.fods/month.fods/minute.fods/year.fods/function_based_test_Example.fods/function_based_test_Example_reference.fods'#Sheet2
H3: 4