Sheet: Sheet1
A1: MULTINOMIAL Function
A3: Result | B3: of:=AND([.B8:.B95]) -> true
A7: Sheet | B7: Result | C7: Description
A8: 1 | B8: of:=AND([Sheet2.C2:.C92]) -> true | C8: Simple MULTINOMIAL formulas with local references and values

Sheet: Sheet2
A1: Function | B1: Expected | C1: Correct | D1: FunctionString | E1: Comment | G1: 2
A2: of:=MULTINOMIAL([.G1:.G3]) -> 1260 | B2: 1260 | C2: of:=ROUND([.A2];12)=ROUND([.B2];12) -> true | D2: of:=FORMULA([.A2]) -> =MULTINOMIAL(G1:G3) | G2: 3
A3: of:=MULTINOMIAL({2;3;4}) -> 1260 | B3: 1260 | C3: of:=ROUND([.A3];12)=ROUND([.B3];12) -> true | D3: of:=FORMULA([.A3]) -> =MULTINOMIAL({2,3,4}) | G3: 4
A4: of:=MULTINOMIAL(1000;0) -> 1 | B4: 1 | C4: of:=ROUND([.A4];12)=ROUND([.B4];12) -> true | D4: of:=FORMULA([.A4]) -> =MULTINOMIAL(1000,0) | E4: Tdf#43135 | G4: -1
A5: of:=MULTINOMIAL([.G5];[.H5]) -> 10 | B5: 10 | C5: of:=ROUND([.A5];12)=ROUND([.B5];12) -> true | D5: of:=FORMULA([.A5]) -> =MULTINOMIAL(G5,H5) | G5: 3 | H5: 2
A6: of:=MULTINOMIAL([.G6];[.H6];[.I6];[.J6];[.K6];[.L6]) -> 3 | B6: 3 | C6: of:=ROUND([.A6];12)=ROUND([.B6];12) -> true | D6: of:=FORMULA([.A6]) -> =MULTINOMIAL(G6,H6,I6,J6,K6,L6) | G6: 0 | H6: 0 | I6: 2 | J6: 1 | K6: 0 | L6: 0
A7: of:=MULTINOMIAL([.G7];[.H7];[.I7]) -> 6.18970023101455E+026 | B7: 6.18970023101455E+026 | C7: of:=ROUND([.A7];12)=ROUND([.B7];12) -> true | D7: of:=FORMULA([.A7]) -> =MULTINOMIAL(G7,H7,I7) | G7: of:=2^30 -> 1073741824 | H7: 2 | I7: 1
A8: of:=MULTINOMIAL([.G8];[.H8];[.I8];[.J8];[.K8];[.L8]) -> 2053230379200 | B8: 2053230379200 | C8: of:=ROUND([.A8];12)=ROUND([.B8];12) -> true | D8: of:=FORMULA([.A8]) -> =MULTINOMIAL(G8,H8,I8,J8,K8,L8) | G8: 1 | H8: 2 | I8: 3 | J8: 4 | K8: 5 | L8: 6
A9: of:=MULTINOMIAL([.G9];[.H9];[.I9];[.J9];[.K9]) -> 97772875200 | B9: 97772875200 | C9: of:=ROUND([.A9];12)=ROUND([.B9];12) -> true | D9: of:=FORMULA([.A9]) -> =MULTINOMIAL(G9,H9,I9,J9,K9) | G9: 2 | H9: 3 | I9: 4 | J9: 5 | K9: 6
A10: of:=MULTINOMIAL([.G10];[.H10];[.I10];[.J10]) -> 514594080 | B10: 514594080 | C10: of:=ROUND([.A10];12)=ROUND([.B10];12) -> true | D10: of:=FORMULA([.A10]) -> =MULTINOMIAL(G10,H10,I10,J10) | G10: 3 | H10: 4 | I10: 5 | J10: 6
A11: of:=MULTINOMIAL([.G11];[.H11];[.I11]) -> 630630 | B11: 630630 | C11: of:=ROUND([.A11];12)=ROUND([.B11];12) -> true | D11: of:=FORMULA([.A11]) -> =MULTINOMIAL(G11,H11,I11) | G11: 4 | H11: 5 | I11: 6
A12: of:=MULTINOMIAL([.G12];[.H12]) -> 462 | B12: 462 | C12: of:=ROUND([.A12];12)=ROUND([.B12];12) -> true | D12: of:=FORMULA([.A12]) -> =MULTINOMIAL(G12,H12) | G12: 5 | H12: 6
A13: of:=MULTINOMIAL([.G13];[.H13]) -> 2.47272060489868E+023 | B13: 2.47272060489868E+023 | C13: of:=ROUND([.A13];12)=ROUND([.B13];12) -> true | D13: of:=FORMULA([.A13]) -> =MULTINOMIAL(G13,H13) | G13: 102 | H13: 21
A14: of:=MULTINOMIAL([.G14];[.H14]) -> 30663442810 | B14: 30663442810 | C14: of:=ROUND([.A14];12)=ROUND([.B14];12) -> true | D14: of:=FORMULA([.A14]) -> =MULTINOMIAL(G14,H14) | G14: 164 | H14: 6
A15: of:=MULTINOMIAL([.G15];[.H15];[.I15]) -> 8.94321721058995E+033 | B15: 8.94321721058995E+033 | C15: of:=ROUND([.A15];12)=ROUND([.B15];12) -> true | D15: of:=FORMULA([.A15]) -> =MULTINOMIAL(G15,H15,I15) | G15: 5 | H15: 67 | I15: 32
A16: of:=MULTINOMIAL([.G16];[.H16]) -> 33 | B16: 33 | C16: of:=ROUND([.A16];12)=ROUND([.B16];12) -> true | D16: of:=FORMULA([.A16]) -> =MULTINOMIAL(G16,H16) | G16: 1 | H16: 32
A17: of:=MULTINOMIAL([.G17];[.H17]) -> 1 | B17: 1 | C17: of:=ROUND([.A17];12)=ROUND([.B17];12) -> true | D17: of:=FORMULA([.A17]) -> =MULTINOMIAL(G17,H17) | G17: 1000 | H17: 0
A18: of:=MULTINOMIAL([.G18];[.H18];[.I18]) -> 1260 | B18: 1260 | C18: of:=ROUND([.A18];12)=ROUND([.B18];12) -> true | D18: of:=FORMULA([.A18]) -> =MULTINOMIAL(G18,H18,I18) | G18: 2 | H18: 3 | I18: 4
A19: of:=MULTINOMIAL([.G19];[.H19]) -> 10 | B19: 10 | C19: of:=ROUND([.A19];12)=ROUND([.B19];12) -> true | D19: of:=FORMULA([.A19]) -> =MULTINOMIAL(G19,H19) | G19: 3.4 | H19: 2.3
A20: of:=MULTINOMIAL([.G20];[.H20];[.I20]) -> 4.13450750638954E+080 | B20: 4.13450750638954E+080 | C20: of:=ROUND([.A20];12)=ROUND([.B20];12) -> true | D20: of:=FORMULA([.A20]) -> =MULTINOMIAL(G20,H20,I20) | G20: 40 | H20: 60 | I20: 80
A21: of:=MULTINOMIAL(1;2;3;{4;5}) -> 37837800 | B21: 37837800 | C21: of:=ROUND([.A21];12)=ROUND([.B21];12) -> true | D21: of:=FORMULA([.A21]) -> =MULTINOMIAL(1,2,3,{4,5}) | E21: AOO#25890
A22: of:=MULTINOMIAL([.G2:.G4]) ->  | B22: Err:502 | C22: of:=ISERROR([.A22]) -> true | D22: of:=FORMULA([.A22]) -> =MULTINOMIAL(G2:G4)

Sheet: 'file:///home/zdenek/Dokumenty/LO/sc-unit-test/Project%20Calc%20functions%20tests/fods/multinomial.fods/mround.fods/mod.fods/log10.fods/log.fods/ln.fods/bitxor.fods/bitxor.fods/bitor.fods/bitand.fods/bitand.fods/atan.fods/asinh.fods/asin.fods/acos.fods/abs.fods/abs.fods/xor.fods/xor.fods/not.fods/ifna.fods/ifna.fods/iferror.fods/iferror.fods/if.fods/and.fods/and.fods/and.fods/and.fods/type.fods/isna.fods/isna.fods/islogical.fods/isformula.fods/iserr.fods/isblank.fods/info.fods/formula.fods/formula.fods/current.fods/cell.fods/cell.fods/minute.fods/minute.fods/year.fods/function_based_test_Example.fods/function_based_test_Example_reference.fods'#Sheet2
H3: 4

Sheet: 'file:///home/zdenek/Dokumenty/LO/sc-unit-test/Project%20Calc%20functions%20tests/fods/multinomial.fods/mround.fods/mod.fods/log10.fods/log.fods/ln.fods/bitxor.fods/bitxor.fods/bitor.fods/bitand.fods/bitand.fods/atan.fods/asinh.fods/asin.fods/acos.fods/abs.fods/abs.fods/xor.fods/xor.fods/not.fods/ifna.fods/ifna.fods/iferror.fods/iferror.fods/if.fods/and.fods/and.fods/and.fods/and.fods/type.fods/isna.fods/isna.fods/islogical.fods/isformula.fods/sc-unit-test/information-functions.ods'#Information
O7: O5