Sheet: Sheet1
A1: NETWORKDAYS Function
A3: Result | B3: of:=AND([.B8:.B95]) -> true
A7: Sheet | B7: Result | C7: Description
A8: 1 | B8: of:=AND([Sheet2.C2:.C49]) -> true | C8: Simple NETWORKDAYS formulas with local references and values

Sheet: Sheet2
A1: Function | B1: Expected | C1: Correct | D1: FunctionString | E1: Comment | K1: DATA | M1: of:={1|0|0|0|0|0|1} -> 1
A2: of:=NETWORKDAYS([.K2];[.K3];[.K4:.K6]) -> 17 | B2: 17 | C2: of:=[.A2]=[.B2] -> true | D2: of:=FORMULA([.A2]) -> =NETWORKDAYS(K2;K3;K4:K6) | K2: 2014-11-01 | M2: 0
A3: of:=NETWORKDAYS([.K2];[.K2];[.K2]) -> 0 | B3: 0 | C3: of:=[.A3]=[.B3] -> true | D3: of:=FORMULA([.A3]) -> =NETWORKDAYS(K2;K2;K2) | K3: 2014-11-30 | M3: 0
A4: of:=NETWORKDAYS([.K2];[.K3];[.L2]) -> 20 | B4: 20 | C4: of:=[.A4]=[.B4] -> true | D4: of:=FORMULA([.A4]) -> =NETWORKDAYS(K2;K3;L2) | K4: 2014-11-11 | M4: 0
A5: of:=NETWORKDAYS([.K2];[.K3];) -> 20 | B5: 20 | C5: of:=[.A5]=[.B5] -> true | D5: of:=FORMULA([.A5]) -> =NETWORKDAYS(K2;K3;) | K5: 2014-11-27 | M5: 0
A6: of:=NETWORKDAYS([.K3];[.K2];) -> -20 | B6: -20 | C6: of:=[.A6]=[.B6] -> true | D6: of:=FORMULA([.A6]) -> =NETWORKDAYS(K3;K2;) | K6: 2014-11-28 | M6: 0
A7: of:=NETWORKDAYS(DATE(2014;11;1);DATE(2014;11;30);{"2014-11-11"|"2014-11-28"|"2014-11-27"}) -> 17 | B7: 17 | C7: of:=[.A7]=[.B7] -> true | D7: of:=FORMULA([.A7]) -> =NETWORKDAYS(DATE(2014;11;1);DATE(2014;11;30);{"2014-11-11";"2014-11-28";"2014-11-27"}) | E7: Fixed with https://gerrit.libreoffice.org/gitweb?p=core.git;a=commitdiff;h=3c2803bdbc598deeaf6efe43870d4f9d61cb2c6a | K7: 2001-12-24 | M7: 1
A8: of:=NETWORKDAYS([.K2];[.K2]+6;;{1|0|1|0|1|0|1}) -> 3 | B8: 3 | C8: of:=[.A8]=[.B8] -> true | D8: of:=FORMULA([.A8]) -> =NETWORKDAYS(K2;K2+6;;{1;0;1;0;1;0;1}) | K8: 2001-12-25
A9: of:=NETWORKDAYS([.K2];[.K3];;{0|0|0|0|0|1|1}) -> 21 | B9: 21 | C9: of:=[.A9]=[.B9] -> true | D9: of:=FORMULA([.A9]) -> =NETWORKDAYS(K2;K3;;{0;0;0;0;0;1;1}) | K9: 2001-12-26
A10: of:=NETWORKDAYS([.K2];[.K3];;{1|0|0|0|0|0|1}) -> 20 | B10: 20 | C10: of:=[.A10]=[.B10] -> true | D10: of:=FORMULA([.A10]) -> =NETWORKDAYS(K2;K3;;{1;0;0;0;0;0;1}) | E10: should be the same like row 5 tdf#100342 | K10: 2001-12-31
A11: of:=NETWORKDAYS([.K2];[.K3];;[.M1:.M7]) -> 20 | B11: 20 | C11: of:=[.A11]=[.B11] -> true | D11: of:=FORMULA([.A11]) -> =NETWORKDAYS(K2;K3;;M1:M7) | K11: 2002-01-01
A12: of:=NETWORKDAYS(day1;day2;days) -> 17 | B12: 17 | C12: of:=[.A12]=[.B12] -> true | D12: of:=FORMULA([.A12]) -> =NETWORKDAYS(day1;day2;days) | K12: 17
K13: 2001-12-01
J20: NETWORKDAYS Summary: Returns the whole number of work days between two dates. Syntax: NETWORKDAYS( DateParam Date1 ; DateParam Date2 [ ; [ DateSequence holidays ] [ ; LogicalSequence workdays ] ] ) Returns: Number Constraints: None Semantics: Returns the whole number of work days between two dates. Work days are defined as non-weekend, non-holiday days. By default, weekends are Saturdays and Sundays and there are no holidays. The optional 3rd parameter Holidays can be used to specify a list of dates to be treated as holidays. Note that this parameter can be omitted as an empty parameter (two consecutive ;; semicolons) to be able to pass the set of Workdays without Holidays. The optional 4th parameter Workdays can be used to specify a different definition for the standard work week by passing in a list of numbers which define which days of the week are workdays (indicated by 0) or not (indicated by non-zero) in order Sunday, Monday,...,Saturday. So, the default definition of the work week excludes Saturday and Sunday and is: {1;0;0;0;0;0;1}. To define the work week as excluding Friday and Saturday, the third parameter would be: {0;0;0;0;0;1;1}.

Sheet: 'file:///home/zdenek/Dokumenty/LO/sc-unit-test/Project%20Calc%20functions%20tests/fods/networkdays.fods/function_based_test_Example.fods/function_based_test_Example_reference.fods'#Sheet2
H3: 4