Sheet: Sheet1
A1: NPV Function
A3: Result | B3: of:=AND([.B8:.B95]) -> true
A7: Sheet | B7: Result | C7: Description
A8: 1 | B8: of:=AND([Sheet2.C2:.C149]) -> true | C8: Simple NPV formulas with local references and values

Sheet: Sheet2
A1: Function | B1: Expected | C1: Correct | D1: FunctionString | E1: Comment | J1: 1
A2: of:=NPV(0.0875;10;20;30) -> 49.432121038173 | B2: 49.432121038173 | C2: of:=ROUND([.A2];12)=ROUND([.B2];12) -> true | D2: of:=FORMULA([.A2]) -> =NPV(0.0875,10,20,30) | F2: 1 | G2: 4 | J2: 2 | K2: 1
A3: of:=NPV(0.05;[.J1:.J30]) -> 183.995002371025 | B3: 183.995002371025 | C3: of:=ROUND([.A3];12)=ROUND([.B3];12) -> true | D3: of:=FORMULA([.A3]) -> =NPV(0.05,J1:J30) | F3: 2 | G3: 5 | J3: 3 | K3: 2
A4: of:=NPV(0.5;[.F1];[.F2];[.F3];[.F4];[.G1];[.G2];[.G3];[.G4]) -> 4.41975308641975 | B4: 4.41975308641975 | C4: of:=ROUND([.A4];12)=ROUND([.B4];12) -> true | D4: of:=FORMULA([.A4]) -> =NPV(0.5,F1,F2,F3,F4,G1,G2,G3,G4) | E4: AOO#92774 | F4: 3 | G4: 6 | J4: 4 | K4: 3
A5: of:=NPV(0.5;[.F1:.F4];[.G1:.G4]) -> 4.41975308641975 | B5: 4.41975308641975 | C5: of:=ROUND([.A5];12)=ROUND([.B5];12) -> true | D5: of:=FORMULA([.A5]) -> =NPV(0.5,F1:F4,G1:G4) | J5: 5 | K5: 4
A6: of:=NPV(0.05;[.J1:.J31]) -> 190.826146093245 | B6: 190.826146093245 | C6: of:=ROUND([.A6];12)=ROUND([.B6];12) -> true | D6: of:=FORMULA([.A6]) -> =NPV(0.05,J1:J31) | E6: Calc Help: Value1;... are up to 30 values, which represent deposits or withdrawals. | J6: 6 | K6: 5
A7: of:=NPV(0.05;[.K1:.K258]) -> 419.980073779556 | B7: 419.980073779556 | C7: of:=ROUND([.A7];12)=ROUND([.B7];12) -> true | D7: of:=FORMULA([.A7]) -> =NPV(0.05,K1:K258) | E7: Excel help: Value1, value2, ... Value1 is required, subsequent values are optional. 1 to 254 arguments representing the payments and income. | J7: 7 | K7: 6
A8: of:=NPV(0.5;[.F1:.G4]) -> 4.94650205761317 | B8: 4.94650205761317 | C8: of:=ROUND([.A8];12)=ROUND([.B8];12) -> true | D8: of:=FORMULA([.A8]) -> =NPV(0.5,F1:G4) | J8: 8 | K8: 7
A9: of:=NPV(-0.5;[.F1:.G4]) -> 594 | B9: 594 | C9: of:=ROUND([.A9];12)=ROUND([.B9];12) -> true | D9: of:=FORMULA([.A9]) -> =NPV(-0.5,F1:G4) | J9: 9 | K9: 8
A10: of:=NPV(0.5;[.F1:.G1]) -> 0 | B10: 0 | C10: of:=ROUND([.A10];12)=ROUND([.B10];12) -> true | D10: of:=FORMULA([.A10]) -> =NPV(0.5,F1:G1) | J10: 10 | K10: 9
A11: of:=NPV(0.0875;{10|20|30}) -> 49.432121038173 | B11: 49.432121038173 | C11: of:=ROUND([.A11];12)=ROUND([.B11];12) -> true | D11: of:=FORMULA([.A11]) -> =NPV(0.0875,{10;20;30}) | E11: Tdf#100762 | J11: 11 | K11: 10
J12: 12 | K12: 11
J13: 13 | K13: 12
J14: 14 | K14: 13
J15: 15 | K15: 14
J16: 16 | K16: 15
D17: NPV Summary: Compute the net present value (NPV) for a series of periodic cash flows. Syntax: NPV( Number Rate ; { NumberSequenceList Value }+ ) Returns: Currency Constraints: None. Semantics: Computes the net present value for a series of periodic cash flows with the discount rate Rate. Values should be positive if they are received as income, and negative if the amounts are paid as outgo. Because the result is affected by the order of values, evaluators shall evaluate arguments in the order given and range reference and array arguments row-wise starting from top left. | J17: 17 | K17: 16
J18: 18 | K18: 17
J19: 19 | K19: 18
J20: 20 | K20: 19
J21: 21 | K21: 20
J22: 22 | K22: 21
J23: 23 | K23: 22
J24: 24 | K24: 23
J25: 25 | K25: 24
J26: 26 | K26: 25
J27: 27 | K27: 26
J28: 28 | K28: 27
J29: 29 | K29: 28
J30: 30 | K30: 29
J31: 31 | K31: 30
J32: 32 | K32: 31
J33: 33 | K33: 32
J34: 34 | K34: 33
K35: 34
K36: 35
K37: 36
K38: 37
K39: 38
K40: 39
K41: 40
K42: 41
K43: 42
K44: 43
K45: 44
K46: 45
K47: 46
K48: 47
K49: 48
K50: 49
K51: 50
K52: 51
K53: 52
K54: 53
K55: 54
K56: 55
K57: 56
K58: 57
K59: 58
K60: 59
K61: 60
K62: 61
K63: 62
K64: 63
K65: 64
K66: 65
K67: 66
K68: 67
K69: 68
K70: 69
K71: 70
K72: 71
K73: 72
K74: 73
K75: 74
K76: 75
K77: 76
K78: 77
K79: 78
K80: 79
K81: 80
K82: 81
K83: 82
K84: 83
K85: 84
K86: 85
K87: 86
K88: 87
K89: 88
K90: 89
K91: 90
K92: 91
K93: 92
K94: 93
K95: 94
K96: 95
K97: 96
K98: 97
K99: 98
K100: 99
K101: 100
K102: 101
K103: 102
K104: 103
K105: 104
K106: 105
K107: 106
K108: 107
K109: 108
K110: 109
K111: 110
K112: 111
K113: 112
K114: 113
K115: 114
K116: 115
K117: 116
K118: 117
K119: 118
K120: 119
K121: 120
K122: 121
K123: 122
K124: 123
K125: 124
K126: 125
K127: 126
K128: 127
K129: 128
K130: 129
K131: 130
K132: 131
K133: 132
K134: 133
K135: 134
K136: 135
K137: 136
K138: 137
K139: 138
K140: 139
K141: 140
K142: 141
K143: 142
K144: 143
K145: 144
K146: 145
K147: 146
K148: 147
K149: 148
K150: 149
K151: 150
K152: 151
K153: 152
K154: 153
K155: 154
K156: 155
K157: 156
K158: 157
K159: 158
K160: 159
K161: 160
K162: 161
K163: 162
K164: 163
K165: 164
K166: 165
K167: 166
K168: 167
K169: 168
K170: 169
K171: 170
K172: 171
K173: 172
K174: 173
K175: 174
K176: 175
K177: 176
K178: 177
K179: 178
K180: 179
K181: 180
K182: 181
K183: 182
K184: 183
K185: 184
K186: 185
K187: 186
K188: 187
K189: 188
K190: 189
K191: 190
K192: 191
K193: 192
K194: 193
K195: 194
K196: 195
K197: 196
K198: 197
K199: 198
K200: 199
K201: 200
K202: 201
K203: 202
K204: 203
K205: 204
K206: 205
K207: 206
K208: 207
K209: 208
K210: 209
K211: 210
K212: 211
K213: 212
K214: 213
K215: 214
K216: 215
K217: 216
K218: 217
K219: 218
K220: 219
K221: 220
K222: 221
K223: 222
K224: 223
K225: 224
K226: 225
K227: 226
K228: 227
K229: 228
K230: 229
K231: 230
K232: 231
K233: 232
K234: 233
K235: 234
K236: 235
K237: 236
K238: 237
K239: 238
K240: 239
K241: 240
K242: 241
K243: 242
K244: 243
K245: 244
K246: 245
K247: 246
K248: 247
K249: 248
K250: 249
K251: 250
K252: 251
K253: 252
K254: 253
K255: 254
K256: 255
K257: 256
K258: 257

Sheet: 'file:///home/zdenek/Dokumenty/LO/sc-unit-test/Project%20Calc%20functions%20tests/fods/function_based_test_Example.fods/function_based_test_Example_reference.fods'#Sheet2
H3: 4