Sheet: Sheet1
A1: ODDLYIELD Function
A3: Result | B3: of:=AND([.B8:.B95]) -> true
A7: Sheet | B7: Result | C7: Description
A8: 1 | B8: of:=AND([Sheet2.C2:.C49]) -> true | C8: Simple ODDLYIELD formulas with local references and values

Sheet: Sheet2
A1: Function | B1: Expected | C1: Correct | D1: FunctionString | E1: Comment
A2: of:=ODDLYIELD("1999-04-20";"1999-06-15"; "1998-10-15"; 0.0375; 99.875; 100;2;0) -> 0.0448731663302424 | B2: 0.0448731663302424 | C2: of:=ROUND([.A2];12)=ROUND([.B2];12) -> true | D2: of:=FORMULA([.A2]) -> =ODDLYIELD("1999-04-20","1999-06-15", "1998-10-15", 0.0375, 99.875, 100,2,0)
A3: of:=ODDLYIELD("1999-04-20";"1999-06-15"; "1998-10-15"; 0.0375; 99.875; 100;2;1) -> 0.0448418572461875 | B3: 0.0448418572461875 | C3: of:=ROUND([.A3];12)=ROUND([.B3];12) -> true | D3: of:=FORMULA([.A3]) -> =ODDLYIELD("1999-04-20","1999-06-15", "1998-10-15", 0.0375, 99.875, 100,2,1)
A4: of:=ODDLYIELD("1999-04-20";"1999-06-15"; "1998-10-15"; 0.0375; 99.875; 100;2;2) -> 0.0447204968944091 | B4: 0.0447204968944091 | C4: of:=ROUND([.A4];12)=ROUND([.B4];12) -> true | D4: of:=FORMULA([.A4]) -> =ODDLYIELD("1999-04-20","1999-06-15", "1998-10-15", 0.0375, 99.875, 100,2,2)
A5: of:=ODDLYIELD("1999-04-20";"1999-06-15"; "1998-10-15"; 0.0375; 99.875; 100;2;3) -> 0.0448418572461875 | B5: 0.0448418572461875 | C5: of:=ROUND([.A5];12)=ROUND([.B5];12) -> true | D5: of:=FORMULA([.A5]) -> =ODDLYIELD("1999-04-20","1999-06-15", "1998-10-15", 0.0375, 99.875, 100,2,3)
A6: of:=ODDLYIELD("1999-04-20";"1999-06-15"; "1998-10-15"; 0.0375; 99.875; 100;2;4) -> 0.0448731663302424 | B6: 0.0448731663302424 | C6: of:=ROUND([.A6];12)=ROUND([.B6];12) -> true | D6: of:=FORMULA([.A6]) -> =ODDLYIELD("1999-04-20","1999-06-15", "1998-10-15", 0.0375, 99.875, 100,2,4)
A7: of:=ODDLYIELD("1999-04-20";"1999-06-15"; "1998-10-15"; 0.0375; 99.875; 100;2;5) ->  | B7: error | C7: of:=ISERROR([.A7]) -> true | D7: of:=FORMULA([.A7]) -> =ODDLYIELD("1999-04-20","1999-06-15", "1998-10-15", 0.0375, 99.875, 100,2,5)
A8: of:=ODDLYIELD("1999-04-20";"1999-06-15"; "1998-10-15"; 0.0375; 99.875; 100;1;0) -> 0.0448731663302424 | B8: 0.0448731663302424 | C8: of:=ROUND([.A8];12)=ROUND([.B8];12) -> true | D8: of:=FORMULA([.A8]) -> =ODDLYIELD("1999-04-20","1999-06-15", "1998-10-15", 0.0375, 99.875, 100,1,0)
A9: of:=ODDLYIELD("1999-04-20";"1999-06-15"; "1998-10-15"; 0.0375; 99.875; 100;4;0) -> 0.0448731663302424 | B9: 0.0448731663302424 | C9: of:=ROUND([.A9];12)=ROUND([.B9];12) -> true | D9: of:=FORMULA([.A9]) -> =ODDLYIELD("1999-04-20","1999-06-15", "1998-10-15", 0.0375, 99.875, 100,4,0)
A10: of:=ODDLYIELD("1999-04-20";"1999-06-15"; "1998-10-15"; 0.0375; 99.875; 100;4;0) -> 0.0448731663302424 | B10: 0.0448731663302424 | C10: of:=ROUND([.A10];12)=ROUND([.B10];12) -> true | D10: of:=FORMULA([.A10]) -> =ODDLYIELD("1999-04-20","1999-06-15", "1998-10-15", 0.0375, 99.875, 100,4,0)
A11: of:=ODDLYIELD("1999-04-20";"1999-06-15"; "1998-10-15"; 0.0375; 99.875; 100;2;) -> 0.0448731663302424 | B11: 0.0448731663302424 | C11: of:=ROUND([.A11];12)=ROUND([.B11];12) -> true | D11: of:=FORMULA([.A11]) -> =ODDLYIELD("1999-04-20","1999-06-15", "1998-10-15", 0.0375, 99.875, 100,2,)
A12: of:=ODDLYIELD("1999-04-20";"1999-06-15"; "1998-10-15"; 0.0375; 99.875; 100;2) -> 0.0448731663302424 | B12: 0.0448731663302424 | C12: of:=ROUND([.A12];12)=ROUND([.B12];12) -> true | D12: of:=FORMULA([.A12]) -> =ODDLYIELD("1999-04-20","1999-06-15", "1998-10-15", 0.0375, 99.875, 100,2)
A13: of:=ODDLYIELD("1999-04-20";"1999-06-15"; "1998-10-15"; 0.0375; 99.875; 100;;0) ->  | B13: error | C13: of:=ISERROR([.A13]) -> true | D13: of:=FORMULA([.A13]) -> =ODDLYIELD("1999-04-20","1999-06-15", "1998-10-15", 0.0375, 99.875, 100,,0)
A14: of:=ODDLYIELD("1999-04-20";"1999-06-15"; "1998-10-15"; 0.0375; 99.875; 100;;0) ->  | B14: error | C14: of:=ISERROR([.A14]) -> true | D14: of:=FORMULA([.A14]) -> =ODDLYIELD("1999-04-20","1999-06-15", "1998-10-15", 0.0375, 99.875, 100,,0)
A15: of:=ODDLYIELD("1999-04-20";"1999-06-15"; "1998-10-15"; 0.0375; 99.875; 100;-2;0) ->  | B15: error | C15: of:=ISERROR([.A15]) -> true | D15: of:=FORMULA([.A15]) -> =ODDLYIELD("1999-04-20","1999-06-15", "1998-10-15", 0.0375, 99.875, 100,-2,0)
A16: of:=ODDLYIELD("1999-04-20";"1999-06-15"; "1998-10-15"; 0.0375; ; 100;2;0) ->  | B16: error | C16: of:=ISERROR([.A16]) -> true | D16: of:=FORMULA([.A16]) -> =ODDLYIELD("1999-04-20","1999-06-15", "1998-10-15", 0.0375, , 100,2,0) | E16: Constraints: Rate, Price, and Redemption should be greater than 0.
A17: of:=ODDLYIELD("1999-04-20";"1999-06-15"; "1998-10-15"; 0.0375; 0; 100;2;0) ->  | B17: error | C17: of:=ISERROR([.A17]) -> true | D17: of:=FORMULA([.A17]) -> =ODDLYIELD("1999-04-20","1999-06-15", "1998-10-15", 0.0375, 0, 100,2,0) | E17: Constraints: Rate, Price, and Redemption should be greater than 0.
A18: of:=ODDLYIELD("1999-04-20";"1999-06-15"; "1998-10-15"; 0.0375; -99.875; 100;2;0) ->  | B18: error | C18: of:=ISERROR([.A18]) -> true | D18: of:=FORMULA([.A18]) -> =ODDLYIELD("1999-04-20","1999-06-15", "1998-10-15", 0.0375, -99.875, 100,2,0) | E18: Constraints: Rate, Price, and Redemption should be greater than 0.
A19: of:=ODDLYIELD("1999-04-20";"1999-06-15"; "1998-10-15"; -0.0375; 99.875; 100;2;0) ->  | B19: error | C19: of:=ISERROR([.A19]) -> true | D19: of:=FORMULA([.A19]) -> =ODDLYIELD("1999-04-20","1999-06-15", "1998-10-15", -0.0375, 99.875, 100,2,0) | E19: Constraints: Rate, Price, and Redemption should be greater than 0.
A20: of:=ODDLYIELD("1999-06-15";"1999-04-20"; "1998-10-15"; 0.0375; 99.875; 100;2;0) ->  | B20: error | C20: of:=ISERROR([.A20]) -> true | D20: of:=FORMULA([.A20]) -> =ODDLYIELD("1999-06-15","1999-04-20", "1998-10-15", 0.0375, 99.875, 100,2,0)
A21: of:=ODDLYIELD("1999-04-20";"1999-06-15"; "1999-10-15"; 0.0375; 99.875; 100;2;0) ->  | B21: error | C21: of:=ISERROR([.A21]) -> true | D21: of:=FORMULA([.A21]) -> =ODDLYIELD("1999-04-20","1999-06-15", "1999-10-15", 0.0375, 99.875, 100,2,0)
A22: of:=ODDLYIELD("1999-04-20";"1999-06-15"; "1998-10-15"; 0.0375; 99.875; ;2;0) ->  | B22: error | C22: of:=ISERROR([.A22]) -> true | D22: of:=FORMULA([.A22]) -> =ODDLYIELD("1999-04-20","1999-06-15", "1998-10-15", 0.0375, 99.875, ,2,0) | E22: Tdf# 100729 Constraints: Rate, Price, and Redemption should be greater than 0.
A23: of:=ODDLYIELD("1999-04-20";"1999-06-15"; "1998-10-15"; 0.0375; 99.875;0;2;0) ->  | B23: error | C23: of:=ISERROR([.A23]) -> true | D23: of:=FORMULA([.A23]) -> =ODDLYIELD("1999-04-20","1999-06-15", "1998-10-15", 0.0375, 99.875,0,2,0) | E23: Constraints: Rate, Price, and Redemption should be greater than 0.
A24: of:=ODDLYIELD("1999-04-20";"1999-06-15"; "1998-10-15"; 0.0375; 99.875; -100;2;0) ->  | B24: error | C24: of:=ISERROR([.A24]) -> true | D24: of:=FORMULA([.A24]) -> =ODDLYIELD("1999-04-20","1999-06-15", "1998-10-15", 0.0375, 99.875, -100,2,0) | E24: Constraints: Rate, Price, and Redemption should be greater than 0.
A25: of:=ODDLYIELD("1999-04-20";"1999-06-15"; "1998-10-15"; ; 99.875; 100;2;0) ->  | B25: error | C25: of:=ISERROR([.A25]) -> true | D25: of:=FORMULA([.A25]) -> =ODDLYIELD("1999-04-20","1999-06-15", "1998-10-15", , 99.875, 100,2,0) | E25: Constraints: Rate, Price, and Redemption should be greater than 0.
A26: of:=ODDLYIELD("1999-04-20";"1999-06-15"; "1998-10-15"; 0; 99.875; 100;2;0) ->  | B26: error | C26: of:=ISERROR([.A26]) -> true | D26: of:=FORMULA([.A26]) -> =ODDLYIELD("1999-04-20","1999-06-15", "1998-10-15", 0, 99.875, 100,2,0) | E26: Constraints: Rate, Price, and Redemption should be greater than 0.
D28: ODDLYIELD Summary: Compute the yield of a security which has an irregular last interest date. Syntax: ODDLYIELD( DateParam Settlement ; DateParam Maturity ; DateParam Last ; Number Rate ; Number Price ; Number Redemption ; Number Frequency [ ; Basis Basis = 0 ] ) Returns: Number Constraints: Rate, Price, and Redemption should be greater than 0. Semantics: The parameters are Settlement: the settlement/purchase date of the security Maturity: the maturity/expire date of the security Last: the last interest date of the security Rate: the interest rate of the security Price: the price of the security Redemption: the redemption value per 100 currency units face value Frequency: the number of interest payments per year. 1=annual; 2=semiannual; 4=quarterly. Basis: indicates the day-count convention to use in the calculation

Sheet: 'file:///home/zdenek/Dokumenty/LO/sc-unit-test/Project%20Calc%20functions%20tests/fods/oddlyield.fods/function_based_test_Example.fods/function_based_test_Example_reference.fods'#Sheet2
H3: 4