Sheet: Sheet1
A1: OFFSET Function
A3: Result | B3: of:=AND([.B8:.B95]) -> true
A7: Sheet | B7: Result | C7: Description
A8: 1 | B8: of:=AND([Sheet2.C2:.C349]) -> true | C8: Simple OFFSET formulas with local references and values

Sheet: Sheet2
A1: Function | B1: Expected | C1: Correct | D1: FunctionString | E1: Comment
A2: of:=OFFSET([.A1];2;5) -> S | B2: S | C2: of:=[.A2]=[.B2] -> true | D2: of:=FORMULA([.A2]) -> =OFFSET(A1,2,5)
A3: of:=SUM(OFFSET([.G2:.H3];1;1)) -> 4 | B3: 4 | C3: of:=[.A3]=[.B3] -> true | D3: of:=FORMULA([.A3]) -> =SUM(OFFSET(G2:H3,1,1)) | F3: S | H3: 1 | I3: 1
A4: of:=SUM(OFFSET([.I4:.J5];-1;-1)) -> 4 | B4: 4 | C4: of:=[.A4]=[.B4] -> true | D4: of:=FORMULA([.A4]) -> =SUM(OFFSET(I4:J5,-1,-1)) | H4: 1 | I4: 1
A5: of:=SUM(OFFSET([.G2:.H3];0;0;3;4)) -> 4 | B5: 4 | C5: of:=[.A5]=[.B5] -> true | D5: of:=FORMULA([.A5]) -> =SUM(OFFSET(G2:H3,0,0,3,4))
A6: of:=SUM(OFFSET([.E1];2;2;5;6)) -> 4 | B6: 4 | C6: of:=[.A6]=[.B6] -> true | D6: of:=FORMULA([.A6]) -> =SUM(OFFSET(E1,2,2,5,6))
A7: of:=-([.G14]-0*OFFSET([.G10]; 0; 0; 1)) -> -55106.231365724 | B7: -55106.231365724 | C7: of:=ROUND([.A7];12)=ROUND([.B7];12) -> true | D7: of:=FORMULA([.A7]) -> =-(G14-0*OFFSET(G10, 0, 0, 1))
A8: of:=OFFSET([.G18];-1;0) -> 1984 | B8: 1984 | C8: of:=ROUND([.A8];12)=ROUND([.B8];12) -> true | D8: of:=FORMULA([.A8]) -> =OFFSET(G18,-1,0) | F8: Yearly revenues | G8: 829186.96 | H8: 621890.22
A9: of:=OFFSET([.G18];-1;0;1;1) -> 1984 | B9: 1984 | C9: of:=ROUND([.A9];12)=ROUND([.B9];12) -> true | D9: of:=FORMULA([.A9]) -> =OFFSET(G18,-1,0,1,1) | F9: Accounts Receivable as percentage of revenue | G9: of:=66458.15/1000000 -> 0.06645815 | H9: of:=38731.24/1000000 -> 0.03873124
A10: of:=OFFSET([.G18];-1;1) -> 2005 | B10: 2005 | C10: of:=ROUND([.A10];12)=ROUND([.B10];12) -> true | D10: of:=FORMULA([.A10]) -> =OFFSET(G18,-1,1) | F10: Previous year's accounts receivable | G10: 0
A11: of:=OFFSET([.G18];-1;1;1;1) -> 2005 | B11: 2005 | C11: of:=ROUND([.A11];12)=ROUND([.B11];12) -> true | D11: of:=FORMULA([.A11]) -> =OFFSET(G18,-1,1,1,1)
A12: of:=OFFSET([.G18];-1;-1) -> 1976 | B12: 1976 | C12: of:=ROUND([.A12];12)=ROUND([.B12];12) -> true | D12: of:=FORMULA([.A12]) -> =OFFSET(G18,-1,-1)
A13: of:=OFFSET([.G18];-1;-1;1;1) -> 1976 | B13: 1976 | C13: of:=ROUND([.A13];12)=ROUND([.B13];12) -> true | D13: of:=FORMULA([.A13]) -> =OFFSET(G18,-1,-1,1,1)
A14: of:=OFFSET([.G18];-1;0) -> 1984 | B14: 1984 | C14: of:=ROUND([.A14];12)=ROUND([.B14];12) -> true | D14: of:=FORMULA([.A14]) -> =OFFSET(G18,-1,0) | G14: of:=[.$G8]*[.G$9] -> 55106.231365724 | H14: of:=[.$G8]*[.H$9] -> 32115.4391526304
A15: of:=OFFSET([.G18];-1;0;1;1) -> 1984 | B15: 1984 | C15: of:=ROUND([.A15];12)=ROUND([.B15];12) -> true | D15: of:=FORMULA([.A15]) -> =OFFSET(G18,-1,0,1,1)
A16: of:=OFFSET([.G18];-1;1) -> 2005 | B16: 2005 | C16: of:=ROUND([.A16];12)=ROUND([.B16];12) -> true | D16: of:=FORMULA([.A16]) -> =OFFSET(G18,-1,1)
A17: of:=OFFSET([.G18];-1;1;1;1) -> 2005 | B17: 2005 | C17: of:=ROUND([.A17];12)=ROUND([.B17];12) -> true | D17: of:=FORMULA([.A17]) -> =OFFSET(G18,-1,1,1,1) | F17: 1976 | G17: 1984 | H17: 2005 | I17: 1996
A18: of:=OFFSET([.G18];-1;-1) -> 1976 | B18: 1976 | C18: of:=ROUND([.A18];12)=ROUND([.B18];12) -> true | D18: of:=FORMULA([.A18]) -> =OFFSET(G18,-1,-1) | F18: A4 | G18: B4 | H18: C4 | I18: D4
A19: of:=OFFSET([.G18];-1;-1;1;1) -> 1976 | B19: 1976 | C19: of:=ROUND([.A19];12)=ROUND([.B19];12) -> true | D19: of:=FORMULA([.A19]) -> =OFFSET(G18,-1,-1,1,1)
A20: of:=OFFSET([.G18];-1;0) -> 1984 | B20: 1984 | C20: of:=ROUND([.A20];12)=ROUND([.B20];12) -> true | D20: of:=FORMULA([.A20]) -> =OFFSET(G18,-1,0)
A21: of:=OFFSET([.G18];-1;0;1;1) -> 1984 | B21: 1984 | C21: of:=ROUND([.A21];12)=ROUND([.B21];12) -> true | D21: of:=FORMULA([.A21]) -> =OFFSET(G18,-1,0,1,1)
A22: of:=OFFSET([.G18];-1;1) -> 2005 | B22: 2005 | C22: of:=ROUND([.A22];12)=ROUND([.B22];12) -> true | D22: of:=FORMULA([.A22]) -> =OFFSET(G18,-1,1)
A23: of:=OFFSET([.G18];-1;1;1;1) -> 2005 | B23: 2005 | C23: of:=ROUND([.A23];12)=ROUND([.B23];12) -> true | D23: of:=FORMULA([.A23]) -> =OFFSET(G18,-1,1,1,1)
A24: of:=OFFSET([.G18];-1;-1) -> 1976 | B24: 1976 | C24: of:=ROUND([.A24];12)=ROUND([.B24];12) -> true | D24: of:=FORMULA([.A24]) -> =OFFSET(G18,-1,-1)
A25: of:=OFFSET([.G18];-1;-1;1;1) -> 1976 | B25: 1976 | C25: of:=ROUND([.A25];12)=ROUND([.B25];12) -> true | D25: of:=FORMULA([.A25]) -> =OFFSET(G18,-1,-1,1,1)
A26: of:=OFFSET([.G18];-1;0) -> 1984 | B26: 1984 | C26: of:=ROUND([.A26];12)=ROUND([.B26];12) -> true | D26: of:=FORMULA([.A26]) -> =OFFSET(G18,-1,0)
A27: of:=OFFSET([.G18];-1;0;1;1) -> 1984 | B27: 1984 | C27: of:=ROUND([.A27];12)=ROUND([.B27];12) -> true | D27: of:=FORMULA([.A27]) -> =OFFSET(G18,-1,0,1,1)
A28: of:=OFFSET([.G18];-1;1) -> 2005 | B28: 2005 | C28: of:=ROUND([.A28];12)=ROUND([.B28];12) -> true | D28: of:=FORMULA([.A28]) -> =OFFSET(G18,-1,1)
A29: of:=OFFSET([.G18];-1;1;1;1) -> 2005 | B29: 2005 | C29: of:=ROUND([.A29];12)=ROUND([.B29];12) -> true | D29: of:=FORMULA([.A29]) -> =OFFSET(G18,-1,1,1,1)
A30: of:=OFFSET([.G18];-1;-1) -> 1976 | B30: 1976 | C30: of:=ROUND([.A30];12)=ROUND([.B30];12) -> true | D30: of:=FORMULA([.A30]) -> =OFFSET(G18,-1,-1)
A31: of:=OFFSET([.G18];-1;-1;1;1) -> 1976 | B31: 1976 | C31: of:=ROUND([.A31];12)=ROUND([.B31];12) -> true | D31: of:=FORMULA([.A31]) -> =OFFSET(G18,-1,-1,1,1)
A32: of:=OFFSET([.G3:.G4];0;1) -> 1 | B32: 1 | C32: of:=ROUND([.A32];12)=ROUND([.B32];12) -> true | D32: of:=FORMULA([.A32]) -> {=OFFSET(G3:G4,0,1)}
A33: 1 | B33: 1 | C33: of:=ROUND([.A33];12)=ROUND([.B33];12) -> true | D33: of:=FORMULA([.A33]) -> {=OFFSET(G3:G4,0,1)}

Sheet: 'file:///tmp/mozilla_zdenek0/yieldmat.fods/yieldmat.fods/yieldmat.fods/function_based_test_Example.fods/function_based_test_Example_reference.fods'#Sheet2
H3: 4