Sheet: Sheet1
A1: PMT Function
A3: Result | B3: of:=AND([.B8:.B95]) -> true
A7: Sheet | B7: Result | C7: Description
A8: 1 | B8: of:=AND([Sheet2.C2:.C49]) -> true | C8: Simple PMT formulas with local references and values

Sheet: Sheet2
A1: Function | B1: Expected | C1: Correct | D1: FunctionString | E1: Comment | F1: 1 | I1: Data | J1: Description | K1: Data | L1: Description
A2: of:=PMT(0.0199/12;36;25000;0;0) -> -715.955334437392 | B2: -715.955334437392 | C2: of:=ROUND([.A2];10)=ROUND([.B2];10) -> true | D2: of:=FORMULA([.A2]) -> =PMT(0.0199/12,36,25000,0,0) | I2: 0.08 | J2: Annual interest rate | K2: 0.06 | L2: Annual interest rate
A3: of:=PMT(0.0199/12;36;25000;0;) -> -715.955334437392 | B3: -715.955334437392 | C3: of:=ROUND([.A3];10)=ROUND([.B3];10) -> true | D3: of:=FORMULA([.A3]) -> =PMT(0.0199/12,36,25000,0,) | I3: 10 | J3: Number of months of payments | K3: 18 | L3: Number of months of payments
A4: of:=PMT(0.0199/12;36;25000;0) -> -715.955334437392 | B4: -715.955334437392 | C4: of:=ROUND([.A4];10)=ROUND([.B4];10) -> true | D4: of:=FORMULA([.A4]) -> =PMT(0.0199/12,36,25000,0) | I4: 10000 | J4: Amount of loan | K4: 50000 | L4: Amount of loan
A5: of:=PMT(0.0199/12;36;25000;) -> -715.955334437392 | B5: -715.955334437392 | C5: of:=ROUND([.A5];10)=ROUND([.B5];10) -> true | D5: of:=FORMULA([.A5]) -> =PMT(0.0199/12,36,25000,)
A6: of:=PMT(0.0199/12;36;25000) -> -715.955334437392 | B6: -715.955334437392 | C6: of:=ROUND([.A6];10)=ROUND([.B6];10) -> true | D6: of:=FORMULA([.A6]) -> =PMT(0.0199/12,36,25000)
A7: of:=PMT(0.0199/12;36;25000;0;1) -> -714.770007508274 | B7: -714.770007508274 | C7: of:=ROUND([.A7];10)=ROUND([.B7];10) -> true | D7: of:=FORMULA([.A7]) -> =PMT(0.0199/12,36,25000,0,1)
A8: of:=PMT(0.0199/12;36;25000;0;2) -> -714.770007508274 | B8: -714.770007508274 | C8: of:=ROUND([.A8];10)=ROUND([.B8];10) -> true | D8: of:=FORMULA([.A8]) -> =PMT(0.0199/12,36,25000,0,2) | E8: PayType: the type of payment, defaults to 0. It is 0 if payments are due at the end of the period; 1 if they are due at the beginning of the period. With PayType=1 the first payment is made on the same day the loan is taken out. TDF#100689
A9: of:=PMT(0.0199/12;36;25000;0;-20) -> -714.770007508274 | B9: -714.770007508274 | C9: of:=ROUND([.A9];10)=ROUND([.B9];10) -> true | D9: of:=FORMULA([.A9]) -> =PMT(0.0199/12,36,25000,0,-20) | E9: Tdf#100689 PayType: the type of payment, defaults to 0. It is 0 if payments are due at the end of the period; 1 if they are due at the beginning of the period. With PayType=1 the first payment is made on the same day the loan is taken out.
A10: of:=PMT(0.0199/12;36;25000;-11;0) -> -715.658555756906 | B10: -715.658555756906 | C10: of:=ROUND([.A10];10)=ROUND([.B10];10) -> true | D10: of:=FORMULA([.A10]) -> =PMT(0.0199/12,36,25000,-11,0)
A11: of:=PMT(0.0199/12;0;25000;0;0) ->  | B11: error | C11: of:=ISERROR([.A11]) -> true | D11: of:=FORMULA([.A11]) -> =PMT(0.0199/12,0,25000,0,0) | E11: https://lists.oasis-open.org/archives/office-comment/201607/msg00002.html
A12: of:=PMT(0.0199/12;-36;25000;0;0) -> 674.497001104058 | B12: 674.497001104058 | C12: of:=ROUND([.A12];10)=ROUND([.B12];10) -> true | D12: of:=FORMULA([.A12]) -> =PMT(0.0199/12,-36,25000,0,0) | E12: Constraints: Nper > 0; tdf#100689
A13: of:=PMT(0.0199/12;36;-25000;0;0) -> 715.955334437392 | B13: 715.955334437392 | C13: of:=ROUND([.A13];10)=ROUND([.B13];10) -> true | D13: of:=FORMULA([.A13]) -> =PMT(0.0199/12,36,-25000,0,0)
A14: of:=PMT(0;36;25000;0;0) -> -694.444444444444 | B14: -694.444444444444 | C14: of:=ROUND([.A14];10)=ROUND([.B14];10) -> true | D14: of:=FORMULA([.A14]) -> =PMT(0,36,25000,0,0)
A15: of:=PMT(-1;36;25000;0;0) -> -0 | B15: -0 | C15: of:=ROUND([.A15];10)=ROUND([.B15];10) -> true | D15: of:=FORMULA([.A15]) -> =PMT(-1,36,25000,0,0)
A16: of:=PMT(-1;36;25000;0;0) -> -0 | B16: -0 | C16: of:=ROUND([.A16];10)=ROUND([.B16];10) -> true | D16: of:=FORMULA([.A16]) -> =PMT(-1,36,25000,0,0)
A17: of:=PMT(1E-016;10;1000;0;0) -> -100 | B17: -100 | C17: of:=ROUND([.A17];10)=ROUND([.B17];10) -> true | D17: of:=FORMULA([.A17]) -> =PMT(1E-016,10,1000,0,0) | E17: AOO#91870
A18: of:=PMT(4.567E-015;10;1000;0;0) -> -100.000000000003 | B18: -100.000000000003 | C18: of:=ROUND([.A18];10)=ROUND([.B18];10) -> true | D18: of:=FORMULA([.A18]) -> =PMT(4.567E-015,10,1000,0,0)
A19: of:=PMT(0.075/12; 2*12; 5000; 0;1) -> -223.600460380743 | B19: -223.600460380743 | C19: of:=ROUND([.A19];10)=ROUND([.B19];10) -> true | D19: of:=FORMULA([.A19]) -> =PMT(0.075/12, 2*12, 5000, 0,1)
A20: of:=PMT(0.06/52; 4*52; 8000; 0; 0) -> -43.2834404364871 | B20: -43.2834404364871 | C20: of:=ROUND([.A20];10)=ROUND([.B20];10) -> true | D20: of:=FORMULA([.A20]) -> =PMT(0.06/52, 4*52, 8000, 0, 0)
A21: of:=PMT(0.0025/1; 10*1; 6500; 0;0) -> -658.970973448874 | B21: -658.970973448874 | C21: of:=ROUND([.A21];10)=ROUND([.B21];10) -> true | D21: of:=FORMULA([.A21]) -> =PMT(0.0025/1, 10*1, 6500, 0,0)
A22: of:=PMT(0.08/12; 3*12; 5000; -1000; 0) -> -132.01212851239 | B22: -132.01212851239 | C22: of:=ROUND([.A22];10)=ROUND([.B22];10) -> true | D22: of:=FORMULA([.A22]) -> =PMT(0.08/12, 3*12, 5000, -1000, 0)
A23: of:=PMT([.I2]/12;[.I3];[.I4]) -> -1037.03208935915 | B23: -1037.03208935915 | C23: of:=ROUND([.A23];10)=ROUND([.B23];10) -> true | D23: of:=FORMULA([.A23]) -> =PMT(I2/12,I3,I4)
A24: of:=PMT([.I2]/12;[.I3];[.I4]) -> -1037.03208935915 | B24: -1037.03208935915 | C24: of:=ROUND([.A24];10)=ROUND([.B24];10) -> true | D24: of:=FORMULA([.A24]) -> =PMT(I2/12,I3,I4)
A25: of:=PMT([.K2]/12;[.K3]*12; 0;[.K4]) -> -129.081160867991 | B25: -129.081160867991 | C25: of:=ROUND([.A25];10)=ROUND([.B25];10) -> true | D25: of:=FORMULA([.A25]) -> =PMT(K2/12,K3*12, 0,K4)
A26: of:=ABS(PMT(0.05;12;1000)+112.82541)<0.005 -> true | B26: 1 | C26: of:=ROUND([.A26];10)=ROUND([.B26];10) -> true | D26: of:=FORMULA([.A26]) -> =ABS(PMT(0.05,12,1000)+112.82541)<0.005
A27: of:=ABS(PMT(0.05;12;1000;100)+119.10795)<0.005 -> true | B27: 1 | C27: of:=ROUND([.A27];10)=ROUND([.B27];10) -> true | D27: of:=FORMULA([.A27]) -> =ABS(PMT(0.05,12,1000,100)+119.10795)<0.005
A28: of:=ABS(PMT(0.05;12;1000;100;1)+113.43614)<0.005 -> true | B28: 1 | C28: of:=ROUND([.A28];10)=ROUND([.B28];10) -> true | D28: of:=FORMULA([.A28]) -> =ABS(PMT(0.05,12,1000,100,1)+113.43614)<0.005
A29: of:=PMT(0;10;1000) -> -100 | B29: -100 | C29: of:=ROUND([.A29];10)=ROUND([.B29];10) -> true | D29: of:=FORMULA([.A29]) -> =PMT(0,10,1000)
D40: PMT Summary: Compute the payment made each period for an investment. Syntax: PMT( Number Rate ; Integer Nper ; Number Pv [ ; [ Number Fv = 0 ] [ ; Number PayType = 0 ] ] ) Returns: Currency Constraints: Nper > 0 Semantics: Computes the payment made each period for an investment. The parameters are: Rate: the interest rate per period. Nper: the total number of payment periods. Pv: the present value of the investment. Fv: the future value of the investment; default is 0. PayType: the type of payment, defaults to 0. It is 0 if payments are due at the end of the period; 1 if they are due at the beginning of the period. With PayType=1 the first payment is made on the same day the loan is taken out.

Sheet: 'file:///Dokumenty/LO/sc-unit-test/Project%20Calc%20functions%20tests/fods/pmt.fods/pmt.fods/function_based_test_Example.fods/function_based_test_Example_reference.fods'#Sheet2
H3: 4