Sheet: Sheet1
A1: PPMT Function
A3: Result | B3: of:=AND([.B8:.B95]) -> true
A7: Sheet | B7: Result | C7: Description
A8: 1 | B8: of:=AND([Sheet2.C2:.C149]) -> true | C8: Simple PPMT formulas with local references and values

Sheet: Sheet2
A1: Function | B1: Expected | C1: Correct | D1: FunctionString | E1: Comment | I1: Data | J1: Argument description
A2: of:=PPMT(0.0875/12;1;36;5000;8000;1) -> -350.992937038239 | B2: -350.992937038239 | C2: of:=[.A2]=[.B2] -> true | D2: of:=FORMULA([.A2]) -> =PPMT(0.0875/12,1,36,5000,8000,1) | I2: 0.1 | J2: Annual interest rate
A3: of:=PPMT(0.0875/12;1;36;5000;8000;0) -> -317.093927204143 | B3: -317.093927204143 | C3: of:=[.A3]=[.B3] -> true | D3: of:=FORMULA([.A3]) -> =PPMT(0.0875/12,1,36,5000,8000,0) | I3: 2 | J3: Number of years for the loan
A4: of:=PPMT(0.0875/12;1;36;5000;8000;3) -> -350.992937038239 | B4: -350.992937038239 | C4: of:=[.A4]=[.B4] -> true | D4: of:=FORMULA([.A4]) -> =PPMT(0.0875/12,1,36,5000,8000,3) | E4: Type: optional, 0 or 1, respectively for payment at the end or at the beginning of a period. The default value is 0. https://lists.oasis-open.org/archives/office-comment/201607/msg00003.html | I4: 2000 | J4: Amount of loan
A5: of:=PPMT(0.0875/12;1;36;5000;8000;) -> -317.093927204143 | B5: -317.093927204143 | C5: of:=[.A5]=[.B5] -> true | D5: of:=FORMULA([.A5]) -> =PPMT(0.0875/12,1,36,5000,8000,)
A6: of:=PPMT(0.0875/12;1;36;5000;8000) -> -317.093927204143 | B6: -317.093927204143 | C6: of:=[.A6]=[.B6] -> true | D6: of:=FORMULA([.A6]) -> =PPMT(0.0875/12,1,36,5000,8000)
A7: of:=PPMT(0.0875/12;1;36;5000;;1) -> -157.27077007238 | B7: -157.27077007238 | C7: of:=[.A7]=[.B7] -> true | D7: of:=FORMULA([.A7]) -> =PPMT(0.0875/12,1,36,5000,,1) | I7: Data | J7: Argument description
A8: of:=PPMT(0.0875/12;1;36;5000;) -> -121.959202770824 | B8: -121.959202770824 | C8: of:=[.A8]=[.B8] -> true | D8: of:=FORMULA([.A8]) -> =PPMT(0.0875/12,1,36,5000,) | I8: 0.08 | J8: Annual interest rate
A9: of:=PPMT(0.0875/12;1;36;5000) -> -121.959202770824 | B9: -121.959202770824 | C9: of:=[.A9]=[.B9] -> true | D9: of:=FORMULA([.A9]) -> =PPMT(0.0875/12,1,36,5000) | I9: 10 | J9: Number of years for the loan
A10: of:=PPMT(0.0875/12;1;36;0;8000;1) -> -193.72216696586 | B10: -193.72216696586 | C10: of:=[.A10]=[.B10] -> true | D10: of:=FORMULA([.A10]) -> =PPMT(0.0875/12,1,36,0,8000,1) | E10: Constraints: Rate and Present should be greater than 0. | I10: 200000 | J10: Amount of loan
A11: of:=PPMT(0.0875/12;1;36;;8000;1) -> -193.72216696586 | B11: -193.72216696586 | C11: of:=[.A11]=[.B11] -> true | D11: of:=FORMULA([.A11]) -> =PPMT(0.0875/12,1,36,,8000,1) | E11: Constraints: Rate and Present should be greater than 0.
A12: of:=PPMT(0.0875/12;1;36;-5000;8000;1) -> -36.4513968934796 | B12: -36.4513968934796 | C12: of:=[.A12]=[.B12] -> true | D12: of:=FORMULA([.A12]) -> =PPMT(0.0875/12,1,36,-5000,8000,1) | E12: Constraints: Rate and Present should be greater than 0.
A13: of:=PPMT(0.0875/12;1;;5000;8000;1) ->  | B13: error | C13: of:=ISERROR([.A13]) -> true | D13: of:=FORMULA([.A13]) -> =PPMT(0.0875/12,1,,5000,8000,1)
A14: of:=PPMT(0.0875/12;1;0;5000;8000;1) ->  | B14: error | C14: of:=ISERROR([.A14]) -> true | D14: of:=FORMULA([.A14]) -> =PPMT(0.0875/12,1,0,5000,8000,1)
A15: of:=PPMT(0.0875/12;1;-36;5000;8000;1) ->  | B15: error | C15: of:=ISERROR([.A15]) -> true | D15: of:=FORMULA([.A15]) -> =PPMT(0.0875/12,1,-36,5000,8000,1)
A16: of:=PPMT(0.0875/12;1;;5000;8000;1) ->  | B16: error | C16: of:=ISERROR([.A16]) -> true | D16: of:=FORMULA([.A16]) -> =PPMT(0.0875/12,1,,5000,8000,1)
A17: of:=PPMT(0.0875/12;0;36;5000;8000;1) ->  | B17: error | C17: of:=ISERROR([.A17]) -> true | D17: of:=FORMULA([.A17]) -> =PPMT(0.0875/12,0,36,5000,8000,1)
A18: of:=PPMT(0.0875/12;-1;36;5000;8000;1) ->  | B18: error | C18: of:=ISERROR([.A18]) -> true | D18: of:=FORMULA([.A18]) -> =PPMT(0.0875/12,-1,36,5000,8000,1)
A19: of:=PPMT(0;1;36;5000;8000;1) -> -361.111111111111 | B19: -361.111111111111 | C19: of:=[.A19]=[.B19] -> true | D19: of:=FORMULA([.A19]) -> =PPMT(0,1,36,5000,8000,1) | E19: Constraints: Rate and Present should be greater than 0
A20: of:=PPMT(-0.005;1;36;5000;8000;1) -> -370.537180629527 | B20: -370.537180629527 | C20: of:=[.A20]=[.B20] -> true | D20: of:=FORMULA([.A20]) -> =PPMT(-0.005,1,36,5000,8000,1) | E20: Constraints: Rate and Present should be greater than 0
A21: of:=PPMT([.I2]/12; 1; [.I3]*12; [.I4]) -> -75.6231860083664 | B21: -75.6231860083663 | C21: of:=[.A21]=[.B21] -> true | D21: of:=FORMULA([.A21]) -> =PPMT(I2/12, 1, I3*12, I4)
A22: of:=PPMT([.I8]; [.I9]; 10;[.I10]) -> -27598.0534624214 | B22: -27598.0534624214 | C22: of:=[.A22]=[.B22] -> true | D22: of:=FORMULA([.A22]) -> =PPMT(I8, I9, 10,I10)

Sheet: 'file:///home/zdenek/Dokumenty/LO/sc-unit-test/Project%20Calc%20functions%20tests/fods/ppmt.fods/function_based_test_Example.fods/function_based_test_Example_reference.fods'#Sheet2
H3: 4