Sheet: Sheet1
A1: PRICE Function
A3: Result | B3: of:=AND([.B8:.B95]) -> true
A7: Sheet | B7: Result | C7: Description
A8: 1 | B8: of:=AND([Sheet2.C2:.C149]) -> true | C8: Simple PRICE formulas with local references and values

Sheet: Sheet2
A1: Function | B1: Expected | C1: Correct | D1: FunctionString | E1: Comment
A2: of:=PRICE("1999-02-15"; "2007-11-15"; 0.0575; 0.065; 100; 2; 0) -> 95.0428743993921 | B2: 95.0428743993921 | C2: of:=[.A2]=[.B2] -> true | D2: of:=FORMULA([.A2]) -> =PRICE("1999-02-15", "2007-11-15", 0.0575, 0.065, 100, 2, 0)
A3: of:=PRICE("1999-02-15"; "2007-11-15"; 0.0575; 0.065; 100; 2; 1) -> 95.0446242216248 | B3: 95.0446242216248 | C3: of:=[.A3]=[.B3] -> true | D3: of:=FORMULA([.A3]) -> =PRICE("1999-02-15", "2007-11-15", 0.0575, 0.065, 100, 2, 1)
A4: of:=PRICE("1999-02-15"; "2007-11-15"; 0.0575; 0.065; 100; 2; 2) -> 95.0280744571527 | B4: 95.0280744571527 | C4: of:=[.A4]=[.B4] -> true | D4: of:=FORMULA([.A4]) -> =PRICE("1999-02-15", "2007-11-15", 0.0575, 0.065, 100, 2, 2)
A5: of:=PRICE("1999-02-15"; "2007-11-15"; 0.0575; 0.065; 100; 2; 3) -> 95.0691101558316 | B5: 95.0691101558316 | C5: of:=[.A5]=[.B5] -> true | D5: of:=FORMULA([.A5]) -> =PRICE("1999-02-15", "2007-11-15", 0.0575, 0.065, 100, 2, 3)
A6: of:=PRICE("1999-02-15"; "2007-11-15"; 0.0575; 0.065; 100; 2; 4) -> 95.0428743993921 | B6: 95.0428743993921 | C6: of:=[.A6]=[.B6] -> true | D6: of:=FORMULA([.A6]) -> =PRICE("1999-02-15", "2007-11-15", 0.0575, 0.065, 100, 2, 4)
A7: of:=PRICE("1999-02-15"; "2007-11-15"; 0.0575; 0.065; 100; 2; 5) ->  | B7: error | C7: of:=ISERROR([.A7]) -> true | D7: of:=FORMULA([.A7]) -> =PRICE("1999-02-15", "2007-11-15", 0.0575, 0.065, 100, 2, 5)
A8: of:=PRICE("1999-02-15"; "2007-11-15"; 0.0575; 0.065; 100; 1; ) -> 95.0780346202577 | B8: 95.0780346202577 | C8: of:=[.A8]=[.B8] -> true | D8: of:=FORMULA([.A8]) -> =PRICE("1999-02-15", "2007-11-15", 0.0575, 0.065, 100, 1, )
A9: of:=PRICE("1999-02-15"; "2007-11-15"; 0.0575; 0.065; 100; 1 ) -> 95.0780346202577 | B9: 95.0780346202577 | C9: of:=[.A9]=[.B9] -> true | D9: of:=FORMULA([.A9]) -> =PRICE("1999-02-15", "2007-11-15", 0.0575, 0.065, 100, 1 )
A10: of:=PRICE("1999-02-15"; "2007-11-15"; 0.0575; 0.065; 100; ; 0) ->  | B10: error | C10: of:=ISERROR([.A10]) -> true | D10: of:=FORMULA([.A10]) -> =PRICE("1999-02-15", "2007-11-15", 0.0575, 0.065, 100, , 0)
A11: of:=PRICE("1999-02-15"; "2007-11-15"; 0.0575; 0.065; 100;0 ; 0) ->  | B11: error | C11: of:=ISERROR([.A11]) -> true | D11: of:=FORMULA([.A11]) -> =PRICE("1999-02-15", "2007-11-15", 0.0575, 0.065, 100,0 , 0)
A12: of:=PRICE("1999-02-15"; "2007-11-15"; 0.0575; 0.065; 100;-2 ; 0) ->  | B12: error | C12: of:=ISERROR([.A12]) -> true | D12: of:=FORMULA([.A12]) -> =PRICE("1999-02-15", "2007-11-15", 0.0575, 0.065, 100,-2 , 0)
A13: of:=PRICE("1999-02-15"; "2007-11-15"; 0.0575; 0.065; 100;-2 ; 0) ->  | B13: error | C13: of:=ISERROR([.A13]) -> true | D13: of:=FORMULA([.A13]) -> =PRICE("1999-02-15", "2007-11-15", 0.0575, 0.065, 100,-2 , 0)
A14: of:=PRICE("1999-02-15"; "2007-11-15"; 0.0575; 0.065; ; 2; 0) ->  | B14: error | C14: of:=ISERROR([.A14]) -> true | D14: of:=FORMULA([.A14]) -> =PRICE("1999-02-15", "2007-11-15", 0.0575, 0.065, , 2, 0)
A15: of:=PRICE("1999-02-15"; "2007-11-15"; 0.0575; 0.065;0 ; 2; 0) ->  | B15: error | C15: of:=ISERROR([.A15]) -> true | D15: of:=FORMULA([.A15]) -> =PRICE("1999-02-15", "2007-11-15", 0.0575, 0.065,0 , 2, 0)
A16: of:=PRICE("1999-02-15"; "2007-11-15"; 0.0575; 0.065;-100 ; 2; 0) ->  | B16: error | C16: of:=ISERROR([.A16]) -> true | D16: of:=FORMULA([.A16]) -> =PRICE("1999-02-15", "2007-11-15", 0.0575, 0.065,-100 , 2, 0)
A17: of:=PRICE("1999-02-15"; "2007-11-15"; 0.0575; ; 100; 2; 0) ->  | B17: error | C17: of:=ISERROR([.A17]) -> true | D17: of:=FORMULA([.A17]) -> =PRICE("1999-02-15", "2007-11-15", 0.0575, , 100, 2, 0) | E17: Constraints: Rate, AnnualYield, and Redemption should be greater than 0;
A18: of:=PRICE("1999-02-15"; "2007-11-15"; 0.0575; 0; 100; 2; 0) -> 150.3125 | B18: 150.3125 | C18: of:=[.A18]=[.B18] -> true | D18: of:=FORMULA([.A18]) -> =PRICE("1999-02-15", "2007-11-15", 0.0575, 0, 100, 2, 0) | E18: Constraints: Rate, AnnualYield, and Redemption should be greater than 0;
A19: of:=PRICE("1999-02-15"; "2007-11-15"; 0.0575; -0.065; 100; 2; 0) ->  | B19: error | C19: of:=ISERROR([.A19]) -> true | D19: of:=FORMULA([.A19]) -> =PRICE("1999-02-15", "2007-11-15", 0.0575, -0.065, 100, 2, 0) | E19: Constraints: Rate, AnnualYield, and Redemption should be greater than 0;
A20: of:=PRICE("1999-02-15"; "2007-11-15"; 0; 0.065; 100; 2; 0) -> 57.1378565335038 | B20: 57.1378565335038 | C20: of:=[.A20]=[.B20] -> true | D20: of:=FORMULA([.A20]) -> =PRICE("1999-02-15", "2007-11-15", 0, 0.065, 100, 2, 0) | E20: Constraints: Rate, AnnualYield, and Redemption should be greater than 0;
A21: of:=PRICE("1999-02-15"; "2007-11-15"; ; 0.065; 100; 2; 0) ->  | B21: error | C21: of:=ISERROR([.A21]) -> true | D21: of:=FORMULA([.A21]) -> =PRICE("1999-02-15", "2007-11-15", , 0.065, 100, 2, 0) | E21: Constraints: Rate, AnnualYield, and Redemption should be greater than 0;
A22: of:=PRICE("1999-02-15"; "2007-11-15";-0.06 ; 0.065; 100; 2; 0) ->  | B22: error | C22: of:=ISERROR([.A22]) -> true | D22: of:=FORMULA([.A22]) -> =PRICE("1999-02-15", "2007-11-15",-0.06 , 0.065, 100, 2, 0)
A23: of:=PRICE("1999-02-15"; "1997-11-15"; 0.0575; 0.065; 100; 2; 0) ->  | B23: error | C23: of:=ISERROR([.A23]) -> true | D23: of:=FORMULA([.A23]) -> =PRICE("1999-02-15", "1997-11-15", 0.0575, 0.065, 100, 2, 0)
A24: of:=PRICE("1999-02-15"; "1999-02-15"; 0.0575; 0.065; 100; 2; 0) ->  | B24: error | C24: of:=ISERROR([.A24]) -> true | D24: of:=FORMULA([.A24]) -> =PRICE("1999-02-15", "1999-02-15", 0.0575, 0.065, 100, 2, 0)
A25: of:=PRICE([.I25];[.I26];[.I27];[.I28];[.I29];[.I30];[.I31]) -> 100.472555867292 | B25: 100.472555867292 | C25: of:=ROUND([.A25];12)=ROUND([.B25];12) -> true | D25: of:=FORMULA([.A25]) -> =PRICE(I25,I26,I27,I28,I29,I30,I31) | E25: AOO#36075 | H25: Settlement | I25: 2004-01-08 | J25: 2004-02-08 | K25: 2004-03-08 | L25: 2004-04-08 | M25: 2004-05-08 | N25: 2004-06-08 | O25: 2004-07-08 | P25: 2004-08-08 | Q25: 2004-09-08 | R25: 2004-10-08
A26: of:=PRICE([.J25];[.J26];[.J27];[.J28];[.J29];[.J30];[.J31]) -> 100.424425709057 | B26: 100.424425709057 | C26: of:=ROUND([.A26];12)=ROUND([.B26];12) -> true | D26: of:=FORMULA([.A26]) -> =PRICE(J25,J26,J27,J28,J29,J30,J31) | H26: Maturity | I26: 2004-10-24 | J26: 2004-10-24 | K26: 2004-10-24 | L26: 2004-10-24 | M26: 2004-10-24 | N26: 2004-10-24 | O26: 2004-10-24 | P26: 2004-10-24 | Q26: 2004-10-24 | R26: 2004-10-24
A27: of:=PRICE([.K25];[.K26];[.K27];[.K28];[.K29];[.K30];[.K31]) -> 100.372924031957 | B27: 100.372924031957 | C27: of:=ROUND([.A27];12)=ROUND([.B27];12) -> true | D27: of:=FORMULA([.A27]) -> =PRICE(K25,K26,K27,K28,K29,K30,K31) | H27: Rate | I27: 0.08875 | J27: 0.08875 | K27: 0.08875 | L27: 0.08875 | M27: 0.08875 | N27: 0.08875 | O27: 0.08875 | P27: 0.08875 | Q27: 0.08875 | R27: 0.08875
A28: of:=PRICE([.L25];[.L26];[.L27];[.L28];[.L29];[.L30];[.L31]) -> 100.326120761241 | B28: 100.326120761241 | C28: of:=ROUND([.A28];12)=ROUND([.B28];12) -> true | D28: of:=FORMULA([.A28]) -> =PRICE(L25,L26,L27,L28,L29,L30,L31) | H28: Yield | I28: 0.0825 | J28: 0.0825 | K28: 0.0825 | L28: 0.0825 | M28: 0.0825 | N28: 0.0825 | O28: 0.0825 | P28: 0.0825 | Q28: 0.0825 | R28: 0.0825
A29: of:=PRICE([.M25];[.M26];[.M27];[.M28];[.M29];[.M30];[.M31]) -> 100.276990704766 | B29: 100.276990704766 | C29: of:=ROUND([.A29];12)=ROUND([.B29];12) -> true | D29: of:=FORMULA([.A29]) -> =PRICE(M25,M26,M27,M28,M29,M30,M31) | H29: Redemption | I29: 100 | J29: 100 | K29: 100 | L29: 100 | M29: 100 | N29: 100 | O29: 100 | P29: 100 | Q29: 100 | R29: 100
A30: of:=PRICE([.N25];[.N26];[.N27];[.N28];[.N29];[.N30];[.N31]) -> 100.224482301852 | B30: 100.224482301852 | C30: of:=ROUND([.A30];12)=ROUND([.B30];12) -> true | D30: of:=FORMULA([.A30]) -> =PRICE(N25,N26,N27,N28,N29,N30,N31) | H30: Frequency | I30: 4 | J30: 4 | K30: 4 | L30: 4 | M30: 4 | N30: 4 | O30: 4 | P30: 4 | Q30: 4 | R30: 4
A31: of:=PRICE([.O25];[.O26];[.O27];[.O28];[.O29];[.O30];[.O31]) -> 100.176665431127 | B31: 100.176665431127 | C31: of:=ROUND([.A31];12)=ROUND([.B31];12) -> true | D31: of:=FORMULA([.A31]) -> =PRICE(O25,O26,O27,O28,O29,O30,O31) | H31: Basis | I31: 0 | J31: 0 | K31: 0 | L31: 0 | M31: 0 | N31: 0 | O31: 0 | P31: 0 | Q31: 0 | R31: 0
A32: of:=PRICE([.P25];[.P26];[.P27];[.P28];[.P29];[.P30];[.P31]) -> 100.126514853511 | B32: 100.126514853511 | C32: of:=ROUND([.A32];12)=ROUND([.B32];12) -> true | D32: of:=FORMULA([.A32]) -> =PRICE(P25,P26,P27,P28,P29,P30,P31)
A33: of:=PRICE([.Q25];[.Q26];[.Q27];[.Q28];[.Q29];[.Q30];[.Q31]) -> 100.072978961063 | B33: 100.072978961063 | C33: of:=ROUND([.A33];12)=ROUND([.B33];12) -> true | D33: of:=FORMULA([.A33]) -> =PRICE(Q25,Q26,Q27,Q28,Q29,Q30,Q31)
A34: of:=PRICE([.R25];[.R26];[.R27];[.R28];[.R29];[.R30];[.R31]) -> 100.02412758483 | B34: 100.02412758483 | C34: of:=ROUND([.A34];12)=ROUND([.B34];12) -> true | D34: of:=FORMULA([.A34]) -> =PRICE(R25,R26,R27,R28,R29,R30,R31)
A35: of:=PRICE([.I35];[.I36];[.I37];[.I38];[.I39];[.I40];[.I41]) -> 100.449578219874 | B35: 100.449578219874 | C35: of:=ROUND([.A35];12)=ROUND([.B35];12) -> true | D35: of:=FORMULA([.A35]) -> =PRICE(I35,I36,I37,I38,I39,I40,I41) | H35: Settlement | I35: 2004-01-08 | J35: 2004-02-08 | K35: 2004-03-08 | L35: 2004-04-08 | M35: 2004-05-08 | N35: 2004-06-08 | O35: 2004-07-08 | P35: 2004-08-08 | Q35: 2004-09-08 | R35: 2004-10-08
A36: of:=PRICE([.J35];[.J36];[.J37];[.J38];[.J39];[.J40];[.J41]) -> 100.401338756182 | B36: 100.401338756182 | C36: of:=ROUND([.A36];12)=ROUND([.B36];12) -> true | D36: of:=FORMULA([.A36]) -> =PRICE(J35,J36,J37,J38,J39,J40,J41) | H36: Maturity | I36: 2004-10-24 | J36: 2004-10-24 | K36: 2004-10-24 | L36: 2004-10-24 | M36: 2004-10-24 | N36: 2004-10-24 | O36: 2004-10-24 | P36: 2004-10-24 | Q36: 2004-10-24 | R36: 2004-10-24
A37: of:=PRICE([.K35];[.K36];[.K37];[.K38];[.K39];[.K40];[.K41]) -> 100.357772590583 | B37: 100.357772590583 | C37: of:=ROUND([.A37];12)=ROUND([.B37];12) -> true | D37: of:=FORMULA([.A37]) -> =PRICE(K35,K36,K37,K38,K39,K40,K41) | H37: Rate | I37: 0.08875 | J37: 0.08875 | K37: 0.08875 | L37: 0.08875 | M37: 0.08875 | N37: 0.08875 | O37: 0.08875 | P37: 0.08875 | Q37: 0.08875 | R37: 0.08875
A38: of:=PRICE([.L35];[.L36];[.L37];[.L38];[.L39];[.L40];[.L41]) -> 100.318911313312 | B38: 100.318911313312 | C38: of:=ROUND([.A38];12)=ROUND([.B38];12) -> true | D38: of:=FORMULA([.A38]) -> =PRICE(L35,L36,L37,L38,L39,L40,L41) | H38: Yield | I38: 0.0825 | J38: 0.0825 | K38: 0.0825 | L38: 0.0825 | M38: 0.0825 | N38: 0.0825 | O38: 0.0825 | P38: 0.0825 | Q38: 0.0825 | R38: 0.0825
A39: of:=PRICE([.M35];[.M36];[.M37];[.M38];[.M39];[.M40];[.M41]) -> 100.270813599753 | B39: 100.270813599753 | C39: of:=ROUND([.A39];12)=ROUND([.B39];12) -> true | D39: of:=FORMULA([.A39]) -> =PRICE(M35,M36,M37,M38,M39,M40,M41) | H39: Redemption | I39: 100 | J39: 100 | K39: 100 | L39: 100 | M39: 100 | N39: 100 | O39: 100 | P39: 100 | Q39: 100 | R39: 100
A40: of:=PRICE([.N35];[.N36];[.N37];[.N38];[.N39];[.N40];[.N41]) -> 100.211366967729 | B40: 100.211366967729 | C40: of:=ROUND([.A40];12)=ROUND([.B40];12) -> true | D40: of:=FORMULA([.A40]) -> =PRICE(N35,N36,N37,N38,N39,N40,N41) | H40: Frequency | I40: 2 | J40: 2 | K40: 2 | L40: 2 | M40: 2 | N40: 2 | O40: 2 | P40: 2 | Q40: 2 | R40: 2
A41: of:=PRICE([.O35];[.O36];[.O37];[.O38];[.O39];[.O40];[.O41]) -> 100.156517876363 | B41: 100.156517876363 | C41: of:=ROUND([.A41];12)=ROUND([.B41];12) -> true | D41: of:=FORMULA([.A41]) -> =PRICE(O35,O36,O37,O38,O39,O40,O41) | H41: Basis | I41: 0 | J41: 0 | K41: 0 | L41: 0 | M41: 0 | N41: 0 | O41: 0 | P41: 0 | Q41: 0 | R41: 0
A42: of:=PRICE([.P35];[.P36];[.P37];[.P38];[.P39];[.P40];[.P41]) -> 100.106297403791 | B42: 100.106297403791 | C42: of:=ROUND([.A42];12)=ROUND([.B42];12) -> true | D42: of:=FORMULA([.A42]) -> =PRICE(P35,P36,P37,P38,P39,P40,P41)
A43: of:=PRICE([.Q35];[.Q36];[.Q37];[.Q38];[.Q39];[.Q40];[.Q41]) -> 100.060736838227 | B43: 100.060736838227 | C43: of:=ROUND([.A43];12)=ROUND([.B43];12) -> true | D43: of:=FORMULA([.A43]) -> =PRICE(Q35,Q36,Q37,Q38,Q39,Q40,Q41)
A44: of:=PRICE([.R35];[.R36];[.R37];[.R38];[.R39];[.R40];[.R41]) -> 100.019867679385 | B44: 100.019867679385 | C44: of:=ROUND([.A44];12)=ROUND([.B44];12) -> true | D44: of:=FORMULA([.A44]) -> =PRICE(R35,R36,R37,R38,R39,R40,R41)
A45: of:=PRICE([.I45];[.I46];[.I47];[.I48];[.I49];[.I50];[.I51]) -> 100.405400047889 | B45: 100.405400047889 | C45: of:=ROUND([.A45];12)=ROUND([.B45];12) -> true | D45: of:=FORMULA([.A45]) -> =PRICE(I45,I46,I47,I48,I49,I50,I51) | H45: Settlement | I45: 2004-01-08 | J45: 2004-02-08 | K45: 2004-03-08 | L45: 2004-04-08 | M45: 2004-05-08 | N45: 2004-06-08 | O45: 2004-07-08 | P45: 2004-08-08 | Q45: 2004-09-08 | R45: 2004-10-08
A46: of:=PRICE([.J45];[.J46];[.J47];[.J48];[.J49];[.J50];[.J51]) -> 100.343391809716 | B46: 100.343391809716 | C46: of:=ROUND([.A46];12)=ROUND([.B46];12) -> true | D46: of:=FORMULA([.A46]) -> =PRICE(J45,J46,J47,J48,J49,J50,J51) | H46: Maturity | I46: 2004-10-24 | J46: 2004-10-24 | K46: 2004-10-24 | L46: 2004-10-24 | M46: 2004-10-24 | N46: 2004-10-24 | O46: 2004-10-24 | P46: 2004-10-24 | Q46: 2004-10-24 | R46: 2004-10-24
A47: of:=PRICE([.K45];[.K46];[.K47];[.K48];[.K49];[.K50];[.K51]) -> 100.285874516781 | B47: 100.285874516781 | C47: of:=ROUND([.A47];12)=ROUND([.B47];12) -> true | D47: of:=FORMULA([.A47]) -> =PRICE(K45,K46,K47,K48,K49,K50,K51) | H47: Rate | I47: 0.08875 | J47: 0.08875 | K47: 0.08875 | L47: 0.08875 | M47: 0.08875 | N47: 0.08875 | O47: 0.08875 | P47: 0.08875 | Q47: 0.08875 | R47: 0.08875
A48: of:=PRICE([.L45];[.L46];[.L47];[.L48];[.L49];[.L50];[.L51]) -> 100.23287793492 | B48: 100.23287793492 | C48: of:=ROUND([.A48];12)=ROUND([.B48];12) -> true | D48: of:=FORMULA([.A48]) -> =PRICE(L45,L46,L47,L48,L49,L50,L51) | H48: Yield | I48: 0.0825 | J48: 0.0825 | K48: 0.0825 | L48: 0.0825 | M48: 0.0825 | N48: 0.0825 | O48: 0.0825 | P48: 0.0825 | Q48: 0.0825 | R48: 0.0825
A49: of:=PRICE([.M45];[.M46];[.M47];[.M48];[.M49];[.M50];[.M51]) -> 100.184432027256 | B49: 100.184432027256 | C49: of:=ROUND([.A49];12)=ROUND([.B49];12) -> true | D49: of:=FORMULA([.A49]) -> =PRICE(M45,M46,M47,M48,M49,M50,M51) | H49: Redemption | I49: 100 | J49: 100 | K49: 100 | L49: 100 | M49: 100 | N49: 100 | O49: 100 | P49: 100 | Q49: 100 | R49: 100
A50: of:=PRICE([.N45];[.N46];[.N47];[.N48];[.N49];[.N50];[.N51]) -> 100.140566955506 | B50: 100.140566955506 | C50: of:=ROUND([.A50];12)=ROUND([.B50];12) -> true | D50: of:=FORMULA([.A50]) -> =PRICE(N45,N46,N47,N48,N49,N50,N51) | H50: Frequency | I50: 1 | J50: 1 | K50: 1 | L50: 1 | M50: 1 | N50: 1 | O50: 1 | P50: 1 | Q50: 1 | R50: 1
A51: of:=PRICE([.O45];[.O46];[.O47];[.O48];[.O49];[.O50];[.O51]) -> 100.1013130813 | B51: 100.1013130813 | C51: of:=ROUND([.A51];12)=ROUND([.B51];12) -> true | D51: of:=FORMULA([.A51]) -> =PRICE(O45,O46,O47,O48,O49,O50,O51) | H51: Basis | I51: 0 | J51: 0 | K51: 0 | L51: 0 | M51: 0 | N51: 0 | O51: 0 | P51: 0 | Q51: 0 | R51: 0
A52: of:=PRICE([.P45];[.P46];[.P47];[.P48];[.P49];[.P50];[.P51]) -> 100.066700967501 | B52: 100.066700967501 | C52: of:=ROUND([.A52];12)=ROUND([.B52];12) -> true | D52: of:=FORMULA([.A52]) -> =PRICE(P45,P46,P47,P48,P49,P50,P51)
A53: of:=PRICE([.Q45];[.Q46];[.Q47];[.Q48];[.Q49];[.Q50];[.Q51]) -> 100.036761379542 | B53: 100.036761379542 | C53: of:=ROUND([.A53];12)=ROUND([.B53];12) -> true | D53: of:=FORMULA([.A53]) -> =PRICE(Q45,Q46,Q47,Q48,Q49,Q50,Q51)
A54: of:=PRICE([.R45];[.R46];[.R47];[.R48];[.R49];[.R50];[.R51]) -> 100.011525286772 | B54: 100.011525286772 | C54: of:=ROUND([.A54];12)=ROUND([.B54];12) -> true | D54: of:=FORMULA([.A54]) -> =PRICE(R45,R46,R47,R48,R49,R50,R51)
D56: PRICE Summary: Calculates a quoted price for an interest paying security, per 100 currency units of face value. Syntax: PRICE( DateParam Settlement ; DateParam Maturity ; Number Rate ; Number AnnualYield ; Number Redemption ; Number Frequency [ ; Basis Basis = 0 ] ) Returns: Number Constraints: Rate, AnnualYield, and Redemption should be greater than 0; Frequency = 1, 2 or 4. Semantics: If A is the number of days from the Settlement date to next coupon date, B is the number of days of the coupon period that the Settlement is in, C is the number of coupons between Settlement date and Redemption date, D is the number of days from beginning of coupon period to Settlement date, then PRICE is calculated as

Sheet: 'file:///home/zdenek/Dokumenty/LO/sc-unit-test/Project%20Calc%20functions%20tests/fods/function_based_test_Example.fods/function_based_test_Example_reference.fods'#Sheet2
H3: 4