Sheet: Sheet1
A1: RATE Function
A3: Result | B3: of:=AND([.B8:.B95]) -> true
A7: Sheet | B7: Result | C7: Description
A8: 1 | B8: of:=AND([Sheet2.C2:.C349]) -> true | C8: Simple RATE formulas with local references and values

Sheet: Sheet2
A1: Function | B1: Expected | C1: Correct | D1: FunctionString | E1: Comment | I1: Data | J1: Description
A2: of:=RATE(3;-10;900) -> -0.75626593687807 | B2: -0.75626593687807 | C2: of:=ROUND([.A2];12)=ROUND([.B2];12) -> true | D2: of:=FORMULA([.A2]) -> =RATE(3,-10,900) | I2: 4 | J2: Years of the loan
A3: of:=RATE([.I2]*12; [.I3]; [.I4]) -> 0.00770147248823279 | B3: 0.00770147248823279 | C3: of:=ROUND([.A3];12)=ROUND([.B3];12) -> true | D3: of:=FORMULA([.A3]) -> =RATE(I2*12, I3, I4) | I3: -200 | J3: Monthly payment
A4: of:=RATE([.I2]*12; [.I3]; [.I4])*12 -> 0.0924176698587934 | B4: 0.0924176698587934 | C4: of:=ROUND([.A4];12)=ROUND([.B4];12) -> true | D4: of:=FORMULA([.A4]) -> =RATE(I2*12, I3, I4)*12 | I4: 8000 | J4: Amount of the loan
A5: of:=RATE(3;-10;900;0;0;0) -> -0.756265936878073 | B5: -0.756265936878073 | C5: of:=ROUND([.A5];12)=ROUND([.B5];12) -> true | D5: of:=FORMULA([.A5]) -> =RATE(3,-10,900,0,0,0)
A6: of:=RATE(3;-10;900;0;0;1) -> -0.756265936878073 | B6: -0.756265936878073 | C6: of:=ROUND([.A6];12)=ROUND([.B6];12) -> true | D6: of:=FORMULA([.A6]) -> =RATE(3,-10,900,0,0,1)
A7: of:=RATE(3;-10;900;0;0;2) -> -0.756265936878073 | B7: -0.756265936878073 | C7: of:=ROUND([.A7];12)=ROUND([.B7];12) -> true | D7: of:=FORMULA([.A7]) -> =RATE(3,-10,900,0,0,2)
A8: of:=RATE(3;-10;900;-1;0;2) -> -0.749594208543077 | B8: -0.749594208543077 | C8: of:=ROUND([.A8];12)=ROUND([.B8];12) -> true | D8: of:=FORMULA([.A8]) -> =RATE(3,-10,900,-1,0,2)
A9: of:=RATE(3;-10;900;-1;0;2) -> -0.749594208543077 | B9: -0.749594208543077 | C9: of:=ROUND([.A9];12)=ROUND([.B9];12) -> true | D9: of:=FORMULA([.A9]) -> =RATE(3,-10,900,-1,0,2)
A10: of:=RATE(3;-10;900;-1;0;-2) -> -0.749594208543077 | B10: -0.749594208543077 | C10: of:=ROUND([.A10];12)=ROUND([.B10];12) -> true | D10: of:=FORMULA([.A10]) -> =RATE(3,-10,900,-1,0,-2)
A11: of:=RATE(3;-10;-900;0;0;2) ->  | B11: error | C11: of:=ISERROR([.A11]) -> true | D11: of:=FORMULA([.A11]) -> =RATE(3,-10,-900,0,0,2)
A12: of:=RATE(3;10;900;0;0;2) ->  | B12: error | C12: of:=ISERROR([.A12]) -> true | D12: of:=FORMULA([.A12]) -> =RATE(3,10,900,0,0,2)
A13: of:=RATE(3;-10;900;0;2;0) -> -0.88823346276572 | B13: -0.88823346276572 | C13: of:=ROUND([.A13];12)=ROUND([.B13];12) -> true | D13: of:=FORMULA([.A13]) -> =RATE(3,-10,900,0,2,0)
A14: of:=RATE(-3;-10;900;0;0;2) ->  | B14: error | C14: of:=ISERROR([.A14]) -> true | D14: of:=FORMULA([.A14]) -> =RATE(-3,-10,900,0,0,2)
A15: of:=RATE(2*12; -250; 5000) -> 0.0151308439023102 | B15: 0.0151308439023102 | C15: of:=ROUND([.A15];12)=ROUND([.B15];12) -> true | D15: of:=FORMULA([.A15]) -> =RATE(2*12, -250, 5000)
A16: of:=RATE(2*12; -250; 5000; ; 1) -> 0.0165501190666842 | B16: 0.0165501190666842 | C16: of:=ROUND([.A16];12)=ROUND([.B16];12) -> true | D16: of:=FORMULA([.A16]) -> =RATE(2*12, -250, 5000, , 1)
A17: of:=RATE(4*52; -700; 8000; ; 0) -> 0.0874999976840937 | B17: 0.0874999976840937 | C17: of:=ROUND([.A17];12)=ROUND([.B17];12) -> true | D17: of:=FORMULA([.A17]) -> =RATE(4*52, -700, 8000, , 0)
A18: of:=RATE(10*1; -1000; 6500) -> 0.0871137556058632 | B18: 0.0871137556058632 | C18: of:=ROUND([.A18];12)=ROUND([.B18];12) -> true | D18: of:=FORMULA([.A18]) -> =RATE(10*1, -1000, 6500)
A19: of:=RATE([.H19];[.H21];[.H20];[.H22];[.H23];[.H24]) ->  | B19: error | C19: of:=ISERROR([.A19]) -> true | D19: of:=FORMULA([.A19]) -> =RATE(H19,H21,H20,H22,H23,H24) | G19: Nper | H19: 4 | I19: 4 | J19: 2 | K19: 2 | L19: 2 | M19: 2
A20: of:=RATE([.I19];[.I21];[.I20];[.I22];[.I23];[.I24]) -> 0.895219454192331 | B20: 0.895219454192331 | C20: of:=ROUND([.A20];12)=ROUND([.B20];12) -> true | D20: of:=FORMULA([.A20]) -> =RATE(I19,I21,I20,I22,I23,I24) | G20: Pv | H20: -1 | I20: -1 | J20: 1 | K20: 1 | L20: 1 | M20: 1
A21: of:=RATE([.J19];[.J21];[.J20];[.J22];[.J23];[.J24]) -> 0.200000000000001 | B21: 0.200000000000001 | C21: of:=ROUND([.A21];12)=ROUND([.B21];12) -> true | D21: of:=FORMULA([.A21]) -> =RATE(J19,J21,J20,J22,J23,J24) | G21: Payment | H21: 0.82 | I21: 0.82 | J21: -2.5 | K21: -2.5 | L21: -2.5 | M21: -2.5
A22: of:=RATE([.K19];[.K21];[.K20];[.K22];[.K23];[.K24]) -> 0.300000000000016 | B22: 0.300000000000016 | C22: of:=ROUND([.A22];12)=ROUND([.B22];12) -> true | D22: of:=FORMULA([.A22]) -> =RATE(K19,K21,K20,K22,K23,K24) | G22: Fv | H22: 2 | I22: 2 | J22: 4.06 | K22: 4.06 | L22: 4.0625 | M22: 4.0625
A23: of:=RATE([.L19];[.L21];[.L20];[.L22];[.L23];[.L24]) -> 0.2500000946085 | B23: 0.2500000946085 | C23: of:=ROUND([.A23];12)=ROUND([.B23];12) -> true | D23: of:=FORMULA([.A23]) -> =RATE(L19,L21,L20,L22,L23,L24) | G23: Type | I23: 0 | K23: 0 | L23: 0 | M23: 0
A24: of:=RATE([.M19];[.M21];[.M20];[.M22];[.M23];[.M24]) -> 0.25 | B24: 0.25 | C24: of:=ROUND([.A24];12)=ROUND([.B24];12) -> true | D24: of:=FORMULA([.A24]) -> =RATE(M19,M21,M20,M22,M23,M24) | G24: Guess | I24: 1 | K24: 0.25 | L24: 0.3 | M24: 0.25
A25: of:=RATE([.H25];[.H27];[.H26];[.H28];[.H29];[.H30]) -> 0.0080529819239056 | B25: 0.0080529819239056 | C25: of:=ROUND([.A25];12)=ROUND([.B25];12) -> true | D25: of:=FORMULA([.A25]) -> =RATE(H25,H27,H26,H28,H29,H30) | G25: Nper | H25: 48 | I25: of:=[.H25] -> 48
A26: of:=RATE([.I25];[.I27];[.I26];[.I28];[.I29];[.I30]) -> 0.0080529819239056 | B26: 0.0080529819239056 | C26: of:=ROUND([.A26];12)=ROUND([.B26];12) -> true | D26: of:=FORMULA([.A26]) -> =RATE(I25,I27,I26,I28,I29,I30) | G26: Pv | H26: 2000 | I26: of:=[.H26]+[.H27]*[.H29] -> 1950
A27: of:=RATE([.J30];[.J32];[.J31];[.J33];[.J34];[.J35]) -> 0.0080529819239056 | B27: 0.0080529819239056 | C27: of:=ROUND([.A27];12)=ROUND([.B27];12) -> true | D27: of:=FORMULA([.A27]) -> =RATE(J30,J32,J31,J33,J34,J35) | G27: Payment | H27: -50 | I27: of:=[.H27] -> -50
A28: of:=RATE([.K30];[.K32];[.K31];[.K33];[.K34];[.K35]) -> 0.0078735205223535 | B28: 0.0078735205223535 | C28: of:=ROUND([.A28];12)=ROUND([.B28];12) -> true | D28: of:=FORMULA([.A28]) -> =RATE(K30,K32,K31,K33,K34,K35) | G28: Fv | H28: 0 | I28: of:=[.H28]-[.H27]*[.H29] -> 50
A29: of:=RATE([.H40];[.H42];[.H41];[.H43];[.H44];[.H45]) -> 0.00792577876446905 | B29: 0.00792577876446905 | C29: of:=ROUND([.A29];12)=ROUND([.B29];12) -> true | D29: of:=FORMULA([.A29]) -> =RATE(H40,H42,H41,H43,H44,H45) | G29: Type | H29: 1 | I29: 0
A30: of:=RATE([.I40];[.I42];[.I41];[.I43];[.I44];[.I45]) -> 0.0082190741125343 | B30: 0.0082190741125343 | C30: of:=ROUND([.A30];12)=ROUND([.B30];12) -> true | D30: of:=FORMULA([.A30]) -> =RATE(I40,I42,I41,I43,I44,I45) | G30: Guess | J30: 48 | K30: of:=[.J30] -> 48
A31: of:=RATE([.J40];[.J42];[.J41];[.J43];[.J44];[.J45]) -> 0.00770147248820161 | B31: 0.00770147248820161 | C31: of:=ROUND([.A31];12)=ROUND([.B31];12) -> true | D31: of:=FORMULA([.A31]) -> =RATE(J40,J42,J41,J43,J44,J45) | J31: 2000 | K31: of:=[.J31]+[.J32]*[.J34] -> 1975
A32: of:=RATE([.K40];[.K42];[.K41];[.K43];[.K44];[.K45]) -> -0.977281511751269 | B32: -0.977281511751269 | C32: of:=ROUND([.A32];12)=ROUND([.B32];12) -> true | D32: of:=FORMULA([.A32]) -> =RATE(K40,K42,K41,K43,K44,K45) | J32: -50 | K32: of:=[.J32] -> -50
A33: of:=RATE([.L40];[.L42];[.L41];[.L43];[.L44];[.L45]) -> 0.126939052753719 | B33: 0.126939052753719 | C33: of:=ROUND([.A33];12)=ROUND([.B33];12) -> true | D33: of:=FORMULA([.A33]) -> =RATE(L40,L42,L41,L43,L44,L45) | J33: 0 | K33: of:=[.J33]-[.J32]*[.J34] -> 25
A34: of:=RATE([.M40];[.M42];[.M41];[.M43];[.M44];[.M45]) -> 0.126939052753719 | B34: 0.126939052753719 | C34: of:=ROUND([.A34];12)=ROUND([.B34];12) -> true | D34: of:=FORMULA([.A34]) -> =RATE(M40,M42,M41,M43,M44,M45) | J34: 0.5 | K34: 0
A35: of:=RATE([.N40];[.N42];[.N41];[.N43];[.N44];[.N45]) -> 0.0000328946279214223 | B35: 0.0000328946279214223 | C35: of:=ROUND([.A35];12)=ROUND([.B35];12) -> true | D35: of:=FORMULA([.A35]) -> =RATE(N40,N42,N41,N43,N44,N45)
A36: of:=ROUND(RATE([.F37];35;-250;0);6) -> -0.86 | B36: -0.86 | C36: of:=ROUND([.A36];12)=ROUND([.B36];12) -> true | D36: of:=FORMULA([.A36]) -> =ROUND(RATE(F37,35,-250,0),6) | F36: Number of Periods
A37: of:=ROUND(RATE([.F38];35;-250;0);6) -> -0.549343 | B37: -0.549343 | C37: of:=ROUND([.A37];12)=ROUND([.B37];12) -> true | D37: of:=FORMULA([.A37]) -> =ROUND(RATE(F38,35,-250,0),6) | F37: 1
A38: of:=ROUND(RATE([.F39];35;-250;0);6) -> -0.33407 | B38: -0.33407 | C38: of:=ROUND([.A38];12)=ROUND([.B38];12) -> true | D38: of:=FORMULA([.A38]) -> =ROUND(RATE(F39,35,-250,0),6) | F38: of:=[.F37]+1 -> 2
A39: of:=ROUND(RATE([.F40];35;-250;0);6) -> -0.197416 | B39: -0.197416 | C39: of:=ROUND([.A39];12)=ROUND([.B39];12) -> true | D39: of:=FORMULA([.A39]) -> =ROUND(RATE(F40,35,-250,0),6) | F39: of:=[.F38]+1 -> 3
A40: of:=ROUND(RATE([.F41];35;-250;0);6) -> -0.108216 | B40: -0.108216 | C40: of:=ROUND([.A40];12)=ROUND([.B40];12) -> true | D40: of:=FORMULA([.A40]) -> =ROUND(RATE(F41,35,-250,0),6) | F40: of:=[.F39]+1 -> 4 | G40: Nper | H40: 48.3 | I40: 48.7 | J40: 48 | K40: of:=0.9753161640958 -> 0.9753161640958 | L40: 9.99999999999999 | M40: of:=10 -> 10 | N40: 70000
A41: of:=ROUND(RATE([.F42];35;-250;0);6) -> -0.04765 | B41: -0.04765 | C41: of:=ROUND([.A41];12)=ROUND([.B41];12) -> true | D41: of:=FORMULA([.A41]) -> =ROUND(RATE(F42,35,-250,0),6) | F41: of:=[.F40]+1 -> 5 | G41: Pv | H41: 2000 | I41: 2000 | J41: 2000 | K41: 2000 | L41: -1 | M41: -1 | N41: 1
A42: of:=ROUND(RATE([.F43];35;-250;0);6) -> -0.005025 | B42: -0.005025 | C42: of:=ROUND([.A42];12)=ROUND([.B42];12) -> true | D42: of:=FORMULA([.A42]) -> =ROUND(RATE(F43,35,-250,0),6) | F42: of:=[.F41]+1 -> 6 | G42: Payment | H42: -50 | I42: of:=[.H42] -> -50 | J42: -50 | K42: of:=[.J42] -> -50 | L42: 0.16 | M42: 0.16 | N42: 0
A43: of:=ROUND(RATE([.F44];35;-250;0);6) -> 0.025895 | B43: 0.025895 | C43: of:=ROUND([.A43];12)=ROUND([.B43];12) -> true | D43: of:=FORMULA([.A43]) -> =ROUND(RATE(F44,35,-250,0),6) | F43: of:=[.F42]+1 -> 7 | G43: Fv | H43: 0 | I43: 0 | J43: 0 | K43: 0 | L43: 0.4 | M43: 0.4 | N43: -10
A44: of:=ROUND(RATE([.F45];35;-250;0);6) -> 0.048897 | B44: 0.048897 | C44: of:=ROUND([.A44];12)=ROUND([.B44];12) -> true | D44: of:=FORMULA([.A44]) -> =ROUND(RATE(F45,35,-250,0),6) | F44: of:=[.F43]+1 -> 8 | G44: Type
A45: of:=ROUND(RATE([.F46];35;-250;0);6) -> 0.066373 | B45: 0.066373 | C45: of:=ROUND([.A45];12)=ROUND([.B45];12) -> true | D45: of:=FORMULA([.A45]) -> =ROUND(RATE(F46,35,-250,0),6) | F45: of:=[.F44]+1 -> 9 | G45: Guess
A46: of:=ROUND(RATE([.F47];35;-250;0);6) -> 0.079888 | B46: 0.079888 | C46: of:=ROUND([.A46];12)=ROUND([.B46];12) -> true | D46: of:=FORMULA([.A46]) -> =ROUND(RATE(F47,35,-250,0),6) | F46: of:=[.F45]+1 -> 10 | G46: RATE=
A47: of:=ROUND(RATE([.F48];35;-250;0);6) -> 0.090496 | B47: 0.090496 | C47: of:=ROUND([.A47];12)=ROUND([.B47];12) -> true | D47: of:=FORMULA([.A47]) -> =ROUND(RATE(F48,35,-250,0),6) | F47: of:=[.F46]+1 -> 11
A48: of:=ROUND(RATE([.F49];35;-250;0);6) -> 0.098931 | B48: 0.098931 | C48: of:=ROUND([.A48];12)=ROUND([.B48];12) -> true | D48: of:=FORMULA([.A48]) -> =ROUND(RATE(F49,35,-250,0),6) | F48: of:=[.F47]+1 -> 12
A49: of:=ROUND(RATE([.F50];35;-250;0);6) -> 0.105712 | B49: 0.105712 | C49: of:=ROUND([.A49];12)=ROUND([.B49];12) -> true | D49: of:=FORMULA([.A49]) -> =ROUND(RATE(F50,35,-250,0),6) | F49: of:=[.F48]+1 -> 13
A50: of:=ROUND(RATE([.F51];35;-250;0);6) -> 0.111216 | B50: 0.111216 | C50: of:=ROUND([.A50];12)=ROUND([.B50];12) -> true | D50: of:=FORMULA([.A50]) -> =ROUND(RATE(F51,35,-250,0),6) | F50: of:=[.F49]+1 -> 14
A51: of:=ROUND(RATE([.F52];35;-250;0);6) -> 0.11572 | B51: 0.11572 | C51: of:=ROUND([.A51];12)=ROUND([.B51];12) -> true | D51: of:=FORMULA([.A51]) -> =ROUND(RATE(F52,35,-250,0),6) | F51: of:=[.F50]+1 -> 15
A52: of:=ROUND(RATE([.F53];35;-250;0);6) -> 0.119434 | B52: 0.119434 | C52: of:=ROUND([.A52];12)=ROUND([.B52];12) -> true | D52: of:=FORMULA([.A52]) -> =ROUND(RATE(F53,35,-250,0),6) | F52: of:=[.F51]+1 -> 16
A53: of:=ROUND(RATE([.F54];35;-250;0);6) -> 0.122515 | B53: 0.122515 | C53: of:=ROUND([.A53];12)=ROUND([.B53];12) -> true | D53: of:=FORMULA([.A53]) -> =ROUND(RATE(F54,35,-250,0),6) | F53: of:=[.F52]+1 -> 17
A54: of:=ROUND(RATE([.F55];35;-250;0);6) -> 0.125086 | B54: 0.125086 | C54: of:=ROUND([.A54];12)=ROUND([.B54];12) -> true | D54: of:=FORMULA([.A54]) -> =ROUND(RATE(F55,35,-250,0),6) | F54: of:=[.F53]+1 -> 18
A55: of:=ROUND(RATE([.F56];35;-250;0);6) -> 0.127242 | B55: 0.127242 | C55: of:=ROUND([.A55];12)=ROUND([.B55];12) -> true | D55: of:=FORMULA([.A55]) -> =ROUND(RATE(F56,35,-250,0),6) | F55: of:=[.F54]+1 -> 19
A56: of:=ROUND(RATE([.F57];35;-250;0);6) -> 0.129058 | B56: 0.129058 | C56: of:=ROUND([.A56];12)=ROUND([.B56];12) -> true | D56: of:=FORMULA([.A56]) -> =ROUND(RATE(F57,35,-250,0),6) | F56: of:=[.F55]+1 -> 20
A57: of:=ROUND(RATE([.F58];35;-250;0);6) -> 0.130595 | B57: 0.130595 | C57: of:=ROUND([.A57];12)=ROUND([.B57];12) -> true | D57: of:=FORMULA([.A57]) -> =ROUND(RATE(F58,35,-250,0),6) | F57: of:=[.F56]+1 -> 21
A58: of:=ROUND(RATE([.F59];35;-250;0);6) -> 0.131899 | B58: 0.131899 | C58: of:=ROUND([.A58];12)=ROUND([.B58];12) -> true | D58: of:=FORMULA([.A58]) -> =ROUND(RATE(F59,35,-250,0),6) | F58: of:=[.F57]+1 -> 22
A59: of:=ROUND(RATE([.F60];35;-250;0);6) -> 0.133009 | B59: 0.133009 | C59: of:=ROUND([.A59];12)=ROUND([.B59];12) -> true | D59: of:=FORMULA([.A59]) -> =ROUND(RATE(F60,35,-250,0),6) | F59: of:=[.F58]+1 -> 23
A60: of:=ROUND(RATE([.F61];35;-250;0);6) -> 0.133958 | B60: 0.133958 | C60: of:=ROUND([.A60];12)=ROUND([.B60];12) -> true | D60: of:=FORMULA([.A60]) -> =ROUND(RATE(F61,35,-250,0),6) | F60: of:=[.F59]+1 -> 24
A61: of:=ROUND(RATE([.F62];35;-250;0);6) -> 0.13477 | B61: 0.13477 | C61: of:=ROUND([.A61];12)=ROUND([.B61];12) -> true | D61: of:=FORMULA([.A61]) -> =ROUND(RATE(F62,35,-250,0),6) | F61: of:=[.F60]+1 -> 25
A62: of:=ROUND(RATE([.F63];35;-250;0);6) -> 0.135467 | B62: 0.135467 | C62: of:=ROUND([.A62];12)=ROUND([.B62];12) -> true | D62: of:=FORMULA([.A62]) -> =ROUND(RATE(F63,35,-250,0),6) | F62: of:=[.F61]+1 -> 26
A63: of:=ROUND(RATE([.F64];35;-250;0);6) -> 0.136066 | B63: 0.136066 | C63: of:=ROUND([.A63];12)=ROUND([.B63];12) -> true | D63: of:=FORMULA([.A63]) -> =ROUND(RATE(F64,35,-250,0),6) | F63: of:=[.F62]+1 -> 27
A64: of:=ROUND(RATE([.F65];35;-250;0);6) -> 0.136583 | B64: 0.136583 | C64: of:=ROUND([.A64];12)=ROUND([.B64];12) -> true | D64: of:=FORMULA([.A64]) -> =ROUND(RATE(F65,35,-250,0),6) | F64: of:=[.F63]+1 -> 28
A65: of:=ROUND(RATE([.F66];35;-250;0);6) -> 0.137028 | B65: 0.137028 | C65: of:=ROUND([.A65];12)=ROUND([.B65];12) -> true | D65: of:=FORMULA([.A65]) -> =ROUND(RATE(F66,35,-250,0),6) | F65: of:=[.F64]+1 -> 29
A66: of:=ROUND(RATE([.F67];35;-250;0);6) -> 0.137414 | B66: 0.137414 | C66: of:=ROUND([.A66];12)=ROUND([.B66];12) -> true | D66: of:=FORMULA([.A66]) -> =ROUND(RATE(F67,35,-250,0),6) | F66: of:=[.F65]+1 -> 30
A67: of:=ROUND(RATE([.F68];35;-250;0);6) -> 0.137748 | B67: 0.137748 | C67: of:=ROUND([.A67];12)=ROUND([.B67];12) -> true | D67: of:=FORMULA([.A67]) -> =ROUND(RATE(F68,35,-250,0),6) | F67: of:=[.F66]+1 -> 31
A68: of:=ROUND(RATE([.F69];35;-250;0);6) -> 0.138037 | B68: 0.138037 | C68: of:=ROUND([.A68];12)=ROUND([.B68];12) -> true | D68: of:=FORMULA([.A68]) -> =ROUND(RATE(F69,35,-250,0),6) | F68: of:=[.F67]+1 -> 32
A69: of:=ROUND(RATE([.F70];35;-250;0);6) -> 0.138288 | B69: 0.138288 | C69: of:=ROUND([.A69];12)=ROUND([.B69];12) -> true | D69: of:=FORMULA([.A69]) -> =ROUND(RATE(F70,35,-250,0),6) | F69: of:=[.F68]+1 -> 33
A70: of:=ROUND(RATE([.F71];35;-250;0);6) -> 0.138506 | B70: 0.138506 | C70: of:=ROUND([.A70];12)=ROUND([.B70];12) -> true | D70: of:=FORMULA([.A70]) -> =ROUND(RATE(F71,35,-250,0),6) | F70: of:=[.F69]+1 -> 34
A71: of:=ROUND(RATE([.F72];35;-250;0);6) -> 0.138695 | B71: 0.138695 | C71: of:=ROUND([.A71];12)=ROUND([.B71];12) -> true | D71: of:=FORMULA([.A71]) -> =ROUND(RATE(F72,35,-250,0),6) | F71: of:=[.F70]+1 -> 35
A72: of:=ROUND(RATE([.F73];35;-250;0);6) -> 0.13886 | B72: 0.13886 | C72: of:=ROUND([.A72];12)=ROUND([.B72];12) -> true | D72: of:=FORMULA([.A72]) -> =ROUND(RATE(F73,35,-250,0),6) | F72: of:=[.F71]+1 -> 36
A73: of:=ROUND(RATE([.F74];35;-250;0);6) -> 0.139004 | B73: 0.139004 | C73: of:=ROUND([.A73];12)=ROUND([.B73];12) -> true | D73: of:=FORMULA([.A73]) -> =ROUND(RATE(F74,35,-250,0),6) | F73: of:=[.F72]+1 -> 37
A74: of:=ROUND(RATE([.F75];35;-250;0);6) -> 0.139129 | B74: 0.139129 | C74: of:=ROUND([.A74];12)=ROUND([.B74];12) -> true | D74: of:=FORMULA([.A74]) -> =ROUND(RATE(F75,35,-250,0),6) | F74: of:=[.F73]+1 -> 38
A75: of:=ROUND(RATE([.F76];35;-250;0);6) -> 0.139239 | B75: 0.139239 | C75: of:=ROUND([.A75];12)=ROUND([.B75];12) -> true | D75: of:=FORMULA([.A75]) -> =ROUND(RATE(F76,35,-250,0),6) | F75: of:=[.F74]+1 -> 39
A76: of:=ROUND(RATE([.F77];35;-250;0);6) -> 0.139334 | B76: 0.139334 | C76: of:=ROUND([.A76];12)=ROUND([.B76];12) -> true | D76: of:=FORMULA([.A76]) -> =ROUND(RATE(F77,35,-250,0),6) | F76: of:=[.F75]+1 -> 40
A77: of:=ROUND(RATE([.F78];35;-250;0);6) -> 0.139417 | B77: 0.139417 | C77: of:=ROUND([.A77];12)=ROUND([.B77];12) -> true | D77: of:=FORMULA([.A77]) -> =ROUND(RATE(F78,35,-250,0),6) | F77: of:=[.F76]+1 -> 41
A78: of:=ROUND(RATE([.F79];35;-250;0);6) -> 0.13949 | B78: 0.13949 | C78: of:=ROUND([.A78];12)=ROUND([.B78];12) -> true | D78: of:=FORMULA([.A78]) -> =ROUND(RATE(F79,35,-250,0),6) | F78: of:=[.F77]+1 -> 42
A79: of:=ROUND(RATE([.F80];35;-250;0);6) -> 0.139554 | B79: 0.139554 | C79: of:=ROUND([.A79];12)=ROUND([.B79];12) -> true | D79: of:=FORMULA([.A79]) -> =ROUND(RATE(F80,35,-250,0),6) | F79: of:=[.F78]+1 -> 43
A80: of:=ROUND(RATE([.F81];35;-250;0);6) -> 0.139609 | B80: 0.139609 | C80: of:=ROUND([.A80];12)=ROUND([.B80];12) -> true | D80: of:=FORMULA([.A80]) -> =ROUND(RATE(F81,35,-250,0),6) | F80: of:=[.F79]+1 -> 44
A81: of:=ROUND(RATE([.F82];35;-250;0);6) -> 0.139658 | B81: 0.139658 | C81: of:=ROUND([.A81];12)=ROUND([.B81];12) -> true | D81: of:=FORMULA([.A81]) -> =ROUND(RATE(F82,35,-250,0),6) | F81: of:=[.F80]+1 -> 45
A82: of:=ROUND(RATE([.F83];35;-250;0);6) -> 0.1397 | B82: 0.1397 | C82: of:=ROUND([.A82];12)=ROUND([.B82];12) -> true | D82: of:=FORMULA([.A82]) -> =ROUND(RATE(F83,35,-250,0),6) | F82: of:=[.F81]+1 -> 46
A83: of:=ROUND(RATE([.F84];35;-250;0);6) -> 0.139737 | B83: 0.139737 | C83: of:=ROUND([.A83];12)=ROUND([.B83];12) -> true | D83: of:=FORMULA([.A83]) -> =ROUND(RATE(F84,35,-250,0),6) | F83: of:=[.F82]+1 -> 47
A84: of:=ROUND(RATE([.F85];35;-250;0);6) -> 0.13977 | B84: 0.13977 | C84: of:=ROUND([.A84];12)=ROUND([.B84];12) -> true | D84: of:=FORMULA([.A84]) -> =ROUND(RATE(F85,35,-250,0),6) | F84: of:=[.F83]+1 -> 48
A85: of:=ROUND(RATE([.F86];35;-250;0);6) -> 0.139798 | B85: 0.139798 | C85: of:=ROUND([.A85];12)=ROUND([.B85];12) -> true | D85: of:=FORMULA([.A85]) -> =ROUND(RATE(F86,35,-250,0),6) | F85: of:=[.F84]+1 -> 49
A86: of:=ROUND(RATE([.F87];35;-250;0);6) -> 0.139823 | B86: 0.139823 | C86: of:=ROUND([.A86];12)=ROUND([.B86];12) -> true | D86: of:=FORMULA([.A86]) -> =ROUND(RATE(F87,35,-250,0),6) | F86: of:=[.F85]+1 -> 50
A87: of:=ROUND(RATE([.F88];35;-250;0);6) -> 0.139845 | B87: 0.139845 | C87: of:=ROUND([.A87];12)=ROUND([.B87];12) -> true | D87: of:=FORMULA([.A87]) -> =ROUND(RATE(F88,35,-250,0),6) | F87: of:=[.F86]+1 -> 51
A88: of:=ROUND(RATE([.F89];35;-250;0);6) -> 0.139864 | B88: 0.139864 | C88: of:=ROUND([.A88];12)=ROUND([.B88];12) -> true | D88: of:=FORMULA([.A88]) -> =ROUND(RATE(F89,35,-250,0),6) | F88: of:=[.F87]+1 -> 52
A89: of:=ROUND(RATE([.F90];35;-250;0);6) -> 0.139881 | B89: 0.139881 | C89: of:=ROUND([.A89];12)=ROUND([.B89];12) -> true | D89: of:=FORMULA([.A89]) -> =ROUND(RATE(F90,35,-250,0),6) | F89: of:=[.F88]+1 -> 53
A90: of:=ROUND(RATE([.F91];35;-250;0);6) -> 0.139896 | B90: 0.139896 | C90: of:=ROUND([.A90];12)=ROUND([.B90];12) -> true | D90: of:=FORMULA([.A90]) -> =ROUND(RATE(F91,35,-250,0),6) | F90: of:=[.F89]+1 -> 54
A91: of:=ROUND(RATE([.F92];35;-250;0);6) -> 0.139909 | B91: 0.139909 | C91: of:=ROUND([.A91];12)=ROUND([.B91];12) -> true | D91: of:=FORMULA([.A91]) -> =ROUND(RATE(F92,35,-250,0),6) | F91: of:=[.F90]+1 -> 55
A92: of:=ROUND(RATE([.F93];35;-250;0);6) -> 0.13992 | B92: 0.13992 | C92: of:=ROUND([.A92];12)=ROUND([.B92];12) -> true | D92: of:=FORMULA([.A92]) -> =ROUND(RATE(F93,35,-250,0),6) | F92: of:=[.F91]+1 -> 56
A93: of:=ROUND(RATE([.F94];35;-250;0);6) -> 0.13993 | B93: 0.13993 | C93: of:=ROUND([.A93];12)=ROUND([.B93];12) -> true | D93: of:=FORMULA([.A93]) -> =ROUND(RATE(F94,35,-250,0),6) | F93: of:=[.F92]+1 -> 57
A94: of:=ROUND(RATE([.F95];35;-250;0);6) -> 0.139938 | B94: 0.139938 | C94: of:=ROUND([.A94];12)=ROUND([.B94];12) -> true | D94: of:=FORMULA([.A94]) -> =ROUND(RATE(F95,35,-250,0),6) | F94: of:=[.F93]+1 -> 58
A95: of:=ROUND(RATE([.F96];35;-250;0);6) -> 0.139946 | B95: 0.139946 | C95: of:=ROUND([.A95];12)=ROUND([.B95];12) -> true | D95: of:=FORMULA([.A95]) -> =ROUND(RATE(F96,35,-250,0),6) | F95: of:=[.F94]+1 -> 59
A96: of:=ROUND(RATE([.F97];35;-250;0);6) -> 0.139953 | B96: 0.139953 | C96: of:=ROUND([.A96];12)=ROUND([.B96];12) -> true | D96: of:=FORMULA([.A96]) -> =ROUND(RATE(F97,35,-250,0),6) | F96: of:=[.F95]+1 -> 60
A97: of:=ROUND(RATE([.F98];35;-250;0);6) -> 0.139958 | B97: 0.139958 | C97: of:=ROUND([.A97];12)=ROUND([.B97];12) -> true | D97: of:=FORMULA([.A97]) -> =ROUND(RATE(F98,35,-250,0),6) | F97: of:=[.F96]+1 -> 61
A98: of:=ROUND(RATE([.F99];35;-250;0);6) -> 0.139964 | B98: 0.139964 | C98: of:=ROUND([.A98];12)=ROUND([.B98];12) -> true | D98: of:=FORMULA([.A98]) -> =ROUND(RATE(F99,35,-250,0),6) | F98: of:=[.F97]+1 -> 62
A99: of:=ROUND(RATE([.F100];35;-250;0);6) -> 0.139968 | B99: 0.139968 | C99: of:=ROUND([.A99];12)=ROUND([.B99];12) -> true | D99: of:=FORMULA([.A99]) -> =ROUND(RATE(F100,35,-250,0),6) | F99: of:=[.F98]+1 -> 63
A100: of:=ROUND(RATE([.F101];35;-250;0);6) -> 0.139972 | B100: 0.139972 | C100: of:=ROUND([.A100];12)=ROUND([.B100];12) -> true | D100: of:=FORMULA([.A100]) -> =ROUND(RATE(F101,35,-250,0),6) | F100: of:=[.F99]+1 -> 64
A101: of:=ROUND(RATE([.F102];35;-250;0);6) -> 0.139975 | B101: 0.139975 | C101: of:=ROUND([.A101];12)=ROUND([.B101];12) -> true | D101: of:=FORMULA([.A101]) -> =ROUND(RATE(F102,35,-250,0),6) | F101: of:=[.F100]+1 -> 65
A102: of:=ROUND(RATE([.F103];35;-250;0);6) -> 0.139978 | B102: 0.139978 | C102: of:=ROUND([.A102];12)=ROUND([.B102];12) -> true | D102: of:=FORMULA([.A102]) -> =ROUND(RATE(F103,35,-250,0),6) | F102: of:=[.F101]+1 -> 66
A103: of:=ROUND(RATE([.F104];35;-250;0);6) -> 0.139981 | B103: 0.139981 | C103: of:=ROUND([.A103];12)=ROUND([.B103];12) -> true | D103: of:=FORMULA([.A103]) -> =ROUND(RATE(F104,35,-250,0),6) | F103: of:=[.F102]+1 -> 67
A104: of:=ROUND(RATE([.F105];35;-250;0);6) -> 0.139983 | B104: 0.139983 | C104: of:=ROUND([.A104];12)=ROUND([.B104];12) -> true | D104: of:=FORMULA([.A104]) -> =ROUND(RATE(F105,35,-250,0),6) | F104: of:=[.F103]+1 -> 68
A105: of:=ROUND(RATE([.F106];35;-250;0);6) -> 0.139985 | B105: 0.139985 | C105: of:=ROUND([.A105];12)=ROUND([.B105];12) -> true | D105: of:=FORMULA([.A105]) -> =ROUND(RATE(F106,35,-250,0),6) | F105: of:=[.F104]+1 -> 69
A106: of:=ROUND(RATE([.F107];35;-250;0);6) -> 0.139987 | B106: 0.139987 | C106: of:=ROUND([.A106];12)=ROUND([.B106];12) -> true | D106: of:=FORMULA([.A106]) -> =ROUND(RATE(F107,35,-250,0),6) | F106: of:=[.F105]+1 -> 70
A107: of:=ROUND(RATE([.F108];35;-250;0);6) -> 0.139989 | B107: 0.139989 | C107: of:=ROUND([.A107];12)=ROUND([.B107];12) -> true | D107: of:=FORMULA([.A107]) -> =ROUND(RATE(F108,35,-250,0),6) | F107: of:=[.F106]+1 -> 71
A108: of:=ROUND(RATE([.F109];35;-250;0);6) -> 0.13999 | B108: 0.13999 | C108: of:=ROUND([.A108];12)=ROUND([.B108];12) -> true | D108: of:=FORMULA([.A108]) -> =ROUND(RATE(F109,35,-250,0),6) | F108: of:=[.F107]+1 -> 72
A109: of:=ROUND(RATE([.F110];35;-250;0);6) -> 0.139991 | B109: 0.139991 | C109: of:=ROUND([.A109];12)=ROUND([.B109];12) -> true | D109: of:=FORMULA([.A109]) -> =ROUND(RATE(F110,35,-250,0),6) | F109: of:=[.F108]+1 -> 73
A110: of:=ROUND(RATE([.F111];35;-250;0);6) -> 0.139992 | B110: 0.139992 | C110: of:=ROUND([.A110];12)=ROUND([.B110];12) -> true | D110: of:=FORMULA([.A110]) -> =ROUND(RATE(F111,35,-250,0),6) | F110: of:=[.F109]+1 -> 74
A111: of:=ROUND(RATE([.F112];35;-250;0);6) -> 0.139993 | B111: 0.139993 | C111: of:=ROUND([.A111];12)=ROUND([.B111];12) -> true | D111: of:=FORMULA([.A111]) -> =ROUND(RATE(F112,35,-250,0),6) | F111: of:=[.F110]+1 -> 75
A112: of:=ROUND(RATE([.F113];35;-250;0);6) -> 0.139994 | B112: 0.139994 | C112: of:=ROUND([.A112];12)=ROUND([.B112];12) -> true | D112: of:=FORMULA([.A112]) -> =ROUND(RATE(F113,35,-250,0),6) | F112: of:=[.F111]+1 -> 76
A113: of:=ROUND(RATE([.F114];35;-250;0);6) -> 0.139995 | B113: 0.139995 | C113: of:=ROUND([.A113];12)=ROUND([.B113];12) -> true | D113: of:=FORMULA([.A113]) -> =ROUND(RATE(F114,35,-250,0),6) | F113: of:=[.F112]+1 -> 77
A114: of:=ROUND(RATE([.F115];35;-250;0);6) -> 0.139996 | B114: 0.139996 | C114: of:=ROUND([.A114];12)=ROUND([.B114];12) -> true | D114: of:=FORMULA([.A114]) -> =ROUND(RATE(F115,35,-250,0),6) | F114: of:=[.F113]+1 -> 78
A115: of:=ROUND(RATE([.F116];35;-250;0);6) -> 0.139996 | B115: 0.139996 | C115: of:=ROUND([.A115];12)=ROUND([.B115];12) -> true | D115: of:=FORMULA([.A115]) -> =ROUND(RATE(F116,35,-250,0),6) | F115: of:=[.F114]+1 -> 79
A116: of:=ROUND(RATE([.F117];35;-250;0);6) -> 0.139997 | B116: 0.139997 | C116: of:=ROUND([.A116];12)=ROUND([.B116];12) -> true | D116: of:=FORMULA([.A116]) -> =ROUND(RATE(F117,35,-250,0),6) | F116: of:=[.F115]+1 -> 80
A117: of:=ROUND(RATE([.F118];35;-250;0);6) -> 0.139997 | B117: 0.139997 | C117: of:=ROUND([.A117];12)=ROUND([.B117];12) -> true | D117: of:=FORMULA([.A117]) -> =ROUND(RATE(F118,35,-250,0),6) | F117: of:=[.F116]+1 -> 81
A118: of:=ROUND(RATE([.F119];35;-250;0);6) -> 0.139997 | B118: 0.139997 | C118: of:=ROUND([.A118];12)=ROUND([.B118];12) -> true | D118: of:=FORMULA([.A118]) -> =ROUND(RATE(F119,35,-250,0),6) | F118: of:=[.F117]+1 -> 82
A119: of:=ROUND(RATE([.F120];35;-250;0);6) -> 0.139998 | B119: 0.139998 | C119: of:=ROUND([.A119];12)=ROUND([.B119];12) -> true | D119: of:=FORMULA([.A119]) -> =ROUND(RATE(F120,35,-250,0),6) | F119: of:=[.F118]+1 -> 83
A120: of:=ROUND(RATE([.F121];35;-250;0);6) -> 0.139998 | B120: 0.139998 | C120: of:=ROUND([.A120];12)=ROUND([.B120];12) -> true | D120: of:=FORMULA([.A120]) -> =ROUND(RATE(F121,35,-250,0),6) | F120: of:=[.F119]+1 -> 84
A121: of:=ROUND(RATE([.F122];35;-250;0);6) -> 0.139998 | B121: 0.139998 | C121: of:=ROUND([.A121];12)=ROUND([.B121];12) -> true | D121: of:=FORMULA([.A121]) -> =ROUND(RATE(F122,35,-250,0),6) | F121: of:=[.F120]+1 -> 85
A122: of:=ROUND(RATE([.F123];35;-250;0);6) -> 0.139998 | B122: 0.139998 | C122: of:=ROUND([.A122];12)=ROUND([.B122];12) -> true | D122: of:=FORMULA([.A122]) -> =ROUND(RATE(F123,35,-250,0),6) | F122: of:=[.F121]+1 -> 86
A123: of:=ROUND(RATE([.F124];35;-250;0);6) -> 0.139999 | B123: 0.139999 | C123: of:=ROUND([.A123];12)=ROUND([.B123];12) -> true | D123: of:=FORMULA([.A123]) -> =ROUND(RATE(F124,35,-250,0),6) | F123: of:=[.F122]+1 -> 87
A124: of:=ROUND(RATE([.F125];35;-250;0);6) -> 0.139999 | B124: 0.139999 | C124: of:=ROUND([.A124];12)=ROUND([.B124];12) -> true | D124: of:=FORMULA([.A124]) -> =ROUND(RATE(F125,35,-250,0),6) | F124: of:=[.F123]+1 -> 88
A125: of:=ROUND(RATE([.F126];35;-250;0);6) -> 0.139999 | B125: 0.139999 | C125: of:=ROUND([.A125];12)=ROUND([.B125];12) -> true | D125: of:=FORMULA([.A125]) -> =ROUND(RATE(F126,35,-250,0),6) | F125: of:=[.F124]+1 -> 89
A126: of:=ROUND(RATE([.F127];35;-250;0);6) -> 0.139999 | B126: 0.139999 | C126: of:=ROUND([.A126];12)=ROUND([.B126];12) -> true | D126: of:=FORMULA([.A126]) -> =ROUND(RATE(F127,35,-250,0),6) | F126: of:=[.F125]+1 -> 90
A127: of:=ROUND(RATE([.F128];35;-250;0);6) -> 0.139999 | B127: 0.139999 | C127: of:=ROUND([.A127];12)=ROUND([.B127];12) -> true | D127: of:=FORMULA([.A127]) -> =ROUND(RATE(F128,35,-250,0),6) | F127: of:=[.F126]+1 -> 91
A128: of:=ROUND(RATE([.F129];35;-250;0);6) -> 0.139999 | B128: 0.139999 | C128: of:=ROUND([.A128];12)=ROUND([.B128];12) -> true | D128: of:=FORMULA([.A128]) -> =ROUND(RATE(F129,35,-250,0),6) | F128: of:=[.F127]+1 -> 92
A129: of:=ROUND(RATE([.F130];35;-250;0);6) -> 0.139999 | B129: 0.139999 | C129: of:=ROUND([.A129];12)=ROUND([.B129];12) -> true | D129: of:=FORMULA([.A129]) -> =ROUND(RATE(F130,35,-250,0),6) | F129: of:=[.F128]+1 -> 93
A130: of:=ROUND(RATE([.F131];35;-250;0);6) -> 0.139999 | B130: 0.139999 | C130: of:=ROUND([.A130];12)=ROUND([.B130];12) -> true | D130: of:=FORMULA([.A130]) -> =ROUND(RATE(F131,35,-250,0),6) | F130: of:=[.F129]+1 -> 94
A131: of:=ROUND(RATE([.F132];35;-250;0);6) -> 0.14 | B131: 0.14 | C131: of:=ROUND([.A131];12)=ROUND([.B131];12) -> true | D131: of:=FORMULA([.A131]) -> =ROUND(RATE(F132,35,-250,0),6) | F131: of:=[.F130]+1 -> 95
A132: of:=ROUND(RATE([.F133];35;-250;0);6) -> 0.14 | B132: 0.14 | C132: of:=ROUND([.A132];12)=ROUND([.B132];12) -> true | D132: of:=FORMULA([.A132]) -> =ROUND(RATE(F133,35,-250,0),6) | F132: of:=[.F131]+1 -> 96
A133: of:=ROUND(RATE([.F134];35;-250;0);6) -> 0.14 | B133: 0.14 | C133: of:=ROUND([.A133];12)=ROUND([.B133];12) -> true | D133: of:=FORMULA([.A133]) -> =ROUND(RATE(F134,35,-250,0),6) | F133: of:=[.F132]+1 -> 97
A134: of:=ROUND(RATE([.F135];35;-250;0);6) -> 0.14 | B134: 0.14 | C134: of:=ROUND([.A134];12)=ROUND([.B134];12) -> true | D134: of:=FORMULA([.A134]) -> =ROUND(RATE(F135,35,-250,0),6) | F134: of:=[.F133]+1 -> 98
A135: of:=ROUND(RATE([.F136];35;-250;0);6) -> 0.14 | B135: 0.14 | C135: of:=ROUND([.A135];12)=ROUND([.B135];12) -> true | D135: of:=FORMULA([.A135]) -> =ROUND(RATE(F136,35,-250,0),6) | F135: of:=[.F134]+1 -> 99
A136: of:=ROUND(RATE([.F137];35;-250;0);6) -> 0.14 | B136: 0.14 | C136: of:=ROUND([.A136];12)=ROUND([.B136];12) -> true | D136: of:=FORMULA([.A136]) -> =ROUND(RATE(F137,35,-250,0),6) | F136: of:=[.F135]+1 -> 100
A137: of:=ROUND(RATE([.F138];35;-250;0);6) -> 0.14 | B137: 0.14 | C137: of:=ROUND([.A137];12)=ROUND([.B137];12) -> true | D137: of:=FORMULA([.A137]) -> =ROUND(RATE(F138,35,-250,0),6) | F137: of:=[.F136]+1 -> 101
A138: of:=ROUND(RATE([.F139];35;-250;0);6) -> 0.14 | B138: 0.14 | C138: of:=ROUND([.A138];12)=ROUND([.B138];12) -> true | D138: of:=FORMULA([.A138]) -> =ROUND(RATE(F139,35,-250,0),6) | F138: of:=[.F137]+1 -> 102
A139: of:=ROUND(RATE([.F140];35;-250;0);6) -> 0.14 | B139: 0.14 | C139: of:=ROUND([.A139];12)=ROUND([.B139];12) -> true | D139: of:=FORMULA([.A139]) -> =ROUND(RATE(F140,35,-250,0),6) | F139: of:=[.F138]+1 -> 103
A140: of:=ROUND(RATE([.F141];35;-250;0);6) -> 0.14 | B140: 0.14 | C140: of:=ROUND([.A140];12)=ROUND([.B140];12) -> true | D140: of:=FORMULA([.A140]) -> =ROUND(RATE(F141,35,-250,0),6) | F140: of:=[.F139]+1 -> 104
A141: of:=ROUND(RATE([.F142];35;-250;0);6) -> 0.14 | B141: 0.14 | C141: of:=ROUND([.A141];12)=ROUND([.B141];12) -> true | D141: of:=FORMULA([.A141]) -> =ROUND(RATE(F142,35,-250,0),6) | F141: of:=[.F140]+1 -> 105
A142: of:=ROUND(RATE([.F143];35;-250;0);6) -> 0.14 | B142: 0.14 | C142: of:=ROUND([.A142];12)=ROUND([.B142];12) -> true | D142: of:=FORMULA([.A142]) -> =ROUND(RATE(F143,35,-250,0),6) | F142: of:=[.F141]+1 -> 106
A143: of:=ROUND(RATE([.F144];35;-250;0);6) -> 0.14 | B143: 0.14 | C143: of:=ROUND([.A143];12)=ROUND([.B143];12) -> true | D143: of:=FORMULA([.A143]) -> =ROUND(RATE(F144,35,-250,0),6) | F143: of:=[.F142]+1 -> 107
A144: of:=ROUND(RATE([.F145];35;-250;0);6) -> 0.14 | B144: 0.14 | C144: of:=ROUND([.A144];12)=ROUND([.B144];12) -> true | D144: of:=FORMULA([.A144]) -> =ROUND(RATE(F145,35,-250,0),6) | F144: of:=[.F143]+1 -> 108
A145: of:=ROUND(RATE([.F146];35;-250;0);6) -> 0.14 | B145: 0.14 | C145: of:=ROUND([.A145];12)=ROUND([.B145];12) -> true | D145: of:=FORMULA([.A145]) -> =ROUND(RATE(F146,35,-250,0),6) | F145: of:=[.F144]+1 -> 109
A146: of:=ROUND(RATE([.F147];35;-250;0);6) -> 0.14 | B146: 0.14 | C146: of:=ROUND([.A146];12)=ROUND([.B146];12) -> true | D146: of:=FORMULA([.A146]) -> =ROUND(RATE(F147,35,-250,0),6) | F146: of:=[.F145]+1 -> 110
A147: of:=ROUND(RATE([.F148];35;-250;0);6) -> 0.14 | B147: 0.14 | C147: of:=ROUND([.A147];12)=ROUND([.B147];12) -> true | D147: of:=FORMULA([.A147]) -> =ROUND(RATE(F148,35,-250,0),6) | F147: of:=[.F146]+1 -> 111
A148: of:=ROUND(RATE([.F149];35;-250;0);6) -> 0.14 | B148: 0.14 | C148: of:=ROUND([.A148];12)=ROUND([.B148];12) -> true | D148: of:=FORMULA([.A148]) -> =ROUND(RATE(F149,35,-250,0),6) | F148: of:=[.F147]+1 -> 112
A149: of:=ROUND(RATE([.F150];35;-250;0);6) -> 0.14 | B149: 0.14 | C149: of:=ROUND([.A149];12)=ROUND([.B149];12) -> true | D149: of:=FORMULA([.A149]) -> =ROUND(RATE(F150,35,-250,0),6) | F149: of:=[.F148]+1 -> 113
A150: of:=ROUND(RATE([.F151];35;-250;0);6) -> 0.14 | B150: 0.14 | C150: of:=ROUND([.A150];12)=ROUND([.B150];12) -> true | D150: of:=FORMULA([.A150]) -> =ROUND(RATE(F151,35,-250,0),6) | F150: of:=[.F149]+1 -> 114
A151: of:=ROUND(RATE([.F152];35;-250;0);6) -> 0.14 | B151: 0.14 | C151: of:=ROUND([.A151];12)=ROUND([.B151];12) -> true | D151: of:=FORMULA([.A151]) -> =ROUND(RATE(F152,35,-250,0),6) | F151: of:=[.F150]+1 -> 115
A152: of:=ROUND(RATE([.F153];35;-250;0);6) -> 0.14 | B152: 0.14 | C152: of:=ROUND([.A152];12)=ROUND([.B152];12) -> true | D152: of:=FORMULA([.A152]) -> =ROUND(RATE(F153,35,-250,0),6) | F152: of:=[.F151]+1 -> 116
A153: of:=ROUND(RATE([.F154];35;-250;0);6) -> 0.14 | B153: 0.14 | C153: of:=ROUND([.A153];12)=ROUND([.B153];12) -> true | D153: of:=FORMULA([.A153]) -> =ROUND(RATE(F154,35,-250,0),6) | F153: of:=[.F152]+1 -> 117
A154: of:=ROUND(RATE([.F155];35;-250;0);6) -> 0.14 | B154: 0.14 | C154: of:=ROUND([.A154];12)=ROUND([.B154];12) -> true | D154: of:=FORMULA([.A154]) -> =ROUND(RATE(F155,35,-250,0),6) | F154: of:=[.F153]+1 -> 118
A155: of:=ROUND(RATE([.F156];35;-250;0);6) -> 0.14 | B155: 0.14 | C155: of:=ROUND([.A155];12)=ROUND([.B155];12) -> true | D155: of:=FORMULA([.A155]) -> =ROUND(RATE(F156,35,-250,0),6) | F155: of:=[.F154]+1 -> 119
A156: of:=ROUND(RATE([.F157];35;-250;0);6) -> 0.14 | B156: 0.14 | C156: of:=ROUND([.A156];12)=ROUND([.B156];12) -> true | D156: of:=FORMULA([.A156]) -> =ROUND(RATE(F157,35,-250,0),6) | F156: of:=[.F155]+1 -> 120
A157: of:=ROUND(RATE([.F158];35;-250;0);6) -> 0.14 | B157: 0.14 | C157: of:=ROUND([.A157];12)=ROUND([.B157];12) -> true | D157: of:=FORMULA([.A157]) -> =ROUND(RATE(F158,35,-250,0),6) | F157: of:=[.F156]+1 -> 121
A158: of:=ROUND(RATE([.F159];35;-250;0);6) -> 0.14 | B158: 0.14 | C158: of:=ROUND([.A158];12)=ROUND([.B158];12) -> true | D158: of:=FORMULA([.A158]) -> =ROUND(RATE(F159,35,-250,0),6) | F158: of:=[.F157]+1 -> 122
A159: of:=ROUND(RATE([.F160];35;-250;0);6) -> 0.14 | B159: 0.14 | C159: of:=ROUND([.A159];12)=ROUND([.B159];12) -> true | D159: of:=FORMULA([.A159]) -> =ROUND(RATE(F160,35,-250,0),6) | F159: of:=[.F158]+1 -> 123
A160: of:=ROUND(RATE([.F161];35;-250;0);6) -> 0.14 | B160: 0.14 | C160: of:=ROUND([.A160];12)=ROUND([.B160];12) -> true | D160: of:=FORMULA([.A160]) -> =ROUND(RATE(F161,35,-250,0),6) | F160: of:=[.F159]+1 -> 124
A161: of:=ROUND(RATE([.F162];35;-250;0);6) -> 0.14 | B161: 0.14 | C161: of:=ROUND([.A161];12)=ROUND([.B161];12) -> true | D161: of:=FORMULA([.A161]) -> =ROUND(RATE(F162,35,-250,0),6) | F161: of:=[.F160]+1 -> 125
A162: of:=ROUND(RATE([.F163];35;-250;0);6) -> 0.14 | B162: 0.14 | C162: of:=ROUND([.A162];12)=ROUND([.B162];12) -> true | D162: of:=FORMULA([.A162]) -> =ROUND(RATE(F163,35,-250,0),6) | F162: of:=[.F161]+1 -> 126
A163: of:=ROUND(RATE([.F164];35;-250;0);6) -> 0.14 | B163: 0.14 | C163: of:=ROUND([.A163];12)=ROUND([.B163];12) -> true | D163: of:=FORMULA([.A163]) -> =ROUND(RATE(F164,35,-250,0),6) | F163: of:=[.F162]+1 -> 127
A164: of:=ROUND(RATE([.F165];35;-250;0);6) -> 0.14 | B164: 0.14 | C164: of:=ROUND([.A164];12)=ROUND([.B164];12) -> true | D164: of:=FORMULA([.A164]) -> =ROUND(RATE(F165,35,-250,0),6) | F164: of:=[.F163]+1 -> 128
A165: of:=ROUND(RATE([.F166];35;-250;0);6) -> 0.14 | B165: 0.14 | C165: of:=ROUND([.A165];12)=ROUND([.B165];12) -> true | D165: of:=FORMULA([.A165]) -> =ROUND(RATE(F166,35,-250,0),6) | F165: of:=[.F164]+1 -> 129
A166: of:=ROUND(RATE([.F167];35;-250;0);6) -> 0.14 | B166: 0.14 | C166: of:=ROUND([.A166];12)=ROUND([.B166];12) -> true | D166: of:=FORMULA([.A166]) -> =ROUND(RATE(F167,35,-250,0),6) | F166: of:=[.F165]+1 -> 130
A167: of:=ROUND(RATE([.F168];35;-250;0);6) -> 0.14 | B167: 0.14 | C167: of:=ROUND([.A167];12)=ROUND([.B167];12) -> true | D167: of:=FORMULA([.A167]) -> =ROUND(RATE(F168,35,-250,0),6) | F167: of:=[.F166]+1 -> 131
A168: of:=ROUND(RATE([.F169];35;-250;0);6) -> 0.14 | B168: 0.14 | C168: of:=ROUND([.A168];12)=ROUND([.B168];12) -> true | D168: of:=FORMULA([.A168]) -> =ROUND(RATE(F169,35,-250,0),6) | F168: of:=[.F167]+1 -> 132
A169: of:=ROUND(RATE([.F170];35;-250;0);6) -> 0.14 | B169: 0.14 | C169: of:=ROUND([.A169];12)=ROUND([.B169];12) -> true | D169: of:=FORMULA([.A169]) -> =ROUND(RATE(F170,35,-250,0),6) | F169: of:=[.F168]+1 -> 133
A170: of:=ROUND(RATE([.F171];35;-250;0);6) -> 0.14 | B170: 0.14 | C170: of:=ROUND([.A170];12)=ROUND([.B170];12) -> true | D170: of:=FORMULA([.A170]) -> =ROUND(RATE(F171,35,-250,0),6) | F170: of:=[.F169]+1 -> 134
A171: of:=ROUND(RATE([.F172];35;-250;0);6) -> 0.14 | B171: 0.14 | C171: of:=ROUND([.A171];12)=ROUND([.B171];12) -> true | D171: of:=FORMULA([.A171]) -> =ROUND(RATE(F172,35,-250,0),6) | F171: of:=[.F170]+1 -> 135
A172: of:=ROUND(RATE([.F173];35;-250;0);6) -> 0.14 | B172: 0.14 | C172: of:=ROUND([.A172];12)=ROUND([.B172];12) -> true | D172: of:=FORMULA([.A172]) -> =ROUND(RATE(F173,35,-250,0),6) | F172: of:=[.F171]+1 -> 136
A173: of:=ROUND(RATE([.F174];35;-250;0);6) -> 0.14 | B173: 0.14 | C173: of:=ROUND([.A173];12)=ROUND([.B173];12) -> true | D173: of:=FORMULA([.A173]) -> =ROUND(RATE(F174,35,-250,0),6) | F173: of:=[.F172]+1 -> 137
A174: of:=ROUND(RATE([.F175];35;-250;0);6) -> 0.14 | B174: 0.14 | C174: of:=ROUND([.A174];12)=ROUND([.B174];12) -> true | D174: of:=FORMULA([.A174]) -> =ROUND(RATE(F175,35,-250,0),6) | F174: of:=[.F173]+1 -> 138
A175: of:=ROUND(RATE([.F176];35;-250;0);6) -> 0.14 | B175: 0.14 | C175: of:=ROUND([.A175];12)=ROUND([.B175];12) -> true | D175: of:=FORMULA([.A175]) -> =ROUND(RATE(F176,35,-250,0),6) | F175: of:=[.F174]+1 -> 139
A176: of:=ROUND(RATE([.F177];35;-250;0);6) -> 0.14 | B176: 0.14 | C176: of:=ROUND([.A176];12)=ROUND([.B176];12) -> true | D176: of:=FORMULA([.A176]) -> =ROUND(RATE(F177,35,-250,0),6) | F176: of:=[.F175]+1 -> 140
A177: of:=ROUND(RATE([.F178];35;-250;0);6) -> 0.14 | B177: 0.14 | C177: of:=ROUND([.A177];12)=ROUND([.B177];12) -> true | D177: of:=FORMULA([.A177]) -> =ROUND(RATE(F178,35,-250,0),6) | F177: of:=[.F176]+1 -> 141
A178: of:=ROUND(RATE([.F179];35;-250;0);6) -> 0.14 | B178: 0.14 | C178: of:=ROUND([.A178];12)=ROUND([.B178];12) -> true | D178: of:=FORMULA([.A178]) -> =ROUND(RATE(F179,35,-250,0),6) | F178: of:=[.F177]+1 -> 142
A179: of:=ROUND(RATE([.F180];35;-250;0);6) -> 0.14 | B179: 0.14 | C179: of:=ROUND([.A179];12)=ROUND([.B179];12) -> true | D179: of:=FORMULA([.A179]) -> =ROUND(RATE(F180,35,-250,0),6) | F179: of:=[.F178]+1 -> 143
A180: of:=ROUND(RATE([.F181];35;-250;0);6) -> 0.14 | B180: 0.14 | C180: of:=ROUND([.A180];12)=ROUND([.B180];12) -> true | D180: of:=FORMULA([.A180]) -> =ROUND(RATE(F181,35,-250,0),6) | F180: of:=[.F179]+1 -> 144
A181: of:=ROUND(RATE([.F182];35;-250;0);6) -> 0.14 | B181: 0.14 | C181: of:=ROUND([.A181];12)=ROUND([.B181];12) -> true | D181: of:=FORMULA([.A181]) -> =ROUND(RATE(F182,35,-250,0),6) | F181: of:=[.F180]+1 -> 145
A182: of:=ROUND(RATE([.F183];35;-250;0);6) -> 0.14 | B182: 0.14 | C182: of:=ROUND([.A182];12)=ROUND([.B182];12) -> true | D182: of:=FORMULA([.A182]) -> =ROUND(RATE(F183,35,-250,0),6) | F182: of:=[.F181]+1 -> 146
A183: of:=ROUND(RATE([.F184];35;-250;0);6) -> 0.14 | B183: 0.14 | C183: of:=ROUND([.A183];12)=ROUND([.B183];12) -> true | D183: of:=FORMULA([.A183]) -> =ROUND(RATE(F184,35,-250,0),6) | F183: of:=[.F182]+1 -> 147
A184: of:=ROUND(RATE([.F185];35;-250;0);6) -> 0.14 | B184: 0.14 | C184: of:=ROUND([.A184];12)=ROUND([.B184];12) -> true | D184: of:=FORMULA([.A184]) -> =ROUND(RATE(F185,35,-250,0),6) | F184: of:=[.F183]+1 -> 148
A185: of:=ROUND(RATE([.F186];35;-250;0);6) -> 0.14 | B185: 0.14 | C185: of:=ROUND([.A185];12)=ROUND([.B185];12) -> true | D185: of:=FORMULA([.A185]) -> =ROUND(RATE(F186,35,-250,0),6) | F185: of:=[.F184]+1 -> 149
A186: of:=ROUND(RATE([.F187];35;-250;0);6) -> 0.14 | B186: 0.14 | C186: of:=ROUND([.A186];12)=ROUND([.B186];12) -> true | D186: of:=FORMULA([.A186]) -> =ROUND(RATE(F187,35,-250,0),6) | F186: of:=[.F185]+1 -> 150
A187: of:=ROUND(RATE([.F188];35;-250;0);6) -> 0.14 | B187: 0.14 | C187: of:=ROUND([.A187];12)=ROUND([.B187];12) -> true | D187: of:=FORMULA([.A187]) -> =ROUND(RATE(F188,35,-250,0),6) | F187: of:=[.F186]+1 -> 151
A188: of:=ROUND(RATE([.F189];35;-250;0);6) -> 0.14 | B188: 0.14 | C188: of:=ROUND([.A188];12)=ROUND([.B188];12) -> true | D188: of:=FORMULA([.A188]) -> =ROUND(RATE(F189,35,-250,0),6) | F188: of:=[.F187]+1 -> 152
A189: of:=ROUND(RATE([.F190];35;-250;0);6) -> 0.14 | B189: 0.14 | C189: of:=ROUND([.A189];12)=ROUND([.B189];12) -> true | D189: of:=FORMULA([.A189]) -> =ROUND(RATE(F190,35,-250,0),6) | F189: of:=[.F188]+1 -> 153
A190: of:=ROUND(RATE([.F191];35;-250;0);6) -> 0.14 | B190: 0.14 | C190: of:=ROUND([.A190];12)=ROUND([.B190];12) -> true | D190: of:=FORMULA([.A190]) -> =ROUND(RATE(F191,35,-250,0),6) | F190: of:=[.F189]+1 -> 154
A191: of:=ROUND(RATE([.F192];35;-250;0);6) -> 0.14 | B191: 0.14 | C191: of:=ROUND([.A191];12)=ROUND([.B191];12) -> true | D191: of:=FORMULA([.A191]) -> =ROUND(RATE(F192,35,-250,0),6) | F191: of:=[.F190]+1 -> 155
A192: of:=ROUND(RATE([.F193];35;-250;0);6) -> 0.14 | B192: 0.14 | C192: of:=ROUND([.A192];12)=ROUND([.B192];12) -> true | D192: of:=FORMULA([.A192]) -> =ROUND(RATE(F193,35,-250,0),6) | F192: of:=[.F191]+1 -> 156
A193: of:=ROUND(RATE([.F194];35;-250;0);6) -> 0.14 | B193: 0.14 | C193: of:=ROUND([.A193];12)=ROUND([.B193];12) -> true | D193: of:=FORMULA([.A193]) -> =ROUND(RATE(F194,35,-250,0),6) | F193: of:=[.F192]+1 -> 157
A194: of:=ROUND(RATE([.F195];35;-250;0);6) -> 0.14 | B194: 0.14 | C194: of:=ROUND([.A194];12)=ROUND([.B194];12) -> true | D194: of:=FORMULA([.A194]) -> =ROUND(RATE(F195,35,-250,0),6) | F194: of:=[.F193]+1 -> 158
A195: of:=ROUND(RATE([.F196];35;-250;0);6) -> 0.14 | B195: 0.14 | C195: of:=ROUND([.A195];12)=ROUND([.B195];12) -> true | D195: of:=FORMULA([.A195]) -> =ROUND(RATE(F196,35,-250,0),6) | F195: of:=[.F194]+1 -> 159
A196: of:=ROUND(RATE([.F197];35;-250;0);6) -> 0.14 | B196: 0.14 | C196: of:=ROUND([.A196];12)=ROUND([.B196];12) -> true | D196: of:=FORMULA([.A196]) -> =ROUND(RATE(F197,35,-250,0),6) | F196: of:=[.F195]+1 -> 160
A197: of:=ROUND(RATE([.F198];35;-250;0);6) -> 0.14 | B197: 0.14 | C197: of:=ROUND([.A197];12)=ROUND([.B197];12) -> true | D197: of:=FORMULA([.A197]) -> =ROUND(RATE(F198,35,-250,0),6) | F197: of:=[.F196]+1 -> 161
A198: of:=ROUND(RATE([.F199];35;-250;0);6) -> 0.14 | B198: 0.14 | C198: of:=ROUND([.A198];12)=ROUND([.B198];12) -> true | D198: of:=FORMULA([.A198]) -> =ROUND(RATE(F199,35,-250,0),6) | F198: of:=[.F197]+1 -> 162
A199: of:=ROUND(RATE([.F200];35;-250;0);6) -> 0.14 | B199: 0.14 | C199: of:=ROUND([.A199];12)=ROUND([.B199];12) -> true | D199: of:=FORMULA([.A199]) -> =ROUND(RATE(F200,35,-250,0),6) | F199: of:=[.F198]+1 -> 163
A200: of:=ROUND(RATE([.F201];35;-250;0);6) -> 0.14 | B200: 0.14 | C200: of:=ROUND([.A200];12)=ROUND([.B200];12) -> true | D200: of:=FORMULA([.A200]) -> =ROUND(RATE(F201,35,-250,0),6) | F200: of:=[.F199]+1 -> 164
A201: of:=ROUND(RATE([.F202];35;-250;0);6) -> 0.14 | B201: 0.14 | C201: of:=ROUND([.A201];12)=ROUND([.B201];12) -> true | D201: of:=FORMULA([.A201]) -> =ROUND(RATE(F202,35,-250,0),6) | F201: of:=[.F200]+1 -> 165
A202: of:=ROUND(RATE([.F203];35;-250;0);6) -> 0.14 | B202: 0.14 | C202: of:=ROUND([.A202];12)=ROUND([.B202];12) -> true | D202: of:=FORMULA([.A202]) -> =ROUND(RATE(F203,35,-250,0),6) | F202: of:=[.F201]+1 -> 166
A203: of:=ROUND(RATE([.F204];35;-250;0);6) -> 0.14 | B203: 0.14 | C203: of:=ROUND([.A203];12)=ROUND([.B203];12) -> true | D203: of:=FORMULA([.A203]) -> =ROUND(RATE(F204,35,-250,0),6) | F203: of:=[.F202]+1 -> 167
A204: of:=ROUND(RATE([.F205];35;-250;0);6) -> 0.14 | B204: 0.14 | C204: of:=ROUND([.A204];12)=ROUND([.B204];12) -> true | D204: of:=FORMULA([.A204]) -> =ROUND(RATE(F205,35,-250,0),6) | F204: of:=[.F203]+1 -> 168
A205: of:=ROUND(RATE([.F206];35;-250;0);6) -> 0.14 | B205: 0.14 | C205: of:=ROUND([.A205];12)=ROUND([.B205];12) -> true | D205: of:=FORMULA([.A205]) -> =ROUND(RATE(F206,35,-250,0),6) | F205: of:=[.F204]+1 -> 169
A206: of:=ROUND(RATE([.F207];35;-250;0);6) -> 0.14 | B206: 0.14 | C206: of:=ROUND([.A206];12)=ROUND([.B206];12) -> true | D206: of:=FORMULA([.A206]) -> =ROUND(RATE(F207,35,-250,0),6) | F206: of:=[.F205]+1 -> 170
A207: of:=ROUND(RATE([.F208];35;-250;0);6) -> 0.14 | B207: 0.14 | C207: of:=ROUND([.A207];12)=ROUND([.B207];12) -> true | D207: of:=FORMULA([.A207]) -> =ROUND(RATE(F208,35,-250,0),6) | F207: of:=[.F206]+1 -> 171
A208: of:=ROUND(RATE([.F209];35;-250;0);6) -> 0.14 | B208: 0.14 | C208: of:=ROUND([.A208];12)=ROUND([.B208];12) -> true | D208: of:=FORMULA([.A208]) -> =ROUND(RATE(F209,35,-250,0),6) | F208: of:=[.F207]+1 -> 172
A209: of:=ROUND(RATE([.F210];35;-250;0);6) -> 0.14 | B209: 0.14 | C209: of:=ROUND([.A209];12)=ROUND([.B209];12) -> true | D209: of:=FORMULA([.A209]) -> =ROUND(RATE(F210,35,-250,0),6) | F209: of:=[.F208]+1 -> 173
A210: of:=ROUND(RATE([.F211];35;-250;0);6) -> 0.14 | B210: 0.14 | C210: of:=ROUND([.A210];12)=ROUND([.B210];12) -> true | D210: of:=FORMULA([.A210]) -> =ROUND(RATE(F211,35,-250,0),6) | F210: of:=[.F209]+1 -> 174
A211: of:=ROUND(RATE([.F212];35;-250;0);6) -> 0.14 | B211: 0.14 | C211: of:=ROUND([.A211];12)=ROUND([.B211];12) -> true | D211: of:=FORMULA([.A211]) -> =ROUND(RATE(F212,35,-250,0),6) | F211: of:=[.F210]+1 -> 175
A212: of:=ROUND(RATE([.F213];35;-250;0);6) -> 0.14 | B212: 0.14 | C212: of:=ROUND([.A212];12)=ROUND([.B212];12) -> true | D212: of:=FORMULA([.A212]) -> =ROUND(RATE(F213,35,-250,0),6) | F212: of:=[.F211]+1 -> 176
A213: of:=ROUND(RATE([.F214];35;-250;0);6) -> 0.14 | B213: 0.14 | C213: of:=ROUND([.A213];12)=ROUND([.B213];12) -> true | D213: of:=FORMULA([.A213]) -> =ROUND(RATE(F214,35,-250,0),6) | F213: of:=[.F212]+1 -> 177
A214: of:=ROUND(RATE([.F215];35;-250;0);6) -> 0.14 | B214: 0.14 | C214: of:=ROUND([.A214];12)=ROUND([.B214];12) -> true | D214: of:=FORMULA([.A214]) -> =ROUND(RATE(F215,35,-250,0),6) | F214: of:=[.F213]+1 -> 178
A215: of:=ROUND(RATE([.F216];35;-250;0);6) -> 0.14 | B215: 0.14 | C215: of:=ROUND([.A215];12)=ROUND([.B215];12) -> true | D215: of:=FORMULA([.A215]) -> =ROUND(RATE(F216,35,-250,0),6) | F215: of:=[.F214]+1 -> 179
A216: of:=ROUND(RATE([.F217];35;-250;0);6) -> 0.14 | B216: 0.14 | C216: of:=ROUND([.A216];12)=ROUND([.B216];12) -> true | D216: of:=FORMULA([.A216]) -> =ROUND(RATE(F217,35,-250,0),6) | F216: of:=[.F215]+1 -> 180
A217: of:=ROUND(RATE([.F218];35;-250;0);6) -> 0.14 | B217: 0.14 | C217: of:=ROUND([.A217];12)=ROUND([.B217];12) -> true | D217: of:=FORMULA([.A217]) -> =ROUND(RATE(F218,35,-250,0),6) | F217: of:=[.F216]+1 -> 181
A218: of:=ROUND(RATE([.F219];35;-250;0);6) -> 0.14 | B218: 0.14 | C218: of:=ROUND([.A218];12)=ROUND([.B218];12) -> true | D218: of:=FORMULA([.A218]) -> =ROUND(RATE(F219,35,-250,0),6) | F218: of:=[.F217]+1 -> 182
A219: of:=ROUND(RATE([.F220];35;-250;0);6) -> 0.14 | B219: 0.14 | C219: of:=ROUND([.A219];12)=ROUND([.B219];12) -> true | D219: of:=FORMULA([.A219]) -> =ROUND(RATE(F220,35,-250,0),6) | F219: of:=[.F218]+1 -> 183
A220: of:=ROUND(RATE([.F221];35;-250;0);6) -> 0.14 | B220: 0.14 | C220: of:=ROUND([.A220];12)=ROUND([.B220];12) -> true | D220: of:=FORMULA([.A220]) -> =ROUND(RATE(F221,35,-250,0),6) | F220: of:=[.F219]+1 -> 184
A221: of:=ROUND(RATE([.F222];35;-250;0);6) -> 0.14 | B221: 0.14 | C221: of:=ROUND([.A221];12)=ROUND([.B221];12) -> true | D221: of:=FORMULA([.A221]) -> =ROUND(RATE(F222,35,-250,0),6) | F221: of:=[.F220]+1 -> 185
A222: of:=ROUND(RATE([.F223];35;-250;0);6) -> 0.14 | B222: 0.14 | C222: of:=ROUND([.A222];12)=ROUND([.B222];12) -> true | D222: of:=FORMULA([.A222]) -> =ROUND(RATE(F223,35,-250,0),6) | F222: of:=[.F221]+1 -> 186
A223: of:=ROUND(RATE([.F224];35;-250;0);6) -> 0.14 | B223: 0.14 | C223: of:=ROUND([.A223];12)=ROUND([.B223];12) -> true | D223: of:=FORMULA([.A223]) -> =ROUND(RATE(F224,35,-250,0),6) | F223: of:=[.F222]+1 -> 187
A224: of:=ROUND(RATE([.F225];35;-250;0);6) -> 0.14 | B224: 0.14 | C224: of:=ROUND([.A224];12)=ROUND([.B224];12) -> true | D224: of:=FORMULA([.A224]) -> =ROUND(RATE(F225,35,-250,0),6) | F224: of:=[.F223]+1 -> 188
A225: of:=ROUND(RATE([.F226];35;-250;0);6) -> 0.14 | B225: 0.14 | C225: of:=ROUND([.A225];12)=ROUND([.B225];12) -> true | D225: of:=FORMULA([.A225]) -> =ROUND(RATE(F226,35,-250,0),6) | F225: of:=[.F224]+1 -> 189
A226: of:=ROUND(RATE([.F227];35;-250;0);6) -> 0.14 | B226: 0.14 | C226: of:=ROUND([.A226];12)=ROUND([.B226];12) -> true | D226: of:=FORMULA([.A226]) -> =ROUND(RATE(F227,35,-250,0),6) | F226: of:=[.F225]+1 -> 190
A227: of:=ROUND(RATE([.F228];35;-250;0);6) -> 0.14 | B227: 0.14 | C227: of:=ROUND([.A227];12)=ROUND([.B227];12) -> true | D227: of:=FORMULA([.A227]) -> =ROUND(RATE(F228,35,-250,0),6) | F227: of:=[.F226]+1 -> 191
A228: of:=ROUND(RATE([.F229];35;-250;0);6) -> 0.14 | B228: 0.14 | C228: of:=ROUND([.A228];12)=ROUND([.B228];12) -> true | D228: of:=FORMULA([.A228]) -> =ROUND(RATE(F229,35,-250,0),6) | F228: of:=[.F227]+1 -> 192
A229: of:=ROUND(RATE([.F230];35;-250;0);6) -> 0.14 | B229: 0.14 | C229: of:=ROUND([.A229];12)=ROUND([.B229];12) -> true | D229: of:=FORMULA([.A229]) -> =ROUND(RATE(F230,35,-250,0),6) | F229: of:=[.F228]+1 -> 193
A230: of:=ROUND(RATE([.F231];35;-250;0);6) -> 0.14 | B230: 0.14 | C230: of:=ROUND([.A230];12)=ROUND([.B230];12) -> true | D230: of:=FORMULA([.A230]) -> =ROUND(RATE(F231,35,-250,0),6) | F230: of:=[.F229]+1 -> 194
A231: of:=ROUND(RATE([.F232];35;-250;0);6) -> 0.14 | B231: 0.14 | C231: of:=ROUND([.A231];12)=ROUND([.B231];12) -> true | D231: of:=FORMULA([.A231]) -> =ROUND(RATE(F232,35,-250,0),6) | F231: of:=[.F230]+1 -> 195
A232: of:=ROUND(RATE([.F233];35;-250;0);6) -> 0.14 | B232: 0.14 | C232: of:=ROUND([.A232];12)=ROUND([.B232];12) -> true | D232: of:=FORMULA([.A232]) -> =ROUND(RATE(F233,35,-250,0),6) | F232: of:=[.F231]+1 -> 196
A233: of:=ROUND(RATE([.F234];35;-250;0);6) -> 0.14 | B233: 0.14 | C233: of:=ROUND([.A233];12)=ROUND([.B233];12) -> true | D233: of:=FORMULA([.A233]) -> =ROUND(RATE(F234,35,-250,0),6) | F233: of:=[.F232]+1 -> 197
A234: of:=ROUND(RATE([.F235];35;-250;0);6) -> 0.14 | B234: 0.14 | C234: of:=ROUND([.A234];12)=ROUND([.B234];12) -> true | D234: of:=FORMULA([.A234]) -> =ROUND(RATE(F235,35,-250,0),6) | F234: of:=[.F233]+1 -> 198
A235: of:=ROUND(RATE([.F236];35;-250;0);6) -> 0.14 | B235: 0.14 | C235: of:=ROUND([.A235];12)=ROUND([.B235];12) -> true | D235: of:=FORMULA([.A235]) -> =ROUND(RATE(F236,35,-250,0),6) | F235: of:=[.F234]+1 -> 199
A236: of:=RATE(4;500;-600;500;0;0.8) -> 0.819622073601656 | B236: 0.819622073601656 | C236: of:=ROUND([.A236];12)=ROUND([.B236];12) -> true | D236: of:=FORMULA([.A236]) -> =RATE(4,500,-600,500,0,0.8) | F236: of:=[.F235]+1 -> 200
A237: of:=ABS(RATE(12;-100;1000)-0.0292285)<0.005 -> true | B237: 1 | C237: of:=ROUND([.A237];12)=ROUND([.B237];12) -> true | D237: of:=FORMULA([.A237]) -> =ABS(RATE(12,-100,1000)-0.0292285)<0.005
A238: of:=ABS(RATE(12;-100;1000;100)-0.01623133)<0.005 -> true | B238: 1 | C238: of:=ROUND([.A238];12)=ROUND([.B238];12) -> true | D238: of:=FORMULA([.A238]) -> =ABS(RATE(12,-100,1000,100)-0.01623133)<0.005
A239: of:=ABS(RATE(12;-100;1000;100;1)-0.01996455)<0.005 -> true | B239: 1 | C239: of:=ROUND([.A239];12)=ROUND([.B239];12) -> true | D239: of:=FORMULA([.A239]) -> =ABS(RATE(12,-100,1000,100,1)-0.01996455)<0.005
A240: of:=ABS(RATE(12;-100;1000;100;1;0.01)-0.01996455)<0.005 -> true | B240: 1 | C240: of:=ROUND([.A240];12)=ROUND([.B240];12) -> true | D240: of:=FORMULA([.A240]) -> =ABS(RATE(12,-100,1000,100,1,0.01)-0.01996455)<0.005
A241: of:=RATE(0;-100;1000) ->  | B241: error | C241: of:=ISERROR([.A241]) -> true | D241: of:=FORMULA([.A241]) -> =RATE(0,-100,1000)
A242: of:=RATE(3;-10;900;0;1;0) -> -0.88823346276572 | B242: -0.88823346276572 | C242: of:=ROUND([.A242];12)=ROUND([.B242];12) -> true | D242: of:=FORMULA([.A242]) -> =RATE(3,-10,900,0,1,0)
A243: of:=RATE(3;-10;900;0;2;0) -> -0.88823346276572 | B243: -0.88823346276572 | C243: of:=ROUND([.A243];12)=ROUND([.B243];12) -> true | D243: of:=FORMULA([.A243]) -> =RATE(3,-10,900,0,2,0)

Sheet: 'file:///home/zdenek/Dokumenty/LO/sc-unit-test/Project%20Calc%20functions%20tests/fods/rate.fods/rate.fods/rate.fods/function_based_test_Example.fods/function_based_test_Example_reference.fods'#Sheet2
H3: 4