Sheet: Sheet1
A1: Reference operators tests
A3: Result | B3: of:=AND([.B8:.B95]) -> true
A7: Sheet | B7: Result | C7: Description
A8: 1 | B8: of:=AND([Sheet2.C9:.C841]) -> true | C8: Test from AOO bug https://bz.apache.org/ooo/show_bug.cgi?id=32341
C9: ODFF: OpCode 'ocUnion' to pass multiple ranges as one parameter

Sheet: Sheet2
B1: 1 | E1: of:=ADDRESS(ROW([.D5]);COLUMN([.D5])) -> $D$5
B2: 2 | D2: 16
B3: 4 | C3: xxx | D3: 32
B4: 8 | D4: 64 | F4: of:=[.B1:.B4]~[.D2:.D5] ->  | G4: of:=NA() ->  | H4: of:=IF(ISERROR([.G4]);ISERROR([.F4]);[.F4]=[.G4]) -> 1
D5: 128 | F5: of:=[.B1:.B4]~[.D2:.D5] ->  | G5: of:=NA() ->  | H5: of:=IF(ISERROR([.G5]);ISERROR([.F5]);[.F5]=[.G5]) -> 1
A6: Note: #N/A in the Must column means that the specific semantic isn't supported and should generate an error. Some Is cells have comments attached as PostIt notes.
A8: Function | B8: Expected | C8: Correct | D8: FunctionString | E8: Comment
A9: of:=SUM([.B1:.D5]) -> 255 | B9: 255 | C9: of:=[.A9]=[.B9] -> true | D9: of:=FORMULA([.A9]) -> =SUM(B1:D5)
A10: of:=SUM(([.C1:.C5]~[.B1:.B5]~[.D1:.D5])) -> 255 | B10: of:=SUM([.B1:.D5]) -> 255 | C10: of:=[.A10]=[.B10] -> true | D10: of:=FORMULA([.A10]) -> =SUM((C1:C5~B1:B5~D1:D5))
A11: of:=SUM(([.C1:.C5]~[.B1:.B5]~[.D1:.D5])) -> 255 | B11: of:=SUM([.B1:.D5]) -> 255 | C11: of:=[.A11]=[.B11] -> true | D11: of:=FORMULA([.A11]) -> {=SUM((C1:C5~B1:B5~D1:D5))}
A12: of:=SUM(([.C1:.C5]~[.B2:.B5]~[.D1:.D5])) -> 254 | B12: of:=SUM([.B2:.D5]) -> 254 | C12: of:=[.A12]=[.B12] -> true | D12: of:=FORMULA([.A12]) -> =SUM((C1:C5~B2:B5~D1:D5))
A13: of:=SUM(([.C1:.C5]~[.B2:.B5]~[.D1:.D5])) -> 254 | B13: of:=SUM([.B2:.D5]) -> 254 | C13: of:=[.A13]=[.B13] -> true | D13: of:=FORMULA([.A13]) -> {=SUM((C1:C5~B2:B5~D1:D5))}
A14: of:=SUM(([.B1:.B4]~[.D2:.D5])!([.B2:.D2]~[.B4:.D4])) -> 90 | B14: of:=SUM([.B2];[.D2];[.B4];[.D4]) -> 90 | C14: of:=[.A14]=[.B14] -> true | D14: of:=FORMULA([.A14]) -> =SUM((B1:B4~D2:D5)!(B2:D2~B4:D4))
A15: of:=SUM([.B1:.B4]~[.D2:.D5]![.B2:.D2]~[.B4:.D4]) -> 103 | B15: of:=SUM([.B1:.B4];[.D2];[.B4:.D4]) -> 103 | C15: of:=[.A15]=[.B15] -> true | D15: of:=FORMULA([.A15]) -> =SUM(B1:B4~D2:D5!B2:D2~B4:D4)
A16: of:=SUM([.B1:.B4]~([.D2:.D5]![.B2:.D2])~[.B4:.D4]) -> 103 | B16: of:=SUM([.B1:.B4];[.D2];[.B4:.D4]) -> 103 | C16: of:=[.A16]=[.B16] -> true | D16: of:=FORMULA([.A16]) -> =SUM(B1:B4~(D2:D5!B2:D2)~B4:D4)
A17: of:=SUM([.B1:.B4]~[.D2:.D5]!([.B2:.D2]~[.B4:.D4])) -> 95 | B17: of:=SUM([.B1:.B4];[.D2];[.D4]) -> 95 | C17: of:=[.A17]=[.B17] -> true | D17: of:=FORMULA([.A17]) -> =SUM(B1:B4~D2:D5!(B2:D2~B4:D4))
A18: of:=SUM([.B1:.B4]~[.D2:.D5]![.B2]:([.C2:.D2]~[.B4:.C4]):[.D4]) -> 127 | B18: of:=SUM([.B1:.B4];[.D2:.D4]) -> 127 | C18: of:=[.A18]=[.B18] -> true | D18: of:=FORMULA([.A18]) -> =SUM(B1:B4~D2:D5!B2:(C2:D2~B4:C4):D4)
A19: of:=SUM((([.B1:.B4]~[.D2:.D5])!([.B2:.D2]~[.B4:.D4])):[.D5]) -> 254 | B19: of:=SUM([.B2:.D5]) -> 254 | C19: of:=[.A19]=[.B19] -> true | D19: of:=FORMULA([.A19]) -> =SUM(((B1:B4~D2:D5)!(B2:D2~B4:D4)):D5)
A20: of:=SUM((([.B1:.B4]~[.D2:.D5])!([.B2:.D2]~[.B4:.D4])):INDIRECT([.E1])) -> 254 | B20: of:=SUM([.B2:.D5]) -> 254 | C20: of:=[.A20]=[.B20] -> true | D20: of:=FORMULA([.A20]) -> =SUM(((B1:B4~D2:D5)!(B2:D2~B4:D4)):INDIRECT(E1))
A21: of:=SUM(([.B1:.B4]~[.D2:.D5])!([.B2:.D2]~[.B4:.D4]):[.D5]) -> 254 | B21: of:=SUM([.B2:.D5]) -> 254 | C21: of:=[.A21]=[.B21] -> true | D21: of:=FORMULA([.A21]) -> =SUM((B1:B4~D2:D5)!(B2:D2~B4:D4):D5)
A22: of:=SUM(([.B1:.B4]~[.D2:.D5])!([.B2:.D2]~[.B4:.D4]):INDIRECT([.E1])) -> 254 | B22: of:=SUM([.B2:.D5]) -> 254 | C22: of:=[.A22]=[.B22] -> true | D22: of:=FORMULA([.A22]) -> =SUM((B1:B4~D2:D5)!(B2:D2~B4:D4):INDIRECT(E1))
A23: of:=SUM(([.B1:.B4]~[.D2:.D5])!([.B2:.D2])~([.B4:.D5])) -> 218 | B23: of:=SUM([.B2];[.D2];[.B4:.D5]) -> 218 | C23: of:=[.A23]=[.B23] -> true | D23: of:=FORMULA([.A23]) -> =SUM((B1:B4~D2:D5)!(B2:D2)~(B4:D5))
A24: of:=SUM(([.B1:.B4]~[.D2:.D5])!([.B2:.D2])~([.B4:.D4]:INDIRECT([.E1]))) -> 218 | B24: of:=SUM([.B2];[.D2];[.B4:.D5]) -> 218 | C24: of:=[.A24]=[.B24] -> true | D24: of:=FORMULA([.A24]) -> =SUM((B1:B4~D2:D5)!(B2:D2)~(B4:D4:INDIRECT(E1)))
A25: of:=SUM(([.B1:.B4]~[.D2:.D5])!([.B2:.D2]~[.B4:.D5])) -> 218 | B25: of:=SUM([.B2];[.D2];[.B4:.D5]) -> 218 | C25: of:=[.A25]=[.B25] -> true | D25: of:=FORMULA([.A25]) -> =SUM((B1:B4~D2:D5)!(B2:D2~B4:D5))
A26: of:=SUM(([.B1:.B4]~[.D2:.D5])!([.B2:.D2]~[.B4:.D4]:INDIRECT([.E1]))) -> 218 | B26: of:=SUM([.B2];[.D2];[.B4:.D5]) -> 218 | C26: of:=[.A26]=[.B26] -> true | D26: of:=FORMULA([.A26]) -> =SUM((B1:B4~D2:D5)!(B2:D2~B4:D4:INDIRECT(E1)))
A27: of:=SUM(([.B1:.B4]~[.D2:.D5])![.B2:.D2]~[.B4:.D5]) -> 218 | B27: of:=SUM([.B2];[.D2];[.B4:.D5]) -> 218 | C27: of:=[.A27]=[.B27] -> true | D27: of:=FORMULA([.A27]) -> =SUM((B1:B4~D2:D5)!B2:D2~B4:D5)
A28: of:=SUM(([.B1:.B4]~[.D2:.D5])![.B2:.D2]~[.B4:.D4]:INDIRECT([.E1])) -> 218 | B28: of:=SUM([.B2];[.D2];[.B4:.D5]) -> 218 | C28: of:=[.A28]=[.B28] -> true | D28: of:=FORMULA([.A28]) -> =SUM((B1:B4~D2:D5)!B2:D2~B4:D4:INDIRECT(E1))
A29: of:=SUM([.B1:.B4]~[.D2:.D5]![.B2:.D2]~[.B4:.D5]) -> 231 | B29: of:=SUM([.B1:.B4];[.D2];[.B4:.D5]) -> 231 | C29: of:=[.A29]=[.B29] -> true | D29: of:=FORMULA([.A29]) -> =SUM(B1:B4~D2:D5!B2:D2~B4:D5)
A30: of:=SUM([.B1:.B4]~[.D2:.D5]![.B2:.D2]~[.B4:.D4]:INDIRECT([.E1])) -> 231 | B30: of:=SUM([.B1:.B4];[.D2];[.B4:.D5]) -> 231 | C30: of:=[.A30]=[.B30] -> true | D30: of:=FORMULA([.A30]) -> =SUM(B1:B4~D2:D5!B2:D2~B4:D4:INDIRECT(E1))
A31: of:=SUM(([.B2:.B3]~[.D3:.D4]):[.D5]) -> 254 | B31: of:=SUM([.B2:.D5]) -> 254 | C31: of:=[.A31]=[.B31] -> true | D31: of:=FORMULA([.A31]) -> =SUM((B2:B3~D3:D4):D5)
A32: of:=SUM(([.B2:.B3]~[.D3:.D4]):INDIRECT([.E1])) -> 254 | B32: of:=SUM([.B2:.D5]) -> 254 | C32: of:=[.A32]=[.B32] -> true | D32: of:=FORMULA([.A32]) -> =SUM((B2:B3~D3:D4):INDIRECT(E1))
A33: of:=SUM(([.B2:.B3]~([.D3:.D5]))) -> 230 | B33: of:=SUM([.B2:.B3];[.D3:.D5]) -> 230 | C33: of:=[.A33]=[.B33] -> true | D33: of:=FORMULA([.A33]) -> =SUM((B2:B3~(D3:D5)))
A34: of:=SUM(([.B2:.B3]~([.D3:.D4]:INDIRECT([.E1])))) -> 230 | B34: of:=SUM([.B2:.B3];[.D3:.D5]) -> 230 | C34: of:=[.A34]=[.B34] -> true | D34: of:=FORMULA([.A34]) -> =SUM((B2:B3~(D3:D4:INDIRECT(E1))))
A35: of:=SUM(([.B2:.B3]~[.D3:.D5])) -> 230 | B35: of:=SUM([.B2:.B3];[.D3:.D5]) -> 230 | C35: of:=[.A35]=[.B35] -> true | D35: of:=FORMULA([.A35]) -> =SUM((B2:B3~D3:D5))
A36: of:=SUM(([.B2:.B3]~[.D3:.D4]:INDIRECT([.E1]))) -> 230 | B36: of:=SUM([.B2:.B3];[.D3:.D5]) -> 230 | C36: of:=[.A36]=[.B36] -> true | D36: of:=FORMULA([.A36]) -> =SUM((B2:B3~D3:D4:INDIRECT(E1)))
A37: of:=SUM([.B4:.D4]!([.D3:.D5])) -> 64 | B37: of:=SUM([.D4]) -> 64 | C37: of:=[.A37]=[.B37] -> true | D37: of:=FORMULA([.A37]) -> =SUM(B4:D4!(D3:D5))
A38: of:=SUM([.B4:.D4]!([.D3:.D4]:INDIRECT([.E1]))) -> 64 | B38: of:=SUM([.D4]) -> 64 | C38: of:=[.A38]=[.B38] -> true | D38: of:=FORMULA([.A38]) -> =SUM(B4:D4!(D3:D4:INDIRECT(E1)))
A39: of:=SUM([.B4:.D4]![.D3:.D5]) -> 64 | B39: of:=SUM([.D4]) -> 64 | C39: of:=[.A39]=[.B39] -> true | D39: of:=FORMULA([.A39]) -> =SUM(B4:D4!D3:D5)
A40: of:=SUM([.B4:.D4]![.D3:.D4]:INDIRECT([.E1])) -> 64 | B40: of:=SUM([.D4]) -> 64 | C40: of:=[.A40]=[.B40] -> true | D40: of:=FORMULA([.A40]) -> =SUM(B4:D4!D3:D4:INDIRECT(E1))
A41: of:=SUM(([.B4:.D4]![.D3:.D4]):[.D5]) -> 192 | B41: of:=SUM([.D4:.D5]) -> 192 | C41: of:=[.A41]=[.B41] -> true | D41: of:=FORMULA([.A41]) -> =SUM((B4:D4!D3:D4):D5)
A42: of:=SUM(([.B4:.D4]![.D3:.D4]):INDIRECT([.E1])) -> 192 | B42: of:=SUM([.D4:.D5]) -> 192 | C42: of:=[.A42]=[.B42] -> true | D42: of:=FORMULA([.A42]) -> =SUM((B4:D4!D3:D4):INDIRECT(E1))
A43: of:=AND([.B1:.D5]) -> true | B43: true | C43: of:=[.A43]=[.B43] -> true | D43: of:=FORMULA([.A43]) -> =AND(B1:D5)
A44: of:=AND(([.C1:.C5]~[.B1:.B5]~[.D1:.D5])) -> true | B44: true | C44: of:=[.A44]=[.B44] -> true | D44: of:=FORMULA([.A44]) -> =AND((C1:C5~B1:B5~D1:D5))
A45: of:=OR([.B1:.D5]) -> true | B45: true | C45: of:=[.A45]=[.B45] -> true | D45: of:=FORMULA([.A45]) -> =OR(B1:D5)
A46: of:=OR(([.C1:.C5]~[.B1:.B5]~[.D1:.D5])) -> true | B46: true | C46: of:=[.A46]=[.B46] -> true | D46: of:=FORMULA([.A46]) -> =OR((C1:C5~B1:B5~D1:D5))
A47: of:=ISREF([.B1:.D5]) -> true | B47: true | C47: of:=[.A47]=[.B47] -> true | D47: of:=FORMULA([.A47]) -> =ISREF(B1:D5)
A48: of:=ISREF(([.C1:.C5]~[.B1:.B5]~[.D1:.D5])) -> true | B48: true | C48: of:=[.A48]=[.B48] -> true | D48: of:=FORMULA([.A48]) -> =ISREF((C1:C5~B1:B5~D1:D5))
A49: of:=ISNUMBER([.B1:.D5]) -> false | B49: false | C49: of:=[.A49]=[.B49] -> true | D49: of:=FORMULA([.A49]) -> =ISNUMBER(B1:D5)
A50: of:=ISNUMBER(([.C1:.C5]~[.B1:.B5]~[.D1:.D5])) -> false | B50: false | C50: of:=[.A50]=[.B50] -> true | D50: of:=FORMULA([.A50]) -> =ISNUMBER((C1:C5~B1:B5~D1:D5))
A51: of:=ISLOGICAL([.B1:.D5]) -> false | B51: false | C51: of:=[.A51]=[.B51] -> true | D51: of:=FORMULA([.A51]) -> =ISLOGICAL(B1:D5)
A52: of:=ISLOGICAL(([.C1:.C5]~[.B1:.B5]~[.D1:.D5])) -> false | B52: false | C52: of:=[.A52]=[.B52] -> true | D52: of:=FORMULA([.A52]) -> =ISLOGICAL((C1:C5~B1:B5~D1:D5))
A53: of:=MIN([.B1:.D5]) -> 1 | B53: 1 | C53: of:=[.A53]=[.B53] -> true | D53: of:=FORMULA([.A53]) -> =MIN(B1:D5)
A54: of:=MIN(([.C1:.C5]~[.B1:.B5]~[.D1:.D5])) -> 1 | B54: 1 | C54: of:=[.A54]=[.B54] -> true | D54: of:=FORMULA([.A54]) -> =MIN((C1:C5~B1:B5~D1:D5))
A55: of:=MINA([.B1:.D5]) -> 0 | B55: 0 | C55: of:=[.A55]=[.B55] -> true | D55: of:=FORMULA([.A55]) -> =MINA(B1:D5)
A56: of:=MINA(([.C1:.C5]~[.B1:.B5]~[.D1:.D5])) -> 0 | B56: 0 | C56: of:=[.A56]=[.B56] -> true | D56: of:=FORMULA([.A56]) -> =MINA((C1:C5~B1:B5~D1:D5))
A57: of:=MAX([.B1:.D5]) -> 128 | B57: 128 | C57: of:=[.A57]=[.B57] -> true | D57: of:=FORMULA([.A57]) -> =MAX(B1:D5)
A58: of:=MAX(([.C1:.C5]~[.B1:.B5]~[.D1:.D5])) -> 128 | B58: 128 | C58: of:=[.A58]=[.B58] -> true | D58: of:=FORMULA([.A58]) -> =MAX((C1:C5~B1:B5~D1:D5))
A59: of:=MAXA([.B1:.D5]) -> 128 | B59: 128 | C59: of:=[.A59]=[.B59] -> true | D59: of:=FORMULA([.A59]) -> =MAXA(B1:D5)
A60: of:=MAXA(([.C1:.C5]~[.B1:.B5]~[.D1:.D5])) -> 128 | B60: 128 | C60: of:=[.A60]=[.B60] -> true | D60: of:=FORMULA([.A60]) -> =MAXA((C1:C5~B1:B5~D1:D5))
A61: of:=COUNT([.B1:.D5]) -> 8 | B61: 8 | C61: of:=[.A61]=[.B61] -> true | D61: of:=FORMULA([.A61]) -> =COUNT(B1:D5)
A62: of:=COUNT(([.C1:.C5]~[.B1:.B5]~[.D1:.D5])) -> 8 | B62: 8 | C62: of:=[.A62]=[.B62] -> true | D62: of:=FORMULA([.A62]) -> =COUNT((C1:C5~B1:B5~D1:D5))
A63: of:=COUNTA([.B1:.D5]) -> 9 | B63: 9 | C63: of:=[.A63]=[.B63] -> true | D63: of:=FORMULA([.A63]) -> =COUNTA(B1:D5)
A64: of:=COUNTA(([.C1:.C5]~[.B1:.B5]~[.D1:.D5])) -> 9 | B64: 9 | C64: of:=[.A64]=[.B64] -> true | D64: of:=FORMULA([.A64]) -> =COUNTA((C1:C5~B1:B5~D1:D5))
A65: of:=STDEV([.B1:.D5]) -> 44.2668450584472 | B65: 44.2668450584472 | C65: of:=ORG.LIBREOFFICE.ROUNDSIG([.A65];15)=ORG.LIBREOFFICE.ROUNDSIG([.B65];15) -> true | D65: of:=FORMULA([.A65]) -> =STDEV(B1:D5)
A66: of:=STDEV(([.C1:.C5]~[.B1:.B5]~[.D1:.D5])) -> 44.2668450584472 | B66: 44.2668450584472 | C66: of:=ORG.LIBREOFFICE.ROUNDSIG([.A66];15)=ORG.LIBREOFFICE.ROUNDSIG([.B66];15) -> true | D66: of:=FORMULA([.A66]) -> =STDEV((C1:C5~B1:B5~D1:D5))
A67: of:=STDEVA([.B1:.D5]) -> 42.7492689995981 | B67: 42.7492689995981 | C67: of:=ORG.LIBREOFFICE.ROUNDSIG([.A67];15)=ORG.LIBREOFFICE.ROUNDSIG([.B67];15) -> true | D67: of:=FORMULA([.A67]) -> =STDEVA(B1:D5)
A68: of:=STDEVA(([.C1:.C5]~[.B1:.B5]~[.D1:.D5])) -> 42.7492689995981 | B68: 42.7492689995981 | C68: of:=ORG.LIBREOFFICE.ROUNDSIG([.A68];15)=ORG.LIBREOFFICE.ROUNDSIG([.B68];15) -> true | D68: of:=FORMULA([.A68]) -> =STDEVA((C1:C5~B1:B5~D1:D5))
A69: of:=COUNTBLANK([.B1:.D5]) -> 6 | B69: 6 | C69: of:=ORG.LIBREOFFICE.ROUNDSIG([.A69];15)=ORG.LIBREOFFICE.ROUNDSIG([.B69];15) -> true | D69: of:=FORMULA([.A69]) -> =COUNTBLANK(B1:D5)
A70: of:=COUNTBLANK(([.C1:.C5]~[.B1:.B5]~[.D1:.D5])) -> 6 | B70: 6 | C70: of:=ORG.LIBREOFFICE.ROUNDSIG([.A70];15)=ORG.LIBREOFFICE.ROUNDSIG([.B70];15) -> true | D70: of:=FORMULA([.A70]) -> =COUNTBLANK((C1:C5~B1:B5~D1:D5))
A71: of:=COUNTIF([.B1:.D5];32) -> 1 | B71: 1 | C71: of:=ORG.LIBREOFFICE.ROUNDSIG([.A71];15)=ORG.LIBREOFFICE.ROUNDSIG([.B71];15) -> true | D71: of:=FORMULA([.A71]) -> =COUNTIF(B1:D5,32)
A72: of:=COUNTIF(([.C1:.C5]~[.B1:.B5]~[.D1:.D5]);32) -> 1 | B72: 1 | C72: of:=ORG.LIBREOFFICE.ROUNDSIG([.A72];15)=ORG.LIBREOFFICE.ROUNDSIG([.B72];15) -> true | D72: of:=FORMULA([.A72]) -> =COUNTIF((C1:C5~B1:B5~D1:D5),32)
A73: of:=SUMIF([.B1:.D5];"<>0") -> 255 | B73: 255 | C73: of:=ORG.LIBREOFFICE.ROUNDSIG([.A73];15)=ORG.LIBREOFFICE.ROUNDSIG([.B73];15) -> true | D73: of:=FORMULA([.A73]) -> =SUMIF(B1:D5,"<>0")
A74: of:=SUMIF(([.C1:.C5]~[.B1:.B5]~[.D1:.D5]);"<>0") -> 255 | B74: 255 | C74: of:=ORG.LIBREOFFICE.ROUNDSIG([.A74];15)=ORG.LIBREOFFICE.ROUNDSIG([.B74];15) -> true | D74: of:=FORMULA([.A74]) -> =SUMIF((C1:C5~B1:B5~D1:D5),"<>0")
A75: of:=SUMIF([.B1:.D5];32;[.B1:.D5]) -> 32 | B75: 32 | C75: of:=ORG.LIBREOFFICE.ROUNDSIG([.A75];15)=ORG.LIBREOFFICE.ROUNDSIG([.B75];15) -> true | D75: of:=FORMULA([.A75]) -> =SUMIF(B1:D5,32,B1:D5)
A76: of:=SUMIF(([.C1:.C5]~[.B1:.B5]~[.D1:.D5]);32;[.B1:.D5]) ->  | B76: of:=NA() ->  | C76: of:=ISERROR([.A76]) -> true | D76: of:=FORMULA([.A76]) -> =SUMIF((C1:C5~B1:B5~D1:D5),32,B1:D5)
A77: of:=SUMIF(([.C1:.C5]~[.B1:.B5]~[.D1:.D5]):[.D5];32;[.B1:.D5]) -> 32 | B77: 32 | C77: of:=ORG.LIBREOFFICE.ROUNDSIG([.A77];15)=ORG.LIBREOFFICE.ROUNDSIG([.B77];15) -> true | D77: of:=FORMULA([.A77]) -> =SUMIF((C1:C5~B1:B5~D1:D5):D5,32,B1:D5)
A78: of:=SUMIF(([.C1:.C5]~[.B1:.B5]~[.D1:.D5]);32) -> 32 | B78: 32 | C78: of:=ORG.LIBREOFFICE.ROUNDSIG([.A78];15)=ORG.LIBREOFFICE.ROUNDSIG([.B78];15) -> true | D78: of:=FORMULA([.A78]) -> =SUMIF((C1:C5~B1:B5~D1:D5),32)
A79: of:=ORG.OPENOFFICE.ERRORTYPE([.B1:.D5]) -> 519 | B79: 519 | C79: of:=ORG.LIBREOFFICE.ROUNDSIG([.A79];15)=ORG.LIBREOFFICE.ROUNDSIG([.B79];15) -> true | D79: of:=FORMULA([.A79]) -> =ERRORTYPE(B1:D5)
A80: of:=ORG.OPENOFFICE.ERRORTYPE(([.C1:.C5]~[.B1:.B5]~[.D1:.D5])) -> 519 | B80: 519 | C80: of:=ORG.LIBREOFFICE.ROUNDSIG([.A80];15)=ORG.LIBREOFFICE.ROUNDSIG([.B80];15) -> true | D80: of:=FORMULA([.A80]) -> =ERRORTYPE((C1:C5~B1:B5~D1:D5))
A81: of:=NPV(42;[.B1:.D5];[.B1:.D5]) -> 0.024540109048499 | B81: 0.024540109048499 | C81: of:=ORG.LIBREOFFICE.ROUNDSIG([.A81];15)=ORG.LIBREOFFICE.ROUNDSIG([.B81];15) -> true | D81: of:=FORMULA([.A81]) -> =NPV(42,B1:D5,B1:D5)
A82: of:=NPV(42;([.C1:.C5]~[.B1:.B5]~[.D1:.D5]);([.C1:.C5]~[.B1:.B5]~[.D1:.D5])) -> 0.0243902439019069 | B82: 0.0243902439019069 | C82: of:=ORG.LIBREOFFICE.ROUNDSIG([.A82];15)=ORG.LIBREOFFICE.ROUNDSIG([.B82];15) -> true | D82: of:=FORMULA([.A82]) -> =NPV(42,(C1:C5~B1:B5~D1:D5),(C1:C5~B1:B5~D1:D5))
A83: of:=ZTEST([.B1:.D5];42) -> 0.741163382876075 | B83: 0.741163382876075 | C83: of:=ORG.LIBREOFFICE.ROUNDSIG([.A83];15)=ORG.LIBREOFFICE.ROUNDSIG([.B83];15) -> true | D83: of:=FORMULA([.A83]) -> =ZTEST(B1:D5,42)
A84: of:=ZTEST(([.C1:.C5]~[.B1:.B5]~[.D1:.D5]);42) -> 0.741163382876075 | B84: 0.741163382876075 | C84: of:=ORG.LIBREOFFICE.ROUNDSIG([.A84];15)=ORG.LIBREOFFICE.ROUNDSIG([.B84];15) -> true | D84: of:=FORMULA([.A84]) -> =ZTEST((C1:C5~B1:B5~D1:D5),42)
A85: of:=KURT([.B1:.D5];[.B1:.D5]) -> 1.60155859406862 | B85: 1.60155859406862 | C85: of:=ORG.LIBREOFFICE.ROUNDSIG([.A85];15)=ORG.LIBREOFFICE.ROUNDSIG([.B85];15) -> true | D85: of:=FORMULA([.A85]) -> =KURT(B1:D5,B1:D5)
A86: of:=KURT(([.C1:.C5]~[.B1:.B5]~[.D1:.D5]);([.C1:.C5]~[.B1:.B5]~[.D1:.D5])) -> 1.60155859406862 | B86: 1.60155859406862 | C86: of:=ORG.LIBREOFFICE.ROUNDSIG([.A86];15)=ORG.LIBREOFFICE.ROUNDSIG([.B86];15) -> true | D86: of:=FORMULA([.A86]) -> =KURT((C1:C5~B1:B5~D1:D5),(C1:C5~B1:B5~D1:D5))
A87: of:=HARMEAN([.B1:.D5];[.B1:.D5]) -> 4.0156862745098 | B87: 4.0156862745098 | C87: of:=ORG.LIBREOFFICE.ROUNDSIG([.A87];15)=ORG.LIBREOFFICE.ROUNDSIG([.B87];15) -> true | D87: of:=FORMULA([.A87]) -> =HARMEAN(B1:D5,B1:D5)
A88: of:=HARMEAN(([.C1:.C5]~[.B1:.B5]~[.D1:.D5]);([.C1:.C5]~[.B1:.B5]~[.D1:.D5])) -> 4.0156862745098 | B88: 4.0156862745098 | C88: of:=ORG.LIBREOFFICE.ROUNDSIG([.A88];15)=ORG.LIBREOFFICE.ROUNDSIG([.B88];15) -> true | D88: of:=FORMULA([.A88]) -> =HARMEAN((C1:C5~B1:B5~D1:D5),(C1:C5~B1:B5~D1:D5))
A89: of:=GEOMEAN([.B1:.D5];[.B1:.D5]) -> 11.3137084989848 | B89: 11.3137084989848 | C89: of:=ORG.LIBREOFFICE.ROUNDSIG([.A89];15)=ORG.LIBREOFFICE.ROUNDSIG([.B89];15) -> true | D89: of:=FORMULA([.A89]) -> =GEOMEAN(B1:D5,B1:D5)
A90: of:=GEOMEAN(([.C1:.C5]~[.B1:.B5]~[.D1:.D5]);([.C1:.C5]~[.B1:.B5]~[.D1:.D5])) -> 11.3137084989848 | B90: 11.3137084989848 | C90: of:=ORG.LIBREOFFICE.ROUNDSIG([.A90];15)=ORG.LIBREOFFICE.ROUNDSIG([.B90];15) -> true | D90: of:=FORMULA([.A90]) -> =GEOMEAN((C1:C5~B1:B5~D1:D5),(C1:C5~B1:B5~D1:D5))
A91: of:=SKEW([.B1:.D5];[.B1:.D5]) -> 1.60920689814072 | B91: 1.60920689814072 | C91: of:=ORG.LIBREOFFICE.ROUNDSIG([.A91];15)=ORG.LIBREOFFICE.ROUNDSIG([.B91];15) -> true | D91: of:=FORMULA([.A91]) -> =SKEW(B1:D5,B1:D5)
A92: of:=SKEW(([.C1:.C5]~[.B1:.B5]~[.D1:.D5]);([.C1:.C5]~[.B1:.B5]~[.D1:.D5])) -> 1.60920689814072 | B92: 1.60920689814072 | C92: of:=ORG.LIBREOFFICE.ROUNDSIG([.A92];15)=ORG.LIBREOFFICE.ROUNDSIG([.B92];15) -> true | D92: of:=FORMULA([.A92]) -> =SKEW((C1:C5~B1:B5~D1:D5),(C1:C5~B1:B5~D1:D5))
A93: of:=RANK(32;[.B1:.D5]) -> 3 | B93: 3 | C93: of:=ORG.LIBREOFFICE.ROUNDSIG([.A93];15)=ORG.LIBREOFFICE.ROUNDSIG([.B93];15) -> true | D93: of:=FORMULA([.A93]) -> =RANK(32,B1:D5)
A94: of:=RANK(32;([.C1:.C5]~[.B1:.B5]~[.D1:.D5])) -> 3 | B94: 3 | C94: of:=ORG.LIBREOFFICE.ROUNDSIG([.A94];15)=ORG.LIBREOFFICE.ROUNDSIG([.B94];15) -> true | D94: of:=FORMULA([.A94]) -> =RANK(32,(C1:C5~B1:B5~D1:D5))
A95: of:=AVEDEV([.B1:.D5];[.B1:.D5]) -> 32.09375 | B95: 32.09375 | C95: of:=ORG.LIBREOFFICE.ROUNDSIG([.A95];15)=ORG.LIBREOFFICE.ROUNDSIG([.B95];15) -> true | D95: of:=FORMULA([.A95]) -> =AVEDEV(B1:D5,B1:D5)
A96: of:=AVEDEV(([.C1:.C5]~[.B1:.B5]~[.D1:.D5]);([.C1:.C5]~[.B1:.B5]~[.D1:.D5])) -> 32.09375 | B96: 32.09375 | C96: of:=ORG.LIBREOFFICE.ROUNDSIG([.A96];15)=ORG.LIBREOFFICE.ROUNDSIG([.B96];15) -> true | D96: of:=FORMULA([.A96]) -> =AVEDEV((C1:C5~B1:B5~D1:D5),(C1:C5~B1:B5~D1:D5))
A97: of:=GCD([.B1:.D5];[.B1:.D5]) -> 1 | B97: 1 | C97: of:=ORG.LIBREOFFICE.ROUNDSIG([.A97];15)=ORG.LIBREOFFICE.ROUNDSIG([.B97];15) -> true | D97: of:=FORMULA([.A97]) -> =GCD(B1:D5,B1:D5)
A98: of:=GCD(([.C1:.C5]~[.B1:.B5]~[.D1:.D5]);([.C1:.C5]~[.B1:.B5]~[.D1:.D5])) -> 1 | B98: 1 | C98: of:=ORG.LIBREOFFICE.ROUNDSIG([.A98];15)=ORG.LIBREOFFICE.ROUNDSIG([.B98];15) -> true | D98: of:=FORMULA([.A98]) -> =GCD((C1:C5~B1:B5~D1:D5),(C1:C5~B1:B5~D1:D5))
A99: of:=LCM([.B1:.D5];[.B1:.D5]) -> 128 | B99: 128 | C99: of:=ORG.LIBREOFFICE.ROUNDSIG([.A99];15)=ORG.LIBREOFFICE.ROUNDSIG([.B99];15) -> true | D99: of:=FORMULA([.A99]) -> =LCM(B1:D5,B1:D5)
A100: of:=LCM(([.C1:.C5]~[.B1:.B5]~[.D1:.D5]);([.C1:.C5]~[.B1:.B5]~[.D1:.D5])) -> 128 | B100: 128 | C100: of:=ORG.LIBREOFFICE.ROUNDSIG([.A100];15)=ORG.LIBREOFFICE.ROUNDSIG([.B100];15) -> true | D100: of:=FORMULA([.A100]) -> =LCM((C1:C5~B1:B5~D1:D5),(C1:C5~B1:B5~D1:D5))
A101: of:=SUM(INDEX(([.C1:.C5]~[.B1:.B5]~[.D1:.D5]);0;0;0)) ->  | B101: of:=NA() ->  | C101: of:=ISERROR([.A101]) -> true | D101: of:=FORMULA([.A101]) -> =SUM(INDEX((C1:C5~B1:B5~D1:D5),0,0,0))
A102: of:=SUM(INDEX(([.C1:.C5]~[.B1:.B5]~[.D1:.D5]);0;0;4)) ->  | B102: of:=NA() ->  | C102: of:=ISERROR([.A102]) -> true | D102: of:=FORMULA([.A102]) -> =SUM(INDEX((C1:C5~B1:B5~D1:D5),0,0,4))
A103: of:=SUM([.C1:.C5]) -> 0 | B103: 0 | C103: of:=ORG.LIBREOFFICE.ROUNDSIG([.A103];15)=ORG.LIBREOFFICE.ROUNDSIG([.B103];15) -> true | D103: of:=FORMULA([.A103]) -> =SUM(C1:C5)
A104: of:=SUM(INDEX(([.C1:.C5]~[.B1:.B5]~[.D1:.D5]);0;0;1)) -> 0 | B104: 0 | C104: of:=ORG.LIBREOFFICE.ROUNDSIG([.A104];15)=ORG.LIBREOFFICE.ROUNDSIG([.B104];15) -> true | D104: of:=FORMULA([.A104]) -> =SUM(INDEX((C1:C5~B1:B5~D1:D5),0,0,1))
A105: of:=SUM([.B1:.B5]) -> 15 | B105: 15 | C105: of:=ORG.LIBREOFFICE.ROUNDSIG([.A105];15)=ORG.LIBREOFFICE.ROUNDSIG([.B105];15) -> true | D105: of:=FORMULA([.A105]) -> =SUM(B1:B5)
A106: of:=SUM(INDEX(([.C1:.C5]~[.B1:.B5]~[.D1:.D5]);0;0;2)) -> 15 | B106: 15 | C106: of:=ORG.LIBREOFFICE.ROUNDSIG([.A106];15)=ORG.LIBREOFFICE.ROUNDSIG([.B106];15) -> true | D106: of:=FORMULA([.A106]) -> =SUM(INDEX((C1:C5~B1:B5~D1:D5),0,0,2))
A107: of:=SUM([.D1:.D5]) -> 240 | B107: 240 | C107: of:=ORG.LIBREOFFICE.ROUNDSIG([.A107];15)=ORG.LIBREOFFICE.ROUNDSIG([.B107];15) -> true | D107: of:=FORMULA([.A107]) -> =SUM(D1:D5)
A108: of:=SUM(INDEX(([.C1:.C5]~[.B1:.B5]~[.D1:.D5]);0;0;3)) -> 240 | B108: 240 | C108: of:=ORG.LIBREOFFICE.ROUNDSIG([.A108];15)=ORG.LIBREOFFICE.ROUNDSIG([.B108];15) -> true | D108: of:=FORMULA([.A108]) -> =SUM(INDEX((C1:C5~B1:B5~D1:D5),0,0,3))
A109: of:=AREAS(([.C1:.C5]~[.B1:.B5]~[.D1:.D5])) -> 3 | B109: 3 | C109: of:=ORG.LIBREOFFICE.ROUNDSIG([.A109];15)=ORG.LIBREOFFICE.ROUNDSIG([.B109];15) -> true | D109: of:=FORMULA([.A109]) -> =AREAS((C1:C5~B1:B5~D1:D5))
A110: of:=FREQUENCY(([.C1:.C5]~[.B1:.B5]~[.D1:.D5]);{4;16;64}) -> 3 | B110: 3 | C110: of:=ORG.LIBREOFFICE.ROUNDSIG([.A110];15)=ORG.LIBREOFFICE.ROUNDSIG([.B110];15) -> true | D110: of:=FORMULA([.A110]) -> {=FREQUENCY((C1:C5~B1:B5~D1:D5),{4,16,64})}
A111: 2 | B111: 2 | C111: of:=ORG.LIBREOFFICE.ROUNDSIG([.A111];15)=ORG.LIBREOFFICE.ROUNDSIG([.B111];15) -> true | D111: of:=FORMULA([.A111]) -> {=FREQUENCY((C1:C5~B1:B5~D1:D5),{4,16,64})}
A112: 2 | B112: 2 | C112: of:=ORG.LIBREOFFICE.ROUNDSIG([.A112];15)=ORG.LIBREOFFICE.ROUNDSIG([.B112];15) -> true | D112: of:=FORMULA([.A112]) -> {=FREQUENCY((C1:C5~B1:B5~D1:D5),{4,16,64})}
A113: 1 | B113: 1 | C113: of:=ORG.LIBREOFFICE.ROUNDSIG([.A113];15)=ORG.LIBREOFFICE.ROUNDSIG([.B113];15) -> true | D113: of:=FORMULA([.A113]) -> {=FREQUENCY((C1:C5~B1:B5~D1:D5),{4,16,64})}
A114: of:=MEDIAN(([.C1:.C5]~[.B1:.B5]~[.D1:.D5])) -> 12 | B114: 12 | C114: of:=ORG.LIBREOFFICE.ROUNDSIG([.A114];15)=ORG.LIBREOFFICE.ROUNDSIG([.B114];15) -> true | D114: of:=FORMULA([.A114]) -> =MEDIAN((C1:C5~B1:B5~D1:D5))
A115: of:=PERCENTILE(([.C1:.C5]~[.B1:.B5]~[.D1:.D5]);0.5) -> 12 | B115: 12 | C115: of:=ORG.LIBREOFFICE.ROUNDSIG([.A115];15)=ORG.LIBREOFFICE.ROUNDSIG([.B115];15) -> true | D115: of:=FORMULA([.A115]) -> =PERCENTILE((C1:C5~B1:B5~D1:D5),0.5)
A116: of:=QUARTILE(([.C1:.C5]~[.B1:.B5]~[.D1:.D5]);2) -> 12 | B116: 12 | C116: of:=ORG.LIBREOFFICE.ROUNDSIG([.A116];15)=ORG.LIBREOFFICE.ROUNDSIG([.B116];15) -> true | D116: of:=FORMULA([.A116]) -> =QUARTILE((C1:C5~B1:B5~D1:D5),2)
A117: of:=MODE(([.C1:.C5]~[.B1:.B5]~[.D1:.D5])) ->  | B117: of:=NA() ->  | C117: of:=ISERROR([.A117]) -> true | D117: of:=FORMULA([.A117]) -> =MODE((C1:C5~B1:B5~D1:D5))
A118: of:=LARGE(([.C1:.C5]~[.B1:.B5]~[.D1:.D5]);4) -> 16 | B118: 16 | C118: of:=ORG.LIBREOFFICE.ROUNDSIG([.A118];15)=ORG.LIBREOFFICE.ROUNDSIG([.B118];15) -> true | D118: of:=FORMULA([.A118]) -> =LARGE((C1:C5~B1:B5~D1:D5),4)
A119: of:=SMALL(([.C1:.C5]~[.B1:.B5]~[.D1:.D5]);4) -> 8 | B119: 8 | C119: of:=ORG.LIBREOFFICE.ROUNDSIG([.A119];15)=ORG.LIBREOFFICE.ROUNDSIG([.B119];15) -> true | D119: of:=FORMULA([.A119]) -> =SMALL((C1:C5~B1:B5~D1:D5),4) | H119: xxx
A120: of:=TRIMMEAN(([.C1:.C5]~[.B1:.B5]~[.D1:.D5]);0.5) -> 15 | B120: 15 | C120: of:=ORG.LIBREOFFICE.ROUNDSIG([.A120];15)=ORG.LIBREOFFICE.ROUNDSIG([.B120];15) -> true | D120: of:=FORMULA([.A120]) -> =TRIMMEAN((C1:C5~B1:B5~D1:D5),0.5)
H122: 1
H123: 2
A124: of:=PERCENTRANK(([.C1:.C5]~[.B1:.B5]~[.D1:.D5]);42) -> 0.759 | B124: 0.758 | D124: of:=FORMULA([.A124]) -> =PERCENTRANK((C1:C5~B1:B5~D1:D5),42) | E124: Eike, winfried | H124: 4
H125: 8
H128: 16
H129: 32
H130: 64
H131: 128
H133: of:=PERCENTRANK([.H117:.H131];42) -> 0.759