Sheet: Sheet1
A1: SIN Function
A3: Result | B3: of:=AND([.B8:.B95]) -> true
A7: Sheet | B7: Result | C7: Description
A8: 1 | B8: of:=AND([Sheet2.C2:.C92]) -> true | C8: Simple SIN formulas with local references and values

Sheet: Sheet2
A1: Function | B1: Expected | C1: Correct | D1: FunctionString | E1: Comment
A2: of:=SIN(0)/PI() -> 0 | B2: 0 | C2: of:=ROUND([.A2];12)=ROUND([.B2];12) -> true | D2: of:=FORMULA([.A2]) -> =SIN(0)/PI() | J2: of:=1/0 ->  | K2: AA
A3: of:=SIN(1) -> 0.841470984807896 | B3: 0.841470984807896 | C3: of:=ROUND([.A3];12)=ROUND([.B3];12) -> true | D3: of:=FORMULA([.A3]) -> =SIN(1) | J3: 13 | K3: AA
A4: of:=SIN(-1)/PI() -> -0.267848533401164 | B4: -0.267848533401164 | C4: of:=ROUND([.A4];12)=ROUND([.B4];12) -> true | D4: of:=FORMULA([.A4]) -> =SIN(-1)/PI()
A5: of:=SIN(1-[.K20]/[.J18]) -> -0.841470984807896 | B5: -0.841470984807896 | C5: of:=ROUND([.A5];12)=ROUND([.B5];12) -> true | D5: of:=FORMULA([.A5]) -> =SIN(1-K20/J18)
A6: of:=SIN(-0.5) -> -0.479425538604203 | B6: -0.479425538604203 | C6: of:=ROUND([.A6];12)=ROUND([.B6];12) -> true | D6: of:=FORMULA([.A6]) -> =SIN(-0.5) | J6: of:=TRUE() -> true
A7: of:=SIN(-0.5)*180/PI() -> -27.4690599528072 | B7: -27.4690599528072 | C7: of:=ROUND([.A7];12)=ROUND([.B7];12) -> true | D7: of:=FORMULA([.A7]) -> =SIN(-0.5)*180/PI() | J7: of:=FALSE() -> false
A8: of:=DEGREES(SIN(-0.5)) -> -27.4690599528072 | B8: -27.4690599528072 | C8: of:=ROUND([.A8];12)=ROUND([.B8];12) -> true | D8: of:=FORMULA([.A8]) -> =DEGREES(SIN(-0.5))
A9: of:=SIN([.J2]) ->  | B9: of:#DIV/0! ->  | C9: of:=ISERROR([.A9]) -> true | D9: of:=FORMULA([.A9]) -> =SIN(J2) | J9: 1
A10: of:=SIN([.J6]) -> 0.841470984807896 | B10: 0.841470984807896 | C10: of:=ROUND([.A10];12)=ROUND([.B10];12) -> true | D10: of:=FORMULA([.A10]) -> =SIN(J6) | J10: of:=NA() -> 
A11: of:=SIN([.K2]) ->  | B11: of:#VALUE! ->  | C11: of:=ISERROR([.A11]) -> true | D11: of:=FORMULA([.A11]) -> =SIN(K2) | J11: of:=PI() -> 3.14159265358979
A12: of:=SIN([.F1]) -> 0 | B12: 0 | C12: of:=[.A12]=[.B12] -> true | D12: of:=FORMULA([.A12]) -> =SIN(F1)
A13: of:=SIN([.J13]) ->  | B13: of:#VALUE! ->  | C13: of:=ISERROR([.A13]) -> true | D13: of:=FORMULA([.A13]) -> =SIN(J13) | J13: 1.4E+154
J18: 1.15
J19: 2.2 | K19: of:=[.J19]+0.1 -> 2.3
K20: 2.3

Sheet: 'file:///home/zdenek/Dokumenty/LO/sc-unit-test/Project%20Calc%20functions%20tests/fods/cos.fods/cos.fods/atan.fods/asinh.fods/asin.fods/acos.fods/abs.fods/abs.fods/xor.fods/xor.fods/not.fods/ifna.fods/ifna.fods/iferror.fods/iferror.fods/if.fods/and.fods/and.fods/and.fods/and.fods/type.fods/isna.fods/isna.fods/islogical.fods/isformula.fods/iserr.fods/isblank.fods/info.fods/formula.fods/formula.fods/current.fods/cell.fods/cell.fods/minute.fods/minute.fods/year.fods/function_based_test_Example.fods/function_based_test_Example_reference.fods'#Sheet2
H3: 4

Sheet: 'file:///home/zdenek/Dokumenty/LO/sc-unit-test/Project%20Calc%20functions%20tests/fods/cos.fods/cos.fods/atan.fods/asinh.fods/asin.fods/acos.fods/abs.fods/abs.fods/xor.fods/xor.fods/not.fods/ifna.fods/ifna.fods/iferror.fods/iferror.fods/if.fods/and.fods/and.fods/and.fods/and.fods/type.fods/isna.fods/isna.fods/islogical.fods/isformula.fods/sc-unit-test/information-functions.ods'#Information
O7: O5