Sheet: Sheet1
A1: SUMIF Function
A3: Result | B3: of:=AND([.B8:.B95]) -> true
A7: Sheet | B7: Result | C7: Description
A8: 1 | B8: of:=AND([Sheet2.C2:.C92]) -> true | C8: Simple SUMIF formulas with local references and values

Sheet: Sheet2
A1: Sumif | B1: Sumif expected | C1: correct | D1: pattern | E1: cells | I1: abcd1234ab12 | J1: 1
A2: of:=SUMIF([.$I$1:.$I$25];[.$D2];[.$J$1:.$J$25]) -> 50001 | B2: of:=[.J1]+[.J5] -> 50001 | C2: of:=[.A2]=[.B2] -> true | D2: a* | E2: of:=FORMULA([.A2]) -> =SUMIF($I$1:$I$25,$D2,$J$1:$J$25) | I2: of:=RIGHT([.I1])&LEFT([.I1];LEN([.I1])-1) -> 2abcd1234ab1 | J2: of:=+[.J1]*10/ROW([.J1])*ROW() -> 20
A3: of:=SUMIF([.$I$1:.$I$25];[.$D3];[.$J$1:.$J$25]) -> 1200000004000 | B3: of:=[.J4]+[.J12] -> 1200000004000 | C3: of:=[.A3]=[.B3] -> true | D3: b* | E3: of:=FORMULA([.A3]) -> =SUMIF($I$1:$I$25,$D3,$J$1:$J$25) | I3: of:=RIGHT([.I2])&LEFT([.I2];LEN([.I2])-1) -> 12abcd1234ab | J3: of:=+[.J2]*10/ROW([.J2])*ROW() -> 300
A4: of:=SUMIF([.$I$1:.$I$25];[.$D4];[.$J$1:.$J$25]) -> 7000000 | B4: of:=[.J7] -> 7000000 | C4: of:=[.A4]=[.B4] -> true | D4: 3* | E4: of:=FORMULA([.A4]) -> =SUMIF($I$1:$I$25,$D4,$J$1:$J$25) | I4: of:=RIGHT([.I3])&LEFT([.I3];LEN([.I3])-1) -> b12abcd1234a | J4: of:=+[.J3]*10/ROW([.J3])*ROW() -> 4000
A5: of:=SUMIF([.$I$1:.$I$25];[.$D5];[.$J$1:.$J$25]) -> 600000 | B5: of:=[.J6] -> 600000 | C5: of:=[.A5]=[.B5] -> true | D5: 4* | E5: of:=FORMULA([.A5]) -> =SUMIF($I$1:$I$25,$D5,$J$1:$J$25) | I5: of:=RIGHT([.I4])&LEFT([.I4];LEN([.I4])-1) -> ab12abcd1234 | J5: of:=+[.J4]*10/ROW([.J4])*ROW() -> 50000
A6: of:=SUMIF([.$I$1:.$I$24];[.$D6];[.$J$1:.$J$24]) -> 900000000 | B6: of:=[.J9] -> 900000000 | C6: of:=[.A6]=[.B6] -> true | D6: *c? | E6: of:=FORMULA([.A6]) -> =SUMIF($I$1:$I$24,$D6,$J$1:$J$24) | I6: of:=RIGHT([.I5])&LEFT([.I5];LEN([.I5])-1) -> 4ab12abcd123 | J6: of:=+[.J5]*10/ROW([.J5])*ROW() -> 600000
A7: of:=SUMIF([.$I$1:.$I$24];[.$D7];[.$J$1:.$J$24]) -> 80000000 | B7: of:=[.J8] -> 80000000 | C7: of:=[.A7]=[.B7] -> true | D7: *d? | E7: of:=FORMULA([.A7]) -> =SUMIF($I$1:$I$24,$D7,$J$1:$J$24) | I7: of:=RIGHT([.I6])&LEFT([.I6];LEN([.I6])-1) -> 34ab12abcd12 | J7: of:=+[.J6]*10/ROW([.J6])*ROW() -> 7000000
A8: of:=SUMIF([.$I$1:.$I$24];[.$D8];[.$J$1:.$J$24]) -> 7000001 | B8: of:=[.J1]+[.J7] -> 7000001 | C8: of:=[.A8]=[.B8] -> true | D8: *1? | E8: of:=FORMULA([.A8]) -> =SUMIF($I$1:$I$24,$D8,$J$1:$J$24) | I8: of:=RIGHT([.I7])&LEFT([.I7];LEN([.I7])-1) -> 234ab12abcd1 | J8: of:=+[.J7]*10/ROW([.J7])*ROW() -> 80000000
A9: of:=SUMIF([.$I$1:.$I$24];[.$D9];[.$J$1:.$J$24]) -> 1200000600000 | B9: of:=[.J6]+[.J12] -> 1200000600000 | C9: of:=[.A9]=[.B9] -> true | D9: *2? | E9: of:=FORMULA([.A9]) -> =SUMIF($I$1:$I$24,$D9,$J$1:$J$24) | I9: of:=RIGHT([.I8])&LEFT([.I8];LEN([.I8])-1) -> 1234ab12abcd | J9: of:=+[.J8]*10/ROW([.J8])*ROW() -> 900000000
A10: of:=SUMIF([.$I$1:.$I$23];[.$D10];[.$J$1:.$J$23]) -> 0 | B10: 0 | C10: of:=[.A10]=[.B10] -> true | D10: a*c | E10: of:=FORMULA([.A10]) -> =SUMIF($I$1:$I$23,$D10,$J$1:$J$23) | I10: of:=RIGHT([.I9])&LEFT([.I9];LEN([.I9])-1) -> d1234ab12abc | J10: of:=+[.J9]*10/ROW([.J9])*ROW() -> 10000000000
A11: of:=SUMIF([.$I$1:.$I$23];[.$D11];[.$J$1:.$J$23]) -> 1200000004000 | B11: of:=[.J4]+[.J12] -> 1200000004000 | C11: of:=[.A11]=[.B11] -> true | D11: b*a | E11: of:=FORMULA([.A11]) -> =SUMIF($I$1:$I$23,$D11,$J$1:$J$23) | I11: of:=RIGHT([.I10])&LEFT([.I10];LEN([.I10])-1) -> cd1234ab12ab | J11: of:=+[.J10]*10/ROW([.J10])*ROW() -> 110000000000
A12: of:=SUMIF([.$I$1:.$I$23];[.$D12];[.$J$1:.$J$23]) -> 900000000 | B12: of:=[.J9] -> 900000000 | C12: of:=[.A12]=[.B12] -> true | D12: 1*d | E12: of:=FORMULA([.A12]) -> =SUMIF($I$1:$I$23,$D12,$J$1:$J$23) | I12: of:=RIGHT([.I11])&LEFT([.I11];LEN([.I11])-1) -> bcd1234ab12a | J12: of:=+[.J11]*10/ROW([.J11])*ROW() -> 1200000000000
A13: of:=SUMIF([.$I$1:.$I$23];[.$D13];[.$J$1:.$J$23]) -> 80000020 | B13: of:=[.J2]+[.J8] -> 80000020 | C13: of:=[.A13]=[.B13] -> true | D13: 2*1 | E13: of:=FORMULA([.A13]) -> =SUMIF($I$1:$I$23,$D13,$J$1:$J$23)
A14: of:=SUMIF([.$I$1:.$I$22];[.$D14];[.$J$1:.$J$22]) -> 80000000 | B14: of:=[.J8] -> 80000000 | C14: of:=[.A14]=[.B14] -> true | D14: *c?1 | E14: of:=FORMULA([.A14]) -> =SUMIF($I$1:$I$22,$D14,$J$1:$J$22)
A15: of:=SUMIF([.$I$1:.$I$22];[.$D15];[.$J$1:.$J$22]) -> 7000000 | B15: of:=[.J7] -> 7000000 | C15: of:=[.A15]=[.B15] -> true | D15: *d?2 | E15: of:=FORMULA([.A15]) -> =SUMIF($I$1:$I$22,$D15,$J$1:$J$22)
A16: of:=SUMIF([.$I$1:.$I$22];[.$D16];[.$J$1:.$J$22]) -> 600000 | B16: of:=[.J6] -> 600000 | C16: of:=[.A16]=[.B16] -> true | D16: *1?3 | E16: of:=FORMULA([.A16]) -> =SUMIF($I$1:$I$22,$D16,$J$1:$J$22)
A17: of:=SUMIF([.$I$1:.$I$22];[.$D17];[.$J$1:.$J$22]) -> 110000000000 | B17: of:=[.J11] -> 110000000000 | C17: of:=[.A17]=[.B17] -> true | D17: *2?b | E17: of:=FORMULA([.A17]) -> =SUMIF($I$1:$I$22,$D17,$J$1:$J$22)
A18: of:=SUMIF([.$I$1:.$I$21];[.$D18];[.$J$1:.$J$21]) -> 50001 | B18: of:=[.J1]+[.J5] -> 50001 | C18: of:=[.A18]=[.B18] -> true | D18: of:=[.D10]&"*" -> a*c* | E18: of:=FORMULA([.A18]) -> =SUMIF($I$1:$I$21,$D18,$J$1:$J$21)
A19: of:=SUMIF([.$I$1:.$I$21];[.$D19];[.$J$1:.$J$21]) -> 1200000004000 | B19: of:=[.J4]+[.J12] -> 1200000004000 | C19: of:=[.A19]=[.B19] -> true | D19: of:=[.D11]&"*" -> b*a* | E19: of:=FORMULA([.A19]) -> =SUMIF($I$1:$I$21,$D19,$J$1:$J$21)
A20: of:=SUMIF([.$I$1:.$I$21];[.$D20];[.$J$1:.$J$21]) -> 900000300 | B20: of:=[.J3]+[.J9] -> 900000300 | C20: of:=[.A20]=[.B20] -> true | D20: of:=[.D12]&"*" -> 1*d* | E20: of:=FORMULA([.A20]) -> =SUMIF($I$1:$I$21,$D20,$J$1:$J$21)
A21: of:=SUMIF([.$I$1:.$I$21];[.$D21];[.$J$1:.$J$21]) -> 80000020 | B21: of:=[.J2]+[.J8] -> 80000020 | C21: of:=[.A21]=[.B21] -> true | D21: of:=[.D13]&"*" -> 2*1* | E21: of:=FORMULA([.A21]) -> =SUMIF($I$1:$I$21,$D21,$J$1:$J$21)
A22: of:=SUMIF([.$I$1:.$I$21];[.$D22];[.$J$1:.$J$21]) -> 80000020 | B22: of:=[.J2]+[.J8] -> 80000020 | C22: of:=[.A22]=[.B22] -> true | D22: of:=SUBSTITUTE([.D14];"?";"?*") -> *c?*1 | E22: of:=FORMULA([.A22]) -> =SUMIF($I$1:$I$21,$D22,$J$1:$J$21)
A23: of:=SUMIF([.$I$1:.$I$21];[.$D23];[.$J$1:.$J$21]) -> 7000001 | B23: of:=[.J1]+[.J7] -> 7000001 | C23: of:=[.A23]=[.B23] -> true | D23: of:=SUBSTITUTE([.D15];"?";"?*") -> *d?*2 | E23: of:=FORMULA([.A23]) -> =SUMIF($I$1:$I$21,$D23,$J$1:$J$21)
A24: of:=SUMIF([.$I$1:.$I$21];[.$D24];[.$J$1:.$J$21]) -> 600000 | B24: of:=[.J6] -> 600000 | C24: of:=[.A24]=[.B24] -> true | D24: of:=SUBSTITUTE([.D16];"?";"?*") -> *1?*3 | E24: of:=FORMULA([.A24]) -> =SUMIF($I$1:$I$21,$D24,$J$1:$J$21)
A25: of:=SUMIF([.$I$1:.$I$21];[.$D25];[.$J$1:.$J$21]) -> 110000000300 | B25: of:=[.J3]+[.J11] -> 110000000300 | C25: of:=[.A25]=[.B25] -> true | D25: of:=SUBSTITUTE([.D17];"?";"?*") -> *2?*b | E25: of:=FORMULA([.A25]) -> =SUMIF($I$1:$I$21,$D25,$J$1:$J$21)