Sheet: Sheet1
A1: TBILLYIELD Function
A3: Result | B3: of:=AND([.B8:.B95]) -> true
A7: Sheet | B7: Result | C7: Description
A8: 1 | B8: of:=AND([Sheet2.C2:.C349]) -> true | C8: Simple TBILLYIELD formulas with local references and values

Sheet: Sheet2
A1: Function | B1: Expected | C1: Correct | D1: FunctionString | E1: Comment | I1: Data | J1: Description
A2: of:=TBILLYIELD(DATE(1999;3;31);DATE(1999;6;1); 0.0914) -> 6346.98524740594 | B2: 6346.98524740594 | C2: of:=ROUND([.A2];12)=ROUND([.B2];12) -> true | D2: of:=FORMULA([.A2]) -> =TBILLYIELD(DATE(1999,3,31),DATE(1999,6,1), 0.0914) | I2: 2008-03-31 | J2: Settlement date
A3: of:=TBILLYIELD([.I2];[.I3];[.I4]) -> 6346.98524740594 | B3: 6346.98524740594 | C3: of:=ROUND([.A3];12)=ROUND([.B3];12) -> true | D3: of:=FORMULA([.A3]) -> =TBILLYIELD(I2,I3,I4) | I3: 2008-06-01 | J3: Maturity date
A4: of:=TBILLYIELD(DATE(2008;7;14); DATE(2009;1;14); 0.04) -> 4970.38674033149 | B4: 4970.38674033149 | C4: of:=ROUND([.A4];12)=ROUND([.B4];12) -> true | D4: of:=FORMULA([.A4]) -> =TBILLYIELD(DATE(2008,7,14), DATE(2009,1,14), 0.04) | E4: #tdf 101071 | I4: 0.0914 | J4: Percent discount rate
A5: of:=TBILLYIELD(DATE(1999;3;31);DATE(1999;6;1); ) ->  | B5: error | C5: of:=ISERROR([.A5]) -> true | D5: of:=FORMULA([.A5]) -> =TBILLYIELD(DATE(1999,3,31),DATE(1999,6,1), )
A6: of:=TBILLYIELD(DATE(1999;3;31);DATE(1999;6;1)) ->  | B6: error | C6: of:=ISERROR([.A6]) -> true | D6: of:=FORMULA([.A6]) -> =TBILLYIELD(DATE(1999,3,31),DATE(1999,6,1))
A7: of:=TBILLYIELD(DATE(1999;3;31);DATE(1999;6;1); 0) ->  | B7: error | C7: of:=ISERROR([.A7]) -> true | D7: of:=FORMULA([.A7]) -> =TBILLYIELD(DATE(1999,3,31),DATE(1999,6,1), 0)
A8: of:=TBILLYIELD(DATE(1999;8;31);DATE(1999;6;1); 0.0914) ->  | B8: error | C8: of:=ISERROR([.A8]) -> true | D8: of:=FORMULA([.A8]) -> =TBILLYIELD(DATE(1999,8,31),DATE(1999,6,1), 0.0914)
A9: of:=TBILLYIELD(DATE(1999;3;31);; 0.0914) ->  | B9: error | C9: of:=ISERROR([.A9]) -> true | D9: of:=FORMULA([.A9]) -> =TBILLYIELD(DATE(1999,3,31),, 0.0914)
A10: of:=TBILLYIELD(DATE(1999;3;31);DATE(1999;6;1); -0.0914) ->  | B10: error | C10: of:=ISERROR([.A10]) -> true | D10: of:=FORMULA([.A10]) -> =TBILLYIELD(DATE(1999,3,31),DATE(1999,6,1), -0.0914)
A11: of:=TBILLYIELD(DATE(1999;3;31);DATE(1999;6;1); [.I11]) -> 5800.64516129032 | B11: 5800.64516129032 | C11: of:=ROUND([.A11];12)=ROUND([.B11];12) -> true | D11: of:=FORMULA([.A11]) -> =TBILLYIELD(DATE(1999,3,31),DATE(1999,6,1), I11) | I11: 0.1
A12: of:=TBILLYIELD(DATE(1999;3;31);DATE(1999;6;1); [.I12]) -> 2897.41935483871 | B12: 2897.41935483871 | C12: of:=ROUND([.A12];12)=ROUND([.B12];12) -> true | D12: of:=FORMULA([.A12]) -> =TBILLYIELD(DATE(1999,3,31),DATE(1999,6,1), I12) | I12: of:=[.I11]+0.1 -> 0.2
A13: of:=TBILLYIELD(DATE(1999;3;31);DATE(1999;6;1); [.I13]) -> 1929.67741935484 | B13: 1929.67741935484 | C13: of:=ROUND([.A13];12)=ROUND([.B13];12) -> true | D13: of:=FORMULA([.A13]) -> =TBILLYIELD(DATE(1999,3,31),DATE(1999,6,1), I13) | I13: of:=[.I12]+0.1 -> 0.3
A14: of:=TBILLYIELD(DATE(1999;3;31);DATE(1999;6;1); [.I14]) -> 1445.8064516129 | B14: 1445.8064516129 | C14: of:=ROUND([.A14];12)=ROUND([.B14];12) -> true | D14: of:=FORMULA([.A14]) -> =TBILLYIELD(DATE(1999,3,31),DATE(1999,6,1), I14) | I14: of:=[.I13]+0.1 -> 0.4
A15: of:=TBILLYIELD(DATE(1999;3;31);DATE(1999;6;1); [.I15]) -> 1155.48387096774 | B15: 1155.48387096774 | C15: of:=ROUND([.A15];12)=ROUND([.B15];12) -> true | D15: of:=FORMULA([.A15]) -> =TBILLYIELD(DATE(1999,3,31),DATE(1999,6,1), I15) | I15: of:=[.I14]+0.1 -> 0.5
A16: of:=TBILLYIELD(DATE(1999;3;31);DATE(1999;6;1); [.I16]) -> 961.935483870968 | B16: 961.935483870968 | C16: of:=ROUND([.A16];12)=ROUND([.B16];12) -> true | D16: of:=FORMULA([.A16]) -> =TBILLYIELD(DATE(1999,3,31),DATE(1999,6,1), I16) | I16: of:=[.I15]+0.1 -> 0.6
A17: of:=TBILLYIELD(DATE(1999;3;31);DATE(1999;6;1); [.I17]) -> 823.686635944701 | B17: 823.686635944701 | C17: of:=ROUND([.A17];12)=ROUND([.B17];12) -> true | D17: of:=FORMULA([.A17]) -> =TBILLYIELD(DATE(1999,3,31),DATE(1999,6,1), I17) | I17: of:=[.I16]+0.1 -> 0.7
A18: of:=TBILLYIELD(DATE(1999;3;31);DATE(1999;6;1); [.I18]) -> 720 | B18: 720 | C18: of:=ROUND([.A18];12)=ROUND([.B18];12) -> true | D18: of:=FORMULA([.A18]) -> =TBILLYIELD(DATE(1999,3,31),DATE(1999,6,1), I18) | I18: of:=[.I17]+0.1 -> 0.8
A19: of:=TBILLYIELD(DATE(1999;3;31);DATE(1999;6;1); [.I19]) -> 639.354838709678 | B19: 639.354838709678 | C19: of:=ROUND([.A19];12)=ROUND([.B19];12) -> true | D19: of:=FORMULA([.A19]) -> =TBILLYIELD(DATE(1999,3,31),DATE(1999,6,1), I19) | I19: of:=[.I18]+0.1 -> 0.9
A20: of:=TBILLYIELD(DATE(1999;3;31);DATE(1999;6;1); [.I20]) -> 574.838709677419 | B20: 574.838709677419 | C20: of:=ROUND([.A20];12)=ROUND([.B20];12) -> true | D20: of:=FORMULA([.A20]) -> =TBILLYIELD(DATE(1999,3,31),DATE(1999,6,1), I20) | I20: of:=[.I19]+0.1 -> 1
A21: of:=TBILLYIELD(DATE(1999;3;31);DATE(1999;6;1); [.I21]) -> 522.052785923754 | B21: 522.052785923754 | C21: of:=ROUND([.A21];12)=ROUND([.B21];12) -> true | D21: of:=FORMULA([.A21]) -> =TBILLYIELD(DATE(1999,3,31),DATE(1999,6,1), I21) | I21: of:=[.I20]+0.1 -> 1.1
A22: of:=TBILLYIELD(DATE(1999;3;31);DATE(1999;6;1); [.I22]) -> 478.064516129032 | B22: 478.064516129032 | C22: of:=ROUND([.A22];12)=ROUND([.B22];12) -> true | D22: of:=FORMULA([.A22]) -> =TBILLYIELD(DATE(1999,3,31),DATE(1999,6,1), I22) | I22: of:=[.I21]+0.1 -> 1.2

Sheet: 'file:///home/zdenek/Dokumenty/LO/sc-unit-test/Project%20Calc%20functions%20tests/fods/function_based_test_Example.fods/function_based_test_Example_reference.fods'#Sheet2
H3: 4