Sheet: Sheet1
A1: VDB Function
A3: Result | B3: of:=AND([.B8:.B95]) -> true
A7: Sheet | B7: Result | C7: Description
A8: 1 | B8: of:=AND([Sheet2.C2:.C349]) -> true | C8: Simple VDB formulas with local references and values

Sheet: Sheet2
A1: Function | B1: Expected | C1: Correct | D1: FunctionString | E1: Comment | I1: Data | J1: Description
A2: of:=VDB(35000;7500;36;10;20;2) -> 8603.80245372397 | B2: 8603.80245372397 | C2: of:=ROUND([.A2];12)=ROUND([.B2];12) -> true | D2: of:=FORMULA([.A2]) -> =VDB(35000,7500,36,10,20,2) | I2: 2400 | J2: Initial cost
A3: of:=VDB(10000; 5000; 5*12; 6; 12; 2; 1) -> 1501.7926317979 | B3: 1501.7926317979 | C3: of:=ROUND([.A3];12)=ROUND([.B3];12) -> true | D3: of:=FORMULA([.A3]) -> =VDB(10000, 5000, 5*12, 6, 12, 2, 1) | I3: 300 | J3: Salvage value
A4: of:=VDB(10000; 5000; 5*12; 18; 24; 1; 1) -> 708.833929085397 | B4: 708.833929085397 | C4: of:=ROUND([.A4];12)=ROUND([.B4];12) -> true | D4: of:=FORMULA([.A4]) -> =VDB(10000, 5000, 5*12, 18, 24, 1, 1) | I4: 10 | J4: Lifetime in years
A5: of:=VDB([.I2]; [.I3]; [.I4]*365; 0; 1) -> 1.31506849315065 | B5: 1.31506849315065 | C5: of:=ROUND([.A5];12)=ROUND([.B5];12) -> true | D5: of:=FORMULA([.A5]) -> =VDB(I2, I3, I4*365, 0, 1) | E5: First day's depreciation. Excel automatically assumes that factor is 2. | I5: Formula | J5: Description | K5: R esult
A6: of:=VDB([.I2]; [.I3]; [.I4]*12; 0; 1) -> 40 | B6: 40 | C6: of:=ROUND([.A6];12)=ROUND([.B6];12) -> true | D6: of:=FORMULA([.A6]) -> =VDB(I2, I3, I4*12, 0, 1) | E6: First month's depreciation. | K6: 1.32
A7: of:=VDB([.I2]; [.I3]; [.I4]; 0; 1) -> 480 | B7: 480 | C7: of:=ROUND([.A7];12)=ROUND([.B7];12) -> true | D7: of:=FORMULA([.A7]) -> =VDB(I2, I3, I4, 0, 1) | E7: First year's depreciation. | K7: 40
A8: of:=VDB([.I2]; [.A3];[.I4]*12; 6; 18) -> 396.306053264752 | B8: 396.306053264752 | C8: of:=ROUND([.A8];12)=ROUND([.B8];12) -> true | D8: of:=FORMULA([.A8]) -> =VDB(I2, A3,I4*12, 6, 18) | E8: Depreciation between the sixth month and the eighteenth month. | K8: 480
A9: of:=VDB([.I2]; [.A3]; [.I4]*12; 6; 18; 1.5) -> 311.808936658233 | B9: 311.808936658233 | C9: of:=ROUND([.A9];12)=ROUND([.B9];12) -> true | D9: of:=FORMULA([.A9]) -> =VDB(I2, A3, I4*12, 6, 18, 1.5) | E9: Depreciation between the sixth month and the eighteenth month using a factor of 1.5 instead of the double-declining balance method. | K9: 396.31
A10: of:=VDB([.I2]; [.I3]; [.I4]; 0; 0.875; 1.5) -> 315 | B10: 315 | C10: of:=ROUND([.A10];12)=ROUND([.B10];12) -> true | D10: of:=FORMULA([.A10]) -> =VDB(I2, I3, I4, 0, 0.875, 1.5) | E10: Depreciation for the first fiscal year that you own the asset, assuming that tax laws limit you to 150-percent depreciation of the declining balance. Asset is purchased in the middle of the first quarter of the fiscal year. | K10: 311.81
A11: of:=VDB(100000;20000;10;7;8) -> 971.519999999989 | B11: 971.519999999989 | C11: of:=ROUND([.A11];12)=ROUND([.B11];12) -> true | D11: of:=FORMULA([.A11]) -> =VDB(100000,20000,10,7,8) | K11: 315
A12: of:=VDB(35000;7500;36;10;20;2;1) -> 8603.80245372398 | B12: 8603.80245372398 | C12: of:=ROUND([.A12];12)=ROUND([.B12];12) -> true | D12: of:=FORMULA([.A12]) -> =VDB(35000,7500,36,10,20,2,1)
A13: of:=VDB(35000;7500;36;10;20;2;0) -> 8603.80245372397 | B13: 8603.80245372397 | C13: of:=ROUND([.A13];12)=ROUND([.B13];12) -> true | D13: of:=FORMULA([.A13]) -> =VDB(35000,7500,36,10,20,2,0)
A14: of:=VDB(35000;7500;36;10;20;2;-1) -> 8603.80245372398 | B14: 8603.80245372398 | C14: of:=ROUND([.A14];12)=ROUND([.B14];12) -> true | D14: of:=FORMULA([.A14]) -> =VDB(35000,7500,36,10,20,2,-1)
A15: of:=VDB(35000;7500;36;10;20;2;) -> 8603.80245372397 | B15: 8603.80245372397 | C15: of:=ROUND([.A15];12)=ROUND([.B15];12) -> true | D15: of:=FORMULA([.A15]) -> =VDB(35000,7500,36,10,20,2,)
A16: of:=VDB(35000;7500;36;10;20;;) ->  | B16: Err:502 | C16: of:=ISERROR([.A16]) -> true | D16: of:=FORMULA([.A16]) -> =VDB(35000,7500,36,10,20,,)
A17: of:=VDB(35000;7500;36;10;20;) ->  | B17: Err:502 | C17: of:=ISERROR([.A17]) -> true | D17: of:=FORMULA([.A17]) -> =VDB(35000,7500,36,10,20,)
A18: of:=VDB(35000;7500;36;10;20) -> 8603.80245372397 | B18: 8603.80245372397 | C18: of:=ROUND([.A18];12)=ROUND([.B18];12) -> true | D18: of:=FORMULA([.A18]) -> =VDB(35000,7500,36,10,20)
A19: of:=VDB(35000;7500;36;10;;2;1) ->  | B19: Err:502 | C19: of:=ISERROR([.A19]) -> true | D19: of:=FORMULA([.A19]) -> =VDB(35000,7500,36,10,,2,1)
A20: of:=VDB(35000;7500;36;;20;2;1) -> 23841.7427463641 | B20: 23841.7427463641 | C20: of:=ROUND([.A20];12)=ROUND([.B20];12) -> true | D20: of:=FORMULA([.A20]) -> =VDB(35000,7500,36,,20,2,1)
A21: of:=VDB(35000;7500;36;-10;20;2;1) ->  | B21: Err:502 | C21: of:=ISERROR([.A21]) -> true | D21: of:=FORMULA([.A21]) -> =VDB(35000,7500,36,-10,20,2,1)
A22: of:=VDB(35000;7500;;10;20;2;1) ->  | B22: Err:502 | C22: of:=ISERROR([.A22]) -> true | D22: of:=FORMULA([.A22]) -> =VDB(35000,7500,,10,20,2,1)
A23: of:=VDB(35000;;36;10;20;2;1) -> 8603.80245372398 | B23: 8603.80245372398 | C23: of:=ROUND([.A23];12)=ROUND([.B23];12) -> true | D23: of:=FORMULA([.A23]) -> =VDB(35000,,36,10,20,2,1)
A24: of:=VDB(;7500;36;10;20;2;1) ->  | B24: Err:511 | C24: of:=ISERROR([.A24]) -> true | D24: of:=FORMULA([.A24]) -> =VDB(,7500,36,10,20,2,1)
A25: of:=VDB(300;7500;36;10;20;2;1) ->  | B25: Err:502 | C25: of:=ISERROR([.A25]) -> true | D25: of:=FORMULA([.A25]) -> =VDB(300,7500,36,10,20,2,1) | E25: salvage<cost
A26: of:=VDB(35000;7500;0;10;20;2;1) ->  | B26: Err:502 | C26: of:=ISERROR([.A26]) -> true | D26: of:=FORMULA([.A26]) -> =VDB(35000,7500,0,10,20,2,1) | E26: Lifetime > 0
A27: of:=VDB(35000;7500;36;0;20;2;1) -> 23841.7427463641 | B27: 23841.7427463641 | C27: of:=ROUND([.A27];12)=ROUND([.B27];12) -> true | D27: of:=FORMULA([.A27]) -> =VDB(35000,7500,36,0,20,2,1) | E27: start period>=0
A28: of:=VDB(35000;7500;36;-10;20;2;1) ->  | B28: Err:502 | C28: of:=ISERROR([.A28]) -> true | D28: of:=FORMULA([.A28]) -> =VDB(35000,7500,36,-10,20,2,1) | E28: start period>=0
A29: of:=VDB(35000;7500;36;100;20;2;1) ->  | B29: Err:502 | C29: of:=ISERROR([.A29]) -> true | D29: of:=FORMULA([.A29]) -> =VDB(35000,7500,36,100,20,2,1) | E29: startperiod<lifeTime
A30: of:=VDB(35000;7500;36;10;2;2;1) ->  | B30: Err:502 | C30: of:=ISERROR([.A30]) -> true | D30: of:=FORMULA([.A30]) -> =VDB(35000,7500,36,10,2,2,1) | E30: start period<=endPeriod | G30: 100000 | H30: cost
A31: of:=VDB(35000;7500;36;10;200;2;1) ->  | B31: Err:502 | C31: of:=ISERROR([.A31]) -> true | D31: of:=FORMULA([.A31]) -> =VDB(35000,7500,36,10,200,2,1) | E31: enPeriod<=LifeTime | G31: 20000 | H31: salvage value
A32: of:=VDB(35000;7500;36;10;20;-2;1) ->  | B32: Err:502 | C32: of:=ISERROR([.A32]) -> true | D32: of:=FORMULA([.A32]) -> =VDB(35000,7500,36,10,20,-2,1) | E32: DepreciationFactor ≥ 0 | G32: 10 | H32: periods
A33: of:=VDB(100000;20000;10;7.25;7.75) -> 485.759999999995 | B33: 485.759999999995 | C33: of:=ROUND([.A33];12)=ROUND([.B33];12) -> true | D33: of:=FORMULA([.A33]) -> =VDB(100000,20000,10,7.25,7.75) | E33: AOO#91651, TDF#101204
A34: of:=VDB([.G30];[.G31];[.G32];[.$G34];[.$G35]) -> 20000 | B34: 20000 | C34: of:=ROUND([.A34];12)=ROUND([.B34];12) -> true | D34: of:=FORMULA([.A34]) -> =VDB(G30,G31,G32,$G34,$G35) | E34: AOO#109420, TDF#101204 | G34: 0
A35: of:=VDB([.G30];[.G31];[.G32];[.$G35];[.$G36]) -> 16000 | B35: 16000 | C35: of:=ROUND([.A35];12)=ROUND([.B35];12) -> true | D35: of:=FORMULA([.A35]) -> =VDB(G30,G31,G32,$G35,$G36) | G35: 1
A36: of:=VDB([.G30];[.G31];[.G32];[.$G36];[.$G37]) -> 12800 | B36: 12800 | C36: of:=ROUND([.A36];12)=ROUND([.B36];12) -> true | D36: of:=FORMULA([.A36]) -> =VDB(G30,G31,G32,$G36,$G37) | G36: 2
A37: of:=VDB([.G30];[.G31];[.G32];[.$G37];[.$G38]) -> 10240 | B37: 10240 | C37: of:=ROUND([.A37];12)=ROUND([.B37];12) -> true | D37: of:=FORMULA([.A37]) -> =VDB(G30,G31,G32,$G37,$G38) | G37: 3
A38: of:=VDB([.G30];[.G31];[.G32];[.$G38];[.$G39]) -> 8192 | B38: 8192 | C38: of:=ROUND([.A38];12)=ROUND([.B38];12) -> true | D38: of:=FORMULA([.A38]) -> =VDB(G30,G31,G32,$G38,$G39) | G38: 4
A39: of:=VDB([.G30];[.G31];[.G32];[.$G39];[.$G40]) -> 6553.6 | B39: 6553.6 | C39: of:=ROUND([.A39];12)=ROUND([.B39];12) -> true | D39: of:=FORMULA([.A39]) -> =VDB(G30,G31,G32,$G39,$G40) | G39: 5
A40: of:=VDB([.G30];[.G31];[.G32];[.$G40];[.$G41]) -> 5242.88 | B40: 5242.88 | C40: of:=ROUND([.A40];12)=ROUND([.B40];12) -> true | D40: of:=FORMULA([.A40]) -> =VDB(G30,G31,G32,$G40,$G41) | G40: 6
A41: of:=VDB([.G30];[.G31];[.G32];[.$G41];[.$G42]) -> 971.519999999989 | B41: 971.519999999989 | C41: of:=ROUND([.A41];12)=ROUND([.B41];12) -> true | D41: of:=FORMULA([.A41]) -> =VDB(G30,G31,G32,$G41,$G42) | G41: 7
A42: of:=VDB([.G30];[.G31];[.G32];[.$G42];[.$G43]) -> 0 | B42: 0 | C42: of:=ROUND([.A42];12)=ROUND([.B42];12) -> true | D42: of:=FORMULA([.A42]) -> =VDB(G30,G31,G32,$G42,$G43) | G42: 8
A43: of:=VDB([.G30];[.G31];[.G32];[.$G43];[.$G44]) -> 0 | B43: 0 | C43: of:=ROUND([.A43];12)=ROUND([.B43];12) -> true | D43: of:=FORMULA([.A43]) -> =VDB(G30,G31,G32,$G43,$G44) | G43: 9
A44: of:=VDB([.G30];[.G31];[.G32];[.$G34];[.$G35];2;1) -> 20000 | B44: 20000 | C44: of:=ROUND([.A44];12)=ROUND([.B44];12) -> true | D44: of:=FORMULA([.A44]) -> =VDB(G30,G31,G32,$G34,$G35,2,1) | G44: 10
A45: of:=VDB([.G30];[.G31];[.G32];[.$G35];[.$G36];2;1) -> 16000 | B45: 16000 | C45: of:=ROUND([.A45];12)=ROUND([.B45];12) -> true | D45: of:=FORMULA([.A45]) -> =VDB(G30,G31,G32,$G35,$G36,2,1)
A46: of:=VDB([.G30];[.G31];[.G32];[.$G36];[.$G37];2;1) -> 12800 | B46: 12800 | C46: of:=ROUND([.A46];12)=ROUND([.B46];12) -> true | D46: of:=FORMULA([.A46]) -> =VDB(G30,G31,G32,$G36,$G37,2,1)
A47: of:=VDB([.G30];[.G31];[.G32];[.$G37];[.$G38];2;1) -> 10240 | B47: 10240 | C47: of:=ROUND([.A47];12)=ROUND([.B47];12) -> true | D47: of:=FORMULA([.A47]) -> =VDB(G30,G31,G32,$G37,$G38,2,1)
A48: of:=VDB([.G30];[.G31];[.G32];[.$G38];[.$G39];2;1) -> 8192 | B48: 8192 | C48: of:=ROUND([.A48];12)=ROUND([.B48];12) -> true | D48: of:=FORMULA([.A48]) -> =VDB(G30,G31,G32,$G38,$G39,2,1)
A49: of:=VDB([.G30];[.G31];[.G32];[.$G39];[.$G40];2;1) -> 6553.6 | B49: 6553.6 | C49: of:=ROUND([.A49];12)=ROUND([.B49];12) -> true | D49: of:=FORMULA([.A49]) -> =VDB(G30,G31,G32,$G39,$G40,2,1) | G49: 7
A50: of:=VDB([.G30];[.G31];[.G32];[.$G40];[.$G41];2;1) -> 5242.88 | B50: 5242.88 | C50: of:=ROUND([.A50];12)=ROUND([.B50];12) -> true | D50: of:=FORMULA([.A50]) -> =VDB(G30,G31,G32,$G40,$G41,2,1) | G50: 7.25
A51: of:=VDB([.G30];[.G31];[.G32];[.$G41];[.$G42];2;1) -> 971.520000000008 | B51: 971.520000000008 | C51: of:=ROUND([.A51];12)=ROUND([.B51];12) -> true | D51: of:=FORMULA([.A51]) -> =VDB(G30,G31,G32,$G41,$G42,2,1) | G51: 7.75
A52: of:=VDB([.G30];[.G31];[.G32];[.$G42];[.$G43];2;1) -> 0 | B52: 0 | C52: of:=ROUND([.A52];12)=ROUND([.B52];12) -> true | D52: of:=FORMULA([.A52]) -> =VDB(G30,G31,G32,$G42,$G43,2,1)
A53: of:=VDB([.G30];[.G31];[.G32];[.$G43];[.$G44];2;1) -> 0 | B53: 0 | C53: of:=ROUND([.A53];12)=ROUND([.B53];12) -> true | D53: of:=FORMULA([.A53]) -> =VDB(G30,G31,G32,$G43,$G44,2,1)
A54: of:=[.G30]-VDB([.G30];[.G31];[.G32];[.$G$34];[.$G35]) -> 80000 | B54: 80000 | C54: of:=ROUND([.A54];12)=ROUND([.B54];12) -> true | D54: of:=FORMULA([.A54]) -> =G30-VDB(G30,G31,G32,$G$34,$G35) | G54: 6.2
A55: of:=[.G30]-VDB([.G30];[.G31];[.G32];[.$G$34];[.$G36]) -> 64000 | B55: 64000 | C55: of:=ROUND([.A55];12)=ROUND([.B55];12) -> true | D55: of:=FORMULA([.A55]) -> =G30-VDB(G30,G31,G32,$G$34,$G36) | G55: 7.6
A56: of:=[.G30]-VDB([.G30];[.G31];[.G32];[.$G$34];[.$G37]) -> 51200 | B56: 51200 | C56: of:=ROUND([.A56];12)=ROUND([.B56];12) -> true | D56: of:=FORMULA([.A56]) -> =G30-VDB(G30,G31,G32,$G$34,$G37)
A57: of:=[.G30]-VDB([.G30];[.G31];[.G32];[.$G$34];[.$G38]) -> 40960 | B57: 40960 | C57: of:=ROUND([.A57];12)=ROUND([.B57];12) -> true | D57: of:=FORMULA([.A57]) -> =G30-VDB(G30,G31,G32,$G$34,$G38)
A58: of:=[.G30]-VDB([.G30];[.G31];[.G32];[.$G$34];[.$G39]) -> 32768 | B58: 32768 | C58: of:=ROUND([.A58];12)=ROUND([.B58];12) -> true | D58: of:=FORMULA([.A58]) -> =G30-VDB(G30,G31,G32,$G$34,$G39)
A59: of:=[.G30]-VDB([.G30];[.G31];[.G32];[.$G$34];[.$G40]) -> 26214.4 | B59: 26214.4 | C59: of:=ROUND([.A59];12)=ROUND([.B59];12) -> true | D59: of:=FORMULA([.A59]) -> =G30-VDB(G30,G31,G32,$G$34,$G40)
A60: of:=[.G30]-VDB([.G30];[.G31];[.G32];[.$G$34];[.$G41]) -> 20971.52 | B60: 20971.52 | C60: of:=ROUND([.A60];12)=ROUND([.B60];12) -> true | D60: of:=FORMULA([.A60]) -> =G30-VDB(G30,G31,G32,$G$34,$G41)
A61: of:=[.G30]-VDB([.G30];[.G31];[.G32];[.$G$34];[.$G42]) -> 20000 | B61: 20000 | C61: of:=ROUND([.A61];12)=ROUND([.B61];12) -> true | D61: of:=FORMULA([.A61]) -> =G30-VDB(G30,G31,G32,$G$34,$G42)
A62: of:=[.G30]-VDB([.G30];[.G31];[.G32];[.$G$34];[.$G43]) -> 20000 | B62: 20000 | C62: of:=ROUND([.A62];12)=ROUND([.B62];12) -> true | D62: of:=FORMULA([.A62]) -> =G30-VDB(G30,G31,G32,$G$34,$G43)
A63: of:=[.G30]-VDB([.G30];[.G31];[.G32];[.$G$34];[.$G44]) -> 20000 | B63: 20000 | C63: of:=ROUND([.A63];12)=ROUND([.B63];12) -> true | D63: of:=FORMULA([.A63]) -> =G30-VDB(G30,G31,G32,$G$34,$G44)
A64: of:=VDB(100000;20000;10;[.G49];[.G50]) -> 242.879999999997 | B64: 242.879999999997 | C64: of:=ROUND([.A64];12)=ROUND([.B64];12) -> true | D64: of:=FORMULA([.A64]) -> =VDB(100000,20000,10,G49,G50)
A65: of:=VDB(100000;20000;10;[.G50];[.G51]) -> 485.759999999995 | B65: 485.759999999995 | C65: of:=ROUND([.A65];12)=ROUND([.B65];12) -> true | D65: of:=FORMULA([.A65]) -> =VDB(100000,20000,10,G50,G51)
A66: of:=VDB(100000;20000;10;[.G49];[.G51]) -> 728.639999999992 | B66: 728.639999999992 | C66: of:=ROUND([.A66];12)=ROUND([.B66];12) -> true | D66: of:=FORMULA([.A66]) -> =VDB(100000,20000,10,G49,G51)
A67: of:=VDB([.G30];[.G31];[.G32];[.G54];[.G55]) -> 4777.216 | B67: 4777.216 | C67: of:=ROUND([.A67];12)=ROUND([.B67];12) -> true | D67: of:=FORMULA([.A67]) -> =VDB(G30,G31,G32,G54,G55)
A68: of:=VDB(100000;20000;10;[.G49];[.G50];2;1) -> 242.880000000002 | B68: 242.880000000002 | C68: of:=ROUND([.A68];12)=ROUND([.B68];12) -> true | D68: of:=FORMULA([.A68]) -> =VDB(100000,20000,10,G49,G50,2,1)
A69: of:=VDB(100000;20000;10;[.G50];[.G51];2;1) -> 485.760000000004 | B69: 485.760000000004 | C69: of:=ROUND([.A69];12)=ROUND([.B69];12) -> true | D69: of:=FORMULA([.A69]) -> =VDB(100000,20000,10,G50,G51,2,1)
A70: of:=[.G30]-VDB(100000;20000;10;[.G$34];[.G50]) -> 20728.64 | B70: 20728.64 | C70: of:=ROUND([.A70];12)=ROUND([.B70];12) -> true | D70: of:=FORMULA([.A70]) -> =G30-VDB(100000,20000,10,G$34,G50)
A71: of:=[.G30]-VDB(100000;20000;10;[.G$34];[.G51]) -> 20242.88 | B71: 20242.88 | C71: of:=ROUND([.A71];12)=ROUND([.B71];12) -> true | D71: of:=FORMULA([.A71]) -> =G30-VDB(100000,20000,10,G$34,G51)

Sheet: 'file:///home/zdenek/Dokumenty/LO/sc-unit-test/Project%20Calc%20functions%20tests/fods/function_based_test_Example.fods/function_based_test_Example_reference.fods'#Sheet2
H3: 4