Sheet: Sheet1
A1: WEEKNUM Function
A3: Result | B3: of:=AND([.B8:.B95]) -> true
A7: Sheet | B7: Result | C7: Description
A8: 1 | B8: of:=AND([Sheet2.C2:.C47]) -> true | C8: Simple WEEKNUM formulas with local references and values

Sheet: Sheet2
A1: Function | B1: Expected | C1: Correct | D1: FunctionString | E1: Comment | K1: 1
A2: of:=WEEKNUM("2000-06-14") -> 25 | B2: 25 | C2: of:=[.A2]=[.B2] -> true | D2: of:=FORMULA([.A2]) -> =WEEKNUM("2000-06-14") | K2: 2
A3: of:=WEEKNUM("1996-07-24";2) -> 30 | B3: 30 | C3: of:=[.A3]=[.B3] -> true | D3: of:=FORMULA([.A3]) -> =WEEKNUM("1996-07-24";2)
A4: of:=WEEKNUM("2016-07-24";1) -> 31 | B4: 31 | C4: of:=[.A4]=[.B4] -> true | D4: of:=FORMULA([.A4]) -> =WEEKNUM("2016-07-24";1)
A5: of:=WEEKNUM("2016-07-24";2) -> 30 | B5: 30 | C5: of:=[.A5]=[.B5] -> true | D5: of:=FORMULA([.A5]) -> =WEEKNUM("2016-07-24";2)
A6: of:=WEEKNUM("2016-07-24";3) ->  | B6: Err | C6: of:=ISERROR([.A6]) -> true | D6: of:=FORMULA([.A6]) -> =WEEKNUM("2016-07-24";3)
A7: of:=WEEKNUM([.$K$9];2) -> 30 | B7: 30 | C7: of:=[.A7]=[.B7] -> true | D7: of:=FORMULA([.A7]) -> =WEEKNUM($K$9;2)
A8: of:=WEEKNUM([.K9];0) ->  | B8: ERR | C8: of:=ISERROR([.A8]) -> true | D8: of:=FORMULA([.A8]) -> =WEEKNUM(K9;0)
A9: of:=WEEKNUM([.K9];) ->  | B9: ERR | C9: of:=ISERROR([.A9]) -> true | D9: of:=FORMULA([.A9]) -> =WEEKNUM(K9;) | K9: 2016-07-24T10:19:00
A10: of:=WEEKNUM(datum;1) -> 31 | B10: 31 | C10: of:=[.A10]=[.B10] -> true | D10: of:=FORMULA([.A10]) -> =WEEKNUM(datum;1)
A11: of:=WEEKNUM(datum;999999) ->  | B11: Err | C11: of:=ISERROR([.A11]) -> true | D11: of:=FORMULA([.A11]) -> =WEEKNUM(datum;999999)
A12: of:=WEEKNUM([.K10];[.K1:.K2]) ->  | B12: Err | C12: of:=ISERROR(a13ú) -> true | D12: of:=FORMULA([.A12]) -> =WEEKNUM(K10;K1:K2)
A13: of:=WEEKNUM([.$K$9];11) -> 30 | B13: 30 | C13: of:=ISERROR(a13ú) -> true | D13: of:=FORMULA([.A13]) -> =WEEKNUM($K$9;11)
A14: of:=WEEKNUM([.$K$9];12) -> 30 | B14: 30 | C14: of:=ISERROR(a13ú) -> true | D14: of:=FORMULA([.A14]) -> =WEEKNUM($K$9;12)
A15: of:=WEEKNUM([.$K$9];13) -> 30 | B15: 30 | C15: of:=ISERROR(a13ú) -> true | D15: of:=FORMULA([.A15]) -> =WEEKNUM($K$9;13)
A16: of:=WEEKNUM([.$K$9];14) -> 30 | B16: 30 | C16: of:=ISERROR(a13ú) -> true | D16: of:=FORMULA([.A16]) -> =WEEKNUM($K$9;14)
A17: of:=WEEKNUM([.$K$9];15) -> 30 | B17: 30 | C17: of:=ISERROR(a13ú) -> true | D17: of:=FORMULA([.A17]) -> =WEEKNUM($K$9;15) | K17: WEEKNUM Summary: Determines the week number of the year for a given date. Syntax: WEEKNUM( DateParam Date [ ; Number Mode = 1 ] ) Returns: Number Constraints: 1 ≤ Mode ≤ 2, or 11 ≤ Mode ≤ 17, or Mode = 21, or Mode = 150 Semantics: Returns the number of the week in the year for the given date. For Mode={1, 2, 11, 12, ..., 17} the week containing January 1 is the first week of the year, and is numbered week 1. The week starts on {Sunday, Monday, Monday, Tuesday, ..., Sunday}. Mode 21 or 150 are both , the week starts on Monday and the week containing the first Thursday of the year is the first week of the year, and is numbered week 1.
A18: of:=WEEKNUM([.$K$9];16) -> 31 | B18: 31 | C18: of:=ISERROR(a13ú) -> true | D18: of:=FORMULA([.A18]) -> =WEEKNUM($K$9;16)
A19: of:=WEEKNUM([.$K$9];17) -> 31 | B19: 31 | C19: of:=ISERROR(a13ú) -> true | D19: of:=FORMULA([.A19]) -> =WEEKNUM($K$9;17)
A20: of:=WEEKNUM([.$K$9];21) -> 29 | B20: 29 | C20: of:=ISERROR(a13ú) -> true | D20: of:=FORMULA([.A20]) -> =WEEKNUM($K$9;21)
A21: of:=WEEKNUM([.$K$9];150) -> 29 | B21: 29 | C21: of:=ISERROR(a13ú) -> true | D21: of:=FORMULA([.A21]) -> =WEEKNUM($K$9;150)

Sheet: 'file:///home/zdenek/Dokumenty/LO/sc-unit-test/Project%20Calc%20functions%20tests/fods/function_based_test_Example.fods/function_based_test_Example_reference.fods'#Sheet2
H3: 4