Sheet: Sheet1
A1: XIRR Function
A3: Result | B3: of:=AND([.B8:.B95]) -> true
A7: Sheet | B7: Result | C7: Description
A8: 1 | B8: of:=AND([Sheet2.C2:.C349]) -> true | C8: Simple XIRR formulas with local references and values

Sheet: Sheet2
A1: Function | B1: Expected | C1: Correct | D1: FunctionString | E1: Comment | I1: 2001-01-01 | J1: -10000 | K1: Received | M1: Values | N1: Dates | P1: value | Q1: date | S1: value | T1: date | W1: Date | X1: Amount | Z1: Date | AA1: Amount
A2: of:=XIRR([.J1:.J5]; [.I1:.I5]; 0.1) -> 0.194818475056105 | B2: 0.194818475056105 | C2: of:=ROUND([.A2];12)=ROUND([.B2];12) -> true | D2: of:=FORMULA([.A2]) -> =XIRR(J1:J5, I1:I5, 0.1) | I2: 2001-01-02 | J2: 2000 | K2: Deposited | M2: -10000 | N2: 2008-01-01 | P2: -7500 | Q2: 1.1.2016 | R2: 2016-01-01 | S2: -5000 | T2: 30.4.2016 | U2: 2016-04-30 | W2: 1980-05-13 | X2: 900 | Z2: 1980-05-13 | AA2: 900
A3: of:=XIRR([.M2:.M6]; [.N2:.N6]; 0.1) -> 0.373362533518831 | B3: 0.373362533518831 | C3: of:=ROUND([.A3];12)=ROUND([.B3];12) -> true | D3: of:=FORMULA([.A3]) -> =XIRR(M2:M6, N2:N6, 0.1) | I3: 2001-03-15 | J3: 2500 | M3: 2750 | N3: 2008-03-01 | P3: 3000 | Q3: 1.2.2016 | R3: 2016-02-01 | S3: 800 | T3: 31.5.2016 | U3: 2016-05-31 | W3: 1980-06-05 | X3: -21.65 | Z3: 1980-06-05 | AA3: -21.65
A4: of:=XIRR([.P2:.P6];[.R2:.R6]) -> 2.6602420360887 | B4: 2.6602420360887 | C4: of:=ROUND([.A4];12)=ROUND([.B4];12) -> true | D4: of:=FORMULA([.A4]) -> =XIRR(P2:P6,R2:R6) | I4: 2001-05-12 | J4: 5000 | M4: 4250 | N4: 2008-10-30 | P4: 5000 | Q4: 15.4.2016 | R4: 2016-04-15 | S4: 1300 | T4: 1.9.2016 | U4: 2016-09-01 | W4: 1981-03-24 | X4: 152.24 | Z4: 1981-03-24 | AA4: 152.24
A5: of:=XIRR([.S2:.S6];[.U2:.U6]) -> 2.18630968237577 | B5: 2.18630968237577 | C5: of:=ROUND([.A5];12)=ROUND([.B5];12) -> true | D5: of:=FORMULA([.A5]) -> =XIRR(S2:S6,U2:U6) | I5: 2001-08-10 | J5: 1000 | M5: 3250 | N5: 2009-02-15 | P5: 1200 | Q5: 1.8.2016 | R5: 2016-08-01 | S5: 600 | T5: 31.12.2016 | U5: 2016-12-31 | W5: 1983-08-01 | X5: 1000 | Z5: 1983-08-01 | AA5: 1000
A6: of:=XIRR([.J$28:.J$40];[.$I$28:.$I$40]) -> 1.41526706548978 | B6: 1.41526706548978 | C6: of:=ROUND([.A6];12)=ROUND([.B6];12) -> true | D6: of:=FORMULA([.A6]) -> =XIRR(J$28:J$40,$I$28:$I$40) | E6: AOO#95167 | M6: 2750 | N6: 2009-04-01 | P6: 4000 | Q6: 26.3.2017 | R6: 2017-03-26 | S6: 7500 | T6: 31.1.2017 | U6: 2017-01-31 | W6: 1984-11-21 | X6: -900 | Z6: 1984-11-21 | AA6: -900
A7: of:=XIRR([.K$28:.K$40];[.$I$28:.$I$40]) -> 1.03112197466669 | B7: 1.03112197466669 | C7: of:=ROUND([.A7];12)=ROUND([.B7];12) -> true | D7: of:=FORMULA([.A7]) -> =XIRR(K$28:K$40,$I$28:$I$40) | W7: 1987-05-08 | X7: -35.48 | Z7: 1987-05-08 | AA7: -35.48
A8: of:=XIRR([.L$28:.L$40];[.$I$28:.$I$40]) -> 0.665339866487698 | B8: 0.665339866487698 | C8: of:=ROUND([.A8];12)=ROUND([.B8];12) -> true | D8: of:=FORMULA([.A8]) -> =XIRR(L$28:L$40,$I$28:$I$40) | W8: 1989-10-30 | X8: 45092.66 | Z8: 1989-10-30 | AA8: 45092.66
A9: of:=XIRR([.M$28:.M$40];[.$I$28:.$I$40]) -> 0.320513615664647 | B9: 0.320513615664647 | C9: of:=ROUND([.A9];12)=ROUND([.B9];12) -> true | D9: of:=FORMULA([.A9]) -> =XIRR(M$28:M$40,$I$28:$I$40) | I9: -100 | J9: 2004-01-01 | W9: 1989-12-22 | X9: -64.83 | Z9: 1989-12-22 | AA9: -64.83
A10: of:=XIRR([.N$28:.N$40];[.$I$28:.$I$40]) -> 3.75808762269898E-016 | B10: 3.75808762269898E-016 | C10: of:=ROUND([.A10];12)=ROUND([.B10];12) -> true | D10: of:=FORMULA([.A10]) -> =XIRR(N$28:N$40,$I$28:$I$40) | I10: 10 | J10: 2005-01-01 | W10: 1989-12-23 | X10: -48.26 | Z10: 1989-12-23 | AA10: -48.26
A11: of:=XIRR([.O$28:.O$40];[.$I$28:.$I$40]) -> -0.29171165478267 | B11: -0.29171165478267 | C11: of:=ROUND([.A11];12)=ROUND([.B11];12) -> true | D11: of:=FORMULA([.A11]) -> =XIRR(O$28:O$40,$I$28:$I$40) | I11: 10 | J11: 2006-01-01 | W11: 1989-12-23 | X11: -641.36 | Z11: 1989-12-23 | AA11: -641.36
A12: of:=XIRR([.P$28:.P$40];[.$I$28:.$I$40]) -> -0.548371585025588 | B12: -0.548371585025588 | C12: of:=ROUND([.A12];12)=ROUND([.B12];12) -> true | D12: of:=FORMULA([.A12]) -> =XIRR(P$28:P$40,$I$28:$I$40) | I12: 110 | J12: 2007-01-01 | W12: 1990-01-14 | X12: -61.9 | Z12: 1990-01-14 | AA12: -61.9
A13: of:=XIRR([.Q$28:.Q$40];[.$I$28:.$I$40]) -> -0.760852514281991 | B13: -0.760852514281991 | C13: of:=ROUND([.A13];12)=ROUND([.B13];12) -> true | D13: of:=FORMULA([.A13]) -> =XIRR(Q$28:Q$40,$I$28:$I$40) | W13: 1990-01-18 | X13: -995 | Z13: 1990-01-18 | AA13: -995
A14: of:=XIRR([.R$28:.R$40];[.$I$28:.$I$40]) -> -0.915227454539025 | B14: -0.915227454539025 | C14: of:=ROUND([.A14];12)=ROUND([.B14];12) -> true | D14: of:=FORMULA([.A14]) -> =XIRR(R$28:R$40,$I$28:$I$40) | E14: AOO#2130 | W14: 1990-02-07 | X14: -9339.14 | Z14: 1990-02-07 | AA14: -9339.14
A15: of:=XIRR([.K43:.O43];[.P43:.T43];[.U43]) -> 0.374858597687371 | B15: 0.374858597687371 | C15: of:=ROUND([.A15];12)=ROUND([.B15];12) -> true | D15: of:=FORMULA([.A15]) -> =XIRR(K43:O43,P43:T43,U43) | W15: 1990-03-05 | X15: 1300 | Z15: 1990-03-05 | AA15: 1300
A16: of:=XIRR([.K44:.O44];[.P44:.T44];[.U44]) -> 0.0799495862990467 | B16: 0.0799495862990467 | C16: of:=ROUND([.A16];12)=ROUND([.B16];12) -> true | D16: of:=FORMULA([.A16]) -> =XIRR(K44:O44,P44:T44,U44) | W16: 1990-04-12 | X16: -1.17 | Z16: 1990-04-12 | AA16: -1.17
A17: of:=XIRR([.K45:.O45];[.P45:.T45];[.U45]) -> -0.351015039169015 | B17: -0.351015039169015 | C17: of:=ROUND([.A17];12)=ROUND([.B17];12) -> true | D17: of:=FORMULA([.A17]) -> =XIRR(K45:O45,P45:T45,U45) | W17: 1990-06-25 | X17: 1100 | Z17: 1990-06-25 | AA17: 1100
A18: of:=XIRR([.I9:.I12];[.J9:.J12]) -> 0.0998951090083094 | B18: 0.0998951090083094 | C18: of:=ROUND([.A18];12)=ROUND([.B18];12) -> true | D18: of:=FORMULA([.A18]) -> =XIRR(I9:I12,J9:J12) | E18: AOO#27002 | I18: 10 | J18: 2016-01-01 | W18: 1990-08-14 | X18: -1196.76 | Z18: 1990-08-14 | AA18: -1196.76
I19: 20 | J19: 2016-03-01 | W19: 1990-08-22 | X19: 1200 | Z19: 1990-08-22 | AA19: 1200
I20: -35 | J20: 2017-01-01 | W20: 1991-01-18 | X20: -500 | Z20: 1991-01-18 | AA20: -500
W21: 1991-05-17 | X21: 1000 | Z21: 1991-05-17 | AA21: 1000
W22: 1991-05-30 | X22: 1000 | Z22: 1991-05-30 | AA22: 1000
W23: 1991-06-09 | X23: 412 | Z23: 1991-06-09 | AA23: 412
W24: 1991-08-12 | X24: 5000 | Z24: 1991-08-12 | AA24: 5000
W25: 1991-08-24 | X25: 3336 | Z25: 1991-08-24 | AA25: 3336
W26: 1991-08-28 | X26: 107.17 | Z26: 1991-08-28 | AA26: 107.17
A27: of:=XIRR([.X2:.X68];[.$W2:.$W68]) -> -0.0025297622901596 | B27: -0.0025297622901596 | E27: AOO#27597 | W27: 1991-08-30 | X27: 96670 | Z27: 1991-08-30 | AA27: 96670
A28: of:=XIRR([.AA2:.AA68];[.$Z2:.$Z68]) -> 0.0229215392406578 | B28: 0.0229215392406578 | E28: AOO#27598 | I28: 2007-10-01 | J28: 100 | K28: of:=[.J28] -> 100 | L28: of:=[.K28] -> 100 | M28: of:=[.L28] -> 100 | N28: of:=[.M28] -> 100 | O28: of:=[.N28] -> 100 | P28: of:=[.O28] -> 100 | Q28: of:=[.P28] -> 100 | R28: of:=[.Q28] -> 100 | W28: 1991-10-18 | X28: 2368.84 | Z28: 1991-10-18 | AA28: 2368.84
A29: of:=XIRR([.I18:.I20];[.J18:.J20]) -> 0.18826194159203 | B29: 0.18826194159203 | E29: AOO118154 | I29: 2007-11-01 | J29: 100 | K29: of:=[.J29] -> 100 | L29: of:=[.K29] -> 100 | M29: of:=[.L29] -> 100 | N29: of:=[.M29] -> 100 | O29: of:=[.N29] -> 100 | P29: of:=[.O29] -> 100 | Q29: of:=[.P29] -> 100 | R29: of:=[.Q29] -> 100 | W29: 1991-12-31 | X29: -0.7 | Z29: 1991-12-31 | AA29: -0.7
A30: of:=XIRR([.I18:.I19]~[.J20];[.J18:.J19]~[.J20]) ->  | E30: AOO118155 | I30: 2007-12-01 | J30: 100 | K30: of:=[.J30] -> 100 | L30: of:=[.K30] -> 100 | M30: of:=[.L30] -> 100 | N30: of:=[.M30] -> 100 | O30: of:=[.N30] -> 100 | P30: of:=[.O30] -> 100 | Q30: of:=[.P30] -> 100 | R30: of:=[.Q30] -> 100 | W30: 1992-04-01 | X30: -10000 | Z30: 1992-04-01 | AA30: -10000
I31: 2008-01-01 | J31: 100 | K31: of:=[.J31] -> 100 | L31: of:=[.K31] -> 100 | M31: of:=[.L31] -> 100 | N31: of:=[.M31] -> 100 | O31: of:=[.N31] -> 100 | P31: of:=[.O31] -> 100 | Q31: of:=[.P31] -> 100 | R31: of:=[.Q31] -> 100 | W31: 1992-04-27 | X31: -2.8 | Z31: 1992-04-27 | AA31: -2.8
I32: 2008-02-01 | J32: 100 | K32: of:=[.J32] -> 100 | L32: of:=[.K32] -> 100 | M32: of:=[.L32] -> 100 | N32: of:=[.M32] -> 100 | O32: of:=[.N32] -> 100 | P32: of:=[.O32] -> 100 | Q32: of:=[.P32] -> 100 | R32: of:=[.Q32] -> 100 | W32: 1992-05-26 | X32: -1.4 | Z32: 1992-05-26 | AA32: -1.4
I33: 2008-03-01 | J33: 100 | K33: of:=[.J33] -> 100 | L33: of:=[.K33] -> 100 | M33: of:=[.L33] -> 100 | N33: of:=[.M33] -> 100 | O33: of:=[.N33] -> 100 | P33: of:=[.O33] -> 100 | Q33: of:=[.P33] -> 100 | R33: of:=[.Q33] -> 100 | W33: 1992-06-25 | X33: -2.1 | Z33: 1992-06-25 | AA33: -2.1
I34: 2008-04-01 | J34: 100 | K34: of:=[.J34] -> 100 | L34: of:=[.K34] -> 100 | M34: of:=[.L34] -> 100 | N34: of:=[.M34] -> 100 | O34: of:=[.N34] -> 100 | P34: of:=[.O34] -> 100 | Q34: of:=[.P34] -> 100 | R34: of:=[.Q34] -> 100 | W34: 1992-07-03 | X34: -9519.34 | Z34: 1992-07-03 | AA34: -9519.34
I35: 2008-05-01 | J35: 100 | K35: of:=[.J35] -> 100 | L35: of:=[.K35] -> 100 | M35: of:=[.L35] -> 100 | N35: of:=[.M35] -> 100 | O35: of:=[.N35] -> 100 | P35: of:=[.O35] -> 100 | Q35: of:=[.P35] -> 100 | R35: of:=[.Q35] -> 100 | W35: 1992-07-11 | X35: 180.79 | Z35: 1992-07-11 | AA35: 180.79
I36: 2008-06-01 | J36: 100 | K36: of:=[.J36] -> 100 | L36: of:=[.K36] -> 100 | M36: of:=[.L36] -> 100 | N36: of:=[.M36] -> 100 | O36: of:=[.N36] -> 100 | P36: of:=[.O36] -> 100 | Q36: of:=[.P36] -> 100 | R36: of:=[.Q36] -> 100 | W36: 1992-07-11 | X36: 800 | Z36: 1992-07-11 | AA36: 800
I37: 2008-07-01 | J37: 100 | K37: of:=[.J37] -> 100 | L37: of:=[.K37] -> 100 | M37: of:=[.L37] -> 100 | N37: of:=[.M37] -> 100 | O37: of:=[.N37] -> 100 | P37: of:=[.O37] -> 100 | Q37: of:=[.P37] -> 100 | R37: of:=[.Q37] -> 100 | W37: 1992-07-18 | X37: 6000 | Z37: 1992-07-18 | AA37: 6000
I38: 2008-08-01 | J38: 100 | K38: of:=[.J38] -> 100 | L38: of:=[.K38] -> 100 | M38: of:=[.L38] -> 100 | N38: of:=[.M38] -> 100 | O38: of:=[.N38] -> 100 | P38: of:=[.O38] -> 100 | Q38: of:=[.P38] -> 100 | R38: of:=[.Q38] -> 100 | W38: 1992-07-29 | X38: -1.05 | Z38: 1992-07-29 | AA38: -1.05
I39: 2008-09-01 | J39: 100 | K39: of:=[.J39] -> 100 | L39: of:=[.K39] -> 100 | M39: of:=[.L39] -> 100 | N39: of:=[.M39] -> 100 | O39: of:=[.N39] -> 100 | P39: of:=[.O39] -> 100 | Q39: of:=[.P39] -> 100 | R39: of:=[.Q39] -> 100 | W39: 1992-08-27 | X39: -2.26 | Z39: 1992-08-27 | AA39: -2.26
I40: 2008-10-01 | J40: -2000 | K40: of:=[.J40]+200 -> -1800 | L40: of:=[.K40]+200 -> -1600 | M40: of:=[.L40]+200 -> -1400 | N40: of:=[.M40]+200 -> -1200 | O40: of:=[.N40]+200 -> -1000 | P40: of:=[.O40]+200 -> -800 | Q40: of:=[.P40]+200 -> -600 | R40: of:=[.Q40]+200 -> -400 | W40: 1992-09-25 | X40: -2.27 | Z40: 1992-09-25 | AA40: -2.27
W41: 1993-05-18 | X41: 4500 | Z41: 1993-05-18 | AA41: 4500
W42: 1994-06-02 | X42: 7500 | Z42: 1994-06-02 | AA42: 7500
K43: -10000 | L43: 2750 | M43: 4250 | N43: 3250 | O43: 2750 | P43: 1998-01-01 | Q43: 1998-03-01 | R43: 1998-10-30 | S43: 1999-02-15 | T43: 1999-04-01 | U43: 0.1 | W43: 1994-06-14 | X43: 1800 | Z43: 1994-06-14 | AA43: 1800
K44: -10000 | L44: 2750 | M44: 4250 | N44: 3250 | O44: 2750 | P44: 1998-01-01 | Q44: 1999-03-01 | R44: 2000-10-30 | S44: 2002-02-15 | T44: 2004-04-01 | U44: 0.1 | W44: 1994-12-27 | X44: 4800 | Z44: 1994-12-27 | AA44: 4800
K45: -10000 | L45: 1 | M45: 2 | N45: 3250 | O45: 2750 | P45: 1998-01-01 | Q45: 1998-03-01 | R45: 1998-10-30 | S45: 1999-02-15 | T45: 1999-04-01 | U45: 0.1 | W45: 1995-03-07 | X45: 4200 | Z45: 1995-03-07 | AA45: 4200
W46: 1995-04-26 | X46: 1152 | Z46: 1995-04-26 | AA46: 1152
W47: 1995-08-11 | X47: 3000 | Z47: 1995-08-11 | AA47: 3000
W48: 1995-12-27 | X48: 4000 | Z48: 1995-12-27 | AA48: 4000
W49: 1996-05-31 | X49: 9000 | Z49: 1996-05-31 | AA49: 9000
W50: 1996-12-31 | X50: 6000 | Z50: 1996-12-31 | AA50: 6000
W51: 1998-02-04 | X51: -7500 | Z51: 1998-02-04 | AA51: -7500
W52: 1998-03-18 | X52: 714.79 | Z52: 1998-03-18 | AA52: 714.79
W53: 1998-03-30 | X53: 1300.93 | Z53: 1998-03-30 | AA53: 1300.93
W54: 1998-04-01 | X54: 27.53 | Z54: 1998-04-01 | AA54: 27.53
W55: 1998-04-14 | X55: 1000 | Z55: 1998-04-14 | AA55: 1000
W56: 1998-06-22 | X56: -1000 | Z56: 1998-06-22 | AA56: -1000
W57: 1998-07-07 | X57: -1500 | Z57: 1998-07-07 | AA57: -1500
W58: 1998-10-23 | X58: -734.41 | Z58: 1998-10-23 | AA58: -734.41
W59: 1998-11-27 | X59: -8000 | Z59: 1998-11-27 | AA59: -8000
W60: 1998-12-01 | X60: 640.51 | Z60: 1998-12-01 | AA60: 640.51
W61: 1999-03-22 | X61: 6275 | Z61: 1999-03-22 | AA61: 6275
W62: 2000-09-21 | X62: -18000 | Z62: 2000-09-21 | AA62: -18000
W63: 2002-07-08 | X63: 40000 | Z63: 2002-07-08 | AA63: 40000
W64: 2003-01-06 | X64: 10000 | Z64: 2003-01-06 | AA64: 10000
W65: 2003-06-24 | X65: 10000 | Z65: 2003-06-24 | AA65: 10000
W66: 2003-09-19 | X66: 5000 | Z66: 2003-09-19 | AA66: 5000
W67: 2004-03-29 | X67: -7500 | Z67: 2004-03-29 | AA67: -7500
X68: -267741.73 | Z68: 2004-04-06 | AA68: -267741.73

Sheet: 'file:///home/zdenek/Dokumenty/LO/sc-unit-test/Project%20Calc%20functions%20tests/fods/function_based_test_Example.fods/function_based_test_Example_reference.fods'#Sheet2
H3: 4