Sheet: Sheet1
A1: XNPV Function
A3: Result | B3: of:=AND([.B8:.B95]) -> true
A7: Sheet | B7: Result | C7: Description
A8: 1 | B8: of:=AND([Sheet2.C2:.C349]) -> true | C8: Simple XNPV formulas with local references and values

Sheet: Sheet2
A1: Function | B1: Expected | C1: Correct | D1: FunctionString | E1: Comment | J1: 2001-01-01 | K1: -10000 | M1: Values | N1: Dates
A2: of:=XNPV(0.06;[.K1:.K5];[.J1:.J5]) -> 332.570918796713 | B2: 332.570918796713 | C2: of:=ROUND([.A2];12)=ROUND([.B2];12) -> true | D2: of:=FORMULA([.A2]) -> =XNPV(0.06,K1:K5,J1:J5) | J2: 2001-01-02 | K2: 2000 | M2: -10000 | N2: 2008-01-01
A3: of:=XNPV(0.09; [.M2:.M6]; [.N2:.N6]) -> 2086.64760203153 | B3: 2086.64760203153 | C3: of:=ROUND([.A3];12)=ROUND([.B3];12) -> true | D3: of:=FORMULA([.A3]) -> =XNPV(0.09, M2:M6, N2:N6) | J3: 2001-03-15 | K3: 2500 | M3: 2750 | N3: 2008-03-01
A4: of:=XNPV(0; [.M2:.M6]; [.N2:.N6]) -> 3000 | B4: 3000 | C4: of:=ROUND([.A4];12)=ROUND([.B4];12) -> true | D4: of:=FORMULA([.A4]) -> =XNPV(0, M2:M6, N2:N6) | J4: 2001-05-12 | K4: 5000 | M4: 4250 | N4: 2008-10-30
A5: of:=XNPV(-0.09; [.M2:.M6]; [.N2:.N6]) -> 4097.08021067856 | B5: 4097.08021067856 | C5: of:=ROUND([.A5];12)=ROUND([.B5];12) -> true | D5: of:=FORMULA([.A5]) -> =XNPV(-0.09, M2:M6, N2:N6) | J5: 2001-08-10 | K5: 1000 | M5: 3250 | N5: 2009-02-15
A6: of:=XNPV(-0.99; [.M2:.M6]; [.N2:.N6]) -> 1637817.19885881 | B6: 1637817.19885881 | C6: of:=ROUND([.A6];12)=ROUND([.B6];12) -> true | D6: of:=FORMULA([.A6]) -> =XNPV(-0.99, M2:M6, N2:N6) | M6: 2750 | N6: 2009-04-01
A7: of:=XNPV(0.06;{100;100;155};[.J1:.J3]) -> 353.188185593695 | B7: 353.188185593695 | C7: of:=ROUND([.A7];12)=ROUND([.B7];12) -> true | D7: of:=FORMULA([.A7]) -> =XNPV(0.06,{100,100,155},J1:J3)
A8: of:=XNPV(9; [.M2:.M6]; [.N2:.N6]) -> -7090.12101316346 | B8: -7090.12101316346 | C8: of:=ROUND([.A8];12)=ROUND([.B8];12) -> true | D8: of:=FORMULA([.A8]) -> =XNPV(9, M2:M6, N2:N6)

Sheet: 'file:///home/zdenek/Dokumenty/LO/sc-unit-test/Project%20Calc%20functions%20tests/function_based_test_Example.fods/function_based_test_Example_reference.fods'#Sheet2
H3: 4