Sheet: Sheet1
A1: CHOOSECOLS Function
A3: Result | B3: of:=AND([.B8:.B95]) -> true
A7: Sheet | B7: Result | C7: Description
A8: 2 | B8: of:=AND([Sheet2.G2:.G249]) -> true | C8: Simple CHOOSECOLS formulas with local references and values

Sheet: Sheet2
A1: Function | D1: Expected | G1: Correct | H1: FunctionString | I1: Comment | J1: Data | O1: Rows
A2: Data | D2: Data | I2: one parameter | O2: 3 | P2: -2 | Q2: -3
A3: of:=COM.MICROSOFT.CHOOSECOLS([.J3:.N8]; 3) -> 1 | D3: 1 | G3: of:=([.A3]=[.D3])AND([.B3]=[.E3])AND([.C3]=[.F3]) -> true | H3: of:=FORMULA([.A3]) -> {=CHOOSECOLS(J3:N8; 3)} | J3: January | K3: 100 | L3: 1 | M3: 3 | N3: 5 | O3: 30 | P3: -30
A4: 2 | D4: 2 | G4: of:=([.A4]=[.D4])AND([.B4]=[.E4])AND([.C4]=[.F4]) -> true | H4: of:=FORMULA([.A4]) -> {=CHOOSECOLS(J3:N8; 3)} | J4: February | K4: 150 | L4: 2 | M4: 4 | N4: 6
D5: of:=VLOOKUP(1; [.AA5:.AB10]; 2) ->  | G5: of:=ISERROR([.A5]) -> true | H5: of:=FORMULA([.A5]) -> {=CHOOSECOLS(J3:N8; 3)} | J5: of:=VLOOKUP(1; [.AG5:.AH10]; 2) ->  | K5: of:=VLOOKUP(1; [.AH5:.AI10]; 2) ->  | L5: of:=VLOOKUP(1; [.AI5:.AJ10]; 2) ->  | M5: of:=VLOOKUP(1; [.AJ5:.AK10]; 2) ->  | N5: of:=VLOOKUP(1; [.AK5:.AL10]; 2) -> 
A6: 0 | G6: of:=([.A6]=[.D6])AND([.B6]=[.E6])AND([.C6]=[.F6]) -> true | H6: of:=FORMULA([.A6]) -> {=CHOOSECOLS(J3:N8; 3)}
A7: 4 | D7: 4 | G7: of:=([.A7]=[.D7])AND([.B7]=[.E7])AND([.C7]=[.F7]) -> true | H7: of:=FORMULA([.A7]) -> {=CHOOSECOLS(J3:N8; 3)} | J7: April | K7: 250 | L7: 4 | M7: 6 | N7: 20
A8: 5 | D8: 5 | G8: of:=([.A8]=[.D8])AND([.B8]=[.E8])AND([.C8]=[.F8]) -> true | H8: of:=FORMULA([.A8]) -> {=CHOOSECOLS(J3:N8; 3)} | J8: May | K8: 300 | L8: 5 | M8: 7 | N8: 10
A9: of:=COM.MICROSOFT.CHOOSECOLS([.J3:.N8]; -2) -> 3 | D9: 3 | G9: of:=([.A9]=[.D9])AND([.B9]=[.E9])AND([.C9]=[.F9]) -> true | H9: of:=FORMULA([.A9]) -> {=CHOOSECOLS(J3:N8; -2)}
A10: 4 | D10: 4 | G10: of:=([.A10]=[.D10])AND([.B10]=[.E10])AND([.C10]=[.F10]) -> true | H10: of:=FORMULA([.A10]) -> {=CHOOSECOLS(J3:N8; -2)}
D11: of:=VLOOKUP(1; [.AA11:.AB16]; 2) ->  | G11: of:=ISERROR([.A11]) -> true | H11: of:=FORMULA([.A11]) -> {=CHOOSECOLS(J3:N8; -2)}
A12: 0 | G12: of:=([.A12]=[.D12])AND([.B12]=[.E12])AND([.C12]=[.F12]) -> true | H12: of:=FORMULA([.A12]) -> {=CHOOSECOLS(J3:N8; -2)}
A13: 6 | D13: 6 | G13: of:=([.A13]=[.D13])AND([.B13]=[.E13])AND([.C13]=[.F13]) -> true | H13: of:=FORMULA([.A13]) -> {=CHOOSECOLS(J3:N8; -2)}
A14: 7 | D14: 7 | G14: of:=([.A14]=[.D14])AND([.B14]=[.E14])AND([.C14]=[.F14]) -> true | H14: of:=FORMULA([.A14]) -> {=CHOOSECOLS(J3:N8; -2)}
A15: of:=COM.MICROSOFT.CHOOSECOLS([.J3:.N8]; 3.9) -> 1 | D15: 1 | G15: of:=([.A15]=[.D15])AND([.B15]=[.E15])AND([.C15]=[.F15]) -> true | H15: of:=FORMULA([.A15]) -> {=CHOOSECOLS(J3:N8; 3,9)}
A16: 2 | D16: 2 | G16: of:=([.A16]=[.D16])AND([.B16]=[.E16])AND([.C16]=[.F16]) -> true | H16: of:=FORMULA([.A16]) -> {=CHOOSECOLS(J3:N8; 3,9)}
D17: of:=VLOOKUP(1; [.AA17:.AB22]; 2) ->  | G17: of:=ISERROR([.A17]) -> true | H17: of:=FORMULA([.A17]) -> {=CHOOSECOLS(J3:N8; 3,9)}
A18: 0 | G18: of:=([.A18]=[.D18])AND([.B18]=[.E18])AND([.C18]=[.F18]) -> true | H18: of:=FORMULA([.A18]) -> {=CHOOSECOLS(J3:N8; 3,9)}
A19: 4 | D19: 4 | G19: of:=([.A19]=[.D19])AND([.B19]=[.E19])AND([.C19]=[.F19]) -> true | H19: of:=FORMULA([.A19]) -> {=CHOOSECOLS(J3:N8; 3,9)}
A20: 5 | D20: 5 | G20: of:=([.A20]=[.D20])AND([.B20]=[.E20])AND([.C20]=[.F20]) -> true | H20: of:=FORMULA([.A20]) -> {=CHOOSECOLS(J3:N8; 3,9)}
A21: of:=COM.MICROSOFT.CHOOSECOLS([.J3:.N8]; -2.9) -> 3 | D21: 3 | G21: of:=([.A21]=[.D21])AND([.B21]=[.E21])AND([.C21]=[.F21]) -> true | H21: of:=FORMULA([.A21]) -> {=CHOOSECOLS(J3:N8; -2,9)}
A22: 4 | D22: 4 | G22: of:=([.A22]=[.D22])AND([.B22]=[.E22])AND([.C22]=[.F22]) -> true | H22: of:=FORMULA([.A22]) -> {=CHOOSECOLS(J3:N8; -2,9)}
D23: of:=VLOOKUP(1; [.AA23:.AB28]; 2) ->  | G23: of:=ISERROR([.A23]) -> true | H23: of:=FORMULA([.A23]) -> {=CHOOSECOLS(J3:N8; -2,9)}
A24: 0 | G24: of:=([.A24]=[.D24])AND([.B24]=[.E24])AND([.C24]=[.F24]) -> true | H24: of:=FORMULA([.A24]) -> {=CHOOSECOLS(J3:N8; -2,9)}
A25: 6 | D25: 6 | G25: of:=([.A25]=[.D25])AND([.B25]=[.E25])AND([.C25]=[.F25]) -> true | H25: of:=FORMULA([.A25]) -> {=CHOOSECOLS(J3:N8; -2,9)}
A26: 7 | D26: 7 | G26: of:=([.A26]=[.D26])AND([.B26]=[.E26])AND([.C26]=[.F26]) -> true | H26: of:=FORMULA([.A26]) -> {=CHOOSECOLS(J3:N8; -2,9)}
I27: two parameters
A28: of:=COM.MICROSOFT.CHOOSECOLS([.J3:.N8]; 3; 3) -> 1 | B28: 1 | D28: 1 | E28: 1 | G28: of:=([.A28]=[.D28])AND([.B28]=[.E28])AND([.C28]=[.F28]) -> true | H28: of:=FORMULA([.A28]) -> {=CHOOSECOLS(J3:N8; 3; 3)}
A29: 2 | B29: 2 | D29: 2 | E29: 2 | G29: of:=([.A29]=[.D29])AND([.B29]=[.E29])AND([.C29]=[.F29]) -> true | H29: of:=FORMULA([.A29]) -> {=CHOOSECOLS(J3:N8; 3; 3)}
D30: of:=VLOOKUP(1; [.AA30:.AB35]; 2) ->  | E30: of:=VLOOKUP(1; [.AB30:.AC35]; 2) ->  | G30: of:=ISERROR([.A30])AND(ISERROR([.B30])) -> true | H30: of:=FORMULA([.A30]) -> {=CHOOSECOLS(J3:N8; 3; 3)}
A31: 0 | B31: 0 | G31: of:=([.A31]=[.D31])AND([.B31]=[.E31])AND([.C31]=[.F31]) -> true | H31: of:=FORMULA([.A31]) -> {=CHOOSECOLS(J3:N8; 3; 3)}
A32: 4 | B32: 4 | D32: 4 | E32: 4 | G32: of:=([.A32]=[.D32])AND([.B32]=[.E32])AND([.C32]=[.F32]) -> true | H32: of:=FORMULA([.A32]) -> {=CHOOSECOLS(J3:N8; 3; 3)}
A33: 5 | B33: 5 | D33: 5 | E33: 5 | G33: of:=([.A33]=[.D33])AND([.B33]=[.E33])AND([.C33]=[.F33]) -> true | H33: of:=FORMULA([.A33]) -> {=CHOOSECOLS(J3:N8; 3; 3)}
A34: of:=COM.MICROSOFT.CHOOSECOLS([.J3:.N8]; -3; -3) -> 1 | B34: 1 | D34: 1 | E34: 1 | G34: of:=([.A34]=[.D34])AND([.B34]=[.E34])AND([.C34]=[.F34]) -> true | H34: of:=FORMULA([.A34]) -> {=CHOOSECOLS(J3:N8; -3; -3)}
A35: 2 | B35: 2 | D35: 2 | E35: 2 | G35: of:=([.A35]=[.D35])AND([.B35]=[.E35])AND([.C35]=[.F35]) -> true | H35: of:=FORMULA([.A35]) -> {=CHOOSECOLS(J3:N8; -3; -3)}
D36: of:=VLOOKUP(1; [.AA36:.AB41]; 2) ->  | E36: of:=VLOOKUP(1; [.AB36:.AC41]; 2) ->  | G36: of:=ISERROR([.A36])AND(ISERROR([.B36])) -> true | H36: of:=FORMULA([.A36]) -> {=CHOOSECOLS(J3:N8; -3; -3)}
A37: 0 | B37: 0 | G37: of:=([.A37]=[.D37])AND([.B37]=[.E37])AND([.C37]=[.F37]) -> true | H37: of:=FORMULA([.A37]) -> {=CHOOSECOLS(J3:N8; -3; -3)}
A38: 4 | B38: 4 | D38: 4 | E38: 4 | G38: of:=([.A38]=[.D38])AND([.B38]=[.E38])AND([.C38]=[.F38]) -> true | H38: of:=FORMULA([.A38]) -> {=CHOOSECOLS(J3:N8; -3; -3)}
A39: 5 | B39: 5 | D39: 5 | E39: 5 | G39: of:=([.A39]=[.D39])AND([.B39]=[.E39])AND([.C39]=[.F39]) -> true | H39: of:=FORMULA([.A39]) -> {=CHOOSECOLS(J3:N8; -3; -3)}
A40: of:=COM.MICROSOFT.CHOOSECOLS([.J3:.N8]; 3; -2) -> 1 | B40: 3 | D40: 1 | E40: 3 | G40: of:=([.A40]=[.D40])AND([.B40]=[.E40])AND([.C40]=[.F40]) -> true | H40: of:=FORMULA([.A40]) -> {=CHOOSECOLS(J3:N8; 3; -2)}
A41: 2 | B41: 4 | D41: 2 | E41: 4 | G41: of:=([.A41]=[.D41])AND([.B41]=[.E41])AND([.C41]=[.F41]) -> true | H41: of:=FORMULA([.A41]) -> {=CHOOSECOLS(J3:N8; 3; -2)}
D42: of:=VLOOKUP(1; [.AA42:.AB46]; 2) ->  | E42: of:=VLOOKUP(1; [.AB42:.AC46]; 2) ->  | G42: of:=ISERROR([.A42])AND(ISERROR([.B42])) -> true | H42: of:=FORMULA([.A42]) -> {=CHOOSECOLS(J3:N8; 3; -2)}
A43: 0 | B43: 0 | G43: of:=([.A43]=[.D43])AND([.B43]=[.E43])AND([.C43]=[.F43]) -> true | H43: of:=FORMULA([.A43]) -> {=CHOOSECOLS(J3:N8; 3; -2)}
A44: 4 | B44: 6 | D44: 4 | E44: 6 | G44: of:=([.A44]=[.D44])AND([.B44]=[.E44])AND([.C44]=[.F44]) -> true | H44: of:=FORMULA([.A44]) -> {=CHOOSECOLS(J3:N8; 3; -2)}
A45: 5 | B45: 7 | D45: 5 | E45: 7 | G45: of:=([.A45]=[.D45])AND([.B45]=[.E45])AND([.C45]=[.F45]) -> true | H45: of:=FORMULA([.A45]) -> {=CHOOSECOLS(J3:N8; 3; -2)}
I46: Errors
A47: of:=COM.MICROSOFT.CHOOSECOLS([.J3:.L8]; 5; ;-5) ->  | G47: of:=ISERROR([.A47]) -> true | H47: of:=FORMULA([.A47]) -> {=CHOOSECOLS(J3:L8; 5; ;-5)}
A48: of:=COM.MICROSOFT.CHOOSECOLS([.J3:.L8]; 5; 30) ->  | G48: of:=ISERROR([.A48]) -> true | H48: of:=FORMULA([.A48]) -> {=CHOOSECOLS(J3:L8; 5; 30)}
A49: of:=COM.MICROSOFT.CHOOSECOLS([.J3:.L8]; 5; -30) ->  | G49: of:=ISERROR([.A49]) -> true | H49: of:=FORMULA([.A49]) -> {=CHOOSECOLS(J3:L8; 5; -30)}
A50: of:=COM.MICROSOFT.CHOOSECOLS([.J3:.L8]; 5; 0) ->  | G50: of:=ISERROR([.A50]) -> true | H50: of:=FORMULA([.A50]) -> {=CHOOSECOLS(J3:L8; 5; 0)}
A51: of:=COM.MICROSOFT.CHOOSECOLS([.J3:.L8]; 5; "test") ->  | G51: of:=ISERROR([.A51]) -> true | H51: of:=FORMULA([.A51]) -> {=CHOOSECOLS(J3:L8; 5; "test")}
A52: of:=COM.MICROSOFT.CHOOSECOLS([.J3:.L8]; {5|30}) ->  | G52: of:=ISERROR([.A52]) -> true | H52: of:=FORMULA([.A52]) -> {=CHOOSECOLS(J3:L8; {5;30})}
A53: of:=COM.MICROSOFT.CHOOSECOLS([.J3:.L8]; {5|-30}) ->  | G53: of:=ISERROR([.A53]) -> true | H53: of:=FORMULA([.A53]) -> {=CHOOSECOLS(J3:L8; {5;-30})}
A54: of:=COM.MICROSOFT.CHOOSECOLS([.J3:.L8]; [.O3]) ->  | G54: of:=ISERROR([.A54]) -> true | H54: of:=FORMULA([.A54]) -> {=CHOOSECOLS(J3:L8; O3)}
A55: of:=COM.MICROSOFT.CHOOSECOLS([.J3:.L8]; [.P3]) ->  | G55: of:=ISERROR([.A55]) -> true | H55: of:=FORMULA([.A55]) -> {=CHOOSECOLS(J3:L8; P3)}
A56: of:=COM.MICROSOFT.CHOOSECOLS([.J3:.L8]; [.AD3]) ->  | G56: of:=ISERROR([.A56]) -> true | H56: of:=FORMULA([.A56]) -> {=CHOOSECOLS(J3:L8; AD3)}
I57: matrices
A58: of:=COM.MICROSOFT.CHOOSECOLS([.J3:.N8]; {3}) -> 1 | D58: 1 | G58: of:=([.A58]=[.D58])AND([.B58]=[.E58])AND([.C58]=[.F58]) -> true | H58: of:=FORMULA([.A58]) -> {=CHOOSECOLS(J3:N8; {3})}
A59: 2 | D59: 2 | G59: of:=([.A59]=[.D59])AND([.B59]=[.E59])AND([.C59]=[.F59]) -> true | H59: of:=FORMULA([.A59]) -> {=CHOOSECOLS(J3:N8; {3})}
D60: of:=VLOOKUP(1; [.AA60:.AB65]; 2) ->  | G60: of:=ISERROR([.A60]) -> true | H60: of:=FORMULA([.A60]) -> {=CHOOSECOLS(J3:N8; {3})}
A61: 0 | G61: of:=([.A61]=[.D61])AND([.B61]=[.E61])AND([.C61]=[.F61]) -> true | H61: of:=FORMULA([.A61]) -> {=CHOOSECOLS(J3:N8; {3})}
A62: 4 | D62: 4 | G62: of:=([.A62]=[.D62])AND([.B62]=[.E62])AND([.C62]=[.F62]) -> true | H62: of:=FORMULA([.A62]) -> {=CHOOSECOLS(J3:N8; {3})}
A63: 5 | D63: 5 | G63: of:=([.A63]=[.D63])AND([.B63]=[.E63])AND([.C63]=[.F63]) -> true | H63: of:=FORMULA([.A63]) -> {=CHOOSECOLS(J3:N8; {3})}
A64: of:=COM.MICROSOFT.CHOOSECOLS([.J3:.N8]; {-2}) -> 3 | D64: 3 | G64: of:=([.A64]=[.D64])AND([.B64]=[.E64])AND([.C64]=[.F64]) -> true | H64: of:=FORMULA([.A64]) -> {=CHOOSECOLS(J3:N8; {-2})}
A65: 4 | D65: 4 | G65: of:=([.A65]=[.D65])AND([.B65]=[.E65])AND([.C65]=[.F65]) -> true | H65: of:=FORMULA([.A65]) -> {=CHOOSECOLS(J3:N8; {-2})}
D66: of:=VLOOKUP(1; [.AA66:.AB71]; 2) ->  | G66: of:=ISERROR([.A66]) -> true | H66: of:=FORMULA([.A66]) -> {=CHOOSECOLS(J3:N8; {-2})}
A67: 0 | G67: of:=([.A67]=[.D67])AND([.B67]=[.E67])AND([.C67]=[.F67]) -> true | H67: of:=FORMULA([.A67]) -> {=CHOOSECOLS(J3:N8; {-2})}
A68: 6 | D68: 6 | G68: of:=([.A68]=[.D68])AND([.B68]=[.E68])AND([.C68]=[.F68]) -> true | H68: of:=FORMULA([.A68]) -> {=CHOOSECOLS(J3:N8; {-2})}
A69: 7 | D69: 7 | G69: of:=([.A69]=[.D69])AND([.B69]=[.E69])AND([.C69]=[.F69]) -> true | H69: of:=FORMULA([.A69]) -> {=CHOOSECOLS(J3:N8; {-2})}
A71: of:=COM.MICROSOFT.CHOOSECOLS([.J3:.N8]; {3|3}) -> 1 | B71: 1 | D71: 1 | E71: 1 | G71: of:=([.A71]=[.D71])AND([.B71]=[.E71])AND([.C71]=[.F71]) -> true | H71: of:=FORMULA([.A71]) -> {=CHOOSECOLS(J3:N8; {3;3})}
A72: 2 | B72: 2 | D72: 2 | E72: 2 | G72: of:=([.A72]=[.D72])AND([.B72]=[.E72])AND([.C72]=[.F72]) -> true | H72: of:=FORMULA([.A72]) -> {=CHOOSECOLS(J3:N8; {3;3})}
D73: of:=VLOOKUP(1; [.AA73:.AB78]; 2) ->  | E73: of:=VLOOKUP(1; [.AB73:.AC78]; 2) ->  | G73: of:=ISERROR([.A73])AND(ISERROR([.B73])) -> true | H73: of:=FORMULA([.A73]) -> {=CHOOSECOLS(J3:N8; {3;3})}
A74: 0 | B74: 0 | G74: of:=([.A74]=[.D74])AND([.B74]=[.E74])AND([.C74]=[.F74]) -> true | H74: of:=FORMULA([.A74]) -> {=CHOOSECOLS(J3:N8; {3;3})}
A75: 4 | B75: 4 | D75: 4 | E75: 4 | G75: of:=([.A75]=[.D75])AND([.B75]=[.E75])AND([.C75]=[.F75]) -> true | H75: of:=FORMULA([.A75]) -> {=CHOOSECOLS(J3:N8; {3;3})}
A76: 5 | B76: 5 | D76: 5 | E76: 5 | G76: of:=([.A76]=[.D76])AND([.B76]=[.E76])AND([.C76]=[.F76]) -> true | H76: of:=FORMULA([.A76]) -> {=CHOOSECOLS(J3:N8; {3;3})}
A77: of:=COM.MICROSOFT.CHOOSECOLS([.J3:.N8]; {-3|-3}) -> 1 | B77: 1 | D77: 1 | E77: 1 | G77: of:=([.A77]=[.D77])AND([.B77]=[.E77])AND([.C77]=[.F77]) -> true | H77: of:=FORMULA([.A77]) -> {=CHOOSECOLS(J3:N8; {-3;-3})}
A78: 2 | B78: 2 | D78: 2 | E78: 2 | G78: of:=([.A78]=[.D78])AND([.B78]=[.E78])AND([.C78]=[.F78]) -> true | H78: of:=FORMULA([.A78]) -> {=CHOOSECOLS(J3:N8; {-3;-3})}
D79: of:=VLOOKUP(1; [.AA79:.AB84]; 2) ->  | E79: of:=VLOOKUP(1; [.AB79:.AC84]; 2) ->  | G79: of:=ISERROR([.A79])AND(ISERROR([.B79])) -> true | H79: of:=FORMULA([.A79]) -> {=CHOOSECOLS(J3:N8; {-3;-3})}
A80: 0 | B80: 0 | G80: of:=([.A80]=[.D80])AND([.B80]=[.E80])AND([.C80]=[.F80]) -> true | H80: of:=FORMULA([.A80]) -> {=CHOOSECOLS(J3:N8; {-3;-3})}
A81: 4 | B81: 4 | D81: 4 | E81: 4 | G81: of:=([.A81]=[.D81])AND([.B81]=[.E81])AND([.C81]=[.F81]) -> true | H81: of:=FORMULA([.A81]) -> {=CHOOSECOLS(J3:N8; {-3;-3})}
A82: 5 | B82: 5 | D82: 5 | E82: 5 | G82: of:=([.A82]=[.D82])AND([.B82]=[.E82])AND([.C82]=[.F82]) -> true | H82: of:=FORMULA([.A82]) -> {=CHOOSECOLS(J3:N8; {-3;-3})}
A83: of:=COM.MICROSOFT.CHOOSECOLS([.J3:.N8]; {3|-2}) -> 1 | B83: 3 | D83: 1 | E83: 3 | G83: of:=([.A83]=[.D83])AND([.B83]=[.E83])AND([.C83]=[.F83]) -> true | H83: of:=FORMULA([.A83]) -> {=CHOOSECOLS(J3:N8; {3;-2})}
A84: 2 | B84: 4 | D84: 2 | E84: 4 | G84: of:=([.A84]=[.D84])AND([.B84]=[.E84])AND([.C84]=[.F84]) -> true | H84: of:=FORMULA([.A84]) -> {=CHOOSECOLS(J3:N8; {3;-2})}
D85: of:=VLOOKUP(1; [.AA85:.AB89]; 2) ->  | E85: of:=VLOOKUP(1; [.AB85:.AC89]; 2) ->  | G85: of:=ISERROR([.A85])AND(ISERROR([.B85])) -> true | H85: of:=FORMULA([.A85]) -> {=CHOOSECOLS(J3:N8; {3;-2})}
A86: 0 | B86: 0 | G86: of:=([.A86]=[.D86])AND([.B86]=[.E86])AND([.C86]=[.F86]) -> true | H86: of:=FORMULA([.A86]) -> {=CHOOSECOLS(J3:N8; {3;-2})}
A87: 4 | B87: 6 | D87: 4 | E87: 6 | G87: of:=([.A87]=[.D87])AND([.B87]=[.E87])AND([.C87]=[.F87]) -> true | H87: of:=FORMULA([.A87]) -> {=CHOOSECOLS(J3:N8; {3;-2})}
A88: 5 | B88: 7 | D88: 5 | E88: 7 | G88: of:=([.A88]=[.D88])AND([.B88]=[.E88])AND([.C88]=[.F88]) -> true | H88: of:=FORMULA([.A88]) -> {=CHOOSECOLS(J3:N8; {3;-2})}
A89: of:=COM.MICROSOFT.CHOOSECOLS([.J3:.N8]; {3;3}) -> 1 | B89: 1 | D89: 1 | E89: 1 | G89: of:=([.A89]=[.D89])AND([.B89]=[.E89])AND([.C89]=[.F89]) -> true | H89: of:=FORMULA([.A89]) -> {=CHOOSECOLS(J3:N8; {3.3})}
A90: 2 | B90: 2 | D90: 2 | E90: 2 | G90: of:=([.A90]=[.D90])AND([.B90]=[.E90])AND([.C90]=[.F90]) -> true | H90: of:=FORMULA([.A90]) -> {=CHOOSECOLS(J3:N8; {3.3})}
D91: of:=VLOOKUP(1; [.AA91:.AB96]; 2) ->  | E91: of:=VLOOKUP(1; [.AB91:.AC96]; 2) ->  | G91: of:=ISERROR([.A91])AND(ISERROR([.B91])) -> true | H91: of:=FORMULA([.A91]) -> {=CHOOSECOLS(J3:N8; {3.3})}
A92: 0 | B92: 0 | G92: of:=([.A92]=[.D92])AND([.B92]=[.E92])AND([.C92]=[.F92]) -> true | H92: of:=FORMULA([.A92]) -> {=CHOOSECOLS(J3:N8; {3.3})}
A93: 4 | B93: 4 | D93: 4 | E93: 4 | G93: of:=([.A93]=[.D93])AND([.B93]=[.E93])AND([.C93]=[.F93]) -> true | H93: of:=FORMULA([.A93]) -> {=CHOOSECOLS(J3:N8; {3.3})}
A94: 5 | B94: 5 | D94: 5 | E94: 5 | G94: of:=([.A94]=[.D94])AND([.B94]=[.E94])AND([.C94]=[.F94]) -> true | H94: of:=FORMULA([.A94]) -> {=CHOOSECOLS(J3:N8; {3.3})}
A95: of:=COM.MICROSOFT.CHOOSECOLS([.J3:.N8]; {-3;-3}) -> 1 | B95: 1 | D95: 1 | E95: 1 | G95: of:=([.A95]=[.D95])AND([.B95]=[.E95])AND([.C95]=[.F95]) -> true | H95: of:=FORMULA([.A95]) -> {=CHOOSECOLS(J3:N8; {-3.-3})}
A96: 2 | B96: 2 | D96: 2 | E96: 2 | G96: of:=([.A96]=[.D96])AND([.B96]=[.E96])AND([.C96]=[.F96]) -> true | H96: of:=FORMULA([.A96]) -> {=CHOOSECOLS(J3:N8; {-3.-3})}
D97: of:=VLOOKUP(1; [.AA97:.AB102]; 2) ->  | E97: of:=VLOOKUP(1; [.AB97:.AC102]; 2) ->  | G97: of:=ISERROR([.A97])AND(ISERROR([.B97])) -> true | H97: of:=FORMULA([.A97]) -> {=CHOOSECOLS(J3:N8; {-3.-3})}
A98: 0 | B98: 0 | G98: of:=([.A98]=[.D98])AND([.B98]=[.E98])AND([.C98]=[.F98]) -> true | H98: of:=FORMULA([.A98]) -> {=CHOOSECOLS(J3:N8; {-3.-3})}
A99: 4 | B99: 4 | D99: 4 | E99: 4 | G99: of:=([.A99]=[.D99])AND([.B99]=[.E99])AND([.C99]=[.F99]) -> true | H99: of:=FORMULA([.A99]) -> {=CHOOSECOLS(J3:N8; {-3.-3})}
A100: 5 | B100: 5 | D100: 5 | E100: 5 | G100: of:=([.A100]=[.D100])AND([.B100]=[.E100])AND([.C100]=[.F100]) -> true | H100: of:=FORMULA([.A100]) -> {=CHOOSECOLS(J3:N8; {-3.-3})}
A101: of:=COM.MICROSOFT.CHOOSECOLS([.J3:.N8]; {3;-2}) -> 1 | B101: 3 | D101: 1 | E101: 3 | G101: of:=([.A101]=[.D101])AND([.B101]=[.E101])AND([.C101]=[.F101]) -> true | H101: of:=FORMULA([.A101]) -> {=CHOOSECOLS(J3:N8; {3.-2})}
A102: 2 | B102: 4 | D102: 2 | E102: 4 | G102: of:=([.A102]=[.D102])AND([.B102]=[.E102])AND([.C102]=[.F102]) -> true | H102: of:=FORMULA([.A102]) -> {=CHOOSECOLS(J3:N8; {3.-2})}
D103: of:=VLOOKUP(1; [.AA103:.AB107]; 2) ->  | E103: of:=VLOOKUP(1; [.AB103:.AC107]; 2) ->  | G103: of:=ISERROR([.A103])AND(ISERROR([.B103])) -> true | H103: of:=FORMULA([.A103]) -> {=CHOOSECOLS(J3:N8; {3.-2})}
A104: 0 | B104: 0 | G104: of:=([.A104]=[.D104])AND([.B104]=[.E104])AND([.C104]=[.F104]) -> true | H104: of:=FORMULA([.A104]) -> {=CHOOSECOLS(J3:N8; {3.-2})}
A105: 4 | B105: 6 | D105: 4 | E105: 6 | G105: of:=([.A105]=[.D105])AND([.B105]=[.E105])AND([.C105]=[.F105]) -> true | H105: of:=FORMULA([.A105]) -> {=CHOOSECOLS(J3:N8; {3.-2})}
A106: 5 | B106: 7 | D106: 5 | E106: 7 | G106: of:=([.A106]=[.D106])AND([.B106]=[.E106])AND([.C106]=[.F106]) -> true | H106: of:=FORMULA([.A106]) -> {=CHOOSECOLS(J3:N8; {3.-2})}
I107: references
A108: of:=COM.MICROSOFT.CHOOSECOLS([.J3:.N8]; [.O2]) -> 1 | D108: 1 | G108: of:=([.A108]=[.D108])AND([.B108]=[.E108])AND([.C108]=[.F108]) -> true | H108: of:=FORMULA([.A108]) -> {=CHOOSECOLS(J3:N8; O2)}
A109: 2 | D109: 2 | G109: of:=([.A109]=[.D109])AND([.B109]=[.E109])AND([.C109]=[.F109]) -> true | H109: of:=FORMULA([.A109]) -> {=CHOOSECOLS(J3:N8; O2)}
D110: of:=VLOOKUP(1; [.AA110:.AB121]; 2) ->  | G110: of:=ISERROR([.A110]) -> true | H110: of:=FORMULA([.A110]) -> {=CHOOSECOLS(J3:N8; O2)}
A111: 0 | G111: of:=([.A111]=[.D111])AND([.B111]=[.E111])AND([.C111]=[.F111]) -> true | H111: of:=FORMULA([.A111]) -> {=CHOOSECOLS(J3:N8; O2)}
A112: 4 | D112: 4 | G112: of:=([.A112]=[.D112])AND([.B112]=[.E112])AND([.C112]=[.F112]) -> true | H112: of:=FORMULA([.A112]) -> {=CHOOSECOLS(J3:N8; O2)}
A113: 5 | D113: 5 | G113: of:=([.A113]=[.D113])AND([.B113]=[.E113])AND([.C113]=[.F113]) -> true | H113: of:=FORMULA([.A113]) -> {=CHOOSECOLS(J3:N8; O2)}
A115: of:=COM.MICROSOFT.CHOOSECOLS([.J3:.N8]; [.Q2]) -> 1 | D115: 1 | G115: of:=([.A115]=[.D115])AND([.B115]=[.E115])AND([.C115]=[.F115]) -> true | H115: of:=FORMULA([.A115]) -> {=CHOOSECOLS(J3:N8; Q2)}
A116: 2 | D116: 2 | G116: of:=([.A116]=[.D116])AND([.B116]=[.E116])AND([.C116]=[.F116]) -> true | H116: of:=FORMULA([.A116]) -> {=CHOOSECOLS(J3:N8; Q2)}
D117: of:=VLOOKUP(1; [.AA117:.AB135]; 2) ->  | G117: of:=ISERROR([.A117]) -> true | H117: of:=FORMULA([.A117]) -> {=CHOOSECOLS(J3:N8; Q2)}
A118: 0 | G118: of:=([.A118]=[.D118])AND([.B118]=[.E118])AND([.C118]=[.F118]) -> true | H118: of:=FORMULA([.A118]) -> {=CHOOSECOLS(J3:N8; Q2)}
A119: 4 | D119: 4 | G119: of:=([.A119]=[.D119])AND([.B119]=[.E119])AND([.C119]=[.F119]) -> true | H119: of:=FORMULA([.A119]) -> {=CHOOSECOLS(J3:N8; Q2)}
A120: 5 | D120: 5 | G120: of:=([.A120]=[.D120])AND([.B120]=[.E120])AND([.C120]=[.F120]) -> true | H120: of:=FORMULA([.A120]) -> {=CHOOSECOLS(J3:N8; Q2)}
A122: of:=COM.MICROSOFT.CHOOSECOLS([.J3:.N8]; [.O2:.P2]) -> 1 | B122: 3 | D122: 1 | E122: 3 | G122: of:=([.A122]=[.D122])AND([.B122]=[.E122])AND([.C122]=[.F122]) -> true | H122: of:=FORMULA([.A122]) -> {=CHOOSECOLS(J3:N8; O2:P2)}
A123: 2 | B123: 4 | D123: 2 | E123: 4 | G123: of:=([.A123]=[.D123])AND([.B123]=[.E123])AND([.C123]=[.F123]) -> true | H123: of:=FORMULA([.A123]) -> {=CHOOSECOLS(J3:N8; O2:P2)}
D124: of:=VLOOKUP(1; [.AA124:.AB128]; 2) ->  | E124: of:=VLOOKUP(1; [.AB124:.AC128]; 2) ->  | G124: of:=ISERROR([.A124])AND(ISERROR([.B124])) -> true | H124: of:=FORMULA([.A124]) -> {=CHOOSECOLS(J3:N8; O2:P2)}
A125: 0 | B125: 0 | G125: of:=([.A125]=[.D125])AND([.B125]=[.E125])AND([.C125]=[.F125]) -> true | H125: of:=FORMULA([.A125]) -> {=CHOOSECOLS(J3:N8; O2:P2)}
A126: 4 | B126: 6 | D126: 4 | E126: 6 | G126: of:=([.A126]=[.D126])AND([.B126]=[.E126])AND([.C126]=[.F126]) -> true | H126: of:=FORMULA([.A126]) -> {=CHOOSECOLS(J3:N8; O2:P2)}
A127: 5 | B127: 7 | D127: 5 | E127: 7 | G127: of:=([.A127]=[.D127])AND([.B127]=[.E127])AND([.C127]=[.F127]) -> true | H127: of:=FORMULA([.A127]) -> {=CHOOSECOLS(J3:N8; O2:P2)}
I128: odd columns
A129: of:=COM.MICROSOFT.CHOOSECOLS([.J3:.N8]; COM.MICROSOFT.SEQUENCE(ROUNDUP(COLUMNS([.J3:.N8])/2; 0);1; 1; 2)) -> January | B129: 1 | C129: 5 | D129: January | E129: 1 | F129: 5 | G129: of:=([.A129]=[.D129])AND([.B129]=[.E129])AND([.C129]=[.F129]) -> true | H129: of:=FORMULA([.A129]) -> {=CHOOSECOLS(J3:N8; SEQUENCE(ROUNDUP(COLUMNS(J3:N8)/2; 0);1; 1; 2))}
A130: February | B130: 2 | C130: 6 | D130: February | E130: 2 | F130: 6 | G130: of:=([.A130]=[.D130])AND([.B130]=[.E130])AND([.C130]=[.F130]) -> true | H130: of:=FORMULA([.A130]) -> {=CHOOSECOLS(J3:N8; SEQUENCE(ROUNDUP(COLUMNS(J3:N8)/2; 0);1; 1; 2))}
D131: of:=VLOOKUP(1; [.AA131:.AB136]; 2) ->  | E131: of:=VLOOKUP(1; [.AB131:.AC136]; 2) ->  | F131: of:=VLOOKUP(1; [.AC131:.AD136]; 2) ->  | G131: of:=ISERROR([.A131])AND(ISERROR([.B131]))AND(ISERROR([.C131])) -> true | H131: of:=FORMULA([.A131]) -> {=CHOOSECOLS(J3:N8; SEQUENCE(ROUNDUP(COLUMNS(J3:N8)/2; 0);1; 1; 2))}
A132: 0 | B132: 0 | C132: 0 | G132: of:=([.A132]=[.D132])AND([.B132]=[.E132])AND([.C132]=[.F132]) -> true | H132: of:=FORMULA([.A132]) -> {=CHOOSECOLS(J3:N8; SEQUENCE(ROUNDUP(COLUMNS(J3:N8)/2; 0);1; 1; 2))}
A133: April | B133: 4 | C133: 20 | D133: April | E133: 4 | F133: 20 | G133: of:=([.A133]=[.D133])AND([.B133]=[.E133])AND([.C133]=[.F133]) -> true | H133: of:=FORMULA([.A133]) -> {=CHOOSECOLS(J3:N8; SEQUENCE(ROUNDUP(COLUMNS(J3:N8)/2; 0);1; 1; 2))}
A134: May | B134: 5 | C134: 10 | D134: May | E134: 5 | F134: 10 | G134: of:=([.A134]=[.D134])AND([.B134]=[.E134])AND([.C134]=[.F134]) -> true | H134: of:=FORMULA([.A134]) -> {=CHOOSECOLS(J3:N8; SEQUENCE(ROUNDUP(COLUMNS(J3:N8)/2; 0);1; 1; 2))}
I135: even columns
A136: of:=COM.MICROSOFT.CHOOSECOLS([.J3:.N8]; COM.MICROSOFT.SEQUENCE(ROUNDDOWN(COLUMNS([.J3:.N8])/2; 0);1; 2; 2)) -> 100 | B136: 3 | D136: 100 | E136: 3 | G136: of:=([.A136]=[.D136])AND([.B136]=[.E136])AND([.C136]=[.F136]) -> true | H136: of:=FORMULA([.A136]) -> {=CHOOSECOLS(J3:N8; SEQUENCE(ROUNDDOWN(COLUMNS(J3:N8)/2; 0);1; 2; 2))}
A137: 150 | B137: 4 | D137: 150 | E137: 4 | G137: of:=([.A137]=[.D137])AND([.B137]=[.E137])AND([.C137]=[.F137]) -> true | H137: of:=FORMULA([.A137]) -> {=CHOOSECOLS(J3:N8; SEQUENCE(ROUNDDOWN(COLUMNS(J3:N8)/2; 0);1; 2; 2))}
D138: of:=VLOOKUP(1; [.AA138:.AB143]; 2) ->  | E138: of:=VLOOKUP(1; [.AB138:.AC143]; 2) ->  | G138: of:=ISERROR([.A138])AND(ISERROR([.B138])) -> true | H138: of:=FORMULA([.A138]) -> {=CHOOSECOLS(J3:N8; SEQUENCE(ROUNDDOWN(COLUMNS(J3:N8)/2; 0);1; 2; 2))}
A139: 0 | B139: 0 | G139: of:=([.A139]=[.D139])AND([.B139]=[.E139])AND([.C139]=[.F139]) -> true | H139: of:=FORMULA([.A139]) -> {=CHOOSECOLS(J3:N8; SEQUENCE(ROUNDDOWN(COLUMNS(J3:N8)/2; 0);1; 2; 2))}
A140: 250 | B140: 6 | D140: 250 | E140: 6 | G140: of:=([.A140]=[.D140])AND([.B140]=[.E140])AND([.C140]=[.F140]) -> true | H140: of:=FORMULA([.A140]) -> {=CHOOSECOLS(J3:N8; SEQUENCE(ROUNDDOWN(COLUMNS(J3:N8)/2; 0);1; 2; 2))}
A141: 300 | B141: 7 | D141: 300 | E141: 7 | G141: of:=([.A141]=[.D141])AND([.B141]=[.E141])AND([.C141]=[.F141]) -> true | H141: of:=FORMULA([.A141]) -> {=CHOOSECOLS(J3:N8; SEQUENCE(ROUNDDOWN(COLUMNS(J3:N8)/2; 0);1; 2; 2))}
A143: of:=COM.MICROSOFT.CHOOSECOLS([.J3:.N8]; -3; {-3};[.P2]) -> 1 | B143: 1 | C143: 3 | D143: 1 | E143: 1 | F143: 3 | G143: of:=([.A143]=[.D143])AND([.B143]=[.E143])AND([.C143]=[.F143]) -> true | H143: of:=FORMULA([.A143]) -> {=CHOOSECOLS(J3:N8; -3; {-3};P2)}
A144: 2 | B144: 2 | C144: 4 | D144: 2 | E144: 2 | F144: 4 | G144: of:=([.A144]=[.D144])AND([.B144]=[.E144])AND([.C144]=[.F144]) -> true | H144: of:=FORMULA([.A144]) -> {=CHOOSECOLS(J3:N8; -3; {-3};P2)}
D145: of:=VLOOKUP(1; [.AA145:.AB150]; 2) ->  | E145: of:=VLOOKUP(1; [.AB145:.AC150]; 2) ->  | F145: of:=VLOOKUP(1; [.AC145:.AD150]; 2) ->  | G145: of:=ISERROR([.A145])AND(ISERROR([.B145]))AND(ISERROR([.C145])) -> true | H145: of:=FORMULA([.A145]) -> {=CHOOSECOLS(J3:N8; -3; {-3};P2)}
A146: 0 | B146: 0 | C146: 0 | G146: of:=([.A146]=[.D146])AND([.B146]=[.E146])AND([.C146]=[.F146]) -> true | H146: of:=FORMULA([.A146]) -> {=CHOOSECOLS(J3:N8; -3; {-3};P2)}
A147: 4 | B147: 4 | C147: 6 | D147: 4 | E147: 4 | F147: 6 | G147: of:=([.A147]=[.D147])AND([.B147]=[.E147])AND([.C147]=[.F147]) -> true | H147: of:=FORMULA([.A147]) -> {=CHOOSECOLS(J3:N8; -3; {-3};P2)}
A148: 5 | B148: 5 | C148: 7 | D148: 5 | E148: 5 | F148: 7 | G148: of:=([.A148]=[.D148])AND([.B148]=[.E148])AND([.C148]=[.F148]) -> true | H148: of:=FORMULA([.A148]) -> {=CHOOSECOLS(J3:N8; -3; {-3};P2)}