Sheet: Sheet1
A1: LET Function
A3: Result | B3: of:=AND([.B8:.B95]) -> true
A7: Sheet | B7: Result | C7: Description
A8: 2 | B8: of:=AND([Sheet2.I2:.I211]) -> true | C8: Simple LET formulas with local references and values

Sheet: Sheet2
A1: Function | E1: Expected | I1: Correct | J1: FunctionString | K1: Comment | L1: XL-test | N1: Student | O1: Maths | P1: English | Q1: Biology | R1: Art | U1: Rep | V1: Region | W1: Product | X1: Profit
A2: of:=COM.MICROSOFT.LET(_xlpm.first;5;_xlpm.second;SUM(_xlpm.first;5);_xlpm.third;SUM(_xlpm.second;5);SUM(_xlpm.second;_xlpm.third)) -> 25 | E2: 25 | I2: of:=[.A2]=[.E2] -> true | J2: of:=FORMULA([.A2]) -> =LET(first;5;second;SUM(first;5);third;SUM(second;5);SUM(second;third)) | N2: Aiden | O2: 263 | P2: 215 | Q2: 160 | R2: 153 | U2: Amy | V2: East | W2: Apple | X2: 1.33
A3: of:=COM.MICROSOFT.LET(_xlpm.first;SUM(5;6);_xlpm.second;SUM(10;19);SUM(_xlpm.first;_xlpm.second)) -> 40 | E3: 40 | I3: of:=[.A3]=[.E3] -> true | J3: of:=FORMULA([.A3]) -> =LET(first;SUM(5;6);second;SUM(10;19);SUM(first;second)) | N3: Ava | O3: 231 | P3: 228 | Q3: 208 | R3: 187 | U3: Fred | V3: South | W3: Banana | X3: 0.09
N4: Carter | O4: 154 | P4: 201 | Q4: 213 | R4: 167 | U4: Amy | V4: West | W4: Mango | X4: 1.85
A5: Result | E5: Result | N5: Emma | O5: 257 | P5: 220 | Q5: 167 | R5: 172 | U5: Fred | V5: North | X5: 0.82
A6: of:=COM.MICROSOFT.LET(_xlpm.avg; AVERAGE([.O2:.R2]); IF(_xlpm.avg>249; "Excellent"; IF(_xlpm.avg>=200; "Good"; IF(_xlpm.avg>150; "Satisfactory"; "Poor")))) -> Satisfactory | E6: Satisfactory | I6: of:=[.A6]=[.E6] -> true | J6: of:=FORMULA([.A6]) -> =LET(avg; AVERAGE(O2:R2); IF(avg>249; "Excellent"; IF(avg>=200; "Good"; IF(avg>150; "Satisfactory"; "Poor")))) | N6: Isabella | O6: 238 | P6: 256 | Q6: 260 | R6: 246 | U6: Fred | V6: West | W6: Banana | X6: 1.25
A7: of:=COM.MICROSOFT.LET(_xlpm.avg; AVERAGE([.O3:.R3]); IF(_xlpm.avg>249; "Excellent"; IF(_xlpm.avg>=200; "Good"; IF(_xlpm.avg>150; "Satisfactory"; "Poor")))) -> Good | E7: Good | I7: of:=[.A7]=[.E7] -> true | J7: of:=FORMULA([.A7]) -> =LET(avg; AVERAGE(O3:R3); IF(avg>249; "Excellent"; IF(avg>=200; "Good"; IF(avg>150; "Satisfactory"; "Poor")))) | N7: Jackson | O7: 149 | P7: 164 | Q7: 130 | R7: 270 | U7: Amy | V7: East | W7: Apple | X7: 0.72
A8: of:=COM.MICROSOFT.LET(_xlpm.avg; AVERAGE([.O4:.R4]); IF(_xlpm.avg>249; "Excellent"; IF(_xlpm.avg>=200; "Good"; IF(_xlpm.avg>150; "Satisfactory"; "Poor")))) -> Satisfactory | E8: Satisfactory | I8: of:=[.A8]=[.E8] -> true | J8: of:=FORMULA([.A8]) -> =LET(avg; AVERAGE(O4:R4); IF(avg>249; "Excellent"; IF(avg>=200; "Good"; IF(avg>150; "Satisfactory"; "Poor")))) | N8: Liam | O8: 284 | P8: 250 | Q8: 150 | R8: 158 | U8: Fred | V8: North | W8: Mango | X8: 0.54
A9: of:=COM.MICROSOFT.LET(_xlpm.avg; AVERAGE([.O5:.R5]); IF(_xlpm.avg>249; "Excellent"; IF(_xlpm.avg>=200; "Good"; IF(_xlpm.avg>150; "Satisfactory"; "Poor")))) -> Good | E9: Good | I9: of:=[.A9]=[.E9] -> true | J9: of:=FORMULA([.A9]) -> =LET(avg; AVERAGE(O5:R5); IF(avg>249; "Excellent"; IF(avg>=200; "Good"; IF(avg>150; "Satisfactory"; "Poor")))) | N9: Lucas | O9: 261 | P9: 227 | Q9: 191 | R9: 221
A10: of:=COM.MICROSOFT.LET(_xlpm.avg; AVERAGE([.O6:.R6]); IF(_xlpm.avg>249; "Excellent"; IF(_xlpm.avg>=200; "Good"; IF(_xlpm.avg>150; "Satisfactory"; "Poor")))) -> Excellent | E10: Excellent | I10: of:=[.A10]=[.E10] -> true | J10: of:=FORMULA([.A10]) -> =LET(avg; AVERAGE(O6:R6); IF(avg>249; "Excellent"; IF(avg>=200; "Good"; IF(avg>150; "Satisfactory"; "Poor")))) | N10: Mia | O10: 187 | P10: 196 | Q10: 152 | R10: 173
A11: of:=COM.MICROSOFT.LET(_xlpm.avg; AVERAGE([.O7:.R7]); IF(_xlpm.avg>249; "Excellent"; IF(_xlpm.avg>=200; "Good"; IF(_xlpm.avg>150; "Satisfactory"; "Poor")))) -> Satisfactory | E11: Satisfactory | I11: of:=[.A11]=[.E11] -> true | J11: of:=FORMULA([.A11]) -> =LET(avg; AVERAGE(O7:R7); IF(avg>249; "Excellent"; IF(avg>=200; "Good"; IF(avg>150; "Satisfactory"; "Poor"))))
A12: of:=COM.MICROSOFT.LET(_xlpm.avg; AVERAGE([.O8:.R8]); IF(_xlpm.avg>249; "Excellent"; IF(_xlpm.avg>=200; "Good"; IF(_xlpm.avg>150; "Satisfactory"; "Poor")))) -> Good | E12: Good | I12: of:=[.A12]=[.E12] -> true | J12: of:=FORMULA([.A12]) -> =LET(avg; AVERAGE(O8:R8); IF(avg>249; "Excellent"; IF(avg>=200; "Good"; IF(avg>150; "Satisfactory"; "Poor"))))
A13: of:=COM.MICROSOFT.LET(_xlpm.avg; AVERAGE([.O9:.R9]); IF(_xlpm.avg>249; "Excellent"; IF(_xlpm.avg>=200; "Good"; IF(_xlpm.avg>150; "Satisfactory"; "Poor")))) -> Good | E13: Good | I13: of:=[.A13]=[.E13] -> true | J13: of:=FORMULA([.A13]) -> =LET(avg; AVERAGE(O9:R9); IF(avg>249; "Excellent"; IF(avg>=200; "Good"; IF(avg>150; "Satisfactory"; "Poor"))))
A14: of:=COM.MICROSOFT.LET(_xlpm.avg; AVERAGE([.O10:.R10]); IF(_xlpm.avg>249; "Excellent"; IF(_xlpm.avg>=200; "Good"; IF(_xlpm.avg>150; "Satisfactory"; "Poor")))) -> Satisfactory | E14: Satisfactory | I14: of:=[.A14]=[.E14] -> true | J14: of:=FORMULA([.A14]) -> =LET(avg; AVERAGE(O10:R10); IF(avg>249; "Excellent"; IF(avg>=200; "Good"; IF(avg>150; "Satisfactory"; "Poor"))))
A17: Middle name | E17: Middle name | N17: Full name
A18: of:=COM.MICROSOFT.LET(_xlpm.full_name; [.N18]; _xlpm.space; SEARCH(" "; _xlpm.full_name); MID(_xlpm.full_name; _xlpm.space+1; SEARCH(" "; _xlpm.full_name; _xlpm.space+1) -_xlpm.space-1)) -> D. | E18: D. | I18: of:=[.A18]=[.E18] -> true | J18: of:=FORMULA([.A18]) -> =LET(full_name; N18; space; SEARCH(" "; full_name); MID(full_name; space+1; SEARCH(" "; full_name; space+1) -space-1)) | N18: Aiden D. Anderson
A19: of:=COM.MICROSOFT.LET(_xlpm.full_name; [.N19]; _xlpm.space; SEARCH(" "; _xlpm.full_name); MID(_xlpm.full_name; _xlpm.space+1; SEARCH(" "; _xlpm.full_name; _xlpm.space+1) -_xlpm.space-1)) -> Andrew | E19: Andrew | I19: of:=[.A19]=[.E19] -> true | J19: of:=FORMULA([.A19]) -> =LET(full_name; N19; space; SEARCH(" "; full_name); MID(full_name; space+1; SEARCH(" "; full_name; space+1) -space-1)) | N19: John Andrew Brown
A20: of:=COM.MICROSOFT.LET(_xlpm.full_name; [.N20]; _xlpm.space; SEARCH(" "; _xlpm.full_name); MID(_xlpm.full_name; _xlpm.space+1; SEARCH(" "; _xlpm.full_name; _xlpm.space+1) -_xlpm.space-1)) -> Claire | E20: Claire | I20: of:=[.A20]=[.E20] -> true | J20: of:=FORMULA([.A20]) -> =LET(full_name; N20; space; SEARCH(" "; full_name); MID(full_name; space+1; SEARCH(" "; full_name; space+1) -space-1)) | N20: Ava Claire Brook
A21: of:=COM.MICROSOFT.LET(_xlpm.full_name; [.N21]; _xlpm.space; SEARCH(" "; _xlpm.full_name); MID(_xlpm.full_name; _xlpm.space+1; SEARCH(" "; _xlpm.full_name; _xlpm.space+1) -_xlpm.space-1)) -> Finn | E21: Finn | I21: of:=[.A21]=[.E21] -> true | J21: of:=FORMULA([.A21]) -> =LET(full_name; N21; space; SEARCH(" "; full_name); MID(full_name; space+1; SEARCH(" "; full_name; space+1) -space-1)) | N21: Frank Finn Hill
A22: of:=COM.MICROSOFT.LET(_xlpm.full_name; [.N22]; _xlpm.space; SEARCH(" "; _xlpm.full_name); MID(_xlpm.full_name; _xlpm.space+1; SEARCH(" "; _xlpm.full_name; _xlpm.space+1) -_xlpm.space-1)) -> M. | E22: M. | I22: of:=[.A22]=[.E22] -> true | J22: of:=FORMULA([.A22]) -> =LET(full_name; N22; space; SEARCH(" "; full_name); MID(full_name; space+1; SEARCH(" "; full_name; space+1) -space-1)) | N22: Robert M. Furlan
A23: of:=COM.MICROSOFT.LET(_xlpm.full_name; [.N23]; _xlpm.space; SEARCH(" "; _xlpm.full_name); MID(_xlpm.full_name; _xlpm.space+1; SEARCH(" "; _xlpm.full_name; _xlpm.space+1) -_xlpm.space-1)) -> Grace | E23: Grace | I23: of:=[.A23]=[.E23] -> true | J23: of:=FORMULA([.A23]) -> =LET(full_name; N23; space; SEARCH(" "; full_name); MID(full_name; space+1; SEARCH(" "; full_name; space+1) -space-1)) | N23: Mia Grace Johnson
A26: Student | B26: Subject | C26: Date | E26: Student | F26: Subject | G26: Date
A27: of:=COM.MICROSOFT.LET(_xlpm.data;[.$N$28:.$P$45];_xlpm.dates;[.P$28:.P$45];_xlpm.today;45444;_xlpm.n;[.R30];COM.MICROSOFT.FILTER(_xlpm.data;(_xlpm.dates>_xlpm.today)*(_xlpm.dates<=_xlpm.today+_xlpm.n); "No results")) -> Carter | B27: Biology | C27: 45445 | E27: Carter | F27: Biology | G27: 45445 | I27: of:=([.A27]=[.E27])AND([.B27]=[.F27])AND([.C27]=[.G27]) -> true | J27: of:=FORMULA([.A27]) -> {=LET(data;$N$28:$P$45;dates;P$28:P$45;today;45444;n;R30;FILTER(data;(dates>today)*(dates<=today+n); "No results"))} | N27: Student | O27: Subject | P27: Date | T27: Range1 | V27: Range2 | X27: Range3
A28: Emma | B28: English | C28: 45446 | E28: Emma | F28: English | G28: 45446 | I28: of:=([.A28]=[.E28])AND([.B28]=[.F28])AND([.C28]=[.G28]) -> true | J28: of:=FORMULA([.A28]) -> {=LET(data;$N$28:$P$45;dates;P$28:P$45;today;45444;n;R30;FILTER(data;(dates>today)*(dates<=today+n); "No results"))} | N28: Aiden | O28: Maths | P28: 2024-05-28 | T28: Alfa | V28: Delta | X28: Golf
A29: Emma | B29: Maths | C29: 45447 | E29: Emma | F29: Maths | G29: 45447 | I29: of:=([.A29]=[.E29])AND([.B29]=[.F29])AND([.C29]=[.G29]) -> true | J29: of:=FORMULA([.A29]) -> {=LET(data;$N$28:$P$45;dates;P$28:P$45;today;45444;n;R30;FILTER(data;(dates>today)*(dates<=today+n); "No results"))} | N29: Aiden | O29: Biology | P29: 2024-05-29 | T29: Bravo | V29: Echo | X29: Hotel
N30: Ava | O30: Art | P30: 2024-05-30 | R30: 3 | T30: Charlie | V30: Foxtrot | X30: India
N31: Ava | O31: English | P31: 2024-05-31
A32: of:=COM.MICROSOFT.LET(_xlpm.filtercriteria;"Fred";_xlpm.filteredrange;COM.MICROSOFT.FILTER([.$U$2:.$X$8];[.U2:.U8]=_xlpm.filtercriteria);IF(ISBLANK(_xlpm.filteredrange);"-";_xlpm.filteredrange)) -> Fred | B32: South | C32: Banana | D32: 1899-12-30T02:09:36 | E32: Fred | F32: South | G32: Banana | H32: 0.09 | I32: of:=([.A32]=[.E32])AND([.B32]=[.F32])AND([.C32]=[.G32])AND([.D32]=[.H32]) -> true | J32: of:=FORMULA([.A32]) -> {=LET(filtercriteria;"Fred";filteredrange;FILTER($U$2:$X$8;U2:U8=filtercriteria);IF(ISBLANK(filteredrange);"-";filteredrange))} | N32: Carter | O32: English | P32: 2024-06-01
A33: Fred | B33: North | C33: - | D33: 1899-12-30T19:40:48 | E33: Fred | F33: North | G33: - | H33: 0.82 | I33: of:=([.A33]=[.E33])AND([.B33]=[.F33])AND([.C33]=[.G33])AND([.D33]=[.H33]) -> true | J33: of:=FORMULA([.A33]) -> {=LET(filtercriteria;"Fred";filteredrange;FILTER($U$2:$X$8;U2:U8=filtercriteria);IF(ISBLANK(filteredrange);"-";filteredrange))} | N33: Carter | O33: Biology | P33: 2024-06-02
A34: Fred | B34: West | C34: Banana | D34: 1899-12-31T06:00:00 | E34: Fred | F34: West | G34: Banana | H34: 1.25 | I34: of:=([.A34]=[.E34])AND([.B34]=[.F34])AND([.C34]=[.G34])AND([.D34]=[.H34]) -> true | J34: of:=FORMULA([.A34]) -> {=LET(filtercriteria;"Fred";filteredrange;FILTER($U$2:$X$8;U2:U8=filtercriteria);IF(ISBLANK(filteredrange);"-";filteredrange))} | N34: Emma | O34: English | P34: 2024-06-03
A35: Fred | B35: North | C35: Mango | D35: 1899-12-30T12:57:36 | E35: Fred | F35: North | G35: Mango | H35: 0.54 | I35: of:=([.A35]=[.E35])AND([.B35]=[.F35])AND([.C35]=[.G35])AND([.D35]=[.H35]) -> true | J35: of:=FORMULA([.A35]) -> {=LET(filtercriteria;"Fred";filteredrange;FILTER($U$2:$X$8;U2:U8=filtercriteria);IF(ISBLANK(filteredrange);"-";filteredrange))} | N35: Emma | O35: Maths | P35: 2024-06-04
N36: Isabella | O36: English | P36: 2024-06-05
N37: Isabella | O37: Biology | P37: 2024-06-06
A38: of:=COM.MICROSOFT.LET(_xlpm.a;[.T$28:.T$30];_xlpm.b;[.V$28:.V$30];_xlpm.c;[.X$28:.X$30];INDEX((_xlpm.a~_xlpm.b~_xlpm.c);MOD(COM.MICROSOFT.SEQUENCE(9;1;0);3)+1;0;INT(COM.MICROSOFT.SEQUENCE(9;1;0)/3)+1)) -> Alfa | E38: Alfa | I38: of:=([.A38]=[.E38]) -> true | J38: of:=FORMULA([.A38]) -> {=LET(a;T$28:T$30;b;V$28:V$30;c;X$28:X$30;INDEX((a~b~c);MOD(SEQUENCE(9;1;0);3)+1;0;INT(SEQUENCE(9;1;0)/3)+1))} | N38: Jackson | O38: Biology | P38: 2024-06-07
A39: Bravo | E39: Bravo | I39: of:=([.A39]=[.E39]) -> true | J39: of:=FORMULA([.A39]) -> {=LET(a;T$28:T$30;b;V$28:V$30;c;X$28:X$30;INDEX((a~b~c);MOD(SEQUENCE(9;1;0);3)+1;0;INT(SEQUENCE(9;1;0)/3)+1))} | N39: Jackson | O39: Art | P39: 2024-06-08
A40: Charlie | E40: Charlie | I40: of:=([.A40]=[.E40]) -> true | J40: of:=FORMULA([.A40]) -> {=LET(a;T$28:T$30;b;V$28:V$30;c;X$28:X$30;INDEX((a~b~c);MOD(SEQUENCE(9;1;0);3)+1;0;INT(SEQUENCE(9;1;0)/3)+1))} | N40: Liam | O40: Art | P40: 2024-06-09
A41: Delta | E41: Delta | I41: of:=([.A41]=[.E41]) -> true | J41: of:=FORMULA([.A41]) -> {=LET(a;T$28:T$30;b;V$28:V$30;c;X$28:X$30;INDEX((a~b~c);MOD(SEQUENCE(9;1;0);3)+1;0;INT(SEQUENCE(9;1;0)/3)+1))} | N41: Liam | O41: Maths | P41: 2024-06-10
A42: Echo | E42: Echo | I42: of:=([.A42]=[.E42]) -> true | J42: of:=FORMULA([.A42]) -> {=LET(a;T$28:T$30;b;V$28:V$30;c;X$28:X$30;INDEX((a~b~c);MOD(SEQUENCE(9;1;0);3)+1;0;INT(SEQUENCE(9;1;0)/3)+1))} | N42: Lucas | O42: Maths | P42: 2024-06-11
A43: Foxtrot | E43: Foxtrot | I43: of:=([.A43]=[.E43]) -> true | J43: of:=FORMULA([.A43]) -> {=LET(a;T$28:T$30;b;V$28:V$30;c;X$28:X$30;INDEX((a~b~c);MOD(SEQUENCE(9;1;0);3)+1;0;INT(SEQUENCE(9;1;0)/3)+1))} | N43: Lucas | O43: English | P43: 2024-06-12
A44: Golf | E44: Golf | I44: of:=([.A44]=[.E44]) -> true | J44: of:=FORMULA([.A44]) -> {=LET(a;T$28:T$30;b;V$28:V$30;c;X$28:X$30;INDEX((a~b~c);MOD(SEQUENCE(9;1;0);3)+1;0;INT(SEQUENCE(9;1;0)/3)+1))} | N44: Mia | O44: Art | P44: 2024-06-13
A45: Hotel | E45: Hotel | I45: of:=([.A45]=[.E45]) -> true | J45: of:=FORMULA([.A45]) -> {=LET(a;T$28:T$30;b;V$28:V$30;c;X$28:X$30;INDEX((a~b~c);MOD(SEQUENCE(9;1;0);3)+1;0;INT(SEQUENCE(9;1;0)/3)+1))} | N45: Mia | O45: Biology | P45: 2024-06-14
A46: India | E46: India | I46: of:=([.A46]=[.E46]) -> true | J46: of:=FORMULA([.A46]) -> {=LET(a;T$28:T$30;b;V$28:V$30;c;X$28:X$30;INDEX((a~b~c);MOD(SEQUENCE(9;1;0);3)+1;0;INT(SEQUENCE(9;1;0)/3)+1))}
A49: of:=IFERROR(COM.MICROSOFT.LET(_xlpm.a_1;1;_xlpm.a_1);"ERROR") -> 1 | E49: 1 | I49: of:=([.A49]=[.E49]) -> true | J49: of:=FORMULA([.A49]) -> =IFERROR(LET(a_1;1;a_1);"ERROR")
A50: of:=SUM(COM.MICROSOFT.LET(_xlpm.a_1;SUM(5;4);_xlpm.a_1);2) -> 11 | E50: 11 | I50: of:=([.A50]=[.E50]) -> true | J50: of:=FORMULA([.A50]) -> =SUM(LET(a_1;SUM(5;4);a_1);2)
A51: of:=COM.MICROSOFT.LET(_xlpm.a_1;1;_xlpm.a_1) -> 1 | E51: 1 | I51: of:=([.A51]=[.E51]) -> true | J51: of:=FORMULA([.A51]) -> =LET(a_1;1;a_1)
A52: of:=COM.MICROSOFT.LET(_xlpm.avg; AVERAGE([.O2:.R2]); IF(_xlpm.avg>249; "Excellent"; "No good")) -> No good | E52: No good | I52: of:=([.A52]=[.E52]) -> true | J52: of:=FORMULA([.A52]) -> =LET(avg; AVERAGE(O2:R2); IF(avg>249; "Excellent"; "No good"))