Sheet: Sheet1
A1: LOOKUP Function
A3: Result | B3: of:=AND([.B8:.B95]) -> true
A7: Sheet | B7: Result | C7: Description
A8: 1 | B8: of:=AND([Sheet2.C2:.C1849]) -> true | C8: Simple LOOKUP formulas with local references and values

Sheet: Sheet2
A1: Function | B1: Expected | C1: Correct | D1: FunctionString | E1: Comment | I1: Date | R1: 1 | Y1: Bug 71589
A2: of:=LOOKUP("cc";[Sheet2.P12:.P17];[.R12:.R17]) -> yy | B2: yy | C2: of:=[.A2]=[.B2] -> true | D2: of:=FORMULA([.A2]) -> =LOOKUP("cc",Sheet2.P12:P17,R12:R17) | I2: 2013-11-01 | R2: 2 | Y2: 1 | Z2: 2 | AA2: 3 | AB2: E
A3: of:=LOOKUP("cc";[Sheet2.P12:.P17];[.R3:.R9]) -> test | B3: test | C3: of:=[.A3]=[.B3] -> true | D3: of:=FORMULA([.A3]) -> =LOOKUP("cc",Sheet2.P12:P17,R3:R9) | I3: 2013-11-02 | R3: tes
A4: of:=LOOKUP(3;[.Y2:.AB2];[.Y6:.AB6]) -> PLUM | B4: PLUM | C4: of:=[.A4]=[.B4] -> true | D4: of:=FORMULA([.A4]) -> =LOOKUP(3,Y2:AB2,Y6:AB6) | I4: 2013-11-03 | R4: test
A5: of:=LOOKUP("E";[.Y2:.AB2];[.Y6:.AB6]) -> VAN | B5: VAN | C5: of:=[.A5]=[.B5] -> true | D5: of:=FORMULA([.A5]) -> =LOOKUP("E",Y2:AB2,Y6:AB6) | I5: 2013-11-04 | R5: test | Y5: 2 | Z5: BLUE | AA5: PEAR | AB5: TRUCK
A6: of:=LOOKUP([.K23];[.K20:.R20];[.K20:.R20]) ->  | B6: #N/A | C6: of:=ISERROR([.A6]) -> true | D6: of:=FORMULA([.A6]) -> =LOOKUP(K23,K20:R20,K20:R20) | I6: 2013-11-05 | R6: t | Y6: 3 | Z6: GREEN | AA6: PLUM | AB6: VAN
A7: of:=LOOKUP([.K24];[.K20:.R20];[.K20:.R20]) -> 2 | B7: 2 | C7: of:=[.A7]=[.B7] -> true | D7: of:=FORMULA([.A7]) -> =LOOKUP(K24,K20:R20,K20:R20) | I7: 2013-11-06 | R7: a
A8: of:=LOOKUP([.K25];[.K20:.R20];[.K20:.R20]) -> 2 | B8: 2 | C8: of:=[.A8]=[.B8] -> true | D8: of:=FORMULA([.A8]) -> =LOOKUP(K25,K20:R20,K20:R20) | I8: 2013-11-07 | R8: testing
A9: of:=LOOKUP([.K26];[.K20:.R20];[.K20:.R20]) -> 4 | B9: 4 | C9: of:=[.A9]=[.B9] -> true | D9: of:=FORMULA([.A9]) -> =LOOKUP(K26,K20:R20,K20:R20) | I9: 2013-11-08 | R9: testing2
A10: of:=LOOKUP([.K27];[.K20:.R20];[.K20:.R20]) -> 4 | B10: 4 | C10: of:=[.A10]=[.B10] -> true | D10: of:=FORMULA([.A10]) -> =LOOKUP(K27,K20:R20,K20:R20)
A11: of:=LOOKUP([.K28];[.K20:.R20];[.K20:.R20]) -> 4 | B11: 4 | C11: of:=[.A11]=[.B11] -> true | D11: of:=FORMULA([.A11]) -> =LOOKUP(K28,K20:R20,K20:R20)
A12: of:=LOOKUP([.K29];[.K20:.R20];[.K20:.R20]) -> 4 | B12: 4 | C12: of:=[.A12]=[.B12] -> true | D12: of:=FORMULA([.A12]) -> =LOOKUP(K29,K20:R20,K20:R20) | E12: TODO | P12: aa | Q12: 1 | R12: xx
A13: of:=LOOKUP([.K30];[.K20:.R20];[.K20:.R20]) -> 8 | B13: 8 | C13: of:=[.A13]=[.B13] -> true | D13: of:=FORMULA([.A13]) -> =LOOKUP(K30,K20:R20,K20:R20) | E13: LOOKUP Kohei's test case from bug AOO#74245 | P13: bb | Q13: 2 | R13: zz
A14: of:=LOOKUP([.K31];[.K20:.R20];[.K20:.R20]) -> 8 | B14: 8 | C14: of:=[.A14]=[.B14] -> true | D14: of:=FORMULA([.A14]) -> =LOOKUP(K31,K20:R20,K20:R20) | P14: cc | Q14: 3 | R14: yy
A15: of:=LOOKUP([.K32];[.K20:.R20];[.K20:.R20]) ->  | B15: #N/A | C15: of:=ISERROR([.A15]) -> true | D15: of:=FORMULA([.A15]) -> =LOOKUP(K32,K20:R20,K20:R20) | P15: dd | Q15: 4 | R15: ww
A16: of:=LOOKUP([.K33];[.K20:.R20];[.K20:.R20]) -> B | B16: B | C16: of:=[.A16]=[.B16] -> true | D16: of:=FORMULA([.A16]) -> =LOOKUP(K33,K20:R20,K20:R20) | P16: ee | Q16: 5 | R16: qq
A17: of:=LOOKUP([.K34];[.K20:.R20];[.K20:.R20]) -> B | B17: B | C17: of:=[.A17]=[.B17] -> true | D17: of:=FORMULA([.A17]) -> =LOOKUP(K34,K20:R20,K20:R20) | P17: ff | Q17: 6 | R17: bb
A18: of:=LOOKUP([.K35];[.K20:.R20];[.K20:.R20]) -> D | B18: D | C18: of:=[.A18]=[.B18] -> true | D18: of:=FORMULA([.A18]) -> =LOOKUP(K35,K20:R20,K20:R20)
A19: of:=LOOKUP([.K36];[.K20:.R20];[.K20:.R20]) -> D | B19: D | C19: of:=[.A19]=[.B19] -> true | D19: of:=FORMULA([.A19]) -> =LOOKUP(K36,K20:R20,K20:R20)
A20: of:=LOOKUP([.K37];[.K20:.R20];[.K20:.R20]) -> D | B20: D | C20: of:=[.A20]=[.B20] -> true | D20: of:=FORMULA([.A20]) -> =LOOKUP(K37,K20:R20,K20:R20) | K20: 2 | L20: 4 | M20: 4 | N20: 8 | O20: B | P20: B | Q20: D | R20: H
A21: of:=LOOKUP([.K38];[.K20:.R20];[.K20:.R20]) -> D | B21: D | C21: of:=[.A21]=[.B21] -> true | D21: of:=FORMULA([.A21]) -> =LOOKUP(K38,K20:R20,K20:R20)
A22: of:=LOOKUP([.K39];[.K20:.R20];[.K20:.R20]) -> H | B22: H | C22: of:=[.A22]=[.B22] -> true | D22: of:=FORMULA([.A22]) -> =LOOKUP(K39,K20:R20,K20:R20) | K22: Lookup
A23: of:=LOOKUP([.K40];[.K20:.R20];[.K20:.R20]) -> H | B23: H | C23: of:=[.A23]=[.B23] -> true | D23: of:=FORMULA([.A23]) -> =LOOKUP(K40,K20:R20,K20:R20) | K23: 1
A24: of:=LOOKUP([.I2];[$Data.A2:.A9];[$Data.B2:.B9]) -> a | B24: a | C24: of:=[.A24]=[.B24] -> true | D24: of:=FORMULA([.A24]) -> =LOOKUP(I2,$Data.A2:A9,$Data.B2:B9) | K24: 2
A25: of:=LOOKUP([.I3];[$Data.$A$2:.A10];[$Data.$B$2:.B10]) -> 0 | C25: of:=[.A25]=[.B25] -> true | D25: of:=FORMULA([.A25]) -> =LOOKUP(I3,$Data.$A$2:A10,$Data.$B$2:B10) | K25: 3
A26: of:=LOOKUP([.I4];[$Data.$A$2:.A11];[$Data.$B$2:.B11]) -> b | B26: b | C26: of:=[.A26]=[.B26] -> true | D26: of:=FORMULA([.A26]) -> =LOOKUP(I4,$Data.$A$2:A11,$Data.$B$2:B11) | K26: 4
A27: of:=LOOKUP([.I5];[$Data.$A$2:.A12];[$Data.$B$2:.B12]) -> 0 | C27: of:=[.A27]="" -> true | D27: of:=FORMULA([.A27]) -> =LOOKUP(I5,$Data.$A$2:A12,$Data.$B$2:B12) | K27: 5
A28: of:=LOOKUP([.I6];[$Data.$A$2:.A13];[$Data.$B$2:.B13]) -> c | B28: c | C28: of:=[.A28]=[.B28] -> true | D28: of:=FORMULA([.A28]) -> =LOOKUP(I6,$Data.$A$2:A13,$Data.$B$2:B13) | K28: 6
A29: of:=LOOKUP([.I7];[$Data.$A$2:.A14];[$Data.$B$2:.B14]) ->   | C29: of:=[.A29]=" " -> true | D29: of:=FORMULA([.A29]) -> =LOOKUP(I7,$Data.$A$2:A14,$Data.$B$2:B14) | K29: 7
A30: of:=LOOKUP([.I8];[$Data.$A$2:.A15];[$Data.$B$2:.B15]) -> d | B30: d | C30: of:=[.A30]=[.B30] -> true | D30: of:=FORMULA([.A30]) -> =LOOKUP(I8,$Data.$A$2:A15,$Data.$B$2:B15) | K30: 8
A31: of:=LOOKUP([.I9];[$Data.$A$2:.A16];[$Data.$B$2:.B16]) -> 0 | C31: of:=[.A31]=[.B31] -> true | D31: of:=FORMULA([.A31]) -> =LOOKUP(I9,$Data.$A$2:A16,$Data.$B$2:B16) | K31: 9
A32: of:=LOOKUP(4; [.K43:.M43]*2; [.K45:.M45]/3) -> 7.33333333333333 | B32: 7.33333333333333 | C32: of:=ROUND([.A32];12)=ROUND([.B32];12) -> true | D32: of:=FORMULA([.A32]) -> =LOOKUP(4, K43:M43*2, K45:M45/3) | K32: A
A33: of:=LOOKUP(2;[.K43]) -> 2 | B33: 2 | C33: of:=[.A33]=[.B33] -> true | D33: of:=FORMULA([.A33]) -> =LOOKUP(2,K43) | K33: B
A34: of:=LOOKUP(1;1) -> 1 | B34: 1 | C34: of:=[.A34]=[.B34] -> true | D34: of:=FORMULA([.A34]) -> =LOOKUP(1,1) | K34: C
A35: of:=LOOKUP(1;{1;2}) -> 1 | B35: 1 | C35: of:=[.A35]=[.B35] -> true | D35: of:=FORMULA([.A35]) -> =LOOKUP(1,{1,2}) | K35: D
A36: of:=LOOKUP(2;[.K43];[.K45]) -> 22 | B36: 22 | C36: of:=[.A36]=[.B36] -> true | D36: of:=FORMULA([.A36]) -> =LOOKUP(2,K43,K45) | K36: E
A37: of:=LOOKUP(1;1;3) -> 3 | B37: 3 | C37: of:=[.A37]=[.B37] -> true | D37: of:=FORMULA([.A37]) -> =LOOKUP(1,1,3) | K37: F
A38: of:=LOOKUP(1;{1;2};{3;4}) -> 3 | B38: 3 | C38: of:=[.A38]=[.B38] -> true | D38: of:=FORMULA([.A38]) -> =LOOKUP(1,{1,2},{3,4}) | K38: G
A39: of:=LOOKUP([.K49];[.L49:.L56]) ->  | B39: #N/A | C39: of:=ISERROR([.A39]) -> true | D39: of:=FORMULA([.A39]) -> =LOOKUP(K49,L49:L56) | K39: H
A40: of:=LOOKUP([.K50];[.L49:.L56]) -> 0 | B40: 0 | C40: of:=[.A40]=[.B40] -> true | D40: of:=FORMULA([.A40]) -> =LOOKUP(K50,L49:L56) | K40: I
A41: of:=LOOKUP([.K51];[.L49:.L56]) ->  | B41: #N/A | C41: of:=ISERROR([.A41]) -> true | D41: of:=FORMULA([.A41]) -> =LOOKUP(K51,L49:L56)
A42: of:=LOOKUP([.K52];[.L49:.L56]) -> 1 | B42: 1 | C42: of:=[.A42]=[.B42] -> true | D42: of:=FORMULA([.A42]) -> =LOOKUP(K52,L49:L56)
A43: of:=LOOKUP([.K53];[.L49:.L56]) -> 2 | B43: 2 | C43: of:=[.A43]=[.B43] -> true | D43: of:=FORMULA([.A43]) -> =LOOKUP(K53,L49:L56) | K43: 2 | L43: 4 | M43: 8 | Q43: constants lookups
A44: of:=LOOKUP([.K54];[.L49:.L56]) -> 3 | B44: 3 | C44: of:=[.A44]=[.B44] -> true | D44: of:=FORMULA([.A44]) -> =LOOKUP(K54,L49:L56)
A45: of:=LOOKUP([.K55];[.L49:.L56]) ->  | B45: #N/A | C45: of:=ISERROR([.A45]) -> true | D45: of:=FORMULA([.A45]) -> =LOOKUP(K55,L49:L56) | K45: 22 | L45: 44 | M45: 88
A46: of:=LOOKUP([.K56];[.L49:.L56]) -> b | B46: b | C46: of:=[.A46]=[.B46] -> true | D46: of:=FORMULA([.A46]) -> =LOOKUP(K56,L49:L56) | O46: forced array
A47: of:=LOOKUP([.K57];[.L49:.L56]) -> c | B47: c | C47: of:=[.A47]=[.B47] -> true | D47: of:=FORMULA([.A47]) -> =LOOKUP(K57,L49:L56)
A48: of:=LOOKUP([.K58];[.L49:.L56]) -> y | B48: y | C48: of:=[.A48]=[.B48] -> true | D48: of:=FORMULA([.A48]) -> =LOOKUP(K58,L49:L56) | P48: mixed lookup no result vector | Q48: mixed lookup result vector | R48: mixed lookup result matrix | S48: search vector numeric | T48: search vector string
A49: of:=LOOKUP([.K49];[.L49:.L56];[.M49:.M56]) ->  | B49: #N/A | C49: of:=ISERROR([.A49]) -> true | D49: of:=FORMULA([.A49]) -> =LOOKUP(K49,L49:L56,M49:M56) | K49: -1 | L49: 0 | M49: 0 | N49: of:=[.M49]&" 2" -> 0 2
A50: of:=LOOKUP([.K50];[.L49:.L56];[.M49:.M56]) -> 0 | B50: 0 | C50: of:=[.A50]=[.B50] -> true | D50: of:=FORMULA([.A50]) -> =LOOKUP(K50,L49:L56,M49:M56) | K50: 0 | L50: 1 | M50: 11 | N50: of:=[.M50]&" 2" -> 11 2
A51: of:=LOOKUP([.K51];[.L49:.L56];[.M49:.M56]) ->  | B51: #N/A | C51: of:=ISERROR([.A51]) -> true | D51: of:=FORMULA([.A51]) -> =LOOKUP(K51,L49:L56,M49:M56) | L51: 2 | M51: 22 | N51: of:=[.M51]&" 2" -> 22 2
A52: of:=LOOKUP([.K52];[.L49:.L56];[.M49:.M56]) -> 11 | B52: 11 | C52: of:=[.A52]=[.B52] -> true | D52: of:=FORMULA([.A52]) -> =LOOKUP(K52,L49:L56,M49:M56) | K52: 1 | L52: 3 | M52: 33 | N52: of:=[.M52]&" 2" -> 33 2
A53: of:=LOOKUP([.K53];[.L49:.L56];[.M49:.M56]) -> 22 | B53: 22 | C53: of:=[.A53]=[.B53] -> true | D53: of:=FORMULA([.A53]) -> =LOOKUP(K53,L49:L56,M49:M56) | K53: 2 | L53: b | M53: bb | N53: of:=[.M53]&" 2" -> bb 2
A54: of:=LOOKUP([.K54];[.L49:.L56];[.M49:.M56]) -> 33 | B54: 33 | C54: of:=[.A54]=[.B54] -> true | D54: of:=FORMULA([.A54]) -> =LOOKUP(K54,L49:L56,M49:M56) | K54: 4 | L54: c | M54: cc | N54: of:=[.M54]&" 2" -> cc 2
A55: of:=LOOKUP([.K55];[.L49:.L56];[.M49:.M56]) ->  | B55: #N/A | C55: of:=ISERROR([.A55]) -> true | D55: of:=FORMULA([.A55]) -> =LOOKUP(K55,L49:L56,M49:M56) | K55: a | L55: x | M55: xx | N55: of:=[.M55]&" 2" -> xx 2
A56: of:=LOOKUP([.K56];[.L49:.L56];[.M49:.M56]) -> bb | B56: bb | C56: of:=[.A56]=[.B56] -> true | D56: of:=FORMULA([.A56]) -> =LOOKUP(K56,L49:L56,M49:M56) | K56: b | L56: y | M56: yy | N56: of:=[.M56]&" 2" -> yy 2
A57: of:=LOOKUP([.K57];[.L49:.L56];[.M49:.M56]) -> cc | B57: cc | C57: of:=[.A57]=[.B57] -> true | D57: of:=FORMULA([.A57]) -> =LOOKUP(K57,L49:L56,M49:M56) | K57: d
A58: of:=LOOKUP([.K58];[.L49:.L56];[.M49:.M56]) -> yy | B58: yy | C58: of:=[.A58]=[.B58] -> true | D58: of:=FORMULA([.A58]) -> =LOOKUP(K58,L49:L56,M49:M56) | K58: z
A59: of:=LOOKUP([.K49];[.L49:.N56]) ->  | B59: #N/A | C59: of:=ISERROR([.A59]) -> true | D59: of:=FORMULA([.A59]) -> =LOOKUP(K49,L49:N56)
A60: of:=LOOKUP([.K50];[.L49:.N56]) -> 0 2 | B60: 0 2 | C60: of:=[.A60]=[.B60] -> true | D60: of:=FORMULA([.A60]) -> =LOOKUP(K50,L49:N56) | K60: single data lookup
A61: of:=LOOKUP([.K51];[.L49:.N56]) ->  | B61: #N/A | C61: of:=ISERROR([.A61]) -> true | D61: of:=FORMULA([.A61]) -> =LOOKUP(K51,L49:N56)
A62: of:=LOOKUP([.K52];[.L49:.N56]) -> 11 2 | B62: 11 2 | C62: of:=[.A62]=[.B62] -> true | D62: of:=FORMULA([.A62]) -> =LOOKUP(K52,L49:N56)
A63: of:=LOOKUP([.K53];[.L49:.N56]) -> 22 2 | B63: 22 2 | C63: of:=[.A63]=[.B63] -> true | D63: of:=FORMULA([.A63]) -> =LOOKUP(K53,L49:N56)
A64: of:=LOOKUP([.K54];[.L49:.N56]) -> 33 2 | B64: 33 2 | C64: of:=[.A64]=[.B64] -> true | D64: of:=FORMULA([.A64]) -> =LOOKUP(K54,L49:N56)
A65: of:=LOOKUP([.K55];[.L49:.N56]) ->  | B65: #N/A | C65: of:=ISERROR([.A65]) -> true | D65: of:=FORMULA([.A65]) -> =LOOKUP(K55,L49:N56)
A66: of:=LOOKUP([.K56];[.L49:.N56]) -> bb 2 | B66: bb 2 | C66: of:=[.A66]=[.B66] -> true | D66: of:=FORMULA([.A66]) -> =LOOKUP(K56,L49:N56)
A67: of:=LOOKUP([.K57];[.L49:.N56]) -> cc 2 | B67: cc 2 | C67: of:=[.A67]=[.B67] -> true | D67: of:=FORMULA([.A67]) -> =LOOKUP(K57,L49:N56)
A68: of:=LOOKUP([.K58];[.L49:.N56]) -> yy 2 | B68: yy 2 | C68: of:=[.A68]=[.B68] -> true | D68: of:=FORMULA([.A68]) -> =LOOKUP(K58,L49:N56)
A69: of:=LOOKUP([.K49];[.L49:.L52];[.M49:.M56]) ->  | B69: #N/A | C69: of:=ISERROR([.A69]) -> true | D69: of:=FORMULA([.A69]) -> =LOOKUP(K49,L49:L52,M49:M56)
A70: of:=LOOKUP([.K50];[.L49:.L52];[.M49:.M56]) -> 0 | B70: 0 | C70: of:=[.A70]=[.B70] -> true | D70: of:=FORMULA([.A70]) -> =LOOKUP(K50,L49:L52,M49:M56)
A71: of:=LOOKUP([.K51];[.L49:.L52];[.M49:.M56]) ->  | B71: #N/A | C71: of:=ISERROR([.A71]) -> true | D71: of:=FORMULA([.A71]) -> =LOOKUP(K51,L49:L52,M49:M56)
A72: of:=LOOKUP([.K52];[.L49:.L52];[.M49:.M56]) -> 11 | B72: 11 | C72: of:=[.A72]=[.B72] -> true | D72: of:=FORMULA([.A72]) -> =LOOKUP(K52,L49:L52,M49:M56) | K72: single value in data
A73: of:=LOOKUP([.K53];[.L49:.L52];[.M49:.M56]) -> 22 | B73: 22 | C73: of:=[.A73]=[.B73] -> true | D73: of:=FORMULA([.A73]) -> =LOOKUP(K53,L49:L52,M49:M56) | K73: -1 | L73: 1 | M73: zero | Q73: c
A74: of:=LOOKUP([.K54];[.L49:.L52];[.M49:.M56]) -> 33 | B74: 33 | C74: of:=[.A74]=[.B74] -> true | D74: of:=FORMULA([.A74]) -> =LOOKUP(K54,L49:L52,M49:M56) | K74: 0 | L74: 1 | M74: one | Q74: c
A75: of:=LOOKUP([.K55];[.L49:.L52];[.M49:.M56]) ->  | B75: #N/A | C75: of:=ISERROR([.A75]) -> true | D75: of:=FORMULA([.A75]) -> =LOOKUP(K55,L49:L52,M49:M56) | L75: 1 | M75: two | Q75: c
A76: of:=LOOKUP([.K56];[.L49:.L52];[.M49:.M56]) ->  | B76: #N/A | C76: of:=ISERROR([.A76]) -> true | D76: of:=FORMULA([.A76]) -> =LOOKUP(K56,L49:L52,M49:M56) | K76: 1 | L76: 1 | M76: three | Q76: c
A77: of:=LOOKUP([.K57];[.L49:.L52];[.M49:.M56]) ->  | B77: #N/A | C77: of:=ISERROR([.A77]) -> true | D77: of:=FORMULA([.A77]) -> =LOOKUP(K57,L49:L52,M49:M56) | K77: 2 | L77: 1 | M77: four | Q77: c
A78: of:=LOOKUP([.K58];[.L49:.L52];[.M49:.M56]) ->  | B78: #N/A | C78: of:=ISERROR([.A78]) -> true | D78: of:=FORMULA([.A78]) -> =LOOKUP(K58,L49:L52,M49:M56) | K78: 4 | L78: 1 | M78: five | Q78: c
A79: of:=LOOKUP([.K49];[.L53:.L56];[.M49:.M56]) ->  | B79: #N/A | C79: of:=ISERROR([.A79]) -> true | D79: of:=FORMULA([.A79]) -> =LOOKUP(K49,L53:L56,M49:M56) | K79: a | L79: 1 | M79: six | Q79: c
A80: of:=LOOKUP([.K50];[.L53:.L56];[.M49:.M56]) ->  | B80: #N/A | C80: of:=ISERROR([.A80]) -> true | D80: of:=FORMULA([.A80]) -> =LOOKUP(K50,L53:L56,M49:M56) | K80: b | L80: 1 | M80: seven | Q80: c
A81: of:=LOOKUP([.K51];[.L53:.L56];[.M49:.M56]) ->  | B81: #N/A | C81: of:=ISERROR([.A81]) -> true | D81: of:=FORMULA([.A81]) -> =LOOKUP(K51,L53:L56,M49:M56) | K81: d | L81: 1 | M81: eight | Q81: c
A82: of:=LOOKUP([.K52];[.L53:.L56];[.M49:.M56]) ->  | B82: #N/A | C82: of:=ISERROR([.A82]) -> true | D82: of:=FORMULA([.A82]) -> =LOOKUP(K52,L53:L56,M49:M56)
A83: of:=LOOKUP([.K53];[.L53:.L56];[.M49:.M56]) ->  | B83: #N/A | C83: of:=ISERROR([.A83]) -> true | D83: of:=FORMULA([.A83]) -> =LOOKUP(K53,L53:L56,M49:M56)
A84: of:=LOOKUP([.K54];[.L53:.L56];[.M49:.M56]) ->  | B84: #N/A | C84: of:=ISERROR([.A84]) -> true | D84: of:=FORMULA([.A84]) -> =LOOKUP(K54,L53:L56,M49:M56)
A85: of:=LOOKUP([.K55];[.L53:.L56];[.M49:.M56]) ->  | B85: #N/A | C85: of:=ISERROR([.A85]) -> true | D85: of:=FORMULA([.A85]) -> =LOOKUP(K55,L53:L56,M49:M56)
A86: of:=LOOKUP([.K56];[.L53:.L56];[.M49:.M56]) -> 0 | B86: 0 | C86: of:=[.A86]=[.B86] -> true | D86: of:=FORMULA([.A86]) -> =LOOKUP(K56,L53:L56,M49:M56)
A87: of:=LOOKUP([.K57];[.L53:.L56];[.M49:.M56]) -> 11 | B87: 11 | C87: of:=[.A87]=[.B87] -> true | D87: of:=FORMULA([.A87]) -> =LOOKUP(K57,L53:L56,M49:M56)
A88: of:=LOOKUP([.K58];[.L53:.L56];[.M49:.M56]) -> 33 | B88: 33 | C88: of:=[.A88]=[.B88] -> true | D88: of:=FORMULA([.A88]) -> =LOOKUP(K58,L53:L56,M49:M56)
A89: of:=LOOKUP([.K49];[.L49];[.M49:.M56]) ->  | B89: #N/A | C89: of:=ISERROR([.A89]) -> true | D89: of:=FORMULA([.A89]) -> =LOOKUP(K49,L49,M49:M56)
A90: of:=LOOKUP([.K50];[.L49];[.M49:.M56]) -> 0 | B90: 0 | C90: of:=[.A90]=[.B90] -> true | D90: of:=FORMULA([.A90]) -> =LOOKUP(K50,L49,M49:M56)
A91: of:=LOOKUP([.K51];[.L49];[.M49:.M56]) ->  | B91: #N/A | C91: of:=ISERROR([.A91]) -> true | D91: of:=FORMULA([.A91]) -> =LOOKUP(K51,L49,M49:M56)
A92: of:=LOOKUP([.K52];[.L49];[.M49:.M56]) -> 0 | B92: 0 | C92: of:=[.A92]=[.B92] -> true | D92: of:=FORMULA([.A92]) -> =LOOKUP(K52,L49,M49:M56)
A93: of:=LOOKUP([.K53];[.L49];[.M49:.M56]) -> 0 | B93: 0 | C93: of:=[.A93]=[.B93] -> true | D93: of:=FORMULA([.A93]) -> =LOOKUP(K53,L49,M49:M56)
A94: of:=LOOKUP([.K54];[.L49];[.M49:.M56]) -> 0 | B94: 0 | C94: of:=[.A94]=[.B94] -> true | D94: of:=FORMULA([.A94]) -> =LOOKUP(K54,L49,M49:M56)
A95: of:=LOOKUP([.K55];[.L49];[.M49:.M56]) ->  | B95: #N/A | C95: of:=ISERROR([.A95]) -> true | D95: of:=FORMULA([.A95]) -> =LOOKUP(K55,L49,M49:M56)
A96: of:=LOOKUP([.K56];[.L49];[.M49:.M56]) ->  | B96: #N/A | C96: of:=ISERROR([.A96]) -> true | D96: of:=FORMULA([.A96]) -> =LOOKUP(K56,L49,M49:M56)
A97: of:=LOOKUP([.K57];[.L49];[.M49:.M56]) ->  | B97: #N/A | C97: of:=ISERROR([.A97]) -> true | D97: of:=FORMULA([.A97]) -> =LOOKUP(K57,L49,M49:M56)
A98: of:=LOOKUP([.K58];[.L49];[.M49:.M56]) ->  | B98: #N/A | C98: of:=ISERROR([.A98]) -> true | D98: of:=FORMULA([.A98]) -> =LOOKUP(K58,L49,M49:M56)
A99: of:=LOOKUP([.K49];[.L50];[.M49:.M56]) ->  | B99: #N/A | C99: of:=ISERROR([.A99]) -> true | D99: of:=FORMULA([.A99]) -> =LOOKUP(K49,L50,M49:M56)
A100: of:=LOOKUP([.K50];[.L50];[.M49:.M56]) ->  | B100: #N/A | C100: of:=ISERROR([.A100]) -> true | D100: of:=FORMULA([.A100]) -> =LOOKUP(K50,L50,M49:M56)
A101: of:=LOOKUP([.K51];[.L50];[.M49:.M56]) ->  | B101: #N/A | C101: of:=ISERROR([.A101]) -> true | D101: of:=FORMULA([.A101]) -> =LOOKUP(K51,L50,M49:M56)
A102: of:=LOOKUP([.K52];[.L50];[.M49:.M56]) -> 0 | B102: 0 | C102: of:=[.A102]=[.B102] -> true | D102: of:=FORMULA([.A102]) -> =LOOKUP(K52,L50,M49:M56)
A103: of:=LOOKUP([.K53];[.L50];[.M49:.M56]) -> 0 | B103: 0 | C103: of:=[.A103]=[.B103] -> true | D103: of:=FORMULA([.A103]) -> =LOOKUP(K53,L50,M49:M56)
A104: of:=LOOKUP([.K54];[.L50];[.M49:.M56]) -> 0 | B104: 0 | C104: of:=[.A104]=[.B104] -> true | D104: of:=FORMULA([.A104]) -> =LOOKUP(K54,L50,M49:M56)
A105: of:=LOOKUP([.K55];[.L50];[.M49:.M56]) ->  | B105: #N/A | C105: of:=ISERROR([.A105]) -> true | D105: of:=FORMULA([.A105]) -> =LOOKUP(K55,L50,M49:M56)
A106: of:=LOOKUP([.K56];[.L50];[.M49:.M56]) ->  | B106: #N/A | C106: of:=ISERROR([.A106]) -> true | D106: of:=FORMULA([.A106]) -> =LOOKUP(K56,L50,M49:M56)
A107: of:=LOOKUP([.K57];[.L50];[.M49:.M56]) ->  | B107: #N/A | C107: of:=ISERROR([.A107]) -> true | D107: of:=FORMULA([.A107]) -> =LOOKUP(K57,L50,M49:M56)
A108: of:=LOOKUP([.K58];[.L50];[.M49:.M56]) ->  | B108: #N/A | C108: of:=ISERROR([.A108]) -> true | D108: of:=FORMULA([.A108]) -> =LOOKUP(K58,L50,M49:M56)
A109: of:=LOOKUP([.K49];[.L51];[.M49:.M56]) ->  | B109: #N/A | C109: of:=ISERROR([.A109]) -> true | D109: of:=FORMULA([.A109]) -> =LOOKUP(K49,L51,M49:M56)
A110: of:=LOOKUP([.K50];[.L51];[.M49:.M56]) ->  | B110: #N/A | C110: of:=ISERROR([.A110]) -> true | D110: of:=FORMULA([.A110]) -> =LOOKUP(K50,L51,M49:M56)
A111: of:=LOOKUP([.K51];[.L51];[.M49:.M56]) ->  | B111: #N/A | C111: of:=ISERROR([.A111]) -> true | D111: of:=FORMULA([.A111]) -> =LOOKUP(K51,L51,M49:M56)
A112: of:=LOOKUP([.K52];[.L51];[.M49:.M56]) ->  | B112: #N/A | C112: of:=ISERROR([.A112]) -> true | D112: of:=FORMULA([.A112]) -> =LOOKUP(K52,L51,M49:M56)
A113: of:=LOOKUP([.K53];[.L51];[.M49:.M56]) -> 0 | B113: 0 | C113: of:=[.A113]=[.B113] -> true | D113: of:=FORMULA([.A113]) -> =LOOKUP(K53,L51,M49:M56)
A114: of:=LOOKUP([.K54];[.L51];[.M49:.M56]) -> 0 | B114: 0 | C114: of:=[.A114]=[.B114] -> true | D114: of:=FORMULA([.A114]) -> =LOOKUP(K54,L51,M49:M56)
A115: of:=LOOKUP([.K55];[.L51];[.M49:.M56]) ->  | B115: #N/A | C115: of:=ISERROR([.A115]) -> true | D115: of:=FORMULA([.A115]) -> =LOOKUP(K55,L51,M49:M56)
A116: of:=LOOKUP([.K56];[.L51];[.M49:.M56]) ->  | B116: #N/A | C116: of:=ISERROR([.A116]) -> true | D116: of:=FORMULA([.A116]) -> =LOOKUP(K56,L51,M49:M56)
A117: of:=LOOKUP([.K57];[.L51];[.M49:.M56]) ->  | B117: #N/A | C117: of:=ISERROR([.A117]) -> true | D117: of:=FORMULA([.A117]) -> =LOOKUP(K57,L51,M49:M56)
A118: of:=LOOKUP([.K58];[.L51];[.M49:.M56]) ->  | B118: #N/A | C118: of:=ISERROR([.A118]) -> true | D118: of:=FORMULA([.A118]) -> =LOOKUP(K58,L51,M49:M56)
A119: of:=LOOKUP([.K49];[.L52];[.M49:.M56]) ->  | B119: #N/A | C119: of:=ISERROR([.A119]) -> true | D119: of:=FORMULA([.A119]) -> =LOOKUP(K49,L52,M49:M56)
A120: of:=LOOKUP([.K50];[.L52];[.M49:.M56]) ->  | B120: #N/A | C120: of:=ISERROR([.A120]) -> true | D120: of:=FORMULA([.A120]) -> =LOOKUP(K50,L52,M49:M56)
A121: of:=LOOKUP([.K51];[.L52];[.M49:.M56]) ->  | B121: #N/A | C121: of:=ISERROR([.A121]) -> true | D121: of:=FORMULA([.A121]) -> =LOOKUP(K51,L52,M49:M56)
A122: of:=LOOKUP([.K52];[.L52];[.M49:.M56]) ->  | B122: #N/A | C122: of:=ISERROR([.A122]) -> true | D122: of:=FORMULA([.A122]) -> =LOOKUP(K52,L52,M49:M56)
A123: of:=LOOKUP([.K53];[.L52];[.M49:.M56]) ->  | B123: #N/A | C123: of:=ISERROR([.A123]) -> true | D123: of:=FORMULA([.A123]) -> =LOOKUP(K53,L52,M49:M56)
A124: of:=LOOKUP([.K54];[.L52];[.M49:.M56]) -> 0 | B124: 0 | C124: of:=[.A124]=[.B124] -> true | D124: of:=FORMULA([.A124]) -> =LOOKUP(K54,L52,M49:M56)
A125: of:=LOOKUP([.K55];[.L52];[.M49:.M56]) ->  | B125: #N/A | C125: of:=ISERROR([.A125]) -> true | D125: of:=FORMULA([.A125]) -> =LOOKUP(K55,L52,M49:M56)
A126: of:=LOOKUP([.K56];[.L52];[.M49:.M56]) ->  | B126: #N/A | C126: of:=ISERROR([.A126]) -> true | D126: of:=FORMULA([.A126]) -> =LOOKUP(K56,L52,M49:M56)
A127: of:=LOOKUP([.K57];[.L52];[.M49:.M56]) ->  | B127: #N/A | C127: of:=ISERROR([.A127]) -> true | D127: of:=FORMULA([.A127]) -> =LOOKUP(K57,L52,M49:M56)
A128: of:=LOOKUP([.K58];[.L52];[.M49:.M56]) ->  | B128: #N/A | C128: of:=ISERROR([.A128]) -> true | D128: of:=FORMULA([.A128]) -> =LOOKUP(K58,L52,M49:M56)
A129: of:=LOOKUP([.K49];[.L56];[.M49:.M56]) ->  | B129: #N/A | C129: of:=ISERROR([.A129]) -> true | D129: of:=FORMULA([.A129]) -> =LOOKUP(K49,L56,M49:M56)
A130: of:=LOOKUP([.K50];[.L56];[.M49:.M56]) ->  | B130: #N/A | C130: of:=ISERROR([.A130]) -> true | D130: of:=FORMULA([.A130]) -> =LOOKUP(K50,L56,M49:M56)
A131: of:=LOOKUP([.K51];[.L56];[.M49:.M56]) ->  | B131: #N/A | C131: of:=ISERROR([.A131]) -> true | D131: of:=FORMULA([.A131]) -> =LOOKUP(K51,L56,M49:M56)
A132: of:=LOOKUP([.K52];[.L56];[.M49:.M56]) ->  | B132: #N/A | C132: of:=ISERROR([.A132]) -> true | D132: of:=FORMULA([.A132]) -> =LOOKUP(K52,L56,M49:M56)
A133: of:=LOOKUP([.K53];[.L56];[.M49:.M56]) ->  | B133: #N/A | C133: of:=ISERROR([.A133]) -> true | D133: of:=FORMULA([.A133]) -> =LOOKUP(K53,L56,M49:M56)
A134: of:=LOOKUP([.K54];[.L56];[.M49:.M56]) ->  | B134: #N/A | C134: of:=ISERROR([.A134]) -> true | D134: of:=FORMULA([.A134]) -> =LOOKUP(K54,L56,M49:M56)
A135: of:=LOOKUP([.K55];[.L56];[.M49:.M56]) ->  | B135: #N/A | C135: of:=ISERROR([.A135]) -> true | D135: of:=FORMULA([.A135]) -> =LOOKUP(K55,L56,M49:M56)
A136: of:=LOOKUP([.K56];[.L56];[.M49:.M56]) ->  | B136: #N/A | C136: of:=ISERROR([.A136]) -> true | D136: of:=FORMULA([.A136]) -> =LOOKUP(K56,L56,M49:M56)
A137: of:=LOOKUP([.K57];[.L56];[.M49:.M56]) ->  | B137: #N/A | C137: of:=ISERROR([.A137]) -> true | D137: of:=FORMULA([.A137]) -> =LOOKUP(K57,L56,M49:M56)
A138: of:=LOOKUP([.K58];[.L56];[.M49:.M56]) -> 0 | B138: 0 | C138: of:=[.A138]=[.B138] -> true | D138: of:=FORMULA([.A138]) -> =LOOKUP(K58,L56,M49:M56)
A139: of:=LOOKUP([.K49];[.L55];[.M49:.M56]) ->  | B139: #N/A | C139: of:=ISERROR([.A139]) -> true | D139: of:=FORMULA([.A139]) -> =LOOKUP(K49,L55,M49:M56)
A140: of:=LOOKUP([.K50];[.L55];[.M49:.M56]) ->  | B140: #N/A | C140: of:=ISERROR([.A140]) -> true | D140: of:=FORMULA([.A140]) -> =LOOKUP(K50,L55,M49:M56)
A141: of:=LOOKUP([.K51];[.L55];[.M49:.M56]) ->  | B141: #N/A | C141: of:=ISERROR([.A141]) -> true | D141: of:=FORMULA([.A141]) -> =LOOKUP(K51,L55,M49:M56)
A142: of:=LOOKUP([.K52];[.L55];[.M49:.M56]) ->  | B142: #N/A | C142: of:=ISERROR([.A142]) -> true | D142: of:=FORMULA([.A142]) -> =LOOKUP(K52,L55,M49:M56)
A143: of:=LOOKUP([.K53];[.L55];[.M49:.M56]) ->  | B143: #N/A | C143: of:=ISERROR([.A143]) -> true | D143: of:=FORMULA([.A143]) -> =LOOKUP(K53,L55,M49:M56)
A144: of:=LOOKUP([.K54];[.L55];[.M49:.M56]) ->  | B144: #N/A | C144: of:=ISERROR([.A144]) -> true | D144: of:=FORMULA([.A144]) -> =LOOKUP(K54,L55,M49:M56)
A145: of:=LOOKUP([.K55];[.L55];[.M49:.M56]) ->  | B145: #N/A | C145: of:=ISERROR([.A145]) -> true | D145: of:=FORMULA([.A145]) -> =LOOKUP(K55,L55,M49:M56)
A146: of:=LOOKUP([.K56];[.L55];[.M49:.M56]) ->  | B146: #N/A | C146: of:=ISERROR([.A146]) -> true | D146: of:=FORMULA([.A146]) -> =LOOKUP(K56,L55,M49:M56)
A147: of:=LOOKUP([.K57];[.L55];[.M49:.M56]) ->  | B147: #N/A | C147: of:=ISERROR([.A147]) -> true | D147: of:=FORMULA([.A147]) -> =LOOKUP(K57,L55,M49:M56)
A148: of:=LOOKUP([.K58];[.L55];[.M49:.M56]) -> 0 | B148: 0 | C148: of:=[.A148]=[.B148] -> true | D148: of:=FORMULA([.A148]) -> =LOOKUP(K58,L55,M49:M56)
A149: of:=LOOKUP([.K49];[.L54];[.M49:.M56]) ->  | B149: #N/A | C149: of:=ISERROR([.A149]) -> true | D149: of:=FORMULA([.A149]) -> =LOOKUP(K49,L54,M49:M56)
A150: of:=LOOKUP([.K50];[.L54];[.M49:.M56]) ->  | B150: #N/A | C150: of:=ISERROR([.A150]) -> true | D150: of:=FORMULA([.A150]) -> =LOOKUP(K50,L54,M49:M56)
A151: of:=LOOKUP([.K51];[.L54];[.M49:.M56]) ->  | B151: #N/A | C151: of:=ISERROR([.A151]) -> true | D151: of:=FORMULA([.A151]) -> =LOOKUP(K51,L54,M49:M56)
A152: of:=LOOKUP([.K52];[.L54];[.M49:.M56]) ->  | B152: #N/A | C152: of:=ISERROR([.A152]) -> true | D152: of:=FORMULA([.A152]) -> =LOOKUP(K52,L54,M49:M56)
A153: of:=LOOKUP([.K53];[.L54];[.M49:.M56]) ->  | B153: #N/A | C153: of:=ISERROR([.A153]) -> true | D153: of:=FORMULA([.A153]) -> =LOOKUP(K53,L54,M49:M56)
A154: of:=LOOKUP([.K54];[.L54];[.M49:.M56]) ->  | B154: #N/A | C154: of:=ISERROR([.A154]) -> true | D154: of:=FORMULA([.A154]) -> =LOOKUP(K54,L54,M49:M56)
A155: of:=LOOKUP([.K55];[.L54];[.M49:.M56]) ->  | B155: #N/A | C155: of:=ISERROR([.A155]) -> true | D155: of:=FORMULA([.A155]) -> =LOOKUP(K55,L54,M49:M56)
A156: of:=LOOKUP([.K56];[.L54];[.M49:.M56]) ->  | B156: #N/A | C156: of:=ISERROR([.A156]) -> true | D156: of:=FORMULA([.A156]) -> =LOOKUP(K56,L54,M49:M56)
A157: of:=LOOKUP([.K57];[.L54];[.M49:.M56]) -> 0 | B157: 0 | C157: of:=[.A157]=[.B157] -> true | D157: of:=FORMULA([.A157]) -> =LOOKUP(K57,L54,M49:M56)
A158: of:=LOOKUP([.K58];[.L54];[.M49:.M56]) -> 0 | B158: 0 | C158: of:=[.A158]=[.B158] -> true | D158: of:=FORMULA([.A158]) -> =LOOKUP(K58,L54,M49:M56)
A159: of:=LOOKUP([.K49];[.L53];[.M49:.M56]) ->  | B159: #N/A | C159: of:=ISERROR([.A159]) -> true | D159: of:=FORMULA([.A159]) -> =LOOKUP(K49,L53,M49:M56)
A160: of:=LOOKUP([.K50];[.L53];[.M49:.M56]) ->  | B160: #N/A | C160: of:=ISERROR([.A160]) -> true | D160: of:=FORMULA([.A160]) -> =LOOKUP(K50,L53,M49:M56)
A161: of:=LOOKUP([.K51];[.L53];[.M49:.M56]) ->  | B161: #N/A | C161: of:=ISERROR([.A161]) -> true | D161: of:=FORMULA([.A161]) -> =LOOKUP(K51,L53,M49:M56)
A162: of:=LOOKUP([.K52];[.L53];[.M49:.M56]) ->  | B162: #N/A | C162: of:=ISERROR([.A162]) -> true | D162: of:=FORMULA([.A162]) -> =LOOKUP(K52,L53,M49:M56)
A163: of:=LOOKUP([.K53];[.L53];[.M49:.M56]) ->  | B163: #N/A | C163: of:=ISERROR([.A163]) -> true | D163: of:=FORMULA([.A163]) -> =LOOKUP(K53,L53,M49:M56)
A164: of:=LOOKUP([.K54];[.L53];[.M49:.M56]) ->  | B164: #N/A | C164: of:=ISERROR([.A164]) -> true | D164: of:=FORMULA([.A164]) -> =LOOKUP(K54,L53,M49:M56)
A165: of:=LOOKUP([.K55];[.L53];[.M49:.M56]) ->  | B165: #N/A | C165: of:=ISERROR([.A165]) -> true | D165: of:=FORMULA([.A165]) -> =LOOKUP(K55,L53,M49:M56)
A166: of:=LOOKUP([.K56];[.L53];[.M49:.M56]) -> 0 | B166: 0 | C166: of:=[.A166]=[.B166] -> true | D166: of:=FORMULA([.A166]) -> =LOOKUP(K56,L53,M49:M56)
A167: of:=LOOKUP([.K57];[.L53];[.M49:.M56]) -> 0 | B167: 0 | C167: of:=[.A167]=[.B167] -> true | D167: of:=FORMULA([.A167]) -> =LOOKUP(K57,L53,M49:M56)
A168: of:=LOOKUP([.K58];[.L53];[.M49:.M56]) -> 0 | B168: 0 | C168: of:=[.A168]=[.B168] -> true | D168: of:=FORMULA([.A168]) -> =LOOKUP(K58,L53,M49:M56)
A169: of:=LOOKUP([.K73];[.L73:.L81];[.M73:.M81]) ->  | B169: #N/A | C169: of:=ISERROR([.A169]) -> true | D169: of:=FORMULA([.A169]) -> =LOOKUP(K73,L73:L81,M73:M81)
A170: of:=LOOKUP([.K74];[.L73:.L81];[.M73:.M81]) ->  | B170: #N/A | C170: of:=ISERROR([.A170]) -> true | D170: of:=FORMULA([.A170]) -> =LOOKUP(K74,L73:L81,M73:M81)
A171: of:=LOOKUP([.K75];[.L73:.L81];[.M73:.M81]) ->  | B171: #N/A | C171: of:=ISERROR([.A171]) -> true | D171: of:=FORMULA([.A171]) -> =LOOKUP(K75,L73:L81,M73:M81)
A172: of:=LOOKUP([.K76];[.L73:.L81];[.M73:.M81]) -> eight | B172: eight | C172: of:=[.A172]=[.B172] -> true | D172: of:=FORMULA([.A172]) -> =LOOKUP(K76,L73:L81,M73:M81)
A173: of:=LOOKUP([.K77];[.L73:.L81];[.M73:.M81]) -> eight | B173: eight | C173: of:=[.A173]=[.B173] -> true | D173: of:=FORMULA([.A173]) -> =LOOKUP(K77,L73:L81,M73:M81)
A174: of:=LOOKUP([.K78];[.L73:.L81];[.M73:.M81]) -> eight | B174: eight | C174: of:=[.A174]=[.B174] -> true | D174: of:=FORMULA([.A174]) -> =LOOKUP(K78,L73:L81,M73:M81)
A175: of:=LOOKUP([.K79];[.L73:.L81];[.M73:.M81]) ->  | B175: #N/A | C175: of:=ISERROR([.A175]) -> true | D175: of:=FORMULA([.A175]) -> =LOOKUP(K79,L73:L81,M73:M81)
A176: of:=LOOKUP([.K80];[.L73:.L81];[.M73:.M81]) ->  | B176: #N/A | C176: of:=ISERROR([.A176]) -> true | D176: of:=FORMULA([.A176]) -> =LOOKUP(K80,L73:L81,M73:M81)
A177: of:=LOOKUP([.K81];[.L73:.L81];[.M73:.M81]) ->  | B177: #N/A | C177: of:=ISERROR([.A177]) -> true | D177: of:=FORMULA([.A177]) -> =LOOKUP(K81,L73:L81,M73:M81)
A178: of:=LOOKUP([.K73];[.Q73:.Q81];[.M73:.M81]) ->  | B178: #N/A | C178: of:=ISERROR([.A178]) -> true | D178: of:=FORMULA([.A178]) -> =LOOKUP(K73,Q73:Q81,M73:M81)
A179: of:=LOOKUP([.K74];[.Q73:.Q81];[.M73:.M81]) ->  | B179: #N/A | C179: of:=ISERROR([.A179]) -> true | D179: of:=FORMULA([.A179]) -> =LOOKUP(K74,Q73:Q81,M73:M81)
A180: of:=LOOKUP([.K75];[.Q73:.Q81];[.M73:.M81]) ->  | B180: #N/A | C180: of:=ISERROR([.A180]) -> true | D180: of:=FORMULA([.A180]) -> =LOOKUP(K75,Q73:Q81,M73:M81)
A181: of:=LOOKUP([.K76];[.Q73:.Q81];[.M73:.M81]) ->  | B181: #N/A | C181: of:=ISERROR([.A181]) -> true | D181: of:=FORMULA([.A181]) -> =LOOKUP(K76,Q73:Q81,M73:M81)
A182: of:=LOOKUP([.K77];[.Q73:.Q81];[.M73:.M81]) ->  | B182: #N/A | C182: of:=ISERROR([.A182]) -> true | D182: of:=FORMULA([.A182]) -> =LOOKUP(K77,Q73:Q81,M73:M81)
A183: of:=LOOKUP([.K78];[.Q73:.Q81];[.M73:.M81]) ->  | B183: #N/A | C183: of:=ISERROR([.A183]) -> true | D183: of:=FORMULA([.A183]) -> =LOOKUP(K78,Q73:Q81,M73:M81)
A184: of:=LOOKUP([.K79];[.Q73:.Q81];[.M73:.M81]) ->  | B184: #N/A | C184: of:=ISERROR([.A184]) -> true | D184: of:=FORMULA([.A184]) -> =LOOKUP(K79,Q73:Q81,M73:M81)
A185: of:=LOOKUP([.K80];[.Q73:.Q81];[.M73:.M81]) ->  | B185: #N/A | C185: of:=ISERROR([.A185]) -> true | D185: of:=FORMULA([.A185]) -> =LOOKUP(K80,Q73:Q81,M73:M81)
A186: of:=LOOKUP([.K81];[.Q73:.Q81];[.M73:.M81]) -> eight | B186: eight | C186: of:=[.A186]=[.B186] -> true | D186: of:=FORMULA([.A186]) -> =LOOKUP(K81,Q73:Q81,M73:M81)
A187: of:=LOOKUP([.L187];[.I187:.I212]) -> A | B187: A | C187: of:=[.A187]=[.B187] -> true | D187: of:=FORMULA([.A187]) -> =LOOKUP(L187,I187:I212) | I187: A | J187: Andy | L187: A
A188: of:=LOOKUP([.L188];[.I187:.I212]) -> B | B188: B | C188: of:=[.A188]=[.B188] -> true | D188: of:=FORMULA([.A188]) -> =LOOKUP(L188,I187:I212) | I188: B | J188: Bruce | L188: B
A189: of:=LOOKUP([.L189];[.I187:.I212]) -> C | B189: C | C189: of:=[.A189]=[.B189] -> true | D189: of:=FORMULA([.A189]) -> =LOOKUP(L189,I187:I212) | I189: C | J189: Charlie | L189: C
A190: of:=LOOKUP([.L190];[.I187:.I212]) -> D | B190: D | C190: of:=[.A190]=[.B190] -> true | D190: of:=FORMULA([.A190]) -> =LOOKUP(L190,I187:I212) | I190: D | J190: David | L190: D
A191: of:=LOOKUP([.L$191];[.I187:.I212]) -> E | B191: E | C191: of:=[.A191]=[.B191] -> true | D191: of:=FORMULA([.A191]) -> =LOOKUP(L$191,I187:I212) | I191: E | J191: Edward | L191: E
A192: of:=LOOKUP([.L192];[.I187:.I212]) -> F | B192: F | C192: of:=[.A192]=[.B192] -> true | D192: of:=FORMULA([.A192]) -> =LOOKUP(L192,I187:I212) | I192: F | J192: Frank | L192: F
A193: of:=LOOKUP([.L$193];[.I187:.I212]) -> G | B193: G | C193: of:=[.A193]=[.B193] -> true | D193: of:=FORMULA([.A193]) -> =LOOKUP(L$193,I187:I212) | I193: G | J193: George | L193: G
A194: of:=LOOKUP([.L194];[.I187:.I212]) -> H | B194: H | C194: of:=[.A194]=[.B194] -> true | D194: of:=FORMULA([.A194]) -> =LOOKUP(L194,I187:I212) | I194: H | J194: Henry | L194: H
A195: of:=LOOKUP([.L195];[.I187:.I212]) -> I | B195: I | C195: of:=[.A195]=[.B195] -> true | D195: of:=FORMULA([.A195]) -> =LOOKUP(L195,I187:I212) | I195: I | J195: Ira | L195: I
A196: of:=LOOKUP([.L196];[.I187:.I212]) -> J | B196: J | C196: of:=[.A196]=[.B196] -> true | D196: of:=FORMULA([.A196]) -> =LOOKUP(L196,I187:I212) | I196: J | J196: Jamie | L196: J
A197: of:=LOOKUP([.L197];[.I187:.I212]) -> K | B197: K | C197: of:=[.A197]=[.B197] -> true | D197: of:=FORMULA([.A197]) -> =LOOKUP(L197,I187:I212) | I197: K | J197: Kevin | L197: K
A198: of:=LOOKUP([.L198];[.I187:.I212]) -> L | B198: L | C198: of:=[.A198]=[.B198] -> true | D198: of:=FORMULA([.A198]) -> =LOOKUP(L198,I187:I212) | I198: L | J198: Leonard | L198: L
A199: of:=LOOKUP([.L199];[.I187:.I212]) -> M | B199: M | C199: of:=[.A199]=[.B199] -> true | D199: of:=FORMULA([.A199]) -> =LOOKUP(L199,I187:I212) | I199: M | J199: Michael | L199: M
A200: of:=LOOKUP([.L200];[.I187:.I212]) -> N | B200: N | C200: of:=[.A200]=[.B200] -> true | D200: of:=FORMULA([.A200]) -> =LOOKUP(L200,I187:I212) | I200: N | J200: Noel | L200: N
A201: of:=LOOKUP([.L201];[.I187:.I212]) -> O | B201: O | C201: of:=[.A201]=[.B201] -> true | D201: of:=FORMULA([.A201]) -> =LOOKUP(L201,I187:I212) | I201: O | J201: Oliver | L201: O
A202: of:=LOOKUP([.L202];[.I187:.I212]) -> P | B202: P | C202: of:=[.A202]=[.B202] -> true | D202: of:=FORMULA([.A202]) -> =LOOKUP(L202,I187:I212) | I202: P | J202: Peter | L202: P
A203: of:=LOOKUP([.L203];[.I187:.I212]) -> Q | B203: Q | C203: of:=[.A203]=[.B203] -> true | D203: of:=FORMULA([.A203]) -> =LOOKUP(L203,I187:I212) | I203: Q | J203: Quincy | L203: Q
A204: of:=LOOKUP([.L204];[.I187:.I212]) -> R | B204: R | C204: of:=[.A204]=[.B204] -> true | D204: of:=FORMULA([.A204]) -> =LOOKUP(L204,I187:I212) | I204: R | J204: Rachel | L204: R
A205: of:=LOOKUP([.L205];[.I187:.I212]) -> S | B205: S | C205: of:=[.A205]=[.B205] -> true | D205: of:=FORMULA([.A205]) -> =LOOKUP(L205,I187:I212) | I205: S | J205: Stuart | L205: S
A206: of:=LOOKUP([.L206];[.I187:.I212]) -> T | B206: T | C206: of:=[.A206]=[.B206] -> true | D206: of:=FORMULA([.A206]) -> =LOOKUP(L206,I187:I212) | I206: T | J206: Tom | L206: T
A207: of:=LOOKUP([.L207];[.I187:.I212]) -> U | B207: U | C207: of:=[.A207]=[.B207] -> true | D207: of:=FORMULA([.A207]) -> =LOOKUP(L207,I187:I212) | I207: U | J207: Uma | L207: U
A208: of:=LOOKUP([.L208];[.I187:.I212]) -> V | B208: V | C208: of:=[.A208]=[.B208] -> true | D208: of:=FORMULA([.A208]) -> =LOOKUP(L208,I187:I212) | I208: V | J208: Victor | L208: V
A209: of:=LOOKUP([.L209];[.I187:.I212]) -> W | B209: W | C209: of:=[.A209]=[.B209] -> true | D209: of:=FORMULA([.A209]) -> =LOOKUP(L209,I187:I212) | I209: W | J209: Wesley | L209: W
A210: of:=LOOKUP([.L210];[.I187:.I212]) -> X | B210: X | C210: of:=[.A210]=[.B210] -> true | D210: of:=FORMULA([.A210]) -> =LOOKUP(L210,I187:I212) | I210: X | J210: Xander | L210: X
A211: of:=LOOKUP([.L211];[.I187:.I212]) -> Y | B211: Y | C211: of:=[.A211]=[.B211] -> true | D211: of:=FORMULA([.A211]) -> =LOOKUP(L211,I187:I212) | I211: Y | J211: Yoko | L211: Y
A212: of:=LOOKUP([.L212];[.I187:.I212]) -> Z | B212: Z | C212: of:=[.A212]=[.B212] -> true | D212: of:=FORMULA([.A212]) -> =LOOKUP(L212,I187:I212) | I212: Z | J212: Zebulon | L212: Z
A213: of:=LOOKUP([.L187];[.I187:.J212]) -> Andy | B213: Andy | C213: of:=[.A213]=[.B213] -> true | D213: of:=FORMULA([.A213]) -> =LOOKUP(L187,I187:J212)
A214: of:=LOOKUP([.L188];[.I187:.J212]) -> Bruce | B214: Bruce | C214: of:=[.A214]=[.B214] -> true | D214: of:=FORMULA([.A214]) -> =LOOKUP(L188,I187:J212)
A215: of:=LOOKUP([.L189];[.I187:.J212]) -> Charlie | B215: Charlie | C215: of:=[.A215]=[.B215] -> true | D215: of:=FORMULA([.A215]) -> =LOOKUP(L189,I187:J212)
A216: of:=LOOKUP([.L190];[.I187:.J212]) -> David | B216: David | C216: of:=[.A216]=[.B216] -> true | D216: of:=FORMULA([.A216]) -> =LOOKUP(L190,I187:J212)
A217: of:=LOOKUP([.L$191];[.I187:.J212]) -> Edward | B217: Edward | C217: of:=[.A217]=[.B217] -> true | D217: of:=FORMULA([.A217]) -> =LOOKUP(L$191,I187:J212)
A218: of:=LOOKUP([.L192];[.I187:.J212]) -> Frank | B218: Frank | C218: of:=[.A218]=[.B218] -> true | D218: of:=FORMULA([.A218]) -> =LOOKUP(L192,I187:J212)
A219: of:=LOOKUP([.L193];[.I187:.J212]) -> George | B219: George | C219: of:=[.A219]=[.B219] -> true | D219: of:=FORMULA([.A219]) -> =LOOKUP(L193,I187:J212)
A220: of:=LOOKUP([.L194];[.I187:.J212]) -> Henry | B220: Henry | C220: of:=[.A220]=[.B220] -> true | D220: of:=FORMULA([.A220]) -> =LOOKUP(L194,I187:J212)
A221: of:=LOOKUP([.L195];[.I187:.J212]) -> Ira | B221: Ira | C221: of:=[.A221]=[.B221] -> true | D221: of:=FORMULA([.A221]) -> =LOOKUP(L195,I187:J212)
A222: of:=LOOKUP([.L196];[.I187:.J212]) -> Jamie | B222: Jamie | C222: of:=[.A222]=[.B222] -> true | D222: of:=FORMULA([.A222]) -> =LOOKUP(L196,I187:J212)
A223: of:=LOOKUP([.L197];[.I187:.J212]) -> Kevin | B223: Kevin | C223: of:=[.A223]=[.B223] -> true | D223: of:=FORMULA([.A223]) -> =LOOKUP(L197,I187:J212)
A224: of:=LOOKUP([.L198];[.I187:.J212]) -> Leonard | B224: Leonard | C224: of:=[.A224]=[.B224] -> true | D224: of:=FORMULA([.A224]) -> =LOOKUP(L198,I187:J212)
A225: of:=LOOKUP([.L199];[.I187:.J212]) -> Michael | B225: Michael | C225: of:=[.A225]=[.B225] -> true | D225: of:=FORMULA([.A225]) -> =LOOKUP(L199,I187:J212)
A226: of:=LOOKUP([.L200];[.I187:.J212]) -> Noel | B226: Noel | C226: of:=[.A226]=[.B226] -> true | D226: of:=FORMULA([.A226]) -> =LOOKUP(L200,I187:J212)
A227: of:=LOOKUP([.L201];[.I187:.J212]) -> Oliver | B227: Oliver | C227: of:=[.A227]=[.B227] -> true | D227: of:=FORMULA([.A227]) -> =LOOKUP(L201,I187:J212)
A228: of:=LOOKUP([.L202];[.I187:.J212]) -> Peter | B228: Peter | C228: of:=[.A228]=[.B228] -> true | D228: of:=FORMULA([.A228]) -> =LOOKUP(L202,I187:J212)
A229: of:=LOOKUP([.L203];[.I187:.J212]) -> Quincy | B229: Quincy | C229: of:=[.A229]=[.B229] -> true | D229: of:=FORMULA([.A229]) -> =LOOKUP(L203,I187:J212)
A230: of:=LOOKUP([.L204];[.I187:.J212]) -> Rachel | B230: Rachel | C230: of:=[.A230]=[.B230] -> true | D230: of:=FORMULA([.A230]) -> =LOOKUP(L204,I187:J212)
A231: of:=LOOKUP([.L205];[.I187:.J212]) -> Stuart | B231: Stuart | C231: of:=[.A231]=[.B231] -> true | D231: of:=FORMULA([.A231]) -> =LOOKUP(L205,I187:J212)
A232: of:=LOOKUP([.L206];[.I187:.J212]) -> Tom | B232: Tom | C232: of:=[.A232]=[.B232] -> true | D232: of:=FORMULA([.A232]) -> =LOOKUP(L206,I187:J212)
A233: of:=LOOKUP([.L207];[.I187:.J212]) -> Uma | B233: Uma | C233: of:=[.A233]=[.B233] -> true | D233: of:=FORMULA([.A233]) -> =LOOKUP(L207,I187:J212)
A234: of:=LOOKUP([.L208];[.I187:.J212]) -> Victor | B234: Victor | C234: of:=[.A234]=[.B234] -> true | D234: of:=FORMULA([.A234]) -> =LOOKUP(L208,I187:J212)
A235: of:=LOOKUP([.L209];[.I187:.J212]) -> Wesley | B235: Wesley | C235: of:=[.A235]=[.B235] -> true | D235: of:=FORMULA([.A235]) -> =LOOKUP(L209,I187:J212)
A236: of:=LOOKUP([.L210];[.I187:.J212]) -> Xander | B236: Xander | C236: of:=[.A236]=[.B236] -> true | D236: of:=FORMULA([.A236]) -> =LOOKUP(L210,I187:J212)
A237: of:=LOOKUP([.L211];[.I187:.J212]) -> Yoko | B237: Yoko | C237: of:=[.A237]=[.B237] -> true | D237: of:=FORMULA([.A237]) -> =LOOKUP(L211,I187:J212)
A238: of:=LOOKUP([.L212];[.I187:.J212]) -> Zebulon | B238: Zebulon | C238: of:=[.A238]=[.B238] -> true | D238: of:=FORMULA([.A238]) -> =LOOKUP(L212,I187:J212)
A239: of:=LOOKUP([.L187];[.I187:.I212];[.J187:.J212]) -> Andy | B239: Andy | C239: of:=[.A239]=[.B239] -> true | D239: of:=FORMULA([.A239]) -> =LOOKUP(L187,I187:I212,J187:J212)
A240: of:=LOOKUP([.L188];[.I187:.I212];[.J187:.J212]) -> Bruce | B240: Bruce | C240: of:=[.A240]=[.B240] -> true | D240: of:=FORMULA([.A240]) -> =LOOKUP(L188,I187:I212,J187:J212)
A241: of:=LOOKUP([.L189];[.I187:.I212];[.J187:.J212]) -> Charlie | B241: Charlie | C241: of:=[.A241]=[.B241] -> true | D241: of:=FORMULA([.A241]) -> =LOOKUP(L189,I187:I212,J187:J212)
A242: of:=LOOKUP([.L190];[.I187:.I212];[.J187:.J212]) -> David | B242: David | C242: of:=[.A242]=[.B242] -> true | D242: of:=FORMULA([.A242]) -> =LOOKUP(L190,I187:I212,J187:J212)
A243: of:=LOOKUP([.L191];[.I187:.I212];[.J187:.J212]) -> Edward | B243: Edward | C243: of:=[.A243]=[.B243] -> true | D243: of:=FORMULA([.A243]) -> =LOOKUP(L191,I187:I212,J187:J212)
A244: of:=LOOKUP([.L192];[.I187:.I212];[.J187:.J212]) -> Frank | B244: Frank | C244: of:=[.A244]=[.B244] -> true | D244: of:=FORMULA([.A244]) -> =LOOKUP(L192,I187:I212,J187:J212)
A245: of:=LOOKUP([.L193];[.I187:.I212];[.J187:.J212]) -> George | B245: George | C245: of:=[.A245]=[.B245] -> true | D245: of:=FORMULA([.A245]) -> =LOOKUP(L193,I187:I212,J187:J212)
A246: of:=LOOKUP([.L194];[.I187:.I212];[.J187:.J212]) -> Henry | B246: Henry | C246: of:=[.A246]=[.B246] -> true | D246: of:=FORMULA([.A246]) -> =LOOKUP(L194,I187:I212,J187:J212)
A247: of:=LOOKUP([.L195];[.I187:.I212];[.J187:.J212]) -> Ira | B247: Ira | C247: of:=[.A247]=[.B247] -> true | D247: of:=FORMULA([.A247]) -> =LOOKUP(L195,I187:I212,J187:J212)
A248: of:=LOOKUP([.L196];[.I187:.I212];[.J187:.J212]) -> Jamie | B248: Jamie | C248: of:=[.A248]=[.B248] -> true | D248: of:=FORMULA([.A248]) -> =LOOKUP(L196,I187:I212,J187:J212)
A249: of:=LOOKUP([.L197];[.I187:.I212];[.J187:.J212]) -> Kevin | B249: Kevin | C249: of:=[.A249]=[.B249] -> true | D249: of:=FORMULA([.A249]) -> =LOOKUP(L197,I187:I212,J187:J212)
A250: of:=LOOKUP([.L198];[.I187:.I212];[.J187:.J212]) -> Leonard | B250: Leonard | C250: of:=[.A250]=[.B250] -> true | D250: of:=FORMULA([.A250]) -> =LOOKUP(L198,I187:I212,J187:J212)
A251: of:=LOOKUP([.L199];[.I187:.I212];[.J187:.J212]) -> Michael | B251: Michael | C251: of:=[.A251]=[.B251] -> true | D251: of:=FORMULA([.A251]) -> =LOOKUP(L199,I187:I212,J187:J212)
A252: of:=LOOKUP([.L200];[.I187:.I212];[.J187:.J212]) -> Noel | B252: Noel | C252: of:=[.A252]=[.B252] -> true | D252: of:=FORMULA([.A252]) -> =LOOKUP(L200,I187:I212,J187:J212)
A253: of:=LOOKUP([.L201];[.I187:.I212];[.J187:.J212]) -> Oliver | B253: Oliver | C253: of:=[.A253]=[.B253] -> true | D253: of:=FORMULA([.A253]) -> =LOOKUP(L201,I187:I212,J187:J212)
A254: of:=LOOKUP([.L202];[.I187:.I212];[.J187:.J212]) -> Peter | B254: Peter | C254: of:=[.A254]=[.B254] -> true | D254: of:=FORMULA([.A254]) -> =LOOKUP(L202,I187:I212,J187:J212)
A255: of:=LOOKUP([.L203];[.I187:.I212];[.J187:.J212]) -> Quincy | B255: Quincy | C255: of:=[.A255]=[.B255] -> true | D255: of:=FORMULA([.A255]) -> =LOOKUP(L203,I187:I212,J187:J212)
A256: of:=LOOKUP([.L204];[.I187:.I212];[.J187:.J212]) -> Rachel | B256: Rachel | C256: of:=[.A256]=[.B256] -> true | D256: of:=FORMULA([.A256]) -> =LOOKUP(L204,I187:I212,J187:J212)
A257: of:=LOOKUP([.L205];[.I187:.I212];[.J187:.J212]) -> Stuart | B257: Stuart | C257: of:=[.A257]=[.B257] -> true | D257: of:=FORMULA([.A257]) -> =LOOKUP(L205,I187:I212,J187:J212)
A258: of:=LOOKUP([.L206];[.I187:.I212];[.J187:.J212]) -> Tom | B258: Tom | C258: of:=[.A258]=[.B258] -> true | D258: of:=FORMULA([.A258]) -> =LOOKUP(L206,I187:I212,J187:J212)
A259: of:=LOOKUP([.L207];[.I187:.I212];[.J187:.J212]) -> Uma | B259: Uma | C259: of:=[.A259]=[.B259] -> true | D259: of:=FORMULA([.A259]) -> =LOOKUP(L207,I187:I212,J187:J212)
A260: of:=LOOKUP([.L208];[.I187:.I212];[.J187:.J212]) -> Victor | B260: Victor | C260: of:=[.A260]=[.B260] -> true | D260: of:=FORMULA([.A260]) -> =LOOKUP(L208,I187:I212,J187:J212)
A261: of:=LOOKUP([.L209];[.I187:.I212];[.J187:.J212]) -> Wesley | B261: Wesley | C261: of:=[.A261]=[.B261] -> true | D261: of:=FORMULA([.A261]) -> =LOOKUP(L209,I187:I212,J187:J212)
A262: of:=LOOKUP([.L210];[.I187:.I212];[.J187:.J212]) -> Xander | B262: Xander | C262: of:=[.A262]=[.B262] -> true | D262: of:=FORMULA([.A262]) -> =LOOKUP(L210,I187:I212,J187:J212)
A263: of:=LOOKUP([.L211];[.I187:.I212];[.J187:.J212]) -> Yoko | B263: Yoko | C263: of:=[.A263]=[.B263] -> true | D263: of:=FORMULA([.A263]) -> =LOOKUP(L211,I187:I212,J187:J212)
A264: of:=LOOKUP([.L212];[.I187:.I212];[.J187:.J212]) -> Zebulon | B264: Zebulon | C264: of:=[.A264]=[.B264] -> true | D264: of:=FORMULA([.A264]) -> =LOOKUP(L212,I187:I212,J187:J212) | F264: Normal row ranges
A265: of:=LOOKUP([.I269];[.G265:.AF265]) -> A | B265: A | C265: of:=[.A265]=[.B265] -> true | D265: of:=FORMULA([.A265]) -> =LOOKUP(I269,G265:AF265) | F265: Name | G265: A | H265: B | I265: C | J265: D | K265: E | L265: F | M265: G | N265: H | O265: I | P265: J | Q265: K | R265: L | S265: M | T265: N | U265: O | V265: P | W265: Q | X265: R | Y265: S | Z265: T | AA265: U | AB265: V | AC265: W | AD265: X | AE265: Y | AF265: Z
A266: of:=LOOKUP([.I270];[.G265:.AF265]) -> B | B266: B | C266: of:=[.A266]=[.B266] -> true | D266: of:=FORMULA([.A266]) -> =LOOKUP(I270,G265:AF265) | F266: Value | G266: Andy | H266: Bruce | I266: Charlie | J266: David | K266: Edward | L266: Frank | M266: George | N266: Henry | O266: Ira | P266: Jamie | Q266: Kevin | R266: Leonard | S266: Michael | T266: Noel | U266: Oliver | V266: Peter | W266: Quincy | X266: Rachel | Y266: Stuart | Z266: Tom | AA266: Uma | AB266: Victor | AC266: Wesley | AD266: Xander | AE266: Yoko | AF266: Zebulon
A267: of:=LOOKUP([.I271];[.G265:.AF265]) -> C | B267: C | C267: of:=[.A267]=[.B267] -> true | D267: of:=FORMULA([.A267]) -> =LOOKUP(I271,G265:AF265)
A268: of:=LOOKUP([.I272];[.G265:.AF265]) -> D | B268: D | C268: of:=[.A268]=[.B268] -> true | D268: of:=FORMULA([.A268]) -> =LOOKUP(I272,G265:AF265) | I268: Formula
A269: of:=LOOKUP([.I273];[.G265:.AF265]) -> E | B269: E | C269: of:=[.A269]=[.B269] -> true | D269: of:=FORMULA([.A269]) -> =LOOKUP(I273,G265:AF265) | I269: A
A270: of:=LOOKUP([.I274];[.G265:.AF265]) -> F | B270: F | C270: of:=[.A270]=[.B270] -> true | D270: of:=FORMULA([.A270]) -> =LOOKUP(I274,G265:AF265) | I270: B
A271: of:=LOOKUP([.I275];[.G265:.AF265]) -> G | B271: G | C271: of:=[.A271]=[.B271] -> true | D271: of:=FORMULA([.A271]) -> =LOOKUP(I275,G265:AF265) | I271: C
A272: of:=LOOKUP([.I276];[.G265:.AF265]) -> H | B272: H | C272: of:=[.A272]=[.B272] -> true | D272: of:=FORMULA([.A272]) -> =LOOKUP(I276,G265:AF265) | I272: D
A273: of:=LOOKUP([.I277];[.G265:.AF265]) -> I | B273: I | C273: of:=[.A273]=[.B273] -> true | D273: of:=FORMULA([.A273]) -> =LOOKUP(I277,G265:AF265) | I273: E
A274: of:=LOOKUP([.I278];[.G265:.AF265]) -> J | B274: J | C274: of:=[.A274]=[.B274] -> true | D274: of:=FORMULA([.A274]) -> =LOOKUP(I278,G265:AF265) | I274: F
A275: of:=LOOKUP([.I279];[.G265:.AF265]) -> K | B275: K | C275: of:=[.A275]=[.B275] -> true | D275: of:=FORMULA([.A275]) -> =LOOKUP(I279,G265:AF265) | I275: G
A276: of:=LOOKUP([.I280];[.G265:.AF265]) -> L | B276: L | C276: of:=[.A276]=[.B276] -> true | D276: of:=FORMULA([.A276]) -> =LOOKUP(I280,G265:AF265) | I276: H
A277: of:=LOOKUP([.I281];[.G265:.AF265]) -> M | B277: M | C277: of:=[.A277]=[.B277] -> true | D277: of:=FORMULA([.A277]) -> =LOOKUP(I281,G265:AF265) | I277: I
A278: of:=LOOKUP([.I282];[.G265:.AF265]) -> N | B278: N | C278: of:=[.A278]=[.B278] -> true | D278: of:=FORMULA([.A278]) -> =LOOKUP(I282,G265:AF265) | I278: J
A279: of:=LOOKUP([.I283];[.G265:.AF265]) -> O | B279: O | C279: of:=[.A279]=[.B279] -> true | D279: of:=FORMULA([.A279]) -> =LOOKUP(I283,G265:AF265) | I279: K
A280: of:=LOOKUP([.I284];[.G265:.AF265]) -> P | B280: P | C280: of:=[.A280]=[.B280] -> true | D280: of:=FORMULA([.A280]) -> =LOOKUP(I284,G265:AF265) | I280: L
A281: of:=LOOKUP([.I285];[.G265:.AF265]) -> Q | B281: Q | C281: of:=[.A281]=[.B281] -> true | D281: of:=FORMULA([.A281]) -> =LOOKUP(I285,G265:AF265) | I281: M
A282: of:=LOOKUP([.I286];[.G265:.AF265]) -> R | B282: R | C282: of:=[.A282]=[.B282] -> true | D282: of:=FORMULA([.A282]) -> =LOOKUP(I286,G265:AF265) | I282: N
A283: of:=LOOKUP([.I287];[.G265:.AF265]) -> S | B283: S | C283: of:=[.A283]=[.B283] -> true | D283: of:=FORMULA([.A283]) -> =LOOKUP(I287,G265:AF265) | I283: O
A284: of:=LOOKUP([.I288];[.G265:.AF265]) -> T | B284: T | C284: of:=[.A284]=[.B284] -> true | D284: of:=FORMULA([.A284]) -> =LOOKUP(I288,G265:AF265) | I284: P
A285: of:=LOOKUP([.I289];[.G265:.AF265]) -> U | B285: U | C285: of:=[.A285]=[.B285] -> true | D285: of:=FORMULA([.A285]) -> =LOOKUP(I289,G265:AF265) | I285: Q
A286: of:=LOOKUP([.I290];[.G265:.AF265]) -> V | B286: V | C286: of:=[.A286]=[.B286] -> true | D286: of:=FORMULA([.A286]) -> =LOOKUP(I290,G265:AF265) | I286: R
A287: of:=LOOKUP([.I291];[.G265:.AF265]) -> W | B287: W | C287: of:=[.A287]=[.B287] -> true | D287: of:=FORMULA([.A287]) -> =LOOKUP(I291,G265:AF265) | I287: S
A288: of:=LOOKUP([.I292];[.G265:.AF265]) -> X | B288: X | C288: of:=[.A288]=[.B288] -> true | D288: of:=FORMULA([.A288]) -> =LOOKUP(I292,G265:AF265) | I288: T
A289: of:=LOOKUP([.I293];[.G265:.AF265]) -> Y | B289: Y | C289: of:=[.A289]=[.B289] -> true | D289: of:=FORMULA([.A289]) -> =LOOKUP(I293,G265:AF265) | I289: U
A290: of:=LOOKUP([.I294];[.G265:.AF265]) -> Z | B290: Z | C290: of:=[.A290]=[.B290] -> true | D290: of:=FORMULA([.A290]) -> =LOOKUP(I294,G265:AF265) | I290: V
A291: of:=LOOKUP([.I269];[.G265:.AF266]) -> Andy | B291: Andy | C291: of:=[.A291]=[.B291] -> true | D291: of:=FORMULA([.A291]) -> =LOOKUP(I269,G265:AF266) | I291: W
A292: of:=LOOKUP([.I270];[.G265:.AF266]) -> Bruce | B292: Bruce | C292: of:=[.A292]=[.B292] -> true | D292: of:=FORMULA([.A292]) -> =LOOKUP(I270,G265:AF266) | I292: X
A293: of:=LOOKUP([.I271];[.G265:.AF266]) -> Charlie | B293: Charlie | C293: of:=[.A293]=[.B293] -> true | D293: of:=FORMULA([.A293]) -> =LOOKUP(I271,G265:AF266) | I293: Y
A294: of:=LOOKUP([.I272];[.G265:.AF266]) -> David | B294: David | C294: of:=[.A294]=[.B294] -> true | D294: of:=FORMULA([.A294]) -> =LOOKUP(I272,G265:AF266) | I294: Z
A295: of:=LOOKUP([.I273];[.G265:.AF266]) -> Edward | B295: Edward | C295: of:=[.A295]=[.B295] -> true | D295: of:=FORMULA([.A295]) -> =LOOKUP(I273,G265:AF266)
A296: of:=LOOKUP([.I274];[.G265:.AF266]) -> Frank | B296: Frank | C296: of:=[.A296]=[.B296] -> true | D296: of:=FORMULA([.A296]) -> =LOOKUP(I274,G265:AF266)
A297: of:=LOOKUP([.I275];[.G265:.AF266]) -> George | B297: George | C297: of:=[.A297]=[.B297] -> true | D297: of:=FORMULA([.A297]) -> =LOOKUP(I275,G265:AF266)
A298: of:=LOOKUP([.I276];[.G265:.AF266]) -> Henry | B298: Henry | C298: of:=[.A298]=[.B298] -> true | D298: of:=FORMULA([.A298]) -> =LOOKUP(I276,G265:AF266)
A299: of:=LOOKUP([.I277];[.G265:.AF266]) -> Ira | B299: Ira | C299: of:=[.A299]=[.B299] -> true | D299: of:=FORMULA([.A299]) -> =LOOKUP(I277,G265:AF266)
A300: of:=LOOKUP([.I278];[.G265:.AF266]) -> Jamie | B300: Jamie | C300: of:=[.A300]=[.B300] -> true | D300: of:=FORMULA([.A300]) -> =LOOKUP(I278,G265:AF266)
A301: of:=LOOKUP([.I279];[.G265:.AF266]) -> Kevin | B301: Kevin | C301: of:=[.A301]=[.B301] -> true | D301: of:=FORMULA([.A301]) -> =LOOKUP(I279,G265:AF266)
A302: of:=LOOKUP([.I280];[.G265:.AF266]) -> Leonard | B302: Leonard | C302: of:=[.A302]=[.B302] -> true | D302: of:=FORMULA([.A302]) -> =LOOKUP(I280,G265:AF266)
A303: of:=LOOKUP([.I281];[.G265:.AF266]) -> Michael | B303: Michael | C303: of:=[.A303]=[.B303] -> true | D303: of:=FORMULA([.A303]) -> =LOOKUP(I281,G265:AF266)
A304: of:=LOOKUP([.I282];[.G265:.AF266]) -> Noel | B304: Noel | C304: of:=[.A304]=[.B304] -> true | D304: of:=FORMULA([.A304]) -> =LOOKUP(I282,G265:AF266)
A305: of:=LOOKUP([.I283];[.G265:.AF266]) -> Oliver | B305: Oliver | C305: of:=[.A305]=[.B305] -> true | D305: of:=FORMULA([.A305]) -> =LOOKUP(I283,G265:AF266)
A306: of:=LOOKUP([.I284];[.G265:.AF266]) -> Peter | B306: Peter | C306: of:=[.A306]=[.B306] -> true | D306: of:=FORMULA([.A306]) -> =LOOKUP(I284,G265:AF266)
A307: of:=LOOKUP([.I285];[.G265:.AF266]) -> Quincy | B307: Quincy | C307: of:=[.A307]=[.B307] -> true | D307: of:=FORMULA([.A307]) -> =LOOKUP(I285,G265:AF266)
A308: of:=LOOKUP([.I286];[.G265:.AF266]) -> Rachel | B308: Rachel | C308: of:=[.A308]=[.B308] -> true | D308: of:=FORMULA([.A308]) -> =LOOKUP(I286,G265:AF266)
A309: of:=LOOKUP([.I287];[.G265:.AF266]) -> Stuart | B309: Stuart | C309: of:=[.A309]=[.B309] -> true | D309: of:=FORMULA([.A309]) -> =LOOKUP(I287,G265:AF266)
A310: of:=LOOKUP([.I288];[.G265:.AF266]) -> Tom | B310: Tom | C310: of:=[.A310]=[.B310] -> true | D310: of:=FORMULA([.A310]) -> =LOOKUP(I288,G265:AF266)
A311: of:=LOOKUP([.I289];[.G265:.AF266]) -> Uma | B311: Uma | C311: of:=[.A311]=[.B311] -> true | D311: of:=FORMULA([.A311]) -> =LOOKUP(I289,G265:AF266)
A312: of:=LOOKUP([.I290];[.G265:.AF266]) -> Victor | B312: Victor | C312: of:=[.A312]=[.B312] -> true | D312: of:=FORMULA([.A312]) -> =LOOKUP(I290,G265:AF266)
A313: of:=LOOKUP([.I291];[.G265:.AF266]) -> Wesley | B313: Wesley | C313: of:=[.A313]=[.B313] -> true | D313: of:=FORMULA([.A313]) -> =LOOKUP(I291,G265:AF266)
A314: of:=LOOKUP([.I292];[.G265:.AF266]) -> Xander | B314: Xander | C314: of:=[.A314]=[.B314] -> true | D314: of:=FORMULA([.A314]) -> =LOOKUP(I292,G265:AF266)
A315: of:=LOOKUP([.I293];[.G265:.AF266]) -> Yoko | B315: Yoko | C315: of:=[.A315]=[.B315] -> true | D315: of:=FORMULA([.A315]) -> =LOOKUP(I293,G265:AF266)
A316: of:=LOOKUP([.I294];[.G265:.AF266]) -> Zebulon | B316: Zebulon | C316: of:=[.A316]=[.B316] -> true | D316: of:=FORMULA([.A316]) -> =LOOKUP(I294,G265:AF266)
A317: of:=LOOKUP([.I269];[.G265:.AF265];[.G266:.AF266]) -> Andy | B317: Andy | C317: of:=[.A317]=[.B317] -> true | D317: of:=FORMULA([.A317]) -> =LOOKUP(I269,G265:AF265,G266:AF266)
A318: of:=LOOKUP([.I270];[.G265:.AF265];[.G266:.AF266]) -> Bruce | B318: Bruce | C318: of:=[.A318]=[.B318] -> true | D318: of:=FORMULA([.A318]) -> =LOOKUP(I270,G265:AF265,G266:AF266)
A319: of:=LOOKUP([.I271];[.G265:.AF265];[.G266:.AF266]) -> Charlie | B319: Charlie | C319: of:=[.A319]=[.B319] -> true | D319: of:=FORMULA([.A319]) -> =LOOKUP(I271,G265:AF265,G266:AF266)
A320: of:=LOOKUP([.I272];[.G265:.AF265];[.G266:.AF266]) -> David | B320: David | C320: of:=[.A320]=[.B320] -> true | D320: of:=FORMULA([.A320]) -> =LOOKUP(I272,G265:AF265,G266:AF266)
A321: of:=LOOKUP([.I273];[.G265:.AF265];[.G266:.AF266]) -> Edward | B321: Edward | C321: of:=[.A321]=[.B321] -> true | D321: of:=FORMULA([.A321]) -> =LOOKUP(I273,G265:AF265,G266:AF266)
A322: of:=LOOKUP([.I274];[.G265:.AF265];[.G266:.AF266]) -> Frank | B322: Frank | C322: of:=[.A322]=[.B322] -> true | D322: of:=FORMULA([.A322]) -> =LOOKUP(I274,G265:AF265,G266:AF266)
A323: of:=LOOKUP([.I275];[.G265:.AF265];[.G266:.AF266]) -> George | B323: George | C323: of:=[.A323]=[.B323] -> true | D323: of:=FORMULA([.A323]) -> =LOOKUP(I275,G265:AF265,G266:AF266)
A324: of:=LOOKUP([.I276];[.G265:.AF265];[.G266:.AF266]) -> Henry | B324: Henry | C324: of:=[.A324]=[.B324] -> true | D324: of:=FORMULA([.A324]) -> =LOOKUP(I276,G265:AF265,G266:AF266)
A325: of:=LOOKUP([.I277];[.G265:.AF265];[.G266:.AF266]) -> Ira | B325: Ira | C325: of:=[.A325]=[.B325] -> true | D325: of:=FORMULA([.A325]) -> =LOOKUP(I277,G265:AF265,G266:AF266)
A326: of:=LOOKUP([.I278];[.G265:.AF265];[.G266:.AF266]) -> Jamie | B326: Jamie | C326: of:=[.A326]=[.B326] -> true | D326: of:=FORMULA([.A326]) -> =LOOKUP(I278,G265:AF265,G266:AF266)
A327: of:=LOOKUP([.I279];[.G265:.AF265];[.G266:.AF266]) -> Kevin | B327: Kevin | C327: of:=[.A327]=[.B327] -> true | D327: of:=FORMULA([.A327]) -> =LOOKUP(I279,G265:AF265,G266:AF266)
A328: of:=LOOKUP([.I280];[.G265:.AF265];[.G266:.AF266]) -> Leonard | B328: Leonard | C328: of:=[.A328]=[.B328] -> true | D328: of:=FORMULA([.A328]) -> =LOOKUP(I280,G265:AF265,G266:AF266)
A329: of:=LOOKUP([.I281];[.G265:.AF265];[.G266:.AF266]) -> Michael | B329: Michael | C329: of:=[.A329]=[.B329] -> true | D329: of:=FORMULA([.A329]) -> =LOOKUP(I281,G265:AF265,G266:AF266)
A330: of:=LOOKUP([.I282];[.G265:.AF265];[.G266:.AF266]) -> Noel | B330: Noel | C330: of:=[.A330]=[.B330] -> true | D330: of:=FORMULA([.A330]) -> =LOOKUP(I282,G265:AF265,G266:AF266)
A331: of:=LOOKUP([.I283];[.G265:.AF265];[.G266:.AF266]) -> Oliver | B331: Oliver | C331: of:=[.A331]=[.B331] -> true | D331: of:=FORMULA([.A331]) -> =LOOKUP(I283,G265:AF265,G266:AF266)
A332: of:=LOOKUP([.I284];[.G265:.AF265];[.G266:.AF266]) -> Peter | B332: Peter | C332: of:=[.A332]=[.B332] -> true | D332: of:=FORMULA([.A332]) -> =LOOKUP(I284,G265:AF265,G266:AF266)
A333: of:=LOOKUP([.I285];[.G265:.AF265];[.G266:.AF266]) -> Quincy | B333: Quincy | C333: of:=[.A333]=[.B333] -> true | D333: of:=FORMULA([.A333]) -> =LOOKUP(I285,G265:AF265,G266:AF266)
A334: of:=LOOKUP([.I286];[.G265:.AF265];[.G266:.AF266]) -> Rachel | B334: Rachel | C334: of:=[.A334]=[.B334] -> true | D334: of:=FORMULA([.A334]) -> =LOOKUP(I286,G265:AF265,G266:AF266)
A335: of:=LOOKUP([.I287];[.G265:.AF265];[.G266:.AF266]) -> Stuart | B335: Stuart | C335: of:=[.A335]=[.B335] -> true | D335: of:=FORMULA([.A335]) -> =LOOKUP(I287,G265:AF265,G266:AF266)
A336: of:=LOOKUP([.I288];[.G265:.AF265];[.G266:.AF266]) -> Tom | B336: Tom | C336: of:=[.A336]=[.B336] -> true | D336: of:=FORMULA([.A336]) -> =LOOKUP(I288,G265:AF265,G266:AF266)
A337: of:=LOOKUP([.I289];[.G265:.AF265];[.G266:.AF266]) -> Uma | B337: Uma | C337: of:=[.A337]=[.B337] -> true | D337: of:=FORMULA([.A337]) -> =LOOKUP(I289,G265:AF265,G266:AF266)
A338: of:=LOOKUP([.I290];[.G265:.AF265];[.G266:.AF266]) -> Victor | B338: Victor | C338: of:=[.A338]=[.B338] -> true | D338: of:=FORMULA([.A338]) -> =LOOKUP(I290,G265:AF265,G266:AF266)
A339: of:=LOOKUP([.I291];[.G265:.AF265];[.G266:.AF266]) -> Wesley | B339: Wesley | C339: of:=[.A339]=[.B339] -> true | D339: of:=FORMULA([.A339]) -> =LOOKUP(I291,G265:AF265,G266:AF266)
A340: of:=LOOKUP([.I292];[.G265:.AF265];[.G266:.AF266]) -> Xander | B340: Xander | C340: of:=[.A340]=[.B340] -> true | D340: of:=FORMULA([.A340]) -> =LOOKUP(I292,G265:AF265,G266:AF266)
A341: of:=LOOKUP([.I293];[.G265:.AF265];[.G266:.AF266]) -> Yoko | B341: Yoko | C341: of:=[.A341]=[.B341] -> true | D341: of:=FORMULA([.A341]) -> =LOOKUP(I293,G265:AF265,G266:AF266) | F341: Non-matching source and result ranges
A342: of:=LOOKUP([.I294];[.G265:.AF265];[.G266:.AF266]) -> Zebulon | B342: Zebulon | C342: of:=[.A342]=[.B342] -> true | D342: of:=FORMULA([.A342]) -> =LOOKUP(I294,G265:AF265,G266:AF266) | F342: Name | G342: Value | H342: Andy | I342: Bruce | J342: Charlie | K342: David | L342: Edward | N342: Name | O342: A | P342: B | Q342: C | R342: D | S342: E | T342: Value
A343: of:=LOOKUP([.H345];[.F343:.F347];[.H342:.L342]) -> Andy | B343: Andy | C343: of:=[.A343]=[.B343] -> true | D343: of:=FORMULA([.A343]) -> =LOOKUP(H345,F343:F347,H342:L342) | F343: A | T343: Andy
A344: of:=LOOKUP([.H346];[.F343:.F347];[.H342:.L342]) -> Bruce | B344: Bruce | C344: of:=[.A344]=[.B344] -> true | D344: of:=FORMULA([.A344]) -> =LOOKUP(H346,F343:F347,H342:L342) | F344: B | H344: Formula | N344: Formula | T344: Bruce
A345: of:=LOOKUP([.H347];[.F343:.F347];[.H342:.L342]) -> Charlie | B345: Charlie | C345: of:=[.A345]=[.B345] -> true | D345: of:=FORMULA([.A345]) -> =LOOKUP(H347,F343:F347,H342:L342) | F345: C | H345: A | N345: A | T345: Charlie
A346: of:=LOOKUP([.H348];[.F343:.F347];[.H342:.L342]) -> David | B346: David | C346: of:=[.A346]=[.B346] -> true | D346: of:=FORMULA([.A346]) -> =LOOKUP(H348,F343:F347,H342:L342) | F346: D | H346: B | N346: B | T346: David
A347: of:=LOOKUP([.H349];[.F343:.F347];[.H342:.L342]) -> Edward | B347: Edward | C347: of:=[.A347]=[.B347] -> true | D347: of:=FORMULA([.A347]) -> =LOOKUP(H349,F343:F347,H342:L342) | F347: E | H347: C | N347: C | T347: Edward
A348: of:=LOOKUP([.N345];[.O342:.S342];[.T343:.T347]) -> Andy | B348: Andy | C348: of:=[.A348]=[.B348] -> true | D348: of:=FORMULA([.A348]) -> =LOOKUP(N345,O342:S342,T343:T347) | H348: D | N348: D
A349: of:=LOOKUP([.N346];[.O342:.S342];[.T343:.T347]) -> Bruce | B349: Bruce | C349: of:=[.A349]=[.B349] -> true | D349: of:=FORMULA([.A349]) -> =LOOKUP(N346,O342:S342,T343:T347) | H349: E | N349: E
A350: of:=LOOKUP([.N347];[.O342:.S342];[.T343:.T347]) -> Charlie | B350: Charlie | C350: of:=[.A350]=[.B350] -> true | D350: of:=FORMULA([.A350]) -> =LOOKUP(N347,O342:S342,T343:T347)
A351: of:=LOOKUP([.N348];[.O342:.S342];[.T343:.T347]) -> David | B351: David | C351: of:=[.A351]=[.B351] -> true | D351: of:=FORMULA([.A351]) -> =LOOKUP(N348,O342:S342,T343:T347) | F351: Non-vector source and result ranges
A352: of:=LOOKUP([.N349];[.O342:.S342];[.T343:.T347]) -> Edward | B352: Edward | C352: of:=[.A352]=[.B352] -> true | D352: of:=FORMULA([.A352]) -> =LOOKUP(N349,O342:S342,T343:T347) | F352: Name | H352: Value | J352: Formula
A353: of:=LOOKUP([.J353];[.F353:.G357];[.H353:.I357]) ->  | B353: Err:504 | C353: of:=ISERROR([.A353]) -> true | D353: of:=FORMULA([.A353]) -> =LOOKUP(J353,F353:G357,H353:I357) | F353: A | G353: F | H353: Andy | I353: Frank | J353: A
A354: of:=LOOKUP([.J354];[.F353:.G357];[.H353:.I357]) ->  | B354: Err:504 | C354: of:=ISERROR([.A354]) -> true | D354: of:=FORMULA([.A354]) -> =LOOKUP(J354,F353:G357,H353:I357) | F354: B | G354: G | H354: Bruce | I354: George | J354: B
A355: of:=LOOKUP([.J355];[.F353:.G357];[.H353:.I357]) ->  | B355: Err:504 | C355: of:=ISERROR([.A355]) -> true | D355: of:=FORMULA([.A355]) -> =LOOKUP(J355,F353:G357,H353:I357) | F355: C | G355: H | H355: Charlie | I355: Henry | J355: C
A356: of:=LOOKUP([.J356];[.F353:.G357];[.H353:.I357]) ->  | B356: Err:504 | C356: of:=ISERROR([.A356]) -> true | D356: of:=FORMULA([.A356]) -> =LOOKUP(J356,F353:G357,H353:I357) | F356: D | G356: I | H356: David | I356: Ira | J356: D
A357: of:=LOOKUP([.J357];[.F353:.G357];[.H353:.I357]) ->  | B357: Err:504 | C357: of:=ISERROR([.A357]) -> true | D357: of:=FORMULA([.A357]) -> =LOOKUP(J357,F353:G357,H353:I357) | F357: E | G357: J | H357: Edward | I357: Jamie | J357: E
A358: of:=LOOKUP([.J358];[.F353:.G357];[.H353:.I357]) ->  | B358: Err:504 | C358: of:=ISERROR([.A358]) -> true | D358: of:=FORMULA([.A358]) -> =LOOKUP(J358,F353:G357,H353:I357) | J358: F
A359: of:=LOOKUP([.J359];[.F353:.G357];[.H353:.I357]) ->  | B359: Err:504 | C359: of:=ISERROR([.A359]) -> true | D359: of:=FORMULA([.A359]) -> =LOOKUP(J359,F353:G357,H353:I357) | J359: G
A360: of:=LOOKUP([.J360];[.F353:.G357];[.H353:.I357]) ->  | B360: Err:504 | C360: of:=ISERROR([.A360]) -> true | D360: of:=FORMULA([.A360]) -> =LOOKUP(J360,F353:G357,H353:I357) | J360: H
A361: of:=LOOKUP([.J361];[.F353:.G357];[.H353:.I357]) ->  | B361: Err:504 | C361: of:=ISERROR([.A361]) -> true | D361: of:=FORMULA([.A361]) -> =LOOKUP(J361,F353:G357,H353:I357) | J361: I
A362: of:=LOOKUP([.J362];[.F353:.G357];[.H353:.I357]) ->  | B362: Err:504 | C362: of:=ISERROR([.A362]) -> true | D362: of:=FORMULA([.A362]) -> =LOOKUP(J362,F353:G357,H353:I357) | J362: J
A363: of:=LOOKUP([.I365];[.F365:.H369]) -> Frank | B363: Frank | C363: of:=[.A363]=[.B363] -> true | D363: of:=FORMULA([.A363]) -> =LOOKUP(I365,F365:H369) | F363: Non-matching geometries
A364: of:=LOOKUP([.I366];[.F365:.H369]) -> George | B364: George | C364: of:=[.A364]=[.B364] -> true | D364: of:=FORMULA([.A364]) -> =LOOKUP(I366,F365:H369) | F364: Name | G364: Value | I364: Formula
A365: of:=LOOKUP([.I367];[.F365:.H369]) -> Henry | B365: Henry | C365: of:=[.A365]=[.B365] -> true | D365: of:=FORMULA([.A365]) -> =LOOKUP(I367,F365:H369) | F365: A | G365: Andy | H365: Frank | I365: A
A366: of:=LOOKUP([.I368];[.F365:.H369]) -> Ira | B366: Ira | C366: of:=[.A366]=[.B366] -> true | D366: of:=FORMULA([.A366]) -> =LOOKUP(I368,F365:H369) | F366: B | G366: Bruce | H366: George | I366: B
A367: of:=LOOKUP([.I369];[.F365:.H369]) -> Jamie | B367: Jamie | C367: of:=[.A367]=[.B367] -> true | D367: of:=FORMULA([.A367]) -> =LOOKUP(I369,F365:H369) | F367: C | G367: Charlie | H367: Henry | I367: C
A368: of:=LOOKUP([.I365];[.F365:.F369];[.G365:.H369]) ->  | B368: Err:504 | C368: of:=ISERROR([.A368]) -> true | D368: of:=FORMULA([.A368]) -> =LOOKUP(I365,F365:F369,G365:H369) | F368: D | G368: David | H368: Ira | I368: D
A369: of:=LOOKUP([.I366];[.F365:.F369];[.G365:.H369]) ->  | B369: Err:504 | C369: of:=ISERROR([.A369]) -> true | D369: of:=FORMULA([.A369]) -> =LOOKUP(I366,F365:F369,G365:H369) | F369: E | G369: Edward | H369: Jamie | I369: E
A370: of:=LOOKUP([.I367];[.F365:.F369];[.G365:.H369]) ->  | B370: Err:504 | C370: of:=ISERROR([.A370]) -> true | D370: of:=FORMULA([.A370]) -> =LOOKUP(I367,F365:F369,G365:H369)
A371: of:=LOOKUP([.I368];[.F365:.F369];[.G365:.H369]) ->  | B371: Err:504 | C371: of:=ISERROR([.A371]) -> true | D371: of:=FORMULA([.A371]) -> =LOOKUP(I368,F365:F369,G365:H369)
A372: of:=LOOKUP([.I369];[.F365:.F369];[.G365:.H369]) ->  | B372: Err:504 | C372: of:=ISERROR([.A372]) -> true | D372: of:=FORMULA([.A372]) -> =LOOKUP(I369,F365:F369,G365:H369) | F372: Name | H372: Value | I372: Formula
A373: of:=LOOKUP([.I373];[.F373:.H377]) -> Andy | B373: Andy | C373: of:=[.A373]=[.B373] -> true | D373: of:=FORMULA([.A373]) -> =LOOKUP(I373,F373:H377) | F373: A | G373: F | H373: Andy | I373: A
A374: of:=LOOKUP([.I374];[.F373:.H377]) -> Bruce | B374: Bruce | C374: of:=[.A374]=[.B374] -> true | D374: of:=FORMULA([.A374]) -> =LOOKUP(I374,F373:H377) | F374: B | G374: G | H374: Bruce | I374: B
A375: of:=LOOKUP([.I375];[.F373:.H377]) -> Charlie | B375: Charlie | C375: of:=[.A375]=[.B375] -> true | D375: of:=FORMULA([.A375]) -> =LOOKUP(I375,F373:H377) | F375: C | G375: H | H375: Charlie | I375: C
A376: of:=LOOKUP([.I376];[.F373:.H377]) -> David | B376: David | C376: of:=[.A376]=[.B376] -> true | D376: of:=FORMULA([.A376]) -> =LOOKUP(I376,F373:H377) | F376: D | G376: I | H376: David | I376: D
A377: of:=LOOKUP([.I377];[.F373:.H377]) -> Edward | B377: Edward | C377: of:=[.A377]=[.B377] -> true | D377: of:=FORMULA([.A377]) -> =LOOKUP(I377,F373:H377) | F377: E | G377: J | H377: Edward | I377: E
A378: of:=LOOKUP([.I378];[.F373:.H377]) -> Edward | B378: Edward | C378: of:=[.A378]=[.B378] -> true | D378: of:=FORMULA([.A378]) -> =LOOKUP(I378,F373:H377) | I378: F
A379: of:=LOOKUP([.I379];[.F373:.H377]) -> Edward | B379: Edward | C379: of:=[.A379]=[.B379] -> true | D379: of:=FORMULA([.A379]) -> =LOOKUP(I379,F373:H377) | I379: G
A380: of:=LOOKUP([.I380];[.F373:.H377]) -> Edward | B380: Edward | C380: of:=[.A380]=[.B380] -> true | D380: of:=FORMULA([.A380]) -> =LOOKUP(I380,F373:H377) | I380: H
A381: of:=LOOKUP([.I381];[.F373:.H377]) -> Edward | B381: Edward | C381: of:=[.A381]=[.B381] -> true | D381: of:=FORMULA([.A381]) -> =LOOKUP(I381,F373:H377) | I381: I
A382: of:=LOOKUP([.I382];[.F373:.H377]) -> Edward | B382: Edward | C382: of:=[.A382]=[.B382] -> true | D382: of:=FORMULA([.A382]) -> =LOOKUP(I382,F373:H377) | I382: J
A383: of:=LOOKUP([.I373];[.F373:.G377];[.H373:.H377]) -> Andy | B383: Andy | C383: of:=[.A383]=[.B383] -> true | D383: of:=FORMULA([.A383]) -> =LOOKUP(I373,F373:G377,H373:H377)
A384: of:=LOOKUP([.I374];[.F373:.G377];[.H373:.H377]) -> Bruce | B384: Bruce | C384: of:=[.A384]=[.B384] -> true | D384: of:=FORMULA([.A384]) -> =LOOKUP(I374,F373:G377,H373:H377)
A385: of:=LOOKUP([.I375];[.F373:.G377];[.H373:.H377]) -> Charlie | B385: Charlie | C385: of:=[.A385]=[.B385] -> true | D385: of:=FORMULA([.A385]) -> =LOOKUP(I375,F373:G377,H373:H377)
A386: of:=LOOKUP([.I376];[.F373:.G377];[.H373:.H377]) -> David | B386: David | C386: of:=[.A386]=[.B386] -> true | D386: of:=FORMULA([.A386]) -> =LOOKUP(I376,F373:G377,H373:H377)
A387: of:=LOOKUP([.I377];[.F373:.G377];[.H373:.H377]) -> Edward | B387: Edward | C387: of:=[.A387]=[.B387] -> true | D387: of:=FORMULA([.A387]) -> =LOOKUP(I377,F373:G377,H373:H377)
A388: of:=LOOKUP([.I378];[.F373:.G377];[.H373:.H377]) -> Edward | B388: Edward | C388: of:=[.A388]=[.B388] -> true | D388: of:=FORMULA([.A388]) -> =LOOKUP(I378,F373:G377,H373:H377)
A389: of:=LOOKUP([.I379];[.F373:.G377];[.H373:.H377]) -> Edward | B389: Edward | C389: of:=[.A389]=[.B389] -> true | D389: of:=FORMULA([.A389]) -> =LOOKUP(I379,F373:G377,H373:H377)
A390: of:=LOOKUP([.I380];[.F373:.G377];[.H373:.H377]) -> Edward | B390: Edward | C390: of:=[.A390]=[.B390] -> true | D390: of:=FORMULA([.A390]) -> =LOOKUP(I380,F373:G377,H373:H377)
A391: of:=LOOKUP([.I381];[.F373:.G377];[.H373:.H377]) -> Edward | B391: Edward | C391: of:=[.A391]=[.B391] -> true | D391: of:=FORMULA([.A391]) -> =LOOKUP(I381,F373:G377,H373:H377) | F391: Name | G391: A | H391: B | I391: C | J391: D | K391: E
A392: of:=LOOKUP([.I382];[.F373:.G377];[.H373:.H377]) -> Edward | B392: Edward | C392: of:=[.A392]=[.B392] -> true | D392: of:=FORMULA([.A392]) -> =LOOKUP(I382,F373:G377,H373:H377) | F392: Value | G392: Andy | H392: Bruce | I392: Charlie | J392: David | K392: Edward
A393: of:=LOOKUP([.I396];[.G391:.K393]) -> Frank | B393: Frank | C393: of:=[.A393]=[.B393] -> true | D393: of:=FORMULA([.A393]) -> =LOOKUP(I396,G391:K393) | G393: Frank | H393: George | I393: Henry | J393: Ira | K393: Jamie
A394: of:=LOOKUP([.I397];[.G391:.K393]) -> George | B394: George | C394: of:=[.A394]=[.B394] -> true | D394: of:=FORMULA([.A394]) -> =LOOKUP(I397,G391:K393)
A395: of:=LOOKUP([.I398];[.G391:.K393]) -> Henry | B395: Henry | C395: of:=[.A395]=[.B395] -> true | D395: of:=FORMULA([.A395]) -> =LOOKUP(I398,G391:K393) | I395: Formula
A396: of:=LOOKUP([.I399];[.G391:.K393]) -> Ira | B396: Ira | C396: of:=[.A396]=[.B396] -> true | D396: of:=FORMULA([.A396]) -> =LOOKUP(I399,G391:K393) | I396: A
A397: of:=LOOKUP([.I400];[.G391:.K393]) -> Jamie | B397: Jamie | C397: of:=[.A397]=[.B397] -> true | D397: of:=FORMULA([.A397]) -> =LOOKUP(I400,G391:K393) | I397: B
A398: of:=LOOKUP([.I396];[.G391:.K391];[.G392:.K393]) ->  | B398: Err:504 | C398: of:=ISERROR([.A398]) -> true | D398: of:=FORMULA([.A398]) -> =LOOKUP(I396,G391:K391,G392:K393) | I398: C
A399: of:=LOOKUP([.I397];[.G391:.K391];[.G392:.K393]) ->  | B399: Err:504 | C399: of:=ISERROR([.A399]) -> true | D399: of:=FORMULA([.A399]) -> =LOOKUP(I397,G391:K391,G392:K393) | I399: D
A400: of:=LOOKUP([.I398];[.G391:.K391];[.G392:.K393]) ->  | B400: Err:504 | C400: of:=ISERROR([.A400]) -> true | D400: of:=FORMULA([.A400]) -> =LOOKUP(I398,G391:K391,G392:K393) | I400: E
A401: of:=LOOKUP([.I399];[.G391:.K391];[.G392:.K393]) ->  | B401: Err:504 | C401: of:=ISERROR([.A401]) -> true | D401: of:=FORMULA([.A401]) -> =LOOKUP(I399,G391:K391,G392:K393)
A402: of:=LOOKUP([.I400];[.G391:.K391];[.G392:.K393]) ->  | B402: Err:504 | C402: of:=ISERROR([.A402]) -> true | D402: of:=FORMULA([.A402]) -> =LOOKUP(I400,G391:K391,G392:K393)
A403: of:=LOOKUP([.I408];[.G403:.K405]) -> Andy | B403: Andy | C403: of:=[.A403]=[.B403] -> true | D403: of:=FORMULA([.A403]) -> =LOOKUP(I408,G403:K405) | F403: Name | G403: A | H403: B | I403: C | J403: D | K403: E
A404: of:=LOOKUP([.I409];[.G403:.K405]) -> Bruce | B404: Bruce | C404: of:=[.A404]=[.B404] -> true | D404: of:=FORMULA([.A404]) -> =LOOKUP(I409,G403:K405) | G404: F | H404: G | I404: H | J404: I | K404: J
A405: of:=LOOKUP([.I410];[.G403:.K405]) -> Charlie | B405: Charlie | C405: of:=[.A405]=[.B405] -> true | D405: of:=FORMULA([.A405]) -> =LOOKUP(I410,G403:K405) | F405: Value | G405: Andy | H405: Bruce | I405: Charlie | J405: David | K405: Edward
A406: of:=LOOKUP([.I411];[.G403:.K405]) -> David | B406: David | C406: of:=[.A406]=[.B406] -> true | D406: of:=FORMULA([.A406]) -> =LOOKUP(I411,G403:K405)
A407: of:=LOOKUP([.I412];[.G403:.K405]) -> Edward | B407: Edward | C407: of:=[.A407]=[.B407] -> true | D407: of:=FORMULA([.A407]) -> =LOOKUP(I412,G403:K405) | I407: Formula
A408: of:=LOOKUP([.I413];[.G403:.K405]) -> Edward | B408: Edward | C408: of:=[.A408]=[.B408] -> true | D408: of:=FORMULA([.A408]) -> =LOOKUP(I413,G403:K405) | I408: A
A409: of:=LOOKUP([.I414];[.G403:.K405]) -> Edward | B409: Edward | C409: of:=[.A409]=[.B409] -> true | D409: of:=FORMULA([.A409]) -> =LOOKUP(I414,G403:K405) | I409: B
A410: of:=LOOKUP([.I415];[.G403:.K405]) -> Edward | B410: Edward | C410: of:=[.A410]=[.B410] -> true | D410: of:=FORMULA([.A410]) -> =LOOKUP(I415,G403:K405) | I410: C
A411: of:=LOOKUP([.I416];[.G403:.K405]) -> Edward | B411: Edward | C411: of:=[.A411]=[.B411] -> true | D411: of:=FORMULA([.A411]) -> =LOOKUP(I416,G403:K405) | I411: D
A412: of:=LOOKUP([.I417];[.G403:.K405]) -> Edward | B412: Edward | C412: of:=[.A412]=[.B412] -> true | D412: of:=FORMULA([.A412]) -> =LOOKUP(I417,G403:K405) | I412: E
A413: of:=LOOKUP([.I408];[.G403:.K404];[.G405:.K405]) -> Andy | B413: Andy | C413: of:=[.A413]=[.B413] -> true | D413: of:=FORMULA([.A413]) -> =LOOKUP(I408,G403:K404,G405:K405) | I413: F
A414: of:=LOOKUP([.I409];[.G403:.K404];[.G405:.K405]) -> Bruce | B414: Bruce | C414: of:=[.A414]=[.B414] -> true | D414: of:=FORMULA([.A414]) -> =LOOKUP(I409,G403:K404,G405:K405) | I414: G
A415: of:=LOOKUP([.I410];[.G403:.K404];[.G405:.K405]) -> Charlie | B415: Charlie | C415: of:=[.A415]=[.B415] -> true | D415: of:=FORMULA([.A415]) -> =LOOKUP(I410,G403:K404,G405:K405) | I415: H
A416: of:=LOOKUP([.I411];[.G403:.K404];[.G405:.K405]) -> David | B416: David | C416: of:=[.A416]=[.B416] -> true | D416: of:=FORMULA([.A416]) -> =LOOKUP(I411,G403:K404,G405:K405) | I416: I
A417: of:=LOOKUP([.I412];[.G403:.K404];[.G405:.K405]) -> Edward | B417: Edward | C417: of:=[.A417]=[.B417] -> true | D417: of:=FORMULA([.A417]) -> =LOOKUP(I412,G403:K404,G405:K405) | I417: J
A418: of:=LOOKUP([.I413];[.G403:.K404];[.G405:.K405]) -> Edward | B418: Edward | C418: of:=[.A418]=[.B418] -> true | D418: of:=FORMULA([.A418]) -> =LOOKUP(I413,G403:K404,G405:K405)
A419: of:=LOOKUP([.I414];[.G403:.K404];[.G405:.K405]) -> Edward | B419: Edward | C419: of:=[.A419]=[.B419] -> true | D419: of:=FORMULA([.A419]) -> =LOOKUP(I414,G403:K404,G405:K405)
A420: of:=LOOKUP([.I415];[.G403:.K404];[.G405:.K405]) -> Edward | B420: Edward | C420: of:=[.A420]=[.B420] -> true | D420: of:=FORMULA([.A420]) -> =LOOKUP(I415,G403:K404,G405:K405) | F420: Square ranges
A421: of:=LOOKUP([.I416];[.G403:.K404];[.G405:.K405]) -> Edward | B421: Edward | C421: of:=[.A421]=[.B421] -> true | D421: of:=FORMULA([.A421]) -> =LOOKUP(I416,G403:K404,G405:K405) | F421: Name | H421: Value | I421: Formula
A422: of:=LOOKUP([.I417];[.G403:.K404];[.G405:.K405]) -> Edward | B422: Edward | C422: of:=[.A422]=[.B422] -> true | D422: of:=FORMULA([.A422]) -> =LOOKUP(I417,G403:K404,G405:K405) | F422: A | G422: D | H422: Andy | I422: A
A423: of:=LOOKUP([.I422];[.F422:.H424]) -> Andy | B423: Andy | C423: of:=[.A423]=[.B423] -> true | D423: of:=FORMULA([.A423]) -> =LOOKUP(I422,F422:H424) | F423: B | G423: E | H423: Bruce | I423: B
A424: of:=LOOKUP([.I423];[.F422:.H424]) -> Bruce | B424: Bruce | C424: of:=[.A424]=[.B424] -> true | D424: of:=FORMULA([.A424]) -> =LOOKUP(I423,F422:H424) | F424: C | G424: F | H424: Charlie | I424: C
A425: of:=LOOKUP([.I424];[.F422:.H424]) -> Charlie | B425: Charlie | C425: of:=[.A425]=[.B425] -> true | D425: of:=FORMULA([.A425]) -> =LOOKUP(I424,F422:H424) | I425: D
A426: of:=LOOKUP([.I425];[.F422:.H424]) -> Charlie | B426: Charlie | C426: of:=[.A426]=[.B426] -> true | D426: of:=FORMULA([.A426]) -> =LOOKUP(I425,F422:H424) | I426: E
A427: of:=LOOKUP([.I426];[.F422:.H424]) -> Charlie | B427: Charlie | C427: of:=[.A427]=[.B427] -> true | D427: of:=FORMULA([.A427]) -> =LOOKUP(I426,F422:H424) | I427: F
A428: of:=LOOKUP([.I427];[.F422:.H424]) -> Charlie | B428: Charlie | C428: of:=[.A428]=[.B428] -> true | D428: of:=FORMULA([.A428]) -> =LOOKUP(I427,F422:H424)
A429: of:=LOOKUP([.I422];[.F422:.G424];[.H422:.H424]) -> Andy | B429: Andy | C429: of:=[.A429]=[.B429] -> true | D429: of:=FORMULA([.A429]) -> =LOOKUP(I422,F422:G424,H422:H424)
A430: of:=LOOKUP([.I423];[.F422:.G424];[.H422:.H424]) -> Bruce | B430: Bruce | C430: of:=[.A430]=[.B430] -> true | D430: of:=FORMULA([.A430]) -> =LOOKUP(I423,F422:G424,H422:H424)
A431: of:=LOOKUP([.I424];[.F422:.G424];[.H422:.H424]) -> Charlie | B431: Charlie | C431: of:=[.A431]=[.B431] -> true | D431: of:=FORMULA([.A431]) -> =LOOKUP(I424,F422:G424,H422:H424)
A432: of:=LOOKUP([.I425];[.F422:.G424];[.H422:.H424]) -> Charlie | B432: Charlie | C432: of:=[.A432]=[.B432] -> true | D432: of:=FORMULA([.A432]) -> =LOOKUP(I425,F422:G424,H422:H424)
A433: of:=LOOKUP([.I426];[.F422:.G424];[.H422:.H424]) -> Charlie | B433: Charlie | C433: of:=[.A433]=[.B433] -> true | D433: of:=FORMULA([.A433]) -> =LOOKUP(I426,F422:G424,H422:H424)
A434: of:=LOOKUP([.I427];[.F422:.G424];[.H422:.H424]) -> Charlie | B434: Charlie | C434: of:=[.A434]=[.B434] -> true | D434: of:=FORMULA([.A434]) -> =LOOKUP(I427,F422:G424,H422:H424) | F434: Name | G434: A | H434: B | I434: C | J434: Formula
A435: of:=LOOKUP([.J435];[.G434:.I436]) -> C | B435: C | C435: of:=[.A435]=[.B435] -> true | D435: of:=FORMULA([.A435]) -> =LOOKUP(J435,G434:I436) | G435: D | H435: E | I435: F | J435: A
A436: of:=LOOKUP([.J436];[.G434:.I436]) -> C | B436: C | C436: of:=[.A436]=[.B436] -> true | D436: of:=FORMULA([.A436]) -> =LOOKUP(J436,G434:I436) | F436: Value | G436: Andy | H436: Bruce | I436: Charlie | J436: B
A437: of:=LOOKUP([.J437];[.G434:.I436]) -> C | B437: C | C437: of:=[.A437]=[.B437] -> true | D437: of:=FORMULA([.A437]) -> =LOOKUP(J437,G434:I436) | J437: C
A438: of:=LOOKUP([.J438];[.G434:.I436]) -> F | B438: F | C438: of:=[.A438]=[.B438] -> true | D438: of:=FORMULA([.A438]) -> =LOOKUP(J438,G434:I436) | J438: D
A439: of:=LOOKUP([.J439];[.G434:.I436]) -> Charlie | B439: Charlie | C439: of:=[.A439]=[.B439] -> true | D439: of:=FORMULA([.A439]) -> =LOOKUP(J439,G434:I436) | J439: E
A440: of:=LOOKUP([.J440];[.G434:.I436]) -> Charlie | B440: Charlie | C440: of:=[.A440]=[.B440] -> true | D440: of:=FORMULA([.A440]) -> =LOOKUP(J440,G434:I436) | J440: F
A441: of:=LOOKUP([.J435];[.G434:.I435];[.G436:.I436]) -> Andy | B441: Andy | C441: of:=[.A441]=[.B441] -> true | D441: of:=FORMULA([.A441]) -> =LOOKUP(J435,G434:I435,G436:I436)
A442: of:=LOOKUP([.J436];[.G434:.I435];[.G436:.I436]) -> Bruce | B442: Bruce | C442: of:=[.A442]=[.B442] -> true | D442: of:=FORMULA([.A442]) -> =LOOKUP(J436,G434:I435,G436:I436)
A443: of:=LOOKUP([.J437];[.G434:.I435];[.G436:.I436]) -> Charlie | B443: Charlie | C443: of:=[.A443]=[.B443] -> true | D443: of:=FORMULA([.A443]) -> =LOOKUP(J437,G434:I435,G436:I436) | F443: Ranges of different lengths
A444: of:=LOOKUP([.J438];[.G434:.I435];[.G436:.I436]) -> Charlie | B444: Charlie | C444: of:=[.A444]=[.B444] -> true | D444: of:=FORMULA([.A444]) -> =LOOKUP(J438,G434:I435,G436:I436) | F444: Name | G444: Value | I444: Formula
A445: of:=LOOKUP([.J439];[.G434:.I435];[.G436:.I436]) -> Charlie | B445: Charlie | C445: of:=[.A445]=[.B445] -> true | D445: of:=FORMULA([.A445]) -> =LOOKUP(J439,G434:I435,G436:I436) | F445: A | G445: Andy | I445: A
A446: of:=LOOKUP([.J440];[.G434:.I435];[.G436:.I436]) -> Charlie | B446: Charlie | C446: of:=[.A446]=[.B446] -> true | D446: of:=FORMULA([.A446]) -> =LOOKUP(J440,G434:I435,G436:I436) | F446: B | G446: Bruce | I446: B
A447: of:=LOOKUP([.I445];[.F445:.F449];[.G445:.G447]) -> Andy | B447: Andy | C447: of:=[.A447]=[.B447] -> true | D447: of:=FORMULA([.A447]) -> =LOOKUP(I445,F445:F449,G445:G447) | F447: C | G447: Charlie | I447: C
A448: of:=LOOKUP([.I446];[.F445:.F449];[.G445:.G447]) -> Bruce | B448: Bruce | C448: of:=[.A448]=[.B448] -> true | D448: of:=FORMULA([.A448]) -> =LOOKUP(I446,F445:F449,G445:G447) | F448: D | G448: OUT OF BOUND | I448: D
A449: of:=LOOKUP([.I447];[.F445:.F449];[.G445:.G447]) -> Charlie | B449: Charlie | C449: of:=[.A449]=[.B449] -> true | D449: of:=FORMULA([.A449]) -> =LOOKUP(I447,F445:F449,G445:G447) | F449: E | G449: OUT OF BOUND | I449: E
A450: of:=LOOKUP([.I448];[.F445:.F449];[.G445:.G447]) -> OUT OF BOUND | B450: OUT OF BOUND | C450: of:=[.A450]=[.B450] -> true | D450: of:=FORMULA([.A450]) -> =LOOKUP(I448,F445:F449,G445:G447)
A451: of:=LOOKUP([.I449];[.F445:.F449];[.G445:.G447]) -> OUT OF BOUND | B451: OUT OF BOUND | C451: of:=[.A451]=[.B451] -> true | D451: of:=FORMULA([.A451]) -> =LOOKUP(I449,F445:F449,G445:G447) | F451: Name | G451: Value | I451: Formula
A452: of:=LOOKUP([.I452];[.F452:.F456];[.G452:.G455]) -> Andy | B452: Andy | C452: of:=[.A452]=[.B452] -> true | D452: of:=FORMULA([.A452]) -> =LOOKUP(I452,F452:F456,G452:G455) | F452: A | G452: Andy | I452: A
A453: of:=LOOKUP([.I453];[.F452:.F456];[.G452:.G455]) -> Bruce | B453: Bruce | C453: of:=[.A453]=[.B453] -> true | D453: of:=FORMULA([.A453]) -> =LOOKUP(I453,F452:F456,G452:G455) | F453: B | G453: Bruce | I453: B
A454: of:=LOOKUP([.I454];[.F452:.F456];[.G452:.G455]) -> Charlie | B454: Charlie | C454: of:=[.A454]=[.B454] -> true | D454: of:=FORMULA([.A454]) -> =LOOKUP(I454,F452:F456,G452:G455) | F454: C | G454: Charlie | I454: C
A455: of:=LOOKUP([.I455];[.F452:.F456];[.G452:.G455]) -> David | B455: David | C455: of:=[.A455]=[.B455] -> true | D455: of:=FORMULA([.A455]) -> =LOOKUP(I455,F452:F456,G452:G455) | F455: D | G455: David | I455: D
A456: of:=LOOKUP([.I456];[.F452:.F456];[.G452:.G455]) -> OUT OF BOUND | B456: OUT OF BOUND | C456: of:=[.A456]=[.B456] -> true | D456: of:=FORMULA([.A456]) -> =LOOKUP(I456,F452:F456,G452:G455) | F456: E | G456: OUT OF BOUND | I456: E
A457: of:=LOOKUP([.I459];[.F459:.F461];[.G459:.G463]) -> Andy | B457: Andy | C457: of:=[.A457]=[.B457] -> true | D457: of:=FORMULA([.A457]) -> =LOOKUP(I459,F459:F461,G459:G463)
A458: of:=LOOKUP([.I460];[.F459:.F461];[.G459:.G463]) -> Bruce | B458: Bruce | C458: of:=[.A458]=[.B458] -> true | D458: of:=FORMULA([.A458]) -> =LOOKUP(I460,F459:F461,G459:G463) | F458: Name | G458: Value | I458: Formula
A459: of:=LOOKUP([.I461];[.F459:.F461];[.G459:.G463]) -> Charlie | B459: Charlie | C459: of:=[.A459]=[.B459] -> true | D459: of:=FORMULA([.A459]) -> =LOOKUP(I461,F459:F461,G459:G463) | F459: A | G459: Andy | I459: A
A460: of:=LOOKUP([.I462];[.F459:.F461];[.G459:.G463]) -> Charlie | B460: Charlie | C460: of:=[.A460]=[.B460] -> true | D460: of:=FORMULA([.A460]) -> =LOOKUP(I462,F459:F461,G459:G463) | F460: B | G460: Bruce | I460: B
A461: of:=LOOKUP([.I463];[.F459:.F461];[.G459:.G463]) -> Charlie | B461: Charlie | C461: of:=[.A461]=[.B461] -> true | D461: of:=FORMULA([.A461]) -> =LOOKUP(I463,F459:F461,G459:G463) | F461: C | G461: Charlie | I461: C
A462: of:=LOOKUP([.I466];[.F466:.F469];[.G466:.G470]) -> Andy | B462: Andy | C462: of:=[.A462]=[.B462] -> true | D462: of:=FORMULA([.A462]) -> =LOOKUP(I466,F466:F469,G466:G470) | F462: D | G462: David | I462: D
A463: of:=LOOKUP([.I467];[.F466:.F469];[.G466:.G470]) -> Bruce | B463: Bruce | C463: of:=[.A463]=[.B463] -> true | D463: of:=FORMULA([.A463]) -> =LOOKUP(I467,F466:F469,G466:G470) | F463: E | G463: Edward | I463: E
A464: of:=LOOKUP([.I468];[.F466:.F469];[.G466:.G470]) -> Charlie | B464: Charlie | C464: of:=[.A464]=[.B464] -> true | D464: of:=FORMULA([.A464]) -> =LOOKUP(I468,F466:F469,G466:G470)
A465: of:=LOOKUP([.I469];[.F466:.F469];[.G466:.G470]) -> David | B465: David | C465: of:=[.A465]=[.B465] -> true | D465: of:=FORMULA([.A465]) -> =LOOKUP(I469,F466:F469,G466:G470) | F465: Name | G465: Value | I465: Formula
A466: of:=LOOKUP([.I470];[.F466:.F469];[.G466:.G470]) -> David | B466: David | C466: of:=[.A466]=[.B466] -> true | D466: of:=FORMULA([.A466]) -> =LOOKUP(I470,F466:F469,G466:G470) | F466: A | G466: Andy | I466: A
A467: of:=LOOKUP([.I475];[.F475:.G484]) -> Andy | B467: Andy | C467: of:=[.A467]=[.B467] -> true | D467: of:=FORMULA([.A467]) -> =LOOKUP(I475,F475:G484) | F467: B | G467: Bruce | I467: B
A468: of:=LOOKUP([.I476];[.F475:.G484]) -> Bruce | B468: Bruce | C468: of:=[.A468]=[.B468] -> true | D468: of:=FORMULA([.A468]) -> =LOOKUP(I476,F475:G484) | F468: C | G468: Charlie | I468: C
A469: of:=LOOKUP([.I477];[.F475:.G484]) -> Charlie5 | B469: Charlie5 | C469: of:=[.A469]=[.B469] -> true | D469: of:=FORMULA([.A469]) -> =LOOKUP(I477,F475:G484) | F469: D | G469: David | I469: D
A470: of:=LOOKUP([.I478];[.F475:.G484]) -> David | B470: David | C470: of:=[.A470]=[.B470] -> true | D470: of:=FORMULA([.A470]) -> =LOOKUP(I478,F475:G484) | F470: E | G470: Edward | I470: E
A471: of:=LOOKUP([.I479];[.F475:.G484]) -> Edward | B471: Edward | C471: of:=[.A471]=[.B471] -> true | D471: of:=FORMULA([.A471]) -> =LOOKUP(I479,F475:G484)
A472: of:=LOOKUP([.I480];[.F475:.G484]) -> Frank | B472: Frank | C472: of:=[.A472]=[.B472] -> true | D472: of:=FORMULA([.A472]) -> =LOOKUP(I480,F475:G484)
A473: of:=LOOKUP([.N475];[.K475:.L482]) -> Andy | B473: Andy | C473: of:=[.A473]=[.B473] -> true | D473: of:=FORMULA([.A473]) -> =LOOKUP(N475,K475:L482) | F473: Duplicate entries | K473: Case-sensitivity
A474: of:=LOOKUP([.N476];[.K475:.L482]) -> Bruce | B474: Bruce | C474: of:=[.A474]=[.B474] -> true | D474: of:=FORMULA([.A474]) -> =LOOKUP(N476,K475:L482) | F474: Name | G474: Value | K474: Name | L474: Value
A475: of:=LOOKUP([.N477];[.K475:.L482]) -> Charlie | B475: Charlie | C475: of:=[.A475]=[.B475] -> true | D475: of:=FORMULA([.A475]) -> =LOOKUP(N477,K475:L482) | F475: A | G475: Andy | I475: A | K475: a | L475: Andy | N475: A | T475: of:=IF(ISERROR([.A481]);IF(ISERROR([.R475]);TRUE();FALSE());IF(ISERROR([.R475]);FALSE();[.A481]=[.R475])) -> false
A476: of:=LOOKUP([.N478];[.K475:.L482]) -> David | B476: David | C476: of:=[.A476]=[.B476] -> true | D476: of:=FORMULA([.A476]) -> =LOOKUP(N478,K475:L482) | F476: B | G476: Bruce | I476: B | K476: B | L476: Bruce | N476: b | T476: of:=IF(ISERROR([.A482]);IF(ISERROR([.R476]);TRUE();FALSE());IF(ISERROR([.R476]);FALSE();[.A482]=[.R476])) -> false
A477: of:=LOOKUP([.N479];[.K475:.L482]) -> Edward | B477: Edward | C477: of:=[.A477]=[.B477] -> true | D477: of:=FORMULA([.A477]) -> =LOOKUP(N479,K475:L482) | F477: C | G477: Charlie1 | I477: C | K477: c | L477: Charlie | N477: C | T477: of:=IF(ISERROR([.A483]);IF(ISERROR([.R477]);TRUE();FALSE());IF(ISERROR([.R477]);FALSE();[.A483]=[.R477])) -> false
A478: of:=LOOKUP([.N480];[.K475:.L482]) -> Frank | B478: Frank | C478: of:=[.A478]=[.B478] -> true | D478: of:=FORMULA([.A478]) -> =LOOKUP(N480,K475:L482) | F478: C | G478: Charlie2 | I478: D | K478: D | L478: David | N478: d | T478: of:=IF(ISERROR([.A484]);IF(ISERROR([.R478]);TRUE();FALSE());IF(ISERROR([.R478]);FALSE();[.A484]=[.R478])) -> false
A479: of:=LOOKUP([.N481];[.K475:.L482]) -> George | B479: George | C479: of:=[.A479]=[.B479] -> true | D479: of:=FORMULA([.A479]) -> =LOOKUP(N481,K475:L482) | F479: C | G479: Charlie3 | I479: E | K479: e | L479: Edward | N479: E | T479: of:=IF(ISERROR([.A485]);IF(ISERROR([.R479]);TRUE();FALSE());IF(ISERROR([.R479]);FALSE();[.A485]=[.R479])) -> false
A480: of:=LOOKUP([.N482];[.K475:.L482]) -> Henry | B480: Henry | C480: of:=[.A480]=[.B480] -> true | D480: of:=FORMULA([.A480]) -> =LOOKUP(N482,K475:L482) | F480: C | G480: Charlie4 | I480: F | K480: F | L480: Frank | N480: f | T480: of:=IF(ISERROR([.A486]);IF(ISERROR([.R480]);TRUE();FALSE());IF(ISERROR([.R480]);FALSE();[.A486]=[.R480])) -> false
A481: of:=LOOKUP([.N475];[.K475:.K482];[.L475:.L482]) -> Andy | B481: Andy | C481: of:=[.A481]=[.B481] -> true | D481: of:=FORMULA([.A481]) -> =LOOKUP(N475,K475:K482,L475:L482) | F481: C | G481: Charlie5 | K481: g | L481: George | N481: G | T481: of:=IF(ISERROR([.A487]);IF(ISERROR([.R481]);TRUE();FALSE());IF(ISERROR([.R481]);FALSE();[.A487]=[.R481])) -> false
A482: of:=LOOKUP([.N476];[.K475:.K482];[.L475:.L482]) -> Bruce | B482: Bruce | C482: of:=[.A482]=[.B482] -> true | D482: of:=FORMULA([.A482]) -> =LOOKUP(N476,K475:K482,L475:L482) | F482: D | G482: David | K482: H | L482: Henry | N482: h | T482: of:=IF(ISERROR([.A488]);IF(ISERROR([.R482]);TRUE();FALSE());IF(ISERROR([.R482]);FALSE();[.A488]=[.R482])) -> false
A483: of:=LOOKUP([.N477];[.K475:.K482];[.L475:.L482]) -> Charlie | B483: Charlie | C483: of:=[.A483]=[.B483] -> true | D483: of:=FORMULA([.A483]) -> =LOOKUP(N477,K475:K482,L475:L482) | F483: E | G483: Edward
A484: of:=LOOKUP([.N478];[.K475:.K482];[.L475:.L482]) -> David | B484: David | C484: of:=[.A484]=[.B484] -> true | D484: of:=FORMULA([.A484]) -> =LOOKUP(N478,K475:K482,L475:L482) | F484: F | G484: Frank
A485: of:=LOOKUP([.N479];[.K475:.K482];[.L475:.L482]) -> Edward | B485: Edward | C485: of:=[.A485]=[.B485] -> true | D485: of:=FORMULA([.A485]) -> =LOOKUP(N479,K475:K482,L475:L482)
A486: of:=LOOKUP([.N480];[.K475:.K482];[.L475:.L482]) -> Frank | B486: Frank | C486: of:=[.A486]=[.B486] -> true | D486: of:=FORMULA([.A486]) -> =LOOKUP(N480,K475:K482,L475:L482)
A487: of:=LOOKUP([.N481];[.K475:.K482];[.L475:.L482]) -> George | B487: George | C487: of:=[.A487]=[.B487] -> true | D487: of:=FORMULA([.A487]) -> =LOOKUP(N481,K475:K482,L475:L482)
A488: of:=LOOKUP([.N482];[.K475:.K482];[.L475:.L482]) -> Henry | B488: Henry | C488: of:=[.A488]=[.B488] -> true | D488: of:=FORMULA([.A488]) -> =LOOKUP(N482,K475:K482,L475:L482) | F488: c | G488: Value | H488: Target | I488: Formula
A489: of:=LOOKUP([.H489];[.F489:.F528]) -> 8 | B489: 8 | C489: of:=[.A489]=[.B489] -> true | D489: of:=FORMULA([.A489]) -> =LOOKUP(H489,F489:F528) | F489: 1 | G489: of:=CONCATENATE("Res";[.F489]) -> Res1 | H489: 8.95370887542645
A490: of:=LOOKUP([.H490];[.F489:.F528]) ->  | B490: of:=NA() ->  | C490: of:=ISERROR([.A490]) -> true | D490: of:=FORMULA([.A490]) -> =LOOKUP(H490,F489:F528) | F490: 2 | G490: of:=CONCATENATE("Res";[.F490]) -> Res2 | H490: -5.40458751555081
A491: of:=LOOKUP([.H491];[.F489:.F528]) -> 14 | B491: 14 | C491: of:=[.A491]=[.B491] -> true | D491: of:=FORMULA([.A491]) -> =LOOKUP(H491,F489:F528) | F491: 3 | G491: of:=CONCATENATE("Res";[.F491]) -> Res3 | H491: 14.2256297754681
A492: of:=LOOKUP([.H492];[.F489:.F528]) -> 22 | B492: 22 | C492: of:=[.A492]=[.B492] -> true | D492: of:=FORMULA([.A492]) -> =LOOKUP(H492,F489:F528) | F492: 4 | G492: of:=CONCATENATE("Res";[.F492]) -> Res4 | H492: 22.5896448722584
A493: of:=LOOKUP([.H493];[.F489:.F528]) -> 25 | B493: 25 | C493: of:=[.A493]=[.B493] -> true | D493: of:=FORMULA([.A493]) -> =LOOKUP(H493,F489:F528) | F493: 5 | G493: of:=CONCATENATE("Res";[.F493]) -> Res5 | H493: 25.5819104499515
A494: of:=LOOKUP([.H494];[.F489:.F528]) -> 12 | B494: 12 | C494: of:=[.A494]=[.B494] -> true | D494: of:=FORMULA([.A494]) -> =LOOKUP(H494,F489:F528) | F494: 6 | G494: of:=CONCATENATE("Res";[.F494]) -> Res6 | H494: 12.6221489733041
A495: of:=LOOKUP([.H495];[.F489:.F528]) ->  | B495: of:=NA() ->  | C495: of:=ISERROR([.A495]) -> true | D495: of:=FORMULA([.A495]) -> =LOOKUP(H495,F489:F528) | F495: 7 | G495: of:=CONCATENATE("Res";[.F495]) -> Res7 | H495: -5.19531318050678
A496: of:=LOOKUP([.H496];[.F489:.F528]) -> 29 | B496: 29 | C496: of:=[.A496]=[.B496] -> true | D496: of:=FORMULA([.A496]) -> =LOOKUP(H496,F489:F528) | F496: 8 | G496: of:=CONCATENATE("Res";[.F496]) -> Res8 | H496: 29.5088742428718
A497: of:=LOOKUP([.H497];[.F489:.F528]) ->  | B497: of:=NA() ->  | C497: of:=ISERROR([.A497]) -> true | D497: of:=FORMULA([.A497]) -> =LOOKUP(H497,F489:F528) | F497: 9 | G497: of:=CONCATENATE("Res";[.F497]) -> Res9 | H497: -0.666440755846702
A498: of:=LOOKUP([.H498];[.F489:.F528]) -> 40 | B498: 40 | C498: of:=[.A498]=[.B498] -> true | D498: of:=FORMULA([.A498]) -> =LOOKUP(H498,F489:F528) | F498: 10 | G498: of:=CONCATENATE("Res";[.F498]) -> Res10 | H498: 47.5649568295371
A499: of:=LOOKUP([.H499];[.F489:.F528]) -> 28 | B499: 28 | C499: of:=[.A499]=[.B499] -> true | D499: of:=FORMULA([.A499]) -> =LOOKUP(H499,F489:F528) | F499: 11 | G499: of:=CONCATENATE("Res";[.F499]) -> Res11 | H499: 28.1206428839629
A500: of:=LOOKUP([.H500];[.F489:.F528]) -> 40 | B500: 40 | C500: of:=[.A500]=[.B500] -> true | D500: of:=FORMULA([.A500]) -> =LOOKUP(H500,F489:F528) | F500: 12 | G500: of:=CONCATENATE("Res";[.F500]) -> Res12 | H500: 45.5133833999322
A501: of:=LOOKUP([.H501];[.F489:.F528]) -> 39 | B501: 39 | C501: of:=[.A501]=[.B501] -> true | D501: of:=FORMULA([.A501]) -> =LOOKUP(H501,F489:F528) | F501: 13 | G501: of:=CONCATENATE("Res";[.F501]) -> Res13 | H501: 39.6179907338434
A502: of:=LOOKUP([.H502];[.F489:.F528]) -> 40 | B502: 40 | C502: of:=[.A502]=[.B502] -> true | D502: of:=FORMULA([.A502]) -> =LOOKUP(H502,F489:F528) | F502: 14 | G502: of:=CONCATENATE("Res";[.F502]) -> Res14 | H502: 40.966617076512
A503: of:=LOOKUP([.H503];[.F489:.F528]) -> 25 | B503: 25 | C503: of:=[.A503]=[.B503] -> true | D503: of:=FORMULA([.A503]) -> =LOOKUP(H503,F489:F528) | F503: 15 | G503: of:=CONCATENATE("Res";[.F503]) -> Res15 | H503: 25.8259284242617
A504: of:=LOOKUP([.H504];[.F489:.F528]) -> 9 | B504: 9 | C504: of:=[.A504]=[.B504] -> true | D504: of:=FORMULA([.A504]) -> =LOOKUP(H504,F489:F528) | F504: 16 | G504: of:=CONCATENATE("Res";[.F504]) -> Res16 | H504: 9.12267467377832
A505: of:=LOOKUP([.H505];[.F489:.F528]) -> 6 | B505: 6 | C505: of:=[.A505]=[.B505] -> true | D505: of:=FORMULA([.A505]) -> =LOOKUP(H505,F489:F528) | F505: 17 | G505: of:=CONCATENATE("Res";[.F505]) -> Res17 | H505: 6.46759117691756
A506: of:=LOOKUP([.H506];[.F489:.F528]) -> 30 | B506: 30 | C506: of:=[.A506]=[.B506] -> true | D506: of:=FORMULA([.A506]) -> =LOOKUP(H506,F489:F528) | F506: 18 | G506: of:=CONCATENATE("Res";[.F506]) -> Res18 | H506: 30.892568507333
A507: of:=LOOKUP([.H507];[.F489:.F528]) -> 28 | B507: 28 | C507: of:=[.A507]=[.B507] -> true | D507: of:=FORMULA([.A507]) -> =LOOKUP(H507,F489:F528) | F507: 19 | G507: of:=CONCATENATE("Res";[.F507]) -> Res19 | H507: 28.5949305176141
A508: of:=LOOKUP([.H508];[.F489:.F528]) -> 23 | B508: 23 | C508: of:=[.A508]=[.B508] -> true | D508: of:=FORMULA([.A508]) -> =LOOKUP(H508,F489:F528) | F508: 20 | G508: of:=CONCATENATE("Res";[.F508]) -> Res20 | H508: 23.4922334876289
A509: of:=LOOKUP([.H509];[.F489:.F528]) -> 9 | B509: 9 | C509: of:=[.A509]=[.B509] -> true | D509: of:=FORMULA([.A509]) -> =LOOKUP(H509,F489:F528) | F509: 21 | G509: of:=CONCATENATE("Res";[.F509]) -> Res21 | H509: 9.9047020034232
A510: of:=LOOKUP([.H510];[.F489:.F528]) -> 6 | B510: 6 | C510: of:=[.A510]=[.B510] -> true | D510: of:=FORMULA([.A510]) -> =LOOKUP(H510,F489:F528) | F510: 22 | G510: of:=CONCATENATE("Res";[.F510]) -> Res22 | H510: 6.75799561922819
A511: of:=LOOKUP([.H511];[.F489:.F528]) -> 2 | B511: 2 | C511: of:=[.A511]=[.B511] -> true | D511: of:=FORMULA([.A511]) -> =LOOKUP(H511,F489:F528) | F511: 23 | G511: of:=CONCATENATE("Res";[.F511]) -> Res23 | H511: 2.95459644009574
A512: of:=LOOKUP([.H512];[.F489:.F528]) -> 29 | B512: 29 | C512: of:=[.A512]=[.B512] -> true | D512: of:=FORMULA([.A512]) -> =LOOKUP(H512,F489:F528) | F512: 24 | G512: of:=CONCATENATE("Res";[.F512]) -> Res24 | H512: 29.7712581802436
A513: of:=LOOKUP([.H513];[.F489:.F528]) ->  | B513: of:=NA() ->  | C513: of:=ISERROR([.A513]) -> true | D513: of:=FORMULA([.A513]) -> =LOOKUP(H513,F489:F528) | F513: 25 | G513: of:=CONCATENATE("Res";[.F513]) -> Res25 | H513: -3.79379182727252
A514: of:=LOOKUP([.H514];[.F489:.F528]) ->  | B514: of:=NA() ->  | C514: of:=ISERROR([.A514]) -> true | D514: of:=FORMULA([.A514]) -> =LOOKUP(H514,F489:F528) | F514: 26 | G514: of:=CONCATENATE("Res";[.F514]) -> Res26 | H514: -6.14991564343158
A515: of:=LOOKUP([.H515];[.F489:.F528]) -> 14 | B515: 14 | C515: of:=[.A515]=[.B515] -> true | D515: of:=FORMULA([.A515]) -> =LOOKUP(H515,F489:F528) | F515: 27 | G515: of:=CONCATENATE("Res";[.F515]) -> Res27 | H515: 14.3580858584808
A516: of:=LOOKUP([.H516];[.F489:.F528]) -> 3 | B516: 3 | C516: of:=[.A516]=[.B516] -> true | D516: of:=FORMULA([.A516]) -> =LOOKUP(H516,F489:F528) | F516: 28 | G516: of:=CONCATENATE("Res";[.F516]) -> Res28 | H516: 3.4408361400043
A517: of:=LOOKUP([.H517];[.F489:.F528]) -> 5 | B517: 5 | C517: of:=[.A517]=[.B517] -> true | D517: of:=FORMULA([.A517]) -> =LOOKUP(H517,F489:F528) | F517: 29 | G517: of:=CONCATENATE("Res";[.F517]) -> Res29 | H517: 5.1313509822275
A518: of:=LOOKUP([.H518];[.F489:.F528]) -> 40 | B518: 40 | C518: of:=[.A518]=[.B518] -> true | D518: of:=FORMULA([.A518]) -> =LOOKUP(H518,F489:F528) | F518: 30 | G518: of:=CONCATENATE("Res";[.F518]) -> Res30 | H518: 47.6776164562826
A519: of:=LOOKUP([.H519];[.F489:.F528]) ->  | B519: of:=NA() ->  | C519: of:=ISERROR([.A519]) -> true | D519: of:=FORMULA([.A519]) -> =LOOKUP(H519,F489:F528) | F519: 31 | G519: of:=CONCATENATE("Res";[.F519]) -> Res31 | H519: -5.44916284816093
A520: of:=LOOKUP([.H520];[.F489:.F528]) ->  | B520: of:=NA() ->  | C520: of:=ISERROR([.A520]) -> true | D520: of:=FORMULA([.A520]) -> =LOOKUP(H520,F489:F528) | F520: 32 | G520: of:=CONCATENATE("Res";[.F520]) -> Res32 | H520: -3.54871178850439
A521: of:=LOOKUP([.H521];[.F489:.F528]) ->  | B521: of:=NA() ->  | C521: of:=ISERROR([.A521]) -> true | D521: of:=FORMULA([.A521]) -> =LOOKUP(H521,F489:F528) | F521: 33 | G521: of:=CONCATENATE("Res";[.F521]) -> Res33 | H521: 0.781145098434259
A522: of:=LOOKUP([.H522];[.F489:.F528]) -> 40 | B522: 40 | C522: of:=[.A522]=[.B522] -> true | D522: of:=FORMULA([.A522]) -> =LOOKUP(H522,F489:F528) | F522: 34 | G522: of:=CONCATENATE("Res";[.F522]) -> Res34 | H522: 44.3056317228615
A523: of:=LOOKUP([.H523];[.F489:.F528]) ->  | B523: of:=NA() ->  | C523: of:=ISERROR([.A523]) -> true | D523: of:=FORMULA([.A523]) -> =LOOKUP(H523,F489:F528) | F523: 35 | G523: of:=CONCATENATE("Res";[.F523]) -> Res35 | H523: -1.71122977764052
A524: of:=LOOKUP([.H524];[.F489:.F528]) -> 40 | B524: 40 | C524: of:=[.A524]=[.B524] -> true | D524: of:=FORMULA([.A524]) -> =LOOKUP(H524,F489:F528) | F524: 36 | G524: of:=CONCATENATE("Res";[.F524]) -> Res36 | H524: 46.6919737925024
A525: of:=LOOKUP([.H525];[.F489:.F528]) -> 34 | B525: 34 | C525: of:=[.A525]=[.B525] -> true | D525: of:=FORMULA([.A525]) -> =LOOKUP(H525,F489:F528) | F525: 37 | G525: of:=CONCATENATE("Res";[.F525]) -> Res37 | H525: 34.5542361657355
A526: of:=LOOKUP([.H526];[.F489:.F528]) -> 40 | B526: 40 | C526: of:=[.A526]=[.B526] -> true | D526: of:=FORMULA([.A526]) -> =LOOKUP(H526,F489:F528) | F526: 38 | G526: of:=CONCATENATE("Res";[.F526]) -> Res38 | H526: 49.8330036884452
A527: of:=LOOKUP([.H527];[.F489:.F528]) -> 40 | B527: 40 | C527: of:=[.A527]=[.B527] -> true | D527: of:=FORMULA([.A527]) -> =LOOKUP(H527,F489:F528) | F527: 39 | G527: of:=CONCATENATE("Res";[.F527]) -> Res39 | H527: 42.6088442205808
A528: of:=LOOKUP([.H528];[.F489:.F528]) -> 14 | B528: 14 | C528: of:=[.A528]=[.B528] -> true | D528: of:=FORMULA([.A528]) -> =LOOKUP(H528,F489:F528) | F528: 40 | G528: of:=CONCATENATE("Res";[.F528]) -> Res40 | H528: 14.1387103236814
A529: of:=LOOKUP([.H489];[.F489:.G528]) -> Res8 | B529: Res8 | C529: of:=[.A529]=[.B529] -> true | D529: of:=FORMULA([.A529]) -> =LOOKUP(H489,F489:G528)
A530: of:=LOOKUP([.H490];[.F489:.G528]) ->  | B530: of:=NA() ->  | C530: of:=ISERROR([.A530]) -> true | D530: of:=FORMULA([.A530]) -> =LOOKUP(H490,F489:G528)
A531: of:=LOOKUP([.H491];[.F489:.G528]) -> Res14 | B531: Res14 | C531: of:=[.A531]=[.B531] -> true | D531: of:=FORMULA([.A531]) -> =LOOKUP(H491,F489:G528)
A532: of:=LOOKUP([.H492];[.F489:.G528]) -> Res22 | B532: Res22 | C532: of:=[.A532]=[.B532] -> true | D532: of:=FORMULA([.A532]) -> =LOOKUP(H492,F489:G528)
A533: of:=LOOKUP([.H493];[.F489:.G528]) -> Res25 | B533: Res25 | C533: of:=[.A533]=[.B533] -> true | D533: of:=FORMULA([.A533]) -> =LOOKUP(H493,F489:G528)
A534: of:=LOOKUP([.H494];[.F489:.G528]) -> Res12 | B534: Res12 | C534: of:=[.A534]=[.B534] -> true | D534: of:=FORMULA([.A534]) -> =LOOKUP(H494,F489:G528)
A535: of:=LOOKUP([.H495];[.F489:.G528]) ->  | B535: of:=NA() ->  | C535: of:=ISERROR([.A535]) -> true | D535: of:=FORMULA([.A535]) -> =LOOKUP(H495,F489:G528)
A536: of:=LOOKUP([.H496];[.F489:.G528]) -> Res29 | B536: Res29 | C536: of:=[.A536]=[.B536] -> true | D536: of:=FORMULA([.A536]) -> =LOOKUP(H496,F489:G528)
A537: of:=LOOKUP([.H497];[.F489:.G528]) ->  | B537: of:=NA() ->  | C537: of:=ISERROR([.A537]) -> true | D537: of:=FORMULA([.A537]) -> =LOOKUP(H497,F489:G528)
A538: of:=LOOKUP([.H498];[.F489:.G528]) -> Res40 | B538: Res40 | C538: of:=[.A538]=[.B538] -> true | D538: of:=FORMULA([.A538]) -> =LOOKUP(H498,F489:G528)
A539: of:=LOOKUP([.H499];[.F489:.G528]) -> Res28 | B539: Res28 | C539: of:=[.A539]=[.B539] -> true | D539: of:=FORMULA([.A539]) -> =LOOKUP(H499,F489:G528)
A540: of:=LOOKUP([.H500];[.F489:.G528]) -> Res40 | B540: Res40 | C540: of:=[.A540]=[.B540] -> true | D540: of:=FORMULA([.A540]) -> =LOOKUP(H500,F489:G528)
A541: of:=LOOKUP([.H501];[.F489:.G528]) -> Res39 | B541: Res39 | C541: of:=[.A541]=[.B541] -> true | D541: of:=FORMULA([.A541]) -> =LOOKUP(H501,F489:G528)
A542: of:=LOOKUP([.H502];[.F489:.G528]) -> Res40 | B542: Res40 | C542: of:=[.A542]=[.B542] -> true | D542: of:=FORMULA([.A542]) -> =LOOKUP(H502,F489:G528)
A543: of:=LOOKUP([.H503];[.F489:.G528]) -> Res25 | B543: Res25 | C543: of:=[.A543]=[.B543] -> true | D543: of:=FORMULA([.A543]) -> =LOOKUP(H503,F489:G528)
A544: of:=LOOKUP([.H504];[.F489:.G528]) -> Res9 | B544: Res9 | C544: of:=[.A544]=[.B544] -> true | D544: of:=FORMULA([.A544]) -> =LOOKUP(H504,F489:G528)
A545: of:=LOOKUP([.H505];[.F489:.G528]) -> Res6 | B545: Res6 | C545: of:=[.A545]=[.B545] -> true | D545: of:=FORMULA([.A545]) -> =LOOKUP(H505,F489:G528)
A546: of:=LOOKUP([.H506];[.F489:.G528]) -> Res30 | B546: Res30 | C546: of:=[.A546]=[.B546] -> true | D546: of:=FORMULA([.A546]) -> =LOOKUP(H506,F489:G528)
A547: of:=LOOKUP([.H507];[.F489:.G528]) -> Res28 | B547: Res28 | C547: of:=[.A547]=[.B547] -> true | D547: of:=FORMULA([.A547]) -> =LOOKUP(H507,F489:G528)
A548: of:=LOOKUP([.H508];[.F489:.G528]) -> Res23 | B548: Res23 | C548: of:=[.A548]=[.B548] -> true | D548: of:=FORMULA([.A548]) -> =LOOKUP(H508,F489:G528)
A549: of:=LOOKUP([.H509];[.F489:.G528]) -> Res9 | B549: Res9 | C549: of:=[.A549]=[.B549] -> true | D549: of:=FORMULA([.A549]) -> =LOOKUP(H509,F489:G528)
A550: of:=LOOKUP([.H510];[.F489:.G528]) -> Res6 | B550: Res6 | C550: of:=[.A550]=[.B550] -> true | D550: of:=FORMULA([.A550]) -> =LOOKUP(H510,F489:G528)
A551: of:=LOOKUP([.H511];[.F489:.G528]) -> Res2 | B551: Res2 | C551: of:=[.A551]=[.B551] -> true | D551: of:=FORMULA([.A551]) -> =LOOKUP(H511,F489:G528)
A552: of:=LOOKUP([.H512];[.F489:.G528]) -> Res29 | B552: Res29 | C552: of:=[.A552]=[.B552] -> true | D552: of:=FORMULA([.A552]) -> =LOOKUP(H512,F489:G528)
A553: of:=LOOKUP([.H513];[.F489:.G528]) ->  | B553: of:=NA() ->  | C553: of:=ISERROR([.A553]) -> true | D553: of:=FORMULA([.A553]) -> =LOOKUP(H513,F489:G528)
A554: of:=LOOKUP([.H514];[.F489:.G528]) ->  | B554: of:=NA() ->  | C554: of:=ISERROR([.A554]) -> true | D554: of:=FORMULA([.A554]) -> =LOOKUP(H514,F489:G528)
A555: of:=LOOKUP([.H515];[.F489:.G528]) -> Res14 | B555: Res14 | C555: of:=[.A555]=[.B555] -> true | D555: of:=FORMULA([.A555]) -> =LOOKUP(H515,F489:G528)
A556: of:=LOOKUP([.H516];[.F489:.G528]) -> Res3 | B556: Res3 | C556: of:=[.A556]=[.B556] -> true | D556: of:=FORMULA([.A556]) -> =LOOKUP(H516,F489:G528)
A557: of:=LOOKUP([.H517];[.F489:.G528]) -> Res5 | B557: Res5 | C557: of:=[.A557]=[.B557] -> true | D557: of:=FORMULA([.A557]) -> =LOOKUP(H517,F489:G528)
A558: of:=LOOKUP([.H518];[.F489:.G528]) -> Res40 | B558: Res40 | C558: of:=[.A558]=[.B558] -> true | D558: of:=FORMULA([.A558]) -> =LOOKUP(H518,F489:G528)
A559: of:=LOOKUP([.H519];[.F489:.G528]) ->  | B559: of:=NA() ->  | C559: of:=ISERROR([.A559]) -> true | D559: of:=FORMULA([.A559]) -> =LOOKUP(H519,F489:G528)
A560: of:=LOOKUP([.H520];[.F489:.G528]) ->  | B560: of:=NA() ->  | C560: of:=ISERROR([.A560]) -> true | D560: of:=FORMULA([.A560]) -> =LOOKUP(H520,F489:G528)
A561: of:=LOOKUP([.H521];[.F489:.G528]) ->  | B561: of:=NA() ->  | C561: of:=ISERROR([.A561]) -> true | D561: of:=FORMULA([.A561]) -> =LOOKUP(H521,F489:G528)
A562: of:=LOOKUP([.H522];[.F489:.G528]) -> Res40 | B562: Res40 | C562: of:=[.A562]=[.B562] -> true | D562: of:=FORMULA([.A562]) -> =LOOKUP(H522,F489:G528)
A563: of:=LOOKUP([.H523];[.F489:.G528]) ->  | B563: of:=NA() ->  | C563: of:=ISERROR([.A563]) -> true | D563: of:=FORMULA([.A563]) -> =LOOKUP(H523,F489:G528)
A564: of:=LOOKUP([.H524];[.F489:.G528]) -> Res40 | B564: Res40 | C564: of:=[.A564]=[.B564] -> true | D564: of:=FORMULA([.A564]) -> =LOOKUP(H524,F489:G528)
A565: of:=LOOKUP([.H525];[.F489:.G528]) -> Res34 | B565: Res34 | C565: of:=[.A565]=[.B565] -> true | D565: of:=FORMULA([.A565]) -> =LOOKUP(H525,F489:G528)
A566: of:=LOOKUP([.H526];[.F489:.G528]) -> Res40 | B566: Res40 | C566: of:=[.A566]=[.B566] -> true | D566: of:=FORMULA([.A566]) -> =LOOKUP(H526,F489:G528)
A567: of:=LOOKUP([.H527];[.F489:.G528]) -> Res40 | B567: Res40 | C567: of:=[.A567]=[.B567] -> true | D567: of:=FORMULA([.A567]) -> =LOOKUP(H527,F489:G528)
A568: of:=LOOKUP([.H528];[.F489:.G528]) -> Res14 | B568: Res14 | C568: of:=[.A568]=[.B568] -> true | D568: of:=FORMULA([.A568]) -> =LOOKUP(H528,F489:G528) | F568: Numbers
A569: of:=LOOKUP([.H570];MMULT([.F570:.F609];1)) ->  | B569: of:=NA() ->  | C569: of:=ISERROR([.A569]) -> true | D569: of:=FORMULA([.A569]) -> =LOOKUP(H570,MMULT(F570:F609,1)) | F569: Data | G569: Result | H569: Target | I569: Formula | N569: Excel XP | S569: Check
A570: of:=LOOKUP([.H571];MMULT([.F570:.F609];1)) -> 9 | B570: 9 | C570: of:=[.A570]=[.B570] -> true | D570: of:=FORMULA([.A570]) -> =LOOKUP(H571,MMULT(F570:F609,1)) | F570: 1 | G570: of:=[.F570]*10 -> 10 | H570: -4.53336217568421 | L570: of:=LOOKUP([.H570];MMULT([.F570:.G609];1)) ->  | M570: of:=LOOKUP([.H$570];MMULT([.F570:.G609];1);MMULT([.G$570:.G609];1)) ->  | Q570: = | R570: = | S570: of:=IF(ISERROR([.A569]);IF(ISERROR([.B569]);TRUE();FALSE());IF(ISERROR([.B569]);FALSE();[.A569]=[.B569])) -> true | T570: of:=IF(ISERROR([.A612]);IF(ISERROR([.B612]);TRUE();FALSE());IF(ISERROR([.B612]);FALSE();[.A612]=[.B612])) -> true | U570: of:=IF(ISERROR([.A655]);IF(ISERROR([.B655]);TRUE();FALSE());IF(ISERROR([.B655]);FALSE();[.A655]=[.B655])) -> true | V570: of:=IF(ISERROR([.L570]);IF(ISERROR([.Q570]);TRUE();FALSE());IF(ISERROR([.Q570]);FALSE();[.L570]=[.Q570])) -> false | W570: of:=IF(ISERROR([.M570]);IF(ISERROR([.R570]);TRUE();FALSE());IF(ISERROR([.R570]);FALSE();[.M570]=[.R570])) -> false
A571: of:=LOOKUP([.H572];MMULT([.F570:.F609];1)) -> 15 | B571: 15 | C571: of:=[.A571]=[.B571] -> true | D571: of:=FORMULA([.A571]) -> =LOOKUP(H572,MMULT(F570:F609,1)) | F571: 2 | G571: of:=[.F571]*10 -> 20 | H571: 9.70396666611532 | L571: of:=LOOKUP([.H571];MMULT([.F570:.G609];1)) ->  | M571: of:=LOOKUP([.H$571];MMULT([.F570:.G609];1);MMULT([.G$571:.G609];1)) ->  | Q571: = | R571: = | S571: of:=IF(ISERROR([.A570]);IF(ISERROR([.B570]);TRUE();FALSE());IF(ISERROR([.B570]);FALSE();[.A570]=[.B570])) -> true | T571: of:=IF(ISERROR([.A613]);IF(ISERROR([.B613]);TRUE();FALSE());IF(ISERROR([.B613]);FALSE();[.A613]=[.B613])) -> true | U571: of:=IF(ISERROR([.A656]);IF(ISERROR([.B656]);TRUE();FALSE());IF(ISERROR([.B656]);FALSE();[.A656]=[.B656])) -> true | V571: of:=IF(ISERROR([.L571]);IF(ISERROR([.Q571]);TRUE();FALSE());IF(ISERROR([.Q571]);FALSE();[.L571]=[.Q571])) -> false | W571: of:=IF(ISERROR([.M571]);IF(ISERROR([.R571]);TRUE();FALSE());IF(ISERROR([.R571]);FALSE();[.M571]=[.R571])) -> false
A572: of:=LOOKUP([.H573];MMULT([.F570:.F609];1)) -> 9 | B572: 9 | C572: of:=[.A572]=[.B572] -> true | D572: of:=FORMULA([.A572]) -> =LOOKUP(H573,MMULT(F570:F609,1)) | F572: 3 | G572: of:=[.F572]*10 -> 30 | H572: 15.3362479185479 | L572: of:=LOOKUP([.H572];MMULT([.F570:.G609];1)) ->  | M572: of:=LOOKUP([.H$572];MMULT([.F570:.G609];1);MMULT([.G$572:.G609];1)) ->  | Q572: = | R572: = | S572: of:=IF(ISERROR([.A571]);IF(ISERROR([.B571]);TRUE();FALSE());IF(ISERROR([.B571]);FALSE();[.A571]=[.B571])) -> true | T572: of:=IF(ISERROR([.A614]);IF(ISERROR([.B614]);TRUE();FALSE());IF(ISERROR([.B614]);FALSE();[.A614]=[.B614])) -> true | U572: of:=IF(ISERROR([.A657]);IF(ISERROR([.B657]);TRUE();FALSE());IF(ISERROR([.B657]);FALSE();[.A657]=[.B657])) -> true | V572: of:=IF(ISERROR([.L572]);IF(ISERROR([.Q572]);TRUE();FALSE());IF(ISERROR([.Q572]);FALSE();[.L572]=[.Q572])) -> false | W572: of:=IF(ISERROR([.M572]);IF(ISERROR([.R572]);TRUE();FALSE());IF(ISERROR([.R572]);FALSE();[.M572]=[.R572])) -> false
A573: of:=LOOKUP([.H574];MMULT([.F570:.F609];1)) ->  | B573: of:=NA() ->  | C573: of:=ISERROR([.A573]) -> true | D573: of:=FORMULA([.A573]) -> =LOOKUP(H574,MMULT(F570:F609,1)) | F573: 4 | G573: of:=[.F573]*10 -> 40 | H573: 9.97042805851738 | L573: of:=LOOKUP([.H573];MMULT([.F570:.G609];1)) ->  | M573: of:=LOOKUP([.H$573];MMULT([.F570:.G609];1);MMULT([.G$573:.G609];1)) ->  | Q573: = | R573: = | S573: of:=IF(ISERROR([.A572]);IF(ISERROR([.B572]);TRUE();FALSE());IF(ISERROR([.B572]);FALSE();[.A572]=[.B572])) -> true | T573: of:=IF(ISERROR([.A615]);IF(ISERROR([.B615]);TRUE();FALSE());IF(ISERROR([.B615]);FALSE();[.A615]=[.B615])) -> true | U573: of:=IF(ISERROR([.A658]);IF(ISERROR([.B658]);TRUE();FALSE());IF(ISERROR([.B658]);FALSE();[.A658]=[.B658])) -> true | V573: of:=IF(ISERROR([.L573]);IF(ISERROR([.Q573]);TRUE();FALSE());IF(ISERROR([.Q573]);FALSE();[.L573]=[.Q573])) -> false | W573: of:=IF(ISERROR([.M573]);IF(ISERROR([.R573]);TRUE();FALSE());IF(ISERROR([.R573]);FALSE();[.M573]=[.R573])) -> false
A574: of:=LOOKUP([.H575];MMULT([.F570:.F609];1)) ->  | B574: of:=NA() ->  | C574: of:=ISERROR([.A574]) -> true | D574: of:=FORMULA([.A574]) -> =LOOKUP(H575,MMULT(F570:F609,1)) | F574: 5 | G574: of:=[.F574]*10 -> 50 | H574: -7.74641730083382 | L574: of:=LOOKUP([.H574];MMULT([.F570:.G609];1)) ->  | M574: of:=LOOKUP([.H$574];MMULT([.F570:.G609];1);MMULT([.G$574:.G609];1)) ->  | Q574: = | R574: = | S574: of:=IF(ISERROR([.A573]);IF(ISERROR([.B573]);TRUE();FALSE());IF(ISERROR([.B573]);FALSE();[.A573]=[.B573])) -> true | T574: of:=IF(ISERROR([.A616]);IF(ISERROR([.B616]);TRUE();FALSE());IF(ISERROR([.B616]);FALSE();[.A616]=[.B616])) -> true | U574: of:=IF(ISERROR([.A659]);IF(ISERROR([.B659]);TRUE();FALSE());IF(ISERROR([.B659]);FALSE();[.A659]=[.B659])) -> true | V574: of:=IF(ISERROR([.L574]);IF(ISERROR([.Q574]);TRUE();FALSE());IF(ISERROR([.Q574]);FALSE();[.L574]=[.Q574])) -> false | W574: of:=IF(ISERROR([.M574]);IF(ISERROR([.R574]);TRUE();FALSE());IF(ISERROR([.R574]);FALSE();[.M574]=[.R574])) -> false
A575: of:=LOOKUP([.H576];MMULT([.F570:.F609];1)) -> 20 | B575: 20 | C575: of:=[.A575]=[.B575] -> true | D575: of:=FORMULA([.A575]) -> =LOOKUP(H576,MMULT(F570:F609,1)) | F575: 6 | G575: of:=[.F575]*10 -> 60 | H575: -4.88469148891315 | L575: of:=LOOKUP([.H575];MMULT([.F570:.G609];1)) ->  | M575: of:=LOOKUP([.H$575];MMULT([.F570:.G609];1);MMULT([.G$575:.G609];1)) ->  | Q575: = | R575: = | S575: of:=IF(ISERROR([.A574]);IF(ISERROR([.B574]);TRUE();FALSE());IF(ISERROR([.B574]);FALSE();[.A574]=[.B574])) -> true | T575: of:=IF(ISERROR([.A617]);IF(ISERROR([.B617]);TRUE();FALSE());IF(ISERROR([.B617]);FALSE();[.A617]=[.B617])) -> true | U575: of:=IF(ISERROR([.A660]);IF(ISERROR([.B660]);TRUE();FALSE());IF(ISERROR([.B660]);FALSE();[.A660]=[.B660])) -> true | V575: of:=IF(ISERROR([.L575]);IF(ISERROR([.Q575]);TRUE();FALSE());IF(ISERROR([.Q575]);FALSE();[.L575]=[.Q575])) -> false | W575: of:=IF(ISERROR([.M575]);IF(ISERROR([.R575]);TRUE();FALSE());IF(ISERROR([.R575]);FALSE();[.M575]=[.R575])) -> false
A576: of:=LOOKUP([.H577];MMULT([.F570:.F609];1)) -> 40 | B576: 40 | C576: of:=[.A576]=[.B576] -> true | D576: of:=FORMULA([.A576]) -> =LOOKUP(H577,MMULT(F570:F609,1)) | F576: 7 | G576: of:=[.F576]*10 -> 70 | H576: 20.1245073839552 | L576: of:=LOOKUP([.H576];MMULT([.F570:.G609];1)) ->  | M576: of:=LOOKUP([.H$576];MMULT([.F570:.G609];1);MMULT([.G$576:.G609];1)) ->  | Q576: = | R576: = | S576: of:=IF(ISERROR([.A575]);IF(ISERROR([.B575]);TRUE();FALSE());IF(ISERROR([.B575]);FALSE();[.A575]=[.B575])) -> true | T576: of:=IF(ISERROR([.A618]);IF(ISERROR([.B618]);TRUE();FALSE());IF(ISERROR([.B618]);FALSE();[.A618]=[.B618])) -> true | U576: of:=IF(ISERROR([.A661]);IF(ISERROR([.B661]);TRUE();FALSE());IF(ISERROR([.B661]);FALSE();[.A661]=[.B661])) -> true | V576: of:=IF(ISERROR([.L576]);IF(ISERROR([.Q576]);TRUE();FALSE());IF(ISERROR([.Q576]);FALSE();[.L576]=[.Q576])) -> false | W576: of:=IF(ISERROR([.M576]);IF(ISERROR([.R576]);TRUE();FALSE());IF(ISERROR([.R576]);FALSE();[.M576]=[.R576])) -> false
A577: of:=LOOKUP([.H578];MMULT([.F570:.F609];1)) -> 28 | B577: 28 | C577: of:=[.A577]=[.B577] -> true | D577: of:=FORMULA([.A577]) -> =LOOKUP(H578,MMULT(F570:F609,1)) | F577: 8 | G577: of:=[.F577]*10 -> 80 | H577: 46.1170436051383 | L577: of:=LOOKUP([.H577];MMULT([.F570:.G609];1)) ->  | M577: of:=LOOKUP([.H$577];MMULT([.F570:.G609];1);MMULT([.G$577:.G609];1)) ->  | Q577: = | R577: = | S577: of:=IF(ISERROR([.A576]);IF(ISERROR([.B576]);TRUE();FALSE());IF(ISERROR([.B576]);FALSE();[.A576]=[.B576])) -> true | T577: of:=IF(ISERROR([.A619]);IF(ISERROR([.B619]);TRUE();FALSE());IF(ISERROR([.B619]);FALSE();[.A619]=[.B619])) -> true | U577: of:=IF(ISERROR([.A662]);IF(ISERROR([.B662]);TRUE();FALSE());IF(ISERROR([.B662]);FALSE();[.A662]=[.B662])) -> true | V577: of:=IF(ISERROR([.L577]);IF(ISERROR([.Q577]);TRUE();FALSE());IF(ISERROR([.Q577]);FALSE();[.L577]=[.Q577])) -> false | W577: of:=IF(ISERROR([.M577]);IF(ISERROR([.R577]);TRUE();FALSE());IF(ISERROR([.R577]);FALSE();[.M577]=[.R577])) -> false
A578: of:=LOOKUP([.H579];MMULT([.F570:.F609];1)) ->  | B578: of:=NA() ->  | C578: of:=ISERROR([.A578]) -> true | D578: of:=FORMULA([.A578]) -> =LOOKUP(H579,MMULT(F570:F609,1)) | F578: 9 | G578: of:=[.F578]*10 -> 90 | H578: 28.1648660630625 | L578: of:=LOOKUP([.H578];MMULT([.F570:.G609];1)) ->  | M578: of:=LOOKUP([.H$578];MMULT([.F570:.G609];1);MMULT([.G$578:.G609];1)) ->  | Q578: = | R578: = | S578: of:=IF(ISERROR([.A577]);IF(ISERROR([.B577]);TRUE();FALSE());IF(ISERROR([.B577]);FALSE();[.A577]=[.B577])) -> true | T578: of:=IF(ISERROR([.A620]);IF(ISERROR([.B620]);TRUE();FALSE());IF(ISERROR([.B620]);FALSE();[.A620]=[.B620])) -> true | U578: of:=IF(ISERROR([.A663]);IF(ISERROR([.B663]);TRUE();FALSE());IF(ISERROR([.B663]);FALSE();[.A663]=[.B663])) -> true | V578: of:=IF(ISERROR([.L578]);IF(ISERROR([.Q578]);TRUE();FALSE());IF(ISERROR([.Q578]);FALSE();[.L578]=[.Q578])) -> false | W578: of:=IF(ISERROR([.M578]);IF(ISERROR([.R578]);TRUE();FALSE());IF(ISERROR([.R578]);FALSE();[.M578]=[.R578])) -> false
A579: of:=LOOKUP([.H580];MMULT([.F570:.F609];1)) ->  | B579: of:=NA() ->  | C579: of:=ISERROR([.A579]) -> true | D579: of:=FORMULA([.A579]) -> =LOOKUP(H580,MMULT(F570:F609,1)) | F579: 10 | G579: of:=[.F579]*10 -> 100 | H579: -0.170774662933884 | L579: of:=LOOKUP([.H579];MMULT([.F570:.G609];1)) ->  | M579: of:=LOOKUP([.H$579];MMULT([.F570:.G609];1);MMULT([.G$579:.G609];1)) ->  | Q579: = | R579: = | S579: of:=IF(ISERROR([.A578]);IF(ISERROR([.B578]);TRUE();FALSE());IF(ISERROR([.B578]);FALSE();[.A578]=[.B578])) -> true | T579: of:=IF(ISERROR([.A621]);IF(ISERROR([.B621]);TRUE();FALSE());IF(ISERROR([.B621]);FALSE();[.A621]=[.B621])) -> true | U579: of:=IF(ISERROR([.A664]);IF(ISERROR([.B664]);TRUE();FALSE());IF(ISERROR([.B664]);FALSE();[.A664]=[.B664])) -> true | V579: of:=IF(ISERROR([.L579]);IF(ISERROR([.Q579]);TRUE();FALSE());IF(ISERROR([.Q579]);FALSE();[.L579]=[.Q579])) -> false | W579: of:=IF(ISERROR([.M579]);IF(ISERROR([.R579]);TRUE();FALSE());IF(ISERROR([.R579]);FALSE();[.M579]=[.R579])) -> false
A580: of:=LOOKUP([.H581];MMULT([.F570:.F609];1)) -> 34 | B580: 34 | C580: of:=[.A580]=[.B580] -> true | D580: of:=FORMULA([.A580]) -> =LOOKUP(H581,MMULT(F570:F609,1)) | F580: 11 | G580: of:=[.F580]*10 -> 110 | H580: -4.49834467367032 | L580: of:=LOOKUP([.H580];MMULT([.F570:.G609];1)) ->  | M580: of:=LOOKUP([.H$580];MMULT([.F570:.G609];1);MMULT([.G$580:.G609];1)) ->  | Q580: = | R580: = | S580: of:=IF(ISERROR([.A579]);IF(ISERROR([.B579]);TRUE();FALSE());IF(ISERROR([.B579]);FALSE();[.A579]=[.B579])) -> true | T580: of:=IF(ISERROR([.A622]);IF(ISERROR([.B622]);TRUE();FALSE());IF(ISERROR([.B622]);FALSE();[.A622]=[.B622])) -> true | U580: of:=IF(ISERROR([.A665]);IF(ISERROR([.B665]);TRUE();FALSE());IF(ISERROR([.B665]);FALSE();[.A665]=[.B665])) -> true | V580: of:=IF(ISERROR([.L580]);IF(ISERROR([.Q580]);TRUE();FALSE());IF(ISERROR([.Q580]);FALSE();[.L580]=[.Q580])) -> false | W580: of:=IF(ISERROR([.M580]);IF(ISERROR([.R580]);TRUE();FALSE());IF(ISERROR([.R580]);FALSE();[.M580]=[.R580])) -> false
A581: of:=LOOKUP([.H582];MMULT([.F570:.F609];1)) -> 34 | B581: 34 | C581: of:=[.A581]=[.B581] -> true | D581: of:=FORMULA([.A581]) -> =LOOKUP(H582,MMULT(F570:F609,1)) | F581: 12 | G581: of:=[.F581]*10 -> 120 | H581: 34.436579883806 | L581: of:=LOOKUP([.H$581];MMULT([.F570:.G609];1)) ->  | M581: of:=LOOKUP([.H$581];MMULT([.F570:.G609];1);MMULT([.G$581:.G609];1)) ->  | Q581: = | R581: = | S581: of:=IF(ISERROR([.A580]);IF(ISERROR([.B580]);TRUE();FALSE());IF(ISERROR([.B580]);FALSE();[.A580]=[.B580])) -> true | T581: of:=IF(ISERROR([.A623]);IF(ISERROR([.B623]);TRUE();FALSE());IF(ISERROR([.B623]);FALSE();[.A623]=[.B623])) -> true | U581: of:=IF(ISERROR([.A666]);IF(ISERROR([.B666]);TRUE();FALSE());IF(ISERROR([.B666]);FALSE();[.A666]=[.B666])) -> true | V581: of:=IF(ISERROR([.L581]);IF(ISERROR([.Q581]);TRUE();FALSE());IF(ISERROR([.Q581]);FALSE();[.L581]=[.Q581])) -> false | W581: of:=IF(ISERROR([.M581]);IF(ISERROR([.R581]);TRUE();FALSE());IF(ISERROR([.R581]);FALSE();[.M581]=[.R581])) -> false
A582: of:=LOOKUP([.H583];MMULT([.F570:.F609];1)) -> 14 | B582: 14 | C582: of:=[.A582]=[.B582] -> true | D582: of:=FORMULA([.A582]) -> =LOOKUP(H583,MMULT(F570:F609,1)) | F582: 13 | G582: of:=[.F582]*10 -> 130 | H582: 34.3306588586823 | L582: of:=LOOKUP([.H$582];MMULT([.F570:.G609];1)) ->  | M582: of:=LOOKUP([.H$582];MMULT([.F570:.G609];1);MMULT([.G$582:.G609];1)) ->  | Q582: = | R582: = | S582: of:=IF(ISERROR([.A581]);IF(ISERROR([.B581]);TRUE();FALSE());IF(ISERROR([.B581]);FALSE();[.A581]=[.B581])) -> true | T582: of:=IF(ISERROR([.A624]);IF(ISERROR([.B624]);TRUE();FALSE());IF(ISERROR([.B624]);FALSE();[.A624]=[.B624])) -> true | U582: of:=IF(ISERROR([.A667]);IF(ISERROR([.B667]);TRUE();FALSE());IF(ISERROR([.B667]);FALSE();[.A667]=[.B667])) -> true | V582: of:=IF(ISERROR([.L582]);IF(ISERROR([.Q582]);TRUE();FALSE());IF(ISERROR([.Q582]);FALSE();[.L582]=[.Q582])) -> false | W582: of:=IF(ISERROR([.M582]);IF(ISERROR([.R582]);TRUE();FALSE());IF(ISERROR([.R582]);FALSE();[.M582]=[.R582])) -> false
A583: of:=LOOKUP([.H584];MMULT([.F570:.F609];1)) -> 35 | B583: 35 | C583: of:=[.A583]=[.B583] -> true | D583: of:=FORMULA([.A583]) -> =LOOKUP(H584,MMULT(F570:F609,1)) | F583: 14 | G583: of:=[.F583]*10 -> 140 | H583: 14.0802711187292 | L583: of:=LOOKUP([.H$583];MMULT([.F570:.G609];1)) ->  | M583: of:=LOOKUP([.H$583];MMULT([.F570:.G609];1);MMULT([.G$583:.G609];1)) ->  | Q583: = | R583: = | S583: of:=IF(ISERROR([.A582]);IF(ISERROR([.B582]);TRUE();FALSE());IF(ISERROR([.B582]);FALSE();[.A582]=[.B582])) -> true | T583: of:=IF(ISERROR([.A625]);IF(ISERROR([.B625]);TRUE();FALSE());IF(ISERROR([.B625]);FALSE();[.A625]=[.B625])) -> true | U583: of:=IF(ISERROR([.A668]);IF(ISERROR([.B668]);TRUE();FALSE());IF(ISERROR([.B668]);FALSE();[.A668]=[.B668])) -> true | V583: of:=IF(ISERROR([.L583]);IF(ISERROR([.Q583]);TRUE();FALSE());IF(ISERROR([.Q583]);FALSE();[.L583]=[.Q583])) -> false | W583: of:=IF(ISERROR([.M583]);IF(ISERROR([.R583]);TRUE();FALSE());IF(ISERROR([.R583]);FALSE();[.M583]=[.R583])) -> false
A584: of:=LOOKUP([.H585];MMULT([.F570:.F609];1)) -> 26 | B584: 26 | C584: of:=[.A584]=[.B584] -> true | D584: of:=FORMULA([.A584]) -> =LOOKUP(H585,MMULT(F570:F609,1)) | F584: 15 | G584: of:=[.F584]*10 -> 150 | H584: 35.0222770395998 | L584: of:=LOOKUP([.H$584];MMULT([.F570:.G609];1)) ->  | M584: of:=LOOKUP([.H$584];MMULT([.F570:.G609];1);MMULT([.G$584:.G609];1)) ->  | Q584: = | R584: = | S584: of:=IF(ISERROR([.A583]);IF(ISERROR([.B583]);TRUE();FALSE());IF(ISERROR([.B583]);FALSE();[.A583]=[.B583])) -> true | T584: of:=IF(ISERROR([.A626]);IF(ISERROR([.B626]);TRUE();FALSE());IF(ISERROR([.B626]);FALSE();[.A626]=[.B626])) -> true | U584: of:=IF(ISERROR([.A669]);IF(ISERROR([.B669]);TRUE();FALSE());IF(ISERROR([.B669]);FALSE();[.A669]=[.B669])) -> true | V584: of:=IF(ISERROR([.L584]);IF(ISERROR([.Q584]);TRUE();FALSE());IF(ISERROR([.Q584]);FALSE();[.L584]=[.Q584])) -> false | W584: of:=IF(ISERROR([.M584]);IF(ISERROR([.R584]);TRUE();FALSE());IF(ISERROR([.R584]);FALSE();[.M584]=[.R584])) -> false
A585: of:=LOOKUP([.H586];MMULT([.F570:.F609];1)) -> 20 | B585: 20 | C585: of:=[.A585]=[.B585] -> true | D585: of:=FORMULA([.A585]) -> =LOOKUP(H586,MMULT(F570:F609,1)) | F585: 16 | G585: of:=[.F585]*10 -> 160 | H585: 26.4624259092933 | L585: of:=LOOKUP([.H$585];MMULT([.F570:.G609];1)) ->  | M585: of:=LOOKUP([.H$585];MMULT([.F570:.G609];1);MMULT([.G$585:.G609];1)) ->  | Q585: = | R585: = | S585: of:=IF(ISERROR([.A584]);IF(ISERROR([.B584]);TRUE();FALSE());IF(ISERROR([.B584]);FALSE();[.A584]=[.B584])) -> true | T585: of:=IF(ISERROR([.A627]);IF(ISERROR([.B627]);TRUE();FALSE());IF(ISERROR([.B627]);FALSE();[.A627]=[.B627])) -> true | U585: of:=IF(ISERROR([.A670]);IF(ISERROR([.B670]);TRUE();FALSE());IF(ISERROR([.B670]);FALSE();[.A670]=[.B670])) -> true | V585: of:=IF(ISERROR([.L585]);IF(ISERROR([.Q585]);TRUE();FALSE());IF(ISERROR([.Q585]);FALSE();[.L585]=[.Q585])) -> false | W585: of:=IF(ISERROR([.M585]);IF(ISERROR([.R585]);TRUE();FALSE());IF(ISERROR([.R585]);FALSE();[.M585]=[.R585])) -> false
A586: of:=LOOKUP([.H587];MMULT([.F570:.F609];1)) -> 27 | B586: 27 | C586: of:=[.A586]=[.B586] -> true | D586: of:=FORMULA([.A586]) -> =LOOKUP(H587,MMULT(F570:F609,1)) | F586: 17 | G586: of:=[.F586]*10 -> 170 | H586: 20.1644751694455 | L586: of:=LOOKUP([.H$586];MMULT([.F570:.G609];1)) ->  | M586: of:=LOOKUP([.H$586];MMULT([.F570:.G609];1);MMULT([.G$586:.G609];1)) ->  | Q586: = | R586: = | S586: of:=IF(ISERROR([.A585]);IF(ISERROR([.B585]);TRUE();FALSE());IF(ISERROR([.B585]);FALSE();[.A585]=[.B585])) -> true | T586: of:=IF(ISERROR([.A628]);IF(ISERROR([.B628]);TRUE();FALSE());IF(ISERROR([.B628]);FALSE();[.A628]=[.B628])) -> true | U586: of:=IF(ISERROR([.A671]);IF(ISERROR([.B671]);TRUE();FALSE());IF(ISERROR([.B671]);FALSE();[.A671]=[.B671])) -> true | V586: of:=IF(ISERROR([.L586]);IF(ISERROR([.Q586]);TRUE();FALSE());IF(ISERROR([.Q586]);FALSE();[.L586]=[.Q586])) -> false | W586: of:=IF(ISERROR([.M586]);IF(ISERROR([.R586]);TRUE();FALSE());IF(ISERROR([.R586]);FALSE();[.M586]=[.R586])) -> false
A587: of:=LOOKUP([.H588];MMULT([.F570:.F609];1)) -> 25 | B587: 25 | C587: of:=[.A587]=[.B587] -> true | D587: of:=FORMULA([.A587]) -> =LOOKUP(H588,MMULT(F570:F609,1)) | F587: 18 | G587: of:=[.F587]*10 -> 180 | H587: 27.9902591243144 | L587: of:=LOOKUP([.H$587];MMULT([.F570:.G609];1)) ->  | M587: of:=LOOKUP([.H$587];MMULT([.F570:.G609];1);MMULT([.G$587:.G609];1)) ->  | Q587: = | R587: = | S587: of:=IF(ISERROR([.A586]);IF(ISERROR([.B586]);TRUE();FALSE());IF(ISERROR([.B586]);FALSE();[.A586]=[.B586])) -> true | T587: of:=IF(ISERROR([.A629]);IF(ISERROR([.B629]);TRUE();FALSE());IF(ISERROR([.B629]);FALSE();[.A629]=[.B629])) -> true | U587: of:=IF(ISERROR([.A672]);IF(ISERROR([.B672]);TRUE();FALSE());IF(ISERROR([.B672]);FALSE();[.A672]=[.B672])) -> true | V587: of:=IF(ISERROR([.L587]);IF(ISERROR([.Q587]);TRUE();FALSE());IF(ISERROR([.Q587]);FALSE();[.L587]=[.Q587])) -> false | W587: of:=IF(ISERROR([.M587]);IF(ISERROR([.R587]);TRUE();FALSE());IF(ISERROR([.R587]);FALSE();[.M587]=[.R587])) -> false
A588: of:=LOOKUP([.H589];MMULT([.F570:.F609];1)) -> 19 | B588: 19 | C588: of:=[.A588]=[.B588] -> true | D588: of:=FORMULA([.A588]) -> =LOOKUP(H589,MMULT(F570:F609,1)) | F588: 19 | G588: of:=[.F588]*10 -> 190 | H588: 25.0144798916406 | L588: of:=LOOKUP([.H$588];MMULT([.F570:.G609];1)) ->  | M588: of:=LOOKUP([.H$588];MMULT([.F570:.G609];1);MMULT([.G$588:.G609];1)) ->  | Q588: = | R588: = | S588: of:=IF(ISERROR([.A587]);IF(ISERROR([.B587]);TRUE();FALSE());IF(ISERROR([.B587]);FALSE();[.A587]=[.B587])) -> true | T588: of:=IF(ISERROR([.A630]);IF(ISERROR([.B630]);TRUE();FALSE());IF(ISERROR([.B630]);FALSE();[.A630]=[.B630])) -> true | U588: of:=IF(ISERROR([.A673]);IF(ISERROR([.B673]);TRUE();FALSE());IF(ISERROR([.B673]);FALSE();[.A673]=[.B673])) -> true | V588: of:=IF(ISERROR([.L588]);IF(ISERROR([.Q588]);TRUE();FALSE());IF(ISERROR([.Q588]);FALSE();[.L588]=[.Q588])) -> false | W588: of:=IF(ISERROR([.M588]);IF(ISERROR([.R588]);TRUE();FALSE());IF(ISERROR([.R588]);FALSE();[.M588]=[.R588])) -> false
A589: of:=LOOKUP([.H590];MMULT([.F570:.F609];1)) ->  | B589: of:=NA() ->  | C589: of:=ISERROR([.A589]) -> true | D589: of:=FORMULA([.A589]) -> =LOOKUP(H590,MMULT(F570:F609,1)) | F589: 20 | G589: of:=[.F589]*10 -> 200 | H589: 19.8866358021334 | L589: of:=LOOKUP([.H$589];MMULT([.F570:.G609];1)) ->  | M589: of:=LOOKUP([.H$589];MMULT([.F570:.G609];1);MMULT([.G$589:.G609];1)) ->  | Q589: = | R589: = | S589: of:=IF(ISERROR([.A588]);IF(ISERROR([.B588]);TRUE();FALSE());IF(ISERROR([.B588]);FALSE();[.A588]=[.B588])) -> true | T589: of:=IF(ISERROR([.A631]);IF(ISERROR([.B631]);TRUE();FALSE());IF(ISERROR([.B631]);FALSE();[.A631]=[.B631])) -> true | U589: of:=IF(ISERROR([.A674]);IF(ISERROR([.B674]);TRUE();FALSE());IF(ISERROR([.B674]);FALSE();[.A674]=[.B674])) -> true | V589: of:=IF(ISERROR([.L589]);IF(ISERROR([.Q589]);TRUE();FALSE());IF(ISERROR([.Q589]);FALSE();[.L589]=[.Q589])) -> false | W589: of:=IF(ISERROR([.M589]);IF(ISERROR([.R589]);TRUE();FALSE());IF(ISERROR([.R589]);FALSE();[.M589]=[.R589])) -> false
A590: of:=LOOKUP([.H591];MMULT([.F570:.F609];1)) -> 10 | B590: 10 | C590: of:=[.A590]=[.B590] -> true | D590: of:=FORMULA([.A590]) -> =LOOKUP(H591,MMULT(F570:F609,1)) | F590: 21 | G590: of:=[.F590]*10 -> 210 | H590: -0.670167247409896 | L590: of:=LOOKUP([.H$590];MMULT([.F570:.G609];1)) ->  | M590: of:=LOOKUP([.H$590];MMULT([.F570:.G609];1);MMULT([.G$590:.G609];1)) ->  | Q590: = | R590: = | S590: of:=IF(ISERROR([.A589]);IF(ISERROR([.B589]);TRUE();FALSE());IF(ISERROR([.B589]);FALSE();[.A589]=[.B589])) -> true | T590: of:=IF(ISERROR([.A632]);IF(ISERROR([.B632]);TRUE();FALSE());IF(ISERROR([.B632]);FALSE();[.A632]=[.B632])) -> true | U590: of:=IF(ISERROR([.A675]);IF(ISERROR([.B675]);TRUE();FALSE());IF(ISERROR([.B675]);FALSE();[.A675]=[.B675])) -> true | V590: of:=IF(ISERROR([.L590]);IF(ISERROR([.Q590]);TRUE();FALSE());IF(ISERROR([.Q590]);FALSE();[.L590]=[.Q590])) -> false | W590: of:=IF(ISERROR([.M590]);IF(ISERROR([.R590]);TRUE();FALSE());IF(ISERROR([.R590]);FALSE();[.M590]=[.R590])) -> false
A591: of:=LOOKUP([.H592];MMULT([.F570:.F609];1)) ->  | B591: of:=NA() ->  | C591: of:=ISERROR([.A591]) -> true | D591: of:=FORMULA([.A591]) -> =LOOKUP(H592,MMULT(F570:F609,1)) | F591: 22 | G591: of:=[.F591]*10 -> 220 | H591: 10.9670831874084 | L591: of:=LOOKUP([.H$591];MMULT([.F570:.G609];1)) ->  | M591: of:=LOOKUP([.H$591];MMULT([.F570:.G609];1);MMULT([.G$591:.G609];1)) ->  | Q591: = | R591: = | S591: of:=IF(ISERROR([.A590]);IF(ISERROR([.B590]);TRUE();FALSE());IF(ISERROR([.B590]);FALSE();[.A590]=[.B590])) -> true | T591: of:=IF(ISERROR([.A633]);IF(ISERROR([.B633]);TRUE();FALSE());IF(ISERROR([.B633]);FALSE();[.A633]=[.B633])) -> true | U591: of:=IF(ISERROR([.A676]);IF(ISERROR([.B676]);TRUE();FALSE());IF(ISERROR([.B676]);FALSE();[.A676]=[.B676])) -> true | V591: of:=IF(ISERROR([.L591]);IF(ISERROR([.Q591]);TRUE();FALSE());IF(ISERROR([.Q591]);FALSE();[.L591]=[.Q591])) -> false | W591: of:=IF(ISERROR([.M591]);IF(ISERROR([.R591]);TRUE();FALSE());IF(ISERROR([.R591]);FALSE();[.M591]=[.R591])) -> false
A592: of:=LOOKUP([.H593];MMULT([.F570:.F609];1)) ->  | B592: of:=NA() ->  | C592: of:=ISERROR([.A592]) -> true | D592: of:=FORMULA([.A592]) -> =LOOKUP(H593,MMULT(F570:F609,1)) | F592: 23 | G592: of:=[.F592]*10 -> 230 | H592: 0.403603537805273 | L592: of:=LOOKUP([.H$592];MMULT([.F570:.G609];1)) ->  | M592: of:=LOOKUP([.H$592];MMULT([.F570:.G609];1);MMULT([.G$592:.G609];1)) ->  | Q592: = | R592: = | S592: of:=IF(ISERROR([.A591]);IF(ISERROR([.B591]);TRUE();FALSE());IF(ISERROR([.B591]);FALSE();[.A591]=[.B591])) -> true | T592: of:=IF(ISERROR([.A634]);IF(ISERROR([.B634]);TRUE();FALSE());IF(ISERROR([.B634]);FALSE();[.A634]=[.B634])) -> true | U592: of:=IF(ISERROR([.A677]);IF(ISERROR([.B677]);TRUE();FALSE());IF(ISERROR([.B677]);FALSE();[.A677]=[.B677])) -> true | V592: of:=IF(ISERROR([.L592]);IF(ISERROR([.Q592]);TRUE();FALSE());IF(ISERROR([.Q592]);FALSE();[.L592]=[.Q592])) -> false | W592: of:=IF(ISERROR([.M592]);IF(ISERROR([.R592]);TRUE();FALSE());IF(ISERROR([.R592]);FALSE();[.M592]=[.R592])) -> false
A593: of:=LOOKUP([.H594];MMULT([.F570:.F609];1)) -> 4 | B593: 4 | C593: of:=[.A593]=[.B593] -> true | D593: of:=FORMULA([.A593]) -> =LOOKUP(H594,MMULT(F570:F609,1)) | F593: 24 | G593: of:=[.F593]*10 -> 240 | H593: -3.53003521441687 | L593: of:=LOOKUP([.H$593];MMULT([.F570:.G609];1)) ->  | M593: of:=LOOKUP([.H$593];MMULT([.F570:.G609];1);MMULT([.G$593:.G609];1)) ->  | Q593: = | R593: = | S593: of:=IF(ISERROR([.A592]);IF(ISERROR([.B592]);TRUE();FALSE());IF(ISERROR([.B592]);FALSE();[.A592]=[.B592])) -> true | T593: of:=IF(ISERROR([.A635]);IF(ISERROR([.B635]);TRUE();FALSE());IF(ISERROR([.B635]);FALSE();[.A635]=[.B635])) -> true | U593: of:=IF(ISERROR([.A678]);IF(ISERROR([.B678]);TRUE();FALSE());IF(ISERROR([.B678]);FALSE();[.A678]=[.B678])) -> true | V593: of:=IF(ISERROR([.L593]);IF(ISERROR([.Q593]);TRUE();FALSE());IF(ISERROR([.Q593]);FALSE();[.L593]=[.Q593])) -> false | W593: of:=IF(ISERROR([.M593]);IF(ISERROR([.R593]);TRUE();FALSE());IF(ISERROR([.R593]);FALSE();[.M593]=[.R593])) -> false
A594: of:=LOOKUP([.H595];MMULT([.F570:.F609];1)) ->  | B594: of:=NA() ->  | C594: of:=ISERROR([.A594]) -> true | D594: of:=FORMULA([.A594]) -> =LOOKUP(H595,MMULT(F570:F609,1)) | F594: 25 | G594: of:=[.F594]*10 -> 250 | H594: 4.20377921192994 | L594: of:=LOOKUP([.H$594];MMULT([.F570:.G609];1)) ->  | M594: of:=LOOKUP([.H$594];MMULT([.F570:.G609];1);MMULT([.G$594:.G609];1)) ->  | Q594: = | R594: = | S594: of:=IF(ISERROR([.A593]);IF(ISERROR([.B593]);TRUE();FALSE());IF(ISERROR([.B593]);FALSE();[.A593]=[.B593])) -> true | T594: of:=IF(ISERROR([.A636]);IF(ISERROR([.B636]);TRUE();FALSE());IF(ISERROR([.B636]);FALSE();[.A636]=[.B636])) -> true | U594: of:=IF(ISERROR([.A679]);IF(ISERROR([.B679]);TRUE();FALSE());IF(ISERROR([.B679]);FALSE();[.A679]=[.B679])) -> true | V594: of:=IF(ISERROR([.L594]);IF(ISERROR([.Q594]);TRUE();FALSE());IF(ISERROR([.Q594]);FALSE();[.L594]=[.Q594])) -> false | W594: of:=IF(ISERROR([.M594]);IF(ISERROR([.R594]);TRUE();FALSE());IF(ISERROR([.R594]);FALSE();[.M594]=[.R594])) -> false
A595: of:=LOOKUP([.H596];MMULT([.F570:.F609];1)) -> 40 | B595: 40 | C595: of:=[.A595]=[.B595] -> true | D595: of:=FORMULA([.A595]) -> =LOOKUP(H596,MMULT(F570:F609,1)) | F595: 26 | G595: of:=[.F595]*10 -> 260 | H595: -2.00473963604861 | L595: of:=LOOKUP([.H$595];MMULT([.F570:.G609];1)) ->  | M595: of:=LOOKUP([.H$595];MMULT([.F570:.G609];1);MMULT([.G$595:.G609];1)) ->  | Q595: = | R595: = | S595: of:=IF(ISERROR([.A594]);IF(ISERROR([.B594]);TRUE();FALSE());IF(ISERROR([.B594]);FALSE();[.A594]=[.B594])) -> true | T595: of:=IF(ISERROR([.A637]);IF(ISERROR([.B637]);TRUE();FALSE());IF(ISERROR([.B637]);FALSE();[.A637]=[.B637])) -> true | U595: of:=IF(ISERROR([.A680]);IF(ISERROR([.B680]);TRUE();FALSE());IF(ISERROR([.B680]);FALSE();[.A680]=[.B680])) -> true | V595: of:=IF(ISERROR([.L595]);IF(ISERROR([.Q595]);TRUE();FALSE());IF(ISERROR([.Q595]);FALSE();[.L595]=[.Q595])) -> false | W595: of:=IF(ISERROR([.M595]);IF(ISERROR([.R595]);TRUE();FALSE());IF(ISERROR([.R595]);FALSE();[.M595]=[.R595])) -> false
A596: of:=LOOKUP([.H597];MMULT([.F570:.F609];1)) -> 29 | B596: 29 | C596: of:=[.A596]=[.B596] -> true | D596: of:=FORMULA([.A596]) -> =LOOKUP(H597,MMULT(F570:F609,1)) | F596: 27 | G596: of:=[.F596]*10 -> 270 | H596: 44.1316543666094 | L596: of:=LOOKUP([.H$596];MMULT([.F570:.G609];1)) ->  | M596: of:=LOOKUP([.H$596];MMULT([.F570:.G609];1);MMULT([.G$596:.G609];1)) ->  | Q596: = | R596: = | S596: of:=IF(ISERROR([.A595]);IF(ISERROR([.B595]);TRUE();FALSE());IF(ISERROR([.B595]);FALSE();[.A595]=[.B595])) -> true | T596: of:=IF(ISERROR([.A638]);IF(ISERROR([.B638]);TRUE();FALSE());IF(ISERROR([.B638]);FALSE();[.A638]=[.B638])) -> true | U596: of:=IF(ISERROR([.A681]);IF(ISERROR([.B681]);TRUE();FALSE());IF(ISERROR([.B681]);FALSE();[.A681]=[.B681])) -> true | V596: of:=IF(ISERROR([.L596]);IF(ISERROR([.Q596]);TRUE();FALSE());IF(ISERROR([.Q596]);FALSE();[.L596]=[.Q596])) -> false | W596: of:=IF(ISERROR([.M596]);IF(ISERROR([.R596]);TRUE();FALSE());IF(ISERROR([.R596]);FALSE();[.M596]=[.R596])) -> false
A597: of:=LOOKUP([.H598];MMULT([.F570:.F609];1)) -> 15 | B597: 15 | C597: of:=[.A597]=[.B597] -> true | D597: of:=FORMULA([.A597]) -> =LOOKUP(H598,MMULT(F570:F609,1)) | F597: 28 | G597: of:=[.F597]*10 -> 280 | H597: 29.6571544709686 | L597: of:=LOOKUP([.H$597];MMULT([.F570:.G609];1)) ->  | M597: of:=LOOKUP([.H$597];MMULT([.F570:.G609];1);MMULT([.G$597:.G609];1)) ->  | Q597: = | R597: = | S597: of:=IF(ISERROR([.A596]);IF(ISERROR([.B596]);TRUE();FALSE());IF(ISERROR([.B596]);FALSE();[.A596]=[.B596])) -> true | T597: of:=IF(ISERROR([.A639]);IF(ISERROR([.B639]);TRUE();FALSE());IF(ISERROR([.B639]);FALSE();[.A639]=[.B639])) -> true | U597: of:=IF(ISERROR([.A682]);IF(ISERROR([.B682]);TRUE();FALSE());IF(ISERROR([.B682]);FALSE();[.A682]=[.B682])) -> true | V597: of:=IF(ISERROR([.L597]);IF(ISERROR([.Q597]);TRUE();FALSE());IF(ISERROR([.Q597]);FALSE();[.L597]=[.Q597])) -> false | W597: of:=IF(ISERROR([.M597]);IF(ISERROR([.R597]);TRUE();FALSE());IF(ISERROR([.R597]);FALSE();[.M597]=[.R597])) -> false
A598: of:=LOOKUP([.H599];MMULT([.F570:.F609];1)) -> 18 | B598: 18 | C598: of:=[.A598]=[.B598] -> true | D598: of:=FORMULA([.A598]) -> =LOOKUP(H599,MMULT(F570:F609,1)) | F598: 29 | G598: of:=[.F598]*10 -> 290 | H598: 15.5936793829992 | L598: of:=LOOKUP([.H$598];MMULT([.F570:.G609];1)) ->  | M598: of:=LOOKUP([.H$598];MMULT([.F570:.G609];1);MMULT([.G$598:.G609];1)) ->  | Q598: = | R598: = | S598: of:=IF(ISERROR([.A597]);IF(ISERROR([.B597]);TRUE();FALSE());IF(ISERROR([.B597]);FALSE();[.A597]=[.B597])) -> true | T598: of:=IF(ISERROR([.A640]);IF(ISERROR([.B640]);TRUE();FALSE());IF(ISERROR([.B640]);FALSE();[.A640]=[.B640])) -> true | U598: of:=IF(ISERROR([.A683]);IF(ISERROR([.B683]);TRUE();FALSE());IF(ISERROR([.B683]);FALSE();[.A683]=[.B683])) -> true | V598: of:=IF(ISERROR([.L598]);IF(ISERROR([.Q598]);TRUE();FALSE());IF(ISERROR([.Q598]);FALSE();[.L598]=[.Q598])) -> false | W598: of:=IF(ISERROR([.M598]);IF(ISERROR([.R598]);TRUE();FALSE());IF(ISERROR([.R598]);FALSE();[.M598]=[.R598])) -> false
A599: of:=LOOKUP([.H600];MMULT([.F570:.F609];1)) -> 40 | B599: 40 | C599: of:=[.A599]=[.B599] -> true | D599: of:=FORMULA([.A599]) -> =LOOKUP(H600,MMULT(F570:F609,1)) | F599: 30 | G599: of:=[.F599]*10 -> 300 | H599: 18.2048404349184 | L599: of:=LOOKUP([.H$599];MMULT([.F570:.G609];1)) ->  | M599: of:=LOOKUP([.H$599];MMULT([.F570:.G609];1);MMULT([.G$599:.G609];1)) ->  | Q599: = | R599: = | S599: of:=IF(ISERROR([.A598]);IF(ISERROR([.B598]);TRUE();FALSE());IF(ISERROR([.B598]);FALSE();[.A598]=[.B598])) -> true | T599: of:=IF(ISERROR([.A641]);IF(ISERROR([.B641]);TRUE();FALSE());IF(ISERROR([.B641]);FALSE();[.A641]=[.B641])) -> true | U599: of:=IF(ISERROR([.A684]);IF(ISERROR([.B684]);TRUE();FALSE());IF(ISERROR([.B684]);FALSE();[.A684]=[.B684])) -> true | V599: of:=IF(ISERROR([.L599]);IF(ISERROR([.Q599]);TRUE();FALSE());IF(ISERROR([.Q599]);FALSE();[.L599]=[.Q599])) -> false | W599: of:=IF(ISERROR([.M599]);IF(ISERROR([.R599]);TRUE();FALSE());IF(ISERROR([.R599]);FALSE();[.M599]=[.R599])) -> false
A600: of:=LOOKUP([.H601];MMULT([.F570:.F609];1)) ->  | B600: of:=NA() ->  | C600: of:=ISERROR([.A600]) -> true | D600: of:=FORMULA([.A600]) -> =LOOKUP(H601,MMULT(F570:F609,1)) | F600: 31 | G600: of:=[.F600]*10 -> 310 | H600: 42.4175313332475 | L600: of:=LOOKUP([.H$600];MMULT([.F570:.G609];1)) ->  | M600: of:=LOOKUP([.H$600];MMULT([.F570:.G609];1);MMULT([.G$600:.G609];1)) ->  | Q600: = | R600: = | S600: of:=IF(ISERROR([.A599]);IF(ISERROR([.B599]);TRUE();FALSE());IF(ISERROR([.B599]);FALSE();[.A599]=[.B599])) -> true | T600: of:=IF(ISERROR([.A642]);IF(ISERROR([.B642]);TRUE();FALSE());IF(ISERROR([.B642]);FALSE();[.A642]=[.B642])) -> true | U600: of:=IF(ISERROR([.A685]);IF(ISERROR([.B685]);TRUE();FALSE());IF(ISERROR([.B685]);FALSE();[.A685]=[.B685])) -> true | V600: of:=IF(ISERROR([.L600]);IF(ISERROR([.Q600]);TRUE();FALSE());IF(ISERROR([.Q600]);FALSE();[.L600]=[.Q600])) -> false | W600: of:=IF(ISERROR([.M600]);IF(ISERROR([.R600]);TRUE();FALSE());IF(ISERROR([.R600]);FALSE();[.M600]=[.R600])) -> false
A601: of:=LOOKUP([.H602];MMULT([.F570:.F609];1)) -> 10 | B601: 10 | C601: of:=[.A601]=[.B601] -> true | D601: of:=FORMULA([.A601]) -> =LOOKUP(H602,MMULT(F570:F609,1)) | F601: 32 | G601: of:=[.F601]*10 -> 320 | H601: -4.74515617634479 | L601: of:=LOOKUP([.H$601];MMULT([.F570:.G609];1)) ->  | M601: of:=LOOKUP([.H$601];MMULT([.F570:.G609];1);MMULT([.G$601:.G609];1)) ->  | Q601: = | R601: = | S601: of:=IF(ISERROR([.A600]);IF(ISERROR([.B600]);TRUE();FALSE());IF(ISERROR([.B600]);FALSE();[.A600]=[.B600])) -> true | T601: of:=IF(ISERROR([.A643]);IF(ISERROR([.B643]);TRUE();FALSE());IF(ISERROR([.B643]);FALSE();[.A643]=[.B643])) -> true | U601: of:=IF(ISERROR([.A686]);IF(ISERROR([.B686]);TRUE();FALSE());IF(ISERROR([.B686]);FALSE();[.A686]=[.B686])) -> true | V601: of:=IF(ISERROR([.L601]);IF(ISERROR([.Q601]);TRUE();FALSE());IF(ISERROR([.Q601]);FALSE();[.L601]=[.Q601])) -> false | W601: of:=IF(ISERROR([.M601]);IF(ISERROR([.R601]);TRUE();FALSE());IF(ISERROR([.R601]);FALSE();[.M601]=[.R601])) -> false
A602: of:=LOOKUP([.H603];MMULT([.F570:.F609];1)) -> 40 | B602: 40 | C602: of:=[.A602]=[.B602] -> true | D602: of:=FORMULA([.A602]) -> =LOOKUP(H603,MMULT(F570:F609,1)) | F602: 33 | G602: of:=[.F602]*10 -> 330 | H602: 10.5008121178258 | L602: of:=LOOKUP([.H$602];MMULT([.F570:.G609];1)) ->  | M602: of:=LOOKUP([.H$602];MMULT([.F570:.G609];1);MMULT([.G$602:.G609];1)) ->  | Q602: = | R602: = | S602: of:=IF(ISERROR([.A601]);IF(ISERROR([.B601]);TRUE();FALSE());IF(ISERROR([.B601]);FALSE();[.A601]=[.B601])) -> true | T602: of:=IF(ISERROR([.A644]);IF(ISERROR([.B644]);TRUE();FALSE());IF(ISERROR([.B644]);FALSE();[.A644]=[.B644])) -> true | U602: of:=IF(ISERROR([.A687]);IF(ISERROR([.B687]);TRUE();FALSE());IF(ISERROR([.B687]);FALSE();[.A687]=[.B687])) -> true | V602: of:=IF(ISERROR([.L602]);IF(ISERROR([.Q602]);TRUE();FALSE());IF(ISERROR([.Q602]);FALSE();[.L602]=[.Q602])) -> false | W602: of:=IF(ISERROR([.M602]);IF(ISERROR([.R602]);TRUE();FALSE());IF(ISERROR([.R602]);FALSE();[.M602]=[.R602])) -> false
A603: of:=LOOKUP([.H604];MMULT([.F570:.F609];1)) -> 20 | B603: 20 | C603: of:=[.A603]=[.B603] -> true | D603: of:=FORMULA([.A603]) -> =LOOKUP(H604,MMULT(F570:F609,1)) | F603: 34 | G603: of:=[.F603]*10 -> 340 | H603: 41.1554291672324 | L603: of:=LOOKUP([.H$603];MMULT([.F570:.G609];1)) ->  | M603: of:=LOOKUP([.H$603];MMULT([.F570:.G609];1);MMULT([.G$603:.G609];1)) ->  | Q603: = | R603: = | S603: of:=IF(ISERROR([.A602]);IF(ISERROR([.B602]);TRUE();FALSE());IF(ISERROR([.B602]);FALSE();[.A602]=[.B602])) -> true | T603: of:=IF(ISERROR([.A645]);IF(ISERROR([.B645]);TRUE();FALSE());IF(ISERROR([.B645]);FALSE();[.A645]=[.B645])) -> true | U603: of:=IF(ISERROR([.A688]);IF(ISERROR([.B688]);TRUE();FALSE());IF(ISERROR([.B688]);FALSE();[.A688]=[.B688])) -> true | V603: of:=IF(ISERROR([.L603]);IF(ISERROR([.Q603]);TRUE();FALSE());IF(ISERROR([.Q603]);FALSE();[.L603]=[.Q603])) -> false | W603: of:=IF(ISERROR([.M603]);IF(ISERROR([.R603]);TRUE();FALSE());IF(ISERROR([.R603]);FALSE();[.M603]=[.R603])) -> false
A604: of:=LOOKUP([.H605];MMULT([.F570:.F609];1)) ->  | B604: of:=NA() ->  | C604: of:=ISERROR([.A604]) -> true | D604: of:=FORMULA([.A604]) -> =LOOKUP(H605,MMULT(F570:F609,1)) | F604: 35 | G604: of:=[.F604]*10 -> 350 | H604: 20.1494713890097 | L604: of:=LOOKUP([.H$604];MMULT([.F570:.G609];1)) ->  | M604: of:=LOOKUP([.H$604];MMULT([.F570:.G609];1);MMULT([.G$604:.G609];1)) ->  | Q604: = | R604: = | S604: of:=IF(ISERROR([.A603]);IF(ISERROR([.B603]);TRUE();FALSE());IF(ISERROR([.B603]);FALSE();[.A603]=[.B603])) -> true | T604: of:=IF(ISERROR([.A646]);IF(ISERROR([.B646]);TRUE();FALSE());IF(ISERROR([.B646]);FALSE();[.A646]=[.B646])) -> true | U604: of:=IF(ISERROR([.A689]);IF(ISERROR([.B689]);TRUE();FALSE());IF(ISERROR([.B689]);FALSE();[.A689]=[.B689])) -> true | V604: of:=IF(ISERROR([.L604]);IF(ISERROR([.Q604]);TRUE();FALSE());IF(ISERROR([.Q604]);FALSE();[.L604]=[.Q604])) -> false | W604: of:=IF(ISERROR([.M604]);IF(ISERROR([.R604]);TRUE();FALSE());IF(ISERROR([.R604]);FALSE();[.M604]=[.R604])) -> false
A605: of:=LOOKUP([.H606];MMULT([.F570:.F609];1)) -> 19 | B605: 19 | C605: of:=[.A605]=[.B605] -> true | D605: of:=FORMULA([.A605]) -> =LOOKUP(H606,MMULT(F570:F609,1)) | F605: 36 | G605: of:=[.F605]*10 -> 360 | H605: 0.638131464622695 | L605: of:=LOOKUP([.H$605];MMULT([.F570:.G609];1)) ->  | M605: of:=LOOKUP([.H$605];MMULT([.F570:.G609];1);MMULT([.G$605:.G609];1)) ->  | Q605: = | R605: = | S605: of:=IF(ISERROR([.A604]);IF(ISERROR([.B604]);TRUE();FALSE());IF(ISERROR([.B604]);FALSE();[.A604]=[.B604])) -> true | T605: of:=IF(ISERROR([.A647]);IF(ISERROR([.B647]);TRUE();FALSE());IF(ISERROR([.B647]);FALSE();[.A647]=[.B647])) -> true | U605: of:=IF(ISERROR([.A690]);IF(ISERROR([.B690]);TRUE();FALSE());IF(ISERROR([.B690]);FALSE();[.A690]=[.B690])) -> true | V605: of:=IF(ISERROR([.L605]);IF(ISERROR([.Q605]);TRUE();FALSE());IF(ISERROR([.Q605]);FALSE();[.L605]=[.Q605])) -> false | W605: of:=IF(ISERROR([.M605]);IF(ISERROR([.R605]);TRUE();FALSE());IF(ISERROR([.R605]);FALSE();[.M605]=[.R605])) -> false
A606: of:=LOOKUP([.H607];MMULT([.F570:.F609];1)) -> 40 | B606: 40 | C606: of:=[.A606]=[.B606] -> true | D606: of:=FORMULA([.A606]) -> =LOOKUP(H607,MMULT(F570:F609,1)) | F606: 37 | G606: of:=[.F606]*10 -> 370 | H606: 19.7687340594918 | L606: of:=LOOKUP([.H$606];MMULT([.F570:.G609];1)) ->  | M606: of:=LOOKUP([.H$606];MMULT([.F570:.G609];1);MMULT([.G$606:.G609];1)) ->  | Q606: = | R606: = | S606: of:=IF(ISERROR([.A605]);IF(ISERROR([.B605]);TRUE();FALSE());IF(ISERROR([.B605]);FALSE();[.A605]=[.B605])) -> true | T606: of:=IF(ISERROR([.A648]);IF(ISERROR([.B648]);TRUE();FALSE());IF(ISERROR([.B648]);FALSE();[.A648]=[.B648])) -> true | U606: of:=IF(ISERROR([.A691]);IF(ISERROR([.B691]);TRUE();FALSE());IF(ISERROR([.B691]);FALSE();[.A691]=[.B691])) -> true | V606: of:=IF(ISERROR([.L606]);IF(ISERROR([.Q606]);TRUE();FALSE());IF(ISERROR([.Q606]);FALSE();[.L606]=[.Q606])) -> false | W606: of:=IF(ISERROR([.M606]);IF(ISERROR([.R606]);TRUE();FALSE());IF(ISERROR([.R606]);FALSE();[.M606]=[.R606])) -> false
A607: of:=LOOKUP([.H608];MMULT([.F570:.F609];1)) -> 7 | B607: 7 | C607: of:=[.A607]=[.B607] -> true | D607: of:=FORMULA([.A607]) -> =LOOKUP(H608,MMULT(F570:F609,1)) | F607: 38 | G607: of:=[.F607]*10 -> 380 | H607: 41.416818269397 | L607: of:=LOOKUP([.H$607];MMULT([.F570:.G609];1)) ->  | M607: of:=LOOKUP([.H$607];MMULT([.F570:.G609];1);MMULT([.G$607:.G609];1)) ->  | Q607: = | R607: = | S607: of:=IF(ISERROR([.A606]);IF(ISERROR([.B606]);TRUE();FALSE());IF(ISERROR([.B606]);FALSE();[.A606]=[.B606])) -> true | T607: of:=IF(ISERROR([.A649]);IF(ISERROR([.B649]);TRUE();FALSE());IF(ISERROR([.B649]);FALSE();[.A649]=[.B649])) -> true | U607: of:=IF(ISERROR([.A692]);IF(ISERROR([.B692]);TRUE();FALSE());IF(ISERROR([.B692]);FALSE();[.A692]=[.B692])) -> true | V607: of:=IF(ISERROR([.L607]);IF(ISERROR([.Q607]);TRUE();FALSE());IF(ISERROR([.Q607]);FALSE();[.L607]=[.Q607])) -> false | W607: of:=IF(ISERROR([.M607]);IF(ISERROR([.R607]);TRUE();FALSE());IF(ISERROR([.R607]);FALSE();[.M607]=[.R607])) -> false
A608: of:=LOOKUP([.H609];MMULT([.F570:.F609];1)) ->  | B608: of:=NA() ->  | C608: of:=ISERROR([.A608]) -> true | D608: of:=FORMULA([.A608]) -> =LOOKUP(H609,MMULT(F570:F609,1)) | F608: 39 | G608: of:=[.F608]*10 -> 390 | H608: 7.25184374767483 | L608: of:=LOOKUP([.H$608];MMULT([.F570:.G609];1)) ->  | M608: of:=LOOKUP([.H$608];MMULT([.F570:.G609];1);MMULT([.G$608:.G609];1)) ->  | Q608: = | R608: = | S608: of:=IF(ISERROR([.A607]);IF(ISERROR([.B607]);TRUE();FALSE());IF(ISERROR([.B607]);FALSE();[.A607]=[.B607])) -> true | T608: of:=IF(ISERROR([.A650]);IF(ISERROR([.B650]);TRUE();FALSE());IF(ISERROR([.B650]);FALSE();[.A650]=[.B650])) -> true | U608: of:=IF(ISERROR([.A693]);IF(ISERROR([.B693]);TRUE();FALSE());IF(ISERROR([.B693]);FALSE();[.A693]=[.B693])) -> true | V608: of:=IF(ISERROR([.L608]);IF(ISERROR([.Q608]);TRUE();FALSE());IF(ISERROR([.Q608]);FALSE();[.L608]=[.Q608])) -> false | W608: of:=IF(ISERROR([.M608]);IF(ISERROR([.R608]);TRUE();FALSE());IF(ISERROR([.R608]);FALSE();[.M608]=[.R608])) -> false
A609: of:=LOOKUP([.H610];MMULT([.F570:.F609];1)) -> 1 | B609: 1 | C609: of:=[.A609]=[.B609] -> true | D609: of:=FORMULA([.A609]) -> =LOOKUP(H610,MMULT(F570:F609,1)) | F609: 40 | G609: of:=[.F609]*10 -> 400 | H609: -6.96293408546318 | L609: of:=LOOKUP([.H$609];MMULT([.F570:.G609];1)) ->  | M609: of:=LOOKUP([.H$609];MMULT([.F570:.G609];1);MMULT([.G$609:.G609];1)) ->  | Q609: = | R609: = | S609: of:=IF(ISERROR([.A608]);IF(ISERROR([.B608]);TRUE();FALSE());IF(ISERROR([.B608]);FALSE();[.A608]=[.B608])) -> true | T609: of:=IF(ISERROR([.A651]);IF(ISERROR([.B651]);TRUE();FALSE());IF(ISERROR([.B651]);FALSE();[.A651]=[.B651])) -> true | U609: of:=IF(ISERROR([.A694]);IF(ISERROR([.B694]);TRUE();FALSE());IF(ISERROR([.B694]);FALSE();[.A694]=[.B694])) -> true | V609: of:=IF(ISERROR([.L609]);IF(ISERROR([.Q609]);TRUE();FALSE());IF(ISERROR([.Q609]);FALSE();[.L609]=[.Q609])) -> false | W609: of:=IF(ISERROR([.M609]);IF(ISERROR([.R609]);TRUE();FALSE());IF(ISERROR([.R609]);FALSE();[.M609]=[.R609])) -> false
A610: of:=LOOKUP([.H611];MMULT([.F570:.F609];1)) -> 40 | B610: 40 | C610: of:=[.A610]=[.B610] -> true | D610: of:=FORMULA([.A610]) -> =LOOKUP(H611,MMULT(F570:F609,1)) | H610: 1 | L610: of:=LOOKUP([.H$610];MMULT([.F570:.G609];1)) ->  | M610: of:=LOOKUP([.H$610];MMULT([.F570:.G609];1);MMULT([.G609:.G$610];1)) ->  | Q610: = | R610: = | S610: of:=IF(ISERROR([.A609]);IF(ISERROR([.B609]);TRUE();FALSE());IF(ISERROR([.B609]);FALSE();[.A609]=[.B609])) -> true | T610: of:=IF(ISERROR([.A652]);IF(ISERROR([.B652]);TRUE();FALSE());IF(ISERROR([.B652]);FALSE();[.A652]=[.B652])) -> true | U610: of:=IF(ISERROR([.A695]);IF(ISERROR([.B695]);TRUE();FALSE());IF(ISERROR([.B695]);FALSE();[.A695]=[.B695])) -> true | V610: of:=IF(ISERROR([.L610]);IF(ISERROR([.Q610]);TRUE();FALSE());IF(ISERROR([.Q610]);FALSE();[.L610]=[.Q610])) -> false | W610: of:=IF(ISERROR([.M610]);IF(ISERROR([.R610]);TRUE();FALSE());IF(ISERROR([.R610]);FALSE();[.M610]=[.R610])) -> false
A611: of:=LOOKUP([.H612];MMULT([.F570:.F609];1)) ->  | B611: of:=NA() ->  | C611: of:=ISERROR([.A611]) -> true | D611: of:=FORMULA([.A611]) -> =LOOKUP(H612,MMULT(F570:F609,1)) | H611: 40 | L611: of:=LOOKUP([.H$611];MMULT([.F570:.G609];1)) ->  | M611: of:=LOOKUP([.H$611];MMULT([.F570:.G609];1);MMULT([.G609:.G$611];1)) ->  | Q611: = | R611: = | S611: of:=IF(ISERROR([.A610]);IF(ISERROR([.B610]);TRUE();FALSE());IF(ISERROR([.B610]);FALSE();[.A610]=[.B610])) -> true | T611: of:=IF(ISERROR([.A653]);IF(ISERROR([.B653]);TRUE();FALSE());IF(ISERROR([.B653]);FALSE();[.A653]=[.B653])) -> true | U611: of:=IF(ISERROR([.A696]);IF(ISERROR([.B696]);TRUE();FALSE());IF(ISERROR([.B696]);FALSE();[.A696]=[.B696])) -> true | V611: of:=IF(ISERROR([.L611]);IF(ISERROR([.Q611]);TRUE();FALSE());IF(ISERROR([.Q611]);FALSE();[.L611]=[.Q611])) -> false | W611: of:=IF(ISERROR([.M611]);IF(ISERROR([.R611]);TRUE();FALSE());IF(ISERROR([.R611]);FALSE();[.M611]=[.R611])) -> false
A612: of:=LOOKUP([.H570];MMULT([.F570:.F609];1);MMULT([.G570:.G609];1)) ->  | B612: of:=NA() ->  | C612: of:=ISERROR([.A612]) -> true | D612: of:=FORMULA([.A612]) -> =LOOKUP(H570,MMULT(F570:F609,1),MMULT(G570:G609,1)) | H612: 0 | L612: of:=LOOKUP([.H$612];MMULT([.F570:.G609];1)) ->  | M612: of:=LOOKUP([.H$612];MMULT([.F570:.G609];1);MMULT([.G609:.G$612];1)) ->  | Q612: = | R612: = | S612: of:=IF(ISERROR([.A611]);IF(ISERROR([.B611]);TRUE();FALSE());IF(ISERROR([.B611]);FALSE();[.A611]=[.B611])) -> true | T612: of:=IF(ISERROR([.A654]);IF(ISERROR([.B654]);TRUE();FALSE());IF(ISERROR([.B654]);FALSE();[.A654]=[.B654])) -> true | U612: of:=IF(ISERROR([.A697]);IF(ISERROR([.B697]);TRUE();FALSE());IF(ISERROR([.B697]);FALSE();[.A697]=[.B697])) -> true | V612: of:=IF(ISERROR([.L612]);IF(ISERROR([.Q612]);TRUE();FALSE());IF(ISERROR([.Q612]);FALSE();[.L612]=[.Q612])) -> false | W612: of:=IF(ISERROR([.M612]);IF(ISERROR([.R612]);TRUE();FALSE());IF(ISERROR([.R612]);FALSE();[.M612]=[.R612])) -> false
A613: of:=LOOKUP([.H571];MMULT([.F570:.F609];1);MMULT([.G570:.G609];1)) -> 90 | B613: 90 | C613: of:=[.A613]=[.B613] -> true | D613: of:=FORMULA([.A613]) -> =LOOKUP(H571,MMULT(F570:F609,1),MMULT(G570:G609,1))
A614: of:=LOOKUP([.H572];MMULT([.F570:.F609];1);MMULT([.G570:.G609];1)) -> 150 | B614: 150 | C614: of:=[.A614]=[.B614] -> true | D614: of:=FORMULA([.A614]) -> =LOOKUP(H572,MMULT(F570:F609,1),MMULT(G570:G609,1))
A615: of:=LOOKUP([.H573];MMULT([.F570:.F609];1);MMULT([.G570:.G609];1)) -> 90 | B615: 90 | C615: of:=[.A615]=[.B615] -> true | D615: of:=FORMULA([.A615]) -> =LOOKUP(H573,MMULT(F570:F609,1),MMULT(G570:G609,1))
A616: of:=LOOKUP([.H574];MMULT([.F570:.F609];1);MMULT([.G570:.G609];1)) ->  | B616: of:=NA() ->  | C616: of:=ISERROR([.A616]) -> true | D616: of:=FORMULA([.A616]) -> =LOOKUP(H574,MMULT(F570:F609,1),MMULT(G570:G609,1))
A617: of:=LOOKUP([.H575];MMULT([.F570:.F609];1);MMULT([.G570:.G609];1)) ->  | B617: of:=NA() ->  | C617: of:=ISERROR([.A617]) -> true | D617: of:=FORMULA([.A617]) -> =LOOKUP(H575,MMULT(F570:F609,1),MMULT(G570:G609,1))
A618: of:=LOOKUP([.H576];MMULT([.F570:.F609];1);MMULT([.G570:.G609];1)) -> 200 | B618: 200 | C618: of:=[.A618]=[.B618] -> true | D618: of:=FORMULA([.A618]) -> =LOOKUP(H576,MMULT(F570:F609,1),MMULT(G570:G609,1))
A619: of:=LOOKUP([.H577];MMULT([.F570:.F609];1);MMULT([.G570:.G609];1)) -> 400 | B619: 400 | C619: of:=[.A619]=[.B619] -> true | D619: of:=FORMULA([.A619]) -> =LOOKUP(H577,MMULT(F570:F609,1),MMULT(G570:G609,1))
A620: of:=LOOKUP([.H578];MMULT([.F570:.F609];1);MMULT([.G570:.G609];1)) -> 280 | B620: 280 | C620: of:=[.A620]=[.B620] -> true | D620: of:=FORMULA([.A620]) -> =LOOKUP(H578,MMULT(F570:F609,1),MMULT(G570:G609,1))
A621: of:=LOOKUP([.H579];MMULT([.F570:.F609];1);MMULT([.G570:.G609];1)) ->  | B621: of:=NA() ->  | C621: of:=ISERROR([.A621]) -> true | D621: of:=FORMULA([.A621]) -> =LOOKUP(H579,MMULT(F570:F609,1),MMULT(G570:G609,1))
A622: of:=LOOKUP([.H580];MMULT([.F570:.F609];1);MMULT([.G570:.G609];1)) ->  | B622: of:=NA() ->  | C622: of:=ISERROR([.A622]) -> true | D622: of:=FORMULA([.A622]) -> =LOOKUP(H580,MMULT(F570:F609,1),MMULT(G570:G609,1))
A623: of:=LOOKUP([.H581];MMULT([.F570:.F609];1);MMULT([.G570:.G609];1)) -> 340 | B623: 340 | C623: of:=[.A623]=[.B623] -> true | D623: of:=FORMULA([.A623]) -> =LOOKUP(H581,MMULT(F570:F609,1),MMULT(G570:G609,1))
A624: of:=LOOKUP([.H582];MMULT([.F570:.F609];1);MMULT([.G570:.G609];1)) -> 340 | B624: 340 | C624: of:=[.A624]=[.B624] -> true | D624: of:=FORMULA([.A624]) -> =LOOKUP(H582,MMULT(F570:F609,1),MMULT(G570:G609,1))
A625: of:=LOOKUP([.H583];MMULT([.F570:.F609];1);MMULT([.G570:.G609];1)) -> 140 | B625: 140 | C625: of:=[.A625]=[.B625] -> true | D625: of:=FORMULA([.A625]) -> =LOOKUP(H583,MMULT(F570:F609,1),MMULT(G570:G609,1))
A626: of:=LOOKUP([.H584];MMULT([.F570:.F609];1);MMULT([.G570:.G609];1)) -> 350 | B626: 350 | C626: of:=[.A626]=[.B626] -> true | D626: of:=FORMULA([.A626]) -> =LOOKUP(H584,MMULT(F570:F609,1),MMULT(G570:G609,1))
A627: of:=LOOKUP([.H585];MMULT([.F570:.F609];1);MMULT([.G570:.G609];1)) -> 260 | B627: 260 | C627: of:=[.A627]=[.B627] -> true | D627: of:=FORMULA([.A627]) -> =LOOKUP(H585,MMULT(F570:F609,1),MMULT(G570:G609,1))
A628: of:=LOOKUP([.H586];MMULT([.F570:.F609];1);MMULT([.G570:.G609];1)) -> 200 | B628: 200 | C628: of:=[.A628]=[.B628] -> true | D628: of:=FORMULA([.A628]) -> =LOOKUP(H586,MMULT(F570:F609,1),MMULT(G570:G609,1))
A629: of:=LOOKUP([.H587];MMULT([.F570:.F609];1);MMULT([.G570:.G609];1)) -> 270 | B629: 270 | C629: of:=[.A629]=[.B629] -> true | D629: of:=FORMULA([.A629]) -> =LOOKUP(H587,MMULT(F570:F609,1),MMULT(G570:G609,1))
A630: of:=LOOKUP([.H588];MMULT([.F570:.F609];1);MMULT([.G570:.G609];1)) -> 250 | B630: 250 | C630: of:=[.A630]=[.B630] -> true | D630: of:=FORMULA([.A630]) -> =LOOKUP(H588,MMULT(F570:F609,1),MMULT(G570:G609,1))
A631: of:=LOOKUP([.H589];MMULT([.F570:.F609];1);MMULT([.G570:.G609];1)) -> 190 | B631: 190 | C631: of:=[.A631]=[.B631] -> true | D631: of:=FORMULA([.A631]) -> =LOOKUP(H589,MMULT(F570:F609,1),MMULT(G570:G609,1))
A632: of:=LOOKUP([.H590];MMULT([.F570:.F609];1);MMULT([.G570:.G609];1)) ->  | B632: of:=NA() ->  | C632: of:=ISERROR([.A632]) -> true | D632: of:=FORMULA([.A632]) -> =LOOKUP(H590,MMULT(F570:F609,1),MMULT(G570:G609,1))
A633: of:=LOOKUP([.H591];MMULT([.F570:.F609];1);MMULT([.G570:.G609];1)) -> 100 | B633: 100 | C633: of:=[.A633]=[.B633] -> true | D633: of:=FORMULA([.A633]) -> =LOOKUP(H591,MMULT(F570:F609,1),MMULT(G570:G609,1))
A634: of:=LOOKUP([.H592];MMULT([.F570:.F609];1);MMULT([.G570:.G609];1)) ->  | B634: of:=NA() ->  | C634: of:=ISERROR([.A634]) -> true | D634: of:=FORMULA([.A634]) -> =LOOKUP(H592,MMULT(F570:F609,1),MMULT(G570:G609,1))
A635: of:=LOOKUP([.H593];MMULT([.F570:.F609];1);MMULT([.G570:.G609];1)) ->  | B635: of:=NA() ->  | C635: of:=ISERROR([.A635]) -> true | D635: of:=FORMULA([.A635]) -> =LOOKUP(H593,MMULT(F570:F609,1),MMULT(G570:G609,1))
A636: of:=LOOKUP([.H594];MMULT([.F570:.F609];1);MMULT([.G570:.G609];1)) -> 40 | B636: 40 | C636: of:=[.A636]=[.B636] -> true | D636: of:=FORMULA([.A636]) -> =LOOKUP(H594,MMULT(F570:F609,1),MMULT(G570:G609,1))
A637: of:=LOOKUP([.H595];MMULT([.F570:.F609];1);MMULT([.G570:.G609];1)) ->  | B637: of:=NA() ->  | C637: of:=ISERROR([.A637]) -> true | D637: of:=FORMULA([.A637]) -> =LOOKUP(H595,MMULT(F570:F609,1),MMULT(G570:G609,1))
A638: of:=LOOKUP([.H596];MMULT([.F570:.F609];1);MMULT([.G570:.G609];1)) -> 400 | B638: 400 | C638: of:=[.A638]=[.B638] -> true | D638: of:=FORMULA([.A638]) -> =LOOKUP(H596,MMULT(F570:F609,1),MMULT(G570:G609,1))
A639: of:=LOOKUP([.H597];MMULT([.F570:.F609];1);MMULT([.G570:.G609];1)) -> 290 | B639: 290 | C639: of:=[.A639]=[.B639] -> true | D639: of:=FORMULA([.A639]) -> =LOOKUP(H597,MMULT(F570:F609,1),MMULT(G570:G609,1))
A640: of:=LOOKUP([.H598];MMULT([.F570:.F609];1);MMULT([.G570:.G609];1)) -> 150 | B640: 150 | C640: of:=[.A640]=[.B640] -> true | D640: of:=FORMULA([.A640]) -> =LOOKUP(H598,MMULT(F570:F609,1),MMULT(G570:G609,1))
A641: of:=LOOKUP([.H599];MMULT([.F570:.F609];1);MMULT([.G570:.G609];1)) -> 180 | B641: 180 | C641: of:=[.A641]=[.B641] -> true | D641: of:=FORMULA([.A641]) -> =LOOKUP(H599,MMULT(F570:F609,1),MMULT(G570:G609,1))
A642: of:=LOOKUP([.H600];MMULT([.F570:.F609];1);MMULT([.G570:.G609];1)) -> 400 | B642: 400 | C642: of:=[.A642]=[.B642] -> true | D642: of:=FORMULA([.A642]) -> =LOOKUP(H600,MMULT(F570:F609,1),MMULT(G570:G609,1))
A643: of:=LOOKUP([.H601];MMULT([.F570:.F609];1);MMULT([.G570:.G609];1)) ->  | B643: of:=NA() ->  | C643: of:=ISERROR([.A643]) -> true | D643: of:=FORMULA([.A643]) -> =LOOKUP(H601,MMULT(F570:F609,1),MMULT(G570:G609,1))
A644: of:=LOOKUP([.H602];MMULT([.F570:.F609];1);MMULT([.G570:.G609];1)) -> 100 | B644: 100 | C644: of:=[.A644]=[.B644] -> true | D644: of:=FORMULA([.A644]) -> =LOOKUP(H602,MMULT(F570:F609,1),MMULT(G570:G609,1))
A645: of:=LOOKUP([.H603];MMULT([.F570:.F609];1);MMULT([.G570:.G609];1)) -> 400 | B645: 400 | C645: of:=[.A645]=[.B645] -> true | D645: of:=FORMULA([.A645]) -> =LOOKUP(H603,MMULT(F570:F609,1),MMULT(G570:G609,1))
A646: of:=LOOKUP([.H604];MMULT([.F570:.F609];1);MMULT([.G570:.G609];1)) -> 200 | B646: 200 | C646: of:=[.A646]=[.B646] -> true | D646: of:=FORMULA([.A646]) -> =LOOKUP(H604,MMULT(F570:F609,1),MMULT(G570:G609,1))
A647: of:=LOOKUP([.H605];MMULT([.F570:.F609];1);MMULT([.G570:.G609];1)) ->  | B647: of:=NA() ->  | C647: of:=ISERROR([.A647]) -> true | D647: of:=FORMULA([.A647]) -> =LOOKUP(H605,MMULT(F570:F609,1),MMULT(G570:G609,1))
A648: of:=LOOKUP([.H606];MMULT([.F570:.F609];1);MMULT([.G570:.G609];1)) -> 190 | B648: 190 | C648: of:=[.A648]=[.B648] -> true | D648: of:=FORMULA([.A648]) -> =LOOKUP(H606,MMULT(F570:F609,1),MMULT(G570:G609,1))
A649: of:=LOOKUP([.H607];MMULT([.F570:.F609];1);MMULT([.G570:.G609];1)) -> 400 | B649: 400 | C649: of:=[.A649]=[.B649] -> true | D649: of:=FORMULA([.A649]) -> =LOOKUP(H607,MMULT(F570:F609,1),MMULT(G570:G609,1))
A650: of:=LOOKUP([.H608];MMULT([.F570:.F609];1);MMULT([.G570:.G609];1)) -> 70 | B650: 70 | C650: of:=[.A650]=[.B650] -> true | D650: of:=FORMULA([.A650]) -> =LOOKUP(H608,MMULT(F570:F609,1),MMULT(G570:G609,1))
A651: of:=LOOKUP([.H609];MMULT([.F570:.F609];1);MMULT([.G570:.G609];1)) ->  | B651: of:=NA() ->  | C651: of:=ISERROR([.A651]) -> true | D651: of:=FORMULA([.A651]) -> =LOOKUP(H609,MMULT(F570:F609,1),MMULT(G570:G609,1))
A652: of:=LOOKUP([.H610];MMULT([.F570:.F609];1);MMULT([.G570:.G609];1)) -> 10 | B652: 10 | C652: of:=[.A652]=[.B652] -> true | D652: of:=FORMULA([.A652]) -> =LOOKUP(H610,MMULT(F570:F609,1),MMULT(G570:G609,1))
A653: of:=LOOKUP([.H611];MMULT([.F570:.F609];1);MMULT([.G570:.G609];1)) -> 400 | B653: 400 | C653: of:=[.A653]=[.B653] -> true | D653: of:=FORMULA([.A653]) -> =LOOKUP(H611,MMULT(F570:F609,1),MMULT(G570:G609,1))
A654: of:=LOOKUP([.H612];MMULT([.F570:.F609];1);MMULT([.G570:.G609];1)) ->  | B654: of:=NA() ->  | C654: of:=ISERROR([.A654]) -> true | D654: of:=FORMULA([.A654]) -> =LOOKUP(H612,MMULT(F570:F609,1),MMULT(G570:G609,1))
A655: of:=LOOKUP([.H570];MMULT([.F570:.F609];1);[.G570:.G609]) ->  | B655: of:=NA() ->  | C655: of:=ISERROR([.A655]) -> true | D655: of:=FORMULA([.A655]) -> =LOOKUP(H570,MMULT(F570:F609,1),G570:G609)
A656: of:=LOOKUP([.H571];MMULT([.F570:.F609];1);[.G570:.G609]) -> 90 | B656: 90 | C656: of:=[.A656]=[.B656] -> true | D656: of:=FORMULA([.A656]) -> =LOOKUP(H571,MMULT(F570:F609,1),G570:G609)
A657: of:=LOOKUP([.H572];MMULT([.F570:.F609];1);[.G570:.G609]) -> 150 | B657: 150 | C657: of:=[.A657]=[.B657] -> true | D657: of:=FORMULA([.A657]) -> =LOOKUP(H572,MMULT(F570:F609,1),G570:G609)
A658: of:=LOOKUP([.H573];MMULT([.F570:.F609];1);[.G570:.G609]) -> 90 | B658: 90 | C658: of:=[.A658]=[.B658] -> true | D658: of:=FORMULA([.A658]) -> =LOOKUP(H573,MMULT(F570:F609,1),G570:G609)
A659: of:=LOOKUP([.H574];MMULT([.F570:.F609];1);[.G570:.G609]) ->  | B659: of:=NA() ->  | C659: of:=ISERROR([.A659]) -> true | D659: of:=FORMULA([.A659]) -> =LOOKUP(H574,MMULT(F570:F609,1),G570:G609)
A660: of:=LOOKUP([.H575];MMULT([.F570:.F609];1);[.G570:.G609]) ->  | B660: of:=NA() ->  | C660: of:=ISERROR([.A660]) -> true | D660: of:=FORMULA([.A660]) -> =LOOKUP(H575,MMULT(F570:F609,1),G570:G609)
A661: of:=LOOKUP([.H576];MMULT([.F570:.F609];1);[.G570:.G609]) -> 200 | B661: 200 | C661: of:=[.A661]=[.B661] -> true | D661: of:=FORMULA([.A661]) -> =LOOKUP(H576,MMULT(F570:F609,1),G570:G609)
A662: of:=LOOKUP([.H577];MMULT([.F570:.F609];1);[.G570:.G609]) -> 400 | B662: 400 | C662: of:=[.A662]=[.B662] -> true | D662: of:=FORMULA([.A662]) -> =LOOKUP(H577,MMULT(F570:F609,1),G570:G609)
A663: of:=LOOKUP([.H578];MMULT([.F570:.F609];1);[.G570:.G609]) -> 280 | B663: 280 | C663: of:=[.A663]=[.B663] -> true | D663: of:=FORMULA([.A663]) -> =LOOKUP(H578,MMULT(F570:F609,1),G570:G609)
A664: of:=LOOKUP([.H579];MMULT([.F570:.F609];1);[.G570:.G609]) ->  | B664: of:=NA() ->  | C664: of:=ISERROR([.A664]) -> true | D664: of:=FORMULA([.A664]) -> =LOOKUP(H579,MMULT(F570:F609,1),G570:G609)
A665: of:=LOOKUP([.H580];MMULT([.F570:.F609];1);[.G570:.G609]) ->  | B665: of:=NA() ->  | C665: of:=ISERROR([.A665]) -> true | D665: of:=FORMULA([.A665]) -> =LOOKUP(H580,MMULT(F570:F609,1),G570:G609)
A666: of:=LOOKUP([.H581];MMULT([.F570:.F609];1);[.G570:.G609]) -> 340 | B666: 340 | C666: of:=[.A666]=[.B666] -> true | D666: of:=FORMULA([.A666]) -> =LOOKUP(H581,MMULT(F570:F609,1),G570:G609)
A667: of:=LOOKUP([.H582];MMULT([.F570:.F609];1);[.G570:.G609]) -> 340 | B667: 340 | C667: of:=[.A667]=[.B667] -> true | D667: of:=FORMULA([.A667]) -> =LOOKUP(H582,MMULT(F570:F609,1),G570:G609)
A668: of:=LOOKUP([.H583];MMULT([.F570:.F609];1);[.G570:.G609]) -> 140 | B668: 140 | C668: of:=[.A668]=[.B668] -> true | D668: of:=FORMULA([.A668]) -> =LOOKUP(H583,MMULT(F570:F609,1),G570:G609)
A669: of:=LOOKUP([.H584];MMULT([.F570:.F609];1);[.G570:.G609]) -> 350 | B669: 350 | C669: of:=[.A669]=[.B669] -> true | D669: of:=FORMULA([.A669]) -> =LOOKUP(H584,MMULT(F570:F609,1),G570:G609)
A670: of:=LOOKUP([.H585];MMULT([.F570:.F609];1);[.G570:.G609]) -> 260 | B670: 260 | C670: of:=[.A670]=[.B670] -> true | D670: of:=FORMULA([.A670]) -> =LOOKUP(H585,MMULT(F570:F609,1),G570:G609)
A671: of:=LOOKUP([.H586];MMULT([.F570:.F609];1);[.G570:.G609]) -> 200 | B671: 200 | C671: of:=[.A671]=[.B671] -> true | D671: of:=FORMULA([.A671]) -> =LOOKUP(H586,MMULT(F570:F609,1),G570:G609)
A672: of:=LOOKUP([.H587];MMULT([.F570:.F609];1);[.G570:.G609]) -> 270 | B672: 270 | C672: of:=[.A672]=[.B672] -> true | D672: of:=FORMULA([.A672]) -> =LOOKUP(H587,MMULT(F570:F609,1),G570:G609)
A673: of:=LOOKUP([.H588];MMULT([.F570:.F609];1);[.G570:.G609]) -> 250 | B673: 250 | C673: of:=[.A673]=[.B673] -> true | D673: of:=FORMULA([.A673]) -> =LOOKUP(H588,MMULT(F570:F609,1),G570:G609)
A674: of:=LOOKUP([.H589];MMULT([.F570:.F609];1);[.G570:.G609]) -> 190 | B674: 190 | C674: of:=[.A674]=[.B674] -> true | D674: of:=FORMULA([.A674]) -> =LOOKUP(H589,MMULT(F570:F609,1),G570:G609)
A675: of:=LOOKUP([.H590];MMULT([.F570:.F609];1);[.G570:.G609]) ->  | B675: of:=NA() ->  | C675: of:=ISERROR([.A675]) -> true | D675: of:=FORMULA([.A675]) -> =LOOKUP(H590,MMULT(F570:F609,1),G570:G609)
A676: of:=LOOKUP([.H591];MMULT([.F570:.F609];1);[.G570:.G609]) -> 100 | B676: 100 | C676: of:=[.A676]=[.B676] -> true | D676: of:=FORMULA([.A676]) -> =LOOKUP(H591,MMULT(F570:F609,1),G570:G609)
A677: of:=LOOKUP([.H592];MMULT([.F570:.F609];1);[.G570:.G609]) ->  | B677: of:=NA() ->  | C677: of:=ISERROR([.A677]) -> true | D677: of:=FORMULA([.A677]) -> =LOOKUP(H592,MMULT(F570:F609,1),G570:G609)
A678: of:=LOOKUP([.H593];MMULT([.F570:.F609];1);[.G570:.G609]) ->  | B678: of:=NA() ->  | C678: of:=ISERROR([.A678]) -> true | D678: of:=FORMULA([.A678]) -> =LOOKUP(H593,MMULT(F570:F609,1),G570:G609)
A679: of:=LOOKUP([.H594];MMULT([.F570:.F609];1);[.G570:.G609]) -> 40 | B679: 40 | C679: of:=[.A679]=[.B679] -> true | D679: of:=FORMULA([.A679]) -> =LOOKUP(H594,MMULT(F570:F609,1),G570:G609)
A680: of:=LOOKUP([.H595];MMULT([.F570:.F609];1);[.G570:.G609]) ->  | B680: of:=NA() ->  | C680: of:=ISERROR([.A680]) -> true | D680: of:=FORMULA([.A680]) -> =LOOKUP(H595,MMULT(F570:F609,1),G570:G609)
A681: of:=LOOKUP([.H596];MMULT([.F570:.F609];1);[.G570:.G609]) -> 400 | B681: 400 | C681: of:=[.A681]=[.B681] -> true | D681: of:=FORMULA([.A681]) -> =LOOKUP(H596,MMULT(F570:F609,1),G570:G609)
A682: of:=LOOKUP([.H597];MMULT([.F570:.F609];1);[.G570:.G609]) -> 290 | B682: 290 | C682: of:=[.A682]=[.B682] -> true | D682: of:=FORMULA([.A682]) -> =LOOKUP(H597,MMULT(F570:F609,1),G570:G609)
A683: of:=LOOKUP([.H598];MMULT([.F570:.F609];1);[.G570:.G609]) -> 150 | B683: 150 | C683: of:=[.A683]=[.B683] -> true | D683: of:=FORMULA([.A683]) -> =LOOKUP(H598,MMULT(F570:F609,1),G570:G609)
A684: of:=LOOKUP([.H599];MMULT([.F570:.F609];1);[.G570:.G609]) -> 180 | B684: 180 | C684: of:=[.A684]=[.B684] -> true | D684: of:=FORMULA([.A684]) -> =LOOKUP(H599,MMULT(F570:F609,1),G570:G609)
A685: of:=LOOKUP([.H600];MMULT([.F570:.F609];1);[.G570:.G609]) -> 400 | B685: 400 | C685: of:=[.A685]=[.B685] -> true | D685: of:=FORMULA([.A685]) -> =LOOKUP(H600,MMULT(F570:F609,1),G570:G609)
A686: of:=LOOKUP([.H601];MMULT([.F570:.F609];1);[.G570:.G609]) ->  | B686: of:=NA() ->  | C686: of:=ISERROR([.A686]) -> true | D686: of:=FORMULA([.A686]) -> =LOOKUP(H601,MMULT(F570:F609,1),G570:G609)
A687: of:=LOOKUP([.H602];MMULT([.F570:.F609];1);[.G570:.G609]) -> 100 | B687: 100 | C687: of:=[.A687]=[.B687] -> true | D687: of:=FORMULA([.A687]) -> =LOOKUP(H602,MMULT(F570:F609,1),G570:G609)
A688: of:=LOOKUP([.H603];MMULT([.F570:.F609];1);[.G570:.G609]) -> 400 | B688: 400 | C688: of:=[.A688]=[.B688] -> true | D688: of:=FORMULA([.A688]) -> =LOOKUP(H603,MMULT(F570:F609,1),G570:G609)
A689: of:=LOOKUP([.H604];MMULT([.F570:.F609];1);[.G570:.G609]) -> 200 | B689: 200 | C689: of:=[.A689]=[.B689] -> true | D689: of:=FORMULA([.A689]) -> =LOOKUP(H604,MMULT(F570:F609,1),G570:G609)
A690: of:=LOOKUP([.H605];MMULT([.F570:.F609];1);[.G570:.G609]) ->  | B690: of:=NA() ->  | C690: of:=ISERROR([.A690]) -> true | D690: of:=FORMULA([.A690]) -> =LOOKUP(H605,MMULT(F570:F609,1),G570:G609)
A691: of:=LOOKUP([.H606];MMULT([.F570:.F609];1);[.G570:.G609]) -> 190 | B691: 190 | C691: of:=[.A691]=[.B691] -> true | D691: of:=FORMULA([.A691]) -> =LOOKUP(H606,MMULT(F570:F609,1),G570:G609)
A692: of:=LOOKUP([.H607];MMULT([.F570:.F609];1);[.G570:.G609]) -> 400 | B692: 400 | C692: of:=[.A692]=[.B692] -> true | D692: of:=FORMULA([.A692]) -> =LOOKUP(H607,MMULT(F570:F609,1),G570:G609)
A693: of:=LOOKUP([.H608];MMULT([.F570:.F609];1);[.G570:.G609]) -> 70 | B693: 70 | C693: of:=[.A693]=[.B693] -> true | D693: of:=FORMULA([.A693]) -> =LOOKUP(H608,MMULT(F570:F609,1),G570:G609)
A694: of:=LOOKUP([.H609];MMULT([.F570:.F609];1);[.G570:.G609]) ->  | B694: of:=NA() ->  | C694: of:=ISERROR([.A694]) -> true | D694: of:=FORMULA([.A694]) -> =LOOKUP(H609,MMULT(F570:F609,1),G570:G609)
A695: of:=LOOKUP([.H610];MMULT([.F570:.F609];1);[.G570:.G609]) -> 10 | B695: 10 | C695: of:=[.A695]=[.B695] -> true | D695: of:=FORMULA([.A695]) -> =LOOKUP(H610,MMULT(F570:F609,1),G570:G609)
A696: of:=LOOKUP([.H611];MMULT([.F570:.F609];1);[.G570:.G609]) -> 400 | B696: 400 | C696: of:=[.A696]=[.B696] -> true | D696: of:=FORMULA([.A696]) -> =LOOKUP(H611,MMULT(F570:F609,1),G570:G609)
A697: of:=LOOKUP([.H612];MMULT([.F570:.F609];1);[.G570:.G609]) ->  | B697: of:=NA() ->  | C697: of:=ISERROR([.A697]) -> true | D697: of:=FORMULA([.A697]) -> =LOOKUP(H612,MMULT(F570:F609,1),G570:G609) | F697: Matrix of non-matching size
A698: of:=LOOKUP([.F699];{"A";"B";"C"};{"Andy"}) -> Andy | B698: Andy | C698: of:=[.A698]=[.B698] -> true | D698: of:=FORMULA([.A698]) -> =LOOKUP(F699,{"A","B","C"},{"Andy"}) | F698: Target | G698: Formula | I698: Excel XP
A699: of:=LOOKUP([.F700];{"A";"B";"C"};{"Andy"}) ->  | B699: of:=NA() ->  | C699: of:=ISERROR([.A699]) -> true | D699: of:=FORMULA([.A699]) -> =LOOKUP(F700,{"A","B","C"},{"Andy"}) | F699: A
A700: of:=LOOKUP([.F701];{"A";"B";"C"};{"Andy"}) ->  | B700: of:=NA() ->  | C700: of:=ISERROR([.A700]) -> true | D700: of:=FORMULA([.A700]) -> =LOOKUP(F701,{"A","B","C"},{"Andy"}) | F700: B
A701: of:=LOOKUP([.F699];{"A"};{"Andy";"Bruce";"Charlie"}) -> Andy | B701: Andy | C701: of:=[.A701]=[.B701] -> true | D701: of:=FORMULA([.A701]) -> =LOOKUP(F699,{"A"},{"Andy","Bruce","Charlie"}) | F701: C
A702: of:=LOOKUP([.F700];{"A"};{"Andy";"Bruce";"Charlie"}) -> Andy | B702: Andy | C702: of:=[.A702]=[.B702] -> true | D702: of:=FORMULA([.A702]) -> =LOOKUP(F700,{"A"},{"Andy","Bruce","Charlie"})
A703: of:=LOOKUP([.F701];{"A"};{"Andy";"Bruce";"Charlie"}) -> Andy | B703: Andy | C703: of:=[.A703]=[.B703] -> true | D703: of:=FORMULA([.A703]) -> =LOOKUP(F701,{"A"},{"Andy","Bruce","Charlie"}) | I703: Case sensitivity
A704: of:=LOOKUP([.I705];{"A";"B";"C";"D";"E";"F"};{"Andy";"Bruce";"Charlie";"David";"Edward";"Frank"}) -> Andy | B704: Andy | C704: of:=[.A704]=[.B704] -> true | D704: of:=FORMULA([.A704]) -> =LOOKUP(I705,{"A","B","C","D","E","F"},{"Andy","Bruce","Charlie","David","Edward","Frank"}) | I704: Target | J704: Formula
A705: of:=LOOKUP([.I706];{"A";"B";"C";"D";"E";"F"};{"Andy";"Bruce";"Charlie";"David";"Edward";"Frank"}) -> Bruce | B705: Bruce | C705: of:=[.A705]=[.B705] -> true | D705: of:=FORMULA([.A705]) -> =LOOKUP(I706,{"A","B","C","D","E","F"},{"Andy","Bruce","Charlie","David","Edward","Frank"}) | I705: a
A706: of:=LOOKUP([.I707];{"A";"B";"C";"D";"E";"F"};{"Andy";"Bruce";"Charlie";"David";"Edward";"Frank"}) -> Charlie | B706: Charlie | C706: of:=[.A706]=[.B706] -> true | D706: of:=FORMULA([.A706]) -> =LOOKUP(I707,{"A","B","C","D","E","F"},{"Andy","Bruce","Charlie","David","Edward","Frank"}) | I706: B
A707: of:=LOOKUP([.I708];{"A";"B";"C";"D";"E";"F"};{"Andy";"Bruce";"Charlie";"David";"Edward";"Frank"}) -> David | B707: David | C707: of:=[.A707]=[.B707] -> true | D707: of:=FORMULA([.A707]) -> =LOOKUP(I708,{"A","B","C","D","E","F"},{"Andy","Bruce","Charlie","David","Edward","Frank"}) | I707: c
A708: of:=LOOKUP([.I709];{"A";"B";"C";"D";"E";"F"};{"Andy";"Bruce";"Charlie";"David";"Edward";"Frank"}) -> Edward | B708: Edward | C708: of:=[.A708]=[.B708] -> true | D708: of:=FORMULA([.A708]) -> =LOOKUP(I709,{"A","B","C","D","E","F"},{"Andy","Bruce","Charlie","David","Edward","Frank"}) | I708: D
A709: of:=LOOKUP([.I710];{"A";"B";"C";"D";"E";"F"};{"Andy";"Bruce";"Charlie";"David";"Edward";"Frank"}) -> Frank | B709: Frank | C709: of:=[.A709]=[.B709] -> true | D709: of:=FORMULA([.A709]) -> =LOOKUP(I710,{"A","B","C","D","E","F"},{"Andy","Bruce","Charlie","David","Edward","Frank"}) | I709: e
A710: of:=LOOKUP([.I711];{"A";"B";"C";"D";"E";"F"};{"Andy";"Bruce";"Charlie";"David";"Edward";"Frank"}) -> Frank | B710: Frank | C710: of:=[.A710]=[.B710] -> true | D710: of:=FORMULA([.A710]) -> =LOOKUP(I711,{"A","B","C","D","E","F"},{"Andy","Bruce","Charlie","David","Edward","Frank"}) | I710: F
A711: of:=LOOKUP([.I712];{"A";"B";"C";"D";"E";"F"};{"Andy";"Bruce";"Charlie";"David";"Edward";"Frank"}) -> Frank | B711: Frank | C711: of:=[.A711]=[.B711] -> true | D711: of:=FORMULA([.A711]) -> =LOOKUP(I712,{"A","B","C","D","E","F"},{"Andy","Bruce","Charlie","David","Edward","Frank"}) | I711: g
A712: of:=LOOKUP([.I713];{"A";"B";"C";"D";"E";"F"};{"Andy";"Bruce";"Charlie";"David";"Edward";"Frank"}) -> Frank | B712: Frank | C712: of:=[.A712]=[.B712] -> true | D712: of:=FORMULA([.A712]) -> =LOOKUP(I713,{"A","B","C","D","E","F"},{"Andy","Bruce","Charlie","David","Edward","Frank"}) | I712: H
A713: of:=LOOKUP(4; [.I715:.K715]*2; [.I717:.K717]/3) -> 7.33333333333333 | B713: 7.33333333333333 | C713: of:=ROUND([.A713];12)=ROUND([.B713];12) -> true | D713: of:=FORMULA([.A713]) -> =LOOKUP(4, I715:K715*2, I717:K717/3) | I713: z
A714: of:=LOOKUP(2;[.I715]) -> 2 | B714: 2 | C714: of:=ROUND([.A714];12)=ROUND([.B714];12) -> true | D714: of:=FORMULA([.A714]) -> =LOOKUP(2,I715)
A715: of:=LOOKUP(1;1) -> 1 | B715: 1 | C715: of:=ROUND([.A715];12)=ROUND([.B715];12) -> true | D715: of:=FORMULA([.A715]) -> =LOOKUP(1,1) | I715: 2 | J715: 4 | K715: 8 | O715: constants lookups
A716: of:=LOOKUP(1;{1;2}) -> 1 | B716: 1 | C716: of:=ROUND([.A716];12)=ROUND([.B716];12) -> true | D716: of:=FORMULA([.A716]) -> =LOOKUP(1,{1,2})
A717: of:=LOOKUP(2;[.I715];[.I717]) -> 22 | B717: 22 | C717: of:=ROUND([.A717];12)=ROUND([.B717];12) -> true | D717: of:=FORMULA([.A717]) -> =LOOKUP(2,I715,I717) | I717: 22 | J717: 44 | K717: 88
A718: of:=LOOKUP(1;1;3) -> 3 | B718: 3 | C718: of:=ROUND([.A718];12)=ROUND([.B718];12) -> true | D718: of:=FORMULA([.A718]) -> =LOOKUP(1,1,3) | M718: forced array
A719: of:=LOOKUP(1;{1;2};{3;4}) -> 3 | B719: 3 | C719: of:=ROUND([.A719];12)=ROUND([.B719];12) -> true | D719: of:=FORMULA([.A719]) -> =LOOKUP(1,{1,2},{3,4})
A720: of:=LOOKUP(15000;{500|501|502|700|701|702|703|900|901|902|1600|1601|1800|1801|2000|2001|2002|2003|2004|2005|2006|2300|2301|2302|2303|2304|2305|2306|2307|2308|2309|2310|2311|2312|2313|2314|10000|10001|10002|10003|10004|10005|10006|10007|10008|10009|10010|10011|10012|10013|10014|11000|11001|11002|11003|11004|11005|11006|11007|11008|12000|12001|12002|12003|13000|13001|13002|13003|13004|13005|13006|13007|13008|13500|13501|13502|13503|13504|14000|14001|14100|14100|14101|14102|14103|14104|14105|14106|14400|14800|14801|14802|14803|14804|14805|15000|||};{500|501|502|700|701|702|703|900|901|902|1600|1601|1800|1801|2000|2001|2002|2003|2004|2005|2006|2300|2301|2302|2303|2304|2305|2306|2307|2308|2309|2310|2311|2312|2313|2314|10000|10001|10002|10003|10004|10005|10006|10007|10008|10009|10010|10011|10012|10013|10014|11000|11001|11002|11003|11004|11005|11006|11007|11008|12000|12001|12002|12003|13000|13001|13002|13003|13004|13005|13006|13007|13008|13500|13501|13502|13503|13504|14000|14001|14100|14100|14101|14102|14103|14104|14105|14106|14400|14800|14801|14802|14803|14804|14805|15000|||}) -> 15000 | B720: 15000 | C720: of:=[.A720]=[.B720] -> true | D720: of:=FORMULA([.A720]) -> =LOOKUP(15000;{500;501;502;700;701;702;703;900;901;902;1600;1601;1800;1801;2000;2001;2002;2003;2004;2005;2006;2300;2301;2302;2303;2304;2305;2306;2307;2308;2309;2310;2311;2312;2313;2314;10000;10001;10002;10003;10004;10005;10006;10007;10008;10009;10010;10011;10012;10013;10014;11000;11001;11002;11003;11004;11005;11006;11007;11008;12000;12001;12002;12003;13000;13001;13002;13003;13004;13005;13006;13007;13008;13500;13501;13502;13503;13504;14000;14001;14100;14100;14101;14102;14103;14104;14105;14106;14400;14800;14801;14802;14803;14804;14805;15000;;;};{500;501;502;700;701;702;703;900;901;902;1600;1601;1800;1801;2000;2001;2002;2003;2004;2005;2006;2300;2301;2302;2303;2304;2305;2306;2307;2308;2309;2310;2311;2312;2313;2314;10000;10001;10002;10003;10004;10005;10006;10007;10008;10009;10010;10011;10012;10013;10014;11000;11001;11002;11003;11004;11005;11006;11007;11008;12000;12001;12002;12003;13000;13001;13002;13003;13004;13005;13006;13007;13008;13500;13501;13502;13503;13504;14000;14001;14100;14100;14101;14102;14103;14104;14105;14106;14400;14800;14801;14802;14803;14804;14805;15000;;;})

Sheet: Data
A1: Date | B1: Data
A2: 2013-11-01 | B2: a
A3: 2013-11-02
A4: 2013-11-03 | B4: b
A5: 2013-11-04
A6: 2013-11-05 | B6: c
A7: 2013-11-06
A8: 2013-11-07 | B8: d
A9: 2013-11-08

Sheet: 'file:///home/zdenek/Dokumenty/LO/sc-unit-test/Project%20Calc%20functions%20tests/fods/lookup.fods/lookup.fods/lookup.fods/indirect.fods/index.fods/function_based_test_Example.fods/function_based_test_Example_reference.fods'#Sheet2
H3: 4

Sheet: 'file:///home/zdenek/Dokumenty/LO/sc-unit-test/Project%20Calc%20functions%20tests/fods/lookup.fods/lookup.fods/lookup.fods/test%20files%20from%20web/try2.ods'#Data
A2: 41579
A3: 41580
A4: 41581
A5: 41582
A6: 41583
A7: 41584
A8: 41585
A9: 41586
A10: a
A12: b
A14: c
A16: d