Sheet: Sheet1
A1: MATCH Function
A3: Result | B3: of:=AND([.B8:.B95]) -> true
A7: Sheet | B7: Result | C7: Description
A8: 1 | B8: of:=AND([Sheet2.C2:.C349]) -> true | C8: Simple MATCH formulas with local references and values

Sheet: Sheet2
A1: Function | B1: Expected | C1: Correct | D1: FunctionString | E1: Comment | F1: A | G1: a
A2: of:=MATCH("a";range1) -> 1 | B2: 1 | C2: of:=ROUND([.A2];12)=ROUND([.B2];12) -> true | D2: of:=FORMULA([.A2]) -> =MATCH("a";range1)
A3: of:=MATCH([.F8];[.F5:.M5];1) ->  | B3: of:=NA() ->  | C3: of:=ISERROR([.A3]) -> true | D3: of:=FORMULA([.A3]) -> =MATCH(F8;F5:M5;1)
A4: of:=MATCH([.F9];[.F5:.M5];1) -> 1 | B4: 1 | C4: of:=ROUND([.A4];12)=ROUND([.B4];12) -> true | D4: of:=FORMULA([.A4]) -> =MATCH(F9;F5:M5;1)
A5: of:=MATCH([.F10];[.F5:.M5];1) -> 1 | B5: 1 | C5: of:=ROUND([.A5];12)=ROUND([.B5];12) -> true | D5: of:=FORMULA([.A5]) -> =MATCH(F10;F5:M5;1) | F5: 2 | G5: 4 | H5: 4 | I5: 8 | J5: B | K5: B | L5: D | M5: H
A6: of:=MATCH([.F11];[.F5:.M5];1) -> 3 | B6: 3 | C6: of:=ROUND([.A6];12)=ROUND([.B6];12) -> true | D6: of:=FORMULA([.A6]) -> =MATCH(F11;F5:M5;1)
A7: of:=MATCH([.F12];[.F5:.M5];1) -> 3 | B7: 3 | C7: of:=ROUND([.A7];12)=ROUND([.B7];12) -> true | D7: of:=FORMULA([.A7]) -> =MATCH(F12;F5:M5;1) | F7: Lookup
A8: of:=MATCH([.F13];[.F5:.M5];1) -> 3 | B8: 3 | C8: of:=ROUND([.A8];12)=ROUND([.B8];12) -> true | D8: of:=FORMULA([.A8]) -> =MATCH(F13;F5:M5;1) | F8: 1
A9: of:=MATCH([.F14];[.F5:.M5];1) -> 3 | B9: 3 | C9: of:=ROUND([.A9];12)=ROUND([.B9];12) -> true | D9: of:=FORMULA([.A9]) -> =MATCH(F14;F5:M5;1) | F9: 2
A10: of:=MATCH([.F15];[.F5:.M5];1) -> 4 | B10: 4 | C10: of:=ROUND([.A10];12)=ROUND([.B10];12) -> true | D10: of:=FORMULA([.A10]) -> =MATCH(F15;F5:M5;1) | F10: 3
A11: of:=MATCH([.F16];[.F5:.M5];1) -> 4 | B11: 4 | C11: of:=ROUND([.A11];12)=ROUND([.B11];12) -> true | D11: of:=FORMULA([.A11]) -> =MATCH(F16;F5:M5;1) | F11: 4
A12: of:=MATCH([.F17];[.F5:.M5];1) ->  | B12: of:=NA() ->  | C12: of:=ISERROR([.A12]) -> true | D12: of:=FORMULA([.A12]) -> =MATCH(F17;F5:M5;1) | F12: 5
A13: of:=MATCH([.F18];[.F5:.M5];1) -> 6 | B13: 6 | C13: of:=ROUND([.A13];12)=ROUND([.B13];12) -> true | D13: of:=FORMULA([.A13]) -> =MATCH(F18;F5:M5;1) | F13: 6
A14: of:=MATCH([.F19];[.F5:.M5];1) -> 6 | B14: 6 | C14: of:=ROUND([.A14];12)=ROUND([.B14];12) -> true | D14: of:=FORMULA([.A14]) -> =MATCH(F19;F5:M5;1) | F14: 7
A15: of:=MATCH([.F20];[.F5:.M5];1) -> 7 | B15: 7 | C15: of:=ROUND([.A15];12)=ROUND([.B15];12) -> true | D15: of:=FORMULA([.A15]) -> =MATCH(F20;F5:M5;1) | F15: 8
A16: of:=MATCH([.F21];[.F5:.M5];1) -> 7 | B16: 7 | C16: of:=ROUND([.A16];12)=ROUND([.B16];12) -> true | D16: of:=FORMULA([.A16]) -> =MATCH(F21;F5:M5;1) | F16: 9
A17: of:=MATCH([.F22];[.F5:.M5];1) -> 7 | B17: 7 | C17: of:=ROUND([.A17];12)=ROUND([.B17];12) -> true | D17: of:=FORMULA([.A17]) -> =MATCH(F22;F5:M5;1) | F17: A
A18: of:=MATCH([.F23];[.F5:.M5];1) -> 7 | B18: 7 | C18: of:=ROUND([.A18];12)=ROUND([.B18];12) -> true | D18: of:=FORMULA([.A18]) -> =MATCH(F23;F5:M5;1) | F18: B
A19: of:=MATCH([.F24];[.F5:.M5];1) -> 8 | B19: 8 | C19: of:=ROUND([.A19];12)=ROUND([.B19];12) -> true | D19: of:=FORMULA([.A19]) -> =MATCH(F24;F5:M5;1) | F19: C
A20: of:=MATCH([.F25];[.F5:.M5];1) -> 8 | B20: 8 | C20: of:=ROUND([.A20];12)=ROUND([.B20];12) -> true | D20: of:=FORMULA([.A20]) -> =MATCH(F25;F5:M5;1) | F20: D
A21: of:=MATCH([.F29];[.F29:.F37];0) -> 1 | B21: 1 | C21: of:=ROUND([.A21];12)=ROUND([.B21];12) -> true | D21: of:=FORMULA([.A21]) -> =MATCH(F29;F29:F37;0) | F21: E
A22: of:=MATCH([.F30];[.F29:.F37];0) -> 2 | B22: 2 | C22: of:=ROUND([.A22];12)=ROUND([.B22];12) -> true | D22: of:=FORMULA([.A22]) -> =MATCH(F30;F29:F37;0) | F22: F
A23: of:=MATCH([.F31];[.F29:.F37];0) -> 3 | B23: 3 | C23: of:=ROUND([.A23];12)=ROUND([.B23];12) -> true | D23: of:=FORMULA([.A23]) -> =MATCH(F31;F29:F37;0) | F23: G
A24: of:=MATCH([.F32];[.F29:.F37];0) -> 4 | B24: 4 | C24: of:=ROUND([.A24];12)=ROUND([.B24];12) -> true | D24: of:=FORMULA([.A24]) -> =MATCH(F32;F29:F37;0) | F24: H
A25: of:=MATCH([.F33];[.F29:.F37];0) -> 5 | B25: 5 | C25: of:=ROUND([.A25];12)=ROUND([.B25];12) -> true | D25: of:=FORMULA([.A25]) -> =MATCH(F33;F29:F37;0) | F25: I
A26: of:=MATCH([.F34];[.F29:.F37];0) -> 6 | B26: 6 | C26: of:=ROUND([.A26];12)=ROUND([.B26];12) -> true | D26: of:=FORMULA([.A26]) -> =MATCH(F34;F29:F37;0)
A27: of:=MATCH([.F35];[.F29:.F37];0) -> 7 | B27: 7 | C27: of:=ROUND([.A27];12)=ROUND([.B27];12) -> true | D27: of:=FORMULA([.A27]) -> =MATCH(F35;F29:F37;0)
A28: of:=MATCH([.F36];[.F29:.F37];0) -> 1 | B28: 1 | C28: of:=ROUND([.A28];12)=ROUND([.B28];12) -> true | D28: of:=FORMULA([.A28]) -> =MATCH(F36;F29:F37;0) | F28: Data | G28: MATCH | H28: MATCH_ARRAY | J28: Data | K28: MATCH | L28: MATCH_ARRAY
A29: of:=MATCH([.F37];[.F29:.F37];0) -> 2 | B29: 2 | C29: of:=ROUND([.A29];12)=ROUND([.B29];12) -> true | D29: of:=FORMULA([.A29]) -> =MATCH(F37;F29:F37;0) | F29: lundi | J29: 1
A30: of:=MATCH([.F29:.F37];[.F29:.F37];0) -> 1 | B30: 1 | C30: of:=ROUND([.A30];12)=ROUND([.B30];12) -> true | D30: of:=FORMULA([.A30]) -> {=MATCH(F29:F37;F29:F37;0)} | F30: mardi | J30: 2
A31: 2 | B31: 2 | C31: of:=ROUND([.A31];12)=ROUND([.B31];12) -> true | D31: of:=FORMULA([.A31]) -> {=MATCH(F29:F37;F29:F37;0)} | F31: mercredi | J31: 3
A32: 3 | B32: 3 | C32: of:=ROUND([.A32];12)=ROUND([.B32];12) -> true | D32: of:=FORMULA([.A32]) -> {=MATCH(F29:F37;F29:F37;0)} | F32: jeudi | J32: 4
A33: 4 | B33: 4 | C33: of:=ROUND([.A33];12)=ROUND([.B33];12) -> true | D33: of:=FORMULA([.A33]) -> {=MATCH(F29:F37;F29:F37;0)} | F33: vendredi | J33: 5
A34: 5 | B34: 5 | C34: of:=ROUND([.A34];12)=ROUND([.B34];12) -> true | D34: of:=FORMULA([.A34]) -> {=MATCH(F29:F37;F29:F37;0)} | F34: samedi | J34: 6
A35: 6 | B35: 6 | C35: of:=ROUND([.A35];12)=ROUND([.B35];12) -> true | D35: of:=FORMULA([.A35]) -> {=MATCH(F29:F37;F29:F37;0)} | F35: dimanche | J35: 7
A36: 7 | B36: 7 | C36: of:=ROUND([.A36];12)=ROUND([.B36];12) -> true | D36: of:=FORMULA([.A36]) -> {=MATCH(F29:F37;F29:F37;0)} | F36: lundi | J36: 1
A37: 1 | B37: 1 | C37: of:=ROUND([.A37];12)=ROUND([.B37];12) -> true | D37: of:=FORMULA([.A37]) -> {=MATCH(F29:F37;F29:F37;0)} | F37: mardi | J37: 2
A38: 2 | B38: 2 | C38: of:=ROUND([.A38];12)=ROUND([.B38];12) -> true | D38: of:=FORMULA([.A38]) -> {=MATCH(F29:F37;F29:F37;0)}
A39: of:=MATCH([.J29];[.J29:.J37];0) -> 1 | B39: 1 | C39: of:=ROUND([.A39];12)=ROUND([.B39];12) -> true | D39: of:=FORMULA([.A39]) -> =MATCH(J29;J29:J37;0) | F39: With Strings | J39: With numbers
A40: of:=MATCH([.J30];[.J29:.J37];0) -> 2 | B40: 2 | C40: of:=ROUND([.A40];12)=ROUND([.B40];12) -> true | D40: of:=FORMULA([.A40]) -> =MATCH(J30;J29:J37;0)
A41: of:=MATCH([.J31];[.J29:.J37];0) -> 3 | B41: 3 | C41: of:=ROUND([.A41];12)=ROUND([.B41];12) -> true | D41: of:=FORMULA([.A41]) -> =MATCH(J31;J29:J37;0) | G41: match_type
A42: of:=MATCH([.J32];[.J29:.J37];0) -> 4 | B42: 4 | C42: of:=ROUND([.A42];12)=ROUND([.B42];12) -> true | D42: of:=FORMULA([.A42]) -> =MATCH(J32;J29:J37;0) | F42: Other test | G42: 0 | H42: 1
A43: of:=MATCH([.J33];[.J29:.J37];0) -> 5 | B43: 5 | C43: of:=ROUND([.A43];12)=ROUND([.B43];12) -> true | D43: of:=FORMULA([.A43]) -> =MATCH(J33;J29:J37;0) | F43: A
A44: of:=MATCH([.J34];[.J29:.J37];0) -> 6 | B44: 6 | C44: of:=ROUND([.A44];12)=ROUND([.B44];12) -> true | D44: of:=FORMULA([.A44]) -> =MATCH(J34;J29:J37;0) | F44: B
A45: of:=MATCH([.J35];[.J29:.J37];0) -> 7 | B45: 7 | C45: of:=ROUND([.A45];12)=ROUND([.B45];12) -> true | D45: of:=FORMULA([.A45]) -> =MATCH(J35;J29:J37;0) | F45: C
A46: of:=MATCH([.J36];[.J29:.J37];0) -> 1 | B46: 1 | C46: of:=ROUND([.A46];12)=ROUND([.B46];12) -> true | D46: of:=FORMULA([.A46]) -> =MATCH(J36;J29:J37;0)
A47: of:=MATCH([.J37];[.J29:.J37];0) -> 2 | B47: 2 | C47: of:=ROUND([.A47];12)=ROUND([.B47];12) -> true | D47: of:=FORMULA([.A47]) -> =MATCH(J37;J29:J37;0)
A48: of:=MATCH([.J29:.J37];[.J29:.J37];0) -> 1 | B48: 1 | C48: of:=ROUND([.A48];12)=ROUND([.B48];12) -> true | D48: of:=FORMULA([.A48]) -> {=MATCH(J29:J37;J29:J37;0)}
A49: 2 | B49: 2 | C49: of:=ROUND([.A49];12)=ROUND([.B49];12) -> true | D49: of:=FORMULA([.A49]) -> {=MATCH(J29:J37;J29:J37;0)}
A50: 3 | B50: 3 | C50: of:=ROUND([.A50];12)=ROUND([.B50];12) -> true | D50: of:=FORMULA([.A50]) -> {=MATCH(J29:J37;J29:J37;0)}
A51: 4 | B51: 4 | C51: of:=ROUND([.A51];12)=ROUND([.B51];12) -> true | D51: of:=FORMULA([.A51]) -> {=MATCH(J29:J37;J29:J37;0)}
A52: 5 | B52: 5 | C52: of:=ROUND([.A52];12)=ROUND([.B52];12) -> true | D52: of:=FORMULA([.A52]) -> {=MATCH(J29:J37;J29:J37;0)}
A53: 6 | B53: 6 | C53: of:=ROUND([.A53];12)=ROUND([.B53];12) -> true | D53: of:=FORMULA([.A53]) -> {=MATCH(J29:J37;J29:J37;0)}
A54: 7 | B54: 7 | C54: of:=ROUND([.A54];12)=ROUND([.B54];12) -> true | D54: of:=FORMULA([.A54]) -> {=MATCH(J29:J37;J29:J37;0)}
A55: 1 | B55: 1 | C55: of:=ROUND([.A55];12)=ROUND([.B55];12) -> true | D55: of:=FORMULA([.A55]) -> {=MATCH(J29:J37;J29:J37;0)}
A56: 2 | B56: 2 | C56: of:=ROUND([.A56];12)=ROUND([.B56];12) -> true | D56: of:=FORMULA([.A56]) -> {=MATCH(J29:J37;J29:J37;0)}
A57: of:=MATCH([.F43:.F45];[.F43:.F45];0) -> 1 | B57: 1 | C57: of:=ROUND([.A57];12)=ROUND([.B57];12) -> true | D57: of:=FORMULA([.A57]) -> {=MATCH(F43:F45;F43:F45;0)}
A58: 2 | B58: 2 | C58: of:=ROUND([.A58];12)=ROUND([.B58];12) -> true | D58: of:=FORMULA([.A58]) -> {=MATCH(F43:F45;F43:F45;0)}
A59: 3 | B59: 3 | C59: of:=ROUND([.A59];12)=ROUND([.B59];12) -> true | D59: of:=FORMULA([.A59]) -> {=MATCH(F43:F45;F43:F45;0)}
A60: of:=MATCH([.F43:.F45];[.F43:.F45];1) -> 1 | B60: 1 | C60: of:=ROUND([.A60];12)=ROUND([.B60];12) -> true | D60: of:=FORMULA([.A60]) -> {=MATCH(F43:F45;F43:F45;1)}
A61: 2 | B61: 2 | C61: of:=ROUND([.A61];12)=ROUND([.B61];12) -> true | D61: of:=FORMULA([.A61]) -> {=MATCH(F43:F45;F43:F45;1)}
A62: 3 | B62: 3 | C62: of:=ROUND([.A62];12)=ROUND([.B62];12) -> true | D62: of:=FORMULA([.A62]) -> {=MATCH(F43:F45;F43:F45;1)}
A63: of:=MATCH({"A"|"B"|"C"};{"A"|"B"|"C"};0) -> 1 | B63: 1 | C63: of:=ROUND([.A63];12)=ROUND([.B63];12) -> true | D63: of:=FORMULA([.A63]) -> {=MATCH({"A";"B";"C"};{"A";"B";"C"};0)}
A64: 2 | B64: 2 | C64: of:=ROUND([.A64];12)=ROUND([.B64];12) -> true | D64: of:=FORMULA([.A64]) -> {=MATCH({"A";"B";"C"};{"A";"B";"C"};0)}
A65: 3 | B65: 3 | C65: of:=ROUND([.A65];12)=ROUND([.B65];12) -> true | D65: of:=FORMULA([.A65]) -> {=MATCH({"A";"B";"C"};{"A";"B";"C"};0)}
A66: of:=MATCH([.F43:.F45];{"A"|"B"|"C"};0) -> 1 | B66: 1 | C66: of:=ROUND([.A66];12)=ROUND([.B66];12) -> true | D66: of:=FORMULA([.A66]) -> {=MATCH(F43:F45;{"A";"B";"C"};0)}
A67: 2 | B67: 2 | C67: of:=ROUND([.A67];12)=ROUND([.B67];12) -> true | D67: of:=FORMULA([.A67]) -> {=MATCH(F43:F45;{"A";"B";"C"};0)}
A68: 3 | B68: 3 | C68: of:=ROUND([.A68];12)=ROUND([.B68];12) -> true | D68: of:=FORMULA([.A68]) -> {=MATCH(F43:F45;{"A";"B";"C"};0)}
A69: of:=MATCH({"A"|"B"|"C"};[.F43:.F45];0) -> 1 | B69: 1 | C69: of:=ROUND([.A69];12)=ROUND([.B69];12) -> true | D69: of:=FORMULA([.A69]) -> {=MATCH({"A";"B";"C"};F43:F45;0)}
A70: 2 | B70: 2 | C70: of:=ROUND([.A70];12)=ROUND([.B70];12) -> true | D70: of:=FORMULA([.A70]) -> {=MATCH({"A";"B";"C"};F43:F45;0)}
A71: 3 | B71: 3 | C71: of:=ROUND([.A71];12)=ROUND([.B71];12) -> true | D71: of:=FORMULA([.A71]) -> {=MATCH({"A";"B";"C"};F43:F45;0)} | H71: of:=[.I71] -> test2 | I71: test2 | J71: test1
A72: of:=MATCH([.F43:.F45];[.F43:.F45];0) -> 1 | B72: 1 | C72: of:=ROUND([.A72];12)=ROUND([.B72];12) -> true | D72: of:=FORMULA([.A72]) -> {=MATCH(F43:F45;F43:F45;0)} | J72: test2
A73: 2 | B73: 2 | C73: of:=ROUND([.A73];12)=ROUND([.B73];12) -> true | D73: of:=FORMULA([.A73]) -> {=MATCH(F43:F45;F43:F45;0)} | J73: test3
A74: 3 | B74: 3 | C74: of:=ROUND([.A74];12)=ROUND([.B74];12) -> true | D74: of:=FORMULA([.A74]) -> {=MATCH(F43:F45;F43:F45;0)}
A75: of:=MATCH([.H71];[.J71:.J73];0) -> 2 | B75: 2 | C75: of:=ROUND([.A75];12)=ROUND([.B75];12) -> true | D75: of:=FORMULA([.A75]) -> =MATCH(H71;J71:J73;0)
A76: of:=MATCH([.G76];[.A1:.A5]) ->  | B76: of:#N/A ->  | C76: of:=ISERROR([.A76]) -> true | D76: of:=FORMULA([.A76]) -> =MATCH(G76;A1:A5)
A77: of:=MATCH(0;[.G77:.G79];0) -> 2 | B77: 2 | C77: of:=ROUND([.A77];12)=ROUND([.B77];12) -> true | D77: of:=FORMULA([.A77]) -> =MATCH(0;G77:G79;0) | G77: of:=NA() -> 
A78: of:=MATCH(1;[.G77:.G79];0) -> 3 | B78: 3 | C78: of:=ROUND([.A78];12)=ROUND([.B78];12) -> true | D78: of:=FORMULA([.A78]) -> =MATCH(1;G77:G79;0) | G78: 0
A79: of:=MATCH(5;[.G77:.G79];0) ->  | B79: of:#N/A ->  | C79: of:=ISERROR([.A79]) -> true | D79: of:=FORMULA([.A79]) -> =MATCH(5;G77:G79;0) | G79: 1
A80: of:=MATCH([.I100];[.G95:.G98]) ->  | B80: of:#N/A ->  | C80: of:=ISERROR([.A80]) -> true | D80: of:=FORMULA([.A80]) -> =MATCH(I100;G95:G98)
A81: of:=MATCH([.I101];[.G95:.G98]) -> 1 | B81: 1 | C81: of:=[.A81]=[.B81] -> true | D81: of:=FORMULA([.A81]) -> =MATCH(I101;G95:G98)
A82: of:=MATCH([.I102];[.G95:.G98]) -> 1 | B82: 1 | C82: of:=[.A82]=[.B82] -> true | D82: of:=FORMULA([.A82]) -> =MATCH(I102;G95:G98) | G82: 842020700000001
A83: of:=MATCH([.I103];[.G95:.G98]) -> 2 | B83: 2 | C83: of:=[.A83]=[.B83] -> true | D83: of:=FORMULA([.A83]) -> =MATCH(I103;G95:G98) | G83: 842020700000002
A84: of:=MATCH([.I104];[.G95:.G98]) -> 2 | B84: 2 | C84: of:=[.A84]=[.B84] -> true | D84: of:=FORMULA([.A84]) -> =MATCH(I104;G95:G98) | G84: 842020700000003
A85: of:=MATCH([.I105];[.G95:.G98]) ->  | B85: of:#N/A ->  | C85: of:=ISERROR([.A85]) -> true | D85: of:=FORMULA([.A85]) -> =MATCH(I105;G95:G98) | G85: 842020700000004
A86: of:=MATCH([.I106];[.G95:.G98]) -> 3 | B86: 3 | C86: of:=[.A86]=[.B86] -> true | D86: of:=FORMULA([.A86]) -> =MATCH(I106;G95:G98) | G86: 842020700000005
A87: of:=MATCH([.I107];[.G95:.G98]) -> 3 | B87: 3 | C87: of:=[.A87]=[.B87] -> true | D87: of:=FORMULA([.A87]) -> =MATCH(I107;G95:G98)
A88: of:=MATCH([.I108];[.G95:.G98]) -> 4 | B88: 4 | C88: of:=[.A88]=[.B88] -> true | D88: of:=FORMULA([.A88]) -> =MATCH(I108;G95:G98)
A89: of:=MATCH([.I109];[.G95:.G98]) -> 4 | B89: 4 | C89: of:=[.A89]=[.B89] -> true | D89: of:=FORMULA([.A89]) -> =MATCH(I109;G95:G98) | G89: of:=MATCH([.G82];[.G82:.G86];0) -> 1 | I89: AOO#103291
A90: of:=MATCH([.I100];[.J95:.M95]) ->  | B90: of:#N/A ->  | C90: of:=ISERROR([.A90]) -> true | D90: of:=FORMULA([.A90]) -> =MATCH(I100;J95:M95) | G90: of:=MATCH([.G83];[.G82:.G86];0) -> 2
A91: of:=MATCH([.I101];[.J95:.M95]) -> 1 | B91: 1 | C91: of:=[.A91]=[.B91] -> true | D91: of:=FORMULA([.A91]) -> =MATCH(I101;J95:M95) | G91: of:=MATCH([.G84];[.G82:.G86];0) -> 3
A92: of:=MATCH([.I102];[.J95:.M95]) -> 1 | B92: 1 | C92: of:=[.A92]=[.B92] -> true | D92: of:=FORMULA([.A92]) -> =MATCH(I102;J95:M95) | G92: of:=MATCH([.G85];[.G82:.G86];0) -> 4
A93: of:=MATCH([.I103];[.J95:.M95]) -> 2 | B93: 2 | C93: of:=[.A93]=[.B93] -> true | D93: of:=FORMULA([.A93]) -> =MATCH(I103;J95:M95) | G93: of:=MATCH([.G86];[.G82:.G86];0) -> 5
A94: of:=MATCH([.I104];[.J95:.M95]) -> 2 | B94: 2 | C94: of:=[.A94]=[.B94] -> true | D94: of:=FORMULA([.A94]) -> =MATCH(I104;J95:M95)
A95: of:=MATCH([.I105];[.J95:.M95]) ->  | B95: of:#N/A ->  | C95: of:=ISERROR([.A95]) -> true | D95: of:=FORMULA([.A95]) -> =MATCH(I105;J95:M95) | G95: 1 | H95: one | J95: 1 | K95: 3 | L95: b | M95: d
A96: of:=MATCH([.I106];[.J95:.M95]) -> 3 | B96: 3 | C96: of:=[.A96]=[.B96] -> true | D96: of:=FORMULA([.A96]) -> =MATCH(I106;J95:M95) | G96: 3 | H96: two | J96: one | K96: two | L96: three | M96: four
A97: of:=MATCH([.I107];[.J95:.M95]) -> 3 | B97: 3 | C97: of:=[.A97]=[.B97] -> true | D97: of:=FORMULA([.A97]) -> =MATCH(I107;J95:M95) | G97: b | H97: three
A98: of:=MATCH([.I108];[.J95:.M95]) -> 4 | B98: 4 | C98: of:=[.A98]=[.B98] -> true | D98: of:=FORMULA([.A98]) -> =MATCH(I108;J95:M95) | G98: d | H98: four
A99: of:=MATCH([.I109];[.J95:.M95]) -> 4 | B99: 4 | C99: of:=[.A99]=[.B99] -> true | D99: of:=FORMULA([.A99]) -> =MATCH(I109;J95:M95) | I99: query value
A100: of:=MATCH([.H112];[.I112:.I121];-1) -> 1 | B100: 1 | C100: of:=[.A100]=[.B100] -> true | D100: of:=FORMULA([.A100]) -> =MATCH(H112;I112:I121;-1) | I100: 0
A101: of:=MATCH([.H113];[.I112:.I121];-1) -> 1 | B101: 1 | C101: of:=[.A101]=[.B101] -> true | D101: of:=FORMULA([.A101]) -> =MATCH(H113;I112:I121;-1) | I101: 1
A102: of:=MATCH([.H114];[.I112:.I121];-1) -> 2 | B102: 2 | C102: of:=[.A102]=[.B102] -> true | D102: of:=FORMULA([.A102]) -> =MATCH(H114;I112:I121;-1) | I102: 2
A103: of:=MATCH([.H115];[.I112:.I121];-1) -> 2 | B103: 2 | C103: of:=[.A103]=[.B103] -> true | D103: of:=FORMULA([.A103]) -> =MATCH(H115;I112:I121;-1) | I103: 3
A104: of:=MATCH([.H116];[.I112:.I121];-1) -> 3 | B104: 3 | C104: of:=[.A104]=[.B104] -> true | D104: of:=FORMULA([.A104]) -> =MATCH(H116;I112:I121;-1) | I104: 4
A105: of:=MATCH([.H117];[.I112:.I121];-1) -> 3 | B105: 3 | C105: of:=[.A105]=[.B105] -> true | D105: of:=FORMULA([.A105]) -> =MATCH(H117;I112:I121;-1) | I105: a
A106: of:=MATCH([.H118];[.I112:.I121];-1) -> 4 | B106: 4 | C106: of:=[.A106]=[.B106] -> true | D106: of:=FORMULA([.A106]) -> =MATCH(H118;I112:I121;-1) | I106: b
A107: of:=MATCH([.H119];[.I112:.I121];-1) -> 4 | B107: 4 | C107: of:=[.A107]=[.B107] -> true | D107: of:=FORMULA([.A107]) -> =MATCH(H119;I112:I121;-1) | I107: c
A108: of:=MATCH([.H120];[.I112:.I121];-1) -> 5 | B108: 5 | C108: of:=[.A108]=[.B108] -> true | D108: of:=FORMULA([.A108]) -> =MATCH(H120;I112:I121;-1) | I108: d
A109: of:=MATCH([.H121];[.I112:.I121];-1) -> 5 | B109: 5 | C109: of:=[.A109]=[.B109] -> true | D109: of:=FORMULA([.A109]) -> =MATCH(H121;I112:I121;-1) | I109: e
A110: of:=MATCH(1;[.O125:.O130];0) -> 6 | B110: 6 | C110: of:=[.A110]=[.B110] -> true | D110: of:=FORMULA([.A110]) -> =MATCH(1;O125:O130;0)
A111: of:=MATCH(1;FREQUENCY([.I126];[.H129:.M129]);0) -> 2 | B111: 2 | C111: of:=[.A111]=[.B111] -> true | D111: of:=FORMULA([.A111]) -> =MATCH(1;FREQUENCY(I126;H129:M129);0)
A112: of:=MATCH("r.d";[.H133:.H134];0) -> 2 | B112: 2 | C112: of:=[.A112]=[.B112] -> true | D112: of:=FORMULA([.A112]) -> =MATCH("r.d";H133:H134;0) | H112: 10 | I112: 10
A113: of:=MATCH("C";[.H138:.H149];0) -> 3 | B113: 3 | C113: of:=[.A113]=[.B113] -> true | D113: of:=FORMULA([.A113]) -> =MATCH("C";H138:H149;0) | H113: 9 | I113: 8
A114: of:=MATCH("C";[.I138:.I149];0) -> 3 | B114: 3 | C114: of:=[.A114]=[.B114] -> true | D114: of:=FORMULA([.A114]) -> =MATCH("C";I138:I149;0) | H114: 8 | I114: 6
A115: of:=MATCH("C";[.J138:.J149];0) -> 9 | B115: 9 | C115: of:=[.A115]=[.B115] -> true | D115: of:=FORMULA([.A115]) -> =MATCH("C";J138:J149;0) | H115: 7 | I115: 4
A116: of:=MATCH("C";[.K138:.K149];0) -> 9 | B116: 9 | C116: of:=[.A116]=[.B116] -> true | D116: of:=FORMULA([.A116]) -> =MATCH("C";K138:K149;0) | H116: 6 | I116: 2
A117: of:=MATCH(5;{20;19;18;17;16;15;14;13;12;11;10;6;6;5;5;4;4;3;2;1};-1) -> 15 | B117: 15 | C117: of:=[.A117]=[.B117] -> true | D117: of:=FORMULA([.A117]) -> =MATCH(5;{20.19.18.17.16.15.14.13.12.11.10.6.6.5.5.4.4.3.2.1};-1) | H117: 5 | I117: 0
A118: of:=MATCH("a";{1;3;"b";"d"};1) ->  | B118: of:#N/A ->  | C118: of:=ISERROR([.A118]) -> true | D118: of:=FORMULA([.A118]) -> =MATCH("a";{1.3."b"."d"};1) | E118: Tdf#152774 | H118: 4 | I118: -2
A119: of:=MATCH(4;{"d";"b";3;1};-1) ->  | B119: of:#N/A ->  | C119: of:=ISERROR([.A119]) -> true | D119: of:=FORMULA([.A119]) -> =MATCH(4;{"d"."b".3.1};-1) | E119: Tdf#152774 | H119: 3 | I119: -4
H120: 2 | I120: -6
H121: 1 | I121: -8
I125: 1 | O125: of:=FREQUENCY([.I125];[.H129:.M129]) -> 0
A126: of:=MATCH("^$";[.F1:.F2];0) ->  | B126: 2 | E126: Tdf#54255 | I126: 22 | O126: 0
O127: 0
O128: 0
H129: 30 | I129: 25 | J129: 20 | K129: 15 | L129: 10 | M129: 5 | O129: 0
H130: 1 | I130: 2 | J130: 3 | K130: 4 | L130: 5 | M130: 6 | O130: 1
A131: of:=MATCH([.$A$150];[.$150:.$150];0) -> 1 | B131: 1 | C131: of:=[.A131]=[.B131] -> true | E131: Tdf#161964 | O131: 0
A132: of:=MATCH([.$B$150];[.$150:.$150];0) -> 2 | B132: 2 | C132: of:=[.A132]=[.B132] -> true
A133: of:=MATCH([.$C$150];[.$150:.$150];0) -> 3 | B133: 3 | C133: of:=[.A133]=[.B133] -> true | H133: blue
A134: of:=MATCH([.$D$150];[.$150:.$150];0) -> 4 | B134: 4 | C134: of:=[.A134]=[.B134] -> true | H134: red
A136: of:=MATCH([.$A$150];[.$150:.$150];1) -> 1 | B136: 1 | C136: of:=[.A136]=[.B136] -> true
A137: of:=MATCH([.$B$150];[.$150:.$150];1) -> 2 | B137: 2 | C137: of:=[.A137]=[.B137] -> true
A138: of:=MATCH([.$C$150];[.$150:.$150];1) -> 3 | B138: 3 | C138: of:=[.A138]=[.B138] -> true | H138: A | I138: A | J138: A | K138: A
A139: of:=MATCH([.$D$150];[.$150:.$150];1) -> 4 | B139: 4 | C139: of:=[.A139]=[.B139] -> true | H139: B | I139: B | J139: A | K139: B
H140: C | I140: C | J140: A | K140: X
A141: of:=MATCH([.$A$150];[.$150:.$150];-1) -> 1 | B141: 1 | C141: of:=[.A141]=[.B141] -> true | H141: D | I141: A | J141: A | K141: A
A142: of:=MATCH([.$B$150];[.$150:.$150];-1) -> 2 | B142: 2 | C142: of:=[.A142]=[.B142] -> true | H142: E | I142: B | J142: B | K142: B
A143: of:=MATCH([.$C$150];[.$150:.$150];-1) ->  | B143: of:=NA() ->  | C143: of:=ISERROR([.A143]) -> true | H143: F | I143: C | J143: B | K143: X
A144: of:=MATCH([.$D$150];[.$150:.$150];-1) ->  | B144: of:=NA() ->  | C144: of:=ISERROR([.A144]) -> true | H144: G | I144: A | J144: B | K144: A
H145: H | I145: B | J145: B | K145: B
H146: I | I146: C | J146: C | K146: C
H147: J | I147: A | J147: C | K147: A
H148: K | I148: B | J148: C | K148: B
H149: L | I149: C | J149: C | K149: X
A150: aaaa | B150: bbbb | C150: cccc | D150: ddddd
E151: Tdf#167171
A152: of:=MATCH(90;{100;110;120};1) ->  | B152: of:#N/A ->  | C152: of:=ISERROR([.A152]) -> true | D152: of:=FORMULA([.A152]) -> =MATCH(90;{100.110.120};1)
A153: of:=MATCH(100;{100;110;120};1) -> 1 | B153: 1 | C153: of:=[.A153]=[.B153] -> true | D153: of:=FORMULA([.A153]) -> =MATCH(100;{100.110.120};1)
A154: of:=MATCH(110;{100;110;120};1) -> 2 | B154: 2 | C154: of:=[.A154]=[.B154] -> true | D154: of:=FORMULA([.A154]) -> =MATCH(110;{100.110.120};1)
A155: of:=MATCH(115;{100;110;120};1) -> 2 | B155: 2 | C155: of:=[.A155]=[.B155] -> true | D155: of:=FORMULA([.A155]) -> =MATCH(115;{100.110.120};1)
A156: of:=MATCH(120;{100;110;120};1) -> 3 | B156: 3 | C156: of:=[.A156]=[.B156] -> true | D156: of:=FORMULA([.A156]) -> =MATCH(120;{100.110.120};1)
A157: of:=MATCH(130;{100;110;120};1) -> 3 | B157: 3 | C157: of:=[.A157]=[.B157] -> true | D157: of:=FORMULA([.A157]) -> =MATCH(130;{100.110.120};1)
A158: of:=MATCH(2; {1.2}; 1) -> 1 | B158: 1 | C158: of:=[.A158]=[.B158] -> true | D158: of:=FORMULA([.A158]) -> =MATCH(2; {1,2}; 1)
A159: of:=MATCH(2; {1;2}; 1) -> 2 | B159: 2 | C159: of:=[.A159]=[.B159] -> true | D159: of:=FORMULA([.A159]) -> =MATCH(2; {1.2}; 1)
A160: of:=MATCH(2; {1|2}; 1) -> 2 | B160: 2 | C160: of:=[.A160]=[.B160] -> true | D160: of:=FORMULA([.A160]) -> =MATCH(2; {1;2}; 1)

Sheet: 'file:///tmp/mozilla_zdenek0/yieldmat.fods/yieldmat.fods/yieldmat.fods/function_based_test_Example.fods/function_based_test_Example_reference.fods'#Sheet2
H3: 4