Sheet: Sheet1
A1: Unique Function
A3: Result | B3: of:=AND([.B8:.B95]) -> true
A7: Sheet | B7: Result | C7: Description
A8: 2 | B8: of:=AND([Sheet2.I2:.I209]) -> true | C8: Simple UNIQUE formulas with local references and values

Sheet: Sheet2
A1: Function | E1: Expected | I1: Correct | J1: FunctionString | K1: Comment | L1: XL-test | M1: Data | N1: 3 | O1: a | P1: 2 | Q1: 5 | R1: f | S1: c | T1: 7 | U1: c | V1: 3 | W1: a | X1: 3 | Y1: 4 | Z1: 7 | AA1: a
A2: Data | E2: Data | K2: by row | M2: 3
A3: of:=COM.MICROSOFT.UNIQUE([.M$2:.M$62]) -> 3 | E3: 3 | I3: of:=([.A3]=[.E3]) -> true | J3: of:=FORMULA([.A3]) -> {=UNIQUE(M$2:M$62)} | M3: 4
A4: 4 | E4: 4 | I4: of:=([.A4]=[.E4]) -> true | J4: of:=FORMULA([.A4]) -> {=UNIQUE(M$2:M$62)} | M4: 2
A5: 2 | E5: 2 | I5: of:=([.A5]=[.E5]) -> true | J5: of:=FORMULA([.A5]) -> {=UNIQUE(M$2:M$62)} | M5: 5
A6: 5 | E6: 5 | I6: of:=([.A6]=[.E6]) -> true | J6: of:=FORMULA([.A6]) -> {=UNIQUE(M$2:M$62)} | M6: 7
A7: 7 | E7: 7 | I7: of:=([.A7]=[.E7]) -> true | J7: of:=FORMULA([.A7]) -> {=UNIQUE(M$2:M$62)} | M7: 12 | P7: Sales Rep
A8: 12 | E8: 12 | I8: of:=([.A8]=[.E8]) -> true | J8: of:=FORMULA([.A8]) -> {=UNIQUE(M$2:M$62)} | M8: 7 | P8: Tom
A9: 8 | E9: 8 | I9: of:=([.A9]=[.E9]) -> true | J9: of:=FORMULA([.A9]) -> {=UNIQUE(M$2:M$62)} | M9: 8 | P9: Fred
A10: a | E10: a | I10: of:=([.A10]=[.E10]) -> true | J10: of:=FORMULA([.A10]) -> {=UNIQUE(M$2:M$62)} | M10: 3 | P10: Amy
A11: v | E11: v | I11: of:=([.A11]=[.E11]) -> true | J11: of:=FORMULA([.A11]) -> {=UNIQUE(M$2:M$62)} | M11: 4 | P11: Sal
A12: r | E12: r | I12: of:=([.A12]=[.E12]) -> true | J12: of:=FORMULA([.A12]) -> {=UNIQUE(M$2:M$62)} | M12: 3 | P12: Fritz
A13: s | E13: s | I13: of:=([.A13]=[.E13]) -> true | J13: of:=FORMULA([.A13]) -> {=UNIQUE(M$2:M$62)} | M13: 4 | P13: Srivan
A14: b | E14: b | I14: of:=([.A14]=[.E14]) -> true | J14: of:=FORMULA([.A14]) -> {=UNIQUE(M$2:M$62)} | M14: 7 | P14: Xi
A15: c | E15: c | I15: of:=([.A15]=[.E15]) -> true | J15: of:=FORMULA([.A15]) -> {=UNIQUE(M$2:M$62)} | M15: a | P15: Hector
A16: x | E16: x | I16: of:=([.A16]=[.E16]) -> true | J16: of:=FORMULA([.A16]) -> {=UNIQUE(M$2:M$62)} | M16: v | P16: Tom
A17: 6 | E17: 6 | I17: of:=([.A17]=[.E17]) -> true | J17: of:=FORMULA([.A17]) -> {=UNIQUE(M$2:M$62)} | M17: r | P17: Fred
A18: 13 | E18: 13 | I18: of:=([.A18]=[.E18]) -> true | J18: of:=FORMULA([.A18]) -> {=UNIQUE(M$2:M$62)} | M18: s | P18: Amy
A19: 9 | E19: 9 | I19: of:=([.A19]=[.E19]) -> true | J19: of:=FORMULA([.A19]) -> {=UNIQUE(M$2:M$62)} | M19: a | P19: Sal
A20: 14 | E20: 14 | I20: of:=([.A20]=[.E20]) -> true | J20: of:=FORMULA([.A20]) -> {=UNIQUE(M$2:M$62)} | M20: b | P20: Fritz
A21: 10 | E21: 10 | I21: of:=([.A21]=[.E21]) -> true | J21: of:=FORMULA([.A21]) -> {=UNIQUE(M$2:M$62)} | M21: v | P21: Srivan
M22: c | P22: Xi
M23: x | P23: Hector
A24: Data | E24: Data | K24: Exactly once | M24: x
A25: of:=COM.MICROSOFT.UNIQUE([.M$2:.M$62];FALSE();TRUE()) -> 2 | E25: 2 | I25: of:=([.A25]=[.E25]) -> true | J25: of:=FORMULA([.A25]) -> {=UNIQUE(M$2:M$62;FALSE();TRUE())} | M25: c
A26: 12 | E26: 12 | I26: of:=([.A26]=[.E26]) -> true | J26: of:=FORMULA([.A26]) -> {=UNIQUE(M$2:M$62;FALSE();TRUE())} | M26: 4
A27: 13 | E27: 13 | I27: of:=([.A27]=[.E27]) -> true | J27: of:=FORMULA([.A27]) -> {=UNIQUE(M$2:M$62;FALSE();TRUE())} | M27: 5
A28: 14 | E28: 14 | I28: of:=([.A28]=[.E28]) -> true | J28: of:=FORMULA([.A28]) -> {=UNIQUE(M$2:M$62;FALSE();TRUE())} | M28: 3
A29: 10 | E29: 10 | I29: of:=([.A29]=[.E29]) -> true | J29: of:=FORMULA([.A29]) -> {=UNIQUE(M$2:M$62;FALSE();TRUE())} | M29: 6
M30: 8
M31: 13
A32: of:=COM.MICROSOFT.UNIQUE([.$N1:.$AA1];TRUE()) -> 3 | B32: a | C32: 2 | D32: 5 | E32: f | F32: c | G32: 7 | H32: 4 | I32: of:=([.A32]=[.A33])AND([.B32]=[.B33])AND([.C32]=[.C33])AND([.D32]=[.D33])AND([.E32]=[.E33])AND([.F32]=[.F33])AND([.G32]=[.G33])AND([.H32]=[.H33]) -> true | J32: of:=FORMULA([.A32]) -> {=UNIQUE($N1:$AA1;TRUE())} | K32: by col | M32: 8
A33: 3 | B33: a | C33: 2 | D33: 5 | E33: f | F33: c | G33: 7 | H33: 4 | M33: 9
M34: 4
M35: 5
A36: of:=COM.MICROSOFT.UNIQUE({"A"|"B"|"C"|"A"|"B"}) -> A | E36: A | I36: of:=([.A36]=[.E36]) -> true | J36: of:=FORMULA([.A36]) -> {=UNIQUE({"A";"B";"C";"A";"B"})} | M36: 4 | O36: Country | P36: Participation
A37: B | E37: B | I37: of:=([.A37]=[.E37]) -> true | J37: of:=FORMULA([.A37]) -> {=UNIQUE({"A";"B";"C";"A";"B"})} | M37: 5 | O37: United States | P37: Yes
A38: C | E38: C | I38: of:=([.A38]=[.E38]) -> true | J38: of:=FORMULA([.A38]) -> {=UNIQUE({"A";"B";"C";"A";"B"})} | M38: 8 | O38: Brazil | P38: No
M39: a | O39: Switzerland | P39: No
M40: v | O40: Brazil | P40: Yes
A41: of:=COM.MICROSOFT.UNIQUE({1;1;2;2;3};1) -> 1 | B41: 2 | C41: 3 | E41: 1 | F41: 2 | G41: 3 | I41: of:=([.A41]=[.E41])AND([.B41]=[.F41])AND([.C41]=[.G41]) -> true | J41: of:=FORMULA([.A41]) -> {=UNIQUE({1.1.2.2.3};1)} | M41: r | O41: China | P41: No
M42: s | O42: United States | P42: Yes
M43: a | O43: Argentina | P43: Yes
A44: of:=COM.MICROSOFT.UNIQUE({1|1|2|2|3};0;1) -> 3 | E44: 3 | I44: of:=([.A44]=[.E44]) -> true | J44: of:=FORMULA([.A44]) -> {=UNIQUE({1;1;2;2;3};0;1)} | M44: b | O44: Japan | P44: Yes
M45: v | O45: Switzerland | P45: No
A46: Sales Rep | E46: Sales Rep | K46: Sort & UNIQUE | M46: c | O46: Japan | P46: No
A47: of:=COM.MICROSOFT.SORT(COM.MICROSOFT.UNIQUE([.P$8:.P$23])) -> Amy | E47: Amy | I47: of:=([.A47]=[.E47]) -> true | J47: of:=FORMULA([.A47]) -> {=SORT(UNIQUE(P$8:P$23))} | M47: x | O47: Russia | P47: Yes
A48: Fred | E48: Fred | I48: of:=([.A48]=[.E48]) -> true | J48: of:=FORMULA([.A48]) -> {=SORT(UNIQUE(P$8:P$23))} | M48: x | O48: Brazil | P48: No
A49: Fritz | E49: Fritz | I49: of:=([.A49]=[.E49]) -> true | J49: of:=FORMULA([.A49]) -> {=SORT(UNIQUE(P$8:P$23))} | M49: c
A50: Hector | E50: Hector | I50: of:=([.A50]=[.E50]) -> true | J50: of:=FORMULA([.A50]) -> {=SORT(UNIQUE(P$8:P$23))} | M50: 5
A51: Sal | E51: Sal | I51: of:=([.A51]=[.E51]) -> true | J51: of:=FORMULA([.A51]) -> {=SORT(UNIQUE(P$8:P$23))} | M51: 6
A52: Srivan | E52: Srivan | I52: of:=([.A52]=[.E52]) -> true | J52: of:=FORMULA([.A52]) -> {=SORT(UNIQUE(P$8:P$23))} | M52: 4
A53: Tom | E53: Tom | I53: of:=([.A53]=[.E53]) -> true | J53: of:=FORMULA([.A53]) -> {=SORT(UNIQUE(P$8:P$23))} | M53: 7
A54: Xi | E54: Xi | I54: of:=([.A54]=[.E54]) -> true | J54: of:=FORMULA([.A54]) -> {=SORT(UNIQUE(P$8:P$23))} | M54: 9
M55: 14
M56: 9
M57: 10
A58: of:=COM.MICROSOFT.SORT(COM.MICROSOFT.UNIQUE([.P$8:.P$23]; ;1)) ->  | I58: of:=ISERROR([.A58]) -> true | J58: of:=FORMULA([.A58]) -> {=SORT(UNIQUE(P$8:P$23; ;1))} | K58: empty result array | M58: 5
M59: 6
A60: Country | B60: Participation | E60: Country | F60: Participation | M60: 5
A61: of:=COM.MICROSOFT.UNIQUE([.$O$37:.$P$48]) -> United States | B61: Yes | E61: United States | F61: Yes | I61: of:=([.A61]=[.E61])AND([.B61]=[.F61]) -> true | J61: of:=FORMULA([.A61]) -> {=UNIQUE($O$37:$P$48)} | M61: 6
A62: Brazil | B62: No | E62: Brazil | F62: No | I62: of:=([.A62]=[.E62])AND([.B62]=[.F62]) -> true | J62: of:=FORMULA([.A62]) -> {=UNIQUE($O$37:$P$48)} | M62: 9
A63: Switzerland | B63: No | E63: Switzerland | F63: No | I63: of:=([.A63]=[.E63])AND([.B63]=[.F63]) -> true | J63: of:=FORMULA([.A63]) -> {=UNIQUE($O$37:$P$48)}
A64: Brazil | B64: Yes | E64: Brazil | F64: Yes | I64: of:=([.A64]=[.E64])AND([.B64]=[.F64]) -> true | J64: of:=FORMULA([.A64]) -> {=UNIQUE($O$37:$P$48)}
A65: China | B65: No | E65: China | F65: No | I65: of:=([.A65]=[.E65])AND([.B65]=[.F65]) -> true | J65: of:=FORMULA([.A65]) -> {=UNIQUE($O$37:$P$48)}
A66: Argentina | B66: Yes | E66: Argentina | F66: Yes | I66: of:=([.A66]=[.E66])AND([.B66]=[.F66]) -> true | J66: of:=FORMULA([.A66]) -> {=UNIQUE($O$37:$P$48)}
A67: Japan | B67: Yes | E67: Japan | F67: Yes | I67: of:=([.A67]=[.E67])AND([.B67]=[.F67]) -> true | J67: of:=FORMULA([.A67]) -> {=UNIQUE($O$37:$P$48)}
A68: Japan | B68: No | E68: Japan | F68: No | I68: of:=([.A68]=[.E68])AND([.B68]=[.F68]) -> true | J68: of:=FORMULA([.A68]) -> {=UNIQUE($O$37:$P$48)}
A69: Russia | B69: Yes | E69: Russia | F69: Yes | I69: of:=([.A69]=[.E69])AND([.B69]=[.F69]) -> true | J69: of:=FORMULA([.A69]) -> {=UNIQUE($O$37:$P$48)}

Sheet: 'file:///C:/sources/Users/balu/Downloads/unique.xlsx'#Sheet2
D3: Brazil