Sheet: Sheet1
A1: VLOOKUP Function
A3: Result | B3: of:=AND([.B8:.B95]) -> true
A7: Sheet | B7: Result | C7: Description
A8: 1 | B8: of:=AND([Sheet2.C2:.C100]) -> true | C8: Simple VLOOKUP formulas with local references and values

Sheet: Sheet2
A1: Function | B1: Expected | C1: Correct | D1: FunctionString | E1: Comment | I1: nr | J1: fruit | L1: lookup table | P1: crit. | R1: b | S1: a | U1: 1 | V1: one | X1: 1 | Y1: 3 | Z1: b | AA1: d | AC1: table | AF1: column1 | AG1: expected | AH1: False | AJ1: Sorted num | AM1: Unsorted num
A2: of:=VLOOKUP(111;[.I1:.J5];2;FALSE()) -> Bananas | B2: Bananas | C2: of:=[.A2]=[.B2] -> true | D2: of:=FORMULA([.A2]) -> =VLOOKUP(111,I1:J5,2,FALSE()) | I2: 111 | J2: Bananas | L2: C | M2: 1 | O2: Case 1 | P2: DD | R2: d | S2: b | U2: 3 | V2: two | X2: one | Y2: two | Z2: three | AA2: four | AC2: 1 | AD2: apple | AF2: 3 | AH2: of:=VLOOKUP(column1;table;2;0) -> cherry | AJ2: 1 | AK2: 11 | AM2: 5 | AN2: 21
A3: of:=VLOOKUP([.P2];[.$L$2:.$M$8];2;0) -> 2 | B3: 2 | C3: of:=[.A3]=[.B3] -> true | D3: of:=FORMULA([.A3]) -> =VLOOKUP(P2,$L$2:$M$8,2,0) | I3: 112 | J3: Apples | L3: DD | M3: 2 | O3: Case 2 | P3: D. | S3: c | U3: b | V3: three | AC3: 2 | AD3: banana | AF3: 2 | AH3: of:=VLOOKUP(column1;table;2;0) -> banana | AJ3: 2 | AK3: 12 | AM3: 8 | AN3: 24
A4: of:=VLOOKUP([.P3];[.$L$2:.$M$8];2;0) -> 2 | B4: 2 | C4: of:=[.A4]=[.B4] -> true | D4: of:=FORMULA([.A4]) -> =VLOOKUP(P3,$L$2:$M$8,2,0) | I4: 113 | J4: Pears | L4: E F | M4: 3 | O4: Case 3 | P4: E F | S4: d | U4: d | V4: four | AC4: 3 | AD4: cherry | AF4: 4 | AH4: of:=VLOOKUP(column1;table;2;0) -> blackberry | AJ4: 4 | AK4: 14 | AM4: 6 | AN4: 22
A5: of:=VLOOKUP([.P4];[.$L$2:.$M$8];2;0) -> 3 | B5: 3 | C5: of:=[.A5]=[.B5] -> true | D5: of:=FORMULA([.A5]) -> =VLOOKUP(P4,$L$2:$M$8,2,0) | I5: 114 | J5: Oranges | L5: E.F | M5: 4 | O5: Case 4 | P5: E.F | S5: e | W5: query value | AC5: 4 | AD5: blackberry | AF5: 1 | AH5: of:=VLOOKUP(column1;table;2;0) -> apple
A6: of:=VLOOKUP([.P5];[.$L$2:.$M$8];2;0) -> 4 | B6: 4 | C6: of:=[.A6]=[.B6] -> true | D6: of:=FORMULA([.A6]) -> =VLOOKUP(P5,$L$2:$M$8,2,0) | L6: E\.F | M6: 5 | O6: Case 5 | P6: E\nF | W6: 0
A7: of:=VLOOKUP([.P6];[.$L$2:.$M$8];2;0) -> 3 | B7: 3 | C7: of:=[.A7]=[.B7] -> true | D7: of:=FORMULA([.A7]) -> =VLOOKUP(P6,$L$2:$M$8,2,0) | L7: F | M7: 6 | O7: Case 6 | P7: E\.F | W7: 1
A8: of:=VLOOKUP([.P7];[.$L$2:.$M$8];2;0) -> 4 | B8: 4 | C8: of:=[.A8]=[.B8] -> true | D8: of:=FORMULA([.A8]) -> =VLOOKUP(P7,$L$2:$M$8,2,0) | L8: G | M8: 7 | W8: 2
A9: of:=VLOOKUP([.S1];[.$R$1:.$R$2];1;1) ->  | B9: of:#N/A ->  | C9: of:=ISERROR([.A9]) -> true | D9: of:=FORMULA([.A9]) -> =VLOOKUP(S1,$R$1:$R$2,1,1) | W9: 3
A10: of:=VLOOKUP([.S2];[.$R$1:.$R$2];1;1) -> b | B10: b | C10: of:=[.A10]=[.B10] -> true | D10: of:=FORMULA([.A10]) -> =VLOOKUP(S2,$R$1:$R$2,1,1) | L10: Unsorted table | M10: Crit. | W10: 4
A11: of:=VLOOKUP([.S3];[.$R$1:.$R$2];1;1) -> b | B11: b | C11: of:=[.A11]=[.B11] -> true | D11: of:=FORMULA([.A11]) -> =VLOOKUP(S3,$R$1:$R$2,1,1) | L11: ABC | M11: ABC | W11: a
A12: of:=VLOOKUP([.S4];[.$R$1:.$R$2];1;1) -> d | B12: d | C12: of:=[.A12]=[.B12] -> true | D12: of:=FORMULA([.A12]) -> =VLOOKUP(S4,$R$1:$R$2,1,1) | L12: abcd | M12: AB | W12: b
A13: of:=VLOOKUP([.S5];[.$R$1:.$R$2];1;1) -> d | B13: d | C13: of:=[.A13]=[.B13] -> true | D13: of:=FORMULA([.A13]) -> =VLOOKUP(S5,$R$1:$R$2,1,1) | L13: coté | M13: ABCD | W13: c
A14: of:=VLOOKUP([.$W6];[.$U$1:.$V$4];2) ->  | B14: of:#N/A ->  | C14: of:=ISERROR([.A14]) -> true | D14: of:=FORMULA([.A14]) -> =VLOOKUP($W6,$U$1:$V$4,2) | L14: côte | M14: coté | W14: d
A15: of:=VLOOKUP([.$W7];[.$U$1:.$V$4];2) -> one | B15: one | C15: of:=[.A15]=[.B15] -> true | D15: of:=FORMULA([.A15]) -> =VLOOKUP($W7,$U$1:$V$4,2) | L15: côté | M15: côte | W15: e
A16: of:=VLOOKUP([.$W8];[.$U$1:.$V$4];2) -> one | B16: one | C16: of:=[.A16]=[.B16] -> true | D16: of:=FORMULA([.A16]) -> =VLOOKUP($W8,$U$1:$V$4,2) | L16: cote | M16: côté
A17: of:=VLOOKUP([.$W9];[.$U$1:.$V$4];2) -> two | B17: two | C17: of:=[.A17]=[.B17] -> true | D17: of:=FORMULA([.A17]) -> =VLOOKUP($W9,$U$1:$V$4,2) | L17: Dürst | M17: cote
A18: of:=VLOOKUP([.$W10];[.$U$1:.$V$4];2) -> two | B18: two | C18: of:=[.A18]=[.B18] -> true | D18: of:=FORMULA([.A18]) -> =VLOOKUP($W10,$U$1:$V$4,2) | L18: DUERST | M18: Dürst
A19: of:=VLOOKUP([.$W11];[.$U$1:.$V$4];2) ->  | B19: of:#N/A ->  | C19: of:=ISERROR([.A19]) -> true | D19: of:=FORMULA([.A19]) -> =VLOOKUP($W11,$U$1:$V$4,2) | L19: iiii | M19: DUERST
A20: of:=VLOOKUP([.$W12];[.$U$1:.$V$4];2) -> three | B20: three | C20: of:=[.A20]=[.B20] -> true | D20: of:=FORMULA([.A20]) -> =VLOOKUP($W12,$U$1:$V$4,2) | L20: İİİİ | M20: iiii
A21: of:=VLOOKUP([.$W13];[.$U$1:.$V$4];2) -> three | B21: three | C21: of:=[.A21]=[.B21] -> true | D21: of:=FORMULA([.A21]) -> =VLOOKUP($W13,$U$1:$V$4,2) | L21: ıııı | M21: İİİİ
A22: of:=VLOOKUP([.$W14];[.$U$1:.$V$4];2) -> four | B22: four | C22: of:=[.A22]=[.B22] -> true | D22: of:=FORMULA([.A22]) -> =VLOOKUP($W14,$U$1:$V$4,2) | L22: IIII | M22: ıııı
A23: of:=VLOOKUP([.$W15];[.$U$1:.$V$4];2) -> four | B23: four | C23: of:=[.A23]=[.B23] -> true | D23: of:=FORMULA([.A23]) -> =VLOOKUP($W15,$U$1:$V$4,2) | L23: ABCDEF | M23: IIII
A24: of:=VLOOKUP([.AF2];table;2;0) -> cherry | B24: cherry | C24: of:=[.A24]=[.B24] -> true | D24: of:=FORMULA([.A24]) -> =VLOOKUP(AF2,table,2,0) | M24: iii
A25: of:=VLOOKUP([.AF3];table;2;0) -> banana | B25: banana | C25: of:=[.A25]=[.B25] -> true | D25: of:=FORMULA([.A25]) -> =VLOOKUP(AF3,table,2,0) | M25: İİİ
A26: of:=VLOOKUP([.AF4];table;2;0) -> blackberry | B26: blackberry | C26: of:=[.A26]=[.B26] -> true | D26: of:=FORMULA([.A26]) -> =VLOOKUP(AF4,table,2,0) | M26: ııı
A27: of:=VLOOKUP([.AF5];table;2;0) -> apple | B27: apple | C27: of:=[.A27]=[.B27] -> true | D27: of:=FORMULA([.A27]) -> =VLOOKUP(AF5,table,2,0) | M27: III
A28: of:=[.AH2] -> cherry | B28: cherry | C28: of:=[.A28]=[.B28] -> true | D28: of:=FORMULA([.A28]) -> =AH2 | M28: ABCDEF
A29: of:=[.AH3] -> banana | B29: banana | C29: of:=[.A29]=[.B29] -> true | D29: of:=FORMULA([.A29]) -> =AH3
A30: of:=[.AH4] -> blackberry | B30: blackberry | C30: of:=[.A30]=[.B30] -> true | D30: of:=FORMULA([.A30]) -> =AH4
A31: of:=[.AH5] -> apple | B31: apple | C31: of:=[.A31]=[.B31] -> true | D31: of:=FORMULA([.A31]) -> =AH5
A32: of:=VLOOKUP([.AF2:.AF5];table;2;0) -> cherry | B32: cherry | C32: of:=[.A32]=[.B32] -> true | D32: of:=FORMULA([.A32]) -> {=VLOOKUP(AF2:AF5,table,2,0)}
A33: banana | B33: banana | C33: of:=[.A33]=[.B33] -> true | D33: of:=FORMULA([.A33]) -> {=VLOOKUP(AF2:AF5,table,2,0)}
A34: blackberry | B34: blackberry | C34: of:=[.A34]=[.B34] -> true | D34: of:=FORMULA([.A34]) -> {=VLOOKUP(AF2:AF5,table,2,0)}
A35: apple | B35: apple | C35: of:=[.A35]=[.B35] -> true | D35: of:=FORMULA([.A35]) -> {=VLOOKUP(AF2:AF5,table,2,0)}
A36: of:=VLOOKUP([.M11]; [.L$11:.M$16];1;0) -> ABC | B36: ABC | C36: of:=[.A36]=[.B36] -> true | D36: of:=FORMULA([.A36]) -> =VLOOKUP(M11, L$11:M$16,1,0)
A37: of:=VLOOKUP([.M12]; [.L$11:.M$32];1;0) ->  | B37: of:=#N/A ->  | C37: of:=ISERROR([.A37]) -> true | D37: of:=FORMULA([.A37]) -> =VLOOKUP(M12, L$11:M$32,1,0)
A38: of:=VLOOKUP([.M13]; [.L$11:.M$32];1;0) -> abcd | B38: abcd | C38: of:=[.A38]=[.B38] -> true | D38: of:=FORMULA([.A38]) -> =VLOOKUP(M13, L$11:M$32,1,0)
A39: of:=VLOOKUP([.M14]; [.L$11:.M$32];1;0) -> coté | B39: coté | C39: of:=[.A39]=[.B39] -> true | D39: of:=FORMULA([.A39]) -> =VLOOKUP(M14, L$11:M$32,1,0)
A40: of:=VLOOKUP([.M15]; [.L$11:.M$32];1;0) -> côte | B40: côte | C40: of:=[.A40]=[.B40] -> true | D40: of:=FORMULA([.A40]) -> =VLOOKUP(M15, L$11:M$32,1,0)
A41: of:=VLOOKUP([.M16]; [.L$11:.M$32];1;0) -> côté | B41: côté | C41: of:=[.A41]=[.B41] -> true | D41: of:=FORMULA([.A41]) -> =VLOOKUP(M16, L$11:M$32,1,0)
A42: of:=VLOOKUP([.M17]; [.L$11:.M$32];1;0) -> cote  | B42: cote | C42: of:=[.A42]=[.B42] -> true | D42: of:=FORMULA([.A42]) -> =VLOOKUP(M17, L$11:M$32,1,0)
A43: of:=VLOOKUP([.M18]; [.L$11:.M$32];1;0) -> Dürst | B43: Dürst | C43: of:=[.A43]=[.B43] -> true | D43: of:=FORMULA([.A43]) -> =VLOOKUP(M18, L$11:M$32,1,0)
A44: of:=VLOOKUP([.M19]; [.L$11:.M$32];1;0) -> DUERST | B44: DUERST | C44: of:=[.A44]=[.B44] -> true | D44: of:=FORMULA([.A44]) -> =VLOOKUP(M19, L$11:M$32,1,0)
A45: of:=VLOOKUP([.M20]; [.L$11:.M$32];1;0) -> iiii | B45: iiii | C45: of:=[.A45]=[.B45] -> true | D45: of:=FORMULA([.A45]) -> =VLOOKUP(M20, L$11:M$32,1,0)
A46: of:=VLOOKUP([.M21]; [.L$11:.M$32];1;0) -> İİİİ | B46: İİİİ | C46: of:=[.A46]=[.B46] -> true | D46: of:=FORMULA([.A46]) -> =VLOOKUP(M21, L$11:M$32,1,0)
A47: of:=VLOOKUP([.M22]; [.L$11:.M$32];1;0) -> iiii | B47: ıııı | C47: true | D47: of:=FORMULA([.A47]) -> =VLOOKUP(M22, L$11:M$32,1,0) | E47: Excel interoperability bug, forced to TRUE
A48: of:=VLOOKUP([.M23]; [.L$11:.M$32];1;0) -> iiii | B48: iiii | C48: of:=[.A48]=[.B48] -> true | D48: of:=FORMULA([.A48]) -> =VLOOKUP(M23, L$11:M$32,1,0)
A49: of:=VLOOKUP([.M24]; [.L$11:.M$32];1;0) ->  | B49: of:=#N/A ->  | C49: of:=ISERROR([.A49]) -> true | D49: of:=FORMULA([.A49]) -> =VLOOKUP(M24, L$11:M$32,1,0)
A50: of:=VLOOKUP([.M25]; [.L$11:.M$32];1;0) ->  | B50: of:=#N/A ->  | C50: of:=ISERROR([.A50]) -> true | D50: of:=FORMULA([.A50]) -> =VLOOKUP(M25, L$11:M$32,1,0)
A51: of:=VLOOKUP([.M26]; [.L$11:.M$32];1;0) ->  | B51: of:=#N/A ->  | C51: of:=ISERROR([.A51]) -> true | D51: of:=FORMULA([.A51]) -> =VLOOKUP(M26, L$11:M$32,1,0)
A52: of:=VLOOKUP([.M27]; [.L$11:.M$32];1;0) ->  | B52: of:=#N/A ->  | C52: of:=ISERROR([.A52]) -> true | D52: of:=FORMULA([.A52]) -> =VLOOKUP(M27, L$11:M$32,1,0)
A53: of:=VLOOKUP([.M28]; [.L$11:.M$32];1;0) -> ABCDEF | B53: ABCDEF | C53: of:=[.A53]=[.B53] -> true | D53: of:=FORMULA([.A53]) -> =VLOOKUP(M28, L$11:M$32,1,0)
A54: of:=VLOOKUP([.M19]; [.L$11:.M$32];1;0) -> DUERST | B54: DUERST | C54: of:=[.A54]=[.B54] -> true | D54: of:=FORMULA([.A54]) -> =VLOOKUP(M19, L$11:M$32,1,0)
A55: of:=VLOOKUP("côted";[.L$11:.M$32];1;1) -> cote  | B55: of:=VLOOKUP("côtéd";[.M$11:.N$32];1;1) -> cote  | C55: of:=[.A55]=[.B55] -> true | D55: of:=FORMULA([.A55]) -> =VLOOKUP("côted",L$11:M$32,1,1)
A56: of:=VLOOKUP("côt";[.L$11:.M$32];1;1) -> abcd | B56: abcd | C56: of:=[.A56]=[.B56] -> true | D56: of:=FORMULA([.A56]) -> =VLOOKUP("côt",L$11:M$32,1,1)
A57: of:=VLOOKUP("Dürs";[.L$11:.M$32];1;1) -> cote  | B57: DUERST | C57: true | D57: of:=FORMULA([.A57]) -> =VLOOKUP("Dürs",L$11:M$32,1,1) | E57: Excel interoperability bug, forced to TRUE
A58: of:=VLOOKUP("Durs";[.L$11:.M$32];1;1) -> cote  | B58: DUERST | C58: true | D58: of:=FORMULA([.A58]) -> =VLOOKUP("Durs",L$11:M$32,1,1) | E58: Excel interoperability bug, forced to TRUE
A59: of:=VLOOKUP("côted";[.L$11:.M$32];1;0) ->  | B59: of:=#N/A ->  | C59: of:=ISERROR([.A59]) -> true | D59: of:=FORMULA([.A59]) -> =VLOOKUP("côted",L$11:M$32,1,0)
A60: of:=VLOOKUP("côt";[.L$11:.M$32];1;0) ->  | B60: of:=#N/A ->  | C60: of:=ISERROR([.A60]) -> true | D60: of:=FORMULA([.A60]) -> =VLOOKUP("côt",L$11:M$32,1,0)
A61: of:=VLOOKUP("Dürs";[.L$11:.M$32];1;0) ->  | B61: of:=#N/A ->  | C61: of:=ISERROR([.A61]) -> true | D61: of:=FORMULA([.A61]) -> =VLOOKUP("Dürs",L$11:M$32,1,0)
A62: of:=VLOOKUP("Durs";[.L$11:.M$32];1;0) ->  | B62: of:=#N/A ->  | C62: of:=ISERROR([.A62]) -> true | D62: of:=FORMULA([.A62]) -> =VLOOKUP("Durs",L$11:M$32,1,0)
A63: of:=VLOOKUP(1;[.$AJ$2:.$AK$4];2;1) -> 11 | B63: 11 | C63: of:=[.A63]=[.B63] -> true | D63: of:=FORMULA([.A63]) -> =VLOOKUP(1;$AJ$2:$AK$4;2;1)
A64: of:=VLOOKUP(4;[.$AJ$2:.$AK$4];2;1) -> 14 | B64: 14 | C64: of:=[.A64]=[.B64] -> true | D64: of:=FORMULA([.A64]) -> =VLOOKUP(4;$AJ$2:$AK$4;2;1)
A65: of:=VLOOKUP(3.5;[.$AJ$2:.$AK$4];2;1) -> 12 | B65: 12 | C65: of:=[.A65]=[.B65] -> true | D65: of:=FORMULA([.A65]) -> =VLOOKUP(3,5;$AJ$2:$AK$4;2;1)
A66: of:=VLOOKUP(5;[.$AJ$2:.$AK$4];2;1) -> 14 | B66: 14 | C66: of:=[.A66]=[.B66] -> true | D66: of:=FORMULA([.A66]) -> =VLOOKUP(5;$AJ$2:$AK$4;2;1)
A67: of:=VLOOKUP(-0.5;[.$AJ$2:.$AK$4];2;1) ->  | B67: of:=#N/A ->  | C67: of:=ISERROR([.A67]) -> true | D67: of:=FORMULA([.A67]) -> =VLOOKUP(-0,5;$AJ$2:$AK$4;2;1)
A68: of:=VLOOKUP(11;[.$AJ$2:.$AK$4];2;1) -> 14 | B68: 14 | C68: of:=[.A68]=[.B68] -> true | D68: of:=FORMULA([.A68]) -> =VLOOKUP(11;$AJ$2:$AK$4;2;1)
A69: of:=VLOOKUP(5;[.$AM$2:.$AN$4];2;0) -> 21 | B69: 21 | C69: of:=[.A69]=[.B69] -> true | D69: of:=FORMULA([.A69]) -> =VLOOKUP(5;$AM$2:$AN$4;2;0)
A70: of:=VLOOKUP(6;[.$AM$2:.$AN$4];2;0) -> 22 | B70: 22 | C70: of:=[.A70]=[.B70] -> true | D70: of:=FORMULA([.A70]) -> =VLOOKUP(6;$AM$2:$AN$4;2;0)
A71: of:=VLOOKUP(8;[.$AM$2:.$AN$4];2;0) -> 24 | B71: 24 | C71: of:=[.A71]=[.B71] -> true | D71: of:=FORMULA([.A71]) -> =VLOOKUP(8;$AM$2:$AN$4;2;0)
A72: of:=VLOOKUP(7;[.$AM$2:.$AN$4];2;0) ->  | B72: of:=#N/A ->  | C72: of:=ISERROR([.A72]) -> true | D72: of:=FORMULA([.A72]) -> =VLOOKUP(7;$AM$2:$AN$4;2;0)
A73: of:=VLOOKUP(21;[.$AM$2:.$AN$4];2;0) -> 21 | B73: of:=#N/A ->  | C73: of:=ISERROR([.A73]) -> false | D73: of:=FORMULA([.A73]) -> =VLOOKUP(21;$AM$2:$AN$4;2;0)

Sheet: 'file:///home/zdenek/Dokumenty/LO/sc-unit-test/Project%20Calc%20functions%20tests/fods/hlookup.fods/dstdevp.fods/dstdevp.fods/function_based_test_Example.fods/function_based_test_Example_reference.fods'#Sheet2
H3: 4