Sheet: Sheet1
A1: XLOOKUP Function
A3: Result | B3: of:=AND([.B8:.B95]) -> true
A7: Sheet | B7: Result | C7: Description
A8: 2 | B8: of:=AND([Sheet2.C2:.C202]) -> true | C8: Simple XLOOKUP formulas with local references and values

Sheet: Sheet2
A1: Function | B1: Expected | C1: Correct | D1: FunctionString | E1: Comment | F1: XL-test | H1: Country | I1: Abr | J1: Prefix | K1: Asc | L1: Desc | M1: 5 | N1: 4 | O1: 2 | P1: Country Asc1 | Q1: Country Asc2 | R1: Country Desc1 | S1: Country Desc2 | T1: Prefix
A2: of:=COM.MICROSOFT.XLOOKUP([.G2];[.H2:.H11];[.J2:.J11]) -> +55 | B2: +55 | C2: of:=[.A2]=[.B2] -> true | D2: of:=FORMULA([.A2]) -> =XLOOKUP(G2;H2:H11;J2:J11) | G2: Brazil | H2: China | I2: CN | J2: +86 | K2: 0 | L2: 10 | P2: 0 | Q2: 0 | R2: 8 | S2: 8 | T2: a
A3: of:=COM.MICROSOFT.XLOOKUP("India";[.H2:.H11];[.J2:.J11]) -> +91 | B3: +91 | C3: of:=[.A3]=[.B3] -> true | D3: of:=FORMULA([.A3]) -> =XLOOKUP("India";H2:H11;J2:J11) | H3: India | I3: IN | J3: +91 | K3: 1 | L3: 9 | P3: 1 | Q3: 1 | R3: 7 | S3: 7 | T3: b
A4: of:=COM.MICROSOFT.XLOOKUP("INDIA";[.H2:.H11];[.J2:.J11]) -> +91 | B4: +91 | C4: of:=[.A4]=[.B4] -> true | D4: of:=FORMULA([.A4]) -> =XLOOKUP("INDIA";H2:H11;J2:J11) | H4: United States | I4: US | J4: +1 | K4: 2 | L4: 8 | P4: 1 | Q4: 2 | R4: 7 | S4: 7 | T4: c
A5: of:=COM.MICROSOFT.XLOOKUP("Ireland";[.H2:.H11];[.J2:.J11]) ->  | B5: of:=#N/A ->  | C5: of:=ISNA([.A5]) -> true | D5: of:=FORMULA([.A5]) -> =XLOOKUP("Ireland";H2:H11;J2:J11) | H5: Nigeria | I5: NG2 | J5: 00234 | K5: 3 | L5: 7 | P5: 3 | Q5: 2 | R5: 6 | S5: 6 | T5: d
A6: of:=COM.MICROSOFT.XLOOKUP("Ireland";[.H2:.H11];[.J2:.J11];"") ->  | C6: of:=[.A6]=[.B6] -> true | D6: of:=FORMULA([.A6]) -> =XLOOKUP("Ireland";H2:H11;J2:J11;"") | H6: Indonesia | I6: ID | J6: +62 | K6: 4 | L6: 6 | P6: 3 | Q6: 3 | R6: 4 | S6: 4 | T6: e
A7: of:=COM.MICROSOFT.XLOOKUP("Ireland";[.H2:.H11];[.J2:.J11];-99) -> -99 | B7: -99 | C7: of:=[.A7]=[.B7] -> true | D7: of:=FORMULA([.A7]) -> =XLOOKUP("Ireland";H2:H11;J2:J11;-99) | H7: Brazil | I7: BR | J7: +55 | K7: 6 | L7: 6 | P7: 4 | Q7: 4 | R7: 3 | S7: 3 | T7: f
A8: of:=COM.MICROSOFT.XLOOKUP("Ireland";[.H2:.H11];[.J2:.J11];"Not here") -> Not here | B8: Not here | C8: of:=[.A8]=[.B8] -> true | D8: of:=FORMULA([.A8]) -> =XLOOKUP("Ireland";H2:H11;J2:J11;"Not here") | H8: Pakistan | I8: PK | J8: +92 | K8: 6 | L8: 4 | P8: 6 | Q8: 6 | R8: 3 | S8: 2 | T8: g
A9: of:=COM.MICROSOFT.XLOOKUP("";[.H2:.H11];[.J2:.J11]) ->  | B9: of:=#N/A ->  | C9: of:=ISNA([.A9]) -> true | D9: of:=FORMULA([.A9]) -> =XLOOKUP("";H2:H11;J2:J11) | H9: Nigeria | I9: NG | J9: +234 | K9: 7 | L9: 3 | P9: 7 | Q9: 7 | R9: 1 | S9: 2 | T9: h
A10: of:=COM.MICROSOFT.XLOOKUP("Nigeria";[.H2:.H11];[.J2:.J11];;;1) -> 00234 | B10: 00234 | C10: of:=[.A10]=[.B10] -> true | D10: of:=FORMULA([.A10]) -> =XLOOKUP("Nigeria";H2:H11;J2:J11;;;1) | H10: Bangladesh | I10: BD | J10: +880 | K10: 8 | L10: 2 | P10: 7 | Q10: 7 | R10: 1 | S10: 1 | T10: I
A11: of:=COM.MICROSOFT.XLOOKUP("Nigeria";[.H2:.H11];[.J2:.J11];;;-1) -> +234 | B11: +234 | C11: of:=[.A11]=[.B11] -> true | D11: of:=FORMULA([.A11]) -> =XLOOKUP("Nigeria";H2:H11;J2:J11;;;-1) | H11: Russia | I11: RU | J11: +7 | K11: 9 | L11: 1 | P11: 8 | Q11: 8 | R11: 0 | S11: 0 | T11: j
H12: Mexico | I12: MX | J12: +52 | K12: 10 | L12: 0
A14: of:=COM.MICROSOFT.XLOOKUP(4390;[.I14:.R14];[.I15:.R16]) -> Ned Lanning | B14: Ned Lanning | C14: of:=[.A14]=[.B14] -> true | D14: of:=FORMULA([.A14]) -> {=XLOOKUP(4390;I14:R14;I15:R16)} | G14: 8299 | H14: EmpID | I14: 4390 | J14: 8604 | K14: 8389 | L14: 4937 | M14: 8299 | N14: 2643 | O14: 5243 | P14: 9693 | Q14: 1636 | R14: 6703
A15: Marketing | B15: Marketing | C15: of:=[.A15]=[.B15] -> true | D15: of:=FORMULA([.A15]) -> {=XLOOKUP(4390;I14:R14;I15:R16)} | H15: Name | I15: Ned Lanning | J15: Margo Hendrix | K15: Dianne Pugh | L15: Earlene McCartney | M15: Mia Arnold | N15: Jorge Fellows | O15: Rose Winters | P15: Carmela Hahn | Q15: Delia Cochran | R15: Marguerite Cervantes
A16: of:=COM.MICROSOFT.XLOOKUP([.G14];[.I14:.R14];[.I15:.R16]) -> Mia Arnold | B16: Mia Arnold | C16: of:=[.A16]=[.B16] -> true | D16: of:=FORMULA([.A16]) -> {=XLOOKUP(G14;I14:R14;I15:R16)} | H16: Dept | I16: Marketing | J16: Sales | K16: Finance | L16: Accounting | M16: Operations | N16: Executive | O16: Sales | P16: Finance | Q16: Accounting | R16: Marketing
A17: Operations | B17: Operations | C17: of:=[.A17]=[.B17] -> true | D17: of:=FORMULA([.A17]) -> {=XLOOKUP(G14;I14:R14;I15:R16)}
A18: of:=COM.MICROSOFT.XLOOKUP([.G18];[.I14:.R14];[.I15:.R16];"ID not found") -> ID not found | B18: ID not found | C18: of:=[.A18]=[.B18] -> true | D18: of:=FORMULA([.A18]) -> {=XLOOKUP(G18;I14:R14;I15:R16;"ID not found")} | G18: 5678
A19: ID not found | B19: ID not found | C19: of:=[.A19]=[.B19] -> true | D19: of:=FORMULA([.A19]) -> {=XLOOKUP(G18;I14:R14;I15:R16;"ID not found")}
A20: of:=COM.MICROSOFT.XLOOKUP("";[.I14:.R14];[.I15:.R16]) ->  | B20: of:=#N/A ->  | C20: of:=ISNA([.A20]) -> true | D20: of:=FORMULA([.A20]) -> {=XLOOKUP("";I14:R14;I15:R16)}
B21: of:=#N/A ->  | C21: of:=ISNA([.A21]) -> true | D21: of:=FORMULA([.A21]) -> {=XLOOKUP("";I14:R14;I15:R16)}
A22: of:=COM.MICROSOFT.XLOOKUP(4937;[.I14:.R14];[.I15:.R16];;1) -> Earlene McCartney | B22: Earlene McCartney | C22: of:=[.A22]=[.B22] -> true | D22: of:=FORMULA([.A22]) -> {=XLOOKUP(4937;I14:R14;I15:R16;;1)} | K22: Mark | L22: 87 | P22: Jenny | Q22: 19
A23: Accounting | B23: Accounting | C23: of:=[.A23]=[.B23] -> true | D23: of:=FORMULA([.A23]) -> {=XLOOKUP(4937;I14:R14;I15:R16;;1)} | K23: Ned | L23: 67 | P23: Donna | Q23: 14
A24: of:=COM.MICROSOFT.XLOOKUP(4937;[.I14:.R14];[.I15:.R16];;-1) -> Earlene McCartney | B24: Earlene McCartney | C24: of:=[.A24]=[.B24] -> true | D24: of:=FORMULA([.A24]) -> {=XLOOKUP(4937;I14:R14;I15:R16;;-1)} | K24: Hans | L24: 16 | P24: Stan | Q24: 76
A25: Accounting | B25: Accounting | C25: of:=[.A25]=[.B25] -> true | D25: of:=FORMULA([.A25]) -> {=XLOOKUP(4937;I14:R14;I15:R16;;-1)} | K25: Martha | L25: 68 | N25: Hans | P25: Amy | Q25: 86
A26: of:=COM.MICROSOFT.XLOOKUP(4937;[.I14:.R14];[.I15:.R16]) -> Earlene McCartney | B26: Earlene McCartney | C26: of:=[.A26]=[.B26] -> true | D26: of:=FORMULA([.A26]) -> {=XLOOKUP(4937;I14:R14;I15:R16)} | K26: Greg | L26: 21 | N26: Amy | P26: Pam | Q26: 99
A27: Accounting | B27: Accounting | C27: of:=[.A27]=[.B27] -> true | D27: of:=FORMULA([.A27]) -> {=XLOOKUP(4937;I14:R14;I15:R16)}
A29: of:=COM.MICROSOFT.XLOOKUP([.G29];[.I30:.I35];[.H30:.H35];;1;1) -> 0.24 | B29: 0.24 | C29: of:=[.A29]=[.B29] -> true | D29: of:=FORMULA([.A29]) -> =XLOOKUP(G29;I30:I35;H30:H35;;1;1) | G29: 46523 | H29: tax rate | I29: max income
A30: of:=COM.MICROSOFT.XLOOKUP([.G29];[.I30:.I35];[.H30:.H35];;1;2) -> 0.24 | B30: 0.24 | C30: of:=[.A30]=[.B30] -> true | D30: of:=FORMULA([.A30]) -> =XLOOKUP(G29;I30:I35;H30:H35;;1;2) | H30: 0.1 | I30: -9700
A31: of:=COM.MICROSOFT.XLOOKUP([.G29];[.I30:.I35];[.H30:.H35];;-1;2) -> 0.22 | B31: 0.22 | C31: of:=[.A31]=[.B31] -> true | D31: of:=FORMULA([.A31]) -> =XLOOKUP(G29;I30:I35;H30:H35;;-1;2) | H31: 0.22 | I31: 39475
A32: of:=COM.MICROSOFT.XLOOKUP([.G29];[.I30:.I35];[.H30:.H35];;2;2) ->  | B32: #N/A | C32: of:=ISERROR([.A32]) -> true | D32: of:=FORMULA([.A32]) -> =XLOOKUP(G29;I30:I35;H30:H35;;2;2) | H32: 0.24 | I32: 84200
H33: 0.32 | I33: 160726
H34: 0.35 | I34: 204100
H35: 0.37 | I35: 510300
A37: of:=COM.MICROSOFT.XLOOKUP([.K37];[.$I37:.$T37];COM.MICROSOFT.XLOOKUP([.$G37];[.$H38:.$H42];[.$I38:.$T42])) -> 25000 | B37: 25000 | C37: of:=[.A37]=[.B37] -> true | D37: of:=FORMULA([.A37]) -> =XLOOKUP(K37;$I37:$T37;XLOOKUP($G37;$H38:$H42;$I38:$T42)) | G37: Q1 | H37: income stmnt | I37: Total sales | J37: cost of sales | K37: gross profit | M37: depriciation | N37: interest | O37: earnings before tax | Q37: tax | S37: net profit | T37: profit [%]
A38: of:=COM.MICROSOFT.XLOOKUP([.S37];[.$I37:.$T37];COM.MICROSOFT.XLOOKUP([.$G37];[.$H38:.$H42];[.$I38:.$T42])) -> 19342 | B38: 19342 | C38: of:=[.A38]=[.B38] -> true | D38: of:=FORMULA([.A38]) -> =XLOOKUP(S37;$I37:$T37;XLOOKUP($G37;$H38:$H42;$I38:$T42)) | H38: Q1 | I38: 50000 | J38: -25000 | K38: 25000 | M38: -899 | N38: -513 | O38: 23588 | Q38: -4246 | S38: 19342 | T38: 0.293
A39: of:=COM.MICROSOFT.XLOOKUP([.T37];[.$I37:.$T37];COM.MICROSOFT.XLOOKUP([.$G37];[.$H38:.$H42];[.$I38:.$T42])) -> 0.293 | B39: 0.293 | C39: of:=[.A39]=[.B39] -> true | D39: of:=FORMULA([.A39]) -> =XLOOKUP(T37;$I37:$T37;XLOOKUP($G37;$H38:$H42;$I38:$T42)) | H39: Q2 | I39: 78200 | J39: -42050 | K39: 36150 | M39: -791 | N39: -853 | O39: 34506 | Q39: -6211 | S39: 28295 | T39: 0.278
H40: Q3 | I40: 89500 | J40: -59450 | K40: 30050 | M40: -202 | N40: -150 | O40: 29698 | Q40: -5346 | S40: 24352 | T40: 0.234
A41: of:=COM.MICROSOFT.XLOOKUP([.G14];[.$H14:.$R14];[.$H$15:.$R$16]) -> Mia Arnold | B41: Mia Arnold | C41: of:=[.A41]=[.B41] -> true | D41: of:=FORMULA([.A41]) -> {=XLOOKUP(G14;$H14:$R14;$H$15:$R$16)} | H41: Q4 | I41: 91250 | J41: -60450 | K41: 30800 | M41: -412 | N41: -956 | O41: 29432 | Q41: -5298 | S41: 24134 | T41: 0.276
A42: Operations | B42: Operations | C42: of:=[.A42]=[.B42] -> true | D42: of:=FORMULA([.A42]) -> {=XLOOKUP(G14;$H14:$R14;$H$15:$R$16)} | H42: Total | I42: 308950 | J42: -186950 | K42: 122000 | M42: -2304 | N42: -2472 | O42: 117224 | Q42: -21101 | S42: 96123 | T42: 0.27025
A44: of:=SUM(COM.MICROSOFT.XLOOKUP([.G44];[.H45:.H49];[.K45:.K49]):COM.MICROSOFT.XLOOKUP([.G45];[.H45:.H49];[.K45:.K49])) -> 110.56 | B44: 110.56 | C44: of:=[.A44]=[.B44] -> true | D44: of:=FORMULA([.A44]) -> =SUM(XLOOKUP(G44;H45:H49;K45:K49):XLOOKUP(G45;H45:H49;K45:K49)) | G44: Grape | H44: product | I44: qty | J44: price | K44: total
G45: Banana | H45: Apple | I45: 23 | J45: 0.52 | K45: of:=[.I45]*[.J45] -> 11.96
H46: Grape | I46: 98 | J46: 0.77 | K46: of:=[.I46]*[.J46] -> 75.46
H47: Pear | I47: 75 | J47: 0.24 | K47: of:=[.I47]*[.J47] -> 18
H48: Banana | I48: 95 | J48: 0.18 | K48: of:=[.I48]*[.J48] -> 17.1
H49: Cherry | I49: 42 | J49: 0.16 | K49: of:=[.I49]*[.J49] -> 6.72
A51: of:=COM.MICROSOFT.XLOOKUP("B";[.H51:.H53];[.K51:.K52]) ->  | B51: err:504 | C51: of:=ISERROR([.A51]) -> true | D51: of:=FORMULA([.A51]) -> =XLOOKUP("B";H51:H53;K51:K52) | F51: ? | H51: A | I51: D | K51: a | L51: d
A52: of:=COM.MICROSOFT.XLOOKUP("C";[.H51:.H53];[.K51:.K52]) ->  | B52: err:504 | C52: of:=ISERROR([.A52]) -> true | D52: of:=FORMULA([.A52]) -> =XLOOKUP("C";H51:H53;K51:K52) | F52: ? | H52: B | I52: E | K52: b | L52: e
A53: of:=COM.MICROSOFT.XLOOKUP("E";[.H51:.I53];[.K51:.L53]) ->  | B53: err:504 | C53: of:=ISERROR([.A53]) -> true | D53: of:=FORMULA([.A53]) -> =XLOOKUP("E";H51:I53;K51:L53) | F53: ? | H53: C | I53: F | K53: c | L53: f
A54: of:=COM.MICROSOFT.XLOOKUP("E";[.H51:.I53];[.K51:.K53]) ->  | B54: err:504 | C54: of:=ISERROR([.A54]) -> true | D54: of:=FORMULA([.A54]) -> =XLOOKUP("E";H51:I53;K51:K53) | F54: ?
A55: of:=COM.MICROSOFT.XLOOKUP("C";[.H51:.I53];[.K51:.K53]) ->  | B55: err:504 | C55: of:=ISERROR([.A55]) -> true | D55: of:=FORMULA([.A55]) -> =XLOOKUP("C";H51:I53;K51:K53) | F55: ?
A58: of:=COM.MICROSOFT.XLOOKUP(3;[.I$58:.I$62];[.L$58:.L$62];;0;1) -> b3 | B58: b3 | C58: of:=[.A58]=[.B58] -> true | D58: of:=FORMULA([.A58]) -> =XLOOKUP(3;I$58:I$62;L$58:L$62;;0;1) | F58: ? | H58: 1 | I58: 5 | J58: 6 | K58: a1 | L58: a5 | M58: a6
A59: of:=COM.MICROSOFT.XLOOKUP(4;[.I$58:.I$62];[.L$58:.L$62];;-1;1) -> b3 | B59: b3 | C59: of:=[.A59]=[.B59] -> true | D59: of:=FORMULA([.A59]) -> =XLOOKUP(4;I$58:I$62;L$58:L$62;;-1;1) | F59: ? | H59: 2 | I59: 3 | J59: 5 | K59: b2 | L59: b3 | M59: b5
A60: of:=COM.MICROSOFT.XLOOKUP(4;[.I$58:.I$62];[.L$58:.L$62];;1;1) -> a5 | B60: a5 | C60: of:=[.A60]=[.B60] -> true | D60: of:=FORMULA([.A60]) -> =XLOOKUP(4;I$58:I$62;L$58:L$62;;1;1) | F60: ? | H60: 3 | I60: 1 | J60: 3 | K60: c3 | L60: c1 | M60: c3
A61: of:=COM.MICROSOFT.XLOOKUP(3;[.I$58:.I$62];[.L$58:.L$62];;2;1) -> b3 | B61: b3 | C61: of:=[.A61]=[.B61] -> true | D61: of:=FORMULA([.A61]) -> =XLOOKUP(3;I$58:I$62;L$58:L$62;;2;1) | H61: 5.2 | I61: 6 | J61: 2 | K61: D5.2 | L61: d6 | M61: d2
A62: of:=COM.MICROSOFT.XLOOKUP(3;[.I$58:.I$62];[.L$58:.L$62];;0;-1) -> b3 | B62: b3 | C62: of:=[.A62]=[.B62] -> true | D62: of:=FORMULA([.A62]) -> =XLOOKUP(3;I$58:I$62;L$58:L$62;;0;-1) | F62: ? | H62: 6 | I62: 2 | J62: 1 | K62: e6 | L62: e2 | M62: e1
A63: of:=COM.MICROSOFT.XLOOKUP(4;[.I$58:.I$62];[.L$58:.L$62];;-1;-1) -> b3 | B63: b3 | C63: of:=[.A63]=[.B63] -> true | D63: of:=FORMULA([.A63]) -> =XLOOKUP(4;I$58:I$62;L$58:L$62;;-1;-1) | F63: ?
A64: of:=COM.MICROSOFT.XLOOKUP(4;[.I$58:.I$62];[.L$58:.L$62];;1;-1) -> a5 | B64: a5 | C64: of:=[.A64]=[.B64] -> true | D64: of:=FORMULA([.A64]) -> =XLOOKUP(4;I$58:I$62;L$58:L$62;;1;-1) | F64: ?
A65: of:=COM.MICROSOFT.XLOOKUP(3;[.I$58:.I$62];[.L$58:.L$62];;2;-1) -> b3 | B65: b3 | C65: of:=[.A65]=[.B65] -> true | D65: of:=FORMULA([.A65]) -> =XLOOKUP(3;I$58:I$62;L$58:L$62;;2;-1)
A66: of:=COM.MICROSOFT.XLOOKUP(3;[.H$58:.H$62];[.K$58:.K$62];;0;2) -> c3 | B66: c3 | C66: of:=[.A66]=[.B66] -> true | D66: of:=FORMULA([.A66]) -> =XLOOKUP(3;H$58:H$62;K$58:K$62;;0;2) | F66: ?
A67: of:=COM.MICROSOFT.XLOOKUP(4;[.H$58:.H$62];[.K$58:.K$62];;-1;2) -> c3 | B67: c3 | C67: of:=[.A67]=[.B67] -> true | D67: of:=FORMULA([.A67]) -> =XLOOKUP(4;H$58:H$62;K$58:K$62;;-1;2) | F67: ?
A68: of:=COM.MICROSOFT.XLOOKUP(4;[.H$58:.H$62];[.K$58:.K$62];;1;2) -> D5.2 | B68: D5.2 | C68: of:=[.A68]=[.B68] -> true | D68: of:=FORMULA([.A68]) -> =XLOOKUP(4;H$58:H$62;K$58:K$62;;1;2) | F68: ?
A69: of:=COM.MICROSOFT.XLOOKUP(3;[.H$58:.H$62];[.K$58:.K$62];;2;2) -> c3 | B69: c3 | C69: of:=[.A69]=[.B69] -> true | D69: of:=FORMULA([.A69]) -> =XLOOKUP(3;H$58:H$62;K$58:K$62;;2;2)
A70: of:=COM.MICROSOFT.XLOOKUP(3;[.J$58:.J$62];[.M$58:.M$62];;0;-2) -> c3 | B70: c3 | C70: of:=[.A70]=[.B70] -> true | D70: of:=FORMULA([.A70]) -> =XLOOKUP(3;J$58:J$62;M$58:M$62;;0;-2) | F70: ?
A71: of:=COM.MICROSOFT.XLOOKUP(4;[.J$58:.J$62];[.M$58:.M$62];;-1;-2) -> c3 | B71: c3 | C71: of:=[.A71]=[.B71] -> true | D71: of:=FORMULA([.A71]) -> =XLOOKUP(4;J$58:J$62;M$58:M$62;;-1;-2) | F71: ?
A72: of:=COM.MICROSOFT.XLOOKUP(4;[.J$58:.J$62];[.M$58:.M$62];;1;-2) -> b5 | B72: b5 | C72: of:=[.A72]=[.B72] -> true | D72: of:=FORMULA([.A72]) -> =XLOOKUP(4;J$58:J$62;M$58:M$62;;1;-2) | F72: ?
A73: of:=COM.MICROSOFT.XLOOKUP(3;[.J$58:.J$62];[.M$58:.M$62];;2;-2) -> c3 | B73: c3 | C73: of:=[.A73]=[.B73] -> true | D73: of:=FORMULA([.A73]) -> =XLOOKUP(3;J$58:J$62;M$58:M$62;;2;-2)
A74: of:=COM.MICROSOFT.XLOOKUP(3;[.H$74:.L$74];[.H$75:.L$75];;0;1) -> b3 | B74: b3 | C74: of:=[.A74]=[.B74] -> true | D74: of:=FORMULA([.A74]) -> =XLOOKUP(3;H$74:L$74;H$75:L$75;;0;1) | F74: ? | H74: 5 | I74: 3 | J74: 1 | K74: 6 | L74: 2
A75: of:=COM.MICROSOFT.XLOOKUP(4;[.H$74:.L$74];[.H$75:.L$75];;-1;1) -> b3 | B75: b3 | C75: of:=[.A75]=[.B75] -> true | D75: of:=FORMULA([.A75]) -> =XLOOKUP(4;H$74:L$74;H$75:L$75;;-1;1) | F75: ? | H75: a5 | I75: b3 | J75: c1 | K75: d6 | L75: e2
A76: of:=COM.MICROSOFT.XLOOKUP(4;[.H$74:.L$74];[.H$75:.L$75];;1;1) -> a5 | B76: a5 | C76: of:=[.A76]=[.B76] -> true | D76: of:=FORMULA([.A76]) -> =XLOOKUP(4;H$74:L$74;H$75:L$75;;1;1) | F76: ?
A77: of:=COM.MICROSOFT.XLOOKUP(3;[.H$74:.L$74];[.H$75:.L$75];;2;1) -> b3 | B77: b3 | C77: of:=[.A77]=[.B77] -> true | D77: of:=FORMULA([.A77]) -> =XLOOKUP(3;H$74:L$74;H$75:L$75;;2;1) | F77: ?
A79: of:=COM.MICROSOFT.XLOOKUP("C";[.I$79:.I$83];[.L$79:.L$83];;0;1) -> bC | B79: bC | C79: of:=[.A79]=[.B79] -> true | D79: of:=FORMULA([.A79]) -> =XLOOKUP("C";I$79:I$83;L$79:L$83;;0;1) | F79: ? | H79: A | I79: E | J79: F | K79: aA | L79: aE | M79: fF
A80: of:=COM.MICROSOFT.XLOOKUP("D";[.I$79:.I$83];[.L$79:.L$83];;-1;1) -> bC | B80: bC | C80: of:=[.A80]=[.B80] -> true | D80: of:=FORMULA([.A80]) -> =XLOOKUP("D";I$79:I$83;L$79:L$83;;-1;1) | F80: ? | H80: B | I80: C | J80: E | K80: bB | L80: bC | M80: eE
A81: of:=COM.MICROSOFT.XLOOKUP("D";[.I$79:.I$83];[.L$79:.L$83];;1;1) -> aE | B81: aE | C81: of:=[.A81]=[.B81] -> true | D81: of:=FORMULA([.A81]) -> =XLOOKUP("D";I$79:I$83;L$79:L$83;;1;1) | F81: ? | H81: C | I81: A | J81: C | K81: cC | L81: cA | M81: cC
A82: of:=COM.MICROSOFT.XLOOKUP("b?b";[.I$84:.I$88];[.L$79:.L$83];;2;1) -> eB | B82: eB | C82: of:=[.A82]=[.B82] -> true | D82: of:=FORMULA([.A82]) -> =XLOOKUP("b?b";I$84:I$88;L$79:L$83;;2;1) | H82: E | I82: F | J82: B | K82: eE | L82: dF | M82: bB
A83: of:=COM.MICROSOFT.XLOOKUP("C";[.I$79:.I$83];[.L$79:.L$83];;0;-1) -> bC | B83: bC | C83: of:=[.A83]=[.B83] -> true | D83: of:=FORMULA([.A83]) -> =XLOOKUP("C";I$79:I$83;L$79:L$83;;0;-1) | F83: ? | H83: F | I83: B | J83: A | K83: fF | L83: eB | M83: aA
A84: of:=COM.MICROSOFT.XLOOKUP("D";[.I$79:.I$83];[.L$79:.L$83];;-1;-1) -> bC | B84: bC | C84: of:=[.A84]=[.B84] -> true | D84: of:=FORMULA([.A84]) -> =XLOOKUP("D";I$79:I$83;L$79:L$83;;-1;-1) | F84: ? | I84: eEe
A85: of:=COM.MICROSOFT.XLOOKUP("D";[.I$79:.I$83];[.L$79:.L$83];;1;-1) -> aE | B85: aE | C85: of:=[.A85]=[.B85] -> true | D85: of:=FORMULA([.A85]) -> =XLOOKUP("D";I$79:I$83;L$79:L$83;;1;-1) | F85: ? | I85: cCc
A86: of:=COM.MICROSOFT.XLOOKUP("C";[.I$79:.I$83];[.L$79:.L$83];;2;-1) -> bC | B86: bC | C86: of:=[.A86]=[.B86] -> true | D86: of:=FORMULA([.A86]) -> =XLOOKUP("C";I$79:I$83;L$79:L$83;;2;-1) | I86: aAa
A87: of:=COM.MICROSOFT.XLOOKUP("C";[.H$79:.H$83];[.K$79:.K$83];;0;2) -> cC | B87: cC | C87: of:=[.A87]=[.B87] -> true | D87: of:=FORMULA([.A87]) -> =XLOOKUP("C";H$79:H$83;K$79:K$83;;0;2) | F87: ? | I87: fFf
A88: of:=COM.MICROSOFT.XLOOKUP("D";[.H$79:.H$83];[.K$79:.K$83];;-1;2) -> cC | B88: cC | C88: of:=[.A88]=[.B88] -> true | D88: of:=FORMULA([.A88]) -> =XLOOKUP("D";H$79:H$83;K$79:K$83;;-1;2) | F88: ? | I88: bBb
A89: of:=COM.MICROSOFT.XLOOKUP("D";[.H$79:.H$83];[.K$79:.K$83];;1;2) -> eE | B89: eE | C89: of:=[.A89]=[.B89] -> true | D89: of:=FORMULA([.A89]) -> =XLOOKUP("D";H$79:H$83;K$79:K$83;;1;2) | F89: ?
A90: of:=COM.MICROSOFT.XLOOKUP("C";[.H$79:.H$83];[.K$79:.K$83];;2;2) -> cC | B90: cC | C90: of:=[.A90]=[.B90] -> true | D90: of:=FORMULA([.A90]) -> =XLOOKUP("C";H$79:H$83;K$79:K$83;;2;2)
A91: of:=COM.MICROSOFT.XLOOKUP("C";[.J$79:.J$83];[.M$79:.M$83];;0;-2) -> cC | B91: cC | C91: of:=[.A91]=[.B91] -> true | D91: of:=FORMULA([.A91]) -> =XLOOKUP("C";J$79:J$83;M$79:M$83;;0;-2) | F91: ?
A92: of:=COM.MICROSOFT.XLOOKUP("D";[.J$79:.J$83];[.M$79:.M$83];;-1;-2) -> cC | B92: cC | C92: of:=[.A92]=[.B92] -> true | D92: of:=FORMULA([.A92]) -> =XLOOKUP("D";J$79:J$83;M$79:M$83;;-1;-2) | F92: ?
A93: of:=COM.MICROSOFT.XLOOKUP("D";[.J$79:.J$83];[.M$79:.M$83];;1;-2) -> eE | B93: eE | C93: of:=[.A93]=[.B93] -> true | D93: of:=FORMULA([.A93]) -> =XLOOKUP("D";J$79:J$83;M$79:M$83;;1;-2) | F93: ?
A94: of:=COM.MICROSOFT.XLOOKUP("C";[.J$79:.J$83];[.M$79:.M$83];;2;-2) -> cC | B94: cC | C94: of:=[.A94]=[.B94] -> true | D94: of:=FORMULA([.A94]) -> =XLOOKUP("C";J$79:J$83;M$79:M$83;;2;-2)
A95: of:=COM.MICROSOFT.XLOOKUP("C";[.H$95:.L$95];[.H$96:.L$96];;0;1) -> bC | B95: bC | C95: of:=[.A95]=[.B95] -> true | D95: of:=FORMULA([.A95]) -> =XLOOKUP("C";H$95:L$95;H$96:L$96;;0;1) | F95: ? | H95: E | I95: C | J95: A | K95: F | L95: B
A96: of:=COM.MICROSOFT.XLOOKUP("D";[.H$95:.L$95];[.H$96:.L$96];;-1;1) -> bC | B96: bC | C96: of:=[.A96]=[.B96] -> true | D96: of:=FORMULA([.A96]) -> =XLOOKUP("D";H$95:L$95;H$96:L$96;;-1;1) | F96: ? | H96: aE | I96: bC | J96: cA | K96: dF | L96: eB
A97: of:=COM.MICROSOFT.XLOOKUP("D";[.H$95:.L$95];[.H$96:.L$96];;1;1) -> aE | B97: aE | C97: of:=[.A97]=[.B97] -> true | D97: of:=FORMULA([.A97]) -> =XLOOKUP("D";H$95:L$95;H$96:L$96;;1;1) | F97: ?
A98: of:=COM.MICROSOFT.XLOOKUP("C?";[.H$95:.L$95];[.H$96:.L$96];;2;1) ->  | B98: #N/A | C98: of:=ISERROR([.A98]) -> true | D98: of:=FORMULA([.A98]) -> =XLOOKUP("C?";H$95:L$95;H$96:L$96;;2;1)
H99: LookCol | I99: SearchCol | J99: SearchValue | K99: 2 | M99: LookRow | N99: 2 | O99: 3 | P99: 1 | Q99: w | R99: q
A100: of:=COM.MICROSOFT.XLOOKUP("c";[.I$79:.I$83];[.L$79:.L$83];;0;1) -> bC | B100: bC | C100: of:=[.A100]=[.B100] -> true | D100: of:=FORMULA([.A100]) -> =XLOOKUP("c";I$79:I$83;L$79:L$83;;0;1) | F100: ? | H100: 2 | I100: a | M100: SearchhRow | N100: a | O100: b | P100: c | Q100: d | R100: e
A101: of:=COM.MICROSOFT.XLOOKUP("d";[.I$79:.I$83];[.L$79:.L$83];;-1;1) -> bC | B101: bC | C101: of:=[.A101]=[.B101] -> true | D101: of:=FORMULA([.A101]) -> =XLOOKUP("d";I$79:I$83;L$79:L$83;;-1;1) | F101: ? | H101: 3 | I101: b
A102: of:=COM.MICROSOFT.XLOOKUP("d";[.I$79:.I$83];[.L$79:.L$83];;1;1) -> aE | B102: aE | C102: of:=[.A102]=[.B102] -> true | D102: of:=FORMULA([.A102]) -> =XLOOKUP("d";I$79:I$83;L$79:L$83;;1;1) | F102: ? | H102: 1 | I102: c
A103: of:=COM.MICROSOFT.XLOOKUP("f?";[.I$79:.I$83];[.L$79:.L$83];;2;1) ->  | B103: #N/A | C103: of:=ISERROR([.A103]) -> true | D103: of:=FORMULA([.A103]) -> =XLOOKUP("f?";I$79:I$83;L$79:L$83;;2;1) | H103: w | I103: d
A104: of:=COM.MICROSOFT.XLOOKUP([.K99];[.H$99:.H$109];[.I$99:.I$109];;-1;-1) -> g | B104: g | C104: of:=[.A104]=[.B104] -> true | D104: of:=FORMULA([.A104]) -> =XLOOKUP(K99;H$99:H$109;I$99:I$109;;-1;-1) | H104: q | I104: e
A105: of:=COM.MICROSOFT.XLOOKUP([.K99];[.N$99:.R$99];[.N$100:.R$100];;-1;-1) -> a | B105: a | C105: of:=[.A105]=[.B105] -> true | D105: of:=FORMULA([.A105]) -> =XLOOKUP(K99;N$99:R$99;N$100:R$100;;-1;-1) | H105: 5 | I105: f
A106: of:=COM.MICROSOFT.XLOOKUP([.$M$1];[.K$1:.K$12];[.I$1:.I$12];0;1;2) -> BR | B106: BR | C106: of:=[.A106]=[.B106] -> true | D106: of:=FORMULA([.A106]) -> =XLOOKUP($M$1;K$1:K$12;I$1:I$12;0;1;2) | H106: 2 | I106: g
A107: of:=COM.MICROSOFT.XLOOKUP([.$M$1];[.L$1:.L$12];[.I$1:.I$12];0;1;-2) -> BR | B107: BR | C107: of:=[.A107]=[.B107] -> true | D107: of:=FORMULA([.A107]) -> =XLOOKUP($M$1;L$1:L$12;I$1:I$12;0;1;-2) | H107: 9 | I107: h
A108: of:=COM.MICROSOFT.XLOOKUP([.$M$1];[.K$1:.K$12];[.I$1:.I$12];0;-1;2) -> ID | B108: ID | C108: of:=[.A108]=[.B108] -> true | D108: of:=FORMULA([.A108]) -> =XLOOKUP($M$1;K$1:K$12;I$1:I$12;0;-1;2) | H108: e | I108: I
A109: of:=COM.MICROSOFT.XLOOKUP([.M1];[.L$1:.L$12];[.I$1:.I$12];0;-1;-2) -> PK | B109: PK | C109: of:=[.A109]=[.B109] -> true | D109: of:=FORMULA([.A109]) -> =XLOOKUP(M1;L$1:L$12;I$1:I$12;0;-1;-2) | H109: Russia | I109: j
A110: of:=COM.MICROSOFT.XLOOKUP([.N1];[.L$1:.L$12];[.I$1:.I$12];0;0;-2) -> PK | B110: PK | C110: of:=[.A110]=[.B110] -> true | D110: of:=FORMULA([.A110]) -> =XLOOKUP(N1;L$1:L$12;I$1:I$12;0;0;-2)
A111: of:=COM.MICROSOFT.XLOOKUP([.M1];[.K$1:.K$12];[.I$1:.I$12];;0;2) ->  | B111: #N/A | C111: of:=ISERROR([.A111]) -> true | D111: of:=FORMULA([.A111]) -> =XLOOKUP(M1;K$1:K$12;I$1:I$12;;0;2)
A113: of:=COM.MICROSOFT.XLOOKUP([.$O$1];[.P$1:.P$11];[.T$1:.T$11];;0;2) ->  | B113: #N/A | C113: of:=ISERROR([.A113]) -> true | D113: of:=FORMULA([.A113]) -> =XLOOKUP($O$1;P$1:P$11;T$1:T$11;;0;2)
A114: of:=COM.MICROSOFT.XLOOKUP([.$O$1];[.P$1:.P$11];[.T$1:.T$11];;-1;2) -> c | B114: c | C114: of:=[.A114]=[.B114] -> true | D114: of:=FORMULA([.A114]) -> =XLOOKUP($O$1;P$1:P$11;T$1:T$11;;-1;2)
A115: of:=COM.MICROSOFT.XLOOKUP([.$O$1];[.P$1:.P$11];[.T$1:.T$11];;1;2) -> d | B115: d | C115: of:=[.A115]=[.B115] -> true | D115: of:=FORMULA([.A115]) -> =XLOOKUP($O$1;P$1:P$11;T$1:T$11;;1;2)
A116: of:=COM.MICROSOFT.XLOOKUP([.$O$1];[.Q$1:.Q$11];[.T$1:.T$11];;0;2) -> c | B116: c | C116: of:=[.A116]=[.B116] -> true | D116: of:=FORMULA([.A116]) -> =XLOOKUP($O$1;Q$1:Q$11;T$1:T$11;;0;2)
A117: of:=COM.MICROSOFT.XLOOKUP([.$O$1];[.Q$1:.Q$11];[.T$1:.T$11];;-1;2) -> c | B117: c | C117: of:=[.A117]=[.B117] -> true | D117: of:=FORMULA([.A117]) -> =XLOOKUP($O$1;Q$1:Q$11;T$1:T$11;;-1;2)
A118: of:=COM.MICROSOFT.XLOOKUP([.$O$1];[.Q$1:.Q$11];[.T$1:.T$11];;1;2) -> c | B118: c | C118: of:=[.A118]=[.B118] -> true | D118: of:=FORMULA([.A118]) -> =XLOOKUP($O$1;Q$1:Q$11;T$1:T$11;;1;2)
A120: of:=COM.MICROSOFT.XLOOKUP([.$O$1];[.R$1:.R$11];[.T$1:.T$11];;0;-2) ->  | B120: #N/A | C120: of:=ISERROR([.A120]) -> true | D120: of:=FORMULA([.A120]) -> =XLOOKUP($O$1;R$1:R$11;T$1:T$11;;0;-2)
A121: of:=COM.MICROSOFT.XLOOKUP([.$O$1];[.R$1:.R$11];[.T$1:.T$11];;-1;-2) -> h | B121: h | C121: of:=[.A121]=[.B121] -> true | D121: of:=FORMULA([.A121]) -> =XLOOKUP($O$1;R$1:R$11;T$1:T$11;;-1;-2) | G121: Surname | H121: First Name
A122: of:=COM.MICROSOFT.XLOOKUP([.$O$1];[.R$1:.R$11];[.T$1:.T$11];;1;-2) -> g | B122: g | C122: of:=[.A122]=[.B122] -> true | D122: of:=FORMULA([.A122]) -> =XLOOKUP($O$1;R$1:R$11;T$1:T$11;;1;-2) | G122: Wolf | H122: Dieter
A123: of:=COM.MICROSOFT.XLOOKUP([.$O$1];[.S$1:.S$11];[.T$1:.T$11];;0;-2) -> h | B123: h | C123: of:=[.A123]=[.B123] -> true | D123: of:=FORMULA([.A123]) -> =XLOOKUP($O$1;S$1:S$11;T$1:T$11;;0;-2) | G123: Müller | H123: Gerd
A124: of:=COM.MICROSOFT.XLOOKUP([.$O$1];[.S$1:.S$11];[.T$1:.T$11];;-1;-2) -> h | B124: h | C124: of:=[.A124]=[.B124] -> true | D124: of:=FORMULA([.A124]) -> =XLOOKUP($O$1;S$1:S$11;T$1:T$11;;-1;-2) | G124: Klein | H124: Susanne
A125: of:=COM.MICROSOFT.XLOOKUP([.$O$1];[.S$1:.S$11];[.T$1:.T$11];;1;-2) -> h | B125: h | C125: of:=[.A125]=[.B125] -> true | D125: of:=FORMULA([.A125]) -> =XLOOKUP($O$1;S$1:S$11;T$1:T$11;;1;-2) | G125: Klein | H125: Hans
G126: Klein | H126: Udo
A127: of:=COM.MICROSOFT.XLOOKUP([.N25];[.K22:.K26];[.L22:.L26];COM.MICROSOFT.XLOOKUP([.N25];[.P22:.P26];[.Q22:.Q26])) -> 16 | B127: 16 | C127: of:=[.A127]=[.B127] -> true | D127: of:=FORMULA([.A127]) -> =XLOOKUP(N25;K22:K26;L22:L26;XLOOKUP(N25;P22:P26;Q22:Q26)) | G127: Bauer | H127: Karin
A128: of:=COM.MICROSOFT.XLOOKUP([.N26];[.K22:.K26];[.L22:.L26];COM.MICROSOFT.XLOOKUP([.N26];[.P22:.P26];[.Q22:.Q26])) -> 86 | B128: 86 | C128: of:=[.A128]=[.B128] -> true | D128: of:=FORMULA([.A128]) -> =XLOOKUP(N26;K22:K26;L22:L26;XLOOKUP(N26;P22:P26;Q22:Q26)) | G128: Bauer | H128: Sonja
A130: of:=COM.MICROSOFT.XLOOKUP("Luchs";[.G$121:.G$128];[.H$121:.H$128]; ;-1;-2) -> Susanne | B130: Susanne | C130: of:=[.A130]=[.B130] -> true | D130: of:=FORMULA([.A130]) -> =XLOOKUP("Luchs";G$121:G$128;H$121:H$128; ;-1;-2)
G131: Country Asc1 | H131: 0 | I131: 1 | J131: 1 | K131: 3 | L131: 3 | M131: 4 | N131: 6 | O131: 7 | P131: 7 | Q131: 8
G132: Country Asc2 | H132: 0 | I132: 1 | J132: 2 | K132: 2 | L132: 3 | M132: 4 | N132: 6 | O132: 7 | P132: 7 | Q132: 8
A133: of:=COM.MICROSOFT.XLOOKUP([.G137];[.G132:.Q132];[.G135:.Q135];;1;2) -> c | B133: c | C133: of:=[.A133]=[.B133] -> true | D133: of:=FORMULA([.A133]) -> =XLOOKUP(G137;G132:Q132;G135:Q135;;1;2) | G133: Country Desc1 | H133: 8 | I133: 7 | J133: 1 | K133: 1 | L133: 1 | M133: 0 | N133: 0 | O133: 0 | P133: 0 | Q133: 0
G134: Country Desc2 | H134: 8 | I134: 7 | J134: 7 | K134: 6 | L134: 4 | M134: 3 | N134: 2 | O134: 2 | P134: 1 | Q134: 0
G135: Prefix | H135: a | I135: b | J135: c | K135: d | L135: e | M135: f | N135: g | O135: h | P135: I | Q135: j
G137: 2