Sheet: Sheet1
A1: REPLACEB Function
A3: Result | B3: of:=AND([.B8:.B95]) -> true
A7: Sheet | B7: Result | C7: Description
A8: 1 | B8: of:=AND([Sheet2.C2:.C100]) -> true | C8: Simple REPLACEB formulas with local references and values

Sheet: Sheet2
A1: Function | B1: Expected | C1: Correct | D1: FunctionString | E1: Comment | K1: ᄩᄔᄕᄜᄝᄞᄠᄢᄣᄫᄬᄭᄮᄯᄲᄶ
A2: of:=REPLACEB([.$K$1];[.K2];[.L2];"ab") -> ab ᄔᄕᄜᄝᄞᄠᄢᄣᄫᄬᄭᄮᄯᄲᄶ | B2: ab ᄔᄕᄜᄝᄞᄠᄢᄣᄫᄬᄭᄮᄯᄲᄶ | C2: of:=[.A2]=[.B2] -> true | D2: of:=FORMULA([.A2]) -> =REPLACEB($K$1;K2;L2;"ab") | K2: 1 | L2: 1 | M2: of:=LENB([.A2]) -> 33
A3: of:=REPLACEB([.$K$1];[.K3];[.L3];"ab") ->  abᄔᄕᄜᄝᄞᄠᄢᄣᄫᄬᄭᄮᄯᄲᄶ | B3: abᄔᄕᄜᄝᄞᄠᄢᄣᄫᄬᄭᄮᄯᄲᄶ | C3: of:=[.A3]=[.B3] -> true | D3: of:=FORMULA([.A3]) -> =REPLACEB($K$1;K3;L3;"ab") | K3: 2 | L3: 1 | M3: of:=LENB([.A3]) -> 33
A4: of:=REPLACEB([.$K$1];[.K4];[.L4];"ab") -> ᄩab ᄕᄜᄝᄞᄠᄢᄣᄫᄬᄭᄮᄯᄲᄶ | B4: ᄩab ᄕᄜᄝᄞᄠᄢᄣᄫᄬᄭᄮᄯᄲᄶ | C4: of:=[.A4]=[.B4] -> true | D4: of:=FORMULA([.A4]) -> =REPLACEB($K$1;K4;L4;"ab") | K4: 3 | L4: 1 | M4: of:=LENB([.A4]) -> 33
A5: of:=REPLACEB([.$K$1];[.K5];[.L5];"ab") -> ᄩ abᄕᄜᄝᄞᄠᄢᄣᄫᄬᄭᄮᄯᄲᄶ | B5: ᄩ abᄕᄜᄝᄞᄠᄢᄣᄫᄬᄭᄮᄯᄲᄶ | C5: of:=[.A5]=[.B5] -> true | D5: of:=FORMULA([.A5]) -> =REPLACEB($K$1;K5;L5;"ab") | K5: 4 | L5: 1 | M5: of:=LENB([.A5]) -> 33
A6: of:=REPLACEB([.$K$1];[.K6];[.L6];"ab") -> ᄩᄔab ᄜᄝᄞᄠᄢᄣᄫᄬᄭᄮᄯᄲᄶ | B6: ᄩᄔab ᄜᄝᄞᄠᄢᄣᄫᄬᄭᄮᄯᄲᄶ | C6: of:=[.A6]=[.B6] -> true | D6: of:=FORMULA([.A6]) -> =REPLACEB($K$1;K6;L6;"ab") | K6: 5 | L6: 1 | M6: of:=LENB([.A6]) -> 33
A7: of:=REPLACEB([.$K$1];[.K7];[.L7];"ab") -> ᄩᄔ abᄜᄝᄞᄠᄢᄣᄫᄬᄭᄮᄯᄲᄶ | B7: ᄩᄔ abᄜᄝᄞᄠᄢᄣᄫᄬᄭᄮᄯᄲᄶ | C7: of:=[.A7]=[.B7] -> true | D7: of:=FORMULA([.A7]) -> =REPLACEB($K$1;K7;L7;"ab") | K7: 6 | L7: 1 | M7: of:=LENB([.A7]) -> 33
A8: of:=REPLACEB([.$K$1];[.K8];[.L8];"ab") ->  abᄔᄕᄜᄝᄞᄠᄢᄣᄫᄬᄭᄮᄯᄲᄶ | B8: abᄔᄕᄜᄝᄞᄠᄢᄣᄫᄬᄭᄮᄯᄲᄶ | C8: of:=[.A8]=[.B8] -> true | D8: of:=FORMULA([.A8]) -> =REPLACEB($K$1;K8;L8;"ab") | K8: 2 | L8: 1 | M8: of:=LENB([.A8]) -> 33
A9: of:=REPLACEB([.$K$1];[.K9];[.L9];"ab") ->  ab ᄕᄜᄝᄞᄠᄢᄣᄫᄬᄭᄮᄯᄲᄶ | B9: ab ᄕᄜᄝᄞᄠᄢᄣᄫᄬᄭᄮᄯᄲᄶ | C9: of:=[.A9]=[.B9] -> true | D9: of:=FORMULA([.A9]) -> =REPLACEB($K$1;K9;L9;"ab") | K9: 2 | L9: 2 | M9: of:=LENB([.A9]) -> 32
A10: of:=REPLACEB([.$K$1];[.K10];[.L10];"ab") ->  abᄕᄜᄝᄞᄠᄢᄣᄫᄬᄭᄮᄯᄲᄶ | B10: abᄕᄜᄝᄞᄠᄢᄣᄫᄬᄭᄮᄯᄲᄶ | C10: of:=[.A10]=[.B10] -> true | D10: of:=FORMULA([.A10]) -> =REPLACEB($K$1;K10;L10;"ab") | K10: 2 | L10: 3 | M10: of:=LENB([.A10]) -> 31
A11: of:=REPLACEB([.$K$1];[.K11];[.L11];"ab") ->  ab ᄜᄝᄞᄠᄢᄣᄫᄬᄭᄮᄯᄲᄶ | B11: ab ᄜᄝᄞᄠᄢᄣᄫᄬᄭᄮᄯᄲᄶ | C11: of:=[.A11]=[.B11] -> true | D11: of:=FORMULA([.A11]) -> =REPLACEB($K$1;K11;L11;"ab") | K11: 2 | L11: 4 | M11: of:=LENB([.A11]) -> 30
A12: of:=REPLACEB([.$K$1];[.K12];[.L12];"ab") ->  abᄜᄝᄞᄠᄢᄣᄫᄬᄭᄮᄯᄲᄶ | B12: abᄜᄝᄞᄠᄢᄣᄫᄬᄭᄮᄯᄲᄶ | C12: of:=[.A12]=[.B12] -> true | D12: of:=FORMULA([.A12]) -> =REPLACEB($K$1;K12;L12;"ab") | K12: 2 | L12: 5 | M12: of:=LENB([.A12]) -> 29
A13: of:=REPLACEB([.$K$1];[.K13];[.L13];"ab") ->  ab ᄝᄞᄠᄢᄣᄫᄬᄭᄮᄯᄲᄶ | B13: ab ᄝᄞᄠᄢᄣᄫᄬᄭᄮᄯᄲᄶ | C13: of:=[.A13]=[.B13] -> true | D13: of:=FORMULA([.A13]) -> =REPLACEB($K$1;K13;L13;"ab") | K13: 2 | L13: 6 | M13: of:=LENB([.A13]) -> 28
A14: of:=REPLACEB([.$K$1];[.K14];[.L14];"ab") ->  ab ᄕᄜᄝᄞᄠᄢᄣᄫᄬᄭᄮᄯᄲᄶ | B14: ab ᄕᄜᄝᄞᄠᄢᄣᄫᄬᄭᄮᄯᄲᄶ | C14: of:=[.A14]=[.B14] -> true | D14: of:=FORMULA([.A14]) -> =REPLACEB($K$1;K14;L14;"ab") | K14: 2 | L14: 2 | M14: of:=LENB([.A14]) -> 32
A15: of:=REPLACEB([.$K$1];[.K15];[.L15];"ab") -> ᄩab ᄜᄝᄞᄠᄢᄣᄫᄬᄭᄮᄯᄲᄶ | B15: ᄩab ᄜᄝᄞᄠᄢᄣᄫᄬᄭᄮᄯᄲᄶ | C15: of:=[.A15]=[.B15] -> true | D15: of:=FORMULA([.A15]) -> =REPLACEB($K$1;K15;L15;"ab") | K15: 3 | L15: 3 | M15: of:=LENB([.A15]) -> 31
A16: of:=REPLACEB([.$K$1];[.K16];[.L16];"ab") -> ᄩ ab ᄝᄞᄠᄢᄣᄫᄬᄭᄮᄯᄲᄶ | B16: ᄩ ab ᄝᄞᄠᄢᄣᄫᄬᄭᄮᄯᄲᄶ | C16: of:=[.A16]=[.B16] -> true | D16: of:=FORMULA([.A16]) -> =REPLACEB($K$1;K16;L16;"ab") | K16: 4 | L16: 4 | M16: of:=LENB([.A16]) -> 30
A17: of:=REPLACEB([.$K$1];[.K17];[.L17];"ab") -> ᄩᄔab ᄞᄠᄢᄣᄫᄬᄭᄮᄯᄲᄶ | B17: ᄩᄔab ᄞᄠᄢᄣᄫᄬᄭᄮᄯᄲᄶ | C17: of:=[.A17]=[.B17] -> true | D17: of:=FORMULA([.A17]) -> =REPLACEB($K$1;K17;L17;"ab") | K17: 5 | L17: 5 | M17: of:=LENB([.A17]) -> 29
A18: of:=REPLACEB([.$K$1];[.K18];[.L18];"ab") -> ᄩᄔ ab ᄠᄢᄣᄫᄬᄭᄮᄯᄲᄶ | B18: ᄩᄔ ab ᄠᄢᄣᄫᄬᄭᄮᄯᄲᄶ | C18: of:=[.A18]=[.B18] -> true | D18: of:=FORMULA([.A18]) -> =REPLACEB($K$1;K18;L18;"ab") | K18: 6 | L18: 6 | M18: of:=LENB([.A18]) -> 28
A19: of:=REPLACEB([.$K$1];[.K19];[.L19];"ab") -> abᄜᄝᄞᄠᄢᄣᄫᄬᄭᄮᄯᄲᄶ | B19: abᄜᄝᄞᄠᄢᄣᄫᄬᄭᄮᄯᄲᄶ | C19: of:=[.A19]=[.B19] -> true | D19: of:=FORMULA([.A19]) -> =REPLACEB($K$1;K19;L19;"ab") | K19: 1 | L19: 6 | M19: of:=LENB([.A19]) -> 28
A20: of:=REPLACEB([.$K$1];[.K20];[.L20];"ab") ->  abᄜᄝᄞᄠᄢᄣᄫᄬᄭᄮᄯᄲᄶ | B20: abᄜᄝᄞᄠᄢᄣᄫᄬᄭᄮᄯᄲᄶ | C20: of:=[.A20]=[.B20] -> true | D20: of:=FORMULA([.A20]) -> =REPLACEB($K$1;K20;L20;"ab") | K20: 2 | L20: 5 | M20: of:=LENB([.A20]) -> 29
A21: of:=REPLACEB([.$K$1];[.K21];[.L21];"ab") -> ᄩabᄜᄝᄞᄠᄢᄣᄫᄬᄭᄮᄯᄲᄶ | B21: ᄩabᄜᄝᄞᄠᄢᄣᄫᄬᄭᄮᄯᄲᄶ | C21: of:=[.A21]=[.B21] -> true | D21: of:=FORMULA([.A21]) -> =REPLACEB($K$1;K21;L21;"ab") | K21: 3 | L21: 4 | M21: of:=LENB([.A21]) -> 30
A22: of:=REPLACEB([.$K$1];[.K22];[.L22];"ab") -> ᄩ abᄜᄝᄞᄠᄢᄣᄫᄬᄭᄮᄯᄲᄶ | B22: ᄩ abᄜᄝᄞᄠᄢᄣᄫᄬᄭᄮᄯᄲᄶ | C22: of:=[.A22]=[.B22] -> true | D22: of:=FORMULA([.A22]) -> =REPLACEB($K$1;K22;L22;"ab") | K22: 4 | L22: 3 | M22: of:=LENB([.A22]) -> 31
A23: of:=REPLACEB([.$K$1];[.K23];[.L23];"ab") -> ᄩᄔabᄜᄝᄞᄠᄢᄣᄫᄬᄭᄮᄯᄲᄶ | B23: ᄩᄔabᄜᄝᄞᄠᄢᄣᄫᄬᄭᄮᄯᄲᄶ | C23: of:=[.A23]=[.B23] -> true | D23: of:=FORMULA([.A23]) -> =REPLACEB($K$1;K23;L23;"ab") | K23: 5 | L23: 2 | M23: of:=LENB([.A23]) -> 32
A24: of:=REPLACEB([.$K$1];[.K24];[.L24];"ab") -> ᄩᄔ abᄜᄝᄞᄠᄢᄣᄫᄬᄭᄮᄯᄲᄶ | B24: ᄩᄔ abᄜᄝᄞᄠᄢᄣᄫᄬᄭᄮᄯᄲᄶ | C24: of:=[.A24]=[.B24] -> true | D24: of:=FORMULA([.A24]) -> =REPLACEB($K$1;K24;L24;"ab") | K24: 6 | L24: 1 | M24: of:=LENB([.A24]) -> 33
A25: of:=REPLACEB([.$K$1];[.K25];[.L25];"ᄬ") -> ᄩ ᄬᄕᄜᄝᄞᄠᄢᄣᄫᄬᄭᄮᄯᄲᄶ | B25: ᄩ ᄬᄕᄜᄝᄞᄠᄢᄣᄫᄬᄭᄮᄯᄲᄶ | C25: of:=[.A25]=[.B25] -> true | D25: of:=FORMULA([.A25]) -> =REPLACEB($K$1;K25;L25;"ᄬ") | K25: 4 | L25: 1 | M25: of:=LENB([.A25]) -> 33
A26: of:=REPLACEB([.$K$1];[.K26];[.L26];"ᄬ") -> ᄩ ᄬ ᄜᄝᄞᄠᄢᄣᄫᄬᄭᄮᄯᄲᄶ | B26: ᄩ ᄬ ᄜᄝᄞᄠᄢᄣᄫᄬᄭᄮᄯᄲᄶ | C26: of:=[.A26]=[.B26] -> true | D26: of:=FORMULA([.A26]) -> =REPLACEB($K$1;K26;L26;"ᄬ") | K26: 4 | L26: 2 | M26: of:=LENB([.A26]) -> 32
A27: of:=REPLACEB([.$K$1];[.K27];[.L27];"ᄬ") -> ᄩᄬ ᄕᄜᄝᄞᄠᄢᄣᄫᄬᄭᄮᄯᄲᄶ | B27: ᄩᄬ ᄕᄜᄝᄞᄠᄢᄣᄫᄬᄭᄮᄯᄲᄶ | C27: of:=[.A27]=[.B27] -> true | D27: of:=FORMULA([.A27]) -> =REPLACEB($K$1;K27;L27;"ᄬ") | K27: 3 | L27: 1 | M27: of:=LENB([.A27]) -> 33
A28: of:=REPLACEB([.$K$1];[.K28];[.L28];"ᄬ") -> ᄩᄬᄕᄜᄝᄞᄠᄢᄣᄫᄬᄭᄮᄯᄲᄶ | B28: ᄩᄬᄕᄜᄝᄞᄠᄢᄣᄫᄬᄭᄮᄯᄲᄶ | C28: of:=[.A28]=[.B28] -> true | D28: of:=FORMULA([.A28]) -> =REPLACEB($K$1;K28;L28;"ᄬ") | K28: 3 | L28: 2 | M28: of:=LENB([.A28]) -> 32
A29: of:=REPLACEB([.$K$1];0;3;"ab") ->  | B29: of:#ERR502! ->  | C29: of:=ISERROR([.A29]) -> true | D29: of:=FORMULA([.A29]) -> =REPLACEB($K$1;0;3;"ab") | K29: The quick brown fox jumped…
A30: of:=REPLACEB([.$K$1];2;0;"ab") ->  ab ᄔᄕᄜᄝᄞᄠᄢᄣᄫᄬᄭᄮᄯᄲᄶ | B30: ab ᄔᄕᄜᄝᄞᄠᄢᄣᄫᄬᄭᄮᄯᄲᄶ | C30: of:=[.A30]=[.B30] -> true | D30: of:=FORMULA([.A30]) -> =REPLACEB($K$1;2;0;"ab")
A31: of:=REPLACEB([.$K$1];2;-1;"ab") ->  | B31: of:#ERR502! ->  | C31: of:=ISERROR([.A31]) -> true | D31: of:=FORMULA([.A31]) -> =REPLACEB($K$1;2;-1;"ab")
A32: of:=REPLACEB([.$K$1];-2;4;"ab") ->  | B32: of:#ERR502! ->  | C32: of:=ISERROR([.A32]) -> true | D32: of:=FORMULA([.A32]) -> =REPLACEB($K$1;-2;4;"ab")
A33: of:=REPLACEB([.$K$29];5;5;"slow") -> The slow brown fox jumped… | B33: The slow brown fox jumped… | C33: of:=[.A33]=[.B33] -> true | D33: of:=FORMULA([.A33]) -> =REPLACEB($K$29;5;5;"slow")
A34: of:=REPLACEB([.$K$29];25;5;"slow") ->  | B34: of:#ERR502! ->  | C34: of:=ISERROR([.A34]) -> true | D34: of:=FORMULA([.A34]) -> =REPLACEB($K$29;25;5;"slow")
A35: of:=REPLACEB([.$K$29];5;25;"slow") ->  | B35: of:#ERR502! ->  | C35: of:=ISERROR([.A35]) -> true | D35: of:=FORMULA([.A35]) -> =REPLACEB($K$29;5;25;"slow")