Sheet: Sheet1
A1: SEARCH Function
A3: Result | B3: of:=AND([.B8:.B95]) -> true
A7: Sheet | B7: Result | C7: Description
A8: 1 | B8: of:=AND([Sheet2.C2:.C100]) -> true | C8: Simple SEARCH formulas with local references and values

Sheet: Sheet2
A1: Function | B1: Expected | C1: Correct | D1: FunctionString | E1: Comment | I1: LibreOffice
A2: of:=SEARCH(54;998877665544) -> 10 | B2: 10 | C2: of:=[.A2]=[.B2] -> true | D2: of:=FORMULA([.A2]) -> =SEARCH(54,998877665544)
A3: of:=IF(ISERROR(SEARCH("Gewinn|Promotion|Replay";[.I5]));"";[.K5]) -> 6 | B3: 6 | C3: of:=[.A3]=[.B3] -> true | D3: of:=FORMULA([.A3]) -> =IF(ISERROR(SEARCH("Gewinn|Promotion|Replay",I5)),"",K5)
A4: of:=IF(ISERROR(SEARCH("Gewinn|Promotion|Replay";[.I6]));"";[.K6]) -> 2 | B4: 2 | C4: of:=[.A4]=[.B4] -> true | D4: of:=FORMULA([.A4]) -> =IF(ISERROR(SEARCH("Gewinn|Promotion|Replay",I6)),"",K6)
A5: of:=SUM(IF(ISERROR(SEARCH("Mark";[.I10:.I19]));0;1)) -> 4 | B5: 4 | C5: of:=[.A5]=[.B5] -> true | D5: of:=FORMULA([.A5]) -> {=SUM(IF(ISERROR(SEARCH("Mark",I10:I19)),0,1))} | I5: Gewinn | K5: 6
A6: of:=SEARCH("off";[.I1]) -> 6 | B6: 6 | C6: of:=[.A6]=[.B6] -> true | D6: of:=FORMULA([.A6]) -> =SEARCH("off",I1) | I6: Gewinn | K6: 2
A7: of:=SEARCH("OFf";[.I1]) -> 6 | B7: 6 | C7: of:=[.A7]=[.B7] -> true | D7: of:=FORMULA([.A7]) -> =SEARCH("OFf",I1)
A8: of:=SEARCH("off";[.I1];2) -> 6 | B8: 6 | C8: of:=[.A8]=[.B8] -> true | D8: of:=FORMULA([.A8]) -> =SEARCH("off",I1,2)
A9: of:=SEARCH("off";[.I1];7) ->  | B9: of:=#VALUE! ->  | C9: of:=ISERROR([.A9]) -> true | D9: of:=FORMULA([.A9]) -> =SEARCH("off",I1,7)
A10: of:=SEARCH("e";[.I1]) -> 5 | B10: 5 | C10: of:=[.A10]=[.B10] -> true | D10: of:=FORMULA([.A10]) -> =SEARCH("e",I1) | I10: Mark
A11: of:=SEARCH("e";[.I1];6) -> 11 | B11: 11 | C11: of:=[.A11]=[.B11] -> true | D11: of:=FORMULA([.A11]) -> =SEARCH("e",I1,6) | I11: Julia
A12: of:=SEARCH("e";[.I1];0) ->  | B12: error | C12: of:=ISERROR([.A12]) -> true | D12: of:=FORMULA([.A12]) -> =SEARCH("e",I1,0) | E12: Constraints: Start >= 1 | I12: Wookie
A13: of:=SEARCH("e";"LibreOffice";0) ->  | B13: error | C13: of:=ISERROR([.A13]) -> true | D13: of:=FORMULA([.A13]) -> =SEARCH("e","LibreOffice",0) | I13: Mark
A14: of:=SEARCH("e";"LibreOffice";-1) ->  | B14: error | C14: of:=ISERROR([.A14]) -> true | D14: of:=FORMULA([.A14]) -> =SEARCH("e","LibreOffice",-1) | E14: It is a non-compliance with a purpose to keep backward compatibility (extract from the source code): // This should use GetStringPositionArgument() but old versions up // to LibreOffice 4.2.5 allowed and ignored 0 and negative values. // It is unnecessary to break existing documents that "rely" on // that behavior. Though ODFF constrains Start to be >=1. /* TODO: fix this and possibly break those broken documents? */ Given that version 4.2.5 dates from June 2014, one could argue that making the code fully ODFF compliant will not really break backward compatibility (version 5.4.0 is scheduled for August 2017). OTOH, it doesn't do real harm, the source code simply replaces the value of argument Start with 1 when the value passed is 0 or negative. | I14: Mark
I15: Julia
I16: Gordon
I17: Flash
I18: Andromeda
I19: Mark
A21: of:=SEARCH([.I21];[.J21]) -> 2 | B21: 2 | C21: of:=[.A21]=[.B21] -> true | D21: of:=FORMULA([.A21]) -> =SEARCH(I21;J21) | E21: Excel 2016 has same result | I21: B😂 | J21: ab😂de𝔖gh𝕬𝖈𝖍𝖙𝖚𝖓𝖌!
A22: of:=SEARCH([.I22];[.J21]) -> 3 | B22: 3 | C22: of:=[.A22]=[.B22] -> true | D22: of:=FORMULA([.A22]) -> =SEARCH(I22;J21) | E22: Excel 2016 has same result | I22: 😂d | J22: ab😂
A23: of:=SEARCH([.I23];[.J23]) -> 3 | B23: 3 | C23: of:=[.A23]=[.B23] -> true | D23: of:=FORMULA([.A23]) -> =SEARCH(I23;J23) | E23: Excel 2016 returns 4 | I23: 𧀬 | J23: "𧌒𧀬"
A24: of:=SEARCH([.I24];[.J21]) -> 8 | B24: 8 | C24: of:=[.A24]=[.B24] -> true | D24: of:=FORMULA([.A24]) -> =SEARCH(I24;J21) | E24: Excel 2016 returns 10 | I24: h
A25: of:=SEARCH([.I25];[.J25]) -> 4 | B25: 4 | C25: of:=[.A25]=[.B25] -> true | D25: of:=FORMULA([.A25]) -> =SEARCH(I25;J25) | E25: Excel 2016 has same result | I25: e | J25: "üë"
A26: of:=SEARCH([.I26];[.J26]) -> 3 | B26: 3 | C26: of:=[.A26]=[.B26] -> true | D26: of:=FORMULA([.A26]) -> =SEARCH(I26;J26) | E26: Excel 2016 returns 5 | I26: 𝖍𝖙 | J26: 𝕬𝖈𝖍𝖙𝖚𝖓𝖌!