Sheet: Sheet1
A1: UNICODE Function
A3: Result | B3: of:=AND([.B8:.B95]) -> true
A7: Sheet | B7: Result | C7: Description
A8: 1 | B8: of:=AND([Sheet2.C2:.C196]) -> true | C8: Simple UNICODE formulas with local references and values

Sheet: Sheet2
A1: Function | B1: Expected | C1: Correct | D1: FunctionString | E1: Comment | I1: 68 | J1: D
A2: of:=UNICODE(0) -> 48 | B2: 48 | C2: of:=[.A2]=[.B2] -> true | D2: of:=FORMULA([.A2]) -> =UNICODE(0) | I2: 69 | J2: E
A3: of:=UNICODE("F") -> 70 | B3: 70 | C3: of:=[.A3]=[.B3] -> true | D3: of:=FORMULA([.A3]) -> =UNICODE("F") | I3: 70 | J3: F
A4: of:=UNICODE(32) -> 51 | B4: 51 | C4: of:=[.A4]=[.B4] -> true | D4: of:=FORMULA([.A4]) -> =UNICODE(32) | I4: 71 | J4: G
A5: of:=UNICODE("B") -> 66 | B5: 66 | C5: of:=[.A5]=[.B5] -> true | D5: of:=FORMULA([.A5]) -> =UNICODE("B") | I5: 72 | J5: H
A6: of:=UNICODE("C") -> 67 | B6: 67 | C6: of:=[.A6]=[.B6] -> true | D6: of:=FORMULA([.A6]) -> =UNICODE("C") | I6: 73 | J6: I
A7: of:=UNICODE([.J1:.J60]) -> 68 | B7: 68 | C7: of:=[.A7]=[.B7] -> true | D7: of:=FORMULA([.A7]) -> {=UNICODE(J1:J60)} | I7: 74 | J7: J
A8: 69 | B8: 69 | C8: of:=[.A8]=[.B8] -> true | D8: of:=FORMULA([.A8]) -> {=UNICODE(J1:J60)} | I8: 75 | J8: K
A9: 70 | B9: 70 | C9: of:=[.A9]=[.B9] -> true | D9: of:=FORMULA([.A9]) -> {=UNICODE(J1:J60)} | I9: 76 | J9: L
A10: 71 | B10: 71 | C10: of:=[.A10]=[.B10] -> true | D10: of:=FORMULA([.A10]) -> {=UNICODE(J1:J60)} | I10: 77 | J10: M
A11: 72 | B11: 72 | C11: of:=[.A11]=[.B11] -> true | D11: of:=FORMULA([.A11]) -> {=UNICODE(J1:J60)} | I11: 78 | J11: N
A12: 73 | B12: 73 | C12: of:=[.A12]=[.B12] -> true | D12: of:=FORMULA([.A12]) -> {=UNICODE(J1:J60)} | I12: 79 | J12: O
A13: 74 | B13: 74 | C13: of:=[.A13]=[.B13] -> true | D13: of:=FORMULA([.A13]) -> {=UNICODE(J1:J60)} | I13: 80 | J13: P
A14: 75 | B14: 75 | C14: of:=[.A14]=[.B14] -> true | D14: of:=FORMULA([.A14]) -> {=UNICODE(J1:J60)} | I14: 81 | J14: Q
A15: 76 | B15: 76 | C15: of:=[.A15]=[.B15] -> true | D15: of:=FORMULA([.A15]) -> {=UNICODE(J1:J60)} | I15: 82 | J15: R
A16: 77 | B16: 77 | C16: of:=[.A16]=[.B16] -> true | D16: of:=FORMULA([.A16]) -> {=UNICODE(J1:J60)} | I16: 83 | J16: S
A17: 78 | B17: 78 | C17: of:=[.A17]=[.B17] -> true | D17: of:=FORMULA([.A17]) -> {=UNICODE(J1:J60)} | I17: 84 | J17: T
A18: 79 | B18: 79 | C18: of:=[.A18]=[.B18] -> true | D18: of:=FORMULA([.A18]) -> {=UNICODE(J1:J60)} | I18: 85 | J18: U
A19: 80 | B19: 80 | C19: of:=[.A19]=[.B19] -> true | D19: of:=FORMULA([.A19]) -> {=UNICODE(J1:J60)} | I19: 86 | J19: V
A20: 81 | B20: 81 | C20: of:=[.A20]=[.B20] -> true | D20: of:=FORMULA([.A20]) -> {=UNICODE(J1:J60)} | I20: 87 | J20: W
A21: 82 | B21: 82 | C21: of:=[.A21]=[.B21] -> true | D21: of:=FORMULA([.A21]) -> {=UNICODE(J1:J60)} | I21: 88 | J21: X
A22: 83 | B22: 83 | C22: of:=[.A22]=[.B22] -> true | D22: of:=FORMULA([.A22]) -> {=UNICODE(J1:J60)} | I22: 89 | J22: Y
A23: 84 | B23: 84 | C23: of:=[.A23]=[.B23] -> true | D23: of:=FORMULA([.A23]) -> {=UNICODE(J1:J60)} | I23: 90 | J23: Z
A24: 85 | B24: 85 | C24: of:=[.A24]=[.B24] -> true | D24: of:=FORMULA([.A24]) -> {=UNICODE(J1:J60)} | I24: 91 | J24: [
A25: 86 | B25: 86 | C25: of:=[.A25]=[.B25] -> true | D25: of:=FORMULA([.A25]) -> {=UNICODE(J1:J60)} | I25: 92 | J25: \
A26: 87 | B26: 87 | C26: of:=[.A26]=[.B26] -> true | D26: of:=FORMULA([.A26]) -> {=UNICODE(J1:J60)} | I26: 93 | J26: ]
A27: 88 | B27: 88 | C27: of:=[.A27]=[.B27] -> true | D27: of:=FORMULA([.A27]) -> {=UNICODE(J1:J60)} | I27: 94 | J27: ^
A28: 89 | B28: 89 | C28: of:=[.A28]=[.B28] -> true | D28: of:=FORMULA([.A28]) -> {=UNICODE(J1:J60)} | I28: 95 | J28: _
A29: 90 | B29: 90 | C29: of:=[.A29]=[.B29] -> true | D29: of:=FORMULA([.A29]) -> {=UNICODE(J1:J60)} | I29: 96 | J29: `
A30: 91 | B30: 91 | C30: of:=[.A30]=[.B30] -> true | D30: of:=FORMULA([.A30]) -> {=UNICODE(J1:J60)} | I30: 97 | J30: a
A31: 92 | B31: 92 | C31: of:=[.A31]=[.B31] -> true | D31: of:=FORMULA([.A31]) -> {=UNICODE(J1:J60)} | I31: 98 | J31: b
A32: 93 | B32: 93 | C32: of:=[.A32]=[.B32] -> true | D32: of:=FORMULA([.A32]) -> {=UNICODE(J1:J60)} | I32: 99 | J32: c
A33: 94 | B33: 94 | C33: of:=[.A33]=[.B33] -> true | D33: of:=FORMULA([.A33]) -> {=UNICODE(J1:J60)} | I33: 100 | J33: d
A34: 95 | B34: 95 | C34: of:=[.A34]=[.B34] -> true | D34: of:=FORMULA([.A34]) -> {=UNICODE(J1:J60)} | I34: 101 | J34: e
A35: 96 | B35: 96 | C35: of:=[.A35]=[.B35] -> true | D35: of:=FORMULA([.A35]) -> {=UNICODE(J1:J60)} | I35: 102 | J35: f
A36: 97 | B36: 97 | C36: of:=[.A36]=[.B36] -> true | D36: of:=FORMULA([.A36]) -> {=UNICODE(J1:J60)} | I36: 103 | J36: g
A37: 98 | B37: 98 | C37: of:=[.A37]=[.B37] -> true | D37: of:=FORMULA([.A37]) -> {=UNICODE(J1:J60)} | I37: 104 | J37: h
A38: 99 | B38: 99 | C38: of:=[.A38]=[.B38] -> true | D38: of:=FORMULA([.A38]) -> {=UNICODE(J1:J60)} | I38: 105 | J38: i
A39: 100 | B39: 100 | C39: of:=[.A39]=[.B39] -> true | D39: of:=FORMULA([.A39]) -> {=UNICODE(J1:J60)} | I39: 106 | J39: j
A40: 101 | B40: 101 | C40: of:=[.A40]=[.B40] -> true | D40: of:=FORMULA([.A40]) -> {=UNICODE(J1:J60)} | I40: 107 | J40: k
A41: 102 | B41: 102 | C41: of:=[.A41]=[.B41] -> true | D41: of:=FORMULA([.A41]) -> {=UNICODE(J1:J60)} | I41: 108 | J41: l
A42: 103 | B42: 103 | C42: of:=[.A42]=[.B42] -> true | D42: of:=FORMULA([.A42]) -> {=UNICODE(J1:J60)} | I42: 109 | J42: m
A43: 104 | B43: 104 | C43: of:=[.A43]=[.B43] -> true | D43: of:=FORMULA([.A43]) -> {=UNICODE(J1:J60)} | I43: 110 | J43: n
A44: 105 | B44: 105 | C44: of:=[.A44]=[.B44] -> true | D44: of:=FORMULA([.A44]) -> {=UNICODE(J1:J60)} | I44: 111 | J44: o
A45: 106 | B45: 106 | C45: of:=[.A45]=[.B45] -> true | D45: of:=FORMULA([.A45]) -> {=UNICODE(J1:J60)} | I45: 112 | J45: p
A46: 107 | B46: 107 | C46: of:=[.A46]=[.B46] -> true | D46: of:=FORMULA([.A46]) -> {=UNICODE(J1:J60)} | I46: 113 | J46: q
A47: 108 | B47: 108 | C47: of:=[.A47]=[.B47] -> true | D47: of:=FORMULA([.A47]) -> {=UNICODE(J1:J60)} | I47: 114 | J47: r
A48: 109 | B48: 109 | C48: of:=[.A48]=[.B48] -> true | D48: of:=FORMULA([.A48]) -> {=UNICODE(J1:J60)} | I48: 115 | J48: s
A49: 110 | B49: 110 | C49: of:=[.A49]=[.B49] -> true | D49: of:=FORMULA([.A49]) -> {=UNICODE(J1:J60)} | I49: 116 | J49: t
A50: 111 | B50: 111 | C50: of:=[.A50]=[.B50] -> true | D50: of:=FORMULA([.A50]) -> {=UNICODE(J1:J60)} | I50: 117 | J50: u
A51: 112 | B51: 112 | C51: of:=[.A51]=[.B51] -> true | D51: of:=FORMULA([.A51]) -> {=UNICODE(J1:J60)} | I51: 118 | J51: v
A52: 113 | B52: 113 | C52: of:=[.A52]=[.B52] -> true | D52: of:=FORMULA([.A52]) -> {=UNICODE(J1:J60)} | I52: 119 | J52: w
A53: 114 | B53: 114 | C53: of:=[.A53]=[.B53] -> true | D53: of:=FORMULA([.A53]) -> {=UNICODE(J1:J60)} | I53: 120 | J53: x
A54: 115 | B54: 115 | C54: of:=[.A54]=[.B54] -> true | D54: of:=FORMULA([.A54]) -> {=UNICODE(J1:J60)} | I54: 121 | J54: y
A55: 116 | B55: 116 | C55: of:=[.A55]=[.B55] -> true | D55: of:=FORMULA([.A55]) -> {=UNICODE(J1:J60)} | I55: 122 | J55: z
A56: 117 | B56: 117 | C56: of:=[.A56]=[.B56] -> true | D56: of:=FORMULA([.A56]) -> {=UNICODE(J1:J60)} | I56: 123 | J56: {
A57: 118 | B57: 118 | C57: of:=[.A57]=[.B57] -> true | D57: of:=FORMULA([.A57]) -> {=UNICODE(J1:J60)} | I57: 124 | J57: |
A58: 119 | B58: 119 | C58: of:=[.A58]=[.B58] -> true | D58: of:=FORMULA([.A58]) -> {=UNICODE(J1:J60)} | I58: 125 | J58: }
A59: 120 | B59: 120 | C59: of:=[.A59]=[.B59] -> true | D59: of:=FORMULA([.A59]) -> {=UNICODE(J1:J60)} | I59: 126 | J59: ~
A60: 121 | B60: 121 | C60: of:=[.A60]=[.B60] -> true | D60: of:=FORMULA([.A60]) -> {=UNICODE(J1:J60)} | I60: 127 | J60: 
A61: 122 | B61: 122 | C61: of:=[.A61]=[.B61] -> true | D61: of:=FORMULA([.A61]) -> {=UNICODE(J1:J60)}
A62: 123 | B62: 123 | C62: of:=[.A62]=[.B62] -> true | D62: of:=FORMULA([.A62]) -> {=UNICODE(J1:J60)}
A63: 124 | B63: 124 | C63: of:=[.A63]=[.B63] -> true | D63: of:=FORMULA([.A63]) -> {=UNICODE(J1:J60)}
A64: 125 | B64: 125 | C64: of:=[.A64]=[.B64] -> true | D64: of:=FORMULA([.A64]) -> {=UNICODE(J1:J60)}
A65: 126 | B65: 126 | C65: of:=[.A65]=[.B65] -> true | D65: of:=FORMULA([.A65]) -> {=UNICODE(J1:J60)}
A66: 127 | B66: 127 | C66: of:=[.A66]=[.B66] -> true | D66: of:=FORMULA([.A66]) -> {=UNICODE(J1:J60)}