Sheet: Sheet1
A1: AMORDEGRC Function
A3: Result | B3: of:=AND([.B8:.B95]) -> true
A7: Sheet | B7: Result | C7: Description
A8: 1 | B8: of:=AND([Sheet2.C2:.C49]) -> true | C8: Simple AMORDEGRC formulas with local references and values

Sheet: Sheet2
A1: Function | B1: Expected | C1: Correct | D1: FunctionString | E1: Comment | I1: cost | J1: 10000 | L1: Data | M1: Description
A2: of:=AMORDEGRC([.J1];[.J2];[.J3];[.J4];[.J5];[.J6];[.J7]) -> 2813 | B2: 2813 | C2: of:=[.A2]=[.B2] -> true | D2: of:=FORMULA([.A2]) -> =AMORDEGRC(J1;J2;J3;J4;J5;J6;J7) | E2: tdf69569, verified with Excel2016 | I2: purchase date | J2: 2012-03-01 | L2: 2400 | M2: Cost
A3: of:=AMORDEGRC(10000;DATE(2012;3;1);DATE(2012;12;31);1500;1;0.3;1) -> 2813 | B3: 2813 | C3: of:=[.A3]=[.B3] -> true | D3: of:=FORMULA([.A3]) -> =AMORDEGRC(10000;DATE(2012;3;1);DATE(2012;12;31);1500;1;0,3;1) | E3: tdf69569, verified with Excel2016 | I3: first period | J3: 2012-12-31 | L3: 39679 | M3: Date purchased
A4: of:=AMORDEGRC(10000;DATE(2012;3;1);DATE(2012;12;31);1500;1;0.3;1) -> 2813 | B4: 2813 | C4: of:=[.A4]=[.B4] -> true | D4: of:=FORMULA([.A4]) -> =AMORDEGRC(10000;DATE(2012;3;1);DATE(2012;12;31);1500;1;0,3;1) | E4: tdf69569, verified with Excel2016 | I4: salvage | J4: 1500 | L4: 39813 | M4: End of the first period
A5: of:=AMORDEGRC(10000;DATE(2012;3;1);DATE(2012;12;31);1500;1;0.3;0) -> 2813 | B5: 2813 | C5: of:=[.A5]=[.B5] -> true | D5: of:=FORMULA([.A5]) -> =AMORDEGRC(10000;DATE(2012;3;1);DATE(2012;12;31);1500;1;0,3;0) | I5: period | J5: 1 | L5: 300 | M5: Salvage value
A6: of:=AMORDEGRC(10000;DATE(2012;3;1);DATE(2012;12;31);1500;1;0.3;3) -> 2808 | B6: 2808 | C6: of:=[.A6]=[.B6] -> true | D6: of:=FORMULA([.A6]) -> =AMORDEGRC(10000;DATE(2012;3;1);DATE(2012;12;31);1500;1;0,3;3) | E6: Basis 3 | I6: rate | J6: 0.3 | L6: 1 | M6: Period
A7: of:=AMORDEGRC(10000;DATE(2012;3;1);DATE(2012;12;31);1500;1;0.3;4) -> 2818 | B7: 2818 | C7: of:=[.A7]=[.B7] -> true | D7: of:=FORMULA([.A7]) -> =AMORDEGRC(10000;DATE(2012;3;1);DATE(2012;12;31);1500;1;0,3;4) | E7: Basis 4 | I7: basis | J7: 1 | L7: 0.15 | M7: Depreciation rate
A8: of:=AMORDEGRC([.J1];[.J2];[.J3];[.J4];[.J5];[.J6];) -> 2813 | B8: 2813 | C8: of:=[.A8]=[.B8] -> true | D8: of:=FORMULA([.A8]) -> =AMORDEGRC(J1;J2;J3;J4;J5;J6;) | E8: Basis missing | L8: 1 | M8: Actual basis (see above)
A9: of:=AMORDEGRC([.J1];[.J2];[.J3];[.J4];[.J5];[.J6]) -> 2813 | B9: 2813 | C9: of:=[.A9]=[.B9] -> true | D9: of:=FORMULA([.A9]) -> =AMORDEGRC(J1;J2;J3;J4;J5;J6) | E9: Basis missing
A10: of:=AMORDEGRC([.L2];[.L3];[.L4];[.L5];[.L6];[.L7];[.L8]) -> 776 | B10: 776 | C10: of:=[.A10]=[.B10] -> true | D10: of:=FORMULA([.A10]) -> =AMORDEGRC(L2;L3;L4;L5;L6;L7;L8) | I10: basis | J10: 0
A11: of:=AMORDEGRC(10000;DATE(2012;3;1);DATE(2012;12;31);1500;-1;0.3;4) ->  | B11: error | C11: of:=ISERROR([.A11]) -> true | D11: of:=FORMULA([.A11]) -> =AMORDEGRC(10000;DATE(2012;3;1);DATE(2012;12;31);1500;-1;0,3;4) | E11: Tdf#100523 | J11: 1
A12: of:=AMORDEGRC(-10000;DATE(2012;3;1);DATE(2012;12;31);1500;1;0.3;4) ->  | B12: error | C12: of:=ISERROR([.A12]) -> true | D12: of:=FORMULA([.A12]) -> =AMORDEGRC(-10000;DATE(2012;3;1);DATE(2012;12;31);1500;1;0,3;4) | J12: 2
A13: of:=AMORDEGRC(10000;DATE(2012;3;1);DATE(2012;12;31);-1500;1;0.3;4) ->  | B13: error | C13: of:=ISERROR([.A13]) -> true | D13: of:=FORMULA([.A13]) -> =AMORDEGRC(10000;DATE(2012;3;1);DATE(2012;12;31);-1500;1;0,3;4) | E13: Tdf #100523 | J13: 3
A14: of:=AMORDEGRC(10000;DATE(2012;3;1);DATE(2012;12;31);1500;1;-0.3;4) ->  | B14: error | C14: of:=ISERROR([.A14]) -> true | D14: of:=FORMULA([.A14]) -> =AMORDEGRC(10000;DATE(2012;3;1);DATE(2012;12;31);1500;1;-0,3;4) | J14: 4
A15: of:=AMORDEGRC(10000;DATE(2012;3;1);DATE(2012;12;31);1500;1;0;3;-4) ->  | B15: error | C15: of:=ISERROR([.A15]) -> true | D15: of:=FORMULA([.A15]) -> =AMORDEGRC(10000;DATE(2012;3;1);DATE(2012;12;31);1500;1;0;3;-4)
A19: of:=AMORDEGRC(10000;DATE(2012;3;1);DATE(2012;12;31);1500;1;0.3;2) ->  | D19: of:=FORMULA([.A19]) -> =AMORDEGRC(10000;DATE(2012;3;1);DATE(2012;12;31);1500;1;0,3;2) | E19: Basis 2 tdf#100496
G20: AMORDEGRC Calculates the amount of depreciation for a settlement period as degressive amortization. Unlike AMORLINC, a depreciation coefficient that is independent of the depreciable life is used here. Syntax AMORDEGRC(Cost; DatePurchased; FirstPeriod; Salvage; Period; Rate; Basis) Cost is the acquisition costs. DatePurchased is the date of acquisition. FirstPeriod is the end date of the first settlement period. Salvage is the salvage value of the capital asset at the end of the depreciable life. Period is the settlement period to be considered. Rate is the rate of depreciation. Basis (optional) is chosen from a list of options and indicates how the year is to be calculated. Basis Calculation 0 or missing US method (NASD), 12 months of 30 days each 1 Exact number of days in months, exact number of days in year 2 Exact number of days in month, year has 360 days 3 Exact number of days in month, year has 365 days 4 European method, 12 months of 30 days each

Sheet: 'file:///home/zdenek/Dokumenty/LO/sc-unit-test/Project%20Calc%20functions%20tests/fods/amordegrc.fods/function_based_test_Example.fods/function_based_test_Example_reference.fods'#Sheet2
H3: 4