Sheet: Sheet1
A1: COUPDAYBS Function
A3: Result | B3: of:=AND([.B8:.B95]) -> true
A7: Sheet | B7: Result | C7: Description
A8: 1 | B8: of:=AND([Sheet2.C2:.C49]) -> true | C8: Simple COUPDAYBS formulas with local references and values

Sheet: Sheet2
A1: Function | B1: Expected | C1: Correct | D1: FunctionString | E1: Comment | I1: Data | J1: Description
A2: of:=COUPDAYBS("2001-01-25"; "2001-11-15"; 2; 3) -> 71 | B2: 71 | C2: of:=[.A2]=[.B2] -> true | D2: of:=FORMULA([.A2]) -> =COUPDAYBS("2001-01-25"; "2001-11-15"; 2; 3) | I2: 2011-01-25 | J2: Settlement date
A3: of:=COUPDAYBS([.I2];[.I3];[.I4];[.I5]) -> 71 | B3: 71 | C3: of:=[.A3]=[.B3] -> true | D3: of:=FORMULA([.A3]) -> =COUPDAYBS(I2;I3;I4;I5) | I3: 2011-11-15 | J3: Maturity date
A4: of:=COUPDAYBS("2001-01-25"; "2001-11-15"; 2; 0) -> 70 | B4: 70 | C4: of:=[.A4]=[.B4] -> true | D4: of:=FORMULA([.A4]) -> =COUPDAYBS("2001-01-25"; "2001-11-15"; 2; 0) | I4: 2 | J4: Semiannual coupon (see above)
A5: of:=COUPDAYBS("2001-01-25"; "2001-11-15"; 2; 1) -> 71 | B5: 71 | C5: of:=[.A5]=[.B5] -> true | D5: of:=FORMULA([.A5]) -> =COUPDAYBS("2001-01-25"; "2001-11-15"; 2; 1) | I5: 1 | J5: Actual/actual basis (see above)
A6: of:=COUPDAYBS("2001-01-25"; "2001-11-15"; 2; 2) -> 71 | B6: 71 | C6: of:=[.A6]=[.B6] -> true | D6: of:=FORMULA([.A6]) -> =COUPDAYBS("2001-01-25"; "2001-11-15"; 2; 2)
A7: of:=COUPDAYBS("2001-01-25"; "2001-11-15"; 2; 4) -> 70 | B7: 70 | C7: of:=[.A7]=[.B7] -> true | D7: of:=FORMULA([.A7]) -> =COUPDAYBS("2001-01-25"; "2001-11-15"; 2; 4)
A8: of:=COUPDAYBS("2001-01-25"; "2001-11-15"; 1; 4) -> 70 | B8: 70 | C8: of:=[.A8]=[.B8] -> true | D8: of:=FORMULA([.A8]) -> =COUPDAYBS("2001-01-25"; "2001-11-15"; 1; 4)
A9: of:=COUPDAYBS("2001-01-25"; "2001-11-15"; 4; 4) -> 70 | B9: 70 | C9: of:=[.A9]=[.B9] -> true | D9: of:=FORMULA([.A9]) -> =COUPDAYBS("2001-01-25"; "2001-11-15"; 4; 4)
A10: of:=COUPDAYBS("2001-01-25"; "2001-11-15"; -4; 4) ->  | B10: error | C10: of:=ISERROR([.A10]) -> true | D10: of:=FORMULA([.A10]) -> =COUPDAYBS("2001-01-25"; "2001-11-15"; -4; 4) | I10: basis | J10: 0
A11: of:=COUPDAYBS("2001-01-25"; "2001-11-15"; 4; ) -> 70 | B11: 70 | C11: of:=[.A11]=[.B11] -> true | D11: of:=FORMULA([.A11]) -> =COUPDAYBS("2001-01-25"; "2001-11-15"; 4; ) | J11: 1
A12: of:=COUPDAYBS("2001-11-15";"2001-01-25";  4; 1) ->  | B12: error | C12: of:=ISERROR([.A12]) -> true | D12: of:=FORMULA([.A12]) -> =COUPDAYBS("2001-11-15";"2001-01-25";  4; 1) | J12: 2
J13: 3
J14: 4

Sheet: 'file:///home/zdenek/Dokumenty/LO/sc-unit-test/Project%20Calc%20functions%20tests/fods/function_based_test_Example.fods/function_based_test_Example_reference.fods'#Sheet2
H3: 4