Sheet: Sheet1
A1: IRR Function
A3: Result | B3: of:=AND([.B8:.B95]) -> true
A7: Sheet | B7: Result | C7: Description
A8: 1 | B8: of:=AND([Sheet2.C2:.C49]) -> true | C8: Simple IRR formulas with local references and values

Sheet: Sheet2
A1: Function | B1: Expected | C1: Correct | D1: FunctionString | E1: Comment | G1: -10000 | I1: -7500 | J1: -10000 | L1: Data | M1: Description
A2: of:=IRR([.G1:.G4]) -> 0.113321028236252 | B2: 0.113321028236252 | C2: of:=ROUND([.A2];15)=ROUND([.B2];15) -> true | D2: of:=FORMULA([.A2]) -> =IRR(G1:G4) | G2: 3500 | I2: 3000 | J2: 3400 | L2: -70000 | M2: Initial cost of a business
A3: of:=IRR([.G1:.G4];1) -> -1.14534844077746 | B3: -1.14534844077746 | C3: of:=ROUND([.A3];15)=ROUND([.B3];15) -> true | D3: of:=FORMULA([.A3]) -> =IRR(G1:G4,1) | G3: 7600 | I3: 5000 | J3: 6500 | L3: 12000 | M3: Net income for the first year
A4: of:=IRR([.I1:.I5]) -> 0.276668412777335 | B4: 0.276668412777335 | C4: of:=ROUND([.A4];15)=ROUND([.B4];15) -> true | D4: of:=FORMULA([.A4]) -> =IRR(I1:I5) | G4: 1000 | I4: 1200 | J4: 1000 | L4: 15000 | M4: Net income for the second year
A5: of:=IRR([.J1:.J4]) -> 0.0498584737429534 | B5: 0.0498584737429534 | C5: of:=ROUND([.A5];15)=ROUND([.B5];15) -> true | D5: of:=FORMULA([.A5]) -> =IRR(J1:J4) | I5: 4000 | L5: 18000 | M5: Net income for the third year
A6: of:=IRR([.L2:.L6]) -> -0.021244848273411 | B6: -0.021244848273411 | C6: of:=ROUND([.A6];15)=ROUND([.B6];15) -> true | D6: of:=FORMULA([.A6]) -> =IRR(L2:L6) | L6: 21000 | M6: Net income for the fourth year
A7: of:=IRR([.L2:.L7]) -> 0.0866309480365316 | B7: 0.0866309480365316 | C7: of:=ROUND([.A7];15)=ROUND([.B7];15) -> true | D7: of:=FORMULA([.A7]) -> =IRR(L2:L7) | L7: 26000 | M7: Net income for the fifth year
A8: of:=IRR([.L2:.L4];-0.1) -> -0.443506941334741 | B8: -0.443506941334741 | C8: of:=ROUND([.A8];15)=ROUND([.B8];15) -> true | D8: of:=FORMULA([.A8]) -> =IRR(L2:L4,-0.1)
A9: of:=IRR(;) ->  | B9: error | C9: of:=ISERROR([.A9]) -> true | D9: of:=FORMULA([.A9]) -> =IRR(,)
A10: of:=IRR(;0.1) ->  | B10: error | C10: of:=ISERROR([.A10]) -> true | D10: of:=FORMULA([.A10]) -> =IRR(,0.1)
A11: of:=IRR() ->  | B11: error | C11: of:=ISERROR([.A11]) -> true | D11: of:=FORMULA([.A11]) -> =IRR()
A12: of:=IRR([bug40460.G11:bug40460.G251];0) -> 0.00377567382285619 | B12: 0.00377567382285619 | C12: of:=[.A12]=[.B12] -> true | D12: of:=FORMULA([.A12]) -> =IRR(bug40460.G11:bug40460.G251,0) | G12: 10
G13: 20
G14: -35
A21: of:=IRR([bug40460.G11:bug40460.G251]) ->  | B21: 0.00377567382285619 | D21: of:=FORMULA([.A21]) -> =IRR(bug40460.G11:bug40460.G251) | E21: Tdf#40460
A22: of:=IRR([.G12:.G13]~[.G14]) ->  | D22: of:=FORMULA([.A22]) -> =IRR(G12:G13~G14) | E22: AOO#118154 enhancement
A23: of:=IRR( {-10000|5000|5000|5000}) ->  | D23: of:=FORMULA([.A23]) -> =IRR( {-10000;5000;5000;5000}) | E23: Tdf#58585 enhancement
E24: IRR Summary: Compute the internal rate of return for a series of cash flows. Syntax: IRR( NumberSequence Values [ ; Number Guess = 0.1 ] ) Returns: Percentage Constraints: None. Semantics: Compute the internal rate of return for a series of cash flows. If provided, Guess is an estimate of the interest rate to start the iterative computation. If omitted, the value 0.1 (10%) is assumed. The result of IRR is the rate at which the NPV() function will return zero with the given values. There is no closed form for IRR. Evaluators may return an approximate solution using an iterative method, in which case the Guess parameter may be used to initialize the iteration. If the evaluator is unable to converge on a solution given a particular Guess, it may return an Error.

Sheet: bug40460
H1: https://bugs.documentfoundation.org/show_bug.cgi?id=40460
C2: PRESTAMO A COSTE AMORTIZADO HIPOTECA NAVE TORRECILLA
H3: LibreOffice gives "Err:523" at cell G11. However, the value 0.3775... is a solution. This solution is found by Gnumeric on the same spreadsheet file. By the way, MS Excel fails as LibreOffice does.
A4: Préstamo: 1,000,000 € | C4: Vencimiento: | D4: Mensual
A5: interés:4,25% | C5: nº de años: 20
A6: Fecha: 30/06/08 | B6: 2010-11-08 | C6: Gtos. Formaliz: 23,772,40 €
C9: C U A D R O D E A M O R T I Z A C I O N | G9: TIR | H9: VAN a TIR interes
A10: Periodo | B10: fecha | C10: cuota | D10: intereses | E10: capital | F10: pte amortiz | G10: of:=IRR([.G11:.G251]) ->  | H10: of:=[.G11]+NPV([.G10];[.G12:.G251]) -> 
A11: 0 | B11: 2010-11-08 | F11: 1000000 | G11: -976227.6 | H11: If 0,00 then OK | I11: -976227.6
A12: 1 | B12: 2010-12-08 | C12: 6192.34 | D12: of:=[.F11]*0.0425/12 -> 3541.66666666667 | E12: of:=[.C12]-[.D12] -> 2650.67333333333 | F12: of:=[.F11]-[.E12] -> 997349.326666667 | G12: 6192.34 | I12: 6192.34
A13: 2 | B13: 2011-01-08 | C13: 6192.34 | D13: of:=[.F12]*0.0425/12 -> 3532.27886527778 | E13: of:=[.C13]-[.D13] -> 2660.06113472222 | F13: of:=[.F12]-[.E13] -> 994689.265531945 | G13: 6192.34 | I13: 6192.34
A14: 3 | B14: 2011-02-08 | C14: 6192.34 | D14: of:=[.F13]*0.0425/12 -> 3522.85781542564 | E14: of:=[.C14]-[.D14] -> 2669.48218457436 | F14: of:=[.F13]-[.E14] -> 992019.78334737 | G14: 6192.34 | I14: 6192.34
A15: 4 | B15: 2011-03-08 | C15: 6192.34 | D15: of:=[.F14]*0.0425/12 -> 3513.40339935527 | E15: of:=[.C15]-[.D15] -> 2678.93660064473 | F15: of:=[.F14]-[.E15] -> 989340.846746725 | G15: 6192.34 | I15: 6192.34
A16: 5 | B16: 2011-04-08 | C16: 6192.34 | D16: of:=[.F15]*0.0425/12 -> 3503.91549889465 | E16: of:=[.C16]-[.D16] -> 2688.42450110535 | F16: of:=[.F15]-[.E16] -> 986652.42224562 | G16: 6192.34 | I16: 6192.34
A17: 6 | B17: 2011-05-08 | C17: 6192.34 | D17: of:=[.F16]*0.0425/12 -> 3494.39399545324 | E17: of:=[.C17]-[.D17] -> 2697.94600454676 | F17: of:=[.F16]-[.E17] -> 983954.476241073 | G17: 6192.34 | I17: 6192.34
A18: 7 | B18: 2011-06-08 | C18: 6192.34 | D18: of:=[.F17]*0.0425/12 -> 3484.83877002047 | E18: of:=[.C18]-[.D18] -> 2707.50122997953 | F18: of:=[.F17]-[.E18] -> 981246.975011094 | G18: 6192.34 | I18: 6192.34
A19: 8 | B19: 2011-07-08 | C19: 6192.34 | D19: of:=[.F18]*0.0425/12 -> 3475.24970316429 | E19: of:=[.C19]-[.D19] -> 2717.09029683571 | F19: of:=[.F18]-[.E19] -> 978529.884714258 | G19: 6192.34 | I19: 6192.34
A20: 9 | B20: 2011-08-08 | C20: 6192.34 | D20: of:=[.F19]*0.0425/12 -> 3465.62667502966 | E20: of:=[.C20]-[.D20] -> 2726.71332497034 | F20: of:=[.F19]-[.E20] -> 975803.171389288 | G20: 6192.34 | I20: 6192.34
A21: 10 | B21: 2011-09-08 | C21: 6192.34 | D21: of:=[.F20]*0.0425/12 -> 3455.96956533706 | E21: of:=[.C21]-[.D21] -> 2736.37043466294 | F21: of:=[.F20]-[.E21] -> 973066.800954625 | G21: 6192.34 | I21: 6192.34
A22: 11 | B22: 2011-10-08 | C22: 6192.34 | D22: of:=[.F21]*0.0425/12 -> 3446.27825338096 | E22: of:=[.C22]-[.D22] -> 2746.06174661904 | F22: of:=[.F21]-[.E22] -> 970320.739208006 | G22: 6192.34 | I22: 6192.34
A23: 12 | B23: 2011-11-08 | C23: 6192.34 | D23: of:=[.F22]*0.0425/12 -> 3436.55261802835 | E23: of:=[.C23]-[.D23] -> 2755.78738197165 | F23: of:=[.F22]-[.E23] -> 967564.951826034 | G23: 6192.34 | I23: 6192.34
A24: 13 | B24: 2011-12-08 | C24: 6192.34 | D24: of:=[.F23]*0.0425/12 -> 3426.7925377172 | E24: of:=[.C24]-[.D24] -> 2765.5474622828 | F24: of:=[.F23]-[.E24] -> 964799.404363751 | G24: 6192.34 | I24: 6192.34
A25: 14 | B25: 2012-01-08 | C25: 6192.34 | D25: of:=[.F24]*0.0425/12 -> 3416.99789045495 | E25: of:=[.C25]-[.D25] -> 2775.34210954505 | F25: of:=[.F24]-[.E25] -> 962024.062254206 | G25: 6192.34 | I25: 6192.34
A26: 15 | B26: 2012-02-08 | C26: 6192.34 | D26: of:=[.F25]*0.0425/12 -> 3407.16855381698 | E26: of:=[.C26]-[.D26] -> 2785.17144618302 | F26: of:=[.F25]-[.E26] -> 959238.890808023 | G26: 6192.34 | I26: 6192.34
A27: 16 | B27: 2012-03-08 | C27: 6192.34 | D27: of:=[.F26]*0.0425/12 -> 3397.30440494508 | E27: of:=[.C27]-[.D27] -> 2795.03559505492 | F27: of:=[.F26]-[.E27] -> 956443.855212968 | G27: 6192.34 | I27: 6192.34
A28: 17 | B28: 2012-04-08 | C28: 6192.34 | D28: of:=[.F27]*0.0425/12 -> 3387.40532054593 | E28: of:=[.C28]-[.D28] -> 2804.93467945407 | F28: of:=[.F27]-[.E28] -> 953638.920533514 | G28: 6192.34 | I28: 6192.34
A29: 18 | B29: 2012-05-08 | C29: 6192.34 | D29: of:=[.F28]*0.0425/12 -> 3377.47117688953 | E29: of:=[.C29]-[.D29] -> 2814.86882311047 | F29: of:=[.F28]-[.E29] -> 950824.051710404 | G29: 6192.34 | I29: 6192.34
A30: 19 | B30: 2012-06-08 | C30: 6192.34 | D30: of:=[.F29]*0.0425/12 -> 3367.50184980768 | E30: of:=[.C30]-[.D30] -> 2824.83815019232 | F30: of:=[.F29]-[.E30] -> 947999.213560212 | G30: 6192.34 | I30: 6192.34
A31: 20 | B31: 2012-07-08 | C31: 6192.34 | D31: of:=[.F30]*0.0425/12 -> 3357.49721469242 | E31: of:=[.C31]-[.D31] -> 2834.84278530758 | F31: of:=[.F30]-[.E31] -> 945164.370774904 | G31: 6192.34 | I31: 6192.34
A32: 21 | B32: 2012-08-08 | C32: 6192.34 | D32: of:=[.F31]*0.0425/12 -> 3347.45714649445 | E32: of:=[.C32]-[.D32] -> 2844.88285350555 | F32: of:=[.F31]-[.E32] -> 942319.487921398 | G32: 6192.34 | I32: 6192.34
A33: 22 | B33: 2012-09-08 | C33: 6192.34 | D33: of:=[.F32]*0.0425/12 -> 3337.38151972162 | E33: of:=[.C33]-[.D33] -> 2854.95848027838 | F33: of:=[.F32]-[.E33] -> 939464.52944112 | G33: 6192.34 | I33: 6192.34
A34: 23 | B34: 2012-10-08 | C34: 6192.34 | D34: of:=[.F33]*0.0425/12 -> 3327.2702084373 | E34: of:=[.C34]-[.D34] -> 2865.0697915627 | F34: of:=[.F33]-[.E34] -> 936599.459649557 | G34: 6192.34 | I34: 6192.34
A35: 24 | B35: 2012-11-08 | C35: 6192.34 | D35: of:=[.F34]*0.0425/12 -> 3317.12308625885 | E35: of:=[.C35]-[.D35] -> 2875.21691374115 | F35: of:=[.F34]-[.E35] -> 933724.242735816 | G35: 6192.34 | I35: 6192.34
A36: 25 | B36: 2012-12-08 | C36: 6192.34 | D36: of:=[.F35]*0.0425/12 -> 3306.94002635602 | E36: of:=[.C36]-[.D36] -> 2885.39997364398 | F36: of:=[.F35]-[.E36] -> 930838.842762172 | G36: 6192.34 | I36: 6192.34
A37: 26 | B37: 2013-01-08 | C37: 6192.34 | D37: of:=[.F36]*0.0425/12 -> 3296.72090144936 | E37: of:=[.C37]-[.D37] -> 2895.61909855064 | F37: of:=[.F36]-[.E37] -> 927943.223663621 | G37: 6192.34 | I37: 6192.34
A38: 27 | B38: 2013-02-08 | C38: 6192.34 | D38: of:=[.F37]*0.0425/12 -> 3286.46558380866 | E38: of:=[.C38]-[.D38] -> 2905.87441619134 | F38: of:=[.F37]-[.E38] -> 925037.34924743 | G38: 6192.34 | I38: 6192.34
A39: 28 | B39: 2013-03-08 | C39: 6192.34 | D39: of:=[.F38]*0.0425/12 -> 3276.17394525131 | E39: of:=[.C39]-[.D39] -> 2916.16605474868 | F39: of:=[.F38]-[.E39] -> 922121.183192681 | G39: 6192.34 | I39: 6192.34
A40: 29 | B40: 2013-04-08 | C40: 6192.34 | D40: of:=[.F39]*0.0425/12 -> 3265.84585714075 | E40: of:=[.C40]-[.D40] -> 2926.49414285925 | F40: of:=[.F39]-[.E40] -> 919194.689049822 | G40: 6192.34 | I40: 6192.34
A41: 30 | B41: 2013-05-08 | C41: 6192.34 | D41: of:=[.F40]*0.0425/12 -> 3255.48119038479 | E41: of:=[.C41]-[.D41] -> 2936.85880961521 | F41: of:=[.F40]-[.E41] -> 916257.830240207 | G41: 6192.34 | I41: 6192.34
A42: 31 | B42: 2013-06-08 | C42: 6192.34 | D42: of:=[.F41]*0.0425/12 -> 3245.07981543407 | E42: of:=[.C42]-[.D42] -> 2947.26018456593 | F42: of:=[.F41]-[.E42] -> 913310.570055641 | G42: 6192.34 | I42: 6192.34
A43: 32 | B43: 2013-07-08 | C43: 6192.34 | D43: of:=[.F42]*0.0425/12 -> 3234.6416022804 | E43: of:=[.C43]-[.D43] -> 2957.6983977196 | F43: of:=[.F42]-[.E43] -> 910352.871657921 | G43: 6192.34 | I43: 6192.34
A44: 33 | B44: 2013-08-08 | C44: 6192.34 | D44: of:=[.F43]*0.0425/12 -> 3224.16642045514 | E44: of:=[.C44]-[.D44] -> 2968.17357954486 | F44: of:=[.F43]-[.E44] -> 907384.698078377 | G44: 6192.34 | I44: 6192.34
A45: 34 | B45: 2013-09-08 | C45: 6192.34 | D45: of:=[.F44]*0.0425/12 -> 3213.65413902758 | E45: of:=[.C45]-[.D45] -> 2978.68586097242 | F45: of:=[.F44]-[.E45] -> 904406.012217404 | G45: 6192.34 | I45: 6192.34
A46: 35 | B46: 2013-10-08 | C46: 6192.34 | D46: of:=[.F45]*0.0425/12 -> 3203.10462660331 | E46: of:=[.C46]-[.D46] -> 2989.23537339669 | F46: of:=[.F45]-[.E46] -> 901416.776844008 | G46: 6192.34 | I46: 6192.34
A47: 36 | B47: 2013-11-08 | C47: 6192.34 | D47: of:=[.F46]*0.0425/12 -> 3192.51775132253 | E47: of:=[.C47]-[.D47] -> 2999.82224867747 | F47: of:=[.F46]-[.E47] -> 898416.95459533 | G47: 6192.34 | I47: 6192.34
A48: 37 | B48: 2013-12-08 | C48: 6192.34 | D48: of:=[.F47]*0.0425/12 -> 3181.89338085846 | E48: of:=[.C48]-[.D48] -> 3010.44661914154 | F48: of:=[.F47]-[.E48] -> 895406.507976188 | G48: 6192.34 | I48: 6192.34
A49: 38 | B49: 2014-01-08 | C49: 6192.34 | D49: of:=[.F48]*0.0425/12 -> 3171.23138241567 | E49: of:=[.C49]-[.D49] -> 3021.10861758433 | F49: of:=[.F48]-[.E49] -> 892385.399358604 | G49: 6192.34 | I49: 6192.34
A50: 39 | B50: 2014-02-08 | C50: 6192.34 | D50: of:=[.F49]*0.0425/12 -> 3160.53162272839 | E50: of:=[.C50]-[.D50] -> 3031.80837727161 | F50: of:=[.F49]-[.E50] -> 889353.590981333 | G50: 6192.34 | I50: 6192.34
A51: 40 | B51: 2014-03-08 | C51: 6192.34 | D51: of:=[.F50]*0.0425/12 -> 3149.79396805889 | E51: of:=[.C51]-[.D51] -> 3042.54603194111 | F51: of:=[.F50]-[.E51] -> 886311.044949391 | G51: 6192.34 | I51: 6192.34
A52: 41 | B52: 2014-04-08 | C52: 6192.34 | D52: of:=[.F51]*0.0425/12 -> 3139.01828419576 | E52: of:=[.C52]-[.D52] -> 3053.32171580424 | F52: of:=[.F51]-[.E52] -> 883257.723233587 | G52: 6192.34 | I52: 6192.34
A53: 42 | B53: 2014-05-08 | C53: 6192.34 | D53: of:=[.F52]*0.0425/12 -> 3128.20443645229 | E53: of:=[.C53]-[.D53] -> 3064.13556354771 | F53: of:=[.F52]-[.E53] -> 880193.587670039 | G53: 6192.34 | I53: 6192.34
A54: 43 | B54: 2014-06-08 | C54: 6192.34 | D54: of:=[.F53]*0.0425/12 -> 3117.35228966472 | E54: of:=[.C54]-[.D54] -> 3074.98771033528 | F54: of:=[.F53]-[.E54] -> 877118.599959704 | G54: 6192.34 | I54: 6192.34
A55: 44 | B55: 2014-07-08 | C55: 6192.34 | D55: of:=[.F54]*0.0425/12 -> 3106.46170819062 | E55: of:=[.C55]-[.D55] -> 3085.87829180938 | F55: of:=[.F54]-[.E55] -> 874032.721667895 | G55: 6192.34 | I55: 6192.34
A56: 45 | B56: 2014-08-08 | C56: 6192.34 | D56: of:=[.F55]*0.0425/12 -> 3095.53255590713 | E56: of:=[.C56]-[.D56] -> 3096.80744409287 | F56: of:=[.F55]-[.E56] -> 870935.914223802 | G56: 6192.34 | I56: 6192.34
A57: 46 | B57: 2014-09-08 | C57: 6192.34 | D57: of:=[.F56]*0.0425/12 -> 3084.5646962093 | E57: of:=[.C57]-[.D57] -> 3107.7753037907 | F57: of:=[.F56]-[.E57] -> 867828.138920011 | G57: 6192.34 | I57: 6192.34
A58: 47 | B58: 2014-10-08 | C58: 6192.34 | D58: of:=[.F57]*0.0425/12 -> 3073.55799200837 | E58: of:=[.C58]-[.D58] -> 3118.78200799163 | F58: of:=[.F57]-[.E58] -> 864709.35691202 | G58: 6192.34 | I58: 6192.34
A59: 48 | B59: 2014-11-08 | C59: 6192.34 | D59: of:=[.F58]*0.0425/12 -> 3062.51230573007 | E59: of:=[.C59]-[.D59] -> 3129.82769426993 | F59: of:=[.F58]-[.E59] -> 861579.52921775 | G59: 6192.34 | I59: 6192.34
A60: 49 | B60: 2014-12-08 | C60: 6192.34 | D60: of:=[.F59]*0.0425/12 -> 3051.42749931286 | E60: of:=[.C60]-[.D60] -> 3140.91250068714 | F60: of:=[.F59]-[.E60] -> 858438.616717063 | G60: 6192.34 | I60: 6192.34
A61: 50 | B61: 2015-01-08 | C61: 6192.34 | D61: of:=[.F60]*0.0425/12 -> 3040.30343420626 | E61: of:=[.C61]-[.D61] -> 3152.03656579374 | F61: of:=[.F60]-[.E61] -> 855286.580151269 | G61: 6192.34 | I61: 6192.34
A62: 51 | B62: 2015-02-08 | C62: 6192.34 | D62: of:=[.F61]*0.0425/12 -> 3029.13997136908 | E62: of:=[.C62]-[.D62] -> 3163.20002863092 | F62: of:=[.F61]-[.E62] -> 852123.380122638 | G62: 6192.34 | I62: 6192.34
A63: 52 | B63: 2015-03-08 | C63: 6192.34 | D63: of:=[.F62]*0.0425/12 -> 3017.93697126768 | E63: of:=[.C63]-[.D63] -> 3174.40302873232 | F63: of:=[.F62]-[.E63] -> 848948.977093906 | G63: 6192.34 | I63: 6192.34
A64: 53 | B64: 2015-04-08 | C64: 6192.34 | D64: of:=[.F63]*0.0425/12 -> 3006.69429387425 | E64: of:=[.C64]-[.D64] -> 3185.64570612575 | F64: of:=[.F63]-[.E64] -> 845763.33138778 | G64: 6192.34 | I64: 6192.34
A65: 54 | B65: 2015-05-08 | C65: 6192.34 | D65: of:=[.F64]*0.0425/12 -> 2995.41179866505 | E65: of:=[.C65]-[.D65] -> 3196.92820133495 | F65: of:=[.F64]-[.E65] -> 842566.403186445 | G65: 6192.34 | I65: 6192.34
A66: 55 | B66: 2015-06-08 | C66: 6192.34 | D66: of:=[.F65]*0.0425/12 -> 2984.08934461866 | E66: of:=[.C66]-[.D66] -> 3208.25065538134 | F66: of:=[.F65]-[.E66] -> 839358.152531064 | G66: 6192.34 | I66: 6192.34
A67: 56 | B67: 2015-07-08 | C67: 6192.34 | D67: of:=[.F66]*0.0425/12 -> 2972.72679021418 | E67: of:=[.C67]-[.D67] -> 3219.61320978582 | F67: of:=[.F66]-[.E67] -> 836138.539321278 | G67: 6192.34 | I67: 6192.34
A68: 57 | B68: 2015-08-08 | C68: 6192.34 | D68: of:=[.F67]*0.0425/12 -> 2961.32399342953 | E68: of:=[.C68]-[.D68] -> 3231.01600657047 | F68: of:=[.F67]-[.E68] -> 832907.523314707 | G68: 6192.34 | I68: 6192.34
A69: 58 | B69: 2015-09-08 | C69: 6192.34 | D69: of:=[.F68]*0.0425/12 -> 2949.88081173959 | E69: of:=[.C69]-[.D69] -> 3242.45918826041 | F69: of:=[.F68]-[.E69] -> 829665.064126447 | G69: 6192.34 | I69: 6192.34
A70: 59 | B70: 2015-10-08 | C70: 6192.34 | D70: of:=[.F69]*0.0425/12 -> 2938.3971021145 | E70: of:=[.C70]-[.D70] -> 3253.9428978855 | F70: of:=[.F69]-[.E70] -> 826411.121228561 | G70: 6192.34 | I70: 6192.34
A71: 60 | B71: 2015-11-08 | C71: 6192.34 | D71: of:=[.F70]*0.0425/12 -> 2926.87272101782 | E71: of:=[.C71]-[.D71] -> 3265.46727898218 | F71: of:=[.F70]-[.E71] -> 823145.653949579 | G71: 6192.34 | I71: 6192.34
A72: 61 | B72: 2015-12-08 | C72: 6192.34 | D72: of:=[.F71]*0.0425/12 -> 2915.30752440476 | E72: of:=[.C72]-[.D72] -> 3277.03247559524 | F72: of:=[.F71]-[.E72] -> 819868.621473984 | G72: 6192.34 | I72: 6192.34
A73: 62 | B73: 2016-01-08 | C73: 6192.34 | D73: of:=[.F72]*0.0425/12 -> 2903.70136772036 | E73: of:=[.C73]-[.D73] -> 3288.63863227964 | F73: of:=[.F72]-[.E73] -> 816579.982841705 | G73: 6192.34 | I73: 6192.34
A74: 63 | B74: 2016-02-08 | C74: 6192.34 | D74: of:=[.F73]*0.0425/12 -> 2892.0541058977 | E74: of:=[.C74]-[.D74] -> 3300.2858941023 | F74: of:=[.F73]-[.E74] -> 813279.696947602 | G74: 6192.34 | I74: 6192.34
A75: 64 | B75: 2016-03-08 | C75: 6192.34 | D75: of:=[.F74]*0.0425/12 -> 2880.36559335609 | E75: of:=[.C75]-[.D75] -> 3311.97440664391 | F75: of:=[.F74]-[.E75] -> 809967.722540958 | G75: 6192.34 | I75: 6192.34
A76: 65 | B76: 2016-04-08 | C76: 6192.34 | D76: of:=[.F75]*0.0425/12 -> 2868.63568399923 | E76: of:=[.C76]-[.D76] -> 3323.70431600077 | F76: of:=[.F75]-[.E76] -> 806644.018224958 | G76: 6192.34 | I76: 6192.34
A77: 66 | B77: 2016-05-08 | C77: 6192.34 | D77: of:=[.F76]*0.0425/12 -> 2856.86423121339 | E77: of:=[.C77]-[.D77] -> 3335.47576878661 | F77: of:=[.F76]-[.E77] -> 803308.542456171 | G77: 6192.34 | I77: 6192.34
A78: 67 | B78: 2016-06-08 | C78: 6192.34 | D78: of:=[.F77]*0.0425/12 -> 2845.05108786561 | E78: of:=[.C78]-[.D78] -> 3347.28891213439 | F78: of:=[.F77]-[.E78] -> 799961.253544037 | G78: 6192.34 | I78: 6192.34
A79: 68 | B79: 2016-07-08 | C79: 6192.34 | D79: of:=[.F78]*0.0425/12 -> 2833.1961063018 | E79: of:=[.C79]-[.D79] -> 3359.1438936982 | F79: of:=[.F78]-[.E79] -> 796602.109650338 | G79: 6192.34 | I79: 6192.34
A80: 69 | B80: 2016-08-08 | C80: 6192.34 | D80: of:=[.F79]*0.0425/12 -> 2821.29913834495 | E80: of:=[.C80]-[.D80] -> 3371.04086165505 | F80: of:=[.F79]-[.E80] -> 793231.068788683 | G80: 6192.34 | I80: 6192.34
A81: 70 | B81: 2016-09-08 | C81: 6192.34 | D81: of:=[.F80]*0.0425/12 -> 2809.36003529325 | E81: of:=[.C81]-[.D81] -> 3382.97996470675 | F81: of:=[.F80]-[.E81] -> 789848.088823977 | G81: 6192.34 | I81: 6192.34
A82: 71 | B82: 2016-10-08 | C82: 6192.34 | D82: of:=[.F81]*0.0425/12 -> 2797.37864791825 | E82: of:=[.C82]-[.D82] -> 3394.96135208175 | F82: of:=[.F81]-[.E82] -> 786453.127471895 | G82: 6192.34 | I82: 6192.34
A83: 72 | B83: 2016-11-08 | C83: 6192.34 | D83: of:=[.F82]*0.0425/12 -> 2785.35482646296 | E83: of:=[.C83]-[.D83] -> 3406.98517353704 | F83: of:=[.F82]-[.E83] -> 783046.142298358 | G83: 6192.34 | I83: 6192.34
A84: 73 | B84: 2016-12-08 | C84: 6192.34 | D84: of:=[.F83]*0.0425/12 -> 2773.28842064002 | E84: of:=[.C84]-[.D84] -> 3419.05157935998 | F84: of:=[.F83]-[.E84] -> 779627.090718998 | G84: 6192.34 | I84: 6192.34
A85: 74 | B85: 2017-01-08 | C85: 6192.34 | D85: of:=[.F84]*0.0425/12 -> 2761.17927962978 | E85: of:=[.C85]-[.D85] -> 3431.16072037022 | F85: of:=[.F84]-[.E85] -> 776195.929998628 | G85: 6192.34 | I85: 6192.34
A86: 75 | B86: 2017-02-08 | C86: 6192.34 | D86: of:=[.F85]*0.0425/12 -> 2749.02725207847 | E86: of:=[.C86]-[.D86] -> 3443.31274792153 | F86: of:=[.F85]-[.E86] -> 772752.617250706 | G86: 6192.34 | I86: 6192.34
A87: 76 | B87: 2017-03-08 | C87: 6192.34 | D87: of:=[.F86]*0.0425/12 -> 2736.83218609625 | E87: of:=[.C87]-[.D87] -> 3455.50781390375 | F87: of:=[.F86]-[.E87] -> 769297.109436802 | G87: 6192.34 | I87: 6192.34
A88: 77 | B88: 2017-04-08 | C88: 6192.34 | D88: of:=[.F87]*0.0425/12 -> 2724.59392925534 | E88: of:=[.C88]-[.D88] -> 3467.74607074466 | F88: of:=[.F87]-[.E88] -> 765829.363366058 | G88: 6192.34 | I88: 6192.34
A89: 78 | B89: 2017-05-08 | C89: 6192.34 | D89: of:=[.F88]*0.0425/12 -> 2712.31232858812 | E89: of:=[.C89]-[.D89] -> 3480.02767141188 | F89: of:=[.F88]-[.E89] -> 762349.335694646 | G89: 6192.34 | I89: 6192.34
A90: 79 | B90: 2017-06-08 | C90: 6192.34 | D90: of:=[.F89]*0.0425/12 -> 2699.9872305852 | E90: of:=[.C90]-[.D90] -> 3492.3527694148 | F90: of:=[.F89]-[.E90] -> 758856.982925231 | G90: 6192.34 | I90: 6192.34
A91: 80 | B91: 2017-07-08 | C91: 6192.34 | D91: of:=[.F90]*0.0425/12 -> 2687.61848119353 | E91: of:=[.C91]-[.D91] -> 3504.72151880647 | F91: of:=[.F90]-[.E91] -> 755352.261406424 | G91: 6192.34 | I91: 6192.34
A92: 81 | B92: 2017-08-08 | C92: 6192.34 | D92: of:=[.F91]*0.0425/12 -> 2675.20592581442 | E92: of:=[.C92]-[.D92] -> 3517.13407418558 | F92: of:=[.F91]-[.E92] -> 751835.127332239 | G92: 6192.34 | I92: 6192.34
A93: 82 | B93: 2017-09-08 | C93: 6192.34 | D93: of:=[.F92]*0.0425/12 -> 2662.74940930168 | E93: of:=[.C93]-[.D93] -> 3529.59059069832 | F93: of:=[.F92]-[.E93] -> 748305.53674154 | G93: 6192.34 | I93: 6192.34
A94: 83 | B94: 2017-10-08 | C94: 6192.34 | D94: of:=[.F93]*0.0425/12 -> 2650.24877595962 | E94: of:=[.C94]-[.D94] -> 3542.09122404038 | F94: of:=[.F93]-[.E94] -> 744763.4455175 | G94: 6192.34 | I94: 6192.34
A95: 84 | B95: 2017-11-08 | C95: 6192.34 | D95: of:=[.F94]*0.0425/12 -> 2637.70386954115 | E95: of:=[.C95]-[.D95] -> 3554.63613045885 | F95: of:=[.F94]-[.E95] -> 741208.809387041 | G95: 6192.34 | I95: 6192.34
A96: 85 | B96: 2017-12-08 | C96: 6192.34 | D96: of:=[.F95]*0.0425/12 -> 2625.11453324577 | E96: of:=[.C96]-[.D96] -> 3567.22546675423 | F96: of:=[.F95]-[.E96] -> 737641.583920287 | G96: 6192.34 | I96: 6192.34
A97: 86 | B97: 2018-01-08 | C97: 6192.34 | D97: of:=[.F96]*0.0425/12 -> 2612.48060971768 | E97: of:=[.C97]-[.D97] -> 3579.85939028232 | F97: of:=[.F96]-[.E97] -> 734061.724530005 | G97: 6192.34 | I97: 6192.34
A98: 87 | B98: 2018-02-08 | C98: 6192.34 | D98: of:=[.F97]*0.0425/12 -> 2599.80194104377 | E98: of:=[.C98]-[.D98] -> 3592.53805895623 | F98: of:=[.F97]-[.E98] -> 730469.186471048 | G98: 6192.34 | I98: 6192.34
A99: 88 | B99: 2018-03-08 | C99: 6192.34 | D99: of:=[.F98]*0.0425/12 -> 2587.07836875163 | E99: of:=[.C99]-[.D99] -> 3605.26163124837 | F99: of:=[.F98]-[.E99] -> 726863.9248398 | G99: 6192.34 | I99: 6192.34
A100: 89 | B100: 2018-04-08 | C100: 6192.34 | D100: of:=[.F99]*0.0425/12 -> 2574.30973380763 | E100: of:=[.C100]-[.D100] -> 3618.03026619237 | F100: of:=[.F99]-[.E100] -> 723245.894573608 | G100: 6192.34 | I100: 6192.34
A101: 90 | B101: 2018-05-08 | C101: 6192.34 | D101: of:=[.F100]*0.0425/12 -> 2561.49587661486 | E101: of:=[.C101]-[.D101] -> 3630.84412338514 | F101: of:=[.F100]-[.E101] -> 719615.050450222 | G101: 6192.34 | I101: 6192.34
A102: 91 | B102: 2018-06-08 | C102: 6192.34 | D102: of:=[.F101]*0.0425/12 -> 2548.6366370112 | E102: of:=[.C102]-[.D102] -> 3643.7033629888 | F102: of:=[.F101]-[.E102] -> 715971.347087234 | G102: 6192.34 | I102: 6192.34
A103: 92 | B103: 2018-07-08 | C103: 6192.34 | D103: of:=[.F102]*0.0425/12 -> 2535.73185426729 | E103: of:=[.C103]-[.D103] -> 3656.60814573271 | F103: of:=[.F102]-[.E103] -> 712314.738941501 | G103: 6192.34 | I103: 6192.34
A104: 93 | B104: 2018-08-08 | C104: 6192.34 | D104: of:=[.F103]*0.0425/12 -> 2522.78136708448 | E104: of:=[.C104]-[.D104] -> 3669.55863291552 | F104: of:=[.F103]-[.E104] -> 708645.180308586 | G104: 6192.34 | I104: 6192.34
A105: 94 | B105: 2018-09-08 | C105: 6192.34 | D105: of:=[.F104]*0.0425/12 -> 2509.78501359291 | E105: of:=[.C105]-[.D105] -> 3682.55498640709 | F105: of:=[.F104]-[.E105] -> 704962.625322179 | G105: 6192.34 | I105: 6192.34
A106: 95 | B106: 2018-10-08 | C106: 6192.34 | D106: of:=[.F105]*0.0425/12 -> 2496.74263134938 | E106: of:=[.C106]-[.D106] -> 3695.59736865062 | F106: of:=[.F105]-[.E106] -> 701267.027953528 | G106: 6192.34 | I106: 6192.34
A107: 96 | B107: 2018-11-08 | C107: 6192.34 | D107: of:=[.F106]*0.0425/12 -> 2483.65405733541 | E107: of:=[.C107]-[.D107] -> 3708.68594266459 | F107: of:=[.F106]-[.E107] -> 697558.342010863 | G107: 6192.34 | I107: 6192.34
A108: 97 | B108: 2018-12-08 | C108: 6192.34 | D108: of:=[.F107]*0.0425/12 -> 2470.51912795514 | E108: of:=[.C108]-[.D108] -> 3721.82087204486 | F108: of:=[.F107]-[.E108] -> 693836.521138818 | G108: 6192.34 | I108: 6192.34
A109: 98 | B109: 2019-01-08 | C109: 6192.34 | D109: of:=[.F108]*0.0425/12 -> 2457.33767903332 | E109: of:=[.C109]-[.D109] -> 3735.00232096668 | F109: of:=[.F108]-[.E109] -> 690101.518817852 | G109: 6192.34 | I109: 6192.34
A110: 99 | B110: 2019-02-08 | C110: 6192.34 | D110: of:=[.F109]*0.0425/12 -> 2444.10954581322 | E110: of:=[.C110]-[.D110] -> 3748.23045418678 | F110: of:=[.F109]-[.E110] -> 686353.288363665 | G110: 6192.34 | I110: 6192.34
A111: 100 | B111: 2019-03-08 | C111: 6192.34 | D111: of:=[.F110]*0.0425/12 -> 2430.83456295465 | E111: of:=[.C111]-[.D111] -> 3761.50543704535 | F111: of:=[.F110]-[.E111] -> 682591.78292662 | G111: 6192.34 | I111: 6192.34
A112: 101 | B112: 2019-04-08 | C112: 6192.34 | D112: of:=[.F111]*0.0425/12 -> 2417.51256453178 | E112: of:=[.C112]-[.D112] -> 3774.82743546822 | F112: of:=[.F111]-[.E112] -> 678816.955491151 | G112: 6192.34 | I112: 6192.34
A113: 102 | B113: 2019-05-08 | C113: 6192.34 | D113: of:=[.F112]*0.0425/12 -> 2404.14338403116 | E113: of:=[.C113]-[.D113] -> 3788.19661596884 | F113: of:=[.F112]-[.E113] -> 675028.758875183 | G113: 6192.34 | I113: 6192.34
A114: 103 | B114: 2019-06-08 | C114: 6192.34 | D114: of:=[.F113]*0.0425/12 -> 2390.7268543496 | E114: of:=[.C114]-[.D114] -> 3801.6131456504 | F114: of:=[.F113]-[.E114] -> 671227.145729532 | G114: 6192.34 | I114: 6192.34
A115: 104 | B115: 2019-07-08 | C115: 6192.34 | D115: of:=[.F114]*0.0425/12 -> 2377.26280779209 | E115: of:=[.C115]-[.D115] -> 3815.07719220791 | F115: of:=[.F114]-[.E115] -> 667412.068537324 | G115: 6192.34 | I115: 6192.34
A116: 105 | B116: 2019-08-08 | C116: 6192.34 | D116: of:=[.F115]*0.0425/12 -> 2363.75107606969 | E116: of:=[.C116]-[.D116] -> 3828.58892393031 | F116: of:=[.F115]-[.E116] -> 663583.479613394 | G116: 6192.34 | I116: 6192.34
A117: 106 | B117: 2019-09-08 | C117: 6192.34 | D117: of:=[.F116]*0.0425/12 -> 2350.19149029744 | E117: of:=[.C117]-[.D117] -> 3842.14850970256 | F117: of:=[.F116]-[.E117] -> 659741.331103691 | G117: 6192.34 | I117: 6192.34
A118: 107 | B118: 2019-10-08 | C118: 6192.34 | D118: of:=[.F117]*0.0425/12 -> 2336.58388099224 | E118: of:=[.C118]-[.D118] -> 3855.75611900776 | F118: of:=[.F117]-[.E118] -> 655885.574984684 | G118: 6192.34 | I118: 6192.34
A119: 108 | B119: 2019-11-08 | C119: 6192.34 | D119: of:=[.F118]*0.0425/12 -> 2322.92807807075 | E119: of:=[.C119]-[.D119] -> 3869.41192192925 | F119: of:=[.F118]-[.E119] -> 652016.163062755 | G119: 6192.34 | I119: 6192.34
A120: 109 | B120: 2019-12-08 | C120: 6192.34 | D120: of:=[.F119]*0.0425/12 -> 2309.22391084726 | E120: of:=[.C120]-[.D120] -> 3883.11608915274 | F120: of:=[.F119]-[.E120] -> 648133.046973602 | G120: 6192.34 | I120: 6192.34
A121: 110 | B121: 2020-01-08 | C121: 6192.34 | D121: of:=[.F120]*0.0425/12 -> 2295.47120803151 | E121: of:=[.C121]-[.D121] -> 3896.86879196849 | F121: of:=[.F120]-[.E121] -> 644236.178181633 | G121: 6192.34 | I121: 6192.34
A122: 111 | B122: 2020-02-08 | C122: 6192.34 | D122: of:=[.F121]*0.0425/12 -> 2281.66979772662 | E122: of:=[.C122]-[.D122] -> 3910.67020227338 | F122: of:=[.F121]-[.E122] -> 640325.50797936 | G122: 6192.34 | I122: 6192.34
A123: 112 | B123: 2020-03-08 | C123: 6192.34 | D123: of:=[.F122]*0.0425/12 -> 2267.8195074269 | E123: of:=[.C123]-[.D123] -> 3924.5204925731 | F123: of:=[.F122]-[.E123] -> 636400.987486787 | G123: 6192.34 | I123: 6192.34
A124: 113 | B124: 2020-04-08 | C124: 6192.34 | D124: of:=[.F123]*0.0425/12 -> 2253.9201640157 | E124: of:=[.C124]-[.D124] -> 3938.4198359843 | F124: of:=[.F123]-[.E124] -> 632462.567650802 | G124: 6192.34 | I124: 6192.34
A125: 114 | B125: 2020-05-08 | C125: 6192.34 | D125: of:=[.F124]*0.0425/12 -> 2239.97159376326 | E125: of:=[.C125]-[.D125] -> 3952.36840623674 | F125: of:=[.F124]-[.E125] -> 628510.199244566 | G125: 6192.34 | I125: 6192.34
A126: 115 | B126: 2020-06-08 | C126: 6192.34 | D126: of:=[.F125]*0.0425/12 -> 2225.9736223245 | E126: of:=[.C126]-[.D126] -> 3966.3663776755 | F126: of:=[.F125]-[.E126] -> 624543.83286689 | G126: 6192.34 | I126: 6192.34
A127: 116 | B127: 2020-07-08 | C127: 6192.34 | D127: of:=[.F126]*0.0425/12 -> 2211.9260747369 | E127: of:=[.C127]-[.D127] -> 3980.4139252631 | F127: of:=[.F126]-[.E127] -> 620563.418941627 | G127: 6192.34 | I127: 6192.34
A128: 117 | B128: 2020-08-08 | C128: 6192.34 | D128: of:=[.F127]*0.0425/12 -> 2197.82877541826 | E128: of:=[.C128]-[.D128] -> 3994.51122458174 | F128: of:=[.F127]-[.E128] -> 616568.907717045 | G128: 6192.34 | I128: 6192.34
A129: 118 | B129: 2020-09-08 | C129: 6192.34 | D129: of:=[.F128]*0.0425/12 -> 2183.68154816454 | E129: of:=[.C129]-[.D129] -> 4008.65845183546 | F129: of:=[.F128]-[.E129] -> 612560.24926521 | G129: 6192.34 | I129: 6192.34
A130: 119 | B130: 2020-10-08 | C130: 6192.34 | D130: of:=[.F129]*0.0425/12 -> 2169.48421614762 | E130: of:=[.C130]-[.D130] -> 4022.85578385238 | F130: of:=[.F129]-[.E130] -> 608537.393481358 | G130: 6192.34 | I130: 6192.34
A131: 120 | B131: 2020-11-08 | C131: 6192.34 | D131: of:=[.F130]*0.0425/12 -> 2155.23660191314 | E131: of:=[.C131]-[.D131] -> 4037.10339808686 | F131: of:=[.F130]-[.E131] -> 604500.290083271 | G131: 6192.34 | I131: 6192.34
A132: 121 | B132: 2020-12-08 | C132: 6192.34 | D132: of:=[.F131]*0.0425/12 -> 2140.93852737825 | E132: of:=[.C132]-[.D132] -> 4051.40147262175 | F132: of:=[.F131]-[.E132] -> 600448.888610649 | G132: 6192.34 | I132: 6192.34
A133: 122 | B133: 2021-01-08 | C133: 6192.34 | D133: of:=[.F132]*0.0425/12 -> 2126.58981382938 | E133: of:=[.C133]-[.D133] -> 4065.75018617062 | F133: of:=[.F132]-[.E133] -> 596383.138424478 | G133: 6192.34 | I133: 6192.34
A134: 123 | B134: 2021-02-08 | C134: 6192.34 | D134: of:=[.F133]*0.0425/12 -> 2112.19028192003 | E134: of:=[.C134]-[.D134] -> 4080.14971807997 | F134: of:=[.F133]-[.E134] -> 592302.988706398 | G134: 6192.34 | I134: 6192.34
A135: 124 | B135: 2021-03-08 | C135: 6192.34 | D135: of:=[.F134]*0.0425/12 -> 2097.73975166849 | E135: of:=[.C135]-[.D135] -> 4094.60024833151 | F135: of:=[.F134]-[.E135] -> 588208.388458067 | G135: 6192.34 | I135: 6192.34
A136: 125 | B136: 2021-04-08 | C136: 6192.34 | D136: of:=[.F135]*0.0425/12 -> 2083.23804245565 | E136: of:=[.C136]-[.D136] -> 4109.10195754435 | F136: of:=[.F135]-[.E136] -> 584099.286500523 | G136: 6192.34 | I136: 6192.34
A137: 126 | B137: 2021-05-08 | C137: 6192.34 | D137: of:=[.F136]*0.0425/12 -> 2068.68497302268 | E137: of:=[.C137]-[.D137] -> 4123.65502697732 | F137: of:=[.F136]-[.E137] -> 579975.631473545 | G137: 6192.34 | I137: 6192.34
A138: 127 | B138: 2021-06-08 | C138: 6192.34 | D138: of:=[.F137]*0.0425/12 -> 2054.08036146881 | E138: of:=[.C138]-[.D138] -> 4138.25963853119 | F138: of:=[.F137]-[.E138] -> 575837.371835014 | G138: 6192.34 | I138: 6192.34
A139: 128 | B139: 2021-07-08 | C139: 6192.34 | D139: of:=[.F138]*0.0425/12 -> 2039.42402524901 | E139: of:=[.C139]-[.D139] -> 4152.91597475099 | F139: of:=[.F138]-[.E139] -> 571684.455860263 | G139: 6192.34 | I139: 6192.34
A140: 129 | B140: 2021-08-08 | C140: 6192.34 | D140: of:=[.F139]*0.0425/12 -> 2024.71578117176 | E140: of:=[.C140]-[.D140] -> 4167.62421882823 | F140: of:=[.F139]-[.E140] -> 567516.831641435 | G140: 6192.34 | I140: 6192.34
A141: 130 | B141: 2021-09-08 | C141: 6192.34 | D141: of:=[.F140]*0.0425/12 -> 2009.95544539675 | E141: of:=[.C141]-[.D141] -> 4182.38455460325 | F141: of:=[.F140]-[.E141] -> 563334.447086831 | G141: 6192.34 | I141: 6192.34
A142: 131 | B142: 2021-10-08 | C142: 6192.34 | D142: of:=[.F141]*0.0425/12 -> 1995.14283343253 | E142: of:=[.C142]-[.D142] -> 4197.19716656747 | F142: of:=[.F141]-[.E142] -> 559137.249920264 | G142: 6192.34 | I142: 6192.34
A143: 132 | B143: 2021-11-08 | C143: 6192.34 | D143: of:=[.F142]*0.0425/12 -> 1980.27776013427 | E143: of:=[.C143]-[.D143] -> 4212.06223986573 | F143: of:=[.F142]-[.E143] -> 554925.187680398 | G143: 6192.34 | I143: 6192.34
A144: 133 | B144: 2021-12-08 | C144: 6192.34 | D144: of:=[.F143]*0.0425/12 -> 1965.36003970141 | E144: of:=[.C144]-[.D144] -> 4226.97996029859 | F144: of:=[.F143]-[.E144] -> 550698.2077201 | G144: 6192.34 | I144: 6192.34
A145: 134 | B145: 2022-01-08 | C145: 6192.34 | D145: of:=[.F144]*0.0425/12 -> 1950.38948567535 | E145: of:=[.C145]-[.D145] -> 4241.95051432465 | F145: of:=[.F144]-[.E145] -> 546456.257205775 | G145: 6192.34 | I145: 6192.34
A146: 135 | B146: 2022-02-08 | C146: 6192.34 | D146: of:=[.F145]*0.0425/12 -> 1935.36591093712 | E146: of:=[.C146]-[.D146] -> 4256.97408906288 | F146: of:=[.F145]-[.E146] -> 542199.283116712 | G146: 6192.34 | I146: 6192.34
A147: 136 | B147: 2022-03-08 | C147: 6192.34 | D147: of:=[.F146]*0.0425/12 -> 1920.28912770502 | E147: of:=[.C147]-[.D147] -> 4272.05087229498 | F147: of:=[.F146]-[.E147] -> 537927.232244417 | G147: 6192.34 | I147: 6192.34
A148: 137 | B148: 2022-04-08 | C148: 6192.34 | D148: of:=[.F147]*0.0425/12 -> 1905.15894753231 | E148: of:=[.C148]-[.D148] -> 4287.18105246769 | F148: of:=[.F147]-[.E148] -> 533640.05119195 | G148: 6192.34 | I148: 6192.34
A149: 138 | B149: 2022-05-08 | C149: 6192.34 | D149: of:=[.F148]*0.0425/12 -> 1889.97518130482 | E149: of:=[.C149]-[.D149] -> 4302.36481869518 | F149: of:=[.F148]-[.E149] -> 529337.686373254 | G149: 6192.34 | I149: 6192.34
A150: 139 | B150: 2022-06-08 | C150: 6192.34 | D150: of:=[.F149]*0.0425/12 -> 1874.73763923861 | E150: of:=[.C150]-[.D150] -> 4317.60236076139 | F150: of:=[.F149]-[.E150] -> 525020.084012493 | G150: 6192.34 | I150: 6192.34
A151: 140 | B151: 2022-07-08 | C151: 6192.34 | D151: of:=[.F150]*0.0425/12 -> 1859.44613087758 | E151: of:=[.C151]-[.D151] -> 4332.89386912242 | F151: of:=[.F150]-[.E151] -> 520687.190143371 | G151: 6192.34 | I151: 6192.34
A152: 141 | B152: 2022-08-08 | C152: 6192.34 | D152: of:=[.F151]*0.0425/12 -> 1844.1004650911 | E152: of:=[.C152]-[.D152] -> 4348.2395349089 | F152: of:=[.F151]-[.E152] -> 516338.950608462 | G152: 6192.34 | I152: 6192.34
A153: 142 | B153: 2022-09-08 | C153: 6192.34 | D153: of:=[.F152]*0.0425/12 -> 1828.70045007163 | E153: of:=[.C153]-[.D153] -> 4363.63954992837 | F153: of:=[.F152]-[.E153] -> 511975.311058533 | G153: 6192.34 | I153: 6192.34
A154: 143 | B154: 2022-10-08 | C154: 6192.34 | D154: of:=[.F153]*0.0425/12 -> 1813.24589333231 | E154: of:=[.C154]-[.D154] -> 4379.0941066677 | F154: of:=[.F153]-[.E154] -> 507596.216951866 | G154: 6192.34 | I154: 6192.34
A155: 144 | B155: 2022-11-08 | C155: 6192.34 | D155: of:=[.F154]*0.0425/12 -> 1797.73660170452 | E155: of:=[.C155]-[.D155] -> 4394.60339829548 | F155: of:=[.F154]-[.E155] -> 503201.61355357 | G155: 6192.34 | I155: 6192.34
A156: 145 | B156: 2022-12-08 | C156: 6192.34 | D156: of:=[.F155]*0.0425/12 -> 1782.17238133556 | E156: of:=[.C156]-[.D156] -> 4410.16761866444 | F156: of:=[.F155]-[.E156] -> 498791.445934906 | G156: 6192.34 | I156: 6192.34
A157: 146 | B157: 2023-01-08 | C157: 6192.34 | D157: of:=[.F156]*0.0425/12 -> 1766.55303768612 | E157: of:=[.C157]-[.D157] -> 4425.78696231388 | F157: of:=[.F156]-[.E157] -> 494365.658972592 | G157: 6192.34 | I157: 6192.34
A158: 147 | B158: 2023-02-08 | C158: 6192.34 | D158: of:=[.F157]*0.0425/12 -> 1750.87837552793 | E158: of:=[.C158]-[.D158] -> 4441.46162447207 | F158: of:=[.F157]-[.E158] -> 489924.19734812 | G158: 6192.34 | I158: 6192.34
A159: 148 | B159: 2023-03-08 | C159: 6192.34 | D159: of:=[.F158]*0.0425/12 -> 1735.14819894126 | E159: of:=[.C159]-[.D159] -> 4457.19180105874 | F159: of:=[.F158]-[.E159] -> 485467.005547061 | G159: 6192.34 | I159: 6192.34
A160: 149 | B160: 2023-04-08 | C160: 6192.34 | D160: of:=[.F159]*0.0425/12 -> 1719.36231131251 | E160: of:=[.C160]-[.D160] -> 4472.97768868749 | F160: of:=[.F159]-[.E160] -> 480994.027858373 | G160: 6192.34 | I160: 6192.34
A161: 150 | B161: 2023-05-08 | C161: 6192.34 | D161: of:=[.F160]*0.0425/12 -> 1703.52051533174 | E161: of:=[.C161]-[.D161] -> 4488.81948466826 | F161: of:=[.F160]-[.E161] -> 476505.208373705 | G161: 6192.34 | I161: 6192.34
A162: 151 | B162: 2023-06-08 | C162: 6192.34 | D162: of:=[.F161]*0.0425/12 -> 1687.62261299021 | E162: of:=[.C162]-[.D162] -> 4504.71738700979 | F162: of:=[.F161]-[.E162] -> 472000.490986695 | G162: 6192.34 | I162: 6192.34
A163: 152 | B163: 2023-07-08 | C163: 6192.34 | D163: of:=[.F162]*0.0425/12 -> 1671.66840557788 | E163: of:=[.C163]-[.D163] -> 4520.67159442212 | F163: of:=[.F162]-[.E163] -> 467479.819392273 | G163: 6192.34 | I163: 6192.34
A164: 153 | B164: 2023-08-08 | C164: 6192.34 | D164: of:=[.F163]*0.0425/12 -> 1655.65769368097 | E164: of:=[.C164]-[.D164] -> 4536.68230631903 | F164: of:=[.F163]-[.E164] -> 462943.137085954 | G164: 6192.34 | I164: 6192.34
A165: 154 | B165: 2023-09-08 | C165: 6192.34 | D165: of:=[.F164]*0.0425/12 -> 1639.59027717942 | E165: of:=[.C165]-[.D165] -> 4552.74972282058 | F165: of:=[.F164]-[.E165] -> 458390.387363134 | G165: 6192.34 | I165: 6192.34
A166: 155 | B166: 2023-10-08 | C166: 6192.34 | D166: of:=[.F165]*0.0425/12 -> 1623.46595524443 | E166: of:=[.C166]-[.D166] -> 4568.87404475557 | F166: of:=[.F165]-[.E166] -> 453821.513318378 | G166: 6192.34 | I166: 6192.34
A167: 156 | B167: 2023-11-08 | C167: 6192.34 | D167: of:=[.F166]*0.0425/12 -> 1607.28452633592 | E167: of:=[.C167]-[.D167] -> 4585.05547366408 | F167: of:=[.F166]-[.E167] -> 449236.457844714 | G167: 6192.34 | I167: 6192.34
A168: 157 | B168: 2023-12-08 | C168: 6192.34 | D168: of:=[.F167]*0.0425/12 -> 1591.04578820003 | E168: of:=[.C168]-[.D168] -> 4601.29421179997 | F168: of:=[.F167]-[.E168] -> 444635.163632914 | G168: 6192.34 | I168: 6192.34
A169: 158 | B169: 2024-01-08 | C169: 6192.34 | D169: of:=[.F168]*0.0425/12 -> 1574.74953786657 | E169: of:=[.C169]-[.D169] -> 4617.59046213343 | F169: of:=[.F168]-[.E169] -> 440017.573170781 | G169: 6192.34 | I169: 6192.34
A170: 159 | B170: 2024-02-08 | C170: 6192.34 | D170: of:=[.F169]*0.0425/12 -> 1558.39557164651 | E170: of:=[.C170]-[.D170] -> 4633.94442835349 | F170: of:=[.F169]-[.E170] -> 435383.628742427 | G170: 6192.34 | I170: 6192.34
A171: 160 | B171: 2024-03-08 | C171: 6192.34 | D171: of:=[.F170]*0.0425/12 -> 1541.98368512943 | E171: of:=[.C171]-[.D171] -> 4650.35631487057 | F171: of:=[.F170]-[.E171] -> 430733.272427556 | G171: 6192.34 | I171: 6192.34
A172: 161 | B172: 2024-04-08 | C172: 6192.34 | D172: of:=[.F171]*0.0425/12 -> 1525.51367318093 | E172: of:=[.C172]-[.D172] -> 4666.82632681907 | F172: of:=[.F171]-[.E172] -> 426066.446100737 | G172: 6192.34 | I172: 6192.34
A173: 162 | B173: 2024-05-08 | C173: 6192.34 | D173: of:=[.F172]*0.0425/12 -> 1508.98532994011 | E173: of:=[.C173]-[.D173] -> 4683.35467005989 | F173: of:=[.F172]-[.E173] -> 421383.091430678 | G173: 6192.34 | I173: 6192.34
A174: 163 | B174: 2024-06-08 | C174: 6192.34 | D174: of:=[.F173]*0.0425/12 -> 1492.39844881698 | E174: of:=[.C174]-[.D174] -> 4699.94155118302 | F174: of:=[.F173]-[.E174] -> 416683.149879495 | G174: 6192.34 | I174: 6192.34
A175: 164 | B175: 2024-07-08 | C175: 6192.34 | D175: of:=[.F174]*0.0425/12 -> 1475.75282248988 | E175: of:=[.C175]-[.D175] -> 4716.58717751012 | F175: of:=[.F174]-[.E175] -> 411966.562701984 | G175: 6192.34 | I175: 6192.34
A176: 165 | B176: 2024-08-08 | C176: 6192.34 | D176: of:=[.F175]*0.0425/12 -> 1459.04824290286 | E176: of:=[.C176]-[.D176] -> 4733.29175709714 | F176: of:=[.F175]-[.E176] -> 407233.270944887 | G176: 6192.34 | I176: 6192.34
A177: 166 | B177: 2024-09-08 | C177: 6192.34 | D177: of:=[.F176]*0.0425/12 -> 1442.28450126314 | E177: of:=[.C177]-[.D177] -> 4750.05549873686 | F177: of:=[.F176]-[.E177] -> 402483.21544615 | G177: 6192.34 | I177: 6192.34
A178: 167 | B178: 2024-10-08 | C178: 6192.34 | D178: of:=[.F177]*0.0425/12 -> 1425.46138803845 | E178: of:=[.C178]-[.D178] -> 4766.87861196155 | F178: of:=[.F177]-[.E178] -> 397716.336834189 | G178: 6192.34 | I178: 6192.34
A179: 168 | B179: 2024-11-08 | C179: 6192.34 | D179: of:=[.F178]*0.0425/12 -> 1408.57869295442 | E179: of:=[.C179]-[.D179] -> 4783.76130704558 | F179: of:=[.F178]-[.E179] -> 392932.575527143 | G179: 6192.34 | I179: 6192.34
A180: 169 | B180: 2024-12-08 | C180: 6192.34 | D180: of:=[.F179]*0.0425/12 -> 1391.63620499197 | E180: of:=[.C180]-[.D180] -> 4800.70379500803 | F180: of:=[.F179]-[.E180] -> 388131.871732135 | G180: 6192.34 | I180: 6192.34
A181: 170 | B181: 2025-01-08 | C181: 6192.34 | D181: of:=[.F180]*0.0425/12 -> 1374.63371238465 | E181: of:=[.C181]-[.D181] -> 4817.70628761535 | F181: of:=[.F180]-[.E181] -> 383314.16544452 | G181: 6192.34 | I181: 6192.34
A182: 171 | B182: 2025-02-08 | C182: 6192.34 | D182: of:=[.F181]*0.0425/12 -> 1357.57100261601 | E182: of:=[.C182]-[.D182] -> 4834.76899738399 | F182: of:=[.F181]-[.E182] -> 378479.396447136 | G182: 6192.34 | I182: 6192.34
A183: 172 | B183: 2025-03-08 | C183: 6192.34 | D183: of:=[.F182]*0.0425/12 -> 1340.44786241694 | E183: of:=[.C183]-[.D183] -> 4851.89213758306 | F183: of:=[.F182]-[.E183] -> 373627.504309553 | G183: 6192.34 | I183: 6192.34
A184: 173 | B184: 2025-04-08 | C184: 6192.34 | D184: of:=[.F183]*0.0425/12 -> 1323.264077763 | E184: of:=[.C184]-[.D184] -> 4869.075922237 | F184: of:=[.F183]-[.E184] -> 368758.428387316 | G184: 6192.34 | I184: 6192.34
A185: 174 | B185: 2025-05-08 | C185: 6192.34 | D185: of:=[.F184]*0.0425/12 -> 1306.01943387174 | E185: of:=[.C185]-[.D185] -> 4886.32056612826 | F185: of:=[.F184]-[.E185] -> 363872.107821188 | G185: 6192.34 | I185: 6192.34
A186: 175 | B186: 2025-06-08 | C186: 6192.34 | D186: of:=[.F185]*0.0425/12 -> 1288.71371520004 | E186: of:=[.C186]-[.D186] -> 4903.62628479996 | F186: of:=[.F185]-[.E186] -> 358968.481536388 | G186: 6192.34 | I186: 6192.34
A187: 176 | B187: 2025-07-08 | C187: 6192.34 | D187: of:=[.F186]*0.0425/12 -> 1271.34670544137 | E187: of:=[.C187]-[.D187] -> 4920.99329455863 | F187: of:=[.F186]-[.E187] -> 354047.488241829 | G187: 6192.34 | I187: 6192.34
A188: 177 | B188: 2025-08-08 | C188: 6192.34 | D188: of:=[.F187]*0.0425/12 -> 1253.91818752314 | E188: of:=[.C188]-[.D188] -> 4938.42181247686 | F188: of:=[.F187]-[.E188] -> 349109.066429352 | G188: 6192.34 | I188: 6192.34
A189: 178 | B189: 2025-09-08 | C189: 6192.34 | D189: of:=[.F188]*0.0425/12 -> 1236.42794360396 | E189: of:=[.C189]-[.D189] -> 4955.91205639604 | F189: of:=[.F188]-[.E189] -> 344153.154372956 | G189: 6192.34 | I189: 6192.34
A190: 179 | B190: 2025-10-08 | C190: 6192.34 | D190: of:=[.F189]*0.0425/12 -> 1218.87575507089 | E190: of:=[.C190]-[.D190] -> 4973.46424492911 | F190: of:=[.F189]-[.E190] -> 339179.690128027 | G190: 6192.34 | I190: 6192.34
A191: 180 | B191: 2025-11-08 | C191: 6192.34 | D191: of:=[.F190]*0.0425/12 -> 1201.26140253676 | E191: of:=[.C191]-[.D191] -> 4991.07859746324 | F191: of:=[.F190]-[.E191] -> 334188.611530564 | G191: 6192.34 | I191: 6192.34
A192: 181 | B192: 2025-12-08 | C192: 6192.34 | D192: of:=[.F191]*0.0425/12 -> 1183.58466583741 | E192: of:=[.C192]-[.D192] -> 5008.75533416259 | F192: of:=[.F191]-[.E192] -> 329179.856196401 | G192: 6192.34 | I192: 6192.34
A193: 182 | B193: 2026-01-08 | C193: 6192.34 | D193: of:=[.F192]*0.0425/12 -> 1165.84532402892 | E193: of:=[.C193]-[.D193] -> 5026.49467597108 | F193: of:=[.F192]-[.E193] -> 324153.36152043 | G193: 6192.34 | I193: 6192.34
A194: 183 | B194: 2026-02-08 | C194: 6192.34 | D194: of:=[.F193]*0.0425/12 -> 1148.04315538486 | E194: of:=[.C194]-[.D194] -> 5044.29684461514 | F194: of:=[.F193]-[.E194] -> 319109.064675815 | G194: 6192.34 | I194: 6192.34
A195: 184 | B195: 2026-03-08 | C195: 6192.34 | D195: of:=[.F194]*0.0425/12 -> 1130.17793739351 | E195: of:=[.C195]-[.D195] -> 5062.16206260649 | F195: of:=[.F194]-[.E195] -> 314046.902613208 | G195: 6192.34 | I195: 6192.34
A196: 185 | B196: 2026-04-08 | C196: 6192.34 | D196: of:=[.F195]*0.0425/12 -> 1112.24944675511 | E196: of:=[.C196]-[.D196] -> 5080.09055324489 | F196: of:=[.F195]-[.E196] -> 308966.812059964 | G196: 6192.34 | I196: 6192.34
A197: 186 | B197: 2026-05-08 | C197: 6192.34 | D197: of:=[.F196]*0.0425/12 -> 1094.25745937904 | E197: of:=[.C197]-[.D197] -> 5098.08254062096 | F197: of:=[.F196]-[.E197] -> 303868.729519343 | G197: 6192.34 | I197: 6192.34
A198: 187 | B198: 2026-06-08 | C198: 6192.34 | D198: of:=[.F197]*0.0425/12 -> 1076.20175038101 | E198: of:=[.C198]-[.D198] -> 5116.13824961899 | F198: of:=[.F197]-[.E198] -> 298752.591269724 | G198: 6192.34 | I198: 6192.34
A199: 188 | B199: 2026-07-08 | C199: 6192.34 | D199: of:=[.F198]*0.0425/12 -> 1058.08209408027 | E199: of:=[.C199]-[.D199] -> 5134.25790591973 | F199: of:=[.F198]-[.E199] -> 293618.333363804 | G199: 6192.34 | I199: 6192.34
A200: 189 | B200: 2026-08-08 | C200: 6192.34 | D200: of:=[.F199]*0.0425/12 -> 1039.89826399681 | E200: of:=[.C200]-[.D200] -> 5152.4417360032 | F200: of:=[.F199]-[.E200] -> 288465.891627801 | G200: 6192.34 | I200: 6192.34
A201: 190 | B201: 2026-09-08 | C201: 6192.34 | D201: of:=[.F200]*0.0425/12 -> 1021.65003284846 | E201: of:=[.C201]-[.D201] -> 5170.68996715154 | F201: of:=[.F200]-[.E201] -> 283295.201660649 | G201: 6192.34 | I201: 6192.34
A202: 191 | B202: 2026-10-08 | C202: 6192.34 | D202: of:=[.F201]*0.0425/12 -> 1003.33717254813 | E202: of:=[.C202]-[.D202] -> 5189.00282745187 | F202: of:=[.F201]-[.E202] -> 278106.198833197 | G202: 6192.34 | I202: 6192.34
A203: 192 | B203: 2026-11-08 | C203: 6192.34 | D203: of:=[.F202]*0.0425/12 -> 984.959454200907 | E203: of:=[.C203]-[.D203] -> 5207.38054579909 | F203: of:=[.F202]-[.E203] -> 272898.818287398 | G203: 6192.34 | I203: 6192.34
A204: 193 | B204: 2026-12-08 | C204: 6192.34 | D204: of:=[.F203]*0.0425/12 -> 966.516648101202 | E204: of:=[.C204]-[.D204] -> 5225.8233518988 | F204: of:=[.F203]-[.E204] -> 267672.994935499 | G204: 6192.34 | I204: 6192.34
A205: 194 | B205: 2027-01-08 | C205: 6192.34 | D205: of:=[.F204]*0.0425/12 -> 948.008523729894 | E205: of:=[.C205]-[.D205] -> 5244.33147627011 | F205: of:=[.F204]-[.E205] -> 262428.663459229 | G205: 6192.34 | I205: 6192.34
A206: 195 | B206: 2027-02-08 | C206: 6192.34 | D206: of:=[.F205]*0.0425/12 -> 929.434849751437 | E206: of:=[.C206]-[.D206] -> 5262.90515024856 | F206: of:=[.F205]-[.E206] -> 257165.758308981 | G206: 6192.34 | I206: 6192.34
A207: 196 | B207: 2027-03-08 | C207: 6192.34 | D207: of:=[.F206]*0.0425/12 -> 910.795394010973 | E207: of:=[.C207]-[.D207] -> 5281.54460598903 | F207: of:=[.F206]-[.E207] -> 251884.213702992 | G207: 6192.34 | I207: 6192.34
A208: 197 | B208: 2027-04-08 | C208: 6192.34 | D208: of:=[.F207]*0.0425/12 -> 892.089923531429 | E208: of:=[.C208]-[.D208] -> 5300.25007646857 | F208: of:=[.F207]-[.E208] -> 246583.963626523 | G208: 6192.34 | I208: 6192.34
A209: 198 | B209: 2027-05-08 | C209: 6192.34 | D209: of:=[.F208]*0.0425/12 -> 873.318204510603 | E209: of:=[.C209]-[.D209] -> 5319.0217954894 | F209: of:=[.F208]-[.E209] -> 241264.941831034 | G209: 6192.34 | I209: 6192.34
A210: 199 | B210: 2027-06-08 | C210: 6192.34 | D210: of:=[.F209]*0.0425/12 -> 854.480002318245 | E210: of:=[.C210]-[.D210] -> 5337.85999768176 | F210: of:=[.F209]-[.E210] -> 235927.081833352 | G210: 6192.34 | I210: 6192.34
A211: 200 | B211: 2027-07-08 | C211: 6192.34 | D211: of:=[.F210]*0.0425/12 -> 835.575081493122 | E211: of:=[.C211]-[.D211] -> 5356.76491850688 | F211: of:=[.F210]-[.E211] -> 230570.316914845 | G211: 6192.34 | I211: 6192.34
A212: 201 | B212: 2027-08-08 | C212: 6192.34 | D212: of:=[.F211]*0.0425/12 -> 816.603205740076 | E212: of:=[.C212]-[.D212] -> 5375.73679425992 | F212: of:=[.F211]-[.E212] -> 225194.580120585 | G212: 6192.34 | I212: 6192.34
A213: 202 | B213: 2027-09-08 | C213: 6192.34 | D213: of:=[.F212]*0.0425/12 -> 797.564137927073 | E213: of:=[.C213]-[.D213] -> 5394.77586207293 | F213: of:=[.F212]-[.E213] -> 219799.804258512 | G213: 6192.34 | I213: 6192.34
A214: 203 | B214: 2027-10-08 | C214: 6192.34 | D214: of:=[.F213]*0.0425/12 -> 778.457640082231 | E214: of:=[.C214]-[.D214] -> 5413.88235991777 | F214: of:=[.F213]-[.E214] -> 214385.921898594 | G214: 6192.34 | I214: 6192.34
A215: 204 | B215: 2027-11-08 | C215: 6192.34 | D215: of:=[.F214]*0.0425/12 -> 759.283473390856 | E215: of:=[.C215]-[.D215] -> 5433.05652660914 | F215: of:=[.F214]-[.E215] -> 208952.865371985 | G215: 6192.34 | I215: 6192.34
A216: 205 | B216: 2027-12-08 | C216: 6192.34 | D216: of:=[.F215]*0.0425/12 -> 740.041398192448 | E216: of:=[.C216]-[.D216] -> 5452.29860180755 | F216: of:=[.F215]-[.E216] -> 203500.566770178 | G216: 6192.34 | I216: 6192.34
A217: 206 | B217: 2028-01-08 | C217: 6192.34 | D217: of:=[.F216]*0.0425/12 -> 720.731173977713 | E217: of:=[.C217]-[.D217] -> 5471.60882602229 | F217: of:=[.F216]-[.E217] -> 198028.957944156 | G217: 6192.34 | I217: 6192.34
A218: 207 | B218: 2028-02-08 | C218: 6192.34 | D218: of:=[.F217]*0.0425/12 -> 701.352559385551 | E218: of:=[.C218]-[.D218] -> 5490.98744061445 | F218: of:=[.F217]-[.E218] -> 192537.970503541 | G218: 6192.34 | I218: 6192.34
A219: 208 | B219: 2028-03-08 | C219: 6192.34 | D219: of:=[.F218]*0.0425/12 -> 681.905312200041 | E219: of:=[.C219]-[.D219] -> 5510.43468779996 | F219: of:=[.F218]-[.E219] -> 187027.535815741 | G219: 6192.34 | I219: 6192.34
A220: 209 | B220: 2028-04-08 | C220: 6192.34 | D220: of:=[.F219]*0.0425/12 -> 662.389189347417 | E220: of:=[.C220]-[.D220] -> 5529.95081065258 | F220: of:=[.F219]-[.E220] -> 181497.585005089 | G220: 6192.34 | I220: 6192.34
A221: 210 | B221: 2028-05-08 | C221: 6192.34 | D221: of:=[.F220]*0.0425/12 -> 642.803946893022 | E221: of:=[.C221]-[.D221] -> 5549.53605310698 | F221: of:=[.F220]-[.E221] -> 175948.048951982 | G221: 6192.34 | I221: 6192.34
A222: 211 | B222: 2028-06-08 | C222: 6192.34 | D222: of:=[.F221]*0.0425/12 -> 623.149340038268 | E222: of:=[.C222]-[.D222] -> 5569.19065996173 | F222: of:=[.F221]-[.E222] -> 170378.85829202 | G222: 6192.34 | I222: 6192.34
A223: 212 | B223: 2028-07-08 | C223: 6192.34 | D223: of:=[.F222]*0.0425/12 -> 603.42512311757 | E223: of:=[.C223]-[.D223] -> 5588.91487688243 | F223: of:=[.F222]-[.E223] -> 164789.943415137 | G223: 6192.34 | I223: 6192.34
A224: 213 | B224: 2028-08-08 | C224: 6192.34 | D224: of:=[.F223]*0.0425/12 -> 583.631049595279 | E224: of:=[.C224]-[.D224] -> 5608.70895040472 | F224: of:=[.F223]-[.E224] -> 159181.234464733 | G224: 6192.34 | I224: 6192.34
A225: 214 | B225: 2028-09-08 | C225: 6192.34 | D225: of:=[.F224]*0.0425/12 -> 563.766872062595 | E225: of:=[.C225]-[.D225] -> 5628.57312793741 | F225: of:=[.F224]-[.E225] -> 153552.661336795 | G225: 6192.34 | I225: 6192.34
A226: 215 | B226: 2028-10-08 | C226: 6192.34 | D226: of:=[.F225]*0.0425/12 -> 543.832342234483 | E226: of:=[.C226]-[.D226] -> 5648.50765776552 | F226: of:=[.F225]-[.E226] -> 147904.15367903 | G226: 6192.34 | I226: 6192.34
A227: 216 | B227: 2028-11-08 | C227: 6192.34 | D227: of:=[.F226]*0.0425/12 -> 523.827210946564 | E227: of:=[.C227]-[.D227] -> 5668.51278905344 | F227: of:=[.F226]-[.E227] -> 142235.640889976 | G227: 6192.34 | I227: 6192.34
A228: 217 | B228: 2028-12-08 | C228: 6192.34 | D228: of:=[.F227]*0.0425/12 -> 503.751228152 | E228: of:=[.C228]-[.D228] -> 5688.588771848 | F228: of:=[.F227]-[.E228] -> 136547.052118128 | G228: 6192.34 | I228: 6192.34
A229: 218 | B229: 2029-01-08 | C229: 6192.34 | D229: of:=[.F228]*0.0425/12 -> 483.604142918371 | E229: of:=[.C229]-[.D229] -> 5708.73585708163 | F229: of:=[.F228]-[.E229] -> 130838.316261047 | G229: 6192.34 | I229: 6192.34
A230: 219 | B230: 2029-02-08 | C230: 6192.34 | D230: of:=[.F229]*0.0425/12 -> 463.38570342454 | E230: of:=[.C230]-[.D230] -> 5728.95429657546 | F230: of:=[.F229]-[.E230] -> 125109.361964471 | G230: 6192.34 | I230: 6192.34
A231: 220 | B231: 2029-03-08 | C231: 6192.34 | D231: of:=[.F230]*0.0425/12 -> 443.095656957502 | E231: of:=[.C231]-[.D231] -> 5749.2443430425 | F231: of:=[.F230]-[.E231] -> 119360.117621429 | G231: 6192.34 | I231: 6192.34
A232: 221 | B232: 2029-04-08 | C232: 6192.34 | D232: of:=[.F231]*0.0425/12 -> 422.733749909227 | E232: of:=[.C232]-[.D232] -> 5769.60625009077 | F232: of:=[.F231]-[.E232] -> 113590.511371338 | G232: 6192.34 | I232: 6192.34
A233: 222 | B233: 2029-05-08 | C233: 6192.34 | D233: of:=[.F232]*0.0425/12 -> 402.299727773489 | E233: of:=[.C233]-[.D233] -> 5790.04027222651 | F233: of:=[.F232]-[.E233] -> 107800.471099111 | G233: 6192.34 | I233: 6192.34
A234: 223 | B234: 2029-06-08 | C234: 6192.34 | D234: of:=[.F233]*0.0425/12 -> 381.793335142686 | E234: of:=[.C234]-[.D234] -> 5810.54666485731 | F234: of:=[.F233]-[.E234] -> 101989.924434254 | G234: 6192.34 | I234: 6192.34
A235: 224 | B235: 2029-07-08 | C235: 6192.34 | D235: of:=[.F234]*0.0425/12 -> 361.21431570465 | E235: of:=[.C235]-[.D235] -> 5831.12568429535 | F235: of:=[.F234]-[.E235] -> 96158.7987499588 | G235: 6192.34 | I235: 6192.34
A236: 225 | B236: 2029-08-08 | C236: 6192.34 | D236: of:=[.F235]*0.0425/12 -> 340.562412239437 | E236: of:=[.C236]-[.D236] -> 5851.77758776056 | F236: of:=[.F235]-[.E236] -> 90307.0211621982 | G236: 6192.34 | I236: 6192.34
A237: 226 | B237: 2029-09-08 | C237: 6192.34 | D237: of:=[.F236]*0.0425/12 -> 319.837366616119 | E237: of:=[.C237]-[.D237] -> 5872.50263338388 | F237: of:=[.F236]-[.E237] -> 84434.5185288144 | G237: 6192.34 | I237: 6192.34
A238: 227 | B238: 2029-10-08 | C238: 6192.34 | D238: of:=[.F237]*0.0425/12 -> 299.038919789551 | E238: of:=[.C238]-[.D238] -> 5893.30108021045 | F238: of:=[.F237]-[.E238] -> 78541.2174486039 | G238: 6192.34 | I238: 6192.34
A239: 228 | B239: 2029-11-08 | C239: 6192.34 | D239: of:=[.F238]*0.0425/12 -> 278.166811797139 | E239: of:=[.C239]-[.D239] -> 5914.17318820286 | F239: of:=[.F238]-[.E239] -> 72627.0442604011 | G239: 6192.34 | I239: 6192.34
A240: 229 | B240: 2029-12-08 | C240: 6192.34 | D240: of:=[.F239]*0.0425/12 -> 257.220781755587 | E240: of:=[.C240]-[.D240] -> 5935.11921824441 | F240: of:=[.F239]-[.E240] -> 66691.9250421566 | G240: 6192.34 | I240: 6192.34
A241: 230 | B241: 2030-01-08 | C241: 6192.34 | D241: of:=[.F240]*0.0425/12 -> 236.200567857638 | E241: of:=[.C241]-[.D241] -> 5956.13943214236 | F241: of:=[.F240]-[.E241] -> 60735.7856100143 | G241: 6192.34 | I241: 6192.34
A242: 231 | B242: 2030-02-08 | C242: 6192.34 | D242: of:=[.F241]*0.0425/12 -> 215.105907368801 | E242: of:=[.C242]-[.D242] -> 5977.2340926312 | F242: of:=[.F241]-[.E242] -> 54758.5515173831 | G242: 6192.34 | I242: 6192.34
A243: 232 | B243: 2030-03-08 | C243: 6192.34 | D243: of:=[.F242]*0.0425/12 -> 193.936536624065 | E243: of:=[.C243]-[.D243] -> 5998.40346337593 | F243: of:=[.F242]-[.E243] -> 48760.1480540071 | G243: 6192.34 | I243: 6192.34
A244: 233 | B244: 2030-04-08 | C244: 6192.34 | D244: of:=[.F243]*0.0425/12 -> 172.692191024609 | E244: of:=[.C244]-[.D244] -> 6019.64780897539 | F244: of:=[.F243]-[.E244] -> 42740.5002450317 | G244: 6192.34 | I244: 6192.34
A245: 234 | B245: 2030-05-08 | C245: 6192.34 | D245: of:=[.F244]*0.0425/12 -> 151.372605034487 | E245: of:=[.C245]-[.D245] -> 6040.96739496551 | F245: of:=[.F244]-[.E245] -> 36699.5328500662 | G245: 6192.34 | I245: 6192.34
A246: 235 | B246: 2030-06-08 | C246: 6192.34 | D246: of:=[.F245]*0.0425/12 -> 129.977512177318 | E246: of:=[.C246]-[.D246] -> 6062.36248782268 | F246: of:=[.F245]-[.E246] -> 30637.1703622435 | G246: 6192.34 | I246: 6192.34
A247: 236 | B247: 2030-07-08 | C247: 6192.34 | D247: of:=[.F246]*0.0425/12 -> 108.506645032946 | E247: of:=[.C247]-[.D247] -> 6083.83335496705 | F247: of:=[.F246]-[.E247] -> 24553.3370072765 | G247: 6192.34 | I247: 6192.34
A248: 237 | B248: 2030-08-08 | C248: 6192.34 | D248: of:=[.F247]*0.0425/12 -> 86.9597352341043 | E248: of:=[.C248]-[.D248] -> 6105.3802647659 | F248: of:=[.F247]-[.E248] -> 18447.9567425106 | G248: 6192.34 | I248: 6192.34
A249: 238 | B249: 2030-09-08 | C249: 6192.34 | D249: of:=[.F248]*0.0425/12 -> 65.3365134630584 | E249: of:=[.C249]-[.D249] -> 6127.00348653694 | F249: of:=[.F248]-[.E249] -> 12320.9532559737 | G249: 6192.34 | I249: 6192.34
A250: 239 | B250: 2030-10-08 | C250: 6192.34 | D250: of:=[.F249]*0.0425/12 -> 43.63670944824 | E250: of:=[.C250]-[.D250] -> 6148.70329055176 | F250: of:=[.F249]-[.E250] -> 6172.24996542189 | G250: 6192.34 | I250: 6192.34
A251: 240 | B251: 2030-11-08 | C251: of:=6192.34+1.77 -> 6194.11 | D251: of:=[.F250]*0.0425/12 -> 21.8600519608692 | E251: of:=[.C251]-[.D251] -> 6172.24994803913 | F251: of:=[.F250]-[.E251] -> 0.0000173827629623702 | G251: 6194.11 | I251: 6194.11
C256: C O S T E A M O R T I Z A D O
C257: interés, se usa el TIR = | E257: 0.00331273
A258: Periodo | B258: fecha | C258: cuota | D258: intereses | E258: capital | F258: pte amortiz | G258: C/P | H258: L/P
A259: 0 | B259: 2010-10-28 | F259: 37555.33 | G259: 1971.18 | H259: 35584.15
A260: 1 | B260: 2010-11-28 | C260: 1108.37 | D260: of:=[.F259]*0.331273/100 -> 124.4106683509 | E260: of:=[.C260]-[.D260] -> 983.9593316491 | F260: of:=[.F259]-[.E260] -> 36571.3706683509
A261: 2 | B261: 2010-12-28 | C261: 1108.37 | D261: of:=[.F260]*0.33127/100 -> 121.149979613046 | E261: of:=[.C261]-[.D261] -> 987.220020386954 | F261: of:=[.F260]-[.E261] -> 35584.1506479639 | G261: 12104.85 | H261: 23479.3
A262: 3 | B262: 2011-01-28 | C262: 1108.37 | D262: of:=[.F261]*0.33127/100 -> 117.87961585151 | E262: of:=[.C262]-[.D262] -> 990.49038414849 | F262: of:=[.F261]-[.E262] -> 34593.6602638155
A263: 4 | B263: 2011-02-28 | C263: 1108.37 | D263: of:=[.F262]*0.33127/100 -> 114.598418355941 | E263: of:=[.C263]-[.D263] -> 993.771581644058 | F263: of:=[.F262]-[.E263] -> 33599.8886821714
A264: 5 | B264: 2011-03-28 | C264: 1108.37 | D264: of:=[.F263]*0.33127/100 -> 111.306351237429 | E264: of:=[.C264]-[.D264] -> 997.063648762571 | F264: of:=[.F263]-[.E264] -> 32602.8250334088
A265: 6 | B265: 2011-04-28 | C265: 1108.37 | D265: of:=[.F264]*0.33127/100 -> 108.003378488173 | E265: of:=[.C265]-[.D265] -> 1000.36662151183 | F265: of:=[.F264]-[.E265] -> 31602.458411897
A266: 7 | B266: 2011-05-28 | C266: 1108.37 | D266: of:=[.F265]*0.33127/100 -> 104.689463981091 | E266: of:=[.C266]-[.D266] -> 1003.68053601891 | F266: of:=[.F265]-[.E266] -> 30598.7778758781
A267: 8 | B267: 2011-06-28 | C267: 1108.37 | D267: of:=[.F266]*0.33127/100 -> 101.364571469421 | E267: of:=[.C267]-[.D267] -> 1007.00542853058 | F267: of:=[.F266]-[.E267] -> 29591.7724473475
A268: 9 | B268: 2011-07-28 | C268: 1108.37 | D268: of:=[.F267]*0.33127/100 -> 98.0286645863281 | E268: of:=[.C268]-[.D268] -> 1010.34133541367 | F268: of:=[.F267]-[.E268] -> 28581.4311119338
A269: 10 | B269: 2011-08-28 | C269: 1108.37 | D269: of:=[.F268]*0.33127/100 -> 94.6817068445032 | E269: of:=[.C269]-[.D269] -> 1013.6882931555 | F269: of:=[.F268]-[.E269] -> 27567.7428187783
A270: 11 | B270: 2011-09-28 | C270: 1108.37 | D270: of:=[.F269]*0.33127/100 -> 91.323661635767 | E270: of:=[.C270]-[.D270] -> 1017.04633836423 | F270: of:=[.F269]-[.E270] -> 26550.6964804141
A271: 12 | B271: 2011-10-28 | C271: 1108.37 | D271: of:=[.F270]*0.33127/100 -> 87.9544922306678 | E271: of:=[.C271]-[.D271] -> 1020.41550776933 | F271: of:=[.F270]-[.E271] -> 25530.2809726448
A272: 13 | B272: 2011-11-28 | C272: 1108.37 | D272: of:=[.F271]*0.33127/100 -> 84.5741617780804 | E272: of:=[.C272]-[.D272] -> 1023.79583822192 | F272: of:=[.F271]-[.E272] -> 24506.4851344229
A275: 14 | B275: 2011-12-28 | C275: 1108.37 | D275: of:=[.F272]*0.33127/100 -> 81.1826333048026 | E275: of:=[.C275]-[.D275] -> 1027.1873666952 | F275: of:=[.F272]-[.E275] -> 23479.2977677277 | G275: 12594.91 | H275: 10884.44
A276: 15 | B276: 2012-01-28 | C276: 1108.37 | D276: of:=[.F275]*0.33127/100 -> 77.7798697151514 | E276: of:=[.C276]-[.D276] -> 1030.59013028485 | F276: of:=[.F275]-[.E276] -> 22448.7076374428
A277: 16 | B277: 2012-02-28 | C277: 1108.37 | D277: of:=[.F276]*0.33127/100 -> 74.3658337905568 | E277: of:=[.C277]-[.D277] -> 1034.00416620944 | F277: of:=[.F276]-[.E277] -> 21414.7034712334
A278: 17 | B278: 2012-03-28 | C278: 1108.37 | D278: of:=[.F277]*0.33127/100 -> 70.9404881891548 | E278: of:=[.C278]-[.D278] -> 1037.42951181085 | F278: of:=[.F277]-[.E278] -> 20377.2739594225
A279: 18 | B279: 2012-04-28 | C279: 1108.37 | D279: of:=[.F278]*0.33127/100 -> 67.503795445379 | E279: of:=[.C279]-[.D279] -> 1040.86620455462 | F279: of:=[.F278]-[.E279] -> 19336.4077548679
A280: 19 | B280: 2012-05-28 | C280: 1108.37 | D280: of:=[.F279]*0.33127/100 -> 64.0557179695509 | E280: of:=[.C280]-[.D280] -> 1044.31428203045 | F280: of:=[.F279]-[.E280] -> 18292.0934728375
A281: 20 | B281: 2012-06-28 | C281: 1108.37 | D281: of:=[.F280]*0.33127/100 -> 60.5962180474686 | E281: of:=[.C281]-[.D281] -> 1047.77378195253 | F281: of:=[.F280]-[.E281] -> 17244.3196908849
A282: 21 | B282: 2010-07-28 | C282: 1108.37 | D282: of:=[.F281]*0.33127/100 -> 57.1252578399945 | E282: of:=[.C282]-[.D282] -> 1051.24474216001 | F282: of:=[.F281]-[.E282] -> 16193.0749487249
A283: 22 | B283: 2012-08-28 | C283: 1108.37 | D283: of:=[.F282]*0.33127/100 -> 53.642799382641 | E283: of:=[.C283]-[.D283] -> 1054.72720061736 | F283: of:=[.F282]-[.E283] -> 15138.3477481076
A284: 23 | B284: 2012-09-28 | C284: 1108.37 | D284: of:=[.F283]*0.33127/100 -> 50.1488045851559 | E284: of:=[.C284]-[.D284] -> 1058.22119541484 | F284: of:=[.F283]-[.E284] -> 14080.1265526927
A285: 24 | B285: 2012-10-28 | C285: 1108.37 | D285: of:=[.F284]*0.33127/100 -> 46.6432352311052 | E285: of:=[.C285]-[.D285] -> 1061.72676476889 | F285: of:=[.F284]-[.E285] -> 13018.3997879238
A286: 25 | B286: 2012-11-28 | C286: 1108.37 | D286: of:=[.F285]*0.33127/100 -> 43.1260529774552 | E286: of:=[.C286]-[.D286] -> 1065.24394702254 | F286: of:=[.F285]-[.E286] -> 11953.1558409013
A287: 26 | B287: 2012-12-28 | C287: 1108.37 | D287: of:=[.F286]*0.33127/100 -> 39.5972193541536 | E287: of:=[.C287]-[.D287] -> 1068.77278064585 | F287: of:=[.F286]-[.E287] -> 10884.3830602554 | G287: 10884.38
A288: 27 | B288: 2013-01-28 | C288: 1108.37 | D288: of:=[.F287]*0.33127/100 -> 36.0566957637082 | E288: of:=[.C288]-[.D288] -> 1072.31330423629 | F288: of:=[.F287]-[.E288] -> 9812.06975601913
A289: 28 | B289: 2013-02-28 | C289: 1108.37 | D289: of:=[.F288]*0.33127/100 -> 32.5044434807646 | E289: of:=[.C289]-[.D289] -> 1075.86555651924 | F289: of:=[.F288]-[.E289] -> 8736.2041994999
A290: 29 | B290: 2013-03-28 | C290: 1108.37 | D290: of:=[.F289]*0.33127/100 -> 28.9404236516833 | E290: of:=[.C290]-[.D290] -> 1079.42957634832 | F290: of:=[.F289]-[.E290] -> 7656.77462315158
A291: 30 | B291: 2013-04-28 | C291: 1108.37 | D291: of:=[.F290]*0.33127/100 -> 25.3645972941143 | E291: of:=[.C291]-[.D291] -> 1083.00540270589 | F291: of:=[.F290]-[.E291] -> 6573.7692204457
A292: 31 | B292: 2013-05-28 | C292: 1108.37 | D292: of:=[.F291]*0.33127/100 -> 21.7769252965705 | E292: of:=[.C292]-[.D292] -> 1086.59307470343 | F292: of:=[.F291]-[.E292] -> 5487.17614574227
A293: 32 | B293: 2013-06-28 | C293: 1108.37 | D293: of:=[.F292]*0.33127/100 -> 18.1773684180004 | E293: of:=[.C293]-[.D293] -> 1090.192631582 | F293: of:=[.F292]-[.E293] -> 4396.98351416027
A294: 33 | B294: 2013-07-28 | C294: 1108.37 | D294: of:=[.F293]*0.33127/100 -> 14.5658872873587 | E294: of:=[.C294]-[.D294] -> 1093.80411271264 | F294: of:=[.F293]-[.E294] -> 3303.17940144763
A295: 34 | B295: 2013-08-28 | C295: 1108.37 | D295: of:=[.F294]*0.33127/100 -> 10.9424424031756 | E295: of:=[.C295]-[.D295] -> 1097.42755759682 | F295: of:=[.F294]-[.E295] -> 2205.7518438508
A296: 35 | B296: 2013-09-28 | C296: 1108.37 | D296: of:=[.F295]*0.33127/100 -> 7.30699413312455 | E296: of:=[.C296]-[.D296] -> 1101.06300586688 | F296: of:=[.F295]-[.E296] -> 1104.68883798393
A297: 36 | B297: 2013-10-28 | C297: 1108.37 | D297: of:=[.F296]*0.33127/100 -> 3.65950271358935 | E297: of:=[.C297]-[.D297] -> 1104.71049728641 | F297: of:=[.F296]-[.E297] -> -0.0216593024836129
C300: D I A R I O
A301: 1º concesión préstamo | E301: 2010-10-28
C302: 37555.33 | D302: (570) | E302: a | F302: (170) | G302: 35584.15
F303: (520) | G303: 1971.18
A304: 2º pgo. 1º vencimiento | E304: 2010-11-28
C305: 983.96 | D305: (520) | E305: a
C306: 124.41 | D306: (6623) | E306: a | F306: (570) | G306: 1108.37
A308: 3º pgo. 2º vencimiento | E308: 2010-12-28
C309: 987.22 | D309: (520) | E309: a
C310: 121.15 | D310: (6623) | E310: a | F310: (570) | G310: 1108.37
A312: Reclasificación l/p a c/p | E312: 2010-12-31
C313: 12594.91 | D313: (170) | E313: a | F313: (520) | G313: 12594.91
E314: etc...

Sheet: 'file:///home/zdenek/Dokumenty/LO/sc-unit-test/Project%20Calc%20functions%20tests/fods/function_based_test_Example.fods/function_based_test_Example_reference.fods'#Sheet2
H3: 4