Sheet: Sheet1
A1: ISPMT Function
A3: Result | B3: of:=AND([.B8:.B95]) -> true
A7: Sheet | B7: Result | C7: Description
A8: 1 | B8: of:=AND([Sheet2.C2:.C49]) -> true | C8: Simple ISPMT formulas with local references and values

Sheet: Sheet2
A1: Function | B1: Expected | C1: Correct | D1: FunctionString | E1: Comment | I1: Data | J1: Description | L1: Data | M1: Description
A2: of:=ISPMT(0.05;5;7;15000) -> -214.285714285714 | B2: -214.285714285714 | C2: of:=[.A2]=[.B2] -> true | D2: of:=FORMULA([.A2]) -> =ISPMT(0.05,5,7,15000) | I2: 0.1 | L2: 0.1 | M2: Annual interest rate
A3: of:=ISPMT(0.075/12; 8; 2*12; 5000) -> -20.8333333333333 | B3: -20.8333333333333 | C3: of:=[.A3]=[.B3] -> true | D3: of:=FORMULA([.A3]) -> =ISPMT(0.075/12, 8, 2*12, 5000) | I3: 1 | L3: 1 | M3: Period
A4: of:=ISPMT(0.06/52; 30; 4*52; 8000; 0 ;1) ->  | B4: error | C4: of:=ISERROR([.A4]) -> true | D4: of:=FORMULA([.A4]) -> =ISPMT(0.06/52, 30, 4*52, 8000, 0 ,1) | I4: 3 | L4: 3 | M4: Number of years in the investment
A5: of:=ISPMT(0.0525/1; 4; 10*1; 6500) -> -204.75 | B5: -204.75 | C5: of:=[.A5]=[.B5] -> true | D5: of:=FORMULA([.A5]) -> =ISPMT(0.0525/1, 4, 10*1, 6500) | I5: 8000 | L5: 8000000 | M5: Amount of loan
A6: of:=ISPMT([.I2]/12; [.I3]; [.I4]*12;[.I5]) -> -64.8148148148148 | B6: -64.8148148148148 | C6: of:=[.A6]=[.B6] -> true | D6: of:=FORMULA([.A6]) -> =ISPMT(I2/12, I3, I4*12,I5)
A7: of:=ISPMT([.I2]; 3;[.I4]; [.I5]) -> 0 | B7: 0 | C7: of:=[.A7]=[.B7] -> true | D7: of:=FORMULA([.A7]) -> =ISPMT(I2, 3,I4, I5)
A8: of:=ISPMT(0;5;7;15000) -> -0 | B8: -0 | C8: of:=[.A8]=[.B8] -> true | D8: of:=FORMULA([.A8]) -> =ISPMT(0,5,7,15000)
A9: of:=ISPMT(0.05;0;7;15000) -> -750 | B9: -750 | C9: of:=[.A9]=[.B9] -> true | D9: of:=FORMULA([.A9]) -> =ISPMT(0.05,0,7,15000)
A10: of:=ISPMT(0.05;5;0;15000) ->  | B10: error | C10: of:=ISERROR([.A10]) -> true | D10: of:=FORMULA([.A10]) -> =ISPMT(0.05,5,0,15000)
A11: of:=ISPMT(0.05;5;7;0) -> -0 | B11: -0 | C11: of:=[.A11]=[.B11] -> true | D11: of:=FORMULA([.A11]) -> =ISPMT(0.05,5,7,0)
A12: of:=ISPMT(0.05;5;7;) -> -0 | B12: -0 | C12: of:=[.A12]=[.B12] -> true | D12: of:=FORMULA([.A12]) -> =ISPMT(0.05,5,7,)
A13: of:=ISPMT(0.075/12; 8;2*12; 5000) -> -20.8333333333333 | B13: -20.8333333333333 | C13: of:=[.A13]=[.B13] -> true | D13: of:=FORMULA([.A13]) -> =ISPMT(0.075/12, 8,2*12, 5000)
A14: of:=ISPMT(0.06/52;30; 4*52;8000) -> -7.89940828402367 | B14: -7.89940828402367 | C14: of:=[.A14]=[.B14] -> true | D14: of:=FORMULA([.A14]) -> =ISPMT(0.06/52,30, 4*52,8000)
A15: of:=ISPMT(0.06/52; 30; 4*52; 8000) -> -7.89940828402367 | B15: -7.89940828402367 | C15: of:=[.A15]=[.B15] -> true | D15: of:=FORMULA([.A15]) -> =ISPMT(0.06/52, 30, 4*52, 8000)
A16: of:=ISPMT(0.05;5;7) ->  | B16: error | C16: of:=ISERROR([.A16]) -> true | D16: of:=FORMULA([.A16]) -> =ISPMT(0.05,5,7)
A17: of:=ISPMT(0.05;5;;15000) ->  | B17: error | C17: of:=ISERROR([.A17]) -> true | D17: of:=FORMULA([.A17]) -> =ISPMT(0.05,5,,15000)
A18: of:=ISPMT(0.06/52; 30; 4*52; 8000; ;1) ->  | B18: error | C18: of:=ISERROR([.A18]) -> true | D18: of:=FORMULA([.A18]) -> =ISPMT(0.06/52, 30, 4*52, 8000, ,1)
A19: of:=ISPMT(0.06/52; 30; 4*52; 8000; 0 ) ->  | B19: error | C19: of:=ISERROR([.A19]) -> true | D19: of:=FORMULA([.A19]) -> =ISPMT(0.06/52, 30, 4*52, 8000, 0 )
A20: of:=ISPMT(0.06/52; 30; 4*52; 8000; 0 ;2) ->  | B20: error | C20: of:=ISERROR([.A20]) -> true | D20: of:=FORMULA([.A20]) -> =ISPMT(0.06/52, 30, 4*52, 8000, 0 ,2)
A21: of:=ISPMT(0.06/52; 30; 4*52; 8000; 0 ;-2) ->  | B21: error | C21: of:=ISERROR([.A21]) -> true | D21: of:=FORMULA([.A21]) -> =ISPMT(0.06/52, 30, 4*52, 8000, 0 ,-2)
A22: of:=ISPMT([.L2]/12;[.L3];[.L4]*12;[.L5]) -> -64814.8148148148 | B22: -64814.8148148148 | C22: of:=[.A22]=[.B22] -> true | D22: of:=FORMULA([.A22]) -> =ISPMT(L2/12,L3,L4*12,L5)
A23: of:=ISPMT([.L2];1;[.L4];[.L5]) -> -533333.333333333 | B23: -533333.333333333 | C23: of:=[.A23]=[.B23] -> true | D23: of:=FORMULA([.A23]) -> =ISPMT(L2,1,L4,L5)
A24: of:=ISPMT([.L2];1;[.L4];) -> -0 | B24: 0 | C24: of:=[.A24]=[.B24] -> true | D24: of:=FORMULA([.A24]) -> =ISPMT(L2,1,L4,)
A25: of:=ISPMT([.L2];1;;[.L5]) ->  | B25: error | C25: of:=ISERROR([.A25]) -> true | D25: of:=FORMULA([.A25]) -> =ISPMT(L2,1,,L5)
A26: of:=ISPMT([.L2];;[.L4];[.L5]) -> -800000 | B26: -800000 | C26: of:=[.A26]=[.B26] -> true | D26: of:=FORMULA([.A26]) -> =ISPMT(L2,,L4,L5)
A27: of:=ISPMT([.L2];0;[.L4];[.L5]) -> -800000 | B27: -800000 | C27: of:=[.A27]=[.B27] -> true | D27: of:=FORMULA([.A27]) -> =ISPMT(L2,0,L4,L5)
A28: of:=ISPMT(0;1;[.L4];[.L5]) -> -0 | B28: 0 | C28: of:=[.A28]=[.B28] -> true | D28: of:=FORMULA([.A28]) -> =ISPMT(0,1,L4,L5)
A29: of:=ISPMT(;1;[.L4];[.L5]) -> -0 | B29: 0 | C29: of:=[.A29]=[.B29] -> true | D29: of:=FORMULA([.A29]) -> =ISPMT(,1,L4,L5)
E31: ISPMT Summary: Compute the interest payment of an amortized loan for a given period. Syntax: ISPMT( Number Rate ; Number Period ; Number Nper ; Number Pv ) Returns: Currency Constraints: None. Semantics: Computes the interest payment of an amortized loan for a given period. The parameters are: Rate: the interest rate per period. Period: the period for which the interest is computed Nper: the total number of payment periods. Pv: the amount of the investment

Sheet: 'file:///home/zdenek/Dokumenty/LO/sc-unit-test/Project%20Calc%20functions%20tests/fods/function_based_test_Example.fods/function_based_test_Example_reference.fods'#Sheet2
H3: 4