Sheet: Sheet1
A1: MDURATION Function
A3: Result | B3: of:=AND([.B8:.B95]) -> true
A7: Sheet | B7: Result | C7: Description
A8: 1 | B8: of:=AND([Sheet2.C2:.C49]) -> true | C8: Simple MDURATION formulas with local references and values

Sheet: Sheet2
A1: Function | B1: Expected | C1: Correct | D1: FunctionString | E1: Comment | I1: Data | J1: Description
A2: of:=MDURATION("2001-01-01"; "2006-01-01"; 0.08; 0.09; 2; 3) -> 4.02068710841898 | B2: 4.02068710841898 | C2: of:=[.A2]=[.B2] -> true | D2: of:=FORMULA([.A2]) -> =MDURATION("2001-01-01", "2006-01-01", 0.08, 0.09, 2, 3) | I2: 2008-01-01 | J2: Settlement date
A3: of:=MDURATION([.I2];[.I3];[.I4];[.I5];[.I6];[.I7]) -> 5.73392357705927 | B3: 5.73392357705927 | C3: of:=[.A3]=[.B3] -> true | D3: of:=FORMULA([.A3]) -> =MDURATION(I2,I3,I4,I5,I6,I7) | I3: 2016-01-01 | J3: Maturity date
A4: of:=MDURATION( "2006-01-01";"2001-01-01"; 0.08; 0.09; 2; 3) ->  | B4: error | C4: of:=ISERROR([.A4]) -> true | D4: of:=FORMULA([.A4]) -> =MDURATION( "2006-01-01","2001-01-01", 0.08, 0.09, 2, 3) | I4: 0.08 | J4: Percent coupon
A5: of:=MDURATION("2001-01-01"; "2006-01-01"; -1; 0.09; 2; 3) ->  | B5: error | C5: of:=ISERROR([.A5]) -> true | D5: of:=FORMULA([.A5]) -> =MDURATION("2001-01-01", "2006-01-01", -1, 0.09, 2, 3) | I5: 0.09 | J5: Percent yield
A6: of:=MDURATION("2001-01-01"; "2006-01-01"; 0.08; -0.09; 2; 3) ->  | B6: error | C6: of:=ISERROR([.A6]) -> true | D6: of:=FORMULA([.A6]) -> =MDURATION("2001-01-01", "2006-01-01", 0.08, -0.09, 2, 3) | I6: 2 | J6: Frequency is semiannual (see above)
A7: of:=MDURATION("2001-01-01"; "2006-01-01"; 0.08; 0.09; 1; 3) -> 3.94457330439716 | B7: 3.94457330439716 | C7: of:=[.A7]=[.B7] -> true | D7: of:=FORMULA([.A7]) -> =MDURATION("2001-01-01", "2006-01-01", 0.08, 0.09, 1, 3) | I7: 1 | J7: Actual/actual basis (see above)
A8: of:=MDURATION("2001-01-01"; "2006-01-01"; 0.08; 0.09; 4; 3) -> 4.06028229754139 | B8: 4.06028229754139 | C8: of:=[.A8]=[.B8] -> true | D8: of:=FORMULA([.A8]) -> =MDURATION("2001-01-01", "2006-01-01", 0.08, 0.09, 4, 3)
A9: of:=MDURATION("2001-01-01"; "2006-01-01"; 0.08; 0.09; 5; 3) ->  | B9: error | C9: of:=ISERROR([.A9]) -> true | D9: of:=FORMULA([.A9]) -> =MDURATION("2001-01-01", "2006-01-01", 0.08, 0.09, 5, 3)
A10: of:=MDURATION("2001-01-01"; "2006-01-01"; 0.08; 0.09; 2; 0) -> 4.01806536102434 | B10: 4.01806536102434 | C10: of:=[.A10]=[.B10] -> true | D10: of:=FORMULA([.A10]) -> =MDURATION("2001-01-01", "2006-01-01", 0.08, 0.09, 2, 0)
A11: of:=MDURATION("2001-01-01"; "2006-01-01"; 0.08; 0.09; 2; 1) -> 4.01850211949036 | B11: 4.01850211949036 | C11: of:=[.A11]=[.B11] -> true | D11: of:=FORMULA([.A11]) -> =MDURATION("2001-01-01", "2006-01-01", 0.08, 0.09, 2, 1)
A12: of:=MDURATION("2001-01-01"; "2006-01-01"; 0.08; 0.09; 2; 2) -> 4.08717753539967 | B12: 4.08717753539967 | C12: of:=[.A12]=[.B12] -> true | D12: of:=FORMULA([.A12]) -> =MDURATION("2001-01-01", "2006-01-01", 0.08, 0.09, 2, 2)
A13: of:=MDURATION("2001-01-01"; "2006-01-01"; 0.08; 0.09; 2; 4) -> 4.01806536102434 | B13: 4.01806536102434 | C13: of:=[.A13]=[.B13] -> true | D13: of:=FORMULA([.A13]) -> =MDURATION("2001-01-01", "2006-01-01", 0.08, 0.09, 2, 4)
A14: of:=MDURATION("2001-01-01"; "2006-01-01"; 0.08; 0.09; 2;) -> 4.01806536102434 | B14: 4.01806536102434 | C14: of:=[.A14]=[.B14] -> true | D14: of:=FORMULA([.A14]) -> =MDURATION("2001-01-01", "2006-01-01", 0.08, 0.09, 2,)
A15: of:=MDURATION("2001-01-01"; "2006-01-01"; 0.08; 0.09; 2) -> 4.01806536102434 | B15: 4.01806536102434 | C15: of:=[.A15]=[.B15] -> true | D15: of:=FORMULA([.A15]) -> =MDURATION("2001-01-01", "2006-01-01", 0.08, 0.09, 2)
A16: of:=MDURATION("2001-01-01"; "2006-01-01"; 0.08; ; 2; 3) ->  | B16: error | C16: of:=ISERROR([.A16]) -> true | D16: of:=FORMULA([.A16]) -> =MDURATION("2001-01-01", "2006-01-01", 0.08, , 2, 3)
A17: of:=MDURATION("2001-01-01"; "2006-01-01"; 0.08; 0.09; ; 3) ->  | B17: error | C17: of:=ISERROR([.A17]) -> true | D17: of:=FORMULA([.A17]) -> =MDURATION("2001-01-01", "2006-01-01", 0.08, 0.09, , 3)
A18: of:=MDURATION("2001-01-01"; "2006-01-01"; ; 0.09; 2; 3) ->  | B18: error | C18: of:=ISERROR([.A18]) -> true | D18: of:=FORMULA([.A18]) -> =MDURATION("2001-01-01", "2006-01-01", , 0.09, 2, 3)
A19: of:=MDURATION("2001-01-01"; "2006-01-01"; 0.08;0 ; 2; 3) -> 4.35988258317026 | B19: of:=MDURATION("2001-01-01"; "2006-01-01"; 0.08;0 ; 2; 3) -> 4.35988258317026 | C19: of:=[.A19]=[.B19] -> true | D19: of:=FORMULA([.A19]) -> =MDURATION("2001-01-01", "2006-01-01", 0.08,0 , 2, 3)
A20: of:=MDURATION("2001-01-01"; "2006-01-01";0 ; 0.09; 2; 3) -> 4.78731074260995 | B20: of:=MDURATION("2001-01-01"; "2006-01-01";0 ; 0.09; 2; 3) -> 4.78731074260995 | C20: of:=[.A20]=[.B20] -> true | D20: of:=FORMULA([.A20]) -> =MDURATION("2001-01-01", "2006-01-01",0 , 0.09, 2, 3)

Sheet: 'file:///home/zdenek/Dokumenty/LO/sc-unit-test/Project%20Calc%20functions%20tests/fods/function_based_test_Example.fods/function_based_test_Example_reference.fods'#Sheet2
H3: 4