Sheet: Sheet1
A1: BESSELJ Function
A3: Result | B3: of:=AND([.B8:.B95]) -> true
A7: Sheet | B7: Result | C7: Description
A8: 1 | B8: of:=AND([Sheet2.C2:.C396]) -> true | C8: Simple BESSELJ formulas with local references and values

Sheet: Sheet2
A1: Function | B1: Expected | C1: Correct | D1: FunctionString | E1: Comment | I1: 1.5 | J1: 1 | M1: 1 | N1: 2 | O1: 3 | P1: 4 | Q1: 5 | R1: 6 | S1: 7 | T1: 8 | U1: 9 | V1: 10 | W1: 11 | X1: 12 | Y1: 13
A2: of:=BESSELJ(1.5; 1) -> 0.5579365079101 | B2: 0.5579365079101 | C2: of:=ORG.LIBREOFFICE.ROUNDSIG([.A2];15)=ORG.LIBREOFFICE.ROUNDSIG([.B2];15) -> true | D2: of:=FORMULA([.A2]) -> =BESSELJ(1.5, 1) | I2: 2.5 | J2: 2 | L2: 100
A3: of:=BESSELJ([.I1];[.J1]) -> 0.5579365079101 | B3: 0.5579365079101 | C3: of:=ORG.LIBREOFFICE.ROUNDSIG([.A3];15)=ORG.LIBREOFFICE.ROUNDSIG([.B3];15) -> true | D3: of:=FORMULA([.A3]) -> =BESSELJ(I1,J1) | I3: 3.5 | J3: 3 | L3: 90
A4: of:=BESSELJ([.I2];[.J2]) -> 0.446059058439617 | B4: 0.446059058439617 | C4: of:=ORG.LIBREOFFICE.ROUNDSIG([.A4];15)=ORG.LIBREOFFICE.ROUNDSIG([.B4];15) -> true | D4: of:=FORMULA([.A4]) -> =BESSELJ(I2,J2) | I4: 4.5 | J4: 4 | L4: 80
A5: of:=BESSELJ([.I3];[.J3]) -> 0.386770111716882 | B5: 0.386770111716882 | C5: of:=ORG.LIBREOFFICE.ROUNDSIG([.A5];15)=ORG.LIBREOFFICE.ROUNDSIG([.B5];15) -> true | D5: of:=FORMULA([.A5]) -> =BESSELJ(I3,J3) | I5: 5.5 | J5: 5 | L5: 70
A6: of:=BESSELJ([.I4];[.J4]) -> 0.348422980284095 | B6: 0.348422980284095 | C6: of:=ORG.LIBREOFFICE.ROUNDSIG([.A6];15)=ORG.LIBREOFFICE.ROUNDSIG([.B6];15) -> true | D6: of:=FORMULA([.A6]) -> =BESSELJ(I4,J4) | L6: 60
A7: of:=BESSELJ([.I5];[.J5]) -> 0.320924737147687 | B7: 0.320924737147687 | C7: of:=ORG.LIBREOFFICE.ROUNDSIG([.A7];15)=ORG.LIBREOFFICE.ROUNDSIG([.B7];15) -> true | D7: of:=FORMULA([.A7]) -> =BESSELJ(I5,J5) | L7: 50
A8: of:=BESSELJ([.I6];[.J6]) -> 1 | B8: 1 | C8: of:=ORG.LIBREOFFICE.ROUNDSIG([.A8];15)=ORG.LIBREOFFICE.ROUNDSIG([.B8];15) -> true | D8: of:=FORMULA([.A8]) -> =BESSELJ(I6,J6) | I8: 18.6 | J8: 11 | L8: 40
A9: of:=BESSELJ([.I8:.I12];[.J8:.J12]) -> -0.152175912427928 | B9: -0.152175912427928 | C9: of:=ORG.LIBREOFFICE.ROUNDSIG([.A9];15)=ORG.LIBREOFFICE.ROUNDSIG([.B9];15) -> true | D9: of:=FORMULA([.A9]) -> {=BESSELJ(I8:I12,J8:J12)} | I9: 19.6 | J9: 12 | L9: 31
A10: -0.165693056629604 | B10: -0.165693056629604 | C10: of:=ORG.LIBREOFFICE.ROUNDSIG([.A10];13)=ORG.LIBREOFFICE.ROUNDSIG([.B10];13) -> true | D10: of:=FORMULA([.A10]) -> {=BESSELJ(I8:I12,J8:J12)} | I10: 20.6 | J10: 13 | L10: 30
A11: -0.175385902918068 | B11: -0.175385902918068 | C11: of:=ORG.LIBREOFFICE.ROUNDSIG([.A11];15)=ORG.LIBREOFFICE.ROUNDSIG([.B11];15) -> true | D11: of:=FORMULA([.A11]) -> {=BESSELJ(I8:I12,J8:J12)} | I11: 21.6 | J11: 14 | L11: 29
A12: -0.181923682731076 | B12: -0.181923682731076 | C12: of:=ORG.LIBREOFFICE.ROUNDSIG([.A12];15)=ORG.LIBREOFFICE.ROUNDSIG([.B12];15) -> true | D12: of:=FORMULA([.A12]) -> {=BESSELJ(I8:I12,J8:J12)} | I12: 22.6 | J12: 15 | L12: 28
A13: -0.185874527630435 | B13: -0.185874527630435 | C13: of:=ORG.LIBREOFFICE.ROUNDSIG([.A13];15)=ORG.LIBREOFFICE.ROUNDSIG([.B13];15) -> true | D13: of:=FORMULA([.A13]) -> {=BESSELJ(I8:I12,J8:J12)} | L13: 25
A14: of:=BESSELJ([.$L2];[.M$1]) -> -0.077145352014112 | B14: -0.077145352014112 | C14: of:=ORG.LIBREOFFICE.ROUNDSIG([.A14];15)=ORG.LIBREOFFICE.ROUNDSIG([.B14];15) -> true | D14: of:=FORMULA([.A14]) -> =BESSELJ($L2,M$1) | L14: 20
A15: of:=BESSELJ([.$L3];[.M$1]) -> 0.0799256467088679 | B15: 0.0799256467088679 | C15: of:=ORG.LIBREOFFICE.ROUNDSIG([.A15];15)=ORG.LIBREOFFICE.ROUNDSIG([.B15];15) -> true | D15: of:=FORMULA([.A15]) -> =BESSELJ($L3,M$1) | L15: 15
A16: of:=BESSELJ([.$L4];[.M$1]) -> -0.056057296675713 | B16: -0.056057296675713 | C16: of:=ORG.LIBREOFFICE.ROUNDSIG([.A16];15)=ORG.LIBREOFFICE.ROUNDSIG([.B16];15) -> true | D16: of:=FORMULA([.A16]) -> =BESSELJ($L4,M$1) | L16: 10
A17: of:=BESSELJ([.$L5];[.M$1]) -> 0.00998778878483762 | B17: 0.00998778878483762 | C17: of:=ORG.LIBREOFFICE.ROUNDSIG([.A17];15)=ORG.LIBREOFFICE.ROUNDSIG([.B17];15) -> true | D17: of:=FORMULA([.A17]) -> =BESSELJ($L5,M$1) | L17: 9
A18: of:=BESSELJ([.$L6];[.M$1]) -> 0.0465983837581669 | B18: 0.0465983837581669 | C18: of:=ORG.LIBREOFFICE.ROUNDSIG([.A18];15)=ORG.LIBREOFFICE.ROUNDSIG([.B18];15) -> true | D18: of:=FORMULA([.A18]) -> =BESSELJ($L6,M$1) | L18: 8
A19: of:=BESSELJ([.$L7];[.M$1]) -> -0.0975118281251753 | B19: -0.0975118281251753 | C19: of:=ORG.LIBREOFFICE.ROUNDSIG([.A19];15)=ORG.LIBREOFFICE.ROUNDSIG([.B19];15) -> true | D19: of:=FORMULA([.A19]) -> =BESSELJ($L7,M$1) | L19: 7
A20: of:=BESSELJ([.$L8];[.M$1]) -> 0.126038318037585 | B20: 0.126038318037585 | C20: of:=ORG.LIBREOFFICE.ROUNDSIG([.A20];15)=ORG.LIBREOFFICE.ROUNDSIG([.B20];15) -> true | D20: of:=FORMULA([.A20]) -> =BESSELJ($L8,M$1) | L20: 6
A21: of:=BESSELJ([.$L9];[.M$1]) -> -0.133024316666314 | B21: -0.133024316666314 | C21: of:=ORG.LIBREOFFICE.ROUNDSIG([.A21];15)=ORG.LIBREOFFICE.ROUNDSIG([.B21];15) -> true | D21: of:=FORMULA([.A21]) -> =BESSELJ($L9,M$1) | L21: 5
A22: of:=BESSELJ([.$L10];[.M$1]) -> -0.118751062616623 | B22: -0.118751062616623 | C22: of:=ORG.LIBREOFFICE.ROUNDSIG([.A22];15)=ORG.LIBREOFFICE.ROUNDSIG([.B22];15) -> true | D22: of:=FORMULA([.A22]) -> =BESSELJ($L10,M$1) | L22: 4
A23: of:=BESSELJ([.$L11];[.M$1]) -> 0.00693420455926513 | B23: 0.00693420455926513 | C23: of:=ORG.LIBREOFFICE.ROUNDSIG([.A23];15)=ORG.LIBREOFFICE.ROUNDSIG([.B23];15) -> true | D23: of:=FORMULA([.A23]) -> =BESSELJ($L11,M$1) | L23: 3
A24: of:=BESSELJ([.$L12];[.M$1]) -> 0.130551488335094 | B24: 0.130551488335094 | C24: of:=ORG.LIBREOFFICE.ROUNDSIG([.A24];15)=ORG.LIBREOFFICE.ROUNDSIG([.B24];15) -> true | D24: of:=FORMULA([.A24]) -> =BESSELJ($L12,M$1) | L24: 2
A25: of:=BESSELJ([.$L13];[.M$1]) -> -0.12535024958029 | B25: -0.12535024958029 | C25: of:=ORG.LIBREOFFICE.ROUNDSIG([.A25];15)=ORG.LIBREOFFICE.ROUNDSIG([.B25];15) -> true | D25: of:=FORMULA([.A25]) -> =BESSELJ($L13,M$1) | L25: 1
A26: of:=BESSELJ([.$L14];[.M$1]) -> 0.0668331241758501 | B26: 0.0668331241758501 | C26: of:=ORG.LIBREOFFICE.ROUNDSIG([.A26];15)=ORG.LIBREOFFICE.ROUNDSIG([.B26];15) -> true | D26: of:=FORMULA([.A26]) -> =BESSELJ($L14,M$1)
A27: of:=BESSELJ([.$L15];[.M$1]) -> 0.205104038613523 | B27: 0.205104038613523 | C27: of:=ORG.LIBREOFFICE.ROUNDSIG([.A27];15)=ORG.LIBREOFFICE.ROUNDSIG([.B27];15) -> true | D27: of:=FORMULA([.A27]) -> =BESSELJ($L15,M$1)
A28: of:=BESSELJ([.$L16];[.M$1]) -> 0.0434727461688616 | B28: 0.0434727461688616 | C28: of:=ORG.LIBREOFFICE.ROUNDSIG([.A28];15)=ORG.LIBREOFFICE.ROUNDSIG([.B28];15) -> true | D28: of:=FORMULA([.A28]) -> =BESSELJ($L16,M$1)
A29: of:=BESSELJ([.$L17];[.M$1]) -> 0.245311786573325 | B29: 0.245311786573325 | C29: of:=ORG.LIBREOFFICE.ROUNDSIG([.A29];15)=ORG.LIBREOFFICE.ROUNDSIG([.B29];15) -> true | D29: of:=FORMULA([.A29]) -> =BESSELJ($L17,M$1)
A30: of:=BESSELJ([.$L18];[.M$1]) -> 0.234636346853915 | B30: 0.234636346853915 | C30: of:=ORG.LIBREOFFICE.ROUNDSIG([.A30];15)=ORG.LIBREOFFICE.ROUNDSIG([.B30];15) -> true | D30: of:=FORMULA([.A30]) -> =BESSELJ($L18,M$1)
A31: of:=BESSELJ([.$L19];[.M$1]) -> -0.0046828234823457 | B31: -0.0046828234823457 | C31: of:=ORG.LIBREOFFICE.ROUNDSIG([.A31];15)=ORG.LIBREOFFICE.ROUNDSIG([.B31];15) -> true | D31: of:=FORMULA([.A31]) -> =BESSELJ($L19,M$1)
A32: of:=BESSELJ([.$L20];[.M$1]) -> -0.276683858127566 | B32: -0.276683858127566 | C32: of:=ORG.LIBREOFFICE.ROUNDSIG([.A32];15)=ORG.LIBREOFFICE.ROUNDSIG([.B32];15) -> true | D32: of:=FORMULA([.A32]) -> =BESSELJ($L20,M$1)
A33: of:=BESSELJ([.$L21];[.M$1]) -> -0.327579137591465 | B33: -0.327579137591465 | C33: of:=ORG.LIBREOFFICE.ROUNDSIG([.A33];15)=ORG.LIBREOFFICE.ROUNDSIG([.B33];15) -> true | D33: of:=FORMULA([.A33]) -> =BESSELJ($L21,M$1)
A34: of:=BESSELJ([.$L22];[.M$1]) -> -0.0660433280235491 | B34: -0.0660433280235491 | C34: of:=ORG.LIBREOFFICE.ROUNDSIG([.A34];15)=ORG.LIBREOFFICE.ROUNDSIG([.B34];15) -> true | D34: of:=FORMULA([.A34]) -> =BESSELJ($L22,M$1)
A35: of:=BESSELJ([.$L23];[.M$1]) -> 0.339058958525936 | B35: 0.339058958525936 | C35: of:=ORG.LIBREOFFICE.ROUNDSIG([.A35];15)=ORG.LIBREOFFICE.ROUNDSIG([.B35];15) -> true | D35: of:=FORMULA([.A35]) -> =BESSELJ($L23,M$1)
A36: of:=BESSELJ([.$L24];[.M$1]) -> 0.576724807756874 | B36: 0.576724807756874 | C36: of:=ORG.LIBREOFFICE.ROUNDSIG([.A36];15)=ORG.LIBREOFFICE.ROUNDSIG([.B36];15) -> true | D36: of:=FORMULA([.A36]) -> =BESSELJ($L24,M$1)
A37: of:=BESSELJ([.$L25];[.M$1]) -> 0.440050585744933 | B37: 0.440050585744933 | C37: of:=ORG.LIBREOFFICE.ROUNDSIG([.A37];15)=ORG.LIBREOFFICE.ROUNDSIG([.B37];15) -> true | D37: of:=FORMULA([.A37]) -> =BESSELJ($L25,M$1)
A38: of:=BESSELJ([.$L2];[.N$1]) -> -0.0215287573445057 | B38: -0.0215287573445057 | C38: of:=ORG.LIBREOFFICE.ROUNDSIG([.A38];15)=ORG.LIBREOFFICE.ROUNDSIG([.B38];15) -> true | D38: of:=FORMULA([.A38]) -> =BESSELJ($L2,N$1)
A39: of:=BESSELJ([.$L3];[.N$1]) -> -0.0248538912175502 | B39: -0.0248538912175502 | C39: of:=ORG.LIBREOFFICE.ROUNDSIG([.A39];15)=ORG.LIBREOFFICE.ROUNDSIG([.B39];15) -> true | D39: of:=FORMULA([.A39]) -> =BESSELJ($L3,N$1)
A40: of:=BESSELJ([.$L4];[.N$1]) -> 0.0683407330953173 | B40: 0.0683407330953173 | C40: of:=ORG.LIBREOFFICE.ROUNDSIG([.A40];15)=ORG.LIBREOFFICE.ROUNDSIG([.B40];15) -> true | D40: of:=FORMULA([.A40]) -> =BESSELJ($L4,N$1)
A41: of:=BESSELJ([.$L5];[.N$1]) -> -0.0946233610891609 | B41: -0.0946233610891609 | C41: of:=ORG.LIBREOFFICE.ROUNDSIG([.A41];15)=ORG.LIBREOFFICE.ROUNDSIG([.B41];15) -> true | D41: of:=FORMULA([.A41]) -> =BESSELJ($L5,N$1)
A42: of:=BESSELJ([.$L6];[.N$1]) -> 0.0930250835476677 | B42: 0.0930250835476677 | C42: of:=ORG.LIBREOFFICE.ROUNDSIG([.A42];15)=ORG.LIBREOFFICE.ROUNDSIG([.B42];15) -> true | D42: of:=FORMULA([.A42]) -> =BESSELJ($L6,N$1)
A43: of:=BESSELJ([.$L7];[.N$1]) -> -0.0597128007942591 | B43: -0.0597128007942591 | C43: of:=ORG.LIBREOFFICE.ROUNDSIG([.A43];15)=ORG.LIBREOFFICE.ROUNDSIG([.B43];15) -> true | D43: of:=FORMULA([.A43]) -> =BESSELJ($L7,N$1)
A44: of:=BESSELJ([.$L8];[.N$1]) -> -0.00106497468235817 | B44: -0.00106497468235817 | C44: of:=ORG.LIBREOFFICE.ROUNDSIG([.A44];15)=ORG.LIBREOFFICE.ROUNDSIG([.B44];15) -> true | D44: of:=FORMULA([.A44]) -> =BESSELJ($L8,N$1)
A45: of:=BESSELJ([.$L9];[.N$1]) -> -0.0597903592830139 | B45: -0.0597903592830139 | C45: of:=ORG.LIBREOFFICE.ROUNDSIG([.A45];15)=ORG.LIBREOFFICE.ROUNDSIG([.B45];15) -> true | D45: of:=FORMULA([.A45]) -> =BESSELJ($L9,N$1)
A46: of:=BESSELJ([.$L10];[.N$1]) -> 0.0784512460732655 | B46: 0.0784512460732655 | C46: of:=ORG.LIBREOFFICE.ROUNDSIG([.A46];15)=ORG.LIBREOFFICE.ROUNDSIG([.B46];15) -> true | D46: of:=FORMULA([.A46]) -> =BESSELJ($L10,N$1)
A47: of:=BESSELJ([.$L11];[.N$1]) -> 0.148326985687071 | B47: 0.148326985687071 | C47: of:=ORG.LIBREOFFICE.ROUNDSIG([.A47];15)=ORG.LIBREOFFICE.ROUNDSIG([.B47];15) -> true | D47: of:=FORMULA([.A47]) -> =BESSELJ($L11,N$1)
A48: of:=BESSELJ([.$L12];[.N$1]) -> 0.0824821168586491 | B48: 0.0824821168586491 | C48: of:=ORG.LIBREOFFICE.ROUNDSIG([.A48];15)=ORG.LIBREOFFICE.ROUNDSIG([.B48];15) -> true | D48: of:=FORMULA([.A48]) -> =BESSELJ($L12,N$1)
A49: of:=BESSELJ([.$L13];[.N$1]) -> -0.106294803242381 | B49: -0.106294803242381 | C49: of:=ORG.LIBREOFFICE.ROUNDSIG([.A49];15)=ORG.LIBREOFFICE.ROUNDSIG([.B49];15) -> true | D49: of:=FORMULA([.A49]) -> =BESSELJ($L13,N$1)
A50: of:=BESSELJ([.$L14];[.N$1]) -> -0.160341351922998 | B50: -0.160341351922998 | C50: of:=ORG.LIBREOFFICE.ROUNDSIG([.A50];15)=ORG.LIBREOFFICE.ROUNDSIG([.B50];15) -> true | D50: of:=FORMULA([.A50]) -> =BESSELJ($L14,N$1)
A51: of:=BESSELJ([.$L15];[.N$1]) -> 0.0415716779752504 | B51: 0.0415716779752504 | C51: of:=ORG.LIBREOFFICE.ROUNDSIG([.A51];15)=ORG.LIBREOFFICE.ROUNDSIG([.B51];15) -> true | D51: of:=FORMULA([.A51]) -> =BESSELJ($L15,N$1)
A52: of:=BESSELJ([.$L16];[.N$1]) -> 0.254630313685121 | B52: 0.254630313685121 | C52: of:=ORG.LIBREOFFICE.ROUNDSIG([.A52];15)=ORG.LIBREOFFICE.ROUNDSIG([.B52];15) -> true | D52: of:=FORMULA([.A52]) -> =BESSELJ($L16,N$1)
A53: of:=BESSELJ([.$L17];[.N$1]) -> 0.144847341532504 | B53: 0.144847341532504 | C53: of:=ORG.LIBREOFFICE.ROUNDSIG([.A53];15)=ORG.LIBREOFFICE.ROUNDSIG([.B53];15) -> true | D53: of:=FORMULA([.A53]) -> =BESSELJ($L17,N$1)
A54: of:=BESSELJ([.$L18];[.N$1]) -> -0.112991720424075 | B54: -0.112991720424075 | C54: of:=ORG.LIBREOFFICE.ROUNDSIG([.A54];15)=ORG.LIBREOFFICE.ROUNDSIG([.B54];15) -> true | D54: of:=FORMULA([.A54]) -> =BESSELJ($L18,N$1)
A55: of:=BESSELJ([.$L19];[.N$1]) -> -0.30141722008594 | B55: -0.30141722008594 | C55: of:=ORG.LIBREOFFICE.ROUNDSIG([.A55];15)=ORG.LIBREOFFICE.ROUNDSIG([.B55];15) -> true | D55: of:=FORMULA([.A55]) -> =BESSELJ($L19,N$1)
A56: of:=BESSELJ([.$L20];[.N$1]) -> -0.242873209960186 | B56: -0.242873209960186 | C56: of:=ORG.LIBREOFFICE.ROUNDSIG([.A56];15)=ORG.LIBREOFFICE.ROUNDSIG([.B56];15) -> true | D56: of:=FORMULA([.A56]) -> =BESSELJ($L20,N$1)
A57: of:=BESSELJ([.$L21];[.N$1]) -> 0.0465651162777521 | B57: 0.0465651162777521 | C57: of:=ORG.LIBREOFFICE.ROUNDSIG([.A57];15)=ORG.LIBREOFFICE.ROUNDSIG([.B57];15) -> true | D57: of:=FORMULA([.A57]) -> =BESSELJ($L21,N$1)
A58: of:=BESSELJ([.$L22];[.N$1]) -> 0.364128145852073 | B58: 0.364128145852073 | C58: of:=ORG.LIBREOFFICE.ROUNDSIG([.A58];15)=ORG.LIBREOFFICE.ROUNDSIG([.B58];15) -> true | D58: of:=FORMULA([.A58]) -> =BESSELJ($L22,N$1)
A59: of:=BESSELJ([.$L23];[.N$1]) -> 0.486091260585891 | B59: 0.486091260585891 | C59: of:=ORG.LIBREOFFICE.ROUNDSIG([.A59];15)=ORG.LIBREOFFICE.ROUNDSIG([.B59];15) -> true | D59: of:=FORMULA([.A59]) -> =BESSELJ($L23,N$1)
A60: of:=BESSELJ([.$L24];[.N$1]) -> 0.352834028615638 | B60: 0.352834028615638 | C60: of:=ORG.LIBREOFFICE.ROUNDSIG([.A60];15)=ORG.LIBREOFFICE.ROUNDSIG([.B60];15) -> true | D60: of:=FORMULA([.A60]) -> =BESSELJ($L24,N$1)
A61: of:=BESSELJ([.$L25];[.N$1]) -> 0.1149034849319 | B61: 0.1149034849319 | C61: of:=ORG.LIBREOFFICE.ROUNDSIG([.A61];15)=ORG.LIBREOFFICE.ROUNDSIG([.B61];15) -> true | D61: of:=FORMULA([.A61]) -> =BESSELJ($L25,N$1)
A62: of:=BESSELJ([.$L2];[.O$1]) -> 0.0762842017203317 | B62: 0.0762842017203317 | C62: of:=ORG.LIBREOFFICE.ROUNDSIG([.A62];15)=ORG.LIBREOFFICE.ROUNDSIG([.B62];15) -> true | D62: of:=FORMULA([.A62]) -> =BESSELJ($L2,O$1)
A63: of:=BESSELJ([.$L3];[.O$1]) -> -0.0810302640963146 | B63: -0.0810302640963146 | C63: of:=ORG.LIBREOFFICE.ROUNDSIG([.A63];15)=ORG.LIBREOFFICE.ROUNDSIG([.B63];15) -> true | D63: of:=FORMULA([.A63]) -> =BESSELJ($L3,O$1)
A64: of:=BESSELJ([.$L4];[.O$1]) -> 0.0594743333304783 | B64: 0.0594743333304783 | C64: of:=ORG.LIBREOFFICE.ROUNDSIG([.A64];15)=ORG.LIBREOFFICE.ROUNDSIG([.B64];15) -> true | D64: of:=FORMULA([.A64]) -> =BESSELJ($L4,O$1)
A65: of:=BESSELJ([.$L5];[.O$1]) -> -0.0153948379899336 | B65: -0.0153948379899336 | C65: of:=ORG.LIBREOFFICE.ROUNDSIG([.A65];15)=ORG.LIBREOFFICE.ROUNDSIG([.B65];15) -> true | D65: of:=FORMULA([.A65]) -> =BESSELJ($L5,O$1)
A66: of:=BESSELJ([.$L6];[.O$1]) -> -0.0403967115216558 | B66: -0.0403967115216558 | C66: of:=ORG.LIBREOFFICE.ROUNDSIG([.A66];15)=ORG.LIBREOFFICE.ROUNDSIG([.B66];15) -> true | D66: of:=FORMULA([.A66]) -> =BESSELJ($L6,O$1)
A67: of:=BESSELJ([.$L7];[.O$1]) -> 0.0927348040616347 | B67: 0.0927348040616347 | C67: of:=ORG.LIBREOFFICE.ROUNDSIG([.A67];15)=ORG.LIBREOFFICE.ROUNDSIG([.B67];15) -> true | D67: of:=FORMULA([.A67]) -> =BESSELJ($L7,O$1)
A68: of:=BESSELJ([.$L8];[.O$1]) -> -0.126144815505821 | B68: -0.126144815505821 | C68: of:=ORG.LIBREOFFICE.ROUNDSIG([.A68];15)=ORG.LIBREOFFICE.ROUNDSIG([.B68];15) -> true | D68: of:=FORMULA([.A68]) -> =BESSELJ($L8,O$1)
A69: of:=BESSELJ([.$L9];[.O$1]) -> 0.125309431597538 | B69: 0.125309431597538 | C69: of:=ORG.LIBREOFFICE.ROUNDSIG([.A69];15)=ORG.LIBREOFFICE.ROUNDSIG([.B69];15) -> true | D69: of:=FORMULA([.A69]) -> =BESSELJ($L9,O$1)
A70: of:=BESSELJ([.$L10];[.O$1]) -> 0.129211228759725 | B70: 0.129211228759725 | C70: of:=ORG.LIBREOFFICE.ROUNDSIG([.A70];15)=ORG.LIBREOFFICE.ROUNDSIG([.B70];15) -> true | D70: of:=FORMULA([.A70]) -> =BESSELJ($L10,O$1)
A71: of:=BESSELJ([.$L11];[.O$1]) -> 0.0135246900182618 | B71: 0.0135246900182618 | C71: of:=ORG.LIBREOFFICE.ROUNDSIG([.A71];15)=ORG.LIBREOFFICE.ROUNDSIG([.B71];15) -> true | D71: of:=FORMULA([.A71]) -> =BESSELJ($L11,O$1)
A72: of:=BESSELJ([.$L12];[.O$1]) -> -0.118768328783858 | B72: -0.118768328783858 | C72: of:=ORG.LIBREOFFICE.ROUNDSIG([.A72];15)=ORG.LIBREOFFICE.ROUNDSIG([.B72];15) -> true | D72: of:=FORMULA([.A72]) -> =BESSELJ($L12,O$1)
A73: of:=BESSELJ([.$L13];[.O$1]) -> 0.108343081061509 | B73: 0.108343081061509 | C73: of:=ORG.LIBREOFFICE.ROUNDSIG([.A73];15)=ORG.LIBREOFFICE.ROUNDSIG([.B73];15) -> true | D73: of:=FORMULA([.A73]) -> =BESSELJ($L13,O$1)
A74: of:=BESSELJ([.$L14];[.O$1]) -> -0.0989013945604499 | B74: -0.0989013945604499 | C74: of:=ORG.LIBREOFFICE.ROUNDSIG([.A74];15)=ORG.LIBREOFFICE.ROUNDSIG([.B74];15) -> true | D74: of:=FORMULA([.A74]) -> =BESSELJ($L14,O$1)
A75: of:=BESSELJ([.$L15];[.O$1]) -> -0.194018257820123 | B75: -0.194018257820123 | C75: of:=ORG.LIBREOFFICE.ROUNDSIG([.A75];15)=ORG.LIBREOFFICE.ROUNDSIG([.B75];15) -> true | D75: of:=FORMULA([.A75]) -> =BESSELJ($L15,O$1)
A76: of:=BESSELJ([.$L16];[.O$1]) -> 0.0583793793051869 | B76: 0.0583793793051869 | C76: of:=ORG.LIBREOFFICE.ROUNDSIG([.A76];15)=ORG.LIBREOFFICE.ROUNDSIG([.B76];15) -> true | D76: of:=FORMULA([.A76]) -> =BESSELJ($L16,O$1)
A77: of:=BESSELJ([.$L17];[.O$1]) -> -0.180935190336657 | B77: -0.180935190336657 | C77: of:=ORG.LIBREOFFICE.ROUNDSIG([.A77];15)=ORG.LIBREOFFICE.ROUNDSIG([.B77];15) -> true | D77: of:=FORMULA([.A77]) -> =BESSELJ($L17,O$1)
A78: of:=BESSELJ([.$L18];[.O$1]) -> -0.291132207065952 | B78: -0.291132207065952 | C78: of:=ORG.LIBREOFFICE.ROUNDSIG([.A78];15)=ORG.LIBREOFFICE.ROUNDSIG([.B78];15) -> true | D78: of:=FORMULA([.A78]) -> =BESSELJ($L18,O$1)
A79: of:=BESSELJ([.$L19];[.O$1]) -> -0.167555587995334 | B79: -0.167555587995334 | C79: of:=ORG.LIBREOFFICE.ROUNDSIG([.A79];15)=ORG.LIBREOFFICE.ROUNDSIG([.B79];15) -> true | D79: of:=FORMULA([.A79]) -> =BESSELJ($L19,O$1)
A80: of:=BESSELJ([.$L20];[.O$1]) -> 0.114768384820775 | B80: 0.114768384820775 | C80: of:=ORG.LIBREOFFICE.ROUNDSIG([.A80];15)=ORG.LIBREOFFICE.ROUNDSIG([.B80];15) -> true | D80: of:=FORMULA([.A80]) -> =BESSELJ($L20,O$1)
A81: of:=BESSELJ([.$L21];[.O$1]) -> 0.364831230613667 | B81: 0.364831230613667 | C81: of:=ORG.LIBREOFFICE.ROUNDSIG([.A81];15)=ORG.LIBREOFFICE.ROUNDSIG([.B81];15) -> true | D81: of:=FORMULA([.A81]) -> =BESSELJ($L21,O$1)
A82: of:=BESSELJ([.$L22];[.O$1]) -> 0.430171473875622 | B82: 0.430171473875622 | C82: of:=ORG.LIBREOFFICE.ROUNDSIG([.A82];15)=ORG.LIBREOFFICE.ROUNDSIG([.B82];15) -> true | D82: of:=FORMULA([.A82]) -> =BESSELJ($L22,O$1)
A83: of:=BESSELJ([.$L23];[.O$1]) -> 0.309062722255252 | B83: 0.309062722255252 | C83: of:=ORG.LIBREOFFICE.ROUNDSIG([.A83];15)=ORG.LIBREOFFICE.ROUNDSIG([.B83];15) -> true | D83: of:=FORMULA([.A83]) -> =BESSELJ($L23,O$1)
A84: of:=BESSELJ([.$L24];[.O$1]) -> 0.128943249474402 | B84: 0.128943249474402 | C84: of:=ORG.LIBREOFFICE.ROUNDSIG([.A84];15)=ORG.LIBREOFFICE.ROUNDSIG([.B84];15) -> true | D84: of:=FORMULA([.A84]) -> =BESSELJ($L24,O$1)
A85: of:=BESSELJ([.$L25];[.O$1]) -> 0.0195633539826684 | B85: 0.0195633539826684 | C85: of:=ORG.LIBREOFFICE.ROUNDSIG([.A85];15)=ORG.LIBREOFFICE.ROUNDSIG([.B85];15) -> true | D85: of:=FORMULA([.A85]) -> =BESSELJ($L25,O$1)
A86: of:=BESSELJ([.$L2];[.P$1]) -> 0.0261058094477257 | B86: 0.0261058094477257 | C86: of:=ORG.LIBREOFFICE.ROUNDSIG([.A86];15)=ORG.LIBREOFFICE.ROUNDSIG([.B86];15) -> true | D86: of:=FORMULA([.A86]) -> =BESSELJ($L2,P$1)
A87: of:=BESSELJ([.$L3];[.P$1]) -> 0.0194518736111293 | B87: 0.0194518736111293 | C87: of:=ORG.LIBREOFFICE.ROUNDSIG([.A87];15)=ORG.LIBREOFFICE.ROUNDSIG([.B87];15) -> true | D87: of:=FORMULA([.A87]) -> =BESSELJ($L3,P$1)
A88: of:=BESSELJ([.$L4];[.P$1]) -> -0.0638801580955313 | B88: -0.0638801580955313 | C88: of:=ORG.LIBREOFFICE.ROUNDSIG([.A88];15)=ORG.LIBREOFFICE.ROUNDSIG([.B88];15) -> true | D88: of:=FORMULA([.A88]) -> =BESSELJ($L4,P$1)
A89: of:=BESSELJ([.$L5];[.P$1]) -> 0.0933038035471666 | B89: 0.0933038035471666 | C89: of:=ORG.LIBREOFFICE.ROUNDSIG([.A89];15)=ORG.LIBREOFFICE.ROUNDSIG([.B89];15) -> true | D89: of:=FORMULA([.A89]) -> =BESSELJ($L5,P$1)
A90: of:=BESSELJ([.$L6];[.P$1]) -> -0.0970647546998329 | B90: -0.0970647546998329 | C90: of:=ORG.LIBREOFFICE.ROUNDSIG([.A90];15)=ORG.LIBREOFFICE.ROUNDSIG([.B90];15) -> true | D90: of:=FORMULA([.A90]) -> =BESSELJ($L6,P$1)
A91: of:=BESSELJ([.$L7];[.P$1]) -> 0.0708409772816554 | B91: 0.0708409772816554 | C91: of:=ORG.LIBREOFFICE.ROUNDSIG([.A91];15)=ORG.LIBREOFFICE.ROUNDSIG([.B91];15) -> true | D91: of:=FORMULA([.A91]) -> =BESSELJ($L7,P$1)
A92: of:=BESSELJ([.$L8];[.P$1]) -> -0.0178567476435151 | B92: -0.0178567476435151 | C92: of:=ORG.LIBREOFFICE.ROUNDSIG([.A92];15)=ORG.LIBREOFFICE.ROUNDSIG([.B92];15) -> true | D92: of:=FORMULA([.A92]) -> =BESSELJ($L8,P$1)
A93: of:=BESSELJ([.$L9];[.P$1]) -> 0.0840437976567311 | B93: 0.0840437976567311 | C93: of:=ORG.LIBREOFFICE.ROUNDSIG([.A93];15)=ORG.LIBREOFFICE.ROUNDSIG([.B93];15) -> true | D93: of:=FORMULA([.A93]) -> =BESSELJ($L9,P$1)
A94: of:=BESSELJ([.$L10];[.P$1]) -> -0.0526090003213204 | B94: -0.0526090003213204 | C94: of:=ORG.LIBREOFFICE.ROUNDSIG([.A94];15)=ORG.LIBREOFFICE.ROUNDSIG([.B94];15) -> true | D94: of:=FORMULA([.A94]) -> =BESSELJ($L10,P$1)
A95: of:=BESSELJ([.$L11];[.P$1]) -> -0.145528773959155 | B95: -0.145528773959155 | C95: of:=ORG.LIBREOFFICE.ROUNDSIG([.A95];15)=ORG.LIBREOFFICE.ROUNDSIG([.B95];15) -> true | D95: of:=FORMULA([.A95]) -> =BESSELJ($L11,P$1)
A96: of:=BESSELJ([.$L12];[.P$1]) -> -0.107932473026619 | B96: -0.107932473026619 | C96: of:=ORG.LIBREOFFICE.ROUNDSIG([.A96];15)=ORG.LIBREOFFICE.ROUNDSIG([.B96];15) -> true | D96: of:=FORMULA([.A96]) -> =BESSELJ($L12,P$1)
A97: of:=BESSELJ([.$L13];[.P$1]) -> 0.132297142697144 | B97: 0.132297142697144 | C97: of:=ORG.LIBREOFFICE.ROUNDSIG([.A97];15)=ORG.LIBREOFFICE.ROUNDSIG([.B97];15) -> true | D97: of:=FORMULA([.A97]) -> =BESSELJ($L13,P$1)
A98: of:=BESSELJ([.$L14];[.P$1]) -> 0.130670933554863 | B98: 0.130670933554863 | C98: of:=ORG.LIBREOFFICE.ROUNDSIG([.A98];15)=ORG.LIBREOFFICE.ROUNDSIG([.B98];15) -> true | D98: of:=FORMULA([.A98]) -> =BESSELJ($L14,P$1)
A99: of:=BESSELJ([.$L15];[.P$1]) -> -0.1191789811033 | B99: -0.1191789811033 | C99: of:=ORG.LIBREOFFICE.ROUNDSIG([.A99];15)=ORG.LIBREOFFICE.ROUNDSIG([.B99];15) -> true | D99: of:=FORMULA([.A99]) -> =BESSELJ($L15,P$1)
A100: of:=BESSELJ([.$L16];[.P$1]) -> -0.219602686102009 | B100: -0.219602686102009 | C100: of:=ORG.LIBREOFFICE.ROUNDSIG([.A100];15)=ORG.LIBREOFFICE.ROUNDSIG([.B100];15) -> true | D100: of:=FORMULA([.A100]) -> =BESSELJ($L16,P$1)
A101: of:=BESSELJ([.$L17];[.P$1]) -> -0.265470801756942 | B101: -0.265470801756942 | C101: of:=ORG.LIBREOFFICE.ROUNDSIG([.A101];15)=ORG.LIBREOFFICE.ROUNDSIG([.B101];15) -> true | D101: of:=FORMULA([.A101]) -> =BESSELJ($L17,P$1)
A102: of:=BESSELJ([.$L18];[.P$1]) -> -0.105357434875389 | B102: -0.105357434875389 | C102: of:=ORG.LIBREOFFICE.ROUNDSIG([.A102];15)=ORG.LIBREOFFICE.ROUNDSIG([.B102];15) -> true | D102: of:=FORMULA([.A102]) -> =BESSELJ($L18,P$1)
A103: of:=BESSELJ([.$L19];[.P$1]) -> 0.157798144661368 | B103: 0.157798144661368 | C103: of:=ORG.LIBREOFFICE.ROUNDSIG([.A103];15)=ORG.LIBREOFFICE.ROUNDSIG([.B103];15) -> true | D103: of:=FORMULA([.A103]) -> =BESSELJ($L19,P$1)
A104: of:=BESSELJ([.$L20];[.P$1]) -> 0.357641594780961 | B104: 0.357641594780961 | C104: of:=ORG.LIBREOFFICE.ROUNDSIG([.A104];15)=ORG.LIBREOFFICE.ROUNDSIG([.B104];15) -> true | D104: of:=FORMULA([.A104]) -> =BESSELJ($L20,P$1)
A105: of:=BESSELJ([.$L21];[.P$1]) -> 0.391232360458648 | B105: 0.391232360458648 | C105: of:=ORG.LIBREOFFICE.ROUNDSIG([.A105];15)=ORG.LIBREOFFICE.ROUNDSIG([.B105];15) -> true | D105: of:=FORMULA([.A105]) -> =BESSELJ($L21,P$1)
A106: of:=BESSELJ([.$L22];[.P$1]) -> 0.28112906496136 | B106: 0.28112906496136 | C106: of:=ORG.LIBREOFFICE.ROUNDSIG([.A106];15)=ORG.LIBREOFFICE.ROUNDSIG([.B106];15) -> true | D106: of:=FORMULA([.A106]) -> =BESSELJ($L22,P$1)
A107: of:=BESSELJ([.$L23];[.P$1]) -> 0.132034183924612 | B107: 0.132034183924612 | C107: of:=ORG.LIBREOFFICE.ROUNDSIG([.A107];15)=ORG.LIBREOFFICE.ROUNDSIG([.B107];15) -> true | D107: of:=FORMULA([.A107]) -> =BESSELJ($L23,P$1)
A108: of:=BESSELJ([.$L24];[.P$1]) -> 0.0339957198075684 | B108: 0.0339957198075684 | C108: of:=ORG.LIBREOFFICE.ROUNDSIG([.A108];15)=ORG.LIBREOFFICE.ROUNDSIG([.B108];15) -> true | D108: of:=FORMULA([.A108]) -> =BESSELJ($L24,P$1)
A109: of:=BESSELJ([.$L25];[.P$1]) -> 0.00247663896410996 | B109: 0.00247663896410996 | C109: of:=ORG.LIBREOFFICE.ROUNDSIG([.A109];15)=ORG.LIBREOFFICE.ROUNDSIG([.B109];15) -> true | D109: of:=FORMULA([.A109]) -> =BESSELJ($L25,P$1)
A110: of:=BESSELJ([.$L2];[.Q$1]) -> -0.0741957369645138 | B110: -0.0741957369645138 | C110: of:=ORG.LIBREOFFICE.ROUNDSIG([.A110];15)=ORG.LIBREOFFICE.ROUNDSIG([.B110];15) -> true | D110: of:=FORMULA([.A110]) -> =BESSELJ($L2,Q$1)
A111: of:=BESSELJ([.$L3];[.Q$1]) -> 0.0827593195284153 | B111: 0.0827593195284153 | C111: of:=ORG.LIBREOFFICE.ROUNDSIG([.A111];15)=ORG.LIBREOFFICE.ROUNDSIG([.B111];15) -> true | D111: of:=FORMULA([.A111]) -> =BESSELJ($L3,Q$1)
A112: of:=BESSELJ([.$L4];[.Q$1]) -> -0.0658623491400317 | B112: -0.0658623491400317 | C112: of:=ORG.LIBREOFFICE.ROUNDSIG([.A112];15)=ORG.LIBREOFFICE.ROUNDSIG([.B112];15) -> true | D112: of:=FORMULA([.A112]) -> =BESSELJ($L4,Q$1)
A113: of:=BESSELJ([.$L5];[.Q$1]) -> 0.0260581298238953 | B113: 0.0260581298238953 | C113: of:=ORG.LIBREOFFICE.ROUNDSIG([.A113];15)=ORG.LIBREOFFICE.ROUNDSIG([.B113];15) -> true | D113: of:=FORMULA([.A113]) -> =BESSELJ($L5,Q$1)
A114: of:=BESSELJ([.$L6];[.Q$1]) -> 0.0274547442283443 | B114: 0.0274547442283443 | C114: of:=ORG.LIBREOFFICE.ROUNDSIG([.A114];15)=ORG.LIBREOFFICE.ROUNDSIG([.B114];15) -> true | D114: of:=FORMULA([.A114]) -> =BESSELJ($L6,Q$1)
A115: of:=BESSELJ([.$L7];[.Q$1]) -> -0.0814002476965698 | B115: -0.0814002476965698 | C115: of:=ORG.LIBREOFFICE.ROUNDSIG([.A115];15)=ORG.LIBREOFFICE.ROUNDSIG([.B115];15) -> true | D115: of:=FORMULA([.A115]) -> =BESSELJ($L7,Q$1)
A116: of:=BESSELJ([.$L8];[.Q$1]) -> 0.122573465977118 | B116: 0.122573465977118 | C116: of:=ORG.LIBREOFFICE.ROUNDSIG([.A116];15)=ORG.LIBREOFFICE.ROUNDSIG([.B116];15) -> true | D116: of:=FORMULA([.A116]) -> =BESSELJ($L8,Q$1)
A117: of:=BESSELJ([.$L9];[.Q$1]) -> -0.103620709621608 | B117: -0.103620709621608 | C117: of:=ORG.LIBREOFFICE.ROUNDSIG([.A117];15)=ORG.LIBREOFFICE.ROUNDSIG([.B117];15) -> true | D117: of:=FORMULA([.A117]) -> =BESSELJ($L9,Q$1)
A118: of:=BESSELJ([.$L10];[.Q$1]) -> -0.143240295512077 | B118: -0.143240295512077 | C118: of:=ORG.LIBREOFFICE.ROUNDSIG([.A118];15)=ORG.LIBREOFFICE.ROUNDSIG([.B118];15) -> true | D118: of:=FORMULA([.A118]) -> =BESSELJ($L10,Q$1)
A119: of:=BESSELJ([.$L11];[.Q$1]) -> -0.0536705586966496 | B119: -0.0536705586966496 | C119: of:=ORG.LIBREOFFICE.ROUNDSIG([.A119];15)=ORG.LIBREOFFICE.ROUNDSIG([.B119];15) -> true | D119: of:=FORMULA([.A119]) -> =BESSELJ($L11,Q$1)
A120: of:=BESSELJ([.$L12];[.Q$1]) -> 0.0879304793476818 | B120: 0.0879304793476818 | C120: of:=ORG.LIBREOFFICE.ROUNDSIG([.A120];15)=ORG.LIBREOFFICE.ROUNDSIG([.B120];15) -> true | D120: of:=FORMULA([.A120]) -> =BESSELJ($L12,Q$1)
A121: of:=BESSELJ([.$L13];[.Q$1]) -> -0.066007995398423 | B121: -0.066007995398423 | C121: of:=ORG.LIBREOFFICE.ROUNDSIG([.A121];15)=ORG.LIBREOFFICE.ROUNDSIG([.B121];15) -> true | D121: of:=FORMULA([.A121]) -> =BESSELJ($L13,Q$1)
A122: of:=BESSELJ([.$L14];[.Q$1]) -> 0.151169767982395 | B122: 0.151169767982395 | C122: of:=ORG.LIBREOFFICE.ROUNDSIG([.A122];15)=ORG.LIBREOFFICE.ROUNDSIG([.B122];15) -> true | D122: of:=FORMULA([.A122]) -> =BESSELJ($L14,Q$1)
A123: of:=BESSELJ([.$L15];[.Q$1]) -> 0.13045613456503 | B123: 0.13045613456503 | C123: of:=ORG.LIBREOFFICE.ROUNDSIG([.A123];15)=ORG.LIBREOFFICE.ROUNDSIG([.B123];15) -> true | D123: of:=FORMULA([.A123]) -> =BESSELJ($L15,Q$1)
A124: of:=BESSELJ([.$L16];[.Q$1]) -> -0.234061528186794 | B124: -0.234061528186794 | C124: of:=ORG.LIBREOFFICE.ROUNDSIG([.A124];15)=ORG.LIBREOFFICE.ROUNDSIG([.B124];15) -> true | D124: of:=FORMULA([.A124]) -> =BESSELJ($L16,Q$1)
A125: of:=BESSELJ([.$L17];[.Q$1]) -> -0.0550388556695138 | B125: -0.0550388556695138 | C125: of:=ORG.LIBREOFFICE.ROUNDSIG([.A125];15)=ORG.LIBREOFFICE.ROUNDSIG([.B125];15) -> true | D125: of:=FORMULA([.A125]) -> =BESSELJ($L17,Q$1)
A126: of:=BESSELJ([.$L18];[.Q$1]) -> 0.185774772190564 | B126: 0.185774772190564 | C126: of:=ORG.LIBREOFFICE.ROUNDSIG([.A126];15)=ORG.LIBREOFFICE.ROUNDSIG([.B126];15) -> true | D126: of:=FORMULA([.A126]) -> =BESSELJ($L18,Q$1)
A127: of:=BESSELJ([.$L19];[.Q$1]) -> 0.347896324751183 | B127: 0.347896324751183 | C127: of:=ORG.LIBREOFFICE.ROUNDSIG([.A127];15)=ORG.LIBREOFFICE.ROUNDSIG([.B127];15) -> true | D127: of:=FORMULA([.A127]) -> =BESSELJ($L19,Q$1)
A128: of:=BESSELJ([.$L20];[.Q$1]) -> 0.362087074887172 | B128: 0.362087074887172 | C128: of:=ORG.LIBREOFFICE.ROUNDSIG([.A128];15)=ORG.LIBREOFFICE.ROUNDSIG([.B128];15) -> true | D128: of:=FORMULA([.A128]) -> =BESSELJ($L20,Q$1)
A129: of:=BESSELJ([.$L21];[.Q$1]) -> 0.26114054612017 | B129: 0.26114054612017 | C129: of:=ORG.LIBREOFFICE.ROUNDSIG([.A129];15)=ORG.LIBREOFFICE.ROUNDSIG([.B129];15) -> true | D129: of:=FORMULA([.A129]) -> =BESSELJ($L21,Q$1)
A130: of:=BESSELJ([.$L22];[.Q$1]) -> 0.132086656047098 | B130: 0.132086656047098 | C130: of:=ORG.LIBREOFFICE.ROUNDSIG([.A130];15)=ORG.LIBREOFFICE.ROUNDSIG([.B130];15) -> true | D130: of:=FORMULA([.A130]) -> =BESSELJ($L22,Q$1)
A131: of:=BESSELJ([.$L23];[.Q$1]) -> 0.0430284348770476 | B131: 0.0430284348770476 | C131: of:=ORG.LIBREOFFICE.ROUNDSIG([.A131];15)=ORG.LIBREOFFICE.ROUNDSIG([.B131];15) -> true | D131: of:=FORMULA([.A131]) -> =BESSELJ($L23,Q$1)
A132: of:=BESSELJ([.$L24];[.Q$1]) -> 0.00703962975587169 | B132: 0.00703962975587169 | C132: of:=ORG.LIBREOFFICE.ROUNDSIG([.A132];15)=ORG.LIBREOFFICE.ROUNDSIG([.B132];15) -> true | D132: of:=FORMULA([.A132]) -> =BESSELJ($L24,Q$1)
A133: of:=BESSELJ([.$L25];[.Q$1]) -> 0.000249757730211234 | B133: 0.000249757730211234 | C133: of:=ORG.LIBREOFFICE.ROUNDSIG([.A133];15)=ORG.LIBREOFFICE.ROUNDSIG([.B133];15) -> true | D133: of:=FORMULA([.A133]) -> =BESSELJ($L25,Q$1)
A134: of:=BESSELJ([.$L2];[.R$1]) -> -0.033525383144177 | B134: -0.033525383144177 | C134: of:=ORG.LIBREOFFICE.ROUNDSIG([.A134];15)=ORG.LIBREOFFICE.ROUNDSIG([.B134];15) -> true | D134: of:=FORMULA([.A134]) -> =BESSELJ($L2,R$1)
A135: of:=BESSELJ([.$L3];[.R$1]) -> -0.0102563936635277 | B135: -0.0102563936635277 | C135: of:=ORG.LIBREOFFICE.ROUNDSIG([.A135];15)=ORG.LIBREOFFICE.ROUNDSIG([.B135];15) -> true | D135: of:=FORMULA([.A135]) -> =BESSELJ($L3,R$1)
A136: of:=BESSELJ([.$L4];[.R$1]) -> 0.0556473644530274 | B136: 0.0556473644530274 | C136: of:=ORG.LIBREOFFICE.ROUNDSIG([.A136];15)=ORG.LIBREOFFICE.ROUNDSIG([.B136];15) -> true | D136: of:=FORMULA([.A136]) -> =BESSELJ($L4,R$1)
A137: of:=BESSELJ([.$L5];[.R$1]) -> -0.0895812135723243 | B137: -0.0895812135723243 | C137: of:=ORG.LIBREOFFICE.ROUNDSIG([.A137];15)=ORG.LIBREOFFICE.ROUNDSIG([.B137];15) -> true | D137: of:=FORMULA([.A137]) -> =BESSELJ($L5,R$1)
A138: of:=BESSELJ([.$L6];[.R$1]) -> 0.101640545404557 | B138: 0.101640545404557 | C138: of:=ORG.LIBREOFFICE.ROUNDSIG([.A138];15)=ORG.LIBREOFFICE.ROUNDSIG([.B138];15) -> true | D138: of:=FORMULA([.A138]) -> =BESSELJ($L6,R$1)
A139: of:=BESSELJ([.$L7];[.R$1]) -> -0.0871210268209689 | B139: -0.0871210268209689 | C139: of:=ORG.LIBREOFFICE.ROUNDSIG([.A139];15)=ORG.LIBREOFFICE.ROUNDSIG([.B139];15) -> true | D139: of:=FORMULA([.A139]) -> =BESSELJ($L7,R$1)
A140: of:=BESSELJ([.$L8];[.R$1]) -> 0.0485001141377945 | B140: 0.0485001141377945 | C140: of:=ORG.LIBREOFFICE.ROUNDSIG([.A140];15)=ORG.LIBREOFFICE.ROUNDSIG([.B140];15) -> true | D140: of:=FORMULA([.A140]) -> =BESSELJ($L8,R$1)
A141: of:=BESSELJ([.$L9];[.R$1]) -> -0.11746983301854 | B141: -0.11746983301854 | C141: of:=ORG.LIBREOFFICE.ROUNDSIG([.A141];15)=ORG.LIBREOFFICE.ROUNDSIG([.B141];15) -> true | D141: of:=FORMULA([.A141]) -> =BESSELJ($L9,R$1)
A142: of:=BESSELJ([.$L10];[.R$1]) -> 0.00486223515062804 | B142: 0.00486223515062804 | C142: of:=ORG.LIBREOFFICE.ROUNDSIG([.A142];15)=ORG.LIBREOFFICE.ROUNDSIG([.B142];15) -> true | D142: of:=FORMULA([.A142]) -> =BESSELJ($L10,R$1)
A143: of:=BESSELJ([.$L11];[.R$1]) -> 0.127021684753414 | B143: 0.127021684753414 | C143: of:=ORG.LIBREOFFICE.ROUNDSIG([.A143];15)=ORG.LIBREOFFICE.ROUNDSIG([.B143];15) -> true | D143: of:=FORMULA([.A143]) -> =BESSELJ($L11,R$1)
A144: of:=BESSELJ([.$L12];[.R$1]) -> 0.139336215650791 | B144: 0.139336215650791 | C144: of:=ORG.LIBREOFFICE.ROUNDSIG([.A144];15)=ORG.LIBREOFFICE.ROUNDSIG([.B144];15) -> true | D144: of:=FORMULA([.A144]) -> =BESSELJ($L12,R$1)
A145: of:=BESSELJ([.$L13];[.R$1]) -> -0.158700340856513 | B145: -0.158700340856513 | C145: of:=ORG.LIBREOFFICE.ROUNDSIG([.A145];15)=ORG.LIBREOFFICE.ROUNDSIG([.B145];15) -> true | D145: of:=FORMULA([.A145]) -> =BESSELJ($L13,R$1)
A146: of:=BESSELJ([.$L14];[.R$1]) -> -0.0550860495636658 | B146: -0.0550860495636658 | C146: of:=ORG.LIBREOFFICE.ROUNDSIG([.A146];15)=ORG.LIBREOFFICE.ROUNDSIG([.B146];15) -> true | D146: of:=FORMULA([.A146]) -> =BESSELJ($L14,R$1)
A147: of:=BESSELJ([.$L15];[.R$1]) -> 0.206149737479986 | B147: 0.206149737479986 | C147: of:=ORG.LIBREOFFICE.ROUNDSIG([.A147];15)=ORG.LIBREOFFICE.ROUNDSIG([.B147];15) -> true | D147: of:=FORMULA([.A147]) -> =BESSELJ($L15,R$1)
A148: of:=BESSELJ([.$L16];[.R$1]) -> -0.0144588420847849 | B148: -0.0144588420847849 | C148: of:=ORG.LIBREOFFICE.ROUNDSIG([.A148];15)=ORG.LIBREOFFICE.ROUNDSIG([.B148];15) -> true | D148: of:=FORMULA([.A148]) -> =BESSELJ($L16,R$1)
A149: of:=BESSELJ([.$L17];[.R$1]) -> 0.204316517679704 | B149: 0.204316517679704 | C149: of:=ORG.LIBREOFFICE.ROUNDSIG([.A149];15)=ORG.LIBREOFFICE.ROUNDSIG([.B149];15) -> true | D149: of:=FORMULA([.A149]) -> =BESSELJ($L17,R$1)
A150: of:=BESSELJ([.$L18];[.R$1]) -> 0.337575900113593 | B150: 0.337575900113593 | C150: of:=ORG.LIBREOFFICE.ROUNDSIG([.A150];15)=ORG.LIBREOFFICE.ROUNDSIG([.B150];15) -> true | D150: of:=FORMULA([.A150]) -> =BESSELJ($L18,R$1)
A151: of:=BESSELJ([.$L19];[.R$1]) -> 0.33919660498318 | B151: 0.33919660498318 | C151: of:=ORG.LIBREOFFICE.ROUNDSIG([.A151];15)=ORG.LIBREOFFICE.ROUNDSIG([.B151];15) -> true | D151: of:=FORMULA([.A151]) -> =BESSELJ($L19,R$1)
A152: of:=BESSELJ([.$L20];[.R$1]) -> 0.245836863364327 | B152: 0.245836863364327 | C152: of:=ORG.LIBREOFFICE.ROUNDSIG([.A152];15)=ORG.LIBREOFFICE.ROUNDSIG([.B152];15) -> true | D152: of:=FORMULA([.A152]) -> =BESSELJ($L20,R$1)
A153: of:=BESSELJ([.$L21];[.R$1]) -> 0.131048731781692 | B153: 0.131048731781692 | C153: of:=ORG.LIBREOFFICE.ROUNDSIG([.A153];15)=ORG.LIBREOFFICE.ROUNDSIG([.B153];15) -> true | D153: of:=FORMULA([.A153]) -> =BESSELJ($L21,R$1)
A154: of:=BESSELJ([.$L22];[.R$1]) -> 0.0490875751563856 | B154: 0.0490875751563856 | C154: of:=ORG.LIBREOFFICE.ROUNDSIG([.A154];15)=ORG.LIBREOFFICE.ROUNDSIG([.B154];15) -> true | D154: of:=FORMULA([.A154]) -> =BESSELJ($L22,R$1)
A155: of:=BESSELJ([.$L23];[.R$1]) -> 0.0113939323322131 | B155: 0.0113939323322131 | C155: of:=ORG.LIBREOFFICE.ROUNDSIG([.A155];15)=ORG.LIBREOFFICE.ROUNDSIG([.B155];15) -> true | D155: of:=FORMULA([.A155]) -> =BESSELJ($L23,R$1)
A156: of:=BESSELJ([.$L24];[.R$1]) -> 0.00120242897178999 | B156: 0.00120242897178999 | C156: of:=ORG.LIBREOFFICE.ROUNDSIG([.A156];15)=ORG.LIBREOFFICE.ROUNDSIG([.B156];15) -> true | D156: of:=FORMULA([.A156]) -> =BESSELJ($L24,R$1)
A157: of:=BESSELJ([.$L25];[.R$1]) -> 0.0000209383380023893 | B157: 0.0000209383380023893 | C157: of:=ORG.LIBREOFFICE.ROUNDSIG([.A157];15)=ORG.LIBREOFFICE.ROUNDSIG([.B157];15) -> true | D157: of:=FORMULA([.A157]) -> =BESSELJ($L25,R$1)
A158: of:=BESSELJ([.$L2];[.S$1]) -> 0.0701726909872126 | B158: 0.0701726909872126 | C158: of:=ORG.LIBREOFFICE.ROUNDSIG([.A158];15)=ORG.LIBREOFFICE.ROUNDSIG([.B158];15) -> true | D158: of:=FORMULA([.A158]) -> =BESSELJ($L2,S$1)
A159: of:=BESSELJ([.$L3];[.S$1]) -> -0.0841268386835523 | B159: -0.0841268386835523 | C159: of:=ORG.LIBREOFFICE.ROUNDSIG([.A159];15)=ORG.LIBREOFFICE.ROUNDSIG([.B159];15) -> true | D159: of:=FORMULA([.A159]) -> =BESSELJ($L3,S$1)
A160: of:=BESSELJ([.$L4];[.S$1]) -> 0.0742094538079858 | B160: 0.0742094538079858 | C160: of:=ORG.LIBREOFFICE.ROUNDSIG([.A160];15)=ORG.LIBREOFFICE.ROUNDSIG([.B160];15) -> true | D160: of:=FORMULA([.A160]) -> =BESSELJ($L4,S$1)
A161: of:=BESSELJ([.$L5];[.S$1]) -> -0.0414149092934367 | B161: -0.0414149092934367 | C161: of:=ORG.LIBREOFFICE.ROUNDSIG([.A161];15)=ORG.LIBREOFFICE.ROUNDSIG([.B161];15) -> true | D161: of:=FORMULA([.A161]) -> =BESSELJ($L5,S$1)
A162: of:=BESSELJ([.$L6];[.S$1]) -> -0.00712663514743282 | B162: -0.00712663514743282 | C162: of:=ORG.LIBREOFFICE.ROUNDSIG([.A162];15)=ORG.LIBREOFFICE.ROUNDSIG([.B162];15) -> true | D162: of:=FORMULA([.A162]) -> =BESSELJ($L6,S$1)
A163: of:=BESSELJ([.$L7];[.S$1]) -> 0.0604912012595371 | B163: 0.0604912012595371 | C163: of:=ORG.LIBREOFFICE.ROUNDSIG([.A163];15)=ORG.LIBREOFFICE.ROUNDSIG([.B163];15) -> true | D163: of:=FORMULA([.A163]) -> =BESSELJ($L7,S$1)
A164: of:=BESSELJ([.$L8];[.S$1]) -> -0.108023431735779 | B164: -0.108023431735779 | C164: of:=ORG.LIBREOFFICE.ROUNDSIG([.A164];15)=ORG.LIBREOFFICE.ROUNDSIG([.B164];15) -> true | D164: of:=FORMULA([.A164]) -> =BESSELJ($L8,S$1)
A165: of:=BESSELJ([.$L9];[.S$1]) -> 0.0581485161950761 | B165: 0.0581485161950761 | C165: of:=ORG.LIBREOFFICE.ROUNDSIG([.A165];15)=ORG.LIBREOFFICE.ROUNDSIG([.B165];15) -> true | D165: of:=FORMULA([.A165]) -> =BESSELJ($L9,S$1)
A166: of:=BESSELJ([.$L10];[.S$1]) -> 0.145185189572329 | B166: 0.145185189572329 | C166: of:=ORG.LIBREOFFICE.ROUNDSIG([.A166];15)=ORG.LIBREOFFICE.ROUNDSIG([.B166];15) -> true | D166: of:=FORMULA([.A166]) -> =BESSELJ($L10,S$1)
A167: of:=BESSELJ([.$L11];[.S$1]) -> 0.106231255835993 | B167: 0.106231255835993 | C167: of:=ORG.LIBREOFFICE.ROUNDSIG([.A167];15)=ORG.LIBREOFFICE.ROUNDSIG([.B167];15) -> true | D167: of:=FORMULA([.A167]) -> =BESSELJ($L11,S$1)
A168: of:=BESSELJ([.$L12];[.S$1]) -> -0.0282149583544856 | B168: -0.0282149583544856 | C168: of:=ORG.LIBREOFFICE.ROUNDSIG([.A168];15)=ORG.LIBREOFFICE.ROUNDSIG([.B168];15) -> true | D168: of:=FORMULA([.A168]) -> =BESSELJ($L12,S$1)
A169: of:=BESSELJ([.$L13];[.S$1]) -> -0.0101681682127031 | B169: -0.0101681682127031 | C169: of:=ORG.LIBREOFFICE.ROUNDSIG([.A169];15)=ORG.LIBREOFFICE.ROUNDSIG([.B169];15) -> true | D169: of:=FORMULA([.A169]) -> =BESSELJ($L13,S$1)
A170: of:=BESSELJ([.$L14];[.S$1]) -> -0.184221397720594 | B170: -0.184221397720594 | C170: of:=ORG.LIBREOFFICE.ROUNDSIG([.A170];15)=ORG.LIBREOFFICE.ROUNDSIG([.B170];15) -> true | D170: of:=FORMULA([.A170]) -> =BESSELJ($L14,S$1)
A171: of:=BESSELJ([.$L15];[.S$1]) -> 0.0344636554189591 | B171: 0.0344636554189591 | C171: of:=ORG.LIBREOFFICE.ROUNDSIG([.A171];15)=ORG.LIBREOFFICE.ROUNDSIG([.B171];15) -> true | D171: of:=FORMULA([.A171]) -> =BESSELJ($L15,S$1)
A172: of:=BESSELJ([.$L16];[.S$1]) -> 0.216710917685052 | B172: 0.216710917685052 | C172: of:=ORG.LIBREOFFICE.ROUNDSIG([.A172];15)=ORG.LIBREOFFICE.ROUNDSIG([.B172];15) -> true | D172: of:=FORMULA([.A172]) -> =BESSELJ($L16,S$1)
A173: of:=BESSELJ([.$L17];[.S$1]) -> 0.327460879242453 | B173: 0.327460879242453 | C173: of:=ORG.LIBREOFFICE.ROUNDSIG([.A173];15)=ORG.LIBREOFFICE.ROUNDSIG([.B173];15) -> true | D173: of:=FORMULA([.A173]) -> =BESSELJ($L17,S$1)
A174: of:=BESSELJ([.$L18];[.S$1]) -> 0.320589077979826 | B174: 0.320589077979826 | C174: of:=ORG.LIBREOFFICE.ROUNDSIG([.A174];15)=ORG.LIBREOFFICE.ROUNDSIG([.B174];15) -> true | D174: of:=FORMULA([.A174]) -> =BESSELJ($L18,S$1)
A175: of:=BESSELJ([.$L19];[.S$1]) -> 0.233583569505696 | B175: 0.233583569505696 | C175: of:=ORG.LIBREOFFICE.ROUNDSIG([.A175];15)=ORG.LIBREOFFICE.ROUNDSIG([.B175];15) -> true | D175: of:=FORMULA([.A175]) -> =BESSELJ($L19,S$1)
A176: of:=BESSELJ([.$L20];[.S$1]) -> 0.129586651841481 | B176: 0.129586651841481 | C176: of:=ORG.LIBREOFFICE.ROUNDSIG([.A176];15)=ORG.LIBREOFFICE.ROUNDSIG([.B176];15) -> true | D176: of:=FORMULA([.A176]) -> =BESSELJ($L20,S$1)
A177: of:=BESSELJ([.$L21];[.S$1]) -> 0.0533764101558907 | B177: 0.0533764101558907 | C177: of:=ORG.LIBREOFFICE.ROUNDSIG([.A177];15)=ORG.LIBREOFFICE.ROUNDSIG([.B177];15) -> true | D177: of:=FORMULA([.A177]) -> =BESSELJ($L21,S$1)
A178: of:=BESSELJ([.$L22];[.S$1]) -> 0.0151760694220585 | B178: 0.0151760694220585 | C178: of:=ORG.LIBREOFFICE.ROUNDSIG([.A178];15)=ORG.LIBREOFFICE.ROUNDSIG([.B178];15) -> true | D178: of:=FORMULA([.A178]) -> =BESSELJ($L22,S$1)
A179: of:=BESSELJ([.$L23];[.S$1]) -> 0.00254729445180469 | B179: 0.00254729445180469 | C179: of:=ORG.LIBREOFFICE.ROUNDSIG([.A179];15)=ORG.LIBREOFFICE.ROUNDSIG([.B179];15) -> true | D179: of:=FORMULA([.A179]) -> =BESSELJ($L23,S$1)
A180: of:=BESSELJ([.$L24];[.S$1]) -> 0.000174944074868274 | B180: 0.000174944074868274 | C180: of:=ORG.LIBREOFFICE.ROUNDSIG([.A180];15)=ORG.LIBREOFFICE.ROUNDSIG([.B180];15) -> true | D180: of:=FORMULA([.A180]) -> =BESSELJ($L24,S$1)
A181: of:=BESSELJ([.$L25];[.S$1]) -> 0.00000150232581743681 | B181: 0.00000150232581743681 | C181: of:=ORG.LIBREOFFICE.ROUNDSIG([.A181];15)=ORG.LIBREOFFICE.ROUNDSIG([.B181];15) -> true | D181: of:=FORMULA([.A181]) -> =BESSELJ($L25,S$1)
A182: of:=BESSELJ([.$L2];[.T$1]) -> 0.0433495598823867 | B182: 0.0433495598823867 | C182: of:=ORG.LIBREOFFICE.ROUNDSIG([.A182];15)=ORG.LIBREOFFICE.ROUNDSIG([.B182];15) -> true | D182: of:=FORMULA([.A182]) -> =BESSELJ($L2,T$1)
A183: of:=BESSELJ([.$L3];[.T$1]) -> -0.00283000346502474 | B183: -0.00283000346502474 | C183: of:=ORG.LIBREOFFICE.ROUNDSIG([.A183];15)=ORG.LIBREOFFICE.ROUNDSIG([.B183];15) -> true | D183: of:=FORMULA([.A183]) -> =BESSELJ($L3,T$1)
A184: of:=BESSELJ([.$L4];[.T$1]) -> -0.0426607100366298 | B184: -0.0426607100366298 | C184: of:=ORG.LIBREOFFICE.ROUNDSIG([.A184];15)=ORG.LIBREOFFICE.ROUNDSIG([.B184];15) -> true | D184: of:=FORMULA([.A184]) -> =BESSELJ($L4,T$1)
A185: of:=BESSELJ([.$L5];[.T$1]) -> 0.0812982317136371 | B185: 0.0812982317136371 | C185: of:=ORG.LIBREOFFICE.ROUNDSIG([.A185];15)=ORG.LIBREOFFICE.ROUNDSIG([.B185];15) -> true | D185: of:=FORMULA([.A185]) -> =BESSELJ($L5,T$1)
A186: of:=BESSELJ([.$L6];[.T$1]) -> -0.103303426938958 | B186: -0.103303426938958 | C186: of:=ORG.LIBREOFFICE.ROUNDSIG([.A186];15)=ORG.LIBREOFFICE.ROUNDSIG([.B186];15) -> true | D186: of:=FORMULA([.A186]) -> =BESSELJ($L6,T$1)
A187: of:=BESSELJ([.$L7];[.T$1]) -> 0.104058563173639 | B187: 0.104058563173639 | C187: of:=ORG.LIBREOFFICE.ROUNDSIG([.A187];15)=ORG.LIBREOFFICE.ROUNDSIG([.B187];15) -> true | D187: of:=FORMULA([.A187]) -> =BESSELJ($L7,T$1)
A188: of:=BESSELJ([.$L8];[.T$1]) -> -0.0863083152453173 | B188: -0.0863083152453173 | C188: of:=ORG.LIBREOFFICE.ROUNDSIG([.A188];15)=ORG.LIBREOFFICE.ROUNDSIG([.B188];15) -> true | D188: of:=FORMULA([.A188]) -> =BESSELJ($L8,T$1)
A189: of:=BESSELJ([.$L9];[.T$1]) -> 0.143730453235671 | B189: 0.143730453235671 | C189: of:=ORG.LIBREOFFICE.ROUNDSIG([.A189];15)=ORG.LIBREOFFICE.ROUNDSIG([.B189];15) -> true | D189: of:=FORMULA([.A189]) -> =BESSELJ($L9,T$1)
A190: of:=BESSELJ([.$L10];[.T$1]) -> 0.0628908533164586 | B190: 0.0628908533164586 | C190: of:=ORG.LIBREOFFICE.ROUNDSIG([.A190];15)=ORG.LIBREOFFICE.ROUNDSIG([.B190];15) -> true | D190: of:=FORMULA([.A190]) -> =BESSELJ($L10,T$1)
A191: of:=BESSELJ([.$L11];[.T$1]) -> -0.0757376302119 | B191: -0.0757376302119 | C191: of:=ORG.LIBREOFFICE.ROUNDSIG([.A191];15)=ORG.LIBREOFFICE.ROUNDSIG([.B191];15) -> true | D191: of:=FORMULA([.A191]) -> =BESSELJ($L11,T$1)
A192: of:=BESSELJ([.$L12];[.T$1]) -> -0.153443694828033 | B192: -0.153443694828033 | C192: of:=ORG.LIBREOFFICE.ROUNDSIG([.A192];14)=ORG.LIBREOFFICE.ROUNDSIG([.B192];14) -> true | D192: of:=FORMULA([.A192]) -> =BESSELJ($L12,T$1)
A193: of:=BESSELJ([.$L13];[.T$1]) -> 0.153006166657399 | B193: 0.153006166657399 | C193: of:=ORG.LIBREOFFICE.ROUNDSIG([.A193];15)=ORG.LIBREOFFICE.ROUNDSIG([.B193];15) -> true | D193: of:=FORMULA([.A193]) -> =BESSELJ($L13,T$1)
A194: of:=BESSELJ([.$L14];[.T$1]) -> -0.0738689288407504 | B194: -0.0738689288407504 | C194: of:=ORG.LIBREOFFICE.ROUNDSIG([.A194];15)=ORG.LIBREOFFICE.ROUNDSIG([.B194];15) -> true | D194: of:=FORMULA([.A194]) -> =BESSELJ($L14,T$1)
A195: of:=BESSELJ([.$L15];[.T$1]) -> -0.173983659088957 | B195: -0.173983659088957 | C195: of:=ORG.LIBREOFFICE.ROUNDSIG([.A195];15)=ORG.LIBREOFFICE.ROUNDSIG([.B195];15) -> true | D195: of:=FORMULA([.A195]) -> =BESSELJ($L15,T$1)
A196: of:=BESSELJ([.$L16];[.T$1]) -> 0.317854126843857 | B196: 0.317854126843857 | C196: of:=ORG.LIBREOFFICE.ROUNDSIG([.A196];15)=ORG.LIBREOFFICE.ROUNDSIG([.B196];15) -> true | D196: of:=FORMULA([.A196]) -> =BESSELJ($L16,T$1)
A197: of:=BESSELJ([.$L17];[.T$1]) -> 0.305067072253 | B197: 0.305067072253 | C197: of:=ORG.LIBREOFFICE.ROUNDSIG([.A197];15)=ORG.LIBREOFFICE.ROUNDSIG([.B197];15) -> true | D197: of:=FORMULA([.A197]) -> =BESSELJ($L17,T$1)
A198: of:=BESSELJ([.$L18];[.T$1]) -> 0.223454986351103 | B198: 0.223454986351103 | C198: of:=ORG.LIBREOFFICE.ROUNDSIG([.A198];15)=ORG.LIBREOFFICE.ROUNDSIG([.B198];15) -> true | D198: of:=FORMULA([.A198]) -> =BESSELJ($L18,T$1)
A199: of:=BESSELJ([.$L19];[.T$1]) -> 0.127970534028213 | B199: 0.127970534028213 | C199: of:=ORG.LIBREOFFICE.ROUNDSIG([.A199];15)=ORG.LIBREOFFICE.ROUNDSIG([.B199];15) -> true | D199: of:=FORMULA([.A199]) -> =BESSELJ($L19,T$1)
A200: of:=BESSELJ([.$L20];[.T$1]) -> 0.0565319909324618 | B200: 0.0565319909324618 | C200: of:=ORG.LIBREOFFICE.ROUNDSIG([.A200];15)=ORG.LIBREOFFICE.ROUNDSIG([.B200];15) -> true | D200: of:=FORMULA([.A200]) -> =BESSELJ($L20,T$1)
A201: of:=BESSELJ([.$L21];[.T$1]) -> 0.018405216654802 | B201: 0.018405216654802 | C201: of:=ORG.LIBREOFFICE.ROUNDSIG([.A201];15)=ORG.LIBREOFFICE.ROUNDSIG([.B201];15) -> true | D201: of:=FORMULA([.A201]) -> =BESSELJ($L21,T$1)
A202: of:=BESSELJ([.$L22];[.T$1]) -> 0.00402866782081901 | B202: 0.00402866782081901 | C202: of:=ORG.LIBREOFFICE.ROUNDSIG([.A202];15)=ORG.LIBREOFFICE.ROUNDSIG([.B202];15) -> true | D202: of:=FORMULA([.A202]) -> =BESSELJ($L22,T$1)
A203: of:=BESSELJ([.$L23];[.T$1]) -> 0.000493441776208835 | B203: 0.000493441776208835 | C203: of:=ORG.LIBREOFFICE.ROUNDSIG([.A203];15)=ORG.LIBREOFFICE.ROUNDSIG([.B203];15) -> true | D203: of:=FORMULA([.A203]) -> =BESSELJ($L23,T$1)
A204: of:=BESSELJ([.$L24];[.T$1]) -> 0.0000221795522879259 | B204: 0.0000221795522879259 | C204: of:=ORG.LIBREOFFICE.ROUNDSIG([.A204];15)=ORG.LIBREOFFICE.ROUNDSIG([.B204];15) -> true | D204: of:=FORMULA([.A204]) -> =BESSELJ($L24,T$1)
A205: of:=BESSELJ([.$L25];[.T$1]) -> 0.000000094223441726045 | B205: 0.000000094223441726045 | C205: of:=ORG.LIBREOFFICE.ROUNDSIG([.A205];15)=ORG.LIBREOFFICE.ROUNDSIG([.B205];15) -> true | D205: of:=FORMULA([.A205]) -> =BESSELJ($L25,T$1)
A206: of:=BESSELJ([.$L2];[.U$1]) -> -0.0632367614060305 | B206: -0.0632367614060305 | C206: of:=ORG.LIBREOFFICE.ROUNDSIG([.A206];15)=ORG.LIBREOFFICE.ROUNDSIG([.B206];15) -> true | D206: of:=FORMULA([.A206]) -> =BESSELJ($L2,U$1)
A207: of:=BESSELJ([.$L3];[.U$1]) -> 0.0836237269564366 | B207: 0.0836237269564366 | C207: of:=ORG.LIBREOFFICE.ROUNDSIG([.A207];15)=ORG.LIBREOFFICE.ROUNDSIG([.B207];15) -> true | D207: of:=FORMULA([.A207]) -> =BESSELJ($L3,U$1)
A208: of:=BESSELJ([.$L4];[.U$1]) -> -0.0827415958153118 | B208: -0.0827415958153118 | C208: of:=ORG.LIBREOFFICE.ROUNDSIG([.A208];15)=ORG.LIBREOFFICE.ROUNDSIG([.B208];15) -> true | D208: of:=FORMULA([.A208]) -> =BESSELJ($L4,U$1)
A209: of:=BESSELJ([.$L5];[.U$1]) -> 0.0599973622565535 | B209: 0.0599973622565535 | C209: of:=ORG.LIBREOFFICE.ROUNDSIG([.A209];15)=ORG.LIBREOFFICE.ROUNDSIG([.B209];15) -> true | D209: of:=FORMULA([.A209]) -> =BESSELJ($L5,U$1)
A210: of:=BESSELJ([.$L6];[.U$1]) -> -0.0204209453696227 | B210: -0.0204209453696227 | C210: of:=ORG.LIBREOFFICE.ROUNDSIG([.A210];14)=ORG.LIBREOFFICE.ROUNDSIG([.B210];14) -> true | D210: of:=FORMULA([.A210]) -> =BESSELJ($L6,U$1)
A211: of:=BESSELJ([.$L7];[.U$1]) -> -0.0271924610439724 | B211: -0.0271924610439724 | C211: of:=ORG.LIBREOFFICE.ROUNDSIG([.A211];15)=ORG.LIBREOFFICE.ROUNDSIG([.B211];15) -> true | D211: of:=FORMULA([.A211]) -> =BESSELJ($L7,U$1)
A212: of:=BESSELJ([.$L8];[.U$1]) -> 0.0735001056376525 | B212: 0.0735001056376525 | C212: of:=ORG.LIBREOFFICE.ROUNDSIG([.A212];15)=ORG.LIBREOFFICE.ROUNDSIG([.B212];15) -> true | D212: of:=FORMULA([.A212]) -> =BESSELJ($L8,U$1)
A213: of:=BESSELJ([.$L9];[.U$1]) -> 0.0160349435394639 | B213: 0.0160349435394639 | C213: of:=ORG.LIBREOFFICE.ROUNDSIG([.A213];15)=ORG.LIBREOFFICE.ROUNDSIG([.B213];15) -> true | D213: of:=FORMULA([.A213]) -> =BESSELJ($L9,U$1)
A214: of:=BESSELJ([.$L10];[.U$1]) -> -0.111643401136884 | B214: -0.111643401136884 | C214: of:=ORG.LIBREOFFICE.ROUNDSIG([.A214];15)=ORG.LIBREOFFICE.ROUNDSIG([.B214];15) -> true | D214: of:=FORMULA([.A214]) -> =BESSELJ($L10,U$1)
A215: of:=BESSELJ([.$L11];[.U$1]) -> -0.148017534573593 | B215: -0.148017534573593 | C215: of:=ORG.LIBREOFFICE.ROUNDSIG([.A215];15)=ORG.LIBREOFFICE.ROUNDSIG([.B215];15) -> true | D215: of:=FORMULA([.A215]) -> =BESSELJ($L11,U$1)
A216: of:=BESSELJ([.$L12];[.U$1]) -> -0.0594671529758192 | B216: -0.0594671529758192 | C216: of:=ORG.LIBREOFFICE.ROUNDSIG([.A216];15)=ORG.LIBREOFFICE.ROUNDSIG([.B216];15) -> true | D216: of:=FORMULA([.A216]) -> =BESSELJ($L12,U$1)
A217: of:=BESSELJ([.$L13];[.U$1]) -> 0.108092114873438 | B217: 0.108092114873438 | C217: of:=ORG.LIBREOFFICE.ROUNDSIG([.A217];15)=ORG.LIBREOFFICE.ROUNDSIG([.B217];15) -> true | D217: of:=FORMULA([.A217]) -> =BESSELJ($L13,U$1)
A218: of:=BESSELJ([.$L14];[.U$1]) -> 0.125126254647994 | B218: 0.125126254647994 | C218: of:=ORG.LIBREOFFICE.ROUNDSIG([.A218];15)=ORG.LIBREOFFICE.ROUNDSIG([.B218];15) -> true | D218: of:=FORMULA([.A218]) -> =BESSELJ($L14,U$1)
A219: of:=BESSELJ([.$L15];[.U$1]) -> -0.220046225113847 | B219: -0.220046225113847 | C219: of:=ORG.LIBREOFFICE.ROUNDSIG([.A219];15)=ORG.LIBREOFFICE.ROUNDSIG([.B219];15) -> true | D219: of:=FORMULA([.A219]) -> =BESSELJ($L15,U$1)
A220: of:=BESSELJ([.$L16];[.U$1]) -> 0.29185568526512 | B220: 0.29185568526512 | C220: of:=ORG.LIBREOFFICE.ROUNDSIG([.A220];15)=ORG.LIBREOFFICE.ROUNDSIG([.B220];15) -> true | D220: of:=FORMULA([.A220]) -> =BESSELJ($L16,U$1)
A221: of:=BESSELJ([.$L17];[.U$1]) -> 0.214880582540658 | B221: 0.214880582540658 | C221: of:=ORG.LIBREOFFICE.ROUNDSIG([.A221];15)=ORG.LIBREOFFICE.ROUNDSIG([.B221];15) -> true | D221: of:=FORMULA([.A221]) -> =BESSELJ($L17,U$1)
A222: of:=BESSELJ([.$L18];[.U$1]) -> 0.12632089472238 | B222: 0.12632089472238 | C222: of:=ORG.LIBREOFFICE.ROUNDSIG([.A222];15)=ORG.LIBREOFFICE.ROUNDSIG([.B222];15) -> true | D222: of:=FORMULA([.A222]) -> =BESSELJ($L18,U$1)
A223: of:=BESSELJ([.$L19];[.U$1]) -> 0.0589205082730754 | B223: 0.0589205082730754 | C223: of:=ORG.LIBREOFFICE.ROUNDSIG([.A223];15)=ORG.LIBREOFFICE.ROUNDSIG([.B223];15) -> true | D223: of:=FORMULA([.A223]) -> =BESSELJ($L19,U$1)
A224: of:=BESSELJ([.$L20];[.U$1]) -> 0.0211653239784174 | B224: 0.0211653239784174 | C224: of:=ORG.LIBREOFFICE.ROUNDSIG([.A224];15)=ORG.LIBREOFFICE.ROUNDSIG([.B224];15) -> true | D224: of:=FORMULA([.A224]) -> =BESSELJ($L20,U$1)
A225: of:=BESSELJ([.$L21];[.U$1]) -> 0.00552028313947569 | B225: 0.00552028313947569 | C225: of:=ORG.LIBREOFFICE.ROUNDSIG([.A225];15)=ORG.LIBREOFFICE.ROUNDSIG([.B225];15) -> true | D225: of:=FORMULA([.A225]) -> =BESSELJ($L21,U$1)
A226: of:=BESSELJ([.$L22];[.U$1]) -> 0.000938601861217564 | B226: 0.000938601861217564 | C226: of:=ORG.LIBREOFFICE.ROUNDSIG([.A226];15)=ORG.LIBREOFFICE.ROUNDSIG([.B226];15) -> true | D226: of:=FORMULA([.A226]) -> =BESSELJ($L22,U$1)
A227: of:=BESSELJ([.$L23];[.U$1]) -> 0.0000843950213090918 | B227: 0.0000843950213090918 | C227: of:=ORG.LIBREOFFICE.ROUNDSIG([.A227];15)=ORG.LIBREOFFICE.ROUNDSIG([.B227];15) -> true | D227: of:=FORMULA([.A227]) -> =BESSELJ($L23,U$1)
A228: of:=BESSELJ([.$L24];[.U$1]) -> 0.00000249234343513307 | B228: 0.00000249234343513307 | C228: of:=ORG.LIBREOFFICE.ROUNDSIG([.A228];15)=ORG.LIBREOFFICE.ROUNDSIG([.B228];15) -> true | D228: of:=FORMULA([.A228]) -> =BESSELJ($L24,U$1)
A229: of:=BESSELJ([.$L25];[.U$1]) -> 0.00000000524925017991188 | B229: 0.00000000524925017991188 | C229: of:=ORG.LIBREOFFICE.ROUNDSIG([.A229];15)=ORG.LIBREOFFICE.ROUNDSIG([.B229];15) -> true | D229: of:=FORMULA([.A229]) -> =BESSELJ($L25,U$1)
A230: of:=BESSELJ([.$L2];[.V$1]) -> -0.0547321769354724 | B230: -0.0547321769354724 | C230: of:=ORG.LIBREOFFICE.ROUNDSIG([.A230];15)=ORG.LIBREOFFICE.ROUNDSIG([.B230];15) -> true | D230: of:=FORMULA([.A230]) -> =BESSELJ($L2,V$1)
A231: of:=BESSELJ([.$L3];[.V$1]) -> 0.0195547488563122 | B231: 0.0195547488563122 | C231: of:=ORG.LIBREOFFICE.ROUNDSIG([.A231];15)=ORG.LIBREOFFICE.ROUNDSIG([.B231];15) -> true | D231: of:=FORMULA([.A231]) -> =BESSELJ($L3,V$1)
A232: of:=BESSELJ([.$L4];[.V$1]) -> 0.0240438509781849 | B232: 0.0240438509781849 | C232: of:=ORG.LIBREOFFICE.ROUNDSIG([.A232];15)=ORG.LIBREOFFICE.ROUNDSIG([.B232];15) -> true | D232: of:=FORMULA([.A232]) -> =BESSELJ($L4,V$1)
A233: of:=BESSELJ([.$L5];[.V$1]) -> -0.0658703385619518 | B233: -0.0658703385619518 | C233: of:=ORG.LIBREOFFICE.ROUNDSIG([.A233];15)=ORG.LIBREOFFICE.ROUNDSIG([.B233];15) -> true | D233: of:=FORMULA([.A233]) -> =BESSELJ($L5,V$1)
A234: of:=BESSELJ([.$L6];[.V$1]) -> 0.0971771433280713 | B234: 0.0971771433280713 | C234: of:=ORG.LIBREOFFICE.ROUNDSIG([.A234];15)=ORG.LIBREOFFICE.ROUNDSIG([.B234];15) -> true | D234: of:=FORMULA([.A234]) -> =BESSELJ($L6,V$1)
A235: of:=BESSELJ([.$L7];[.V$1]) -> -0.11384784914947 | B235: -0.11384784914947 | C235: of:=ORG.LIBREOFFICE.ROUNDSIG([.A235];15)=ORG.LIBREOFFICE.ROUNDSIG([.B235];15) -> true | D235: of:=FORMULA([.A235]) -> =BESSELJ($L7,V$1)
A236: of:=BESSELJ([.$L8];[.V$1]) -> 0.119383362782261 | B236: 0.119383362782261 | C236: of:=ORG.LIBREOFFICE.ROUNDSIG([.A236];15)=ORG.LIBREOFFICE.ROUNDSIG([.B236];15) -> true | D236: of:=FORMULA([.A236]) -> =BESSELJ($L8,V$1)
A237: of:=BESSELJ([.$L9];[.V$1]) -> -0.134419840857918 | B237: -0.134419840857918 | C237: of:=ORG.LIBREOFFICE.ROUNDSIG([.A237];15)=ORG.LIBREOFFICE.ROUNDSIG([.B237];15) -> true | D237: of:=FORMULA([.A237]) -> =BESSELJ($L9,V$1)
A238: of:=BESSELJ([.$L10];[.V$1]) -> -0.129876893998589 | B238: -0.129876893998589 | C238: of:=ORG.LIBREOFFICE.ROUNDSIG([.A238];15)=ORG.LIBREOFFICE.ROUNDSIG([.B238];15) -> true | D238: of:=FORMULA([.A238]) -> =BESSELJ($L10,V$1)
A239: of:=BESSELJ([.$L11];[.V$1]) -> -0.0161353222820544 | B239: -0.0161353222820544 | C239: of:=ORG.LIBREOFFICE.ROUNDSIG([.A239];15)=ORG.LIBREOFFICE.ROUNDSIG([.B239];15) -> true | D239: of:=FORMULA([.A239]) -> =BESSELJ($L11,V$1)
A240: of:=BESSELJ([.$L12];[.V$1]) -> 0.11521481077215 | B240: 0.11521481077215 | C240: of:=ORG.LIBREOFFICE.ROUNDSIG([.A240];15)=ORG.LIBREOFFICE.ROUNDSIG([.B240];15) -> true | D240: of:=FORMULA([.A240]) -> =BESSELJ($L12,V$1)
A241: of:=BESSELJ([.$L13];[.V$1]) -> -0.0751798439485233 | B241: -0.0751798439485233 | C241: of:=ORG.LIBREOFFICE.ROUNDSIG([.A241];15)=ORG.LIBREOFFICE.ROUNDSIG([.B241];15) -> true | D241: of:=FORMULA([.A241]) -> =BESSELJ($L13,V$1)
A242: of:=BESSELJ([.$L14];[.V$1]) -> 0.186482558023945 | B242: 0.186482558023945 | C242: of:=ORG.LIBREOFFICE.ROUNDSIG([.A242];15)=ORG.LIBREOFFICE.ROUNDSIG([.B242];15) -> true | D242: of:=FORMULA([.A242]) -> =BESSELJ($L14,V$1)
A243: of:=BESSELJ([.$L15];[.V$1]) -> -0.0900718110476591 | B243: -0.0900718110476591 | C243: of:=ORG.LIBREOFFICE.ROUNDSIG([.A243];15)=ORG.LIBREOFFICE.ROUNDSIG([.B243];15) -> true | D243: of:=FORMULA([.A243]) -> =BESSELJ($L15,V$1)
A244: of:=BESSELJ([.$L16];[.V$1]) -> 0.207486106633359 | B244: 0.207486106633359 | C244: of:=ORG.LIBREOFFICE.ROUNDSIG([.A244];15)=ORG.LIBREOFFICE.ROUNDSIG([.B244];15) -> true | D244: of:=FORMULA([.A244]) -> =BESSELJ($L16,V$1)
A245: of:=BESSELJ([.$L17];[.V$1]) -> 0.124694092828317 | B245: 0.124694092828317 | C245: of:=ORG.LIBREOFFICE.ROUNDSIG([.A245];15)=ORG.LIBREOFFICE.ROUNDSIG([.B245];15) -> true | D245: of:=FORMULA([.A245]) -> =BESSELJ($L17,V$1)
A246: of:=BESSELJ([.$L18];[.V$1]) -> 0.0607670267742511 | B246: 0.0607670267742511 | C246: of:=ORG.LIBREOFFICE.ROUNDSIG([.A246];15)=ORG.LIBREOFFICE.ROUNDSIG([.B246];15) -> true | D246: of:=FORMULA([.A246]) -> =BESSELJ($L18,V$1)
A247: of:=BESSELJ([.$L19];[.V$1]) -> 0.0235393443882671 | B247: 0.0235393443882671 | C247: of:=ORG.LIBREOFFICE.ROUNDSIG([.A247];15)=ORG.LIBREOFFICE.ROUNDSIG([.B247];15) -> true | D247: of:=FORMULA([.A247]) -> =BESSELJ($L19,V$1)
A248: of:=BESSELJ([.$L20];[.V$1]) -> 0.00696398100279032 | B248: 0.00696398100279032 | C248: of:=ORG.LIBREOFFICE.ROUNDSIG([.A248];15)=ORG.LIBREOFFICE.ROUNDSIG([.B248];15) -> true | D248: of:=FORMULA([.A248]) -> =BESSELJ($L20,V$1)
A249: of:=BESSELJ([.$L21];[.V$1]) -> 0.00146780264731047 | B249: 0.00146780264731047 | C249: of:=ORG.LIBREOFFICE.ROUNDSIG([.A249];15)=ORG.LIBREOFFICE.ROUNDSIG([.B249];15) -> true | D249: of:=FORMULA([.A249]) -> =BESSELJ($L21,V$1)
A250: of:=BESSELJ([.$L22];[.V$1]) -> 0.000195040554660035 | B250: 0.000195040554660035 | C250: of:=ORG.LIBREOFFICE.ROUNDSIG([.A250];15)=ORG.LIBREOFFICE.ROUNDSIG([.B250];15) -> true | D250: of:=FORMULA([.A250]) -> =BESSELJ($L22,V$1)
A251: of:=BESSELJ([.$L23];[.V$1]) -> 0.0000129283516457159 | B251: 0.0000129283516457159 | C251: of:=ORG.LIBREOFFICE.ROUNDSIG([.A251];15)=ORG.LIBREOFFICE.ROUNDSIG([.B251];15) -> true | D251: of:=FORMULA([.A251]) -> =BESSELJ($L23,V$1)
A252: of:=BESSELJ([.$L24];[.V$1]) -> 0.000000251538628271674 | B252: 0.000000251538628271674 | C252: of:=ORG.LIBREOFFICE.ROUNDSIG([.A252];15)=ORG.LIBREOFFICE.ROUNDSIG([.B252];15) -> true | D252: of:=FORMULA([.A252]) -> =BESSELJ($L24,V$1)
A253: of:=BESSELJ([.$L25];[.V$1]) -> 0.000000000263061512368745 | B253: 0.000000000263061512368745 | C253: of:=ORG.LIBREOFFICE.ROUNDSIG([.A253];15)=ORG.LIBREOFFICE.ROUNDSIG([.B253];15) -> true | D253: of:=FORMULA([.A253]) -> =BESSELJ($L25,V$1)
A254: of:=BESSELJ([.$L2];[.W$1]) -> 0.0522903260189363 | B254: 0.0522903260189363 | C254: of:=ORG.LIBREOFFICE.ROUNDSIG([.A254];15)=ORG.LIBREOFFICE.ROUNDSIG([.B254];15) -> true | D254: of:=FORMULA([.A254]) -> =BESSELJ($L2,W$1)
A255: of:=BESSELJ([.$L3];[.W$1]) -> -0.0792782272105893 | B255: -0.0792782272105893 | C255: of:=ORG.LIBREOFFICE.ROUNDSIG([.A255];15)=ORG.LIBREOFFICE.ROUNDSIG([.B255];15) -> true | D255: of:=FORMULA([.A255]) -> =BESSELJ($L3,W$1)
A256: of:=BESSELJ([.$L4];[.W$1]) -> 0.0887525585598581 | B256: 0.0887525585598581 | C256: of:=ORG.LIBREOFFICE.ROUNDSIG([.A256];15)=ORG.LIBREOFFICE.ROUNDSIG([.B256];15) -> true | D256: of:=FORMULA([.A256]) -> =BESSELJ($L4,W$1)
A257: of:=BESSELJ([.$L5];[.W$1]) -> -0.07881745898854 | B257: -0.07881745898854 | C257: of:=ORG.LIBREOFFICE.ROUNDSIG([.A257];15)=ORG.LIBREOFFICE.ROUNDSIG([.B257];15) -> true | D257: of:=FORMULA([.A257]) -> =BESSELJ($L5,W$1)
A258: of:=BESSELJ([.$L6];[.W$1]) -> 0.0528133264789797 | B258: 0.0528133264789797 | C258: of:=ORG.LIBREOFFICE.ROUNDSIG([.A258];15)=ORG.LIBREOFFICE.ROUNDSIG([.B258];15) -> true | D258: of:=FORMULA([.A258]) -> =BESSELJ($L6,W$1)
A259: of:=BESSELJ([.$L7];[.W$1]) -> -0.0183466786158153 | B259: -0.0183466786158153 | C259: of:=ORG.LIBREOFFICE.ROUNDSIG([.A259];15)=ORG.LIBREOFFICE.ROUNDSIG([.B259];15) -> true | D259: of:=FORMULA([.A259]) -> =BESSELJ($L7,W$1)
A260: of:=BESSELJ([.$L8];[.W$1]) -> -0.0138084242465221 | B260: -0.0138084242465221 | C260: of:=ORG.LIBREOFFICE.ROUNDSIG([.A260];15)=ORG.LIBREOFFICE.ROUNDSIG([.B260];15) -> true | D260: of:=FORMULA([.A260]) -> =BESSELJ($L8,W$1)
A261: of:=BESSELJ([.$L9];[.W$1]) -> -0.102757421512314 | B261: -0.102757421512314 | C261: of:=ORG.LIBREOFFICE.ROUNDSIG([.A261];15)=ORG.LIBREOFFICE.ROUNDSIG([.B261];15) -> true | D261: of:=FORMULA([.A261]) -> =BESSELJ($L9,W$1)
A262: of:=BESSELJ([.$L10];[.W$1]) -> 0.0250588051378245 | B262: 0.0250588051378245 | C262: of:=ORG.LIBREOFFICE.ROUNDSIG([.A262];15)=ORG.LIBREOFFICE.ROUNDSIG([.B262];15) -> true | D262: of:=FORMULA([.A262]) -> =BESSELJ($L10,W$1)
A263: of:=BESSELJ([.$L11];[.W$1]) -> 0.136889726103211 | B263: 0.136889726103211 | C263: of:=ORG.LIBREOFFICE.ROUNDSIG([.A263];15)=ORG.LIBREOFFICE.ROUNDSIG([.B263];15) -> true | D263: of:=FORMULA([.A263]) -> =BESSELJ($L11,W$1)
A264: of:=BESSELJ([.$L12];[.W$1]) -> 0.141763446384498 | B264: 0.141763446384498 | C264: of:=ORG.LIBREOFFICE.ROUNDSIG([.A264];15)=ORG.LIBREOFFICE.ROUNDSIG([.B264];15) -> true | D264: of:=FORMULA([.A264]) -> =BESSELJ($L12,W$1)
A265: of:=BESSELJ([.$L13];[.W$1]) -> -0.168235990032257 | B265: -0.168235990032257 | C265: of:=ORG.LIBREOFFICE.ROUNDSIG([.A265];15)=ORG.LIBREOFFICE.ROUNDSIG([.B265];15) -> true | D265: of:=FORMULA([.A265]) -> =BESSELJ($L13,W$1)
A266: of:=BESSELJ([.$L14];[.W$1]) -> 0.0613563033759511 | B266: 0.0613563033759511 | C266: of:=ORG.LIBREOFFICE.ROUNDSIG([.A266];15)=ORG.LIBREOFFICE.ROUNDSIG([.B266];15) -> true | D266: of:=FORMULA([.A266]) -> =BESSELJ($L14,W$1)
A267: of:=BESSELJ([.$L15];[.W$1]) -> 0.0999504770503017 | B267: 0.0999504770503017 | C267: of:=ORG.LIBREOFFICE.ROUNDSIG([.A267];15)=ORG.LIBREOFFICE.ROUNDSIG([.B267];15) -> true | D267: of:=FORMULA([.A267]) -> =BESSELJ($L15,W$1)
A268: of:=BESSELJ([.$L16];[.W$1]) -> 0.123116528001598 | B268: 0.123116528001598 | C268: of:=ORG.LIBREOFFICE.ROUNDSIG([.A268];15)=ORG.LIBREOFFICE.ROUNDSIG([.B268];15) -> true | D268: of:=FORMULA([.A268]) -> =BESSELJ($L16,W$1)
A269: of:=BESSELJ([.$L17];[.W$1]) -> 0.0622174015222676 | B269: 0.0622174015222676 | C269: of:=ORG.LIBREOFFICE.ROUNDSIG([.A269];15)=ORG.LIBREOFFICE.ROUNDSIG([.B269];15) -> true | D269: of:=FORMULA([.A269]) -> =BESSELJ($L17,W$1)
A270: of:=BESSELJ([.$L18];[.W$1]) -> 0.0255966722132483 | B270: 0.0255966722132483 | C270: of:=ORG.LIBREOFFICE.ROUNDSIG([.A270];15)=ORG.LIBREOFFICE.ROUNDSIG([.B270];15) -> true | D270: of:=FORMULA([.A270]) -> =BESSELJ($L18,W$1)
A271: of:=BESSELJ([.$L19];[.W$1]) -> 0.00833476140768781 | B271: 0.00833476140768781 | C271: of:=ORG.LIBREOFFICE.ROUNDSIG([.A271];15)=ORG.LIBREOFFICE.ROUNDSIG([.B271];15) -> true | D271: of:=FORMULA([.A271]) -> =BESSELJ($L19,W$1)
A272: of:=BESSELJ([.$L20];[.W$1]) -> 0.00204794603088369 | B272: 0.00204794603088369 | C272: of:=ORG.LIBREOFFICE.ROUNDSIG([.A272];15)=ORG.LIBREOFFICE.ROUNDSIG([.B272];15) -> true | D272: of:=FORMULA([.A272]) -> =BESSELJ($L20,W$1)
A273: of:=BESSELJ([.$L21];[.W$1]) -> 0.000350927449766209 | B273: 0.000350927449766209 | C273: of:=ORG.LIBREOFFICE.ROUNDSIG([.A273];15)=ORG.LIBREOFFICE.ROUNDSIG([.B273];15) -> true | D273: of:=FORMULA([.A273]) -> =BESSELJ($L21,W$1)
A274: of:=BESSELJ([.$L22];[.W$1]) -> 0.0000366009120826085 | B274: 0.0000366009120826085 | C274: of:=ORG.LIBREOFFICE.ROUNDSIG([.A274];15)=ORG.LIBREOFFICE.ROUNDSIG([.B274];15) -> true | D274: of:=FORMULA([.A274]) -> =BESSELJ($L22,W$1)
A275: of:=BESSELJ([.$L23];[.W$1]) -> 0.00000179398966234745 | B275: 0.00000179398966234745 | C275: of:=ORG.LIBREOFFICE.ROUNDSIG([.A275];15)=ORG.LIBREOFFICE.ROUNDSIG([.B275];15) -> true | D275: of:=FORMULA([.A275]) -> =BESSELJ($L23,W$1)
A276: of:=BESSELJ([.$L24];[.W$1]) -> 0.0000000230428475836725 | B276: 0.0000000230428475836725 | C276: of:=ORG.LIBREOFFICE.ROUNDSIG([.A276];15)=ORG.LIBREOFFICE.ROUNDSIG([.B276];15) -> true | D276: of:=FORMULA([.A276]) -> =BESSELJ($L24,W$1)
A277: of:=BESSELJ([.$L25];[.W$1]) -> 0.0000000000119800674630314 | B277: 0.0000000000119800674630314 | C277: of:=ORG.LIBREOFFICE.ROUNDSIG([.A277];15)=ORG.LIBREOFFICE.ROUNDSIG([.B277];15) -> true | D277: of:=FORMULA([.A277]) -> =BESSELJ($L25,W$1)
A278: of:=BESSELJ([.$L2];[.X$1]) -> 0.0662360486596383 | B278: 0.0662360486596383 | C278: of:=ORG.LIBREOFFICE.ROUNDSIG([.A278];15)=ORG.LIBREOFFICE.ROUNDSIG([.B278];15) -> true | D278: of:=FORMULA([.A278]) -> =BESSELJ($L2,X$1)
A279: of:=BESSELJ([.$L3];[.X$1]) -> -0.0389338710633453 | B279: -0.0389338710633453 | C279: of:=ORG.LIBREOFFICE.ROUNDSIG([.A279];15)=ORG.LIBREOFFICE.ROUNDSIG([.B279];15) -> true | D279: of:=FORMULA([.A279]) -> =BESSELJ($L3,X$1)
A280: of:=BESSELJ([.$L4];[.X$1]) -> 0.000363102625776159 | B280: 0.000363102625776159 | C280: of:=ORG.LIBREOFFICE.ROUNDSIG([.A280];15)=ORG.LIBREOFFICE.ROUNDSIG([.B280];15) -> true | D280: of:=FORMULA([.A280]) -> =BESSELJ($L4,X$1)
A281: of:=BESSELJ([.$L5];[.X$1]) -> 0.0410991371655536 | B281: 0.0410991371655536 | C281: of:=ORG.LIBREOFFICE.ROUNDSIG([.A281];15)=ORG.LIBREOFFICE.ROUNDSIG([.B281];15) -> true | D281: of:=FORMULA([.A281]) -> =BESSELJ($L5,X$1)
A282: of:=BESSELJ([.$L6];[.X$1]) -> -0.0778122569524453 | B282: -0.0778122569524453 | C282: of:=ORG.LIBREOFFICE.ROUNDSIG([.A282];15)=ORG.LIBREOFFICE.ROUNDSIG([.B282];15) -> true | D282: of:=FORMULA([.A282]) -> =BESSELJ($L6,X$1)
A283: of:=BESSELJ([.$L7];[.X$1]) -> 0.105775310558511 | B283: 0.105775310558511 | C283: of:=ORG.LIBREOFFICE.ROUNDSIG([.A283];15)=ORG.LIBREOFFICE.ROUNDSIG([.B283];15) -> true | D283: of:=FORMULA([.A283]) -> =BESSELJ($L7,X$1)
A284: of:=BESSELJ([.$L8];[.X$1]) -> -0.126977996117848 | B284: -0.126977996117848 | C284: of:=ORG.LIBREOFFICE.ROUNDSIG([.A284];15)=ORG.LIBREOFFICE.ROUNDSIG([.B284];15) -> true | D284: of:=FORMULA([.A284]) -> =BESSELJ($L8,X$1)
A285: of:=BESSELJ([.$L9];[.X$1]) -> 0.0614952191395015 | B285: 0.0614952191395015 | C285: of:=ORG.LIBREOFFICE.ROUNDSIG([.A285];15)=ORG.LIBREOFFICE.ROUNDSIG([.B285];15) -> true | D285: of:=FORMULA([.A285]) -> =BESSELJ($L9,X$1)
A286: of:=BESSELJ([.$L10];[.X$1]) -> 0.14825335109966 | B286: 0.14825335109966 | C286: of:=ORG.LIBREOFFICE.ROUNDSIG([.A286];15)=ORG.LIBREOFFICE.ROUNDSIG([.B286];15) -> true | D286: of:=FORMULA([.A286]) -> =BESSELJ($L10,X$1)
A287: of:=BESSELJ([.$L11];[.X$1]) -> 0.11998270070518 | B287: 0.11998270070518 | C287: of:=ORG.LIBREOFFICE.ROUNDSIG([.A287];15)=ORG.LIBREOFFICE.ROUNDSIG([.B287];15) -> true | D287: of:=FORMULA([.A287]) -> =BESSELJ($L11,X$1)
A288: of:=BESSELJ([.$L12];[.X$1]) -> -0.00382924575575868 | B288: -0.00382924575575868 | C288: of:=ORG.LIBREOFFICE.ROUNDSIG([.A288];15)=ORG.LIBREOFFICE.ROUNDSIG([.B288];15) -> true | D288: of:=FORMULA([.A288]) -> =BESSELJ($L12,X$1)
A289: of:=BESSELJ([.$L13];[.X$1]) -> -0.072867827279863 | B289: -0.072867827279863 | C289: of:=ORG.LIBREOFFICE.ROUNDSIG([.A289];15)=ORG.LIBREOFFICE.ROUNDSIG([.B289];15) -> true | D289: of:=FORMULA([.A289]) -> =BESSELJ($L13,X$1)
A290: of:=BESSELJ([.$L14];[.X$1]) -> -0.118990624310399 | B290: -0.118990624310399 | C290: of:=ORG.LIBREOFFICE.ROUNDSIG([.A290];15)=ORG.LIBREOFFICE.ROUNDSIG([.B290];15) -> true | D290: of:=FORMULA([.A290]) -> =BESSELJ($L14,X$1)
A291: of:=BESSELJ([.$L15];[.X$1]) -> 0.236665844054768 | B291: 0.236665844054768 | C291: of:=ORG.LIBREOFFICE.ROUNDSIG([.A291];15)=ORG.LIBREOFFICE.ROUNDSIG([.B291];15) -> true | D291: of:=FORMULA([.A291]) -> =BESSELJ($L15,X$1)
A292: of:=BESSELJ([.$L16];[.X$1]) -> 0.063370254970156 | B292: 0.063370254970156 | C292: of:=ORG.LIBREOFFICE.ROUNDSIG([.A292];15)=ORG.LIBREOFFICE.ROUNDSIG([.B292];15) -> true | D292: of:=FORMULA([.A292]) -> =BESSELJ($L16,X$1)
A293: of:=BESSELJ([.$L17];[.X$1]) -> 0.0273928886705597 | B293: 0.0273928886705597 | C293: of:=ORG.LIBREOFFICE.ROUNDSIG([.A293];15)=ORG.LIBREOFFICE.ROUNDSIG([.B293];15) -> true | D293: of:=FORMULA([.A293]) -> =BESSELJ($L17,X$1)
A294: of:=BESSELJ([.$L18];[.X$1]) -> 0.00962382181218163 | B294: 0.00962382181218163 | C294: of:=ORG.LIBREOFFICE.ROUNDSIG([.A294];15)=ORG.LIBREOFFICE.ROUNDSIG([.B294];15) -> true | D294: of:=FORMULA([.A294]) -> =BESSELJ($L18,X$1)
A295: of:=BESSELJ([.$L19];[.X$1]) -> 0.00265562003589457 | B295: 0.00265562003589457 | C295: of:=ORG.LIBREOFFICE.ROUNDSIG([.A295];15)=ORG.LIBREOFFICE.ROUNDSIG([.B295];15) -> true | D295: of:=FORMULA([.A295]) -> =BESSELJ($L19,X$1)
A296: of:=BESSELJ([.$L20];[.X$1]) -> 0.000545154443783211 | B296: 0.000545154443783211 | C296: of:=ORG.LIBREOFFICE.ROUNDSIG([.A296];15)=ORG.LIBREOFFICE.ROUNDSIG([.B296];15) -> true | D296: of:=FORMULA([.A296]) -> =BESSELJ($L20,X$1)
A297: of:=BESSELJ([.$L21];[.X$1]) -> 0.0000762781316608455 | B297: 0.0000762781316608455 | C297: of:=ORG.LIBREOFFICE.ROUNDSIG([.A297];15)=ORG.LIBREOFFICE.ROUNDSIG([.B297];15) -> true | D297: of:=FORMULA([.A297]) -> =BESSELJ($L21,X$1)
A298: of:=BESSELJ([.$L22];[.X$1]) -> 0.00000626446179431221 | B298: 0.00000626446179431221 | C298: of:=ORG.LIBREOFFICE.ROUNDSIG([.A298];15)=ORG.LIBREOFFICE.ROUNDSIG([.B298];15) -> true | D298: of:=FORMULA([.A298]) -> =BESSELJ($L22,X$1)
A299: of:=BESSELJ([.$L23];[.X$1]) -> 0.000000227572544832057 | B299: 0.000000227572544832057 | C299: of:=ORG.LIBREOFFICE.ROUNDSIG([.A299];15)=ORG.LIBREOFFICE.ROUNDSIG([.B299];15) -> true | D299: of:=FORMULA([.A299]) -> =BESSELJ($L23,X$1)
A300: of:=BESSELJ([.$L24];[.X$1]) -> 0.00000000193269514872399 | B300: 0.00000000193269514872399 | C300: of:=ORG.LIBREOFFICE.ROUNDSIG([.A300];15)=ORG.LIBREOFFICE.ROUNDSIG([.B300];15) -> true | D300: of:=FORMULA([.A300]) -> =BESSELJ($L24,X$1)
A301: of:=BESSELJ([.$L25];[.X$1]) -> 0.00000000000049997181794484 | B301: 0.00000000000049997181794484 | C301: of:=ORG.LIBREOFFICE.ROUNDSIG([.A301];15)=ORG.LIBREOFFICE.ROUNDSIG([.B301];15) -> true | D301: of:=FORMULA([.A301]) -> =BESSELJ($L25,X$1)
A302: of:=BESSELJ([.$L2];[.Y$1]) -> -0.0363936743406231 | B302: -0.0363936743406231 | C302: of:=ORG.LIBREOFFICE.ROUNDSIG([.A302];15)=ORG.LIBREOFFICE.ROUNDSIG([.B302];15) -> true | D302: of:=FORMULA([.A302]) -> =BESSELJ($L2,Y$1)
A303: of:=BESSELJ([.$L3];[.Y$1]) -> 0.0688958615936974 | B303: 0.0688958615936974 | C303: of:=ORG.LIBREOFFICE.ROUNDSIG([.A303];15)=ORG.LIBREOFFICE.ROUNDSIG([.B303];15) -> true | D303: of:=FORMULA([.A303]) -> =BESSELJ($L3,Y$1)
A304: of:=BESSELJ([.$L4];[.Y$1]) -> -0.0886436277721252 | B304: -0.0886436277721252 | C304: of:=ORG.LIBREOFFICE.ROUNDSIG([.A304];15)=ORG.LIBREOFFICE.ROUNDSIG([.B304];15) -> true | D304: of:=FORMULA([.A304]) -> =BESSELJ($L4,Y$1)
A305: of:=BESSELJ([.$L5];[.Y$1]) -> 0.0929085917310154 | B305: 0.0929085917310154 | C305: of:=ORG.LIBREOFFICE.ROUNDSIG([.A305];15)=ORG.LIBREOFFICE.ROUNDSIG([.B305];15) -> true | D305: of:=FORMULA([.A305]) -> =BESSELJ($L5,Y$1)
A306: of:=BESSELJ([.$L6];[.Y$1]) -> -0.0839382292599579 | B306: -0.0839382292599579 | C306: of:=ORG.LIBREOFFICE.ROUNDSIG([.A306];15)=ORG.LIBREOFFICE.ROUNDSIG([.B306];15) -> true | D306: of:=FORMULA([.A306]) -> =BESSELJ($L6,Y$1)
A307: of:=BESSELJ([.$L7];[.Y$1]) -> 0.0691188276839006 | B307: 0.0691188276839006 | C307: of:=ORG.LIBREOFFICE.ROUNDSIG([.A307];15)=ORG.LIBREOFFICE.ROUNDSIG([.B307];15) -> true | D307: of:=FORMULA([.A307]) -> =BESSELJ($L7,Y$1)
A308: of:=BESSELJ([.$L8];[.Y$1]) -> -0.0623783734241867 | B308: -0.0623783734241867 | C308: of:=ORG.LIBREOFFICE.ROUNDSIG([.A308];15)=ORG.LIBREOFFICE.ROUNDSIG([.B308];15) -> true | D308: of:=FORMULA([.A308]) -> =BESSELJ($L8,Y$1)
A309: of:=BESSELJ([.$L9];[.Y$1]) -> 0.150366623426767 | B309: 0.150366623426767 | C309: of:=ORG.LIBREOFFICE.ROUNDSIG([.A309];15)=ORG.LIBREOFFICE.ROUNDSIG([.B309];15) -> true | D309: of:=FORMULA([.A309]) -> =BESSELJ($L9,Y$1)
A310: of:=BESSELJ([.$L10];[.Y$1]) -> 0.0935438757419036 | B310: 0.0935438757419036 | C310: of:=ORG.LIBREOFFICE.ROUNDSIG([.A310];15)=ORG.LIBREOFFICE.ROUNDSIG([.B310];15) -> true | D310: of:=FORMULA([.A310]) -> =BESSELJ($L10,Y$1)
A311: of:=BESSELJ([.$L11];[.Y$1]) -> -0.0375936979334067 | B311: -0.0375936979334067 | C311: of:=ORG.LIBREOFFICE.ROUNDSIG([.A311];15)=ORG.LIBREOFFICE.ROUNDSIG([.B311];15) -> true | D311: of:=FORMULA([.A311]) -> =BESSELJ($L11,Y$1)
A312: of:=BESSELJ([.$L12];[.Y$1]) -> -0.145045657032291 | B312: -0.145045657032291 | C312: of:=ORG.LIBREOFFICE.ROUNDSIG([.A312];15)=ORG.LIBREOFFICE.ROUNDSIG([.B312];15) -> true | D312: of:=FORMULA([.A312]) -> =BESSELJ($L12,Y$1)
A313: of:=BESSELJ([.$L13];[.Y$1]) -> 0.0982828758435886 | B313: 0.0982828758435886 | C313: of:=ORG.LIBREOFFICE.ROUNDSIG([.A313];15)=ORG.LIBREOFFICE.ROUNDSIG([.B313];15) -> true | D313: of:=FORMULA([.A313]) -> =BESSELJ($L13,Y$1)
A314: of:=BESSELJ([.$L14];[.Y$1]) -> -0.20414505254843 | B314: -0.20414505254843 | C314: of:=ORG.LIBREOFFICE.ROUNDSIG([.A314];15)=ORG.LIBREOFFICE.ROUNDSIG([.B314];15) -> true | D314: of:=FORMULA([.A314]) -> =BESSELJ($L14,Y$1)
A315: of:=BESSELJ([.$L15];[.Y$1]) -> 0.278714873437327 | B315: 0.278714873437327 | C315: of:=ORG.LIBREOFFICE.ROUNDSIG([.A315];15)=ORG.LIBREOFFICE.ROUNDSIG([.B315];15) -> true | D315: of:=FORMULA([.A315]) -> =BESSELJ($L15,Y$1)
A316: of:=BESSELJ([.$L16];[.Y$1]) -> 0.0289720839267767 | B316: 0.0289720839267767 | C316: of:=ORG.LIBREOFFICE.ROUNDSIG([.A316];15)=ORG.LIBREOFFICE.ROUNDSIG([.B316];15) -> true | D316: of:=FORMULA([.A316]) -> =BESSELJ($L16,Y$1)
A317: of:=BESSELJ([.$L17];[.Y$1]) -> 0.0108303015992249 | B317: 0.0108303015992249 | C317: of:=ORG.LIBREOFFICE.ROUNDSIG([.A317];15)=ORG.LIBREOFFICE.ROUNDSIG([.B317];15) -> true | D317: of:=FORMULA([.A317]) -> =BESSELJ($L17,Y$1)
A318: of:=BESSELJ([.$L18];[.Y$1]) -> 0.0032747932232966 | B318: 0.0032747932232966 | C318: of:=ORG.LIBREOFFICE.ROUNDSIG([.A318];15)=ORG.LIBREOFFICE.ROUNDSIG([.B318];15) -> true | D318: of:=FORMULA([.A318]) -> =BESSELJ($L18,Y$1)
A319: of:=BESSELJ([.$L19];[.Y$1]) -> 0.000770221572522133 | B319: 0.000770221572522133 | C319: of:=ORG.LIBREOFFICE.ROUNDSIG([.A319];15)=ORG.LIBREOFFICE.ROUNDSIG([.B319];15) -> true | D319: of:=FORMULA([.A319]) -> =BESSELJ($L19,Y$1)
A320: of:=BESSELJ([.$L20];[.Y$1]) -> 0.000132671744249154 | B320: 0.000132671744249154 | C320: of:=ORG.LIBREOFFICE.ROUNDSIG([.A320];15)=ORG.LIBREOFFICE.ROUNDSIG([.B320];15) -> true | D320: of:=FORMULA([.A320]) -> =BESSELJ($L20,Y$1)
A321: of:=BESSELJ([.$L21];[.Y$1]) -> 0.0000152075822058495 | B321: 0.0000152075822058495 | C321: of:=ORG.LIBREOFFICE.ROUNDSIG([.A321];15)=ORG.LIBREOFFICE.ROUNDSIG([.B321];15) -> true | D321: of:=FORMULA([.A321]) -> =BESSELJ($L21,Y$1)
A322: of:=BESSELJ([.$L22];[.Y$1]) -> 0.000000985858683264751 | B322: 0.000000985858683264751 | C322: of:=ORG.LIBREOFFICE.ROUNDSIG([.A322];15)=ORG.LIBREOFFICE.ROUNDSIG([.B322];15) -> true | D322: of:=FORMULA([.A322]) -> =BESSELJ($L22,Y$1)
A323: of:=BESSELJ([.$L23];[.Y$1]) -> 0.0000000265906963090111 | B323: 0.0000000265906963090111 | C323: of:=ORG.LIBREOFFICE.ROUNDSIG([.A323];15)=ORG.LIBREOFFICE.ROUNDSIG([.B323];15) -> true | D323: of:=FORMULA([.A323]) -> =BESSELJ($L23,Y$1)
A324: of:=BESSELJ([.$L24];[.Y$1]) -> 0.000000000149494201015312 | B324: 0.000000000149494201015312 | C324: of:=ORG.LIBREOFFICE.ROUNDSIG([.A324];15)=ORG.LIBREOFFICE.ROUNDSIG([.B324];15) -> true | D324: of:=FORMULA([.A324]) -> =BESSELJ($L24,Y$1)
A325: of:=BESSELJ([.$L25];[.Y$1]) -> 0.0000000000000192561676448017 | B325: 0.0000000000000192561676448017 | C325: of:=ORG.LIBREOFFICE.ROUNDSIG([.A325];15)=ORG.LIBREOFFICE.ROUNDSIG([.B325];15) -> true | D325: of:=FORMULA([.A325]) -> =BESSELJ($L25,Y$1)
A326: of:=BESSELJ(1;-9) ->  | B326: of:#ERR502! ->  | C326: of:=ISERROR([.A326]) -> true | D326: of:=FORMULA([.A326]) -> =BESSELJ(1,-9)