Sheet: Sheet1
A1: BESSELK Function
A3: Result | B3: of:=AND([.B8:.B95]) -> true
A7: Sheet | B7: Result | C7: Description
A8: 1 | B8: of:=AND([Sheet2.C2:.C396]) -> true | C8: Simple BESSELK formulas with local references and values

Sheet: Sheet2
A1: Function | B1: Expected | C1: Correct | D1: FunctionString | E1: Comment | I1: 1.5 | J1: 1 | M1: 1 | N1: 2 | O1: 3 | P1: 4 | Q1: 5 | R1: 6 | S1: 7 | T1: 8 | U1: 9 | V1: 10 | W1: 11 | X1: 12 | Y1: 13
A2: of:=BESSELK(1.5; 1) -> 0.277387803602702 | B2: 0.277387803602702 | C2: of:=ORG.LIBREOFFICE.ROUNDSIG([.A2];12)=ORG.LIBREOFFICE.ROUNDSIG([.B2];12) -> true | D2: of:=FORMULA([.A2]) -> =BESSELK(1.5, 1) | I2: 2.5 | J2: 2 | L2: 100
A3: of:=BESSELK([.I1];[.J1]) -> 0.277387803602702 | B3: 0.277387803602702 | C3: of:=ORG.LIBREOFFICE.ROUNDSIG([.A3];12)=ORG.LIBREOFFICE.ROUNDSIG([.B3];12) -> true | D3: of:=FORMULA([.A3]) -> =BESSELK(I1,J1) | I3: 3.5 | J3: 3 | L3: 90
A4: of:=BESSELK([.I2];[.J2]) -> 0.121460206711233 | B4: 0.121460206711233 | C4: of:=ORG.LIBREOFFICE.ROUNDSIG([.A4];12)=ORG.LIBREOFFICE.ROUNDSIG([.B4];12) -> true | D4: of:=FORMULA([.A4]) -> =BESSELK(I2,J2) | I4: 4.5 | J4: 4 | L4: 80
A5: of:=BESSELK([.I3];[.J3]) -> 0.0591618179913482 | B5: 0.0591618179913482 | C5: of:=ORG.LIBREOFFICE.ROUNDSIG([.A5];12)=ORG.LIBREOFFICE.ROUNDSIG([.B5];12) -> true | D5: of:=FORMULA([.A5]) -> =BESSELK(I3,J3) | I5: 5.5 | J5: 5 | L5: 70
A6: of:=BESSELK([.I4];[.J4]) -> 0.0302965322410685 | B6: 0.0302965322410685 | C6: of:=ORG.LIBREOFFICE.ROUNDSIG([.A6];12)=ORG.LIBREOFFICE.ROUNDSIG([.B6];12) -> true | D6: of:=FORMULA([.A6]) -> =BESSELK(I4,J4) | L6: 60
A7: of:=BESSELK([.I5];[.J5]) -> 0.0159711021453196 | B7: 0.0159711021453196 | C7: of:=ORG.LIBREOFFICE.ROUNDSIG([.A7];12)=ORG.LIBREOFFICE.ROUNDSIG([.B7];12) -> true | D7: of:=FORMULA([.A7]) -> =BESSELK(I5,J5) | L7: 50
A8: of:=BESSELK([.I6];[.J6]) ->  | B8: of:#ERR502! ->  | C8: of:=ISERROR([.A8]) -> true | D8: of:=FORMULA([.A8]) -> =BESSELK(I6,J6) | I8: 18.6 | J8: 11 | L8: 40
A9: of:=BESSELK([.I8:.I12];[.J8:.J12]) -> 0.0000000532878817837114 | B9: 0.0000000532878817837114 | C9: of:=ORG.LIBREOFFICE.ROUNDSIG([.A9];12)=ORG.LIBREOFFICE.ROUNDSIG([.B9];12) -> true | D9: of:=FORMULA([.A9]) -> {=BESSELK(I8:I12,J8:J12)} | I9: 19.6 | J9: 12 | L9: 31
A10: 0.0000000284610839524804 | B10: 0.0000000284610839524804 | C10: of:=ORG.LIBREOFFICE.ROUNDSIG([.A10];12)=ORG.LIBREOFFICE.ROUNDSIG([.B10];12) -> true | D10: of:=FORMULA([.A10]) -> {=BESSELK(I8:I12,J8:J12)} | I10: 20.6 | J10: 13 | L10: 30
A11: 0.0000000153263041037753 | B11: 0.0000000153263041037753 | C11: of:=ORG.LIBREOFFICE.ROUNDSIG([.A11];12)=ORG.LIBREOFFICE.ROUNDSIG([.B11];12) -> true | D11: of:=FORMULA([.A11]) -> {=BESSELK(I8:I12,J8:J12)} | I11: 21.6 | J11: 14 | L11: 29
A12: 0.00000000831192784884593 | B12: 0.00000000831192784884593 | C12: of:=ORG.LIBREOFFICE.ROUNDSIG([.A12];12)=ORG.LIBREOFFICE.ROUNDSIG([.B12];12) -> true | D12: of:=FORMULA([.A12]) -> {=BESSELK(I8:I12,J8:J12)} | I12: 22.6 | J12: 15 | L12: 28
A13: 0.00000000453571187393613 | B13: 0.00000000453571187393613 | C13: of:=ORG.LIBREOFFICE.ROUNDSIG([.A13];12)=ORG.LIBREOFFICE.ROUNDSIG([.B13];12) -> true | D13: of:=FORMULA([.A13]) -> {=BESSELK(I8:I12,J8:J12)} | L13: 25
A14: of:=BESSELK([.$L2];[.M$1]) -> 4.67985319856011E-045 | B14: 4.67985319856011E-045 | C14: of:=ORG.LIBREOFFICE.ROUNDSIG([.A14];12)=ORG.LIBREOFFICE.ROUNDSIG([.B14];12) -> true | D14: of:=FORMULA([.A14]) -> =BESSELK($L2,M$1) | L14: 20
A15: of:=BESSELK([.$L3];[.M$1]) -> 1.08701331219588E-040 | B15: 1.08701331219588E-040 | C15: of:=ORG.LIBREOFFICE.ROUNDSIG([.A15];12)=ORG.LIBREOFFICE.ROUNDSIG([.B15];12) -> true | D15: of:=FORMULA([.A15]) -> =BESSELK($L3,M$1) | L15: 15
A16: of:=BESSELK([.$L4];[.M$1]) -> 2.5408527925305E-036 | B16: 2.5408527925305E-036 | C16: of:=ORG.LIBREOFFICE.ROUNDSIG([.A16];12)=ORG.LIBREOFFICE.ROUNDSIG([.B16];12) -> true | D16: of:=FORMULA([.A16]) -> =BESSELK($L4,M$1) | L16: 10
A17: of:=BESSELK([.$L5];[.M$1]) -> 5.98697282597835E-032 | B17: 5.98697282597835E-032 | C17: of:=ORG.LIBREOFFICE.ROUNDSIG([.A17];12)=ORG.LIBREOFFICE.ROUNDSIG([.B17];12) -> true | D17: of:=FORMULA([.A17]) -> =BESSELK($L5,M$1) | L17: 9
A18: of:=BESSELK([.$L6];[.M$1]) -> 1.42563181002464E-027 | B18: 1.42563181002464E-027 | C18: of:=ORG.LIBREOFFICE.ROUNDSIG([.A18];12)=ORG.LIBREOFFICE.ROUNDSIG([.B18];12) -> true | D18: of:=FORMULA([.A18]) -> =BESSELK($L6,M$1) | L18: 8
A19: of:=BESSELK([.$L7];[.M$1]) -> 3.44410167099494E-023 | B19: 3.44410167099494E-023 | C19: of:=ORG.LIBREOFFICE.ROUNDSIG([.A19];12)=ORG.LIBREOFFICE.ROUNDSIG([.B19];12) -> true | D19: of:=FORMULA([.A19]) -> =BESSELK($L7,M$1) | L19: 7
A20: of:=BESSELK([.$L8];[.M$1]) -> 8.49713053786246E-019 | B20: 8.49713053786246E-019 | C20: of:=ORG.LIBREOFFICE.ROUNDSIG([.A20];12)=ORG.LIBREOFFICE.ROUNDSIG([.B20];12) -> true | D20: of:=FORMULA([.A20]) -> =BESSELK($L8,M$1) | L20: 6
A21: of:=BESSELK([.$L9];[.M$1]) -> 7.84189834360267E-015 | B21: 7.84189834360267E-015 | C21: of:=ORG.LIBREOFFICE.ROUNDSIG([.A21];12)=ORG.LIBREOFFICE.ROUNDSIG([.B21];12) -> true | D21: of:=FORMULA([.A21]) -> =BESSELK($L9,M$1) | L21: 5
A22: of:=BESSELK([.$L10];[.M$1]) -> 0.0000000000000216773165879964 | B22: 0.0000000000000216773165879964 | C22: of:=ORG.LIBREOFFICE.ROUNDSIG([.A22];12)=ORG.LIBREOFFICE.ROUNDSIG([.B22];12) -> true | D22: of:=FORMULA([.A22]) -> =BESSELK($L10,M$1) | L22: 4
A23: of:=BESSELK([.$L11];[.M$1]) -> 0.0000000000000599573938692619 | B23: 0.0000000000000599573938692619 | C23: of:=ORG.LIBREOFFICE.ROUNDSIG([.A23];12)=ORG.LIBREOFFICE.ROUNDSIG([.B23];12) -> true | D23: of:=FORMULA([.A23]) -> =BESSELK($L11,M$1) | L23: 3
A24: of:=BESSELK([.$L12];[.M$1]) -> 0.000000000000165939985353202 | B24: 0.000000000000165939985353202 | C24: of:=ORG.LIBREOFFICE.ROUNDSIG([.A24];12)=ORG.LIBREOFFICE.ROUNDSIG([.B24];12) -> true | D24: of:=FORMULA([.A24]) -> =BESSELK($L12,M$1) | L24: 2
A25: of:=BESSELK([.$L13];[.M$1]) -> 0.0000000000035327775746782 | B25: 0.0000000000035327775746782 | C25: of:=ORG.LIBREOFFICE.ROUNDSIG([.A25];12)=ORG.LIBREOFFICE.ROUNDSIG([.B25];12) -> true | D25: of:=FORMULA([.A25]) -> =BESSELK($L13,M$1) | L25: 1
A26: of:=BESSELK([.$L14];[.M$1]) -> 0.000000000588305734212124 | B26: 0.000000000588305734212124 | C26: of:=ORG.LIBREOFFICE.ROUNDSIG([.A26];12)=ORG.LIBREOFFICE.ROUNDSIG([.B26];12) -> true | D26: of:=FORMULA([.A26]) -> =BESSELK($L14,M$1)
A27: of:=BESSELK([.$L15];[.M$1]) -> 0.00000010141728903038 | B27: 0.00000010141728903038 | C27: of:=ORG.LIBREOFFICE.ROUNDSIG([.A27];12)=ORG.LIBREOFFICE.ROUNDSIG([.B27];12) -> true | D27: of:=FORMULA([.A27]) -> =BESSELK($L15,M$1)
A28: of:=BESSELK([.$L16];[.M$1]) -> 0.0000186487739468491 | B28: 0.0000186487739468491 | C28: of:=ORG.LIBREOFFICE.ROUNDSIG([.A28];12)=ORG.LIBREOFFICE.ROUNDSIG([.B28];12) -> true | D28: of:=FORMULA([.A28]) -> =BESSELK($L16,M$1)
A29: of:=BESSELK([.$L17];[.M$1]) -> 0.0000536370181302081 | B29: 0.0000536370181302081 | C29: of:=ORG.LIBREOFFICE.ROUNDSIG([.A29];12)=ORG.LIBREOFFICE.ROUNDSIG([.B29];12) -> true | D29: of:=FORMULA([.A29]) -> =BESSELK($L17,M$1)
A30: of:=BESSELK([.$L18];[.M$1]) -> 0.000155369216604889 | B30: 0.000155369216604889 | C30: of:=ORG.LIBREOFFICE.ROUNDSIG([.A30];12)=ORG.LIBREOFFICE.ROUNDSIG([.B30];12) -> true | D30: of:=FORMULA([.A30]) -> =BESSELK($L18,M$1)
A31: of:=BESSELK([.$L19];[.M$1]) -> 0.000454182495563023 | B31: 0.000454182495563023 | C31: of:=ORG.LIBREOFFICE.ROUNDSIG([.A31];12)=ORG.LIBREOFFICE.ROUNDSIG([.B31];12) -> true | D31: of:=FORMULA([.A31]) -> =BESSELK($L19,M$1)
A32: of:=BESSELK([.$L20];[.M$1]) -> 0.00134391971674326 | B32: 0.00134391971674326 | C32: of:=ORG.LIBREOFFICE.ROUNDSIG([.A32];12)=ORG.LIBREOFFICE.ROUNDSIG([.B32];12) -> true | D32: of:=FORMULA([.A32]) -> =BESSELK($L20,M$1)
A33: of:=BESSELK([.$L21];[.M$1]) -> 0.00404461338320827 | B33: 0.00404461338320827 | C33: of:=ORG.LIBREOFFICE.ROUNDSIG([.A33];12)=ORG.LIBREOFFICE.ROUNDSIG([.B33];12) -> true | D33: of:=FORMULA([.A33]) -> =BESSELK($L21,M$1)
A34: of:=BESSELK([.$L22];[.M$1]) -> 0.0124834988881605 | B34: 0.0124834988881605 | C34: of:=ORG.LIBREOFFICE.ROUNDSIG([.A34];12)=ORG.LIBREOFFICE.ROUNDSIG([.B34];12) -> true | D34: of:=FORMULA([.A34]) -> =BESSELK($L22,M$1)
A35: of:=BESSELK([.$L23];[.M$1]) -> 0.0401564312439175 | B35: 0.0401564312439175 | C35: of:=ORG.LIBREOFFICE.ROUNDSIG([.A35];12)=ORG.LIBREOFFICE.ROUNDSIG([.B35];12) -> true | D35: of:=FORMULA([.A35]) -> =BESSELK($L23,M$1)
A36: of:=BESSELK([.$L24];[.M$1]) -> 0.13986588 | B36: 0.13986588 | C36: of:=ORG.LIBREOFFICE.ROUNDSIG([.A36];12)=ORG.LIBREOFFICE.ROUNDSIG([.B36];12) -> true | D36: of:=FORMULA([.A36]) -> =BESSELK($L24,M$1)
A37: of:=BESSELK([.$L25];[.M$1]) -> 0.601907227223457 | B37: 0.601907227223457 | C37: of:=ORG.LIBREOFFICE.ROUNDSIG([.A37];12)=ORG.LIBREOFFICE.ROUNDSIG([.B37];12) -> true | D37: of:=FORMULA([.A37]) -> =BESSELK($L25,M$1)
A38: of:=BESSELK([.$L2];[.N$1]) -> 4.75022576194228E-045 | B38: 4.75022576194228E-045 | C38: of:=ORG.LIBREOFFICE.ROUNDSIG([.A38];12)=ORG.LIBREOFFICE.ROUNDSIG([.B38];12) -> true | D38: of:=FORMULA([.A38]) -> =BESSELK($L2,N$1)
A39: of:=BESSELK([.$L3];[.N$1]) -> 1.10518022336789E-040 | B39: 1.10518022336789E-040 | C39: of:=ORG.LIBREOFFICE.ROUNDSIG([.A39];12)=ORG.LIBREOFFICE.ROUNDSIG([.B39];12) -> true | D39: of:=FORMULA([.A39]) -> =BESSELK($L3,N$1)
A40: of:=BESSELK([.$L4];[.N$1]) -> 2.58864145331598E-036 | B40: 2.58864145331598E-036 | C40: of:=ORG.LIBREOFFICE.ROUNDSIG([.A40];12)=ORG.LIBREOFFICE.ROUNDSIG([.B40];12) -> true | D40: of:=FORMULA([.A40]) -> =BESSELK($L4,N$1)
A41: of:=BESSELK([.$L5];[.N$1]) -> 6.11571843873254E-032 | B41: 6.11571843873254E-032 | C41: of:=ORG.LIBREOFFICE.ROUNDSIG([.A41];12)=ORG.LIBREOFFICE.ROUNDSIG([.B41];12) -> true | D41: of:=FORMULA([.A41]) -> =BESSELK($L5,N$1)
A42: of:=BESSELK([.$L6];[.N$1]) -> 1.46141908819531E-027 | B42: 1.46141908819531E-027 | C42: of:=ORG.LIBREOFFICE.ROUNDSIG([.A42];12)=ORG.LIBREOFFICE.ROUNDSIG([.B42];12) -> true | D42: of:=FORMULA([.A42]) -> =BESSELK($L6,N$1)
A43: of:=BESSELK([.$L7];[.N$1]) -> 3.54793229676839E-023 | B43: 3.54793229676839E-023 | C43: of:=ORG.LIBREOFFICE.ROUNDSIG([.A43];12)=ORG.LIBREOFFICE.ROUNDSIG([.B43];12) -> true | D43: of:=FORMULA([.A43]) -> =BESSELK($L7,N$1)
A44: of:=BESSELK([.$L8];[.N$1]) -> 8.81771885089245E-019 | B44: 8.81771885089245E-019 | C44: of:=ORG.LIBREOFFICE.ROUNDSIG([.A44];12)=ORG.LIBREOFFICE.ROUNDSIG([.B44];12) -> true | D44: of:=FORMULA([.A44]) -> =BESSELK($L8,N$1)
A45: of:=BESSELK([.$L9];[.N$1]) -> 8.22431266894394E-015 | B45: 8.22431266894394E-015 | C45: of:=ORG.LIBREOFFICE.ROUNDSIG([.A45];12)=ORG.LIBREOFFICE.ROUNDSIG([.B45];12) -> true | D45: of:=FORMULA([.A45]) -> =BESSELK($L9,N$1)
A46: of:=BESSELK([.$L10];[.N$1]) -> 0.000000000000022769932374428 | B46: 0.000000000000022769932374428 | C46: of:=ORG.LIBREOFFICE.ROUNDSIG([.A46];12)=ORG.LIBREOFFICE.ROUNDSIG([.B46];12) -> true | D46: of:=FORMULA([.A46]) -> =BESSELK($L10,N$1)
A47: of:=BESSELK([.$L11];[.N$1]) -> 0.0000000000000630845080627658 | B47: 0.0000000000000630845080627658 | C47: of:=ORG.LIBREOFFICE.ROUNDSIG([.A47];12)=ORG.LIBREOFFICE.ROUNDSIG([.B47];12) -> true | D47: of:=FORMULA([.A47]) -> =BESSELK($L11,N$1)
A48: of:=BESSELK([.$L12];[.N$1]) -> 0.000000000000174906336787692 | B48: 0.000000000000174906336787692 | C48: of:=ORG.LIBREOFFICE.ROUNDSIG([.A48];12)=ORG.LIBREOFFICE.ROUNDSIG([.B48];12) -> true | D48: of:=FORMULA([.A48]) -> =BESSELK($L12,N$1)
A49: of:=BESSELK([.$L13];[.N$1]) -> 0.00000000000374678420160201 | B49: 0.00000000000374678420160201 | C49: of:=ORG.LIBREOFFICE.ROUNDSIG([.A49];12)=ORG.LIBREOFFICE.ROUNDSIG([.B49];12) -> true | D49: of:=FORMULA([.A49]) -> =BESSELK($L13,N$1)
A50: of:=BESSELK([.$L14];[.N$1]) -> 0.000000000632954410081938 | B50: 0.000000000632954410081938 | C50: of:=ORG.LIBREOFFICE.ROUNDSIG([.A50];12)=ORG.LIBREOFFICE.ROUNDSIG([.B50];12) -> true | D50: of:=FORMULA([.A50]) -> =BESSELK($L14,N$1)
A51: of:=BESSELK([.$L15];[.N$1]) -> 0.000000111717674321846 | B51: 0.000000111717674321846 | C51: of:=ORG.LIBREOFFICE.ROUNDSIG([.A51];12)=ORG.LIBREOFFICE.ROUNDSIG([.B51];12) -> true | D51: of:=FORMULA([.A51]) -> =BESSELK($L15,N$1)
A52: of:=BESSELK([.$L16];[.N$1]) -> 0.0000215098167224964 | B52: 0.0000215098167224964 | C52: of:=ORG.LIBREOFFICE.ROUNDSIG([.A52];12)=ORG.LIBREOFFICE.ROUNDSIG([.B52];12) -> true | D52: of:=FORMULA([.A52]) -> =BESSELK($L16,N$1)
A53: of:=BESSELK([.$L17];[.N$1]) -> 0.0000628006488946053 | B53: 0.0000628006488946053 | C53: of:=ORG.LIBREOFFICE.ROUNDSIG([.A53];12)=ORG.LIBREOFFICE.ROUNDSIG([.B53];12) -> true | D53: of:=FORMULA([.A53]) -> =BESSELK($L17,N$1)
A54: of:=BESSELK([.$L18];[.N$1]) -> 0.000185313005331807 | B54: 0.000185313005331807 | C54: of:=ORG.LIBREOFFICE.ROUNDSIG([.A54];12)=ORG.LIBREOFFICE.ROUNDSIG([.B54];12) -> true | D54: of:=FORMULA([.A54]) -> =BESSELK($L18,N$1)
A55: of:=BESSELK([.$L19];[.N$1]) -> 0.000554562161426782 | B55: 0.000554562161426782 | C55: of:=ORG.LIBREOFFICE.ROUNDSIG([.A55];12)=ORG.LIBREOFFICE.ROUNDSIG([.B55];12) -> true | D55: of:=FORMULA([.A55]) -> =BESSELK($L19,N$1)
A56: of:=BESSELK([.$L20];[.N$1]) -> 0.00169196756562546 | B56: 0.00169196756562546 | C56: of:=ORG.LIBREOFFICE.ROUNDSIG([.A56];12)=ORG.LIBREOFFICE.ROUNDSIG([.B56];12) -> true | D56: of:=FORMULA([.A56]) -> =BESSELK($L20,N$1)
A57: of:=BESSELK([.$L21];[.N$1]) -> 0.00530894373524362 | B57: 0.00530894373524362 | C57: of:=ORG.LIBREOFFICE.ROUNDSIG([.A57];12)=ORG.LIBREOFFICE.ROUNDSIG([.B57];12) -> true | D57: of:=FORMULA([.A57]) -> =BESSELK($L21,N$1)
A58: of:=BESSELK([.$L22];[.N$1]) -> 0.0174014255435474 | B58: 0.0174014255435474 | C58: of:=ORG.LIBREOFFICE.ROUNDSIG([.A58];12)=ORG.LIBREOFFICE.ROUNDSIG([.B58];12) -> true | D58: of:=FORMULA([.A58]) -> =BESSELK($L22,N$1)
A59: of:=BESSELK([.$L23];[.N$1]) -> 0.0615104585619118 | B59: 0.0615104585619118 | C59: of:=ORG.LIBREOFFICE.ROUNDSIG([.A59];12)=ORG.LIBREOFFICE.ROUNDSIG([.B59];12) -> true | D59: of:=FORMULA([.A59]) -> =BESSELK($L23,N$1)
A60: of:=BESSELK([.$L24];[.N$1]) -> 0.25375976 | B60: 0.25375976 | C60: of:=ORG.LIBREOFFICE.ROUNDSIG([.A60];12)=ORG.LIBREOFFICE.ROUNDSIG([.B60];12) -> true | D60: of:=FORMULA([.A60]) -> =BESSELK($L24,N$1)
A61: of:=BESSELK([.$L25];[.N$1]) -> 1.62483889612911 | B61: 1.62483889612911 | C61: of:=ORG.LIBREOFFICE.ROUNDSIG([.A61];12)=ORG.LIBREOFFICE.ROUNDSIG([.B61];12) -> true | D61: of:=FORMULA([.A61]) -> =BESSELK($L25,N$1)
A62: of:=BESSELK([.$L2];[.O$1]) -> 4.86986222903781E-045 | B62: 4.86986222903781E-045 | C62: of:=ORG.LIBREOFFICE.ROUNDSIG([.A62];12)=ORG.LIBREOFFICE.ROUNDSIG([.B62];12) -> true | D62: of:=FORMULA([.A62]) -> =BESSELK($L2,O$1)
A63: of:=BESSELK([.$L3];[.O$1]) -> 1.13613243323445E-040 | B63: 1.13613243323445E-040 | C63: of:=ORG.LIBREOFFICE.ROUNDSIG([.A63];12)=ORG.LIBREOFFICE.ROUNDSIG([.B63];12) -> true | D63: of:=FORMULA([.A63]) -> =BESSELK($L3,O$1)
A64: of:=BESSELK([.$L4];[.O$1]) -> 2.67028486519629E-036 | B64: 2.67028486519629E-036 | C64: of:=ORG.LIBREOFFICE.ROUNDSIG([.A64];12)=ORG.LIBREOFFICE.ROUNDSIG([.B64];12) -> true | D64: of:=FORMULA([.A64]) -> =BESSELK($L4,O$1)
A65: of:=BESSELK([.$L5];[.O$1]) -> 6.33644245104878E-032 | B65: 6.33644245104878E-032 | C65: of:=ORG.LIBREOFFICE.ROUNDSIG([.A65];12)=ORG.LIBREOFFICE.ROUNDSIG([.B65];12) -> true | D65: of:=FORMULA([.A65]) -> =BESSELK($L5,O$1)
A66: of:=BESSELK([.$L6];[.O$1]) -> 1.52305974923766E-027 | B66: 1.52305974923766E-027 | C66: of:=ORG.LIBREOFFICE.ROUNDSIG([.A66];12)=ORG.LIBREOFFICE.ROUNDSIG([.B66];12) -> true | D66: of:=FORMULA([.A66]) -> =BESSELK($L6,O$1)
A67: of:=BESSELK([.$L7];[.O$1]) -> 3.72793625473641E-023 | B67: 3.72793625473641E-023 | C67: of:=ORG.LIBREOFFICE.ROUNDSIG([.A67];12)=ORG.LIBREOFFICE.ROUNDSIG([.B67];12) -> true | D67: of:=FORMULA([.A67]) -> =BESSELK($L7,O$1)
A68: of:=BESSELK([.$L8];[.O$1]) -> 9.37890242295171E-019 | B68: 9.37890242295171E-019 | C68: of:=ORG.LIBREOFFICE.ROUNDSIG([.A68];12)=ORG.LIBREOFFICE.ROUNDSIG([.B68];12) -> true | D68: of:=FORMULA([.A68]) -> =BESSELK($L8,O$1)
A69: of:=BESSELK([.$L9];[.O$1]) -> 8.90309997830511E-015 | B69: 8.90309997830511E-015 | C69: of:=ORG.LIBREOFFICE.ROUNDSIG([.A69];12)=ORG.LIBREOFFICE.ROUNDSIG([.B69];12) -> true | D69: of:=FORMULA([.A69]) -> =BESSELK($L9,O$1)
A70: of:=BESSELK([.$L10];[.O$1]) -> 0.0000000000000247133075712534 | B70: 0.0000000000000247133075712534 | C70: of:=ORG.LIBREOFFICE.ROUNDSIG([.A70];12)=ORG.LIBREOFFICE.ROUNDSIG([.B70];12) -> true | D70: of:=FORMULA([.A70]) -> =BESSELK($L10,O$1)
A71: of:=BESSELK([.$L11];[.O$1]) -> 0.0000000000000686587053261952 | B71: 0.0000000000000686587053261952 | C71: of:=ORG.LIBREOFFICE.ROUNDSIG([.A71];12)=ORG.LIBREOFFICE.ROUNDSIG([.B71];12) -> true | D71: of:=FORMULA([.A71]) -> =BESSELK($L11,O$1)
A72: of:=BESSELK([.$L12];[.O$1]) -> 0.000000000000190926604894301 | B72: 0.000000000000190926604894301 | C72: of:=ORG.LIBREOFFICE.ROUNDSIG([.A72];12)=ORG.LIBREOFFICE.ROUNDSIG([.B72];12) -> true | D72: of:=FORMULA([.A72]) -> =BESSELK($L12,O$1)
A73: of:=BESSELK([.$L13];[.O$1]) -> 0.00000000000413226304693452 | B73: 0.00000000000413226304693452 | C73: of:=ORG.LIBREOFFICE.ROUNDSIG([.A73];12)=ORG.LIBREOFFICE.ROUNDSIG([.B73];12) -> true | D73: of:=FORMULA([.A73]) -> =BESSELK($L13,O$1)
A74: of:=BESSELK([.$L14];[.O$1]) -> 0.000000000714896616228512 | B74: 0.000000000714896616228512 | C74: of:=ORG.LIBREOFFICE.ROUNDSIG([.A74];12)=ORG.LIBREOFFICE.ROUNDSIG([.B74];12) -> true | D74: of:=FORMULA([.A74]) -> =BESSELK($L14,O$1)
A75: of:=BESSELK([.$L15];[.O$1]) -> 0.000000131208668849539 | B75: 0.000000131208668849539 | C75: of:=ORG.LIBREOFFICE.ROUNDSIG([.A75];12)=ORG.LIBREOFFICE.ROUNDSIG([.B75];12) -> true | D75: of:=FORMULA([.A75]) -> =BESSELK($L15,O$1)
A76: of:=BESSELK([.$L16];[.O$1]) -> 0.0000272527006358476 | B76: 0.0000272527006358476 | C76: of:=ORG.LIBREOFFICE.ROUNDSIG([.A76];12)=ORG.LIBREOFFICE.ROUNDSIG([.B76];12) -> true | D76: of:=FORMULA([.A76]) -> =BESSELK($L16,O$1)
A77: of:=BESSELK([.$L17];[.O$1]) -> 0.0000815484176389216 | B77: 0.0000815484176389216 | C77: of:=ORG.LIBREOFFICE.ROUNDSIG([.A77];12)=ORG.LIBREOFFICE.ROUNDSIG([.B77];12) -> true | D77: of:=FORMULA([.A77]) -> =BESSELK($L17,O$1)
A78: of:=BESSELK([.$L18];[.O$1]) -> 0.000248025719270793 | B78: 0.000248025719270793 | C78: of:=ORG.LIBREOFFICE.ROUNDSIG([.A78];12)=ORG.LIBREOFFICE.ROUNDSIG([.B78];12) -> true | D78: of:=FORMULA([.A78]) -> =BESSELK($L18,O$1)
A79: of:=BESSELK([.$L19];[.O$1]) -> 0.00077107515923547 | B79: 0.00077107515923547 | C79: of:=ORG.LIBREOFFICE.ROUNDSIG([.A79];12)=ORG.LIBREOFFICE.ROUNDSIG([.B79];12) -> true | D79: of:=FORMULA([.A79]) -> =BESSELK($L19,O$1)
A80: of:=BESSELK([.$L20];[.O$1]) -> 0.0024718980938269 | B80: 0.0024718980938269 | C80: of:=ORG.LIBREOFFICE.ROUNDSIG([.A80];12)=ORG.LIBREOFFICE.ROUNDSIG([.B80];12) -> true | D80: of:=FORMULA([.A80]) -> =BESSELK($L20,O$1)
A81: of:=BESSELK([.$L21];[.O$1]) -> 0.00829176837140317 | B81: 0.00829176837140317 | C81: of:=ORG.LIBREOFFICE.ROUNDSIG([.A81];12)=ORG.LIBREOFFICE.ROUNDSIG([.B81];12) -> true | D81: of:=FORMULA([.A81]) -> =BESSELK($L21,O$1)
A82: of:=BESSELK([.$L22];[.O$1]) -> 0.0298849244317078 | B82: 0.0298849244317078 | C82: of:=ORG.LIBREOFFICE.ROUNDSIG([.A82];12)=ORG.LIBREOFFICE.ROUNDSIG([.B82];12) -> true | D82: of:=FORMULA([.A82]) -> =BESSELK($L22,O$1)
A83: of:=BESSELK([.$L23];[.O$1]) -> 0.122170375993133 | B83: 0.122170375993133 | C83: of:=ORG.LIBREOFFICE.ROUNDSIG([.A83];12)=ORG.LIBREOFFICE.ROUNDSIG([.B83];12) -> true | D83: of:=FORMULA([.A83]) -> =BESSELK($L23,O$1)
A84: of:=BESSELK([.$L24];[.O$1]) -> 0.6473854 | B84: 0.6473854 | C84: of:=ORG.LIBREOFFICE.ROUNDSIG([.A84];12)=ORG.LIBREOFFICE.ROUNDSIG([.B84];12) -> true | D84: of:=FORMULA([.A84]) -> =BESSELK($L24,O$1)
A85: of:=BESSELK([.$L25];[.O$1]) -> 7.10126281173988 | B85: 7.10126281173988 | C85: of:=ORG.LIBREOFFICE.ROUNDSIG([.A85];12)=ORG.LIBREOFFICE.ROUNDSIG([.B85];12) -> true | D85: of:=FORMULA([.A85]) -> =BESSELK($L25,O$1)
A86: of:=BESSELK([.$L2];[.P$1]) -> 5.04241749568455E-045 | B86: 5.04241749568455E-045 | C86: of:=ORG.LIBREOFFICE.ROUNDSIG([.A86];12)=ORG.LIBREOFFICE.ROUNDSIG([.B86];12) -> true | D86: of:=FORMULA([.A86]) -> =BESSELK($L2,P$1)
A87: of:=BESSELK([.$L3];[.P$1]) -> 1.18092238558352E-040 | B87: 1.18092238558352E-040 | C87: of:=ORG.LIBREOFFICE.ROUNDSIG([.A87];12)=ORG.LIBREOFFICE.ROUNDSIG([.B87];12) -> true | D87: of:=FORMULA([.A87]) -> =BESSELK($L3,P$1)
A88: of:=BESSELK([.$L4];[.P$1]) -> 2.7889128182057E-036 | B88: 2.7889128182057E-036 | C88: of:=ORG.LIBREOFFICE.ROUNDSIG([.A88];12)=ORG.LIBREOFFICE.ROUNDSIG([.B88];12) -> true | D88: of:=FORMULA([.A88]) -> =BESSELK($L4,P$1)
A89: of:=BESSELK([.$L5];[.P$1]) -> 6.65884207739386E-032 | B89: 6.65884207739386E-032 | C89: of:=ORG.LIBREOFFICE.ROUNDSIG([.A89];12)=ORG.LIBREOFFICE.ROUNDSIG([.B89];12) -> true | D89: of:=FORMULA([.A89]) -> =BESSELK($L5,P$1)
A90: of:=BESSELK([.$L6];[.P$1]) -> 1.61372506311907E-027 | B90: 1.61372506311907E-027 | C90: of:=ORG.LIBREOFFICE.ROUNDSIG([.A90];12)=ORG.LIBREOFFICE.ROUNDSIG([.B90];12) -> true | D90: of:=FORMULA([.A90]) -> =BESSELK($L6,P$1)
A91: of:=BESSELK([.$L7];[.P$1]) -> 3.99528464733676E-023 | B91: 3.99528464733676E-023 | C91: of:=ORG.LIBREOFFICE.ROUNDSIG([.A91];12)=ORG.LIBREOFFICE.ROUNDSIG([.B91];12) -> true | D91: of:=FORMULA([.A91]) -> =BESSELK($L7,P$1)
A92: of:=BESSELK([.$L8];[.P$1]) -> 1.02245542143352E-018 | B92: 1.02245542143352E-018 | C92: of:=ORG.LIBREOFFICE.ROUNDSIG([.A92];12)=ORG.LIBREOFFICE.ROUNDSIG([.B92];12) -> true | D92: of:=FORMULA([.A92]) -> =BESSELK($L8,P$1)
A93: of:=BESSELK([.$L9];[.P$1]) -> 9.94749330990622E-015 | B93: 9.94749330990622E-015 | C93: of:=ORG.LIBREOFFICE.ROUNDSIG([.A93];12)=ORG.LIBREOFFICE.ROUNDSIG([.B93];12) -> true | D93: of:=FORMULA([.A93]) -> =BESSELK($L9,P$1)
A94: of:=BESSELK([.$L10];[.P$1]) -> 0.0000000000000277125938886786 | B94: 0.0000000000000277125938886786 | C94: of:=ORG.LIBREOFFICE.ROUNDSIG([.A94];12)=ORG.LIBREOFFICE.ROUNDSIG([.B94];12) -> true | D94: of:=FORMULA([.A94]) -> =BESSELK($L10,P$1)
A95: of:=BESSELK([.$L11];[.P$1]) -> 0.0000000000000772897574405993 | B95: 0.0000000000000772897574405993 | C95: of:=ORG.LIBREOFFICE.ROUNDSIG([.A95];12)=ORG.LIBREOFFICE.ROUNDSIG([.B95];12) -> true | D95: of:=FORMULA([.A95]) -> =BESSELK($L11,P$1)
A96: of:=BESSELK([.$L12];[.P$1]) -> 0.000000000000215819180693614 | B96: 0.000000000000215819180693614 | C96: of:=ORG.LIBREOFFICE.ROUNDSIG([.A96];12)=ORG.LIBREOFFICE.ROUNDSIG([.B96];12) -> true | D96: of:=FORMULA([.A96]) -> =BESSELK($L12,P$1)
A97: of:=BESSELK([.$L13];[.P$1]) -> 0.00000000000473852733286629 | B97: 0.00000000000473852733286629 | C97: of:=ORG.LIBREOFFICE.ROUNDSIG([.A97];12)=ORG.LIBREOFFICE.ROUNDSIG([.B97];12) -> true | D97: of:=FORMULA([.A97]) -> =BESSELK($L13,P$1)
A98: of:=BESSELK([.$L14];[.P$1]) -> 0.000000000847423394950491 | B98: 0.000000000847423394950491 | C98: of:=ORG.LIBREOFFICE.ROUNDSIG([.A98];12)=ORG.LIBREOFFICE.ROUNDSIG([.B98];12) -> true | D98: of:=FORMULA([.A98]) -> =BESSELK($L14,P$1)
A99: of:=BESSELK([.$L15];[.P$1]) -> 0.000000164201141861661 | B99: 0.000000164201141861661 | C99: of:=ORG.LIBREOFFICE.ROUNDSIG([.A99];12)=ORG.LIBREOFFICE.ROUNDSIG([.B99];12) -> true | D99: of:=FORMULA([.A99]) -> =BESSELK($L15,P$1)
A100: of:=BESSELK([.$L16];[.P$1]) -> 0.000037861437104005 | B100: 0.000037861437104005 | C100: of:=ORG.LIBREOFFICE.ROUNDSIG([.A100];12)=ORG.LIBREOFFICE.ROUNDSIG([.B100];12) -> true | D100: of:=FORMULA([.A100]) -> =BESSELK($L16,P$1)
A101: of:=BESSELK([.$L17];[.P$1]) -> 0.000117166260653886 | B101: 0.000117166260653886 | C101: of:=ORG.LIBREOFFICE.ROUNDSIG([.A101];12)=ORG.LIBREOFFICE.ROUNDSIG([.B101];12) -> true | D101: of:=FORMULA([.A101]) -> =BESSELK($L17,P$1)
A102: of:=BESSELK([.$L18];[.P$1]) -> 0.000371332294784901 | B102: 0.000371332294784901 | C102: of:=ORG.LIBREOFFICE.ROUNDSIG([.A102];12)=ORG.LIBREOFFICE.ROUNDSIG([.B102];12) -> true | D102: of:=FORMULA([.A102]) -> =BESSELK($L18,P$1)
A103: of:=BESSELK([.$L19];[.P$1]) -> 0.00121548372648576 | B103: 0.00121548372648576 | C103: of:=ORG.LIBREOFFICE.ROUNDSIG([.A103];12)=ORG.LIBREOFFICE.ROUNDSIG([.B103];12) -> true | D103: of:=FORMULA([.A103]) -> =BESSELK($L19,P$1)
A104: of:=BESSELK([.$L20];[.P$1]) -> 0.00416386565945236 | B104: 0.00416386565945236 | C104: of:=ORG.LIBREOFFICE.ROUNDSIG([.A104];12)=ORG.LIBREOFFICE.ROUNDSIG([.B104];12) -> true | D104: of:=FORMULA([.A104]) -> =BESSELK($L20,P$1)
A105: of:=BESSELK([.$L21];[.P$1]) -> 0.0152590657809274 | B105: 0.0152590657809274 | C105: of:=ORG.LIBREOFFICE.ROUNDSIG([.A105];12)=ORG.LIBREOFFICE.ROUNDSIG([.B105];12) -> true | D105: of:=FORMULA([.A105]) -> =BESSELK($L21,P$1)
A106: of:=BESSELK([.$L22];[.P$1]) -> 0.0622288121911091 | B106: 0.0622288121911091 | C106: of:=ORG.LIBREOFFICE.ROUNDSIG([.A106];12)=ORG.LIBREOFFICE.ROUNDSIG([.B106];12) -> true | D106: of:=FORMULA([.A106]) -> =BESSELK($L22,P$1)
A107: of:=BESSELK([.$L23];[.P$1]) -> 0.305851210548178 | B107: 0.305851210548178 | C107: of:=ORG.LIBREOFFICE.ROUNDSIG([.A107];12)=ORG.LIBREOFFICE.ROUNDSIG([.B107];12) -> true | D107: of:=FORMULA([.A107]) -> =BESSELK($L23,P$1)
A108: of:=BESSELK([.$L24];[.P$1]) -> 2.19591596 | B108: 2.19591596 | C108: of:=ORG.LIBREOFFICE.ROUNDSIG([.A108];12)=ORG.LIBREOFFICE.ROUNDSIG([.B108];12) -> true | D108: of:=FORMULA([.A108]) -> =BESSELK($L24,P$1)
A109: of:=BESSELK([.$L25];[.P$1]) -> 44.2324157665684 | B109: 44.2324157665684 | C109: of:=ORG.LIBREOFFICE.ROUNDSIG([.A109];12)=ORG.LIBREOFFICE.ROUNDSIG([.B109];12) -> true | D109: of:=FORMULA([.A109]) -> =BESSELK($L25,P$1)
A110: of:=BESSELK([.$L2];[.Q$1]) -> 5.27325562869257E-045 | B110: 5.27325562869257E-045 | C110: of:=ORG.LIBREOFFICE.ROUNDSIG([.A110];12)=ORG.LIBREOFFICE.ROUNDSIG([.B110];12) -> true | D110: of:=FORMULA([.A110]) -> =BESSELK($L2,Q$1)
A111: of:=BESSELK([.$L3];[.Q$1]) -> 1.24110331195299E-040 | B111: 1.24110331195299E-040 | C111: of:=ORG.LIBREOFFICE.ROUNDSIG([.A111];12)=ORG.LIBREOFFICE.ROUNDSIG([.B111];12) -> true | D111: of:=FORMULA([.A111]) -> =BESSELK($L3,Q$1)
A112: of:=BESSELK([.$L4];[.Q$1]) -> 2.94917614701686E-036 | B112: 2.94917614701686E-036 | C112: of:=ORG.LIBREOFFICE.ROUNDSIG([.A112];12)=ORG.LIBREOFFICE.ROUNDSIG([.B112];12) -> true | D112: of:=FORMULA([.A112]) -> =BESSELK($L4,Q$1)
A113: of:=BESSELK([.$L5];[.Q$1]) -> 7.0974529741795E-032 | B113: 7.0974529741795E-032 | C113: of:=ORG.LIBREOFFICE.ROUNDSIG([.A113];12)=ORG.LIBREOFFICE.ROUNDSIG([.B113];12) -> true | D113: of:=FORMULA([.A113]) -> =BESSELK($L5,Q$1)
A114: of:=BESSELK([.$L6];[.Q$1]) -> 1.73822309098687E-027 | B114: 1.73822309098687E-027 | C114: of:=ORG.LIBREOFFICE.ROUNDSIG([.A114];12)=ORG.LIBREOFFICE.ROUNDSIG([.B114];12) -> true | D114: of:=FORMULA([.A114]) -> =BESSELK($L6,Q$1)
A115: of:=BESSELK([.$L7];[.Q$1]) -> 4.36718179831029E-023 | B115: 4.36718179831029E-023 | C115: of:=ORG.LIBREOFFICE.ROUNDSIG([.A115];12)=ORG.LIBREOFFICE.ROUNDSIG([.B115];12) -> true | D115: of:=FORMULA([.A115]) -> =BESSELK($L7,Q$1)
A116: of:=BESSELK([.$L8];[.Q$1]) -> 1.14238132658187E-018 | B116: 1.14238132658187E-018 | C116: of:=ORG.LIBREOFFICE.ROUNDSIG([.A116];12)=ORG.LIBREOFFICE.ROUNDSIG([.B116];12) -> true | D116: of:=FORMULA([.A116]) -> =BESSELK($L8,Q$1)
A117: of:=BESSELK([.$L9];[.Q$1]) -> 0.0000000000000114701950260229 | B117: 0.0000000000000114701950260229 | C117: of:=ORG.LIBREOFFICE.ROUNDSIG([.A117];12)=ORG.LIBREOFFICE.ROUNDSIG([.B117];12) -> true | D117: of:=FORMULA([.A117]) -> =BESSELK($L9,Q$1)
A118: of:=BESSELK([.$L10];[.Q$1]) -> 0.0000000000000321033326082344 | B118: 0.0000000000000321033326082344 | C118: of:=ORG.LIBREOFFICE.ROUNDSIG([.A118];12)=ORG.LIBREOFFICE.ROUNDSIG([.B118];12) -> true | D118: of:=FORMULA([.A118]) -> =BESSELK($L10,Q$1)
A119: of:=BESSELK([.$L11];[.Q$1]) -> 0.0000000000000899800177236019 | B119: 0.0000000000000899800177236019 | C119: of:=ORG.LIBREOFFICE.ROUNDSIG([.A119];12)=ORG.LIBREOFFICE.ROUNDSIG([.B119];12) -> true | D119: of:=FORMULA([.A119]) -> =BESSELK($L11,Q$1)
A120: of:=BESSELK([.$L12];[.Q$1]) -> 0.000000000000252589227949619 | B120: 0.000000000000252589227949619 | C120: of:=ORG.LIBREOFFICE.ROUNDSIG([.A120];12)=ORG.LIBREOFFICE.ROUNDSIG([.B120];12) -> true | D120: of:=FORMULA([.A120]) -> =BESSELK($L12,Q$1)
A121: of:=BESSELK([.$L13];[.Q$1]) -> 0.00000000000564859179345174 | B121: 0.00000000000564859179345174 | C121: of:=ORG.LIBREOFFICE.ROUNDSIG([.A121];12)=ORG.LIBREOFFICE.ROUNDSIG([.B121];12) -> true | D121: of:=FORMULA([.A121]) -> =BESSELK($L13,Q$1)
A122: of:=BESSELK([.$L14];[.Q$1]) -> 0.00000000105386597420871 | B122: 0.00000000105386597420871 | C122: of:=ORG.LIBREOFFICE.ROUNDSIG([.A122];12)=ORG.LIBREOFFICE.ROUNDSIG([.B122];12) -> true | D122: of:=FORMULA([.A122]) -> =BESSELK($L14,Q$1)
A123: of:=BESSELK([.$L15];[.Q$1]) -> 0.000000218782611175758 | B123: 0.000000218782611175758 | C123: of:=ORG.LIBREOFFICE.ROUNDSIG([.A123];12)=ORG.LIBREOFFICE.ROUNDSIG([.B123];12) -> true | D123: of:=FORMULA([.A123]) -> =BESSELK($L15,Q$1)
A124: of:=BESSELK([.$L16];[.Q$1]) -> 0.0000575418503190517 | B124: 0.0000575418503190517 | C124: of:=ORG.LIBREOFFICE.ROUNDSIG([.A124];12)=ORG.LIBREOFFICE.ROUNDSIG([.B124];12) -> true | D124: of:=FORMULA([.A124]) -> =BESSELK($L16,Q$1)
A125: of:=BESSELK([.$L17];[.Q$1]) -> 0.000185696204886821 | B125: 0.000185696204886821 | C125: of:=ORG.LIBREOFFICE.ROUNDSIG([.A125];12)=ORG.LIBREOFFICE.ROUNDSIG([.B125];12) -> true | D125: of:=FORMULA([.A125]) -> =BESSELK($L17,Q$1)
A126: of:=BESSELK([.$L18];[.Q$1]) -> 0.000619358014055694 | B126: 0.000619358014055694 | C126: of:=ORG.LIBREOFFICE.ROUNDSIG([.A126];12)=ORG.LIBREOFFICE.ROUNDSIG([.B126];12) -> true | D126: of:=FORMULA([.A126]) -> =BESSELK($L18,Q$1)
A127: of:=BESSELK([.$L19];[.Q$1]) -> 0.00216019941807633 | B127: 0.00216019941807633 | C127: of:=ORG.LIBREOFFICE.ROUNDSIG([.A127];12)=ORG.LIBREOFFICE.ROUNDSIG([.B127];12) -> true | D127: of:=FORMULA([.A127]) -> =BESSELK($L19,Q$1)
A128: of:=BESSELK([.$L20];[.Q$1]) -> 0.00802371897309671 | B128: 0.00802371897309671 | C128: of:=ORG.LIBREOFFICE.ROUNDSIG([.A128];12)=ORG.LIBREOFFICE.ROUNDSIG([.B128];12) -> true | D128: of:=FORMULA([.A128]) -> =BESSELK($L20,Q$1)
A129: of:=BESSELK([.$L21];[.Q$1]) -> 0.032706273620887 | B129: 0.032706273620887 | C129: of:=ORG.LIBREOFFICE.ROUNDSIG([.A129];12)=ORG.LIBREOFFICE.ROUNDSIG([.B129];12) -> true | D129: of:=FORMULA([.A129]) -> =BESSELK($L21,Q$1)
A130: of:=BESSELK([.$L22];[.Q$1]) -> 0.154342548813926 | B130: 0.154342548813926 | C130: of:=ORG.LIBREOFFICE.ROUNDSIG([.A130];12)=ORG.LIBREOFFICE.ROUNDSIG([.B130];12) -> true | D130: of:=FORMULA([.A130]) -> =BESSELK($L22,Q$1)
A131: of:=BESSELK([.$L23];[.Q$1]) -> 0.937773604121608 | B131: 0.937773604121608 | C131: of:=ORG.LIBREOFFICE.ROUNDSIG([.A131];12)=ORG.LIBREOFFICE.ROUNDSIG([.B131];12) -> true | D131: of:=FORMULA([.A131]) -> =BESSELK($L23,Q$1)
A132: of:=BESSELK([.$L24];[.Q$1]) -> 9.43104924 | B132: 9.43104924 | C132: of:=ORG.LIBREOFFICE.ROUNDSIG([.A132];12)=ORG.LIBREOFFICE.ROUNDSIG([.B132];12) -> true | D132: of:=FORMULA([.A132]) -> =BESSELK($L24,Q$1)
A133: of:=BESSELK([.$L25];[.Q$1]) -> 360.960588944287 | B133: 360.960588944287 | C133: of:=ORG.LIBREOFFICE.ROUNDSIG([.A133];12)=ORG.LIBREOFFICE.ROUNDSIG([.B133];12) -> true | D133: of:=FORMULA([.A133]) -> =BESSELK($L25,Q$1)
A134: of:=BESSELK([.$L2];[.R$1]) -> 5.5697430585538E-045 | B134: 5.5697430585538E-045 | C134: of:=ORG.LIBREOFFICE.ROUNDSIG([.A134];12)=ORG.LIBREOFFICE.ROUNDSIG([.B134];12) -> true | D134: of:=FORMULA([.A134]) -> =BESSELK($L2,R$1)
A135: of:=BESSELK([.$L3];[.R$1]) -> 1.31882275357829E-040 | B135: 1.31882275357829E-040 | C135: of:=ORG.LIBREOFFICE.ROUNDSIG([.A135];12)=ORG.LIBREOFFICE.ROUNDSIG([.B135];12) -> true | D135: of:=FORMULA([.A135]) -> =BESSELK($L3,R$1)
A136: of:=BESSELK([.$L4];[.R$1]) -> 3.15755983658281E-036 | B136: 3.15755983658281E-036 | C136: of:=ORG.LIBREOFFICE.ROUNDSIG([.A136];12)=ORG.LIBREOFFICE.ROUNDSIG([.B136];12) -> true | D136: of:=FORMULA([.A136]) -> =BESSELK($L4,R$1)
A137: of:=BESSELK([.$L5];[.R$1]) -> 7.67276393084807E-032 | B137: 7.67276393084807E-032 | C137: of:=ORG.LIBREOFFICE.ROUNDSIG([.A137];12)=ORG.LIBREOFFICE.ROUNDSIG([.B137];12) -> true | D137: of:=FORMULA([.A137]) -> =BESSELK($L5,R$1)
A138: of:=BESSELK([.$L6];[.R$1]) -> 1.90342891161688E-027 | B138: 1.90342891161688E-027 | C138: of:=ORG.LIBREOFFICE.ROUNDSIG([.A138];12)=ORG.LIBREOFFICE.ROUNDSIG([.B138];12) -> true | D138: of:=FORMULA([.A138]) -> =BESSELK($L6,R$1)
A139: of:=BESSELK([.$L7];[.R$1]) -> 4.86872100699881E-023 | B139: 4.86872100699881E-023 | C139: of:=ORG.LIBREOFFICE.ROUNDSIG([.A139];12)=ORG.LIBREOFFICE.ROUNDSIG([.B139];12) -> true | D139: of:=FORMULA([.A139]) -> =BESSELK($L7,R$1)
A140: of:=BESSELK([.$L8];[.R$1]) -> 1.30805075307899E-018 | B140: 1.30805075307899E-018 | C140: of:=ORG.LIBREOFFICE.ROUNDSIG([.A140];12)=ORG.LIBREOFFICE.ROUNDSIG([.B140];12) -> true | D140: of:=FORMULA([.A140]) -> =BESSELK($L8,R$1)
A141: of:=BESSELK([.$L9];[.R$1]) -> 0.0000000000000136475562215265 | B141: 0.0000000000000136475562215265 | C141: of:=ORG.LIBREOFFICE.ROUNDSIG([.A141];12)=ORG.LIBREOFFICE.ROUNDSIG([.B141];12) -> true | D141: of:=FORMULA([.A141]) -> =BESSELK($L9,R$1)
A142: of:=BESSELK([.$L10];[.R$1]) -> 0.0000000000000384137047580901 | B142: 0.0000000000000384137047580901 | C142: of:=ORG.LIBREOFFICE.ROUNDSIG([.A142];12)=ORG.LIBREOFFICE.ROUNDSIG([.B142];12) -> true | D142: of:=FORMULA([.A142]) -> =BESSELK($L10,R$1)
A143: of:=BESSELK([.$L11];[.R$1]) -> 0.000000000000108317349759083 | B143: 0.000000000000108317349759083 | C143: of:=ORG.LIBREOFFICE.ROUNDSIG([.A143];12)=ORG.LIBREOFFICE.ROUNDSIG([.B143];12) -> true | D143: of:=FORMULA([.A143]) -> =BESSELK($L11,R$1)
A144: of:=BESSELK([.$L12];[.R$1]) -> 0.000000000000306029619247049 | B144: 0.000000000000306029619247049 | C144: of:=ORG.LIBREOFFICE.ROUNDSIG([.A144];12)=ORG.LIBREOFFICE.ROUNDSIG([.B144];12) -> true | D144: of:=FORMULA([.A144]) -> =BESSELK($L12,R$1)
A145: of:=BESSELK([.$L13];[.R$1]) -> 0.00000000000699796405024699 | B145: 0.00000000000699796405024699 | C145: of:=ORG.LIBREOFFICE.ROUNDSIG([.A145];12)=ORG.LIBREOFFICE.ROUNDSIG([.B145];12) -> true | D145: of:=FORMULA([.A145]) -> =BESSELK($L13,R$1)
A146: of:=BESSELK([.$L14];[.R$1]) -> 0.00000000137435638205485 | B146: 0.00000000137435638205485 | C146: of:=ORG.LIBREOFFICE.ROUNDSIG([.A146];12)=ORG.LIBREOFFICE.ROUNDSIG([.B146];12) -> true | D146: of:=FORMULA([.A146]) -> =BESSELK($L14,R$1)
A147: of:=BESSELK([.$L15];[.R$1]) -> 0.000000310056215978833 | B147: 0.000000310056215978833 | C147: of:=ORG.LIBREOFFICE.ROUNDSIG([.A147];12)=ORG.LIBREOFFICE.ROUNDSIG([.B147];12) -> true | D147: of:=FORMULA([.A147]) -> =BESSELK($L15,R$1)
A148: of:=BESSELK([.$L16];[.R$1]) -> 0.0000954032874230567 | B148: 0.0000954032874230567 | C148: of:=ORG.LIBREOFFICE.ROUNDSIG([.A148];12)=ORG.LIBREOFFICE.ROUNDSIG([.B148];12) -> true | D148: of:=FORMULA([.A148]) -> =BESSELK($L16,R$1)
A149: of:=BESSELK([.$L17];[.R$1]) -> 0.000323495377194798 | B149: 0.000323495377194798 | C149: of:=ORG.LIBREOFFICE.ROUNDSIG([.A149];12)=ORG.LIBREOFFICE.ROUNDSIG([.B149];12) -> true | D149: of:=FORMULA([.A149]) -> =BESSELK($L17,R$1)
A150: of:=BESSELK([.$L18];[.R$1]) -> 0.00114552981235452 | B150: 0.00114552981235452 | C150: of:=ORG.LIBREOFFICE.ROUNDSIG([.A150];12)=ORG.LIBREOFFICE.ROUNDSIG([.B150];12) -> true | D150: of:=FORMULA([.A150]) -> =BESSELK($L18,R$1)
A151: of:=BESSELK([.$L19];[.R$1]) -> 0.00430148289516623 | B151: 0.00430148289516623 | C151: of:=ORG.LIBREOFFICE.ROUNDSIG([.A151];12)=ORG.LIBREOFFICE.ROUNDSIG([.B151];12) -> true | D151: of:=FORMULA([.A151]) -> =BESSELK($L19,R$1)
A152: of:=BESSELK([.$L20];[.R$1]) -> 0.0175367306146135 | B152: 0.0175367306146135 | C152: of:=ORG.LIBREOFFICE.ROUNDSIG([.A152];12)=ORG.LIBREOFFICE.ROUNDSIG([.B152];12) -> true | D152: of:=FORMULA([.A152]) -> =BESSELK($L20,R$1)
A153: of:=BESSELK([.$L21];[.R$1]) -> 0.0806716130227015 | B153: 0.0806716130227015 | C153: of:=ORG.LIBREOFFICE.ROUNDSIG([.A153];12)=ORG.LIBREOFFICE.ROUNDSIG([.B153];12) -> true | D153: of:=FORMULA([.A153]) -> =BESSELK($L21,R$1)
A154: of:=BESSELK([.$L22];[.R$1]) -> 0.448085184225924 | B154: 0.448085184225924 | C154: of:=ORG.LIBREOFFICE.ROUNDSIG([.A154];12)=ORG.LIBREOFFICE.ROUNDSIG([.B154];12) -> true | D154: of:=FORMULA([.A154]) -> =BESSELK($L22,R$1)
A155: of:=BESSELK([.$L23];[.R$1]) -> 3.43176322428687 | B155: 3.43176322428687 | C155: of:=ORG.LIBREOFFICE.ROUNDSIG([.A155];12)=ORG.LIBREOFFICE.ROUNDSIG([.B155];12) -> true | D155: of:=FORMULA([.A155]) -> =BESSELK($L23,R$1)
A156: of:=BESSELK([.$L24];[.R$1]) -> 49.35116216 | B156: 49.35116216 | C156: of:=ORG.LIBREOFFICE.ROUNDSIG([.A156];12)=ORG.LIBREOFFICE.ROUNDSIG([.B156];12) -> true | D156: of:=FORMULA([.A156]) -> =BESSELK($L24,R$1)
A157: of:=BESSELK([.$L25];[.R$1]) -> 3653.83830520944 | B157: 3653.83830520944 | C157: of:=ORG.LIBREOFFICE.ROUNDSIG([.A157];12)=ORG.LIBREOFFICE.ROUNDSIG([.B157];12) -> true | D157: of:=FORMULA([.A157]) -> =BESSELK($L25,R$1)
A158: of:=BESSELK([.$L2];[.S$1]) -> 5.94162479571903E-045 | B158: 5.94162479571903E-045 | C158: of:=ORG.LIBREOFFICE.ROUNDSIG([.A158];12)=ORG.LIBREOFFICE.ROUNDSIG([.B158];12) -> true | D158: of:=FORMULA([.A158]) -> =BESSELK($L2,S$1)
A159: of:=BESSELK([.$L3];[.S$1]) -> 1.41694634576343E-040 | B159: 1.41694634576343E-040 | C159: of:=ORG.LIBREOFFICE.ROUNDSIG([.A159];12)=ORG.LIBREOFFICE.ROUNDSIG([.B159];12) -> true | D159: of:=FORMULA([.A159]) -> =BESSELK($L3,S$1)
A160: of:=BESSELK([.$L4];[.S$1]) -> 3.42281012250429E-036 | B160: 3.42281012250429E-036 | C160: of:=ORG.LIBREOFFICE.ROUNDSIG([.A160];12)=ORG.LIBREOFFICE.ROUNDSIG([.B160];12) -> true | D160: of:=FORMULA([.A160]) -> =BESSELK($L4,S$1)
A161: of:=BESSELK([.$L5];[.S$1]) -> 8.41278393375346E-032 | B161: 8.41278393375346E-032 | C161: of:=ORG.LIBREOFFICE.ROUNDSIG([.A161];12)=ORG.LIBREOFFICE.ROUNDSIG([.B161];12) -> true | D161: of:=FORMULA([.A161]) -> =BESSELK($L5,S$1)
A162: of:=BESSELK([.$L6];[.S$1]) -> 2.11890887331025E-027 | B162: 2.11890887331025E-027 | C162: of:=ORG.LIBREOFFICE.ROUNDSIG([.A162];12)=ORG.LIBREOFFICE.ROUNDSIG([.B162];12) -> true | D162: of:=FORMULA([.A162]) -> =BESSELK($L6,S$1)
A163: of:=BESSELK([.$L7];[.S$1]) -> 5.53567483999001E-023 | B163: 5.53567483999001E-023 | C163: of:=ORG.LIBREOFFICE.ROUNDSIG([.A163];12)=ORG.LIBREOFFICE.ROUNDSIG([.B163];12) -> true | D163: of:=FORMULA([.A163]) -> =BESSELK($L7,S$1)
A164: of:=BESSELK([.$L8];[.S$1]) -> 1.53479655250557E-018 | B164: 1.53479655250557E-018 | C164: of:=ORG.LIBREOFFICE.ROUNDSIG([.A164];12)=ORG.LIBREOFFICE.ROUNDSIG([.B164];12) -> true | D164: of:=FORMULA([.A164]) -> =BESSELK($L8,S$1)
A165: of:=BESSELK([.$L9];[.S$1]) -> 0.0000000000000167531200150008 | B165: 0.0000000000000167531200150008 | C165: of:=ORG.LIBREOFFICE.ROUNDSIG([.A165];12)=ORG.LIBREOFFICE.ROUNDSIG([.B165];12) -> true | D165: of:=FORMULA([.A165]) -> =BESSELK($L9,S$1)
A166: of:=BESSELK([.$L10];[.S$1]) -> 0.0000000000000474688145114705 | B166: 0.0000000000000474688145114705 | C166: of:=ORG.LIBREOFFICE.ROUNDSIG([.A166];12)=ORG.LIBREOFFICE.ROUNDSIG([.B166];12) -> true | D166: of:=FORMULA([.A166]) -> =BESSELK($L10,S$1)
A167: of:=BESSELK([.$L11];[.S$1]) -> 0.000000000000134800990037705 | B167: 0.000000000000134800990037705 | C167: of:=ORG.LIBREOFFICE.ROUNDSIG([.A167];12)=ORG.LIBREOFFICE.ROUNDSIG([.B167];12) -> true | D167: of:=FORMULA([.A167]) -> =BESSELK($L11,S$1)
A168: of:=BESSELK([.$L12];[.S$1]) -> 0.000000000000383744779055497 | B168: 0.000000000000383744779055497 | C168: of:=ORG.LIBREOFFICE.ROUNDSIG([.A168];12)=ORG.LIBREOFFICE.ROUNDSIG([.B168];12) -> true | D168: of:=FORMULA([.A168]) -> =BESSELK($L12,S$1)
A169: of:=BESSELK([.$L13];[.S$1]) -> 0.00000000000900761453757029 | B169: 0.00000000000900761453757029 | C169: of:=ORG.LIBREOFFICE.ROUNDSIG([.A169];12)=ORG.LIBREOFFICE.ROUNDSIG([.B169];12) -> true | D169: of:=FORMULA([.A169]) -> =BESSELK($L13,S$1)
A170: of:=BESSELK([.$L14];[.S$1]) -> 0.00000000187847980344162 | B170: 0.00000000187847980344162 | C170: of:=ORG.LIBREOFFICE.ROUNDSIG([.A170];12)=ORG.LIBREOFFICE.ROUNDSIG([.B170];12) -> true | D170: of:=FORMULA([.A170]) -> =BESSELK($L14,S$1)
A171: of:=BESSELK([.$L15];[.S$1]) -> 0.000000466827583958825 | B171: 0.000000466827583958825 | C171: of:=ORG.LIBREOFFICE.ROUNDSIG([.A171];12)=ORG.LIBREOFFICE.ROUNDSIG([.B171];12) -> true | D171: of:=FORMULA([.A171]) -> =BESSELK($L15,S$1)
A172: of:=BESSELK([.$L16];[.S$1]) -> 0.00017202579522672 | B172: 0.00017202579522672 | C172: of:=ORG.LIBREOFFICE.ROUNDSIG([.A172];12)=ORG.LIBREOFFICE.ROUNDSIG([.B172];12) -> true | D172: of:=FORMULA([.A172]) -> =BESSELK($L16,S$1)
A173: of:=BESSELK([.$L17];[.S$1]) -> 0.000617023374479885 | B173: 0.000617023374479885 | C173: of:=ORG.LIBREOFFICE.ROUNDSIG([.A173];12)=ORG.LIBREOFFICE.ROUNDSIG([.B173];12) -> true | D173: of:=FORMULA([.A173]) -> =BESSELK($L17,S$1)
A174: of:=BESSELK([.$L18];[.S$1]) -> 0.00233765273258747 | B174: 0.00233765273258747 | C174: of:=ORG.LIBREOFFICE.ROUNDSIG([.A174];12)=ORG.LIBREOFFICE.ROUNDSIG([.B174];12) -> true | D174: of:=FORMULA([.A174]) -> =BESSELK($L18,S$1)
A175: of:=BESSELK([.$L19];[.S$1]) -> 0.00953417009550416 | B175: 0.00953417009550416 | C175: of:=ORG.LIBREOFFICE.ROUNDSIG([.A175];12)=ORG.LIBREOFFICE.ROUNDSIG([.B175];12) -> true | D175: of:=FORMULA([.A175]) -> =BESSELK($L19,S$1)
A176: of:=BESSELK([.$L20];[.S$1]) -> 0.0430971802023238 | B176: 0.0430971802023238 | C176: of:=ORG.LIBREOFFICE.ROUNDSIG([.A176];12)=ORG.LIBREOFFICE.ROUNDSIG([.B176];12) -> true | D176: of:=FORMULA([.A176]) -> =BESSELK($L20,S$1)
A177: of:=BESSELK([.$L21];[.S$1]) -> 0.226318144875371 | B177: 0.226318144875371 | C177: of:=ORG.LIBREOFFICE.ROUNDSIG([.A177];12)=ORG.LIBREOFFICE.ROUNDSIG([.B177];12) -> true | D177: of:=FORMULA([.A177]) -> =BESSELK($L21,S$1)
A178: of:=BESSELK([.$L22];[.S$1]) -> 1.4985981014917 | B178: 1.4985981014917 | C178: of:=ORG.LIBREOFFICE.ROUNDSIG([.A178];12)=ORG.LIBREOFFICE.ROUNDSIG([.B178];12) -> true | D178: of:=FORMULA([.A178]) -> =BESSELK($L22,S$1)
A179: of:=BESSELK([.$L23];[.S$1]) -> 14.6648265012691 | B179: 14.6648265012691 | C179: of:=ORG.LIBREOFFICE.ROUNDSIG([.A179];12)=ORG.LIBREOFFICE.ROUNDSIG([.B179];12) -> true | D179: of:=FORMULA([.A179]) -> =BESSELK($L23,S$1)
A180: of:=BESSELK([.$L24];[.S$1]) -> 305.5380222 | B180: 305.5380222 | C180: of:=ORG.LIBREOFFICE.ROUNDSIG([.A180];12)=ORG.LIBREOFFICE.ROUNDSIG([.B180];12) -> true | D180: of:=FORMULA([.A180]) -> =BESSELK($L24,S$1)
A181: of:=BESSELK([.$L25];[.S$1]) -> 44207.0202514575 | B181: 44207.0202514575 | C181: of:=ORG.LIBREOFFICE.ROUNDSIG([.A181];12)=ORG.LIBREOFFICE.ROUNDSIG([.B181];12) -> true | D181: of:=FORMULA([.A181]) -> =BESSELK($L25,S$1)
A182: of:=BESSELK([.$L2];[.T$1]) -> 6.40157052995447E-045 | B182: 6.40157052995447E-045 | C182: of:=ORG.LIBREOFFICE.ROUNDSIG([.A182];12)=ORG.LIBREOFFICE.ROUNDSIG([.B182];12) -> true | D182: of:=FORMULA([.A182]) -> =BESSELK($L2,T$1)
A183: of:=BESSELK([.$L3];[.T$1]) -> 1.53923662958594E-040 | B183: 1.53923662958594E-040 | C183: of:=ORG.LIBREOFFICE.ROUNDSIG([.A183];12)=ORG.LIBREOFFICE.ROUNDSIG([.B183];12) -> true | D183: of:=FORMULA([.A183]) -> =BESSELK($L3,T$1)
A184: of:=BESSELK([.$L4];[.T$1]) -> 3.75655160802106E-036 | B184: 3.75655160802106E-036 | C184: of:=ORG.LIBREOFFICE.ROUNDSIG([.A184];12)=ORG.LIBREOFFICE.ROUNDSIG([.B184];12) -> true | D184: of:=FORMULA([.A184]) -> =BESSELK($L4,T$1)
A185: of:=BESSELK([.$L5];[.T$1]) -> 9.35532071759877E-032 | B185: 9.35532071759877E-032 | C185: of:=ORG.LIBREOFFICE.ROUNDSIG([.A185];12)=ORG.LIBREOFFICE.ROUNDSIG([.B185];12) -> true | D185: of:=FORMULA([.A185]) -> =BESSELK($L5,T$1)
A186: of:=BESSELK([.$L6];[.T$1]) -> 2.39784098205594E-027 | B186: 2.39784098205594E-027 | C186: of:=ORG.LIBREOFFICE.ROUNDSIG([.A186];12)=ORG.LIBREOFFICE.ROUNDSIG([.B186];12) -> true | D186: of:=FORMULA([.A186]) -> =BESSELK($L6,T$1)
A187: of:=BESSELK([.$L7];[.T$1]) -> 6.41870996219601E-023 | B187: 6.41870996219601E-023 | C187: of:=ORG.LIBREOFFICE.ROUNDSIG([.A187];12)=ORG.LIBREOFFICE.ROUNDSIG([.B187];12) -> true | D187: of:=FORMULA([.A187]) -> =BESSELK($L7,T$1)
A188: of:=BESSELK([.$L8];[.T$1]) -> 1.84522954645594E-018 | B188: 1.84522954645594E-018 | C188: of:=ORG.LIBREOFFICE.ROUNDSIG([.A188];12)=ORG.LIBREOFFICE.ROUNDSIG([.B188];12) -> true | D188: of:=FORMULA([.A188]) -> =BESSELK($L8,T$1)
A189: of:=BESSELK([.$L9];[.T$1]) -> 0.0000000000000212134813895914 | B189: 0.0000000000000212134813895914 | C189: of:=ORG.LIBREOFFICE.ROUNDSIG([.A189];12)=ORG.LIBREOFFICE.ROUNDSIG([.B189];12) -> true | D189: of:=FORMULA([.A189]) -> =BESSELK($L9,T$1)
A190: of:=BESSELK([.$L10];[.T$1]) -> 0.0000000000000605658181967763 | B190: 0.0000000000000605658181967763 | C190: of:=ORG.LIBREOFFICE.ROUNDSIG([.A190];12)=ORG.LIBREOFFICE.ROUNDSIG([.B190];12) -> true | D190: of:=FORMULA([.A190]) -> =BESSELK($L10,T$1)
A191: of:=BESSELK([.$L11];[.T$1]) -> 0.000000000000173393689777285 | B191: 0.000000000000173393689777285 | C191: of:=ORG.LIBREOFFICE.ROUNDSIG([.A191];12)=ORG.LIBREOFFICE.ROUNDSIG([.B191];12) -> true | D191: of:=FORMULA([.A191]) -> =BESSELK($L11,T$1)
A192: of:=BESSELK([.$L12];[.T$1]) -> 0.000000000000497902008774797 | B192: 0.000000000000497902008774797 | C192: of:=ORG.LIBREOFFICE.ROUNDSIG([.A192];12)=ORG.LIBREOFFICE.ROUNDSIG([.B192];12) -> true | D192: of:=FORMULA([.A192]) -> =BESSELK($L12,T$1)
A193: of:=BESSELK([.$L13];[.T$1]) -> 0.0000000000120422281912864 | B193: 0.0000000000120422281912864 | C193: of:=ORG.LIBREOFFICE.ROUNDSIG([.A193];12)=ORG.LIBREOFFICE.ROUNDSIG([.B193];12) -> true | D193: of:=FORMULA([.A193]) -> =BESSELK($L13,T$1)
A194: of:=BESSELK([.$L14];[.T$1]) -> 0.00000000268929224446398 | B194: 0.00000000268929224446398 | C194: of:=ORG.LIBREOFFICE.ROUNDSIG([.A194];12)=ORG.LIBREOFFICE.ROUNDSIG([.B194];12) -> true | D194: of:=FORMULA([.A194]) -> =BESSELK($L14,T$1)
A195: of:=BESSELK([.$L15];[.T$1]) -> 0.000000745761961007069 | B195: 0.000000745761961007069 | C195: of:=ORG.LIBREOFFICE.ROUNDSIG([.A195];12)=ORG.LIBREOFFICE.ROUNDSIG([.B195];12) -> true | D195: of:=FORMULA([.A195]) -> =BESSELK($L15,T$1)
A196: of:=BESSELK([.$L16];[.T$1]) -> 0.000336239400740464 | B196: 0.000336239400740464 | C196: of:=ORG.LIBREOFFICE.ROUNDSIG([.A196];12)=ORG.LIBREOFFICE.ROUNDSIG([.B196];12) -> true | D196: of:=FORMULA([.A196]) -> =BESSELK($L16,T$1)
A197: of:=BESSELK([.$L17];[.T$1]) -> 0.00128330951527462 | B197: 0.00128330951527462 | C197: of:=ORG.LIBREOFFICE.ROUNDSIG([.A197];12)=ORG.LIBREOFFICE.ROUNDSIG([.B197];12) -> true | D197: of:=FORMULA([.A197]) -> =BESSELK($L17,T$1)
A198: of:=BESSELK([.$L18];[.T$1]) -> 0.00523642209438259 | B198: 0.00523642209438259 | C198: of:=ORG.LIBREOFFICE.ROUNDSIG([.A198];12)=ORG.LIBREOFFICE.ROUNDSIG([.B198];12) -> true | D198: of:=FORMULA([.A198]) -> =BESSELK($L18,T$1)
A199: of:=BESSELK([.$L19];[.T$1]) -> 0.0233698230861746 | B199: 0.0233698230861746 | C199: of:=ORG.LIBREOFFICE.ROUNDSIG([.A199];12)=ORG.LIBREOFFICE.ROUNDSIG([.B199];12) -> true | D199: of:=FORMULA([.A199]) -> =BESSELK($L19,T$1)
A200: of:=BESSELK([.$L20];[.T$1]) -> 0.118096817753369 | B200: 0.118096817753369 | C200: of:=ORG.LIBREOFFICE.ROUNDSIG([.A200];12)=ORG.LIBREOFFICE.ROUNDSIG([.B200];12) -> true | D200: of:=FORMULA([.A200]) -> =BESSELK($L20,T$1)
A201: of:=BESSELK([.$L21];[.T$1]) -> 0.714362418673739 | B201: 0.714362418673739 | C201: of:=ORG.LIBREOFFICE.ROUNDSIG([.A201];12)=ORG.LIBREOFFICE.ROUNDSIG([.B201];12) -> true | D201: of:=FORMULA([.A201]) -> =BESSELK($L21,T$1)
A202: of:=BESSELK([.$L22];[.T$1]) -> 5.69317853944687 | B202: 5.69317853944687 | C202: of:=ORG.LIBREOFFICE.ROUNDSIG([.A202];12)=ORG.LIBREOFFICE.ROUNDSIG([.B202];12) -> true | D202: of:=FORMULA([.A202]) -> =BESSELK($L22,T$1)
A203: of:=BESSELK([.$L23];[.T$1]) -> 71.8676202302093 | B203: 71.8676202302093 | C203: of:=ORG.LIBREOFFICE.ROUNDSIG([.A203];12)=ORG.LIBREOFFICE.ROUNDSIG([.B203];12) -> true | D203: of:=FORMULA([.A203]) -> =BESSELK($L23,T$1)
A204: of:=BESSELK([.$L24];[.T$1]) -> 2188.11731756 | B204: 2188.11731756 | C204: of:=ORG.LIBREOFFICE.ROUNDSIG([.A204];12)=ORG.LIBREOFFICE.ROUNDSIG([.B204];12) -> true | D204: of:=FORMULA([.A204]) -> =BESSELK($L24,T$1)
A205: of:=BESSELK([.$L25];[.T$1]) -> 622552.121825615 | B205: 622552.121825615 | C205: of:=ORG.LIBREOFFICE.ROUNDSIG([.A205];12)=ORG.LIBREOFFICE.ROUNDSIG([.B205];12) -> true | D205: of:=FORMULA([.A205]) -> =BESSELK($L25,T$1)
A206: of:=BESSELK([.$L2];[.U$1]) -> 6.96587608051174E-045 | B206: 6.96587608051174E-045 | C206: of:=ORG.LIBREOFFICE.ROUNDSIG([.A206];12)=ORG.LIBREOFFICE.ROUNDSIG([.B206];12) -> true | D206: of:=FORMULA([.A206]) -> =BESSELK($L2,U$1)
A207: of:=BESSELK([.$L3];[.U$1]) -> 1.69058841324537E-040 | B207: 1.69058841324537E-040 | C207: of:=ORG.LIBREOFFICE.ROUNDSIG([.A207];12)=ORG.LIBREOFFICE.ROUNDSIG([.B207];12) -> true | D207: of:=FORMULA([.A207]) -> =BESSELK($L3,U$1)
A208: of:=BESSELK([.$L4];[.U$1]) -> 4.1741204441085E-036 | B208: 4.1741204441085E-036 | C208: of:=ORG.LIBREOFFICE.ROUNDSIG([.A208];12)=ORG.LIBREOFFICE.ROUNDSIG([.B208];12) -> true | D208: of:=FORMULA([.A208]) -> =BESSELK($L4,U$1)
A209: of:=BESSELK([.$L5];[.U$1]) -> 1.05511429549189E-031 | B209: 1.05511429549189E-031 | C209: of:=ORG.LIBREOFFICE.ROUNDSIG([.A209];12)=ORG.LIBREOFFICE.ROUNDSIG([.B209];12) -> true | D209: of:=FORMULA([.A209]) -> =BESSELK($L5,U$1)
A210: of:=BESSELK([.$L6];[.U$1]) -> 2.75833313519183E-027 | B210: 2.75833313519183E-027 | C210: of:=ORG.LIBREOFFICE.ROUNDSIG([.A210];12)=ORG.LIBREOFFICE.ROUNDSIG([.B210];12) -> true | D210: of:=FORMULA([.A210]) -> =BESSELK($L6,U$1)
A211: of:=BESSELK([.$L7];[.U$1]) -> 7.58966202789273E-023 | B211: 7.58966202789273E-023 | C211: of:=ORG.LIBREOFFICE.ROUNDSIG([.A211];12)=ORG.LIBREOFFICE.ROUNDSIG([.B211];12) -> true | D211: of:=FORMULA([.A211]) -> =BESSELK($L7,U$1)
A212: of:=BESSELK([.$L8];[.U$1]) -> 2.27288837108795E-018 | B212: 2.27288837108795E-018 | C212: of:=ORG.LIBREOFFICE.ROUNDSIG([.A212];12)=ORG.LIBREOFFICE.ROUNDSIG([.B212];12) -> true | D212: of:=FORMULA([.A212]) -> =BESSELK($L8,U$1)
A213: of:=BESSELK([.$L9];[.U$1]) -> 0.0000000000000277020136354351 | B213: 0.0000000000000277020136354351 | C213: of:=ORG.LIBREOFFICE.ROUNDSIG([.A213];12)=ORG.LIBREOFFICE.ROUNDSIG([.B213];12) -> true | D213: of:=FORMULA([.A213]) -> =BESSELK($L9,U$1)
A214: of:=BESSELK([.$L10];[.U$1]) -> 0.0000000000000797705842164178 | B214: 0.0000000000000797705842164178 | C214: of:=ORG.LIBREOFFICE.ROUNDSIG([.A214];12)=ORG.LIBREOFFICE.ROUNDSIG([.B214];12) -> true | D214: of:=FORMULA([.A214]) -> =BESSELK($L10,U$1)
A215: of:=BESSELK([.$L11];[.U$1]) -> 0.000000000000230466474052759 | B215: 0.000000000000230466474052759 | C215: of:=ORG.LIBREOFFICE.ROUNDSIG([.A215];12)=ORG.LIBREOFFICE.ROUNDSIG([.B215];12) -> true | D215: of:=FORMULA([.A215]) -> =BESSELK($L11,U$1)
A216: of:=BESSELK([.$L12];[.U$1]) -> 0.000000000000668260212641095 | B216: 0.000000000000668260212641095 | C216: of:=ORG.LIBREOFFICE.ROUNDSIG([.A216];12)=ORG.LIBREOFFICE.ROUNDSIG([.B216];12) -> true | D216: of:=FORMULA([.A216]) -> =BESSELK($L12,U$1)
A217: of:=BESSELK([.$L13];[.U$1]) -> 0.0000000000167146405799936 | B217: 0.0000000000167146405799936 | C217: of:=ORG.LIBREOFFICE.ROUNDSIG([.A217];12)=ORG.LIBREOFFICE.ROUNDSIG([.B217];12) -> true | D217: of:=FORMULA([.A217]) -> =BESSELK($L13,U$1)
A218: of:=BESSELK([.$L14];[.U$1]) -> 0.0000000040299135990128 | B218: 0.0000000040299135990128 | C218: of:=ORG.LIBREOFFICE.ROUNDSIG([.A218];12)=ORG.LIBREOFFICE.ROUNDSIG([.B218];12) -> true | D218: of:=FORMULA([.A218]) -> =BESSELK($L14,U$1)
A219: of:=BESSELK([.$L15];[.U$1]) -> 0.00000126230700903303 | B219: 0.00000126230700903303 | C219: of:=ORG.LIBREOFFICE.ROUNDSIG([.A219];12)=ORG.LIBREOFFICE.ROUNDSIG([.B219];12) -> true | D219: of:=FORMULA([.A219]) -> =BESSELK($L15,U$1)
A220: of:=BESSELK([.$L16];[.U$1]) -> 0.000710008836411463 | B220: 0.000710008836411463 | C220: of:=ORG.LIBREOFFICE.ROUNDSIG([.A220];12)=ORG.LIBREOFFICE.ROUNDSIG([.B220];12) -> true | D220: of:=FORMULA([.A220]) -> =BESSELK($L16,U$1)
A221: of:=BESSELK([.$L17];[.U$1]) -> 0.00289846251274587 | B221: 0.00289846251274587 | C221: of:=ORG.LIBREOFFICE.ROUNDSIG([.A221];12)=ORG.LIBREOFFICE.ROUNDSIG([.B221];12) -> true | D221: of:=FORMULA([.A221]) -> =BESSELK($L17,U$1)
A222: of:=BESSELK([.$L18];[.U$1]) -> 0.0128104969213527 | B222: 0.0128104969213527 | C222: of:=ORG.LIBREOFFICE.ROUNDSIG([.A222];12)=ORG.LIBREOFFICE.ROUNDSIG([.B222];12) -> true | D222: of:=FORMULA([.A222]) -> =BESSELK($L18,U$1)
A223: of:=BESSELK([.$L19];[.U$1]) -> 0.0629509085781889 | B223: 0.0629509085781889 | C223: of:=ORG.LIBREOFFICE.ROUNDSIG([.A223];12)=ORG.LIBREOFFICE.ROUNDSIG([.B223];12) -> true | D223: of:=FORMULA([.A223]) -> =BESSELK($L19,U$1)
A224: of:=BESSELK([.$L20];[.U$1]) -> 0.358022027544641 | B224: 0.358022027544641 | C224: of:=ORG.LIBREOFFICE.ROUNDSIG([.A224];12)=ORG.LIBREOFFICE.ROUNDSIG([.B224];12) -> true | D224: of:=FORMULA([.A224]) -> =BESSELK($L20,U$1)
A225: of:=BESSELK([.$L21];[.U$1]) -> 2.51227788463134 | B225: 2.51227788463134 | C225: of:=ORG.LIBREOFFICE.ROUNDSIG([.A225];12)=ORG.LIBREOFFICE.ROUNDSIG([.B225];12) -> true | D225: of:=FORMULA([.A225]) -> =BESSELK($L21,U$1)
A226: of:=BESSELK([.$L22];[.U$1]) -> 24.2713122592792 | B226: 24.2713122592792 | C226: of:=ORG.LIBREOFFICE.ROUNDSIG([.A226];12)=ORG.LIBREOFFICE.ROUNDSIG([.B226];12) -> true | D226: of:=FORMULA([.A226]) -> =BESSELK($L22,U$1)
A227: of:=BESSELK([.$L23];[.U$1]) -> 397.958801062385 | B227: 397.958801062385 | C227: of:=ORG.LIBREOFFICE.ROUNDSIG([.A227];12)=ORG.LIBREOFFICE.ROUNDSIG([.B227];12) -> true | D227: of:=FORMULA([.A227]) -> =BESSELK($L23,U$1)
A228: of:=BESSELK([.$L24];[.U$1]) -> 17810.47656268 | B228: 17810.47656268 | C228: of:=ORG.LIBREOFFICE.ROUNDSIG([.A228];12)=ORG.LIBREOFFICE.ROUNDSIG([.B228];12) -> true | D228: of:=FORMULA([.A228]) -> =BESSELK($L24,U$1)
A229: of:=BESSELK([.$L25];[.U$1]) -> 10005040.9694613 | B229: 10005040.9694613 | C229: of:=ORG.LIBREOFFICE.ROUNDSIG([.A229];12)=ORG.LIBREOFFICE.ROUNDSIG([.B229];12) -> true | D229: of:=FORMULA([.A229]) -> =BESSELK($L25,U$1)
A230: of:=BESSELK([.$L2];[.V$1]) -> 7.65542822444658E-045 | B230: 7.65542822444658E-045 | C230: of:=ORG.LIBREOFFICE.ROUNDSIG([.A230];12)=ORG.LIBREOFFICE.ROUNDSIG([.B230];12) -> true | D230: of:=FORMULA([.A230]) -> =BESSELK($L2,V$1)
A231: of:=BESSELK([.$L3];[.V$1]) -> 1.87735431223501E-040 | B231: 1.87735431223501E-040 | C231: of:=ORG.LIBREOFFICE.ROUNDSIG([.A231];12)=ORG.LIBREOFFICE.ROUNDSIG([.B231];12) -> true | D231: of:=FORMULA([.A231]) -> =BESSELK($L3,V$1)
A232: of:=BESSELK([.$L4];[.V$1]) -> 4.69572870794547E-036 | B232: 4.69572870794547E-036 | C232: of:=ORG.LIBREOFFICE.ROUNDSIG([.A232];12)=ORG.LIBREOFFICE.ROUNDSIG([.B232];12) -> true | D232: of:=FORMULA([.A232]) -> =BESSELK($L4,V$1)
A233: of:=BESSELK([.$L5];[.V$1]) -> 1.20684717631493E-031 | B233: 1.20684717631493E-031 | C233: of:=ORG.LIBREOFFICE.ROUNDSIG([.A233];12)=ORG.LIBREOFFICE.ROUNDSIG([.B233];12) -> true | D233: of:=FORMULA([.A233]) -> =BESSELK($L5,V$1)
A234: of:=BESSELK([.$L6];[.V$1]) -> 3.22534092261349E-027 | B234: 3.22534092261349E-027 | C234: of:=ORG.LIBREOFFICE.ROUNDSIG([.A234];12)=ORG.LIBREOFFICE.ROUNDSIG([.B234];12) -> true | D234: of:=FORMULA([.A234]) -> =BESSELK($L6,V$1)
A235: of:=BESSELK([.$L7];[.V$1]) -> 9.1509882922374E-023 | B235: 9.1509882922374E-023 | C235: of:=ORG.LIBREOFFICE.ROUNDSIG([.A235];12)=ORG.LIBREOFFICE.ROUNDSIG([.B235];12) -> true | D235: of:=FORMULA([.A235]) -> =BESSELK($L7,V$1)
A236: of:=BESSELK([.$L8];[.V$1]) -> 2.86802931344551E-018 | B236: 2.86802931344551E-018 | C236: of:=ORG.LIBREOFFICE.ROUNDSIG([.A236];12)=ORG.LIBREOFFICE.ROUNDSIG([.B236];12) -> true | D236: of:=FORMULA([.A236]) -> =BESSELK($L8,V$1)
A237: of:=BESSELK([.$L9];[.V$1]) -> 0.0000000000000372985215650053 | B237: 0.0000000000000372985215650053 | C237: of:=ORG.LIBREOFFICE.ROUNDSIG([.A237];12)=ORG.LIBREOFFICE.ROUNDSIG([.B237];12) -> true | D237: of:=FORMULA([.A237]) -> =BESSELK($L9,V$1)
A238: of:=BESSELK([.$L10];[.V$1]) -> 0.000000000000108428168726627 | B238: 0.000000000000108428168726627 | C238: of:=ORG.LIBREOFFICE.ROUNDSIG([.A238];12)=ORG.LIBREOFFICE.ROUNDSIG([.B238];12) -> true | D238: of:=FORMULA([.A238]) -> =BESSELK($L10,V$1)
A239: of:=BESSELK([.$L11];[.V$1]) -> 0.000000000000316441846085894 | B239: 0.000000000000316441846085894 | C239: of:=ORG.LIBREOFFICE.ROUNDSIG([.A239];12)=ORG.LIBREOFFICE.ROUNDSIG([.B239];12) -> true | D239: of:=FORMULA([.A239]) -> =BESSELK($L11,V$1)
A240: of:=BESSELK([.$L12];[.V$1]) -> 0.000000000000927497859758358 | B240: 0.000000000000927497859758358 | C240: of:=ORG.LIBREOFFICE.ROUNDSIG([.A240];12)=ORG.LIBREOFFICE.ROUNDSIG([.B240];12) -> true | D240: of:=FORMULA([.A240]) -> =BESSELK($L12,V$1)
A241: of:=BESSELK([.$L13];[.V$1]) -> 0.0000000000240767694088817 | B241: 0.0000000000240767694088817 | C241: of:=ORG.LIBREOFFICE.ROUNDSIG([.A241];12)=ORG.LIBREOFFICE.ROUNDSIG([.B241];12) -> true | D241: of:=FORMULA([.A241]) -> =BESSELK($L13,V$1)
A242: of:=BESSELK([.$L14];[.V$1]) -> 0.00000000631621448357549 | B242: 0.00000000631621448357549 | C242: of:=ORG.LIBREOFFICE.ROUNDSIG([.A242];12)=ORG.LIBREOFFICE.ROUNDSIG([.B242];12) -> true | D242: of:=FORMULA([.A242]) -> =BESSELK($L14,V$1)
A243: of:=BESSELK([.$L15];[.V$1]) -> 0.00000226053037184671 | B243: 0.00000226053037184671 | C243: of:=ORG.LIBREOFFICE.ROUNDSIG([.A243];12)=ORG.LIBREOFFICE.ROUNDSIG([.B243];12) -> true | D243: of:=FORMULA([.A243]) -> =BESSELK($L15,V$1)
A244: of:=BESSELK([.$L16];[.V$1]) -> 0.0016142553062811 | B244: 0.0016142553062811 | C244: of:=ORG.LIBREOFFICE.ROUNDSIG([.A244];12)=ORG.LIBREOFFICE.ROUNDSIG([.B244];12) -> true | D244: of:=FORMULA([.A244]) -> =BESSELK($L16,V$1)
A245: of:=BESSELK([.$L17];[.V$1]) -> 0.00708023454076637 | B245: 0.00708023454076637 | C245: of:=ORG.LIBREOFFICE.ROUNDSIG([.A245];12)=ORG.LIBREOFFICE.ROUNDSIG([.B245];12) -> true | D245: of:=FORMULA([.A245]) -> =BESSELK($L17,V$1)
A246: of:=BESSELK([.$L18];[.V$1]) -> 0.0340600401674261 | B246: 0.0340600401674261 | C246: of:=ORG.LIBREOFFICE.ROUNDSIG([.A246];12)=ORG.LIBREOFFICE.ROUNDSIG([.B246];12) -> true | D246: of:=FORMULA([.A246]) -> =BESSELK($L18,V$1)
A247: of:=BESSELK([.$L19];[.V$1]) -> 0.185243588001517 | B247: 0.185243588001517 | C247: of:=ORG.LIBREOFFICE.ROUNDSIG([.A247];12)=ORG.LIBREOFFICE.ROUNDSIG([.B247];12) -> true | D247: of:=FORMULA([.A247]) -> =BESSELK($L19,V$1)
A248: of:=BESSELK([.$L20];[.V$1]) -> 1.19216290038729 | B248: 1.19216290038729 | C248: of:=ORG.LIBREOFFICE.ROUNDSIG([.A248];12)=ORG.LIBREOFFICE.ROUNDSIG([.B248];12) -> true | D248: of:=FORMULA([.A248]) -> =BESSELK($L20,V$1)
A249: of:=BESSELK([.$L21];[.V$1]) -> 9.75856280334655 | B249: 9.75856280334655 | C249: of:=ORG.LIBREOFFICE.ROUNDSIG([.A249];12)=ORG.LIBREOFFICE.ROUNDSIG([.B249];12) -> true | D249: of:=FORMULA([.A249]) -> =BESSELK($L21,V$1)
A250: of:=BESSELK([.$L22];[.V$1]) -> 114.914083706203 | B250: 114.914083706203 | C250: of:=ORG.LIBREOFFICE.ROUNDSIG([.A250];12)=ORG.LIBREOFFICE.ROUNDSIG([.B250];12) -> true | D250: of:=FORMULA([.A250]) -> =BESSELK($L22,V$1)
A251: of:=BESSELK([.$L23];[.V$1]) -> 2459.62042660452 | B251: 2459.62042660452 | C251: of:=ORG.LIBREOFFICE.ROUNDSIG([.A251];12)=ORG.LIBREOFFICE.ROUNDSIG([.B251];12) -> true | D251: of:=FORMULA([.A251]) -> =BESSELK($L23,V$1)
A252: of:=BESSELK([.$L24];[.V$1]) -> 162482.40638168 | B252: 162482.40638168 | C252: of:=ORG.LIBREOFFICE.ROUNDSIG([.A252];12)=ORG.LIBREOFFICE.ROUNDSIG([.B252];12) -> true | D252: of:=FORMULA([.A252]) -> =BESSELK($L24,V$1)
A253: of:=BESSELK([.$L25];[.V$1]) -> 180713289.572129 | B253: 180713289.572129 | C253: of:=ORG.LIBREOFFICE.ROUNDSIG([.A253];12)=ORG.LIBREOFFICE.ROUNDSIG([.B253];12) -> true | D253: of:=FORMULA([.A253]) -> =BESSELK($L25,V$1)
A254: of:=BESSELK([.$L2];[.W$1]) -> 8.49696172540106E-045 | B254: 8.49696172540106E-045 | C254: of:=ORG.LIBREOFFICE.ROUNDSIG([.A254];12)=ORG.LIBREOFFICE.ROUNDSIG([.B254];12) -> true | D254: of:=FORMULA([.A254]) -> =BESSELK($L2,W$1)
A255: of:=BESSELK([.$L3];[.W$1]) -> 2.10777826040871E-040 | B255: 2.10777826040871E-040 | C255: of:=ORG.LIBREOFFICE.ROUNDSIG([.A255];12)=ORG.LIBREOFFICE.ROUNDSIG([.B255];12) -> true | D255: of:=FORMULA([.A255]) -> =BESSELK($L3,W$1)
A256: of:=BESSELK([.$L4];[.W$1]) -> 5.34805262109487E-036 | B256: 5.34805262109487E-036 | C256: of:=ORG.LIBREOFFICE.ROUNDSIG([.A256];12)=ORG.LIBREOFFICE.ROUNDSIG([.B256];12) -> true | D256: of:=FORMULA([.A256]) -> =BESSELK($L4,W$1)
A257: of:=BESSELK([.$L5];[.W$1]) -> 1.39992777443901E-031 | B257: 1.39992777443901E-031 | C257: of:=ORG.LIBREOFFICE.ROUNDSIG([.A257];12)=ORG.LIBREOFFICE.ROUNDSIG([.B257];12) -> true | D257: of:=FORMULA([.A257]) -> =BESSELK($L5,W$1)
A258: of:=BESSELK([.$L6];[.W$1]) -> 3.83344677606299E-027 | B258: 3.83344677606299E-027 | C258: of:=ORG.LIBREOFFICE.ROUNDSIG([.A258];12)=ORG.LIBREOFFICE.ROUNDSIG([.B258];12) -> true | D258: of:=FORMULA([.A258]) -> =BESSELK($L6,W$1)
A259: of:=BESSELK([.$L7];[.W$1]) -> 1.12500573447877E-022 | B259: 1.12500573447877E-022 | C259: of:=ORG.LIBREOFFICE.ROUNDSIG([.A259];12)=ORG.LIBREOFFICE.ROUNDSIG([.B259];12) -> true | D259: of:=FORMULA([.A259]) -> =BESSELK($L7,W$1)
A260: of:=BESSELK([.$L8];[.W$1]) -> 3.7069030278107E-018 | B260: 3.7069030278107E-018 | C260: of:=ORG.LIBREOFFICE.ROUNDSIG([.A260];12)=ORG.LIBREOFFICE.ROUNDSIG([.B260];12) -> true | D260: of:=FORMULA([.A260]) -> =BESSELK($L8,W$1)
A261: of:=BESSELK([.$L9];[.W$1]) -> 0.0000000000000517655759354385 | B261: 0.0000000000000517655759354385 | C261: of:=ORG.LIBREOFFICE.ROUNDSIG([.A261];12)=ORG.LIBREOFFICE.ROUNDSIG([.B261];12) -> true | D261: of:=FORMULA([.A261]) -> =BESSELK($L9,W$1)
A262: of:=BESSELK([.$L10];[.W$1]) -> 0.000000000000152056030034169 | B262: 0.000000000000152056030034169 | C262: of:=ORG.LIBREOFFICE.ROUNDSIG([.A262];12)=ORG.LIBREOFFICE.ROUNDSIG([.B262];12) -> true | D262: of:=FORMULA([.A262]) -> =BESSELK($L10,W$1)
A263: of:=BESSELK([.$L11];[.W$1]) -> 0.000000000000448702229974065 | B263: 0.000000000000448702229974065 | C263: of:=ORG.LIBREOFFICE.ROUNDSIG([.A263];12)=ORG.LIBREOFFICE.ROUNDSIG([.B263];12) -> true | D263: of:=FORMULA([.A263]) -> =BESSELK($L11,W$1)
A264: of:=BESSELK([.$L12];[.W$1]) -> 0.00000000000133075868389707 | B264: 0.00000000000133075868389707 | C264: of:=ORG.LIBREOFFICE.ROUNDSIG([.A264];12)=ORG.LIBREOFFICE.ROUNDSIG([.B264];12) -> true | D264: of:=FORMULA([.A264]) -> =BESSELK($L12,W$1)
A265: of:=BESSELK([.$L13];[.W$1]) -> 0.0000000000359760561070989 | B265: 0.0000000000359760561070989 | C265: of:=ORG.LIBREOFFICE.ROUNDSIG([.A265];12)=ORG.LIBREOFFICE.ROUNDSIG([.B265];12) -> true | D265: of:=FORMULA([.A265]) -> =BESSELK($L13,W$1)
A266: of:=BESSELK([.$L14];[.W$1]) -> 0.0000000103461280825883 | B266: 0.0000000103461280825883 | C266: of:=ORG.LIBREOFFICE.ROUNDSIG([.A266];12)=ORG.LIBREOFFICE.ROUNDSIG([.B266];12) -> true | D266: of:=FORMULA([.A266]) -> =BESSELK($L14,W$1)
A267: of:=BESSELK([.$L15];[.W$1]) -> 0.00000427634750482864 | B267: 0.00000427634750482864 | C267: of:=ORG.LIBREOFFICE.ROUNDSIG([.A267];12)=ORG.LIBREOFFICE.ROUNDSIG([.B267];12) -> true | D267: of:=FORMULA([.A267]) -> =BESSELK($L15,W$1)
A268: of:=BESSELK([.$L16];[.W$1]) -> 0.00393851944897366 | B268: 0.00393851944897366 | C268: of:=ORG.LIBREOFFICE.ROUNDSIG([.A268];12)=ORG.LIBREOFFICE.ROUNDSIG([.B268];12) -> true | D268: of:=FORMULA([.A268]) -> =BESSELK($L16,W$1)
A269: of:=BESSELK([.$L17];[.W$1]) -> 0.0186323170477822 | B269: 0.0186323170477822 | C269: of:=ORG.LIBREOFFICE.ROUNDSIG([.A269];12)=ORG.LIBREOFFICE.ROUNDSIG([.B269];12) -> true | D269: of:=FORMULA([.A269]) -> =BESSELK($L17,W$1)
A270: of:=BESSELK([.$L18];[.W$1]) -> 0.0979605973399179 | B270: 0.0979605973399179 | C270: of:=ORG.LIBREOFFICE.ROUNDSIG([.A270];12)=ORG.LIBREOFFICE.ROUNDSIG([.B270];12) -> true | D270: of:=FORMULA([.A270]) -> =BESSELK($L18,W$1)
A271: of:=BESSELK([.$L19];[.W$1]) -> 0.592218302868238 | B271: 0.592218302868238 | C271: of:=ORG.LIBREOFFICE.ROUNDSIG([.A271];12)=ORG.LIBREOFFICE.ROUNDSIG([.B271];12) -> true | D271: of:=FORMULA([.A271]) -> =BESSELK($L19,W$1)
A272: of:=BESSELK([.$L20];[.W$1]) -> 4.33189836216895 | B272: 4.33189836216895 | C272: of:=ORG.LIBREOFFICE.ROUNDSIG([.A272];12)=ORG.LIBREOFFICE.ROUNDSIG([.B272];12) -> true | D272: of:=FORMULA([.A272]) -> =BESSELK($L20,W$1)
A273: of:=BESSELK([.$L21];[.W$1]) -> 41.5465290980175 | B273: 41.5465290980175 | C273: of:=ORG.LIBREOFFICE.ROUNDSIG([.A273];12)=ORG.LIBREOFFICE.ROUNDSIG([.B273];12) -> true | D273: of:=FORMULA([.A273]) -> =BESSELK($L21,W$1)
A274: of:=BESSELK([.$L22];[.W$1]) -> 598.841730790295 | B274: 598.841730790295 | C274: of:=ORG.LIBREOFFICE.ROUNDSIG([.A274];12)=ORG.LIBREOFFICE.ROUNDSIG([.B274];12) -> true | D274: of:=FORMULA([.A274]) -> =BESSELK($L22,W$1)
A275: of:=BESSELK([.$L23];[.W$1]) -> 16795.4283117592 | B275: 16795.4283117592 | C275: of:=ORG.LIBREOFFICE.ROUNDSIG([.A275];12)=ORG.LIBREOFFICE.ROUNDSIG([.B275];12) -> true | D275: of:=FORMULA([.A275]) -> =BESSELK($L23,W$1)
A276: of:=BESSELK([.$L24];[.W$1]) -> 1642634.54037948 | B276: 1642634.54037948 | C276: of:=ORG.LIBREOFFICE.ROUNDSIG([.A276];12)=ORG.LIBREOFFICE.ROUNDSIG([.B276];12) -> true | D276: of:=FORMULA([.A276]) -> =BESSELK($L24,W$1)
A277: of:=BESSELK([.$L25];[.W$1]) -> 3624270832.41204 | B277: 3624270832.41204 | C277: of:=ORG.LIBREOFFICE.ROUNDSIG([.A277];12)=ORG.LIBREOFFICE.ROUNDSIG([.B277];12) -> true | D277: of:=FORMULA([.A277]) -> =BESSELK($L25,W$1)
A278: of:=BESSELK([.$L2];[.X$1]) -> 9.52475980403481E-045 | B278: 9.52475980403481E-045 | C278: of:=ORG.LIBREOFFICE.ROUNDSIG([.A278];12)=ORG.LIBREOFFICE.ROUNDSIG([.B278];12) -> true | D278: of:=FORMULA([.A278]) -> =BESSELK($L2,X$1)
A279: of:=BESSELK([.$L3];[.X$1]) -> 2.3925889981127E-040 | B279: 2.3925889981127E-040 | C279: of:=ORG.LIBREOFFICE.ROUNDSIG([.A279];12)=ORG.LIBREOFFICE.ROUNDSIG([.B279];12) -> true | D279: of:=FORMULA([.A279]) -> =BESSELK($L3,X$1)
A280: of:=BESSELK([.$L4];[.X$1]) -> 6.16644317874656E-036 | B280: 6.16644317874656E-036 | C280: of:=ORG.LIBREOFFICE.ROUNDSIG([.A280];12)=ORG.LIBREOFFICE.ROUNDSIG([.B280];12) -> true | D280: of:=FORMULA([.A280]) -> =BESSELK($L4,X$1)
A281: of:=BESSELK([.$L5];[.X$1]) -> 1.64682447685291E-031 | B281: 1.64682447685291E-031 | C281: of:=ORG.LIBREOFFICE.ROUNDSIG([.A281];12)=ORG.LIBREOFFICE.ROUNDSIG([.B281];12) -> true | D281: of:=FORMULA([.A281]) -> =BESSELK($L5,X$1)
A282: of:=BESSELK([.$L6];[.X$1]) -> 4.63093807383659E-027 | B282: 4.63093807383659E-027 | C282: of:=ORG.LIBREOFFICE.ROUNDSIG([.A282];12)=ORG.LIBREOFFICE.ROUNDSIG([.B282];12) -> true | D282: of:=FORMULA([.A282]) -> =BESSELK($L6,X$1)
A283: of:=BESSELK([.$L7];[.X$1]) -> 1.4101013523944E-022 | B283: 1.4101013523944E-022 | C283: of:=ORG.LIBREOFFICE.ROUNDSIG([.A283];12)=ORG.LIBREOFFICE.ROUNDSIG([.B283];12) -> true | D283: of:=FORMULA([.A283]) -> =BESSELK($L7,X$1)
A284: of:=BESSELK([.$L8];[.X$1]) -> 4.9068259787414E-018 | B284: 4.9068259787414E-018 | C284: of:=ORG.LIBREOFFICE.ROUNDSIG([.A284];12)=ORG.LIBREOFFICE.ROUNDSIG([.B284];12) -> true | D284: of:=FORMULA([.A284]) -> =BESSELK($L8,X$1)
A285: of:=BESSELK([.$L9];[.X$1]) -> 0.0000000000000740353819062843 | B285: 0.0000000000000740353819062843 | C285: of:=ORG.LIBREOFFICE.ROUNDSIG([.A285];12)=ORG.LIBREOFFICE.ROUNDSIG([.B285];12) -> true | D285: of:=FORMULA([.A285]) -> =BESSELK($L9,X$1)
A286: of:=BESSELK([.$L10];[.X$1]) -> 0.000000000000219935924085018 | B286: 0.000000000000219935924085018 | C286: of:=ORG.LIBREOFFICE.ROUNDSIG([.A286];12)=ORG.LIBREOFFICE.ROUNDSIG([.B286];12) -> true | D286: of:=FORMULA([.A286]) -> =BESSELK($L10,X$1)
A287: of:=BESSELK([.$L11];[.X$1]) -> 0.000000000000656836641238633 | B287: 0.000000000000656836641238633 | C287: of:=ORG.LIBREOFFICE.ROUNDSIG([.A287];12)=ORG.LIBREOFFICE.ROUNDSIG([.B287];12) -> true | D287: of:=FORMULA([.A287]) -> =BESSELK($L11,X$1)
A288: of:=BESSELK([.$L12];[.X$1]) -> 0.00000000000197309396853462 | B288: 0.00000000000197309396853462 | C288: of:=ORG.LIBREOFFICE.ROUNDSIG([.A288];12)=ORG.LIBREOFFICE.ROUNDSIG([.B288];12) -> true | D288: of:=FORMULA([.A288]) -> =BESSELK($L12,X$1)
A289: of:=BESSELK([.$L13];[.X$1]) -> 0.0000000000557356987831288 | B289: 0.0000000000557356987831288 | C289: of:=ORG.LIBREOFFICE.ROUNDSIG([.A289];12)=ORG.LIBREOFFICE.ROUNDSIG([.B289];12) -> true | D289: of:=FORMULA([.A289]) -> =BESSELK($L13,X$1)
A290: of:=BESSELK([.$L14];[.X$1]) -> 0.0000000176969553744226 | B290: 0.0000000176969553744226 | C290: of:=ORG.LIBREOFFICE.ROUNDSIG([.A290];12)=ORG.LIBREOFFICE.ROUNDSIG([.B290];12) -> true | D290: of:=FORMULA([.A290]) -> =BESSELK($L14,X$1)
A291: of:=BESSELK([.$L15];[.X$1]) -> 0.00000853250671226205 | B291: 0.00000853250671226205 | C291: of:=ORG.LIBREOFFICE.ROUNDSIG([.A291];12)=ORG.LIBREOFFICE.ROUNDSIG([.B291];12) -> true | D291: of:=FORMULA([.A291]) -> =BESSELK($L15,X$1)
A292: of:=BESSELK([.$L16];[.X$1]) -> 0.0102789980940231 | B292: 0.0102789980940231 | C292: of:=ORG.LIBREOFFICE.ROUNDSIG([.A292];12)=ORG.LIBREOFFICE.ROUNDSIG([.B292];12) -> true | D292: of:=FORMULA([.A292]) -> =BESSELK($L16,X$1)
A293: of:=BESSELK([.$L17];[.X$1]) -> 0.0526258984353452 | B293: 0.0526258984353452 | C293: of:=ORG.LIBREOFFICE.ROUNDSIG([.A293];12)=ORG.LIBREOFFICE.ROUNDSIG([.B293];12) -> true | D293: of:=FORMULA([.A293]) -> =BESSELK($L17,X$1)
A294: of:=BESSELK([.$L18];[.X$1]) -> 0.3034516828522 | B294: 0.3034516828522 | C294: of:=ORG.LIBREOFFICE.ROUNDSIG([.A294];12)=ORG.LIBREOFFICE.ROUNDSIG([.B294];12) -> true | D294: of:=FORMULA([.A294]) -> =BESSELK($L18,X$1)
A295: of:=BESSELK([.$L19];[.X$1]) -> 2.04650111130169 | B295: 2.04650111130169 | C295: of:=ORG.LIBREOFFICE.ROUNDSIG([.A295];12)=ORG.LIBREOFFICE.ROUNDSIG([.B295];12) -> true | D295: of:=FORMULA([.A295]) -> =BESSELK($L19,X$1)
A296: of:=BESSELK([.$L20];[.X$1]) -> 17.0757902283401 | B296: 17.0757902283401 | C296: of:=ORG.LIBREOFFICE.ROUNDSIG([.A296];12)=ORG.LIBREOFFICE.ROUNDSIG([.B296];12) -> true | D296: of:=FORMULA([.A296]) -> =BESSELK($L20,X$1)
A297: of:=BESSELK([.$L21];[.X$1]) -> 192.563290834624 | B297: 192.563290834624 | C297: of:=ORG.LIBREOFFICE.ROUNDSIG([.A297];12)=ORG.LIBREOFFICE.ROUNDSIG([.B297];12) -> true | D297: of:=FORMULA([.A297]) -> =BESSELK($L21,X$1)
A298: of:=BESSELK([.$L22];[.X$1]) -> 3408.54360305283 | B298: 3408.54360305283 | C298: of:=ORG.LIBREOFFICE.ROUNDSIG([.A298];12)=ORG.LIBREOFFICE.ROUNDSIG([.B298];12) -> true | D298: of:=FORMULA([.A298]) -> =BESSELK($L22,X$1)
A299: of:=BESSELK([.$L23];[.X$1]) -> 125626.094712839 | B299: 125626.094712839 | C299: of:=ORG.LIBREOFFICE.ROUNDSIG([.A299];12)=ORG.LIBREOFFICE.ROUNDSIG([.B299];12) -> true | D299: of:=FORMULA([.A299]) -> =BESSELK($L23,X$1)
A300: of:=BESSELK([.$L24];[.X$1]) -> 18231462.350556 | B300: 18231462.350556 | C300: of:=ORG.LIBREOFFICE.ROUNDSIG([.A300];12)=ORG.LIBREOFFICE.ROUNDSIG([.B300];12) -> true | D300: of:=FORMULA([.A300]) -> =BESSELK($L24,X$1)
A301: of:=BESSELK([.$L25];[.X$1]) -> 79914671602.637 | B301: 79914671602.637 | C301: of:=ORG.LIBREOFFICE.ROUNDSIG([.A301];12)=ORG.LIBREOFFICE.ROUNDSIG([.B301];12) -> true | D301: of:=FORMULA([.A301]) -> =BESSELK($L25,X$1)
A302: of:=BESSELK([.$L2];[.Y$1]) -> 1.07829040783694E-044 | B302: 1.07829040783694E-044 | C302: of:=ORG.LIBREOFFICE.ROUNDSIG([.A302];12)=ORG.LIBREOFFICE.ROUNDSIG([.B302];12) -> true | D302: of:=FORMULA([.A302]) -> =BESSELK($L2,Y$1)
A303: of:=BESSELK([.$L3];[.Y$1]) -> 2.74580199323876E-040 | B303: 2.74580199323876E-040 | C303: of:=ORG.LIBREOFFICE.ROUNDSIG([.A303];12)=ORG.LIBREOFFICE.ROUNDSIG([.B303];12) -> true | D303: of:=FORMULA([.A303]) -> =BESSELK($L3,Y$1)
A304: of:=BESSELK([.$L4];[.Y$1]) -> 7.19798557471883E-036 | B304: 7.19798557471883E-036 | C304: of:=ORG.LIBREOFFICE.ROUNDSIG([.A304];12)=ORG.LIBREOFFICE.ROUNDSIG([.B304];12) -> true | D304: of:=FORMULA([.A304]) -> =BESSELK($L4,Y$1)
A305: of:=BESSELK([.$L5];[.Y$1]) -> 1.96455330936001E-031 | B305: 1.96455330936001E-031 | C305: of:=ORG.LIBREOFFICE.ROUNDSIG([.A305];12)=ORG.LIBREOFFICE.ROUNDSIG([.B305];12) -> true | D305: of:=FORMULA([.A305]) -> =BESSELK($L5,Y$1)
A306: of:=BESSELK([.$L6];[.Y$1]) -> 5.68582200559763E-027 | B306: 5.68582200559763E-027 | C306: of:=ORG.LIBREOFFICE.ROUNDSIG([.A306];12)=ORG.LIBREOFFICE.ROUNDSIG([.B306];12) -> true | D306: of:=FORMULA([.A306]) -> =BESSELK($L6,Y$1)
A307: of:=BESSELK([.$L7];[.Y$1]) -> 1.80185438362808E-022 | B307: 1.80185438362808E-022 | C307: of:=ORG.LIBREOFFICE.ROUNDSIG([.A307];12)=ORG.LIBREOFFICE.ROUNDSIG([.B307];12) -> true | D307: of:=FORMULA([.A307]) -> =BESSELK($L7,Y$1)
A308: of:=BESSELK([.$L8];[.Y$1]) -> 6.65099861505555E-018 | B308: 6.65099861505555E-018 | C308: of:=ORG.LIBREOFFICE.ROUNDSIG([.A308];12)=ORG.LIBREOFFICE.ROUNDSIG([.B308];12) -> true | D308: of:=FORMULA([.A308]) -> =BESSELK($L8,Y$1)
A309: of:=BESSELK([.$L9];[.Y$1]) -> 0.000000000000109083290959659 | B309: 0.000000000000109083290959659 | C309: of:=ORG.LIBREOFFICE.ROUNDSIG([.A309];12)=ORG.LIBREOFFICE.ROUNDSIG([.B309];12) -> true | D309: of:=FORMULA([.A309]) -> =BESSELK($L9,Y$1)
A310: of:=BESSELK([.$L10];[.Y$1]) -> 0.000000000000328004769302183 | B310: 0.000000000000328004769302183 | C310: of:=ORG.LIBREOFFICE.ROUNDSIG([.A310];12)=ORG.LIBREOFFICE.ROUNDSIG([.B310];12) -> true | D310: of:=FORMULA([.A310]) -> =BESSELK($L10,Y$1)
A311: of:=BESSELK([.$L11];[.Y$1]) -> 0.000000000000992291174447417 | B311: 0.000000000000992291174447417 | C311: of:=ORG.LIBREOFFICE.ROUNDSIG([.A311];12)=ORG.LIBREOFFICE.ROUNDSIG([.B311];12) -> true | D311: of:=FORMULA([.A311]) -> =BESSELK($L11,Y$1)
A312: of:=BESSELK([.$L12];[.Y$1]) -> 0.00000000000302198208549817 | B312: 0.00000000000302198208549817 | C312: of:=ORG.LIBREOFFICE.ROUNDSIG([.A312];12)=ORG.LIBREOFFICE.ROUNDSIG([.B312];12) -> true | D312: of:=FORMULA([.A312]) -> =BESSELK($L12,Y$1)
A313: of:=BESSELK([.$L13];[.Y$1]) -> 0.0000000000894823269389025 | B313: 0.0000000000894823269389025 | C313: of:=ORG.LIBREOFFICE.ROUNDSIG([.A313];12)=ORG.LIBREOFFICE.ROUNDSIG([.B313];12) -> true | D313: of:=FORMULA([.A313]) -> =BESSELK($L13,Y$1)
A314: of:=BESSELK([.$L14];[.Y$1]) -> 0.0000000315824745318954 | B314: 0.0000000315824745318954 | C314: of:=ORG.LIBREOFFICE.ROUNDSIG([.A314];12)=ORG.LIBREOFFICE.ROUNDSIG([.B314];12) -> true | D314: of:=FORMULA([.A314]) -> =BESSELK($L14,Y$1)
A315: of:=BESSELK([.$L15];[.Y$1]) -> 0.0000179283582444479 | B315: 0.0000179283582444479 | C315: of:=ORG.LIBREOFFICE.ROUNDSIG([.A315];12)=ORG.LIBREOFFICE.ROUNDSIG([.B315];12) -> true | D315: of:=FORMULA([.A315]) -> =BESSELK($L15,Y$1)
A316: of:=BESSELK([.$L16];[.Y$1]) -> 0.0286081148746292 | B316: 0.0286081148746292 | C316: of:=ORG.LIBREOFFICE.ROUNDSIG([.A316];12)=ORG.LIBREOFFICE.ROUNDSIG([.B316];12) -> true | D316: of:=FORMULA([.A316]) -> =BESSELK($L16,Y$1)
A317: of:=BESSELK([.$L17];[.Y$1]) -> 0.158968046208703 | B317: 0.158968046208703 | C317: of:=ORG.LIBREOFFICE.ROUNDSIG([.A317];12)=ORG.LIBREOFFICE.ROUNDSIG([.B317];12) -> true | D317: of:=FORMULA([.A317]) -> =BESSELK($L17,Y$1)
A318: of:=BESSELK([.$L18];[.Y$1]) -> 1.00831564589652 | B318: 1.00831564589652 | C318: of:=ORG.LIBREOFFICE.ROUNDSIG([.A318];12)=ORG.LIBREOFFICE.ROUNDSIG([.B318];12) -> true | D318: of:=FORMULA([.A318]) -> =BESSELK($L18,Y$1)
A319: of:=BESSELK([.$L19];[.Y$1]) -> 7.6087935416169 | B319: 7.6087935416169 | C319: of:=ORG.LIBREOFFICE.ROUNDSIG([.A319];12)=ORG.LIBREOFFICE.ROUNDSIG([.B319];12) -> true | D319: of:=FORMULA([.A319]) -> =BESSELK($L19,Y$1)
A320: of:=BESSELK([.$L20];[.Y$1]) -> 72.6350592755294 | B320: 72.6350592755294 | C320: of:=ORG.LIBREOFFICE.ROUNDSIG([.A320];12)=ORG.LIBREOFFICE.ROUNDSIG([.B320];12) -> true | D320: of:=FORMULA([.A320]) -> =BESSELK($L20,Y$1)
A321: of:=BESSELK([.$L21];[.Y$1]) -> 965.850325104212 | B321: 965.850325104212 | C321: of:=ORG.LIBREOFFICE.ROUNDSIG([.A321];12)=ORG.LIBREOFFICE.ROUNDSIG([.B321];12) -> true | D321: of:=FORMULA([.A321]) -> =BESSELK($L21,Y$1)
A322: of:=BESSELK([.$L22];[.Y$1]) -> 21050.1033491073 | B322: 21050.1033491073 | C322: of:=ORG.LIBREOFFICE.ROUNDSIG([.A322];12)=ORG.LIBREOFFICE.ROUNDSIG([.B322];12) -> true | D322: of:=FORMULA([.A322]) -> =BESSELK($L22,Y$1)
A323: of:=BESSELK([.$L23];[.Y$1]) -> 1021804.18601447 | B323: 1021804.18601447 | C323: of:=ORG.LIBREOFFICE.ROUNDSIG([.A323];12)=ORG.LIBREOFFICE.ROUNDSIG([.B323];12) -> true | D323: of:=FORMULA([.A323]) -> =BESSELK($L23,Y$1)
A324: of:=BESSELK([.$L24];[.Y$1]) -> 220420182.747051 | B324: 220420182.747051 | C324: of:=ORG.LIBREOFFICE.ROUNDSIG([.A324];12)=ORG.LIBREOFFICE.ROUNDSIG([.B324];12) -> true | D324: of:=FORMULA([.A324]) -> =BESSELK($L24,Y$1)
A325: of:=BESSELK([.$L25];[.Y$1]) -> 1921576389295.7 | B325: 1921576389295.7 | C325: of:=ORG.LIBREOFFICE.ROUNDSIG([.A325];12)=ORG.LIBREOFFICE.ROUNDSIG([.B325];12) -> true | D325: of:=FORMULA([.A325]) -> =BESSELK($L25,Y$1)
A326: of:=BESSELK(1;-9) ->  | B326: of:#ERR502! ->  | C326: of:=ISERROR([.A326]) -> true | D326: of:=FORMULA([.A326]) -> =BESSELK(1,-9)