Sheet: Sheet1
A1: BESSELY Function
A3: Result | B3: of:=AND([.B8:.B95]) -> true
A7: Sheet | B7: Result | C7: Description
A8: 1 | B8: of:=AND([Sheet2.C2:.C596]) -> true | C8: Simple BESSELY formulas with local references and values

Sheet: Sheet2
A1: Function | B1: Expected | C1: Correct | D1: FunctionString | E1: Comment | I1: 1.5 | J1: 1 | M1: 1 | N1: 2 | O1: 3 | P1: 4 | Q1: 5 | R1: 6 | S1: 7 | T1: 8 | U1: 9 | V1: 10 | W1: 11 | X1: 12 | Y1: 13
A2: of:=BESSELY(1.5; 1) -> -0.412308626973911 | B2: -0.412308626973911 | C2: of:=ORG.LIBREOFFICE.ROUNDSIG([.A2];15)=ORG.LIBREOFFICE.ROUNDSIG([.B2];15) -> true | D2: of:=FORMULA([.A2]) -> =BESSELY(1.5, 1) | I2: 2.5 | J2: 2 | L2: 100
A3: of:=BESSELY([.I1];[.J1]) -> -0.412308626973911 | B3: -0.412308626973911 | C3: of:=ORG.LIBREOFFICE.ROUNDSIG([.A3];15)=ORG.LIBREOFFICE.ROUNDSIG([.B3];15) -> true | D3: of:=FORMULA([.A3]) -> =BESSELY(I1,J1) | I3: 3.5 | J3: 3 | L3: 90
A4: of:=BESSELY([.I2];[.J2]) -> -0.381335849241803 | B4: -0.381335849241803 | C4: of:=ORG.LIBREOFFICE.ROUNDSIG([.A4];15)=ORG.LIBREOFFICE.ROUNDSIG([.B4];15) -> true | D4: of:=FORMULA([.A4]) -> =BESSELY(I2,J2) | I4: 4.5 | J4: 4 | L4: 80
A5: of:=BESSELY([.I3];[.J3]) -> -0.35833534619702 | B5: -0.35833534619702 | C5: of:=ORG.LIBREOFFICE.ROUNDSIG([.A5];15)=ORG.LIBREOFFICE.ROUNDSIG([.B5];15) -> true | D5: of:=FORMULA([.A5]) -> =BESSELY(I3,J3) | I5: 5.5 | J5: 5 | L5: 70
A6: of:=BESSELY([.I4];[.J4]) -> -0.34049983878538 | B6: -0.34049983878538 | C6: of:=ORG.LIBREOFFICE.ROUNDSIG([.A6];15)=ORG.LIBREOFFICE.ROUNDSIG([.B6];15) -> true | D6: of:=FORMULA([.A6]) -> =BESSELY(I4,J4) | L6: 60
A7: of:=BESSELY([.I5];[.J5]) -> -0.326097387285247 | B7: -0.326097387285247 | C7: of:=ORG.LIBREOFFICE.ROUNDSIG([.A7];15)=ORG.LIBREOFFICE.ROUNDSIG([.B7];15) -> true | D7: of:=FORMULA([.A7]) -> =BESSELY(I5,J5) | L7: 50
A8: of:=BESSELY([.I6];[.J6]) ->  | B8: of:#ERR502! ->  | C8: of:=ISERROR([.A8]) -> true | D8: of:=FORMULA([.A8]) -> =BESSELY(I6,J6) | I8: 18.6 | J8: 11 | L8: 40
A9: of:=BESSELY([.I8:.I12];[.J8:.J12]) -> -0.138426627663832 | B9: -0.138426627663832 | C9: of:=ORG.LIBREOFFICE.ROUNDSIG([.A9];15)=ORG.LIBREOFFICE.ROUNDSIG([.B9];15) -> true | D9: of:=FORMULA([.A9]) -> {=BESSELY(I8:I12,J8:J12)} | I9: 19.6 | J9: 12 | L9: 31
A10: -0.116179849931473 | B10: -0.116179849931473 | C10: of:=ORG.LIBREOFFICE.ROUNDSIG([.A10];15)=ORG.LIBREOFFICE.ROUNDSIG([.B10];15) -> true | D10: of:=FORMULA([.A10]) -> {=BESSELY(I8:I12,J8:J12)} | I10: 20.6 | J10: 13 | L10: 30
A11: -0.0945941050972257 | B11: -0.0945941050972257 | C11: of:=ORG.LIBREOFFICE.ROUNDSIG([.A11];15)=ORG.LIBREOFFICE.ROUNDSIG([.B11];15) -> true | D11: of:=FORMULA([.A11]) -> {=BESSELY(I8:I12,J8:J12)} | I11: 21.6 | J11: 14 | L11: 29
A12: -0.0739900011334602 | B12: -0.0739900011334602 | C12: of:=ORG.LIBREOFFICE.ROUNDSIG([.A12];15)=ORG.LIBREOFFICE.ROUNDSIG([.B12];15) -> true | D12: of:=FORMULA([.A12]) -> {=BESSELY(I8:I12,J8:J12)} | I12: 22.6 | J12: 15 | L12: 28
A13: -0.0545505432368408 | B13: -0.0545505432368408 | C13: of:=ORG.LIBREOFFICE.ROUNDSIG([.A13];15)=ORG.LIBREOFFICE.ROUNDSIG([.B13];15) -> true | D13: of:=FORMULA([.A13]) -> {=BESSELY(I8:I12,J8:J12)} | L13: 25
A14: of:=BESSELY([.$L2];[.M$1]) -> -0.0203723120027596 | B14: -0.0203723120027596 | C14: of:=ORG.LIBREOFFICE.ROUNDSIG([.A14];15)=ORG.LIBREOFFICE.ROUNDSIG([.B14];15) -> true | D14: of:=FORMULA([.A14]) -> =BESSELY($L2,M$1) | L14: 20
A15: of:=BESSELY([.$L3];[.M$1]) -> -0.0261872386077691 | B15: -0.0261872386077691 | C15: of:=ORG.LIBREOFFICE.ROUNDSIG([.A15];15)=ORG.LIBREOFFICE.ROUNDSIG([.B15];15) -> true | D15: of:=FORMULA([.A15]) -> =BESSELY($L3,M$1) | L15: 15
A16: of:=BESSELY([.$L4];[.M$1]) -> 0.0693959137845865 | B16: 0.0693959137845865 | C16: of:=ORG.LIBREOFFICE.ROUNDSIG([.A16];15)=ORG.LIBREOFFICE.ROUNDSIG([.B16];15) -> true | D16: of:=FORMULA([.A16]) -> =BESSELY($L4,M$1) | L16: 10
A17: of:=BESSELY([.$L5];[.M$1]) -> -0.0948446526257167 | B17: -0.0948446526257167 | C17: of:=ORG.LIBREOFFICE.ROUNDSIG([.A17];15)=ORG.LIBREOFFICE.ROUNDSIG([.B17];15) -> true | D17: of:=FORMULA([.A17]) -> =BESSELY($L5,M$1) | L17: 9
A18: of:=BESSELY([.$L6];[.M$1]) -> 0.0918696093698676 | B18: 0.0918696093698676 | C18: of:=ORG.LIBREOFFICE.ROUNDSIG([.A18];15)=ORG.LIBREOFFICE.ROUNDSIG([.B18];15) -> true | D18: of:=FORMULA([.A18]) -> =BESSELY($L6,M$1) | L18: 8
A19: of:=BESSELY([.$L7];[.M$1]) -> -0.056795668562015 | B19: -0.056795668562015 | C19: of:=ORG.LIBREOFFICE.ROUNDSIG([.A19];15)=ORG.LIBREOFFICE.ROUNDSIG([.B19];15) -> true | D19: of:=FORMULA([.A19]) -> =BESSELY($L7,M$1) | L19: 7
A20: of:=BESSELY([.$L8];[.M$1]) -> -0.00579350582154983 | B20: -0.00579350582154983 | C20: of:=ORG.LIBREOFFICE.ROUNDSIG([.A20];15)=ORG.LIBREOFFICE.ROUNDSIG([.B20];15) -> true | D20: of:=FORMULA([.A20]) -> =BESSELY($L8,M$1) | L20: 6
A21: of:=BESSELY([.$L9];[.M$1]) -> -0.0533728269573212 | B21: -0.0533728269573212 | C21: of:=ORG.LIBREOFFICE.ROUNDSIG([.A21];15)=ORG.LIBREOFFICE.ROUNDSIG([.B21];15) -> true | D21: of:=FORMULA([.A21]) -> =BESSELY($L9,M$1) | L21: 5
A22: of:=BESSELY([.$L10];[.M$1]) -> 0.0844255706617468 | B22: 0.0844255706617468 | C22: of:=ORG.LIBREOFFICE.ROUNDSIG([.A22];15)=ORG.LIBREOFFICE.ROUNDSIG([.B22];15) -> true | D22: of:=FORMULA([.A22]) -> =BESSELY($L10,M$1) | L22: 4
A23: of:=BESSELY([.$L11];[.M$1]) -> 0.148034119119417 | B23: 0.148034119119417 | C23: of:=ORG.LIBREOFFICE.ROUNDSIG([.A23];15)=ORG.LIBREOFFICE.ROUNDSIG([.B23];15) -> true | D23: of:=FORMULA([.A23]) -> =BESSELY($L11,M$1) | L23: 3
A24: of:=BESSELY([.$L12];[.M$1]) -> 0.0755221265822651 | B24: 0.0755221265822651 | C24: of:=ORG.LIBREOFFICE.ROUNDSIG([.A24];15)=ORG.LIBREOFFICE.ROUNDSIG([.B24];15) -> true | D24: of:=FORMULA([.A24]) -> =BESSELY($L12,M$1) | L24: 2
A25: of:=BESSELY([.$L13];[.M$1]) -> -0.0988299647832375 | B25: -0.0988299647832375 | C25: of:=ORG.LIBREOFFICE.ROUNDSIG([.A25];15)=ORG.LIBREOFFICE.ROUNDSIG([.B25];15) -> true | D25: of:=FORMULA([.A25]) -> =BESSELY($L13,M$1) | L25: 1
A26: of:=BESSELY([.$L14];[.M$1]) -> -0.165511614362521 | B26: -0.165511614362521 | C26: of:=ORG.LIBREOFFICE.ROUNDSIG([.A26];15)=ORG.LIBREOFFICE.ROUNDSIG([.B26];15) -> true | D26: of:=FORMULA([.A26]) -> =BESSELY($L14,M$1)
A27: of:=BESSELY([.$L15];[.M$1]) -> 0.0210736280368735 | B27: 0.0210736280368735 | C27: of:=ORG.LIBREOFFICE.ROUNDSIG([.A27];15)=ORG.LIBREOFFICE.ROUNDSIG([.B27];15) -> true | D27: of:=FORMULA([.A27]) -> =BESSELY($L15,M$1)
A28: of:=BESSELY([.$L16];[.M$1]) -> 0.249015424206954 | B28: 0.249015424206954 | C28: of:=ORG.LIBREOFFICE.ROUNDSIG([.A28];15)=ORG.LIBREOFFICE.ROUNDSIG([.B28];15) -> true | D28: of:=FORMULA([.A28]) -> =BESSELY($L16,M$1)
A29: of:=BESSELY([.$L17];[.M$1]) -> 0.104314575196716 | B29: 0.104314575196716 | C29: of:=ORG.LIBREOFFICE.ROUNDSIG([.A29];15)=ORG.LIBREOFFICE.ROUNDSIG([.B29];15) -> true | D29: of:=FORMULA([.A29]) -> =BESSELY($L17,M$1)
A30: of:=BESSELY([.$L18];[.M$1]) -> -0.158060461731248 | B30: -0.158060461731248 | C30: of:=ORG.LIBREOFFICE.ROUNDSIG([.A30];15)=ORG.LIBREOFFICE.ROUNDSIG([.B30];15) -> true | D30: of:=FORMULA([.A30]) -> =BESSELY($L18,M$1)
A31: of:=BESSELY([.$L19];[.M$1]) -> -0.302667237024185 | B31: -0.302667237024185 | C31: of:=ORG.LIBREOFFICE.ROUNDSIG([.A31];15)=ORG.LIBREOFFICE.ROUNDSIG([.B31];15) -> true | D31: of:=FORMULA([.A31]) -> =BESSELY($L19,M$1)
A32: of:=BESSELY([.$L20];[.M$1]) -> -0.175010344300398 | B32: -0.175010344300398 | C32: of:=ORG.LIBREOFFICE.ROUNDSIG([.A32];15)=ORG.LIBREOFFICE.ROUNDSIG([.B32];15) -> true | D32: of:=FORMULA([.A32]) -> =BESSELY($L20,M$1)
A33: of:=BESSELY([.$L21];[.M$1]) -> 0.147863143391227 | B33: 0.147863143391227 | C33: of:=ORG.LIBREOFFICE.ROUNDSIG([.A33];15)=ORG.LIBREOFFICE.ROUNDSIG([.B33];15) -> true | D33: of:=FORMULA([.A33]) -> =BESSELY($L21,M$1)
A34: of:=BESSELY([.$L22];[.M$1]) -> 0.3979257105571 | B34: 0.3979257105571 | C34: of:=ORG.LIBREOFFICE.ROUNDSIG([.A34];15)=ORG.LIBREOFFICE.ROUNDSIG([.B34];15) -> true | D34: of:=FORMULA([.A34]) -> =BESSELY($L22,M$1)
A35: of:=BESSELY([.$L23];[.M$1]) -> 0.3246744247918 | B35: 0.3246744247918 | C35: of:=ORG.LIBREOFFICE.ROUNDSIG([.A35];15)=ORG.LIBREOFFICE.ROUNDSIG([.B35];15) -> true | D35: of:=FORMULA([.A35]) -> =BESSELY($L23,M$1)
A36: of:=BESSELY([.$L24];[.M$1]) -> -0.107032431540938 | B36: -0.107032431540938 | C36: of:=ORG.LIBREOFFICE.ROUNDSIG([.A36];15)=ORG.LIBREOFFICE.ROUNDSIG([.B36];15) -> true | D36: of:=FORMULA([.A36]) -> =BESSELY($L24,M$1)
A37: of:=BESSELY([.$L25];[.M$1]) -> -0.781212821300289 | B37: -0.781212821300289 | C37: of:=ORG.LIBREOFFICE.ROUNDSIG([.A37];15)=ORG.LIBREOFFICE.ROUNDSIG([.B37];15) -> true | D37: of:=FORMULA([.A37]) -> =BESSELY($L25,M$1)
A38: of:=BESSELY([.$L2];[.N$1]) -> 0.0768368671250279 | B38: 0.0768368671250279 | C38: of:=ORG.LIBREOFFICE.ROUNDSIG([.A38];15)=ORG.LIBREOFFICE.ROUNDSIG([.B38];15) -> true | D38: of:=FORMULA([.A38]) -> =BESSELY($L2,N$1)
A39: of:=BESSELY([.$L3];[.N$1]) -> -0.0803584144906058 | B39: -0.0803584144906058 | C39: of:=ORG.LIBREOFFICE.ROUNDSIG([.A39];15)=ORG.LIBREOFFICE.ROUNDSIG([.B39];15) -> true | D39: of:=FORMULA([.A39]) -> =BESSELY($L3,N$1)
A40: of:=BESSELY([.$L4];[.N$1]) -> 0.0573552369343847 | B40: 0.0573552369343847 | C40: of:=ORG.LIBREOFFICE.ROUNDSIG([.A40];15)=ORG.LIBREOFFICE.ROUNDSIG([.B40];15) -> true | D40: of:=FORMULA([.A40]) -> =BESSELY($L4,N$1)
A41: of:=BESSELY([.$L5];[.N$1]) -> -0.012019513676819 | B41: -0.012019513676819 | C41: of:=ORG.LIBREOFFICE.ROUNDSIG([.A41];15)=ORG.LIBREOFFICE.ROUNDSIG([.B41];15) -> true | D41: of:=FORMULA([.A41]) -> =BESSELY($L5,N$1)
A42: of:=BESSELY([.$L6];[.N$1]) -> -0.0442966318971205 | B42: -0.0442966318971205 | C42: of:=ORG.LIBREOFFICE.ROUNDSIG([.A42];15)=ORG.LIBREOFFICE.ROUNDSIG([.B42];15) -> true | D42: of:=FORMULA([.A42]) -> =BESSELY($L6,N$1)
A43: of:=BESSELY([.$L7];[.N$1]) -> 0.0957931687275965 | B43: 0.0957931687275965 | C43: of:=ORG.LIBREOFFICE.ROUNDSIG([.A43];15)=ORG.LIBREOFFICE.ROUNDSIG([.B43];15) -> true | D43: of:=FORMULA([.A43]) -> =BESSELY($L7,N$1)
A44: of:=BESSELY([.$L8];[.N$1]) -> -0.126226092349338 | B44: -0.126226092349338 | C44: of:=ORG.LIBREOFFICE.ROUNDSIG([.A44];15)=ORG.LIBREOFFICE.ROUNDSIG([.B44];15) -> true | D44: of:=FORMULA([.A44]) -> =BESSELY($L8,N$1)
A45: of:=BESSELY([.$L9];[.N$1]) -> 0.130389252312849 | B45: 0.130389252312849 | C45: of:=ORG.LIBREOFFICE.ROUNDSIG([.A45];15)=ORG.LIBREOFFICE.ROUNDSIG([.B45];15) -> true | D45: of:=FORMULA([.A45]) -> =BESSELY($L9,N$1)
A46: of:=BESSELY([.$L10];[.N$1]) -> 0.122924103064114 | B46: 0.122924103064114 | C46: of:=ORG.LIBREOFFICE.ROUNDSIG([.A46];15)=ORG.LIBREOFFICE.ROUNDSIG([.B46];15) -> true | D46: of:=FORMULA([.A46]) -> =BESSELY($L10,N$1)
A47: of:=BESSELY([.$L11];[.N$1]) -> 0.000728089872609307 | B47: 0.000728089872609307 | C47: of:=ORG.LIBREOFFICE.ROUNDSIG([.A47];15)=ORG.LIBREOFFICE.ROUNDSIG([.B47];15) -> true | D47: of:=FORMULA([.A47]) -> =BESSELY($L11,N$1)
A48: of:=BESSELY([.$L12];[.N$1]) -> -0.126442032810514 | B48: -0.126442032810514 | C48: of:=ORG.LIBREOFFICE.ROUNDSIG([.A48];15)=ORG.LIBREOFFICE.ROUNDSIG([.B48];15) -> true | D48: of:=FORMULA([.A48]) -> =BESSELY($L12,N$1)
A49: of:=BESSELY([.$L13];[.N$1]) -> 0.119343035085347 | B49: 0.119343035085347 | C49: of:=ORG.LIBREOFFICE.ROUNDSIG([.A49];15)=ORG.LIBREOFFICE.ROUNDSIG([.B49];15) -> true | D49: of:=FORMULA([.A49]) -> =BESSELY($L13,N$1)
A50: of:=BESSELY([.$L14];[.N$1]) -> -0.0791917582456361 | B50: -0.0791917582456361 | C50: of:=ORG.LIBREOFFICE.ROUNDSIG([.A50];15)=ORG.LIBREOFFICE.ROUNDSIG([.B50];15) -> true | D50: of:=FORMULA([.A50]) -> =BESSELY($L14,N$1)
A51: of:=BESSELY([.$L15];[.N$1]) -> -0.202654478967335 | B51: -0.202654478967335 | C51: of:=ORG.LIBREOFFICE.ROUNDSIG([.A51];15)=ORG.LIBREOFFICE.ROUNDSIG([.B51];15) -> true | D51: of:=FORMULA([.A51]) -> =BESSELY($L15,N$1)
A52: of:=BESSELY([.$L16];[.N$1]) -> -0.00586808244220866 | B52: -0.00586808244220866 | C52: of:=ORG.LIBREOFFICE.ROUNDSIG([.A52];15)=ORG.LIBREOFFICE.ROUNDSIG([.B52];15) -> true | D52: of:=FORMULA([.A52]) -> =BESSELY($L16,N$1)
A53: of:=BESSELY([.$L17];[.N$1]) -> -0.226755681574643 | B53: -0.226755681574643 | C53: of:=ORG.LIBREOFFICE.ROUNDSIG([.A53];15)=ORG.LIBREOFFICE.ROUNDSIG([.B53];15) -> true | D53: of:=FORMULA([.A53]) -> =BESSELY($L17,N$1)
A54: of:=BESSELY([.$L18];[.N$1]) -> -0.263036604820378 | B54: -0.263036604820378 | C54: of:=ORG.LIBREOFFICE.ROUNDSIG([.A54];15)=ORG.LIBREOFFICE.ROUNDSIG([.B54];15) -> true | D54: of:=FORMULA([.A54]) -> =BESSELY($L18,N$1)
A55: of:=BESSELY([.$L19];[.N$1]) -> -0.0605266094682721 | B55: -0.0605266094682721 | C55: of:=ORG.LIBREOFFICE.ROUNDSIG([.A55];15)=ORG.LIBREOFFICE.ROUNDSIG([.B55];15) -> true | D55: of:=FORMULA([.A55]) -> =BESSELY($L19,N$1)
A56: of:=BESSELY([.$L20];[.N$1]) -> 0.229857902548113 | B56: 0.229857902548113 | C56: of:=ORG.LIBREOFFICE.ROUNDSIG([.A56];15)=ORG.LIBREOFFICE.ROUNDSIG([.B56];15) -> true | D56: of:=FORMULA([.A56]) -> =BESSELY($L20,N$1)
A57: of:=BESSELY([.$L21];[.N$1]) -> 0.367662882605524 | B57: 0.367662882605524 | C57: of:=ORG.LIBREOFFICE.ROUNDSIG([.A57];15)=ORG.LIBREOFFICE.ROUNDSIG([.B57];15) -> true | D57: of:=FORMULA([.A57]) -> =BESSELY($L21,N$1)
A58: of:=BESSELY([.$L22];[.N$1]) -> 0.215903594603615 | B58: 0.215903594603615 | C58: of:=ORG.LIBREOFFICE.ROUNDSIG([.A58];15)=ORG.LIBREOFFICE.ROUNDSIG([.B58];15) -> true | D58: of:=FORMULA([.A58]) -> =BESSELY($L22,N$1)
A59: of:=BESSELY([.$L23];[.N$1]) -> -0.160400393484924 | B59: -0.160400393484924 | C59: of:=ORG.LIBREOFFICE.ROUNDSIG([.A59];15)=ORG.LIBREOFFICE.ROUNDSIG([.B59];15) -> true | D59: of:=FORMULA([.A59]) -> =BESSELY($L23,N$1)
A60: of:=BESSELY([.$L24];[.N$1]) -> -0.617408104190683 | B60: -0.617408104190683 | C60: of:=ORG.LIBREOFFICE.ROUNDSIG([.A60];15)=ORG.LIBREOFFICE.ROUNDSIG([.B60];15) -> true | D60: of:=FORMULA([.A60]) -> =BESSELY($L24,N$1)
A61: of:=BESSELY([.$L25];[.N$1]) -> -1.65068260681625 | B61: -1.65068260681625 | C61: of:=ORG.LIBREOFFICE.ROUNDSIG([.A61];15)=ORG.LIBREOFFICE.ROUNDSIG([.B61];15) -> true | D61: of:=FORMULA([.A61]) -> =BESSELY($L25,N$1)
A62: of:=BESSELY([.$L2];[.O$1]) -> 0.0234457866877607 | B62: 0.0234457866877607 | C62: of:=ORG.LIBREOFFICE.ROUNDSIG([.A62];15)=ORG.LIBREOFFICE.ROUNDSIG([.B62];15) -> true | D62: of:=FORMULA([.A62]) -> =BESSELY($L2,O$1)
A63: of:=BESSELY([.$L3];[.O$1]) -> 0.0226157535192978 | B63: 0.0226157535192978 | C63: of:=ORG.LIBREOFFICE.ROUNDSIG([.A63];15)=ORG.LIBREOFFICE.ROUNDSIG([.B63];15) -> true | D63: of:=FORMULA([.A63]) -> =BESSELY($L3,O$1)
A64: of:=BESSELY([.$L4];[.O$1]) -> -0.0665281519378672 | B64: -0.0665281519378672 | C64: of:=ORG.LIBREOFFICE.ROUNDSIG([.A64];15)=ORG.LIBREOFFICE.ROUNDSIG([.B64];15) -> true | D64: of:=FORMULA([.A64]) -> =BESSELY($L4,O$1)
A65: of:=BESSELY([.$L5];[.O$1]) -> 0.0941578232727556 | B65: 0.0941578232727556 | C65: of:=ORG.LIBREOFFICE.ROUNDSIG([.A65];15)=ORG.LIBREOFFICE.ROUNDSIG([.B65];15) -> true | D65: of:=FORMULA([.A65]) -> =BESSELY($L5,O$1)
A66: of:=BESSELY([.$L6];[.O$1]) -> -0.0948227181630089 | B66: -0.0948227181630089 | C66: of:=ORG.LIBREOFFICE.ROUNDSIG([.A66];15)=ORG.LIBREOFFICE.ROUNDSIG([.B66];15) -> true | D66: of:=FORMULA([.A66]) -> =BESSELY($L6,O$1)
A67: of:=BESSELY([.$L7];[.O$1]) -> 0.0644591220602227 | B67: 0.0644591220602227 | C67: of:=ORG.LIBREOFFICE.ROUNDSIG([.A67];15)=ORG.LIBREOFFICE.ROUNDSIG([.B67];15) -> true | D67: of:=FORMULA([.A67]) -> =BESSELY($L7,O$1)
A68: of:=BESSELY([.$L8];[.O$1]) -> -0.00682910341338402 | B68: -0.00682910341338402 | C68: of:=ORG.LIBREOFFICE.ROUNDSIG([.A68];15)=ORG.LIBREOFFICE.ROUNDSIG([.B68];15) -> true | D68: of:=FORMULA([.A68]) -> =BESSELY($L8,O$1)
A69: of:=BESSELY([.$L9];[.O$1]) -> 0.0701972466105921 | B69: 0.0701972466105921 | C69: of:=ORG.LIBREOFFICE.ROUNDSIG([.A69];15)=ORG.LIBREOFFICE.ROUNDSIG([.B69];15) -> true | D69: of:=FORMULA([.A69]) -> =BESSELY($L9,O$1)
A70: of:=BESSELY([.$L10];[.O$1]) -> -0.0680356902531983 | B70: -0.0680356902531983 | C70: of:=ORG.LIBREOFFICE.ROUNDSIG([.A70];15)=ORG.LIBREOFFICE.ROUNDSIG([.B70];15) -> true | D70: of:=FORMULA([.A70]) -> =BESSELY($L10,O$1)
A71: of:=BESSELY([.$L11];[.O$1]) -> -0.147933692930092 | B71: -0.147933692930092 | C71: of:=ORG.LIBREOFFICE.ROUNDSIG([.A71];15)=ORG.LIBREOFFICE.ROUNDSIG([.B71];15) -> true | D71: of:=FORMULA([.A71]) -> =BESSELY($L11,O$1)
A72: of:=BESSELY([.$L12];[.O$1]) -> -0.0935852741266242 | B72: -0.0935852741266242 | C72: of:=ORG.LIBREOFFICE.ROUNDSIG([.A72];15)=ORG.LIBREOFFICE.ROUNDSIG([.B72];15) -> true | D72: of:=FORMULA([.A72]) -> =BESSELY($L12,O$1)
A73: of:=BESSELY([.$L13];[.O$1]) -> 0.117924850396893 | B73: 0.117924850396893 | C73: of:=ORG.LIBREOFFICE.ROUNDSIG([.A73];15)=ORG.LIBREOFFICE.ROUNDSIG([.B73];15) -> true | D73: of:=FORMULA([.A73]) -> =BESSELY($L13,O$1)
A74: of:=BESSELY([.$L14];[.O$1]) -> 0.149673262713394 | B74: 0.149673262713394 | C74: of:=ORG.LIBREOFFICE.ROUNDSIG([.A74];15)=ORG.LIBREOFFICE.ROUNDSIG([.B74];15) -> true | D74: of:=FORMULA([.A74]) -> =BESSELY($L14,O$1)
A75: of:=BESSELY([.$L15];[.O$1]) -> -0.0751148224281629 | B75: -0.0751148224281629 | C75: of:=ORG.LIBREOFFICE.ROUNDSIG([.A75];15)=ORG.LIBREOFFICE.ROUNDSIG([.B75];15) -> true | D75: of:=FORMULA([.A75]) -> =BESSELY($L15,O$1)
A76: of:=BESSELY([.$L16];[.O$1]) -> -0.251362657183837 | B76: -0.251362657183837 | C76: of:=ORG.LIBREOFFICE.ROUNDSIG([.A76];14)=ORG.LIBREOFFICE.ROUNDSIG([.B76];14) -> true | D76: of:=FORMULA([.A76]) -> =BESSELY($L16,O$1)
A77: of:=BESSELY([.$L17];[.O$1]) -> -0.20509487811878 | B77: -0.20509487811878 | C77: of:=ORG.LIBREOFFICE.ROUNDSIG([.A77];15)=ORG.LIBREOFFICE.ROUNDSIG([.B77];15) -> true | D77: of:=FORMULA([.A77]) -> =BESSELY($L17,O$1)
A78: of:=BESSELY([.$L18];[.O$1]) -> 0.0265421593210587 | B78: 0.0265421593210587 | C78: of:=ORG.LIBREOFFICE.ROUNDSIG([.A78];15)=ORG.LIBREOFFICE.ROUNDSIG([.B78];15) -> true | D78: of:=FORMULA([.A78]) -> =BESSELY($L18,O$1)
A79: of:=BESSELY([.$L19];[.O$1]) -> 0.268080603042315 | B79: 0.268080603042315 | C79: of:=ORG.LIBREOFFICE.ROUNDSIG([.A79];15)=ORG.LIBREOFFICE.ROUNDSIG([.B79];15) -> true | D79: of:=FORMULA([.A79]) -> =BESSELY($L19,O$1)
A80: of:=BESSELY([.$L20];[.O$1]) -> 0.32824894599914 | B80: 0.32824894599914 | C80: of:=ORG.LIBREOFFICE.ROUNDSIG([.A80];15)=ORG.LIBREOFFICE.ROUNDSIG([.B80];15) -> true | D80: of:=FORMULA([.A80]) -> =BESSELY($L20,O$1)
A81: of:=BESSELY([.$L21];[.O$1]) -> 0.146267162693193 | B81: 0.146267162693193 | C81: of:=ORG.LIBREOFFICE.ROUNDSIG([.A81];15)=ORG.LIBREOFFICE.ROUNDSIG([.B81];15) -> true | D81: of:=FORMULA([.A81]) -> =BESSELY($L21,O$1)
A82: of:=BESSELY([.$L22];[.O$1]) -> -0.182022115953485 | B82: -0.182022115953485 | C82: of:=ORG.LIBREOFFICE.ROUNDSIG([.A82];15)=ORG.LIBREOFFICE.ROUNDSIG([.B82];15) -> true | D82: of:=FORMULA([.A82]) -> =BESSELY($L22,O$1)
A83: of:=BESSELY([.$L23];[.O$1]) -> -0.538541616105032 | B83: -0.538541616105032 | C83: of:=ORG.LIBREOFFICE.ROUNDSIG([.A83];15)=ORG.LIBREOFFICE.ROUNDSIG([.B83];15) -> true | D83: of:=FORMULA([.A83]) -> =BESSELY($L23,O$1)
A84: of:=BESSELY([.$L24];[.O$1]) -> -1.12778377684043 | B84: -1.12778377684043 | C84: of:=ORG.LIBREOFFICE.ROUNDSIG([.A84];15)=ORG.LIBREOFFICE.ROUNDSIG([.B84];15) -> true | D84: of:=FORMULA([.A84]) -> =BESSELY($L24,O$1)
A85: of:=BESSELY([.$L25];[.O$1]) -> -5.82151760596473 | B85: -5.82151760596473 | C85: of:=ORG.LIBREOFFICE.ROUNDSIG([.A85];15)=ORG.LIBREOFFICE.ROUNDSIG([.B85];15) -> true | D85: of:=FORMULA([.A85]) -> =BESSELY($L25,O$1)
A86: of:=BESSELY([.$L2];[.P$1]) -> -0.0754301199237622 | B86: -0.0754301199237622 | C86: of:=ORG.LIBREOFFICE.ROUNDSIG([.A86];15)=ORG.LIBREOFFICE.ROUNDSIG([.B86];15) -> true | D86: of:=FORMULA([.A86]) -> =BESSELY($L2,P$1)
A87: of:=BESSELY([.$L3];[.P$1]) -> 0.0818661313918924 | B87: 0.0818661313918924 | C87: of:=ORG.LIBREOFFICE.ROUNDSIG([.A87];15)=ORG.LIBREOFFICE.ROUNDSIG([.B87];15) -> true | D87: of:=FORMULA([.A87]) -> =BESSELY($L3,P$1)
A88: of:=BESSELY([.$L4];[.P$1]) -> -0.0623448483297247 | B88: -0.0623448483297247 | C88: of:=ORG.LIBREOFFICE.ROUNDSIG([.A88];15)=ORG.LIBREOFFICE.ROUNDSIG([.B88];15) -> true | D88: of:=FORMULA([.A88]) -> =BESSELY($L4,P$1)
A89: of:=BESSELY([.$L5];[.P$1]) -> 0.0200901842430552 | B89: 0.0200901842430552 | C89: of:=ORG.LIBREOFFICE.ROUNDSIG([.A89];15)=ORG.LIBREOFFICE.ROUNDSIG([.B89];15) -> true | D89: of:=FORMULA([.A89]) -> =BESSELY($L5,P$1)
A90: of:=BESSELY([.$L6];[.P$1]) -> 0.0348143600808196 | B90: 0.0348143600808196 | C90: of:=ORG.LIBREOFFICE.ROUNDSIG([.A90];15)=ORG.LIBREOFFICE.ROUNDSIG([.B90];15) -> true | D90: of:=FORMULA([.A90]) -> =BESSELY($L6,P$1)
A91: of:=BESSELY([.$L7];[.P$1]) -> -0.0880580740803697 | B91: -0.0880580740803697 | C91: of:=ORG.LIBREOFFICE.ROUNDSIG([.A91];15)=ORG.LIBREOFFICE.ROUNDSIG([.B91];15) -> true | D91: of:=FORMULA([.A91]) -> =BESSELY($L7,P$1)
A92: of:=BESSELY([.$L8];[.P$1]) -> 0.125201726837331 | B92: 0.125201726837331 | C92: of:=ORG.LIBREOFFICE.ROUNDSIG([.A92];15)=ORG.LIBREOFFICE.ROUNDSIG([.B92];15) -> true | D92: of:=FORMULA([.A92]) -> =BESSELY($L8,P$1)
A93: of:=BESSELY([.$L9];[.P$1]) -> -0.116802688452735 | B93: -0.116802688452735 | C93: of:=ORG.LIBREOFFICE.ROUNDSIG([.A93];15)=ORG.LIBREOFFICE.ROUNDSIG([.B93];15) -> true | D93: of:=FORMULA([.A93]) -> =BESSELY($L9,P$1)
A94: of:=BESSELY([.$L10];[.P$1]) -> -0.136531241114754 | B94: -0.136531241114754 | C94: of:=ORG.LIBREOFFICE.ROUNDSIG([.A94];15)=ORG.LIBREOFFICE.ROUNDSIG([.B94];15) -> true | D94: of:=FORMULA([.A94]) -> =BESSELY($L10,P$1)
A95: of:=BESSELY([.$L11];[.P$1]) -> -0.0313350608236628 | B95: -0.0313350608236628 | C95: of:=ORG.LIBREOFFICE.ROUNDSIG([.A95];15)=ORG.LIBREOFFICE.ROUNDSIG([.B95];15) -> true | D95: of:=FORMULA([.A95]) -> =BESSELY($L11,P$1)
A96: of:=BESSELY([.$L12];[.P$1]) -> 0.106388045497666 | B96: 0.106388045497666 | C96: of:=ORG.LIBREOFFICE.ROUNDSIG([.A96];15)=ORG.LIBREOFFICE.ROUNDSIG([.B96];15) -> true | D96: of:=FORMULA([.A96]) -> =BESSELY($L12,P$1)
A97: of:=BESSELY([.$L13];[.P$1]) -> -0.0910410709900929 | B97: -0.0910410709900929 | C97: of:=ORG.LIBREOFFICE.ROUNDSIG([.A97];15)=ORG.LIBREOFFICE.ROUNDSIG([.B97];15) -> true | D97: of:=FORMULA([.A97]) -> =BESSELY($L13,P$1)
A98: of:=BESSELY([.$L14];[.P$1]) -> 0.124093737059654 | B98: 0.124093737059654 | C98: of:=ORG.LIBREOFFICE.ROUNDSIG([.A98];15)=ORG.LIBREOFFICE.ROUNDSIG([.B98];15) -> true | D98: of:=FORMULA([.A98]) -> =BESSELY($L14,P$1)
A99: of:=BESSELY([.$L15];[.P$1]) -> 0.17260854999607 | B99: 0.17260854999607 | C99: of:=ORG.LIBREOFFICE.ROUNDSIG([.A99];15)=ORG.LIBREOFFICE.ROUNDSIG([.B99];15) -> true | D99: of:=FORMULA([.A99]) -> =BESSELY($L15,P$1)
A100: of:=BESSELY([.$L16];[.P$1]) -> -0.144949511868094 | B100: -0.144949511868094 | C100: of:=ORG.LIBREOFFICE.ROUNDSIG([.A100];15)=ORG.LIBREOFFICE.ROUNDSIG([.B100];15) -> true | D100: of:=FORMULA([.A100]) -> =BESSELY($L16,P$1)
A101: of:=BESSELY([.$L17];[.P$1]) -> 0.0900257628287902 | B101: 0.0900257628287902 | C101: of:=ORG.LIBREOFFICE.ROUNDSIG([.A101];15)=ORG.LIBREOFFICE.ROUNDSIG([.B101];15) -> true | D101: of:=FORMULA([.A101]) -> =BESSELY($L17,P$1)
A102: of:=BESSELY([.$L18];[.P$1]) -> 0.282943224311172 | B102: 0.282943224311172 | C102: of:=ORG.LIBREOFFICE.ROUNDSIG([.A102];15)=ORG.LIBREOFFICE.ROUNDSIG([.B102];15) -> true | D102: of:=FORMULA([.A102]) -> =BESSELY($L18,P$1)
A103: of:=BESSELY([.$L19];[.P$1]) -> 0.290309983504542 | B103: 0.290309983504542 | C103: of:=ORG.LIBREOFFICE.ROUNDSIG([.A103];15)=ORG.LIBREOFFICE.ROUNDSIG([.B103];15) -> true | D103: of:=FORMULA([.A103]) -> =BESSELY($L19,P$1)
A104: of:=BESSELY([.$L20];[.P$1]) -> 0.0983910434510274 | B104: 0.0983910434510274 | C104: of:=ORG.LIBREOFFICE.ROUNDSIG([.A104];15)=ORG.LIBREOFFICE.ROUNDSIG([.B104];15) -> true | D104: of:=FORMULA([.A104]) -> =BESSELY($L20,P$1)
A105: of:=BESSELY([.$L21];[.P$1]) -> -0.192142287373693 | B105: -0.192142287373693 | C105: of:=ORG.LIBREOFFICE.ROUNDSIG([.A105];15)=ORG.LIBREOFFICE.ROUNDSIG([.B105];15) -> true | D105: of:=FORMULA([.A105]) -> =BESSELY($L21,P$1)
A106: of:=BESSELY([.$L22];[.P$1]) -> -0.488936768533842 | B106: -0.488936768533842 | C106: of:=ORG.LIBREOFFICE.ROUNDSIG([.A106];15)=ORG.LIBREOFFICE.ROUNDSIG([.B106];15) -> true | D106: of:=FORMULA([.A106]) -> =BESSELY($L22,P$1)
A107: of:=BESSELY([.$L23];[.P$1]) -> -0.916682838725139 | B107: -0.916682838725139 | C107: of:=ORG.LIBREOFFICE.ROUNDSIG([.A107];15)=ORG.LIBREOFFICE.ROUNDSIG([.B107];15) -> true | D107: of:=FORMULA([.A107]) -> =BESSELY($L23,P$1)
A108: of:=BESSELY([.$L24];[.P$1]) -> -2.7659432263306 | B108: -2.7659432263306 | C108: of:=ORG.LIBREOFFICE.ROUNDSIG([.A108];15)=ORG.LIBREOFFICE.ROUNDSIG([.B108];15) -> true | D108: of:=FORMULA([.A108]) -> =BESSELY($L24,P$1)
A109: of:=BESSELY([.$L25];[.P$1]) -> -33.2784230289721 | B109: -33.2784230289721 | C109: of:=ORG.LIBREOFFICE.ROUNDSIG([.A109];15)=ORG.LIBREOFFICE.ROUNDSIG([.B109];15) -> true | D109: of:=FORMULA([.A109]) -> =BESSELY($L25,P$1)
A110: of:=BESSELY([.$L2];[.Q$1]) -> -0.0294801962816617 | B110: -0.0294801962816617 | C110: of:=ORG.LIBREOFFICE.ROUNDSIG([.A110];15)=ORG.LIBREOFFICE.ROUNDSIG([.B110];15) -> true | D110: of:=FORMULA([.A110]) -> =BESSELY($L2,Q$1)
A111: of:=BESSELY([.$L3];[.Q$1]) -> -0.0153387640622407 | B111: -0.0153387640622407 | C111: of:=ORG.LIBREOFFICE.ROUNDSIG([.A111];15)=ORG.LIBREOFFICE.ROUNDSIG([.B111];15) -> true | D111: of:=FORMULA([.A111]) -> =BESSELY($L3,Q$1)
A112: of:=BESSELY([.$L4];[.Q$1]) -> 0.0602936671048948 | B112: 0.0602936671048948 | C112: of:=ORG.LIBREOFFICE.ROUNDSIG([.A112];15)=ORG.LIBREOFFICE.ROUNDSIG([.B112];15) -> true | D112: of:=FORMULA([.A112]) -> =BESSELY($L4,Q$1)
A113: of:=BESSELY([.$L5];[.Q$1]) -> -0.0918618022164065 | B113: -0.0918618022164065 | C113: of:=ORG.LIBREOFFICE.ROUNDSIG([.A113];15)=ORG.LIBREOFFICE.ROUNDSIG([.B113];15) -> true | D113: of:=FORMULA([.A113]) -> =BESSELY($L5,Q$1)
A114: of:=BESSELY([.$L6];[.Q$1]) -> 0.0994646328404516 | B114: 0.0994646328404516 | C114: of:=ORG.LIBREOFFICE.ROUNDSIG([.A114];15)=ORG.LIBREOFFICE.ROUNDSIG([.B114];15) -> true | D114: of:=FORMULA([.A114]) -> =BESSELY($L6,Q$1)
A115: of:=BESSELY([.$L7];[.Q$1]) -> -0.0785484139130819 | B115: -0.0785484139130819 | C115: of:=ORG.LIBREOFFICE.ROUNDSIG([.A115];15)=ORG.LIBREOFFICE.ROUNDSIG([.B115];15) -> true | D115: of:=FORMULA([.A115]) -> =BESSELY($L7,Q$1)
A116: of:=BESSELY([.$L8];[.Q$1]) -> 0.0318694487808502 | B116: 0.0318694487808502 | C116: of:=ORG.LIBREOFFICE.ROUNDSIG([.A116];15)=ORG.LIBREOFFICE.ROUNDSIG([.B116];15) -> true | D116: of:=FORMULA([.A116]) -> =BESSELY($L8,Q$1)
A117: of:=BESSELY([.$L9];[.Q$1]) -> -0.100339875888717 | B117: -0.100339875888717 | C117: of:=ORG.LIBREOFFICE.ROUNDSIG([.A117];15)=ORG.LIBREOFFICE.ROUNDSIG([.B117];15) -> true | D117: of:=FORMULA([.A117]) -> =BESSELY($L9,Q$1)
A118: of:=BESSELY([.$L10];[.Q$1]) -> 0.0316273592892641 | B118: 0.0316273592892641 | C118: of:=ORG.LIBREOFFICE.ROUNDSIG([.A118];15)=ORG.LIBREOFFICE.ROUNDSIG([.B118];15) -> true | D118: of:=FORMULA([.A118]) -> =BESSELY($L10,Q$1)
A119: of:=BESSELY([.$L11];[.Q$1]) -> 0.139289538220116 | B119: 0.139289538220116 | C119: of:=ORG.LIBREOFFICE.ROUNDSIG([.A119];15)=ORG.LIBREOFFICE.ROUNDSIG([.B119];15) -> true | D119: of:=FORMULA([.A119]) -> =BESSELY($L11,Q$1)
A120: of:=BESSELY([.$L12];[.Q$1]) -> 0.123981858554529 | B120: 0.123981858554529 | C120: of:=ORG.LIBREOFFICE.ROUNDSIG([.A120];15)=ORG.LIBREOFFICE.ROUNDSIG([.B120];15) -> true | D120: of:=FORMULA([.A120]) -> =BESSELY($L12,Q$1)
A121: of:=BESSELY([.$L13];[.Q$1]) -> -0.147057993113723 | B121: -0.147057993113723 | C121: of:=ORG.LIBREOFFICE.ROUNDSIG([.A121];15)=ORG.LIBREOFFICE.ROUNDSIG([.B121];15) -> true | D121: of:=FORMULA([.A121]) -> =BESSELY($L13,Q$1)
A122: of:=BESSELY([.$L14];[.Q$1]) -> -0.100035767889532 | B122: -0.100035767889532 | C122: of:=ORG.LIBREOFFICE.ROUNDSIG([.A122];15)=ORG.LIBREOFFICE.ROUNDSIG([.B122];15) -> true | D122: of:=FORMULA([.A122]) -> =BESSELY($L14,Q$1)
A123: of:=BESSELY([.$L15];[.Q$1]) -> 0.1671727157594 | B123: 0.1671727157594 | C123: of:=ORG.LIBREOFFICE.ROUNDSIG([.A123];15)=ORG.LIBREOFFICE.ROUNDSIG([.B123];15) -> true | D123: of:=FORMULA([.A123]) -> =BESSELY($L15,Q$1)
A124: of:=BESSELY([.$L16];[.Q$1]) -> 0.135403047689362 | B124: 0.135403047689362 | C124: of:=ORG.LIBREOFFICE.ROUNDSIG([.A124];15)=ORG.LIBREOFFICE.ROUNDSIG([.B124];15) -> true | D124: of:=FORMULA([.A124]) -> =BESSELY($L16,Q$1)
A125: of:=BESSELY([.$L17];[.Q$1]) -> 0.285117778411038 | B125: 0.285117778411038 | C125: of:=ORG.LIBREOFFICE.ROUNDSIG([.A125];15)=ORG.LIBREOFFICE.ROUNDSIG([.B125];15) -> true | D125: of:=FORMULA([.A125]) -> =BESSELY($L17,Q$1)
A126: of:=BESSELY([.$L18];[.Q$1]) -> 0.256401064990113 | B126: 0.256401064990113 | C126: of:=ORG.LIBREOFFICE.ROUNDSIG([.A126];14)=ORG.LIBREOFFICE.ROUNDSIG([.B126];14) -> true | D126: of:=FORMULA([.A126]) -> =BESSELY($L18,Q$1)
A127: of:=BESSELY([.$L19];[.Q$1]) -> 0.0637022352485902 | B127: 0.0637022352485902 | C127: of:=ORG.LIBREOFFICE.ROUNDSIG([.A127];15)=ORG.LIBREOFFICE.ROUNDSIG([.B127];15) -> true | D127: of:=FORMULA([.A127]) -> =BESSELY($L19,Q$1)
A128: of:=BESSELY([.$L20];[.Q$1]) -> -0.197060888064437 | B128: -0.197060888064437 | C128: of:=ORG.LIBREOFFICE.ROUNDSIG([.A128];15)=ORG.LIBREOFFICE.ROUNDSIG([.B128];15) -> true | D128: of:=FORMULA([.A128]) -> =BESSELY($L20,Q$1)
A129: of:=BESSELY([.$L21];[.Q$1]) -> -0.453694822491102 | B129: -0.453694822491102 | C129: of:=ORG.LIBREOFFICE.ROUNDSIG([.A129];15)=ORG.LIBREOFFICE.ROUNDSIG([.B129];15) -> true | D129: of:=FORMULA([.A129]) -> =BESSELY($L21,Q$1)
A130: of:=BESSELY([.$L22];[.Q$1]) -> -0.7958514211142 | B130: -0.7958514211142 | C130: of:=ORG.LIBREOFFICE.ROUNDSIG([.A130];15)=ORG.LIBREOFFICE.ROUNDSIG([.B130];15) -> true | D130: of:=FORMULA([.A130]) -> =BESSELY($L22,Q$1)
A131: of:=BESSELY([.$L23];[.Q$1]) -> -1.90594595382867 | B131: -1.90594595382867 | C131: of:=ORG.LIBREOFFICE.ROUNDSIG([.A131];15)=ORG.LIBREOFFICE.ROUNDSIG([.B131];15) -> true | D131: of:=FORMULA([.A131]) -> =BESSELY($L23,Q$1)
A132: of:=BESSELY([.$L24];[.Q$1]) -> -9.93598912848198 | B132: -9.93598912848198 | C132: of:=ORG.LIBREOFFICE.ROUNDSIG([.A132];15)=ORG.LIBREOFFICE.ROUNDSIG([.B132];15) -> true | D132: of:=FORMULA([.A132]) -> =BESSELY($L24,Q$1)
A133: of:=BESSELY([.$L25];[.Q$1]) -> -260.405866625812 | B133: -260.405866625812 | C133: of:=ORG.LIBREOFFICE.ROUNDSIG([.A133];15)=ORG.LIBREOFFICE.ROUNDSIG([.B133];15) -> true | D133: of:=FORMULA([.A133]) -> =BESSELY($L25,Q$1)
A134: of:=BESSELY([.$L2];[.R$1]) -> 0.0724821002955961 | B134: 0.0724821002955961 | C134: of:=ORG.LIBREOFFICE.ROUNDSIG([.A134];15)=ORG.LIBREOFFICE.ROUNDSIG([.B134];15) -> true | D134: of:=FORMULA([.A134]) -> =BESSELY($L2,R$1)
A135: of:=BESSELY([.$L3];[.R$1]) -> -0.0835704385099191 | B135: -0.0835704385099191 | C135: of:=ORG.LIBREOFFICE.ROUNDSIG([.A135];15)=ORG.LIBREOFFICE.ROUNDSIG([.B135];15) -> true | D135: of:=FORMULA([.A135]) -> =BESSELY($L3,R$1)
A136: of:=BESSELY([.$L4];[.R$1]) -> 0.0698815567178366 | B136: 0.0698815567178366 | C136: of:=ORG.LIBREOFFICE.ROUNDSIG([.A136];15)=ORG.LIBREOFFICE.ROUNDSIG([.B136];15) -> true | D136: of:=FORMULA([.A136]) -> =BESSELY($L4,R$1)
A137: of:=BESSELY([.$L5];[.R$1]) -> -0.033213298845399 | B137: -0.033213298845399 | C137: of:=ORG.LIBREOFFICE.ROUNDSIG([.A137];15)=ORG.LIBREOFFICE.ROUNDSIG([.B137];15) -> true | D137: of:=FORMULA([.A137]) -> =BESSELY($L5,R$1)
A138: of:=BESSELY([.$L6];[.R$1]) -> -0.0182369212740777 | B138: -0.0182369212740777 | C138: of:=ORG.LIBREOFFICE.ROUNDSIG([.A138];15)=ORG.LIBREOFFICE.ROUNDSIG([.B138];15) -> true | D138: of:=FORMULA([.A138]) -> =BESSELY($L6,R$1)
A139: of:=BESSELY([.$L7];[.R$1]) -> 0.0723483912977534 | B139: 0.0723483912977534 | C139: of:=ORG.LIBREOFFICE.ROUNDSIG([.A139];15)=ORG.LIBREOFFICE.ROUNDSIG([.B139];15) -> true | D139: of:=FORMULA([.A139]) -> =BESSELY($L7,R$1)
A140: of:=BESSELY([.$L8];[.R$1]) -> -0.117234364642118 | B140: -0.117234364642118 | C140: of:=ORG.LIBREOFFICE.ROUNDSIG([.A140];15)=ORG.LIBREOFFICE.ROUNDSIG([.B140];15) -> true | D140: of:=FORMULA([.A140]) -> =BESSELY($L8,R$1)
A141: of:=BESSELY([.$L9];[.R$1]) -> 0.0844349865531487 | B141: 0.0844349865531487 | C141: of:=ORG.LIBREOFFICE.ROUNDSIG([.A141];15)=ORG.LIBREOFFICE.ROUNDSIG([.B141];15) -> true | D141: of:=FORMULA([.A141]) -> =BESSELY($L9,R$1)
A142: of:=BESSELY([.$L10];[.R$1]) -> 0.147073694211175 | B142: 0.147073694211175 | C142: of:=ORG.LIBREOFFICE.ROUNDSIG([.A142];15)=ORG.LIBREOFFICE.ROUNDSIG([.B142];15) -> true | D142: of:=FORMULA([.A142]) -> =BESSELY($L10,R$1)
A143: of:=BESSELY([.$L11];[.R$1]) -> 0.0793659360719786 | B143: 0.0793659360719786 | C143: of:=ORG.LIBREOFFICE.ROUNDSIG([.A143];15)=ORG.LIBREOFFICE.ROUNDSIG([.B143];15) -> true | D143: of:=FORMULA([.A143]) -> =BESSELY($L11,R$1)
A144: of:=BESSELY([.$L12];[.R$1]) -> -0.0621088102996196 | B144: -0.0621088102996196 | C144: of:=ORG.LIBREOFFICE.ROUNDSIG([.A144];15)=ORG.LIBREOFFICE.ROUNDSIG([.B144];15) -> true | D144: of:=FORMULA([.A144]) -> =BESSELY($L12,R$1)
A145: of:=BESSELY([.$L13];[.R$1]) -> 0.0322178737446038 | B145: 0.0322178737446038 | C145: of:=ORG.LIBREOFFICE.ROUNDSIG([.A145];15)=ORG.LIBREOFFICE.ROUNDSIG([.B145];15) -> true | D145: of:=FORMULA([.A145]) -> =BESSELY($L13,R$1)
A146: of:=BESSELY([.$L14];[.R$1]) -> -0.17411162100442 | B146: -0.17411162100442 | C146: of:=ORG.LIBREOFFICE.ROUNDSIG([.A146];15)=ORG.LIBREOFFICE.ROUNDSIG([.B146];15) -> true | D146: of:=FORMULA([.A146]) -> =BESSELY($L14,R$1)
A147: of:=BESSELY([.$L15];[.R$1]) -> -0.0611600728231365 | B147: -0.0611600728231365 | C147: of:=ORG.LIBREOFFICE.ROUNDSIG([.A147];15)=ORG.LIBREOFFICE.ROUNDSIG([.B147];15) -> true | D147: of:=FORMULA([.A147]) -> =BESSELY($L15,R$1)
A148: of:=BESSELY([.$L16];[.R$1]) -> 0.280352559557456 | B148: 0.280352559557456 | C148: of:=ORG.LIBREOFFICE.ROUNDSIG([.A148];15)=ORG.LIBREOFFICE.ROUNDSIG([.B148];15) -> true | D148: of:=FORMULA([.A148]) -> =BESSELY($L16,R$1)
A149: of:=BESSELY([.$L17];[.R$1]) -> 0.226771768739029 | B149: 0.226771768739029 | C149: of:=ORG.LIBREOFFICE.ROUNDSIG([.A149];15)=ORG.LIBREOFFICE.ROUNDSIG([.B149];15) -> true | D149: of:=FORMULA([.A149]) -> =BESSELY($L17,R$1)
A150: of:=BESSELY([.$L18];[.R$1]) -> 0.0375581069264697 | B150: 0.0375581069264697 | C150: of:=ORG.LIBREOFFICE.ROUNDSIG([.A150];15)=ORG.LIBREOFFICE.ROUNDSIG([.B150];15) -> true | D150: of:=FORMULA([.A150]) -> =BESSELY($L18,R$1)
A151: of:=BESSELY([.$L19];[.R$1]) -> -0.199306790292271 | B151: -0.199306790292271 | C151: of:=ORG.LIBREOFFICE.ROUNDSIG([.A151];15)=ORG.LIBREOFFICE.ROUNDSIG([.B151];15) -> true | D151: of:=FORMULA([.A151]) -> =BESSELY($L19,R$1)
A152: of:=BESSELY([.$L20];[.R$1]) -> -0.426825856891756 | B152: -0.426825856891756 | C152: of:=ORG.LIBREOFFICE.ROUNDSIG([.A152];15)=ORG.LIBREOFFICE.ROUNDSIG([.B152];15) -> true | D152: of:=FORMULA([.A152]) -> =BESSELY($L20,R$1)
A153: of:=BESSELY([.$L21];[.R$1]) -> -0.71524735760851 | B153: -0.71524735760851 | C153: of:=ORG.LIBREOFFICE.ROUNDSIG([.A153];15)=ORG.LIBREOFFICE.ROUNDSIG([.B153];15) -> true | D153: of:=FORMULA([.A153]) -> =BESSELY($L21,R$1)
A154: of:=BESSELY([.$L22];[.R$1]) -> -1.50069178425166 | B154: -1.50069178425166 | C154: of:=ORG.LIBREOFFICE.ROUNDSIG([.A154];15)=ORG.LIBREOFFICE.ROUNDSIG([.B154];15) -> true | D154: of:=FORMULA([.A154]) -> =BESSELY($L22,R$1)
A155: of:=BESSELY([.$L23];[.R$1]) -> -5.43647034070377 | B155: -5.43647034070377 | C155: of:=ORG.LIBREOFFICE.ROUNDSIG([.A155];15)=ORG.LIBREOFFICE.ROUNDSIG([.B155];15) -> true | D155: of:=FORMULA([.A155]) -> =BESSELY($L23,R$1)
A156: of:=BESSELY([.$L24];[.R$1]) -> -46.9140024160793 | B156: -46.9140024160793 | C156: of:=ORG.LIBREOFFICE.ROUNDSIG([.A156];15)=ORG.LIBREOFFICE.ROUNDSIG([.B156];15) -> true | D156: of:=FORMULA([.A156]) -> =BESSELY($L24,R$1)
A157: of:=BESSELY([.$L25];[.R$1]) -> -2570.78024322915 | B157: -2570.78024322915 | C157: of:=ORG.LIBREOFFICE.ROUNDSIG([.A157];15)=ORG.LIBREOFFICE.ROUNDSIG([.B157];15) -> true | D157: of:=FORMULA([.A157]) -> =BESSELY($L25,R$1)
A158: of:=BESSELY([.$L2];[.S$1]) -> 0.0381780483171332 | B158: 0.0381780483171332 | C158: of:=ORG.LIBREOFFICE.ROUNDSIG([.A158];15)=ORG.LIBREOFFICE.ROUNDSIG([.B158];15) -> true | D158: of:=FORMULA([.A158]) -> =BESSELY($L2,S$1)
A159: of:=BESSELY([.$L3];[.S$1]) -> 0.00419603892758478 | B159: 0.00419603892758478 | C159: of:=ORG.LIBREOFFICE.ROUNDSIG([.A159];15)=ORG.LIBREOFFICE.ROUNDSIG([.B159];15) -> true | D159: of:=FORMULA([.A159]) -> =BESSELY($L3,S$1)
A160: of:=BESSELY([.$L4];[.S$1]) -> -0.0498114335972193 | B160: -0.0498114335972193 | C160: of:=ORG.LIBREOFFICE.ROUNDSIG([.A160];15)=ORG.LIBREOFFICE.ROUNDSIG([.B160];15) -> true | D160: of:=FORMULA([.A160]) -> =BESSELY($L4,S$1)
A161: of:=BESSELY([.$L5];[.S$1]) -> 0.0861680938429095 | B161: 0.0861680938429095 | C161: of:=ORG.LIBREOFFICE.ROUNDSIG([.A161];15)=ORG.LIBREOFFICE.ROUNDSIG([.B161];15) -> true | D161: of:=FORMULA([.A161]) -> =BESSELY($L5,S$1)
A162: of:=BESSELY([.$L6];[.S$1]) -> -0.103112017095267 | B162: -0.103112017095267 | C162: of:=ORG.LIBREOFFICE.ROUNDSIG([.A162];15)=ORG.LIBREOFFICE.ROUNDSIG([.B162];15) -> true | D162: of:=FORMULA([.A162]) -> =BESSELY($L6,S$1)
A163: of:=BESSELY([.$L7];[.S$1]) -> 0.0959120278245427 | B163: 0.0959120278245427 | C163: of:=ORG.LIBREOFFICE.ROUNDSIG([.A163];15)=ORG.LIBREOFFICE.ROUNDSIG([.B163];15) -> true | D163: of:=FORMULA([.A163]) -> =BESSELY($L7,S$1)
A164: of:=BESSELY([.$L8];[.S$1]) -> -0.0670397581734857 | B164: -0.0670397581734857 | C164: of:=ORG.LIBREOFFICE.ROUNDSIG([.A164];15)=ORG.LIBREOFFICE.ROUNDSIG([.B164];15) -> true | D164: of:=FORMULA([.A164]) -> =BESSELY($L8,S$1)
A165: of:=BESSELY([.$L9];[.S$1]) -> 0.133024386812517 | B165: 0.133024386812517 | C165: of:=ORG.LIBREOFFICE.ROUNDSIG([.A165];15)=ORG.LIBREOFFICE.ROUNDSIG([.B165];15) -> true | D165: of:=FORMULA([.A165]) -> =BESSELY($L9,S$1)
A166: of:=BESSELY([.$L10];[.S$1]) -> 0.0272021183952059 | B166: 0.0272021183952059 | C166: of:=ORG.LIBREOFFICE.ROUNDSIG([.A166];15)=ORG.LIBREOFFICE.ROUNDSIG([.B166];15) -> true | D166: of:=FORMULA([.A166]) -> =BESSELY($L10,S$1)
A167: of:=BESSELY([.$L11];[.S$1]) -> -0.106448461224814 | B167: -0.106448461224814 | C167: of:=ORG.LIBREOFFICE.ROUNDSIG([.A167];15)=ORG.LIBREOFFICE.ROUNDSIG([.B167];15) -> true | D167: of:=FORMULA([.A167]) -> =BESSELY($L11,S$1)
A168: of:=BESSELY([.$L12];[.S$1]) -> -0.150599920111508 | B168: -0.150599920111508 | C168: of:=ORG.LIBREOFFICE.ROUNDSIG([.A168];15)=ORG.LIBREOFFICE.ROUNDSIG([.B168];15) -> true | D168: of:=FORMULA([.A168]) -> =BESSELY($L12,S$1)
A169: of:=BESSELY([.$L13];[.S$1]) -> 0.162522572511133 | B169: 0.162522572511133 | C169: of:=ORG.LIBREOFFICE.ROUNDSIG([.A169];15)=ORG.LIBREOFFICE.ROUNDSIG([.B169];15) -> true | D169: of:=FORMULA([.A169]) -> =BESSELY($L13,S$1)
A170: of:=BESSELY([.$L14];[.S$1]) -> -0.00443120471312017 | B170: -0.00443120471312017 | C170: of:=ORG.LIBREOFFICE.ROUNDSIG([.A170];15)=ORG.LIBREOFFICE.ROUNDSIG([.B170];15) -> true | D170: of:=FORMULA([.A170]) -> =BESSELY($L14,S$1)
A171: of:=BESSELY([.$L15];[.S$1]) -> -0.21610077401791 | B171: -0.21610077401791 | C171: of:=ORG.LIBREOFFICE.ROUNDSIG([.A171];15)=ORG.LIBREOFFICE.ROUNDSIG([.B171];15) -> true | D171: of:=FORMULA([.A171]) -> =BESSELY($L15,S$1)
A172: of:=BESSELY([.$L16];[.S$1]) -> 0.201020023779585 | B172: 0.201020023779585 | C172: of:=ORG.LIBREOFFICE.ROUNDSIG([.A172];15)=ORG.LIBREOFFICE.ROUNDSIG([.B172];15) -> true | D172: of:=FORMULA([.A172]) -> =BESSELY($L16,S$1)
A173: of:=BESSELY([.$L17];[.S$1]) -> 0.0172445799076681 | B173: 0.0172445799076681 | C173: of:=ORG.LIBREOFFICE.ROUNDSIG([.A173];15)=ORG.LIBREOFFICE.ROUNDSIG([.B173];15) -> true | D173: of:=FORMULA([.A173]) -> =BESSELY($L17,S$1)
A174: of:=BESSELY([.$L18];[.S$1]) -> -0.200063904600409 | B174: -0.200063904600409 | C174: of:=ORG.LIBREOFFICE.ROUNDSIG([.A174];15)=ORG.LIBREOFFICE.ROUNDSIG([.B174];15) -> true | D174: of:=FORMULA([.A174]) -> =BESSELY($L18,S$1)
A175: of:=BESSELY([.$L19];[.S$1]) -> -0.405371018606768 | B175: -0.405371018606768 | C175: of:=ORG.LIBREOFFICE.ROUNDSIG([.A175];15)=ORG.LIBREOFFICE.ROUNDSIG([.B175];15) -> true | D175: of:=FORMULA([.A175]) -> =BESSELY($L19,S$1)
A176: of:=BESSELY([.$L20];[.S$1]) -> -0.656590825719075 | B176: -0.656590825719075 | C176: of:=ORG.LIBREOFFICE.ROUNDSIG([.A176];15)=ORG.LIBREOFFICE.ROUNDSIG([.B176];15) -> true | D176: of:=FORMULA([.A176]) -> =BESSELY($L20,S$1)
A177: of:=BESSELY([.$L21];[.S$1]) -> -1.26289883576932 | B177: -1.26289883576932 | C177: of:=ORG.LIBREOFFICE.ROUNDSIG([.A177];15)=ORG.LIBREOFFICE.ROUNDSIG([.B177];15) -> true | D177: of:=FORMULA([.A177]) -> =BESSELY($L21,S$1)
A178: of:=BESSELY([.$L22];[.S$1]) -> -3.70622393164077 | B178: -3.70622393164077 | C178: of:=ORG.LIBREOFFICE.ROUNDSIG([.A178];15)=ORG.LIBREOFFICE.ROUNDSIG([.B178];15) -> true | D178: of:=FORMULA([.A178]) -> =BESSELY($L22,S$1)
A179: of:=BESSELY([.$L23];[.S$1]) -> -19.8399354089864 | B179: -19.8399354089864 | C179: of:=ORG.LIBREOFFICE.ROUNDSIG([.A179];15)=ORG.LIBREOFFICE.ROUNDSIG([.B179];15) -> true | D179: of:=FORMULA([.A179]) -> =BESSELY($L23,S$1)
A180: of:=BESSELY([.$L24];[.S$1]) -> -271.548025367994 | B180: -271.548025367994 | C180: of:=ORG.LIBREOFFICE.ROUNDSIG([.A180];15)=ORG.LIBREOFFICE.ROUNDSIG([.B180];15) -> true | D180: of:=FORMULA([.A180]) -> =BESSELY($L24,S$1)
A181: of:=BESSELY([.$L25];[.S$1]) -> -30588.957052124 | B181: -30588.957052124 | C181: of:=ORG.LIBREOFFICE.ROUNDSIG([.A181];15)=ORG.LIBREOFFICE.ROUNDSIG([.B181];15) -> true | D181: of:=FORMULA([.A181]) -> =BESSELY($L25,S$1)
A182: of:=BESSELY([.$L2];[.T$1]) -> -0.0671371735311974 | B182: -0.0671371735311974 | C182: of:=ORG.LIBREOFFICE.ROUNDSIG([.A182];15)=ORG.LIBREOFFICE.ROUNDSIG([.B182];15) -> true | D182: of:=FORMULA([.A182]) -> =BESSELY($L2,T$1)
A183: of:=BESSELY([.$L3];[.T$1]) -> 0.0842231556764323 | B183: 0.0842231556764323 | C183: of:=ORG.LIBREOFFICE.ROUNDSIG([.A183];15)=ORG.LIBREOFFICE.ROUNDSIG([.B183];15) -> true | D183: of:=FORMULA([.A183]) -> =BESSELY($L3,T$1)
A184: of:=BESSELY([.$L4];[.T$1]) -> -0.0785985575973499 | B184: -0.0785985575973499 | C184: of:=ORG.LIBREOFFICE.ROUNDSIG([.A184];15)=ORG.LIBREOFFICE.ROUNDSIG([.B184];15) -> true | D184: of:=FORMULA([.A184]) -> =BESSELY($L4,T$1)
A185: of:=BESSELY([.$L5];[.T$1]) -> 0.0504469176139809 | B185: 0.0504469176139809 | C185: of:=ORG.LIBREOFFICE.ROUNDSIG([.A185];15)=ORG.LIBREOFFICE.ROUNDSIG([.B185];15) -> true | D185: of:=FORMULA([.A185]) -> =BESSELY($L5,T$1)
A186: of:=BESSELY([.$L6];[.T$1]) -> -0.00582254938148461 | B186: -0.00582254938148461 | C186: of:=ORG.LIBREOFFICE.ROUNDSIG([.A186];15)=ORG.LIBREOFFICE.ROUNDSIG([.B186];15) -> true | D186: of:=FORMULA([.A186]) -> =BESSELY($L6,T$1)
A187: of:=BESSELY([.$L7];[.T$1]) -> -0.0454930235068814 | B187: -0.0454930235068814 | C187: of:=ORG.LIBREOFFICE.ROUNDSIG([.A187];15)=ORG.LIBREOFFICE.ROUNDSIG([.B187];15) -> true | D187: of:=FORMULA([.A187]) -> =BESSELY($L7,T$1)
A188: of:=BESSELY([.$L8];[.T$1]) -> 0.0937704492813983 | B188: 0.0937704492813983 | C188: of:=ORG.LIBREOFFICE.ROUNDSIG([.A188];15)=ORG.LIBREOFFICE.ROUNDSIG([.B188];15) -> true | D188: of:=FORMULA([.A188]) -> =BESSELY($L8,T$1)
A189: of:=BESSELY([.$L9];[.T$1]) -> -0.0243594570249153 | B189: -0.0243594570249153 | C189: of:=ORG.LIBREOFFICE.ROUNDSIG([.A189];15)=ORG.LIBREOFFICE.ROUNDSIG([.B189];15) -> true | D189: of:=FORMULA([.A189]) -> =BESSELY($L9,T$1)
A190: of:=BESSELY([.$L10];[.T$1]) -> -0.134379372293412 | B190: -0.134379372293412 | C190: of:=ORG.LIBREOFFICE.ROUNDSIG([.A190];15)=ORG.LIBREOFFICE.ROUNDSIG([.B190];15) -> true | D190: of:=FORMULA([.A190]) -> =BESSELY($L10,T$1)
A191: of:=BESSELY([.$L11];[.T$1]) -> -0.130754848387406 | B191: -0.130754848387406 | C191: of:=ORG.LIBREOFFICE.ROUNDSIG([.A191];15)=ORG.LIBREOFFICE.ROUNDSIG([.B191];15) -> true | D191: of:=FORMULA([.A191]) -> =BESSELY($L11,T$1)
A192: of:=BESSELY([.$L12];[.T$1]) -> -0.0131911497561346 | B192: -0.0131911497561346 | C192: of:=ORG.LIBREOFFICE.ROUNDSIG([.A192];15)=ORG.LIBREOFFICE.ROUNDSIG([.B192];15) -> true | D192: of:=FORMULA([.A192]) -> =BESSELY($L12,T$1)
A193: of:=BESSELY([.$L13];[.T$1]) -> 0.0587947668616305 | B193: 0.0587947668616305 | C193: of:=ORG.LIBREOFFICE.ROUNDSIG([.A193];15)=ORG.LIBREOFFICE.ROUNDSIG([.B193];15) -> true | D193: of:=FORMULA([.A193]) -> =BESSELY($L13,T$1)
A194: of:=BESSELY([.$L14];[.T$1]) -> 0.171009777705236 | B194: 0.171009777705236 | C194: of:=ORG.LIBREOFFICE.ROUNDSIG([.A194];15)=ORG.LIBREOFFICE.ROUNDSIG([.B194];15) -> true | D194: of:=FORMULA([.A194]) -> =BESSELY($L14,T$1)
A195: of:=BESSELY([.$L15];[.T$1]) -> -0.140533982926912 | B195: -0.140533982926912 | C195: of:=ORG.LIBREOFFICE.ROUNDSIG([.A195];15)=ORG.LIBREOFFICE.ROUNDSIG([.B195];15) -> true | D195: of:=FORMULA([.A195]) -> =BESSELY($L15,T$1)
A196: of:=BESSELY([.$L16];[.T$1]) -> 0.001075473733963 | B196: 0.001075473733963 | C196: of:=ORG.LIBREOFFICE.ROUNDSIG([.A196];15)=ORG.LIBREOFFICE.ROUNDSIG([.B196];15) -> true | D196: of:=FORMULA([.A196]) -> =BESSELY($L16,T$1)
A197: of:=BESSELY([.$L17];[.T$1]) -> -0.199946866660434 | B197: -0.199946866660434 | C197: of:=ORG.LIBREOFFICE.ROUNDSIG([.A197];15)=ORG.LIBREOFFICE.ROUNDSIG([.B197];15) -> true | D197: of:=FORMULA([.A197]) -> =BESSELY($L17,T$1)
A198: of:=BESSELY([.$L18];[.T$1]) -> -0.387669939977185 | B198: -0.387669939977185 | C198: of:=ORG.LIBREOFFICE.ROUNDSIG([.A198];15)=ORG.LIBREOFFICE.ROUNDSIG([.B198];15) -> true | D198: of:=FORMULA([.A198]) -> =BESSELY($L18,T$1)
A199: of:=BESSELY([.$L19];[.T$1]) -> -0.611435246921266 | B199: -0.611435246921266 | C199: of:=ORG.LIBREOFFICE.ROUNDSIG([.A199];15)=ORG.LIBREOFFICE.ROUNDSIG([.B199];15) -> true | D199: of:=FORMULA([.A199]) -> =BESSELY($L19,T$1)
A200: of:=BESSELY([.$L20];[.T$1]) -> -1.10521940311942 | B200: -1.10521940311942 | C200: of:=ORG.LIBREOFFICE.ROUNDSIG([.A200];15)=ORG.LIBREOFFICE.ROUNDSIG([.B200];15) -> true | D200: of:=FORMULA([.A200]) -> =BESSELY($L20,T$1)
A201: of:=BESSELY([.$L21];[.T$1]) -> -2.8208693825456 | B201: -2.8208693825456 | C201: of:=ORG.LIBREOFFICE.ROUNDSIG([.A201];15)=ORG.LIBREOFFICE.ROUNDSIG([.B201];15) -> true | D201: of:=FORMULA([.A201]) -> =BESSELY($L21,T$1)
A202: of:=BESSELY([.$L22];[.T$1]) -> -11.4710919764911 | B202: -11.4710919764911 | C202: of:=ORG.LIBREOFFICE.ROUNDSIG([.A202];15)=ORG.LIBREOFFICE.ROUNDSIG([.B202];15) -> true | D202: of:=FORMULA([.A202]) -> =BESSELY($L22,T$1)
A203: of:=BESSELY([.$L23];[.T$1]) -> -87.1498949012328 | B203: -87.1498949012328 | C203: of:=ORG.LIBREOFFICE.ROUNDSIG([.A203];15)=ORG.LIBREOFFICE.ROUNDSIG([.B203];15) -> true | D203: of:=FORMULA([.A203]) -> =BESSELY($L23,T$1)
A204: of:=BESSELY([.$L24];[.T$1]) -> -1853.92217515988 | B204: -1853.92217515988 | C204: of:=ORG.LIBREOFFICE.ROUNDSIG([.A204];15)=ORG.LIBREOFFICE.ROUNDSIG([.B204];15) -> true | D204: of:=FORMULA([.A204]) -> =BESSELY($L24,T$1)
A205: of:=BESSELY([.$L25];[.T$1]) -> -425674.618486507 | B205: -425674.618486507 | C205: of:=ORG.LIBREOFFICE.ROUNDSIG([.A205];15)=ORG.LIBREOFFICE.ROUNDSIG([.B205];15) -> true | D205: of:=FORMULA([.A205]) -> =BESSELY($L25,T$1)
A206: of:=BESSELY([.$L2];[.U$1]) -> -0.0489199960821248 | B206: -0.0489199960821248 | C206: of:=ORG.LIBREOFFICE.ROUNDSIG([.A206];15)=ORG.LIBREOFFICE.ROUNDSIG([.B206];15) -> true | D206: of:=FORMULA([.A206]) -> =BESSELY($L2,U$1)
A207: of:=BESSELY([.$L3];[.U$1]) -> 0.0107769665260032 | B207: 0.0107769665260032 | C207: of:=ORG.LIBREOFFICE.ROUNDSIG([.A207];15)=ORG.LIBREOFFICE.ROUNDSIG([.B207];15) -> true | D207: of:=FORMULA([.A207]) -> =BESSELY($L3,U$1)
A208: of:=BESSELY([.$L4];[.U$1]) -> 0.0340917220777493 | B208: 0.0340917220777493 | C208: of:=ORG.LIBREOFFICE.ROUNDSIG([.A208];15)=ORG.LIBREOFFICE.ROUNDSIG([.B208];15) -> true | D208: of:=FORMULA([.A208]) -> =BESSELY($L4,U$1)
A209: of:=BESSELY([.$L5];[.U$1]) -> -0.0746373698168567 | B209: -0.0746373698168567 | C209: of:=ORG.LIBREOFFICE.ROUNDSIG([.A209];15)=ORG.LIBREOFFICE.ROUNDSIG([.B209];15) -> true | D209: of:=FORMULA([.A209]) -> =BESSELY($L5,U$1)
A210: of:=BESSELY([.$L6];[.U$1]) -> 0.101559337260205 | B210: 0.101559337260205 | C210: of:=ORG.LIBREOFFICE.ROUNDSIG([.A210];15)=ORG.LIBREOFFICE.ROUNDSIG([.B210];15) -> true | D210: of:=FORMULA([.A210]) -> =BESSELY($L6,U$1)
A211: of:=BESSELY([.$L7];[.U$1]) -> -0.110469795346745 | B211: -0.110469795346745 | C211: of:=ORG.LIBREOFFICE.ROUNDSIG([.A211];15)=ORG.LIBREOFFICE.ROUNDSIG([.B211];15) -> true | D211: of:=FORMULA([.A211]) -> =BESSELY($L7,U$1)
A212: of:=BESSELY([.$L8];[.U$1]) -> 0.104547937886045 | B212: 0.104547937886045 | C212: of:=ORG.LIBREOFFICE.ROUNDSIG([.A212];15)=ORG.LIBREOFFICE.ROUNDSIG([.B212];15) -> true | D212: of:=FORMULA([.A212]) -> =BESSELY($L8,U$1)
A213: of:=BESSELY([.$L9];[.U$1]) -> -0.145597009793118 | B213: -0.145597009793118 | C213: of:=ORG.LIBREOFFICE.ROUNDSIG([.A213];15)=ORG.LIBREOFFICE.ROUNDSIG([.B213];15) -> true | D213: of:=FORMULA([.A213]) -> =BESSELY($L9,U$1)
A214: of:=BESSELY([.$L10];[.U$1]) -> -0.0988711169516924 | B214: -0.0988711169516924 | C214: of:=ORG.LIBREOFFICE.ROUNDSIG([.A214];15)=ORG.LIBREOFFICE.ROUNDSIG([.B214];15) -> true | D214: of:=FORMULA([.A214]) -> =BESSELY($L10,U$1)
A215: of:=BESSELY([.$L11];[.U$1]) -> 0.0343078552179696 | B215: 0.0343078552179696 | C215: of:=ORG.LIBREOFFICE.ROUNDSIG([.A215];15)=ORG.LIBREOFFICE.ROUNDSIG([.B215];15) -> true | D215: of:=FORMULA([.A215]) -> =BESSELY($L11,U$1)
A216: of:=BESSELY([.$L12];[.U$1]) -> 0.14306212025086 | B216: 0.14306212025086 | C216: of:=ORG.LIBREOFFICE.ROUNDSIG([.A216];15)=ORG.LIBREOFFICE.ROUNDSIG([.B216];15) -> true | D216: of:=FORMULA([.A216]) -> =BESSELY($L12,U$1)
A217: of:=BESSELY([.$L13];[.U$1]) -> -0.124893921719689 | B217: -0.124893921719689 | C217: of:=ORG.LIBREOFFICE.ROUNDSIG([.A217];15)=ORG.LIBREOFFICE.ROUNDSIG([.B217];15) -> true | D217: of:=FORMULA([.A217]) -> =BESSELY($L13,U$1)
A218: of:=BESSELY([.$L14];[.U$1]) -> 0.141239026877309 | B218: 0.141239026877309 | C218: of:=ORG.LIBREOFFICE.ROUNDSIG([.A218];15)=ORG.LIBREOFFICE.ROUNDSIG([.B218];15) -> true | D218: of:=FORMULA([.A218]) -> =BESSELY($L14,U$1)
A219: of:=BESSELY([.$L15];[.U$1]) -> 0.0661978588958697 | B219: 0.0661978588958697 | C219: of:=ORG.LIBREOFFICE.ROUNDSIG([.A219];15)=ORG.LIBREOFFICE.ROUNDSIG([.B219];15) -> true | D219: of:=FORMULA([.A219]) -> =BESSELY($L15,U$1)
A220: of:=BESSELY([.$L16];[.U$1]) -> -0.199299265805244 | B220: -0.199299265805244 | C220: of:=ORG.LIBREOFFICE.ROUNDSIG([.A220];15)=ORG.LIBREOFFICE.ROUNDSIG([.B220];15) -> true | D220: of:=FORMULA([.A220]) -> =BESSELY($L16,U$1)
A221: of:=BESSELY([.$L17];[.U$1]) -> -0.372705676192885 | B221: -0.372705676192885 | C221: of:=ORG.LIBREOFFICE.ROUNDSIG([.A221];15)=ORG.LIBREOFFICE.ROUNDSIG([.B221];15) -> true | D221: of:=FORMULA([.A221]) -> =BESSELY($L17,U$1)
A222: of:=BESSELY([.$L18];[.U$1]) -> -0.575275975353962 | B222: -0.575275975353962 | C222: of:=ORG.LIBREOFFICE.ROUNDSIG([.A222];15)=ORG.LIBREOFFICE.ROUNDSIG([.B222];15) -> true | D222: of:=FORMULA([.A222]) -> =BESSELY($L18,U$1)
A223: of:=BESSELY([.$L19];[.U$1]) -> -0.992195260070411 | B223: -0.992195260070411 | C223: of:=ORG.LIBREOFFICE.ROUNDSIG([.A223];15)=ORG.LIBREOFFICE.ROUNDSIG([.B223];15) -> true | D223: of:=FORMULA([.A223]) -> =BESSELY($L19,U$1)
A224: of:=BESSELY([.$L20];[.U$1]) -> -2.29066091593271 | B224: -2.29066091593271 | C224: of:=ORG.LIBREOFFICE.ROUNDSIG([.A224];15)=ORG.LIBREOFFICE.ROUNDSIG([.B224];15) -> true | D224: of:=FORMULA([.A224]) -> =BESSELY($L20,U$1)
A225: of:=BESSELY([.$L21];[.U$1]) -> -7.76388318837658 | B225: -7.76388318837658 | C225: of:=ORG.LIBREOFFICE.ROUNDSIG([.A225];15)=ORG.LIBREOFFICE.ROUNDSIG([.B225];15) -> true | D225: of:=FORMULA([.A225]) -> =BESSELY($L21,U$1)
A226: of:=BESSELY([.$L22];[.U$1]) -> -42.1781439743234 | B226: -42.1781439743234 | C226: of:=ORG.LIBREOFFICE.ROUNDSIG([.A226];15)=ORG.LIBREOFFICE.ROUNDSIG([.B226];15) -> true | D226: of:=FORMULA([.A226]) -> =BESSELY($L22,U$1)
A227: of:=BESSELY([.$L23];[.U$1]) -> -444.959504064255 | B227: -444.959504064255 | C227: of:=ORG.LIBREOFFICE.ROUNDSIG([.A227];15)=ORG.LIBREOFFICE.ROUNDSIG([.B227];15) -> true | D227: of:=FORMULA([.A227]) -> =BESSELY($L23,U$1)
A228: of:=BESSELY([.$L24];[.U$1]) -> -14559.829375911 | B228: -14559.829375911 | C228: of:=ORG.LIBREOFFICE.ROUNDSIG([.A228];15)=ORG.LIBREOFFICE.ROUNDSIG([.B228];15) -> true | D228: of:=FORMULA([.A228]) -> =BESSELY($L24,U$1)
A229: of:=BESSELY([.$L25];[.U$1]) -> -6780204.93873198 | B229: -6780204.93873198 | C229: of:=ORG.LIBREOFFICE.ROUNDSIG([.A229];15)=ORG.LIBREOFFICE.ROUNDSIG([.B229];15) -> true | D229: of:=FORMULA([.A229]) -> =BESSELY($L25,U$1)
A230: of:=BESSELY([.$L2];[.V$1]) -> 0.0583315742364149 | B230: 0.0583315742364149 | C230: of:=ORG.LIBREOFFICE.ROUNDSIG([.A230];15)=ORG.LIBREOFFICE.ROUNDSIG([.B230];15) -> true | D230: of:=FORMULA([.A230]) -> =BESSELY($L2,V$1)
A231: of:=BESSELY([.$L3];[.V$1]) -> -0.0820677623712317 | B231: -0.0820677623712317 | C231: of:=ORG.LIBREOFFICE.ROUNDSIG([.A231];15)=ORG.LIBREOFFICE.ROUNDSIG([.B231];15) -> true | D231: of:=FORMULA([.A231]) -> =BESSELY($L3,V$1)
A232: of:=BESSELY([.$L4];[.V$1]) -> 0.0862691950648435 | B232: 0.0862691950648435 | C232: of:=ORG.LIBREOFFICE.ROUNDSIG([.A232];15)=ORG.LIBREOFFICE.ROUNDSIG([.B232];15) -> true | D232: of:=FORMULA([.A232]) -> =BESSELY($L4,V$1)
A233: of:=BESSELY([.$L5];[.V$1]) -> -0.0696393841383155 | B233: -0.0696393841383155 | C233: of:=ORG.LIBREOFFICE.ROUNDSIG([.A233];15)=ORG.LIBREOFFICE.ROUNDSIG([.B233];15) -> true | D233: of:=FORMULA([.A233]) -> =BESSELY($L5,V$1)
A234: of:=BESSELY([.$L6];[.V$1]) -> 0.036290350559546 | B234: 0.036290350559546 | C234: of:=ORG.LIBREOFFICE.ROUNDSIG([.A234];15)=ORG.LIBREOFFICE.ROUNDSIG([.B234];15) -> true | D234: of:=FORMULA([.A234]) -> =BESSELY($L6,V$1)
A235: of:=BESSELY([.$L7];[.V$1]) -> 0.00572389718205328 | B235: 0.00572389718205328 | C235: of:=ORG.LIBREOFFICE.ROUNDSIG([.A235];15)=ORG.LIBREOFFICE.ROUNDSIG([.B235];15) -> true | D235: of:=FORMULA([.A235]) -> =BESSELY($L7,V$1)
A236: of:=BESSELY([.$L8];[.V$1]) -> -0.0467238772326781 | B236: -0.0467238772326781 | C236: of:=ORG.LIBREOFFICE.ROUNDSIG([.A236];15)=ORG.LIBREOFFICE.ROUNDSIG([.B236];15) -> true | D236: of:=FORMULA([.A236]) -> =BESSELY($L8,V$1)
A237: of:=BESSELY([.$L9];[.V$1]) -> -0.0601807422097984 | B237: -0.0601807422097984 | C237: of:=ORG.LIBREOFFICE.ROUNDSIG([.A237];15)=ORG.LIBREOFFICE.ROUNDSIG([.B237];15) -> true | D237: of:=FORMULA([.A237]) -> =BESSELY($L9,V$1)
A238: of:=BESSELY([.$L10];[.V$1]) -> 0.0750567021223967 | B238: 0.0750567021223967 | C238: of:=ORG.LIBREOFFICE.ROUNDSIG([.A238];15)=ORG.LIBREOFFICE.ROUNDSIG([.B238];15) -> true | D238: of:=FORMULA([.A238]) -> =BESSELY($L10,V$1)
A239: of:=BESSELY([.$L11];[.V$1]) -> 0.152049379212353 | B239: 0.152049379212353 | C239: of:=ORG.LIBREOFFICE.ROUNDSIG([.A239];15)=ORG.LIBREOFFICE.ROUNDSIG([.B239];15) -> true | D239: of:=FORMULA([.A239]) -> =BESSELY($L11,V$1)
A240: of:=BESSELY([.$L12];[.V$1]) -> 0.105159655631688 | B240: 0.105159655631688 | C240: of:=ORG.LIBREOFFICE.ROUNDSIG([.A240];15)=ORG.LIBREOFFICE.ROUNDSIG([.B240];15) -> true | D240: of:=FORMULA([.A240]) -> =BESSELY($L12,V$1)
A241: of:=BESSELY([.$L13];[.V$1]) -> -0.148718390499807 | B241: -0.148718390499807 | C241: of:=ORG.LIBREOFFICE.ROUNDSIG([.A241];15)=ORG.LIBREOFFICE.ROUNDSIG([.B241];15) -> true | D241: of:=FORMULA([.A241]) -> =BESSELY($L13,V$1)
A242: of:=BESSELY([.$L14];[.V$1]) -> -0.0438946535156579 | B242: -0.0438946535156579 | C242: of:=ORG.LIBREOFFICE.ROUNDSIG([.A242];15)=ORG.LIBREOFFICE.ROUNDSIG([.B242];15) -> true | D242: of:=FORMULA([.A242]) -> =BESSELY($L14,V$1)
A243: of:=BESSELY([.$L15];[.V$1]) -> 0.219971413601956 | B243: 0.219971413601956 | C243: of:=ORG.LIBREOFFICE.ROUNDSIG([.A243];15)=ORG.LIBREOFFICE.ROUNDSIG([.B243];15) -> true | D243: of:=FORMULA([.A243]) -> =BESSELY($L15,V$1)
A244: of:=BESSELY([.$L16];[.V$1]) -> -0.359814152183403 | B244: -0.359814152183403 | C244: of:=ORG.LIBREOFFICE.ROUNDSIG([.A244];15)=ORG.LIBREOFFICE.ROUNDSIG([.B244];15) -> true | D244: of:=FORMULA([.A244]) -> =BESSELY($L16,V$1)
A245: of:=BESSELY([.$L17];[.V$1]) -> -0.545464485725335 | B245: -0.545464485725335 | C245: of:=ORG.LIBREOFFICE.ROUNDSIG([.A245];15)=ORG.LIBREOFFICE.ROUNDSIG([.B245];15) -> true | D245: of:=FORMULA([.A245]) -> =BESSELY($L17,V$1)
A246: of:=BESSELY([.$L18];[.V$1]) -> -0.906701004569229 | B246: -0.906701004569229 | C246: of:=ORG.LIBREOFFICE.ROUNDSIG([.A246];15)=ORG.LIBREOFFICE.ROUNDSIG([.B246];15) -> true | D246: of:=FORMULA([.A246]) -> =BESSELY($L18,V$1)
A247: of:=BESSELY([.$L19];[.V$1]) -> -1.93992399325979 | B247: -1.93992399325979 | C247: of:=ORG.LIBREOFFICE.ROUNDSIG([.A247];15)=ORG.LIBREOFFICE.ROUNDSIG([.B247];15) -> true | D247: of:=FORMULA([.A247]) -> =BESSELY($L19,V$1)
A248: of:=BESSELY([.$L20];[.V$1]) -> -5.76676334467871 | B248: -5.76676334467871 | C248: of:=ORG.LIBREOFFICE.ROUNDSIG([.A248];15)=ORG.LIBREOFFICE.ROUNDSIG([.B248];15) -> true | D248: of:=FORMULA([.A248]) -> =BESSELY($L20,V$1)
A249: of:=BESSELY([.$L21];[.V$1]) -> -25.1291100956101 | B249: -25.1291100956101 | C249: of:=ORG.LIBREOFFICE.ROUNDSIG([.A249];15)=ORG.LIBREOFFICE.ROUNDSIG([.B249];15) -> true | D249: of:=FORMULA([.A249]) -> =BESSELY($L21,V$1)
A250: of:=BESSELY([.$L22];[.V$1]) -> -178.330555907964 | B250: -178.330555907964 | C250: of:=ORG.LIBREOFFICE.ROUNDSIG([.A250];15)=ORG.LIBREOFFICE.ROUNDSIG([.B250];15) -> true | D250: of:=FORMULA([.A250]) -> =BESSELY($L22,V$1)
A251: of:=BESSELY([.$L23];[.V$1]) -> -2582.6071294843 | B251: -2582.6071294843 | C251: of:=ORG.LIBREOFFICE.ROUNDSIG([.A251];15)=ORG.LIBREOFFICE.ROUNDSIG([.B251];15) -> true | D251: of:=FORMULA([.A251]) -> =BESSELY($L23,V$1)
A252: of:=BESSELY([.$L24];[.V$1]) -> -129184.542208039 | B252: -129184.542208039 | C252: of:=ORG.LIBREOFFICE.ROUNDSIG([.A252];15)=ORG.LIBREOFFICE.ROUNDSIG([.B252];15) -> true | D252: of:=FORMULA([.A252]) -> =BESSELY($L24,V$1)
A253: of:=BESSELY([.$L25];[.V$1]) -> -121618014.278689 | B253: -121618014.278689 | C253: of:=ORG.LIBREOFFICE.ROUNDSIG([.A253];15)=ORG.LIBREOFFICE.ROUNDSIG([.B253];15) -> true | D253: of:=FORMULA([.A253]) -> =BESSELY($L25,V$1)
A254: of:=BESSELY([.$L2];[.W$1]) -> 0.0605863109294078 | B254: 0.0605863109294078 | C254: of:=ORG.LIBREOFFICE.ROUNDSIG([.A254];15)=ORG.LIBREOFFICE.ROUNDSIG([.B254];15) -> true | D254: of:=FORMULA([.A254]) -> =BESSELY($L2,W$1)
A255: of:=BESSELY([.$L3];[.W$1]) -> -0.0290142470529436 | B255: -0.0290142470529436 | C255: of:=ORG.LIBREOFFICE.ROUNDSIG([.A255];15)=ORG.LIBREOFFICE.ROUNDSIG([.B255];15) -> true | D255: of:=FORMULA([.A255]) -> =BESSELY($L3,W$1)
A256: of:=BESSELY([.$L4];[.W$1]) -> -0.0125244233115384 | B256: -0.0125244233115384 | C256: of:=ORG.LIBREOFFICE.ROUNDSIG([.A256];15)=ORG.LIBREOFFICE.ROUNDSIG([.B256];15) -> true | D256: of:=FORMULA([.A256]) -> =BESSELY($L4,W$1)
A257: of:=BESSELY([.$L5];[.W$1]) -> 0.0547404029201952 | B257: 0.0547404029201952 | C257: of:=ORG.LIBREOFFICE.ROUNDSIG([.A257];15)=ORG.LIBREOFFICE.ROUNDSIG([.B257];15) -> true | D257: of:=FORMULA([.A257]) -> =BESSELY($L5,W$1)
A258: of:=BESSELY([.$L6];[.W$1]) -> -0.0894625537403559 | B258: -0.0894625537403559 | C258: of:=ORG.LIBREOFFICE.ROUNDSIG([.A258];15)=ORG.LIBREOFFICE.ROUNDSIG([.B258];15) -> true | D258: of:=FORMULA([.A258]) -> =BESSELY($L6,W$1)
A259: of:=BESSELY([.$L7];[.W$1]) -> 0.112759354219566 | B259: 0.112759354219566 | C259: of:=ORG.LIBREOFFICE.ROUNDSIG([.A259];15)=ORG.LIBREOFFICE.ROUNDSIG([.B259];15) -> true | D259: of:=FORMULA([.A259]) -> =BESSELY($L7,W$1)
A260: of:=BESSELY([.$L8];[.W$1]) -> -0.127909876502384 | B260: -0.127909876502384 | C260: of:=ORG.LIBREOFFICE.ROUNDSIG([.A260];15)=ORG.LIBREOFFICE.ROUNDSIG([.B260];15) -> true | D260: of:=FORMULA([.A260]) -> =BESSELY($L8,W$1)
A261: of:=BESSELY([.$L9];[.W$1]) -> 0.106770724496474 | B261: 0.106770724496474 | C261: of:=ORG.LIBREOFFICE.ROUNDSIG([.A261];15)=ORG.LIBREOFFICE.ROUNDSIG([.B261];15) -> true | D261: of:=FORMULA([.A261]) -> =BESSELY($L9,W$1)
A262: of:=BESSELY([.$L10];[.W$1]) -> 0.148908918366624 | B262: 0.148908918366624 | C262: of:=ORG.LIBREOFFICE.ROUNDSIG([.A262];15)=ORG.LIBREOFFICE.ROUNDSIG([.B262];15) -> true | D262: of:=FORMULA([.A262]) -> =BESSELY($L10,W$1)
A263: of:=BESSELY([.$L11];[.W$1]) -> 0.0705537856181359 | B263: 0.0705537856181359 | C263: of:=ORG.LIBREOFFICE.ROUNDSIG([.A263];15)=ORG.LIBREOFFICE.ROUNDSIG([.B263];15) -> true | D263: of:=FORMULA([.A263]) -> =BESSELY($L11,W$1)
A264: of:=BESSELY([.$L12];[.W$1]) -> -0.0679480805139405 | B264: -0.0679480805139405 | C264: of:=ORG.LIBREOFFICE.ROUNDSIG([.A264];15)=ORG.LIBREOFFICE.ROUNDSIG([.B264];15) -> true | D264: of:=FORMULA([.A264]) -> =BESSELY($L12,W$1)
A265: of:=BESSELY([.$L13];[.W$1]) -> 0.00591920931984377 | B265: 0.00591920931984377 | C265: of:=ORG.LIBREOFFICE.ROUNDSIG([.A265];15)=ORG.LIBREOFFICE.ROUNDSIG([.B265];15) -> true | D265: of:=FORMULA([.A265]) -> =BESSELY($L13,W$1)
A266: of:=BESSELY([.$L14];[.W$1]) -> -0.185133680392967 | B266: -0.185133680392967 | C266: of:=ORG.LIBREOFFICE.ROUNDSIG([.A266];15)=ORG.LIBREOFFICE.ROUNDSIG([.B266];15) -> true | D266: of:=FORMULA([.A266]) -> =BESSELY($L14,W$1)
A267: of:=BESSELY([.$L15];[.W$1]) -> 0.227097359240072 | B267: 0.227097359240072 | C267: of:=ORG.LIBREOFFICE.ROUNDSIG([.A267];15)=ORG.LIBREOFFICE.ROUNDSIG([.B267];15) -> true | D267: of:=FORMULA([.A267]) -> =BESSELY($L15,W$1)
A268: of:=BESSELY([.$L16];[.W$1]) -> -0.520329038561561 | B268: -0.520329038561561 | C268: of:=ORG.LIBREOFFICE.ROUNDSIG([.A268];15)=ORG.LIBREOFFICE.ROUNDSIG([.B268];15) -> true | D268: of:=FORMULA([.A268]) -> =BESSELY($L16,W$1)
A269: of:=BESSELY([.$L17];[.W$1]) -> -0.839437625418971 | B269: -0.839437625418971 | C269: of:=ORG.LIBREOFFICE.ROUNDSIG([.A269];15)=ORG.LIBREOFFICE.ROUNDSIG([.B269];15) -> true | D269: of:=FORMULA([.A269]) -> =BESSELY($L17,W$1)
A270: of:=BESSELY([.$L18];[.W$1]) -> -1.69147653606911 | B270: -1.69147653606911 | C270: of:=ORG.LIBREOFFICE.ROUNDSIG([.A270];15)=ORG.LIBREOFFICE.ROUNDSIG([.B270];15) -> true | D270: of:=FORMULA([.A270]) -> =BESSELY($L18,W$1)
A271: of:=BESSELY([.$L19];[.W$1]) -> -4.55044472067185 | B271: -4.55044472067185 | C271: of:=ORG.LIBREOFFICE.ROUNDSIG([.A271];15)=ORG.LIBREOFFICE.ROUNDSIG([.B271];15) -> true | D271: of:=FORMULA([.A271]) -> =BESSELY($L19,W$1)
A272: of:=BESSELY([.$L20];[.W$1]) -> -16.9318835663296 | B272: -16.9318835663296 | C272: of:=ORG.LIBREOFFICE.ROUNDSIG([.A272];15)=ORG.LIBREOFFICE.ROUNDSIG([.B272];15) -> true | D272: of:=FORMULA([.A272]) -> =BESSELY($L20,W$1)
A273: of:=BESSELY([.$L21];[.W$1]) -> -92.7525571940638 | B273: -92.7525571940638 | C273: of:=ORG.LIBREOFFICE.ROUNDSIG([.A273];15)=ORG.LIBREOFFICE.ROUNDSIG([.B273];15) -> true | D273: of:=FORMULA([.A273]) -> =BESSELY($L21,W$1)
A274: of:=BESSELY([.$L22];[.W$1]) -> -849.474635565498 | B274: -849.474635565498 | C274: of:=ORG.LIBREOFFICE.ROUNDSIG([.A274];15)=ORG.LIBREOFFICE.ROUNDSIG([.B274];15) -> true | D274: of:=FORMULA([.A274]) -> =BESSELY($L22,W$1)
A275: of:=BESSELY([.$L23];[.W$1]) -> -16772.4213591644 | B275: -16772.4213591644 | C275: of:=ORG.LIBREOFFICE.ROUNDSIG([.A275];15)=ORG.LIBREOFFICE.ROUNDSIG([.B275];15) -> true | D275: of:=FORMULA([.A275]) -> =BESSELY($L23,W$1)
A276: of:=BESSELY([.$L24];[.W$1]) -> -1277285.59270448 | B276: -1277285.59270448 | C276: of:=ORG.LIBREOFFICE.ROUNDSIG([.A276];15)=ORG.LIBREOFFICE.ROUNDSIG([.B276];15) -> true | D276: of:=FORMULA([.A276]) -> =BESSELY($L24,W$1)
A277: of:=BESSELY([.$L25];[.W$1]) -> -2425580080.63505 | B277: -2425580080.63505 | C277: of:=ORG.LIBREOFFICE.ROUNDSIG([.A277];15)=ORG.LIBREOFFICE.ROUNDSIG([.B277];15) -> true | D277: of:=FORMULA([.A277]) -> =BESSELY($L25,W$1)
A278: of:=BESSELY([.$L2];[.X$1]) -> -0.0450025858319452 | B278: -0.0450025858319452 | C278: of:=ORG.LIBREOFFICE.ROUNDSIG([.A278];15)=ORG.LIBREOFFICE.ROUNDSIG([.B278];15) -> true | D278: of:=FORMULA([.A278]) -> =BESSELY($L2,X$1)
A279: of:=BESSELY([.$L3];[.X$1]) -> 0.074975390869401 | B279: 0.074975390869401 | C279: of:=ORG.LIBREOFFICE.ROUNDSIG([.A279];15)=ORG.LIBREOFFICE.ROUNDSIG([.B279];15) -> true | D279: of:=FORMULA([.A279]) -> =BESSELY($L3,X$1)
A280: of:=BESSELY([.$L4];[.X$1]) -> -0.0897134114755166 | B280: -0.0897134114755166 | C280: of:=ORG.LIBREOFFICE.ROUNDSIG([.A280];15)=ORG.LIBREOFFICE.ROUNDSIG([.B280];15) -> true | D280: of:=FORMULA([.A280]) -> =BESSELY($L4,X$1)
A281: of:=BESSELY([.$L5];[.X$1]) -> 0.0868435107703768 | B281: 0.0868435107703768 | C281: of:=ORG.LIBREOFFICE.ROUNDSIG([.A281];15)=ORG.LIBREOFFICE.ROUNDSIG([.B281];15) -> true | D281: of:=FORMULA([.A281]) -> =BESSELY($L5,X$1)
A282: of:=BESSELY([.$L6];[.X$1]) -> -0.0690932869310098 | B282: -0.0690932869310098 | C282: of:=ORG.LIBREOFFICE.ROUNDSIG([.A282];15)=ORG.LIBREOFFICE.ROUNDSIG([.B282];15) -> true | D282: of:=FORMULA([.A282]) -> =BESSELY($L6,X$1)
A283: of:=BESSELY([.$L7];[.X$1]) -> 0.0438902186745558 | B283: 0.0438902186745558 | C283: of:=ORG.LIBREOFFICE.ROUNDSIG([.A283];15)=ORG.LIBREOFFICE.ROUNDSIG([.B283];15) -> true | D283: of:=FORMULA([.A283]) -> =BESSELY($L7,X$1)
A284: of:=BESSELY([.$L8];[.X$1]) -> -0.0236265548436332 | B284: -0.0236265548436332 | C284: of:=ORG.LIBREOFFICE.ROUNDSIG([.A284];15)=ORG.LIBREOFFICE.ROUNDSIG([.B284];15) -> true | D284: of:=FORMULA([.A284]) -> =BESSELY($L8,X$1)
A285: of:=BESSELY([.$L9];[.X$1]) -> 0.135953514433103 | B285: 0.135953514433103 | C285: of:=ORG.LIBREOFFICE.ROUNDSIG([.A285];15)=ORG.LIBREOFFICE.ROUNDSIG([.B285];15) -> true | D285: of:=FORMULA([.A285]) -> =BESSELY($L9,X$1)
A286: of:=BESSELY([.$L10];[.X$1]) -> 0.0341431713464605 | B286: 0.0341431713464605 | C286: of:=ORG.LIBREOFFICE.ROUNDSIG([.A286];15)=ORG.LIBREOFFICE.ROUNDSIG([.B286];15) -> true | D286: of:=FORMULA([.A286]) -> =BESSELY($L10,X$1)
A287: of:=BESSELY([.$L11];[.X$1]) -> -0.0985258177089395 | B287: -0.0985258177089395 | C287: of:=ORG.LIBREOFFICE.ROUNDSIG([.A287];15)=ORG.LIBREOFFICE.ROUNDSIG([.B287];15) -> true | D287: of:=FORMULA([.A287]) -> =BESSELY($L11,X$1)
A288: of:=BESSELY([.$L12];[.X$1]) -> -0.158547433178355 | B288: -0.158547433178355 | C288: of:=ORG.LIBREOFFICE.ROUNDSIG([.A288];15)=ORG.LIBREOFFICE.ROUNDSIG([.B288];15) -> true | D288: of:=FORMULA([.A288]) -> =BESSELY($L12,X$1)
A289: of:=BESSELY([.$L13];[.X$1]) -> 0.153927294701269 | B289: 0.153927294701269 | C289: of:=ORG.LIBREOFFICE.ROUNDSIG([.A289];15)=ORG.LIBREOFFICE.ROUNDSIG([.B289];15) -> true | D289: of:=FORMULA([.A289]) -> =BESSELY($L13,X$1)
A290: of:=BESSELY([.$L14];[.X$1]) -> -0.159752394916606 | B290: -0.159752394916606 | C290: of:=ORG.LIBREOFFICE.ROUNDSIG([.A290];15)=ORG.LIBREOFFICE.ROUNDSIG([.B290];15) -> true | D290: of:=FORMULA([.A290]) -> =BESSELY($L14,X$1)
A291: of:=BESSELY([.$L15];[.X$1]) -> 0.113104713283482 | B291: 0.113104713283482 | C291: of:=ORG.LIBREOFFICE.ROUNDSIG([.A291];15)=ORG.LIBREOFFICE.ROUNDSIG([.B291];15) -> true | D291: of:=FORMULA([.A291]) -> =BESSELY($L15,X$1)
A292: of:=BESSELY([.$L16];[.X$1]) -> -0.784909732652032 | B292: -0.784909732652032 | C292: of:=ORG.LIBREOFFICE.ROUNDSIG([.A292];15)=ORG.LIBREOFFICE.ROUNDSIG([.B292];15) -> true | D292: of:=FORMULA([.A292]) -> =BESSELY($L16,X$1)
A293: of:=BESSELY([.$L17];[.X$1]) -> -1.50649415418771 | B293: -1.50649415418771 | C293: of:=ORG.LIBREOFFICE.ROUNDSIG([.A293];15)=ORG.LIBREOFFICE.ROUNDSIG([.B293];15) -> true | D293: of:=FORMULA([.A293]) -> =BESSELY($L17,X$1)
A294: of:=BESSELY([.$L18];[.X$1]) -> -3.74485946962082 | B294: -3.74485946962082 | C294: of:=ORG.LIBREOFFICE.ROUNDSIG([.A294];15)=ORG.LIBREOFFICE.ROUNDSIG([.B294];15) -> true | D294: of:=FORMULA([.A294]) -> =BESSELY($L18,X$1)
A295: of:=BESSELY([.$L19];[.X$1]) -> -12.3614737002803 | B295: -12.3614737002803 | C295: of:=ORG.LIBREOFFICE.ROUNDSIG([.A295];15)=ORG.LIBREOFFICE.ROUNDSIG([.B295];15) -> true | D295: of:=FORMULA([.A295]) -> =BESSELY($L19,X$1)
A296: of:=BESSELY([.$L20];[.X$1]) -> -56.3168097318633 | B296: -56.3168097318633 | C296: of:=ORG.LIBREOFFICE.ROUNDSIG([.A296];15)=ORG.LIBREOFFICE.ROUNDSIG([.B296];15) -> true | D296: of:=FORMULA([.A296]) -> =BESSELY($L20,X$1)
A297: of:=BESSELY([.$L21];[.X$1]) -> -382.982141558271 | B297: -382.982141558271 | C297: of:=ORG.LIBREOFFICE.ROUNDSIG([.A297];15)=ORG.LIBREOFFICE.ROUNDSIG([.B297];15) -> true | D297: of:=FORMULA([.A297]) -> =BESSELY($L21,X$1)
A298: of:=BESSELY([.$L22];[.X$1]) -> -4493.77993970228 | B298: -4493.77993970228 | C298: of:=ORG.LIBREOFFICE.ROUNDSIG([.A298];15)=ORG.LIBREOFFICE.ROUNDSIG([.B298];15) -> true | D298: of:=FORMULA([.A298]) -> =BESSELY($L22,X$1)
A299: of:=BESSELY([.$L23];[.X$1]) -> -120415.149504388 | B299: -120415.149504388 | C299: of:=ORG.LIBREOFFICE.ROUNDSIG([.A299];15)=ORG.LIBREOFFICE.ROUNDSIG([.B299];15) -> true | D299: of:=FORMULA([.A299]) -> =BESSELY($L23,X$1)
A300: of:=BESSELY([.$L24];[.X$1]) -> -13920956.9775413 | B300: -13920956.9775413 | C300: of:=ORG.LIBREOFFICE.ROUNDSIG([.A300];15)=ORG.LIBREOFFICE.ROUNDSIG([.B300];15) -> true | D300: of:=FORMULA([.A300]) -> =BESSELY($L24,X$1)
A301: of:=BESSELY([.$L25];[.X$1]) -> -53241143759.6925 | B301: -53241143759.6925 | C301: of:=ORG.LIBREOFFICE.ROUNDSIG([.A301];15)=ORG.LIBREOFFICE.ROUNDSIG([.B301];15) -> true | D301: of:=FORMULA([.A301]) -> =BESSELY($L25,X$1)
A302: of:=BESSELY([.$L2];[.Y$1]) -> -0.0713869315290746 | B302: -0.0713869315290746 | C302: of:=ORG.LIBREOFFICE.ROUNDSIG([.A302];15)=ORG.LIBREOFFICE.ROUNDSIG([.B302];15) -> true | D302: of:=FORMULA([.A302]) -> =BESSELY($L2,Y$1)
A303: of:=BESSELY([.$L3];[.Y$1]) -> 0.0490076846181172 | B303: 0.0490076846181172 | C303: of:=ORG.LIBREOFFICE.ROUNDSIG([.A303];15)=ORG.LIBREOFFICE.ROUNDSIG([.B303];15) -> true | D303: of:=FORMULA([.A303]) -> =BESSELY($L3,Y$1)
A304: of:=BESSELY([.$L4];[.Y$1]) -> -0.0143896001311166 | B304: -0.0143896001311166 | C304: of:=ORG.LIBREOFFICE.ROUNDSIG([.A304];15)=ORG.LIBREOFFICE.ROUNDSIG([.B304];15) -> true | D304: of:=FORMULA([.A304]) -> =BESSELY($L4,Y$1)
A305: of:=BESSELY([.$L5];[.Y$1]) -> -0.0249654849417803 | B305: -0.0249654849417803 | C305: of:=ORG.LIBREOFFICE.ROUNDSIG([.A305];15)=ORG.LIBREOFFICE.ROUNDSIG([.B305];15) -> true | D305: of:=FORMULA([.A305]) -> =BESSELY($L5,Y$1)
A306: of:=BESSELY([.$L6];[.Y$1]) -> 0.061825238967952 | B306: 0.061825238967952 | C306: of:=ORG.LIBREOFFICE.ROUNDSIG([.A306];15)=ORG.LIBREOFFICE.ROUNDSIG([.B306];15) -> true | D306: of:=FORMULA([.A306]) -> =BESSELY($L6,Y$1)
A307: of:=BESSELY([.$L7];[.Y$1]) -> -0.0916920492557793 | B307: -0.0916920492557793 | C307: of:=ORG.LIBREOFFICE.ROUNDSIG([.A307];15)=ORG.LIBREOFFICE.ROUNDSIG([.B307];15) -> true | D307: of:=FORMULA([.A307]) -> =BESSELY($L7,Y$1)
A308: of:=BESSELY([.$L8];[.Y$1]) -> 0.113733943596204 | B308: 0.113733943596204 | C308: of:=ORG.LIBREOFFICE.ROUNDSIG([.A308];15)=ORG.LIBREOFFICE.ROUNDSIG([.B308];15) -> true | D308: of:=FORMULA([.A308]) -> =BESSELY($L8,Y$1)
A309: of:=BESSELY([.$L9];[.Y$1]) -> -0.00151639074181398 | B309: -0.00151639074181398 | C309: of:=ORG.LIBREOFFICE.ROUNDSIG([.A309];15)=ORG.LIBREOFFICE.ROUNDSIG([.B309];15) -> true | D309: of:=FORMULA([.A309]) -> =BESSELY($L9,Y$1)
A310: of:=BESSELY([.$L10];[.Y$1]) -> -0.121594381289455 | B310: -0.121594381289455 | C310: of:=ORG.LIBREOFFICE.ROUNDSIG([.A310];15)=ORG.LIBREOFFICE.ROUNDSIG([.B310];15) -> true | D310: of:=FORMULA([.A310]) -> =BESSELY($L10,Y$1)
A311: of:=BESSELY([.$L11];[.Y$1]) -> -0.152092393377258 | B311: -0.152092393377258 | C311: of:=ORG.LIBREOFFICE.ROUNDSIG([.A311];15)=ORG.LIBREOFFICE.ROUNDSIG([.B311];15) -> true | D311: of:=FORMULA([.A311]) -> =BESSELY($L11,Y$1)
A312: of:=BESSELY([.$L12];[.Y$1]) -> -0.067949719353221 | B312: -0.067949719353221 | C312: of:=ORG.LIBREOFFICE.ROUNDSIG([.A312];15)=ORG.LIBREOFFICE.ROUNDSIG([.B312];15) -> true | D312: of:=FORMULA([.A312]) -> =BESSELY($L12,Y$1)
A313: of:=BESSELY([.$L13];[.Y$1]) -> 0.141850993593375 | B313: 0.141850993593375 | C313: of:=ORG.LIBREOFFICE.ROUNDSIG([.A313];15)=ORG.LIBREOFFICE.ROUNDSIG([.B313];15) -> true | D313: of:=FORMULA([.A313]) -> =BESSELY($L13,Y$1)
A314: of:=BESSELY([.$L14];[.Y$1]) -> -0.00656919350695995 | B314: -0.00656919350695995 | C314: of:=ORG.LIBREOFFICE.ROUNDSIG([.A314];15)=ORG.LIBREOFFICE.ROUNDSIG([.B314];15) -> true | D314: of:=FORMULA([.A314]) -> =BESSELY($L14,Y$1)
A315: of:=BESSELY([.$L15];[.Y$1]) -> -0.0461298179864999 | B315: -0.0461298179864999 | C315: of:=ORG.LIBREOFFICE.ROUNDSIG([.A315];15)=ORG.LIBREOFFICE.ROUNDSIG([.B315];15) -> true | D315: of:=FORMULA([.A315]) -> =BESSELY($L15,Y$1)
A316: of:=BESSELY([.$L16];[.Y$1]) -> -1.36345431980332 | B316: -1.36345431980332 | C316: of:=ORG.LIBREOFFICE.ROUNDSIG([.A316];15)=ORG.LIBREOFFICE.ROUNDSIG([.B316];15) -> true | D316: of:=FORMULA([.A316]) -> =BESSELY($L16,Y$1)
A317: of:=BESSELY([.$L17];[.Y$1]) -> -3.17788011908158 | B317: -3.17788011908158 | C317: of:=ORG.LIBREOFFICE.ROUNDSIG([.A317];15)=ORG.LIBREOFFICE.ROUNDSIG([.B317];15) -> true | D317: of:=FORMULA([.A317]) -> =BESSELY($L17,Y$1)
A318: of:=BESSELY([.$L18];[.Y$1]) -> -9.54310187279336 | B318: -9.54310187279336 | C318: of:=ORG.LIBREOFFICE.ROUNDSIG([.A318];15)=ORG.LIBREOFFICE.ROUNDSIG([.B318];15) -> true | D318: of:=FORMULA([.A318]) -> =BESSELY($L18,Y$1)
A319: of:=BESSELY([.$L19];[.Y$1]) -> -37.8317508231463 | B319: -37.8317508231463 | C319: of:=ORG.LIBREOFFICE.ROUNDSIG([.A319];15)=ORG.LIBREOFFICE.ROUNDSIG([.B319];15) -> true | D319: of:=FORMULA([.A319]) -> =BESSELY($L19,Y$1)
A320: of:=BESSELY([.$L20];[.Y$1]) -> -208.335355361124 | B320: -208.335355361124 | C320: of:=ORG.LIBREOFFICE.ROUNDSIG([.A320];15)=ORG.LIBREOFFICE.ROUNDSIG([.B320];15) -> true | D320: of:=FORMULA([.A320]) -> =BESSELY($L20,Y$1)
A321: of:=BESSELY([.$L21];[.Y$1]) -> -1745.56172228564 | B321: -1745.56172228564 | C321: of:=ORG.LIBREOFFICE.ROUNDSIG([.A321];15)=ORG.LIBREOFFICE.ROUNDSIG([.B321];15) -> true | D321: of:=FORMULA([.A321]) -> =BESSELY($L21,Y$1)
A322: of:=BESSELY([.$L22];[.Y$1]) -> -26113.2050026482 | B322: -26113.2050026482 | C322: of:=ORG.LIBREOFFICE.ROUNDSIG([.A322];15)=ORG.LIBREOFFICE.ROUNDSIG([.B322];15) -> true | D322: of:=FORMULA([.A322]) -> =BESSELY($L22,Y$1)
A323: of:=BESSELY([.$L23];[.Y$1]) -> -946548.774675939 | B323: -946548.774675939 | C323: of:=ORG.LIBREOFFICE.ROUNDSIG([.A323];15)=ORG.LIBREOFFICE.ROUNDSIG([.B323];15) -> true | D323: of:=FORMULA([.A323]) -> =BESSELY($L23,Y$1)
A324: of:=BESSELY([.$L24];[.Y$1]) -> -165774198.137791 | B324: -165774198.137791 | C324: of:=ORG.LIBREOFFICE.ROUNDSIG([.A324];15)=ORG.LIBREOFFICE.ROUNDSIG([.B324];15) -> true | D324: of:=FORMULA([.A324]) -> =BESSELY($L24,Y$1)
A325: of:=BESSELY([.$L25];[.Y$1]) -> -1275361870151.98 | B325: -1275361870151.98 | C325: of:=ORG.LIBREOFFICE.ROUNDSIG([.A325];15)=ORG.LIBREOFFICE.ROUNDSIG([.B325];15) -> true | D325: of:=FORMULA([.A325]) -> =BESSELY($L25,Y$1)
A326: of:=BESSELY(1;-9) ->  | B326: of:#ERR502! ->  | C326: of:=ISERROR([.A326]) -> true | D326: of:=FORMULA([.A326]) -> =BESSELY(1,-9)