Sheet: Sheet1
A1: BESSELI Function
A3: Result | B3: of:=AND([.B8:.B95]) -> true
A7: Sheet | B7: Result | C7: Description
A8: 1 | B8: of:=AND([Sheet2.C2:.C396]) -> true | C8: Simple BESSELI formulas with local references and values

Sheet: Sheet2
A1: Function | B1: Expected | C1: Correct | D1: FunctionString | E1: Comment | I1: 1.5 | J1: 1 | M1: 1 | N1: 2 | O1: 3 | P1: 4 | Q1: 5 | R1: 6 | S1: 7 | T1: 8 | U1: 9 | V1: 10 | W1: 11 | X1: 12 | Y1: 13
A2: of:=BESSELI(1.5; 1) -> 0.981666428577908 | B2: 0.981666428577908 | C2: of:=ORG.LIBREOFFICE.ROUNDSIG([.A2];12)=ORG.LIBREOFFICE.ROUNDSIG([.B2];12) -> true | D2: of:=FORMULA([.A2]) -> =BESSELI(1.5, 1) | I2: 2.5 | J2: 2 | L2: 100
A3: of:=BESSELI([.I1];[.J1]) -> 0.981666428577908 | B3: 0.981666428577908 | C3: of:=ORG.LIBREOFFICE.ROUNDSIG([.A3];12)=ORG.LIBREOFFICE.ROUNDSIG([.B3];12) -> true | D3: of:=FORMULA([.A3]) -> =BESSELI(I1,J1) | I3: 3.5 | J3: 3 | L3: 90
A4: of:=BESSELI([.I2];[.J2]) -> 1.27646614781916 | B4: 1.27646614781916 | C4: of:=ORG.LIBREOFFICE.ROUNDSIG([.A4];12)=ORG.LIBREOFFICE.ROUNDSIG([.B4];12) -> true | D4: of:=FORMULA([.A4]) -> =BESSELI(I2,J2) | I4: 4.5 | J4: 4 | L4: 80
A5: of:=BESSELI([.I3];[.J3]) -> 1.82639258159797 | B5: 1.82639258159797 | C5: of:=ORG.LIBREOFFICE.ROUNDSIG([.A5];12)=ORG.LIBREOFFICE.ROUNDSIG([.B5];12) -> true | D5: of:=FORMULA([.A5]) -> =BESSELI(I3,J3) | I5: 5.5 | J5: 5 | L5: 70
A6: of:=BESSELI([.I4];[.J4]) -> 2.73472227669304 | B6: 2.73472227669304 | C6: of:=ORG.LIBREOFFICE.ROUNDSIG([.A6];12)=ORG.LIBREOFFICE.ROUNDSIG([.B6];12) -> true | D6: of:=FORMULA([.A6]) -> =BESSELI(I4,J4) | L6: 60
A7: of:=BESSELI([.I5];[.J5]) -> 4.20523822716318 | B7: 4.20523822716318 | C7: of:=ORG.LIBREOFFICE.ROUNDSIG([.A7];12)=ORG.LIBREOFFICE.ROUNDSIG([.B7];12) -> true | D7: of:=FORMULA([.A7]) -> =BESSELI(I5,J5) | L7: 50
A8: of:=BESSELI([.I6];[.J6]) -> 1 | B8: 1 | C8: of:=ORG.LIBREOFFICE.ROUNDSIG([.A8];12)=ORG.LIBREOFFICE.ROUNDSIG([.B8];12) -> true | D8: of:=FORMULA([.A8]) -> =BESSELI(I6,J6) | I8: 18.6 | J8: 11 | L8: 40
A9: of:=BESSELI([.I8:.I12];[.J8:.J12]) -> 434186.106334628 | B9: 434186.106334628 | C9: of:=ORG.LIBREOFFICE.ROUNDSIG([.A9];12)=ORG.LIBREOFFICE.ROUNDSIG([.B9];12) -> true | D9: of:=FORMULA([.A9]) -> {=BESSELI(I8:I12,J8:J12)} | I9: 19.6 | J9: 12 | L9: 31
A10: 764378.420600369 | B10: 764378.420600369 | C10: of:=ORG.LIBREOFFICE.ROUNDSIG([.A10];12)=ORG.LIBREOFFICE.ROUNDSIG([.B10];12) -> true | D10: of:=FORMULA([.A10]) -> {=BESSELI(I8:I12,J8:J12)} | I10: 20.6 | J10: 13 | L10: 30
A11: 1339200.18447567 | B11: 1339200.18447567 | C11: of:=ORG.LIBREOFFICE.ROUNDSIG([.A11];12)=ORG.LIBREOFFICE.ROUNDSIG([.B11];12) -> true | D11: of:=FORMULA([.A11]) -> {=BESSELI(I8:I12,J8:J12)} | I11: 21.6 | J11: 14 | L11: 29
A12: 2336833.93031894 | B12: 2336833.93031894 | C12: of:=ORG.LIBREOFFICE.ROUNDSIG([.A12];12)=ORG.LIBREOFFICE.ROUNDSIG([.B12];12) -> true | D12: of:=FORMULA([.A12]) -> {=BESSELI(I8:I12,J8:J12)} | I12: 22.6 | J12: 15 | L12: 28
A13: 4063771.24974278 | B13: 4063771.24974278 | C13: of:=ORG.LIBREOFFICE.ROUNDSIG([.A13];12)=ORG.LIBREOFFICE.ROUNDSIG([.B13];12) -> true | D13: of:=FORMULA([.A13]) -> {=BESSELI(I8:I12,J8:J12)} | L13: 25
A14: of:=BESSELI([.$L2];[.M$1]) -> 1.06836939033816E+042 | B14: 1.06836939033816E+042 | C14: of:=ORG.LIBREOFFICE.ROUNDSIG([.A14];12)=ORG.LIBREOFFICE.ROUNDSIG([.B14];12) -> true | D14: of:=FORMULA([.A14]) -> =BESSELI($L2,M$1) | L14: 20
A15: of:=BESSELI([.$L3];[.M$1]) -> 5.1106068152566E+037 | B15: 5.1106068152566E+037 | C15: of:=ORG.LIBREOFFICE.ROUNDSIG([.A15];12)=ORG.LIBREOFFICE.ROUNDSIG([.B15];12) -> true | D15: of:=FORMULA([.A15]) -> =BESSELI($L3,M$1) | L15: 15
A16: of:=BESSELI([.$L4];[.M$1]) -> 2.45965957956754E+033 | B16: 2.45965957956754E+033 | C16: of:=ORG.LIBREOFFICE.ROUNDSIG([.A16];12)=ORG.LIBREOFFICE.ROUNDSIG([.B16];12) -> true | D16: of:=FORMULA([.A16]) -> =BESSELI($L4,M$1) | L16: 10
A17: of:=BESSELI([.$L5];[.M$1]) -> 1.19297507888923E+029 | B17: 1.19297507888923E+029 | C17: of:=ORG.LIBREOFFICE.ROUNDSIG([.A17];12)=ORG.LIBREOFFICE.ROUNDSIG([.B17];12) -> true | D17: of:=FORMULA([.A17]) -> =BESSELI($L5,M$1) | L17: 9
A18: of:=BESSELI([.$L6];[.M$1]) -> 5.84475158839047E+024 | B18: 5.84475158839047E+024 | C18: of:=ORG.LIBREOFFICE.ROUNDSIG([.A18];12)=ORG.LIBREOFFICE.ROUNDSIG([.B18];12) -> true | D18: of:=FORMULA([.A18]) -> =BESSELI($L6,M$1) | L18: 8
A19: of:=BESSELI([.$L7];[.M$1]) -> 2.90307859010356E+020 | B19: 2.90307859010356E+020 | C19: of:=ORG.LIBREOFFICE.ROUNDSIG([.A19];12)=ORG.LIBREOFFICE.ROUNDSIG([.B19];12) -> true | D19: of:=FORMULA([.A19]) -> =BESSELI($L7,M$1) | L19: 7
A20: of:=BESSELI([.$L8];[.M$1]) -> 1.47073961632594E+016 | B20: 1.47073961632594E+016 | C20: of:=ORG.LIBREOFFICE.ROUNDSIG([.A20];12)=ORG.LIBREOFFICE.ROUNDSIG([.B20];12) -> true | D20: of:=FORMULA([.A20]) -> =BESSELI($L8,M$1) | L20: 6
A21: of:=BESSELI([.$L9];[.M$1]) -> 2055972795294.56 | B21: 2055972795294.56 | C21: of:=ORG.LIBREOFFICE.ROUNDSIG([.A21];12)=ORG.LIBREOFFICE.ROUNDSIG([.B21];12) -> true | D21: of:=FORMULA([.A21]) -> =BESSELI($L9,M$1) | L21: 5
A22: of:=BESSELI([.$L10];[.M$1]) -> 768532038938.957 | B22: 768532038938.957 | C22: of:=ORG.LIBREOFFICE.ROUNDSIG([.A22];12)=ORG.LIBREOFFICE.ROUNDSIG([.B22];12) -> true | D22: of:=FORMULA([.A22]) -> =BESSELI($L10,M$1) | L22: 4
A23: of:=BESSELI([.$L11];[.M$1]) -> 287432108126.255 | B23: 287432108126.255 | C23: of:=ORG.LIBREOFFICE.ROUNDSIG([.A23];12)=ORG.LIBREOFFICE.ROUNDSIG([.B23];12) -> true | D23: of:=FORMULA([.A23]) -> =BESSELI($L11,M$1) | L23: 3
A24: of:=BESSELI([.$L12];[.M$1]) -> 107560504208.082 | B24: 107560504208.082 | C24: of:=ORG.LIBREOFFICE.ROUNDSIG([.A24];12)=ORG.LIBREOFFICE.ROUNDSIG([.B24];12) -> true | D24: of:=FORMULA([.A24]) -> =BESSELI($L12,M$1) | L24: 2
A25: of:=BESSELI([.$L13];[.M$1]) -> 5657865129.87871 | B25: 5657865129.87871 | C25: of:=ORG.LIBREOFFICE.ROUNDSIG([.A25];12)=ORG.LIBREOFFICE.ROUNDSIG([.B25];12) -> true | D25: of:=FORMULA([.A25]) -> =BESSELI($L13,M$1) | L25: 1
A26: of:=BESSELI([.$L14];[.M$1]) -> 42454973.3851278 | B26: 42454973.3851278 | C26: of:=ORG.LIBREOFFICE.ROUNDSIG([.A26];12)=ORG.LIBREOFFICE.ROUNDSIG([.B26];12) -> true | D26: of:=FORMULA([.A26]) -> =BESSELI($L14,M$1)
A27: of:=BESSELI([.$L15];[.M$1]) -> 328124.921970206 | B27: 328124.921970206 | C27: of:=ORG.LIBREOFFICE.ROUNDSIG([.A27];12)=ORG.LIBREOFFICE.ROUNDSIG([.B27];12) -> true | D27: of:=FORMULA([.A27]) -> =BESSELI($L15,M$1)
A28: of:=BESSELI([.$L16];[.M$1]) -> 2670.98830370126 | B28: 2670.98830370126 | C28: of:=ORG.LIBREOFFICE.ROUNDSIG([.A28];12)=ORG.LIBREOFFICE.ROUNDSIG([.B28];12) -> true | D28: of:=FORMULA([.A28]) -> =BESSELI($L16,M$1)
A29: of:=BESSELI([.$L17];[.M$1]) -> 1030.91472251696 | B29: 1030.91472251696 | C29: of:=ORG.LIBREOFFICE.ROUNDSIG([.A29];12)=ORG.LIBREOFFICE.ROUNDSIG([.B29];12) -> true | D29: of:=FORMULA([.A29]) -> =BESSELI($L17,M$1)
A30: of:=BESSELI([.$L18];[.M$1]) -> 399.87313678256 | B30: 399.87313678256 | C30: of:=ORG.LIBREOFFICE.ROUNDSIG([.A30];12)=ORG.LIBREOFFICE.ROUNDSIG([.B30];12) -> true | D30: of:=FORMULA([.A30]) -> =BESSELI($L18,M$1)
A31: of:=BESSELI([.$L19];[.M$1]) -> 156.039092869955 | B31: 156.039092869955 | C31: of:=ORG.LIBREOFFICE.ROUNDSIG([.A31];12)=ORG.LIBREOFFICE.ROUNDSIG([.B31];12) -> true | D31: of:=FORMULA([.A31]) -> =BESSELI($L19,M$1)
A32: of:=BESSELI([.$L20];[.M$1]) -> 61.3419367776402 | B32: 61.3419367776402 | C32: of:=ORG.LIBREOFFICE.ROUNDSIG([.A32];12)=ORG.LIBREOFFICE.ROUNDSIG([.B32];12) -> true | D32: of:=FORMULA([.A32]) -> =BESSELI($L20,M$1)
A33: of:=BESSELI([.$L21];[.M$1]) -> 24.3356421424505 | B33: 24.3356421424505 | C33: of:=ORG.LIBREOFFICE.ROUNDSIG([.A33];12)=ORG.LIBREOFFICE.ROUNDSIG([.B33];12) -> true | D33: of:=FORMULA([.A33]) -> =BESSELI($L21,M$1)
A34: of:=BESSELI([.$L22];[.M$1]) -> 9.75946515370445 | B34: 9.75946515370445 | C34: of:=ORG.LIBREOFFICE.ROUNDSIG([.A34];12)=ORG.LIBREOFFICE.ROUNDSIG([.B34];12) -> true | D34: of:=FORMULA([.A34]) -> =BESSELI($L22,M$1)
A35: of:=BESSELI([.$L23];[.M$1]) -> 3.95337021740261 | B35: 3.95337021740261 | C35: of:=ORG.LIBREOFFICE.ROUNDSIG([.A35];12)=ORG.LIBREOFFICE.ROUNDSIG([.B35];12) -> true | D35: of:=FORMULA([.A35]) -> =BESSELI($L23,M$1)
A36: of:=BESSELI([.$L24];[.M$1]) -> 1.59063685463733 | B36: 1.59063685463733 | C36: of:=ORG.LIBREOFFICE.ROUNDSIG([.A36];12)=ORG.LIBREOFFICE.ROUNDSIG([.B36];12) -> true | D36: of:=FORMULA([.A36]) -> =BESSELI($L24,M$1)
A37: of:=BESSELI([.$L25];[.M$1]) -> 0.565159103992485 | B37: 0.565159103992485 | C37: of:=ORG.LIBREOFFICE.ROUNDSIG([.A37];12)=ORG.LIBREOFFICE.ROUNDSIG([.B37];12) -> true | D37: of:=FORMULA([.A37]) -> =BESSELI($L25,M$1)
A38: of:=BESSELI([.$L2];[.N$1]) -> 1.05238431932431E+042 | B38: 1.05238431932431E+042 | C38: of:=ORG.LIBREOFFICE.ROUNDSIG([.A38];12)=ORG.LIBREOFFICE.ROUNDSIG([.B38];12) -> true | D38: of:=FORMULA([.A38]) -> =BESSELI($L2,N$1)
A39: of:=BESSELI([.$L3];[.N$1]) -> 5.02566930516963E+037 | B39: 5.02566930516963E+037 | C39: of:=ORG.LIBREOFFICE.ROUNDSIG([.A39];12)=ORG.LIBREOFFICE.ROUNDSIG([.B39];12) -> true | D39: of:=FORMULA([.A39]) -> =BESSELI($L3,N$1)
A40: of:=BESSELI([.$L4];[.N$1]) -> 2.41368691484498E+033 | B40: 2.41368691484498E+033 | C40: of:=ORG.LIBREOFFICE.ROUNDSIG([.A40];12)=ORG.LIBREOFFICE.ROUNDSIG([.B40];12) -> true | D40: of:=FORMULA([.A40]) -> =BESSELI($L4,N$1)
A41: of:=BESSELI([.$L5];[.N$1]) -> 1.16750395565857E+029 | B41: 1.16750395565857E+029 | C41: of:=ORG.LIBREOFFICE.ROUNDSIG([.A41];12)=ORG.LIBREOFFICE.ROUNDSIG([.B41];12) -> true | D41: of:=FORMULA([.A41]) -> =BESSELI($L5,N$1)
A42: of:=BESSELI([.$L6];[.N$1]) -> 5.69925200266345E+024 | B42: 5.69925200266345E+024 | C42: of:=ORG.LIBREOFFICE.ROUNDSIG([.A42];12)=ORG.LIBREOFFICE.ROUNDSIG([.B42];12) -> true | D42: of:=FORMULA([.A42]) -> =BESSELI($L6,N$1)
A43: of:=BESSELI([.$L7];[.N$1]) -> 2.81643064024519E+020 | B43: 2.81643064024519E+020 | C43: of:=ORG.LIBREOFFICE.ROUNDSIG([.A43];12)=ORG.LIBREOFFICE.ROUNDSIG([.B43];12) -> true | D43: of:=FORMULA([.A43]) -> =BESSELI($L7,N$1)
A44: of:=BESSELI([.$L8];[.N$1]) -> 1.41594049852569E+016 | B44: 1.41594049852569E+016 | C44: of:=ORG.LIBREOFFICE.ROUNDSIG([.A44];12)=ORG.LIBREOFFICE.ROUNDSIG([.B44];12) -> true | D44: of:=FORMULA([.A44]) -> =BESSELI($L8,N$1)
A45: of:=BESSELI([.$L9];[.N$1]) -> 1957319560343.87 | B45: 1957319560343.87 | C45: of:=ORG.LIBREOFFICE.ROUNDSIG([.A45];12)=ORG.LIBREOFFICE.ROUNDSIG([.B45];12) -> true | D45: of:=FORMULA([.A45]) -> =BESSELI($L9,N$1)
A46: of:=BESSELI([.$L10];[.N$1]) -> 730436828561.381 | B46: 730436828561.381 | C46: of:=ORG.LIBREOFFICE.ROUNDSIG([.A46];12)=ORG.LIBREOFFICE.ROUNDSIG([.B46];12) -> true | D46: of:=FORMULA([.A46]) -> =BESSELI($L10,N$1)
A47: of:=BESSELI([.$L11];[.N$1]) -> 272697727776.984 | B47: 272697727776.984 | C47: of:=ORG.LIBREOFFICE.ROUNDSIG([.A47];12)=ORG.LIBREOFFICE.ROUNDSIG([.B47];12) -> true | D47: of:=FORMULA([.A47]) -> =BESSELI($L11,N$1)
A48: of:=BESSELI([.$L12];[.N$1]) -> 101851711574.037 | B48: 101851711574.037 | C48: of:=ORG.LIBREOFFICE.ROUNDSIG([.A48];12)=ORG.LIBREOFFICE.ROUNDSIG([.B48];12) -> true | D48: of:=FORMULA([.A48]) -> =BESSELI($L12,N$1)
A49: of:=BESSELI([.$L13];[.N$1]) -> 5321931396.07602 | B49: 5321931396.07602 | C49: of:=ORG.LIBREOFFICE.ROUNDSIG([.A49];12)=ORG.LIBREOFFICE.ROUNDSIG([.B49];12) -> true | D49: of:=FORMULA([.A49]) -> =BESSELI($L13,N$1)
A50: of:=BESSELI([.$L14];[.N$1]) -> 39312785.2210408 | B50: 39312785.2210408 | C50: of:=ORG.LIBREOFFICE.ROUNDSIG([.A50];12)=ORG.LIBREOFFICE.ROUNDSIG([.B50];12) -> true | D50: of:=FORMULA([.A50]) -> =BESSELI($L14,N$1)
A51: of:=BESSELI([.$L15];[.N$1]) -> 295899.383701886 | B51: 295899.383701886 | C51: of:=ORG.LIBREOFFICE.ROUNDSIG([.A51];12)=ORG.LIBREOFFICE.ROUNDSIG([.B51];12) -> true | D51: of:=FORMULA([.A51]) -> =BESSELI($L15,N$1)
A52: of:=BESSELI([.$L16];[.N$1]) -> 2281.518967726 | B52: 2281.518967726 | C52: of:=ORG.LIBREOFFICE.ROUNDSIG([.A52];12)=ORG.LIBREOFFICE.ROUNDSIG([.B52];12) -> true | D52: of:=FORMULA([.A52]) -> =BESSELI($L16,N$1)
A53: of:=BESSELI([.$L17];[.N$1]) -> 864.496193952051 | B53: 864.496193952051 | C53: of:=ORG.LIBREOFFICE.ROUNDSIG([.A53];12)=ORG.LIBREOFFICE.ROUNDSIG([.B53];12) -> true | D53: of:=FORMULA([.A53]) -> =BESSELI($L17,N$1)
A54: of:=BESSELI([.$L18];[.N$1]) -> 327.595831526165 | B54: 327.595831526165 | C54: of:=ORG.LIBREOFFICE.ROUNDSIG([.A54];12)=ORG.LIBREOFFICE.ROUNDSIG([.B54];12) -> true | D54: of:=FORMULA([.A54]) -> =BESSELI($L18,N$1)
A55: of:=BESSELI([.$L19];[.N$1]) -> 124.011310547445 | B55: 124.011310547445 | C55: of:=ORG.LIBREOFFICE.ROUNDSIG([.A55];12)=ORG.LIBREOFFICE.ROUNDSIG([.B55];12) -> true | D55: of:=FORMULA([.A55]) -> =BESSELI($L19,N$1)
A56: of:=BESSELI([.$L20];[.N$1]) -> 46.7870947172646 | B56: 46.7870947172646 | C56: of:=ORG.LIBREOFFICE.ROUNDSIG([.A56];12)=ORG.LIBREOFFICE.ROUNDSIG([.B56];12) -> true | D56: of:=FORMULA([.A56]) -> =BESSELI($L20,N$1)
A57: of:=BESSELI([.$L21];[.N$1]) -> 17.5056149666242 | B57: 17.5056149666242 | C57: of:=ORG.LIBREOFFICE.ROUNDSIG([.A57];12)=ORG.LIBREOFFICE.ROUNDSIG([.B57];12) -> true | D57: of:=FORMULA([.A57]) -> =BESSELI($L21,N$1)
A58: of:=BESSELI([.$L22];[.N$1]) -> 6.42218937528411 | B58: 6.42218937528411 | C58: of:=ORG.LIBREOFFICE.ROUNDSIG([.A58];12)=ORG.LIBREOFFICE.ROUNDSIG([.B58];12) -> true | D58: of:=FORMULA([.A58]) -> =BESSELI($L22,N$1)
A59: of:=BESSELI([.$L23];[.N$1]) -> 2.24521244092995 | B59: 2.24521244092995 | C59: of:=ORG.LIBREOFFICE.ROUNDSIG([.A59];12)=ORG.LIBREOFFICE.ROUNDSIG([.B59];12) -> true | D59: of:=FORMULA([.A59]) -> =BESSELI($L23,N$1)
A60: of:=BESSELI([.$L24];[.N$1]) -> 0.688948447698738 | B60: 0.688948447698738 | C60: of:=ORG.LIBREOFFICE.ROUNDSIG([.A60];12)=ORG.LIBREOFFICE.ROUNDSIG([.B60];12) -> true | D60: of:=FORMULA([.A60]) -> =BESSELI($L24,N$1)
A61: of:=BESSELI([.$L25];[.N$1]) -> 0.135747669767038 | B61: 0.135747669767038 | C61: of:=ORG.LIBREOFFICE.ROUNDSIG([.A61];12)=ORG.LIBREOFFICE.ROUNDSIG([.B61];12) -> true | D61: of:=FORMULA([.A61]) -> =BESSELI($L25,N$1)
A62: of:=BESSELI([.$L2];[.O$1]) -> 1.02627401756519E+042 | B62: 1.02627401756519E+042 | C62: of:=ORG.LIBREOFFICE.ROUNDSIG([.A62];12)=ORG.LIBREOFFICE.ROUNDSIG([.B62];12) -> true | D62: of:=FORMULA([.A62]) -> =BESSELI($L2,O$1)
A63: of:=BESSELI([.$L3];[.O$1]) -> 4.88724373502684E+037 | B63: 4.88724373502684E+037 | C63: of:=ORG.LIBREOFFICE.ROUNDSIG([.A63];12)=ORG.LIBREOFFICE.ROUNDSIG([.B63];12) -> true | D63: of:=FORMULA([.A63]) -> =BESSELI($L3,O$1)
A64: of:=BESSELI([.$L4];[.O$1]) -> 2.33897523382529E+033 | B64: 2.33897523382529E+033 | C64: of:=ORG.LIBREOFFICE.ROUNDSIG([.A64];12)=ORG.LIBREOFFICE.ROUNDSIG([.B64];12) -> true | D64: of:=FORMULA([.A64]) -> =BESSELI($L4,O$1)
A65: of:=BESSELI([.$L5];[.O$1]) -> 1.12626056713731E+029 | B65: 1.12626056713731E+029 | C65: of:=ORG.LIBREOFFICE.ROUNDSIG([.A65];12)=ORG.LIBREOFFICE.ROUNDSIG([.B65];12) -> true | D65: of:=FORMULA([.A65]) -> =BESSELI($L5,O$1)
A66: of:=BESSELI([.$L6];[.O$1]) -> 5.46480145487957E+024 | B66: 5.46480145487957E+024 | C66: of:=ORG.LIBREOFFICE.ROUNDSIG([.A66];12)=ORG.LIBREOFFICE.ROUNDSIG([.B66];12) -> true | D66: of:=FORMULA([.A66]) -> =BESSELI($L6,O$1)
A67: of:=BESSELI([.$L7];[.O$1]) -> 2.67776413888394E+020 | B67: 2.67776413888394E+020 | C67: of:=ORG.LIBREOFFICE.ROUNDSIG([.A67];12)=ORG.LIBREOFFICE.ROUNDSIG([.B67];12) -> true | D67: of:=FORMULA([.A67]) -> =BESSELI($L7,O$1)
A68: of:=BESSELI([.$L8];[.O$1]) -> 1.32914556647337E+016 | B68: 1.32914556647337E+016 | C68: of:=ORG.LIBREOFFICE.ROUNDSIG([.A68];12)=ORG.LIBREOFFICE.ROUNDSIG([.B68];12) -> true | D68: of:=FORMULA([.A68]) -> =BESSELI($L8,O$1)
A69: of:=BESSELI([.$L9];[.O$1]) -> 1803415432669.55 | B69: 1803415432669.55 | C69: of:=ORG.LIBREOFFICE.ROUNDSIG([.A69];12)=ORG.LIBREOFFICE.ROUNDSIG([.B69];12) -> true | D69: of:=FORMULA([.A69]) -> =BESSELI($L9,O$1)
A70: of:=BESSELI([.$L10];[.O$1]) -> 671140461797.44 | B70: 671140461797.44 | C70: of:=ORG.LIBREOFFICE.ROUNDSIG([.A70];12)=ORG.LIBREOFFICE.ROUNDSIG([.B70];12) -> true | D70: of:=FORMULA([.A70]) -> =BESSELI($L10,O$1)
A71: of:=BESSELI([.$L11];[.O$1]) -> 249818628432.878 | B71: 249818628432.878 | C71: of:=ORG.LIBREOFFICE.ROUNDSIG([.A71];12)=ORG.LIBREOFFICE.ROUNDSIG([.B71];12) -> true | D71: of:=FORMULA([.A71]) -> =BESSELI($L11,O$1)
A72: of:=BESSELI([.$L12];[.O$1]) -> 93010259697.5054 | B72: 93010259697.5054 | C72: of:=ORG.LIBREOFFICE.ROUNDSIG([.A72];12)=ORG.LIBREOFFICE.ROUNDSIG([.B72];12) -> true | D72: of:=FORMULA([.A72]) -> =BESSELI($L12,O$1)
A73: of:=BESSELI([.$L13];[.O$1]) -> 4806356106.50654 | B73: 4806356106.50654 | C73: of:=ORG.LIBREOFFICE.ROUNDSIG([.A73];12)=ORG.LIBREOFFICE.ROUNDSIG([.B73];12) -> true | D73: of:=FORMULA([.A73]) -> =BESSELI($L13,O$1)
A74: of:=BESSELI([.$L14];[.O$1]) -> 34592416.3409196 | B74: 34592416.3409196 | C74: of:=ORG.LIBREOFFICE.ROUNDSIG([.A74];12)=ORG.LIBREOFFICE.ROUNDSIG([.B74];12) -> true | D74: of:=FORMULA([.A74]) -> =BESSELI($L14,O$1)
A75: of:=BESSELI([.$L15];[.O$1]) -> 249218.419649703 | B75: 249218.419649703 | C75: of:=ORG.LIBREOFFICE.ROUNDSIG([.A75];12)=ORG.LIBREOFFICE.ROUNDSIG([.B75];12) -> true | D75: of:=FORMULA([.A75]) -> =BESSELI($L15,O$1)
A76: of:=BESSELI([.$L16];[.O$1]) -> 1758.38071661085 | B76: 1758.38071661085 | C76: of:=ORG.LIBREOFFICE.ROUNDSIG([.A76];12)=ORG.LIBREOFFICE.ROUNDSIG([.B76];12) -> true | D76: of:=FORMULA([.A76]) -> =BESSELI($L16,O$1)
A77: of:=BESSELI([.$L17];[.O$1]) -> 646.6941918716 | B77: 646.6941918716 | C77: of:=ORG.LIBREOFFICE.ROUNDSIG([.A77];12)=ORG.LIBREOFFICE.ROUNDSIG([.B77];12) -> true | D77: of:=FORMULA([.A77]) -> =BESSELI($L17,O$1)
A78: of:=BESSELI([.$L18];[.O$1]) -> 236.075221019478 | B78: 236.075221019478 | C78: of:=ORG.LIBREOFFICE.ROUNDSIG([.A78];12)=ORG.LIBREOFFICE.ROUNDSIG([.B78];12) -> true | D78: of:=FORMULA([.A78]) -> =BESSELI($L18,O$1)
A79: of:=BESSELI([.$L19];[.O$1]) -> 85.1754868428439 | B79: 85.1754868428439 | C79: of:=ORG.LIBREOFFICE.ROUNDSIG([.A79];12)=ORG.LIBREOFFICE.ROUNDSIG([.B79];12) -> true | D79: of:=FORMULA([.A79]) -> =BESSELI($L19,O$1)
A80: of:=BESSELI([.$L20];[.O$1]) -> 30.1505402994639 | B80: 30.1505402994639 | C80: of:=ORG.LIBREOFFICE.ROUNDSIG([.A80];12)=ORG.LIBREOFFICE.ROUNDSIG([.B80];12) -> true | D80: of:=FORMULA([.A80]) -> =BESSELI($L20,O$1)
A81: of:=BESSELI([.$L21];[.O$1]) -> 10.3311501691511 | B81: 10.3311501691511 | C81: of:=ORG.LIBREOFFICE.ROUNDSIG([.A81];12)=ORG.LIBREOFFICE.ROUNDSIG([.B81];12) -> true | D81: of:=FORMULA([.A81]) -> =BESSELI($L21,O$1)
A82: of:=BESSELI([.$L22];[.O$1]) -> 3.33727577842034 | B82: 3.33727577842034 | C82: of:=ORG.LIBREOFFICE.ROUNDSIG([.A82];12)=ORG.LIBREOFFICE.ROUNDSIG([.B82];12) -> true | D82: of:=FORMULA([.A82]) -> =BESSELI($L22,O$1)
A83: of:=BESSELI([.$L23];[.O$1]) -> 0.959753629496008 | B83: 0.959753629496008 | C83: of:=ORG.LIBREOFFICE.ROUNDSIG([.A83];12)=ORG.LIBREOFFICE.ROUNDSIG([.B83];12) -> true | D83: of:=FORMULA([.A83]) -> =BESSELI($L23,O$1)
A84: of:=BESSELI([.$L24];[.O$1]) -> 0.212739959239853 | B84: 0.212739959239853 | C84: of:=ORG.LIBREOFFICE.ROUNDSIG([.A84];12)=ORG.LIBREOFFICE.ROUNDSIG([.B84];12) -> true | D84: of:=FORMULA([.A84]) -> =BESSELI($L24,O$1)
A85: of:=BESSELI([.$L25];[.O$1]) -> 0.0221684249243319 | B85: 0.0221684249243319 | C85: of:=ORG.LIBREOFFICE.ROUNDSIG([.A85];12)=ORG.LIBREOFFICE.ROUNDSIG([.B85];12) -> true | D85: of:=FORMULA([.A85]) -> =BESSELI($L25,O$1)
A86: of:=BESSELI([.$L2];[.P$1]) -> 9.908078782704E+041 | B86: 9.908078782704E+041 | C86: of:=ORG.LIBREOFFICE.ROUNDSIG([.A86];12)=ORG.LIBREOFFICE.ROUNDSIG([.B86];12) -> true | D86: of:=FORMULA([.A86]) -> =BESSELI($L2,P$1)
A87: of:=BESSELI([.$L3];[.P$1]) -> 4.69985305616784E+037 | B87: 4.69985305616784E+037 | C87: of:=ORG.LIBREOFFICE.ROUNDSIG([.A87];12)=ORG.LIBREOFFICE.ROUNDSIG([.B87];12) -> true | D87: of:=FORMULA([.A87]) -> =BESSELI($L3,P$1)
A88: of:=BESSELI([.$L4];[.P$1]) -> 2.23826377230809E+033 | B88: 2.23826377230809E+033 | C88: of:=ORG.LIBREOFFICE.ROUNDSIG([.A88];12)=ORG.LIBREOFFICE.ROUNDSIG([.B88];12) -> true | D88: of:=FORMULA([.A88]) -> =BESSELI($L4,P$1)
A89: of:=BESSELI([.$L5];[.P$1]) -> 1.07096733561823E+029 | B89: 1.07096733561823E+029 | C89: of:=ORG.LIBREOFFICE.ROUNDSIG([.A89];12)=ORG.LIBREOFFICE.ROUNDSIG([.B89];12) -> true | D89: of:=FORMULA([.A89]) -> =BESSELI($L5,P$1)
A90: of:=BESSELI([.$L6];[.P$1]) -> 5.1527718571755E+024 | B90: 5.1527718571755E+024 | C90: of:=ORG.LIBREOFFICE.ROUNDSIG([.A90];12)=ORG.LIBREOFFICE.ROUNDSIG([.B90];12) -> true | D90: of:=FORMULA([.A90]) -> =BESSELI($L6,P$1)
A91: of:=BESSELI([.$L7];[.P$1]) -> 2.49509894357912E+020 | B91: 2.49509894357912E+020 | C91: of:=ORG.LIBREOFFICE.ROUNDSIG([.A91];12)=ORG.LIBREOFFICE.ROUNDSIG([.B91];12) -> true | D91: of:=FORMULA([.A91]) -> =BESSELI($L7,P$1)
A92: of:=BESSELI([.$L8];[.P$1]) -> 1.21656866355469E+016 | B92: 1.21656866355469E+016 | C92: of:=ORG.LIBREOFFICE.ROUNDSIG([.A92];12)=ORG.LIBREOFFICE.ROUNDSIG([.B92];12) -> true | D92: of:=FORMULA([.A92]) -> =BESSELI($L8,P$1)
A93: of:=BESSELI([.$L9];[.P$1]) -> 1608271412085.24 | B93: 1608271412085.24 | C93: of:=ORG.LIBREOFFICE.ROUNDSIG([.A93];12)=ORG.LIBREOFFICE.ROUNDSIG([.B93];12) -> true | D93: of:=FORMULA([.A93]) -> =BESSELI($L9,P$1)
A94: of:=BESSELI([.$L10];[.P$1]) -> 596208736201.892 | B94: 596208736201.892 | C94: of:=ORG.LIBREOFFICE.ROUNDSIG([.A94];12)=ORG.LIBREOFFICE.ROUNDSIG([.B94];12) -> true | D94: of:=FORMULA([.A94]) -> =BESSELI($L10,P$1)
A95: of:=BESSELI([.$L11];[.P$1]) -> 221011114997.768 | B95: 221011114997.768 | C95: of:=ORG.LIBREOFFICE.ROUNDSIG([.A95];12)=ORG.LIBREOFFICE.ROUNDSIG([.B95];12) -> true | D95: of:=FORMULA([.A95]) -> =BESSELI($L11,P$1)
A96: of:=BESSELI([.$L12];[.P$1]) -> 81920941638.8573 | B96: 81920941638.8573 | C96: of:=ORG.LIBREOFFICE.ROUNDSIG([.A96];12)=ORG.LIBREOFFICE.ROUNDSIG([.B96];12) -> true | D96: of:=FORMULA([.A96]) -> =BESSELI($L12,P$1)
A97: of:=BESSELI([.$L13];[.P$1]) -> 4168405930.51445 | B97: 4168405930.51445 | C97: of:=ORG.LIBREOFFICE.ROUNDSIG([.A97];12)=ORG.LIBREOFFICE.ROUNDSIG([.B97];12) -> true | D97: of:=FORMULA([.A97]) -> =BESSELI($L13,P$1)
A98: of:=BESSELI([.$L14];[.P$1]) -> 28935060.3187649 | B98: 28935060.3187649 | C98: of:=ORG.LIBREOFFICE.ROUNDSIG([.A98];12)=ORG.LIBREOFFICE.ROUNDSIG([.B98];12) -> true | D98: of:=FORMULA([.A98]) -> =BESSELI($L14,P$1)
A99: of:=BESSELI([.$L15];[.P$1]) -> 196212.015842005 | B99: 196212.015842005 | C99: of:=ORG.LIBREOFFICE.ROUNDSIG([.A99];12)=ORG.LIBREOFFICE.ROUNDSIG([.B99];12) -> true | D99: of:=FORMULA([.A99]) -> =BESSELI($L15,P$1)
A100: of:=BESSELI([.$L16];[.P$1]) -> 1226.49053775949 | B100: 1226.49053775949 | C100: of:=ORG.LIBREOFFICE.ROUNDSIG([.A100];12)=ORG.LIBREOFFICE.ROUNDSIG([.B100];12) -> true | D100: of:=FORMULA([.A100]) -> =BESSELI($L16,P$1)
A101: of:=BESSELI([.$L17];[.P$1]) -> 433.366732704318 | B101: 433.366732704318 | C101: of:=ORG.LIBREOFFICE.ROUNDSIG([.A101];12)=ORG.LIBREOFFICE.ROUNDSIG([.B101];12) -> true | D101: of:=FORMULA([.A101]) -> =BESSELI($L17,P$1)
A102: of:=BESSELI([.$L18];[.P$1]) -> 150.539415761556 | B102: 150.539415761556 | C102: of:=ORG.LIBREOFFICE.ROUNDSIG([.A102];12)=ORG.LIBREOFFICE.ROUNDSIG([.B102];12) -> true | D102: of:=FORMULA([.A102]) -> =BESSELI($L18,P$1)
A103: of:=BESSELI([.$L19];[.P$1]) -> 51.0037503964363 | B103: 51.0037503964363 | C103: of:=ORG.LIBREOFFICE.ROUNDSIG([.A103];12)=ORG.LIBREOFFICE.ROUNDSIG([.B103];12) -> true | D103: of:=FORMULA([.A103]) -> =BESSELI($L19,P$1)
A104: of:=BESSELI([.$L20];[.P$1]) -> 16.6365544178007 | B104: 16.6365544178007 | C104: of:=ORG.LIBREOFFICE.ROUNDSIG([.A104];12)=ORG.LIBREOFFICE.ROUNDSIG([.B104];12) -> true | D104: of:=FORMULA([.A104]) -> =BESSELI($L20,P$1)
A105: of:=BESSELI([.$L21];[.P$1]) -> 5.10823476364287 | B105: 5.10823476364287 | C105: of:=ORG.LIBREOFFICE.ROUNDSIG([.A105];12)=ORG.LIBREOFFICE.ROUNDSIG([.B105];12) -> true | D105: of:=FORMULA([.A105]) -> =BESSELI($L21,P$1)
A106: of:=BESSELI([.$L22];[.P$1]) -> 1.41627570765359 | B106: 1.41627570765359 | C106: of:=ORG.LIBREOFFICE.ROUNDSIG([.A106];12)=ORG.LIBREOFFICE.ROUNDSIG([.B106];12) -> true | D106: of:=FORMULA([.A106]) -> =BESSELI($L22,P$1)
A107: of:=BESSELI([.$L23];[.P$1]) -> 0.325705181937935 | B107: 0.325705181937935 | C107: of:=ORG.LIBREOFFICE.ROUNDSIG([.A107];12)=ORG.LIBREOFFICE.ROUNDSIG([.B107];12) -> true | D107: of:=FORMULA([.A107]) -> =BESSELI($L23,P$1)
A108: of:=BESSELI([.$L24];[.P$1]) -> 0.0507285699791802 | B108: 0.0507285699791802 | C108: of:=ORG.LIBREOFFICE.ROUNDSIG([.A108];12)=ORG.LIBREOFFICE.ROUNDSIG([.B108];12) -> true | D108: of:=FORMULA([.A108]) -> =BESSELI($L24,P$1)
A109: of:=BESSELI([.$L25];[.P$1]) -> 0.00273712022104687 | B109: 0.00273712022104687 | C109: of:=ORG.LIBREOFFICE.ROUNDSIG([.A109];12)=ORG.LIBREOFFICE.ROUNDSIG([.B109];12) -> true | D109: of:=FORMULA([.A109]) -> =BESSELI($L25,P$1)
A110: of:=BESSELI([.$L2];[.Q$1]) -> 9.47009387303558E+041 | B110: 9.47009387303558E+041 | C110: of:=ORG.LIBREOFFICE.ROUNDSIG([.A110];12)=ORG.LIBREOFFICE.ROUNDSIG([.B110];12) -> true | D110: of:=FORMULA([.A110]) -> =BESSELI($L2,Q$1)
A111: of:=BESSELI([.$L3];[.Q$1]) -> 4.46947901892303E+037 | B111: 4.46947901892303E+037 | C111: of:=ORG.LIBREOFFICE.ROUNDSIG([.A111];12)=ORG.LIBREOFFICE.ROUNDSIG([.B111];12) -> true | D111: of:=FORMULA([.A111]) -> =BESSELI($L3,Q$1)
A112: of:=BESSELI([.$L4];[.Q$1]) -> 2.11514885659448E+033 | B112: 2.11514885659448E+033 | C112: of:=ORG.LIBREOFFICE.ROUNDSIG([.A112];12)=ORG.LIBREOFFICE.ROUNDSIG([.B112];12) -> true | D112: of:=FORMULA([.A112]) -> =BESSELI($L4,Q$1)
A113: of:=BESSELI([.$L5];[.Q$1]) -> 1.00386430020952E+029 | B113: 1.00386430020952E+029 | C113: of:=ORG.LIBREOFFICE.ROUNDSIG([.A113];12)=ORG.LIBREOFFICE.ROUNDSIG([.B113];12) -> true | D113: of:=FORMULA([.A113]) -> =BESSELI($L5,Q$1)
A114: of:=BESSELI([.$L6];[.Q$1]) -> 4.77776520725617E+024 | B114: 4.77776520725617E+024 | C114: of:=ORG.LIBREOFFICE.ROUNDSIG([.A114];12)=ORG.LIBREOFFICE.ROUNDSIG([.B114];12) -> true | D114: of:=FORMULA([.A114]) -> =BESSELI($L6,Q$1)
A115: of:=BESSELI([.$L7];[.Q$1]) -> 2.27854830791128E+020 | B115: 2.27854830791128E+020 | C115: of:=ORG.LIBREOFFICE.ROUNDSIG([.A115];12)=ORG.LIBREOFFICE.ROUNDSIG([.B115];12) -> true | D115: of:=FORMULA([.A115]) -> =BESSELI($L7,Q$1)
A116: of:=BESSELI([.$L8];[.Q$1]) -> 1.08583183376243E+016 | B116: 1.08583183376243E+016 | C116: of:=ORG.LIBREOFFICE.ROUNDSIG([.A116];12)=ORG.LIBREOFFICE.ROUNDSIG([.B116];12) -> true | D116: of:=FORMULA([.A116]) -> =BESSELI($L8,Q$1)
A117: of:=BESSELI([.$L9];[.Q$1]) -> 1388377648905.61 | B117: 1388377648905.61 | C117: of:=ORG.LIBREOFFICE.ROUNDSIG([.A117];12)=ORG.LIBREOFFICE.ROUNDSIG([.B117];12) -> true | D117: of:=FORMULA([.A117]) -> =BESSELI($L9,Q$1)
A118: of:=BESSELI([.$L10];[.Q$1]) -> 512151465476.935 | B118: 512151465476.935 | C118: of:=ORG.LIBREOFFICE.ROUNDSIG([.A118];12)=ORG.LIBREOFFICE.ROUNDSIG([.B118];12) -> true | D118: of:=FORMULA([.A118]) -> =BESSELI($L10,Q$1)
A119: of:=BESSELI([.$L11];[.Q$1]) -> 188850044985.218 | B119: 188850044985.218 | C119: of:=ORG.LIBREOFFICE.ROUNDSIG([.A119];12)=ORG.LIBREOFFICE.ROUNDSIG([.B119];12) -> true | D119: of:=FORMULA([.A119]) -> =BESSELI($L11,Q$1)
A120: of:=BESSELI([.$L12];[.Q$1]) -> 69604276372.1176 | B120: 69604276372.1176 | C120: of:=ORG.LIBREOFFICE.ROUNDSIG([.A120];12)=ORG.LIBREOFFICE.ROUNDSIG([.B120];12) -> true | D120: of:=FORMULA([.A120]) -> =BESSELI($L12,Q$1)
A121: of:=BESSELI([.$L13];[.Q$1]) -> 3472466208.74192 | B121: 3472466208.74192 | C121: of:=ORG.LIBREOFFICE.ROUNDSIG([.A121];12)=ORG.LIBREOFFICE.ROUNDSIG([.B121];12) -> true | D121: of:=FORMULA([.A121]) -> =BESSELI($L13,Q$1)
A122: of:=BESSELI([.$L14];[.Q$1]) -> 23018392.2134137 | B122: 23018392.2134137 | C122: of:=ORG.LIBREOFFICE.ROUNDSIG([.A122];12)=ORG.LIBREOFFICE.ROUNDSIG([.B122];12) -> true | D122: of:=FORMULA([.A122]) -> =BESSELI($L14,Q$1)
A123: of:=BESSELI([.$L15];[.Q$1]) -> 144572.011200634 | B123: 144572.011200634 | C123: of:=ORG.LIBREOFFICE.ROUNDSIG([.A123];12)=ORG.LIBREOFFICE.ROUNDSIG([.B123];12) -> true | D123: of:=FORMULA([.A123]) -> =BESSELI($L15,Q$1)
A124: of:=BESSELI([.$L16];[.Q$1]) -> 777.18828640326 | B124: 777.18828640326 | C124: of:=ORG.LIBREOFFICE.ROUNDSIG([.A124];12)=ORG.LIBREOFFICE.ROUNDSIG([.B124];12) -> true | D124: of:=FORMULA([.A124]) -> =BESSELI($L16,Q$1)
A125: of:=BESSELI([.$L17];[.Q$1]) -> 261.479318356651 | B125: 261.479318356651 | C125: of:=ORG.LIBREOFFICE.ROUNDSIG([.A125];12)=ORG.LIBREOFFICE.ROUNDSIG([.B125];12) -> true | D125: of:=FORMULA([.A125]) -> =BESSELI($L17,Q$1)
A126: of:=BESSELI([.$L18];[.Q$1]) -> 85.5358052579213 | B126: 85.5358052579213 | C126: of:=ORG.LIBREOFFICE.ROUNDSIG([.A126];12)=ORG.LIBREOFFICE.ROUNDSIG([.B126];12) -> true | D126: of:=FORMULA([.A126]) -> =BESSELI($L18,Q$1)
A127: of:=BESSELI([.$L19];[.Q$1]) -> 26.8854863897739 | B127: 26.8854863897739 | C127: of:=ORG.LIBREOFFICE.ROUNDSIG([.A127];12)=ORG.LIBREOFFICE.ROUNDSIG([.B127];12) -> true | D127: of:=FORMULA([.A127]) -> =BESSELI($L19,Q$1)
A128: of:=BESSELI([.$L20];[.Q$1]) -> 7.96846774239626 | B128: 7.96846774239626 | C128: of:=ORG.LIBREOFFICE.ROUNDSIG([.A128];12)=ORG.LIBREOFFICE.ROUNDSIG([.B128];12) -> true | D128: of:=FORMULA([.A128]) -> =BESSELI($L20,Q$1)
A129: of:=BESSELI([.$L21];[.Q$1]) -> 2.15797454732255 | B129: 2.15797454732255 | C129: of:=ORG.LIBREOFFICE.ROUNDSIG([.A129];12)=ORG.LIBREOFFICE.ROUNDSIG([.B129];12) -> true | D129: of:=FORMULA([.A129]) -> =BESSELI($L21,Q$1)
A130: of:=BESSELI([.$L22];[.Q$1]) -> 0.504724363113166 | B130: 0.504724363113166 | C130: of:=ORG.LIBREOFFICE.ROUNDSIG([.A130];12)=ORG.LIBREOFFICE.ROUNDSIG([.B130];12) -> true | D130: of:=FORMULA([.A130]) -> =BESSELI($L22,Q$1)
A131: of:=BESSELI([.$L23];[.Q$1]) -> 0.0912064776615133 | B131: 0.0912064776615133 | C131: of:=ORG.LIBREOFFICE.ROUNDSIG([.A131];12)=ORG.LIBREOFFICE.ROUNDSIG([.B131];12) -> true | D131: of:=FORMULA([.A131]) -> =BESSELI($L23,Q$1)
A132: of:=BESSELI([.$L24];[.Q$1]) -> 0.0098256793231317 | B132: 0.0098256793231317 | C132: of:=ORG.LIBREOFFICE.ROUNDSIG([.A132];12)=ORG.LIBREOFFICE.ROUNDSIG([.B132];12) -> true | D132: of:=FORMULA([.A132]) -> =BESSELI($L24,Q$1)
A133: of:=BESSELI([.$L25];[.Q$1]) -> 0.000271463155956972 | B133: 0.000271463155956972 | C133: of:=ORG.LIBREOFFICE.ROUNDSIG([.A133];12)=ORG.LIBREOFFICE.ROUNDSIG([.B133];12) -> true | D133: of:=FORMULA([.A133]) -> =BESSELI($L25,Q$1)
A134: of:=BESSELI([.$L2];[.R$1]) -> 8.96106939540043E+041 | B134: 8.96106939540043E+041 | C134: of:=ORG.LIBREOFFICE.ROUNDSIG([.A134];12)=ORG.LIBREOFFICE.ROUNDSIG([.B134];12) -> true | D134: of:=FORMULA([.A134]) -> =BESSELI($L2,R$1)
A135: of:=BESSELI([.$L3];[.R$1]) -> 4.20324427628751E+037 | B135: 4.20324427628751E+037 | C135: of:=ORG.LIBREOFFICE.ROUNDSIG([.A135];12)=ORG.LIBREOFFICE.ROUNDSIG([.B135];12) -> true | D135: of:=FORMULA([.A135]) -> =BESSELI($L3,R$1)
A136: of:=BESSELI([.$L4];[.R$1]) -> 1.97387016523378E+033 | B136: 1.97387016523378E+033 | C136: of:=ORG.LIBREOFFICE.ROUNDSIG([.A136];12)=ORG.LIBREOFFICE.ROUNDSIG([.B136];12) -> true | D136: of:=FORMULA([.A136]) -> =BESSELI($L4,R$1)
A137: of:=BESSELI([.$L5];[.R$1]) -> 9.27558149874011E+028 | B137: 9.27558149874011E+028 | C137: of:=ORG.LIBREOFFICE.ROUNDSIG([.A137];12)=ORG.LIBREOFFICE.ROUNDSIG([.B137];12) -> true | D137: of:=FORMULA([.A137]) -> =BESSELI($L5,R$1)
A138: of:=BESSELI([.$L6];[.R$1]) -> 4.35647765596613E+024 | B138: 4.35647765596613E+024 | C138: of:=ORG.LIBREOFFICE.ROUNDSIG([.A138];12)=ORG.LIBREOFFICE.ROUNDSIG([.B138];12) -> true | D138: of:=FORMULA([.A138]) -> =BESSELI($L6,R$1)
A139: of:=BESSELI([.$L7];[.R$1]) -> 2.03938928199686E+020 | B139: 2.03938928199686E+020 | C139: of:=ORG.LIBREOFFICE.ROUNDSIG([.A139];12)=ORG.LIBREOFFICE.ROUNDSIG([.B139];12) -> true | D139: of:=FORMULA([.A139]) -> =BESSELI($L7,R$1)
A140: of:=BESSELI([.$L8];[.R$1]) -> 9.45110705114082E+015 | B140: 9.45110705114082E+015 | C140: of:=ORG.LIBREOFFICE.ROUNDSIG([.A140];12)=ORG.LIBREOFFICE.ROUNDSIG([.B140];12) -> true | D140: of:=FORMULA([.A140]) -> =BESSELI($L8,R$1)
A141: of:=BESSELI([.$L9];[.R$1]) -> 1160407654373.76 | B141: 1160407654373.76 | C141: of:=ORG.LIBREOFFICE.ROUNDSIG([.A141];12)=ORG.LIBREOFFICE.ROUNDSIG([.B141];12) -> true | D141: of:=FORMULA([.A141]) -> =BESSELI($L9,R$1)
A142: of:=BESSELI([.$L10];[.R$1]) -> 425491581042.914 | B142: 425491581042.914 | C142: of:=ORG.LIBREOFFICE.ROUNDSIG([.A142];12)=ORG.LIBREOFFICE.ROUNDSIG([.B142];12) -> true | D142: of:=FORMULA([.A142]) -> =BESSELI($L10,R$1)
A143: of:=BESSELI([.$L11];[.R$1]) -> 155890409830.451 | B143: 155890409830.451 | C143: of:=ORG.LIBREOFFICE.ROUNDSIG([.A143];12)=ORG.LIBREOFFICE.ROUNDSIG([.B143];12) -> true | D143: of:=FORMULA([.A143]) -> =BESSELI($L11,R$1)
A144: of:=BESSELI([.$L12];[.R$1]) -> 57062271505.9582 | B144: 57062271505.9582 | C144: of:=ORG.LIBREOFFICE.ROUNDSIG([.A144];12)=ORG.LIBREOFFICE.ROUNDSIG([.B144];12) -> true | D144: of:=FORMULA([.A144]) -> =BESSELI($L12,R$1)
A145: of:=BESSELI([.$L13];[.R$1]) -> 2779419447.01768 | B145: 2779419447.01768 | C145: of:=ORG.LIBREOFFICE.ROUNDSIG([.A145];12)=ORG.LIBREOFFICE.ROUNDSIG([.B145];12) -> true | D145: of:=FORMULA([.A145]) -> =BESSELI($L13,R$1)
A146: of:=BESSELI([.$L14];[.R$1]) -> 17425864.212058 | B146: 17425864.212058 | C146: of:=ORG.LIBREOFFICE.ROUNDSIG([.A146];12)=ORG.LIBREOFFICE.ROUNDSIG([.B146];12) -> true | D146: of:=FORMULA([.A146]) -> =BESSELI($L14,R$1)
A147: of:=BESSELI([.$L15];[.R$1]) -> 99830.6750415823 | B147: 99830.6750415823 | C147: of:=ORG.LIBREOFFICE.ROUNDSIG([.A147];12)=ORG.LIBREOFFICE.ROUNDSIG([.B147];12) -> true | D147: of:=FORMULA([.A147]) -> =BESSELI($L15,R$1)
A148: of:=BESSELI([.$L16];[.R$1]) -> 449.302251356232 | B148: 449.302251356232 | C148: of:=ORG.LIBREOFFICE.ROUNDSIG([.A148];12)=ORG.LIBREOFFICE.ROUNDSIG([.B148];12) -> true | D148: of:=FORMULA([.A148]) -> =BESSELI($L16,R$1)
A149: of:=BESSELI([.$L17];[.R$1]) -> 142.834156752482 | B149: 142.834156752482 | C149: of:=ORG.LIBREOFFICE.ROUNDSIG([.A149];12)=ORG.LIBREOFFICE.ROUNDSIG([.B149];12) -> true | D149: of:=FORMULA([.A149]) -> =BESSELI($L17,R$1)
A150: of:=BESSELI([.$L18];[.R$1]) -> 43.6196591891549 | B150: 43.6196591891549 | C150: of:=ORG.LIBREOFFICE.ROUNDSIG([.A150];12)=ORG.LIBREOFFICE.ROUNDSIG([.B150];12) -> true | D150: of:=FORMULA([.A150]) -> =BESSELI($L18,R$1)
A151: of:=BESSELI([.$L19];[.R$1]) -> 12.5959126967593 | B151: 12.5959126967593 | C151: of:=ORG.LIBREOFFICE.ROUNDSIG([.A151];12)=ORG.LIBREOFFICE.ROUNDSIG([.B151];12) -> true | D151: of:=FORMULA([.A151]) -> =BESSELI($L19,R$1)
A152: of:=BESSELI([.$L20];[.R$1]) -> 3.35577484714026 | B152: 3.35577484714026 | C152: of:=ORG.LIBREOFFICE.ROUNDSIG([.A152];12)=ORG.LIBREOFFICE.ROUNDSIG([.B152];12) -> true | D152: of:=FORMULA([.A152]) -> =BESSELI($L20,R$1)
A153: of:=BESSELI([.$L21];[.R$1]) -> 0.792285668997777 | B153: 0.792285668997777 | C153: of:=ORG.LIBREOFFICE.ROUNDSIG([.A153];12)=ORG.LIBREOFFICE.ROUNDSIG([.B153];12) -> true | D153: of:=FORMULA([.A153]) -> =BESSELI($L21,R$1)
A154: of:=BESSELI([.$L22];[.R$1]) -> 0.154464799870673 | B154: 0.154464799870673 | C154: of:=ORG.LIBREOFFICE.ROUNDSIG([.A154];12)=ORG.LIBREOFFICE.ROUNDSIG([.B154];12) -> true | D154: of:=FORMULA([.A154]) -> =BESSELI($L22,R$1)
A155: of:=BESSELI([.$L23];[.R$1]) -> 0.0216835897328909 | B155: 0.0216835897328909 | C155: of:=ORG.LIBREOFFICE.ROUNDSIG([.A155];12)=ORG.LIBREOFFICE.ROUNDSIG([.B155];12) -> true | D155: of:=FORMULA([.A155]) -> =BESSELI($L23,R$1)
A156: of:=BESSELI([.$L24];[.R$1]) -> 0.00160017336352173 | B156: 0.00160017336352173 | C156: of:=ORG.LIBREOFFICE.ROUNDSIG([.A156];12)=ORG.LIBREOFFICE.ROUNDSIG([.B156];12) -> true | D156: of:=FORMULA([.A156]) -> =BESSELI($L24,R$1)
A157: of:=BESSELI([.$L25];[.R$1]) -> 0.0000224886614771476 | B157: 0.0000224886614771476 | C157: of:=ORG.LIBREOFFICE.ROUNDSIG([.A157];12)=ORG.LIBREOFFICE.ROUNDSIG([.B157];12) -> true | D157: of:=FORMULA([.A157]) -> =BESSELI($L25,R$1)
A158: of:=BESSELI([.$L2];[.S$1]) -> 8.39476554558753E+041 | B158: 8.39476554558753E+041 | C158: of:=ORG.LIBREOFFICE.ROUNDSIG([.A158];12)=ORG.LIBREOFFICE.ROUNDSIG([.B158];12) -> true | D158: of:=FORMULA([.A158]) -> =BESSELI($L2,S$1)
A159: of:=BESSELI([.$L3];[.S$1]) -> 3.90904644875137E+037 | B159: 3.90904644875137E+037 | C159: of:=ORG.LIBREOFFICE.ROUNDSIG([.A159];12)=ORG.LIBREOFFICE.ROUNDSIG([.B159];12) -> true | D159: of:=FORMULA([.A159]) -> =BESSELI($L3,S$1)
A160: of:=BESSELI([.$L4];[.S$1]) -> 1.81906833180942E+033 | B160: 1.81906833180942E+033 | C160: of:=ORG.LIBREOFFICE.ROUNDSIG([.A160];12)=ORG.LIBREOFFICE.ROUNDSIG([.B160];12) -> true | D160: of:=FORMULA([.A160]) -> =BESSELI($L4,S$1)
A161: of:=BESSELI([.$L5];[.S$1]) -> 8.44854331659685E+028 | B161: 8.44854331659685E+028 | C161: of:=ORG.LIBREOFFICE.ROUNDSIG([.A161];12)=ORG.LIBREOFFICE.ROUNDSIG([.B161];12) -> true | D161: of:=FORMULA([.A161]) -> =BESSELI($L5,S$1)
A162: of:=BESSELI([.$L6];[.S$1]) -> 3.90646967606294E+024 | B162: 3.90646967606294E+024 | C162: of:=ORG.LIBREOFFICE.ROUNDSIG([.A162];12)=ORG.LIBREOFFICE.ROUNDSIG([.B162];12) -> true | D162: of:=FORMULA([.A162]) -> =BESSELI($L6,S$1)
A163: of:=BESSELI([.$L7];[.S$1]) -> 1.78909488023203E+020 | B163: 1.78909488023203E+020 | C163: of:=ORG.LIBREOFFICE.ROUNDSIG([.A163];12)=ORG.LIBREOFFICE.ROUNDSIG([.B163];12) -> true | D163: of:=FORMULA([.A163]) -> =BESSELI($L7,S$1)
A164: of:=BESSELI([.$L8];[.S$1]) -> 8022986222282041 | B164: 8022986222282041 | C164: of:=ORG.LIBREOFFICE.ROUNDSIG([.A164];12)=ORG.LIBREOFFICE.ROUNDSIG([.B164];12) -> true | D164: of:=FORMULA([.A164]) -> =BESSELI($L8,S$1)
A165: of:=BESSELI([.$L9];[.S$1]) -> 939187589148.033 | B165: 939187589148.033 | C165: of:=ORG.LIBREOFFICE.ROUNDSIG([.A165];12)=ORG.LIBREOFFICE.ROUNDSIG([.B165];12) -> true | D165: of:=FORMULA([.A165]) -> =BESSELI($L9,S$1)
A166: of:=BESSELI([.$L10];[.S$1]) -> 341954833059.769 | B166: 341954833059.769 | C166: of:=ORG.LIBREOFFICE.ROUNDSIG([.A166];12)=ORG.LIBREOFFICE.ROUNDSIG([.B166];12) -> true | D166: of:=FORMULA([.A166]) -> =BESSELI($L10,S$1)
A167: of:=BESSELI([.$L11];[.S$1]) -> 124343668503.652 | B167: 124343668503.652 | C167: of:=ORG.LIBREOFFICE.ROUNDSIG([.A167];12)=ORG.LIBREOFFICE.ROUNDSIG([.B167];12) -> true | D167: of:=FORMULA([.A167]) -> =BESSELI($L11,S$1)
A168: of:=BESSELI([.$L12];[.S$1]) -> 45149017155.2784 | B168: 45149017155.2784 | C168: of:=ORG.LIBREOFFICE.ROUNDSIG([.A168];12)=ORG.LIBREOFFICE.ROUNDSIG([.B168];12) -> true | D168: of:=FORMULA([.A168]) -> =BESSELI($L12,S$1)
A169: of:=BESSELI([.$L13];[.S$1]) -> 2138344874.17343 | B169: 2138344874.17343 | C169: of:=ORG.LIBREOFFICE.ROUNDSIG([.A169];12)=ORG.LIBREOFFICE.ROUNDSIG([.B169];12) -> true | D169: of:=FORMULA([.A169]) -> =BESSELI($L13,S$1)
A170: of:=BESSELI([.$L14];[.S$1]) -> 12562873.6861788 | B170: 12562873.6861788 | C170: of:=ORG.LIBREOFFICE.ROUNDSIG([.A170];12)=ORG.LIBREOFFICE.ROUNDSIG([.B170];12) -> true | D170: of:=FORMULA([.A170]) -> =BESSELI($L14,S$1)
A171: of:=BESSELI([.$L15];[.S$1]) -> 64707.4711673681 | B171: 64707.4711673681 | C171: of:=ORG.LIBREOFFICE.ROUNDSIG([.A171];12)=ORG.LIBREOFFICE.ROUNDSIG([.B171];12) -> true | D171: of:=FORMULA([.A171]) -> =BESSELI($L15,S$1)
A172: of:=BESSELI([.$L16];[.S$1]) -> 238.025584775782 | B172: 238.025584775782 | C172: of:=ORG.LIBREOFFICE.ROUNDSIG([.A172];12)=ORG.LIBREOFFICE.ROUNDSIG([.B172];12) -> true | D172: of:=FORMULA([.A172]) -> =BESSELI($L16,S$1)
A173: of:=BESSELI([.$L17];[.S$1]) -> 71.0337760200085 | B173: 71.0337760200085 | C173: of:=ORG.LIBREOFFICE.ROUNDSIG([.A173];12)=ORG.LIBREOFFICE.ROUNDSIG([.B173];12) -> true | D173: of:=FORMULA([.A173]) -> =BESSELI($L17,S$1)
A174: of:=BESSELI([.$L18];[.S$1]) -> 20.1063164741889 | B174: 20.1063164741889 | C174: of:=ORG.LIBREOFFICE.ROUNDSIG([.A174];12)=ORG.LIBREOFFICE.ROUNDSIG([.B174];12) -> true | D174: of:=FORMULA([.A174]) -> =BESSELI($L18,S$1)
A175: of:=BESSELI([.$L19];[.S$1]) -> 5.2924931953293 | B175: 5.2924931953293 | C175: of:=ORG.LIBREOFFICE.ROUNDSIG([.A175];12)=ORG.LIBREOFFICE.ROUNDSIG([.B175];12) -> true | D175: of:=FORMULA([.A175]) -> =BESSELI($L19,S$1)
A176: of:=BESSELI([.$L20];[.S$1]) -> 1.25691804811574 | B176: 1.25691804811574 | C176: of:=ORG.LIBREOFFICE.ROUNDSIG([.A176];12)=ORG.LIBREOFFICE.ROUNDSIG([.B176];12) -> true | D176: of:=FORMULA([.A176]) -> =BESSELI($L20,S$1)
A177: of:=BESSELI([.$L21];[.S$1]) -> 0.256488941727882 | B177: 0.256488941727882 | C177: of:=ORG.LIBREOFFICE.ROUNDSIG([.A177];12)=ORG.LIBREOFFICE.ROUNDSIG([.B177];12) -> true | D177: of:=FORMULA([.A177]) -> =BESSELI($L21,S$1)
A178: of:=BESSELI([.$L22];[.S$1]) -> 0.0413299635011473 | B178: 0.0413299635011473 | C178: of:=ORG.LIBREOFFICE.ROUNDSIG([.A178];12)=ORG.LIBREOFFICE.ROUNDSIG([.B178];12) -> true | D178: of:=FORMULA([.A178]) -> =BESSELI($L22,S$1)
A179: of:=BESSELI([.$L23];[.S$1]) -> 0.00447211872994957 | B179: 0.00447211872994957 | C179: of:=ORG.LIBREOFFICE.ROUNDSIG([.A179];12)=ORG.LIBREOFFICE.ROUNDSIG([.B179];12) -> true | D179: of:=FORMULA([.A179]) -> =BESSELI($L23,S$1)
A180: of:=BESSELI([.$L24];[.S$1]) -> 0.000224639142001342 | B180: 0.000224639142001342 | C180: of:=ORG.LIBREOFFICE.ROUNDSIG([.A180];12)=ORG.LIBREOFFICE.ROUNDSIG([.B180];12) -> true | D180: of:=FORMULA([.A180]) -> =BESSELI($L24,S$1)
A181: of:=BESSELI([.$L25];[.S$1]) -> 0.000001599218231201 | B181: 0.000001599218231201 | C181: of:=ORG.LIBREOFFICE.ROUNDSIG([.A181];12)=ORG.LIBREOFFICE.ROUNDSIG([.B181];12) -> true | D181: of:=FORMULA([.A181]) -> =BESSELI($L25,S$1)
A182: of:=BESSELI([.$L2];[.T$1]) -> 7.78580221901819E+041 | B182: 7.78580221901819E+041 | C182: of:=ORG.LIBREOFFICE.ROUNDSIG([.A182];12)=ORG.LIBREOFFICE.ROUNDSIG([.B182];12) -> true | D182: of:=FORMULA([.A182]) -> =BESSELI($L2,T$1)
A183: of:=BESSELI([.$L3];[.T$1]) -> 3.59517038425952E+037 | B183: 3.59517038425952E+037 | C183: of:=ORG.LIBREOFFICE.ROUNDSIG([.A183];12)=ORG.LIBREOFFICE.ROUNDSIG([.B183];12) -> true | D183: of:=FORMULA([.A183]) -> =BESSELI($L3,T$1)
A184: of:=BESSELI([.$L4];[.T$1]) -> 1.65553320716713E+033 | B184: 1.65553320716713E+033 | C184: of:=ORG.LIBREOFFICE.ROUNDSIG([.A184];12)=ORG.LIBREOFFICE.ROUNDSIG([.B184];12) -> true | D184: of:=FORMULA([.A184]) -> =BESSELI($L4,T$1)
A185: of:=BESSELI([.$L5];[.T$1]) -> 7.58587283542073E+028 | B185: 7.58587283542073E+028 | C185: of:=ORG.LIBREOFFICE.ROUNDSIG([.A185];12)=ORG.LIBREOFFICE.ROUNDSIG([.B185];12) -> true | D185: of:=FORMULA([.A185]) -> =BESSELI($L5,T$1)
A186: of:=BESSELI([.$L6];[.T$1]) -> 3.44496806488478E+024 | B186: 3.44496806488478E+024 | C186: of:=ORG.LIBREOFFICE.ROUNDSIG([.A186];12)=ORG.LIBREOFFICE.ROUNDSIG([.B186];12) -> true | D186: of:=FORMULA([.A186]) -> =BESSELI($L6,T$1)
A187: of:=BESSELI([.$L7];[.T$1]) -> 1.5384427155319E+020 | B187: 1.5384427155319E+020 | C187: of:=ORG.LIBREOFFICE.ROUNDSIG([.A187];12)=ORG.LIBREOFFICE.ROUNDSIG([.B187];12) -> true | D187: of:=FORMULA([.A187]) -> =BESSELI($L7,T$1)
A188: of:=BESSELI([.$L8];[.T$1]) -> 6643061873342103 | B188: 6643061873342103 | C188: of:=ORG.LIBREOFFICE.ROUNDSIG([.A188];12)=ORG.LIBREOFFICE.ROUNDSIG([.B188];12) -> true | D188: of:=FORMULA([.A188]) -> =BESSELI($L8,T$1)
A189: of:=BESSELI([.$L9];[.T$1]) -> 736258420564.967 | B189: 736258420564.967 | C189: of:=ORG.LIBREOFFICE.ROUNDSIG([.A189];12)=ORG.LIBREOFFICE.ROUNDSIG([.B189];12) -> true | D189: of:=FORMULA([.A189]) -> =BESSELI($L9,T$1)
A190: of:=BESSELI([.$L10];[.T$1]) -> 265912658948.355 | B190: 265912658948.355 | C190: of:=ORG.LIBREOFFICE.ROUNDSIG([.A190];12)=ORG.LIBREOFFICE.ROUNDSIG([.B190];12) -> true | D190: of:=FORMULA([.A190]) -> =BESSELI($L10,T$1)
A191: of:=BESSELI([.$L11];[.T$1]) -> 95862431932.1365 | B191: 95862431932.1365 | C191: of:=ORG.LIBREOFFICE.ROUNDSIG([.A191];12)=ORG.LIBREOFFICE.ROUNDSIG([.B191];12) -> true | D191: of:=FORMULA([.A191]) -> =BESSELI($L11,T$1)
A192: of:=BESSELI([.$L12];[.T$1]) -> 34487762928.3189 | B192: 34487762928.3189 | C192: of:=ORG.LIBREOFFICE.ROUNDSIG([.A192];12)=ORG.LIBREOFFICE.ROUNDSIG([.B192];12) -> true | D192: of:=FORMULA([.A192]) -> =BESSELI($L12,T$1)
A193: of:=BESSELI([.$L13];[.T$1]) -> 1581946317.48056 | B193: 1581946317.48056 | C193: of:=ORG.LIBREOFFICE.ROUNDSIG([.A193];12)=ORG.LIBREOFFICE.ROUNDSIG([.B193];12) -> true | D193: of:=FORMULA([.A193]) -> =BESSELI($L13,T$1)
A194: of:=BESSELI([.$L14];[.T$1]) -> 8631852.63173284 | B194: 8631852.63173284 | C194: of:=ORG.LIBREOFFICE.ROUNDSIG([.A194];12)=ORG.LIBREOFFICE.ROUNDSIG([.B194];12) -> true | D194: of:=FORMULA([.A194]) -> =BESSELI($L14,T$1)
A195: of:=BESSELI([.$L15];[.T$1]) -> 39437.035285372 | B195: 39437.035285372 | C195: of:=ORG.LIBREOFFICE.ROUNDSIG([.A195];12)=ORG.LIBREOFFICE.ROUNDSIG([.B195];12) -> true | D195: of:=FORMULA([.A195]) -> =BESSELI($L15,T$1)
A196: of:=BESSELI([.$L16];[.T$1]) -> 116.066432670137 | B196: 116.066432670137 | C196: of:=ORG.LIBREOFFICE.ROUNDSIG([.A196];12)=ORG.LIBREOFFICE.ROUNDSIG([.B196];12) -> true | D196: of:=FORMULA([.A196]) -> =BESSELI($L16,T$1)
A197: of:=BESSELI([.$L17];[.T$1]) -> 32.3371718324691 | B197: 32.3371718324691 | C197: of:=ORG.LIBREOFFICE.ROUNDSIG([.A197];12)=ORG.LIBREOFFICE.ROUNDSIG([.B197];12) -> true | D197: of:=FORMULA([.A197]) -> =BESSELI($L17,T$1)
A198: of:=BESSELI([.$L18];[.T$1]) -> 8.43360535932438 | B198: 8.43360535932438 | C198: of:=ORG.LIBREOFFICE.ROUNDSIG([.A198];12)=ORG.LIBREOFFICE.ROUNDSIG([.B198];12) -> true | D198: of:=FORMULA([.A198]) -> =BESSELI($L18,T$1)
A199: of:=BESSELI([.$L19];[.T$1]) -> 2.01092630610073 | B199: 2.01092630610073 | C199: of:=ORG.LIBREOFFICE.ROUNDSIG([.A199];12)=ORG.LIBREOFFICE.ROUNDSIG([.B199];12) -> true | D199: of:=FORMULA([.A199]) -> =BESSELI($L19,T$1)
A200: of:=BESSELI([.$L20];[.T$1]) -> 0.422966068203539 | B200: 0.422966068203539 | C200: of:=ORG.LIBREOFFICE.ROUNDSIG([.A200];12)=ORG.LIBREOFFICE.ROUNDSIG([.B200];12) -> true | D200: of:=FORMULA([.A200]) -> =BESSELI($L20,T$1)
A201: of:=BESSELI([.$L21];[.T$1]) -> 0.0741166321597085 | B201: 0.0741166321597085 | C201: of:=ORG.LIBREOFFICE.ROUNDSIG([.A201];12)=ORG.LIBREOFFICE.ROUNDSIG([.B201];12) -> true | D201: of:=FORMULA([.A201]) -> =BESSELI($L21,T$1)
A202: of:=BESSELI([.$L22];[.T$1]) -> 0.00980992761665736 | B202: 0.00980992761665736 | C202: of:=ORG.LIBREOFFICE.ROUNDSIG([.A202];12)=ORG.LIBREOFFICE.ROUNDSIG([.B202];12) -> true | D202: of:=FORMULA([.A202]) -> =BESSELI($L22,T$1)
A203: of:=BESSELI([.$L23];[.T$1]) -> 0.000813702326459637 | B203: 0.000813702326459637 | C203: of:=ORG.LIBREOFFICE.ROUNDSIG([.A203];12)=ORG.LIBREOFFICE.ROUNDSIG([.B203];12) -> true | D203: of:=FORMULA([.A203]) -> =BESSELI($L23,T$1)
A204: of:=BESSELI([.$L24];[.T$1]) -> 0.000027699369512329 | B204: 0.000027699369512329 | C204: of:=ORG.LIBREOFFICE.ROUNDSIG([.A204];12)=ORG.LIBREOFFICE.ROUNDSIG([.B204];12) -> true | D204: of:=FORMULA([.A204]) -> =BESSELI($L24,T$1)
A205: of:=BESSELI([.$L25];[.T$1]) -> 0.0000000996062403336398 | B205: 0.0000000996062403336398 | C205: of:=ORG.LIBREOFFICE.ROUNDSIG([.A205];12)=ORG.LIBREOFFICE.ROUNDSIG([.B205];12) -> true | D205: of:=FORMULA([.A205]) -> =BESSELI($L25,T$1)
A206: of:=BESSELI([.$L2];[.U$1]) -> 7.14903719054461E+041 | B206: 7.14903719054461E+041 | C206: of:=ORG.LIBREOFFICE.ROUNDSIG([.A206];12)=ORG.LIBREOFFICE.ROUNDSIG([.B206];12) -> true | D206: of:=FORMULA([.A206]) -> =BESSELI($L2,U$1)
A207: of:=BESSELI([.$L3];[.U$1]) -> 3.26990504710522E+037 | B207: 3.26990504710522E+037 | C207: of:=ORG.LIBREOFFICE.ROUNDSIG([.A207];12)=ORG.LIBREOFFICE.ROUNDSIG([.B207];12) -> true | D207: of:=FORMULA([.A207]) -> =BESSELI($L3,U$1)
A208: of:=BESSELI([.$L4];[.U$1]) -> 1.48796169037599E+033 | B208: 1.48796169037599E+033 | C208: of:=ORG.LIBREOFFICE.ROUNDSIG([.A208];12)=ORG.LIBREOFFICE.ROUNDSIG([.B208];12) -> true | D208: of:=FORMULA([.A208]) -> =BESSELI($L4,U$1)
A209: of:=BESSELI([.$L5];[.U$1]) -> 6.71462952564353E+028 | B209: 6.71462952564353E+028 | C209: of:=ORG.LIBREOFFICE.ROUNDSIG([.A209];12)=ORG.LIBREOFFICE.ROUNDSIG([.B209];12) -> true | D209: of:=FORMULA([.A209]) -> =BESSELI($L5,U$1)
A210: of:=BESSELI([.$L6];[.U$1]) -> 2.987811525427E+024 | B210: 2.987811525427E+024 | C210: of:=ORG.LIBREOFFICE.ROUNDSIG([.A210];12)=ORG.LIBREOFFICE.ROUNDSIG([.B210];12) -> true | D210: of:=FORMULA([.A210]) -> =BESSELI($L6,U$1)
A211: of:=BESSELI([.$L7];[.U$1]) -> 1.29679321126183E+020 | B211: 1.29679321126183E+020 | C211: of:=ORG.LIBREOFFICE.ROUNDSIG([.A211];12)=ORG.LIBREOFFICE.ROUNDSIG([.B211];12) -> true | D211: of:=FORMULA([.A211]) -> =BESSELI($L7,U$1)
A212: of:=BESSELI([.$L8];[.U$1]) -> 5365761472945197 | B212: 5365761472945197 | C212: of:=ORG.LIBREOFFICE.ROUNDSIG([.A212];12)=ORG.LIBREOFFICE.ROUNDSIG([.B212];12) -> true | D212: of:=FORMULA([.A212]) -> =BESSELI($L8,U$1)
A213: of:=BESSELI([.$L9];[.U$1]) -> 559183243049.985 | B213: 559183243049.985 | C213: of:=ORG.LIBREOFFICE.ROUNDSIG([.A213];12)=ORG.LIBREOFFICE.ROUNDSIG([.B213];12) -> true | D213: of:=FORMULA([.A213]) -> =BESSELI($L9,U$1)
A214: of:=BESSELI([.$L10];[.U$1]) -> 200134748287.313 | B214: 200134748287.313 | C214: of:=ORG.LIBREOFFICE.ROUNDSIG([.A214];12)=ORG.LIBREOFFICE.ROUNDSIG([.B214];12) -> true | D214: of:=FORMULA([.A214]) -> =BESSELI($L10,U$1)
A215: of:=BESSELI([.$L11];[.U$1]) -> 71454050885.9213 | B215: 71454050885.9213 | C215: of:=ORG.LIBREOFFICE.ROUNDSIG([.A215];12)=ORG.LIBREOFFICE.ROUNDSIG([.B215];12) -> true | D215: of:=FORMULA([.A215]) -> =BESSELI($L11,U$1)
A216: of:=BESSELI([.$L12];[.U$1]) -> 25441724053.3819 | B216: 25441724053.3819 | C216: of:=ORG.LIBREOFFICE.ROUNDSIG([.A216];12)=ORG.LIBREOFFICE.ROUNDSIG([.B216];12) -> true | D216: of:=FORMULA([.A216]) -> =BESSELI($L12,U$1)
A217: of:=BESSELI([.$L13];[.U$1]) -> 1125899230.98588 | B217: 1125899230.98588 | C217: of:=ORG.LIBREOFFICE.ROUNDSIG([.A217];12)=ORG.LIBREOFFICE.ROUNDSIG([.B217];12) -> true | D217: of:=FORMULA([.A217]) -> =BESSELI($L13,U$1)
A218: of:=BESSELI([.$L14];[.U$1]) -> 5657391.58079258 | B218: 5657391.58079258 | C218: of:=ORG.LIBREOFFICE.ROUNDSIG([.A218];12)=ORG.LIBREOFFICE.ROUNDSIG([.B218];12) -> true | D218: of:=FORMULA([.A218]) -> =BESSELI($L14,U$1)
A219: of:=BESSELI([.$L15];[.U$1]) -> 22641.3001963047 | B219: 22641.3001963047 | C219: of:=ORG.LIBREOFFICE.ROUNDSIG([.A219];12)=ORG.LIBREOFFICE.ROUNDSIG([.B219];12) -> true | D219: of:=FORMULA([.A219]) -> =BESSELI($L15,U$1)
A220: of:=BESSELI([.$L16];[.U$1]) -> 52.319292503563 | B220: 52.319292503563 | C220: of:=ORG.LIBREOFFICE.ROUNDSIG([.A220];12)=ORG.LIBREOFFICE.ROUNDSIG([.B220];12) -> true | D220: of:=FORMULA([.A220]) -> =BESSELI($L16,U$1)
A221: of:=BESSELI([.$L17];[.U$1]) -> 13.5454705400636 | B221: 13.5454705400636 | C221: of:=ORG.LIBREOFFICE.ROUNDSIG([.A221];12)=ORG.LIBREOFFICE.ROUNDSIG([.B221];12) -> true | D221: of:=FORMULA([.A221]) -> =BESSELI($L17,U$1)
A222: of:=BESSELI([.$L18];[.U$1]) -> 3.2391057555401 | B222: 3.2391057555401 | C222: of:=ORG.LIBREOFFICE.ROUNDSIG([.A222];12)=ORG.LIBREOFFICE.ROUNDSIG([.B222];12) -> true | D222: of:=FORMULA([.A222]) -> =BESSELI($L18,U$1)
A223: of:=BESSELI([.$L19];[.U$1]) -> 0.696090209956195 | B223: 0.696090209956195 | C223: of:=ORG.LIBREOFFICE.ROUNDSIG([.A223];12)=ORG.LIBREOFFICE.ROUNDSIG([.B223];12) -> true | D223: of:=FORMULA([.A223]) -> =BESSELI($L19,U$1)
A224: of:=BESSELI([.$L20];[.U$1]) -> 0.129008532906302 | B224: 0.129008532906302 | C224: of:=ORG.LIBREOFFICE.ROUNDSIG([.A224];12)=ORG.LIBREOFFICE.ROUNDSIG([.B224];12) -> true | D224: of:=FORMULA([.A224]) -> =BESSELI($L20,U$1)
A225: of:=BESSELI([.$L21];[.U$1]) -> 0.0193157188168146 | B225: 0.0193157188168146 | C225: of:=ORG.LIBREOFFICE.ROUNDSIG([.A225];12)=ORG.LIBREOFFICE.ROUNDSIG([.B225];12) -> true | D225: of:=FORMULA([.A225]) -> =BESSELI($L21,U$1)
A226: of:=BESSELI([.$L22];[.U$1]) -> 0.00209025303451787 | B226: 0.00209025303451787 | C226: of:=ORG.LIBREOFFICE.ROUNDSIG([.A226];12)=ORG.LIBREOFFICE.ROUNDSIG([.B226];12) -> true | D226: of:=FORMULA([.A226]) -> =BESSELI($L22,U$1)
A227: of:=BESSELI([.$L23];[.U$1]) -> 0.000132372988831504 | B227: 0.000132372988831504 | C227: of:=ORG.LIBREOFFICE.ROUNDSIG([.A227];12)=ORG.LIBREOFFICE.ROUNDSIG([.B227];12) -> true | D227: of:=FORMULA([.A227]) -> =BESSELI($L23,U$1)
A228: of:=BESSELI([.$L24];[.U$1]) -> 0.00000304418590271044 | B228: 0.00000304418590271044 | C228: of:=ORG.LIBREOFFICE.ROUNDSIG([.A228];12)=ORG.LIBREOFFICE.ROUNDSIG([.B228];12) -> true | D228: of:=FORMULA([.A228]) -> =BESSELI($L24,U$1)
A229: of:=BESSELI([.$L25];[.U$1]) -> 0.00000000551838586275867 | B229: 0.00000000551838586275867 | C229: of:=ORG.LIBREOFFICE.ROUNDSIG([.A229];12)=ORG.LIBREOFFICE.ROUNDSIG([.B229];12) -> true | D229: of:=FORMULA([.A229]) -> =BESSELI($L25,U$1)
A230: of:=BESSELI([.$L2];[.V$1]) -> 6.49897552472014E+041 | B230: 6.49897552472014E+041 | C230: of:=ORG.LIBREOFFICE.ROUNDSIG([.A230];12)=ORG.LIBREOFFICE.ROUNDSIG([.B230];12) -> true | D230: of:=FORMULA([.A230]) -> =BESSELI($L2,V$1)
A231: of:=BESSELI([.$L3];[.V$1]) -> 2.94118937483847E+037 | B231: 2.94118937483847E+037 | C231: of:=ORG.LIBREOFFICE.ROUNDSIG([.A231];12)=ORG.LIBREOFFICE.ROUNDSIG([.B231];12) -> true | D231: of:=FORMULA([.A231]) -> =BESSELI($L3,V$1)
A232: of:=BESSELI([.$L4];[.V$1]) -> 1.32074182683253E+033 | B232: 1.32074182683253E+033 | C232: of:=ORG.LIBREOFFICE.ROUNDSIG([.A232];12)=ORG.LIBREOFFICE.ROUNDSIG([.B232];12) -> true | D232: of:=FORMULA([.A232]) -> =BESSELI($L4,V$1)
A233: of:=BESSELI([.$L5];[.V$1]) -> 5.85925381454096E+028 | B233: 5.85925381454096E+028 | C233: of:=ORG.LIBREOFFICE.ROUNDSIG([.A233];12)=ORG.LIBREOFFICE.ROUNDSIG([.B233];12) -> true | D233: of:=FORMULA([.A233]) -> =BESSELI($L5,V$1)
A234: of:=BESSELI([.$L6];[.V$1]) -> 2.54862460725668E+024 | B234: 2.54862460725668E+024 | C234: of:=ORG.LIBREOFFICE.ROUNDSIG([.A234];12)=ORG.LIBREOFFICE.ROUNDSIG([.B234];12) -> true | D234: of:=FORMULA([.A234]) -> =BESSELI($L6,V$1)
A235: of:=BESSELI([.$L7];[.V$1]) -> 1.07159715947764E+020 | B235: 1.07159715947764E+020 | C235: of:=ORG.LIBREOFFICE.ROUNDSIG([.A235];12)=ORG.LIBREOFFICE.ROUNDSIG([.B235];12) -> true | D235: of:=FORMULA([.A235]) -> =BESSELI($L7,V$1)
A236: of:=BESSELI([.$L8];[.V$1]) -> 4.22846921051676E+015 | B236: 4228469210516760 | C236: of:=ORG.LIBREOFFICE.ROUNDSIG([.A236];12)=ORG.LIBREOFFICE.ROUNDSIG([.B236];12) -> true | D236: of:=FORMULA([.A236]) -> =BESSELI($L8,V$1)
A237: of:=BESSELI([.$L9];[.V$1]) -> 411571376213.363 | B237: 411571376213.363 | C237: of:=ORG.LIBREOFFICE.ROUNDSIG([.A237];12)=ORG.LIBREOFFICE.ROUNDSIG([.B237];12) -> true | D237: of:=FORMULA([.A237]) -> =BESSELI($L9,V$1)
A238: of:=BESSELI([.$L10];[.V$1]) -> 145831809975.967 | B238: 145831809975.967 | C238: of:=ORG.LIBREOFFICE.ROUNDSIG([.A238];12)=ORG.LIBREOFFICE.ROUNDSIG([.B238];12) -> true | D238: of:=FORMULA([.A238]) -> =BESSELI($L10,V$1)
A239: of:=BESSELI([.$L11];[.V$1]) -> 51511641727.0818 | B239: 51511641727.0818 | C239: of:=ORG.LIBREOFFICE.ROUNDSIG([.A239];12)=ORG.LIBREOFFICE.ROUNDSIG([.B239];12) -> true | D239: of:=FORMULA([.A239]) -> =BESSELI($L11,V$1)
A240: of:=BESSELI([.$L12];[.V$1]) -> 18132368894.002 | B240: 18132368894.002 | C240: of:=ORG.LIBREOFFICE.ROUNDSIG([.A240];12)=ORG.LIBREOFFICE.ROUNDSIG([.B240];12) -> true | D240: of:=FORMULA([.A240]) -> =BESSELI($L12,V$1)
A241: of:=BESSELI([.$L13];[.V$1]) -> 771298871.170727 | B241: 771298871.170727 | C241: of:=ORG.LIBREOFFICE.ROUNDSIG([.A241];12)=ORG.LIBREOFFICE.ROUNDSIG([.B241];12) -> true | D241: of:=FORMULA([.A241]) -> =BESSELI($L13,V$1)
A242: of:=BESSELI([.$L14];[.V$1]) -> 3540200.20901952 | B242: 3540200.20901952 | C242: of:=ORG.LIBREOFFICE.ROUNDSIG([.A242];12)=ORG.LIBREOFFICE.ROUNDSIG([.B242];12) -> true | D242: of:=FORMULA([.A242]) -> =BESSELI($L14,V$1)
A243: of:=BESSELI([.$L15];[.V$1]) -> 12267.4750498065 | B243: 12267.4750498065 | C243: of:=ORG.LIBREOFFICE.ROUNDSIG([.A243];12)=ORG.LIBREOFFICE.ROUNDSIG([.B243];12) -> true | D243: of:=FORMULA([.A243]) -> =BESSELI($L15,V$1)
A244: of:=BESSELI([.$L16];[.V$1]) -> 21.8917061637234 | B244: 21.8917061637234 | C244: of:=ORG.LIBREOFFICE.ROUNDSIG([.A244];12)=ORG.LIBREOFFICE.ROUNDSIG([.B244];12) -> true | D244: of:=FORMULA([.A244]) -> =BESSELI($L16,V$1)
A245: of:=BESSELI([.$L17];[.V$1]) -> 5.24623075234192 | B245: 5.24623075234192 | C245: of:=ORG.LIBREOFFICE.ROUNDSIG([.A245];12)=ORG.LIBREOFFICE.ROUNDSIG([.B245];12) -> true | D245: of:=FORMULA([.A245]) -> =BESSELI($L17,V$1)
A246: of:=BESSELI([.$L18];[.V$1]) -> 1.14561740935916 | B246: 1.14561740935916 | C246: of:=ORG.LIBREOFFICE.ROUNDSIG([.A246];12)=ORG.LIBREOFFICE.ROUNDSIG([.B246];12) -> true | D246: of:=FORMULA([.A246]) -> =BESSELI($L18,V$1)
A247: of:=BESSELI([.$L19];[.V$1]) -> 0.220980051927661 | B247: 0.220980051927661 | C247: of:=ORG.LIBREOFFICE.ROUNDSIG([.A247];12)=ORG.LIBREOFFICE.ROUNDSIG([.B247];12) -> true | D247: of:=FORMULA([.A247]) -> =BESSELI($L19,V$1)
A248: of:=BESSELI([.$L20];[.V$1]) -> 0.0359404694846318 | B248: 0.0359404694846318 | C248: of:=ORG.LIBREOFFICE.ROUNDSIG([.A248];12)=ORG.LIBREOFFICE.ROUNDSIG([.B248];12) -> true | D248: of:=FORMULA([.A248]) -> =BESSELI($L20,V$1)
A249: of:=BESSELI([.$L21];[.V$1]) -> 0.00458004441917605 | B249: 0.00458004441917605 | C249: of:=ORG.LIBREOFFICE.ROUNDSIG([.A249];12)=ORG.LIBREOFFICE.ROUNDSIG([.B249];12) -> true | D249: of:=FORMULA([.A249]) -> =BESSELI($L21,V$1)
A250: of:=BESSELI([.$L22];[.V$1]) -> 0.000403788961326931 | B250: 0.000403788961326931 | C250: of:=ORG.LIBREOFFICE.ROUNDSIG([.A250];12)=ORG.LIBREOFFICE.ROUNDSIG([.B250];12) -> true | D250: of:=FORMULA([.A250]) -> =BESSELI($L22,V$1)
A251: of:=BESSELI([.$L23];[.V$1]) -> 0.000019464393470613 | B251: 0.000019464393470613 | C251: of:=ORG.LIBREOFFICE.ROUNDSIG([.A251];12)=ORG.LIBREOFFICE.ROUNDSIG([.B251];12) -> true | D251: of:=FORMULA([.A251]) -> =BESSELI($L23,V$1)
A252: of:=BESSELI([.$L24];[.V$1]) -> 0.000000301696387935068 | B252: 0.000000301696387935068 | C252: of:=ORG.LIBREOFFICE.ROUNDSIG([.A252];12)=ORG.LIBREOFFICE.ROUNDSIG([.B252];12) -> true | D252: of:=FORMULA([.A252]) -> =BESSELI($L24,V$1)
A253: of:=BESSELI([.$L25];[.V$1]) -> 0.000000000275294803983687 | B253: 0.000000000275294803983687 | C253: of:=ORG.LIBREOFFICE.ROUNDSIG([.A253];12)=ORG.LIBREOFFICE.ROUNDSIG([.B253];12) -> true | D253: of:=FORMULA([.A253]) -> =BESSELI($L25,V$1)
A254: of:=BESSELI([.$L2];[.W$1]) -> 5.84924208560059E+041 | B254: 5.84924208560059E+041 | C254: of:=ORG.LIBREOFFICE.ROUNDSIG([.A254];12)=ORG.LIBREOFFICE.ROUNDSIG([.B254];12) -> true | D254: of:=FORMULA([.A254]) -> =BESSELI($L2,W$1)
A255: of:=BESSELI([.$L3];[.W$1]) -> 2.61630740825223E+037 | B255: 2.61630740825223E+037 | C255: of:=ORG.LIBREOFFICE.ROUNDSIG([.A255];12)=ORG.LIBREOFFICE.ROUNDSIG([.B255];12) -> true | D255: of:=FORMULA([.A255]) -> =BESSELI($L3,W$1)
A256: of:=BESSELI([.$L4];[.W$1]) -> 1.15777623366786E+033 | B256: 1.15777623366786E+033 | C256: of:=ORG.LIBREOFFICE.ROUNDSIG([.A256];12)=ORG.LIBREOFFICE.ROUNDSIG([.B256];12) -> true | D256: of:=FORMULA([.A256]) -> =BESSELI($L4,W$1)
A257: of:=BESSELI([.$L5];[.W$1]) -> 5.04055700720327E+028 | B257: 5.04055700720327E+028 | C257: of:=ORG.LIBREOFFICE.ROUNDSIG([.A257];12)=ORG.LIBREOFFICE.ROUNDSIG([.B257];12) -> true | D257: of:=FORMULA([.A257]) -> =BESSELI($L5,W$1)
A258: of:=BESSELI([.$L6];[.W$1]) -> 2.13826998967478E+024 | B258: 2.13826998967478E+024 | C258: of:=ORG.LIBREOFFICE.ROUNDSIG([.A258];12)=ORG.LIBREOFFICE.ROUNDSIG([.B258];12) -> true | D258: of:=FORMULA([.A258]) -> =BESSELI($L6,W$1)
A259: of:=BESSELI([.$L7];[.W$1]) -> 8.68154347470773E+019 | B259: 8.68154347470773E+019 | C259: of:=ORG.LIBREOFFICE.ROUNDSIG([.A259];12)=ORG.LIBREOFFICE.ROUNDSIG([.B259];12) -> true | D259: of:=FORMULA([.A259]) -> =BESSELI($L7,W$1)
A260: of:=BESSELI([.$L8];[.W$1]) -> 3.25152686768682E+015 | B260: 3251526867686820 | C260: of:=ORG.LIBREOFFICE.ROUNDSIG([.A260];12)=ORG.LIBREOFFICE.ROUNDSIG([.B260];12) -> true | D260: of:=FORMULA([.A260]) -> =BESSELI($L8,W$1)
A261: of:=BESSELI([.$L9];[.W$1]) -> 293653322912.332 | B261: 293653322912.332 | C261: of:=ORG.LIBREOFFICE.ROUNDSIG([.A261];12)=ORG.LIBREOFFICE.ROUNDSIG([.B261];12) -> true | D261: of:=FORMULA([.A261]) -> =BESSELI($L9,W$1)
A262: of:=BESSELI([.$L10];[.W$1]) -> 102913541636.669 | B262: 102913541636.669 | C262: of:=ORG.LIBREOFFICE.ROUNDSIG([.A262];12)=ORG.LIBREOFFICE.ROUNDSIG([.B262];12) -> true | D262: of:=FORMULA([.A262]) -> =BESSELI($L10,W$1)
A263: of:=BESSELI([.$L11];[.W$1]) -> 35928780729.3132 | B263: 35928780729.3132 | C263: of:=ORG.LIBREOFFICE.ROUNDSIG([.A263];12)=ORG.LIBREOFFICE.ROUNDSIG([.B263];12) -> true | D263: of:=FORMULA([.A263]) -> =BESSELI($L11,W$1)
A264: of:=BESSELI([.$L12];[.W$1]) -> 12490031986.2377 | B264: 12490031986.2377 | C264: of:=ORG.LIBREOFFICE.ROUNDSIG([.A264];12)=ORG.LIBREOFFICE.ROUNDSIG([.B264];12) -> true | D264: of:=FORMULA([.A264]) -> =BESSELI($L12,W$1)
A265: of:=BESSELI([.$L13];[.W$1]) -> 508860134.049294 | B265: 508860134.049294 | C265: of:=ORG.LIBREOFFICE.ROUNDSIG([.A265];12)=ORG.LIBREOFFICE.ROUNDSIG([.B265];12) -> true | D265: of:=FORMULA([.A265]) -> =BESSELI($L13,W$1)
A266: of:=BESSELI([.$L14];[.W$1]) -> 2117191.37177306 | B266: 2117191.37177306 | C266: of:=ORG.LIBREOFFICE.ROUNDSIG([.A266];12)=ORG.LIBREOFFICE.ROUNDSIG([.B266];12) -> true | D266: of:=FORMULA([.A266]) -> =BESSELI($L14,W$1)
A267: of:=BESSELI([.$L15];[.W$1]) -> 6284.66679656271 | B267: 6284.66679656271 | C267: of:=ORG.LIBREOFFICE.ROUNDSIG([.A267];12)=ORG.LIBREOFFICE.ROUNDSIG([.B267];12) -> true | D267: of:=FORMULA([.A267]) -> =BESSELI($L15,W$1)
A268: of:=BESSELI([.$L16];[.W$1]) -> 8.5358801761163 | B268: 8.5358801761163 | C268: of:=ORG.LIBREOFFICE.ROUNDSIG([.A268];12)=ORG.LIBREOFFICE.ROUNDSIG([.B268];12) -> true | D268: of:=FORMULA([.A268]) -> =BESSELI($L16,W$1)
A269: of:=BESSELI([.$L17];[.W$1]) -> 1.88717997930373 | B269: 1.88717997930373 | C269: of:=ORG.LIBREOFFICE.ROUNDSIG([.A269];12)=ORG.LIBREOFFICE.ROUNDSIG([.B269];12) -> true | D269: of:=FORMULA([.A269]) -> =BESSELI($L17,W$1)
A270: of:=BESSELI([.$L18];[.W$1]) -> 0.375062232142189 | B270: 0.375062232142189 | C270: of:=ORG.LIBREOFFICE.ROUNDSIG([.A270];12)=ORG.LIBREOFFICE.ROUNDSIG([.B270];12) -> true | D270: of:=FORMULA([.A270]) -> =BESSELI($L18,W$1)
A271: of:=BESSELI([.$L19];[.W$1]) -> 0.0647186330200214 | B271: 0.0647186330200214 | C271: of:=ORG.LIBREOFFICE.ROUNDSIG([.A271];12)=ORG.LIBREOFFICE.ROUNDSIG([.B271];12) -> true | D271: of:=FORMULA([.A271]) -> =BESSELI($L19,W$1)
A272: of:=BESSELI([.$L20];[.W$1]) -> 0.00920696795752943 | B272: 0.00920696795752943 | C272: of:=ORG.LIBREOFFICE.ROUNDSIG([.A272];12)=ORG.LIBREOFFICE.ROUNDSIG([.B272];12) -> true | D272: of:=FORMULA([.A272]) -> =BESSELI($L20,W$1)
A273: of:=BESSELI([.$L21];[.W$1]) -> 0.000995541140110353 | B273: 0.000995541140110353 | C273: of:=ORG.LIBREOFFICE.ROUNDSIG([.A273];12)=ORG.LIBREOFFICE.ROUNDSIG([.B273];12) -> true | D273: of:=FORMULA([.A273]) -> =BESSELI($L21,W$1)
A274: of:=BESSELI([.$L22];[.W$1]) -> 0.0000713082278832211 | B274: 0.0000713082278832211 | C274: of:=ORG.LIBREOFFICE.ROUNDSIG([.A274];12)=ORG.LIBREOFFICE.ROUNDSIG([.B274];12) -> true | D274: of:=FORMULA([.A274]) -> =BESSELI($L22,W$1)
A275: of:=BESSELI([.$L23];[.W$1]) -> 0.00000261036569408416 | B275: 0.00000261036569408416 | C275: of:=ORG.LIBREOFFICE.ROUNDSIG([.A275];12)=ORG.LIBREOFFICE.ROUNDSIG([.B275];12) -> true | D275: of:=FORMULA([.A275]) -> =BESSELI($L23,W$1)
A276: of:=BESSELI([.$L24];[.W$1]) -> 0.0000000272220233597536 | B276: 0.0000000272220233597536 | C276: of:=ORG.LIBREOFFICE.ROUNDSIG([.A276];12)=ORG.LIBREOFFICE.ROUNDSIG([.B276];12) -> true | D276: of:=FORMULA([.A276]) -> =BESSELI($L24,W$1)
A277: of:=BESSELI([.$L25];[.W$1]) -> 0.0000000000124897830849249 | B277: 0.0000000000124897830849249 | C277: of:=ORG.LIBREOFFICE.ROUNDSIG([.A277];12)=ORG.LIBREOFFICE.ROUNDSIG([.B277];12) -> true | D277: of:=FORMULA([.A277]) -> =BESSELI($L25,W$1)
A278: of:=BESSELI([.$L2];[.X$1]) -> 5.21214226588802E+041 | B278: 5.21214226588802E+041 | C278: of:=ORG.LIBREOFFICE.ROUNDSIG([.A278];12)=ORG.LIBREOFFICE.ROUNDSIG([.B278];12) -> true | D278: of:=FORMULA([.A278]) -> =BESSELI($L2,X$1)
A279: of:=BESSELI([.$L3];[.X$1]) -> 2.30164756393236E+037 | B279: 2.30164756393236E+037 | C279: of:=ORG.LIBREOFFICE.ROUNDSIG([.A279];12)=ORG.LIBREOFFICE.ROUNDSIG([.B279];12) -> true | D279: of:=FORMULA([.A279]) -> =BESSELI($L3,X$1)
A280: of:=BESSELI([.$L4];[.X$1]) -> 1.00235336257387E+033 | B280: 1.00235336257387E+033 | C280: of:=ORG.LIBREOFFICE.ROUNDSIG([.A280];12)=ORG.LIBREOFFICE.ROUNDSIG([.B280];12) -> true | D280: of:=FORMULA([.A280]) -> =BESSELI($L4,X$1)
A281: of:=BESSELI([.$L5];[.X$1]) -> 4.27507875513423E+028 | B281: 4.27507875513423E+028 | C281: of:=ORG.LIBREOFFICE.ROUNDSIG([.A281];12)=ORG.LIBREOFFICE.ROUNDSIG([.B281];12) -> true | D281: of:=FORMULA([.A281]) -> =BESSELI($L5,X$1)
A282: of:=BESSELI([.$L6];[.X$1]) -> 1.76459227770926E+024 | B282: 1.76459227770926E+024 | C282: of:=ORG.LIBREOFFICE.ROUNDSIG([.A282];12)=ORG.LIBREOFFICE.ROUNDSIG([.B282];12) -> true | D282: of:=FORMULA([.A282]) -> =BESSELI($L6,X$1)
A283: of:=BESSELI([.$L7];[.X$1]) -> 6.89609246590497E+019 | B283: 6.89609246590497E+019 | C283: of:=ORG.LIBREOFFICE.ROUNDSIG([.A283];12)=ORG.LIBREOFFICE.ROUNDSIG([.B283];12) -> true | D283: of:=FORMULA([.A283]) -> =BESSELI($L7,X$1)
A284: of:=BESSELI([.$L8];[.X$1]) -> 2.44012943328901E+015 | B284: 2440129433289010 | C284: of:=ORG.LIBREOFFICE.ROUNDSIG([.A284];12)=ORG.LIBREOFFICE.ROUNDSIG([.B284];12) -> true | D284: of:=FORMULA([.A284]) -> =BESSELI($L8,X$1)
A285: of:=BESSELI([.$L9];[.X$1]) -> 203172243823.966 | B285: 203172243823.966 | C285: of:=ORG.LIBREOFFICE.ROUNDSIG([.A285];12)=ORG.LIBREOFFICE.ROUNDSIG([.B285];12) -> true | D285: of:=FORMULA([.A285]) -> =BESSELI($L9,X$1)
A286: of:=BESSELI([.$L10];[.X$1]) -> 70361879442.4101 | B286: 70361879442.4101 | C286: of:=ORG.LIBREOFFICE.ROUNDSIG([.A286];12)=ORG.LIBREOFFICE.ROUNDSIG([.B286];12) -> true | D286: of:=FORMULA([.A286]) -> =BESSELI($L10,X$1)
A287: of:=BESSELI([.$L11];[.X$1]) -> 24255325311.7408 | B287: 24255325311.7408 | C287: of:=ORG.LIBREOFFICE.ROUNDSIG([.A287];12)=ORG.LIBREOFFICE.ROUNDSIG([.B287];12) -> true | D287: of:=FORMULA([.A287]) -> =BESSELI($L11,X$1)
A288: of:=BESSELI([.$L12];[.X$1]) -> 8318772333.38668 | B288: 8318772333.38668 | C288: of:=ORG.LIBREOFFICE.ROUNDSIG([.A288];12)=ORG.LIBREOFFICE.ROUNDSIG([.B288];12) -> true | D288: of:=FORMULA([.A288]) -> =BESSELI($L12,X$1)
A289: of:=BESSELI([.$L13];[.X$1]) -> 323501953.207349 | B289: 323501953.207349 | C289: of:=ORG.LIBREOFFICE.ROUNDSIG([.A289];12)=ORG.LIBREOFFICE.ROUNDSIG([.B289];12) -> true | D289: of:=FORMULA([.A289]) -> =BESSELI($L13,X$1)
A290: of:=BESSELI([.$L14];[.X$1]) -> 1211289.70006916 | B290: 1211289.70006916 | C290: of:=ORG.LIBREOFFICE.ROUNDSIG([.A290];12)=ORG.LIBREOFFICE.ROUNDSIG([.B290];12) -> true | D290: of:=FORMULA([.A290]) -> =BESSELI($L14,X$1)
A291: of:=BESSELI([.$L15];[.X$1]) -> 3049.96374818114 | B291: 3049.96374818114 | C291: of:=ORG.LIBREOFFICE.ROUNDSIG([.A291];12)=ORG.LIBREOFFICE.ROUNDSIG([.B291];12) -> true | D291: of:=FORMULA([.A291]) -> =BESSELI($L15,X$1)
A292: of:=BESSELI([.$L16];[.X$1]) -> 3.11276977626751 | B292: 3.11276977626751 | C292: of:=ORG.LIBREOFFICE.ROUNDSIG([.A292];12)=ORG.LIBREOFFICE.ROUNDSIG([.B292];12) -> true | D292: of:=FORMULA([.A292]) -> =BESSELI($L16,X$1)
A293: of:=BESSELI([.$L17];[.X$1]) -> 0.633124136266149 | B293: 0.633124136266149 | C293: of:=ORG.LIBREOFFICE.ROUNDSIG([.A293];12)=ORG.LIBREOFFICE.ROUNDSIG([.B293];12) -> true | D293: of:=FORMULA([.A293]) -> =BESSELI($L17,X$1)
A294: of:=BESSELI([.$L18];[.X$1]) -> 0.114196270968145 | B294: 0.114196270968145 | C294: of:=ORG.LIBREOFFICE.ROUNDSIG([.A294];12)=ORG.LIBREOFFICE.ROUNDSIG([.B294];12) -> true | D294: of:=FORMULA([.A294]) -> =BESSELI($L18,X$1)
A295: of:=BESSELI([.$L19];[.X$1]) -> 0.0175786338647361 | B295: 0.0175786338647361 | C295: of:=ORG.LIBREOFFICE.ROUNDSIG([.A295];12)=ORG.LIBREOFFICE.ROUNDSIG([.B295];12) -> true | D295: of:=FORMULA([.A295]) -> =BESSELI($L19,X$1)
A296: of:=BESSELI([.$L20];[.X$1]) -> 0.00218158697369064 | B296: 0.00218158697369064 | C296: of:=ORG.LIBREOFFICE.ROUNDSIG([.A296];12)=ORG.LIBREOFFICE.ROUNDSIG([.B296];12) -> true | D296: of:=FORMULA([.A296]) -> =BESSELI($L20,X$1)
A297: of:=BESSELI([.$L21];[.X$1]) -> 0.000199663402690499 | B297: 0.000199663402690499 | C297: of:=ORG.LIBREOFFICE.ROUNDSIG([.A297];11)=ORG.LIBREOFFICE.ROUNDSIG([.B297];11) -> true | D297: of:=FORMULA([.A297]) -> =BESSELI($L21,X$1)
A298: of:=BESSELI([.$L22];[.X$1]) -> 0.0000115937079692147 | B298: 0.0000115937079692147 | C298: of:=ORG.LIBREOFFICE.ROUNDSIG([.A298];12)=ORG.LIBREOFFICE.ROUNDSIG([.B298];12) -> true | D298: of:=FORMULA([.A298]) -> =BESSELI($L22,X$1)
A299: of:=BESSELI([.$L23];[.X$1]) -> 0.000000321711713995801 | B299: 0.000000321711713995801 | C299: of:=ORG.LIBREOFFICE.ROUNDSIG([.A299];12)=ORG.LIBREOFFICE.ROUNDSIG([.B299];12) -> true | D299: of:=FORMULA([.A299]) -> =BESSELI($L23,X$1)
A300: of:=BESSELI([.$L24];[.X$1]) -> 0.00000000225413097777903 | B300: 0.00000000225413097777903 | C300: of:=ORG.LIBREOFFICE.ROUNDSIG([.A300];12)=ORG.LIBREOFFICE.ROUNDSIG([.B300];12) -> true | D300: of:=FORMULA([.A300]) -> =BESSELI($L24,X$1)
A301: of:=BESSELI([.$L25];[.X$1]) -> 0.000000000000519576115339285 | B301: 0.000000000000519576115339285 | C301: of:=ORG.LIBREOFFICE.ROUNDSIG([.A301];12)=ORG.LIBREOFFICE.ROUNDSIG([.B301];12) -> true | D301: of:=FORMULA([.A301]) -> =BESSELI($L25,X$1)
A302: of:=BESSELI([.$L2];[.Y$1]) -> 4.59832794178747E+041 | B302: 4.59832794178747E+041 | C302: of:=ORG.LIBREOFFICE.ROUNDSIG([.A302];12)=ORG.LIBREOFFICE.ROUNDSIG([.B302];12) -> true | D302: of:=FORMULA([.A302]) -> =BESSELI($L2,Y$1)
A303: of:=BESSELI([.$L3];[.Y$1]) -> 2.00253472453694E+037 | B303: 2.00253472453694E+037 | C303: of:=ORG.LIBREOFFICE.ROUNDSIG([.A303];12)=ORG.LIBREOFFICE.ROUNDSIG([.B303];12) -> true | D303: of:=FORMULA([.A303]) -> =BESSELI($L3,Y$1)
A304: of:=BESSELI([.$L4];[.Y$1]) -> 8.57070224895699E+032 | B304: 8.57070224895699E+032 | C304: of:=ORG.LIBREOFFICE.ROUNDSIG([.A304];12)=ORG.LIBREOFFICE.ROUNDSIG([.B304];12) -> true | D304: of:=FORMULA([.A304]) -> =BESSELI($L4,Y$1)
A305: of:=BESSELI([.$L5];[.Y$1]) -> 3.57481571972867E+028 | B305: 3.57481571972867E+028 | C305: of:=ORG.LIBREOFFICE.ROUNDSIG([.A305];12)=ORG.LIBREOFFICE.ROUNDSIG([.B305];12) -> true | D305: of:=FORMULA([.A305]) -> =BESSELI($L5,Y$1)
A306: of:=BESSELI([.$L6];[.Y$1]) -> 1.43243307859107E+024 | B306: 1.43243307859107E+024 | C306: of:=ORG.LIBREOFFICE.ROUNDSIG([.A306];12)=ORG.LIBREOFFICE.ROUNDSIG([.B306];12) -> true | D306: of:=FORMULA([.A306]) -> =BESSELI($L6,Y$1)
A307: of:=BESSELI([.$L7];[.Y$1]) -> 5.37141909107335E+019 | B307: 5.37141909107335E+019 | C307: of:=ORG.LIBREOFFICE.ROUNDSIG([.A307];12)=ORG.LIBREOFFICE.ROUNDSIG([.B307];12) -> true | D307: of:=FORMULA([.A307]) -> =BESSELI($L7,Y$1)
A308: of:=BESSELI([.$L8];[.Y$1]) -> 1787449207713414 | B308: 1787449207713414 | C308: of:=ORG.LIBREOFFICE.ROUNDSIG([.A308];12)=ORG.LIBREOFFICE.ROUNDSIG([.B308];12) -> true | D308: of:=FORMULA([.A308]) -> =BESSELI($L8,Y$1)
A309: of:=BESSELI([.$L9];[.Y$1]) -> 136358682532.486 | B309: 136358682532.486 | C309: of:=ORG.LIBREOFFICE.ROUNDSIG([.A309];12)=ORG.LIBREOFFICE.ROUNDSIG([.B309];12) -> true | D309: of:=FORMULA([.A309]) -> =BESSELI($L9,Y$1)
A310: of:=BESSELI([.$L10];[.Y$1]) -> 46624038082.7404 | B310: 46624038082.7404 | C310: of:=ORG.LIBREOFFICE.ROUNDSIG([.A310];12)=ORG.LIBREOFFICE.ROUNDSIG([.B310];12) -> true | D310: of:=FORMULA([.A310]) -> =BESSELI($L10,Y$1)
A311: of:=BESSELI([.$L11];[.Y$1]) -> 15855408057.5277 | B311: 15855408057.5277 | C311: of:=ORG.LIBREOFFICE.ROUNDSIG([.A311];12)=ORG.LIBREOFFICE.ROUNDSIG([.B311];12) -> true | D311: of:=FORMULA([.A311]) -> =BESSELI($L11,Y$1)
A312: of:=BESSELI([.$L12];[.Y$1]) -> 5359655700.47764 | B312: 5359655700.47764 | C312: of:=ORG.LIBREOFFICE.ROUNDSIG([.A312];12)=ORG.LIBREOFFICE.ROUNDSIG([.B312];12) -> true | D312: of:=FORMULA([.A312]) -> =BESSELI($L12,Y$1)
A313: of:=BESSELI([.$L13];[.Y$1]) -> 198298258.970239 | B313: 198298258.970239 | C313: of:=ORG.LIBREOFFICE.ROUNDSIG([.A313];12)=ORG.LIBREOFFICE.ROUNDSIG([.B313];12) -> true | D313: of:=FORMULA([.A313]) -> =BESSELI($L13,Y$1)
A314: of:=BESSELI([.$L14];[.Y$1]) -> 663643.731690065 | B314: 663643.731690065 | C314: of:=ORG.LIBREOFFICE.ROUNDSIG([.A314];12)=ORG.LIBREOFFICE.ROUNDSIG([.B314];12) -> true | D314: of:=FORMULA([.A314]) -> =BESSELI($L14,Y$1)
A315: of:=BESSELI([.$L15];[.Y$1]) -> 1404.72479947288 | B315: 1404.72479947288 | C315: of:=ORG.LIBREOFFICE.ROUNDSIG([.A315];12)=ORG.LIBREOFFICE.ROUNDSIG([.B315];12) -> true | D315: of:=FORMULA([.A315]) -> =BESSELI($L15,Y$1)
A316: of:=BESSELI([.$L16];[.Y$1]) -> 1.06523271307428 | B316: 1.06523271307428 | C316: of:=ORG.LIBREOFFICE.ROUNDSIG([.A316];12)=ORG.LIBREOFFICE.ROUNDSIG([.B316];12) -> true | D316: of:=FORMULA([.A316]) -> =BESSELI($L16,Y$1)
A317: of:=BESSELI([.$L17];[.Y$1]) -> 0.198848949260664 | B317: 0.198848949260664 | C317: of:=ORG.LIBREOFFICE.ROUNDSIG([.A317];12)=ORG.LIBREOFFICE.ROUNDSIG([.B317];12) -> true | D317: of:=FORMULA([.A317]) -> =BESSELI($L17,Y$1)
A318: of:=BESSELI([.$L18];[.Y$1]) -> 0.0324734192377529 | B318: 0.0324734192377529 | C318: of:=ORG.LIBREOFFICE.ROUNDSIG([.A318];12)=ORG.LIBREOFFICE.ROUNDSIG([.B318];12) -> true | D318: of:=FORMULA([.A318]) -> =BESSELI($L18,Y$1)
A319: of:=BESSELI([.$L19];[.Y$1]) -> 0.00444903119806908 | B319: 0.00444903119806908 | C319: of:=ORG.LIBREOFFICE.ROUNDSIG([.A319];12)=ORG.LIBREOFFICE.ROUNDSIG([.B319];12) -> true | D319: of:=FORMULA([.A319]) -> =BESSELI($L19,Y$1)
A320: of:=BESSELI([.$L20];[.Y$1]) -> 0.000480620062766878 | B320: 0.000480620062766878 | C320: of:=ORG.LIBREOFFICE.ROUNDSIG([.A320];12)=ORG.LIBREOFFICE.ROUNDSIG([.B320];12) -> true | D320: of:=FORMULA([.A320]) -> =BESSELI($L20,Y$1)
A321: of:=BESSELI([.$L21];[.Y$1]) -> 0.0000371568071959566 | B321: 0.0000371568071959566 | C321: of:=ORG.LIBREOFFICE.ROUNDSIG([.A321];12)=ORG.LIBREOFFICE.ROUNDSIG([.B321];12) -> true | D321: of:=FORMULA([.A321]) -> =BESSELI($L21,Y$1)
A322: of:=BESSELI([.$L22];[.Y$1]) -> 0.00000174598006793296 | B322: 0.00000174598006793296 | C322: of:=ORG.LIBREOFFICE.ROUNDSIG([.A322];12)=ORG.LIBREOFFICE.ROUNDSIG([.B322];12) -> true | D322: of:=FORMULA([.A322]) -> =BESSELI($L22,Y$1)
A323: of:=BESSELI([.$L23];[.Y$1]) -> 0.0000000366719821177528 | B323: 0.0000000366719821177528 | C323: of:=ORG.LIBREOFFICE.ROUNDSIG([.A323];12)=ORG.LIBREOFFICE.ROUNDSIG([.B323];12) -> true | D323: of:=FORMULA([.A323]) -> =BESSELI($L23,Y$1)
A324: of:=BESSELI([.$L24];[.Y$1]) -> 0.000000000172451626405243 | B324: 0.000000000172451626405243 | C324: of:=ORG.LIBREOFFICE.ROUNDSIG([.A324];12)=ORG.LIBREOFFICE.ROUNDSIG([.B324];12) -> true | D324: of:=FORMULA([.A324]) -> =BESSELI($L24,Y$1)
A325: of:=BESSELI([.$L25];[.Y$1]) -> 0.000000000000019956316782072 | B325: 0.000000000000019956316782072 | C325: of:=ORG.LIBREOFFICE.ROUNDSIG([.A325];12)=ORG.LIBREOFFICE.ROUNDSIG([.B325];12) -> true | D325: of:=FORMULA([.A325]) -> =BESSELI($L25,Y$1)
A326: of:=BESSELI(-1;-8) ->  | B326: of:#ERR502! ->  | C326: of:=ISERROR([.A326]) -> true | D326: of:=FORMULA([.A326]) -> =BESSELI(-1,-8)