Sheet: Sheet1
A1: CONVERT Function
A3: Result | B3: of:=AND([.B8:.B95]) -> true
A7: Sheet | B7: Result | C7: Description
A8: 1 | B8: of:=AND([Sheet2.C2:.C468]) -> true | C8: Simple CONVERT formulas with local references and values

Sheet: Sheet2
A1: Function | B1: Expected | C1: Correct | D1: FunctionString | E1: Comment | H1: Unit symbol | I1: Description
A2: of:=CONVERT(1;[.H2];[.H3]) -> 0.999996000004 | B2: 0.999996000004 | C2: of:=ROUND([.A2];12)=ROUND([.B2];12) -> true | D2: of:=FORMULA([.A2]) -> =CONVERT(1,H2,H3) | H2: uk_acre | I2: International acre (using international feet), exactly 4046.8564224 m2; normally not used for U.S. land areas
A3: of:=CONVERT(1;[.H3];[.H4]) -> 4.04687260987425E+023 | B3: 4.04687260987425E+023 | C3: of:=ROUND([.A3];12)=ROUND([.B3];12) -> true | D3: of:=FORMULA([.A141]) -> =CONVERT(1,H14,H15) | H3: us_acre | I3: U.S. survey/statute acre (using U.S. survey/statute feet), exactly 4046+13525426/15499969 m 2
A4: of:=CONVERT(1;[.H4];[.H5]) -> 1E-022 | B4: 1E-022 | C4: of:=ROUND([.A4];12)=ROUND([.B4];12) -> true | D4: of:=FORMULA([.A142]) -> =CONVERT(1,H15,H16) | G4: ang^2 | H4: ang2 | I4: Square angstrom (an Angstrom is exactly 10-10 m)
A5: of:=CONVERT(1;[.H5];[.H6]) -> 1076.39104167097 | B5: 1076.39104167097 | C5: of:=ROUND([.A5];12)=ROUND([.B5];12) -> true | D5: of:=FORMULA([.A5]) -> =CONVERT(1,H5,H6) | H5: ar | I5: are, 100 m2 (not abbreviated as “a”)
A6: of:=CONVERT(1;[.H6];[.H7]) -> 0.000009290304 | B6: 0.000009290304 | C6: of:=ROUND([.A6];12)=ROUND([.B6];12) -> true | D6: of:=FORMULA([.A6]) -> =CONVERT(1,H6,H7) | G6: ft^2 | H6: ft2 | I6: Square international feet (1 foot is exactly 0.3048 m)
A7: of:=CONVERT(1;[.H7];[.H8]) -> 15500031.000062 | B7: 15500031.000062 | C7: of:=ROUND([.A7];12)=ROUND([.B7];12) -> true | D7: of:=FORMULA([.A7]) -> =CONVERT(1,H7,H8) | H7: ha | I7: hectare, 10 000 m2
A8: of:=CONVERT(1;[.H8];[.H9]) -> 7.20836355779189E-036 | B8: 7.20836355779189E-036 | C8: of:=ROUND([.A8];12)=ROUND([.B8];12) -> true | D8: of:=FORMULA([.A8]) -> =CONVERT(1,H8,H9) | G8: in^2 | H8: in2 | I8: Square international inches (1 inch is exactly 2.54 cm)
A9: of:=CONVERT(1;[.H9];[.H10]) -> 8.9501590038784E+031 | B9: 8.9501590038784E+031 | C9: of:=ROUND([.A9];12)=ROUND([.B9];12) -> true | D9: of:=FORMULA([.A9]) -> =CONVERT(1,H9,H10) | G9: ly^2 | H9: ly2 | I9: Square light-year (where year=365.25 days)
A10: of:=CONVERT(1;[.H10];[.H11]) -> 0.0004 | B10: 0.0004 | C10: of:=ROUND([.A10];12)=ROUND([.B10];12) -> true | D10: of:=FORMULA([.A10]) -> =CONVERT(1,H10,H11) | G10: m^2 | H10: m2 | I10: Square meters
A11: of:=CONVERT(1;[.H11];[.H12]) -> 0.000965255396356115 | B11: 0.000965255396356115 | C11: of:=ROUND([.A11];12)=ROUND([.B11];12) -> true | D11: of:=FORMULA([.A11]) -> =CONVERT(1,H11,H12) | H11: Morgen | I11: Morgen, 2500 m2
A12: of:=CONVERT(1;[.H12];[.H13]) -> 0.755119708987773 | B12: 0.755119708987773 | C12: of:=ROUND([.A12];12)=ROUND([.B12];12) -> true | D12: of:=FORMULA([.A12]) -> =CONVERT(1,H12,H13) | G12: mi^2 | H12: mi2 | I12: Square international miles
A13: of:=CONVERT(1;[.H13];[.H14]) -> 27560019740839.5 | B13: 27560019740839.5 | C13: of:=ROUND([.A13];12)=ROUND([.B13];12) -> true | D13: of:=FORMULA([.A13]) -> =CONVERT(1,H13,H14) | G13: Nmi^2 | H13: Nmi2 | I13: Square nautical miles (1 nautical mile is 1852 m)
C14: of:=ROUND([.A14];12)=ROUND([.B14];12) -> true | D14: of:=FORMULA([.A14]) ->  | G14: Pica^2 | H14: Pica2 | I14: Square Pica Point (one Pica point is 1/72 inch)
A15: of:=CONVERT(1;[.H17];[.H18]) -> 0.00000000008748906 | B15: 0.00000000008748906 | C15: of:=ROUND([.A15];12)=ROUND([.B15];12) -> true | D15: of:=FORMULA([.A15]) -> =CONVERT(1,H17,H18) | G15: picapt^2 | H15: picapt2
A16: of:=CONVERT(1;[.H18];[.H19]) -> 3.75000016575001 | B16: 3.75000016575001 | C16: of:=ROUND([.A16];12)=ROUND([.B16];12) -> true | D16: of:=FORMULA([.A16]) -> =CONVERT(1,H18,H19) | G16: yd^2 | H16: yd2 | I16: Square international yards (1 yard is 0.9144 m)
A17: of:=CONVERT(1;[.H19];[.H20]) -> 12 | B17: 12 | C17: of:=ROUND([.A17];12)=ROUND([.B17];12) -> true | D17: of:=FORMULA([.A17]) -> =CONVERT(1,H19,H20) | H17: ang | I17: Angstrom, exactly 10-10 m
A18: of:=CONVERT(1;[.H20];[.H21]) -> 2.68483957766416E-018 | B18: 2.68483957766416E-018 | C18: of:=ROUND([.A18];12)=ROUND([.B18];12) -> true | D18: of:=FORMULA([.A18]) -> =CONVERT(1,H20,H21) | H18: ell | I18: Ell, exactly 45 international inches
A19: of:=CONVERT(1;[.H21];[.H22]) -> 9.460528E+015 | B19: 9.460528E+015 | C19: of:=ROUND([.A19];12)=ROUND([.B19];12) -> true | D19: of:=FORMULA([.A19]) -> =CONVERT(1,H21,H22) | H19: ft | I19: International Foot, exactly 0.3048 m and also exactly 12 international inches.
A20: of:=CONVERT(1;[.H22];[.H23]) -> 0.000621371192237334 | B20: 0.000621371192237334 | C20: of:=ROUND([.A20];12)=ROUND([.B20];12) -> true | D20: of:=FORMULA([.A20]) -> =CONVERT(1,H22,H23) | H20: in | I20: International Inch, exactly 2.54 cm.
A21: of:=CONVERT(1;[.H23];[.H24]) -> 0.868976241900648 | B21: 0.868976241900648 | C21: of:=ROUND([.A21];12)=ROUND([.B21];12) -> true | D21: of:=FORMULA([.A21]) -> =CONVERT(1,H23,H24) | H21: ly | I21: Light-year, (299792458 m/s) (3600 s/hr) (24 hr/day) (365.25 day)
A22: of:=CONVERT(1;[.H24];[.H25]) -> 0.00000000000006001922708 | B22: 0.00000000000006001922708 | C22: of:=ROUND([.A22];12)=ROUND([.B22];12) -> true | D22: of:=FORMULA([.A22]) -> =CONVERT(1,H24,H25) | H22: m | I22: Meter
A23: of:=CONVERT(1;[.H25];[.H26]) -> 8.74680337440886E+019 | B23: 8.74680337440886E+019 | C23: of:=ROUND([.A23];12)=ROUND([.B23];12) -> true | D23: of:=FORMULA([.A23]) -> =CONVERT(1,H25,H26) | H23: mi | I23: International Mile, exactly 1609.344 m and exactly 5280 international feet. This is not a U.S. survey/statute mile (see “smi”) nor a nautical mile (see “Nmi”), but this is the mile normally used in the U.S. customary system
A24: of:=CONVERT(1;[.H28];[.H29]) -> 1760.00352000704 | B24: 1760.00352000704 | C24: of:=ROUND([.A24];12)=ROUND([.B24];12) -> true | D24: of:=FORMULA([.A24]) -> =CONVERT(1,H28,H29) | H24: Nmi | I24: International nautical mile, exactly 1852 m. Note that this is not the obsolete U.S. nautical mile nor the Admiralty mile.
C25: of:=TRUE() -> true | D25: of:=FORMULA([.A25]) ->  | G25: pc | H25: parsec | I25: Distance from sun to a point having heliocentric parallax of one second (used for stellar distance), AU/tan(1/3600 degree) where an AU is exactly 149,597,870.691 kilometers. *
A26: of:=CONVERT(1;[.H30];[.H31]) -> 252.165488508169 | B26: 252.165488508169 | C26: of:=ROUND([.A26];12)=ROUND([.B26];12) -> true | D26: of:=FORMULA([.A26]) -> =CONVERT(1,H30,H31) | G26: picapt | H26: Pica | I26: Pica (1/72 inch)
A27: of:=CONVERT(1;[.H31];[.H32]) -> 0.99933031528756 | B27: 0.99933031528756 | C27: of:=ROUND([.A27];12)=ROUND([.B27];12) -> true | D27: of:=FORMULA([.A27]) -> =CONVERT(1,H31,H32) | H27: pica | I27: Pica (1/6 inch)
A28: of:=CONVERT(1;[.H32];[.H33]) -> 41867948.4613929 | B28: 41867948.4613929 | C28: of:=ROUND([.A28];12)=ROUND([.B28];12) -> true | D28: of:=FORMULA([.A28]) -> =CONVERT(1,H32,H33) | H28: survey_mi
A29: of:=CONVERT(1;[.H33];[.H34]) -> 624145700000 | B29: 624145700000 | C29: of:=ROUND([.A29];12)=ROUND([.B29];12) -> true | D29: of:=FORMULA([.A29]) -> =CONVERT(1,H33,H34) | H29: yd | I29: International yard, exactly 0.9144 m and exactly 3 international feet.
A30: of:=CONVERT(1;[.H34];[.H35]) -> 3.80206452103493E-018 | B30: 3.80206452103493E-018 | C30: of:=ROUND([.A30];12)=ROUND([.B30];12) -> true | D30: of:=FORMULA([.A30]) -> =CONVERT(1,H34,H35) | G30: btu | H30: BTU | I30: International Table British Thermal Unit
A31: of:=CONVERT(1;[.H35];[.H36]) -> 0.000000015697407642781 | B31: 0.000000015697407642781 | C31: of:=ROUND([.A31];12)=ROUND([.B31];12) -> true | D31: of:=FORMULA([.A31]) -> =CONVERT(1,H35,H36) | H31: c | I31: Thermodynamic calorie, 4.184 J. This is not a dietary Calorie (kilocalorie). For high accuracy, use Joule, due to the many conflicting definitions of calorie.
A32: of:=CONVERT(1;[.H36];[.H37]) -> 2684519.71705162 | B32: 2684519.71705162 | C32: of:=ROUND([.A32];12)=ROUND([.B32];12) -> true | D32: of:=FORMULA([.A32]) -> =CONVERT(1,H36,H37) | H32: cal | I32: International Table (IT) calorie, 4.1868 J. This is not a dietary Calorie (kilocalorie). For high accuracy, use Joule, due to the many conflicting definitions of calorie.
A33: of:=CONVERT(1;[.H37];[.H38]) -> 0.000277777777777778 | B33: 0.000277777777777778 | C33: of:=ROUND([.A33];12)=ROUND([.B33];12) -> true | D33: of:=FORMULA([.A33]) -> =CONVERT(1,H37,H38) | H33: e | I33: Erg
C34: of:=ROUND([.A34];12)=ROUND([.B34];12) -> true | D34: of:=FORMULA([.A34]) ->  | G34: ev | H34: eV | I34: Electron volt (eV preferred)
A35: of:=CONVERT(1;[.H39];[.H40]) -> 0.00001 | B35: 0.00001 | C35: of:=ROUND([.A35];12)=ROUND([.B35];12) -> true | D35: of:=FORMULA([.A35]) -> =CONVERT(1,H39,H40) | H35: flb | I35: Foot-pound (international foot, avoirdupois pound)
A36: of:=CONVERT(1;[.H40];[.H41]) -> 0.224808923655339 | B36: 0.224808923655339 | C36: of:=ROUND([.A36];12)=ROUND([.B36];12) -> true | D36: of:=FORMULA([.A36]) -> =CONVERT(1,H40,H41) | G36: hh | H36: HPh | I36: Horsepower-hour (HPh preferred)
A37: of:=CONVERT(1;[.H41];[.H42]) -> 453.5923144952 | B37: 453.5923144952 | C37: of:=ROUND([.A37];12)=ROUND([.B37];12) -> true | D37: of:=FORMULA([.A37]) -> =CONVERT(1,H41,H42) | H37: J | I37: Joule
C38: of:=ROUND([.A38];12)=ROUND([.B38];12) -> true | D38: of:=FORMULA([.A38]) ->  | G38: wh | H38: Wh | I38: Watt-hour
A39: of:=CONVERT(8;[.H43];[.H44]) -> 1 | B39: 1 | C39: of:=ROUND([.A39];12)=ROUND([.B39];12) -> true | D39: of:=FORMULA([.A39]) -> =CONVERT(8,H43,H44) | G39: dy | H39: dyn | I39: Dyne
C40: of:=ROUND([.A40];12)=ROUND([.B40];12) -> true | D40: of:=FORMULA([.A40]) ->  | H40: N | I40: Newton
A41: of:=CONVERT(1;[.H45];[.H46]) -> 0.0001 | B41: 0.0001 | C41: of:=ROUND([.A41];12)=ROUND([.B41];12) -> true | D41: of:=FORMULA([.A41]) -> =CONVERT(1,H45,H46) | H41: lbf | I41: Pound force (see “lbm” for pound mass)
C42: of:=ROUND([.A42];12)=ROUND([.B42];12) -> true | D42: of:=FORMULA([.A42]) ->  | H42: pond | I42: Pond, gravitational force on a mass of one gram, 9.80665E-3 N.
A43: of:=CONVERT(1;[.H47];[.H48]) -> 15.43236 | B43: 15.43236 | C43: of:=ROUND([.A43];12)=ROUND([.B43];12) -> true | D43: of:=FORMULA([.A43]) -> =CONVERT(1,H47,H48) | H43: bit | I43: bit
A44: of:=CONVERT(10000000;[.H48];[.H49]) -> 14.2857127610345 | B44: 14.2857127610345 | C44: of:=ROUND([.A44];11)=ROUND([.B44];11) -> true | D44: of:=FORMULA([.A44]) -> =CONVERT(10000000,H48,H49) | H44: byte
A45: of:=CONVERT(1;[.H49];[.H50]) -> 0.892857142857143 | B45: 0.892857142857143 | C45: of:=ROUND([.A45];12)=ROUND([.B45];12) -> true | D45: of:=FORMULA([.A45]) -> =CONVERT(1,H49,H50) | H45: ga | I45: Gauss
A46: of:=CONVERT(1;[.H50];[.H51]) -> 112.000014877089 | B46: 112.000014877089 | C46: of:=ROUND([.A46];12)=ROUND([.B46];12) -> true | D46: of:=FORMULA([.A46]) -> =CONVERT(1,H50,H51) | H46: T | I46: Tesla
A47: of:=CONVERT(1;[.H51];[.H52]) -> 0.0714285417930745 | B47: 0.0714285417930745 | C47: of:=ROUND([.A47];12)=ROUND([.B47];12) -> true | D47: of:=FORMULA([.A47]) -> =CONVERT(1,H51,H52) | H47: g | I47: Gram
A48: of:=CONVERT(1;[.H52];[.H53]) -> 0.007 | B48: 0.007 | C48: of:=ROUND([.A48];12)=ROUND([.B48];12) -> true | D48: of:=FORMULA([.A48]) -> =CONVERT(1,H52,H53) | H48: grain | I48: Grain, 1/7000 international pound mass (avoirdupois) (U.S. usage).
A49: of:=CONVERT(1;[.H53];[.H54]) -> 32000.017962592 | B49: 32000.017962592 | C49: of:=ROUND([.A49];12)=ROUND([.B49];12) -> true | D49: of:=FORMULA([.A49]) -> =CONVERT(1,H53,H54) | G49: shweight | H49: cwt | I49: U.S. (short) hundredweight, 100 lbm
A50: of:=CONVERT(1;[.H54];[.H55]) -> 0.00194256689870811 | B50: 0.00194256689870811 | C50: of:=ROUND([.A50];12)=ROUND([.B50];12) -> true | D50: of:=FORMULA([.A50]) -> =CONVERT(1,H54,H55) | G50: lcwt | H50: uk_cwt | I50: Imperial hundredweight, aka long hundredweight; 112 lbm
A51: of:=CONVERT(1;[.H55];[.H56]) -> 8.78861184032002E+027 | B51: 8.78861184032002E+027 | C51: of:=ROUND([.A51];12)=ROUND([.B51];12) -> true | D51: of:=FORMULA([.A51]) -> =CONVERT(1,H55,H56) | G51: hweight | H51: lbm | I51: International pound mass (avoirdupois), exactly 453.59237 g (see “lbf” for pound force)
C52: of:=ROUND([.A52];12)=ROUND([.B52];12) -> true | D52: of:=FORMULA([.A52]) ->  | H52: stone | I52: 14 international pound mass (avoirdupois)
A53: of:=CONVERT(1;[.H58];[.H59]) -> 1.0138700185381 | B53: 1.0138700185381 | C53: of:=ROUND([.A53];12)=ROUND([.B53];12) -> true | D53: of:=FORMULA([.A53]) -> =CONVERT(1,H58,H59) | H53: ton | I53: 2000 international pound mass (avoirdupois) (U.S. usage). Note that there are many other measures also called “ton”; in particular, this is not a metric ton (tonne).
A54: of:=CONVERT(1;[.H59];[.H60]) -> 735.498542977386 | B54: 735.498542977386 | C54: of:=ROUND([.A54];12)=ROUND([.B54];12) -> true | D54: of:=FORMULA([.A54]) -> =CONVERT(1,H59,H60) | H54: ozm | I54: Ounce mass (avoirdupois), exactly 1/16 of an international pound mass (avoirdupois) (see “oz” for fluid ounce)
C55: of:=ROUND([.A55];12)=ROUND([.B55];12) -> true | D55: of:=FORMULA([.A55]) ->  | H55: sg | I55: Slug; 32.174 international pound mass (avoirdupois)
A56: of:=CONVERT(1;[.H61];[.H62]) -> 760 | B56: 760 | C56: of:=ROUND([.A56];12)=ROUND([.B56];12) -> true | D56: of:=FORMULA([.A56]) -> =CONVERT(1,H61,H62) | H56: u | I56: U (atomic mass unit)
A57: of:=CONVERT(1;[.H62];[.H63]) -> 133.322363925 | B57: 133.322363925 | C57: of:=ROUND([.A57];12)=ROUND([.B57];12) -> true | D57: of:=FORMULA([.A57]) -> =CONVERT(1,H62,H63) | G57: LTON | H57: uk_ton | I57: Imperial ton, aka “long ton”, "deadweight ton", or "weight ton". 2240 lbm.
A58: of:=CONVERT(1;[.H63];[.H64]) -> 0.0001450377 | B58: 0.0001450377 | C58: of:=ROUND([.A58];12)=ROUND([.B58];12) -> true | D58: of:=FORMULA([.A58]) -> =CONVERT(1,H63,H64) | H58: HP | I58: Mechanical horsepower aka Imperial horsepower. 550 foot-pounds per second. The unit “h” is deprecated and should be replaced with “HP”.
A59: of:=CONVERT(1;[.H64];[.H65]) -> 51.7150920071126 | B59: 51.7150920071126 | C59: of:=ROUND([.A59];12)=ROUND([.B59];12) -> true | D59: of:=FORMULA([.A59]) -> =CONVERT(1,H64,H65) | H59: PS | I59: Pferdestärke (German “horse strength”, close but not identical to “HP”), the amount of power to lift a mass of 75 kilograms in one second against the earth gravitation between a distance of one meter, approximately 735.49875 W.
C60: of:=ROUND([.A60];12)=ROUND([.B60];12) -> true | D60: of:=FORMULA([.A60]) ->  | G60: w | H60: W | I60: Watt
A61: of:=CONVERT(1;[.H66];[.H67]) -> 0.999999913606911 | B61: 0.999999913606911 | C61: of:=ROUND([.A61];12)=ROUND([.B61];12) -> true | D61: of:=FORMULA([.A61]) -> =CONVERT(1,H66,H67) | G61: at | H61: atm | I61: Atmosphere
A62: of:=CONVERT(1;[.H67];[.H68]) -> 1852 | B62: 1852 | C62: of:=ROUND([.A62];12)=ROUND([.B62];12) -> true | D62: of:=FORMULA([.A62]) -> =CONVERT(1,H67,H68) | H62: mmHg | I62: mm of Mercury
A63: of:=CONVERT(1;[.H68];[.H69]) -> 0.000277777777777778 | B63: 0.000277777777777778 | C63: of:=ROUND([.A63];12)=ROUND([.B63];12) -> true | D63: of:=FORMULA([.A63]) -> =CONVERT(1,H68,H69) | H63: Pa | I63: Pascal; Pa preferred, as it is the standard abbreviation. Note that “P” or “p” need not be accepted.
A64: of:=CONVERT(1;[.H69];[.H70]) -> 2.2369362920544 | B64: 2.2369362920544 | C64: of:=ROUND([.A64];12)=ROUND([.B64];12) -> true | D64: of:=FORMULA([.A64]) -> =CONVERT(1,H69,H70) | H64: psi | I64: Pounds per square inch, using avoirdupois pounds and international inches.
C65: of:=ROUND([.A65];12)=ROUND([.B65];12) -> true | D65: of:=FORMULA([.A65]) ->  | H65: Torr | I65: Torr, exactly 101325/760 Pa (this is close but not equal to mmHg)
A66: of:=CONVERT(1;[.H71];[.H72]) -> 33.8 | B66: 33.8 | C66: of:=ROUND([.A66];12)=ROUND([.B66];12) -> true | D66: of:=FORMULA([.A66]) -> =CONVERT(1,H71,H72) | H66: admkn | I66: Admiralty knot, exactly 6080 international feet/hour.
A67: of:=CONVERT(1;[.H72];[.H73]) -> 255.927777777778 | B67: 255.927777777778 | C67: of:=ROUND([.A67];12)=ROUND([.B67];12) -> true | D67: of:=FORMULA([.A67]) -> =CONVERT(1,H72,H73) | H67: kn | I67: Knot, exactly one Nautical mile per hour or exactly 1852/3600 m/s. Note that this is not an Admiralty knot (“admkn”).
A68: of:=CONVERT(1;[.H73];[.H74]) -> 1.8 | B68: 1.8 | C68: of:=ROUND([.A68];12)=ROUND([.B68];12) -> true | D68: of:=FORMULA([.A68]) -> =CONVERT(1,H73,H74) | G68: m/hr | H68: m/h | I68: Meters per hour
A69: of:=CONVERT(1;[.H74];[.H75]) -> -218.075555555556 | B69: -218.075555555556 | C69: of:=ROUND([.A69];12)=ROUND([.B69];12) -> true | D69: of:=FORMULA([.A69]) -> =CONVERT(1,H74,H75) | G69: m/sec | H69: m/s | I69: Meters per second
C70: of:=ROUND([.A70];12)=ROUND([.B70];12) -> true | D70: of:=FORMULA([.A70]) ->  | H70: mph | I70: Miles per hour (international miles)
A71: of:=CONVERT(1;[.H76];[.H77]) -> 24 | B71: 24 | C71: of:=ROUND([.A71];12)=ROUND([.B71];12) -> true | D71: of:=FORMULA([.A71]) -> =CONVERT(1,H76,H77) | G71: cel | H71: C | I71: degrees Celsius
A72: of:=CONVERT(1;[.H77];[.H78]) -> 60 | B72: 60 | C72: of:=ROUND([.A72];12)=ROUND([.B72];12) -> true | D72: of:=FORMULA([.A72]) -> =CONVERT(1,H77,H78) | G72: fah | H72: F | I72: degrees Fahrenheit
A73: of:=CONVERT(1;[.H78];[.H79]) -> 60 | B73: 60 | C73: of:=ROUND([.A73];12)=ROUND([.B73];12) -> true | D73: of:=FORMULA([.A73]) -> =CONVERT(1,H78,H79) | G73: kel | H73: K | I73: Kelvin
A74: of:=CONVERT(1;[.H79];[.H80]) -> 0.0000000316880878140289 | B74: 0.0000000316880878140289 | C74: of:=ROUND([.A74];12)=ROUND([.B74];12) -> true | D74: of:=FORMULA([.A74]) -> =CONVERT(1,H79,H80) | H74: Rank | I74: degrees Rankine
C75: of:=ROUND([.A75];12)=ROUND([.B75];12) -> true | D75: of:=FORMULA([.A75]) ->  | H75: Reau | I75: degrees Réaumur; °C = °Ré · 5/4.
A76: of:=CONVERT(1;[.H81];[.H82]) -> 6.28981077043211E-030 | B76: 6.28981077043211E-030 | C76: of:=ROUND([.A76];12)=ROUND([.B76];12) -> true | D76: of:=FORMULA([.A76]) -> =CONVERT(1,H81,H82) | G76: day | H76: d | I76: Day (exactly 24 hours)
A77: of:=CONVERT(1;[.H82];[.H83]) -> 4.51167627067586 | B77: 4.51167627067586 | C77: of:=ROUND([.A77];12)=ROUND([.B77];12) -> true | D77: of:=FORMULA([.A77]) -> =CONVERT(1,H82,H83) | H77: hr | I77: Hour (exactly 60 minutes)
A78: of:=CONVERT(1;[.H83];[.H84]) -> 148.946856929372 | B78: 148.946856929372 | C78: of:=ROUND([.A78];12)=ROUND([.B78];12) -> true | D78: of:=FORMULA([.A78]) -> =CONVERT(1,H83,H84) | G78: min | H78: mn | I78: Minute (exactly 60 seconds)
A79: of:=CONVERT(1;[.H84];[.H85]) -> 0.00835503472222222 | B79: 0.00835503472222222 | C79: of:=ROUND([.A79];12)=ROUND([.B79];12) -> true | D79: of:=FORMULA([.A79]) -> =CONVERT(1,H84,H85) | G79: s | H79: sec | I79: Second (“s” is the official abbreviation of this SI base unit, while “sec” is its traditional abbreviation in the CONVERT function) *
A80: of:=CONVERT(1;[.H85];[.H86]) -> 7.48051948051948 | B80: 7.48051948051948 | C80: of:=ROUND([.A80];12)=ROUND([.B80];12) -> true | D80: of:=FORMULA([.A80]) -> =CONVERT(1,H85,H86) | H80: yr | I80: Year (exactly 365.25 days, for purposes of this function)
A81: of:=CONVERT(1;[.H88];[.H89]) -> 0.016387064 | B81: 0.016387064 | C81: of:=ROUND([.A81];12)=ROUND([.B81];12) -> true | D81: of:=FORMULA([.A81]) -> =CONVERT(1,H88,H89) | G81: ang^3 | H81: ang3 | I81: Cubic angstrom
A82: of:=CONVERT(1;[.H89];[.H90]) -> 1.18101081256238E-051 | B82: 1.18101081256238E-051 | C82: of:=ROUND([.A82];12)=ROUND([.B82];12) -> true | D82: of:=FORMULA([.A82]) -> =CONVERT(1,H89,H90) | H82: barrel | I82: U.S. oil barrel, exactly 42 U.S. customary gallons (liquid). Note that many other units are also called barrels (e.g., a beer barrel in the U.K. is 36 Imperial gallons)
A83: of:=CONVERT(1;[.H90];[.H91]) -> 8.46732298606437E+047 | B83: 8.46732298606437E+047 | C83: of:=ROUND([.A83];12)=ROUND([.B83];12) -> true | D83: of:=FORMULA([.A83]) -> =CONVERT(1,H90,H91) | H83: bushel | I83: U.S. bushel (not Imperial bushel), interpreted as volume
A84: of:=CONVERT(1;[.H91];[.H92]) -> 0.000000000239912758578928 | B84: 0.000000000239912758578928 | C84: of:=ROUND([.A84];12)=ROUND([.B84];12) -> true | D84: of:=FORMULA([.A84]) -> =CONVERT(1,H91,H92) | H84: cup | I84: Cup (U.S. customary liquid measure)
A85: of:=CONVERT(1;[.H92];[.H93]) -> 5887918080000 | B85: 5887918080000 | C85: of:=ROUND([.A85];12)=ROUND([.B85];12) -> true | D85: of:=FORMULA([.A85]) -> =CONVERT(1,H92,H93) | G85: ft^3 | H85: ft3 | I85: Cubic international feet
A86: of:=CONVERT(100000000000000;[.H93];[.H94]) -> 11.1445349270435 | B86: 11.1445349270435 | C86: of:=ROUND([.A86];11)=ROUND([.B86];11) -> true | D86: of:=FORMULA([.A86]) -> =CONVERT(100000000000000,H93,H94) | G86: lt | H86: gal | I86: Gallon (U.S. customary liquid measure), 3.785411784 liters.
A87: of:=CONVERT(1;[.H94];[.H95]) -> 214792833387555 | B87: 214792833387555 | C87: of:=ROUND([.A87];12)=ROUND([.B87];12) -> true | D87: of:=FORMULA([.A87]) -> =CONVERT(1,H94,H95) | E87: GRT | G87: regton | H87: GRT | I87: Gross Registered Ton, 100 cubic (international) feet
A88: of:=CONVERT(1;[.H95];[.H96]) -> 673596 | B88: 673596 | C88: of:=ROUND([.A88];12)=ROUND([.B88];12) -> true | D88: of:=FORMULA([.A88]) -> =CONVERT(1,H95,H96) | G88: in^3 | H88: in3 | I88: Cubic international inch
A89: of:=CONVERT(1;[.H99];[.H100]) -> 0.5 | B89: 0.5 | C89: of:=ROUND([.A89];12)=ROUND([.B89];12) -> true | D89: of:=FORMULA([.A89]) -> =CONVERT(1,H99,H100) | G89: L | H89: l | I89: Liter
A90: of:=CONVERT(1;[.H100];[.H101]) -> 64 | B90: 64 | C90: of:=ROUND([.A90];12)=ROUND([.B90];12) -> true | D90: of:=FORMULA([.A90]) -> =CONVERT(1,H100,H101) | G90: ly^3 | H90: ly3 | I90: Cubic light-year
A91: of:=CONVERT(1;[.H101];[.H102]) -> 3 | B91: 3 | C91: of:=ROUND([.A91];12)=ROUND([.B91];12) -> true | D91: of:=FORMULA([.A91]) -> =CONVERT(1,H101,H102) | G91: m^3 | H91: m3 | I91: Cubic meter
A92: of:=CONVERT(1;[.H102];[.H103]) -> 0.98578431875 | B92: 0.98578431875 | C92: of:=ROUND([.A92];12)=ROUND([.B92];12) -> true | D92: of:=FORMULA([.A92]) -> =CONVERT(1,H102,H103) | G92: mi^3 | H92: mi3 | I92: Cubic international mile
A93: of:=CONVERT(1;[.H103];[.H104]) -> 0.00109984624149544 | B93: 0.00109984624149544 | C93: of:=ROUND([.A93];12)=ROUND([.B93];12) -> true | D93: of:=FORMULA([.A93]) -> =CONVERT(1,H103,H104) | H93: MTON | I93: Measurement ton aka “freight ton”, 40 cubic feet
A94: of:=CONVERT(1;[.H104];[.H105]) -> 8 | B94: 8 | C94: of:=ROUND([.A94];12)=ROUND([.B94];12) -> true | D94: of:=FORMULA([.A94]) -> =CONVERT(1,H104,H105) | G94: Nmi^3 | H94: Nmi3 | I94: Cubic nautical mile
A95: of:=CONVERT(1;[.H105];[.H106]) -> 0.5 | B95: 0.5 | C95: of:=ROUND([.A95];12)=ROUND([.B95];12) -> true | D95: of:=FORMULA([.A95]) -> =CONVERT(1,H105,H106) | H95: oz | I95: Fluid ounce (U.S. customary liquid measure; see “ozm” for ounce mass)
A96: of:=CONVERT(1;[.H106];[.H107]) -> 0.00148651530773974 | B96: 0.00148651530773974 | C96: of:=ROUND([.A96];12)=ROUND([.B96];12) -> true | D96: of:=FORMULA([.A96]) -> =CONVERT(1,H106,H107) | G96: Pica^3 | H96: Pica3 | I96: Cubic Pica Point (one Pica point is 1/72 inch)
C97: of:=ROUND([.A97];12)=ROUND([.B97];12) -> true | D97: of:=FORMULA([.A97]) ->  | G97: picapt^3 | H97: picapt3
A98: of:=CONVERT(9072;"in3";"gal") -> 39.2727272727273 | B98: 39.2727272727273 | C98: of:=ROUND([.A98];12)=ROUND([.B98];12) -> true | D98: of:=FORMULA([.A98]) -> =CONVERT(9072,"in3","gal") | G98: pica^3 | H98: pica3 | I98: Cubic Pica (one Pica is 1/6 inch)
A99: of:=CONVERT(10;"m3";"yd3") -> 13.0795061931439 | B99: 13.0795061931439 | C99: of:=ROUND([.A99];12)=ROUND([.B99];12) -> true | D99: of:=FORMULA([.A99]) -> =CONVERT(10,"m3","yd3") | G99: us_pt | H99: pt | I99: U.S. Pint (liquid measure)
A100: of:=CONVERT(1;"tspm";"ml") -> 5 | B100: 5 | C100: of:=ROUND([.A100];12)=ROUND([.B100];12) -> true | D100: of:=FORMULA([.A100]) -> =CONVERT(1,"tspm","ml") | H100: qt | I100: Quart (U.S. customary liquid measure). This is 0.946352946 liters, and thus not the same as the U.S. dry quart (1.101220 liters), nor is this the same as the Imperial quart (as used in the U.K. and Canada, which is 1.1365225 liters exactly)
A101: of:=CONVERT(1;[.H3];[.G4]) -> 4.04687260987425E+023 | B101: 4.04687260987425E+023 | C101: of:=ROUND([.A101];12)=ROUND([.B101];12) -> true | D101: of:=FORMULA([.A101]) -> =CONVERT(1,H3,G4) | H101: tbs | I101: Tablespoon (U.S. customary, traditional meaning). This shall be 0.5 U.S. fluid ounce, not 15mL (common in U.S.) or 20mL (common in Australia).
A102: of:=CONVERT(1;[.H5];[.G6]) -> 1076.39104167097 | B102: 1076.39104167097 | C102: of:=ROUND([.A102];12)=ROUND([.B102];12) -> true | D102: of:=FORMULA([.A102]) -> =CONVERT(1,H5,G6) | H102: tsp | I102: Teaspoon (U.S. customary, traditional meaning), 1/6 fluid ounce in U.S. customary measure. This is not the 1/8 Imperial fl. oz. per Imperial units nor the modern teaspoon of 5 mL currently used in the U.S.; see “tspm”
A103: of:=CONVERT(1;[.H7];[.G8]) -> 15500031.000062 | B103: 15500031.000062 | C103: of:=ROUND([.A103];12)=ROUND([.B103];12) -> true | D103: of:=FORMULA([.A103]) -> =CONVERT(1,H7,G8) | H103: tspm | I103: Modern teaspoon, 5mL
A104: of:=CONVERT(1;[.H8];[.G9]) -> 7.20836355779189E-036 | B104: 7.20836355779189E-036 | C104: of:=ROUND([.A104];12)=ROUND([.B104];12) -> true | D104: of:=FORMULA([.A104]) -> =CONVERT(1,H8,G9) | H104: uk_gal | I104: U.K. / Imperial gallon, 4.54609 liters.
A105: of:=CONVERT(1;[.H9];[.G10]) -> 8.9501590038784E+031 | B105: 8.9501590038784E+031 | C105: of:=ROUND([.A105];12)=ROUND([.B105];12) -> true | D105: of:=FORMULA([.A105]) -> =CONVERT(1,H9,G10) | H105: uk_pt | I105: U.K. / Imperial pint,1/8 of a UK gallon.
A106: of:=CONVERT(1;[.H11];[.G12]) -> 0.000965255396356115 | B106: 0.000965255396356115 | C106: of:=ROUND([.A106];12)=ROUND([.B106];12) -> true | D106: of:=FORMULA([.A106]) -> =CONVERT(1,H11,G12) | H106: uk_qt | I106: U.K. / Imperial quart,1/4 of a UK gallon.
A107: of:=CONVERT(1;[.H12];[.G13]) -> 0.755119708987773 | B107: 0.755119708987773 | C107: of:=ROUND([.A107];12)=ROUND([.B107];12) -> true | D107: of:=FORMULA([.A107]) -> =CONVERT(1,H12,G13) | G107: yd^3 | H107: yd3 | I107: Cubic international yard
A108: of:=CONVERT(1;[.H13];[.G14]) -> 27560019740839.5 | B108: 27560019740839.5 | C108: of:=ROUND([.A108];12)=ROUND([.B108];12) -> true | D108: of:=FORMULA([.A108]) -> =CONVERT(1,H13,G14) | E108: AOO#6037
A109: of:=CONVERT(1;[.H12];[.G16]) -> 3097600 | B109: 3097600 | C109: of:=ROUND([.A109];12)=ROUND([.B109];12) -> true | D109: of:=FORMULA([.A109]) -> =CONVERT(1,H12,G16) | E109: AOO#19434
A110: of:=CONVERT(1;[.H24];[.G25]) -> 0.00000000000006001922708 | B110: 0.00000000000006001922708 | C110: of:=ROUND([.A110];12)=ROUND([.B110];12) -> true | D110: of:=FORMULA([.A110]) -> =CONVERT(1,H24,G25) | E110: Tdf#55367
A111: of:=CONVERT(1;[.G30];[.H31]) -> 252.165488508169 | B111: 252.165488508169 | C111: of:=ROUND([.A111];12)=ROUND([.B111];12) -> true | D111: of:=FORMULA([.A111]) -> =CONVERT(1,G30,H31)
A112: of:=CONVERT(1;[.H33];[.G34]) -> 624145700000 | B112: 624145700000 | C112: of:=ROUND([.A112];12)=ROUND([.B112];12) -> true | D112: of:=FORMULA([.A112]) -> =CONVERT(1,H33,G34)
A113: of:=CONVERT(1;[.H35];[.G36]) -> 0.000000015697407642781 | B113: 0.000000015697407642781 | C113: of:=ROUND([.A113];12)=ROUND([.B113];12) -> true | D113: of:=FORMULA([.A113]) -> =CONVERT(1,H35,G36)
A114: of:=CONVERT(1;[.H37];[.G38]) -> 0.000277777777777778 | B114: 0.000277777777777778 | C114: of:=ROUND([.A114];12)=ROUND([.B114];12) -> true | D114: of:=FORMULA([.A114]) -> =CONVERT(1,H37,G38)
A115: of:=CONVERT(1;[.G39];[.H40]) -> 0.00001 | B115: 0.00001 | C115: of:=ROUND([.A115];12)=ROUND([.B115];12) -> true | D115: of:=FORMULA([.A115]) -> =CONVERT(1,G39,H40)
A116: of:=CONVERT(1;[.H48];[.G49]) -> 0.00000142857152114129 | B116: 0.00000142857152114129 | C116: of:=ROUND([.A116];12)=ROUND([.B116];12) -> true | D116: of:=FORMULA([.A116]) -> =CONVERT(1,H48,G49)
A117: of:=CONVERT(1;[.H49];[.G50]) -> 0.892857142857143 | B117: 0.892857142857143 | C117: of:=ROUND([.A117];12)=ROUND([.B117];12) -> true | D117: of:=FORMULA([.A117]) -> =CONVERT(1,H49,G50)
A118: of:=CONVERT(1;[.H50];[.G51]) -> 0.999999971945867 | B118: 0.999999971945867 | C118: of:=ROUND([.A118];12)=ROUND([.B118];12) -> true | D118: of:=FORMULA([.A118]) -> =CONVERT(1,H50,G51)
A119: of:=CONVERT(1;[.H56];[.G57]) -> 1.63431440967062E-030 | B119: 1.63431440967062E-030 | C119: of:=ROUND([.A119];12)=ROUND([.B119];12) -> true | D119: of:=FORMULA([.A119]) -> =CONVERT(1,H56,G57)
A120: of:=CONVERT(1;[.H59];[.G60]) -> 735.498542977386 | B120: 735.498542977386 | C120: of:=ROUND([.A120];12)=ROUND([.B120];12) -> true | D120: of:=FORMULA([.A120]) -> =CONVERT(1,H59,G60)
A121: of:=CONVERT(1;[.H62];[.G61]) -> 0.00131578947368421 | B121: 0.00131578947368421 | C121: of:=ROUND([.A121];12)=ROUND([.B121];12) -> true | D121: of:=FORMULA([.A121]) -> =CONVERT(1,H62,G61)
A122: of:=CONVERT(1;[.H67];[.G68]) -> 1852 | B122: 1852 | C122: of:=ROUND([.A122];12)=ROUND([.B122];12) -> true | D122: of:=FORMULA([.A122]) -> =CONVERT(1,H67,G68)
A123: of:=CONVERT(1;[.H68];[.G69]) -> 0.000277777777777778 | B123: 0.000277777777777778 | C123: of:=ROUND([.A123];12)=ROUND([.B123];12) -> true | D123: of:=FORMULA([.A123]) -> =CONVERT(1,H68,G69)
A124: of:=CONVERT(1;[.H72];[.G71]) -> -17.2222222222222 | B124: -17.2222222222222 | C124: of:=ROUND([.A124];12)=ROUND([.B124];12) -> true | D124: of:=FORMULA([.A124]) -> =CONVERT(1,H72,G71)
A125: of:=CONVERT(1;[.H73];[.G72]) -> -457.87 | B125: -457.87 | C125: of:=ROUND([.A125];12)=ROUND([.B125];12) -> true | D125: of:=FORMULA([.A125]) -> =CONVERT(1,H73,G72)
A126: of:=CONVERT(1;[.H74];[.G73]) -> 0.555555555555556 | B126: 0.555555555555556 | C126: of:=ROUND([.A126];12)=ROUND([.B126];12) -> true | D126: of:=FORMULA([.A126]) -> =CONVERT(1,H74,G73)
A127: of:=CONVERT(1;[.H77];[.G76]) -> 0.0416666666666667 | B127: 0.0416666666666667 | C127: of:=ROUND([.A127];12)=ROUND([.B127];12) -> true | D127: of:=FORMULA([.A127]) -> =CONVERT(1,H77,G76)
A128: of:=CONVERT(1;[.H79];[.G78]) -> 0.0166666666666667 | B128: 0.0166666666666667 | C128: of:=ROUND([.A128];12)=ROUND([.B128];12) -> true | D128: of:=FORMULA([.A128]) -> =CONVERT(1,H79,G78)
A129: of:=CONVERT(1;[.H80];[.G79]) -> 31557600 | B129: 31557600 | C129: of:=ROUND([.A129];12)=ROUND([.B129];12) -> true | D129: of:=FORMULA([.A129]) -> =CONVERT(1,H80,G79)
A130: of:=CONVERT(1;[.H82];[.G81]) -> 1.58987294928E+029 | B130: 1.58987294928E+029 | C130: of:=ROUND([.A130];12)=ROUND([.B130];12) -> true | D130: of:=FORMULA([.A130]) -> =CONVERT(1,H82,G81)
A131: of:=CONVERT(1;[.H84];[.G85]) -> 0.00835503472222222 | B131: 0.00835503472222222 | C131: of:=ROUND([.A131];12)=ROUND([.B131];12) -> true | D131: of:=FORMULA([.A131]) -> =CONVERT(1,H84,G85)
A132: of:=CONVERT(1;[.H85];[.G86]) -> 28.316846592 | B132: 28.316846592 | C132: of:=ROUND([.A132];12)=ROUND([.B132];12) -> true | D132: of:=FORMULA([.A132]) -> =CONVERT(1,H85,G86)
A133: of:=CONVERT(1;[.H86];[.G87]) -> 0.00133680567966071 | B133: 0.00133680567966071 | C133: of:=ROUND([.A133];12)=ROUND([.B133];12) -> true | D133: of:=FORMULA([.A133]) -> =CONVERT(1,H86,G87)
A134: of:=CONVERT(1;[.H88];[.G89]) -> 0.016387064 | B134: 0.016387064 | C134: of:=ROUND([.A134];12)=ROUND([.B134];12) -> true | D134: of:=FORMULA([.A134]) -> =CONVERT(1,H88,G89)
A135: of:=CONVERT(1;[.H89];[.G90]) -> 1.18101081256238E-051 | B135: 1.18101081256238E-051 | C135: of:=ROUND([.A135];12)=ROUND([.B135];12) -> true | D135: of:=FORMULA([.A135]) -> =CONVERT(1,H89,G90)
A136: of:=CONVERT(1;[.H90];[.G91]) -> 8.46732298606437E+047 | B136: 8.46732298606437E+047 | C136: of:=ROUND([.A136];12)=ROUND([.B136];12) -> true | D136: of:=FORMULA([.A136]) -> =CONVERT(1,H90,G91)
A137: of:=CONVERT(1;[.H91];[.G92]) -> 0.000000000239912758578928 | B137: 0.000000000239912758578928 | C137: of:=ROUND([.A137];12)=ROUND([.B137];12) -> true | D137: of:=FORMULA([.A137]) -> =CONVERT(1,H91,G92)
A138: of:=CONVERT(1;[.H95];[.G96]) -> 673596 | B138: 673596 | C138: of:=ROUND([.A138];12)=ROUND([.B138];12) -> true | D138: of:=FORMULA([.A138]) -> =CONVERT(1,H95,G96)
A139: of:=CONVERT(1;[.H106];[.G107]) -> 0.00148651530773974 | B139: 0.00148651530773974 | C139: of:=ROUND([.A139];12)=ROUND([.B139];12) -> true | D139: of:=FORMULA([.A139]) -> =CONVERT(1,H106,G107)
A140: of:=CONVERT(1000000000000000;[.H93];[.G94]) -> 111.445349270435 | B140: 111.445349270435 | C140: of:=ROUND([.A140];12)=ROUND([.B140];12) -> true | D140: of:=FORMULA([.A140]) -> =CONVERT(1000000000000000,H93,G94)
A141: of:=CONVERT(1;[.H14];[.H15]) -> 1 | B141: 1 | C141: of:=ROUND([.A141];12)=ROUND([.B141];12) -> true | D141: of:=FORMULA([.A141]) -> =CONVERT(1,H14,H15) | E141: picapt2 | F141: Tdf#100811
A142: of:=CONVERT(1;[.H15];[.H16]) -> 0.000000148843545191282 | B142: 0.000000148843545191282 | C142: of:=ROUND([.A142];12)=ROUND([.B142];12) -> true | D142: of:=FORMULA([.A142]) -> =CONVERT(1,H15,H16)
A143: of:=CONVERT(1;[.H96];[.G97]) -> 1 | B143: 1 | C143: of:=ROUND([.A143];12)=ROUND([.B143];12) -> true | D143: of:=FORMULA([.A143]) -> =CONVERT(1,H96,G97)
A144: of:=CONVERT(1;[.H97];[.G98]) -> 0.000578703703705364 | B144: 0.000578703703705364 | C144: of:=ROUND([.A144];12)=ROUND([.B144];12) -> true | D144: of:=FORMULA([.A144]) -> =CONVERT(1,H97,G98)
A145: of:=CONVERT(1;[.H98];[.G99]) -> 0.000160333493666367 | B145: 0.000160333493666367 | C145: of:=ROUND([.A145];12)=ROUND([.B145];12) -> true | D145: of:=FORMULA([.A145]) -> =CONVERT(1,H98,G99)
A146: of:=CONVERT(1;[.H87];[.G88]) -> 172799.98395775 | B146: 172799.98395775 | C146: of:=ROUND([.A146];12)=ROUND([.B146];12) -> true | D146: of:=FORMULA([.A146]) -> =CONVERT(1,H87,G88)
A147: of:=CONVERT(1E+021;[.G26];[.H25]) -> 11.4327481388889 | B147: 11.4327481388889 | C147: of:=ROUND([.A147];12)=ROUND([.B147];12) -> true | D147: of:=FORMULA([.A147]) -> =CONVERT(1E+021,G26,H25)
A148: of:=CONVERT(1;[.H12];[.G15]) -> 20811114086400 | B148: 20811114086400 | C148: of:=ROUND([.A148];12)=ROUND([.B148];12) -> true | D148: of:=FORMULA([.A148]) -> =CONVERT(1,H12,G15)
A149: of:=CONVERT(1;[.H96];[.H97]) -> 1 | B149: 1 | C149: of:=ROUND([.A149];12)=ROUND([.B149];12) -> true | D149: of:=FORMULA([.A149]) -> =CONVERT(1,H96,H97) | E149: picapt3
A150: of:=CONVERT(1;[.H97];[.H98]) -> 0.000578703703705364 | B150: 0.000578703703705364 | C150: of:=ROUND([.A150];12)=ROUND([.B150];12) -> true | D150: of:=FORMULA([.A150]) -> =CONVERT(1,H97,H98)
A151: of:=CONVERT(1;[.H98];[.H99]) -> 0.000160333493666367 | B151: 0.000160333493666367 | C151: of:=ROUND([.A151];12)=ROUND([.B151];12) -> true | D151: of:=FORMULA([.A151]) -> =CONVERT(1,H98,H99) | E151: pica3
A152: of:=CONVERT(1;[.H86];[.H87]) -> 0.00133680567966071 | B152: 0.00133680567966071 | C152: of:=ROUND([.A152];12)=ROUND([.B152];12) -> true | D152: of:=FORMULA([.A152]) -> =CONVERT(1,H86,H87)
A153: of:=CONVERT(1;[.H87];[.H88]) -> 172799.98395775 | B153: 172799.98395775 | C153: of:=ROUND([.A153];12)=ROUND([.B153];12) -> true | D153: of:=FORMULA([.A153]) -> =CONVERT(1,H87,H88)
A154: of:=CONVERT(1;[.H56];[.H57]) -> 1.63431440967062E-030 | B154: 1.63431440967062E-030 | C154: of:=ROUND([.A154];12)=ROUND([.B154];12) -> true | D154: of:=FORMULA([.A154]) -> =CONVERT(1,H56,H57) | E154: uk_ton
A155: of:=CONVERT(1;[.H26];[.H27]) -> 0.0833333333333528 | B155: 0.0833333333333528 | C155: of:=ROUND([.A155];12)=ROUND([.B155];12) -> true | D155: of:=FORMULA([.A155]) -> =CONVERT(1,H26,H27)
A156: of:=CONVERT(1;[.H27];[.H28]) -> 0.00000263046611952801 | B156: 0.00000263046611952801 | C156: of:=ROUND([.A156];12)=ROUND([.B156];12) -> true | D156: of:=FORMULA([.A156]) -> =CONVERT(1,H27,H28) | E156: pica

Sheet: 'file:///home/zdenek/Dokumenty/LO/sc-unit-test/Project%20Calc%20functions%20tests/fods/convert_add.fods/convert_add.fods/convert_add.fods/convert_add.fods/convert_add.fods/convert_add.fods/convert_add.fods/convert.fods/combina.fods/combin.fods/combin.fods/ceiling.xcl.fods/ceiling.xcl.fods/ceiling.precise.fods/ceiling.precise.fods/ceiling.math.fods/ceiling.math.fods/ceiling.fods/ceiling.fods/bitor.fods/bitand.fods/bitand.fods/atan.fods/asinh.fods/asin.fods/acos.fods/abs.fods/abs.fods/xor.fods/xor.fods/not.fods/ifna.fods/ifna.fods/iferror.fods/iferror.fods/if.fods/and.fods/and.fods/and.fods/and.fods/type.fods/isna.fods/isna.fods/islogical.fods/isformula.fods/iserr.fods/isblank.fods/info.fods/formula.fods/formula.fods/current.fods/cell.fods/cell.fods/minute.fods/minute.fods/year.fods/function_based_test_Example.fods/function_based_test_Example_reference.fods'#Sheet2
H3: 4

Sheet: 'file:///home/zdenek/Dokumenty/LO/sc-unit-test/Project%20Calc%20functions%20tests/fods/convert_add.fods/convert_add.fods/convert_add.fods/convert_add.fods/convert_add.fods/convert_add.fods/convert_add.fods/convert.fods/combina.fods/combin.fods/combin.fods/ceiling.xcl.fods/ceiling.xcl.fods/ceiling.precise.fods/ceiling.precise.fods/ceiling.math.fods/ceiling.math.fods/ceiling.fods/ceiling.fods/bitor.fods/bitand.fods/bitand.fods/atan.fods/asinh.fods/asin.fods/acos.fods/abs.fods/abs.fods/xor.fods/xor.fods/not.fods/ifna.fods/ifna.fods/iferror.fods/iferror.fods/if.fods/and.fods/and.fods/and.fods/and.fods/type.fods/isna.fods/isna.fods/islogical.fods/isformula.fods/sc-unit-test/information-functions.ods'#Information
O7: O5