Sheet: Sheet1
A1: IMCSCH Function
A3: Result | B3: of:=AND([.B8:.B95]) -> true
A7: Sheet | B7: Result | C7: Description
A8: 1 | B8: of:=AND([Sheet2.C2:.C840]) -> true | C8: Simple IMCSCH formulas with local references and values

Sheet: Sheet2
A1: Function | B1: Expected | C1: Correct | D1: FunctionString | E1: Comment | F1: Expected Real | G1: Expected Imaginary | I1: Result Real | J1: Result Imaginary | N1: -5+12i
A2: of:=IMCSCH("5+12i") -> 0.0113716081825818+0.00723140654863397i | B2: of:=IF([.F2];[.F2]&IF(OR([.G2]=0;LEFT([.G2];1)="-");"";"+");"")&IF([.G2];[.G2]&"i";"") -> 0.0113716081825818+0.00723140654863397i | C2: of:=AND([.K2:.L2]) -> true | D2: of:=FORMULA([.A2]) -> =IMCSCH("5+12i") | F2: 0.0113716081825818 | G2: 0.00723140654863397 | I2: of:=IMREAL([.A2]) -> 0.0113716081825818 | J2: of:=IMAGINARY([.A2]) -> 0.00723140654863397 | K2: of:=ORG.LIBREOFFICE.ROUNDSIG([.F2];14)=ORG.LIBREOFFICE.ROUNDSIG([.I2];14) -> true | L2: of:=ORG.LIBREOFFICE.ROUNDSIG([.G2];14)=ORG.LIBREOFFICE.ROUNDSIG([.J2];14) -> true | N2: -4+12i
A3: of:=IMCSCH(COMPLEX(0;5)) -> 1.04283521277141i | B3: of:=IF([.F3];[.F3]&IF(OR([.G3]=0;LEFT([.G3];1)="-");"";"+");"")&IF([.G3];[.G3]&"i";"") -> 1.04283521277141i | C3: of:=AND([.K3:.L3]) -> true | D3: of:=FORMULA([.A3]) -> =IMCSCH(COMPLEX(0,5)) | F3: 0 | G3: 1.04283521277141 | I3: of:=IMREAL([.A3]) -> 0 | J3: of:=IMAGINARY([.A3]) -> 1.04283521277141 | K3: of:=ORG.LIBREOFFICE.ROUNDSIG([.F3];14)=ORG.LIBREOFFICE.ROUNDSIG([.I3];14) -> true | L3: of:=ORG.LIBREOFFICE.ROUNDSIG([.G3];14)=ORG.LIBREOFFICE.ROUNDSIG([.J3];14) -> true | N3: -3+12i
A4: of:=IMCSCH("-5+12i") -> -0.0113716081825818+0.00723140654863397i | B4: of:=IF([.F4];[.F4]&IF(OR([.G4]=0;LEFT([.G4];1)="-");"";"+");"")&IF([.G4];[.G4]&"i";"") -> -0.0113716081825818+0.00723140654863397i | C4: of:=AND([.K4:.L4]) -> true | D4: of:=FORMULA([.A4]) -> =IMCSCH("-5+12i") | F4: -0.0113716081825818 | G4: 0.00723140654863397 | I4: of:=IMREAL([.A4]) -> -0.0113716081825818 | J4: of:=IMAGINARY([.A4]) -> 0.00723140654863397 | K4: of:=ORG.LIBREOFFICE.ROUNDSIG([.F4];14)=ORG.LIBREOFFICE.ROUNDSIG([.I4];14) -> true | L4: of:=ORG.LIBREOFFICE.ROUNDSIG([.G4];14)=ORG.LIBREOFFICE.ROUNDSIG([.J4];14) -> true | N4: -2+12i
A5: of:=IMCSCH([.N1]) -> -0.0113716081825818+0.00723140654863397i | B5: of:=IF([.F5];[.F5]&IF(OR([.G5]=0;LEFT([.G5];1)="-");"";"+");"")&IF([.G5];[.G5]&"i";"") -> -0.0113716081825818+0.00723140654863397i | C5: of:=AND([.K5:.L5]) -> true | D5: of:=FORMULA([.A5]) -> =IMCSCH(N1) | F5: -0.0113716081825818 | G5: 0.00723140654863397 | I5: of:=IMREAL([.A5]) -> -0.0113716081825818 | J5: of:=IMAGINARY([.A5]) -> 0.00723140654863397 | K5: of:=ORG.LIBREOFFICE.ROUNDSIG([.F5];14)=ORG.LIBREOFFICE.ROUNDSIG([.I5];14) -> true | L5: of:=ORG.LIBREOFFICE.ROUNDSIG([.G5];14)=ORG.LIBREOFFICE.ROUNDSIG([.J5];14) -> true | N5: -1+12i
A6: of:=IMCSCH([.N1:.N12]) -> -0.0113716081825818+0.00723140654863397i | B6: of:=IF([.F6];[.F6]&IF(OR([.G6]=0;LEFT([.G6];1)="-");"";"+");"")&IF([.G6];[.G6]&"i";"") -> -0.0113716081825818+0.00723140654863397i | C6: of:=AND([.K6:.L6]) -> true | D6: of:=FORMULA([.A6]) -> {=IMCSCH(N1:N12)} | F6: -0.0113716081825818 | G6: 0.00723140654863397 | I6: of:=IMREAL([.A6]) -> -0.0113716081825818 | J6: of:=IMAGINARY([.A6]) -> 0.00723140654863397 | K6: of:=ORG.LIBREOFFICE.ROUNDSIG([.F6];14)=ORG.LIBREOFFICE.ROUNDSIG([.I6];14) -> true | L6: of:=ORG.LIBREOFFICE.ROUNDSIG([.G6];14)=ORG.LIBREOFFICE.ROUNDSIG([.J6];14) -> true | N6: 0+12i
A7: -0.0309098723667019+0.0196675402624156i | B7: of:=IF([.F7];[.F7]&IF(OR([.G7]=0;LEFT([.G7];1)="-");"";"+");"")&IF([.G7];[.G7]&"i";"") -> -0.0309098723667019+0.0196675402624156i | C7: of:=AND([.K7:.L7]) -> true | D7: of:=FORMULA([.A7]) -> {=IMCSCH(N1:N12)} | F7: -0.0309098723667019 | G7: 0.0196675402624156 | I7: of:=IMREAL([.A7]) -> -0.0309098723667019 | J7: of:=IMAGINARY([.A7]) -> 0.0196675402624156 | K7: of:=ORG.LIBREOFFICE.ROUNDSIG([.F7];14)=ORG.LIBREOFFICE.ROUNDSIG([.I7];14) -> true | L7: of:=ORG.LIBREOFFICE.ROUNDSIG([.G7];14)=ORG.LIBREOFFICE.ROUNDSIG([.J7];14) -> true | N7: 1+12i
A8: -0.0839938618035557+0.0536737609428415i | B8: of:=IF([.F8];[.F8]&IF(OR([.G8]=0;LEFT([.G8];1)="-");"";"+");"")&IF([.G8];[.G8]&"i";"") -> -0.0839938618035557+0.0536737609428415i | C8: of:=AND([.K8:.L8]) -> true | D8: of:=FORMULA([.A8]) -> {=IMCSCH(N1:N12)} | F8: -0.0839938618035557 | G8: 0.0536737609428415 | I8: of:=IMREAL([.A8]) -> -0.0839938618035557 | J8: of:=IMAGINARY([.A8]) -> 0.0536737609428415 | K8: of:=ORG.LIBREOFFICE.ROUNDSIG([.F8];14)=ORG.LIBREOFFICE.ROUNDSIG([.I8];14) -> true | L8: of:=ORG.LIBREOFFICE.ROUNDSIG([.G8];14)=ORG.LIBREOFFICE.ROUNDSIG([.J8];14) -> true | N8: 2+12i
A9: -0.227684450599255+0.150177672825509i | B9: of:=IF([.F9];[.F9]&IF(OR([.G9]=0;LEFT([.G9];1)="-");"";"+");"")&IF([.G9];[.G9]&"i";"") -> -0.227684450599255+0.15017767282551i | C9: of:=AND([.K9:.L9]) -> true | D9: of:=FORMULA([.A9]) -> {=IMCSCH(N1:N12)} | F9: -0.227684450599255 | G9: 0.15017767282551 | I9: of:=IMREAL([.A9]) -> -0.227684450599255 | J9: of:=IMAGINARY([.A9]) -> 0.150177672825509 | K9: of:=ORG.LIBREOFFICE.ROUNDSIG([.F9];14)=ORG.LIBREOFFICE.ROUNDSIG([.I9];14) -> true | L9: of:=ORG.LIBREOFFICE.ROUNDSIG([.G9];14)=ORG.LIBREOFFICE.ROUNDSIG([.J9];14) -> true | N9: 3+12i
A10: -0.594184076066616+0.496088160951579i | B10: of:=IF([.F10];[.F10]&IF(OR([.G10]=0;LEFT([.G10];1)="-");"";"+");"")&IF([.G10];[.G10]&"i";"") -> -0.594184076066616+0.496088160951579i | C10: of:=AND([.K10:.L10]) -> true | D10: of:=FORMULA([.A10]) -> {=IMCSCH(N1:N12)} | F10: -0.594184076066616 | G10: 0.496088160951579 | I10: of:=IMREAL([.A10]) -> -0.594184076066616 | J10: of:=IMAGINARY([.A10]) -> 0.496088160951579 | K10: of:=ORG.LIBREOFFICE.ROUNDSIG([.F10];14)=ORG.LIBREOFFICE.ROUNDSIG([.I10];14) -> true | L10: of:=ORG.LIBREOFFICE.ROUNDSIG([.G10];14)=ORG.LIBREOFFICE.ROUNDSIG([.J10];14) -> true | N10: 4+12i
A11: 1.86367959778244i | B11: of:=IF([.F11];[.F11]&IF(OR([.G11]=0;LEFT([.G11];1)="-");"";"+");"")&IF([.G11];[.G11]&"i";"") -> 1.86367959778244i | C11: of:=AND([.K11:.L11]) -> true | D11: of:=FORMULA([.A11]) -> {=IMCSCH(N1:N12)} | F11: 0 | G11: 1.86367959778244 | I11: of:=IMREAL([.A11]) -> 0 | J11: of:=IMAGINARY([.A11]) -> 1.86367959778244 | K11: of:=ORG.LIBREOFFICE.ROUNDSIG([.F11];14)=ORG.LIBREOFFICE.ROUNDSIG([.I11];14) -> true | L11: of:=ORG.LIBREOFFICE.ROUNDSIG([.G11];14)=ORG.LIBREOFFICE.ROUNDSIG([.J11];14) -> true | N11: 5+12i
A12: 0.594184076066616+0.496088160951579i | B12: of:=IF([.F12];[.F12]&IF(OR([.G12]=0;LEFT([.G12];1)="-");"";"+");"")&IF([.G12];[.G12]&"i";"") -> 0.594184076066616+0.496088160951579i | C12: of:=AND([.K12:.L12]) -> true | D12: of:=FORMULA([.A12]) -> {=IMCSCH(N1:N12)} | F12: 0.594184076066616 | G12: 0.496088160951579 | I12: of:=IMREAL([.A12]) -> 0.594184076066616 | J12: of:=IMAGINARY([.A12]) -> 0.496088160951579 | K12: of:=ORG.LIBREOFFICE.ROUNDSIG([.F12];14)=ORG.LIBREOFFICE.ROUNDSIG([.I12];14) -> true | L12: of:=ORG.LIBREOFFICE.ROUNDSIG([.G12];14)=ORG.LIBREOFFICE.ROUNDSIG([.J12];14) -> true | N12: 6+12i
A13: 0.227684450599255+0.150177672825509i | B13: of:=IF([.F13];[.F13]&IF(OR([.G13]=0;LEFT([.G13];1)="-");"";"+");"")&IF([.G13];[.G13]&"i";"") -> 0.227684450599255+0.15017767282551i | C13: of:=AND([.K13:.L13]) -> true | D13: of:=FORMULA([.A13]) -> {=IMCSCH(N1:N12)} | F13: 0.227684450599255 | G13: 0.15017767282551 | I13: of:=IMREAL([.A13]) -> 0.227684450599255 | J13: of:=IMAGINARY([.A13]) -> 0.150177672825509 | K13: of:=ORG.LIBREOFFICE.ROUNDSIG([.F13];14)=ORG.LIBREOFFICE.ROUNDSIG([.I13];14) -> true | L13: of:=ORG.LIBREOFFICE.ROUNDSIG([.G13];14)=ORG.LIBREOFFICE.ROUNDSIG([.J13];14) -> true
A14: 0.0839938618035557+0.0536737609428415i | B14: of:=IF([.F14];[.F14]&IF(OR([.G14]=0;LEFT([.G14];1)="-");"";"+");"")&IF([.G14];[.G14]&"i";"") -> 0.0839938618035557+0.0536737609428415i | C14: of:=AND([.K14:.L14]) -> true | D14: of:=FORMULA([.A14]) -> {=IMCSCH(N1:N12)} | F14: 0.0839938618035557 | G14: 0.0536737609428415 | I14: of:=IMREAL([.A14]) -> 0.0839938618035557 | J14: of:=IMAGINARY([.A14]) -> 0.0536737609428415 | K14: of:=ORG.LIBREOFFICE.ROUNDSIG([.F14];14)=ORG.LIBREOFFICE.ROUNDSIG([.I14];14) -> true | L14: of:=ORG.LIBREOFFICE.ROUNDSIG([.G14];14)=ORG.LIBREOFFICE.ROUNDSIG([.J14];14) -> true
A15: 0.0309098723667019+0.0196675402624156i | B15: of:=IF([.F15];[.F15]&IF(OR([.G15]=0;LEFT([.G15];1)="-");"";"+");"")&IF([.G15];[.G15]&"i";"") -> 0.0309098723667019+0.0196675402624156i | C15: of:=AND([.K15:.L15]) -> true | D15: of:=FORMULA([.A15]) -> {=IMCSCH(N1:N12)} | F15: 0.0309098723667019 | G15: 0.0196675402624156 | I15: of:=IMREAL([.A15]) -> 0.0309098723667019 | J15: of:=IMAGINARY([.A15]) -> 0.0196675402624156 | K15: of:=ORG.LIBREOFFICE.ROUNDSIG([.F15];14)=ORG.LIBREOFFICE.ROUNDSIG([.I15];14) -> true | L15: of:=ORG.LIBREOFFICE.ROUNDSIG([.G15];14)=ORG.LIBREOFFICE.ROUNDSIG([.J15];14) -> true
A16: 0.0113716081825818+0.00723140654863397i | B16: of:=IF([.F16];[.F16]&IF(OR([.G16]=0;LEFT([.G16];1)="-");"";"+");"")&IF([.G16];[.G16]&"i";"") -> 0.0113716081825818+0.00723140654863397i | C16: of:=AND([.K16:.L16]) -> true | D16: of:=FORMULA([.A16]) -> {=IMCSCH(N1:N12)} | F16: 0.0113716081825818 | G16: 0.00723140654863397 | I16: of:=IMREAL([.A16]) -> 0.0113716081825818 | J16: of:=IMAGINARY([.A16]) -> 0.00723140654863397 | K16: of:=ORG.LIBREOFFICE.ROUNDSIG([.F16];14)=ORG.LIBREOFFICE.ROUNDSIG([.I16];14) -> true | L16: of:=ORG.LIBREOFFICE.ROUNDSIG([.G16];14)=ORG.LIBREOFFICE.ROUNDSIG([.J16];14) -> true
A17: 0.00418340577604633+0.00266009278646834i | B17: of:=IF([.F17];[.F17]&IF(OR([.G17]=0;LEFT([.G17];1)="-");"";"+");"")&IF([.G17];[.G17]&"i";"") -> 0.00418340577604633+0.00266009278646834i | C17: of:=AND([.K17:.L17]) -> true | D17: of:=FORMULA([.A17]) -> {=IMCSCH(N1:N12)} | F17: 0.00418340577604633 | G17: 0.00266009278646834 | I17: of:=IMREAL([.A17]) -> 0.00418340577604633 | J17: of:=IMAGINARY([.A17]) -> 0.00266009278646834 | K17: of:=ORG.LIBREOFFICE.ROUNDSIG([.F17];14)=ORG.LIBREOFFICE.ROUNDSIG([.I17];14) -> true | L17: of:=ORG.LIBREOFFICE.ROUNDSIG([.G17];14)=ORG.LIBREOFFICE.ROUNDSIG([.J17];14) -> true
A18: of:=IMCSCH("0-i") -> 1.18839510577812i | B18: of:=IF([.F18];[.F18]&IF(OR([.G18]=0;LEFT([.G18];1)="-");"";"+");"")&IF([.G18];[.G18]&"i";"") -> 1.18839510577812i | C18: of:=AND([.K18:.L18]) -> true | D18: of:=FORMULA([.A18]) -> =IMCSCH("0-i") | F18: 0 | G18: 1.18839510577812 | I18: of:=IMREAL([.A18]) -> 0 | J18: of:=IMAGINARY([.A18]) -> 1.18839510577812 | K18: of:=ORG.LIBREOFFICE.ROUNDSIG([.F18];14)=ORG.LIBREOFFICE.ROUNDSIG([.I18];14) -> true | L18: of:=ORG.LIBREOFFICE.ROUNDSIG([.G18];14)=ORG.LIBREOFFICE.ROUNDSIG([.J18];14) -> true
A19: of:=IMCSCH(4) -> 0.0366435703258656 | B19: of:=IF([.F19];[.F19]&IF(OR([.G19]=0;LEFT([.G19];1)="-");"";"+");"")&IF([.G19];[.G19]&"i";"") -> 0.0366435703258656 | C19: of:=AND([.K19:.L19]) -> true | D19: of:=FORMULA([.A19]) -> =IMCSCH(4) | F19: 0.0366435703258656 | G19: 0 | I19: of:=IMREAL([.A19]) -> 0.0366435703258656 | J19: of:=IMAGINARY([.A19]) -> 0 | K19: of:=ORG.LIBREOFFICE.ROUNDSIG([.F19];14)=ORG.LIBREOFFICE.ROUNDSIG([.I19];14) -> true | L19: of:=ORG.LIBREOFFICE.ROUNDSIG([.G19];14)=ORG.LIBREOFFICE.ROUNDSIG([.J19];14) -> true
A20: of:=IMCSCH("4+3i") -> -0.036275889628626-0.0051744731840194i | B20: of:=IF([.F20];[.F20]&IF(OR([.G20]=0;LEFT([.G20];1)="-");"";"+");"")&IF([.G20];[.G20]&"i";"") -> -0.036275889628626-0.0051744731840194i | C20: of:=AND([.K20:.L20]) -> true | D20: of:=FORMULA([.A20]) -> =IMCSCH("4+3i") | F20: -0.036275889628626 | G20: -0.0051744731840194 | I20: of:=IMREAL([.A20]) -> -0.036275889628626 | J20: of:=IMAGINARY([.A20]) -> -0.0051744731840194 | K20: of:=ORG.LIBREOFFICE.ROUNDSIG([.F20];14)=ORG.LIBREOFFICE.ROUNDSIG([.I20];14) -> true | L20: of:=ORG.LIBREOFFICE.ROUNDSIG([.G20];14)=ORG.LIBREOFFICE.ROUNDSIG([.J20];14) -> true
N61: 58
N62: 59
N63: 60
N64: 61
N65: 62
N66: 63
N67: 64
N68: 65
N69: 66
N70: 67
N71: 68
N72: 69
N73: 70
N74: 71
N75: 72
N76: 73
N77: 74
N78: 75
N79: 76
N80: 77
N81: 78
N82: 79
N83: 80
N84: 81
N85: 82
N86: 83
N87: 84
N88: 85
N89: 86
N90: 87
N91: 88
N92: 89
N93: 90
N94: 91
N95: 92
N96: 93
N97: 94
N98: 95
N99: 96
N100: 97
N101: 98
N102: 99
N103: 100
U551: 548
U552: 549
U553: 550
U554: 551
U555: 552
U556: 553
U557: 554
U558: 555
U559: 556
U560: 557
U561: 558
U562: 559
U563: 560
U564: 561
U565: 562
U566: 563
U567: 564
U568: 565
U569: 566
U570: 567
U571: 568
U572: 569
U573: 570
U574: 571
U575: 572
U576: 573
U577: 574
U578: 575
U579: 576
U580: 577
U581: 578
U582: 579
U583: 580
U584: 581
U585: 582
U586: 583
U587: 584
U588: 585
U589: 586
U590: 587
U591: 588
U592: 589
U593: 590
U594: 591
U595: 592
U596: 593
U597: 594
U598: 595
U599: 596