Sheet: Sheet1
A1: IMPRODUCT Function
A3: Result | B3: of:=AND([.B8:.B95]) -> true
A7: Sheet | B7: Result | C7: Description
A8: 1 | B8: of:=AND([Sheet2.C2:.C840]) -> true | C8: Simple IMPRODUCT formulas with local references and values

Sheet: Sheet2
A1: Function | B1: Expected | C1: Correct | D1: FunctionString | E1: Comment | F1: real part | G1: imaginary part | R1: -5+12i | S1: 20+4i | T1: 1
A2: of:=IMPRODUCT("-238+240i";"10+24i") -> -8140-3312i | C2: of:=AND([.K2:.L2]) -> true | D2: of:=FORMULA([.A2]) -> =IMPRODUCT("-238+240i","10+24i") | F2: -8140 | G2: -3312 | I2: of:=IMREAL([.A2]) -> -8140 | J2: of:=IMAGINARY([.A2]) -> -3312 | K2: of:=ORG.LIBREOFFICE.ROUNDSIG([.F2];15)=ORG.LIBREOFFICE.ROUNDSIG([.I2];15) -> true | L2: of:=ORG.LIBREOFFICE.ROUNDSIG([.G2];15)=ORG.LIBREOFFICE.ROUNDSIG([.J2];15) -> true | R2: -4+12i | S2: 21+4i | T2: 2
A3: of:=IMPRODUCT([.R1];[.S1]) -> -148+220i | C3: of:=AND([.K3:.L3]) -> true | D3: of:=FORMULA([.A3]) -> =IMPRODUCT(R1,S1) | F3: 220 | I3: of:=IMAGINARY([.A3]) -> 220 | K3: of:=ORG.LIBREOFFICE.ROUNDSIG([.F3];15)=ORG.LIBREOFFICE.ROUNDSIG([.I3];15) -> true | L3: of:=ORG.LIBREOFFICE.ROUNDSIG([.G3];15)=ORG.LIBREOFFICE.ROUNDSIG([.J3];15) -> true | R3: -3+12i | S3: 22+4i | T3: 3
A4: of:=IMPRODUCT([.R2];[.S2]) -> -132+236i | C4: of:=AND([.K4:.L4]) -> true | D4: of:=FORMULA([.A4]) -> =IMPRODUCT(R2,S2) | F4: -132 | G4: 236 | I4: of:=IMREAL([.A4]) -> -132 | J4: of:=IMAGINARY([.A4]) -> 236 | K4: of:=ORG.LIBREOFFICE.ROUNDSIG([.F4];15)=ORG.LIBREOFFICE.ROUNDSIG([.I4];15) -> true | L4: of:=ORG.LIBREOFFICE.ROUNDSIG([.G4];15)=ORG.LIBREOFFICE.ROUNDSIG([.J4];15) -> true | R4: -2+12i | S4: 23+4i | T4: 4
A5: of:=IMPRODUCT([.R3];[.S3]) -> -114+252i | C5: of:=AND([.K5:.L5]) -> true | D5: of:=FORMULA([.A5]) -> =IMPRODUCT(R3,S3) | F5: -114 | G5: 252 | I5: of:=IMREAL([.A5]) -> -114 | J5: of:=IMAGINARY([.A5]) -> 252 | K5: of:=ORG.LIBREOFFICE.ROUNDSIG([.F5];15)=ORG.LIBREOFFICE.ROUNDSIG([.I5];15) -> true | L5: of:=ORG.LIBREOFFICE.ROUNDSIG([.G5];15)=ORG.LIBREOFFICE.ROUNDSIG([.J5];15) -> true | R5: -1+12i | S5: 24+4i | T5: 5
A6: of:=IMPRODUCT([.R4];[.S4]) -> -94+268i | C6: of:=AND([.K6:.L6]) -> true | D6: of:=FORMULA([.A6]) -> =IMPRODUCT(R4,S4) | F6: -94 | G6: 268 | I6: of:=IMREAL([.A6]) -> -94 | J6: of:=IMAGINARY([.A6]) -> 268 | K6: of:=ORG.LIBREOFFICE.ROUNDSIG([.F6];15)=ORG.LIBREOFFICE.ROUNDSIG([.I6];15) -> true | L6: of:=ORG.LIBREOFFICE.ROUNDSIG([.G6];15)=ORG.LIBREOFFICE.ROUNDSIG([.J6];15) -> true | R6: 0+12i | S6: 25+4i | T6: 6
A7: of:=IMPRODUCT([.R5];[.S5]) -> -72+284i | C7: of:=AND([.K7:.L7]) -> true | D7: of:=FORMULA([.A7]) -> =IMPRODUCT(R5,S5) | F7: -72 | G7: 284 | I7: of:=IMREAL([.A7]) -> -72 | J7: of:=IMAGINARY([.A7]) -> 284 | K7: of:=ORG.LIBREOFFICE.ROUNDSIG([.F7];15)=ORG.LIBREOFFICE.ROUNDSIG([.I7];15) -> true | L7: of:=ORG.LIBREOFFICE.ROUNDSIG([.G7];15)=ORG.LIBREOFFICE.ROUNDSIG([.J7];15) -> true | R7: 1+12i | S7: 26+4i | T7: 7
A8: of:=IMPRODUCT([.R6];[.S6]) -> -48+300i | C8: of:=AND([.K8:.L8]) -> true | D8: of:=FORMULA([.A8]) -> =IMPRODUCT(R6,S6) | F8: -48 | G8: 300 | I8: of:=IMREAL([.A8]) -> -48 | J8: of:=IMAGINARY([.A8]) -> 300 | K8: of:=ORG.LIBREOFFICE.ROUNDSIG([.F8];15)=ORG.LIBREOFFICE.ROUNDSIG([.I8];15) -> true | L8: of:=ORG.LIBREOFFICE.ROUNDSIG([.G8];15)=ORG.LIBREOFFICE.ROUNDSIG([.J8];15) -> true | R8: 2+12i | S8: 27+4i | T8: 8
A9: of:=IMPRODUCT([.R7];[.S7]) -> -22+316i | C9: of:=AND([.K9:.L9]) -> true | D9: of:=FORMULA([.A9]) -> =IMPRODUCT(R7,S7) | F9: -22 | G9: 316 | I9: of:=IMREAL([.A9]) -> -22 | J9: of:=IMAGINARY([.A9]) -> 316 | K9: of:=ORG.LIBREOFFICE.ROUNDSIG([.F9];15)=ORG.LIBREOFFICE.ROUNDSIG([.I9];15) -> true | L9: of:=ORG.LIBREOFFICE.ROUNDSIG([.G9];15)=ORG.LIBREOFFICE.ROUNDSIG([.J9];15) -> true | R9: 3+12i | S9: 28+4i | T9: 9
A10: of:=IMPRODUCT([.R8];[.S8]) -> 6+332i | C10: of:=AND([.K10:.L10]) -> true | D10: of:=FORMULA([.A10]) -> =IMPRODUCT(R8,S8) | F10: 6 | G10: 332 | I10: of:=IMREAL([.A10]) -> 6 | J10: of:=IMAGINARY([.A10]) -> 332 | K10: of:=ORG.LIBREOFFICE.ROUNDSIG([.F10];15)=ORG.LIBREOFFICE.ROUNDSIG([.I10];15) -> true | L10: of:=ORG.LIBREOFFICE.ROUNDSIG([.G10];15)=ORG.LIBREOFFICE.ROUNDSIG([.J10];15) -> true | R10: 4+12i | S10: 29+4i | T10: 10
A11: of:=IMPRODUCT([.R9];[.S9]) -> 36+348i | C11: of:=AND([.K11:.L11]) -> true | D11: of:=FORMULA([.A11]) -> =IMPRODUCT(R9,S9) | F11: 348 | I11: of:=IMAGINARY([.A11]) -> 348 | K11: of:=ORG.LIBREOFFICE.ROUNDSIG([.F11];15)=ORG.LIBREOFFICE.ROUNDSIG([.I11];15) -> true | L11: of:=ORG.LIBREOFFICE.ROUNDSIG([.G11];15)=ORG.LIBREOFFICE.ROUNDSIG([.J11];15) -> true | R11: 5+12i | S11: 30+4i | T11: 11
A12: of:=IMPRODUCT([.R10];[.S10]) -> 68+364i | C12: of:=AND([.K12:.L12]) -> true | D12: of:=FORMULA([.A12]) -> =IMPRODUCT(R10,S10) | F12: 68 | G12: 364 | I12: of:=IMREAL([.A12]) -> 68 | J12: of:=IMAGINARY([.A12]) -> 364 | K12: of:=ORG.LIBREOFFICE.ROUNDSIG([.F12];15)=ORG.LIBREOFFICE.ROUNDSIG([.I12];15) -> true | L12: of:=ORG.LIBREOFFICE.ROUNDSIG([.G12];15)=ORG.LIBREOFFICE.ROUNDSIG([.J12];15) -> true | R12: 6+12i | S12: 31+4i | T12: 12
A13: of:=IMPRODUCT([.R11];[.S11]) -> 102+380i | C13: of:=AND([.K13:.L13]) -> true | D13: of:=FORMULA([.A13]) -> =IMPRODUCT(R11,S11) | F13: 102 | G13: 380 | I13: of:=IMREAL([.A13]) -> 102 | J13: of:=IMAGINARY([.A13]) -> 380 | K13: of:=ORG.LIBREOFFICE.ROUNDSIG([.F13];15)=ORG.LIBREOFFICE.ROUNDSIG([.I13];15) -> true | L13: of:=ORG.LIBREOFFICE.ROUNDSIG([.G13];15)=ORG.LIBREOFFICE.ROUNDSIG([.J13];15) -> true
A14: of:=IMPRODUCT([.R12];[.S12]) -> 138+396i | C14: of:=AND([.K14:.L14]) -> true | D14: of:=FORMULA([.A14]) -> =IMPRODUCT(R12,S12) | F14: 138 | G14: 396 | I14: of:=IMREAL([.A14]) -> 138 | J14: of:=IMAGINARY([.A14]) -> 396 | K14: of:=ORG.LIBREOFFICE.ROUNDSIG([.F14];15)=ORG.LIBREOFFICE.ROUNDSIG([.I14];15) -> true | L14: of:=ORG.LIBREOFFICE.ROUNDSIG([.G14];15)=ORG.LIBREOFFICE.ROUNDSIG([.J14];15) -> true
A15: of:=IMPRODUCT("3+4i";"5-3i") -> 27+11i | C15: of:=AND([.K15:.L15]) -> true | D15: of:=FORMULA([.A15]) -> =IMPRODUCT("3+4i","5-3i") | F15: 27 | G15: 11 | I15: of:=IMREAL([.A15]) -> 27 | J15: of:=IMAGINARY([.A15]) -> 11 | K15: of:=ORG.LIBREOFFICE.ROUNDSIG([.F15];15)=ORG.LIBREOFFICE.ROUNDSIG([.I15];15) -> true | L15: of:=ORG.LIBREOFFICE.ROUNDSIG([.G15];15)=ORG.LIBREOFFICE.ROUNDSIG([.J15];15) -> true
A16: of:=IMPRODUCT("1+2i";30) -> 30+60i | C16: of:=AND([.K16:.L16]) -> true | D16: of:=FORMULA([.A16]) -> =IMPRODUCT("1+2i",30) | F16: 30 | G16: 60 | I16: of:=IMREAL([.A16]) -> 30 | J16: of:=IMAGINARY([.A16]) -> 60 | K16: of:=ORG.LIBREOFFICE.ROUNDSIG([.F16];15)=ORG.LIBREOFFICE.ROUNDSIG([.I16];15) -> true | L16: of:=ORG.LIBREOFFICE.ROUNDSIG([.G16];15)=ORG.LIBREOFFICE.ROUNDSIG([.J16];15) -> true
A17: of:=IMPRODUCT([.R1:.S12]) -> 1,49931779297184e+29+1,11714179691012e+30i | C17: of:=AND([.K17:.L17]) -> true | D17: of:=FORMULA([.A17]) -> =IMPRODUCT(R1:S12) | F17: 1.49931779297184E+029 | G17: 1.11714179691012E+030 | I17: of:=IMREAL([.A17]) -> 1.49931779297184E+029 | J17: of:=IMAGINARY([.A17]) -> 1.11714179691012E+030 | K17: of:=ORG.LIBREOFFICE.ROUNDSIG([.F17];15)=ORG.LIBREOFFICE.ROUNDSIG([.I17];15) -> true | L17: of:=ORG.LIBREOFFICE.ROUNDSIG([.G17];15)=ORG.LIBREOFFICE.ROUNDSIG([.J17];15) -> true
A18: of:=IMPRODUCT([.R1:.T1]) -> -148+220i | C18: of:=AND([.K18:.L18]) -> true | D18: of:=FORMULA([.A18]) -> =IMPRODUCT(R1:T1) | F18: -148 | G18: 220 | I18: of:=IMREAL([.A18]) -> -148 | J18: of:=IMAGINARY([.A18]) -> 220 | K18: of:=ORG.LIBREOFFICE.ROUNDSIG([.F18];15)=ORG.LIBREOFFICE.ROUNDSIG([.I18];15) -> true | L18: of:=ORG.LIBREOFFICE.ROUNDSIG([.G18];15)=ORG.LIBREOFFICE.ROUNDSIG([.J18];15) -> true
A19: of:=IMPRODUCT([.R2:.T2]) -> -264+472i | C19: of:=AND([.K19:.L19]) -> true | D19: of:=FORMULA([.A19]) -> =IMPRODUCT(R2:T2) | F19: -264 | G19: 472 | I19: of:=IMREAL([.A19]) -> -264 | J19: of:=IMAGINARY([.A19]) -> 472 | K19: of:=ORG.LIBREOFFICE.ROUNDSIG([.F19];15)=ORG.LIBREOFFICE.ROUNDSIG([.I19];15) -> true | L19: of:=ORG.LIBREOFFICE.ROUNDSIG([.G19];15)=ORG.LIBREOFFICE.ROUNDSIG([.J19];15) -> true
A20: of:=IMPRODUCT([.R3:.T3]) -> -342+756i | C20: of:=AND([.K20:.L20]) -> true | D20: of:=FORMULA([.A20]) -> =IMPRODUCT(R3:T3) | F20: -342 | G20: 756 | I20: of:=IMREAL([.A20]) -> -342 | J20: of:=IMAGINARY([.A20]) -> 756 | K20: of:=ORG.LIBREOFFICE.ROUNDSIG([.F20];15)=ORG.LIBREOFFICE.ROUNDSIG([.I20];15) -> true | L20: of:=ORG.LIBREOFFICE.ROUNDSIG([.G20];15)=ORG.LIBREOFFICE.ROUNDSIG([.J20];15) -> true
A21: of:=IMPRODUCT([.R4:.T4]) -> -376+1072i | C21: of:=AND([.K21:.L21]) -> true | D21: of:=FORMULA([.A21]) -> =IMPRODUCT(R4:T4) | F21: -376 | G21: 1072 | I21: of:=IMREAL([.A21]) -> -376 | J21: of:=IMAGINARY([.A21]) -> 1072 | K21: of:=ORG.LIBREOFFICE.ROUNDSIG([.F21];15)=ORG.LIBREOFFICE.ROUNDSIG([.I21];15) -> true | L21: of:=ORG.LIBREOFFICE.ROUNDSIG([.G21];15)=ORG.LIBREOFFICE.ROUNDSIG([.J21];15) -> true
A22: of:=IMPRODUCT([.T1];[.T2];[.T3]) -> 6 | C22: of:=AND([.K22:.L22]) -> true | D22: of:=FORMULA([.A22]) -> =IMPRODUCT(T1,T2,T3) | F22: 6 | G22: 0 | I22: of:=IMREAL([.A22]) -> 6 | J22: of:=IMAGINARY([.A22]) -> 0 | K22: of:=ORG.LIBREOFFICE.ROUNDSIG([.F22];15)=ORG.LIBREOFFICE.ROUNDSIG([.I22];15) -> true | L22: of:=ORG.LIBREOFFICE.ROUNDSIG([.G22];15)=ORG.LIBREOFFICE.ROUNDSIG([.J22];15) -> true
A23: of:=IMPRODUCT([.T2];[.T3];[.T4];[.A2]) -> -195360-79488i | C23: of:=AND([.K23:.L23]) -> true | D23: of:=FORMULA([.A23]) -> =IMPRODUCT(T2,T3,T4,A2) | F23: -195360 | G23: -79488 | I23: of:=IMREAL([.A23]) -> -195360 | J23: of:=IMAGINARY([.A23]) -> -79488 | K23: of:=ORG.LIBREOFFICE.ROUNDSIG([.F23];15)=ORG.LIBREOFFICE.ROUNDSIG([.I23];15) -> true | L23: of:=ORG.LIBREOFFICE.ROUNDSIG([.G23];15)=ORG.LIBREOFFICE.ROUNDSIG([.J23];15) -> true
N61: 58
N62: 59
N63: 60
N64: 61
N65: 62
N66: 63
N67: 64
N68: 65
N69: 66
N70: 67
N71: 68
N72: 69
N73: 70
N74: 71
N75: 72
N76: 73
N77: 74
N78: 75
N79: 76
N80: 77
N81: 78
N82: 79
N83: 80
N84: 81
N85: 82
N86: 83
N87: 84
N88: 85
N89: 86
N90: 87
N91: 88
N92: 89
N93: 90
N94: 91
N95: 92
N96: 93
N97: 94
N98: 95
N99: 96
N100: 97
N101: 98
N102: 99
N103: 100
U551: 548
U552: 549
U553: 550
U554: 551
U555: 552
U556: 553
U557: 554
U558: 555
U559: 556
U560: 557
U561: 558
U562: 559
U563: 560
U564: 561
U565: 562
U566: 563
U567: 564
U568: 565
U569: 566
U570: 567
U571: 568
U572: 569
U573: 570
U574: 571
U575: 572
U576: 573
U577: 574
U578: 575
U579: 576
U580: 577
U581: 578
U582: 579
U583: 580
U584: 581
U585: 582
U586: 583
U587: 584
U588: 585
U589: 586
U590: 587
U591: 588
U592: 589
U593: 590
U594: 591
U595: 592
U596: 593
U597: 594
U598: 595
U599: 596