Sheet: Sheet1
A1: IMSECH Function
A3: Result | B3: of:=AND([.B8:.B95]) -> true
A7: Sheet | B7: Result | C7: Description
A8: 1 | B8: of:=AND([Sheet2.C2:.C840]) -> true | C8: Simple IMSECH formulas with local references and values

Sheet: Sheet2
A1: Function | B1: Expected | C1: Correct | D1: FunctionString | E1: Comment | N1: -5+12i
A2: of:=IMSECH("5+12j") -> 0.0113717647601419+0.00723019299882505j | C2: of:=AND([.K2:.L2]) -> true | D2: of:=FORMULA([.A2]) -> =IMSECH("5+12j") | F2: 0.0113717647601419 | G2: 0.00723019299882505 | I2: of:=IMREAL([.A2]) -> 0.0113717647601419 | J2: of:=IMAGINARY([.A2]) -> 0.00723019299882505 | K2: of:=ORG.LIBREOFFICE.ROUNDSIG([.F2];15)=ORG.LIBREOFFICE.ROUNDSIG([.I2];15) -> true | L2: of:=ORG.LIBREOFFICE.ROUNDSIG([.G2];15)=ORG.LIBREOFFICE.ROUNDSIG([.J2];15) -> true | N2: -4+12i
A3: of:=IMSECH(COMPLEX(0;5)) -> 3.52532008581609 | C3: of:=AND([.K3:.L3]) -> true | D3: of:=FORMULA([.A3]) -> =IMSECH(COMPLEX(0,5)) | F3: 3.52532008581609 | G3: 0 | I3: of:=IMREAL([.A3]) -> 3.52532008581609 | J3: of:=IMAGINARY([.A3]) -> 0 | K3: of:=ORG.LIBREOFFICE.ROUNDSIG([.F3];15)=ORG.LIBREOFFICE.ROUNDSIG([.I3];15) -> true | L3: of:=ORG.LIBREOFFICE.ROUNDSIG([.G3];15)=ORG.LIBREOFFICE.ROUNDSIG([.J3];15) -> true | N3: -3+12i
A4: of:=IMSECH("-5+12i") -> 0.0113717647601419-0.00723019299882505i | C4: of:=AND([.K4:.L4]) -> true | D4: of:=FORMULA([.A4]) -> =IMSECH("-5+12i") | F4: 0.0113717647601419 | G4: -0.00723019299882505 | I4: of:=IMREAL([.A4]) -> 0.0113717647601419 | J4: of:=IMAGINARY([.A4]) -> -0.00723019299882505 | K4: of:=ORG.LIBREOFFICE.ROUNDSIG([.F4];15)=ORG.LIBREOFFICE.ROUNDSIG([.I4];15) -> true | L4: of:=ORG.LIBREOFFICE.ROUNDSIG([.G4];15)=ORG.LIBREOFFICE.ROUNDSIG([.J4];15) -> true | N4: -2+12i
A5: of:=IMSECH([.N1]) -> 0.0113717647601419-0.00723019299882505i | C5: of:=AND([.K5:.L5]) -> true | D5: of:=FORMULA([.A5]) -> =IMSECH(N1) | F5: 0.0113717647601419 | G5: -0.00723019299882505 | I5: of:=IMREAL([.A5]) -> 0.0113717647601419 | J5: of:=IMAGINARY([.A5]) -> -0.00723019299882505 | K5: of:=ORG.LIBREOFFICE.ROUNDSIG([.F5];15)=ORG.LIBREOFFICE.ROUNDSIG([.I5];15) -> true | L5: of:=ORG.LIBREOFFICE.ROUNDSIG([.G5];15)=ORG.LIBREOFFICE.ROUNDSIG([.J5];15) -> true | N5: -1+12i
A6: of:=IMSECH([.N1:.N12]) -> 0.0113717647601419-0.00723019299882505i | C6: of:=AND([.K6:.L6]) -> true | D6: of:=FORMULA([.A6]) -> {=IMSECH(N1:N12)} | F6: 0.0113717647601419 | G6: -0.00723019299882505 | I6: of:=IMREAL([.A6]) -> 0.0113717647601419 | J6: of:=IMAGINARY([.A6]) -> -0.00723019299882505 | K6: of:=ORG.LIBREOFFICE.ROUNDSIG([.F6];15)=ORG.LIBREOFFICE.ROUNDSIG([.I6];15) -> true | L6: of:=ORG.LIBREOFFICE.ROUNDSIG([.G6];15)=ORG.LIBREOFFICE.ROUNDSIG([.J6];15) -> true | N6: 0+12i
A7: 0.0309130173129131-0.019643165464911i | C7: of:=AND([.K7:.L7]) -> true | D7: of:=FORMULA([.A7]) -> {=IMSECH(N1:N12)} | F7: 0.0309130173129131 | G7: -0.019643165464911 | I7: of:=IMREAL([.A7]) -> 0.0309130173129131 | J7: of:=IMAGINARY([.A7]) -> -0.019643165464911 | K7: of:=ORG.LIBREOFFICE.ROUNDSIG([.F7];15)=ORG.LIBREOFFICE.ROUNDSIG([.I7];15) -> true | L7: of:=ORG.LIBREOFFICE.ROUNDSIG([.G7];15)=ORG.LIBREOFFICE.ROUNDSIG([.J7];15) -> true | N7: 1+12i
A8: 0.0840570317615333-0.0531841822306235i | C8: of:=AND([.K8:.L8]) -> true | D8: of:=FORMULA([.A8]) -> {=IMSECH(N1:N12)} | F8: 0.0840570317615332 | G8: -0.0531841822306235 | I8: of:=IMREAL([.A8]) -> 0.0840570317615333 | J8: of:=IMAGINARY([.A8]) -> -0.0531841822306235 | K8: of:=ORG.LIBREOFFICE.ROUNDSIG([.F8];15)=ORG.LIBREOFFICE.ROUNDSIG([.I8];15) -> true | L8: of:=ORG.LIBREOFFICE.ROUNDSIG([.G8];15)=ORG.LIBREOFFICE.ROUNDSIG([.J8];15) -> true | N8: 2+12i
A9: 0.228955472418323-0.140346615592695i | C9: of:=AND([.K9:.L9]) -> true | D9: of:=FORMULA([.A9]) -> {=IMSECH(N1:N12)} | F9: 0.228955472418323 | G9: -0.140346615592695 | I9: of:=IMREAL([.A9]) -> 0.228955472418323 | J9: of:=IMAGINARY([.A9]) -> -0.140346615592695 | K9: of:=ORG.LIBREOFFICE.ROUNDSIG([.F9];15)=ORG.LIBREOFFICE.ROUNDSIG([.I9];15) -> true | L9: of:=ORG.LIBREOFFICE.ROUNDSIG([.G9];15)=ORG.LIBREOFFICE.ROUNDSIG([.J9];15) -> true | N9: 3+12i
A10: 0.622082253088115-0.301254034403057i | C10: of:=AND([.K10:.L10]) -> true | D10: of:=FORMULA([.A10]) -> {=IMSECH(N1:N12)} | F10: 0.622082253088115 | G10: -0.301254034403057 | I10: of:=IMREAL([.A10]) -> 0.622082253088115 | J10: of:=IMAGINARY([.A10]) -> -0.301254034403057 | K10: of:=ORG.LIBREOFFICE.ROUNDSIG([.F10];15)=ORG.LIBREOFFICE.ROUNDSIG([.I10];15) -> true | L10: of:=ORG.LIBREOFFICE.ROUNDSIG([.G10];15)=ORG.LIBREOFFICE.ROUNDSIG([.J10];15) -> true | N10: 4+12i
A11: 1.18503917609398 | C11: of:=AND([.K11:.L11]) -> true | D11: of:=FORMULA([.A11]) -> {=IMSECH(N1:N12)} | F11: 1.18503917609398 | G11: 0 | I11: of:=IMREAL([.A11]) -> 1.18503917609398 | J11: of:=IMAGINARY([.A11]) -> 0 | K11: of:=ORG.LIBREOFFICE.ROUNDSIG([.F11];15)=ORG.LIBREOFFICE.ROUNDSIG([.I11];15) -> true | L11: of:=ORG.LIBREOFFICE.ROUNDSIG([.G11];15)=ORG.LIBREOFFICE.ROUNDSIG([.J11];15) -> true | N11: 5+12i
A12: 0.622082253088115+0.301254034403057i | C12: of:=AND([.K12:.L12]) -> true | D12: of:=FORMULA([.A12]) -> {=IMSECH(N1:N12)} | F12: 0.622082253088115 | G12: 0.301254034403057 | I12: of:=IMREAL([.A12]) -> 0.622082253088115 | J12: of:=IMAGINARY([.A12]) -> 0.301254034403057 | K12: of:=ORG.LIBREOFFICE.ROUNDSIG([.F12];15)=ORG.LIBREOFFICE.ROUNDSIG([.I12];15) -> true | L12: of:=ORG.LIBREOFFICE.ROUNDSIG([.G12];15)=ORG.LIBREOFFICE.ROUNDSIG([.J12];15) -> true | N12: 6+12i
A13: 0.228955472418323+0.140346615592695i | C13: of:=AND([.K13:.L13]) -> true | D13: of:=FORMULA([.A13]) -> {=IMSECH(N1:N12)} | F13: 0.228955472418323 | G13: 0.140346615592695 | I13: of:=IMREAL([.A13]) -> 0.228955472418323 | J13: of:=IMAGINARY([.A13]) -> 0.140346615592695 | K13: of:=ORG.LIBREOFFICE.ROUNDSIG([.F13];15)=ORG.LIBREOFFICE.ROUNDSIG([.I13];15) -> true | L13: of:=ORG.LIBREOFFICE.ROUNDSIG([.G13];15)=ORG.LIBREOFFICE.ROUNDSIG([.J13];15) -> true
A14: 0.0840570317615333+0.0531841822306235i | C14: of:=AND([.K14:.L14]) -> true | D14: of:=FORMULA([.A14]) -> {=IMSECH(N1:N12)} | F14: 0.0840570317615332 | G14: 0.0531841822306235 | I14: of:=IMREAL([.A14]) -> 0.0840570317615333 | J14: of:=IMAGINARY([.A14]) -> 0.0531841822306235 | K14: of:=ORG.LIBREOFFICE.ROUNDSIG([.F14];15)=ORG.LIBREOFFICE.ROUNDSIG([.I14];15) -> true | L14: of:=ORG.LIBREOFFICE.ROUNDSIG([.G14];15)=ORG.LIBREOFFICE.ROUNDSIG([.J14];15) -> true
A15: 0.0309130173129131+0.019643165464911i | C15: of:=AND([.K15:.L15]) -> true | D15: of:=FORMULA([.A15]) -> {=IMSECH(N1:N12)} | F15: 0.0309130173129131 | G15: 0.019643165464911 | I15: of:=IMREAL([.A15]) -> 0.0309130173129131 | J15: of:=IMAGINARY([.A15]) -> 0.019643165464911 | K15: of:=ORG.LIBREOFFICE.ROUNDSIG([.F15];15)=ORG.LIBREOFFICE.ROUNDSIG([.I15];15) -> true | L15: of:=ORG.LIBREOFFICE.ROUNDSIG([.G15];15)=ORG.LIBREOFFICE.ROUNDSIG([.J15];15) -> true
A16: 0.0113717647601419+0.00723019299882505i | C16: of:=AND([.K16:.L16]) -> true | D16: of:=FORMULA([.A16]) -> {=IMSECH(N1:N12)} | F16: 0.0113717647601419 | G16: 0.00723019299882505 | I16: of:=IMREAL([.A16]) -> 0.0113717647601419 | J16: of:=IMAGINARY([.A16]) -> 0.00723019299882505 | K16: of:=ORG.LIBREOFFICE.ROUNDSIG([.F16];15)=ORG.LIBREOFFICE.ROUNDSIG([.I16];15) -> true | L16: of:=ORG.LIBREOFFICE.ROUNDSIG([.G16];15)=ORG.LIBREOFFICE.ROUNDSIG([.J16];15) -> true
A17: 0.00418341357158393+0.00266003236738094i | C17: of:=AND([.K17:.L17]) -> true | D17: of:=FORMULA([.A17]) -> {=IMSECH(N1:N12)} | F17: 0.00418341357158393 | G17: 0.00266003236738094 | I17: of:=IMREAL([.A17]) -> 0.00418341357158393 | J17: of:=IMAGINARY([.A17]) -> 0.00266003236738094 | K17: of:=ORG.LIBREOFFICE.ROUNDSIG([.F17];15)=ORG.LIBREOFFICE.ROUNDSIG([.I17];15) -> true | L17: of:=ORG.LIBREOFFICE.ROUNDSIG([.G17];15)=ORG.LIBREOFFICE.ROUNDSIG([.J17];15) -> true
A18: of:=IMSECH("0-j") -> 1.85081571768093 | C18: of:=AND([.K18:.L18]) -> true | D18: of:=FORMULA([.A18]) -> =IMSECH("0-j") | F18: 1.85081571768093 | G18: 0 | I18: of:=IMREAL([.A18]) -> 1.85081571768093 | J18: of:=IMAGINARY([.A18]) -> 0 | K18: of:=ORG.LIBREOFFICE.ROUNDSIG([.F18];15)=ORG.LIBREOFFICE.ROUNDSIG([.I18];15) -> true | L18: of:=ORG.LIBREOFFICE.ROUNDSIG([.G18];15)=ORG.LIBREOFFICE.ROUNDSIG([.J18];15) -> true
A19: of:=IMSECH(4) -> 0.0366189934736865 | C19: of:=AND([.K19:.L19]) -> true | D19: of:=FORMULA([.A19]) -> =IMSECH(4) | F19: 0.0366189934736865 | G19: 0 | I19: of:=IMREAL([.A19]) -> 0.0366189934736865 | J19: of:=IMAGINARY([.A19]) -> 0 | K19: of:=ORG.LIBREOFFICE.ROUNDSIG([.F19];15)=ORG.LIBREOFFICE.ROUNDSIG([.I19];15) -> true | L19: of:=ORG.LIBREOFFICE.ROUNDSIG([.G19];15)=ORG.LIBREOFFICE.ROUNDSIG([.J19];15) -> true
A20: of:=IMSECH("4+3i") -> -0.0362534969158689-0.00516434460775318i | C20: of:=AND([.K20:.L20]) -> true | D20: of:=FORMULA([.A20]) -> =IMSECH("4+3i") | F20: -0.0362534969158689 | G20: -0.00516434460775318 | I20: of:=IMREAL([.A20]) -> -0.0362534969158689 | J20: of:=IMAGINARY([.A20]) -> -0.00516434460775318 | K20: of:=ORG.LIBREOFFICE.ROUNDSIG([.F20];15)=ORG.LIBREOFFICE.ROUNDSIG([.I20];15) -> true | L20: of:=ORG.LIBREOFFICE.ROUNDSIG([.G20];15)=ORG.LIBREOFFICE.ROUNDSIG([.J20];15) -> true
N61: 58
N62: 59
N63: 60
N64: 61
N65: 62
N66: 63
N67: 64
N68: 65
N69: 66
N70: 67
N71: 68
N72: 69
N73: 70
N74: 71
N75: 72
N76: 73
N77: 74
N78: 75
N79: 76
N80: 77
N81: 78
N82: 79
N83: 80
N84: 81
N85: 82
N86: 83
N87: 84
N88: 85
N89: 86
N90: 87
N91: 88
N92: 89
N93: 90
N94: 91
N95: 92
N96: 93
N97: 94
N98: 95
N99: 96
N100: 97
N101: 98
N102: 99
N103: 100
U551: 548
U552: 549
U553: 550
U554: 551
U555: 552
U556: 553
U557: 554
U558: 555
U559: 556
U560: 557
U561: 558
U562: 559
U563: 560
U564: 561
U565: 562
U566: 563
U567: 564
U568: 565
U569: 566
U570: 567
U571: 568
U572: 569
U573: 570
U574: 571
U575: 572
U576: 573
U577: 574
U578: 575
U579: 576
U580: 577
U581: 578
U582: 579
U583: 580
U584: 581
U585: 582
U586: 583
U587: 584
U588: 585
U589: 586
U590: 587
U591: 588
U592: 589
U593: 590
U594: 591
U595: 592
U596: 593
U597: 594
U598: 595
U599: 596