Sheet: Sheet1
A1: FOURIER Function
A3: Result | B3: of:=AND([.B8:.B95]) -> true
A7: Sheet | B7: Result | C7: Description
A8: Sheet2 | B8: of:=AND([Sheet2.$N$2:.$S$56]) -> true | C8: FOURIER formulas for few even powers of 2 data length.
A9: Sheet3 | B9: of:=AND([Sheet3.$N$2:.$S$77]) -> true | C9: FOURIER formulas for few non powers of 2 data length.

Sheet: Sheet2
A1: xr[n] | B1: xi[n] | C1: Xr[k] | D1: Xi[k] | E1: Exr[k] | F1: Exi[k] | G1: Xm[k] | H1: Xp[k] | I1: Exm[k] | J1: Exp[k] | K1: xhr[n] | L1: xhi[n] | N1: CheckForwardFFTReal | O1: CheckForwardFFTImag | P1: CheckForwardFFTMag | Q1: CheckForwardFFTPhase | R1: CheckInverseReal | S1: CheckInverseImag | T1: EPS | U1: 0.0000000000001
A2: 128 | C2: of:=ORG.LIBREOFFICE.FOURIER([.A2];1) -> 128 | D2: 0 | E2: 128 | F2: 0 | G2: of:=ORG.LIBREOFFICE.FOURIER([.A2];1;;1) -> 128 | H2: 0 | I2: of:=SQRT([.C2]*[.C2]+[.D2]*[.D2]) -> 128 | J2: of:=ATAN2([.C2];[.D2]) -> 0 | K2: of:=ORG.LIBREOFFICE.FOURIER([.C2:.D2];1;1) -> 128 | L2: 0 | N2: of:=IF(ISBLANK([.$C2]); 1; ABS([.$C2]-[.$E2])<[.$U$1]) -> true | O2: of:=IF(ISBLANK([.$D2]); 1; ABS([.$D2]-[.$F2])<[.$U$1]) -> true | P2: of:=IF(ISBLANK([.$G2]); 1; ABS([.$G2]-[.$I2])<[.$U$1]) -> true | Q2: of:=IF(ISBLANK([.$H2]); 1; ABS([.$H2]-[.$J2])<[.$U$1]) -> true | R2: of:=IF(ISBLANK([.$K2]); 1; ABS([.$K2]-[.$A2])<[.$U$1]) -> true | S2: of:=IF(ISBLANK([.$L2]); 1; ABS([.$L2]-[.$B2])<[.$U$1]) -> true
N3: of:=IF(ISBLANK([.$C3]); 1; ABS([.$C3]-[.$E3])<[.$U$1]) -> true | O3: of:=IF(ISBLANK([.$D3]); 1; ABS([.$D3]-[.$F3])<[.$U$1]) -> true | P3: of:=IF(ISBLANK([.$G3]); 1; ABS([.$G3]-[.$I3])<[.$U$1]) -> true | Q3: of:=IF(ISBLANK([.$H3]); 1; ABS([.$H3]-[.$J3])<[.$U$1]) -> true | R3: of:=IF(ISBLANK([.$K3]); 1; ABS([.$K3]-[.$A3])<[.$U$1]) -> true | S3: of:=IF(ISBLANK([.$L3]); 1; ABS([.$L3]-[.$B3])<[.$U$1]) -> true
A4: 1 | C4: of:=ORG.LIBREOFFICE.FOURIER([.A4:.A5];1) -> 3 | D4: 0 | E4: 3 | F4: 0 | G4: of:=ORG.LIBREOFFICE.FOURIER([.A4:.A5];1;;1) -> 3 | H4: 0 | I4: of:=SQRT([.C4]*[.C4]+[.D4]*[.D4]) -> 3 | J4: of:=ATAN2([.C4];[.D4]) -> 0 | K4: of:=ORG.LIBREOFFICE.FOURIER([.C4:.D5];1;1) -> 1 | L4: 0 | N4: of:=IF(ISBLANK([.$C4]); 1; ABS([.$C4]-[.$E4])<[.$U$1]) -> true | O4: of:=IF(ISBLANK([.$D4]); 1; ABS([.$D4]-[.$F4])<[.$U$1]) -> true | P4: of:=IF(ISBLANK([.$G4]); 1; ABS([.$G4]-[.$I4])<[.$U$1]) -> true | Q4: of:=IF(ISBLANK([.$H4]); 1; ABS([.$H4]-[.$J4])<[.$U$1]) -> true | R4: of:=IF(ISBLANK([.$K4]); 1; ABS([.$K4]-[.$A4])<[.$U$1]) -> true | S4: of:=IF(ISBLANK([.$L4]); 1; ABS([.$L4]-[.$B4])<[.$U$1]) -> true
A5: 2 | C5: -1 | D5: 0 | E5: -1 | F5: 0 | G5: 1 | H5: 3.14159265358979 | I5: of:=SQRT([.C5]*[.C5]+[.D5]*[.D5]) -> 1 | J5: of:=ATAN2([.C5];[.D5]) -> 3.14159265358979 | K5: 2 | L5: 0 | N5: of:=IF(ISBLANK([.$C5]); 1; ABS([.$C5]-[.$E5])<[.$U$1]) -> true | O5: of:=IF(ISBLANK([.$D5]); 1; ABS([.$D5]-[.$F5])<[.$U$1]) -> true | P5: of:=IF(ISBLANK([.$G5]); 1; ABS([.$G5]-[.$I5])<[.$U$1]) -> true | Q5: of:=IF(ISBLANK([.$H5]); 1; ABS([.$H5]-[.$J5])<[.$U$1]) -> true | R5: of:=IF(ISBLANK([.$K5]); 1; ABS([.$K5]-[.$A5])<[.$U$1]) -> true | S5: of:=IF(ISBLANK([.$L5]); 1; ABS([.$L5]-[.$B5])<[.$U$1]) -> true
N6: of:=IF(ISBLANK([.$C6]); 1; ABS([.$C6]-[.$E6])<[.$U$1]) -> true | O6: of:=IF(ISBLANK([.$D6]); 1; ABS([.$D6]-[.$F6])<[.$U$1]) -> true | P6: of:=IF(ISBLANK([.$G6]); 1; ABS([.$G6]-[.$I6])<[.$U$1]) -> true | Q6: of:=IF(ISBLANK([.$H6]); 1; ABS([.$H6]-[.$J6])<[.$U$1]) -> true | R6: of:=IF(ISBLANK([.$K6]); 1; ABS([.$K6]-[.$A6])<[.$U$1]) -> true | S6: of:=IF(ISBLANK([.$L6]); 1; ABS([.$L6]-[.$B6])<[.$U$1]) -> true
A7: 1 | C7: of:=ORG.LIBREOFFICE.FOURIER([.A7:.A10];1) -> 10 | D7: 0 | E7: 10 | F7: 0 | G7: of:=ORG.LIBREOFFICE.FOURIER([.A7:.A10];1;;1) -> 10 | H7: 0 | I7: of:=SQRT([.C7]*[.C7]+[.D7]*[.D7]) -> 10 | J7: of:=ATAN2([.C7];[.D7]) -> 0 | K7: of:=ORG.LIBREOFFICE.FOURIER([.C7:.D10];1;1) -> 1 | L7: 0 | N7: of:=IF(ISBLANK([.$C7]); 1; ABS([.$C7]-[.$E7])<[.$U$1]) -> true | O7: of:=IF(ISBLANK([.$D7]); 1; ABS([.$D7]-[.$F7])<[.$U$1]) -> true | P7: of:=IF(ISBLANK([.$G7]); 1; ABS([.$G7]-[.$I7])<[.$U$1]) -> true | Q7: of:=IF(ISBLANK([.$H7]); 1; ABS([.$H7]-[.$J7])<[.$U$1]) -> true | R7: of:=IF(ISBLANK([.$K7]); 1; ABS([.$K7]-[.$A7])<[.$U$1]) -> true | S7: of:=IF(ISBLANK([.$L7]); 1; ABS([.$L7]-[.$B7])<[.$U$1]) -> true
A8: 2 | C8: -2 | D8: 2 | E8: -2 | F8: 2 | G8: 2.82842712474619 | H8: 2.35619449019234 | I8: of:=SQRT([.C8]*[.C8]+[.D8]*[.D8]) -> 2.82842712474619 | J8: of:=ATAN2([.C8];[.D8]) -> 2.35619449019234 | K8: 2 | L8: 0 | N8: of:=IF(ISBLANK([.$C8]); 1; ABS([.$C8]-[.$E8])<[.$U$1]) -> true | O8: of:=IF(ISBLANK([.$D8]); 1; ABS([.$D8]-[.$F8])<[.$U$1]) -> true | P8: of:=IF(ISBLANK([.$G8]); 1; ABS([.$G8]-[.$I8])<[.$U$1]) -> true | Q8: of:=IF(ISBLANK([.$H8]); 1; ABS([.$H8]-[.$J8])<[.$U$1]) -> true | R8: of:=IF(ISBLANK([.$K8]); 1; ABS([.$K8]-[.$A8])<[.$U$1]) -> true | S8: of:=IF(ISBLANK([.$L8]); 1; ABS([.$L8]-[.$B8])<[.$U$1]) -> true
A9: 3 | C9: -2 | D9: 0 | E9: -2 | F9: 0 | G9: 2 | H9: 3.14159265358979 | I9: of:=SQRT([.C9]*[.C9]+[.D9]*[.D9]) -> 2 | J9: of:=ATAN2([.C9];[.D9]) -> 3.14159265358979 | K9: 3 | L9: 0 | N9: of:=IF(ISBLANK([.$C9]); 1; ABS([.$C9]-[.$E9])<[.$U$1]) -> true | O9: of:=IF(ISBLANK([.$D9]); 1; ABS([.$D9]-[.$F9])<[.$U$1]) -> true | P9: of:=IF(ISBLANK([.$G9]); 1; ABS([.$G9]-[.$I9])<[.$U$1]) -> true | Q9: of:=IF(ISBLANK([.$H9]); 1; ABS([.$H9]-[.$J9])<[.$U$1]) -> true | R9: of:=IF(ISBLANK([.$K9]); 1; ABS([.$K9]-[.$A9])<[.$U$1]) -> true | S9: of:=IF(ISBLANK([.$L9]); 1; ABS([.$L9]-[.$B9])<[.$U$1]) -> true
A10: 4 | C10: -2 | D10: -2 | E10: -2 | F10: -2 | G10: 2.82842712474619 | H10: -2.35619449019234 | I10: of:=SQRT([.C10]*[.C10]+[.D10]*[.D10]) -> 2.82842712474619 | J10: of:=ATAN2([.C10];[.D10]) -> -2.35619449019234 | K10: 4 | L10: 0 | N10: of:=IF(ISBLANK([.$C10]); 1; ABS([.$C10]-[.$E10])<[.$U$1]) -> true | O10: of:=IF(ISBLANK([.$D10]); 1; ABS([.$D10]-[.$F10])<[.$U$1]) -> true | P10: of:=IF(ISBLANK([.$G10]); 1; ABS([.$G10]-[.$I10])<[.$U$1]) -> true | Q10: of:=IF(ISBLANK([.$H10]); 1; ABS([.$H10]-[.$J10])<[.$U$1]) -> true | R10: of:=IF(ISBLANK([.$K10]); 1; ABS([.$K10]-[.$A10])<[.$U$1]) -> true | S10: of:=IF(ISBLANK([.$L10]); 1; ABS([.$L10]-[.$B10])<[.$U$1]) -> true
N11: of:=IF(ISBLANK([.$C11]); 1; ABS([.$C11]-[.$E11])<[.$U$1]) -> true | O11: of:=IF(ISBLANK([.$D11]); 1; ABS([.$D11]-[.$F11])<[.$U$1]) -> true | P11: of:=IF(ISBLANK([.$G11]); 1; ABS([.$G11]-[.$I11])<[.$U$1]) -> true | Q11: of:=IF(ISBLANK([.$H11]); 1; ABS([.$H11]-[.$J11])<[.$U$1]) -> true | R11: of:=IF(ISBLANK([.$K11]); 1; ABS([.$K11]-[.$A11])<[.$U$1]) -> true | S11: of:=IF(ISBLANK([.$L11]); 1; ABS([.$L11]-[.$B11])<[.$U$1]) -> true
A12: 1 | C12: of:=ORG.LIBREOFFICE.FOURIER([.A12:.A19];1) -> 36 | D12: -1.22464679914735E-015 | E12: 36 | F12: 0 | G12: of:=ORG.LIBREOFFICE.FOURIER([.A12:.A19];1;;1) -> 36 | H12: -3.4017966642982E-017 | I12: of:=SQRT([.C12]*[.C12]+[.D12]*[.D12]) -> 36 | J12: of:=ATAN2([.C12];[.D12]) -> -3.4017966642982E-017 | K12: of:=ORG.LIBREOFFICE.FOURIER([.C12:.D19];1;1) -> 1 | L12: -4.59242549680257E-016 | N12: of:=IF(ISBLANK([.$C12]); 1; ABS([.$C12]-[.$E12])<[.$U$1]) -> true | O12: of:=IF(ISBLANK([.$D12]); 1; ABS([.$D12]-[.$F12])<[.$U$1]) -> true | P12: of:=IF(ISBLANK([.$G12]); 1; ABS([.$G12]-[.$I12])<[.$U$1]) -> true | Q12: of:=IF(ISBLANK([.$H12]); 1; ABS([.$H12]-[.$J12])<[.$U$1]) -> true | R12: of:=IF(ISBLANK([.$K12]); 1; ABS([.$K12]-[.$A12])<[.$U$1]) -> true | S12: of:=IF(ISBLANK([.$L12]); 1; ABS([.$L12]-[.$B12])<[.$U$1]) -> true
A13: 2 | C13: -4 | D13: 9.65685424949238 | E13: -4 | F13: 9.65685424949238 | G13: 10.452503719011 | H13: 1.96349540849362 | I13: of:=SQRT([.C13]*[.C13]+[.D13]*[.D13]) -> 10.452503719011 | J13: of:=ATAN2([.C13];[.D13]) -> 1.96349540849362 | K13: 2 | L13: 0 | N13: of:=IF(ISBLANK([.$C13]); 1; ABS([.$C13]-[.$E13])<[.$U$1]) -> true | O13: of:=IF(ISBLANK([.$D13]); 1; ABS([.$D13]-[.$F13])<[.$U$1]) -> true | P13: of:=IF(ISBLANK([.$G13]); 1; ABS([.$G13]-[.$I13])<[.$U$1]) -> true | Q13: of:=IF(ISBLANK([.$H13]); 1; ABS([.$H13]-[.$J13])<[.$U$1]) -> true | R13: of:=IF(ISBLANK([.$K13]); 1; ABS([.$K13]-[.$A13])<[.$U$1]) -> true | S13: of:=IF(ISBLANK([.$L13]); 1; ABS([.$L13]-[.$B13])<[.$U$1]) -> true
A14: 3 | C14: -4 | D14: 4 | E14: -4 | F14: 4 | G14: 5.65685424949238 | H14: 2.35619449019234 | I14: of:=SQRT([.C14]*[.C14]+[.D14]*[.D14]) -> 5.65685424949238 | J14: of:=ATAN2([.C14];[.D14]) -> 2.35619449019234 | K14: 3 | L14: -1.416384724412E-016 | N14: of:=IF(ISBLANK([.$C14]); 1; ABS([.$C14]-[.$E14])<[.$U$1]) -> true | O14: of:=IF(ISBLANK([.$D14]); 1; ABS([.$D14]-[.$F14])<[.$U$1]) -> true | P14: of:=IF(ISBLANK([.$G14]); 1; ABS([.$G14]-[.$I14])<[.$U$1]) -> true | Q14: of:=IF(ISBLANK([.$H14]); 1; ABS([.$H14]-[.$J14])<[.$U$1]) -> true | R14: of:=IF(ISBLANK([.$K14]); 1; ABS([.$K14]-[.$A14])<[.$U$1]) -> true | S14: of:=IF(ISBLANK([.$L14]); 1; ABS([.$L14]-[.$B14])<[.$U$1]) -> true
A15: 4 | C15: -4 | D15: 1.65685424949238 | E15: -4 | F15: 1.65685424949238 | G15: 4.32956880116958 | H15: 2.74889357189107 | I15: of:=SQRT([.C15]*[.C15]+[.D15]*[.D15]) -> 4.32956880116958 | J15: of:=ATAN2([.C15];[.D15]) -> 2.74889357189107 | K15: 4 | L15: -2.22044604925031E-016 | N15: of:=IF(ISBLANK([.$C15]); 1; ABS([.$C15]-[.$E15])<[.$U$1]) -> true | O15: of:=IF(ISBLANK([.$D15]); 1; ABS([.$D15]-[.$F15])<[.$U$1]) -> true | P15: of:=IF(ISBLANK([.$G15]); 1; ABS([.$G15]-[.$I15])<[.$U$1]) -> true | Q15: of:=IF(ISBLANK([.$H15]); 1; ABS([.$H15]-[.$J15])<[.$U$1]) -> true | R15: of:=IF(ISBLANK([.$K15]); 1; ABS([.$K15]-[.$A15])<[.$U$1]) -> true | S15: of:=IF(ISBLANK([.$L15]); 1; ABS([.$L15]-[.$B15])<[.$U$1]) -> true
A16: 5 | C16: -4 | D16: 0 | E16: -4 | F16: 0 | G16: 4 | H16: 3.14159265358979 | I16: of:=SQRT([.C16]*[.C16]+[.D16]*[.D16]) -> 4 | J16: of:=ATAN2([.C16];[.D16]) -> 3.14159265358979 | K16: 5 | L16: -3.36777869765522E-016 | N16: of:=IF(ISBLANK([.$C16]); 1; ABS([.$C16]-[.$E16])<[.$U$1]) -> true | O16: of:=IF(ISBLANK([.$D16]); 1; ABS([.$D16]-[.$F16])<[.$U$1]) -> true | P16: of:=IF(ISBLANK([.$G16]); 1; ABS([.$G16]-[.$I16])<[.$U$1]) -> true | Q16: of:=IF(ISBLANK([.$H16]); 1; ABS([.$H16]-[.$J16])<[.$U$1]) -> true | R16: of:=IF(ISBLANK([.$K16]); 1; ABS([.$K16]-[.$A16])<[.$U$1]) -> true | S16: of:=IF(ISBLANK([.$L16]); 1; ABS([.$L16]-[.$B16])<[.$U$1]) -> true
A17: 6 | C17: -4 | D17: -1.65685424949238 | E17: -4 | F17: -1.65685424949238 | G17: 4.32956880116958 | H17: -2.74889357189107 | I17: of:=SQRT([.C17]*[.C17]+[.D17]*[.D17]) -> 4.32956880116958 | J17: of:=ATAN2([.C17];[.D17]) -> -2.74889357189107 | K17: 6 | L17: 0 | N17: of:=IF(ISBLANK([.$C17]); 1; ABS([.$C17]-[.$E17])<[.$U$1]) -> true | O17: of:=IF(ISBLANK([.$D17]); 1; ABS([.$D17]-[.$F17])<[.$U$1]) -> true | P17: of:=IF(ISBLANK([.$G17]); 1; ABS([.$G17]-[.$I17])<[.$U$1]) -> true | Q17: of:=IF(ISBLANK([.$H17]); 1; ABS([.$H17]-[.$J17])<[.$U$1]) -> true | R17: of:=IF(ISBLANK([.$K17]); 1; ABS([.$K17]-[.$A17])<[.$U$1]) -> true | S17: of:=IF(ISBLANK([.$L17]); 1; ABS([.$L17]-[.$B17])<[.$U$1]) -> true
A18: 7 | C18: -4 | D18: -4 | E18: -4 | F18: -4 | G18: 5.65685424949238 | H18: -2.35619449019234 | I18: of:=SQRT([.C18]*[.C18]+[.D18]*[.D18]) -> 5.65685424949238 | J18: of:=ATAN2([.C18];[.D18]) -> -2.35619449019234 | K18: 7 | L18: -2.86987907260374E-016 | N18: of:=IF(ISBLANK([.$C18]); 1; ABS([.$C18]-[.$E18])<[.$U$1]) -> true | O18: of:=IF(ISBLANK([.$D18]); 1; ABS([.$D18]-[.$F18])<[.$U$1]) -> true | P18: of:=IF(ISBLANK([.$G18]); 1; ABS([.$G18]-[.$I18])<[.$U$1]) -> true | Q18: of:=IF(ISBLANK([.$H18]); 1; ABS([.$H18]-[.$J18])<[.$U$1]) -> true | R18: of:=IF(ISBLANK([.$K18]); 1; ABS([.$K18]-[.$A18])<[.$U$1]) -> true | S18: of:=IF(ISBLANK([.$L18]); 1; ABS([.$L18]-[.$B18])<[.$U$1]) -> true
A19: 8 | C19: -4 | D19: -9.65685424949238 | E19: -4 | F19: -9.65685424949238 | G19: 10.452503719011 | H19: -1.96349540849362 | I19: of:=SQRT([.C19]*[.C19]+[.D19]*[.D19]) -> 10.452503719011 | J19: of:=ATAN2([.C19];[.D19]) -> -1.96349540849362 | K19: 8 | L19: -2.22044604925031E-016 | N19: of:=IF(ISBLANK([.$C19]); 1; ABS([.$C19]-[.$E19])<[.$U$1]) -> true | O19: of:=IF(ISBLANK([.$D19]); 1; ABS([.$D19]-[.$F19])<[.$U$1]) -> true | P19: of:=IF(ISBLANK([.$G19]); 1; ABS([.$G19]-[.$I19])<[.$U$1]) -> true | Q19: of:=IF(ISBLANK([.$H19]); 1; ABS([.$H19]-[.$J19])<[.$U$1]) -> true | R19: of:=IF(ISBLANK([.$K19]); 1; ABS([.$K19]-[.$A19])<[.$U$1]) -> true | S19: of:=IF(ISBLANK([.$L19]); 1; ABS([.$L19]-[.$B19])<[.$U$1]) -> true
N20: of:=IF(ISBLANK([.$C20]); 1; ABS([.$C20]-[.$E20])<[.$U$1]) -> true | O20: of:=IF(ISBLANK([.$D20]); 1; ABS([.$D20]-[.$F20])<[.$U$1]) -> true | P20: of:=IF(ISBLANK([.$G20]); 1; ABS([.$G20]-[.$I20])<[.$U$1]) -> true | Q20: of:=IF(ISBLANK([.$H20]); 1; ABS([.$H20]-[.$J20])<[.$U$1]) -> true | R20: of:=IF(ISBLANK([.$K20]); 1; ABS([.$K20]-[.$A20])<[.$U$1]) -> true | S20: of:=IF(ISBLANK([.$L20]); 1; ABS([.$L20]-[.$B20])<[.$U$1]) -> true
A21: 1 | B21: 32 | C21: of:=ORG.LIBREOFFICE.FOURIER([.A21:.B52];1) -> 528 | D21: 528 | E21: 528 | F21: 528 | G21: of:=ORG.LIBREOFFICE.FOURIER([.A21:.B52];1;;1) -> 746.704760932994 | H21: 0.785398163397448 | I21: of:=SQRT([.C21]*[.C21]+[.D21]*[.D21]) -> 746.704760932994 | J21: of:=ATAN2([.C21];[.D21]) -> 0.785398163397448 | K21: of:=ORG.LIBREOFFICE.FOURIER([.C21:.D52];1;1) -> 1 | L21: 32 | N21: of:=IF(ISBLANK([.$C21]); 1; ABS([.$C21]-[.$E21])<[.$U$1]) -> true | O21: of:=IF(ISBLANK([.$D21]); 1; ABS([.$D21]-[.$F21])<[.$U$1]) -> true | P21: of:=IF(ISBLANK([.$G21]); 1; ABS([.$G21]-[.$I21])<[.$U$1]) -> true | Q21: of:=IF(ISBLANK([.$H21]); 1; ABS([.$H21]-[.$J21])<[.$U$1]) -> true | R21: of:=IF(ISBLANK([.$K21]); 1; ABS([.$K21]-[.$A21])<[.$U$1]) -> true | S21: of:=IF(ISBLANK([.$L21]); 1; ABS([.$L21]-[.$B21])<[.$U$1]) -> true
A22: 2 | B22: 31 | C22: 146.450726201742 | D22: 178.450726201742 | E22: 146.450726201742 | F22: 178.450726201742 | G22: 230.851633927392 | H22: 0.883572933822129 | I22: of:=SQRT([.C22]*[.C22]+[.D22]*[.D22]) -> 230.851633927392 | J22: of:=ATAN2([.C22];[.D22]) -> 0.883572933822129 | K22: 2 | L22: 31 | N22: of:=IF(ISBLANK([.$C22]); 1; ABS([.$C22]-[.$E22])<[.$U$1]) -> true | O22: of:=IF(ISBLANK([.$D22]); 1; ABS([.$D22]-[.$F22])<[.$U$1]) -> true | P22: of:=IF(ISBLANK([.$G22]); 1; ABS([.$G22]-[.$I22])<[.$U$1]) -> true | Q22: of:=IF(ISBLANK([.$H22]); 1; ABS([.$H22]-[.$J22])<[.$U$1]) -> true | R22: of:=IF(ISBLANK([.$K22]); 1; ABS([.$K22]-[.$A22])<[.$U$1]) -> true | S22: of:=IF(ISBLANK([.$L22]); 1; ABS([.$L22]-[.$B22])<[.$U$1]) -> true
A23: 3 | B23: 30 | C23: 64.4374318740136 | D23: 96.4374318740136 | E23: 64.4374318740136 | F23: 96.4374318740136 | G23: 115.98431313317 | H23: 0.98174770424681 | I23: of:=SQRT([.C23]*[.C23]+[.D23]*[.D23]) -> 115.98431313317 | J23: of:=ATAN2([.C23];[.D23]) -> 0.98174770424681 | K23: 3 | L23: 30 | N23: of:=IF(ISBLANK([.$C23]); 1; ABS([.$C23]-[.$E23])<[.$U$1]) -> true | O23: of:=IF(ISBLANK([.$D23]); 1; ABS([.$D23]-[.$F23])<[.$U$1]) -> true | P23: of:=IF(ISBLANK([.$G23]); 1; ABS([.$G23]-[.$I23])<[.$U$1]) -> true | Q23: of:=IF(ISBLANK([.$H23]); 1; ABS([.$H23]-[.$J23])<[.$U$1]) -> true | R23: of:=IF(ISBLANK([.$K23]); 1; ABS([.$K23]-[.$A23])<[.$U$1]) -> true | S23: of:=IF(ISBLANK([.$L23]); 1; ABS([.$L23]-[.$B23])<[.$U$1]) -> true
A24: 4 | B24: 29 | C24: 36.7449313430131 | D24: 68.7449313430131 | E24: 36.7449313430131 | F24: 68.7449313430131 | G24: 77.9490574975627 | H24: 1.07992247467149 | I24: of:=SQRT([.C24]*[.C24]+[.D24]*[.D24]) -> 77.9490574975627 | J24: of:=ATAN2([.C24];[.D24]) -> 1.07992247467149 | K24: 4 | L24: 29 | N24: of:=IF(ISBLANK([.$C24]); 1; ABS([.$C24]-[.$E24])<[.$U$1]) -> true | O24: of:=IF(ISBLANK([.$D24]); 1; ABS([.$D24]-[.$F24])<[.$U$1]) -> true | P24: of:=IF(ISBLANK([.$G24]); 1; ABS([.$G24]-[.$I24])<[.$U$1]) -> true | Q24: of:=IF(ISBLANK([.$H24]); 1; ABS([.$H24]-[.$J24])<[.$U$1]) -> true | R24: of:=IF(ISBLANK([.$K24]); 1; ABS([.$K24]-[.$A24])<[.$U$1]) -> true | S24: of:=IF(ISBLANK([.$L24]); 1; ABS([.$L24]-[.$B24])<[.$U$1]) -> true
A25: 5 | B25: 28 | C25: 22.6274169979695 | D25: 54.6274169979695 | E25: 22.6274169979695 | F25: 54.6274169979695 | G25: 59.1282900807223 | H25: 1.17809724509617 | I25: of:=SQRT([.C25]*[.C25]+[.D25]*[.D25]) -> 59.1282900807223 | J25: of:=ATAN2([.C25];[.D25]) -> 1.17809724509617 | K25: 5 | L25: 28 | N25: of:=IF(ISBLANK([.$C25]); 1; ABS([.$C25]-[.$E25])<[.$U$1]) -> true | O25: of:=IF(ISBLANK([.$D25]); 1; ABS([.$D25]-[.$F25])<[.$U$1]) -> true | P25: of:=IF(ISBLANK([.$G25]); 1; ABS([.$G25]-[.$I25])<[.$U$1]) -> true | Q25: of:=IF(ISBLANK([.$H25]); 1; ABS([.$H25]-[.$J25])<[.$U$1]) -> true | R25: of:=IF(ISBLANK([.$K25]); 1; ABS([.$K25]-[.$A25])<[.$U$1]) -> true | S25: of:=IF(ISBLANK([.$L25]); 1; ABS([.$L25]-[.$B25])<[.$U$1]) -> true
A26: 6 | B26: 27 | C26: 13.9338945886302 | D26: 45.9338945886302 | E26: 13.9338945886302 | F26: 45.9338945886302 | G26: 48.0007926026899 | H26: 1.27627201552085 | I26: of:=SQRT([.C26]*[.C26]+[.D26]*[.D26]) -> 48.0007926026899 | J26: of:=ATAN2([.C26];[.D26]) -> 1.27627201552085 | K26: 6 | L26: 27 | N26: of:=IF(ISBLANK([.$C26]); 1; ABS([.$C26]-[.$E26])<[.$U$1]) -> true | O26: of:=IF(ISBLANK([.$D26]); 1; ABS([.$D26]-[.$F26])<[.$U$1]) -> true | P26: of:=IF(ISBLANK([.$G26]); 1; ABS([.$G26]-[.$I26])<[.$U$1]) -> true | Q26: of:=IF(ISBLANK([.$H26]); 1; ABS([.$H26]-[.$J26])<[.$U$1]) -> true | R26: of:=IF(ISBLANK([.$K26]); 1; ABS([.$K26]-[.$A26])<[.$U$1]) -> true | S26: of:=IF(ISBLANK([.$L26]); 1; ABS([.$L26]-[.$B26])<[.$U$1]) -> true
A27: 7 | B27: 26 | C27: 7.94569220264782 | D27: 39.9456922026478 | E27: 7.94569220264782 | F27: 39.9456922026478 | G27: 40.7282745783307 | H27: 1.37444678594553 | I27: of:=SQRT([.C27]*[.C27]+[.D27]*[.D27]) -> 40.7282745783307 | J27: of:=ATAN2([.C27];[.D27]) -> 1.37444678594553 | K27: 7 | L27: 26 | N27: of:=IF(ISBLANK([.$C27]); 1; ABS([.$C27]-[.$E27])<[.$U$1]) -> true | O27: of:=IF(ISBLANK([.$D27]); 1; ABS([.$D27]-[.$F27])<[.$U$1]) -> true | P27: of:=IF(ISBLANK([.$G27]); 1; ABS([.$G27]-[.$I27])<[.$U$1]) -> true | Q27: of:=IF(ISBLANK([.$H27]); 1; ABS([.$H27]-[.$J27])<[.$U$1]) -> true | R27: of:=IF(ISBLANK([.$K27]); 1; ABS([.$K27]-[.$A27])<[.$U$1]) -> true | S27: of:=IF(ISBLANK([.$L27]); 1; ABS([.$L27]-[.$B27])<[.$U$1]) -> true
A28: 8 | B28: 25 | C28: 3.49605640940763 | D28: 35.4960564094076 | E28: 3.49605640940763 | F28: 35.4960564094076 | G28: 35.6678066474182 | H28: 1.47262155637022 | I28: of:=SQRT([.C28]*[.C28]+[.D28]*[.D28]) -> 35.6678066474182 | J28: of:=ATAN2([.C28];[.D28]) -> 1.47262155637022 | K28: 8 | L28: 25 | N28: of:=IF(ISBLANK([.$C28]); 1; ABS([.$C28]-[.$E28])<[.$U$1]) -> true | O28: of:=IF(ISBLANK([.$D28]); 1; ABS([.$D28]-[.$F28])<[.$U$1]) -> true | P28: of:=IF(ISBLANK([.$G28]); 1; ABS([.$G28]-[.$I28])<[.$U$1]) -> true | Q28: of:=IF(ISBLANK([.$H28]); 1; ABS([.$H28]-[.$J28])<[.$U$1]) -> true | R28: of:=IF(ISBLANK([.$K28]); 1; ABS([.$K28]-[.$A28])<[.$U$1]) -> true | S28: of:=IF(ISBLANK([.$L28]); 1; ABS([.$L28]-[.$B28])<[.$U$1]) -> true
A29: 9 | B29: 24 | C29: -3.5527136788005E-015 | D29: 32 | E29: 0 | F29: 32 | G29: 32 | H29: 1.5707963267949 | I29: of:=SQRT([.C29]*[.C29]+[.D29]*[.D29]) -> 32 | J29: of:=ATAN2([.C29];[.D29]) -> 1.5707963267949 | K29: 9 | L29: 24 | N29: of:=IF(ISBLANK([.$C29]); 1; ABS([.$C29]-[.$E29])<[.$U$1]) -> true | O29: of:=IF(ISBLANK([.$D29]); 1; ABS([.$D29]-[.$F29])<[.$U$1]) -> true | P29: of:=IF(ISBLANK([.$G29]); 1; ABS([.$G29]-[.$I29])<[.$U$1]) -> true | Q29: of:=IF(ISBLANK([.$H29]); 1; ABS([.$H29]-[.$J29])<[.$U$1]) -> true | R29: of:=IF(ISBLANK([.$K29]); 1; ABS([.$K29]-[.$A29])<[.$U$1]) -> true | S29: of:=IF(ISBLANK([.$L29]); 1; ABS([.$L29]-[.$B29])<[.$U$1]) -> true
A30: 10 | B30: 23 | C30: -2.86913934674144 | D30: 29.1308606532586 | E30: -2.86913934674144 | F30: 29.1308606532586 | G30: 29.2718124309136 | H30: 1.66897109721958 | I30: of:=SQRT([.C30]*[.C30]+[.D30]*[.D30]) -> 29.2718124309136 | J30: of:=ATAN2([.C30];[.D30]) -> 1.66897109721958 | K30: 10 | L30: 23 | N30: of:=IF(ISBLANK([.$C30]); 1; ABS([.$C30]-[.$E30])<[.$U$1]) -> true | O30: of:=IF(ISBLANK([.$D30]); 1; ABS([.$D30]-[.$F30])<[.$U$1]) -> true | P30: of:=IF(ISBLANK([.$G30]); 1; ABS([.$G30]-[.$I30])<[.$U$1]) -> true | Q30: of:=IF(ISBLANK([.$H30]); 1; ABS([.$H30]-[.$J30])<[.$U$1]) -> true | R30: of:=IF(ISBLANK([.$K30]); 1; ABS([.$K30]-[.$A30])<[.$U$1]) -> true | S30: of:=IF(ISBLANK([.$L30]); 1; ABS([.$L30]-[.$B30])<[.$U$1]) -> true
A31: 11 | B31: 22 | C31: -5.30914179329122 | D31: 26.6908582067088 | E31: -5.30914179329122 | F31: 26.6908582067088 | G31: 27.2137630325522 | H31: 1.76714586764426 | I31: of:=SQRT([.C31]*[.C31]+[.D31]*[.D31]) -> 27.2137630325522 | J31: of:=ATAN2([.C31];[.D31]) -> 1.76714586764426 | K31: 11 | L31: 22 | N31: of:=IF(ISBLANK([.$C31]); 1; ABS([.$C31]-[.$E31])<[.$U$1]) -> true | O31: of:=IF(ISBLANK([.$D31]); 1; ABS([.$D31]-[.$F31])<[.$U$1]) -> true | P31: of:=IF(ISBLANK([.$G31]); 1; ABS([.$G31]-[.$I31])<[.$U$1]) -> true | Q31: of:=IF(ISBLANK([.$H31]); 1; ABS([.$H31]-[.$J31])<[.$U$1]) -> true | R31: of:=IF(ISBLANK([.$K31]); 1; ABS([.$K31]-[.$A31])<[.$U$1]) -> true | S31: of:=IF(ISBLANK([.$L31]); 1; ABS([.$L31]-[.$B31])<[.$U$1]) -> true
A32: 12 | B32: 21 | C32: -7.44782182478733 | D32: 24.5521781752127 | E32: -7.44782182478733 | F32: 24.5521781752127 | G32: 25.6569581806021 | H32: 1.86532063806894 | I32: of:=SQRT([.C32]*[.C32]+[.D32]*[.D32]) -> 25.6569581806021 | J32: of:=ATAN2([.C32];[.D32]) -> 1.86532063806894 | K32: 12 | L32: 21 | N32: of:=IF(ISBLANK([.$C32]); 1; ABS([.$C32]-[.$E32])<[.$U$1]) -> true | O32: of:=IF(ISBLANK([.$D32]); 1; ABS([.$D32]-[.$F32])<[.$U$1]) -> true | P32: of:=IF(ISBLANK([.$G32]); 1; ABS([.$G32]-[.$I32])<[.$U$1]) -> true | Q32: of:=IF(ISBLANK([.$H32]); 1; ABS([.$H32]-[.$J32])<[.$U$1]) -> true | R32: of:=IF(ISBLANK([.$K32]); 1; ABS([.$K32]-[.$A32])<[.$U$1]) -> true | S32: of:=IF(ISBLANK([.$L32]); 1; ABS([.$L32]-[.$B32])<[.$U$1]) -> true
A33: 13 | B33: 20 | C33: -9.37258300203048 | D33: 22.6274169979695 | E33: -9.37258300203048 | F33: 22.6274169979695 | G33: 24.4917396713657 | H33: 1.96349540849362 | I33: of:=SQRT([.C33]*[.C33]+[.D33]*[.D33]) -> 24.4917396713657 | J33: of:=ATAN2([.C33];[.D33]) -> 1.96349540849362 | K33: 13 | L33: 20 | N33: of:=IF(ISBLANK([.$C33]); 1; ABS([.$C33]-[.$E33])<[.$U$1]) -> true | O33: of:=IF(ISBLANK([.$D33]); 1; ABS([.$D33]-[.$F33])<[.$U$1]) -> true | P33: of:=IF(ISBLANK([.$G33]); 1; ABS([.$G33]-[.$I33])<[.$U$1]) -> true | Q33: of:=IF(ISBLANK([.$H33]); 1; ABS([.$H33]-[.$J33])<[.$U$1]) -> true | R33: of:=IF(ISBLANK([.$K33]); 1; ABS([.$K33]-[.$A33])<[.$U$1]) -> true | S33: of:=IF(ISBLANK([.$L33]); 1; ABS([.$L33]-[.$B33])<[.$U$1]) -> true
A34: 14 | B34: 19 | C34: -11.1464530622825 | D34: 20.8535469377175 | E34: -11.1464530622825 | F34: 20.8535469377175 | G34: 23.6455880822037 | H34: 2.0616701789183 | I34: of:=SQRT([.C34]*[.C34]+[.D34]*[.D34]) -> 23.6455880822037 | J34: of:=ATAN2([.C34];[.D34]) -> 2.0616701789183 | K34: 14 | L34: 19 | N34: of:=IF(ISBLANK([.$C34]); 1; ABS([.$C34]-[.$E34])<[.$U$1]) -> true | O34: of:=IF(ISBLANK([.$D34]); 1; ABS([.$D34]-[.$F34])<[.$U$1]) -> true | P34: of:=IF(ISBLANK([.$G34]); 1; ABS([.$G34]-[.$I34])<[.$U$1]) -> true | Q34: of:=IF(ISBLANK([.$H34]); 1; ABS([.$H34]-[.$J34])<[.$U$1]) -> true | R34: of:=IF(ISBLANK([.$K34]); 1; ABS([.$K34]-[.$A34])<[.$U$1]) -> true | S34: of:=IF(ISBLANK([.$L34]); 1; ABS([.$L34]-[.$B34])<[.$U$1]) -> true
A35: 15 | B35: 18 | C35: -12.8174021219255 | D35: 19.1825978780745 | E35: -12.8174021219255 | F35: 19.1825978780745 | G35: 23.0707143042223 | H35: 2.15984494934298 | I35: of:=SQRT([.C35]*[.C35]+[.D35]*[.D35]) -> 23.0707143042223 | J35: of:=ATAN2([.C35];[.D35]) -> 2.15984494934298 | K35: 15 | L35: 18 | N35: of:=IF(ISBLANK([.$C35]); 1; ABS([.$C35]-[.$E35])<[.$U$1]) -> true | O35: of:=IF(ISBLANK([.$D35]); 1; ABS([.$D35]-[.$F35])<[.$U$1]) -> true | P35: of:=IF(ISBLANK([.$G35]); 1; ABS([.$G35]-[.$I35])<[.$U$1]) -> true | Q35: of:=IF(ISBLANK([.$H35]); 1; ABS([.$H35]-[.$J35])<[.$U$1]) -> true | R35: of:=IF(ISBLANK([.$K35]); 1; ABS([.$K35]-[.$A35])<[.$U$1]) -> true | S35: of:=IF(ISBLANK([.$L35]); 1; ABS([.$L35]-[.$B35])<[.$U$1]) -> true
A36: 16 | B36: 17 | C36: -14.4241375462854 | D36: 17.5758624537146 | E36: -14.4241375462854 | F36: 17.5758624537146 | G36: 22.7369013928032 | H36: 2.25801971976766 | I36: of:=SQRT([.C36]*[.C36]+[.D36]*[.D36]) -> 22.7369013928032 | J36: of:=ATAN2([.C36];[.D36]) -> 2.25801971976766 | K36: 16 | L36: 17 | N36: of:=IF(ISBLANK([.$C36]); 1; ABS([.$C36]-[.$E36])<[.$U$1]) -> true | O36: of:=IF(ISBLANK([.$D36]); 1; ABS([.$D36]-[.$F36])<[.$U$1]) -> true | P36: of:=IF(ISBLANK([.$G36]); 1; ABS([.$G36]-[.$I36])<[.$U$1]) -> true | Q36: of:=IF(ISBLANK([.$H36]); 1; ABS([.$H36]-[.$J36])<[.$U$1]) -> true | R36: of:=IF(ISBLANK([.$K36]); 1; ABS([.$K36]-[.$A36])<[.$U$1]) -> true | S36: of:=IF(ISBLANK([.$L36]); 1; ABS([.$L36]-[.$B36])<[.$U$1]) -> true
A37: 17 | B37: 16 | C37: -16 | D37: 16 | E37: -16 | F37: 16 | G37: 22.6274169979695 | H37: 2.35619449019234 | I37: of:=SQRT([.C37]*[.C37]+[.D37]*[.D37]) -> 22.6274169979695 | J37: of:=ATAN2([.C37];[.D37]) -> 2.35619449019234 | K37: 17 | L37: 16 | N37: of:=IF(ISBLANK([.$C37]); 1; ABS([.$C37]-[.$E37])<[.$U$1]) -> true | O37: of:=IF(ISBLANK([.$D37]); 1; ABS([.$D37]-[.$F37])<[.$U$1]) -> true | P37: of:=IF(ISBLANK([.$G37]); 1; ABS([.$G37]-[.$I37])<[.$U$1]) -> true | Q37: of:=IF(ISBLANK([.$H37]); 1; ABS([.$H37]-[.$J37])<[.$U$1]) -> true | R37: of:=IF(ISBLANK([.$K37]); 1; ABS([.$K37]-[.$A37])<[.$U$1]) -> true | S37: of:=IF(ISBLANK([.$L37]); 1; ABS([.$L37]-[.$B37])<[.$U$1]) -> true
A38: 18 | B38: 15 | C38: -17.5758624537146 | D38: 14.4241375462854 | E38: -17.5758624537146 | F38: 14.4241375462854 | G38: 22.7369013928032 | H38: 2.45436926061703 | I38: of:=SQRT([.C38]*[.C38]+[.D38]*[.D38]) -> 22.7369013928032 | J38: of:=ATAN2([.C38];[.D38]) -> 2.45436926061703 | K38: 18 | L38: 15 | N38: of:=IF(ISBLANK([.$C38]); 1; ABS([.$C38]-[.$E38])<[.$U$1]) -> true | O38: of:=IF(ISBLANK([.$D38]); 1; ABS([.$D38]-[.$F38])<[.$U$1]) -> true | P38: of:=IF(ISBLANK([.$G38]); 1; ABS([.$G38]-[.$I38])<[.$U$1]) -> true | Q38: of:=IF(ISBLANK([.$H38]); 1; ABS([.$H38]-[.$J38])<[.$U$1]) -> true | R38: of:=IF(ISBLANK([.$K38]); 1; ABS([.$K38]-[.$A38])<[.$U$1]) -> true | S38: of:=IF(ISBLANK([.$L38]); 1; ABS([.$L38]-[.$B38])<[.$U$1]) -> true
A39: 19 | B39: 14 | C39: -19.1825978780745 | D39: 12.8174021219255 | E39: -19.1825978780745 | F39: 12.8174021219255 | G39: 23.0707143042223 | H39: 2.55254403104171 | I39: of:=SQRT([.C39]*[.C39]+[.D39]*[.D39]) -> 23.0707143042223 | J39: of:=ATAN2([.C39];[.D39]) -> 2.55254403104171 | K39: 19 | L39: 14 | N39: of:=IF(ISBLANK([.$C39]); 1; ABS([.$C39]-[.$E39])<[.$U$1]) -> true | O39: of:=IF(ISBLANK([.$D39]); 1; ABS([.$D39]-[.$F39])<[.$U$1]) -> true | P39: of:=IF(ISBLANK([.$G39]); 1; ABS([.$G39]-[.$I39])<[.$U$1]) -> true | Q39: of:=IF(ISBLANK([.$H39]); 1; ABS([.$H39]-[.$J39])<[.$U$1]) -> true | R39: of:=IF(ISBLANK([.$K39]); 1; ABS([.$K39]-[.$A39])<[.$U$1]) -> true | S39: of:=IF(ISBLANK([.$L39]); 1; ABS([.$L39]-[.$B39])<[.$U$1]) -> true
A40: 20 | B40: 13 | C40: -20.8535469377175 | D40: 11.1464530622825 | E40: -20.8535469377175 | F40: 11.1464530622825 | G40: 23.6455880822037 | H40: 2.65071880146639 | I40: of:=SQRT([.C40]*[.C40]+[.D40]*[.D40]) -> 23.6455880822037 | J40: of:=ATAN2([.C40];[.D40]) -> 2.65071880146639 | K40: 20 | L40: 13 | N40: of:=IF(ISBLANK([.$C40]); 1; ABS([.$C40]-[.$E40])<[.$U$1]) -> true | O40: of:=IF(ISBLANK([.$D40]); 1; ABS([.$D40]-[.$F40])<[.$U$1]) -> true | P40: of:=IF(ISBLANK([.$G40]); 1; ABS([.$G40]-[.$I40])<[.$U$1]) -> true | Q40: of:=IF(ISBLANK([.$H40]); 1; ABS([.$H40]-[.$J40])<[.$U$1]) -> true | R40: of:=IF(ISBLANK([.$K40]); 1; ABS([.$K40]-[.$A40])<[.$U$1]) -> true | S40: of:=IF(ISBLANK([.$L40]); 1; ABS([.$L40]-[.$B40])<[.$U$1]) -> true
A41: 21 | B41: 12 | C41: -22.6274169979695 | D41: 9.37258300203047 | E41: -22.6274169979695 | F41: 9.37258300203048 | G41: 24.4917396713657 | H41: 2.74889357189107 | I41: of:=SQRT([.C41]*[.C41]+[.D41]*[.D41]) -> 24.4917396713657 | J41: of:=ATAN2([.C41];[.D41]) -> 2.74889357189107 | K41: 21 | L41: 12 | N41: of:=IF(ISBLANK([.$C41]); 1; ABS([.$C41]-[.$E41])<[.$U$1]) -> true | O41: of:=IF(ISBLANK([.$D41]); 1; ABS([.$D41]-[.$F41])<[.$U$1]) -> true | P41: of:=IF(ISBLANK([.$G41]); 1; ABS([.$G41]-[.$I41])<[.$U$1]) -> true | Q41: of:=IF(ISBLANK([.$H41]); 1; ABS([.$H41]-[.$J41])<[.$U$1]) -> true | R41: of:=IF(ISBLANK([.$K41]); 1; ABS([.$K41]-[.$A41])<[.$U$1]) -> true | S41: of:=IF(ISBLANK([.$L41]); 1; ABS([.$L41]-[.$B41])<[.$U$1]) -> true
A42: 22 | B42: 11 | C42: -24.5521781752127 | D42: 7.44782182478733 | E42: -24.5521781752127 | F42: 7.44782182478733 | G42: 25.6569581806022 | H42: 2.84706834231575 | I42: of:=SQRT([.C42]*[.C42]+[.D42]*[.D42]) -> 25.6569581806022 | J42: of:=ATAN2([.C42];[.D42]) -> 2.84706834231575 | K42: 22 | L42: 11 | N42: of:=IF(ISBLANK([.$C42]); 1; ABS([.$C42]-[.$E42])<[.$U$1]) -> true | O42: of:=IF(ISBLANK([.$D42]); 1; ABS([.$D42]-[.$F42])<[.$U$1]) -> true | P42: of:=IF(ISBLANK([.$G42]); 1; ABS([.$G42]-[.$I42])<[.$U$1]) -> true | Q42: of:=IF(ISBLANK([.$H42]); 1; ABS([.$H42]-[.$J42])<[.$U$1]) -> true | R42: of:=IF(ISBLANK([.$K42]); 1; ABS([.$K42]-[.$A42])<[.$U$1]) -> true | S42: of:=IF(ISBLANK([.$L42]); 1; ABS([.$L42]-[.$B42])<[.$U$1]) -> true
A43: 23 | B43: 10 | C43: -26.6908582067088 | D43: 5.30914179329121 | E43: -26.6908582067088 | F43: 5.30914179329122 | G43: 27.2137630325522 | H43: 2.94524311274043 | I43: of:=SQRT([.C43]*[.C43]+[.D43]*[.D43]) -> 27.2137630325522 | J43: of:=ATAN2([.C43];[.D43]) -> 2.94524311274043 | K43: 23 | L43: 10 | N43: of:=IF(ISBLANK([.$C43]); 1; ABS([.$C43]-[.$E43])<[.$U$1]) -> true | O43: of:=IF(ISBLANK([.$D43]); 1; ABS([.$D43]-[.$F43])<[.$U$1]) -> true | P43: of:=IF(ISBLANK([.$G43]); 1; ABS([.$G43]-[.$I43])<[.$U$1]) -> true | Q43: of:=IF(ISBLANK([.$H43]); 1; ABS([.$H43]-[.$J43])<[.$U$1]) -> true | R43: of:=IF(ISBLANK([.$K43]); 1; ABS([.$K43]-[.$A43])<[.$U$1]) -> true | S43: of:=IF(ISBLANK([.$L43]); 1; ABS([.$L43]-[.$B43])<[.$U$1]) -> true
A44: 24 | B44: 9 | C44: -29.1308606532586 | D44: 2.86913934674144 | E44: -29.1308606532586 | F44: 2.86913934674144 | G44: 29.2718124309136 | H44: 3.04341788316511 | I44: of:=SQRT([.C44]*[.C44]+[.D44]*[.D44]) -> 29.2718124309136 | J44: of:=ATAN2([.C44];[.D44]) -> 3.04341788316511 | K44: 24 | L44: 9 | N44: of:=IF(ISBLANK([.$C44]); 1; ABS([.$C44]-[.$E44])<[.$U$1]) -> true | O44: of:=IF(ISBLANK([.$D44]); 1; ABS([.$D44]-[.$F44])<[.$U$1]) -> true | P44: of:=IF(ISBLANK([.$G44]); 1; ABS([.$G44]-[.$I44])<[.$U$1]) -> true | Q44: of:=IF(ISBLANK([.$H44]); 1; ABS([.$H44]-[.$J44])<[.$U$1]) -> true | R44: of:=IF(ISBLANK([.$K44]); 1; ABS([.$K44]-[.$A44])<[.$U$1]) -> true | S44: of:=IF(ISBLANK([.$L44]); 1; ABS([.$L44]-[.$B44])<[.$U$1]) -> true
A45: 25 | B45: 8 | C45: -32 | D45: -3.5527136788005E-015 | E45: -32 | F45: 0 | G45: 32 | H45: -3.14159265358979 | I45: of:=SQRT([.C45]*[.C45]+[.D45]*[.D45]) -> 32 | J45: of:=ATAN2([.C45];[.D45]) -> -3.14159265358979 | K45: 25 | L45: 8 | N45: of:=IF(ISBLANK([.$C45]); 1; ABS([.$C45]-[.$E45])<[.$U$1]) -> true | O45: of:=IF(ISBLANK([.$D45]); 1; ABS([.$D45]-[.$F45])<[.$U$1]) -> true | P45: of:=IF(ISBLANK([.$G45]); 1; ABS([.$G45]-[.$I45])<[.$U$1]) -> true | Q45: of:=IF(ISBLANK([.$H45]); 1; ABS([.$H45]-[.$J45])<[.$U$1]) -> true | R45: of:=IF(ISBLANK([.$K45]); 1; ABS([.$K45]-[.$A45])<[.$U$1]) -> true | S45: of:=IF(ISBLANK([.$L45]); 1; ABS([.$L45]-[.$B45])<[.$U$1]) -> true
A46: 26 | B46: 7 | C46: -35.4960564094076 | D46: -3.49605640940763 | E46: -35.4960564094076 | F46: -3.49605640940763 | G46: 35.6678066474182 | H46: -3.04341788316511 | I46: of:=SQRT([.C46]*[.C46]+[.D46]*[.D46]) -> 35.6678066474182 | J46: of:=ATAN2([.C46];[.D46]) -> -3.04341788316511 | K46: 26 | L46: 7 | N46: of:=IF(ISBLANK([.$C46]); 1; ABS([.$C46]-[.$E46])<[.$U$1]) -> true | O46: of:=IF(ISBLANK([.$D46]); 1; ABS([.$D46]-[.$F46])<[.$U$1]) -> true | P46: of:=IF(ISBLANK([.$G46]); 1; ABS([.$G46]-[.$I46])<[.$U$1]) -> true | Q46: of:=IF(ISBLANK([.$H46]); 1; ABS([.$H46]-[.$J46])<[.$U$1]) -> true | R46: of:=IF(ISBLANK([.$K46]); 1; ABS([.$K46]-[.$A46])<[.$U$1]) -> true | S46: of:=IF(ISBLANK([.$L46]); 1; ABS([.$L46]-[.$B46])<[.$U$1]) -> true
A47: 27 | B47: 6 | C47: -39.9456922026478 | D47: -7.94569220264783 | E47: -39.9456922026478 | F47: -7.94569220264782 | G47: 40.7282745783307 | H47: -2.94524311274043 | I47: of:=SQRT([.C47]*[.C47]+[.D47]*[.D47]) -> 40.7282745783307 | J47: of:=ATAN2([.C47];[.D47]) -> -2.94524311274043 | K47: 27 | L47: 6 | N47: of:=IF(ISBLANK([.$C47]); 1; ABS([.$C47]-[.$E47])<[.$U$1]) -> true | O47: of:=IF(ISBLANK([.$D47]); 1; ABS([.$D47]-[.$F47])<[.$U$1]) -> true | P47: of:=IF(ISBLANK([.$G47]); 1; ABS([.$G47]-[.$I47])<[.$U$1]) -> true | Q47: of:=IF(ISBLANK([.$H47]); 1; ABS([.$H47]-[.$J47])<[.$U$1]) -> true | R47: of:=IF(ISBLANK([.$K47]); 1; ABS([.$K47]-[.$A47])<[.$U$1]) -> true | S47: of:=IF(ISBLANK([.$L47]); 1; ABS([.$L47]-[.$B47])<[.$U$1]) -> true
A48: 28 | B48: 5 | C48: -45.9338945886302 | D48: -13.9338945886302 | E48: -45.9338945886302 | F48: -13.9338945886302 | G48: 48.0007926026899 | H48: -2.84706834231575 | I48: of:=SQRT([.C48]*[.C48]+[.D48]*[.D48]) -> 48.0007926026899 | J48: of:=ATAN2([.C48];[.D48]) -> -2.84706834231575 | K48: 28 | L48: 5 | N48: of:=IF(ISBLANK([.$C48]); 1; ABS([.$C48]-[.$E48])<[.$U$1]) -> true | O48: of:=IF(ISBLANK([.$D48]); 1; ABS([.$D48]-[.$F48])<[.$U$1]) -> true | P48: of:=IF(ISBLANK([.$G48]); 1; ABS([.$G48]-[.$I48])<[.$U$1]) -> true | Q48: of:=IF(ISBLANK([.$H48]); 1; ABS([.$H48]-[.$J48])<[.$U$1]) -> true | R48: of:=IF(ISBLANK([.$K48]); 1; ABS([.$K48]-[.$A48])<[.$U$1]) -> true | S48: of:=IF(ISBLANK([.$L48]); 1; ABS([.$L48]-[.$B48])<[.$U$1]) -> true
A49: 29 | B49: 4 | C49: -54.6274169979695 | D49: -22.6274169979695 | E49: -54.6274169979695 | F49: -22.6274169979695 | G49: 59.1282900807223 | H49: -2.74889357189107 | I49: of:=SQRT([.C49]*[.C49]+[.D49]*[.D49]) -> 59.1282900807223 | J49: of:=ATAN2([.C49];[.D49]) -> -2.74889357189107 | K49: 29 | L49: 4 | N49: of:=IF(ISBLANK([.$C49]); 1; ABS([.$C49]-[.$E49])<[.$U$1]) -> true | O49: of:=IF(ISBLANK([.$D49]); 1; ABS([.$D49]-[.$F49])<[.$U$1]) -> true | P49: of:=IF(ISBLANK([.$G49]); 1; ABS([.$G49]-[.$I49])<[.$U$1]) -> true | Q49: of:=IF(ISBLANK([.$H49]); 1; ABS([.$H49]-[.$J49])<[.$U$1]) -> true | R49: of:=IF(ISBLANK([.$K49]); 1; ABS([.$K49]-[.$A49])<[.$U$1]) -> true | S49: of:=IF(ISBLANK([.$L49]); 1; ABS([.$L49]-[.$B49])<[.$U$1]) -> true
A50: 30 | B50: 3 | C50: -68.7449313430131 | D50: -36.7449313430131 | E50: -68.7449313430131 | F50: -36.7449313430131 | G50: 77.9490574975627 | H50: -2.65071880146639 | I50: of:=SQRT([.C50]*[.C50]+[.D50]*[.D50]) -> 77.9490574975627 | J50: of:=ATAN2([.C50];[.D50]) -> -2.65071880146639 | K50: 30 | L50: 3 | N50: of:=IF(ISBLANK([.$C50]); 1; ABS([.$C50]-[.$E50])<[.$U$1]) -> true | O50: of:=IF(ISBLANK([.$D50]); 1; ABS([.$D50]-[.$F50])<[.$U$1]) -> true | P50: of:=IF(ISBLANK([.$G50]); 1; ABS([.$G50]-[.$I50])<[.$U$1]) -> true | Q50: of:=IF(ISBLANK([.$H50]); 1; ABS([.$H50]-[.$J50])<[.$U$1]) -> true | R50: of:=IF(ISBLANK([.$K50]); 1; ABS([.$K50]-[.$A50])<[.$U$1]) -> true | S50: of:=IF(ISBLANK([.$L50]); 1; ABS([.$L50]-[.$B50])<[.$U$1]) -> true
A51: 31 | B51: 2 | C51: -96.4374318740136 | D51: -64.4374318740136 | E51: -96.4374318740136 | F51: -64.4374318740136 | G51: 115.98431313317 | H51: -2.55254403104171 | I51: of:=SQRT([.C51]*[.C51]+[.D51]*[.D51]) -> 115.98431313317 | J51: of:=ATAN2([.C51];[.D51]) -> -2.55254403104171 | K51: 31 | L51: 2 | N51: of:=IF(ISBLANK([.$C51]); 1; ABS([.$C51]-[.$E51])<[.$U$1]) -> true | O51: of:=IF(ISBLANK([.$D51]); 1; ABS([.$D51]-[.$F51])<[.$U$1]) -> true | P51: of:=IF(ISBLANK([.$G51]); 1; ABS([.$G51]-[.$I51])<[.$U$1]) -> true | Q51: of:=IF(ISBLANK([.$H51]); 1; ABS([.$H51]-[.$J51])<[.$U$1]) -> true | R51: of:=IF(ISBLANK([.$K51]); 1; ABS([.$K51]-[.$A51])<[.$U$1]) -> true | S51: of:=IF(ISBLANK([.$L51]); 1; ABS([.$L51]-[.$B51])<[.$U$1]) -> true
A52: 32 | B52: 1 | C52: -178.450726201742 | D52: -146.450726201742 | E52: -178.450726201742 | F52: -146.450726201742 | G52: 230.851633927392 | H52: -2.45436926061703 | I52: of:=SQRT([.C52]*[.C52]+[.D52]*[.D52]) -> 230.851633927392 | J52: of:=ATAN2([.C52];[.D52]) -> -2.45436926061703 | K52: 32 | L52: 0.999999999999999 | N52: of:=IF(ISBLANK([.$C52]); 1; ABS([.$C52]-[.$E52])<[.$U$1]) -> true | O52: of:=IF(ISBLANK([.$D52]); 1; ABS([.$D52]-[.$F52])<[.$U$1]) -> true | P52: of:=IF(ISBLANK([.$G52]); 1; ABS([.$G52]-[.$I52])<[.$U$1]) -> true | Q52: of:=IF(ISBLANK([.$H52]); 1; ABS([.$H52]-[.$J52])<[.$U$1]) -> true | R52: of:=IF(ISBLANK([.$K52]); 1; ABS([.$K52]-[.$A52])<[.$U$1]) -> true | S52: of:=IF(ISBLANK([.$L52]); 1; ABS([.$L52]-[.$B52])<[.$U$1]) -> true
N53: of:=IF(ISBLANK([.$C53]); 1; ABS([.$C53]-[.$E53])<[.$U$1]) -> true | O53: of:=IF(ISBLANK([.$D53]); 1; ABS([.$D53]-[.$F53])<[.$U$1]) -> true | P53: of:=IF(ISBLANK([.$G53]); 1; ABS([.$G53]-[.$I53])<[.$U$1]) -> true | Q53: of:=IF(ISBLANK([.$H53]); 1; ABS([.$H53]-[.$J53])<[.$U$1]) -> true | R53: of:=IF(ISBLANK([.$K53]); 1; ABS([.$K53]-[.$A53])<[.$U$1]) -> true | S53: of:=IF(ISBLANK([.$L53]); 1; ABS([.$L53]-[.$B53])<[.$U$1]) -> true
A54: -0.5 | B54: 0 | C54: of:=ORG.LIBREOFFICE.FOURIER([.A54:.B54];1) -> -0.5 | D54: 0 | E54: -0.5 | F54: 0 | G54: of:=ORG.LIBREOFFICE.FOURIER([.A54:.B54];1;;1) -> 0.5 | H54: 3.14159265358979 | I54: of:=SQRT([.C54]*[.C54]+[.D54]*[.D54]) -> 0.5 | J54: of:=ATAN2([.C54];[.D54]) -> 3.14159265358979 | K54: of:=ORG.LIBREOFFICE.FOURIER([.C54:.D54];1;1) -> -0.5 | L54: 0 | N54: of:=IF(ISBLANK([.$C54]); 1; ABS([.$C54]-[.$E54])<[.$U$1]) -> true | O54: of:=IF(ISBLANK([.$D54]); 1; ABS([.$D54]-[.$F54])<[.$U$1]) -> true | P54: of:=IF(ISBLANK([.$G54]); 1; ABS([.$G54]-[.$I54])<[.$U$1]) -> true | Q54: of:=IF(ISBLANK([.$H54]); 1; ABS([.$H54]-[.$J54])<[.$U$1]) -> true | R54: of:=IF(ISBLANK([.$K54]); 1; ABS([.$K54]-[.$A54])<[.$U$1]) -> true | S54: of:=IF(ISBLANK([.$L54]); 1; ABS([.$L54]-[.$B54])<[.$U$1]) -> true
A55: 0 | B55: -0.5 | C55: of:=ORG.LIBREOFFICE.FOURIER([.A55:.B55];1) -> 0 | D55: -0.5 | E55: 0 | F55: -0.5 | G55: of:=ORG.LIBREOFFICE.FOURIER([.A55:.B55];1;;1) -> 0.5 | H55: -1.5707963267949 | I55: of:=SQRT([.C55]*[.C55]+[.D55]*[.D55]) -> 0.5 | J55: of:=ATAN2([.C55];[.D55]) -> -1.5707963267949 | K55: of:=ORG.LIBREOFFICE.FOURIER([.C55:.D55];1;1) -> 0 | L55: -0.5 | N55: of:=IF(ISBLANK([.$C55]); 1; ABS([.$C55]-[.$E55])<[.$U$1]) -> true | O55: of:=IF(ISBLANK([.$D55]); 1; ABS([.$D55]-[.$F55])<[.$U$1]) -> true | P55: of:=IF(ISBLANK([.$G55]); 1; ABS([.$G55]-[.$I55])<[.$U$1]) -> true | Q55: of:=IF(ISBLANK([.$H55]); 1; ABS([.$H55]-[.$J55])<[.$U$1]) -> true | R55: of:=IF(ISBLANK([.$K55]); 1; ABS([.$K55]-[.$A55])<[.$U$1]) -> true | S55: of:=IF(ISBLANK([.$L55]); 1; ABS([.$L55]-[.$B55])<[.$U$1]) -> true
A56: 0.003 | B56: -0.0002 | C56: of:=ORG.LIBREOFFICE.FOURIER([.A56:.B56];1) -> 0.003 | D56: -0.0002 | E56: 0.003 | F56: -0.0002 | G56: of:=ORG.LIBREOFFICE.FOURIER([.A56:.B56];1;;1;0.01) -> 0 | H56: 0 | I56: 0 | J56: 0 | K56: of:=ORG.LIBREOFFICE.FOURIER([.C56:.D56];1;1) -> 0.003 | L56: -0.0002 | N56: of:=IF(ISBLANK([.$C56]); 1; ABS([.$C56]-[.$E56])<[.$U$1]) -> true | O56: of:=IF(ISBLANK([.$D56]); 1; ABS([.$D56]-[.$F56])<[.$U$1]) -> true | P56: of:=IF(ISBLANK([.$G56]); 1; ABS([.$G56]-[.$I56])<[.$U$1]) -> true | Q56: of:=IF(ISBLANK([.$H56]); 1; ABS([.$H56]-[.$J56])<[.$U$1]) -> true | R56: of:=IF(ISBLANK([.$K56]); 1; ABS([.$K56]-[.$A56])<[.$U$1]) -> true | S56: of:=IF(ISBLANK([.$L56]); 1; ABS([.$L56]-[.$B56])<[.$U$1]) -> true

Sheet: Sheet3
A1: xr[n] | B1: xi[n] | C1: Xr[k] | D1: Xi[k] | E1: Exr[k] | F1: Exi[k] | G1: Xm[k] | H1: Xp[k] | I1: Exm[k] | J1: Exp[k] | K1: xhr[n] | L1: xhi[n] | N1: CheckForwardFFTReal | O1: CheckForwardFFTImag | P1: CheckForwardFFTMag | Q1: CheckForwardFFTPhase | R1: CheckInverseReal | S1: CheckInverseImag | T1: EPS | U1: 0.00000000001
A2: 1 | C2: of:=ORG.LIBREOFFICE.FOURIER([.A2:.A4];1) -> 6 | D2: 4.23839242352229E-016 | E2: 6 | F2: 0 | G2: of:=ORG.LIBREOFFICE.FOURIER([.A2:.A4];1;;1) -> 6 | H2: 7.06398737253716E-017 | I2: of:=SQRT([.C2]*[.C2]+[.D2]*[.D2]) -> 6 | J2: of:=ATAN2([.C2];[.D2]) -> 7.06398737253716E-017 | K2: of:=ORG.LIBREOFFICE.FOURIER([.C2:.D4];1;1) -> 1 | L2: -6.01705842729982E-016 | N2: of:=IF(ISBLANK([.$C2]); 1; ABS([.$C2]-[.$E2])<[.$U$1]) -> true | O2: of:=IF(ISBLANK([.$D2]); 1; ABS([.$D2]-[.$F2])<[.$U$1]) -> true | P2: of:=IF(ISBLANK([.$G2]); 1; ABS([.$G2]-[.$I2])<[.$U$1]) -> true | Q2: of:=IF(ISBLANK([.$H2]); 1; ABS([.$H2]-[.$J2])<[.$U$1]) -> true | R2: of:=IF(ISBLANK([.$K2]); 1; ABS([.$K2]-[.$A2])<[.$U$1]) -> true | S2: of:=IF(ISBLANK([.$L2]); 1; ABS([.$L2]-[.$B2])<[.$U$1]) -> true
A3: 2 | C3: -1.5 | D3: 0.866025403784438 | E3: -1.5 | F3: 0.866025403784439 | G3: 1.73205080756888 | H3: 2.6179938779915 | I3: of:=SQRT([.C3]*[.C3]+[.D3]*[.D3]) -> 1.73205080756888 | J3: of:=ATAN2([.C3];[.D3]) -> 2.6179938779915 | K3: 2 | L3: -2.96059473233375E-016 | N3: of:=IF(ISBLANK([.$C3]); 1; ABS([.$C3]-[.$E3])<[.$U$1]) -> true | O3: of:=IF(ISBLANK([.$D3]); 1; ABS([.$D3]-[.$F3])<[.$U$1]) -> true | P3: of:=IF(ISBLANK([.$G3]); 1; ABS([.$G3]-[.$I3])<[.$U$1]) -> true | Q3: of:=IF(ISBLANK([.$H3]); 1; ABS([.$H3]-[.$J3])<[.$U$1]) -> true | R3: of:=IF(ISBLANK([.$K3]); 1; ABS([.$K3]-[.$A3])<[.$U$1]) -> true | S3: of:=IF(ISBLANK([.$L3]); 1; ABS([.$L3]-[.$B3])<[.$U$1]) -> true
A4: 3 | C4: -1.5 | D4: -0.86602540378444 | E4: -1.5 | F4: -0.866025403784439 | G4: 1.73205080756888 | H4: -2.61799387799149 | I4: of:=SQRT([.C4]*[.C4]+[.D4]*[.D4]) -> 1.73205080756888 | J4: of:=ATAN2([.C4];[.D4]) -> -2.61799387799149 | K4: 3 | L4: 2.96059473233375E-016 | N4: of:=IF(ISBLANK([.$C4]); 1; ABS([.$C4]-[.$E4])<[.$U$1]) -> true | O4: of:=IF(ISBLANK([.$D4]); 1; ABS([.$D4]-[.$F4])<[.$U$1]) -> true | P4: of:=IF(ISBLANK([.$G4]); 1; ABS([.$G4]-[.$I4])<[.$U$1]) -> true | Q4: of:=IF(ISBLANK([.$H4]); 1; ABS([.$H4]-[.$J4])<[.$U$1]) -> true | R4: of:=IF(ISBLANK([.$K4]); 1; ABS([.$K4]-[.$A4])<[.$U$1]) -> true | S4: of:=IF(ISBLANK([.$L4]); 1; ABS([.$L4]-[.$B4])<[.$U$1]) -> true
N5: of:=IF(ISBLANK([.$C5]); 1; ABS([.$C5]-[.$E5])<[.$U$1]) -> true | O5: of:=IF(ISBLANK([.$D5]); 1; ABS([.$D5]-[.$F5])<[.$U$1]) -> true | P5: of:=IF(ISBLANK([.$G5]); 1; ABS([.$G5]-[.$I5])<[.$U$1]) -> true | Q5: of:=IF(ISBLANK([.$H5]); 1; ABS([.$H5]-[.$J5])<[.$U$1]) -> true | R5: of:=IF(ISBLANK([.$K5]); 1; ABS([.$K5]-[.$A5])<[.$U$1]) -> true | S5: of:=IF(ISBLANK([.$L5]); 1; ABS([.$L5]-[.$B5])<[.$U$1]) -> true
A6: 1 | C6: of:=ORG.LIBREOFFICE.FOURIER([.A6:.A10];1) -> 15 | D6: 1.3698155241998E-015 | E6: 15 | F6: 0 | G6: of:=ORG.LIBREOFFICE.FOURIER([.A6:.A10];1;;1) -> 15 | H6: 9.13210349466534E-017 | I6: of:=SQRT([.C6]*[.C6]+[.D6]*[.D6]) -> 15 | J6: of:=ATAN2([.C6];[.D6]) -> 9.13210349466534E-017 | K6: of:=ORG.LIBREOFFICE.FOURIER([.C6:.D10];1;1) -> 1 | L6: -8.422541647321E-016 | N6: of:=IF(ISBLANK([.$C6]); 1; ABS([.$C6]-[.$E6])<[.$U$1]) -> true | O6: of:=IF(ISBLANK([.$D6]); 1; ABS([.$D6]-[.$F6])<[.$U$1]) -> true | P6: of:=IF(ISBLANK([.$G6]); 1; ABS([.$G6]-[.$I6])<[.$U$1]) -> true | Q6: of:=IF(ISBLANK([.$H6]); 1; ABS([.$H6]-[.$J6])<[.$U$1]) -> true | R6: of:=IF(ISBLANK([.$K6]); 1; ABS([.$K6]-[.$A6])<[.$U$1]) -> true | S6: of:=IF(ISBLANK([.$L6]); 1; ABS([.$L6]-[.$B6])<[.$U$1]) -> true
A7: 2 | C7: -2.5 | D7: 3.44095480117793 | E7: -2.5 | F7: 3.44095480117793 | G7: 4.2532540417602 | H7: 2.19911485751286 | I7: of:=SQRT([.C7]*[.C7]+[.D7]*[.D7]) -> 4.2532540417602 | J7: of:=ATAN2([.C7];[.D7]) -> 2.19911485751286 | K7: 2 | L7: 1.77635683940025E-016 | N7: of:=IF(ISBLANK([.$C7]); 1; ABS([.$C7]-[.$E7])<[.$U$1]) -> true | O7: of:=IF(ISBLANK([.$D7]); 1; ABS([.$D7]-[.$F7])<[.$U$1]) -> true | P7: of:=IF(ISBLANK([.$G7]); 1; ABS([.$G7]-[.$I7])<[.$U$1]) -> true | Q7: of:=IF(ISBLANK([.$H7]); 1; ABS([.$H7]-[.$J7])<[.$U$1]) -> true | R7: of:=IF(ISBLANK([.$K7]); 1; ABS([.$K7]-[.$A7])<[.$U$1]) -> true | S7: of:=IF(ISBLANK([.$L7]); 1; ABS([.$L7]-[.$B7])<[.$U$1]) -> true
A8: 3 | C8: -2.5 | D8: 0.812299240582264 | E8: -2.5 | F8: 0.812299240582266 | G8: 2.62865556059567 | H8: 2.82743338823081 | I8: of:=SQRT([.C8]*[.C8]+[.D8]*[.D8]) -> 2.62865556059567 | J8: of:=ATAN2([.C8];[.D8]) -> 2.82743338823081 | K8: 3 | L8: -1.77635683940025E-016 | N8: of:=IF(ISBLANK([.$C8]); 1; ABS([.$C8]-[.$E8])<[.$U$1]) -> true | O8: of:=IF(ISBLANK([.$D8]); 1; ABS([.$D8]-[.$F8])<[.$U$1]) -> true | P8: of:=IF(ISBLANK([.$G8]); 1; ABS([.$G8]-[.$I8])<[.$U$1]) -> true | Q8: of:=IF(ISBLANK([.$H8]); 1; ABS([.$H8]-[.$J8])<[.$U$1]) -> true | R8: of:=IF(ISBLANK([.$K8]); 1; ABS([.$K8]-[.$A8])<[.$U$1]) -> true | S8: of:=IF(ISBLANK([.$L8]); 1; ABS([.$L8]-[.$B8])<[.$U$1]) -> true
A9: 4 | C9: -2.5 | D9: -0.812299240582266 | E9: -2.5 | F9: -0.812299240582266 | G9: 2.62865556059567 | H9: -2.82743338823081 | I9: of:=SQRT([.C9]*[.C9]+[.D9]*[.D9]) -> 2.62865556059567 | J9: of:=ATAN2([.C9];[.D9]) -> -2.82743338823081 | K9: 4 | L9: 0 | N9: of:=IF(ISBLANK([.$C9]); 1; ABS([.$C9]-[.$E9])<[.$U$1]) -> true | O9: of:=IF(ISBLANK([.$D9]); 1; ABS([.$D9]-[.$F9])<[.$U$1]) -> true | P9: of:=IF(ISBLANK([.$G9]); 1; ABS([.$G9]-[.$I9])<[.$U$1]) -> true | Q9: of:=IF(ISBLANK([.$H9]); 1; ABS([.$H9]-[.$J9])<[.$U$1]) -> true | R9: of:=IF(ISBLANK([.$K9]); 1; ABS([.$K9]-[.$A9])<[.$U$1]) -> true | S9: of:=IF(ISBLANK([.$L9]); 1; ABS([.$L9]-[.$B9])<[.$U$1]) -> true
A10: 5 | C10: -2.5 | D10: -3.44095480117793 | E10: -2.5 | F10: -3.44095480117793 | G10: 4.2532540417602 | H10: -2.19911485751285 | I10: of:=SQRT([.C10]*[.C10]+[.D10]*[.D10]) -> 4.2532540417602 | J10: of:=ATAN2([.C10];[.D10]) -> -2.19911485751285 | K10: 5 | L10: 3.5527136788005E-016 | N10: of:=IF(ISBLANK([.$C10]); 1; ABS([.$C10]-[.$E10])<[.$U$1]) -> true | O10: of:=IF(ISBLANK([.$D10]); 1; ABS([.$D10]-[.$F10])<[.$U$1]) -> true | P10: of:=IF(ISBLANK([.$G10]); 1; ABS([.$G10]-[.$I10])<[.$U$1]) -> true | Q10: of:=IF(ISBLANK([.$H10]); 1; ABS([.$H10]-[.$J10])<[.$U$1]) -> true | R10: of:=IF(ISBLANK([.$K10]); 1; ABS([.$K10]-[.$A10])<[.$U$1]) -> true | S10: of:=IF(ISBLANK([.$L10]); 1; ABS([.$L10]-[.$B10])<[.$U$1]) -> true
N11: of:=IF(ISBLANK([.$C11]); 1; ABS([.$C11]-[.$E11])<[.$U$1]) -> true | O11: of:=IF(ISBLANK([.$D11]); 1; ABS([.$D11]-[.$F11])<[.$U$1]) -> true | P11: of:=IF(ISBLANK([.$G11]); 1; ABS([.$G11]-[.$I11])<[.$U$1]) -> true | Q11: of:=IF(ISBLANK([.$H11]); 1; ABS([.$H11]-[.$J11])<[.$U$1]) -> true | R11: of:=IF(ISBLANK([.$K11]); 1; ABS([.$K11]-[.$A11])<[.$U$1]) -> true | S11: of:=IF(ISBLANK([.$L11]); 1; ABS([.$L11]-[.$B11])<[.$U$1]) -> true
A12: 1 | C12: of:=ORG.LIBREOFFICE.FOURIER([.A12:.A18];1) -> 28 | D12: 5.46639190770181E-015 | E12: 28 | F12: 0 | G12: of:=ORG.LIBREOFFICE.FOURIER([.A12:.A18];1;;1) -> 28 | H12: 1.95228282417922E-016 | I12: of:=SQRT([.C12]*[.C12]+[.D12]*[.D12]) -> 28 | J12: of:=ATAN2([.C12];[.D12]) -> 1.95228282417922E-016 | K12: of:=ORG.LIBREOFFICE.FOURIER([.C12:.D18];1;1) -> 1 | L12: -1.37681666234636E-015 | N12: of:=IF(ISBLANK([.$C12]); 1; ABS([.$C12]-[.$E12])<[.$U$1]) -> true | O12: of:=IF(ISBLANK([.$D12]); 1; ABS([.$D12]-[.$F12])<[.$U$1]) -> true | P12: of:=IF(ISBLANK([.$G12]); 1; ABS([.$G12]-[.$I12])<[.$U$1]) -> true | Q12: of:=IF(ISBLANK([.$H12]); 1; ABS([.$H12]-[.$J12])<[.$U$1]) -> true | R12: of:=IF(ISBLANK([.$K12]); 1; ABS([.$K12]-[.$A12])<[.$U$1]) -> true | S12: of:=IF(ISBLANK([.$L12]); 1; ABS([.$L12]-[.$B12])<[.$U$1]) -> true
A13: 2 | C13: -3.5 | D13: 7.26782488800318 | E13: -3.5 | F13: 7.26782488800318 | G13: 8.06667704836871 | H13: 2.01959527730772 | I13: of:=SQRT([.C13]*[.C13]+[.D13]*[.D13]) -> 8.06667704836871 | J13: of:=ATAN2([.C13];[.D13]) -> 2.01959527730772 | K13: 2 | L13: 2.53765262771464E-016 | N13: of:=IF(ISBLANK([.$C13]); 1; ABS([.$C13]-[.$E13])<[.$U$1]) -> true | O13: of:=IF(ISBLANK([.$D13]); 1; ABS([.$D13]-[.$F13])<[.$U$1]) -> true | P13: of:=IF(ISBLANK([.$G13]); 1; ABS([.$G13]-[.$I13])<[.$U$1]) -> true | Q13: of:=IF(ISBLANK([.$H13]); 1; ABS([.$H13]-[.$J13])<[.$U$1]) -> true | R13: of:=IF(ISBLANK([.$K13]); 1; ABS([.$K13]-[.$A13])<[.$U$1]) -> true | S13: of:=IF(ISBLANK([.$L13]); 1; ABS([.$L13]-[.$B13])<[.$U$1]) -> true
A14: 3 | C14: -3.5 | D14: 2.79115686108841 | E14: -3.5 | F14: 2.79115686108841 | G14: 4.47666802691477 | H14: 2.46839422782055 | I14: of:=SQRT([.C14]*[.C14]+[.D14]*[.D14]) -> 4.47666802691477 | J14: of:=ATAN2([.C14];[.D14]) -> 2.46839422782055 | K14: 3 | L14: -2.53765262771464E-016 | N14: of:=IF(ISBLANK([.$C14]); 1; ABS([.$C14]-[.$E14])<[.$U$1]) -> true | O14: of:=IF(ISBLANK([.$D14]); 1; ABS([.$D14]-[.$F14])<[.$U$1]) -> true | P14: of:=IF(ISBLANK([.$G14]); 1; ABS([.$G14]-[.$I14])<[.$U$1]) -> true | Q14: of:=IF(ISBLANK([.$H14]); 1; ABS([.$H14]-[.$J14])<[.$U$1]) -> true | R14: of:=IF(ISBLANK([.$K14]); 1; ABS([.$K14]-[.$A14])<[.$U$1]) -> true | S14: of:=IF(ISBLANK([.$L14]); 1; ABS([.$L14]-[.$B14])<[.$U$1]) -> true
A15: 4 | C15: -3.5 | D15: 0.798852160365522 | E15: -3.5 | F15: 0.798852160365525 | G15: 3.59000902145394 | H15: 2.91719317833338 | I15: of:=SQRT([.C15]*[.C15]+[.D15]*[.D15]) -> 3.59000902145394 | J15: of:=ATAN2([.C15];[.D15]) -> 2.91719317833338 | K15: 4 | L15: -1.52259157662879E-015 | N15: of:=IF(ISBLANK([.$C15]); 1; ABS([.$C15]-[.$E15])<[.$U$1]) -> true | O15: of:=IF(ISBLANK([.$D15]); 1; ABS([.$D15]-[.$F15])<[.$U$1]) -> true | P15: of:=IF(ISBLANK([.$G15]); 1; ABS([.$G15]-[.$I15])<[.$U$1]) -> true | Q15: of:=IF(ISBLANK([.$H15]); 1; ABS([.$H15]-[.$J15])<[.$U$1]) -> true | R15: of:=IF(ISBLANK([.$K15]); 1; ABS([.$K15]-[.$A15])<[.$U$1]) -> true | S15: of:=IF(ISBLANK([.$L15]); 1; ABS([.$L15]-[.$B15])<[.$U$1]) -> true
A16: 5 | C16: -3.5 | D16: -0.798852160365526 | E16: -3.5 | F16: -0.798852160365525 | G16: 3.59000902145394 | H16: -2.91719317833338 | I16: of:=SQRT([.C16]*[.C16]+[.D16]*[.D16]) -> 3.59000902145394 | J16: of:=ATAN2([.C16];[.D16]) -> -2.91719317833338 | K16: 5 | L16: 2.03012210217171E-015 | N16: of:=IF(ISBLANK([.$C16]); 1; ABS([.$C16]-[.$E16])<[.$U$1]) -> true | O16: of:=IF(ISBLANK([.$D16]); 1; ABS([.$D16]-[.$F16])<[.$U$1]) -> true | P16: of:=IF(ISBLANK([.$G16]); 1; ABS([.$G16]-[.$I16])<[.$U$1]) -> true | Q16: of:=IF(ISBLANK([.$H16]); 1; ABS([.$H16]-[.$J16])<[.$U$1]) -> true | R16: of:=IF(ISBLANK([.$K16]); 1; ABS([.$K16]-[.$A16])<[.$U$1]) -> true | S16: of:=IF(ISBLANK([.$L16]); 1; ABS([.$L16]-[.$B16])<[.$U$1]) -> true
A17: 6 | C17: -3.5 | D17: -2.79115686108842 | E17: -3.5 | F17: -2.79115686108841 | G17: 4.47666802691477 | H17: -2.46839422782055 | I17: of:=SQRT([.C17]*[.C17]+[.D17]*[.D17]) -> 4.47666802691477 | J17: of:=ATAN2([.C17];[.D17]) -> -2.46839422782055 | K17: 6 | L17: 0 | N17: of:=IF(ISBLANK([.$C17]); 1; ABS([.$C17]-[.$E17])<[.$U$1]) -> true | O17: of:=IF(ISBLANK([.$D17]); 1; ABS([.$D17]-[.$F17])<[.$U$1]) -> true | P17: of:=IF(ISBLANK([.$G17]); 1; ABS([.$G17]-[.$I17])<[.$U$1]) -> true | Q17: of:=IF(ISBLANK([.$H17]); 1; ABS([.$H17]-[.$J17])<[.$U$1]) -> true | R17: of:=IF(ISBLANK([.$K17]); 1; ABS([.$K17]-[.$A17])<[.$U$1]) -> true | S17: of:=IF(ISBLANK([.$L17]); 1; ABS([.$L17]-[.$B17])<[.$U$1]) -> true
A18: 7 | C18: -3.49999999999999 | D18: -7.26782488800318 | E18: -3.5 | F18: -7.26782488800318 | G18: 8.0666770483687 | H18: -2.01959527730772 | I18: of:=SQRT([.C18]*[.C18]+[.D18]*[.D18]) -> 8.0666770483687 | J18: of:=ATAN2([.C18];[.D18]) -> -2.01959527730772 | K18: 7 | L18: 5.07530525542929E-016 | N18: of:=IF(ISBLANK([.$C18]); 1; ABS([.$C18]-[.$E18])<[.$U$1]) -> true | O18: of:=IF(ISBLANK([.$D18]); 1; ABS([.$D18]-[.$F18])<[.$U$1]) -> true | P18: of:=IF(ISBLANK([.$G18]); 1; ABS([.$G18]-[.$I18])<[.$U$1]) -> true | Q18: of:=IF(ISBLANK([.$H18]); 1; ABS([.$H18]-[.$J18])<[.$U$1]) -> true | R18: of:=IF(ISBLANK([.$K18]); 1; ABS([.$K18]-[.$A18])<[.$U$1]) -> true | S18: of:=IF(ISBLANK([.$L18]); 1; ABS([.$L18]-[.$B18])<[.$U$1]) -> true
N19: of:=IF(ISBLANK([.$C19]); 1; ABS([.$C19]-[.$E19])<[.$U$1]) -> true | O19: of:=IF(ISBLANK([.$D19]); 1; ABS([.$D19]-[.$F19])<[.$U$1]) -> true | P19: of:=IF(ISBLANK([.$G19]); 1; ABS([.$G19]-[.$I19])<[.$U$1]) -> true | Q19: of:=IF(ISBLANK([.$H19]); 1; ABS([.$H19]-[.$J19])<[.$U$1]) -> true | R19: of:=IF(ISBLANK([.$K19]); 1; ABS([.$K19]-[.$A19])<[.$U$1]) -> true | S19: of:=IF(ISBLANK([.$L19]); 1; ABS([.$L19]-[.$B19])<[.$U$1]) -> true
A20: 1 | C20: of:=ORG.LIBREOFFICE.FOURIER([.A20:.A32];1) -> 91 | D20: 0.0000000000000120125026967745 | E20: 91 | F20: 0 | G20: of:=ORG.LIBREOFFICE.FOURIER([.A20:.A32];1;;1) -> 91 | H20: 1.32005524140379E-016 | I20: of:=SQRT([.C20]*[.C20]+[.D20]*[.D20]) -> 91 | J20: of:=ATAN2([.C20];[.D20]) -> 1.32005524140379E-016 | K20: of:=ORG.LIBREOFFICE.FOURIER([.C20:.D32];1;1) -> 1.00000000000002 | L20: -0.0000000000000165810359636775 | N20: of:=IF(ISBLANK([.$C20]); 1; ABS([.$C20]-[.$E20])<[.$U$1]) -> true | O20: of:=IF(ISBLANK([.$D20]); 1; ABS([.$D20]-[.$F20])<[.$U$1]) -> true | P20: of:=IF(ISBLANK([.$G20]); 1; ABS([.$G20]-[.$I20])<[.$U$1]) -> true | Q20: of:=IF(ISBLANK([.$H20]); 1; ABS([.$H20]-[.$J20])<[.$U$1]) -> true | R20: of:=IF(ISBLANK([.$K20]); 1; ABS([.$K20]-[.$A20])<[.$U$1]) -> true | S20: of:=IF(ISBLANK([.$L20]); 1; ABS([.$L20]-[.$B20])<[.$U$1]) -> true
A21: 2 | C21: -6.50000000000001 | D21: 26.3715366566477 | E21: -6.5 | F21: 26.3715366566478 | G21: 27.1607795475924 | H21: 1.81245730014796 | I21: of:=SQRT([.C21]*[.C21]+[.D21]*[.D21]) -> 27.1607795475924 | J21: of:=ATAN2([.C21];[.D21]) -> 1.81245730014796 | K21: 2.00000000000001 | L21: -0.0000000000000136642833800019 | N21: of:=IF(ISBLANK([.$C21]); 1; ABS([.$C21]-[.$E21])<[.$U$1]) -> true | O21: of:=IF(ISBLANK([.$D21]); 1; ABS([.$D21]-[.$F21])<[.$U$1]) -> true | P21: of:=IF(ISBLANK([.$G21]); 1; ABS([.$G21]-[.$I21])<[.$U$1]) -> true | Q21: of:=IF(ISBLANK([.$H21]); 1; ABS([.$H21]-[.$J21])<[.$U$1]) -> true | R21: of:=IF(ISBLANK([.$K21]); 1; ABS([.$K21]-[.$A21])<[.$U$1]) -> true | S21: of:=IF(ISBLANK([.$L21]); 1; ABS([.$L21]-[.$B21])<[.$U$1]) -> true
A22: 3 | C22: -6.50000000000001 | D22: 12.3847152734699 | E22: -6.5 | F22: 12.38471527347 | G22: 13.9868213831778 | H22: 2.05411827350102 | I22: of:=SQRT([.C22]*[.C22]+[.D22]*[.D22]) -> 13.9868213831778 | J22: of:=ATAN2([.C22];[.D22]) -> 2.05411827350102 | K22: 3.00000000000001 | L22: -0.0000000000000150307117180021 | N22: of:=IF(ISBLANK([.$C22]); 1; ABS([.$C22]-[.$E22])<[.$U$1]) -> true | O22: of:=IF(ISBLANK([.$D22]); 1; ABS([.$D22]-[.$F22])<[.$U$1]) -> true | P22: of:=IF(ISBLANK([.$G22]); 1; ABS([.$G22]-[.$I22])<[.$U$1]) -> true | Q22: of:=IF(ISBLANK([.$H22]); 1; ABS([.$H22]-[.$J22])<[.$U$1]) -> true | R22: of:=IF(ISBLANK([.$K22]); 1; ABS([.$K22]-[.$A22])<[.$U$1]) -> true | S22: of:=IF(ISBLANK([.$L22]); 1; ABS([.$L22]-[.$B22])<[.$U$1]) -> true
A23: 4 | C23: -6.5 | D23: 7.33698329057162 | E23: -6.5 | F23: 7.33698329057163 | G23: 9.8021081307098 | H23: 2.29577924685408 | I23: of:=SQRT([.C23]*[.C23]+[.D23]*[.D23]) -> 9.8021081307098 | J23: of:=ATAN2([.C23];[.D23]) -> 2.29577924685408 | K23: 4.00000000000001 | L23: 0 | N23: of:=IF(ISBLANK([.$C23]); 1; ABS([.$C23]-[.$E23])<[.$U$1]) -> true | O23: of:=IF(ISBLANK([.$D23]); 1; ABS([.$D23]-[.$F23])<[.$U$1]) -> true | P23: of:=IF(ISBLANK([.$G23]); 1; ABS([.$G23]-[.$I23])<[.$U$1]) -> true | Q23: of:=IF(ISBLANK([.$H23]); 1; ABS([.$H23]-[.$J23])<[.$U$1]) -> true | R23: of:=IF(ISBLANK([.$K23]); 1; ABS([.$K23]-[.$A23])<[.$U$1]) -> true | S23: of:=IF(ISBLANK([.$L23]); 1; ABS([.$L23]-[.$B23])<[.$U$1]) -> true
A24: 5 | C24: -6.49999999999998 | D24: 4.48662605279997 | E24: -6.5 | F24: 4.48662605279997 | G24: 7.89808922066997 | H24: 2.53744022020714 | I24: of:=SQRT([.C24]*[.C24]+[.D24]*[.D24]) -> 7.89808922066997 | J24: of:=ATAN2([.C24];[.D24]) -> 2.53744022020714 | K24: 5 | L24: -7.105427357601E-015 | N24: of:=IF(ISBLANK([.$C24]); 1; ABS([.$C24]-[.$E24])<[.$U$1]) -> true | O24: of:=IF(ISBLANK([.$D24]); 1; ABS([.$D24]-[.$F24])<[.$U$1]) -> true | P24: of:=IF(ISBLANK([.$G24]); 1; ABS([.$G24]-[.$I24])<[.$U$1]) -> true | Q24: of:=IF(ISBLANK([.$H24]); 1; ABS([.$H24]-[.$J24])<[.$U$1]) -> true | R24: of:=IF(ISBLANK([.$K24]); 1; ABS([.$K24]-[.$A24])<[.$U$1]) -> true | S24: of:=IF(ISBLANK([.$L24]); 1; ABS([.$L24]-[.$B24])<[.$U$1]) -> true
A25: 6 | C25: -6.50000000000002 | D25: 2.46512484013818 | E25: -6.5 | F25: 2.46512484013818 | G25: 6.95175089293817 | H25: 2.7791011935602 | I25: of:=SQRT([.C25]*[.C25]+[.D25]*[.D25]) -> 6.95175089293817 | J25: of:=ATAN2([.C25];[.D25]) -> 2.7791011935602 | K25: 6 | L25: 2.73285667600039E-016 | N25: of:=IF(ISBLANK([.$C25]); 1; ABS([.$C25]-[.$E25])<[.$U$1]) -> true | O25: of:=IF(ISBLANK([.$D25]); 1; ABS([.$D25]-[.$F25])<[.$U$1]) -> true | P25: of:=IF(ISBLANK([.$G25]); 1; ABS([.$G25]-[.$I25])<[.$U$1]) -> true | Q25: of:=IF(ISBLANK([.$H25]); 1; ABS([.$H25]-[.$J25])<[.$U$1]) -> true | R25: of:=IF(ISBLANK([.$K25]); 1; ABS([.$K25]-[.$A25])<[.$U$1]) -> true | S25: of:=IF(ISBLANK([.$L25]); 1; ABS([.$L25]-[.$B25])<[.$U$1]) -> true
A26: 7 | C26: -6.50000000000002 | D26: 0.789242890944638 | E26: -6.5 | F26: 0.789242890944693 | G26: 6.54774039962695 | H26: 3.02076216691327 | I26: of:=SQRT([.C26]*[.C26]+[.D26]*[.D26]) -> 6.54774039962695 | J26: of:=ATAN2([.C26];[.D26]) -> 3.02076216691327 | K26: 7 | L26: -4.91914201680069E-015 | N26: of:=IF(ISBLANK([.$C26]); 1; ABS([.$C26]-[.$E26])<[.$U$1]) -> true | O26: of:=IF(ISBLANK([.$D26]); 1; ABS([.$D26]-[.$F26])<[.$U$1]) -> true | P26: of:=IF(ISBLANK([.$G26]); 1; ABS([.$G26]-[.$I26])<[.$U$1]) -> true | Q26: of:=IF(ISBLANK([.$H26]); 1; ABS([.$H26]-[.$J26])<[.$U$1]) -> true | R26: of:=IF(ISBLANK([.$K26]); 1; ABS([.$K26]-[.$A26])<[.$U$1]) -> true | S26: of:=IF(ISBLANK([.$L26]); 1; ABS([.$L26]-[.$B26])<[.$U$1]) -> true
A27: 8 | C27: -6.49999999999998 | D27: -0.789242890944732 | E27: -6.5 | F27: -0.789242890944693 | G27: 6.54774039962692 | H27: -3.02076216691326 | I27: of:=SQRT([.C27]*[.C27]+[.D27]*[.D27]) -> 6.54774039962692 | J27: of:=ATAN2([.C27];[.D27]) -> -3.02076216691326 | K27: 8 | L27: -7.105427357601E-015 | N27: of:=IF(ISBLANK([.$C27]); 1; ABS([.$C27]-[.$E27])<[.$U$1]) -> true | O27: of:=IF(ISBLANK([.$D27]); 1; ABS([.$D27]-[.$F27])<[.$U$1]) -> true | P27: of:=IF(ISBLANK([.$G27]); 1; ABS([.$G27]-[.$I27])<[.$U$1]) -> true | Q27: of:=IF(ISBLANK([.$H27]); 1; ABS([.$H27]-[.$J27])<[.$U$1]) -> true | R27: of:=IF(ISBLANK([.$K27]); 1; ABS([.$K27]-[.$A27])<[.$U$1]) -> true | S27: of:=IF(ISBLANK([.$L27]); 1; ABS([.$L27]-[.$B27])<[.$U$1]) -> true
A28: 9 | C28: -6.49999999999997 | D28: -2.46512484013818 | E28: -6.5 | F28: -2.46512484013818 | G28: 6.95175089293812 | H28: -2.7791011935602 | I28: of:=SQRT([.C28]*[.C28]+[.D28]*[.D28]) -> 6.95175089293812 | J28: of:=ATAN2([.C28];[.D28]) -> -2.7791011935602 | K28: 9 | L28: 2.45957100840035E-015 | N28: of:=IF(ISBLANK([.$C28]); 1; ABS([.$C28]-[.$E28])<[.$U$1]) -> true | O28: of:=IF(ISBLANK([.$D28]); 1; ABS([.$D28]-[.$F28])<[.$U$1]) -> true | P28: of:=IF(ISBLANK([.$G28]); 1; ABS([.$G28]-[.$I28])<[.$U$1]) -> true | Q28: of:=IF(ISBLANK([.$H28]); 1; ABS([.$H28]-[.$J28])<[.$U$1]) -> true | R28: of:=IF(ISBLANK([.$K28]); 1; ABS([.$K28]-[.$A28])<[.$U$1]) -> true | S28: of:=IF(ISBLANK([.$L28]); 1; ABS([.$L28]-[.$B28])<[.$U$1]) -> true
A29: 10 | C29: -6.49999999999999 | D29: -4.48662605279997 | E29: -6.5 | F29: -4.48662605279997 | G29: 7.89808922066998 | H29: -2.53744022020714 | I29: of:=SQRT([.C29]*[.C29]+[.D29]*[.D29]) -> 7.89808922066998 | J29: of:=ATAN2([.C29];[.D29]) -> -2.53744022020714 | K29: 10 | L29: -1.09314267040015E-015 | N29: of:=IF(ISBLANK([.$C29]); 1; ABS([.$C29]-[.$E29])<[.$U$1]) -> true | O29: of:=IF(ISBLANK([.$D29]); 1; ABS([.$D29]-[.$F29])<[.$U$1]) -> true | P29: of:=IF(ISBLANK([.$G29]); 1; ABS([.$G29]-[.$I29])<[.$U$1]) -> true | Q29: of:=IF(ISBLANK([.$H29]); 1; ABS([.$H29]-[.$J29])<[.$U$1]) -> true | R29: of:=IF(ISBLANK([.$K29]); 1; ABS([.$K29]-[.$A29])<[.$U$1]) -> true | S29: of:=IF(ISBLANK([.$L29]); 1; ABS([.$L29]-[.$B29])<[.$U$1]) -> true
A30: 11 | C30: -6.49999999999997 | D30: -7.33698329057168 | E30: -6.5 | F30: -7.33698329057163 | G30: 9.80210813070983 | H30: -2.29577924685407 | I30: of:=SQRT([.C30]*[.C30]+[.D30]*[.D30]) -> 9.80210813070983 | J30: of:=ATAN2([.C30];[.D30]) -> -2.29577924685407 | K30: 11 | L30: 0.0000000000000163971400560023 | N30: of:=IF(ISBLANK([.$C30]); 1; ABS([.$C30]-[.$E30])<[.$U$1]) -> true | O30: of:=IF(ISBLANK([.$D30]); 1; ABS([.$D30]-[.$F30])<[.$U$1]) -> true | P30: of:=IF(ISBLANK([.$G30]); 1; ABS([.$G30]-[.$I30])<[.$U$1]) -> true | Q30: of:=IF(ISBLANK([.$H30]); 1; ABS([.$H30]-[.$J30])<[.$U$1]) -> true | R30: of:=IF(ISBLANK([.$K30]); 1; ABS([.$K30]-[.$A30])<[.$U$1]) -> true | S30: of:=IF(ISBLANK([.$L30]); 1; ABS([.$L30]-[.$B30])<[.$U$1]) -> true
A31: 12 | C31: -6.49999999999992 | D31: -12.38471527347 | E31: -6.5 | F31: -12.38471527347 | G31: 13.9868213831778 | H31: -2.05411827350101 | I31: of:=SQRT([.C31]*[.C31]+[.D31]*[.D31]) -> 13.9868213831778 | J31: of:=ATAN2([.C31];[.D31]) -> -2.05411827350101 | K31: 12 | L31: 4.37257068160062E-015 | N31: of:=IF(ISBLANK([.$C31]); 1; ABS([.$C31]-[.$E31])<[.$U$1]) -> true | O31: of:=IF(ISBLANK([.$D31]); 1; ABS([.$D31]-[.$F31])<[.$U$1]) -> true | P31: of:=IF(ISBLANK([.$G31]); 1; ABS([.$G31]-[.$I31])<[.$U$1]) -> true | Q31: of:=IF(ISBLANK([.$H31]); 1; ABS([.$H31]-[.$J31])<[.$U$1]) -> true | R31: of:=IF(ISBLANK([.$K31]); 1; ABS([.$K31]-[.$A31])<[.$U$1]) -> true | S31: of:=IF(ISBLANK([.$L31]); 1; ABS([.$L31]-[.$B31])<[.$U$1]) -> true
A32: 13 | C32: -6.49999999999984 | D32: -26.3715366566477 | E32: -6.5 | F32: -26.3715366566478 | G32: 27.1607795475924 | H32: -1.81245730014795 | I32: of:=SQRT([.C32]*[.C32]+[.D32]*[.D32]) -> 27.1607795475924 | J32: of:=ATAN2([.C32];[.D32]) -> -1.81245730014795 | K32: 13 | L32: 4.91914201680069E-015 | N32: of:=IF(ISBLANK([.$C32]); 1; ABS([.$C32]-[.$E32])<[.$U$1]) -> true | O32: of:=IF(ISBLANK([.$D32]); 1; ABS([.$D32]-[.$F32])<[.$U$1]) -> true | P32: of:=IF(ISBLANK([.$G32]); 1; ABS([.$G32]-[.$I32])<[.$U$1]) -> true | Q32: of:=IF(ISBLANK([.$H32]); 1; ABS([.$H32]-[.$J32])<[.$U$1]) -> true | R32: of:=IF(ISBLANK([.$K32]); 1; ABS([.$K32]-[.$A32])<[.$U$1]) -> true | S32: of:=IF(ISBLANK([.$L32]); 1; ABS([.$L32]-[.$B32])<[.$U$1]) -> true
N33: of:=IF(ISBLANK([.$C33]); 1; ABS([.$C33]-[.$E33])<[.$U$1]) -> true | O33: of:=IF(ISBLANK([.$D33]); 1; ABS([.$D33]-[.$F33])<[.$U$1]) -> true | P33: of:=IF(ISBLANK([.$G33]); 1; ABS([.$G33]-[.$I33])<[.$U$1]) -> true | Q33: of:=IF(ISBLANK([.$H33]); 1; ABS([.$H33]-[.$J33])<[.$U$1]) -> true | R33: of:=IF(ISBLANK([.$K33]); 1; ABS([.$K33]-[.$A33])<[.$U$1]) -> true | S33: of:=IF(ISBLANK([.$L33]); 1; ABS([.$L33]-[.$B33])<[.$U$1]) -> true
A34: 1 | B34: 31 | C34: of:=ORG.LIBREOFFICE.FOURIER([.A34:.B64];1) -> 496 | D34: 496 | E34: 496 | F34: 496 | G34: of:=ORG.LIBREOFFICE.FOURIER([.A34:.B64];1;;1) -> 701.449926937055 | H34: 0.785398163397448 | I34: of:=SQRT([.C34]*[.C34]+[.D34]*[.D34]) -> 701.449926937055 | J34: of:=ATAN2([.C34];[.D34]) -> 0.785398163397448 | K34: of:=ORG.LIBREOFFICE.FOURIER([.C34:.D64];1;1) -> 1.00000000000008 | L34: 30.9999999999999 | N34: of:=IF(ISBLANK([.$C34]); 1; ABS([.$C34]-[.$E34])<[.$U$1]) -> true | O34: of:=IF(ISBLANK([.$D34]); 1; ABS([.$D34]-[.$F34])<[.$U$1]) -> true | P34: of:=IF(ISBLANK([.$G34]); 1; ABS([.$G34]-[.$I34])<[.$U$1]) -> true | Q34: of:=IF(ISBLANK([.$H34]); 1; ABS([.$H34]-[.$J34])<[.$U$1]) -> true | R34: of:=IF(ISBLANK([.$K34]); 1; ABS([.$K34]-[.$A34])<[.$U$1]) -> true | S34: of:=IF(ISBLANK([.$L34]); 1; ABS([.$L34]-[.$B34])<[.$U$1]) -> true
A35: 2 | B35: 30 | C35: 136.923942689195 | D35: 167.923942689195 | E35: 136.923942689195 | F35: 167.923942689195 | G35: 216.671679298052 | H35: 0.886739861900346 | I35: of:=SQRT([.C35]*[.C35]+[.D35]*[.D35]) -> 216.671679298052 | J35: of:=ATAN2([.C35];[.D35]) -> 0.886739861900346 | K35: 2.00000000000006 | L35: 29.9999999999999 | N35: of:=IF(ISBLANK([.$C35]); 1; ABS([.$C35]-[.$E35])<[.$U$1]) -> true | O35: of:=IF(ISBLANK([.$D35]); 1; ABS([.$D35]-[.$F35])<[.$U$1]) -> true | P35: of:=IF(ISBLANK([.$G35]); 1; ABS([.$G35]-[.$I35])<[.$U$1]) -> true | Q35: of:=IF(ISBLANK([.$H35]); 1; ABS([.$H35]-[.$J35])<[.$U$1]) -> true | R35: of:=IF(ISBLANK([.$K35]); 1; ABS([.$K35]-[.$A35])<[.$U$1]) -> true | S35: of:=IF(ISBLANK([.$L35]); 1; ABS([.$L35]-[.$B35])<[.$U$1]) -> true
A36: 3 | B36: 29 | C36: 59.9238733733686 | D36: 90.9238733733691 | E36: 59.923873373369 | F36: 90.9238733733689 | G36: 108.894542330109 | H36: 0.988081560403245 | I36: of:=SQRT([.C36]*[.C36]+[.D36]*[.D36]) -> 108.894542330109 | J36: of:=ATAN2([.C36];[.D36]) -> 0.988081560403245 | K36: 3.00000000000006 | L36: 28.9999999999999 | N36: of:=IF(ISBLANK([.$C36]); 1; ABS([.$C36]-[.$E36])<[.$U$1]) -> true | O36: of:=IF(ISBLANK([.$D36]); 1; ABS([.$D36]-[.$F36])<[.$U$1]) -> true | P36: of:=IF(ISBLANK([.$G36]); 1; ABS([.$G36]-[.$I36])<[.$U$1]) -> true | Q36: of:=IF(ISBLANK([.$H36]); 1; ABS([.$H36]-[.$J36])<[.$U$1]) -> true | R36: of:=IF(ISBLANK([.$K36]); 1; ABS([.$K36]-[.$A36])<[.$U$1]) -> true | S36: of:=IF(ISBLANK([.$L36]); 1; ABS([.$L36]-[.$B36])<[.$U$1]) -> true
A37: 4 | B37: 28 | C37: 33.9020717291784 | D37: 64.9020717291789 | E37: 33.9020717291787 | F37: 64.9020717291787 | G37: 73.2231478582411 | H37: 1.08942325890614 | I37: of:=SQRT([.C37]*[.C37]+[.D37]*[.D37]) -> 73.2231478582411 | J37: of:=ATAN2([.C37];[.D37]) -> 1.08942325890614 | K37: 4.00000000000008 | L37: 28 | N37: of:=IF(ISBLANK([.$C37]); 1; ABS([.$C37]-[.$E37])<[.$U$1]) -> true | O37: of:=IF(ISBLANK([.$D37]); 1; ABS([.$D37]-[.$F37])<[.$U$1]) -> true | P37: of:=IF(ISBLANK([.$G37]); 1; ABS([.$G37]-[.$I37])<[.$U$1]) -> true | Q37: of:=IF(ISBLANK([.$H37]); 1; ABS([.$H37]-[.$J37])<[.$U$1]) -> true | R37: of:=IF(ISBLANK([.$K37]); 1; ABS([.$K37]-[.$A37])<[.$U$1]) -> true | S37: of:=IF(ISBLANK([.$L37]); 1; ABS([.$L37]-[.$B37])<[.$U$1]) -> true
A38: 5 | B38: 27 | C38: 20.6192711999175 | D38: 51.6192711999182 | E38: 20.6192711999181 | F38: 51.6192711999181 | G38: 55.585101457373 | H38: 1.19076495740905 | I38: of:=SQRT([.C38]*[.C38]+[.D38]*[.D38]) -> 55.585101457373 | J38: of:=ATAN2([.C38];[.D38]) -> 1.19076495740905 | K38: 5.00000000000006 | L38: 27 | N38: of:=IF(ISBLANK([.$C38]); 1; ABS([.$C38]-[.$E38])<[.$U$1]) -> true | O38: of:=IF(ISBLANK([.$D38]); 1; ABS([.$D38]-[.$F38])<[.$U$1]) -> true | P38: of:=IF(ISBLANK([.$G38]); 1; ABS([.$G38]-[.$I38])<[.$U$1]) -> true | Q38: of:=IF(ISBLANK([.$H38]); 1; ABS([.$H38]-[.$J38])<[.$U$1]) -> true | R38: of:=IF(ISBLANK([.$K38]); 1; ABS([.$K38]-[.$A38])<[.$U$1]) -> true | S38: of:=IF(ISBLANK([.$L38]); 1; ABS([.$L38]-[.$B38])<[.$U$1]) -> true
A39: 6 | B39: 26 | C39: 12.4256495884721 | D39: 43.4256495884724 | E39: 12.4256495884726 | F39: 43.4256495884726 | G39: 45.1683939262433 | H39: 1.29210665591194 | I39: of:=SQRT([.C39]*[.C39]+[.D39]*[.D39]) -> 45.1683939262433 | J39: of:=ATAN2([.C39];[.D39]) -> 1.29210665591194 | K39: 5.99999999999999 | L39: 25.9999999999999 | N39: of:=IF(ISBLANK([.$C39]); 1; ABS([.$C39]-[.$E39])<[.$U$1]) -> true | O39: of:=IF(ISBLANK([.$D39]); 1; ABS([.$D39]-[.$F39])<[.$U$1]) -> true | P39: of:=IF(ISBLANK([.$G39]); 1; ABS([.$G39]-[.$I39])<[.$U$1]) -> true | Q39: of:=IF(ISBLANK([.$H39]); 1; ABS([.$H39]-[.$J39])<[.$U$1]) -> true | R39: of:=IF(ISBLANK([.$K39]); 1; ABS([.$K39]-[.$A39])<[.$U$1]) -> true | S39: of:=IF(ISBLANK([.$L39]); 1; ABS([.$L39]-[.$B39])<[.$U$1]) -> true
A40: 7 | B40: 25 | C40: 6.76945767777696 | D40: 37.7694576777769 | E40: 6.76945767777717 | F40: 37.7694576777772 | G40: 38.3713107741265 | H40: 1.39344835441483 | I40: of:=SQRT([.C40]*[.C40]+[.D40]*[.D40]) -> 38.3713107741265 | J40: of:=ATAN2([.C40];[.D40]) -> 1.39344835441483 | K40: 7.00000000000001 | L40: 24.9999999999999 | N40: of:=IF(ISBLANK([.$C40]); 1; ABS([.$C40]-[.$E40])<[.$U$1]) -> true | O40: of:=IF(ISBLANK([.$D40]); 1; ABS([.$D40]-[.$F40])<[.$U$1]) -> true | P40: of:=IF(ISBLANK([.$G40]); 1; ABS([.$G40]-[.$I40])<[.$U$1]) -> true | Q40: of:=IF(ISBLANK([.$H40]); 1; ABS([.$H40]-[.$J40])<[.$U$1]) -> true | R40: of:=IF(ISBLANK([.$K40]); 1; ABS([.$K40]-[.$A40])<[.$U$1]) -> true | S40: of:=IF(ISBLANK([.$L40]); 1; ABS([.$L40]-[.$B40])<[.$U$1]) -> true
A41: 8 | B41: 24 | C41: 2.55533886323773 | D41: 33.5553388632376 | E41: 2.55533886323785 | F41: 33.5553388632378 | G41: 33.6524965334324 | H41: 1.49479005291773 | I41: of:=SQRT([.C41]*[.C41]+[.D41]*[.D41]) -> 33.6524965334324 | J41: of:=ATAN2([.C41];[.D41]) -> 1.49479005291773 | K41: 8 | L41: 24 | N41: of:=IF(ISBLANK([.$C41]); 1; ABS([.$C41]-[.$E41])<[.$U$1]) -> true | O41: of:=IF(ISBLANK([.$D41]); 1; ABS([.$D41]-[.$F41])<[.$U$1]) -> true | P41: of:=IF(ISBLANK([.$G41]); 1; ABS([.$G41]-[.$I41])<[.$U$1]) -> true | Q41: of:=IF(ISBLANK([.$H41]); 1; ABS([.$H41]-[.$J41])<[.$U$1]) -> true | R41: of:=IF(ISBLANK([.$K41]); 1; ABS([.$K41]-[.$A41])<[.$U$1]) -> true | S41: of:=IF(ISBLANK([.$L41]); 1; ABS([.$L41]-[.$B41])<[.$U$1]) -> true
A42: 9 | B42: 23 | C42: -0.766151327886293 | D42: 30.2338486721131 | E42: -0.76615132788659 | F42: 30.2338486721134 | G42: 30.2435545759003 | H42: 1.59613175142061 | I42: of:=SQRT([.C42]*[.C42]+[.D42]*[.D42]) -> 30.2435545759003 | J42: of:=ATAN2([.C42];[.D42]) -> 1.59613175142061 | K42: 8.99999999999997 | L42: 23 | N42: of:=IF(ISBLANK([.$C42]); 1; ABS([.$C42]-[.$E42])<[.$U$1]) -> true | O42: of:=IF(ISBLANK([.$D42]); 1; ABS([.$D42]-[.$F42])<[.$U$1]) -> true | P42: of:=IF(ISBLANK([.$G42]); 1; ABS([.$G42]-[.$I42])<[.$U$1]) -> true | Q42: of:=IF(ISBLANK([.$H42]); 1; ABS([.$H42]-[.$J42])<[.$U$1]) -> true | R42: of:=IF(ISBLANK([.$K42]); 1; ABS([.$K42]-[.$A42])<[.$U$1]) -> true | S42: of:=IF(ISBLANK([.$L42]); 1; ABS([.$L42]-[.$B42])<[.$U$1]) -> true
A43: 10 | B43: 22 | C43: -3.50210693586752 | D43: 27.4978930641323 | E43: -3.50210693586789 | F43: 27.4978930641321 | G43: 27.7200085850763 | H43: 1.6974734499235 | I43: of:=SQRT([.C43]*[.C43]+[.D43]*[.D43]) -> 27.7200085850763 | J43: of:=ATAN2([.C43];[.D43]) -> 1.6974734499235 | K43: 10 | L43: 22 | N43: of:=IF(ISBLANK([.$C43]); 1; ABS([.$C43]-[.$E43])<[.$U$1]) -> true | O43: of:=IF(ISBLANK([.$D43]); 1; ABS([.$D43]-[.$F43])<[.$U$1]) -> true | P43: of:=IF(ISBLANK([.$G43]); 1; ABS([.$G43]-[.$I43])<[.$U$1]) -> true | Q43: of:=IF(ISBLANK([.$H43]); 1; ABS([.$H43]-[.$J43])<[.$U$1]) -> true | R43: of:=IF(ISBLANK([.$K43]); 1; ABS([.$K43]-[.$A43])<[.$U$1]) -> true | S43: of:=IF(ISBLANK([.$L43]); 1; ABS([.$L43]-[.$B43])<[.$U$1]) -> true
A44: 11 | B44: 21 | C44: -5.83877612714684 | D44: 25.1612238728531 | E44: -5.83877612714696 | F44: 25.161223872853 | G44: 25.8297985559851 | H44: 1.79881514842641 | I44: of:=SQRT([.C44]*[.C44]+[.D44]*[.D44]) -> 25.8297985559851 | J44: of:=ATAN2([.C44];[.D44]) -> 1.79881514842641 | K44: 11 | L44: 21 | N44: of:=IF(ISBLANK([.$C44]); 1; ABS([.$C44]-[.$E44])<[.$U$1]) -> true | O44: of:=IF(ISBLANK([.$D44]); 1; ABS([.$D44]-[.$F44])<[.$U$1]) -> true | P44: of:=IF(ISBLANK([.$G44]); 1; ABS([.$G44]-[.$I44])<[.$U$1]) -> true | Q44: of:=IF(ISBLANK([.$H44]); 1; ABS([.$H44]-[.$J44])<[.$U$1]) -> true | R44: of:=IF(ISBLANK([.$K44]); 1; ABS([.$K44]-[.$A44])<[.$U$1]) -> true | S44: of:=IF(ISBLANK([.$L44]); 1; ABS([.$L44]-[.$B44])<[.$U$1]) -> true
A45: 12 | B45: 20 | C45: -7.8968870190754 | D45: 23.1031129809246 | E45: -7.89688701907541 | F45: 23.1031129809246 | G45: 24.4154593239899 | H45: 1.90015684692931 | I45: of:=SQRT([.C45]*[.C45]+[.D45]*[.D45]) -> 24.4154593239899 | J45: of:=ATAN2([.C45];[.D45]) -> 1.90015684692931 | K45: 12 | L45: 20 | N45: of:=IF(ISBLANK([.$C45]); 1; ABS([.$C45]-[.$E45])<[.$U$1]) -> true | O45: of:=IF(ISBLANK([.$D45]); 1; ABS([.$D45]-[.$F45])<[.$U$1]) -> true | P45: of:=IF(ISBLANK([.$G45]); 1; ABS([.$G45]-[.$I45])<[.$U$1]) -> true | Q45: of:=IF(ISBLANK([.$H45]); 1; ABS([.$H45]-[.$J45])<[.$U$1]) -> true | R45: of:=IF(ISBLANK([.$K45]); 1; ABS([.$K45]-[.$A45])<[.$U$1]) -> true | S45: of:=IF(ISBLANK([.$L45]); 1; ABS([.$L45]-[.$B45])<[.$U$1]) -> true
A46: 13 | B46: 19 | C46: -9.75943036059081 | D46: 21.240569639409 | E46: -9.75943036059086 | F46: 21.2405696394091 | G46: 23.3753776348064 | H46: 2.00149854543221 | I46: of:=SQRT([.C46]*[.C46]+[.D46]*[.D46]) -> 23.3753776348064 | J46: of:=ATAN2([.C46];[.D46]) -> 2.00149854543221 | K46: 13 | L46: 19 | N46: of:=IF(ISBLANK([.$C46]); 1; ABS([.$C46]-[.$E46])<[.$U$1]) -> true | O46: of:=IF(ISBLANK([.$D46]); 1; ABS([.$D46]-[.$F46])<[.$U$1]) -> true | P46: of:=IF(ISBLANK([.$G46]); 1; ABS([.$G46]-[.$I46])<[.$U$1]) -> true | Q46: of:=IF(ISBLANK([.$H46]); 1; ABS([.$H46]-[.$J46])<[.$U$1]) -> true | R46: of:=IF(ISBLANK([.$K46]); 1; ABS([.$K46]-[.$A46])<[.$U$1]) -> true | S46: of:=IF(ISBLANK([.$L46]); 1; ABS([.$L46]-[.$B46])<[.$U$1]) -> true
A47: 14 | B47: 18 | C47: -11.4867719479205 | D47: 19.5132280520797 | E47: -11.4867719479205 | F47: 19.5132280520795 | G47: 22.6431446313449 | H47: 2.1028402439351 | I47: of:=SQRT([.C47]*[.C47]+[.D47]*[.D47]) -> 22.6431446313449 | J47: of:=ATAN2([.C47];[.D47]) -> 2.1028402439351 | K47: 14 | L47: 18 | N47: of:=IF(ISBLANK([.$C47]); 1; ABS([.$C47]-[.$E47])<[.$U$1]) -> true | O47: of:=IF(ISBLANK([.$D47]); 1; ABS([.$D47]-[.$F47])<[.$U$1]) -> true | P47: of:=IF(ISBLANK([.$G47]); 1; ABS([.$G47]-[.$I47])<[.$U$1]) -> true | Q47: of:=IF(ISBLANK([.$H47]); 1; ABS([.$H47]-[.$J47])<[.$U$1]) -> true | R47: of:=IF(ISBLANK([.$K47]); 1; ABS([.$K47]-[.$A47])<[.$U$1]) -> true | S47: of:=IF(ISBLANK([.$L47]); 1; ABS([.$L47]-[.$B47])<[.$U$1]) -> true
A48: 15 | B48: 17 | C48: -13.1254873387914 | D48: 17.8745126612088 | E48: -13.1254873387912 | F48: 17.8745126612088 | G48: 22.176037084125 | H48: 2.204181942438 | I48: of:=SQRT([.C48]*[.C48]+[.D48]*[.D48]) -> 22.176037084125 | J48: of:=ATAN2([.C48];[.D48]) -> 2.204181942438 | K48: 15 | L48: 17 | N48: of:=IF(ISBLANK([.$C48]); 1; ABS([.$C48]-[.$E48])<[.$U$1]) -> true | O48: of:=IF(ISBLANK([.$D48]); 1; ABS([.$D48]-[.$F48])<[.$U$1]) -> true | P48: of:=IF(ISBLANK([.$G48]); 1; ABS([.$G48]-[.$I48])<[.$U$1]) -> true | Q48: of:=IF(ISBLANK([.$H48]); 1; ABS([.$H48]-[.$J48])<[.$U$1]) -> true | R48: of:=IF(ISBLANK([.$K48]); 1; ABS([.$K48]-[.$A48])<[.$U$1]) -> true | S48: of:=IF(ISBLANK([.$L48]); 1; ABS([.$L48]-[.$B48])<[.$U$1]) -> true
A49: 16 | B49: 16 | C49: -14.7139289664655 | D49: 16.2860710335344 | E49: -14.7139289664654 | F49: 16.2860710335346 | G49: 21.9484809346688 | H49: 2.30552364094091 | I49: of:=SQRT([.C49]*[.C49]+[.D49]*[.D49]) -> 21.9484809346688 | J49: of:=ATAN2([.C49];[.D49]) -> 2.30552364094091 | K49: 16 | L49: 16 | N49: of:=IF(ISBLANK([.$C49]); 1; ABS([.$C49]-[.$E49])<[.$U$1]) -> true | O49: of:=IF(ISBLANK([.$D49]); 1; ABS([.$D49]-[.$F49])<[.$U$1]) -> true | P49: of:=IF(ISBLANK([.$G49]); 1; ABS([.$G49]-[.$I49])<[.$U$1]) -> true | Q49: of:=IF(ISBLANK([.$H49]); 1; ABS([.$H49]-[.$J49])<[.$U$1]) -> true | R49: of:=IF(ISBLANK([.$K49]); 1; ABS([.$K49]-[.$A49])<[.$U$1]) -> true | S49: of:=IF(ISBLANK([.$L49]); 1; ABS([.$L49]-[.$B49])<[.$U$1]) -> true
A50: 17 | B50: 15 | C50: -16.2860710335344 | D50: 14.7139289664653 | E50: -16.2860710335346 | F50: 14.7139289664654 | G50: 21.9484809346687 | H50: 2.40686533944379 | I50: of:=SQRT([.C50]*[.C50]+[.D50]*[.D50]) -> 21.9484809346687 | J50: of:=ATAN2([.C50];[.D50]) -> 2.40686533944379 | K50: 17 | L50: 15 | N50: of:=IF(ISBLANK([.$C50]); 1; ABS([.$C50]-[.$E50])<[.$U$1]) -> true | O50: of:=IF(ISBLANK([.$D50]); 1; ABS([.$D50]-[.$F50])<[.$U$1]) -> true | P50: of:=IF(ISBLANK([.$G50]); 1; ABS([.$G50]-[.$I50])<[.$U$1]) -> true | Q50: of:=IF(ISBLANK([.$H50]); 1; ABS([.$H50]-[.$J50])<[.$U$1]) -> true | R50: of:=IF(ISBLANK([.$K50]); 1; ABS([.$K50]-[.$A50])<[.$U$1]) -> true | S50: of:=IF(ISBLANK([.$L50]); 1; ABS([.$L50]-[.$B50])<[.$U$1]) -> true
A51: 18 | B51: 14 | C51: -17.8745126612087 | D51: 13.1254873387913 | E51: -17.8745126612088 | F51: 13.1254873387912 | G51: 22.1760370841248 | H51: 2.50820703794669 | I51: of:=SQRT([.C51]*[.C51]+[.D51]*[.D51]) -> 22.1760370841248 | J51: of:=ATAN2([.C51];[.D51]) -> 2.50820703794669 | K51: 18 | L51: 14 | N51: of:=IF(ISBLANK([.$C51]); 1; ABS([.$C51]-[.$E51])<[.$U$1]) -> true | O51: of:=IF(ISBLANK([.$D51]); 1; ABS([.$D51]-[.$F51])<[.$U$1]) -> true | P51: of:=IF(ISBLANK([.$G51]); 1; ABS([.$G51]-[.$I51])<[.$U$1]) -> true | Q51: of:=IF(ISBLANK([.$H51]); 1; ABS([.$H51]-[.$J51])<[.$U$1]) -> true | R51: of:=IF(ISBLANK([.$K51]); 1; ABS([.$K51]-[.$A51])<[.$U$1]) -> true | S51: of:=IF(ISBLANK([.$L51]); 1; ABS([.$L51]-[.$B51])<[.$U$1]) -> true
A52: 19 | B52: 13 | C52: -19.5132280520797 | D52: 11.4867719479206 | E52: -19.5132280520795 | F52: 11.4867719479205 | G52: 22.6431446313449 | H52: 2.60954873644959 | I52: of:=SQRT([.C52]*[.C52]+[.D52]*[.D52]) -> 22.6431446313449 | J52: of:=ATAN2([.C52];[.D52]) -> 2.60954873644959 | K52: 19 | L52: 13 | N52: of:=IF(ISBLANK([.$C52]); 1; ABS([.$C52]-[.$E52])<[.$U$1]) -> true | O52: of:=IF(ISBLANK([.$D52]); 1; ABS([.$D52]-[.$F52])<[.$U$1]) -> true | P52: of:=IF(ISBLANK([.$G52]); 1; ABS([.$G52]-[.$I52])<[.$U$1]) -> true | Q52: of:=IF(ISBLANK([.$H52]); 1; ABS([.$H52]-[.$J52])<[.$U$1]) -> true | R52: of:=IF(ISBLANK([.$K52]); 1; ABS([.$K52]-[.$A52])<[.$U$1]) -> true | S52: of:=IF(ISBLANK([.$L52]); 1; ABS([.$L52]-[.$B52])<[.$U$1]) -> true
A53: 20 | B53: 12 | C53: -21.2405696394091 | D53: 9.75943036059068 | E53: -21.2405696394091 | F53: 9.75943036059086 | G53: 23.3753776348064 | H53: 2.71089043495249 | I53: of:=SQRT([.C53]*[.C53]+[.D53]*[.D53]) -> 23.3753776348064 | J53: of:=ATAN2([.C53];[.D53]) -> 2.71089043495249 | K53: 20 | L53: 11.9999999999999 | N53: of:=IF(ISBLANK([.$C53]); 1; ABS([.$C53]-[.$E53])<[.$U$1]) -> true | O53: of:=IF(ISBLANK([.$D53]); 1; ABS([.$D53]-[.$F53])<[.$U$1]) -> true | P53: of:=IF(ISBLANK([.$G53]); 1; ABS([.$G53]-[.$I53])<[.$U$1]) -> true | Q53: of:=IF(ISBLANK([.$H53]); 1; ABS([.$H53]-[.$J53])<[.$U$1]) -> true | R53: of:=IF(ISBLANK([.$K53]); 1; ABS([.$K53]-[.$A53])<[.$U$1]) -> true | S53: of:=IF(ISBLANK([.$L53]); 1; ABS([.$L53]-[.$B53])<[.$U$1]) -> true
A54: 21 | B54: 11 | C54: -23.1031129809246 | D54: 7.8968870190755 | E54: -23.1031129809246 | F54: 7.89688701907541 | G54: 24.4154593239899 | H54: 2.81223213345538 | I54: of:=SQRT([.C54]*[.C54]+[.D54]*[.D54]) -> 24.4154593239899 | J54: of:=ATAN2([.C54];[.D54]) -> 2.81223213345538 | K54: 21 | L54: 11 | N54: of:=IF(ISBLANK([.$C54]); 1; ABS([.$C54]-[.$E54])<[.$U$1]) -> true | O54: of:=IF(ISBLANK([.$D54]); 1; ABS([.$D54]-[.$F54])<[.$U$1]) -> true | P54: of:=IF(ISBLANK([.$G54]); 1; ABS([.$G54]-[.$I54])<[.$U$1]) -> true | Q54: of:=IF(ISBLANK([.$H54]); 1; ABS([.$H54]-[.$J54])<[.$U$1]) -> true | R54: of:=IF(ISBLANK([.$K54]); 1; ABS([.$K54]-[.$A54])<[.$U$1]) -> true | S54: of:=IF(ISBLANK([.$L54]); 1; ABS([.$L54]-[.$B54])<[.$U$1]) -> true
A55: 22 | B55: 10 | C55: -25.161223872853 | D55: 5.83877612714712 | E55: -25.161223872853 | F55: 5.83877612714697 | G55: 25.8297985559851 | H55: 2.91357383195827 | I55: of:=SQRT([.C55]*[.C55]+[.D55]*[.D55]) -> 25.8297985559851 | J55: of:=ATAN2([.C55];[.D55]) -> 2.91357383195827 | K55: 22 | L55: 10 | N55: of:=IF(ISBLANK([.$C55]); 1; ABS([.$C55]-[.$E55])<[.$U$1]) -> true | O55: of:=IF(ISBLANK([.$D55]); 1; ABS([.$D55]-[.$F55])<[.$U$1]) -> true | P55: of:=IF(ISBLANK([.$G55]); 1; ABS([.$G55]-[.$I55])<[.$U$1]) -> true | Q55: of:=IF(ISBLANK([.$H55]); 1; ABS([.$H55]-[.$J55])<[.$U$1]) -> true | R55: of:=IF(ISBLANK([.$K55]); 1; ABS([.$K55]-[.$A55])<[.$U$1]) -> true | S55: of:=IF(ISBLANK([.$L55]); 1; ABS([.$L55]-[.$B55])<[.$U$1]) -> true
A56: 23 | B56: 9 | C56: -27.4978930641323 | D56: 3.50210693586775 | E56: -27.4978930641321 | F56: 3.50210693586789 | G56: 27.7200085850764 | H56: 3.01491553046118 | I56: of:=SQRT([.C56]*[.C56]+[.D56]*[.D56]) -> 27.7200085850764 | J56: of:=ATAN2([.C56];[.D56]) -> 3.01491553046118 | K56: 22.9999999999999 | L56: 9.00000000000005 | N56: of:=IF(ISBLANK([.$C56]); 1; ABS([.$C56]-[.$E56])<[.$U$1]) -> true | O56: of:=IF(ISBLANK([.$D56]); 1; ABS([.$D56]-[.$F56])<[.$U$1]) -> true | P56: of:=IF(ISBLANK([.$G56]); 1; ABS([.$G56]-[.$I56])<[.$U$1]) -> true | Q56: of:=IF(ISBLANK([.$H56]); 1; ABS([.$H56]-[.$J56])<[.$U$1]) -> true | R56: of:=IF(ISBLANK([.$K56]); 1; ABS([.$K56]-[.$A56])<[.$U$1]) -> true | S56: of:=IF(ISBLANK([.$L56]); 1; ABS([.$L56]-[.$B56])<[.$U$1]) -> true
A57: 24 | B57: 8 | C57: -30.2338486721136 | D57: 0.766151327886344 | E57: -30.2338486721134 | F57: 0.76615132788659 | G57: 30.2435545759008 | H57: 3.11625722896408 | I57: of:=SQRT([.C57]*[.C57]+[.D57]*[.D57]) -> 30.2435545759008 | J57: of:=ATAN2([.C57];[.D57]) -> 3.11625722896408 | K57: 24 | L57: 7.99999999999996 | N57: of:=IF(ISBLANK([.$C57]); 1; ABS([.$C57]-[.$E57])<[.$U$1]) -> true | O57: of:=IF(ISBLANK([.$D57]); 1; ABS([.$D57]-[.$F57])<[.$U$1]) -> true | P57: of:=IF(ISBLANK([.$G57]); 1; ABS([.$G57]-[.$I57])<[.$U$1]) -> true | Q57: of:=IF(ISBLANK([.$H57]); 1; ABS([.$H57]-[.$J57])<[.$U$1]) -> true | R57: of:=IF(ISBLANK([.$K57]); 1; ABS([.$K57]-[.$A57])<[.$U$1]) -> true | S57: of:=IF(ISBLANK([.$L57]); 1; ABS([.$L57]-[.$B57])<[.$U$1]) -> true
A58: 25 | B58: 7 | C58: -33.5553388632377 | D58: -2.55533886323832 | E58: -33.5553388632378 | F58: -2.55533886323785 | G58: 33.6524965334325 | H58: -3.06558637971261 | I58: of:=SQRT([.C58]*[.C58]+[.D58]*[.D58]) -> 33.6524965334325 | J58: of:=ATAN2([.C58];[.D58]) -> -3.06558637971261 | K58: 24.9999999999999 | L58: 7.00000000000003 | N58: of:=IF(ISBLANK([.$C58]); 1; ABS([.$C58]-[.$E58])<[.$U$1]) -> true | O58: of:=IF(ISBLANK([.$D58]); 1; ABS([.$D58]-[.$F58])<[.$U$1]) -> true | P58: of:=IF(ISBLANK([.$G58]); 1; ABS([.$G58]-[.$I58])<[.$U$1]) -> true | Q58: of:=IF(ISBLANK([.$H58]); 1; ABS([.$H58]-[.$J58])<[.$U$1]) -> true | R58: of:=IF(ISBLANK([.$K58]); 1; ABS([.$K58]-[.$A58])<[.$U$1]) -> true | S58: of:=IF(ISBLANK([.$L58]); 1; ABS([.$L58]-[.$B58])<[.$U$1]) -> true
A59: 26 | B59: 6 | C59: -37.769457677777 | D59: -6.76945767777761 | E59: -37.7694576777772 | F59: -6.76945767777718 | G59: 38.3713107741267 | H59: -2.96424468120971 | I59: of:=SQRT([.C59]*[.C59]+[.D59]*[.D59]) -> 38.3713107741267 | J59: of:=ATAN2([.C59];[.D59]) -> -2.96424468120971 | K59: 26 | L59: 6.00000000000001 | N59: of:=IF(ISBLANK([.$C59]); 1; ABS([.$C59]-[.$E59])<[.$U$1]) -> true | O59: of:=IF(ISBLANK([.$D59]); 1; ABS([.$D59]-[.$F59])<[.$U$1]) -> true | P59: of:=IF(ISBLANK([.$G59]); 1; ABS([.$G59]-[.$I59])<[.$U$1]) -> true | Q59: of:=IF(ISBLANK([.$H59]); 1; ABS([.$H59]-[.$J59])<[.$U$1]) -> true | R59: of:=IF(ISBLANK([.$K59]); 1; ABS([.$K59]-[.$A59])<[.$U$1]) -> true | S59: of:=IF(ISBLANK([.$L59]); 1; ABS([.$L59]-[.$B59])<[.$U$1]) -> true
A60: 27 | B60: 5 | C60: -43.4256495884722 | D60: -12.4256495884728 | E60: -43.4256495884726 | F60: -12.4256495884726 | G60: 45.1683939262433 | H60: -2.86290298270682 | I60: of:=SQRT([.C60]*[.C60]+[.D60]*[.D60]) -> 45.1683939262433 | J60: of:=ATAN2([.C60];[.D60]) -> -2.86290298270682 | K60: 27 | L60: 4.99999999999996 | N60: of:=IF(ISBLANK([.$C60]); 1; ABS([.$C60]-[.$E60])<[.$U$1]) -> true | O60: of:=IF(ISBLANK([.$D60]); 1; ABS([.$D60]-[.$F60])<[.$U$1]) -> true | P60: of:=IF(ISBLANK([.$G60]); 1; ABS([.$G60]-[.$I60])<[.$U$1]) -> true | Q60: of:=IF(ISBLANK([.$H60]); 1; ABS([.$H60]-[.$J60])<[.$U$1]) -> true | R60: of:=IF(ISBLANK([.$K60]); 1; ABS([.$K60]-[.$A60])<[.$U$1]) -> true | S60: of:=IF(ISBLANK([.$L60]); 1; ABS([.$L60]-[.$B60])<[.$U$1]) -> true
A61: 28 | B61: 4 | C61: -51.6192711999179 | D61: -20.6192711999179 | E61: -51.6192711999181 | F61: -20.6192711999182 | G61: 55.5851014573729 | H61: -2.76156128420393 | I61: of:=SQRT([.C61]*[.C61]+[.D61]*[.D61]) -> 55.5851014573729 | J61: of:=ATAN2([.C61];[.D61]) -> -2.76156128420393 | K61: 28 | L61: 3.99999999999997 | N61: of:=IF(ISBLANK([.$C61]); 1; ABS([.$C61]-[.$E61])<[.$U$1]) -> true | O61: of:=IF(ISBLANK([.$D61]); 1; ABS([.$D61]-[.$F61])<[.$U$1]) -> true | P61: of:=IF(ISBLANK([.$G61]); 1; ABS([.$G61]-[.$I61])<[.$U$1]) -> true | Q61: of:=IF(ISBLANK([.$H61]); 1; ABS([.$H61]-[.$J61])<[.$U$1]) -> true | R61: of:=IF(ISBLANK([.$K61]); 1; ABS([.$K61]-[.$A61])<[.$U$1]) -> true | S61: of:=IF(ISBLANK([.$L61]); 1; ABS([.$L61]-[.$B61])<[.$U$1]) -> true
A62: 29 | B62: 3 | C62: -64.9020717291779 | D62: -33.9020717291789 | E62: -64.9020717291786 | F62: -33.9020717291786 | G62: 73.2231478582404 | H62: -2.66021958570103 | I62: of:=SQRT([.C62]*[.C62]+[.D62]*[.D62]) -> 73.2231478582404 | J62: of:=ATAN2([.C62];[.D62]) -> -2.66021958570103 | K62: 29 | L62: 3.0000000000001 | N62: of:=IF(ISBLANK([.$C62]); 1; ABS([.$C62]-[.$E62])<[.$U$1]) -> true | O62: of:=IF(ISBLANK([.$D62]); 1; ABS([.$D62]-[.$F62])<[.$U$1]) -> true | P62: of:=IF(ISBLANK([.$G62]); 1; ABS([.$G62]-[.$I62])<[.$U$1]) -> true | Q62: of:=IF(ISBLANK([.$H62]); 1; ABS([.$H62]-[.$J62])<[.$U$1]) -> true | R62: of:=IF(ISBLANK([.$K62]); 1; ABS([.$K62]-[.$A62])<[.$U$1]) -> true | S62: of:=IF(ISBLANK([.$L62]); 1; ABS([.$L62]-[.$B62])<[.$U$1]) -> true
A63: 30 | B63: 2 | C63: -90.9238733733677 | D63: -59.9238733733693 | E63: -90.9238733733689 | F63: -59.9238733733689 | G63: 108.894542330109 | H63: -2.55887788719813 | I63: of:=SQRT([.C63]*[.C63]+[.D63]*[.D63]) -> 108.894542330109 | J63: of:=ATAN2([.C63];[.D63]) -> -2.55887788719813 | K63: 29.9999999999999 | L63: 2.00000000000015 | N63: of:=IF(ISBLANK([.$C63]); 1; ABS([.$C63]-[.$E63])<[.$U$1]) -> true | O63: of:=IF(ISBLANK([.$D63]); 1; ABS([.$D63]-[.$F63])<[.$U$1]) -> true | P63: of:=IF(ISBLANK([.$G63]); 1; ABS([.$G63]-[.$I63])<[.$U$1]) -> true | Q63: of:=IF(ISBLANK([.$H63]); 1; ABS([.$H63]-[.$J63])<[.$U$1]) -> true | R63: of:=IF(ISBLANK([.$K63]); 1; ABS([.$K63]-[.$A63])<[.$U$1]) -> true | S63: of:=IF(ISBLANK([.$L63]); 1; ABS([.$L63]-[.$B63])<[.$U$1]) -> true
A64: 31 | B64: 1 | C64: -167.923942689193 | D64: -136.923942689195 | E64: -167.923942689195 | F64: -136.923942689195 | G64: 216.671679298051 | H64: -2.45753618869524 | I64: of:=SQRT([.C64]*[.C64]+[.D64]*[.D64]) -> 216.671679298051 | J64: of:=ATAN2([.C64];[.D64]) -> -2.45753618869524 | K64: 30.9999999999999 | L64: 1.00000000000012 | N64: of:=IF(ISBLANK([.$C64]); 1; ABS([.$C64]-[.$E64])<[.$U$1]) -> true | O64: of:=IF(ISBLANK([.$D64]); 1; ABS([.$D64]-[.$F64])<[.$U$1]) -> true | P64: of:=IF(ISBLANK([.$G64]); 1; ABS([.$G64]-[.$I64])<[.$U$1]) -> true | Q64: of:=IF(ISBLANK([.$H64]); 1; ABS([.$H64]-[.$J64])<[.$U$1]) -> true | R64: of:=IF(ISBLANK([.$K64]); 1; ABS([.$K64]-[.$A64])<[.$U$1]) -> true | S64: of:=IF(ISBLANK([.$L64]); 1; ABS([.$L64]-[.$B64])<[.$U$1]) -> true
N65: of:=IF(ISBLANK([.$C65]); 1; ABS([.$C65]-[.$E65])<[.$U$1]) -> true | O65: of:=IF(ISBLANK([.$D65]); 1; ABS([.$D65]-[.$F65])<[.$U$1]) -> true | P65: of:=IF(ISBLANK([.$G65]); 1; ABS([.$G65]-[.$I65])<[.$U$1]) -> true | Q65: of:=IF(ISBLANK([.$H65]); 1; ABS([.$H65]-[.$J65])<[.$U$1]) -> true | R65: of:=IF(ISBLANK([.$K65]); 1; ABS([.$K65]-[.$A65])<[.$U$1]) -> true | S65: of:=IF(ISBLANK([.$L65]); 1; ABS([.$L65]-[.$B65])<[.$U$1]) -> true
A66: 1 | C66: of:=ORG.LIBREOFFICE.FOURIER([.A66:.A77];1) -> 78 | D66: -2.57175827820944E-015 | E66: 78 | F66: 0 | G66: of:=ORG.LIBREOFFICE.FOURIER([.A66:.A77];1;;1) -> 78 | H66: -3.29712599770441E-017 | I66: of:=SQRT([.C66]*[.C66]+[.D66]*[.D66]) -> 78 | J66: of:=ATAN2([.C66];[.D66]) -> -3.29712599770441E-017 | K66: of:=ORG.LIBREOFFICE.FOURIER([.C66:.D77];1;1) -> 1.00000000000001 | L66: 7.25315260227182E-016 | N66: of:=IF(ISBLANK([.$C66]); 1; ABS([.$C66]-[.$E66])<[.$U$1]) -> true | O66: of:=IF(ISBLANK([.$D66]); 1; ABS([.$D66]-[.$F66])<[.$U$1]) -> true | P66: of:=IF(ISBLANK([.$G66]); 1; ABS([.$G66]-[.$I66])<[.$U$1]) -> true | Q66: of:=IF(ISBLANK([.$H66]); 1; ABS([.$H66]-[.$J66])<[.$U$1]) -> true | R66: of:=IF(ISBLANK([.$K66]); 1; ABS([.$K66]-[.$A66])<[.$U$1]) -> true | S66: of:=IF(ISBLANK([.$L66]); 1; ABS([.$L66]-[.$B66])<[.$U$1]) -> true
A67: 2 | C67: -5.99999999999997 | D67: 22.3923048454133 | E67: -6 | F67: 22.3923048454133 | G67: 23.1822198309376 | H67: 1.83259571459404 | I67: of:=SQRT([.C67]*[.C67]+[.D67]*[.D67]) -> 23.1822198309376 | J67: of:=ATAN2([.C67];[.D67]) -> 1.83259571459404 | K67: 2 | L67: -8.14163551391781E-016 | N67: of:=IF(ISBLANK([.$C67]); 1; ABS([.$C67]-[.$E67])<[.$U$1]) -> true | O67: of:=IF(ISBLANK([.$D67]); 1; ABS([.$D67]-[.$F67])<[.$U$1]) -> true | P67: of:=IF(ISBLANK([.$G67]); 1; ABS([.$G67]-[.$I67])<[.$U$1]) -> true | Q67: of:=IF(ISBLANK([.$H67]); 1; ABS([.$H67]-[.$J67])<[.$U$1]) -> true | R67: of:=IF(ISBLANK([.$K67]); 1; ABS([.$K67]-[.$A67])<[.$U$1]) -> true | S67: of:=IF(ISBLANK([.$L67]); 1; ABS([.$L67]-[.$B67])<[.$U$1]) -> true
A68: 3 | C68: -5.99999999999998 | D68: 10.3923048454133 | E68: -6 | F68: 10.3923048454133 | G68: 12 | H68: 2.09439510239319 | I68: of:=SQRT([.C68]*[.C68]+[.D68]*[.D68]) -> 12 | J68: of:=ATAN2([.C68];[.D68]) -> 2.09439510239319 | K68: 3 | L68: 1.48029736616688E-015 | N68: of:=IF(ISBLANK([.$C68]); 1; ABS([.$C68]-[.$E68])<[.$U$1]) -> true | O68: of:=IF(ISBLANK([.$D68]); 1; ABS([.$D68]-[.$F68])<[.$U$1]) -> true | P68: of:=IF(ISBLANK([.$G68]); 1; ABS([.$G68]-[.$I68])<[.$U$1]) -> true | Q68: of:=IF(ISBLANK([.$H68]); 1; ABS([.$H68]-[.$J68])<[.$U$1]) -> true | R68: of:=IF(ISBLANK([.$K68]); 1; ABS([.$K68]-[.$A68])<[.$U$1]) -> true | S68: of:=IF(ISBLANK([.$L68]); 1; ABS([.$L68]-[.$B68])<[.$U$1]) -> true
A69: 4 | C69: -5.99999999999999 | D69: 6 | E69: -6 | F69: 6 | G69: 8.48528137423857 | H69: 2.35619449019234 | I69: of:=SQRT([.C69]*[.C69]+[.D69]*[.D69]) -> 8.48528137423857 | J69: of:=ATAN2([.C69];[.D69]) -> 2.35619449019234 | K69: 4 | L69: 2.368475785867E-015 | N69: of:=IF(ISBLANK([.$C69]); 1; ABS([.$C69]-[.$E69])<[.$U$1]) -> true | O69: of:=IF(ISBLANK([.$D69]); 1; ABS([.$D69]-[.$F69])<[.$U$1]) -> true | P69: of:=IF(ISBLANK([.$G69]); 1; ABS([.$G69]-[.$I69])<[.$U$1]) -> true | Q69: of:=IF(ISBLANK([.$H69]); 1; ABS([.$H69]-[.$J69])<[.$U$1]) -> true | R69: of:=IF(ISBLANK([.$K69]); 1; ABS([.$K69]-[.$A69])<[.$U$1]) -> true | S69: of:=IF(ISBLANK([.$L69]); 1; ABS([.$L69]-[.$B69])<[.$U$1]) -> true
A70: 5 | C70: -5.99999999999999 | D70: 3.46410161513777 | E70: -6 | F70: 3.46410161513775 | G70: 6.92820323027551 | H70: 2.61799387799149 | I70: of:=SQRT([.C70]*[.C70]+[.D70]*[.D70]) -> 6.92820323027551 | J70: of:=ATAN2([.C70];[.D70]) -> 2.61799387799149 | K70: 5.00000000000001 | L70: 2.66453525910038E-015 | N70: of:=IF(ISBLANK([.$C70]); 1; ABS([.$C70]-[.$E70])<[.$U$1]) -> true | O70: of:=IF(ISBLANK([.$D70]); 1; ABS([.$D70]-[.$F70])<[.$U$1]) -> true | P70: of:=IF(ISBLANK([.$G70]); 1; ABS([.$G70]-[.$I70])<[.$U$1]) -> true | Q70: of:=IF(ISBLANK([.$H70]); 1; ABS([.$H70]-[.$J70])<[.$U$1]) -> true | R70: of:=IF(ISBLANK([.$K70]); 1; ABS([.$K70]-[.$A70])<[.$U$1]) -> true | S70: of:=IF(ISBLANK([.$L70]); 1; ABS([.$L70]-[.$B70])<[.$U$1]) -> true
A71: 6 | C71: -5.99999999999999 | D71: 1.60769515458677 | E71: -6 | F71: 1.60769515458674 | G71: 6.2116570824605 | H71: 2.87979326579064 | I71: of:=SQRT([.C71]*[.C71]+[.D71]*[.D71]) -> 6.2116570824605 | J71: of:=ATAN2([.C71];[.D71]) -> 2.87979326579064 | K71: 6 | L71: 8.88178419700125E-016 | N71: of:=IF(ISBLANK([.$C71]); 1; ABS([.$C71]-[.$E71])<[.$U$1]) -> true | O71: of:=IF(ISBLANK([.$D71]); 1; ABS([.$D71]-[.$F71])<[.$U$1]) -> true | P71: of:=IF(ISBLANK([.$G71]); 1; ABS([.$G71]-[.$I71])<[.$U$1]) -> true | Q71: of:=IF(ISBLANK([.$H71]); 1; ABS([.$H71]-[.$J71])<[.$U$1]) -> true | R71: of:=IF(ISBLANK([.$K71]); 1; ABS([.$K71]-[.$A71])<[.$U$1]) -> true | S71: of:=IF(ISBLANK([.$L71]); 1; ABS([.$L71]-[.$B71])<[.$U$1]) -> true
A72: 7 | C72: -6 | D72: 0 | E72: -6 | F72: 0 | G72: 6 | H72: 3.14159265358979 | I72: of:=SQRT([.C72]*[.C72]+[.D72]*[.D72]) -> 6 | J72: of:=ATAN2([.C72];[.D72]) -> 3.14159265358979 | K72: 7 | L72: -7.95401438809192E-016 | N72: of:=IF(ISBLANK([.$C72]); 1; ABS([.$C72]-[.$E72])<[.$U$1]) -> true | O72: of:=IF(ISBLANK([.$D72]); 1; ABS([.$D72]-[.$F72])<[.$U$1]) -> true | P72: of:=IF(ISBLANK([.$G72]); 1; ABS([.$G72]-[.$I72])<[.$U$1]) -> true | Q72: of:=IF(ISBLANK([.$H72]); 1; ABS([.$H72]-[.$J72])<[.$U$1]) -> true | R72: of:=IF(ISBLANK([.$K72]); 1; ABS([.$K72]-[.$A72])<[.$U$1]) -> true | S72: of:=IF(ISBLANK([.$L72]); 1; ABS([.$L72]-[.$B72])<[.$U$1]) -> true
A73: 8 | C73: -5.99999999999999 | D73: -1.60769515458677 | E73: -6 | F73: -1.60769515458674 | G73: 6.2116570824605 | H73: -2.87979326579064 | I73: of:=SQRT([.C73]*[.C73]+[.D73]*[.D73]) -> 6.2116570824605 | J73: of:=ATAN2([.C73];[.D73]) -> -2.87979326579064 | K73: 8 | L73: -5.9211894646675E-015 | N73: of:=IF(ISBLANK([.$C73]); 1; ABS([.$C73]-[.$E73])<[.$U$1]) -> true | O73: of:=IF(ISBLANK([.$D73]); 1; ABS([.$D73]-[.$F73])<[.$U$1]) -> true | P73: of:=IF(ISBLANK([.$G73]); 1; ABS([.$G73]-[.$I73])<[.$U$1]) -> true | Q73: of:=IF(ISBLANK([.$H73]); 1; ABS([.$H73]-[.$J73])<[.$U$1]) -> true | R73: of:=IF(ISBLANK([.$K73]); 1; ABS([.$K73]-[.$A73])<[.$U$1]) -> true | S73: of:=IF(ISBLANK([.$L73]); 1; ABS([.$L73]-[.$B73])<[.$U$1]) -> true
A74: 9 | C74: -5.99999999999999 | D74: -3.46410161513777 | E74: -6 | F74: -3.46410161513775 | G74: 6.92820323027551 | H74: -2.61799387799149 | I74: of:=SQRT([.C74]*[.C74]+[.D74]*[.D74]) -> 6.92820323027551 | J74: of:=ATAN2([.C74];[.D74]) -> -2.61799387799149 | K74: 9 | L74: -9.473903143468E-015 | N74: of:=IF(ISBLANK([.$C74]); 1; ABS([.$C74]-[.$E74])<[.$U$1]) -> true | O74: of:=IF(ISBLANK([.$D74]); 1; ABS([.$D74]-[.$F74])<[.$U$1]) -> true | P74: of:=IF(ISBLANK([.$G74]); 1; ABS([.$G74]-[.$I74])<[.$U$1]) -> true | Q74: of:=IF(ISBLANK([.$H74]); 1; ABS([.$H74]-[.$J74])<[.$U$1]) -> true | R74: of:=IF(ISBLANK([.$K74]); 1; ABS([.$K74]-[.$A74])<[.$U$1]) -> true | S74: of:=IF(ISBLANK([.$L74]); 1; ABS([.$L74]-[.$B74])<[.$U$1]) -> true
A75: 10 | C75: -5.99999999999999 | D75: -6 | E75: -6 | F75: -6 | G75: 8.48528137423857 | H75: -2.35619449019234 | I75: of:=SQRT([.C75]*[.C75]+[.D75]*[.D75]) -> 8.48528137423857 | J75: of:=ATAN2([.C75];[.D75]) -> -2.35619449019234 | K75: 10 | L75: -4.736951571734E-015 | N75: of:=IF(ISBLANK([.$C75]); 1; ABS([.$C75]-[.$E75])<[.$U$1]) -> true | O75: of:=IF(ISBLANK([.$D75]); 1; ABS([.$D75]-[.$F75])<[.$U$1]) -> true | P75: of:=IF(ISBLANK([.$G75]); 1; ABS([.$G75]-[.$I75])<[.$U$1]) -> true | Q75: of:=IF(ISBLANK([.$H75]); 1; ABS([.$H75]-[.$J75])<[.$U$1]) -> true | R75: of:=IF(ISBLANK([.$K75]); 1; ABS([.$K75]-[.$A75])<[.$U$1]) -> true | S75: of:=IF(ISBLANK([.$L75]); 1; ABS([.$L75]-[.$B75])<[.$U$1]) -> true
A76: 11 | C76: -5.99999999999998 | D76: -10.3923048454133 | E76: -6 | F76: -10.3923048454133 | G76: 12 | H76: -2.09439510239319 | I76: of:=SQRT([.C76]*[.C76]+[.D76]*[.D76]) -> 12 | J76: of:=ATAN2([.C76];[.D76]) -> -2.09439510239319 | K76: 11 | L76: -0.0000000000000124344978758018 | N76: of:=IF(ISBLANK([.$C76]); 1; ABS([.$C76]-[.$E76])<[.$U$1]) -> true | O76: of:=IF(ISBLANK([.$D76]); 1; ABS([.$D76]-[.$F76])<[.$U$1]) -> true | P76: of:=IF(ISBLANK([.$G76]); 1; ABS([.$G76]-[.$I76])<[.$U$1]) -> true | Q76: of:=IF(ISBLANK([.$H76]); 1; ABS([.$H76]-[.$J76])<[.$U$1]) -> true | R76: of:=IF(ISBLANK([.$K76]); 1; ABS([.$K76]-[.$A76])<[.$U$1]) -> true | S76: of:=IF(ISBLANK([.$L76]); 1; ABS([.$L76]-[.$B76])<[.$U$1]) -> true
A77: 12 | C77: -5.99999999999997 | D77: -22.3923048454133 | E77: -6 | F77: -22.3923048454133 | G77: 23.1822198309376 | H77: -1.83259571459404 | I77: of:=SQRT([.C77]*[.C77]+[.D77]*[.D77]) -> 23.1822198309376 | J77: of:=ATAN2([.C77];[.D77]) -> -1.83259571459404 | K77: 12 | L77: -0.0000000000000219084010192698 | N77: of:=IF(ISBLANK([.$C77]); 1; ABS([.$C77]-[.$E77])<[.$U$1]) -> true | O77: of:=IF(ISBLANK([.$D77]); 1; ABS([.$D77]-[.$F77])<[.$U$1]) -> true | P77: of:=IF(ISBLANK([.$G77]); 1; ABS([.$G77]-[.$I77])<[.$U$1]) -> true | Q77: of:=IF(ISBLANK([.$H77]); 1; ABS([.$H77]-[.$J77])<[.$U$1]) -> true | R77: of:=IF(ISBLANK([.$K77]); 1; ABS([.$K77]-[.$A77])<[.$U$1]) -> true | S77: of:=IF(ISBLANK([.$L77]); 1; ABS([.$L77]-[.$B77])<[.$U$1]) -> true