Sheet: Sheet1
A1: LINEST Function
A3: Result | B3: of:=AND([.B8:.B95]) -> true
A7: Sheet | B7: Result | C7: Description
A8: 1 | B8: of:=AND([Sheet2.C2:.C992]) -> true | C8: Simple LINEST formulas with local references and values

Sheet: Sheet2
A1: Function | B1: Expected | C1: Correct | D1: FunctionString | E1: Comment | J1: x1 | K1: x2 | L1: y | N1: LINEST value | R1: Known y | S1: Known x | U1: Month | V1: Sales | X1: Floor space (x1) | Y1: Offices (x2) | Z1: Entrances (x3) | AA1: Age (x4) | AB1: Assessed value (y)
A2: of:=[.K17] -> 4.85714285714286 | B2: 4.85714285714286 | C2: of:=ROUND([.A2];12)=ROUND([.B2];12) -> true | D2: of:=FORMULA([.A2]) -> =K17 | J2: 4 | K2: 7 | L2: 100 | N2: 4,17 | O2: -3,48 | P2: 82,33 | R2: 1 | S2: 0 | U2: 1 | V2: 3100 | X2: 2310 | Y2: 2 | Z2: 2 | AA2: 20 | AB2: 142000
A3: of:=[.K18] -> 0.914732033918978 | B3: 0.914732033918978 | C3: of:=ROUND([.A3];12)=ROUND([.B3];12) -> true | D3: of:=FORMULA([.A3]) -> =K18 | J3: 5 | K3: 9 | L3: 105 | N3: 5,46 | O3: 10,96 | P3: 9,35 | R3: 9 | S3: 4 | U3: 2 | V3: 4500 | X3: 2333 | Y3: 2 | Z3: 2 | AA3: 12 | AB3: 144000
A4: of:=[.K19] -> 0.849375459221161 | B4: 0.849375459221161 | C4: of:=ROUND([.A4];12)=ROUND([.B4];12) -> true | D4: of:=FORMULA([.A4]) -> =K19 | J4: 6 | K4: 11 | L4: 104 | N4: 0,87 | O4: 5,06 | P4: #NA | R4: 5 | S4: 2 | U4: 3 | V4: 4400 | X4: 2356 | Y4: 3 | Z4: 1.5 | AA4: 33 | AB4: 151000
A5: of:=[.K20] -> 28.1951219512195 | B5: 28.1951219512195 | C5: of:=ROUND([.A5];9)=ROUND([.B5];9) -> true | D5: of:=FORMULA([.A5]) -> =K20 | J5: 7 | K5: 12 | L5: 108 | N5: 13,21 | O5: 4 | P5: #NA | R5: 7 | S5: 3 | U5: 4 | V5: 5400 | X5: 2379 | Y5: 3 | Z5: 2 | AA5: 43 | AB5: 150000
A6: of:=[.K21] -> 660.571428571428 | B6: 660.571428571428 | C6: of:=ROUND([.A6];12)=ROUND([.B6];12) -> true | D6: of:=FORMULA([.A6]) -> =K21 | J6: 8 | K6: 15 | L6: 111 | N6: 675,45 | O6: 102,26 | P6: #NA | R6: Result (slope) | S6: Result (y-intercept) | U6: 5 | V6: 7500 | X6: 2402 | Y6: 2 | Z6: 3 | AA6: 53 | AB6: 139000
A7: of:=[.L17] -> 77.5714285714286 | B7: 77.5714285714286 | C7: of:=ROUND([.A7];12)=ROUND([.B7];12) -> true | D7: of:=FORMULA([.A7]) -> =L17 | J7: 9 | K7: 17 | L7: 120 | R7: 2 | S7: 1 | U7: 6 | V7: 8100 | X7: 2425 | Y7: 4 | Z7: 2 | AA7: 23 | AB7: 169000
A8: of:=[.L18] -> 6.65934972617524 | B8: 6.65934972617524 | C8: of:=ROUND([.A8];12)=ROUND([.B8];12) -> true | D8: of:=FORMULA([.A8]) -> =L18 | J8: 10 | K8: 19 | L8: 133 | R8: Formula (array formula in cells A7:B7) | U8: Formula | V8: Result | X8: 2448 | Y8: 2 | Z8: 1.5 | AA8: 99 | AB8: 126000
A9: of:=[.L19] -> 4.84030695602783 | B9: 4.84030695602783 | C9: of:=ROUND([.A9];12)=ROUND([.B9];12) -> true | D9: of:=FORMULA([.A9]) -> =L19 | R9: of:=LINEST([.R2:.R5];[.S2:.S5];;0) -> 2 | S9: 1 | V9: $11,000 | X9: 2471 | Y9: 2 | Z9: 2 | AA9: 34 | AB9: 142900
A10: of:=[.L20] -> 5 | B10: 5 | C10: of:=ROUND([.A10];12)=ROUND([.B10];12) -> true | D10: of:=FORMULA([.A10]) -> =L20 | V10: Calculates the estimate of the sales in the ninth month, based on sales in months 2 through 6. | X10: 2494 | Y10: 3 | Z10: 3 | AA10: 23 | AB10: 163000
A11: of:=[.L21] -> 117.142857142857 | B11: 117.142857142857 | C11: of:=ROUND([.A11];12)=ROUND([.B11];12) -> true | D11: of:=FORMULA([.A11]) -> =L21 | X11: 2517 | Y11: 4 | Z11: 4 | AA11: 55 | AB11: 169000
A12: of:=LINEST({2;3;5;7;10};{4;6;10;14;20};1;0) -> 0.5 | B12: 0.5 | C12: of:=ROUND([.A12];12)=ROUND([.B12];12) -> true | D12: of:=FORMULA([.A12]) -> =LINEST({2,3,5,7,10},{4,6,10,14,20},1,0) | X12: 2540 | Y12: 2 | Z12: 3 | AA12: 22 | AB12: 149000
A13: of:=[.K25] -> 0.5 | B13: 0.5 | C13: of:=ROUND([.A13];9)=ROUND([.B13];9) -> true | D13: of:=FORMULA([.A13]) -> =K25 | X13: -234.2371645
A14: of:=[.L25] -> 0 | B14: 0 | C14: of:=ROUND([.A14];12)=ROUND([.B14];12) -> true | D14: of:=FORMULA([.A14]) -> =L25 | X14: 13.26801148
A15: of:=[.R9] -> 2 | B15: 2 | C15: of:=ROUND([.A15];12)=ROUND([.B15];12) -> true | D15: of:=FORMULA([.A15]) -> =R9 | X15: 0.996747993
A16: of:=[.S9] -> 1 | B16: 1 | C16: of:=ROUND([.A16];12)=ROUND([.B16];12) -> true | D16: of:=FORMULA([.A16]) -> =S9 | X16: 459.7536742
A17: of:=SUM(LINEST([.V2:.V6]; [.U2:.U6])*{9;1}) -> 10800 | B17: 10800 | C17: of:=ROUND([.A17];12)=ROUND([.B17];12) -> true | D17: of:=FORMULA([.A17]) -> =SUM(LINEST(V2:V6, U2:U6)*{9,1}) | K17: of:=LINEST([.L2:.L8];[.J2:.J8];1;1) -> 4.85714285714286 | L17: 77.5714285714286 | X17: 1732393319
A18: of:=[.K29] -> -234.237164471202 | B18: -234.237164471202 | C18: of:=ROUND([.A18];12)=ROUND([.B18];12) -> true | D18: of:=FORMULA([.A18]) -> =K29 | K18: 0.914732033918978 | L18: 6.65934972617524 | X18: Formula (array formula entered in A14:A18)
A19: of:=[.K30] -> 13.2680114755004 | B19: 13.2680114755004 | C19: of:=ROUND([.A19];9)=ROUND([.B19];9) -> true | D19: of:=FORMULA([.A19]) -> =K30 | K19: 0.849375459221161 | L19: 4.84030695602783 | X19: of:=LINEST([.E2:.E12];[.A2:.D12];1;1) -> 
A20: of:=[.K31] -> 0.99674799338451 | B20: 0.99674799338451 | C20: of:=ROUND([.A20];12)=ROUND([.B20];12) -> true | D20: of:=FORMULA([.A20]) -> =K31 | K20: 28.1951219512195 | L20: 5
A21: of:=[.K32] -> 459.753674225393 | B21: 459.753674225393 | C21: of:=ROUND([.A21];12)=ROUND([.B21];12) -> true | D21: of:=FORMULA([.A21]) -> =K32 | K21: 660.571428571428 | L21: 117.142857142857
A22: of:=[.K33] -> 1732393319.22925 | B22: 1732393319.22925 | C22: of:=ROUND([.A22];12)=ROUND([.B22];12) -> true | D22: of:=FORMULA([.A22]) -> =K33
A23: of:=[.L29] -> 2553.21066039154 | B23: 2553.21066039154 | C23: of:=ROUND([.A23];12)=ROUND([.B23];12) -> true | D23: of:=FORMULA([.A23]) -> =L29 | S23: x1 | T23: x2 | U23: x3 | V23: of:="y" & FORMULA([.V24]) -> y=-0.3*U24+7*T24-19*S24 | X23: x1 | Y23: x2 | Z23: x3 | AA23: of:="y"&FORMULA([.AA24]) -> y=1.2*X24-2.3*Y24+3.4*Z24
A24: of:=[.L30] -> 530.669151930378 | B24: 530.669151930378 | C24: of:=ROUND([.A24];12)=ROUND([.B24];12) -> true | D24: of:=FORMULA([.A24]) -> =L30 | S24: 0 | T24: of:=[.S24]^2 -> 0 | U24: of:=[.S24]^3 -> 0 | V24: of:=-0.3*[.U24]+7*[.T24]-19*[.S24] -> 0 | X24: 0 | Y24: 5.1 | Z24: 2.1 | AA24: of:=1.2*[.X24]-2.3*[.Y24]+3.4*[.Z24] -> -4.59
A25: of:=[.L31] -> 970.578462928506 | B25: 970.578462928506 | C25: of:=ROUND([.A25];12)=ROUND([.B25];12) -> true | D25: of:=FORMULA([.A25]) -> =L31 | K25: of:=LINEST({2;3;5;7;10};{4;6;10;14;20};1;0) -> 0.5 | L25: 0 | S25: -2 | T25: of:=[.S25]^2 -> 4 | U25: of:=[.S25]^3 -> -8 | V25: of:=-0.3*[.U25]+7*[.T25]-19*[.S25] -> 68.4 | X25: 1 | Y25: 7 | Z25: 8 | AA25: of:=1.2*[.X25]-2.3*[.Y25]+3.4*[.Z25] -> 12.3
A26: of:=[.L32] -> 6 | B26: 6 | C26: of:=ROUND([.A26];12)=ROUND([.B26];12) -> true | D26: of:=FORMULA([.A26]) -> =L32 | S26: -1 | T26: of:=[.S26]^2 -> 1 | U26: of:=[.S26]^3 -> -1 | V26: of:=-0.3*[.U26]+7*[.T26]-19*[.S26] -> 26.3 | X26: 2 | Y26: 4 | Z26: 2 | AA26: of:=1.2*[.X26]-2.3*[.Y26]+3.4*[.Z26] -> 0
A27: of:=[.L33] -> 5652135.31620397 | B27: 5652135.31620397 | C27: of:=ROUND([.A27];12)=ROUND([.B27];12) -> true | D27: of:=FORMULA([.A27]) -> =L33 | S27: 1 | T27: of:=[.S27]^2 -> 1 | U27: of:=[.S27]^3 -> 1 | V27: of:=-0.3*[.U27]+7*[.T27]-19*[.S27] -> -12.3 | X27: -1 | Y27: 6 | Z27: 6 | AA27: of:=1.2*[.X27]-2.3*[.Y27]+3.4*[.Z27] -> 5.4
A28: of:=[.M29] -> 12529.7681670868 | B28: 12529.7681670868 | C28: of:=ROUND([.A28];10)=ROUND([.B28];10) -> true | D28: of:=FORMULA([.A28]) -> =M29 | S28: 3 | T28: of:=[.S28]^2 -> 9 | U28: of:=[.S28]^3 -> 27 | V28: of:=-0.3*[.U28]+7*[.T28]-19*[.S28] -> -2.1 | X28: 6 | Y28: 3 | Z28: 0 | AA28: of:=1.2*[.X28]-2.3*[.Y28]+3.4*[.Z28] -> 0.3
A29: of:=[.M30] -> 400.066838193953 | B29: 400.066838193953 | C29: of:=ROUND([.A29];12)=ROUND([.B29];12) -> true | D29: of:=FORMULA([.A29]) -> =M30 | K29: of:=LINEST([.AB2:.AB12];[.X2:.AA12];1;1) -> -234.237164471202 | L29: 2553.21066039154 | M29: 12529.7681670868 | N29: 27.6413873660203 | O29: 52317.8305072913 | S29: 5 | T29: of:=[.S29]^2 -> 25 | U29: of:=[.S29]^3 -> 125 | V29: of:=-0.3*[.U29]+7*[.T29]-19*[.S29] -> 42.5
A30: of:=[.M31] ->  | B30: error | C30: of:=ISERROR([.A30]) -> true | D30: of:=FORMULA([.A30]) -> =M31 | K30: 13.2680114755004 | L30: 530.669151930378 | M30: 400.066838193953 | N30: 5.42937404154531 | O30: 12237.3616028623
A31: of:=[.M32] ->  | B31: error | C31: of:=ISNA([.A31]) -> true | D31: of:=FORMULA([.A31]) -> =M32 | K31: 0.99674799338451 | L31: 970.578462928506 | S31: of:=LINEST([.V24:.V29];[.S24:.U29];0;1) -> -0.3 | T31: 7 | U31: -19 | V31: 0 | X31: of:=LINEST([.AA24:.AA28];[.X24:.Z28];1;1) -> 3.4 | Y31: -2.3 | Z31: 1.2 | AA31: -0.0000000000000173194791841524
A32: of:=[.M33] ->  | B32: error | C32: of:=ISNA([.A32]) -> true | D32: of:=FORMULA([.A32]) -> =M33 | K32: 459.753674225393 | L32: 6 | S32: 7.78386753299983E-016 | T32: 3.12582706182415E-015 | U32: 7.47872232821402E-015 | X32: 7.40094535217939E-015 | Y32: 0.0000000000000182660844546218 | Z32: 4.02893660475375E-015 | AA32: 0.000000000000072069683128199
A33: of:=[.N29] -> 27.6413873660203 | B33: 27.6413873660203 | C33: of:=ROUND([.A33];12)=ROUND([.B33];12) -> true | D33: of:=FORMULA([.A33]) -> =N29 | K33: 1732393319.22925 | L33: 5652135.31620397 | S33: 1 | T33: 0.0000000000000209805716107385 | X33: 1 | Y33: 0.0000000000000121537732619395
A34: of:=[.N30] -> 5.42937404154531 | B34: 5.42937404154531 | C34: of:=ROUND([.A34];12)=ROUND([.B34];12) -> true | D34: of:=FORMULA([.A34]) -> =N30 | S34: 5.5523702096735E+030 | T34: 3 | X34: 3.73790456956461E+029 | Y34: 1
A35: of:=[.N31] ->  | B35: error | C35: of:=ISERROR([.A35]) -> true | D35: of:=FORMULA([.A35]) -> =N31 | S35: 7332.20000000001 | T35: 1.32055315533997E-027 | X35: 165.64248 | Y35: 1.47714204502634E-028
A36: of:=[.N32] ->  | B36: error | C36: of:=ISERROR([.A36]) -> true | D36: of:=FORMULA([.A36]) -> =N32
A37: of:=[.N33] ->  | B37: error | C37: of:=ISERROR([.A37]) -> true | D37: of:=FORMULA([.A37]) -> =N33
A38: of:=[.O29] -> 52317.8305072913 | B38: 52317.8305072913 | C38: of:=ROUND([.A38];12)=ROUND([.B38];12) -> true | D38: of:=FORMULA([.A38]) -> =O29
A39: of:=[.O30] -> 12237.3616028623 | B39: 12237.3616028623 | C39: of:=ROUND([.A39];12)=ROUND([.B39];12) -> true | D39: of:=FORMULA([.A39]) -> =O30
A40: of:=[.O31] ->  | B40: error | C40: of:=ISERROR([.A40]) -> true | D40: of:=FORMULA([.A40]) -> =O31
A41: of:=[.O32] ->  | B41: error | C41: of:=ISERROR([.A41]) -> true | D41: of:=FORMULA([.A41]) -> =O32
A42: of:=[.O33] ->  | B42: error | C42: of:=ISERROR([.A42]) -> true | D42: of:=FORMULA([.A42]) -> =O33
A43: of:=[.S31] -> -0.3 | B43: -0.3 | C43: of:=ROUND([.A43];12)=ROUND([.B43];12) -> true | D43: of:=FORMULA([.A43]) -> =S31
A44: of:=[.S32] -> 7.78386753299983E-016 | B44: 7.78386753299983E-016 | C44: of:=ROUND([.A44];12)=ROUND([.B44];12) -> true | D44: of:=FORMULA([.A44]) -> =S32
A45: of:=[.S33] -> 1 | B45: 1 | C45: of:=ROUND([.A45];12)=ROUND([.B45];12) -> true | D45: of:=FORMULA([.A45]) -> =S33
A46: of:=[.S34] -> 5.5523702096735E+030 | B46: 5.5523702096735E+030 | C46: of:=ROUND([.A46];12)=ROUND([.B46];12) -> true | D46: of:=FORMULA([.A46]) -> =S34
A47: of:=[.S35] -> 7332.20000000001 | B47: 7332.20000000001 | C47: of:=ROUND([.A47];12)=ROUND([.B47];12) -> true | D47: of:=FORMULA([.A47]) -> =S35
A48: of:=[.T31] -> 7 | B48: 7 | C48: of:=ROUND([.A48];12)=ROUND([.B48];12) -> true | D48: of:=FORMULA([.A48]) -> =T31
A49: of:=[.T32] -> 3.12582706182415E-015 | B49: 3.12582706182415E-015 | C49: of:=ROUND([.A49];12)=ROUND([.B49];12) -> true | D49: of:=FORMULA([.A49]) -> =T32
A50: of:=[.T33] -> 0.0000000000000209805716107385 | B50: 0.0000000000000209805716107385 | C50: of:=ROUND([.A50];12)=ROUND([.B50];12) -> true | D50: of:=FORMULA([.A50]) -> =T33
A51: of:=[.T34] -> 3 | B51: 3 | C51: of:=ROUND([.A51];12)=ROUND([.B51];12) -> true | D51: of:=FORMULA([.A51]) -> =T34
A52: of:=[.T35] -> 1.32055315533997E-027 | B52: 1.32055315533997E-027 | C52: of:=ROUND([.A52];12)=ROUND([.B52];12) -> true | D52: of:=FORMULA([.A52]) -> =T35
A53: of:=[.U31] -> -19 | B53: -19 | C53: of:=ROUND([.A53];12)=ROUND([.B53];12) -> true | D53: of:=FORMULA([.A53]) -> =U31
A54: of:=[.U32] -> 7.47872232821402E-015 | B54: 7.47872232821402E-015 | C54: of:=ROUND([.A54];12)=ROUND([.B54];12) -> true | D54: of:=FORMULA([.A54]) -> =U32
A55: of:=[.U33] ->  | B55: error | C55: of:=ISERROR([.A55]) -> true | D55: of:=FORMULA([.A55]) -> =U33
A56: of:=[.U34] ->  | B56: error | C56: of:=ISERROR([.A56]) -> true | D56: of:=FORMULA([.A56]) -> =U34
A57: of:=[.U35] ->  | B57: error | C57: of:=ISERROR([.A57]) -> true | D57: of:=FORMULA([.A57]) -> =U35
A58: of:=[.V31] -> 0 | B58: 0 | C58: of:=ROUND([.A58];12)=ROUND([.B58];12) -> true | D58: of:=FORMULA([.A58]) -> =V31
A59: of:=[.V32] ->  | B59: error | C59: of:=ISERROR([.A59]) -> true | D59: of:=FORMULA([.A59]) -> =V32
A60: of:=[.V33] ->  | B60: error | C60: of:=ISERROR([.A60]) -> true | D60: of:=FORMULA([.A60]) -> =V33
A61: of:=[.V34] ->  | B61: error | C61: of:=ISERROR([.A61]) -> true | D61: of:=FORMULA([.A61]) -> =V34
A62: of:=[.V35] ->  | B62: error | C62: of:=ISERROR([.A62]) -> true | D62: of:=FORMULA([.A62]) -> =V35
A63: of:=[.X31] -> 3.4 | B63: 3.4 | C63: of:=ROUND([.A63];12)=ROUND([.B63];12) -> true | D63: of:=FORMULA([.A63]) -> =X31
A64: of:=[.X32] -> 7.40094535217939E-015 | B64: 7.40094535217939E-015 | C64: of:=ROUND([.A64];12)=ROUND([.B64];12) -> true | D64: of:=FORMULA([.A64]) -> =X32
A65: of:=[.X33] -> 1 | B65: 1 | C65: of:=ROUND([.A65];12)=ROUND([.B65];12) -> true | D65: of:=FORMULA([.A65]) -> =X33
A66: of:=[.X34] -> 3.73790456956461E+029 | B66: 3.73790456956461E+029 | C66: of:=ROUND([.A66];12)=ROUND([.B66];12) -> true | D66: of:=FORMULA([.A66]) -> =X34
A67: of:=[.X35] -> 165.64248 | B67: 165.64248 | C67: of:=ROUND([.A67];12)=ROUND([.B67];12) -> true | D67: of:=FORMULA([.A67]) -> =X35
A68: of:=[.Y31] -> -2.3 | B68: -2.3 | C68: of:=ROUND([.A68];12)=ROUND([.B68];12) -> true | D68: of:=FORMULA([.A68]) -> =Y31
A69: of:=[.Y32] -> 0.0000000000000182660844546218 | B69: 0.0000000000000182660844546218 | C69: of:=ROUND([.A69];12)=ROUND([.B69];12) -> true | D69: of:=FORMULA([.A69]) -> =Y32
A70: of:=[.Y33] -> 0.0000000000000121537732619395 | B70: 0.0000000000000121537732619395 | C70: of:=ROUND([.A70];12)=ROUND([.B70];12) -> true | D70: of:=FORMULA([.A70]) -> =Y33
A71: of:=[.Y34] -> 1 | B71: 1 | C71: of:=ROUND([.A71];12)=ROUND([.B71];12) -> true | D71: of:=FORMULA([.A71]) -> =Y34
A72: of:=[.Y35] -> 1.47714204502634E-028 | B72: 1.47714204502634E-028 | C72: of:=ROUND([.A72];12)=ROUND([.B72];12) -> true | D72: of:=FORMULA([.A72]) -> =Y35
A73: of:=[.Z31] -> 1.2 | B73: 1.2 | C73: of:=ROUND([.A73];12)=ROUND([.B73];12) -> true | D73: of:=FORMULA([.A73]) -> =Z31
A74: of:=[.Z32] -> 4.02893660475375E-015 | B74: 4.02893660475375E-015 | C74: of:=ROUND([.A74];12)=ROUND([.B74];12) -> true | D74: of:=FORMULA([.A74]) -> =Z32
A75: of:=[.Z33] ->  | B75: error | C75: of:=ISERROR([.A75]) -> true | D75: of:=FORMULA([.A75]) -> =Z33
A76: of:=[.Z34] ->  | B76: error | C76: of:=ISERROR([.A76]) -> true | D76: of:=FORMULA([.A76]) -> =Z34
A77: of:=[.Z35] ->  | B77: error | C77: of:=ISERROR([.A77]) -> true | D77: of:=FORMULA([.A77]) -> =Z35
A78: of:=[.AA31] -> -0.0000000000000173194791841524 | B78: -0.0000000000000173194791841524 | C78: of:=ROUND([.A78];12)=ROUND([.B78];12) -> true | D78: of:=FORMULA([.A78]) -> =AA31
A79: of:=[.AA32] -> 0.000000000000072069683128199 | B79: 0.000000000000072069683128199 | C79: of:=ROUND([.A79];12)=ROUND([.B79];12) -> true | D79: of:=FORMULA([.A79]) -> =AA32
A80: of:=[.AA33] ->  | B80: error | C80: of:=ISERROR([.A80]) -> true | D80: of:=FORMULA([.A80]) -> =AA33
A81: of:=[.AA34] ->  | B81: error | C81: of:=ISERROR([.A81]) -> true | D81: of:=FORMULA([.A81]) -> =AA34 | J81: of:={7;100|9;105|11;104|12;108|15;111|17;120|19;133} -> 7 | K81: 100
A82: of:=[.AA35] ->  | B82: error | C82: of:=ISERROR([.A82]) -> true | D82: of:=FORMULA([.A82]) -> =AA35 | J82: 9 | K82: 105
A83: of:=INDEX(LINEST([.K83:.K87];[.J83:.J87]);1;2) -> 66.5714285714286 | B83: 66.5714285714286 | C83: of:=ROUND([.A83];12)=ROUND([.B83];12) -> true | D83: of:=FORMULA([.A83]) -> =INDEX(LINEST(K83:K87,J83:J87),1,2) | J83: 11 | K83: 104
A84: of:=INDEX(LINEST([.K83:.K87];[.J83:.J87]^{1;2});1;1) -> 0.460217718382158 | B84: 0.460217718382158 | C84: of:=ROUND([.A84];12)=ROUND([.B84];12) -> true | D84: of:=FORMULA([.A84]) -> =INDEX(LINEST(K83:K87,J83:J87^{1,2}),1,1) | J84: 12 | K84: 108
A85: of:=[.J89] -> 2.44177215189873 | B85: 2.44177215189873 | C85: of:=ROUND([.A85];12)=ROUND([.B85];12) -> true | D85: of:=FORMULA([.A85]) -> =J89 | J85: 15 | K85: 111
A86: of:=[.J90] -> 0.460217718382158 | B86: 0.460217718382158 | C86: of:=ROUND([.A86];12)=ROUND([.B86];12) -> true | D86: of:=FORMULA([.A86]) -> =J90 | J86: 17 | K86: 120
A87: of:=[.K89] -> 80.1772151898734 | B87: 80.1772151898734 | C87: of:=ROUND([.A87];10)=ROUND([.B87];10) -> true | D87: of:=FORMULA([.A87]) -> =K89 | J87: 19 | K87: 133
A88: of:=[.K90] -> -10.4180900964687 | B88: -10.4180900964687 | C88: of:=ROUND([.A88];12)=ROUND([.B88];12) -> true | D88: of:=FORMULA([.A88]) -> =K90
A89: of:=[.L90] -> 164.458093636605 | B89: 164.458093636605 | C89: of:=ROUND([.A89];12)=ROUND([.B89];12) -> true | D89: of:=FORMULA([.A89]) -> =L90 | J89: of:=LINEST([.K81:.K87];[.J81:.J87]) -> 2.44177215189873 | K89: 80.1772151898734
A90: of:=[.O93] -> 0.994341547754605 | B90: 0.994341547754605 | C90: of:=ROUND([.A90];12)=ROUND([.B90];12) -> true | D90: of:=FORMULA([.A90]) -> =O93 | J90: of:==LINEST([.K83:.K87];[.J83:.J87]^{1;2}) -> 0.460217718382158 | K90: -10.4180900964687 | L90: 164.458093636605
A91: of:=[.O94] -> 0.00784600090818292 | B91: 0.00784600090818292 | C91: of:=ROUND([.A91];12)=ROUND([.B91];12) -> true | D91: of:=FORMULA([.A91]) -> =O94
A92: of:=[.O95] -> 0.999998850552028 | B92: 0.999998850552028 | C92: of:=ROUND([.A92];12)=ROUND([.B92];12) -> true | D92: of:=FORMULA([.A92]) -> =O95
A93: of:=[.O96] -> 2029957.60481605 | B93: 2029957.60481605 | C93: of:=ROUND([.A93];12)=ROUND([.B93];12) -> true | D93: of:=FORMULA([.A93]) -> =O96 | H93: 1 | I93: 1 | J93: 1 | K93: 6 | L93: 0.666692 | M93: 6.666692 | O93: of:=LINEST([.M93:.M102];[.H93:.J102];0;1) -> 0.994341547754605 | P93: 2.12817454484602 | Q93: 2.30123312876209 | R93: 0
A94: of:=[.O97] -> 3153007.95235537 | B94: 3153007.95235537 | C94: of:=ROUND([.A94];12)=ROUND([.B94];12) -> true | D94: of:=FORMULA([.A94]) -> =O97 | H94: 2 | I94: 4 | J94: 8 | K94: 22 | L94: −1.37614 | M94: 20.62386 | O94: 0.00784600090818292 | P94: 0.110686824028813 | Q94: 0.37209276413207
A95: of:=[.P93] -> 2.12817454484602 | B95: 2.12817454484602 | C95: of:=ROUND([.A95];12)=ROUND([.B95];12) -> true | D95: of:=FORMULA([.A95]) -> =P93 | H95: 3 | I95: 9 | J95: 27 | K95: 54 | L95: −1.13891 | M95: 52.86109 | O95: 0.999998850552028 | P95: 0.719545765557922
A96: of:=[.P94] -> 0.110686824028813 | B96: 0.110686824028813 | C96: of:=ROUND([.A96];12)=ROUND([.B96];12) -> true | D96: of:=FORMULA([.A96]) -> =P94 | H96: 4 | I96: 16 | J96: 64 | K96: 108 | L96: −1.18741 | M96: 106.8126 | O96: 2029957.60481605 | P96: 7
A97: of:=[.P95] -> 0.719545765557922 | B97: 0.719545765557922 | C97: of:=ROUND([.A97];12)=ROUND([.B97];12) -> true | D97: of:=FORMULA([.A97]) -> =P95 | H97: 5 | I97: 25 | J97: 125 | K97: 190 | L97: −1.19113 | M97: 188.8089 | O97: 3153007.95235537 | P97: 3.62422276112635
A98: of:=[.P96] -> 7 | B98: 7 | C98: of:=ROUND([.A98];12)=ROUND([.B98];12) -> true | D98: of:=FORMULA([.A98]) -> =P96 | H98: 6 | I98: 36 | J98: 216 | K98: 306 | L98: −1.23125 | M98: 304.7688
A99: of:=[.P97] -> 3.62422276112635 | B99: 3.62422276112635 | C99: of:=ROUND([.A99];12)=ROUND([.B99];12) -> true | D99: of:=FORMULA([.A99]) -> =P97 | H99: 7 | I99: 49 | J99: 343 | K99: 462 | L99: −0.30762 | M99: 461.6924
A100: of:=[.Q93] -> 2.30123312876209 | B100: 2.30123312876209 | C100: of:=ROUND([.A100];12)=ROUND([.B100];12) -> true | D100: of:=FORMULA([.A100]) -> =Q93 | H100: 8 | I100: 64 | J100: 512 | K100: 664 | L100: 0.70592 | M100: 664.7059
A101: of:=[.Q94] -> 0.37209276413207 | B101: 0.37209276413207 | C101: of:=ROUND([.A101];12)=ROUND([.B101];12) -> true | D101: of:=FORMULA([.A101]) -> =Q94 | H101: 9 | I101: 81 | J101: 729 | K101: 918 | L101: −0.80582 | M101: 917.1942
A102: of:=[.Q95] ->  | C102: of:=ISERROR([.A102]) -> true | D102: of:=FORMULA([.A102]) -> =Q95 | E102: aoo#112324 | H102: 10 | I102: 100 | J102: 1000 | K102: 1230 | L102: 0.271383 | M102: 1230.271
A103: of:=[.Q96] ->  | C103: of:=ISERROR([.A103]) -> true | D103: of:=FORMULA([.A103]) -> =Q96
A104: of:=[.Q97] ->  | C104: of:=ISERROR([.A104]) -> true | D104: of:=FORMULA([.A104]) -> =Q97
A105: of:=[.R93] -> 0 | B105: 0 | C105: of:=ROUND([.A105];12)=ROUND([.B105];12) -> true | D105: of:=FORMULA([.A105]) -> =R93
A106: of:=[.R94] ->  | C106: of:=ISERROR([.A106]) -> true | D106: of:=FORMULA([.A106]) -> =R94
A107: of:=[.R95] ->  | C107: of:=ISERROR([.A107]) -> true | D107: of:=FORMULA([.A107]) -> =R95
A108: of:=[.R96] ->  | C108: of:=ISERROR([.A108]) -> true | D108: of:=FORMULA([.A108]) -> =R96
A109: of:=[.R97] ->  | C109: of:=ISERROR([.A109]) -> true | D109: of:=FORMULA([.A109]) -> =R97
A110: of:=[.M133] -> 0.00109999999999999 | B110: 0.00109999999999999 | C110: of:=ROUND([.A110];12)=ROUND([.B110];12) -> true | D110: of:=FORMULA([.A110]) -> =M133 | E110: Aoo#109264
A111: of:=[.M134] -> 4.04849321602897E-017 | B111: 4.04849321602897E-017 | C111: of:=ROUND([.A111];12)=ROUND([.B111];12) -> true | D111: of:=FORMULA([.A111]) -> =M134 | I111: 0.0305999999999997 | J111: 0.00004 | L111: of:=LINEST([.I111:.I117];[.J111:.J117];;1) -> 793.571428571433 | M111: -0.000778571428572218
A112: of:=[.M135] -> 1 | B112: 1 | C112: of:=ROUND([.A112];12)=ROUND([.B112];12) -> true | D112: of:=FORMULA([.A112]) -> =M135 | I112: 0.039299999999999 | J112: 0.00005 | L112: 5.33567125627786 | M112: 0.000388442730787783
A113: of:=[.M136] -> 7.3824164159995E+026 | B113: 7.3824164159995E+026 | C113: of:=ROUND([.A113];12)=ROUND([.B113];12) -> true | D113: of:=FORMULA([.A113]) -> =M136 | I113: 0.0468999999999991 | J113: 0.00006 | L113: 0.999774015875587 | M113: 0.000282337184434136
A114: of:=[.M137] -> 0.000000483999999999991 | B114: 0.000000483999999999991 | C114: of:=ROUND([.A114];12)=ROUND([.B114];12) -> true | D114: of:=FORMULA([.A114]) -> =M137 | I114: 0.0549 | J114: 0.00007 | L114: 22120.4480286991 | M114: 5
A115: of:=[.N133] -> 0.11 | B115: 0.11 | C115: of:=ROUND([.A115];12)=ROUND([.B115];12) -> true | D115: of:=FORMULA([.A115]) -> =N133 | I115: 0.0625999999999998 | J115: 0.00008 | L115: 0.00176331571428573 | M115: 0.000000398571428570977
A116: of:=[.N134] -> 1.13934698304003E-016 | B116: 1.13934698304003E-016 | C116: of:=ROUND([.A116];12)=ROUND([.B116];12) -> true | D116: of:=FORMULA([.A116]) -> =N134 | I116: 0.0703999999999994 | J116: 0.00009
A117: of:=[.N135] -> 2.56049193087833E-017 | B117: 2.56049193087833E-017 | C117: of:=ROUND([.A117];12)=ROUND([.B117];12) -> true | D117: of:=FORMULA([.A117]) -> =N135 | I117: 0.0786999999999996 | J117: 0.0001
A118: of:=[.N136] -> 3 | B118: 3 | C118: of:=ROUND([.A118];12)=ROUND([.B118];12) -> true | D118: of:=FORMULA([.A118]) -> =N136
A119: of:=[.N137] -> 1.96683567842791E-033 | B119: 1.96683567842791E-033 | C119: of:=ROUND([.A119];12)=ROUND([.B119];12) -> true | D119: of:=FORMULA([.A119]) -> =N137
A120: of:=[.M141] -> 0.993513073759398 | B120: 0.993513073759398 | C120: of:=ROUND([.A120];12)=ROUND([.B120];12) -> true | D120: of:=FORMULA([.A120]) -> =M141 | E120: Aoo#112447
A121: of:=[.M142] -> 0.0128352023106137 | B121: 0.0128352023106137 | C121: of:=ROUND([.A121];12)=ROUND([.B121];12) -> true | D121: of:=FORMULA([.A121]) -> =M142 | H121: 0 | I121: 0.93 | J121: of:=[.I121]*([.L121]+[.$N$122])/[.$N$122] -> 0.93 | K121: 0 | L121: of:=[.K121]*[.$N$121] -> 0 | M121: DV | N121: 0.2
A122: of:=[.M143] -> 0.997004784931993 | B122: 0.997004784931993 | C122: of:=ROUND([.A122];12)=ROUND([.B122];12) -> true | D122: of:=FORMULA([.A122]) -> =M143 | H122: 0.2 | I122: 0.9 | J122: of:=[.I122]*([.L122]+[.$N$122])/[.$N$122] -> 0.9018 | K122: 1 | L122: of:=[.K122]*[.$N$121] -> 0.2 | M122: V0 | N122: 100
A123: of:=[.M144] -> 5991.58515208592 | B123: 5991.58515208592 | C123: of:=ROUND([.A123];12)=ROUND([.B123];12) -> true | D123: of:=FORMULA([.A123]) -> =M144 | H123: 0.4 | I123: 0.84 | J123: of:=[.I123]*([.L123]+[.$N$122])/[.$N$122] -> 0.84336 | K123: 2 | L123: of:=[.K123]*[.$N$121] -> 0.4 | M123: Vinc | N123: 1
A124: of:=[.M145] -> 656.400371441014 | B124: 656.400371441014 | C124: of:=ROUND([.A124];12)=ROUND([.B124];12) -> true | D124: of:=FORMULA([.A124]) -> =M145 | H124: 0.6 | I124: 0.72 | J124: of:=[.I124]*([.L124]+[.$N$122])/[.$N$122] -> 0.72432 | K124: 3 | L124: of:=[.K124]*[.$N$121] -> 0.6 | M124: Ctitolante | N124: 0.005
A125: of:=[.M146] -> 0.998365537944251 | B125: 0.998365537944251 | C125: of:=ROUND([.A125];12)=ROUND([.B125];12) -> true | D125: of:=FORMULA([.A125]) -> =M146 | H125: 0.8 | I125: 0.68 | J125: of:=[.I125]*([.L125]+[.$N$122])/[.$N$122] -> 0.68544 | K125: 4 | L125: of:=[.K125]*[.$N$121] -> 0.8
A126: of:=[.M147] -> 0.006044561390305 | B126: 0.006044561390305 | C126: of:=ROUND([.A126];12)=ROUND([.B126];12) -> true | D126: of:=FORMULA([.A126]) -> =M147 | H126: 1 | I126: 0.58 | J126: of:=[.I126]*([.L126]+[.$N$122])/[.$N$122] -> 0.5858 | K126: 5 | L126: of:=[.K126]*[.$N$121] -> 1
A127: of:=[.M148] -> 0.999304012155418 | B127: 0.999304012155418 | C127: of:=ROUND([.A127];12)=ROUND([.B127];12) -> true | D127: of:=FORMULA([.A127]) -> =M148 | H127: 1.2 | I127: 0.5 | J127: of:=[.I127]*([.L127]+[.$N$122])/[.$N$122] -> 0.506 | K127: 6 | L127: of:=[.K127]*[.$N$121] -> 1.2
A128: of:=[.M149] -> 27280.3273487637 | B128: 27280.3273487637 | C128: of:=ROUND([.A128];12)=ROUND([.B128];12) -> true | D128: of:=FORMULA([.A128]) -> =M149 | H128: 1.4 | I128: 0.43 | J128: of:=[.I128]*([.L128]+[.$N$122])/[.$N$122] -> 0.43602 | K128: 7 | L128: of:=[.K128]*[.$N$121] -> 1.4
A129: of:=[.M150] -> 2860.62585490803 | B129: 2860.62585490803 | C129: of:=ROUND([.A129];12)=ROUND([.B129];12) -> true | D129: of:=FORMULA([.A129]) -> =M150 | H129: 1.6 | I129: 0.33 | J129: of:=[.I129]*([.L129]+[.$N$122])/[.$N$122] -> 0.33528 | K129: 8 | L129: of:=[.K129]*[.$N$121] -> 1.6
A130: of:=[.N141] -> 0.0663170105263173 | B130: 0.0663170105263173 | C130: of:=ROUND([.A130];12)=ROUND([.B130];12) -> true | D130: of:=FORMULA([.A130]) -> =N141 | H130: 1.8 | I130: 0.26 | J130: of:=[.I130]*([.L130]+[.$N$122])/[.$N$122] -> 0.26468 | K130: 9 | L130: of:=[.K130]*[.$N$121] -> 1.8
A131: of:=[.N142] -> 0.15375479515727 | B131: 0.15375479515727 | C131: of:=ROUND([.A131];12)=ROUND([.B131];12) -> true | D131: of:=FORMULA([.A131]) -> =N142 | H131: 2 | I131: 0.19 | J131: of:=[.I131]*([.L131]+[.$N$122])/[.$N$122] -> 0.1938 | K131: 10 | L131: of:=[.K131]*[.$N$121] -> 2
A132: of:=[.N143] -> 0.330988985021654 | B132: 0.330988985021654 | C132: of:=ROUND([.A132];12)=ROUND([.B132];12) -> true | D132: of:=FORMULA([.A132]) -> =N143 | H132: 2.2 | I132: 0.13 | J132: of:=[.I132]*([.L132]+[.$N$122])/[.$N$122] -> 0.13286 | K132: 11 | L132: of:=[.K132]*[.$N$121] -> 2.2 | M132: RegLin 2^tra
A133: of:=[.N144] -> 18 | B133: 18 | C133: of:=ROUND([.A133];12)=ROUND([.B133];12) -> true | D133: of:=FORMULA([.A133]) -> =N144 | H133: 2.4 | I133: 0.11 | J133: of:=[.I133]*([.L133]+[.$N$122])/[.$N$122] -> 0.11264 | K133: 12 | L133: of:=[.K133]*[.$N$121] -> 2.4 | M133: of:=LINEST([.J133:.J137];[.H133:.H137];1;1) -> 0.00109999999999999 | N133: 0.11
A134: of:=[.N145] -> 1.97196674770196 | B134: 1.97196674770196 | C134: of:=ROUND([.A134];12)=ROUND([.B134];12) -> true | D134: of:=FORMULA([.A134]) -> =N145 | H134: 2.6 | I134: 0.11 | J134: of:=[.I134]*([.L134]+[.$N$122])/[.$N$122] -> 0.11286 | K134: 13 | L134: of:=[.K134]*[.$N$121] -> 2.6 | M134: 4.04849321602897E-017 | N134: 1.13934698304003E-016
A135: of:=[.N146] -> 0 | B135: 0 | C135: of:=ROUND([.A135];12)=ROUND([.B135];12) -> true | D135: of:=FORMULA([.A135]) -> =N146 | H135: 2.8 | I135: 0.11 | J135: of:=[.I135]*([.L135]+[.$N$122])/[.$N$122] -> 0.11308 | K135: 14 | L135: of:=[.K135]*[.$N$121] -> 2.8 | M135: 1 | N135: 2.56049193087833E-017
A136: of:=[.N147] ->  | B136: error | C136: of:=ISERROR([.A136]) -> true | D136: of:=FORMULA([.A136]) -> =N147 | H136: 3 | I136: 0.11 | J136: of:=[.I136]*([.L136]+[.$N$122])/[.$N$122] -> 0.1133 | K136: 15 | L136: of:=[.K136]*[.$N$121] -> 3 | M136: 7.3824164159995E+026 | N136: 3
A137: of:=[.N148] -> 0.323821545440303 | B137: 0.323821545440303 | C137: of:=ROUND([.A137];12)=ROUND([.B137];12) -> true | D137: of:=FORMULA([.A137]) -> =N148 | H137: 3.2 | I137: 0.11 | J137: of:=[.I137]*([.L137]+[.$N$122])/[.$N$122] -> 0.11352 | K137: 16 | L137: of:=[.K137]*[.$N$121] -> 3.2 | M137: 0.000000483999999999991 | N137: 1.96683567842791E-033
A138: of:=[.N149] -> 19 | B138: 19 | C138: of:=ROUND([.A138];12)=ROUND([.B138];12) -> true | D138: of:=FORMULA([.A138]) -> =N149
A139: of:=[.N150] -> 1.99234747253558 | B139: 1.99234747253558 | C139: of:=ROUND([.A139];12)=ROUND([.B139];12) -> true | D139: of:=FORMULA([.A139]) -> =N150
A140: of:=[.I165] -> 22 | B140: 22 | C140: of:=ROUND([.A140];12)=ROUND([.B140];12) -> true | D140: of:=FORMULA([.A140]) -> =I165
A141: of:=[.I166] -> 57 | B141: 57 | C141: of:=ROUND([.A141];12)=ROUND([.B141];12) -> true | D141: of:=FORMULA([.A141]) -> =I166 | I141: 1 | K141: 0.7478926 | M141: of:=LINEST([.K141:.K160];[.I141:.I160];1;1) -> 0.993513073759398 | N141: 0.0663170105263173
A142: of:=[.I167] -> 7 | B142: 7 | C142: of:=ROUND([.A142];12)=ROUND([.B142];12) -> true | D142: of:=FORMULA([.A142]) -> =I167 | I142: 2 | K142: 1.8182643 | M142: 0.0128352023106137 | N142: 0.15375479515727
A143: of:=[.I168] -> 0 | B143: 0 | C143: of:=ROUND([.A143];12)=ROUND([.B143];12) -> true | D143: of:=FORMULA([.A143]) -> =I168 | I143: 3 | K143: 3.6512072 | M143: 0.997004784931993 | N143: 0.330988985021654
A144: of:=[.I169] -> 1 | B144: 1 | C144: of:=ROUND([.A144];12)=ROUND([.B144];12) -> true | D144: of:=FORMULA([.A144]) -> =I169 | I144: 4 | K144: 3.8595766 | M144: 5991.58515208592 | N144: 18
A145: of:=[.I170] ->  | C145: of:=ISERROR([.A145]) -> true | D145: of:=FORMULA([.A145]) -> =I170 | I145: 5 | K145: 5.5364063 | M145: 656.400371441014 | N145: 1.97196674770196
A146: of:=[.I171] -> 612.5 | B146: 612.5 | C146: of:=ROUND([.A146];12)=ROUND([.B146];12) -> true | D146: of:=FORMULA([.A146]) -> =I171 | I146: 6 | K146: 6.0990199 | M146: of:=LINEST([.K141:.K160];[.I141:.I160];0;1) -> 0.998365537944251 | N146: 0
A147: of:=[.J165] -> 3 | B147: 3 | C147: of:=ROUND([.A147];12)=ROUND([.B147];12) -> true | D147: of:=FORMULA([.A147]) -> =J165 | I147: 7 | K147: 7.3514376 | M147: 0.006044561390305
A148: of:=[.J166] -> 8 | B148: 8 | C148: of:=ROUND([.A148];12)=ROUND([.B148];12) -> true | D148: of:=FORMULA([.A148]) -> =J166 | I148: 8 | K148: 7.5813859 | M148: 0.999304012155418 | N148: 0.323821545440303
A149: of:=[.J167] -> 1 | B149: 1 | C149: of:=ROUND([.A149];12)=ROUND([.B149];12) -> true | D149: of:=FORMULA([.A149]) -> =J167 | I149: 9 | K149: 8.7487811 | M149: 27280.3273487637 | N149: 19
A150: of:=[.J168] -> 0 | B150: 0 | C150: of:=ROUND([.A150];12)=ROUND([.B150];12) -> true | D150: of:=FORMULA([.A150]) -> =J168 | I150: 10 | K150: 10.1965132 | M150: 2860.62585490803 | N150: 1.99234747253558
A151: of:=[.J169] -> 0 | B151: 0 | C151: of:=ROUND([.A151];12)=ROUND([.B151];12) -> true | D151: of:=FORMULA([.A151]) -> =J169 | I151: 11 | K151: 10.6963219
A152: of:=[.J170] -> 0 | B152: 0 | C152: of:=ROUND([.A152];12)=ROUND([.B152];12) -> true | D152: of:=FORMULA([.A152]) -> =J170 | I152: 12 | K152: 12.1780419
A153: of:=[.M169] -> -6.99452631578947 | B153: -6.99452631578947 | C153: of:=ROUND([.A153];12)=ROUND([.B153];12) -> true | D153: of:=FORMULA([.A153]) -> =M169 | I153: 13 | K153: 12.3980212
A154: of:=[.M170] -> 0.00247568308297809 | B154: 0.00247568308297809 | C154: of:=ROUND([.A154];12)=ROUND([.B154];12) -> true | D154: of:=FORMULA([.A154]) -> =M170 | I154: 14 | K154: 13.9569535
A155: of:=[.M171] -> 0.999999949709745 | B155: 0.999999949709745 | C155: of:=ROUND([.A155];12)=ROUND([.B155];12) -> true | D155: of:=FORMULA([.A155]) -> =M171 | I155: 15 | K155: 15.1322284
A156: of:=[.M172] -> 9942283.62965002 | B156: 9942283.62965002 | C156: of:=ROUND([.A156];12)=ROUND([.B156];12) -> true | D156: of:=FORMULA([.A156]) -> =M172 | I156: 16 | K156: 15.8380816
A157: of:=[.M173] -> 11577901.4177444 | B157: 11577901.4177444 | C157: of:=ROUND([.A157];12)=ROUND([.B157];12) -> true | D157: of:=FORMULA([.A157]) -> =M173 | I157: 17 | K157: 17.3275139
A158: of:=[.N169] -> 4.11879699248141 | B158: 4.11879699248141 | C158: of:=ROUND([.A158];12)=ROUND([.B158];12) -> true | D158: of:=FORMULA([.A158]) -> =N169 | I158: 18 | K158: 18.071353
A159: of:=[.N170] -> 0.320748742445571 | B159: 0.320748742445571 | C159: of:=ROUND([.A159];12)=ROUND([.B159];12) -> true | D159: of:=FORMULA([.A159]) -> =N170 | I159: 19 | K159: 18.6729207
A160: of:=[.N171] -> 0.763056773181177 | B160: 0.763056773181177 | C160: of:=ROUND([.A160];12)=ROUND([.B160];12) -> true | D160: of:=FORMULA([.A160]) -> =N171 | I160: 20 | K160: 20.1021649
A161: of:=[.N172] -> 1 | B161: 1 | C161: of:=ROUND([.A161];12)=ROUND([.B161];12) -> true | D161: of:=FORMULA([.A161]) -> =N172
A162: of:=[.N173] -> 0.582255639097671 | B162: 0.582255639097671 | C162: of:=ROUND([.A162];12)=ROUND([.B162];12) -> true | D162: of:=FORMULA([.A162]) -> =N173
A163: of:=[.O169] -> -108.083609022579 | B163: -108.083609022579 | C163: of:=ROUND([.A163];12)=ROUND([.B163];12) -> true | D163: of:=FORMULA([.A163]) -> =O169
A164: of:=[.O170] -> 34.8435504725221 | B164: 34.8435504725221 | C164: of:=ROUND([.A164];12)=ROUND([.B164];12) -> true | D164: of:=FORMULA([.A164]) -> =O170 | M164: -10188 | N164: 100 | O164: 1500
A165: of:=[.O171] ->  | B165: error | C165: of:=ISERROR([.A165]) -> true | D165: of:=FORMULA([.A165]) -> =O171 | I165: of:=[.J165]*7+1 -> 22 | J165: 3 | M165: -6757 | N165: 101 | O165: 1010
A166: of:=[.O172] ->  | B166: error | C166: of:=ISERROR([.A166]) -> true | D166: of:=FORMULA([.A166]) -> =O172 | I166: of:=[.J166]*7+1 -> 57 | J166: 8 | M166: -6542 | N166: 102 | O166: 980
A167: of:=[.O173] ->  | B167: error | C167: of:=ISERROR([.A167]) -> true | D167: of:=FORMULA([.A167]) -> =O173 | I167: of:=LINEST([.I165:.I166];[.J165:.J166];TRUE();TRUE()) -> 7 | J167: 1 | M167: -5761 | N167: 105 | O167: 870
A168: of:=[.M182] -> -0.699789473684211 | B168: -0.699789473684211 | C168: of:=ROUND([.A168];12)=ROUND([.B168];12) -> true | D168: of:=FORMULA([.A168]) -> =M182 | I168: 0 | J168: 0
A169: of:=[.M183] -> 0.000506389721518251 | B169: 0.000506389721518251 | C169: of:=ROUND([.A169];12)=ROUND([.B169];12) -> true | D169: of:=FORMULA([.A169]) -> =M183 | I169: 1 | J169: 0 | M169: of:=LINEST([.M164:.M167];[.N164:.O167];1;1) -> -6.99452631578947 | N169: 4.11879699248141 | O169: -108.083609022579
A170: of:=[.M184] -> 0.999999798786035 | B170: 0.999999798786035 | C170: of:=ROUND([.A170];12)=ROUND([.B170];12) -> true | D170: of:=FORMULA([.A170]) -> =M184 | J170: 0 | M170: 0.00247568308297809 | N170: 0.320748742445571 | O170: 34.8435504725221
A171: of:=[.M185] -> 2484916.49382742 | B171: 2484916.49382742 | C171: of:=ROUND([.A171];12)=ROUND([.B171];12) -> true | D171: of:=FORMULA([.A171]) -> =M185 | I171: 612.5 | J171: 0 | M171: 0.999999949709745 | N171: 0.763056773181177
A172: of:=[.M186] -> 0.121069615639098 | B172: 0.121069615639098 | C172: of:=ROUND([.A172];12)=ROUND([.B172];12) -> true | D172: of:=FORMULA([.A172]) -> =M186 | M172: 9942283.62965002 | N172: 1
A173: of:=[.N182] -> 0.299248120300747 | B173: 0.299248120300747 | C173: of:=ROUND([.A173];12)=ROUND([.B173];12) -> true | D173: of:=FORMULA([.A173]) -> =N182 | M173: 11577901.4177444 | N173: 0.582255639097671
A174: of:=[.N183] -> 0.0065607697318413 | B174: 0.0065607697318413 | C174: of:=ROUND([.A174];12)=ROUND([.B174];12) -> true | D174: of:=FORMULA([.A174]) -> =N183
A175: of:=[.N184] -> 0.000156079794514333 | B175: 0.000156079794514333 | C175: of:=ROUND([.A175];12)=ROUND([.B175];12) -> true | D175: of:=FORMULA([.A175]) -> =N184
A176: of:=[.N185] -> 1 | B176: 1 | C176: of:=ROUND([.A176];12)=ROUND([.B176];12) -> true | D176: of:=FORMULA([.A176]) -> =N185
A177: of:=[.N186] -> 0.0000000243609022556365 | B177: 0.0000000243609022556365 | C177: of:=ROUND([.A177];12)=ROUND([.B177];12) -> true | D177: of:=FORMULA([.A177]) -> =N186 | M177: 0.3501 | N177: 1 | O177: 1.5
A178: of:=[.O182] -> 1.10053744360903 | B178: 1.10053744360903 | C178: of:=ROUND([.A178];12)=ROUND([.B178];12) -> true | D178: of:=FORMULA([.A178]) -> =O182 | M178: 0.6959 | N178: 1.01 | O178: 1.01
A179: of:=[.O183] -> 0.00712708986937959 | B179: 0.00712708986937959 | C179: of:=ROUND([.A179];12)=ROUND([.B179];12) -> true | D179: of:=FORMULA([.A179]) -> =O183 | M179: 0.7201 | N179: 1.02 | O179: 0.98
A180: of:=[.O184] ->  | B180: error | C180: of:=ISERROR([.A180]) -> true | D180: of:=FORMULA([.A180]) -> =O184 | M180: 0.8059 | N180: 1.05 | O180: 0.87
A181: of:=[.O185] ->  | B181: error | C181: of:=ISERROR([.A181]) -> true | D181: of:=FORMULA([.A181]) -> =O185
A182: of:=[.O186] ->  | B182: error | C182: of:=ISERROR([.A182]) -> true | D182: of:=FORMULA([.A182]) -> =O186 | M182: of:=LINEST([.M177:.M180];[.N177:.O180];1;TRUE()) -> -0.699789473684211 | N182: 0.299248120300747 | O182: 1.10053744360903
A183: of:=[.M193] -> -0.699999999995333 | B183: -0.699999999995333 | C183: of:=ROUND([.A183];12)=ROUND([.B183];12) -> true | D183: of:=FORMULA([.A183]) -> =M193 | M183: 0.000506389721518251 | N183: 0.0065607697318413 | O183: 0.00712708986937959
A184: of:=[.M194] -> 0.000000000000925081260404044 | B184: 0.000000000000925081260404044 | C184: of:=ROUND([.A184];12)=ROUND([.B184];12) -> true | D184: of:=FORMULA([.A184]) -> =M194 | M184: 0.999999798786035 | N184: 0.000156079794514333
A185: of:=[.M195] -> 1 | B185: 1 | C185: of:=ROUND([.A185];12)=ROUND([.B185];12) -> true | D185: of:=FORMULA([.A185]) -> =M195 | M185: 2484916.49382742 | N185: 1
A186: of:=[.M196] -> 3.46285083263994E+030 | B186: 3.46285083263994E+030 | C186: of:=ROUND([.A186];12)=ROUND([.B186];12) -> true | D186: of:=FORMULA([.A186]) -> =M196 | M186: 0.121069615639098 | N186: 0.0000000243609022556365
A187: of:=[.M197] -> 0.001693384196 | B187: 0.001693384196 | C187: of:=ROUND([.A187];12)=ROUND([.B187];12) -> true | D187: of:=FORMULA([.A187]) -> =M197
A188: of:=[.N193] -> 0.299999999990667 | B188: 0.299999999990667 | C188: of:=ROUND([.A188];12)=ROUND([.B188];12) -> true | D188: of:=FORMULA([.A188]) -> =N193 | M188: -0.000007 | N188: 1 | O188: 2.00001
A189: of:=[.N194] -> 0.00000000000184989825908131 | B189: 0.00000000000184989825908131 | C189: of:=ROUND([.A189];12)=ROUND([.B189];12) -> true | D189: of:=FORMULA([.A189]) -> =N194 | M189: -0.010993 | N189: 1.01 | O189: 2.01999
A190: of:=[.N195] -> 1.5636727264106E-017 | B190: 1.5636727264106E-017 | C190: of:=ROUND([.A190];12)=ROUND([.B190];12) -> true | D190: of:=FORMULA([.A190]) -> =N195 | M190: -0.022007 | N190: 1.02 | O190: 2.04001
A191: of:=[.N196] -> 1 | B191: 1 | C191: of:=ROUND([.A191];12)=ROUND([.B191];12) -> true | D191: of:=FORMULA([.A191]) -> =N196 | M191: -0.054993 | N191: 1.05 | O191: 2.09999
A192: of:=[.N197] -> 2.44507239532035E-034 | B192: 2.44507239532035E-034 | C192: of:=ROUND([.A192];12)=ROUND([.B192];12) -> true | D192: of:=FORMULA([.A192]) -> =N197
A193: of:=[.O193] -> 1.1 | B193: 1.1 | C193: of:=ROUND([.A193];12)=ROUND([.B193];12) -> true | D193: of:=FORMULA([.A193]) -> =O193 | M193: of:=LINEST([.M188:.M191];[.N188:.O191];1;1) -> -0.699999999995333 | N193: 0.299999999990667 | O193: 1.1
A194: of:=[.O194] -> 5.04426861242829E-016 | B194: 5.04426861242829E-016 | C194: of:=ROUND([.A194];12)=ROUND([.B194];12) -> true | D194: of:=FORMULA([.A194]) -> =O194 | M194: 0.000000000000925081260404044 | N194: 0.00000000000184989825908131 | O194: 5.04426861242829E-016
A195: of:=[.O195] ->  | B195: error | C195: of:=ISERROR([.A195]) -> true | D195: of:=FORMULA([.A195]) -> =O195 | M195: 1 | N195: 1.5636727264106E-017
A196: of:=[.O196] ->  | B196: error | C196: of:=ISERROR([.A196]) -> true | D196: of:=FORMULA([.A196]) -> =O196 | M196: 3.46285083263994E+030 | N196: 1
A197: of:=[.O197] ->  | B197: error | C197: of:=ISERROR([.A197]) -> true | D197: of:=FORMULA([.A197]) -> =O197 | M197: 0.001693384196 | N197: 2.44507239532035E-034
A198: of:=[.M205] -> -0.684999999999999 | B198: -0.684999999999999 | C198: of:=ROUND([.A198];12)=ROUND([.B198];12) -> true | D198: of:=FORMULA([.A198]) -> =M205
A199: of:=[.M206] -> 0.00935414346693479 | B199: 0.00935414346693479 | C199: of:=ROUND([.A199];12)=ROUND([.B199];12) -> true | D199: of:=FORMULA([.A199]) -> =M206
A200: of:=[.M207] -> 0.999999363887917 | B200: 0.999999363887917 | C200: of:=ROUND([.A200];12)=ROUND([.B200];12) -> true | D200: of:=FORMULA([.A200]) -> =M207 | M200: -0.00145 | N200: 1 | O200: 2.002
A201: of:=[.M208] -> 786024.50000001 | B201: 786024.50000001 | C201: of:=ROUND([.A201];12)=ROUND([.B201];12) -> true | D201: of:=FORMULA([.A201]) -> =M208 | M201: -0.00965 | N201: 1.01 | O201: 2.018
A202: of:=[.M209] -> 0.001572049 | B202: 0.001572049 | C202: of:=ROUND([.A202];12)=ROUND([.B202];12) -> true | D202: of:=FORMULA([.A202]) -> =M209 | M202: -0.02335 | N202: 1.02 | O202: 2.042
A203: of:=[.N205] -> 0.272999999999999 | B203: 0.272999999999999 | C203: of:=ROUND([.A203];12)=ROUND([.B203];12) -> true | D203: of:=FORMULA([.A203]) -> =N205 | M203: -0.05355 | N203: 1.05 | O203: 2.098
A204: of:=[.N206] -> 0.0181934053986601 | B204: 0.0181934053986601 | C204: of:=ROUND([.A204];12)=ROUND([.B204];12) -> true | D204: of:=FORMULA([.A204]) -> =N206
A205: of:=[.N207] -> 0.0000316227766016836 | B205: 0.0000316227766016836 | C205: of:=ROUND([.A205];12)=ROUND([.B205];12) -> true | D205: of:=FORMULA([.A205]) -> =N207 | M205: of:=LINEST([.M200:.M203];[.N200:.O203];1;1) -> -0.684999999999999 | N205: 0.272999999999999 | O205: 1.09694
A206: of:=[.N208] -> 1 | B206: 1 | C206: of:=ROUND([.A206];12)=ROUND([.B206];12) -> true | D206: of:=FORMULA([.A206]) -> =N208 | M206: 0.00935414346693479 | N206: 0.0181934053986601 | O206: 0.00102012254165859
A207: of:=[.N209] -> 0.000000000999999999999988 | B207: 0.000000000999999999999988 | C207: of:=ROUND([.A207];12)=ROUND([.B207];12) -> true | D207: of:=FORMULA([.A207]) -> =N209 | M207: 0.999999363887917 | N207: 0.0000316227766016836
A208: of:=[.O205] -> 1.09694 | B208: 1.09694 | C208: of:=ROUND([.A208];12)=ROUND([.B208];12) -> true | D208: of:=FORMULA([.A208]) -> =O205 | M208: 786024.50000001 | N208: 1
A209: of:=[.O206] -> 0.00102012254165859 | B209: 0.00102012254165859 | C209: of:=ROUND([.A209];12)=ROUND([.B209];12) -> true | D209: of:=FORMULA([.A209]) -> =O206 | M209: 0.001572049 | N209: 0.000000000999999999999988
A210: of:=[.O207] ->  | B210: error | C210: of:=ISERROR([.A210]) -> true | D210: of:=FORMULA([.A210]) -> =O207
A211: of:=[.O208] ->  | B211: error | C211: of:=ISERROR([.A211]) -> true | D211: of:=FORMULA([.A211]) -> =O208
A212: of:=[.O209] ->  | B212: error | C212: of:=ISERROR([.A212]) -> true | D212: of:=FORMULA([.A212]) -> =O209 | M212: -0.00145 | N212: -0.00965 | O212: -0.02335 | P212: -0.05355
A213: of:=[.M216] -> -0.684999999999999 | B213: -0.684999999999999 | C213: of:=ROUND([.A213];12)=ROUND([.B213];12) -> true | D213: of:=FORMULA([.A213]) -> =M216 | M213: 1 | N213: 1.01 | O213: 1.02 | P213: 1.05
A214: of:=[.M217] -> 0.00935414346693479 | B214: 0.00935414346693479 | C214: of:=ROUND([.A214];12)=ROUND([.B214];12) -> true | D214: of:=FORMULA([.A214]) -> =M217 | M214: 2.002 | N214: 2.018 | O214: 2.042 | P214: 2.098
A215: of:=[.M218] -> 0.999999363887917 | B215: 0.999999363887917 | C215: of:=ROUND([.A215];12)=ROUND([.B215];12) -> true | D215: of:=FORMULA([.A215]) -> =M218
A216: of:=[.M219] -> 786024.50000001 | B216: 786024.50000001 | C216: of:=ROUND([.A216];12)=ROUND([.B216];12) -> true | D216: of:=FORMULA([.A216]) -> =M219 | M216: of:=LINEST([.M212:.P212];[.M213:.P214];1;1) -> -0.684999999999999 | N216: 0.272999999999999 | O216: 1.09694
A217: of:=[.M220] -> 0.001572049 | B217: 0.001572049 | C217: of:=ROUND([.A217];12)=ROUND([.B217];12) -> true | D217: of:=FORMULA([.A217]) -> =M220 | M217: 0.00935414346693479 | N217: 0.0181934053986601 | O217: 0.00102012254165859
A218: of:=[.N216] -> 0.272999999999999 | B218: 0.272999999999999 | C218: of:=ROUND([.A218];12)=ROUND([.B218];12) -> true | D218: of:=FORMULA([.A218]) -> =N216 | M218: 0.999999363887917 | N218: 0.0000316227766016836
A219: of:=[.N217] -> 0.0181934053986601 | B219: 0.0181934053986601 | C219: of:=ROUND([.A219];12)=ROUND([.B219];12) -> true | D219: of:=FORMULA([.A219]) -> =N217 | M219: 786024.50000001 | N219: 1
A220: of:=[.N218] -> 0.0000316227766016836 | B220: 0.0000316227766016836 | C220: of:=ROUND([.A220];12)=ROUND([.B220];12) -> true | D220: of:=FORMULA([.A220]) -> =N218 | M220: 0.001572049 | N220: 0.000000000999999999999988
A221: of:=[.N219] -> 1 | B221: 1 | C221: of:=ROUND([.A221];12)=ROUND([.B221];12) -> true | D221: of:=FORMULA([.A221]) -> =N219
A222: of:=[.N220] -> 0.000000000999999999999988 | B222: 0.000000000999999999999988 | C222: of:=ROUND([.A222];12)=ROUND([.B222];12) -> true | D222: of:=FORMULA([.A222]) -> =N220
A223: of:=[.O216] -> 1.09694 | B223: 1.09694 | C223: of:=ROUND([.A223];12)=ROUND([.B223];12) -> true | D223: of:=FORMULA([.A223]) -> =O216
A224: of:=[.O217] -> 0.00102012254165859 | B224: 0.00102012254165859 | C224: of:=ROUND([.A224];12)=ROUND([.B224];12) -> true | D224: of:=FORMULA([.A224]) -> =O217
A225: of:=[.O218] ->  | B225: error | C225: of:=ISERROR([.A225]) -> true | D225: of:=FORMULA([.A225]) -> =O218
A226: of:=[.O219] ->  | B226: error | C226: of:=ISERROR([.A226]) -> true | D226: of:=FORMULA([.A226]) -> =O219
A227: of:=[.O220] ->  | B227: error | C227: of:=ISERROR([.A227]) -> true | D227: of:=FORMULA([.A227]) -> =O220
C228: of:=ROUND([.A228];12)=ROUND([.B228];12) -> true | D228: of:=FORMULA([.A228]) -> 

Sheet: 'file:///tmp/sumif.fods/sum.fods/sum.fods/subtotal.fods/sqrtpi.fods/sqrt.fods/sinh.fods/sin.fods/cos.fods/cos.fods/atan.fods/asinh.fods/asin.fods/acos.fods/abs.fods/abs.fods/xor.fods/xor.fods/not.fods/ifna.fods/ifna.fods/iferror.fods/iferror.fods/if.fods/and.fods/and.fods/and.fods/and.fods/type.fods/isna.fods/isna.fods/islogical.fods/isformula.fods/iserr.fods/isblank.fods/info.fods/formula.fods/formula.fods/current.fods/cell.fods/cell.fods/minute.fods/minute.fods/year.fods/function_based_test_Example.fods/function_based_test_Example_reference.fods'#Sheet2
H3: 4

Sheet: 'file:///tmp/sumif.fods/sum.fods/sum.fods/subtotal.fods/sqrtpi.fods/sqrt.fods/sinh.fods/sin.fods/cos.fods/cos.fods/atan.fods/asinh.fods/asin.fods/acos.fods/abs.fods/abs.fods/xor.fods/xor.fods/not.fods/ifna.fods/ifna.fods/iferror.fods/iferror.fods/if.fods/and.fods/and.fods/and.fods/and.fods/type.fods/isna.fods/isna.fods/islogical.fods/isformula.fods/sc-unit-test/information-functions.ods'#Information
O7: O5

Sheet: 'file:///tmp/sumif.fods/sumif.fods/external_refs/sumif_references.fods'#Sheet1
C6: yes | D6: 1
C7: no | D7: 2
C8: yes | D8: 3