Sheet: Sheet1
A1: LOGEST Function
A3: Result | B3: of:=AND([.B8:.B95]) -> true
A7: Sheet | B7: Result | C7: Description
A8: 1 | B8: of:=AND([Sheet2.C2:.C92]) -> true | C8: Simple LOGEST formulas with local references and values

Sheet: Sheet2
A1: Function | B1: Expected | C1: Correct | D1: FunctionString | E1: Comment | J1: x1 | K1: x2 | L1: y | N1: LINEST value | R1: Known y | S1: Known x | U1: Month | V1: Sales | X1: Floor space (x1) | Y1: Offices (x2) | Z1: Entrances (x3) | AA1: Age (x4) | AB1: Assessed value (y)
A2: of:=[.K17] -> 1.04333180072885 | B2: 1.04333180072885 | C2: of:=ROUND([.A2];12)=ROUND([.B2];12) -> true | D2: of:=FORMULA([.A2]) -> =K17 | J2: 4 | K2: 7 | L2: 100 | N2: 4,17 | O2: -3,48 | P2: 82,33 | R2: 1 | S2: 0 | U2: 1 | V2: 3100 | X2: 2310 | Y2: 2 | Z2: 2 | AA2: 20 | AB2: 142000
A3: of:=[.K18] -> 0.00724946175792764 | B3: 0.00724946175792764 | C3: of:=ROUND([.A3];12)=ROUND([.B3];12) -> true | D3: of:=FORMULA([.A3]) -> =K18 | J3: 5 | K3: 9 | L3: 105 | N3: 5,46 | O3: 10,96 | P3: 9,35 | R3: 9 | S3: 4 | U3: 2 | V3: 4500 | X3: 2333 | Y3: 2 | Z3: 2 | AA3: 12 | AB3: 144000
A4: of:=[.K19] -> 0.872574040951189 | B4: 0.872574040951189 | C4: of:=ROUND([.A4];12)=ROUND([.B4];12) -> true | D4: of:=FORMULA([.A4]) -> =K19 | J4: 6 | K4: 11 | L4: 104 | N4: 0,87 | O4: 5,06 | P4: #NA | R4: 5 | S4: 2 | U4: 3 | V4: 4400 | X4: 2356 | Y4: 3 | Z4: 1.5 | AA4: 33 | AB4: 151000
A5: of:=[.K20] -> 34.2384725790819 | B5: 34.2384725790819 | C5: of:=ROUND([.A5];9)=ROUND([.B5];9) -> true | D5: of:=FORMULA([.A5]) -> =K20 | J5: 7 | K5: 12 | L5: 108 | N5: 13,21 | O5: 4 | P5: #NA | R5: 7 | S5: 3 | U5: 4 | V5: 5400 | X5: 2379 | Y5: 3 | Z5: 2 | AA5: 43 | AB5: 150000
A6: of:=[.K21] -> 0.0503829902899041 | B6: 0.0503829902899041 | C6: of:=ROUND([.A6];12)=ROUND([.B6];12) -> true | D6: of:=FORMULA([.A6]) -> =K21 | J6: 8 | K6: 15 | L6: 111 | N6: 675,45 | O6: 102,26 | P6: #NA | R6: Result (slope) | S6: Result (y-intercept) | U6: 5 | V6: 7500 | X6: 2402 | Y6: 2 | Z6: 3 | AA6: 53 | AB6: 139000
A7: of:=[.L17] -> 82.5576827252647 | B7: 82.5576827252647 | C7: of:=ROUND([.A7];12)=ROUND([.B7];12) -> true | D7: of:=FORMULA([.A7]) -> =L17 | J7: 9 | K7: 17 | L7: 120 | R7: 2 | S7: 1 | U7: 6 | V7: 8100 | X7: 2425 | Y7: 4 | Z7: 2 | AA7: 23 | AB7: 169000
A8: of:=[.L18] -> 0.0527768782358499 | B8: 0.0527768782358499 | C8: of:=ROUND([.A8];12)=ROUND([.B8];12) -> true | D8: of:=FORMULA([.A8]) -> =L18 | J8: 10 | K8: 19 | L8: 133 | R8: Formula (array formula in cells A7:B7) | U8: Formula | V8: Result | X8: 2448 | Y8: 2 | Z8: 1.5 | AA8: 99 | AB8: 126000
A9: of:=[.L19] -> 0.0383605459010993 | B9: 0.0383605459010993 | C9: of:=ROUND([.A9];12)=ROUND([.B9];12) -> true | D9: of:=FORMULA([.A9]) -> =L19 | R9: of:=LINEST([.R2:.R5];[.S2:.S5];;0) -> 2 | S9: 1 | V9: $11,000 | X9: 2471 | Y9: 2 | Z9: 2 | AA9: 34 | AB9: 142900
A10: of:=[.L20] -> 5 | B10: 5 | C10: of:=ROUND([.A10];12)=ROUND([.B10];12) -> true | D10: of:=FORMULA([.A10]) -> =L20 | V10: Calculates the estimate of the sales in the ninth month, based on sales in months 2 through 6. | X10: 2494 | Y10: 3 | Z10: 3 | AA10: 23 | AB10: 163000
A11: of:=[.L21] -> 0.00735765740915173 | B11: 0.00735765740915173 | C11: of:=ROUND([.A11];12)=ROUND([.B11];12) -> true | D11: of:=FORMULA([.A11]) -> =L21 | X11: 2517 | Y11: 4 | Z11: 4 | AA11: 55 | AB11: 169000
A12: of:=LOGEST({2;3;5;7;10};{4;6;10;14;20};1;0) -> 1.10286912552017 | B12: 1.10286912552017 | C12: of:=ROUND([.A12];12)=ROUND([.B12];12) -> true | D12: of:=FORMULA([.A12]) -> =LOGEST({2,3,5,7,10},{4,6,10,14,20},1,0) | X12: 2540 | Y12: 2 | Z12: 3 | AA12: 22 | AB12: 149000
A13: of:=[.K25] -> 1.10286912552017 | B13: 1.10286912552017 | C13: of:=ROUND([.A13];9)=ROUND([.B13];9) -> true | D13: of:=FORMULA([.A13]) -> =K25 | X13: -234.2371645
A14: of:=[.L25] -> 1.60392806375267 | B14: 1.60392806375267 | C14: of:=ROUND([.A14];12)=ROUND([.B14];12) -> true | D14: of:=FORMULA([.A14]) -> =L25 | X14: 13.26801148
A15: of:=[.R9] -> 2 | B15: 2 | C15: of:=ROUND([.A15];12)=ROUND([.B15];12) -> true | D15: of:=FORMULA([.A15]) -> =R9 | X15: 0.996747993
A16: of:=[.S9] -> 1 | B16: 1 | C16: of:=ROUND([.A16];12)=ROUND([.B16];12) -> true | D16: of:=FORMULA([.A16]) -> =S9 | X16: 459.7536742
A17: of:=SUM(LOGEST([.V2:.V6]; [.U2:.U6])*{9;1}) -> 2672.41129180003 | B17: 2672.41129180003 | C17: of:=ROUND([.A17];12)=ROUND([.B17];12) -> true | D17: of:=FORMULA([.A17]) -> =SUM(LOGEST(V2:V6, U2:U6)*{9,1}) | K17: of:=LOGEST([.L2:.L8];[.J2:.J8];1;1) -> 1.04333180072885 | L17: 82.5576827252647 | X17: 1732393319
A18: of:=[.K29] -> 0.998307311395751 | B18: 0.998307311395751 | C18: of:=ROUND([.A18];12)=ROUND([.B18];12) -> true | D18: of:=FORMULA([.A18]) -> =K29 | K18: 0.00724946175792764 | L18: 0.0527768782358499 | X18: Formula (array formula entered in A14:A18)
A19: of:=[.K30] -> 0.0000822132224295928 | B19: 0.0000822132224295928 | C19: of:=ROUND([.A19];9)=ROUND([.B19];9) -> true | D19: of:=FORMULA([.A19]) -> =K30 | K19: 0.872574040951189 | L19: 0.0383605459010993 | X19: of:=LINEST([.E2:.E12];[.A2:.D12];1;1) -> 
A20: of:=[.K31] -> 0.997224228993195 | B20: 0.997224228993195 | C20: of:=ROUND([.A20];12)=ROUND([.B20];12) -> true | D20: of:=FORMULA([.A20]) -> =K31 | K20: 34.2384725790819 | L20: 5
A21: of:=[.K32] -> 538.890398315583 | B21: 538.890398315583 | C21: of:=ROUND([.A21];12)=ROUND([.B21];12) -> true | D21: of:=FORMULA([.A21]) -> =K32 | K21: 0.0503829902899041 | L21: 0.00735765740915173
A22: of:=[.K33] -> 0.0779638724932393 | B22: 0.0779638724932393 | C22: of:=ROUND([.A22];12)=ROUND([.B22];12) -> true | D22: of:=FORMULA([.A22]) -> =K33
A23: of:=[.L29] -> 1.01810621384184 | B23: 1.01810621384184 | C23: of:=ROUND([.A23];12)=ROUND([.B23];12) -> true | D23: of:=FORMULA([.A23]) -> =L29
A24: of:=[.L30] -> 0.00328821098057803 | B24: 0.00328821098057803 | C24: of:=ROUND([.A24];12)=ROUND([.B24];12) -> true | D24: of:=FORMULA([.A24]) -> =L30
A25: of:=[.L31] -> 0.00601404236086587 | B25: 0.00601404236086587 | C25: of:=ROUND([.A25];12)=ROUND([.B25];12) -> true | D25: of:=FORMULA([.A25]) -> =L31 | K25: of:=LOGEST({2;3;5;7;10};{4;6;10;14;20};1;0) -> 1.10286912552017 | L25: 1.60392806375267
A26: of:=[.L32] -> 6 | B26: 6 | C26: of:=ROUND([.A26];12)=ROUND([.B26];12) -> true | D26: of:=FORMULA([.A26]) -> =L32
A27: of:=[.L33] -> 0.000217012233109734 | B27: 0.000217012233109734 | C27: of:=ROUND([.A27];12)=ROUND([.B27];12) -> true | D27: of:=FORMULA([.A27]) -> =L33
A28: of:=[.M29] -> 1.08543473416676 | B28: 1.08543473416676 | C28: of:=ROUND([.A28];12)=ROUND([.B28];12) -> true | D28: of:=FORMULA([.A28]) -> =M29
A29: of:=[.M30] -> 0.00247895353541688 | B29: 0.00247895353541688 | C29: of:=ROUND([.A29];12)=ROUND([.B29];12) -> true | D29: of:=FORMULA([.A29]) -> =M30 | K29: of:=LOGEST([.AB2:.AB12];[.X2:.AA12];1;1) -> 0.998307311395751 | L29: 1.01810621384184 | M29: 1.08543473416676 | N29: 1.00017437377135 | O29: 80387.1472131758
A30: of:=[.M31] ->  | B30: error | C30: of:=ISERROR([.A30]) -> true | D30: of:=FORMULA([.A30]) -> =M31 | K30: 0.0000822132224295928 | L30: 0.00328821098057803 | M30: 0.00247895353541688 | N30: 0.0000336422934631347 | O30: 0.0758269566818821
A31: of:=[.M32] ->  | B31: error | C31: of:=ISNA([.A31]) -> true | D31: of:=FORMULA([.A31]) -> =M32 | K31: 0.997224228993195 | L31: 0.00601404236086587
A32: of:=[.M33] ->  | B32: error | C32: of:=ISNA([.A32]) -> true | D32: of:=FORMULA([.A32]) -> =M33 | K32: 538.890398315583 | L32: 6
A33: of:=[.N29] -> 1.00017437377135 | B33: 1.00017437377135 | C33: of:=ROUND([.A33];12)=ROUND([.B33];12) -> true | D33: of:=FORMULA([.A33]) -> =N29 | K33: 0.0779638724932393 | L33: 0.000217012233109734
A34: of:=[.N30] -> 0.0000336422934631347 | B34: 0.0000336422934631347 | C34: of:=ROUND([.A34];12)=ROUND([.B34];12) -> true | D34: of:=FORMULA([.A34]) -> =N30
A35: of:=[.N31] ->  | B35: error | C35: of:=ISERROR([.A35]) -> true | D35: of:=FORMULA([.A35]) -> =N31
A36: of:=[.N32] ->  | B36: error | C36: of:=ISERROR([.A36]) -> true | D36: of:=FORMULA([.A36]) -> =N32
A37: of:=[.N33] ->  | B37: error | C37: of:=ISERROR([.A37]) -> true | D37: of:=FORMULA([.A37]) -> =N33
A38: of:=[.O29] -> 80387.1472131758 | B38: 80387.1472131758 | C38: of:=ROUND([.A38];12)=ROUND([.B38];12) -> true | D38: of:=FORMULA([.A38]) -> =O29
A39: of:=[.O30] -> 0.0758269566818821 | B39: 0.0758269566818821 | C39: of:=ROUND([.A39];12)=ROUND([.B39];12) -> true | D39: of:=FORMULA([.A39]) -> =O30
A40: of:=[.O31] ->  | B40: error | C40: of:=ISERROR([.A40]) -> true | D40: of:=FORMULA([.A40]) -> =O31
A41: of:=[.O32] ->  | B41: error | C41: of:=ISERROR([.A41]) -> true | D41: of:=FORMULA([.A41]) -> =O32
A42: of:=[.O33] ->  | B42: error | C42: of:=ISERROR([.A42]) -> true | D42: of:=FORMULA([.A42]) -> =O33

Sheet: 'file:///tmp/sumif.fods/sum.fods/sum.fods/subtotal.fods/sqrtpi.fods/sqrt.fods/sinh.fods/sin.fods/cos.fods/cos.fods/atan.fods/asinh.fods/asin.fods/acos.fods/abs.fods/abs.fods/xor.fods/xor.fods/not.fods/ifna.fods/ifna.fods/iferror.fods/iferror.fods/if.fods/and.fods/and.fods/and.fods/and.fods/type.fods/isna.fods/isna.fods/islogical.fods/isformula.fods/iserr.fods/isblank.fods/info.fods/formula.fods/formula.fods/current.fods/cell.fods/cell.fods/minute.fods/minute.fods/year.fods/function_based_test_Example.fods/function_based_test_Example_reference.fods'#Sheet2
H3: 4

Sheet: 'file:///tmp/sumif.fods/sum.fods/sum.fods/subtotal.fods/sqrtpi.fods/sqrt.fods/sinh.fods/sin.fods/cos.fods/cos.fods/atan.fods/asinh.fods/asin.fods/acos.fods/abs.fods/abs.fods/xor.fods/xor.fods/not.fods/ifna.fods/ifna.fods/iferror.fods/iferror.fods/if.fods/and.fods/and.fods/and.fods/and.fods/type.fods/isna.fods/isna.fods/islogical.fods/isformula.fods/sc-unit-test/information-functions.ods'#Information
O7: O5

Sheet: 'file:///tmp/sumif.fods/sumif.fods/external_refs/sumif_references.fods'#Sheet1
C6: yes | D6: 1
C7: no | D7: 2
C8: yes | D8: 3