Sheet: Sheet1
A1: SUMPRODUCT function
A3: Result | B3: of:=AND([.B8:.B95]) -> true
A7: Sheet | B7: Result | C7: Description
A8: 1 | B8: of:=AND([Sheet2.C2:.C92]) -> true | C8: Simple SUMPRODUCT formulas with local references and values

Sheet: Sheet2
A1: Function | B1: Expected | C1: Correct | D1: FunctionString | E1: Comment | I1: 2 | J1: 3 | K1: 4 | L1: 5 | N1: Array 1 | Q1: Array 2
A2: of:=SUMPRODUCT([.I1:.J3];[.K1:.L3]) -> 397 | B2: 397 | C2: of:=ROUND([.A2];12)=ROUND([.B2];12) -> true | D2: of:=FORMULA([.A2]) -> =SUMPRODUCT(I1:J3,K1:L3) | I2: 6 | J2: 7 | K2: 8 | L2: 9 | N2: 3 | O2: 4 | Q2: 2 | R2: 7
A3: of:=SUMPRODUCT([.N2:.O4]; [.Q2:.R4]) -> 156 | B3: 156 | C3: of:=ROUND([.A3];12)=ROUND([.B3];12) -> true | D3: of:=FORMULA([.A3]) -> =SUMPRODUCT(N2:O4, Q2:R4) | I3: 10 | J3: 11 | K3: 12 | L3: 13 | N3: 8 | O3: 6 | Q3: 6 | R3: 7
A4: of:=SUMPRODUCT([.I5:.I6]+1) -> 5 | B4: 5 | C4: of:=ROUND([.A4];12)=ROUND([.B4];12) -> true | D4: of:=FORMULA([.A4]) -> =SUMPRODUCT(I5:I6+1) | E4: AOO#4485 | N4: 1 | O4: 9 | Q4: 5 | R4: 3
A5: of:=SUMPRODUCT([.I5:.I6]+1) -> 5 | B5: 5 | C5: of:=ROUND([.A5];12)=ROUND([.B5];12) -> true | D5: of:=FORMULA([.A5]) -> =SUMPRODUCT(I5:I6+1) | I5: 1 | J5: of:=[.I5:.I6]+1 -> 2 | N5: Formula | O5: Description | P5: Result
A6: of:=SUMPRODUCT([.I5:.I6]+1) -> 5 | B6: 5 | C6: of:=ROUND([.A6];12)=ROUND([.B6];12) -> true | D6: of:=FORMULA([.A6]) -> =SUMPRODUCT(I5:I6+1) | I6: 2 | J6: of:=[.I5:.I6]+1 -> 3 | P6: 156
A7: of:=SUMPRODUCT([.J10:.J11]=9;LEFT([.K10:.K11];LEN([.K9]))=[.K9];[.L10:.L11]) -> 7 | B7: 7 | C7: of:=ROUND([.A7];12)=ROUND([.B7];12) -> true | D7: of:=FORMULA([.A7]) -> =SUMPRODUCT(J10:J11=9,LEFT(K10:K11,LEN(K9))=K9,L10:L11) | E7: Tdf#95670 | J7: of:=[.I5:.I6]+1 -> 
A8: of:=SUMPRODUCT([.J10:.J11]=9;LEFT([.K10:.K11];LEN([.K9]))=[.K9];[.L10:.L11]) -> 7 | B8: 7 | C8: of:=ROUND([.A8];12)=ROUND([.B8];12) -> true | D8: of:=FORMULA([.A8]) -> {=SUMPRODUCT(J10:J11=9,LEFT(K10:K11,LEN(K9))=K9,L10:L11)}
A9: of:=SUMPRODUCT([.J16:.J18];[.K16:.K18]) -> 18 | B9: 18 | C9: of:=ROUND([.A9];12)=ROUND([.B9];12) -> true | D9: of:=FORMULA([.A9]) -> =SUMPRODUCT(J16:J18,K16:K18) | J9: 3 | K9: Lim | L9: Value
A10: of:=SUMPRODUCT([.J16:.J18]*[.K16:.K18]) -> 18 | B10: 18 | C10: of:=ROUND([.A10];12)=ROUND([.B10];12) -> true | D10: of:=FORMULA([.A10]) -> =SUMPRODUCT(J16:J18*K16:K18) | J10: 9 | K10: LimMin | L10: 5
A11: of:=SUMPRODUCT(2*[.K16:.K18]) -> 28 | B11: 28 | C11: of:=ROUND([.A11];12)=ROUND([.B11];12) -> true | D11: of:=FORMULA([.A11]) -> =SUMPRODUCT(2*K16:K18) | J11: 9 | K11: LimPla | L11: 2
A12: of:=SUMPRODUCT([.J16:.J18];[.L16:.L18]) -> 18 | B12: 18 | C12: of:=ROUND([.A12];12)=ROUND([.B12];12) -> true | D12: of:=FORMULA([.A12]) -> =SUMPRODUCT(J16:J18,L16:L18)
A13: of:=SUMPRODUCT([.J16:.J18]*[.L16:.L18]) -> 18 | B13: 18 | C13: of:=ROUND([.A13];12)=ROUND([.B13];12) -> true | D13: of:=FORMULA([.A13]) -> =SUMPRODUCT(J16:J18*L16:L18)
A14: of:=SUMPRODUCT(2*[.L16:.L18]) -> 28 | B14: 28 | C14: of:=ROUND([.A14];12)=ROUND([.B14];12) -> true | D14: of:=FORMULA([.A14]) -> =SUMPRODUCT(2*L16:L18) | J14: Database
A15: of:=SUMPRODUCT([.J16:.J18];[.M16:.M18]) -> 18 | B15: 18 | C15: of:=ROUND([.A15];12)=ROUND([.B15];12) -> true | D15: of:=FORMULA([.A15]) -> =SUMPRODUCT(J16:J18,M16:M18) | J15: Quantity | K15: PriceA | L15: PriceB | M15: PriceC | N15: PriceD
A16: of:=SUMPRODUCT([.J16:.J18];[.N16:.N18]) -> 18 | B16: 18 | C16: of:=ROUND([.A16];12)=ROUND([.B16];12) -> true | D16: of:=FORMULA([.A16]) -> =SUMPRODUCT(J16:J18,N16:N18) | J16: 1 | K16: 10 | L16: 10 | M16: 10 | N16: 10
A17: of:=SUMPRODUCT([.J16:.J18]*[.M16:.M18]) ->  | B17: of:#VALUE! ->  | C17: of:=ISERROR([.A17]) -> true | D17: of:=FORMULA([.A17]) -> =SUMPRODUCT(J16:J18*M16:M18) | E17: Tdf#91453 | J17: 3 | K17: 0 | M17: of:="" ->  | N17: Unknown
A18: of:=SUMPRODUCT(2*[.M16:.M18]) ->  | B18: of:#VALUE! ->  | C18: of:=ISERROR([.A18]) -> true | D18: of:=FORMULA([.A18]) -> =SUMPRODUCT(2*M16:M18) | J18: 2 | K18: 4 | L18: 4 | M18: 4 | N18: 4
A19: of:=SUMPRODUCT([.J16:.J18]*[.N16:.N18]) ->  | B19: of:#VALUE! ->  | C19: of:=ISERROR([.A19]) -> true | D19: of:=FORMULA([.A19]) -> =SUMPRODUCT(J16:J18*N16:N18)
A20: of:=SUMPRODUCT(2*[.N16:.N18]) ->  | B20: of:#VALUE! ->  | C20: of:=ISERROR([.A20]) -> true | D20: of:=FORMULA([.A20]) -> =SUMPRODUCT(2*N16:N18) | J20: 1 | K20: of:=1/0 -> 
A21: of:=SUMPRODUCT([.J20:.K20]) ->  | B21: of:#DIV/0! ->  | C21: of:=ISERROR([.A21]) -> true | D21: of:=FORMULA([.A21]) -> =SUMPRODUCT(J20:K20) | E21: Tdf#79978
A22: of:=SUMPRODUCT(IFNA([.J23:.J26];0)) -> 200 | B22: 200 | C22: of:=ROUND([.A22];12)=ROUND([.B22];12) -> true | D22: of:=FORMULA([.A22]) -> =SUMPRODUCT(IFNA(J23:J26,0))
A23: of:=SUMPRODUCT(IFNA([.J23:.J26];0)) -> 200 | B23: 200 | C23: of:=ROUND([.A23];12)=ROUND([.B23];12) -> true | D23: of:=FORMULA([.A23]) -> =SUMPRODUCT(IFNA(J23:J26,0)) | J23: of:=NA() ->  | K23: of:=IFNA([.J23];0) -> 0
A24: of:=SUMPRODUCT(IFNA([.J23:.J26];0)) -> 200 | B24: 200 | C24: of:=ROUND([.A24];12)=ROUND([.B24];12) -> true | D24: of:=FORMULA([.A24]) -> =SUMPRODUCT(IFNA(J23:J26,0)) | J24: 100 | K24: of:=IFNA([.J24];0) -> 100
A25: of:=SUMPRODUCT(IFNA([.J23:.J26];0)) -> 200 | B25: 200 | C25: of:=ROUND([.A25];12)=ROUND([.B25];12) -> true | D25: of:=FORMULA([.A25]) -> =SUMPRODUCT(IFNA(J23:J26,0)) | J25: 100 | K25: of:=IFNA([.J25];0) -> 100
A26: of:=SUMPRODUCT(IFERROR([.J29:.J32];0)) -> 200 | B26: 200 | C26: of:=ROUND([.A26];12)=ROUND([.B26];12) -> true | D26: of:=FORMULA([.A26]) -> =SUMPRODUCT(IFERROR(J29:J32,0)) | E26: Tdf#79957 | J26: of:=NA() ->  | K26: of:=IFNA([.J26];0) -> 0
A27: of:=SUMPRODUCT(IFERROR([.J29:.J32];0)) -> 200 | B27: 200 | C27: of:=ROUND([.A27];12)=ROUND([.B27];12) -> true | D27: of:=FORMULA([.A27]) -> =SUMPRODUCT(IFERROR(J29:J32,0))
A28: of:=SUMPRODUCT(IFERROR([.J29:.J32];0)) -> 200 | B28: 200 | C28: of:=ROUND([.A28];12)=ROUND([.B28];12) -> true | D28: of:=FORMULA([.A28]) -> =SUMPRODUCT(IFERROR(J29:J32,0))
A29: of:=SUMPRODUCT(IFERROR([.J29:.J32];0)) -> 200 | B29: 200 | C29: of:=ROUND([.A29];12)=ROUND([.B29];12) -> true | D29: of:=FORMULA([.A29]) -> =SUMPRODUCT(IFERROR(J29:J32,0)) | E29: Tdf#74479 | J29: of:=MID("";-1;1) ->  | K29: of:=IFERROR([.J29];0) -> 0
A30: of:=SUMPRODUCT([.K34:.K34];INT([.J34:.J34])) -> 0 | B30: 0 | C30: of:=ROUND([.A30];12)=ROUND([.B30];12) -> true | D30: of:=FORMULA([.A30]) -> =SUMPRODUCT(K34:K34,INT(J34:J34)) | J30: 100 | K30: of:=IFERROR([.J30];0) -> 100
A31: of:=SUMPRODUCT([.K35:.K35];INT([.J35:.J35])) -> 0 | B31: 0 | C31: of:=ROUND([.A31];12)=ROUND([.B31];12) -> true | D31: of:=FORMULA([.A31]) -> =SUMPRODUCT(K35:K35,INT(J35:J35)) | J31: 100 | K31: of:=IFERROR([.J31];0) -> 100
A32: of:=SUMPRODUCT(INT([.J36:.J36]);[.K36:.K36]) -> 0 | B32: 0 | C32: of:=ROUND([.A32];12)=ROUND([.B32];12) -> true | D32: of:=FORMULA([.A32]) -> =SUMPRODUCT(INT(J36:J36),K36:K36) | J32: of:=MID("";-1;1) ->  | K32: of:=IFERROR([.J32];0) -> 0
A33: of:=SUMPRODUCT([.K37:.K37];[.J37:.J37]>1) -> 0 | B33: 0 | C33: of:=ROUND([.A33];12)=ROUND([.B33];12) -> true | D33: of:=FORMULA([.A33]) -> =SUMPRODUCT(K37:K37,J37:J37>1)
A34: of:=SUMPRODUCT([.K38:.K38];[.J38:.J38]>1) -> 0 | B34: 0 | C34: of:=ROUND([.A34];12)=ROUND([.B34];12) -> true | D34: of:=FORMULA([.A34]) -> =SUMPRODUCT(K38:K38,J38:J38>1) | J34: 10
A35: of:=SUMPRODUCT([.J39:.J39]>1;[.K39:.K39]) -> 0 | B35: 0 | C35: of:=ROUND([.A35];12)=ROUND([.B35];12) -> true | D35: of:=FORMULA([.A35]) -> =SUMPRODUCT(J39:J39>1,K39:K39) | J35: 10 | K35: 0
A36: of:=SUMPRODUCT([.K40:.K40];[.J40:.J40]*1) -> 0 | B36: 0 | C36: of:=ROUND([.A36];12)=ROUND([.B36];12) -> true | D36: of:=FORMULA([.A36]) -> =SUMPRODUCT(K40:K40,J40:J40*1) | J36: 10
A37: of:=SUMPRODUCT([.K41:.K41];[.J41:.J41]*1) -> 0 | B37: 0 | C37: of:=ROUND([.A37];12)=ROUND([.B37];12) -> true | D37: of:=FORMULA([.A37]) -> =SUMPRODUCT(K41:K41,J41:J41*1) | J37: 10
A38: of:=SUMPRODUCT([.J42:.J42]*1;[.K42:.K42]) -> 0 | B38: 0 | C38: of:=ROUND([.A38];12)=ROUND([.B38];12) -> true | D38: of:=FORMULA([.A38]) -> =SUMPRODUCT(J42:J42*1,K42:K42) | J38: 10 | K38: 0
J39: 10
J40: 10
J41: 10 | K41: 0
J42: 10