Sheet: Sheet1
A1: B Function
A3: Result | B3: of:=AND([.B8:.B95]) -> true
A7: Sheet | B7: Result | C7: Description
A8: 1 | B8: of:=AND([Sheet2.C2:.C349]) -> true | C8: Simple B formulas with local references and values

Sheet: Sheet2
A1: Function | B1: Expected | C1: Correct | D1: FunctionString | E1: Comment | AA1: year | AB1: month | AC1: day | AD1: value
A2: of:=BINOM.DIST.RANGE(10;1/6;2) -> 0.290710049201722 | B2: 0.290710049201722 | C2: of:=ROUND([.A2];12)=ROUND([.B2];12) -> true | D2: of:=FORMULA([.A2]) -> =B(10,1/6,2) | AA2: 2012 | AB2: 12 | AC2: 15 | AD2: 6
A3: of:=BINOM.DIST.RANGE(10;1/6;) -> 0.161505582889846 | B3: 0.161505582889846 | C3: of:=ROUND([.A3];12)=ROUND([.B3];12) -> true | D3: of:=FORMULA([.A3]) -> =B(10,1/6,) | AA3: 2012 | AB3: 4 | AC3: 1 | AD3: 10.4
A4: of:=BINOM.DIST.RANGE(10;1/6;0) -> 0.161505582889846 | B4: 0.161505582889846 | C4: of:=ROUND([.A4];12)=ROUND([.B4];12) -> true | D4: of:=FORMULA([.A4]) -> =B(10,1/6,0) | K4: 4000 | AA4: 2013 | AB4: 8 | AC4: 15 | AD4: 7
A5: of:=BINOM.DIST.RANGE(10;;0) -> 1 | B5: 1 | C5: of:=ROUND([.A5];12)=ROUND([.B5];12) -> true | D5: of:=FORMULA([.A5]) -> =B(10,,0) | K5: 0.0000007 | AA5: 2011 | AB5: 11 | AC5: 1 | AD5: 12
A6: of:=BINOM.DIST.RANGE(10;;) -> 1 | B6: 1 | C6: of:=ROUND([.A6];12)=ROUND([.B6];12) -> true | D6: of:=FORMULA([.A6]) -> =B(10,,) | AA6: 2011 | AB6: 2 | AC6: 14 | AD6: 8
A7: of:=BINOM.DIST.RANGE(10;;;) -> 1 | B7: 1 | C7: of:=ROUND([.A7];12)=ROUND([.B7];12) -> true | D7: of:=FORMULA([.A7]) -> =B(10,,,) | J7: 0 | AA7: 2010 | AB7: 6 | AC7: 1 | AD7: 15
A8: of:=BINOM.DIST.RANGE(10;1/6;2;2) -> 0.290710049201722 | B8: 0.290710049201722 | C8: of:=ROUND([.A8];12)=ROUND([.B8];12) -> true | D8: of:=FORMULA([.A8]) -> =B(10,1/6,2,2) | J8: 1
A9: of:=BINOM.DIST.RANGE(;;0) -> 1 | B9: 1 | C9: of:=ROUND([.A9];12)=ROUND([.B9];12) -> true | D9: of:=FORMULA([.A9]) -> =B(,,0) | J9: 2
A10: of:=BINOM.DIST.RANGE([.$K$4];[.$K$5];0;[.J7]) -> 0.997203915366774 | B10: 0.997203915366774 | C10: of:=ROUND([.A10];12)=ROUND([.B10];12) -> true | D10: of:=FORMULA([.A10]) -> =B($K$4,$K$5,0,J7) | J10: 3
A11: of:=BINOM.DIST.RANGE([.$K$4];[.$K$5];0;[.J8]) -> 0.999996088284322 | B11: 0.999996088284322 | C11: of:=ROUND([.A11];12)=ROUND([.B11];12) -> true | D11: of:=FORMULA([.A11]) -> =B($K$4,$K$5,0,J8) | J11: 4
A12: of:=BINOM.DIST.RANGE([.$K$4];[.$K$5];0;[.J9]) -> 0.999999996351881 | B12: 0.999999996351881 | C12: of:=ROUND([.A12];12)=ROUND([.B12];12) -> true | D12: of:=FORMULA([.A12]) -> =B($K$4,$K$5,0,J9) | J12: 5
A13: of:=BINOM.DIST.RANGE([.$K$4];[.$K$5];0;[.J10]) -> 0.99999999999759 | B13: 0.99999999999759 | C13: of:=ROUND([.A13];12)=ROUND([.B13];12) -> true | D13: of:=FORMULA([.A13]) -> =B($K$4,$K$5,0,J10) | J13: 6
A14: of:=BINOM.DIST.RANGE([.$K$4];[.$K$5];0;[.J11]) -> 1 | B14: 1 | C14: of:=ROUND([.A14];12)=ROUND([.B14];12) -> true | D14: of:=FORMULA([.A14]) -> =B($K$4,$K$5,0,J11) | J14: 7
A15: of:=BINOM.DIST.RANGE([.$K$4];[.$K$5];0;[.J12]) -> 1 | B15: 1 | C15: of:=ROUND([.A15];12)=ROUND([.B15];12) -> true | D15: of:=FORMULA([.A15]) -> =B($K$4,$K$5,0,J12) | J15: 8
A16: of:=BINOM.DIST.RANGE([.$K$4];[.$K$5];0;[.J13]) -> 1 | B16: 1 | C16: of:=ROUND([.A16];12)=ROUND([.B16];12) -> true | D16: of:=FORMULA([.A16]) -> =B($K$4,$K$5,0,J13) | J16: 9
A17: of:=BINOM.DIST.RANGE([.$K$4];[.$K$5];0;[.J14]) -> 1 | B17: 1 | C17: of:=ROUND([.A17];12)=ROUND([.B17];12) -> true | D17: of:=FORMULA([.A17]) -> =B($K$4,$K$5,0,J14) | J17: 10
A18: of:=BINOM.DIST.RANGE([.$K$4];[.$K$5];0;[.J15]) -> 1 | B18: 1 | C18: of:=ROUND([.A18];12)=ROUND([.B18];12) -> true | D18: of:=FORMULA([.A18]) -> =B($K$4,$K$5,0,J15) | J18: 11
A19: of:=BINOM.DIST.RANGE([.$K$4];[.$K$5];0;[.J16]) -> 1 | B19: 1 | C19: of:=ROUND([.A19];12)=ROUND([.B19];12) -> true | D19: of:=FORMULA([.A19]) -> =B($K$4,$K$5,0,J16) | J19: 12
A20: of:=BINOM.DIST.RANGE([.$K$4];[.$K$5];0;[.J17]) -> 1 | B20: 1 | C20: of:=ROUND([.A20];12)=ROUND([.B20];12) -> true | D20: of:=FORMULA([.A20]) -> =B($K$4,$K$5,0,J17) | J20: 13
A21: of:=BINOM.DIST.RANGE([.$K$4];[.$K$5];0;[.J18]) -> 1 | B21: 1 | C21: of:=ROUND([.A21];12)=ROUND([.B21];12) -> true | D21: of:=FORMULA([.A21]) -> =B($K$4,$K$5,0,J18) | J21: 14
A22: of:=BINOM.DIST.RANGE([.$K$4];[.$K$5];0;[.J19]) -> 1 | B22: 1 | C22: of:=ROUND([.A22];12)=ROUND([.B22];12) -> true | D22: of:=FORMULA([.A22]) -> =B($K$4,$K$5,0,J19) | J22: 15
A23: of:=BINOM.DIST.RANGE([.$K$4];[.$K$5];0;[.J20]) -> 1 | B23: 1 | C23: of:=ROUND([.A23];12)=ROUND([.B23];12) -> true | D23: of:=FORMULA([.A23]) -> =B($K$4,$K$5,0,J20) | J23: 16
A24: of:=BINOM.DIST.RANGE([.$K$4];[.$K$5];0;[.J21]) -> 1 | B24: 1 | C24: of:=ROUND([.A24];12)=ROUND([.B24];12) -> true | D24: of:=FORMULA([.A24]) -> =B($K$4,$K$5,0,J21) | J24: 17
A25: of:=BINOM.DIST.RANGE([.$K$4];[.$K$5];0;[.J22]) -> 1 | B25: 1 | C25: of:=ROUND([.A25];12)=ROUND([.B25];12) -> true | D25: of:=FORMULA([.A25]) -> =B($K$4,$K$5,0,J22) | J25: 18
A26: of:=BINOM.DIST.RANGE([.$K$4];[.$K$5];0;[.J23]) -> 1 | B26: 1 | C26: of:=ROUND([.A26];12)=ROUND([.B26];12) -> true | D26: of:=FORMULA([.A26]) -> =B($K$4,$K$5,0,J23) | J26: 19
A27: of:=BINOM.DIST.RANGE([.$K$4];[.$K$5];0;[.J24]) -> 1 | B27: 1 | C27: of:=ROUND([.A27];12)=ROUND([.B27];12) -> true | D27: of:=FORMULA([.A27]) -> =B($K$4,$K$5,0,J24) | J27: 20
A28: of:=BINOM.DIST.RANGE([.$K$4];[.$K$5];0;[.J25]) -> 1 | B28: 1 | C28: of:=ROUND([.A28];12)=ROUND([.B28];12) -> true | D28: of:=FORMULA([.A28]) -> =B($K$4,$K$5,0,J25) | J28: 21
A29: of:=BINOM.DIST.RANGE([.$K$4];[.$K$5];0;[.J26]) -> 1 | B29: 1 | C29: of:=ROUND([.A29];12)=ROUND([.B29];12) -> true | D29: of:=FORMULA([.A29]) -> =B($K$4,$K$5,0,J26) | J29: 22
A30: of:=BINOM.DIST.RANGE([.$K$4];[.$K$5];0;[.J27]) -> 1 | B30: 1 | C30: of:=ROUND([.A30];12)=ROUND([.B30];12) -> true | D30: of:=FORMULA([.A30]) -> =B($K$4,$K$5,0,J27) | J30: 23
A31: of:=BINOM.DIST.RANGE([.$K$4];[.$K$5];0;[.J28]) -> 1 | B31: 1 | C31: of:=ROUND([.A31];12)=ROUND([.B31];12) -> true | D31: of:=FORMULA([.A31]) -> =B($K$4,$K$5,0,J28) | J31: 24
A32: of:=BINOM.DIST.RANGE([.$K$4];[.$K$5];0;[.J29]) -> 1 | B32: 1 | C32: of:=ROUND([.A32];12)=ROUND([.B32];12) -> true | D32: of:=FORMULA([.A32]) -> =B($K$4,$K$5,0,J29) | J32: 25
A33: of:=BINOM.DIST.RANGE([.$K$4];[.$K$5];0;[.J30]) -> 1 | B33: 1 | C33: of:=ROUND([.A33];12)=ROUND([.B33];12) -> true | D33: of:=FORMULA([.A33]) -> =B($K$4,$K$5,0,J30) | J33: 26
A34: of:=BINOM.DIST.RANGE([.$K$4];[.$K$5];0;[.J31]) -> 1 | B34: 1 | C34: of:=ROUND([.A34];12)=ROUND([.B34];12) -> true | D34: of:=FORMULA([.A34]) -> =B($K$4,$K$5,0,J31) | J34: 27
A35: of:=BINOM.DIST.RANGE([.$K$4];[.$K$5];0;[.J32]) -> 1 | B35: 1 | C35: of:=ROUND([.A35];12)=ROUND([.B35];12) -> true | D35: of:=FORMULA([.A35]) -> =B($K$4,$K$5,0,J32) | J35: 28
A36: of:=BINOM.DIST.RANGE([.$K$4];[.$K$5];0;[.J33]) -> 1 | B36: 1 | C36: of:=ROUND([.A36];12)=ROUND([.B36];12) -> true | D36: of:=FORMULA([.A36]) -> =B($K$4,$K$5,0,J33) | J36: 29
A37: of:=BINOM.DIST.RANGE([.$K$4];[.$K$5];0;[.J34]) -> 1 | B37: 1 | C37: of:=ROUND([.A37];12)=ROUND([.B37];12) -> true | D37: of:=FORMULA([.A37]) -> =B($K$4,$K$5,0,J34) | J37: 30
A38: of:=BINOM.DIST.RANGE([.$K$4];[.$K$5];0;[.J35]) -> 1 | B38: 1 | C38: of:=ROUND([.A38];12)=ROUND([.B38];12) -> true | D38: of:=FORMULA([.A38]) -> =B($K$4,$K$5,0,J35) | J38: 31
A39: of:=BINOM.DIST.RANGE([.$K$4];[.$K$5];0;[.J36]) -> 1 | B39: 1 | C39: of:=ROUND([.A39];12)=ROUND([.B39];12) -> true | D39: of:=FORMULA([.A39]) -> =B($K$4,$K$5,0,J36) | J39: 32
A40: of:=BINOM.DIST.RANGE([.$K$4];[.$K$5];0;[.J37]) -> 1 | B40: 1 | C40: of:=ROUND([.A40];12)=ROUND([.B40];12) -> true | D40: of:=FORMULA([.A40]) -> =B($K$4,$K$5,0,J37) | J40: 33
A41: of:=BINOM.DIST.RANGE([.$K$4];[.$K$5];0;[.J38]) -> 1 | B41: 1 | C41: of:=ROUND([.A41];12)=ROUND([.B41];12) -> true | D41: of:=FORMULA([.A41]) -> =B($K$4,$K$5,0,J38) | J41: 34
A42: of:=BINOM.DIST.RANGE([.$K$4];[.$K$5];0;[.J39]) -> 1 | B42: 1 | C42: of:=ROUND([.A42];12)=ROUND([.B42];12) -> true | D42: of:=FORMULA([.A42]) -> =B($K$4,$K$5,0,J39) | J42: 35
A43: of:=BINOM.DIST.RANGE([.$K$4];[.$K$5];0;[.J40]) -> 1 | B43: 1 | C43: of:=ROUND([.A43];12)=ROUND([.B43];12) -> true | D43: of:=FORMULA([.A43]) -> =B($K$4,$K$5,0,J40) | J43: 36
A44: of:=BINOM.DIST.RANGE([.$K$4];[.$K$5];0;[.J41]) -> 1 | B44: 1 | C44: of:=ROUND([.A44];12)=ROUND([.B44];12) -> true | D44: of:=FORMULA([.A44]) -> =B($K$4,$K$5,0,J41) | J44: 37
A45: of:=BINOM.DIST.RANGE([.$K$4];[.$K$5];0;[.J42]) -> 1 | B45: 1 | C45: of:=ROUND([.A45];12)=ROUND([.B45];12) -> true | D45: of:=FORMULA([.A45]) -> =B($K$4,$K$5,0,J42) | J45: 38
A46: of:=BINOM.DIST.RANGE([.$K$4];[.$K$5];0;[.J43]) -> 1 | B46: 1 | C46: of:=ROUND([.A46];12)=ROUND([.B46];12) -> true | D46: of:=FORMULA([.A46]) -> =B($K$4,$K$5,0,J43) | J46: 39
A47: of:=BINOM.DIST.RANGE([.$K$4];[.$K$5];0;[.J44]) -> 1 | B47: 1 | C47: of:=ROUND([.A47];12)=ROUND([.B47];12) -> true | D47: of:=FORMULA([.A47]) -> =B($K$4,$K$5,0,J44) | J47: 40
A48: of:=BINOM.DIST.RANGE([.$K$4];[.$K$5];0;[.J45]) -> 1 | B48: 1 | C48: of:=ROUND([.A48];12)=ROUND([.B48];12) -> true | D48: of:=FORMULA([.A48]) -> =B($K$4,$K$5,0,J45) | J48: 41
A49: of:=BINOM.DIST.RANGE([.$K$4];[.$K$5];0;[.J46]) -> 1 | B49: 1 | C49: of:=ROUND([.A49];12)=ROUND([.B49];12) -> true | D49: of:=FORMULA([.A49]) -> =B($K$4,$K$5,0,J46) | J49: 42
A50: of:=BINOM.DIST.RANGE([.$K$4];[.$K$5];0;[.J47]) -> 1 | B50: 1 | C50: of:=ROUND([.A50];12)=ROUND([.B50];12) -> true | D50: of:=FORMULA([.A50]) -> =B($K$4,$K$5,0,J47) | J50: 43
A51: of:=BINOM.DIST.RANGE([.$K$4];[.$K$5];0;[.J48]) -> 1 | B51: 1 | C51: of:=ROUND([.A51];12)=ROUND([.B51];12) -> true | D51: of:=FORMULA([.A51]) -> =B($K$4,$K$5,0,J48) | J51: 44
A52: of:=BINOM.DIST.RANGE([.$K$4];[.$K$5];0;[.J49]) -> 1 | B52: 1 | C52: of:=ROUND([.A52];12)=ROUND([.B52];12) -> true | D52: of:=FORMULA([.A52]) -> =B($K$4,$K$5,0,J49) | J52: 45
A53: of:=BINOM.DIST.RANGE([.$K$4];[.$K$5];0;[.J50]) -> 1 | B53: 1 | C53: of:=ROUND([.A53];12)=ROUND([.B53];12) -> true | D53: of:=FORMULA([.A53]) -> =B($K$4,$K$5,0,J50) | J53: 46
A54: of:=BINOM.DIST.RANGE([.$K$4];[.$K$5];0;[.J51]) -> 1 | B54: 1 | C54: of:=ROUND([.A54];12)=ROUND([.B54];12) -> true | D54: of:=FORMULA([.A54]) -> =B($K$4,$K$5,0,J51) | J54: 47
A55: of:=BINOM.DIST.RANGE([.$K$4];[.$K$5];0;[.J52]) -> 1 | B55: 1 | C55: of:=ROUND([.A55];12)=ROUND([.B55];12) -> true | D55: of:=FORMULA([.A55]) -> =B($K$4,$K$5,0,J52) | J55: 48
A56: of:=BINOM.DIST.RANGE([.$K$4];[.$K$5];0;[.J53]) -> 1 | B56: 1 | C56: of:=ROUND([.A56];12)=ROUND([.B56];12) -> true | D56: of:=FORMULA([.A56]) -> =B($K$4,$K$5,0,J53) | J56: 49
A57: of:=BINOM.DIST.RANGE([.$K$4];[.$K$5];0;[.J54]) -> 1 | B57: 1 | C57: of:=ROUND([.A57];12)=ROUND([.B57];12) -> true | D57: of:=FORMULA([.A57]) -> =B($K$4,$K$5,0,J54) | J57: 50
A58: of:=BINOM.DIST.RANGE([.$K$4];[.$K$5];0;[.J55]) -> 1 | B58: 1 | C58: of:=ROUND([.A58];12)=ROUND([.B58];12) -> true | D58: of:=FORMULA([.A58]) -> =B($K$4,$K$5,0,J55) | J58: 51
A59: of:=BINOM.DIST.RANGE([.$K$4];[.$K$5];0;[.J56]) -> 1 | B59: 1 | C59: of:=ROUND([.A59];12)=ROUND([.B59];12) -> true | D59: of:=FORMULA([.A59]) -> =B($K$4,$K$5,0,J56) | J59: 52
A60: of:=BINOM.DIST.RANGE([.$K$4];[.$K$5];0;[.J57]) -> 1 | B60: 1 | C60: of:=ROUND([.A60];12)=ROUND([.B60];12) -> true | D60: of:=FORMULA([.A60]) -> =B($K$4,$K$5,0,J57) | J60: 53
A61: of:=BINOM.DIST.RANGE([.$K$4];[.$K$5];0;[.J58]) -> 1 | B61: 1 | C61: of:=ROUND([.A61];12)=ROUND([.B61];12) -> true | D61: of:=FORMULA([.A61]) -> =B($K$4,$K$5,0,J58) | J61: 54
A62: of:=BINOM.DIST.RANGE([.$K$4];[.$K$5];0;[.J59]) -> 1 | B62: 1 | C62: of:=ROUND([.A62];12)=ROUND([.B62];12) -> true | D62: of:=FORMULA([.A62]) -> =B($K$4,$K$5,0,J59) | J62: 55
A63: of:=BINOM.DIST.RANGE([.$K$4];[.$K$5];0;[.J60]) -> 1 | B63: 1 | C63: of:=ROUND([.A63];12)=ROUND([.B63];12) -> true | D63: of:=FORMULA([.A63]) -> =B($K$4,$K$5,0,J60) | J63: 56
A64: of:=BINOM.DIST.RANGE([.$K$4];[.$K$5];0;[.J61]) -> 1 | B64: 1 | C64: of:=ROUND([.A64];12)=ROUND([.B64];12) -> true | D64: of:=FORMULA([.A64]) -> =B($K$4,$K$5,0,J61) | J64: 57
A65: of:=BINOM.DIST.RANGE([.$K$4];[.$K$5];0;[.J62]) -> 1 | B65: 1 | C65: of:=ROUND([.A65];12)=ROUND([.B65];12) -> true | D65: of:=FORMULA([.A65]) -> =B($K$4,$K$5,0,J62) | J65: 58
A66: of:=BINOM.DIST.RANGE([.$K$4];[.$K$5];0;[.J63]) -> 1 | B66: 1 | C66: of:=ROUND([.A66];12)=ROUND([.B66];12) -> true | D66: of:=FORMULA([.A66]) -> =B($K$4,$K$5,0,J63) | J66: 59
A67: of:=BINOM.DIST.RANGE([.$K$4];[.$K$5];0;[.J64]) -> 1 | B67: 1 | C67: of:=ROUND([.A67];12)=ROUND([.B67];12) -> true | D67: of:=FORMULA([.A67]) -> =B($K$4,$K$5,0,J64) | J67: 60
A68: of:=BINOM.DIST.RANGE([.$K$4];[.$K$5];0;[.J65]) -> 1 | B68: 1 | C68: of:=ROUND([.A68];12)=ROUND([.B68];12) -> true | D68: of:=FORMULA([.A68]) -> =B($K$4,$K$5,0,J65) | J68: 61
A69: of:=BINOM.DIST.RANGE([.$K$4];[.$K$5];0;[.J66]) -> 1 | B69: 1 | C69: of:=ROUND([.A69];12)=ROUND([.B69];12) -> true | D69: of:=FORMULA([.A69]) -> =B($K$4,$K$5,0,J66) | J69: 62
A70: of:=BINOM.DIST.RANGE([.$K$4];[.$K$5];0;[.J67]) -> 1 | B70: 1 | C70: of:=ROUND([.A70];12)=ROUND([.B70];12) -> true | D70: of:=FORMULA([.A70]) -> =B($K$4,$K$5,0,J67) | J70: 63
A71: of:=BINOM.DIST.RANGE([.$K$4];[.$K$5];0;[.J68]) -> 1 | B71: 1 | C71: of:=ROUND([.A71];12)=ROUND([.B71];12) -> true | D71: of:=FORMULA([.A71]) -> =B($K$4,$K$5,0,J68) | J71: 64
A72: of:=BINOM.DIST.RANGE([.$K$4];[.$K$5];0;[.J69]) -> 1 | B72: 1 | C72: of:=ROUND([.A72];12)=ROUND([.B72];12) -> true | D72: of:=FORMULA([.A72]) -> =B($K$4,$K$5,0,J69) | J72: 65
A73: of:=BINOM.DIST.RANGE([.$K$4];[.$K$5];0;[.J70]) -> 1 | B73: 1 | C73: of:=ROUND([.A73];12)=ROUND([.B73];12) -> true | D73: of:=FORMULA([.A73]) -> =B($K$4,$K$5,0,J70) | J73: 66
A74: of:=BINOM.DIST.RANGE([.$K$4];[.$K$5];0;[.J71]) -> 1 | B74: 1 | C74: of:=ROUND([.A74];12)=ROUND([.B74];12) -> true | D74: of:=FORMULA([.A74]) -> =B($K$4,$K$5,0,J71) | J74: 67
A75: of:=BINOM.DIST.RANGE([.$K$4];[.$K$5];0;[.J72]) -> 1 | B75: 1 | C75: of:=ROUND([.A75];12)=ROUND([.B75];12) -> true | D75: of:=FORMULA([.A75]) -> =B($K$4,$K$5,0,J72) | J75: 68
A76: of:=BINOM.DIST.RANGE([.$K$4];[.$K$5];0;[.J73]) -> 1 | B76: 1 | C76: of:=ROUND([.A76];12)=ROUND([.B76];12) -> true | D76: of:=FORMULA([.A76]) -> =B($K$4,$K$5,0,J73) | J76: 69
A77: of:=BINOM.DIST.RANGE([.$K$4];[.$K$5];0;[.J74]) -> 1 | B77: 1 | C77: of:=ROUND([.A77];12)=ROUND([.B77];12) -> true | D77: of:=FORMULA([.A77]) -> =B($K$4,$K$5,0,J74) | J77: 70
A78: of:=BINOM.DIST.RANGE([.$K$4];[.$K$5];0;[.J75]) -> 1 | B78: 1 | C78: of:=ROUND([.A78];12)=ROUND([.B78];12) -> true | D78: of:=FORMULA([.A78]) -> =B($K$4,$K$5,0,J75) | J78: 71
A79: of:=BINOM.DIST.RANGE([.$K$4];[.$K$5];0;[.J76]) -> 1 | B79: 1 | C79: of:=ROUND([.A79];12)=ROUND([.B79];12) -> true | D79: of:=FORMULA([.A79]) -> =B($K$4,$K$5,0,J76) | J79: 72
A80: of:=BINOM.DIST.RANGE([.$K$4];[.$K$5];0;[.J77]) -> 1 | B80: 1 | C80: of:=ROUND([.A80];12)=ROUND([.B80];12) -> true | D80: of:=FORMULA([.A80]) -> =B($K$4,$K$5,0,J77) | J80: 73
A81: of:=BINOM.DIST.RANGE([.$K$4];[.$K$5];0;[.J78]) -> 1 | B81: 1 | C81: of:=ROUND([.A81];12)=ROUND([.B81];12) -> true | D81: of:=FORMULA([.A81]) -> =B($K$4,$K$5,0,J78) | J81: 74
A82: of:=BINOM.DIST.RANGE([.$K$4];[.$K$5];0;[.J79]) -> 1 | B82: 1 | C82: of:=ROUND([.A82];12)=ROUND([.B82];12) -> true | D82: of:=FORMULA([.A82]) -> =B($K$4,$K$5,0,J79) | J82: 75
A83: of:=BINOM.DIST.RANGE([.$K$4];[.$K$5];0;[.J80]) -> 1 | B83: 1 | C83: of:=ROUND([.A83];12)=ROUND([.B83];12) -> true | D83: of:=FORMULA([.A83]) -> =B($K$4,$K$5,0,J80) | J83: 76
A84: of:=BINOM.DIST.RANGE([.$K$4];[.$K$5];0;[.J81]) -> 1 | B84: 1 | C84: of:=ROUND([.A84];12)=ROUND([.B84];12) -> true | D84: of:=FORMULA([.A84]) -> =B($K$4,$K$5,0,J81) | J84: 77
A85: of:=BINOM.DIST.RANGE([.$K$4];[.$K$5];0;[.J82]) -> 1 | B85: 1 | C85: of:=ROUND([.A85];12)=ROUND([.B85];12) -> true | D85: of:=FORMULA([.A85]) -> =B($K$4,$K$5,0,J82) | J85: 78
A86: of:=BINOM.DIST.RANGE([.$K$4];[.$K$5];0;[.J83]) -> 1 | B86: 1 | C86: of:=ROUND([.A86];12)=ROUND([.B86];12) -> true | D86: of:=FORMULA([.A86]) -> =B($K$4,$K$5,0,J83) | J86: 79
A87: of:=BINOM.DIST.RANGE([.$K$4];[.$K$5];0;[.J84]) -> 1 | B87: 1 | C87: of:=ROUND([.A87];12)=ROUND([.B87];12) -> true | D87: of:=FORMULA([.A87]) -> =B($K$4,$K$5,0,J84) | J87: 80
A88: of:=BINOM.DIST.RANGE([.$K$4];[.$K$5];0;[.J85]) -> 1 | B88: 1 | C88: of:=ROUND([.A88];12)=ROUND([.B88];12) -> true | D88: of:=FORMULA([.A88]) -> =B($K$4,$K$5,0,J85) | J88: 81
A89: of:=BINOM.DIST.RANGE([.$K$4];[.$K$5];0;[.J86]) -> 1 | B89: 1 | C89: of:=ROUND([.A89];12)=ROUND([.B89];12) -> true | D89: of:=FORMULA([.A89]) -> =B($K$4,$K$5,0,J86) | J89: 82
A90: of:=BINOM.DIST.RANGE([.$K$4];[.$K$5];0;[.J87]) -> 1 | B90: 1 | C90: of:=ROUND([.A90];12)=ROUND([.B90];12) -> true | D90: of:=FORMULA([.A90]) -> =B($K$4,$K$5,0,J87) | J90: 83
A91: of:=BINOM.DIST.RANGE([.$K$4];[.$K$5];0;[.J88]) -> 1 | B91: 1 | C91: of:=ROUND([.A91];12)=ROUND([.B91];12) -> true | D91: of:=FORMULA([.A91]) -> =B($K$4,$K$5,0,J88) | J91: 84
A92: of:=BINOM.DIST.RANGE([.$K$4];[.$K$5];0;[.J89]) -> 1 | B92: 1 | C92: of:=ROUND([.A92];12)=ROUND([.B92];12) -> true | D92: of:=FORMULA([.A92]) -> =B($K$4,$K$5,0,J89) | J92: 85
A93: of:=BINOM.DIST.RANGE([.$K$4];[.$K$5];0;[.J90]) -> 1 | B93: 1 | C93: of:=ROUND([.A93];12)=ROUND([.B93];12) -> true | D93: of:=FORMULA([.A93]) -> =B($K$4,$K$5,0,J90) | J93: 86
A94: of:=BINOM.DIST.RANGE([.$K$4];[.$K$5];0;[.J91]) -> 1 | B94: 1 | C94: of:=ROUND([.A94];12)=ROUND([.B94];12) -> true | D94: of:=FORMULA([.A94]) -> =B($K$4,$K$5,0,J91) | J94: 87
A95: of:=BINOM.DIST.RANGE([.$K$4];[.$K$5];0;[.J92]) -> 1 | B95: 1 | C95: of:=ROUND([.A95];12)=ROUND([.B95];12) -> true | D95: of:=FORMULA([.A95]) -> =B($K$4,$K$5,0,J92) | J95: 88
A96: of:=BINOM.DIST.RANGE([.$K$4];[.$K$5];0;[.J93]) -> 1 | B96: 1 | C96: of:=ROUND([.A96];12)=ROUND([.B96];12) -> true | D96: of:=FORMULA([.A96]) -> =B($K$4,$K$5,0,J93) | J96: 89
A97: of:=BINOM.DIST.RANGE([.$K$4];[.$K$5];0;[.J94]) -> 1 | B97: 1 | C97: of:=ROUND([.A97];12)=ROUND([.B97];12) -> true | D97: of:=FORMULA([.A97]) -> =B($K$4,$K$5,0,J94) | J97: 90
A98: of:=BINOM.DIST.RANGE([.$K$4];[.$K$5];0;[.J95]) -> 1 | B98: 1 | C98: of:=ROUND([.A98];12)=ROUND([.B98];12) -> true | D98: of:=FORMULA([.A98]) -> =B($K$4,$K$5,0,J95) | J98: 91
A99: of:=BINOM.DIST.RANGE([.$K$4];[.$K$5];0;[.J96]) -> 1 | B99: 1 | C99: of:=ROUND([.A99];12)=ROUND([.B99];12) -> true | D99: of:=FORMULA([.A99]) -> =B($K$4,$K$5,0,J96) | J99: 92
A100: of:=BINOM.DIST.RANGE([.$K$4];[.$K$5];0;[.J97]) -> 1 | B100: 1 | C100: of:=ROUND([.A100];12)=ROUND([.B100];12) -> true | D100: of:=FORMULA([.A100]) -> =B($K$4,$K$5,0,J97) | J100: 93
A101: of:=BINOM.DIST.RANGE([.$K$4];[.$K$5];0;[.J98]) -> 1 | B101: 1 | C101: of:=ROUND([.A101];12)=ROUND([.B101];12) -> true | D101: of:=FORMULA([.A101]) -> =B($K$4,$K$5,0,J98) | J101: 94
A102: of:=BINOM.DIST.RANGE([.$K$4];[.$K$5];0;[.J99]) -> 1 | B102: 1 | C102: of:=ROUND([.A102];12)=ROUND([.B102];12) -> true | D102: of:=FORMULA([.A102]) -> =B($K$4,$K$5,0,J99) | J102: 95
A103: of:=BINOM.DIST.RANGE([.$K$4];[.$K$5];0;[.J100]) -> 1 | B103: 1 | C103: of:=ROUND([.A103];12)=ROUND([.B103];12) -> true | D103: of:=FORMULA([.A103]) -> =B($K$4,$K$5,0,J100) | J103: 96
A104: of:=BINOM.DIST.RANGE([.$K$4];[.$K$5];0;[.J101]) -> 1 | B104: 1 | C104: of:=ROUND([.A104];12)=ROUND([.B104];12) -> true | D104: of:=FORMULA([.A104]) -> =B($K$4,$K$5,0,J101) | J104: 97
A105: of:=BINOM.DIST.RANGE([.$K$4];[.$K$5];0;[.J102]) -> 1 | B105: 1 | C105: of:=ROUND([.A105];12)=ROUND([.B105];12) -> true | D105: of:=FORMULA([.A105]) -> =B($K$4,$K$5,0,J102) | J105: 98
A106: of:=BINOM.DIST.RANGE([.$K$4];[.$K$5];0;[.J103]) -> 1 | B106: 1 | C106: of:=ROUND([.A106];12)=ROUND([.B106];12) -> true | D106: of:=FORMULA([.A106]) -> =B($K$4,$K$5,0,J103) | J106: 99
A107: of:=BINOM.DIST.RANGE([.$K$4];[.$K$5];0;[.J104]) -> 1 | B107: 1 | C107: of:=ROUND([.A107];12)=ROUND([.B107];12) -> true | D107: of:=FORMULA([.A107]) -> =B($K$4,$K$5,0,J104) | J107: 100
A108: of:=BINOM.DIST.RANGE([.$K$4];[.$K$5];0;[.J105]) -> 1 | B108: 1 | C108: of:=ROUND([.A108];12)=ROUND([.B108];12) -> true | D108: of:=FORMULA([.A108]) -> =B($K$4,$K$5,0,J105) | J108: 101
A109: of:=BINOM.DIST.RANGE([.$K$4];[.$K$5];0;[.J106]) -> 1 | B109: 1 | C109: of:=ROUND([.A109];12)=ROUND([.B109];12) -> true | D109: of:=FORMULA([.A109]) -> =B($K$4,$K$5,0,J106)
A110: of:=BINOM.DIST.RANGE([.$K$4];[.$K$5];0;[.J107]) -> 1 | B110: 1 | C110: of:=ROUND([.A110];12)=ROUND([.B110];12) -> true | D110: of:=FORMULA([.A110]) -> =B($K$4,$K$5,0,J107)
A111: of:=BINOM.DIST.RANGE([.$K$4];[.$K$5];0;[.J108]) -> 1 | B111: 1 | C111: of:=ROUND([.A111];12)=ROUND([.B111];12) -> true | D111: of:=FORMULA([.A111]) -> =B($K$4,$K$5,0,J108)
A112: of:=BINOM.DIST.RANGE([.$K$4];[.$K$5];0;[.J109]) -> 0.997203915366774 | B112: 0.997203915366774 | C112: of:=ROUND([.A112];12)=ROUND([.B112];12) -> true | D112: of:=FORMULA([.A112]) -> =B($K$4,$K$5,0,J109)
A113: of:=BINOM.DIST.RANGE([.J114];[.K114];[.L114];[.M114]) -> 0.876363906693644 | B113: 0.876363906693644 | C113: of:=ROUND([.A113];12)=ROUND([.B113];12) -> true | D113: of:=FORMULA([.A113]) -> =B(J114,K114,L114,M114)
A114: of:=BINOM.DIST.RANGE([.J115];[.K115];[.L115];[.M115]) -> 0.0248772728546753 | B114: 0.0248772728546753 | C114: of:=ROUND([.A114];12)=ROUND([.B114];12) -> true | D114: of:=FORMULA([.A114]) -> =B(J115,K115,L115,M115) | J114: 1000 | K114: 0.53 | L114: 500 | M114: 550
A115: of:=BINOM.DIST.RANGE([.J116];[.K116];[.L116];[.M116]) -> 0.00496767170378749 | B115: 0.00496767170378749 | C115: of:=ROUND([.A115];12)=ROUND([.B115];12) -> true | D115: of:=FORMULA([.A115]) -> =B(J116,K116,L116,M116) | J115: 1100 | K115: 0.53 | L115: 500 | M115: 550
A116: of:=BINOM.DIST.RANGE([.J117];[.K117];[.L117];[.M117]) -> 0.000727875700243193 | B116: 0.000727875700243193 | C116: of:=ROUND([.A116];12)=ROUND([.B116];12) -> true | D116: of:=FORMULA([.A116]) -> =B(J117,K117,L117,M117) | J116: 1120 | K116: 0.53 | L116: 500 | M116: 550
A117: of:=BINOM.DIST.RANGE([.J118];[.K118];[.L118];[.M118]) -> 0.0000789074425318779 | B117: 0.0000789074425318779 | C117: of:=ROUND([.A117];12)=ROUND([.B117];12) -> true | D117: of:=FORMULA([.A117]) -> =B(J118,K118,L118,M118) | J117: 1140 | K117: 0.53 | L117: 500 | M117: 550
A118: of:=BINOM.DIST.RANGE([.J119];[.K119];[.L119];[.M119]) -> 0.00000639228949362136 | B118: 0.00000639228949362136 | C118: of:=ROUND([.A118];12)=ROUND([.B118];12) -> true | D118: of:=FORMULA([.A118]) -> =B(J119,K119,L119,M119) | J118: 1160 | K118: 0.53 | L118: 500 | M118: 550
A119: of:=BINOM.DIST.RANGE([.J120];[.K120];[.L120];[.M120]) -> 0.000000391101818094562 | B119: 0.000000391101818094562 | C119: of:=ROUND([.A119];12)=ROUND([.B119];12) -> true | D119: of:=FORMULA([.A119]) -> =B(J120,K120,L120,M120) | J119: 1180 | K119: 0.53 | L119: 500 | M119: 550
A120: of:=BINOM.DIST.RANGE([.J121];[.K121];[.L121];[.M121]) -> 0.0140542051475124 | B120: 0.0140542051475124 | C120: of:=ROUND([.A120];12)=ROUND([.B120];12) -> true | D120: of:=FORMULA([.A120]) -> =B(J121,K121,L121,M121) | J120: 1200 | K120: 0.53 | L120: 500 | M120: 550
A121: of:=BINOM.DIST.RANGE([.J122];[.K122];[.L122];[.M122]) -> 0.00000000778167529704766 | B121: 0.00000000778167529704766 | C121: of:=ROUND([.A121];12)=ROUND([.B121];12) -> true | D121: of:=FORMULA([.A121]) -> =B(J122,K122,L122,M122) | J121: 613 | K121: 0.9997 | L121: 611 | M121: 611
A122: of:=BINOM.DIST.RANGE([.J123];[.K123];[.L123];[.M123]) -> 0.000000155312612114271 | B122: 0.000000155312612114271 | C122: of:=ROUND([.A122];12)=ROUND([.B122];12) -> true | D122: of:=FORMULA([.A122]) -> =B(J123,K123,L123,M123) | J122: 613 | K122: 0.97 | L122: 613 | M122: 613
A123: of:=BINOM.DIST.RANGE([.J124];[.K124];[.L124];[.M124]) -> 0.00000155153323065253 | B123: 0.00000155153323065253 | C123: of:=ROUND([.A123];12)=ROUND([.B123];12) -> true | D123: of:=FORMULA([.A123]) -> =B(J124,K124,L124,M124) | J123: 613 | K123: 0.97 | L123: 612 | M123: 613
A124: of:=BINOM.DIST.RANGE([.J125];[.K125];[.L125];[.M125]) -> 0.000010346283724744 | B124: 0.000010346283724744 | C124: of:=ROUND([.A124];12)=ROUND([.B124];12) -> true | D124: of:=FORMULA([.A124]) -> =B(J125,K125,L125,M125) | J124: 613 | K124: 0.97 | L124: 611 | M124: 613
A125: of:=BINOM.DIST.RANGE([.J126];[.K126];[.L126];[.M126]) -> 0.0537095207747661 | B125: 0.0537095207747661 | C125: of:=ROUND([.A125];12)=ROUND([.B125];12) -> true | D125: of:=FORMULA([.A125]) -> =B(J126,K126,L126,M126) | J125: 613 | K125: 0.97 | L125: 610 | M125: 613
A126: of:=BINOM.DIST.RANGE([.J127];[.K127];[.L127];[.M127]) -> 3.56874532966735E-018 | B126: 3.56874532966735E-018 | C126: of:=ROUND([.A126];12)=ROUND([.B126];12) -> true | D126: of:=FORMULA([.A126]) -> =B(J127,K127,L127,M127) | J126: 613 | K126: 0.1 | L126: 61 | M126: 61
A127: of:=BINOM.DIST.RANGE([.J128];[.K128];[.L128];[.M128]) -> 0.173948845353021 | B127: 0.173948845353021 | C127: of:=ROUND([.A127];12)=ROUND([.B127];12) -> true | D127: of:=FORMULA([.A127]) -> =B(J128,K128,L128,M128) | J127: 613 | K127: 0.53 | L127: 430 | M127: 601
A128: of:=BINOM.DIST.RANGE([.J129];[.K129];[.L129];[.M129]) -> 0.187893911102109 | B128: 0.187893911102109 | C128: of:=ROUND([.A128];12)=ROUND([.B128];12) -> true | D128: of:=FORMULA([.A128]) -> =B(J129,K129,L129,M129) | J128: 613 | K128: 0.683 | L128: 430 | M128: 601
A129: of:=BINOM.DIST.RANGE([.J130];[.K130];[.L130];[.M130]) -> 0.202525649562738 | B129: 0.202525649562738 | C129: of:=ROUND([.A129];12)=ROUND([.B129];12) -> true | D129: of:=FORMULA([.A129]) -> =B(J130,K130,L130,M130) | J129: 613 | K129: 0.684 | L129: 430 | M129: 601
A130: of:=BINOM.DIST.RANGE([.J131];[.K131];[.L131];[.M131]) -> 0.233811189231737 | B130: 0.233811189231737 | C130: of:=ROUND([.A130];12)=ROUND([.B130];12) -> true | D130: of:=FORMULA([.A130]) -> =B(J131,K131,L131,M131) | J130: 613 | K130: 0.685 | L130: 430 | M130: 601
A131: of:=BINOM.DIST.RANGE([.J132];[.K132];[.L132];[.M132]) -> 0.362262111629412 | B131: 0.362262111629412 | C131: of:=ROUND([.A131];12)=ROUND([.B131];12) -> true | D131: of:=FORMULA([.A131]) -> =B(J132,K132,L132,M132) | J131: 613 | K131: 0.687 | L131: 430 | M131: 601
A132: of:=BINOM.DIST.RANGE([.J133];[.K133];[.L133];[.M133]) -> 0.509853657152487 | B132: 0.509853657152487 | C132: of:=ROUND([.A132];12)=ROUND([.B132];12) -> true | D132: of:=FORMULA([.A132]) -> =B(J133,K133,L133,M133) | J132: 613 | K132: 0.694 | L132: 430 | M132: 601
J133: 613 | K133: 0.701 | L133: 430 | M133: 601

Sheet: 'file:///home/zdenek/Dokumenty/LO/sc-unit-test/Project%20Calc%20functions%20tests/fods/function_based_test_Example.fods/function_based_test_Example_reference.fods'#Sheet2
H3: 4