Sheet: Sheet1
A1: BINOMDIST Function
A3: Result | B3: of:=AND([.B8:.B95]) -> true
A7: Sheet | B7: Result | C7: Description
A8: 1 | B8: of:=AND([Sheet2.C2:.C349]) -> true | C8: Simple BINOMDIST formulas with local references and values

Sheet: Sheet2
A1: Function | B1: Expected | C1: Correct | D1: FunctionString | E1: Comment | F1: 4 | I1: Data | J1: Description | AA1: year | AB1: month | AC1: day | AD1: value
A2: of:=BINOMDIST([.F1];12;0.5;0) -> 0.120849609375 | B2: 0.120849609375 | C2: of:=ROUND([.A2];12)=ROUND([.B2];12) -> true | D2: of:=FORMULA([.A2]) -> =BINOMDIST(F1,12,0.5,0) | I2: 6 | J2: Number of successes in trials | AA2: 2012 | AB2: 12 | AC2: 15 | AD2: 6
A3: of:=BINOMDIST([.F1];12;0.5;1) -> 0.19384765625 | B3: 0.19384765625 | C3: of:=ROUND([.A3];12)=ROUND([.B3];12) -> true | D3: of:=FORMULA([.A3]) -> =BINOMDIST(F1,12,0.5,1) | I3: 10 | J3: Number of independent trials | AA3: 2012 | AB3: 4 | AC3: 1 | AD3: 10.4
A4: of:=BINOMDIST(3; 8; 0.35; 1) -> 0.706399436132812 | B4: 0.706399436132812 | C4: of:=ROUND([.A4];12)=ROUND([.B4];12) -> true | D4: of:=FORMULA([.A4]) -> =BINOMDIST(3, 8, 0.35, 1) | I4: 0.5 | J4: Probability of success on each trial | AA4: 2013 | AB4: 8 | AC4: 15 | AD4: 7
A5: of:=BINOMDIST(3; 8; 0.35; 0) -> 0.2785857790625 | B5: 0.2785857790625 | C5: of:=ROUND([.A5];12)=ROUND([.B5];12) -> true | D5: of:=FORMULA([.A5]) -> =BINOMDIST(3, 8, 0.35, 0) | AA5: 2011 | AB5: 11 | AC5: 1 | AD5: 12
A6: of:=BINOMDIST(50; 125; 0.4; 1) -> 0.538748204875451 | B6: 0.538748204875451 | C6: of:=ROUND([.A6];12)=ROUND([.B6];12) -> true | D6: of:=FORMULA([.A6]) -> =BINOMDIST(50, 125, 0.4, 1) | AA6: 2011 | AB6: 2 | AC6: 14 | AD6: 8
A7: of:=BINOMDIST([.I2];[.I3];[.I4];0) -> 0.205078125 | B7: 0.205078125 | C7: of:=ROUND([.A7];12)=ROUND([.B7];12) -> true | D7: of:=FORMULA([.A7]) -> =BINOMDIST(I2,I3,I4,0) | AA7: 2010 | AB7: 6 | AC7: 1 | AD7: 15
A8: of:=BINOMDIST([.F1];12;0.5;2) -> 0.19384765625 | B8: 0.19384765625 | C8: of:=ROUND([.A8];12)=ROUND([.B8];12) -> true | D8: of:=FORMULA([.A8]) -> =BINOMDIST(F1,12,0.5,2)
A9: of:=BINOMDIST(0; 125; 0.4; 1) -> 1.85740366414241E-028 | B9: 1.85740366414241E-028 | C9: of:=ROUND([.A9];12)=ROUND([.B9];12) -> true | D9: of:=FORMULA([.A9]) -> =BINOMDIST(0, 125, 0.4, 1)
A10: of:=BINOMDIST(0; 125; 0; 1) -> 1 | B10: 1 | C10: of:=ROUND([.A10];12)=ROUND([.B10];12) -> true | D10: of:=FORMULA([.A10]) -> =BINOMDIST(0, 125, 0, 1)
A11: of:=BINOMDIST(0; 125;14; 1) ->  | B11: Err:502 | C11: of:=ISERROR([.A11]) -> true | D11: of:=FORMULA([.A11]) -> =BINOMDIST(0, 125,14, 1)
A12: of:=BINOMDIST(-50; 125; 0.4; 1) ->  | B12: Err:502 | C12: of:=ISERROR([.A12]) -> true | D12: of:=FORMULA([.A12]) -> =BINOMDIST(-50, 125, 0.4, 1) | F12: 117 | H12: 117
A13: of:=BINOMDIST(150; 125; 0.4; 1) ->  | B13: Err:502 | C13: of:=ISERROR([.A13]) -> true | D13: of:=FORMULA([.A13]) -> =BINOMDIST(150, 125, 0.4, 1) | F13: 0 | H13: 1
A14: of:=BINOMDIST(50; 125;- 0.4; 1) ->  | B14: Err:502 | C14: of:=ISERROR([.A14]) -> true | D14: of:=FORMULA([.A14]) -> =BINOMDIST(50, 125,- 0.4, 1)
A15: of:=BINOMDIST(50; 125; 1.4; 1) ->  | B15: Err:502 | C15: of:=ISERROR([.A15]) -> true | D15: of:=FORMULA([.A15]) -> =BINOMDIST(50, 125, 1.4, 1) | F15: 0 | H15: 0
A16: of:=BINOMDIST([.F15];[.$F$12];[.$F$13];1) -> 1 | B16: 1 | C16: of:=ROUND([.A16];12)=ROUND([.B16];12) -> true | D16: of:=FORMULA([.A16]) -> =BINOMDIST(F15,$F$12,$F$13,1) | F16: 1 | H16: 1
A17: of:=BINOMDIST([.F16];[.$F$12];[.$F$13];1) -> 1 | B17: 1 | C17: of:=ROUND([.A17];12)=ROUND([.B17];12) -> true | D17: of:=FORMULA([.A17]) -> =BINOMDIST(F16,$F$12,$F$13,1) | F17: of:=[.F12]-1 -> 116 | H17: of:=[.H12]-1 -> 116
A18: of:=BINOMDIST([.F17];[.$F$12];[.$F$13];1) -> 1 | B18: 1 | C18: of:=ROUND([.A18];12)=ROUND([.B18];12) -> true | D18: of:=FORMULA([.A18]) -> =BINOMDIST(F17,$F$12,$F$13,1) | F18: of:=[.F12] -> 117 | H18: of:=[.H12] -> 117
A19: of:=BINOMDIST([.F18];[.$F$12];[.$F$13];1) -> 1 | B19: 1 | C19: of:=ROUND([.A19];12)=ROUND([.B19];12) -> true | D19: of:=FORMULA([.A19]) -> =BINOMDIST(F18,$F$12,$F$13,1) | F19: 0
A20: of:=BINOMDIST([.F19];[.$F$12];[.$F$13];0) -> 1 | B20: 1 | C20: of:=ROUND([.A20];12)=ROUND([.B20];12) -> true | D20: of:=FORMULA([.A20]) -> =BINOMDIST(F19,$F$12,$F$13,0) | F20: 1
A21: of:=BINOMDIST([.F20];[.$F$12];[.$F$13];0) -> 0 | B21: 0 | C21: of:=ROUND([.A21];12)=ROUND([.B21];12) -> true | D21: of:=FORMULA([.A21]) -> =BINOMDIST(F20,$F$12,$F$13,0) | F21: of:=[.F12]-1 -> 116
A22: of:=BINOMDIST([.F21];[.$F$12];[.$F$13];0) -> 0 | B22: 0 | C22: of:=ROUND([.A22];12)=ROUND([.B22];12) -> true | D22: of:=FORMULA([.A22]) -> =BINOMDIST(F21,$F$12,$F$13,0) | F22: of:=[.F12] -> 117
A23: of:=BINOMDIST([.F22];[.$F$12];[.$F$13];0) -> 0 | B23: 0 | C23: of:=ROUND([.A23];12)=ROUND([.B23];12) -> true | D23: of:=FORMULA([.A23]) -> =BINOMDIST(F22,$F$12,$F$13,0) | F23: 0
A24: of:=BINOM.DIST.RANGE([.$F$12];[.$F$13];[.F15]) -> 1 | B24: 1 | C24: of:=ROUND([.A24];12)=ROUND([.B24];12) -> true | D24: of:=FORMULA([.A24]) -> =B($F$12,$F$13,F15) | F24: 1
A25: of:=BINOM.DIST.RANGE([.$F$12];[.$F$13];[.F16]) -> 0 | B25: 0 | C25: of:=ROUND([.A25];12)=ROUND([.B25];12) -> true | D25: of:=FORMULA([.A25]) -> =B($F$12,$F$13,F16) | F25: of:=[.F12]-1 -> 116
A26: of:=BINOM.DIST.RANGE([.$F$12];[.$F$13];[.F17]) -> 0 | B26: 0 | C26: of:=ROUND([.A26];12)=ROUND([.B26];12) -> true | D26: of:=FORMULA([.A26]) -> =B($F$12,$F$13,F17) | F26: of:=[.F12] -> 117
A27: of:=BINOM.DIST.RANGE([.$F$12];[.$F$13];[.F18]) -> 0 | B27: 0 | C27: of:=ROUND([.A27];12)=ROUND([.B27];12) -> true | D27: of:=FORMULA([.A27]) -> =B($F$12,$F$13,F18) | F27: 0
A28: of:=BINOM.DIST.RANGE([.$F$12];[.$F$13];[.F15];[.$F$12]) -> 1 | B28: 1 | C28: of:=ROUND([.A28];12)=ROUND([.B28];12) -> true | D28: of:=FORMULA([.A28]) -> =B($F$12,$F$13,F15,$F$12) | F28: 1
A29: of:=BINOM.DIST.RANGE([.$F$12];[.$F$13];[.F16];[.$F$12]) -> 0 | B29: 0 | C29: of:=ROUND([.A29];12)=ROUND([.B29];12) -> true | D29: of:=FORMULA([.A29]) -> =B($F$12,$F$13,F16,$F$12) | F29: of:=[.F12]-1 -> 116
A30: of:=BINOM.DIST.RANGE([.$F$12];[.$F$13];[.F17];[.$F$12]) -> 0 | B30: 0 | C30: of:=ROUND([.A30];12)=ROUND([.B30];12) -> true | D30: of:=FORMULA([.A30]) -> =B($F$12,$F$13,F17,$F$12) | F30: of:=[.F12] -> 117
A31: of:=BINOM.DIST.RANGE([.$F$12];[.$F$13];[.F18];[.$F$12]) -> 0 | B31: 0 | C31: of:=ROUND([.A31];12)=ROUND([.B31];12) -> true | D31: of:=FORMULA([.A31]) -> =B($F$12,$F$13,F18,$F$12) | F31: 0
A32: of:=BINOM.DIST.RANGE([.$F$12];[.$F$13];0;[.F15]) -> 1 | B32: 1 | C32: of:=ROUND([.A32];12)=ROUND([.B32];12) -> true | D32: of:=FORMULA([.A32]) -> =B($F$12,$F$13,0,F15) | F32: 1
A33: of:=BINOM.DIST.RANGE([.$F$12];[.$F$13];0;[.F16]) -> 1 | B33: 1 | C33: of:=ROUND([.A33];12)=ROUND([.B33];12) -> true | D33: of:=FORMULA([.A33]) -> =B($F$12,$F$13,0,F16) | F33: of:=[.F12]-1 -> 116
A34: of:=BINOM.DIST.RANGE([.$F$12];[.$F$13];0;[.F17]) -> 1 | B34: 1 | C34: of:=ROUND([.A34];12)=ROUND([.B34];12) -> true | D34: of:=FORMULA([.A34]) -> =B($F$12,$F$13,0,F17) | F34: of:=[.F12] -> 117
A35: of:=BINOM.DIST.RANGE([.$F$12];[.$F$13];0;[.F18]) -> 1 | B35: 1 | C35: of:=ROUND([.A35];12)=ROUND([.B35];12) -> true | D35: of:=FORMULA([.A35]) -> =B($F$12,$F$13,0,F18)
A36: of:=BINOMDIST([.H15];[.$H$12];[.$H$13];1) -> 0 | B36: 0 | C36: of:=ROUND([.A36];12)=ROUND([.B36];12) -> true | D36: of:=FORMULA([.A36]) -> =BINOMDIST(H15,$H$12,$H$13,1)
A37: of:=BINOMDIST([.H16];[.$H$12];[.$H$13];1) -> 0 | B37: 0 | C37: of:=ROUND([.A37];12)=ROUND([.B37];12) -> true | D37: of:=FORMULA([.A37]) -> =BINOMDIST(H16,$H$12,$H$13,1)
A38: of:=BINOMDIST([.H17];[.$H$12];[.$H$13];1) -> 0 | B38: 0 | C38: of:=ROUND([.A38];12)=ROUND([.B38];12) -> true | D38: of:=FORMULA([.A38]) -> =BINOMDIST(H17,$H$12,$H$13,1)
A39: of:=BINOMDIST([.H18];[.$H$12];[.$H$13];1) -> 1 | B39: 1 | C39: of:=ROUND([.A39];12)=ROUND([.B39];12) -> true | D39: of:=FORMULA([.A39]) -> =BINOMDIST(H18,$H$12,$H$13,1) | G39: 6
A40: of:=BINOMDIST([.H15];[.$H$12];[.$H$13];0) -> 0 | B40: 0 | C40: of:=ROUND([.A40];12)=ROUND([.B40];12) -> true | D40: of:=FORMULA([.A40]) -> =BINOMDIST(H15,$H$12,$H$13,0) | G40: 0.25
A41: of:=BINOMDIST([.H16];[.$H$12];[.$H$13];0) -> 0 | B41: 0 | C41: of:=ROUND([.A41];12)=ROUND([.B41];12) -> true | D41: of:=FORMULA([.A41]) -> =BINOMDIST(H16,$H$12,$H$13,0) | G41: 0.75
A42: of:=BINOMDIST([.H17];[.$H$12];[.$H$13];0) -> 0 | B42: 0 | C42: of:=ROUND([.A42];12)=ROUND([.B42];12) -> true | D42: of:=FORMULA([.A42]) -> =BINOMDIST(H17,$H$12,$H$13,0)
A43: of:=BINOMDIST([.H18];[.$H$12];[.$H$13];0) -> 1 | B43: 1 | C43: of:=ROUND([.A43];12)=ROUND([.B43];12) -> true | D43: of:=FORMULA([.A43]) -> =BINOMDIST(H18,$H$12,$H$13,0) | F43: 0
A44: of:=BINOMDIST([.F43];[.$G$39];[.$G$40];0) -> 0.177978515625 | B44: 0.177978515625 | C44: of:=ROUND([.A44];12)=ROUND([.B44];12) -> true | D44: of:=FORMULA([.A44]) -> =BINOMDIST(F43,$G$39,$G$40,0) | F44: 1
A45: of:=BINOMDIST([.F44];[.$G$39];[.$G$40];0) -> 0.35595703125 | B45: 0.35595703125 | C45: of:=ROUND([.A45];12)=ROUND([.B45];12) -> true | D45: of:=FORMULA([.A45]) -> =BINOMDIST(F44,$G$39,$G$40,0) | F45: 2
A46: of:=BINOMDIST([.F45];[.$G$39];[.$G$40];0) -> 0.296630859375 | B46: 0.296630859375 | C46: of:=ROUND([.A46];12)=ROUND([.B46];12) -> true | D46: of:=FORMULA([.A46]) -> =BINOMDIST(F45,$G$39,$G$40,0) | F46: 3
A47: of:=BINOMDIST([.F46];[.$G$39];[.$G$40];0) -> 0.1318359375 | B47: 0.1318359375 | C47: of:=ROUND([.A47];12)=ROUND([.B47];12) -> true | D47: of:=FORMULA([.A47]) -> =BINOMDIST(F46,$G$39,$G$40,0) | F47: 4
A48: of:=BINOMDIST([.F47];[.$G$39];[.$G$40];0) -> 0.032958984375 | B48: 0.032958984375 | C48: of:=ROUND([.A48];12)=ROUND([.B48];12) -> true | D48: of:=FORMULA([.A48]) -> =BINOMDIST(F47,$G$39,$G$40,0) | F48: 5
A49: of:=BINOMDIST([.F48];[.$G$39];[.$G$40];0) -> 0.00439453125 | B49: 0.00439453125 | C49: of:=ROUND([.A49];12)=ROUND([.B49];12) -> true | D49: of:=FORMULA([.A49]) -> =BINOMDIST(F48,$G$39,$G$40,0) | F49: 6
A50: of:=BINOMDIST([.F49];[.$G$39];[.$G$40];0) -> 0.000244140625 | B50: 0.000244140625 | C50: of:=ROUND([.A50];12)=ROUND([.B50];12) -> true | D50: of:=FORMULA([.A50]) -> =BINOMDIST(F49,$G$39,$G$40,0) | F50: 0
A51: of:=BINOMDIST([.F50];[.$G$39];[.$G$40];1) -> 0.177978515625 | B51: 0.177978515625 | C51: of:=ROUND([.A51];12)=ROUND([.B51];12) -> true | D51: of:=FORMULA([.A51]) -> =BINOMDIST(F50,$G$39,$G$40,1) | F51: 1
A52: of:=BINOMDIST([.F51];[.$G$39];[.$G$40];1) -> 0.533935546875 | B52: 0.533935546875 | C52: of:=ROUND([.A52];12)=ROUND([.B52];12) -> true | D52: of:=FORMULA([.A52]) -> =BINOMDIST(F51,$G$39,$G$40,1) | F52: 2
A53: of:=BINOMDIST([.F52];[.$G$39];[.$G$40];1) -> 0.83056640625 | B53: 0.83056640625 | C53: of:=ROUND([.A53];12)=ROUND([.B53];12) -> true | D53: of:=FORMULA([.A53]) -> =BINOMDIST(F52,$G$39,$G$40,1) | F53: 3
A54: of:=BINOMDIST([.F53];[.$G$39];[.$G$40];1) -> 0.96240234375 | B54: 0.96240234375 | C54: of:=ROUND([.A54];12)=ROUND([.B54];12) -> true | D54: of:=FORMULA([.A54]) -> =BINOMDIST(F53,$G$39,$G$40,1) | F54: 4
A55: of:=BINOMDIST([.F54];[.$G$39];[.$G$40];1) -> 0.995361328125 | B55: 0.995361328125 | C55: of:=ROUND([.A55];12)=ROUND([.B55];12) -> true | D55: of:=FORMULA([.A55]) -> =BINOMDIST(F54,$G$39,$G$40,1) | F55: 5
A56: of:=BINOMDIST([.F55];[.$G$39];[.$G$40];1) -> 0.999755859375 | B56: 0.999755859375 | C56: of:=ROUND([.A56];12)=ROUND([.B56];12) -> true | D56: of:=FORMULA([.A56]) -> =BINOMDIST(F55,$G$39,$G$40,1) | F56: 6
A57: of:=BINOMDIST([.F56];[.$G$39];[.$G$40];1) -> 1 | B57: 1 | C57: of:=ROUND([.A57];12)=ROUND([.B57];12) -> true | D57: of:=FORMULA([.A57]) -> =BINOMDIST(F56,$G$39,$G$40,1) | F57: 0
A58: of:=BINOM.DIST.RANGE([.$G$39];[.$G$40];[.F57]) -> 0.177978515625 | B58: 0.177978515625 | C58: of:=ROUND([.A58];12)=ROUND([.B58];12) -> true | D58: of:=FORMULA([.A58]) -> =B($G$39,$G$40,F57) | F58: 1
A59: of:=BINOM.DIST.RANGE([.$G$39];[.$G$40];[.F58]) -> 0.35595703125 | B59: 0.35595703125 | C59: of:=ROUND([.A59];12)=ROUND([.B59];12) -> true | D59: of:=FORMULA([.A59]) -> =B($G$39,$G$40,F58) | F59: 2
A60: of:=BINOM.DIST.RANGE([.$G$39];[.$G$40];[.F59]) -> 0.296630859375 | B60: 0.296630859375 | C60: of:=ROUND([.A60];12)=ROUND([.B60];12) -> true | D60: of:=FORMULA([.A60]) -> =B($G$39,$G$40,F59) | F60: 3
A61: of:=BINOM.DIST.RANGE([.$G$39];[.$G$40];[.F60]) -> 0.1318359375 | B61: 0.1318359375 | C61: of:=ROUND([.A61];12)=ROUND([.B61];12) -> true | D61: of:=FORMULA([.A61]) -> =B($G$39,$G$40,F60) | F61: 4
A62: of:=BINOM.DIST.RANGE([.$G$39];[.$G$40];[.F61]) -> 0.032958984375 | B62: 0.032958984375 | C62: of:=ROUND([.A62];12)=ROUND([.B62];12) -> true | D62: of:=FORMULA([.A62]) -> =B($G$39,$G$40,F61) | F62: 5
A63: of:=BINOM.DIST.RANGE([.$G$39];[.$G$40];[.F62]) -> 0.00439453125 | B63: 0.00439453125 | C63: of:=ROUND([.A63];12)=ROUND([.B63];12) -> true | D63: of:=FORMULA([.A63]) -> =B($G$39,$G$40,F62) | F63: 6
A64: of:=BINOM.DIST.RANGE([.$G$39];[.$G$40];[.F63]) -> 0.000244140625 | B64: 0.000244140625 | C64: of:=ROUND([.A64];12)=ROUND([.B64];12) -> true | D64: of:=FORMULA([.A64]) -> =B($G$39,$G$40,F63)
A65: of:=BINOM.DIST.RANGE([.$G$39];[.$G$40];[.F43];[.$G$39]) -> 1 | B65: 1 | C65: of:=ROUND([.A65];12)=ROUND([.B65];12) -> true | D65: of:=FORMULA([.A65]) -> =B($G$39,$G$40,F43,$G$39)
A66: of:=BINOM.DIST.RANGE([.$G$39];[.$G$40];[.F44];[.$G$39]) -> 0.822021484375 | B66: 0.822021484375 | C66: of:=ROUND([.A66];12)=ROUND([.B66];12) -> true | D66: of:=FORMULA([.A66]) -> =B($G$39,$G$40,F44,$G$39)
A67: of:=BINOM.DIST.RANGE([.$G$39];[.$G$40];[.F45];[.$G$39]) -> 0.466064453125 | B67: 0.466064453125 | C67: of:=ROUND([.A67];12)=ROUND([.B67];12) -> true | D67: of:=FORMULA([.A67]) -> =B($G$39,$G$40,F45,$G$39)
A68: of:=BINOM.DIST.RANGE([.$G$39];[.$G$40];[.F46];[.$G$39]) -> 0.16943359375 | B68: 0.16943359375 | C68: of:=ROUND([.A68];12)=ROUND([.B68];12) -> true | D68: of:=FORMULA([.A68]) -> =B($G$39,$G$40,F46,$G$39)
A69: of:=BINOM.DIST.RANGE([.$G$39];[.$G$40];[.F47];[.$G$39]) -> 0.03759765625 | B69: 0.03759765625 | C69: of:=ROUND([.A69];12)=ROUND([.B69];12) -> true | D69: of:=FORMULA([.A69]) -> =B($G$39,$G$40,F47,$G$39)
A70: of:=BINOM.DIST.RANGE([.$G$39];[.$G$40];[.F48];[.$G$39]) -> 0.004638671875 | B70: 0.004638671875 | C70: of:=ROUND([.A70];12)=ROUND([.B70];12) -> true | D70: of:=FORMULA([.A70]) -> =B($G$39,$G$40,F48,$G$39)
A71: of:=BINOM.DIST.RANGE([.$G$39];[.$G$40];[.F49];[.$G$39]) -> 0.000244140625 | B71: 0.000244140625 | C71: of:=ROUND([.A71];12)=ROUND([.B71];12) -> true | D71: of:=FORMULA([.A71]) -> =B($G$39,$G$40,F49,$G$39)
A72: of:=BINOM.DIST.RANGE([.$G$39];[.$G$40];0;[.F43]) -> 0.177978515625 | B72: 0.177978515625 | C72: of:=ROUND([.A72];12)=ROUND([.B72];12) -> true | D72: of:=FORMULA([.A72]) -> =B($G$39,$G$40,0,F43)
A73: of:=BINOM.DIST.RANGE([.$G$39];[.$G$40];0;[.F44]) -> 0.533935546875 | B73: 0.533935546875 | C73: of:=ROUND([.A73];12)=ROUND([.B73];12) -> true | D73: of:=FORMULA([.A73]) -> =B($G$39,$G$40,0,F44)
A74: of:=BINOM.DIST.RANGE([.$G$39];[.$G$40];0;[.F45]) -> 0.83056640625 | B74: 0.83056640625 | C74: of:=ROUND([.A74];12)=ROUND([.B74];12) -> true | D74: of:=FORMULA([.A74]) -> =B($G$39,$G$40,0,F45) | H74: 1100
A75: of:=BINOM.DIST.RANGE([.$G$39];[.$G$40];0;[.F46]) -> 0.96240234375 | B75: 0.96240234375 | C75: of:=ROUND([.A75];12)=ROUND([.B75];12) -> true | D75: of:=FORMULA([.A75]) -> =B($G$39,$G$40,0,F46) | H75: 0.57
A76: of:=BINOM.DIST.RANGE([.$G$39];[.$G$40];0;[.F47]) -> 0.995361328125 | B76: 0.995361328125 | C76: of:=ROUND([.A76];12)=ROUND([.B76];12) -> true | D76: of:=FORMULA([.A76]) -> =B($G$39,$G$40,0,F47) | G76: 0
A77: of:=BINOM.DIST.RANGE([.$G$39];[.$G$40];0;[.F48]) -> 0.999755859375 | B77: 0.999755859375 | C77: of:=ROUND([.A77];12)=ROUND([.B77];12) -> true | D77: of:=FORMULA([.A77]) -> =B($G$39,$G$40,0,F48) | G77: 1
A78: of:=BINOM.DIST.RANGE([.$G$39];[.$G$40];0;[.F49]) -> 1 | B78: 1 | C78: of:=ROUND([.A78];12)=ROUND([.B78];12) -> true | D78: of:=FORMULA([.A78]) -> =B($G$39,$G$40,0,F49) | G78: 2
A79: of:=BINOMDIST([.G76];[.$H$74];[.$H$75];TRUE()) -> 0 | B79: of:=BINOMDIST([.H76];[.$H$74];[.$H$75];TRUE()) -> 0 | C79: of:=ROUND([.A79];12)=ROUND([.B79];12) -> true | D79: of:=FORMULA([.A79]) -> =BINOMDIST(G76,$H$74,$H$75,TRUE()) | G79: 3
A80: of:=BINOMDIST([.G77];[.$H$74];[.$H$75];TRUE()) -> 0 | B80: of:=BINOMDIST([.H77];[.$H$74];[.$H$75];TRUE()) -> 0 | C80: of:=ROUND([.A80];12)=ROUND([.B80];12) -> true | D80: of:=FORMULA([.A80]) -> =BINOMDIST(G77,$H$74,$H$75,TRUE()) | G80: 4
A81: of:=BINOMDIST([.G78];[.$H$74];[.$H$75];TRUE()) -> 0 | B81: of:=BINOMDIST([.H78];[.$H$74];[.$H$75];TRUE()) -> 0 | C81: of:=ROUND([.A81];12)=ROUND([.B81];12) -> true | D81: of:=FORMULA([.A81]) -> =BINOMDIST(G78,$H$74,$H$75,TRUE()) | G81: 5
A82: of:=BINOMDIST([.G79];[.$H$74];[.$H$75];TRUE()) -> 0 | B82: of:=BINOMDIST([.H79];[.$H$74];[.$H$75];TRUE()) -> 0 | C82: of:=ROUND([.A82];12)=ROUND([.B82];12) -> true | D82: of:=FORMULA([.A82]) -> =BINOMDIST(G79,$H$74,$H$75,TRUE()) | G82: 6
A83: of:=BINOMDIST([.G80];[.$H$74];[.$H$75];TRUE()) -> 0 | B83: of:=BINOMDIST([.H80];[.$H$74];[.$H$75];TRUE()) -> 0 | C83: of:=ROUND([.A83];12)=ROUND([.B83];12) -> true | D83: of:=FORMULA([.A83]) -> =BINOMDIST(G80,$H$74,$H$75,TRUE()) | G83: 7
A84: of:=BINOMDIST([.G81];[.$H$74];[.$H$75];TRUE()) -> 0 | B84: of:=BINOMDIST([.H81];[.$H$74];[.$H$75];TRUE()) -> 0 | C84: of:=ROUND([.A84];12)=ROUND([.B84];12) -> true | D84: of:=FORMULA([.A84]) -> =BINOMDIST(G81,$H$74,$H$75,TRUE()) | G84: 8
A85: of:=BINOMDIST([.G82];[.$H$74];[.$H$75];TRUE()) -> 0 | B85: of:=BINOMDIST([.H82];[.$H$74];[.$H$75];TRUE()) -> 0 | C85: of:=ROUND([.A85];12)=ROUND([.B85];12) -> true | D85: of:=FORMULA([.A85]) -> =BINOMDIST(G82,$H$74,$H$75,TRUE()) | G85: 9
A86: of:=BINOMDIST([.G83];[.$H$74];[.$H$75];TRUE()) -> 0 | B86: of:=BINOMDIST([.H83];[.$H$74];[.$H$75];TRUE()) -> 0 | C86: of:=ROUND([.A86];12)=ROUND([.B86];12) -> true | D86: of:=FORMULA([.A86]) -> =BINOMDIST(G83,$H$74,$H$75,TRUE()) | G86: 10
A87: of:=BINOMDIST([.G84];[.$H$74];[.$H$75];TRUE()) -> 0 | B87: of:=BINOMDIST([.H84];[.$H$74];[.$H$75];TRUE()) -> 0 | C87: of:=ROUND([.A87];12)=ROUND([.B87];12) -> true | D87: of:=FORMULA([.A87]) -> =BINOMDIST(G84,$H$74,$H$75,TRUE()) | G87: 11
A88: of:=BINOMDIST([.G85];[.$H$74];[.$H$75];TRUE()) -> 0 | B88: of:=BINOMDIST([.H85];[.$H$74];[.$H$75];TRUE()) -> 0 | C88: of:=ROUND([.A88];12)=ROUND([.B88];12) -> true | D88: of:=FORMULA([.A88]) -> =BINOMDIST(G85,$H$74,$H$75,TRUE()) | G88: 12
A89: of:=BINOMDIST([.G86];[.$H$74];[.$H$75];TRUE()) -> 0 | B89: of:=BINOMDIST([.H86];[.$H$74];[.$H$75];TRUE()) -> 0 | C89: of:=ROUND([.A89];12)=ROUND([.B89];12) -> true | D89: of:=FORMULA([.A89]) -> =BINOMDIST(G86,$H$74,$H$75,TRUE()) | G89: 13
A90: of:=BINOMDIST([.G87];[.$H$74];[.$H$75];TRUE()) -> 0 | B90: of:=BINOMDIST([.H87];[.$H$74];[.$H$75];TRUE()) -> 0 | C90: of:=ROUND([.A90];12)=ROUND([.B90];12) -> true | D90: of:=FORMULA([.A90]) -> =BINOMDIST(G87,$H$74,$H$75,TRUE()) | G90: 14
A91: of:=BINOMDIST([.G88];[.$H$74];[.$H$75];TRUE()) -> 0 | B91: of:=BINOMDIST([.H88];[.$H$74];[.$H$75];TRUE()) -> 0 | C91: of:=ROUND([.A91];12)=ROUND([.B91];12) -> true | D91: of:=FORMULA([.A91]) -> =BINOMDIST(G88,$H$74,$H$75,TRUE()) | G91: 15
A92: of:=BINOMDIST([.G89];[.$H$74];[.$H$75];TRUE()) -> 0 | B92: of:=BINOMDIST([.H89];[.$H$74];[.$H$75];TRUE()) -> 0 | C92: of:=ROUND([.A92];12)=ROUND([.B92];12) -> true | D92: of:=FORMULA([.A92]) -> =BINOMDIST(G89,$H$74,$H$75,TRUE()) | G92: 16
A93: of:=BINOMDIST([.G90];[.$H$74];[.$H$75];TRUE()) -> 0 | B93: of:=BINOMDIST([.H90];[.$H$74];[.$H$75];TRUE()) -> 0 | C93: of:=ROUND([.A93];12)=ROUND([.B93];12) -> true | D93: of:=FORMULA([.A93]) -> =BINOMDIST(G90,$H$74,$H$75,TRUE()) | G93: 17
A94: of:=BINOMDIST([.G91];[.$H$74];[.$H$75];TRUE()) -> 0 | B94: of:=BINOMDIST([.H91];[.$H$74];[.$H$75];TRUE()) -> 0 | C94: of:=ROUND([.A94];12)=ROUND([.B94];12) -> true | D94: of:=FORMULA([.A94]) -> =BINOMDIST(G91,$H$74,$H$75,TRUE()) | G94: 18
A95: of:=BINOMDIST([.G92];[.$H$74];[.$H$75];TRUE()) -> 0 | B95: of:=BINOMDIST([.H92];[.$H$74];[.$H$75];TRUE()) -> 0 | C95: of:=ROUND([.A95];12)=ROUND([.B95];12) -> true | D95: of:=FORMULA([.A95]) -> =BINOMDIST(G92,$H$74,$H$75,TRUE()) | G95: 19
A96: of:=BINOMDIST([.G93];[.$H$74];[.$H$75];TRUE()) -> 0 | B96: of:=BINOMDIST([.H93];[.$H$74];[.$H$75];TRUE()) -> 0 | C96: of:=ROUND([.A96];12)=ROUND([.B96];12) -> true | D96: of:=FORMULA([.A96]) -> =BINOMDIST(G93,$H$74,$H$75,TRUE()) | G96: 20
A97: of:=BINOMDIST([.G94];[.$H$74];[.$H$75];TRUE()) -> 0 | B97: of:=BINOMDIST([.H94];[.$H$74];[.$H$75];TRUE()) -> 0 | C97: of:=ROUND([.A97];12)=ROUND([.B97];12) -> true | D97: of:=FORMULA([.A97]) -> =BINOMDIST(G94,$H$74,$H$75,TRUE()) | G97: 21
A98: of:=BINOMDIST([.G95];[.$H$74];[.$H$75];TRUE()) -> 0 | B98: of:=BINOMDIST([.H95];[.$H$74];[.$H$75];TRUE()) -> 0 | C98: of:=ROUND([.A98];12)=ROUND([.B98];12) -> true | D98: of:=FORMULA([.A98]) -> =BINOMDIST(G95,$H$74,$H$75,TRUE()) | G98: 22
A99: of:=BINOMDIST([.G96];[.$H$74];[.$H$75];TRUE()) -> 0 | B99: of:=BINOMDIST([.H96];[.$H$74];[.$H$75];TRUE()) -> 0 | C99: of:=ROUND([.A99];12)=ROUND([.B99];12) -> true | D99: of:=FORMULA([.A99]) -> =BINOMDIST(G96,$H$74,$H$75,TRUE()) | G99: 23
A100: of:=BINOMDIST([.G97];[.$H$74];[.$H$75];TRUE()) -> 0 | B100: of:=BINOMDIST([.H97];[.$H$74];[.$H$75];TRUE()) -> 0 | C100: of:=ROUND([.A100];12)=ROUND([.B100];12) -> true | D100: of:=FORMULA([.A100]) -> =BINOMDIST(G97,$H$74,$H$75,TRUE()) | G100: 24
A101: of:=BINOMDIST([.G98];[.$H$74];[.$H$75];TRUE()) -> 0 | B101: of:=BINOMDIST([.H98];[.$H$74];[.$H$75];TRUE()) -> 0 | C101: of:=ROUND([.A101];12)=ROUND([.B101];12) -> true | D101: of:=FORMULA([.A101]) -> =BINOMDIST(G98,$H$74,$H$75,TRUE()) | G101: 25
A102: of:=BINOMDIST([.G99];[.$H$74];[.$H$75];TRUE()) -> 0 | B102: of:=BINOMDIST([.H99];[.$H$74];[.$H$75];TRUE()) -> 0 | C102: of:=ROUND([.A102];12)=ROUND([.B102];12) -> true | D102: of:=FORMULA([.A102]) -> =BINOMDIST(G99,$H$74,$H$75,TRUE()) | G102: 26
A103: of:=BINOMDIST([.G100];[.$H$74];[.$H$75];TRUE()) -> 0 | B103: of:=BINOMDIST([.H100];[.$H$74];[.$H$75];TRUE()) -> 0 | C103: of:=ROUND([.A103];12)=ROUND([.B103];12) -> true | D103: of:=FORMULA([.A103]) -> =BINOMDIST(G100,$H$74,$H$75,TRUE()) | G103: 27
A104: of:=BINOMDIST([.G101];[.$H$74];[.$H$75];TRUE()) -> 0 | B104: of:=BINOMDIST([.H101];[.$H$74];[.$H$75];TRUE()) -> 0 | C104: of:=ROUND([.A104];12)=ROUND([.B104];12) -> true | D104: of:=FORMULA([.A104]) -> =BINOMDIST(G101,$H$74,$H$75,TRUE()) | G104: 28
A105: of:=BINOMDIST([.G102];[.$H$74];[.$H$75];TRUE()) -> 0 | B105: of:=BINOMDIST([.H102];[.$H$74];[.$H$75];TRUE()) -> 0 | C105: of:=ROUND([.A105];12)=ROUND([.B105];12) -> true | D105: of:=FORMULA([.A105]) -> =BINOMDIST(G102,$H$74,$H$75,TRUE()) | G105: 29
A106: of:=BINOMDIST([.G103];[.$H$74];[.$H$75];TRUE()) -> 0 | B106: of:=BINOMDIST([.H103];[.$H$74];[.$H$75];TRUE()) -> 0 | C106: of:=ROUND([.A106];12)=ROUND([.B106];12) -> true | D106: of:=FORMULA([.A106]) -> =BINOMDIST(G103,$H$74,$H$75,TRUE()) | G106: 30
A107: of:=BINOMDIST([.G104];[.$H$74];[.$H$75];TRUE()) -> 0 | B107: of:=BINOMDIST([.H104];[.$H$74];[.$H$75];TRUE()) -> 0 | C107: of:=ROUND([.A107];12)=ROUND([.B107];12) -> true | D107: of:=FORMULA([.A107]) -> =BINOMDIST(G104,$H$74,$H$75,TRUE()) | G107: 31
A108: of:=BINOMDIST([.G105];[.$H$74];[.$H$75];TRUE()) -> 0 | B108: of:=BINOMDIST([.H105];[.$H$74];[.$H$75];TRUE()) -> 0 | C108: of:=ROUND([.A108];12)=ROUND([.B108];12) -> true | D108: of:=FORMULA([.A108]) -> =BINOMDIST(G105,$H$74,$H$75,TRUE()) | G108: 32
A109: of:=BINOMDIST([.G106];[.$H$74];[.$H$75];TRUE()) -> 0 | B109: of:=BINOMDIST([.H106];[.$H$74];[.$H$75];TRUE()) -> 0 | C109: of:=ROUND([.A109];12)=ROUND([.B109];12) -> true | D109: of:=FORMULA([.A109]) -> =BINOMDIST(G106,$H$74,$H$75,TRUE()) | G109: 33
A110: of:=BINOMDIST([.G107];[.$H$74];[.$H$75];TRUE()) -> 0 | B110: of:=BINOMDIST([.H107];[.$H$74];[.$H$75];TRUE()) -> 0 | C110: of:=ROUND([.A110];12)=ROUND([.B110];12) -> true | D110: of:=FORMULA([.A110]) -> =BINOMDIST(G107,$H$74,$H$75,TRUE()) | G110: 34
A111: of:=BINOMDIST([.G108];[.$H$74];[.$H$75];TRUE()) -> 0 | B111: of:=BINOMDIST([.H108];[.$H$74];[.$H$75];TRUE()) -> 0 | C111: of:=ROUND([.A111];12)=ROUND([.B111];12) -> true | D111: of:=FORMULA([.A111]) -> =BINOMDIST(G108,$H$74,$H$75,TRUE()) | G111: 35
A112: of:=BINOMDIST([.G109];[.$H$74];[.$H$75];TRUE()) -> 0 | B112: of:=BINOMDIST([.H109];[.$H$74];[.$H$75];TRUE()) -> 0 | C112: of:=ROUND([.A112];12)=ROUND([.B112];12) -> true | D112: of:=FORMULA([.A112]) -> =BINOMDIST(G109,$H$74,$H$75,TRUE()) | G112: 36
A113: of:=BINOMDIST([.G110];[.$H$74];[.$H$75];TRUE()) -> 0 | B113: of:=BINOMDIST([.H110];[.$H$74];[.$H$75];TRUE()) -> 0 | C113: of:=ROUND([.A113];12)=ROUND([.B113];12) -> true | D113: of:=FORMULA([.A113]) -> =BINOMDIST(G110,$H$74,$H$75,TRUE()) | G113: 37
A114: of:=BINOMDIST([.G111];[.$H$74];[.$H$75];TRUE()) -> 0 | B114: of:=BINOMDIST([.H111];[.$H$74];[.$H$75];TRUE()) -> 0 | C114: of:=ROUND([.A114];12)=ROUND([.B114];12) -> true | D114: of:=FORMULA([.A114]) -> =BINOMDIST(G111,$H$74,$H$75,TRUE()) | G114: 38
A115: of:=BINOMDIST([.G112];[.$H$74];[.$H$75];TRUE()) -> 0 | B115: of:=BINOMDIST([.H112];[.$H$74];[.$H$75];TRUE()) -> 0 | C115: of:=ROUND([.A115];12)=ROUND([.B115];12) -> true | D115: of:=FORMULA([.A115]) -> =BINOMDIST(G112,$H$74,$H$75,TRUE()) | G115: 39
A116: of:=BINOMDIST([.G113];[.$H$74];[.$H$75];TRUE()) -> 0 | B116: of:=BINOMDIST([.H113];[.$H$74];[.$H$75];TRUE()) -> 0 | C116: of:=ROUND([.A116];12)=ROUND([.B116];12) -> true | D116: of:=FORMULA([.A116]) -> =BINOMDIST(G113,$H$74,$H$75,TRUE()) | G116: 40
A117: of:=BINOMDIST([.G114];[.$H$74];[.$H$75];TRUE()) -> 0 | B117: of:=BINOMDIST([.H114];[.$H$74];[.$H$75];TRUE()) -> 0 | C117: of:=ROUND([.A117];12)=ROUND([.B117];12) -> true | D117: of:=FORMULA([.A117]) -> =BINOMDIST(G114,$H$74,$H$75,TRUE()) | G117: 41
A118: of:=BINOMDIST([.G115];[.$H$74];[.$H$75];TRUE()) -> 0 | B118: of:=BINOMDIST([.H115];[.$H$74];[.$H$75];TRUE()) -> 0 | C118: of:=ROUND([.A118];12)=ROUND([.B118];12) -> true | D118: of:=FORMULA([.A118]) -> =BINOMDIST(G115,$H$74,$H$75,TRUE()) | G118: 42
A119: of:=BINOMDIST([.G116];[.$H$74];[.$H$75];TRUE()) -> 0 | B119: of:=BINOMDIST([.H116];[.$H$74];[.$H$75];TRUE()) -> 0 | C119: of:=ROUND([.A119];12)=ROUND([.B119];12) -> true | D119: of:=FORMULA([.A119]) -> =BINOMDIST(G116,$H$74,$H$75,TRUE()) | G119: 43
A120: of:=BINOMDIST([.G117];[.$H$74];[.$H$75];TRUE()) -> 1E-323 | B120: of:=BINOMDIST([.H117];[.$H$74];[.$H$75];TRUE()) -> 0 | C120: of:=ROUND([.A120];12)=ROUND([.B120];12) -> true | D120: of:=FORMULA([.A120]) -> =BINOMDIST(G117,$H$74,$H$75,TRUE()) | G120: 44
A121: of:=BINOMDIST([.G118];[.$H$74];[.$H$75];TRUE()) -> 1.65E-322 | B121: of:=BINOMDIST([.H118];[.$H$74];[.$H$75];TRUE()) -> 0 | C121: of:=ROUND([.A121];12)=ROUND([.B121];12) -> true | D121: of:=FORMULA([.A121]) -> =BINOMDIST(G118,$H$74,$H$75,TRUE()) | G121: 45
A122: of:=BINOMDIST([.G119];[.$H$74];[.$H$75];TRUE()) -> 5.37623762376238E-321 | B122: of:=BINOMDIST([.H119];[.$H$74];[.$H$75];TRUE()) -> 0 | C122: of:=ROUND([.A122];12)=ROUND([.B122];12) -> true | D122: of:=FORMULA([.A122]) -> =BINOMDIST(G119,$H$74,$H$75,TRUE()) | G122: 46
A123: of:=BINOMDIST([.G120];[.$H$74];[.$H$75];TRUE()) -> 1.71077075098814E-319 | B123: of:=BINOMDIST([.H120];[.$H$74];[.$H$75];TRUE()) -> 0 | C123: of:=ROUND([.A123];12)=ROUND([.B123];12) -> true | D123: of:=FORMULA([.A123]) -> =BINOMDIST(G120,$H$74,$H$75,TRUE()) | G123: 47
A124: of:=BINOMDIST([.G121];[.$H$74];[.$H$75];TRUE()) -> 5.32577741326667E-318 | B124: of:=BINOMDIST([.H121];[.$H$74];[.$H$75];TRUE()) -> 0 | C124: of:=ROUND([.A124];12)=ROUND([.B124];12) -> true | D124: of:=FORMULA([.A124]) -> =BINOMDIST(G121,$H$74,$H$75,TRUE()) | G124: 48
A125: of:=BINOMDIST([.G122];[.$H$74];[.$H$75];TRUE()) -> 1.62038435837546E-316 | B125: of:=BINOMDIST([.H122];[.$H$74];[.$H$75];TRUE()) -> 0 | C125: of:=ROUND([.A125];12)=ROUND([.B125];12) -> true | D125: of:=FORMULA([.A125]) -> =BINOMDIST(G122,$H$74,$H$75,TRUE()) | G125: 49
A126: of:=BINOMDIST([.G123];[.$H$74];[.$H$75];TRUE()) -> 4.82061509463534E-315 | B126: of:=BINOMDIST([.H123];[.$H$74];[.$H$75];TRUE()) -> 0 | C126: of:=ROUND([.A126];12)=ROUND([.B126];12) -> true | D126: of:=FORMULA([.A126]) -> =BINOMDIST(G123,$H$74,$H$75,TRUE()) | G126: 50
A127: of:=BINOMDIST([.G124];[.$H$74];[.$H$75];TRUE()) -> 1.40291753335915E-313 | B127: of:=BINOMDIST([.H124];[.$H$74];[.$H$75];TRUE()) -> 0 | C127: of:=ROUND([.A127];12)=ROUND([.B127];12) -> true | D127: of:=FORMULA([.A127]) -> =BINOMDIST(G124,$H$74,$H$75,TRUE()) | G127: 51
A128: of:=BINOMDIST([.G125];[.$H$74];[.$H$75];TRUE()) -> 3.99572190708427E-312 | B128: of:=BINOMDIST([.H125];[.$H$74];[.$H$75];TRUE()) -> 0 | C128: of:=ROUND([.A128];12)=ROUND([.B128];12) -> true | D128: of:=FORMULA([.A128]) -> =BINOMDIST(G125,$H$74,$H$75,TRUE()) | G128: 52
A129: of:=BINOMDIST([.G126];[.$H$74];[.$H$75];TRUE()) -> 1.11422351776948E-310 | B129: of:=BINOMDIST([.H126];[.$H$74];[.$H$75];TRUE()) -> 0 | C129: of:=ROUND([.A129];12)=ROUND([.B129];12) -> true | D129: of:=FORMULA([.A129]) -> =BINOMDIST(G126,$H$74,$H$75,TRUE()) | G129: 53
A130: of:=BINOMDIST([.G127];[.$H$74];[.$H$75];TRUE()) -> 3.04324350896419E-309 | B130: of:=BINOMDIST([.H127];[.$H$74];[.$H$75];TRUE()) -> 0 | C130: of:=ROUND([.A130];12)=ROUND([.B130];12) -> true | D130: of:=FORMULA([.A130]) -> =BINOMDIST(G127,$H$74,$H$75,TRUE()) | G130: 54
A131: of:=BINOMDIST([.G128];[.$H$74];[.$H$75];TRUE()) -> 8.1443235660886E-308 | B131: of:=BINOMDIST([.H128];[.$H$74];[.$H$75];TRUE()) -> 0 | C131: of:=ROUND([.A131];12)=ROUND([.B131];12) -> true | D131: of:=FORMULA([.A131]) -> =BINOMDIST(G128,$H$74,$H$75,TRUE()) | G131: 55
A132: of:=BINOMDIST([.G129];[.$H$74];[.$H$75];TRUE()) -> 2.13642433754206E-306 | B132: of:=BINOMDIST([.H129];[.$H$74];[.$H$75];TRUE()) -> 0 | C132: of:=ROUND([.A132];12)=ROUND([.B132];12) -> true | D132: of:=FORMULA([.A132]) -> =BINOMDIST(G129,$H$74,$H$75,TRUE()) | G132: 56
A133: of:=BINOMDIST([.G130];[.$H$74];[.$H$75];TRUE()) -> 5.49526246731005E-305 | B133: of:=BINOMDIST([.H130];[.$H$74];[.$H$75];TRUE()) -> 0 | C133: of:=ROUND([.A133];12)=ROUND([.B133];12) -> true | D133: of:=FORMULA([.A133]) -> =BINOMDIST(G130,$H$74,$H$75,TRUE()) | G133: 57
A134: of:=BINOMDIST([.G131];[.$H$74];[.$H$75];TRUE()) -> 1.38645685148353E-303 | B134: of:=BINOMDIST([.H131];[.$H$74];[.$H$75];TRUE()) -> 0 | C134: of:=ROUND([.A134];12)=ROUND([.B134];12) -> true | D134: of:=FORMULA([.A134]) -> =BINOMDIST(G131,$H$74,$H$75,TRUE()) | G134: 58
A135: of:=BINOMDIST([.G132];[.$H$74];[.$H$75];TRUE()) -> 3.43229391064517E-302 | B135: of:=BINOMDIST([.H132];[.$H$74];[.$H$75];TRUE()) -> 0 | C135: of:=ROUND([.A135];12)=ROUND([.B135];12) -> true | D135: of:=FORMULA([.A135]) -> =BINOMDIST(G132,$H$74,$H$75,TRUE()) | G135: 59
A136: of:=BINOMDIST([.G133];[.$H$74];[.$H$75];TRUE()) -> 8.33990089668934E-301 | B136: of:=BINOMDIST([.H133];[.$H$74];[.$H$75];TRUE()) -> 0 | C136: of:=ROUND([.A136];12)=ROUND([.B136];12) -> true | D136: of:=FORMULA([.A136]) -> =BINOMDIST(G133,$H$74,$H$75,TRUE()) | G136: 60
A137: of:=BINOMDIST([.G134];[.$H$74];[.$H$75];TRUE()) -> 1.98961439662087E-299 | B137: of:=BINOMDIST([.H134];[.$H$74];[.$H$75];TRUE()) -> 0 | C137: of:=ROUND([.A137];12)=ROUND([.B137];12) -> true | D137: of:=FORMULA([.A137]) -> =BINOMDIST(G134,$H$74,$H$75,TRUE()) | G137: 61
A138: of:=BINOMDIST([.G135];[.$H$74];[.$H$75];TRUE()) -> 4.66162429872083E-298 | B138: of:=BINOMDIST([.H135];[.$H$74];[.$H$75];TRUE()) -> 0 | C138: of:=ROUND([.A138];12)=ROUND([.B138];12) -> true | D138: of:=FORMULA([.A138]) -> =BINOMDIST(G135,$H$74,$H$75,TRUE()) | G138: 62
A139: of:=BINOMDIST([.G136];[.$H$74];[.$H$75];TRUE()) -> 1.07297680914213E-296 | B139: of:=BINOMDIST([.H136];[.$H$74];[.$H$75];TRUE()) -> 0 | C139: of:=ROUND([.A139];12)=ROUND([.B139];12) -> true | D139: of:=FORMULA([.A139]) -> =BINOMDIST(G136,$H$74,$H$75,TRUE()) | G139: 63
A140: of:=BINOMDIST([.G137];[.$H$74];[.$H$75];TRUE()) -> 2.42688038627691E-295 | B140: of:=BINOMDIST([.H137];[.$H$74];[.$H$75];TRUE()) -> 0 | C140: of:=ROUND([.A140];12)=ROUND([.B140];12) -> true | D140: of:=FORMULA([.A140]) -> =BINOMDIST(G137,$H$74,$H$75,TRUE()) | G140: 64
A141: of:=BINOMDIST([.G138];[.$H$74];[.$H$75];TRUE()) -> 5.3954504752254E-294 | B141: of:=BINOMDIST([.H138];[.$H$74];[.$H$75];TRUE()) -> 0 | C141: of:=ROUND([.A141];12)=ROUND([.B141];12) -> true | D141: of:=FORMULA([.A141]) -> =BINOMDIST(G138,$H$74,$H$75,TRUE()) | G141: 65
A142: of:=BINOMDIST([.G139];[.$H$74];[.$H$75];TRUE()) -> 1.17934521100453E-292 | B142: of:=BINOMDIST([.H139];[.$H$74];[.$H$75];TRUE()) -> 0 | C142: of:=ROUND([.A142];12)=ROUND([.B142];12) -> true | D142: of:=FORMULA([.A142]) -> =BINOMDIST(G139,$H$74,$H$75,TRUE()) | G142: 66
A143: of:=BINOMDIST([.G140];[.$H$74];[.$H$75];TRUE()) -> 2.53511181964208E-291 | B143: of:=BINOMDIST([.H140];[.$H$74];[.$H$75];TRUE()) -> 0 | C143: of:=ROUND([.A143];12)=ROUND([.B143];12) -> true | D143: of:=FORMULA([.A143]) -> =BINOMDIST(G140,$H$74,$H$75,TRUE()) | G143: 67
A144: of:=BINOMDIST([.G141];[.$H$74];[.$H$75];TRUE()) -> 5.36045765185616E-290 | B144: of:=BINOMDIST([.H141];[.$H$74];[.$H$75];TRUE()) -> 0 | C144: of:=ROUND([.A144];12)=ROUND([.B144];12) -> true | D144: of:=FORMULA([.A144]) -> =BINOMDIST(G141,$H$74,$H$75,TRUE()) | G144: 68
A145: of:=BINOMDIST([.G142];[.$H$74];[.$H$75];TRUE()) -> 1.11521242356323E-288 | B145: of:=BINOMDIST([.H142];[.$H$74];[.$H$75];TRUE()) -> 0 | C145: of:=ROUND([.A145];12)=ROUND([.B145];12) -> true | D145: of:=FORMULA([.A145]) -> =BINOMDIST(G142,$H$74,$H$75,TRUE()) | G145: 69
A146: of:=BINOMDIST([.G143];[.$H$74];[.$H$75];TRUE()) -> 2.28330337665408E-287 | B146: of:=BINOMDIST([.H143];[.$H$74];[.$H$75];TRUE()) -> 0 | C146: of:=ROUND([.A146];12)=ROUND([.B146];12) -> true | D146: of:=FORMULA([.A146]) -> =BINOMDIST(G143,$H$74,$H$75,TRUE()) | G146: 70
A147: of:=BINOMDIST([.G144];[.$H$74];[.$H$75];TRUE()) -> 4.60167862253499E-286 | B147: of:=BINOMDIST([.H144];[.$H$74];[.$H$75];TRUE()) -> 0 | C147: of:=ROUND([.A147];12)=ROUND([.B147];12) -> true | D147: of:=FORMULA([.A147]) -> =BINOMDIST(G144,$H$74,$H$75,TRUE()) | G147: 71
A148: of:=BINOMDIST([.G145];[.$H$74];[.$H$75];TRUE()) -> 9.13080620095145E-285 | B148: of:=BINOMDIST([.H145];[.$H$74];[.$H$75];TRUE()) -> 0 | C148: of:=ROUND([.A148];12)=ROUND([.B148];12) -> true | D148: of:=FORMULA([.A148]) -> =BINOMDIST(G145,$H$74,$H$75,TRUE()) | G148: 72
A149: of:=BINOMDIST([.G146];[.$H$74];[.$H$75];TRUE()) -> 1.78415657779112E-283 | B149: of:=BINOMDIST([.H146];[.$H$74];[.$H$75];TRUE()) -> 0 | C149: of:=ROUND([.A149];12)=ROUND([.B149];12) -> true | D149: of:=FORMULA([.A149]) -> =BINOMDIST(G146,$H$74,$H$75,TRUE()) | G149: 73
A150: of:=BINOMDIST([.G147];[.$H$74];[.$H$75];TRUE()) -> 3.4338082670663E-282 | B150: of:=BINOMDIST([.H147];[.$H$74];[.$H$75];TRUE()) -> 0 | C150: of:=ROUND([.A150];12)=ROUND([.B150];12) -> true | D150: of:=FORMULA([.A150]) -> =BINOMDIST(G147,$H$74,$H$75,TRUE()) | G150: 74
A151: of:=BINOMDIST([.G148];[.$H$74];[.$H$75];TRUE()) -> 6.51064641819634E-281 | B151: of:=BINOMDIST([.H148];[.$H$74];[.$H$75];TRUE()) -> 0 | C151: of:=ROUND([.A151];12)=ROUND([.B151];12) -> true | D151: of:=FORMULA([.A151]) -> =BINOMDIST(G148,$H$74,$H$75,TRUE()) | G151: 75
A152: of:=BINOMDIST([.G149];[.$H$74];[.$H$75];TRUE()) -> 1.21635557090045E-279 | B152: of:=BINOMDIST([.H149];[.$H$74];[.$H$75];TRUE()) -> 0 | C152: of:=ROUND([.A152];12)=ROUND([.B152];12) -> true | D152: of:=FORMULA([.A152]) -> =BINOMDIST(G149,$H$74,$H$75,TRUE()) | G152: 76
A153: of:=BINOMDIST([.G150];[.$H$74];[.$H$75];TRUE()) -> 2.23957934898801E-278 | B153: of:=BINOMDIST([.H150];[.$H$74];[.$H$75];TRUE()) -> 0 | C153: of:=ROUND([.A153];12)=ROUND([.B153];12) -> true | D153: of:=FORMULA([.A153]) -> =BINOMDIST(G150,$H$74,$H$75,TRUE()) | G153: 77
A154: of:=BINOMDIST([.G151];[.$H$74];[.$H$75];TRUE()) -> 4.06462735622521E-277 | B154: of:=BINOMDIST([.H151];[.$H$74];[.$H$75];TRUE()) -> 0 | C154: of:=ROUND([.A154];12)=ROUND([.B154];12) -> true | D154: of:=FORMULA([.A154]) -> =BINOMDIST(G151,$H$74,$H$75,TRUE()) | G154: 78
A155: of:=BINOMDIST([.G152];[.$H$74];[.$H$75];TRUE()) -> 7.27277579991248E-276 | B155: of:=BINOMDIST([.H152];[.$H$74];[.$H$75];TRUE()) -> 0 | C155: of:=ROUND([.A155];12)=ROUND([.B155];12) -> true | D155: of:=FORMULA([.A155]) -> =BINOMDIST(G152,$H$74,$H$75,TRUE()) | G155: 79
A156: of:=BINOMDIST([.G153];[.$H$74];[.$H$75];TRUE()) -> 1.28315651347021E-274 | B156: of:=BINOMDIST([.H153];[.$H$74];[.$H$75];TRUE()) -> 0 | C156: of:=ROUND([.A156];12)=ROUND([.B156];12) -> true | D156: of:=FORMULA([.A156]) -> =BINOMDIST(G153,$H$74,$H$75,TRUE()) | G156: 80
A157: of:=BINOMDIST([.G154];[.$H$74];[.$H$75];TRUE()) -> 2.23270775511191E-273 | B157: of:=BINOMDIST([.H154];[.$H$74];[.$H$75];TRUE()) -> 0 | C157: of:=ROUND([.A157];12)=ROUND([.B157];12) -> true | D157: of:=FORMULA([.A157]) -> =BINOMDIST(G154,$H$74,$H$75,TRUE())
A158: of:=BINOMDIST([.G155];[.$H$74];[.$H$75];TRUE()) -> 3.8320213675842E-272 | B158: of:=BINOMDIST([.H155];[.$H$74];[.$H$75];TRUE()) -> 0 | C158: of:=ROUND([.A158];12)=ROUND([.B158];12) -> true | D158: of:=FORMULA([.A158]) -> =BINOMDIST(G155,$H$74,$H$75,TRUE())
A159: of:=BINOMDIST([.G156];[.$H$74];[.$H$75];TRUE()) -> 6.4883898753303E-271 | B159: of:=BINOMDIST([.H156];[.$H$74];[.$H$75];TRUE()) -> 0 | C159: of:=ROUND([.A159];12)=ROUND([.B159];12) -> true | D159: of:=FORMULA([.A159]) -> =BINOMDIST(G156,$H$74,$H$75,TRUE())
A160: of:=BINOMDIST(391; 462; 0.8; TRUE ()) -> 0.995603391549318 | B160: 0.995603391549318 | C160: of:=ROUND([.A160];12)=ROUND([.B160];12) -> true | D160: of:=FORMULA([.A160]) -> =BINOMDIST(391, 462, 0.8, TRUE ())

Sheet: 'file:///home/zdenek/Dokumenty/LO/sc-unit-test/Project%20Calc%20functions%20tests/fods/function_based_test_Example.fods/function_based_test_Example_reference.fods'#Sheet2
H3: 4