Sheet: Sheet1
A1: CHISQDIST Function
A3: Result | B3: of:=AND([.B8:.B95]) -> true
A7: Sheet | B7: Result | C7: Description
A8: 1 | B8: of:=AND([Sheet2.C2:.C349]) -> true | C8: Simple CHISQDIST formulas with local references and values

Sheet: Sheet2
A1: Function | B1: Expected | C1: Correct | D1: FunctionString | E1: Comment | I1: 2 | J1: 1 | K1: 0
A2: of:=CHISQDIST(3; 2; 0) -> 0.111565080074215 | B2: of:=0.11156508007421+4.91E-015 -> 0.944539492146675 | C2: of:=ORG.LIBREOFFICE.ROUNDSIG([.A2];15)=ORG.LIBREOFFICE.ROUNDSIG([.B2];15) -> true | D2: of:=FORMULA([.A2]) -> =CHISQDIST(3, 2, 0) | I2: 3 | J2: 2 | K2: 1
A3: of:=CHISQDIST(3; 2; 1) -> 0.77686983985157 | B3: 0.77686983985157 | C3: of:=ORG.LIBREOFFICE.ROUNDSIG([.A3];15)=ORG.LIBREOFFICE.ROUNDSIG([.B3];15) -> true | D3: of:=FORMULA([.A3]) -> =CHISQDIST(3, 2, 1) | I3: 4 | J3: 3 | K3: 0
A4: of:=CHISQDIST(2;3;0) -> 0.207553748710297 | B4: 0.207553748710297 | C4: of:=ORG.LIBREOFFICE.ROUNDSIG([.A4];15)=ORG.LIBREOFFICE.ROUNDSIG([.B4];15) -> true | D4: of:=FORMULA([.A4]) -> =CHISQDIST(2,3,0) | I4: 5 | J4: 4 | K4: 1
A5: of:=CHISQDIST(0;0;0) ->  | B5: of:#ERR502! ->  | C5: of:=ISERROR([.A5]) -> true | D5: of:=FORMULA([.A5]) -> =CHISQDIST(0,0,0) | I5: 6 | J5: 5 | K5: 0
A6: of:=CHISQDIST(-2;3;0) -> 0 | B6: 0 | C6: of:=ORG.LIBREOFFICE.ROUNDSIG([.A6];15)=ORG.LIBREOFFICE.ROUNDSIG([.B6];15) -> true | D6: of:=FORMULA([.A6]) -> =CHISQDIST(-2,3,0) | I6: 7 | J6: 6 | K6: 1
A7: of:=CHISQDIST(2;0.3;0) ->  | B7: of:#ERR502! ->  | C7: of:=ISERROR([.A7]) -> true | D7: of:=FORMULA([.A7]) -> =CHISQDIST(2,0.3,0)
A8: of:=CHISQDIST(2;3;-7) -> 0.42759329552912 | B8: 0.42759329552912 | C8: of:=ORG.LIBREOFFICE.ROUNDSIG([.A8];15)=ORG.LIBREOFFICE.ROUNDSIG([.B8];15) -> true | D8: of:=FORMULA([.A8]) -> =CHISQDIST(2,3,-7)
A9: of:=CHISQDIST(2;-3;-7) ->  | B9: of:#ERR502! ->  | C9: of:=ISERROR([.A9]) -> true | D9: of:=FORMULA([.A9]) -> =CHISQDIST(2,-3,-7)
A10: of:=CHISQDIST(2;0;-7) ->  | B10: of:#ERR502! ->  | C10: of:=ISERROR([.A10]) -> true | D10: of:=FORMULA([.A10]) -> =CHISQDIST(2,0,-7)
A11: of:=CHISQDIST(2; 1; 0) -> 0.103776874355149 | B11: 0.103776874355149 | C11: of:=ORG.LIBREOFFICE.ROUNDSIG([.A11];15)=ORG.LIBREOFFICE.ROUNDSIG([.B11];15) -> true | D11: of:=FORMULA([.A11]) -> =CHISQDIST(2, 1, 0)
A12: of:=CHISQDIST([.I1:.I6];[.J1:.J6];[.K1:.K6]) -> 0.103776874355149 | B12: 0.103776874355149 | C12: of:=ORG.LIBREOFFICE.ROUNDSIG([.A12];15)=ORG.LIBREOFFICE.ROUNDSIG([.B12];15) -> true | D12: of:=FORMULA([.A12]) -> {=CHISQDIST(I1:I6,J1:J6,K1:K6)}
A13: 0.77686983985157 | B13: 0.77686983985157 | C13: of:=ORG.LIBREOFFICE.ROUNDSIG([.A13];15)=ORG.LIBREOFFICE.ROUNDSIG([.B13];15) -> true | D13: of:=FORMULA([.A13]) -> {=CHISQDIST(I1:I6,J1:J6,K1:K6)}
A14: 0.107981933026376 | B14: 0.107981933026376 | C14: of:=ORG.LIBREOFFICE.ROUNDSIG([.A14];15)=ORG.LIBREOFFICE.ROUNDSIG([.B14];15) -> true | D14: of:=FORMULA([.A14]) -> {=CHISQDIST(I1:I6,J1:J6,K1:K6)}
A15: 0.712702504816354 | B15: 0.712702504816354 | C15: of:=ORG.LIBREOFFICE.ROUNDSIG([.A15];15)=ORG.LIBREOFFICE.ROUNDSIG([.B15];15) -> true | D15: of:=FORMULA([.A15]) -> {=CHISQDIST(I1:I6,J1:J6,K1:K6)}
A16: 0.0973043466592829 | B16: 0.0973043466592829 | C16: of:=ORG.LIBREOFFICE.ROUNDSIG([.A16];15)=ORG.LIBREOFFICE.ROUNDSIG([.B16];15) -> true | D16: of:=FORMULA([.A16]) -> {=CHISQDIST(I1:I6,J1:J6,K1:K6)}
A17: 0.679152801137866 | B17: 0.679152801137866 | C17: of:=ORG.LIBREOFFICE.ROUNDSIG([.A17];15)=ORG.LIBREOFFICE.ROUNDSIG([.B17];15) -> true | D17: of:=FORMULA([.A17]) -> {=CHISQDIST(I1:I6,J1:J6,K1:K6)}
A18: of:=CHISQDIST(0;2) -> 0 | B18: 0 | C18: of:=ORG.LIBREOFFICE.ROUNDSIG([.A18];15)=ORG.LIBREOFFICE.ROUNDSIG([.B18];15) -> true | D18: of:=FORMULA([.A18]) -> =CHISQDIST(0,2)
A19: of:=CHISQDIST(0;2;FALSE()) -> 0 | B19: 0 | C19: of:=ORG.LIBREOFFICE.ROUNDSIG([.A19];15)=ORG.LIBREOFFICE.ROUNDSIG([.B19];15) -> true | D19: of:=FORMULA([.A19]) -> =CHISQDIST(0,2,FALSE())
A20: of:=CHISQDIST(2;2;FALSE()) -> 0.183939720585721 | B20: 0.183939720585721 | C20: of:=ORG.LIBREOFFICE.ROUNDSIG([.A20];15)=ORG.LIBREOFFICE.ROUNDSIG([.B20];15) -> true | D20: of:=FORMULA([.A20]) -> =CHISQDIST(2,2,FALSE())
A21: of:=CHISQDIST(2;2;TRUE()) -> 0.632120558828558 | B21: 0.632120558828558 | C21: of:=ORG.LIBREOFFICE.ROUNDSIG([.A21];15)=ORG.LIBREOFFICE.ROUNDSIG([.B21];15) -> true | D21: of:=FORMULA([.A21]) -> =CHISQDIST(2,2,TRUE())
A22: of:=CHISQDIST(4;2;FALSE()) -> 0.0676676416183064 | B22: 0.0676676416183064 | C22: of:=ORG.LIBREOFFICE.ROUNDSIG([.A22];15)=ORG.LIBREOFFICE.ROUNDSIG([.B22];15) -> true | D22: of:=FORMULA([.A22]) -> =CHISQDIST(4,2,FALSE())
A23: of:=CHISQDIST(4;2;TRUE()) -> 0.864664716763387 | B23: 0.864664716763387 | C23: of:=ORG.LIBREOFFICE.ROUNDSIG([.A23];15)=ORG.LIBREOFFICE.ROUNDSIG([.B23];15) -> true | D23: of:=FORMULA([.A23]) -> =CHISQDIST(4,2,TRUE())

Sheet: 'file:///home/zdenek/Dokumenty/LO/sc-unit-test/Project%20Calc%20functions%20tests/fods/chisqdist.fods/function_based_test_Example.fods/function_based_test_Example_reference.fods'#Sheet2
H3: 4