Sheet: Sheet1
A1: CHISQ.INV Function
A3: Result | B3: of:=AND([.B8:.B95]) -> true
A7: Sheet | B7: Result | C7: Description
A8: 1 | B8: of:=AND([Sheet2.C2:.C841]) -> true | C8: Simple CHISQ.INV formulas with local references and values

Sheet: Sheet2
A1: Function | B1: Expected | C1: Correct | D1: FunctionString | E1: Comment | F1: 0.08 | G1: 10 | H1: 1 | I1: 1.9 | O1: Data | Q1: Data 1 | R1: Data 2 | T1: 0.402599231572822 | U1: 2
A2: of:=CHISQINV(0.93;1) -> 3.28302028675954 | B2: 3.28302028675954 | C2: of:=ORG.LIBREOFFICE.ROUNDSIG([.A2];15)=ORG.LIBREOFFICE.ROUNDSIG([.B2];15) -> true | D2: of:=FORMULA([.A2]) -> =CHISQINV(0.93,1) | F2: 0.09 | G2: 11 | H2: 2 | I2: 2.9 | O2: 1.959999998 | P2: 0.400653343414888 | Q2: 3 | R2: 6 | T2: 0.194342606933787 | U2: 3 | AB2: 105
A3: of:=CHISQINV(0.6;2) -> 1.83258146374831 | B3: 1.83258146374831 | C3: of:=ORG.LIBREOFFICE.ROUNDSIG([.A3];15)=ORG.LIBREOFFICE.ROUNDSIG([.B3];15) -> true | D3: of:=FORMULA([.A3]) -> =CHISQINV(0.6,2) | F3: 0.1 | G3: 12 | H3: 3 | I3: 3.9 | L3: 0.2 | M3: 6 | O3: 60 | P3: 0.166463582077995 | Q3: 4 | R3: 19 | T3: 0.400653343414888 | U3: 4 | AB3: 20
A4: of:=CHISQINV([.F1:.F11];[.G1:.G11]) -> 4.53504966643008 | B4: 4.53504966643008 | C4: of:=ORG.LIBREOFFICE.ROUNDSIG([.A4];15)=ORG.LIBREOFFICE.ROUNDSIG([.B4];15) -> true | D4: of:=FORMULA([.A4]) -> {=CHISQINV(F1:F11,G1:G11)} | F4: 0.11 | G4: 13 | H4: 4 | I4: 4.9 | L4: 0.3 | M4: 5 | P4: 0.0874699170235544 | Q4: 5 | R4: 3 | T4: 0.166463582077995 | U4: 5 | AB4: 100
A5: 5.40462670205885 | B5: 5.40462670205885 | C5: of:=ORG.LIBREOFFICE.ROUNDSIG([.A5];15)=ORG.LIBREOFFICE.ROUNDSIG([.B5];15) -> true | D5: of:=FORMULA([.A5]) -> {=CHISQINV(F1:F11,G1:G11)} | F5: 0.12 | G5: 14 | H5: 5 | I5: 5.9 | L5: 0.4 | M5: 11 | P5: 0.341886235401034 | Q5: 8 | R5: 2 | T5: 0.0874699170235544 | U5: 6
A6: 6.30379605958432 | B6: 6.30379605958432 | C6: of:=ORG.LIBREOFFICE.ROUNDSIG([.A6];15)=ORG.LIBREOFFICE.ROUNDSIG([.B6];15) -> true | D6: of:=FORMULA([.A6]) -> {=CHISQINV(F1:F11,G1:G11)} | F6: 0.13 | G6: 15 | H6: 6 | I6: 6.9 | L6: 0.5 | M6: 7 | P6: 0.946274813031778 | Q6: 9 | R6: 14 | T6: 0.341886235401034 | U6: 7
A7: 7.22840922887967 | B7: 7.22840922887967 | C7: of:=ORG.LIBREOFFICE.ROUNDSIG([.A7];15)=ORG.LIBREOFFICE.ROUNDSIG([.B7];15) -> true | D7: of:=FORMULA([.A7]) -> {=CHISQINV(F1:F11,G1:G11)} | F7: 0.14 | G7: 16 | H7: 7 | I7: 7.9 | L7: 0.6 | M7: 5 | P7: 0.984649823047221 | Q7: 1 | R7: 4 | T7: 0.946274813031778 | U7: 8
A8: 8.17520208558841 | B8: 8.17520208558841 | C8: of:=ORG.LIBREOFFICE.ROUNDSIG([.A8];15)=ORG.LIBREOFFICE.ROUNDSIG([.B8];15) -> true | D8: of:=FORMULA([.A8]) -> {=CHISQINV(F1:F11,G1:G11)} | F8: 0.15 | G8: 17 | H8: 8 | I8: 8.9 | L8: 0.7 | M8: 4 | P8: 0.910959278000519 | Q8: 2 | R8: 5 | T8: 0.984649823047221 | U8: 9
A9: 9.14156135907027 | B9: 9.14156135907027 | C9: of:=ORG.LIBREOFFICE.ROUNDSIG([.A9];15)=ORG.LIBREOFFICE.ROUNDSIG([.B9];15) -> true | D9: of:=FORMULA([.A9]) -> {=CHISQINV(F1:F11,G1:G11)} | F9: 0.16 | G9: 18 | H9: 9 | I9: 9.9 | L9: 0.8 | M9: 4 | P9: 0.730935096507892 | Q9: 4 | R9: 17 | T9: 0.910959278000519 | U9: 10
A10: 10.1253633400196 | B10: 10.1253633400196 | C10: of:=ORG.LIBREOFFICE.ROUNDSIG([.A10];15)=ORG.LIBREOFFICE.ROUNDSIG([.B10];15) -> true | D10: of:=FORMULA([.A10]) -> {=CHISQINV(F1:F11,G1:G11)} | F10: 0.17 | G10: 19 | H10: 10 | I10: 10.9 | P10: 1.40065334341489 | Q10: 5 | R10: 1 | T10: 0.730935096507892 | U10: 11
A11: 11.1248597059224 | B11: 11.1248597059224 | C11: of:=ORG.LIBREOFFICE.ROUNDSIG([.A11];15)=ORG.LIBREOFFICE.ROUNDSIG([.B11];15) -> true | D11: of:=FORMULA([.A11]) -> {=CHISQINV(F1:F11,G1:G11)} | F11: 0.18 | G11: 20 | H11: 11 | I11: 11.9 | T11: 0.208618188742548 | U11: 12
A12: 12.1385949123142 | B12: 12.1385949123142 | C12: of:=ORG.LIBREOFFICE.ROUNDSIG([.A12];15)=ORG.LIBREOFFICE.ROUNDSIG([.B12];15) -> true | D12: of:=FORMULA([.A12]) -> {=CHISQINV(F1:F11,G1:G11)} | T12: 0.731778104091063 | U12: 13
A13: 13.1653452479781 | B13: 13.1653452479781 | C13: of:=ORG.LIBREOFFICE.ROUNDSIG([.A13];15)=ORG.LIBREOFFICE.ROUNDSIG([.B13];15) -> true | D13: of:=FORMULA([.A13]) -> {=CHISQINV(F1:F11,G1:G11)} | T13: 0.960519265849143 | U13: 14
A14: 14.2040730851385 | B14: 14.2040730851385 | C14: of:=ORG.LIBREOFFICE.ROUNDSIG([.A14];15)=ORG.LIBREOFFICE.ROUNDSIG([.B14];15) -> true | D14: of:=FORMULA([.A14]) -> {=CHISQINV(F1:F11,G1:G11)} | T14: 0.176640923600644 | U14: 15
A15: of:=CHISQINV([.L3:.L9];[.M3:.M9]) -> 3.07008840528929 | B15: 3.07008840528929 | C15: of:=ORG.LIBREOFFICE.ROUNDSIG([.A15];15)=ORG.LIBREOFFICE.ROUNDSIG([.B15];15) -> true | D15: of:=FORMULA([.A15]) -> {=CHISQINV(L3:L9,M3:M9)} | F15: 654654 | G15: 654 | H15: 1
A16: 2.99990813275991 | B16: 2.99990813275991 | C16: of:=ORG.LIBREOFFICE.ROUNDSIG([.A16];15)=ORG.LIBREOFFICE.ROUNDSIG([.B16];15) -> true | D16: of:=FORMULA([.A16]) -> {=CHISQINV(L3:L9,M3:M9)}
A17: 9.23728542384152 | B17: 9.23728542384152 | C17: of:=ORG.LIBREOFFICE.ROUNDSIG([.A17];15)=ORG.LIBREOFFICE.ROUNDSIG([.B17];15) -> true | D17: of:=FORMULA([.A17]) -> {=CHISQINV(L3:L9,M3:M9)}
A18: 6.34581119552152 | B18: 6.34581119552152 | C18: of:=ORG.LIBREOFFICE.ROUNDSIG([.A18];15)=ORG.LIBREOFFICE.ROUNDSIG([.B18];15) -> true | D18: of:=FORMULA([.A18]) -> {=CHISQINV(L3:L9,M3:M9)}
A19: 5.13186707440182 | B19: 5.13186707440182 | C19: of:=ORG.LIBREOFFICE.ROUNDSIG([.A19];15)=ORG.LIBREOFFICE.ROUNDSIG([.B19];15) -> true | D19: of:=FORMULA([.A19]) -> {=CHISQINV(L3:L9,M3:M9)}
A20: 4.87843296656041 | B20: 4.87843296656041 | C20: of:=ORG.LIBREOFFICE.ROUNDSIG([.A20];15)=ORG.LIBREOFFICE.ROUNDSIG([.B20];15) -> true | D20: of:=FORMULA([.A20]) -> {=CHISQINV(L3:L9,M3:M9)}
A21: 5.98861669400425 | B21: 5.98861669400425 | C21: of:=ORG.LIBREOFFICE.ROUNDSIG([.A21];15)=ORG.LIBREOFFICE.ROUNDSIG([.B21];15) -> true | D21: of:=FORMULA([.A21]) -> {=CHISQINV(L3:L9,M3:M9)}
A22: of:=CHISQINV([.T2:.T14];[.U2:.U14]) -> 0.981793008255829 | B22: 0.981793008255829 | C22: of:=ORG.LIBREOFFICE.ROUNDSIG([.A22];15)=ORG.LIBREOFFICE.ROUNDSIG([.B22];15) -> true | D22: of:=FORMULA([.A22]) -> {=CHISQINV(T2:T14,U2:U14)}
A23: 2.75660369088146 | B23: 2.75660369088146 | C23: of:=ORG.LIBREOFFICE.ROUNDSIG([.A23];15)=ORG.LIBREOFFICE.ROUNDSIG([.B23];15) -> true | D23: of:=FORMULA([.A23]) -> {=CHISQINV(T2:T14,U2:U14)}
A24: 2.1113261237018 | B24: 2.1113261237018 | C24: of:=ORG.LIBREOFFICE.ROUNDSIG([.A24];15)=ORG.LIBREOFFICE.ROUNDSIG([.B24];15) -> true | D24: of:=FORMULA([.A24]) -> {=CHISQINV(T2:T14,U2:U14)}
A25: 2.0764999935322 | B25: 2.0764999935322 | C25: of:=ORG.LIBREOFFICE.ROUNDSIG([.A25];15)=ORG.LIBREOFFICE.ROUNDSIG([.B25];15) -> true | D25: of:=FORMULA([.A25]) -> {=CHISQINV(T2:T14,U2:U14)}
A26: 5.01515445024952 | B26: 5.01515445024952 | C26: of:=ORG.LIBREOFFICE.ROUNDSIG([.A26];15)=ORG.LIBREOFFICE.ROUNDSIG([.B26];15) -> true | D26: of:=FORMULA([.A26]) -> {=CHISQINV(T2:T14,U2:U14)}
A27: 15.2911628705065 | B27: 15.2911628705065 | C27: of:=ORG.LIBREOFFICE.ROUNDSIG([.A27];15)=ORG.LIBREOFFICE.ROUNDSIG([.B27];15) -> true | D27: of:=FORMULA([.A27]) -> {=CHISQINV(T2:T14,U2:U14)}
A28: 20.4461298047275 | B28: 20.4461298047275 | C28: of:=ORG.LIBREOFFICE.ROUNDSIG([.A28];15)=ORG.LIBREOFFICE.ROUNDSIG([.B28];15) -> true | D28: of:=FORMULA([.A28]) -> {=CHISQINV(T2:T14,U2:U14)}
A29: 16.3884014923503 | B29: 16.3884014923503 | C29: of:=ORG.LIBREOFFICE.ROUNDSIG([.A29];15)=ORG.LIBREOFFICE.ROUNDSIG([.B29];15) -> true | D29: of:=FORMULA([.A29]) -> {=CHISQINV(T2:T14,U2:U14)}
A30: 13.3824533053927 | B30: 13.3824533053927 | C30: of:=ORG.LIBREOFFICE.ROUNDSIG([.A30];15)=ORG.LIBREOFFICE.ROUNDSIG([.B30];15) -> true | D30: of:=FORMULA([.A30]) -> {=CHISQINV(T2:T14,U2:U14)}
A31: 7.91959455051006 | B31: 7.91959455051006 | C31: of:=ORG.LIBREOFFICE.ROUNDSIG([.A31];15)=ORG.LIBREOFFICE.ROUNDSIG([.B31];15) -> true | D31: of:=FORMULA([.A31]) -> {=CHISQINV(T2:T14,U2:U14)}
A32: 15.6557151216055 | B32: 15.6557151216055 | C32: of:=ORG.LIBREOFFICE.ROUNDSIG([.A32];15)=ORG.LIBREOFFICE.ROUNDSIG([.B32];15) -> true | D32: of:=FORMULA([.A32]) -> {=CHISQINV(T2:T14,U2:U14)}
A33: 24.5318147689017 | B33: 24.5318147689017 | C33: of:=ORG.LIBREOFFICE.ROUNDSIG([.A33];15)=ORG.LIBREOFFICE.ROUNDSIG([.B33];15) -> true | D33: of:=FORMULA([.A33]) -> {=CHISQINV(T2:T14,U2:U14)}
A34: 9.94221245771641 | B34: 9.94221245771641 | C34: of:=ORG.LIBREOFFICE.ROUNDSIG([.A34];15)=ORG.LIBREOFFICE.ROUNDSIG([.B34];15) -> true | D34: of:=FORMULA([.A34]) -> {=CHISQINV(T2:T14,U2:U14)}
A35: of:=CHISQINV(0;1) -> 0 | B35: 0 | C35: of:=ORG.LIBREOFFICE.ROUNDSIG([.A35];15)=ORG.LIBREOFFICE.ROUNDSIG([.B35];15) -> true | D35: of:=FORMULA([.A35]) -> =CHISQINV(0,1)
A36: of:=CHISQINV(1;1) ->  | B36: of:#ERR502! ->  | C36: of:=ISERROR([.A36]) -> true | D36: of:=FORMULA([.A36]) -> =CHISQINV(1,1)
A37: of:=CHISQINV(0.5;1) -> 0.454936423119572 | B37: 0.454936423119572 | C37: of:=ORG.LIBREOFFICE.ROUNDSIG([.A37];15)=ORG.LIBREOFFICE.ROUNDSIG([.B37];15) -> true | D37: of:=FORMULA([.A37]) -> =CHISQINV(0.5,1)
A38: of:=CHISQINV(0.1;1.1) -> 0.0157907740934312 | B38: 0.0157907740934312 | C38: of:=ORG.LIBREOFFICE.ROUNDSIG([.A38];15)=ORG.LIBREOFFICE.ROUNDSIG([.B38];15) -> true | D38: of:=FORMULA([.A38]) -> =CHISQINV(0.1,1.1)
A39: of:=CHISQINV(-1;11) ->  | B39: of:#ERR502! ->  | C39: of:=ISERROR([.A39]) -> true | D39: of:=FORMULA([.A39]) -> =CHISQINV(-1,11)
A40: of:=CHISQINV([.F1:.F11];[.I1:.I11]) -> 0.010086932215776 | B40: 0.010086932215776 | C40: of:=ORG.LIBREOFFICE.ROUNDSIG([.A40];15)=ORG.LIBREOFFICE.ROUNDSIG([.B40];15) -> true | D40: of:=FORMULA([.A40]) -> {=CHISQINV(F1:F11,I1:I11)}
A41: 0.188621358942483 | B41: 0.188621358942483 | C41: of:=ORG.LIBREOFFICE.ROUNDSIG([.A41];15)=ORG.LIBREOFFICE.ROUNDSIG([.B41];15) -> true | D41: of:=FORMULA([.A41]) -> {=CHISQINV(F1:F11,I1:I11)}
A42: 0.584374374155183 | B42: 0.584374374155183 | C42: of:=ORG.LIBREOFFICE.ROUNDSIG([.A42];15)=ORG.LIBREOFFICE.ROUNDSIG([.B42];15) -> true | D42: of:=FORMULA([.A42]) -> {=CHISQINV(F1:F11,I1:I11)}
A43: 1.1267819797945 | B43: 1.1267819797945 | C43: of:=ORG.LIBREOFFICE.ROUNDSIG([.A43];15)=ORG.LIBREOFFICE.ROUNDSIG([.B43];15) -> true | D43: of:=FORMULA([.A43]) -> {=CHISQINV(F1:F11,I1:I11)}
A44: 1.76973389560269 | B44: 1.76973389560269 | C44: of:=ORG.LIBREOFFICE.ROUNDSIG([.A44];15)=ORG.LIBREOFFICE.ROUNDSIG([.B44];15) -> true | D44: of:=FORMULA([.A44]) -> {=CHISQINV(F1:F11,I1:I11)}
A45: 2.48627982968339 | B45: 2.48627982968339 | C45: of:=ORG.LIBREOFFICE.ROUNDSIG([.A45];15)=ORG.LIBREOFFICE.ROUNDSIG([.B45];15) -> true | D45: of:=FORMULA([.A45]) -> {=CHISQINV(F1:F11,I1:I11)}
A46: 3.25953870534247 | B46: 3.25953870534247 | C46: of:=ORG.LIBREOFFICE.ROUNDSIG([.A46];15)=ORG.LIBREOFFICE.ROUNDSIG([.B46];15) -> true | D46: of:=FORMULA([.A46]) -> {=CHISQINV(F1:F11,I1:I11)}
A47: 4.07819909611163 | B47: 4.07819909611163 | C47: of:=ORG.LIBREOFFICE.ROUNDSIG([.A47];15)=ORG.LIBREOFFICE.ROUNDSIG([.B47];15) -> true | D47: of:=FORMULA([.A47]) -> {=CHISQINV(F1:F11,I1:I11)}
A48: 4.93427041996151 | B48: 4.93427041996151 | C48: of:=ORG.LIBREOFFICE.ROUNDSIG([.A48];15)=ORG.LIBREOFFICE.ROUNDSIG([.B48];15) -> true | D48: of:=FORMULA([.A48]) -> {=CHISQINV(F1:F11,I1:I11)}
A49: 5.8218731997855 | B49: 5.8218731997855 | C49: of:=ORG.LIBREOFFICE.ROUNDSIG([.A49];15)=ORG.LIBREOFFICE.ROUNDSIG([.B49];15) -> true | D49: of:=FORMULA([.A49]) -> {=CHISQINV(F1:F11,I1:I11)}
A50: 6.73654101450682 | B50: 6.73654101450682 | C50: of:=ORG.LIBREOFFICE.ROUNDSIG([.A50];15)=ORG.LIBREOFFICE.ROUNDSIG([.B50];15) -> true | D50: of:=FORMULA([.A50]) -> {=CHISQINV(F1:F11,I1:I11)}
A51: of:=CHISQINV(0.1;0.1) ->  | B51: of:#ERR502! ->  | C51: of:=ISERROR([.A51]) -> true | D51: of:=FORMULA([.A51]) -> =CHISQINV(0.1,0.1)
A52: of:=CHISQDIST(CHISQINV(0.1;3);3;TRUE() ) -> 0.1 | B52: 0.1 | C52: of:=ORG.LIBREOFFICE.ROUNDSIG([.A52];15)=ORG.LIBREOFFICE.ROUNDSIG([.B52];15) -> true | D52: of:=FORMULA([.A52]) -> =CHISQDIST(CHISQINV(0.1,3),3,TRUE() )
A53: of:=CHISQDIST(CHISQINV(0.3;3);3;TRUE()) -> 0.3 | B53: 0.3 | C53: of:=ORG.LIBREOFFICE.ROUNDSIG([.A53];15)=ORG.LIBREOFFICE.ROUNDSIG([.B53];15) -> true | D53: of:=FORMULA([.A53]) -> =CHISQDIST(CHISQINV(0.3,3),3,TRUE())
A54: of:=CHISQDIST(CHISQINV(0.5;3);3;TRUE()) -> 0.5 | B54: 0.5 | C54: of:=ORG.LIBREOFFICE.ROUNDSIG([.A54];15)=ORG.LIBREOFFICE.ROUNDSIG([.B54];15) -> true | D54: of:=FORMULA([.A54]) -> =CHISQDIST(CHISQINV(0.5,3),3,TRUE())
A55: of:=CHISQDIST(CHISQINV(0.7;3);3;TRUE()) -> 0.7 | B55: 0.7 | C55: of:=ORG.LIBREOFFICE.ROUNDSIG([.A55];15)=ORG.LIBREOFFICE.ROUNDSIG([.B55];15) -> true | D55: of:=FORMULA([.A55]) -> =CHISQDIST(CHISQINV(0.7,3),3,TRUE())
A56: of:=CHISQDIST(CHISQINV(0.9;3);3;TRUE()) -> 0.9 | B56: 0.9 | C56: of:=ORG.LIBREOFFICE.ROUNDSIG([.A56];15)=ORG.LIBREOFFICE.ROUNDSIG([.B56];15) -> true | D56: of:=FORMULA([.A56]) -> =CHISQDIST(CHISQINV(0.9,3),3,TRUE())
A57: of:=CHISQDIST(CHISQINV(0.1;20);20;TRUE()) -> 0.0999999999999997 | B57: 0.0999999999999997 | C57: of:=ORG.LIBREOFFICE.ROUNDSIG([.A57];15)=ORG.LIBREOFFICE.ROUNDSIG([.B57];15) -> true | D57: of:=FORMULA([.A57]) -> =CHISQDIST(CHISQINV(0.1,20),20,TRUE())
A58: of:=CHISQDIST(CHISQINV(0.3;20);20;TRUE()) -> 0.299999999999999 | B58: 0.299999999999999 | C58: of:=ORG.LIBREOFFICE.ROUNDSIG([.A58];14)=ORG.LIBREOFFICE.ROUNDSIG([.B58];14) -> true | D58: of:=FORMULA([.A58]) -> =CHISQDIST(CHISQINV(0.3,20),20,TRUE())
A59: of:=CHISQDIST(CHISQINV(0.5;20);20;TRUE()) -> 0.500000000000001 | B59: 0.500000000000001 | C59: of:=ORG.LIBREOFFICE.ROUNDSIG([.A59];15)=ORG.LIBREOFFICE.ROUNDSIG([.B59];15) -> true | D59: of:=FORMULA([.A59]) -> =CHISQDIST(CHISQINV(0.5,20),20,TRUE())
A60: of:=CHISQDIST(CHISQINV(0.7;20);20;TRUE()) -> 0.7 | B60: 0.7 | C60: of:=ORG.LIBREOFFICE.ROUNDSIG([.A60];15)=ORG.LIBREOFFICE.ROUNDSIG([.B60];15) -> true | D60: of:=FORMULA([.A60]) -> =CHISQDIST(CHISQINV(0.7,20),20,TRUE())
A61: of:=CHISQDIST(CHISQINV(0.9;20);20;TRUE()) -> 0.9 | B61: 0.9 | C61: of:=ORG.LIBREOFFICE.ROUNDSIG([.A61];15)=ORG.LIBREOFFICE.ROUNDSIG([.B61];15) -> true | D61: of:=FORMULA([.A61]) -> =CHISQDIST(CHISQINV(0.9,20),20,TRUE())
A62: of:=CHISQDIST(CHISQINV(0;20);20;TRUE()) -> 0 | B62: 0 | C62: of:=ORG.LIBREOFFICE.ROUNDSIG([.A62];15)=ORG.LIBREOFFICE.ROUNDSIG([.B62];15) -> true | D62: of:=FORMULA([.A62]) -> =CHISQDIST(CHISQINV(0,20),20,TRUE())