Sheet: Sheet1
A1: CHITEST Function
A3: Result | B3: of:=AND([.B8:.B95]) -> true
A7: Sheet | B7: Result | C7: Description
A8: 1 | B8: of:=AND([Sheet2.C2:.C841]) -> true | C8: Simple CHITEST formulas with local references and values

Sheet: Sheet2
A1: Function | B1: Expected | C1: Correct | D1: FunctionString | E1: Comment | F1: 0.08 | G1: 10 | H1: 1 | I1: 1.9 | O1: Data | Q1: Data 1 | R1: Data 2 | T1: 0.402599231572822 | U1: 2
A2: of:=LEGACY.CHITEST([.F1:.F11];[.G1:.G11]) -> 1.16440189336067E-029 | B2: 1.16440189336067E-029 | C2: of:=ORG.LIBREOFFICE.ROUNDSIG([.A2];14)=ORG.LIBREOFFICE.ROUNDSIG([.B2];14) -> true | D2: of:=FORMULA([.A2]) -> =CHITEST(F1:F11,G1:G11) | F2: 0.09 | G2: 11 | H2: 2 | I2: 2.9 | O2: 1.959999998 | P2: 0.400653343414888 | Q2: 3 | R2: 6 | T2: 0.194342606933787 | U2: 3 | W2: 58 | X2: 35 | AB2: 105
A3: of:=LEGACY.CHITEST([.F1:.F11];[.H1:.H11]) -> 0.000000000903490480352966 | B3: 0.000000000903490480352966 | C3: of:=ORG.LIBREOFFICE.ROUNDSIG([.A3];14)=ORG.LIBREOFFICE.ROUNDSIG([.B3];14) -> true | D3: of:=FORMULA([.A3]) -> =CHITEST(F1:F11,H1:H11) | F3: 0.1 | G3: 12 | H3: 3 | I3: 3.9 | L3: -0.2 | M3: 6 | O3: 60 | P3: 0.166463582077995 | Q3: 4 | R3: 19 | T3: 0.400653343414888 | U3: 4 | W3: 11 | X3: 25 | AB3: 20
A4: of:=LEGACY.CHITEST([.H1:.H11];[.G1:.G11]) -> 0.00000000134423459890025 | B4: 0.00000000134423459890025 | C4: of:=ORG.LIBREOFFICE.ROUNDSIG([.A4];14)=ORG.LIBREOFFICE.ROUNDSIG([.B4];14) -> true | D4: of:=FORMULA([.A4]) -> =CHITEST(H1:H11,G1:G11) | F4: 0.11 | G4: 13 | H4: 4 | I4: 4.9 | L4: 0.8 | M4: 5 | P4: 0.0874699170235544 | Q4: 5 | R4: 3 | T4: 0.166463582077995 | U4: 5 | W4: 10 | X4: 23 | AB4: 100
A5: of:=LEGACY.CHITEST([.H1:.H11];[.F1:.F11]) -> 0 | B5: 0 | C5: of:=ORG.LIBREOFFICE.ROUNDSIG([.A5];14)=ORG.LIBREOFFICE.ROUNDSIG([.B5];14) -> true | D5: of:=FORMULA([.A5]) -> =CHITEST(H1:H11,F1:F11) | F5: 0.12 | G5: 14 | H5: 5 | I5: 5.9 | L5: 1.8 | M5: 11 | P5: 0.341886235401034 | Q5: 8 | R5: 2 | T5: 0.0874699170235544 | U5: 6
A6: of:=LEGACY.CHITEST([.F1:.F11];[.I1:.I11]) -> 0.0000000000112896923737676 | B6: 0.0000000000112896923737676 | C6: of:=ORG.LIBREOFFICE.ROUNDSIG([.A6];14)=ORG.LIBREOFFICE.ROUNDSIG([.B6];14) -> true | D6: of:=FORMULA([.A6]) -> =CHITEST(F1:F11,I1:I11) | F6: 0.13 | G6: 15 | H6: 6 | I6: 6.9 | L6: 2.8 | M6: 7 | P6: 0.946274813031778 | Q6: 9 | R6: 14 | T6: 0.341886235401034 | U6: 7 | W6: 45.35 | X6: 47.65
A7: of:=LEGACY.CHITEST([.H1:.H11];[.I1:.I11]) -> 0.997916658208002 | B7: 0.997916658208002 | C7: of:=ORG.LIBREOFFICE.ROUNDSIG([.A7];14)=ORG.LIBREOFFICE.ROUNDSIG([.B7];14) -> true | D7: of:=FORMULA([.A7]) -> =CHITEST(H1:H11,I1:I11) | F7: 0.14 | G7: 16 | H7: 7 | I7: 7.9 | L7: 3.8 | M7: 5 | P7: 0.984649823047221 | Q7: 1 | R7: 4 | T7: 0.946274813031778 | U7: 8 | W7: 17.56 | X7: 18.44
A8: of:=LEGACY.CHITEST([.L3:.L9];[.M3:.M9]) -> 0.00154971363304587 | B8: 0.00154971363304587 | C8: of:=ORG.LIBREOFFICE.ROUNDSIG([.A8];14)=ORG.LIBREOFFICE.ROUNDSIG([.B8];14) -> true | D8: of:=FORMULA([.A8]) -> =CHITEST(L3:L9,M3:M9) | F8: 0.15 | G8: 17 | H8: 8 | I8: 8.9 | L8: 4.8 | M8: 4 | P8: 0.910959278000519 | Q8: 2 | R8: 5 | T8: 0.984649823047221 | U8: 9 | W8: 16.09 | X8: 16.91
A9: of:=LEGACY.CHITEST([.L4:.L10];[.M4:.M10]) -> 0.0202524730723578 | B9: 0.0202524730723578 | C9: of:=ORG.LIBREOFFICE.ROUNDSIG([.A9];14)=ORG.LIBREOFFICE.ROUNDSIG([.B9];14) -> true | D9: of:=FORMULA([.A9]) -> =CHITEST(L4:L10,M4:M10) | E9: tdf106786 | F9: 0.16 | G9: 18 | H9: 9 | I9: 9.9 | L9: 5.8 | M9: 4 | P9: 0.730935096507892 | Q9: 4 | R9: 17 | T9: 0.910959278000519 | U9: 10
A10: of:=LEGACY.CHITEST([.T1:.T14];[.U1:.U14]) -> 1.66789802691649E-016 | B10: 1.66789802691649E-016 | C10: of:=ORG.LIBREOFFICE.ROUNDSIG([.A10];14)=ORG.LIBREOFFICE.ROUNDSIG([.B10];14) -> true | D10: of:=FORMULA([.A10]) -> =CHITEST(T1:T14,U1:U14) | F10: 0.17 | G10: 19 | H10: 10 | I10: 10.9 | P10: 1.40065334341489 | Q10: 5 | R10: 1 | T10: 0.730935096507892 | U10: 11
A11: of:=LEGACY.CHITEST([.U1:.U14];[.T1:.T14]) -> 0 | B11: 0 | C11: of:=ORG.LIBREOFFICE.ROUNDSIG([.A11];14)=ORG.LIBREOFFICE.ROUNDSIG([.B11];14) -> true | D11: of:=FORMULA([.A11]) -> =CHITEST(U1:U14,T1:T14) | F11: 0.18 | G11: 20 | H11: 11 | I11: 11.9 | T11: 0.208618188742548 | U11: 12
A12: of:=LEGACY.CHITEST([.W2:.X4];[.W6:.X8]) -> 0.000308192017008309 | B12: 0.000308192017008309 | C12: of:=ORG.LIBREOFFICE.ROUNDSIG([.A12];14)=ORG.LIBREOFFICE.ROUNDSIG([.B12];14) -> true | D12: of:=FORMULA([.A12]) -> =CHITEST(W2:X4,W6:X8) | T12: 0.731778104091063 | U12: 13
A13: of:=LEGACY.CHITEST([.F1:.I1];[.F2:.I2]) -> 0.816527699624637 | B13: 0.816527699624637 | C13: of:=ORG.LIBREOFFICE.ROUNDSIG([.A13];14)=ORG.LIBREOFFICE.ROUNDSIG([.B13];14) -> true | D13: of:=FORMULA([.A13]) -> =CHITEST(F1:I1,F2:I2) | T13: 0.960519265849143 | U13: 14
A14: of:=LEGACY.CHITEST([.F2:.I2];[.F3:.I3]) -> 0.87928370831036 | B14: 0.87928370831036 | C14: of:=ORG.LIBREOFFICE.ROUNDSIG([.A14];14)=ORG.LIBREOFFICE.ROUNDSIG([.B14];14) -> true | D14: of:=FORMULA([.A14]) -> =CHITEST(F2:I2,F3:I3) | J14: 12 | K14: 14 | M14: 11 | T14: 0.176640923600644 | U14: 15
A15: of:=LEGACY.CHITEST([.F3:.I3];[.F4:.I4]) -> 0.911826184650631 | B15: 0.911826184650631 | C15: of:=ORG.LIBREOFFICE.ROUNDSIG([.A15];14)=ORG.LIBREOFFICE.ROUNDSIG([.B15];14) -> true | D15: of:=FORMULA([.A15]) -> =CHITEST(F3:I3,F4:I4) | F15: 654654 | G15: 654 | H15: 1 | J15: 17 | M15: 14 | N15: 0
A16: of:=LEGACY.CHITEST([.F4:.I4];[.F5:.I5]) -> 0.9314883584606 | B16: 0.9314883584606 | C16: of:=ORG.LIBREOFFICE.ROUNDSIG([.A16];14)=ORG.LIBREOFFICE.ROUNDSIG([.B16];14) -> true | D16: of:=FORMULA([.A16]) -> =CHITEST(F4:I4,F5:I5) | K16: 18 | N16: 18
A17: of:=LEGACY.CHITEST([.F5:.I5];[.F6:.I6]) -> 0.944539492146675 | B17: 0.944539492146675 | C17: of:=ORG.LIBREOFFICE.ROUNDSIG([.A17];14)=ORG.LIBREOFFICE.ROUNDSIG([.B17];14) -> true | D17: of:=FORMULA([.A17]) -> =CHITEST(F5:I5,F6:I6) | J17: 24 | K17: 34 | M17: 19 | N17: 35
A18: of:=LEGACY.CHITEST([.F6:.I6];[.F7:.I7]) -> 0.953774634535083 | B18: 0.953774634535083 | C18: of:=ORG.LIBREOFFICE.ROUNDSIG([.A18];14)=ORG.LIBREOFFICE.ROUNDSIG([.B18];14) -> true | D18: of:=FORMULA([.A18]) -> =CHITEST(F6:I6,F7:I7) | J18: 45 | K18: 47 | M18: 44 | N18: 0
A19: of:=LEGACY.CHITEST([.F7:.I7];[.F8:.I8]) -> 0.960619865110165 | B19: 0.960619865110165 | C19: of:=ORG.LIBREOFFICE.ROUNDSIG([.A19];14)=ORG.LIBREOFFICE.ROUNDSIG([.B19];14) -> true | D19: of:=FORMULA([.A19]) -> =CHITEST(F7:I7,F8:I8)
A20: of:=LEGACY.CHITEST([.F8:.I8];[.F9:.I9]) -> 0.965875482278625 | B20: 0.965875482278625 | C20: of:=ORG.LIBREOFFICE.ROUNDSIG([.A20];14)=ORG.LIBREOFFICE.ROUNDSIG([.B20];14) -> true | D20: of:=FORMULA([.A20]) -> =CHITEST(F8:I8,F9:I9)
A21: of:=LEGACY.CHITEST([.F9:.I9];[.F10:.I10]) -> 0.970023721006623 | B21: 0.970023721006623 | C21: of:=ORG.LIBREOFFICE.ROUNDSIG([.A21];14)=ORG.LIBREOFFICE.ROUNDSIG([.B21];14) -> true | D21: of:=FORMULA([.A21]) -> =CHITEST(F9:I9,F10:I10)
A22: of:=LEGACY.CHITEST([.F10:.I10];[.F11:.I11]) -> 0.973371683412022 | B22: 0.973371683412022 | C22: of:=ORG.LIBREOFFICE.ROUNDSIG([.A22];14)=ORG.LIBREOFFICE.ROUNDSIG([.B22];14) -> true | D22: of:=FORMULA([.A22]) -> =CHITEST(F10:I10,F11:I11)
A23: of:=LEGACY.CHITEST([.F18:.H19];[.F20:.H21]) ->  | B23: of:#ERR502! ->  | C23: of:=ISERROR([.B23]) -> true | D23: of:=FORMULA([.A23]) -> =CHITEST(F18:H19,F20:H21) | E23: tdf106786, empty datasets not allowed
A24: of:=LEGACY.CHITEST([.I13:.J17];[.L13:.M17]) -> 0.726644540598389 | B24: 0.726644540598389 | C24: of:=ORG.LIBREOFFICE.ROUNDSIG([.A24];14)=ORG.LIBREOFFICE.ROUNDSIG([.B24];14) -> true | D24: of:=FORMULA([.A24]) -> =CHITEST(I13:J17,L13:M17) | E24: tdf106786
A25: of:=LEGACY.CHITEST([.I14:.J18];[.L14:.M18]) -> 0.722466013915364 | B25: 0.722466013915364 | C25: of:=ORG.LIBREOFFICE.ROUNDSIG([.A25];13)=ORG.LIBREOFFICE.ROUNDSIG([.B25];13) -> true | D25: of:=FORMULA([.A25]) -> =CHITEST(I14:J18,L14:M18) | E25: tdf106786
A26: of:=LEGACY.CHITEST([.J13:.K17];[.M13:.N17]) -> 0.721391783070078 | B26: 0.721391783070078 | C26: of:=ORG.LIBREOFFICE.ROUNDSIG([.A26];14)=ORG.LIBREOFFICE.ROUNDSIG([.B26];14) -> true | D26: of:=FORMULA([.A26]) -> =CHITEST(J13:K17,M13:N17) | E26: tdf106786
A27: of:=LEGACY.CHITEST([.J14:.K18];[.M14:.N18]) ->  | B27: of:#DIV/0! ->  | C27: of:=ISERROR([.B27]) -> true | D27: of:=FORMULA([.A27]) -> =CHITEST(J14:K18,M14:N18) | E27: tdf106786, expected value cannot be 0
A28: of:=LEGACY.CHITEST([.K13:.L17];[.N13:.O17]) -> 0.999898925814582 | B28: 0.999898925814582 | C28: of:=ORG.LIBREOFFICE.ROUNDSIG([.A28];14)=ORG.LIBREOFFICE.ROUNDSIG([.B28];14) -> true | D28: of:=FORMULA([.A28]) -> =CHITEST(K13:L17,N13:O17) | E28: tdf106786
A29: of:=LEGACY.CHITEST([.K14:.L18];[.N14:.O18]) ->  | B29: of:#DIV/0! ->  | C29: of:=ISERROR([.B29]) -> true | D29: of:=FORMULA([.A29]) -> =CHITEST(K14:L18,N14:O18) | E29: tdf106786, expected value cannot be 0