Sheet: Sheet1
A1: COUNTIF Function
A3: Result | B3: of:=AND([.B8:.B95]) -> true
A7: Sheet | B7: Result | C7: Description
A8: 1 | B8: of:=AND([Sheet2.C2:.C349]) -> true | C8: Simple COUNTIF formulas with local references and values

Sheet: Sheet2
A1: Function | B1: Expected | C1: Correct | D1: FunctionString | E1: Comment | I1: 2000 | J1: 2006 | K1: >2006 | L1: apple | N1: search for | O1: 1999 | P1: 2002 | Q1: 1998 | R1: >=1999 | S1: >1999 | T1: <2001 | U1: >0 | V1: >=0 | W1: of:=0 -> 0 | X1: X
A2: of:=COUNTIF([.I1:.I10];2006) -> 1 | B2: 1 | C2: of:=ROUND([.A2];12)=ROUND([.B2];12) -> true | D2: of:=FORMULA([.A2]) -> =COUNTIF(I1:I10;2006) | I2: 2001 | L2: pear
A3: of:=COUNTIF([.I1:.I10];[.J1]) -> 1 | B3: 1 | C3: of:=ROUND([.A3];12)=ROUND([.B3];12) -> true | D3: of:=FORMULA([.A3]) -> =COUNTIF(I1:I10;J1) | I3: 2002 | L3: pomelo | O3: 1999 | Q3: abc
A4: of:=COUNTIF([.I1:.I10];">=2006") -> 4 | B4: 4 | C4: of:=ROUND([.A4];12)=ROUND([.B4];12) -> true | D4: of:=FORMULA([.A4]) -> =COUNTIF(I1:I10;">=2006") | I4: 2003 | L4: melon | O4: 2000 | Q4: ABC
A5: of:=COUNTIF([.I1:.I10];"<"&[.J1]) -> 6 | B5: 6 | C5: of:=ROUND([.A5];12)=ROUND([.B5];12) -> true | D5: of:=FORMULA([.A5]) -> =COUNTIF(I1:I10;"<"&J1) | F5: of:=[.G5] -> 0 | I5: 2004 | O5: of:=VALUE("0") -> 0 | Q5: Abc
A6: of:=COUNTIF([.I1:.I10];[.K1]) -> 3 | B6: 3 | C6: of:=ROUND([.A6];12)=ROUND([.B6];12) -> true | D6: of:=FORMULA([.A6]) -> =COUNTIF(I1:I10;K1) | F6: of:="" ->  | I6: 2005 | O6: of:=VALUE("0") -> 0 | Q6: aBc
A7: of:=COUNTIF([.L1:.L5]; ">=P") -> 2 | B7: 2 | C7: of:=ROUND([.A7];12)=ROUND([.B7];12) -> true | D7: of:=FORMULA([.A7]) -> =COUNTIF(L1:L5; ">=P") | I7: 2006 | O7: of:=VALUE("0") -> 0 | Q7: Abc
A8: of:=COUNTIF([.L1:.L8]; ".+") -> 4 | B8: 4 | C8: of:=ROUND([.A8];12)=ROUND([.B8];12) -> true | D8: of:=FORMULA([.A8]) -> =COUNTIF(L1:L8; ".+") | I8: 2007 | O8: 2002 | Q8: a
A9: of:=COUNTIF([.$I$13:.$I$15];1) -> 0 | B9: 0 | C9: of:=ROUND([.A9];12)=ROUND([.B9];12) -> true | D9: of:=FORMULA([.A9]) -> =COUNTIF($I$13:$I$15;1) | I9: 2008 | O9: 2001 | Q9: A
A10: of:=COUNTIF([.$I$13:.$I$15];0) -> 3 | B10: 3 | C10: of:=ROUND([.A10];12)=ROUND([.B10];12) -> true | D10: of:=FORMULA([.A10]) -> =COUNTIF($I$13:$I$15;0) | I10: 2009 | O10: X | Q10: A
A11: of:=COUNTIF([.$I$13:.$I$15];"") -> 3 | B11: 3 | C11: of:=ROUND([.A11];12)=ROUND([.B11];12) -> true | D11: of:=FORMULA([.A11]) -> =COUNTIF($I$13:$I$15;"") | O11: 2002 | Q11: A
A12: of:=COUNTIF([.F12];[.F12]) -> 1 | B12: 1 | C12: of:=ROUND([.A12];12)=ROUND([.B12];12) -> true | D12: of:=FORMULA([.A12]) -> =COUNTIF(F12;F12) | F12: dfdsf]fdf
A13: of:=COUNTIF([.F13];[.F13]) -> 1 | B13: 1 | C13: of:=ROUND([.A13];12)=ROUND([.B13];12) -> true | D13: of:=FORMULA([.A13]) -> =COUNTIF(F13;F13) | F13: fgdg{fg | I13: of:={||} -> 0
A14: of:=COUNTIF([.F14];[.F14]) -> 1 | B14: 1 | C14: of:=ROUND([.A14];12)=ROUND([.B14];12) -> true | D14: of:=FORMULA([.A14]) -> =COUNTIF(F14;F14) | F14: fgsdfg}dfds | I14: 0
A15: of:=COUNTIF([.F20:.F22];"=0") -> 1 | B15: 1 | C15: of:=ROUND([.A15];12)=ROUND([.B15];12) -> true | D15: of:=FORMULA([.A15]) -> =COUNTIF(F20:F22;"=0") | E15: AOO#97733 | I15: 0
A16: of:=COUNTIF(IF([.A2:.A3]=1;[.B2:.B3];[.C2:.C3]);2) -> 0 | B16: 0 | C16: of:=ROUND([.A16];12)=ROUND([.B16];12) -> true | D16: of:=FORMULA([.A16]) -> {=COUNTIF(IF(A2:A3=1;B2:B3;C2:C3);2)} | E16: AOO#65866
A17: of:=COUNTIF([.F24:.F28];[.F24:.F28]) -> 2 | B17: 2 | C17: of:=ROUND([.A17];12)=ROUND([.B17];12) -> true | D17: of:=FORMULA([.A17]) -> {=COUNTIF(F24:F28;F24:F28)} | E17: AOO#57401 | F17: 7 | I17: 2 | J17: of:=[.I17] -> 2 | N17: result
A18: of:=COUNTIF([.I17:.J19];[.J21]) -> 2 | B18: 2 | C18: of:=ROUND([.A18];12)=ROUND([.B18];12) -> true | D18: of:=FORMULA([.A18]) -> =COUNTIF(I17:J19;J21) | E18: AOO#18374 | F18: 8 | I18: 3.5 | J18: of:=[.I18] -> 3.5
A19: of:=COUNTIF([.I17:.J19];SMALL([.I17:.J19];4)) -> 2 | B19: 2 | C19: of:=ROUND([.A19];12)=ROUND([.B19];12) -> true | D19: of:=FORMULA([.A19]) -> =COUNTIF(I17:J19;SMALL(I17:J19;4)) | I19: 4 | J19: of:=[.I19] -> 4
A20: of:=COUNTIF([.O3:.O15];[.O1]) -> 1 | B20: 1 | C20: of:=ROUND([.A20];12)=ROUND([.B20];12) -> true | D20: of:=FORMULA([.A20]) -> =COUNTIF(O3:O15;O1) | E20: AOO#36381 | F20: of:=1/0 -> 
A21: of:=COUNTIF([.O3:.O15];[.P1]) -> 2 | B21: 2 | C21: of:=ROUND([.A21];12)=ROUND([.B21];12) -> true | D21: of:=FORMULA([.A21]) -> =COUNTIF(O3:O15;P1) | F21: 0 | J21: of:=SMALL([.I17:.J19];4) -> 3.5
A22: of:=COUNTIF([.O3:.O15];[.Q1]) -> 0 | B22: 0 | C22: of:=ROUND([.A22];12)=ROUND([.B22];12) -> true | D22: of:=FORMULA([.A22]) -> =COUNTIF(O3:O15;Q1) | F22: 1
A23: of:=COUNTIF([.O3:.O15];[.R1]) -> 5 | B23: 5 | C23: of:=ROUND([.A23];12)=ROUND([.B23];12) -> true | D23: of:=FORMULA([.A23]) -> =COUNTIF(O3:O15;R1)
A24: of:=COUNTIF([.O3:.O15];[.S1]) -> 4 | B24: 4 | C24: of:=ROUND([.A24];12)=ROUND([.B24];12) -> true | D24: of:=FORMULA([.A24]) -> =COUNTIF(O3:O15;S1) | F24: Q
A25: of:=COUNTIF([.O3:.O15];[.T1]) -> 5 | B25: 5 | C25: of:=ROUND([.A25];12)=ROUND([.B25];12) -> true | D25: of:=FORMULA([.A25]) -> =COUNTIF(O3:O15;T1) | F25: R
A26: of:=COUNTIF([.O3:.O15];[.U1]) -> 5 | B26: 5 | C26: of:=ROUND([.A26];12)=ROUND([.B26];12) -> true | D26: of:=FORMULA([.A26]) -> =COUNTIF(O3:O15;U1) | F26: Q
A27: of:=COUNTIF([.O3:.O15];[.V1]) -> 8 | B27: 8 | C27: of:=ROUND([.A27];12)=ROUND([.B27];12) -> true | D27: of:=FORMULA([.A27]) -> =COUNTIF(O3:O15;V1) | F27: T
A28: of:=COUNTIF([.O3:.O15];[.W1]) -> 3 | B28: 3 | C28: of:=ROUND([.A28];12)=ROUND([.B28];12) -> true | D28: of:=FORMULA([.A28]) -> =COUNTIF(O3:O15;W1) | F28: U
A29: of:=COUNTIF([.O3:.O15];[.X1]) -> 1 | B29: 1 | C29: of:=ROUND([.A29];12)=ROUND([.B29];12) -> true | D29: of:=FORMULA([.A29]) -> =COUNTIF(O3:O15;X1)
A30: of:=COUNTIF([.O3:.O15];[.Y1]) -> 3 | B30: 3 | C30: of:=ROUND([.A30];12)=ROUND([.B30];12) -> true | D30: of:=FORMULA([.A30]) -> =COUNTIF(O3:O15;Y1) | I30: 1 | J30: of:=IF([.I30]=1;1;"") -> 1
A31: of:=COUNTIF([.J30:.J35];"") -> 4 | B31: 4 | C31: of:=ROUND([.A31];12)=ROUND([.B31];12) -> true | D31: of:=FORMULA([.A31]) -> =COUNTIF(J30:J35;"") | E31: Tdf#77039 | I31: 2 | J31: of:=IF([.I31]=1;1;"") -> 
A32: of:=COUNTIF([.P20:.R23];"") -> 12 | B32: 12 | C32: of:=ROUND([.A32];12)=ROUND([.B32];12) -> true | D32: of:=FORMULA([.A32]) -> =COUNTIF(P20:R23;"") | E32: tdf#117433 | I32: 3 | J32: of:=IF([.I32]=1;1;"") -> 
A33: of:=COUNTIF([.N33:.N35];"<>7") -> 2 | B33: 2 | C33: of:=ROUND([.A33];12)=ROUND([.B33];12) -> true | D33: of:=FORMULA([.A33]) -> =COUNTIF(N33:N35;"<>7") | E33: Tdf#73081 | I33: 1 | J33: of:=IF([.I33]=1;1;"") -> 1
A34: of:=COUNTIF([.$Q$3:.$Q$11];".*") -> 9 | B34: 9 | C34: of:=ROUND([.A34];12)=ROUND([.B34];12) -> true | D34: of:=FORMULA([.A34]) -> =COUNTIF($Q$3:$Q$11;".*") | E34: tdf#78840: case-insensitive | I34: 2 | J34: of:=IF([.I34]=1;1;"") ->  | N34: 7
A35: of:=COUNTIF([.$Q$3:.$Q$11];"abc") -> 5 | B35: 5 | C35: of:=ROUND([.A35];12)=ROUND([.B35];12) -> true | D35: of:=FORMULA([.A35]) -> =COUNTIF($Q$3:$Q$11;"abc") | E35: tdf#78840: case-insensitive | I35: 3 | J35: of:=IF([.I35]=1;1;"") ->  | N35: 8
A36: of:=COUNTIF([.$Q$3:.$Q$11];"ABC") -> 5 | B36: 5 | C36: of:=ROUND([.A36];12)=ROUND([.B36];12) -> true | D36: of:=FORMULA([.A36]) -> =COUNTIF($Q$3:$Q$11;"ABC") | E36: tdf#78840: case-insensitive
A37: of:=COUNTIF([.$Q$3:.$Q$11];"a") -> 4 | B37: 4 | C37: of:=ROUND([.A37];12)=ROUND([.B37];12) -> true | D37: of:=FORMULA([.A37]) -> =COUNTIF($Q$3:$Q$11;"a") | E37: tdf#78840: case-insensitive
A38: of:=COUNTIF([.$Q$3:.$Q$11];"A") -> 4 | B38: 4 | C38: of:=ROUND([.A38];12)=ROUND([.B38];12) -> true | D38: of:=FORMULA([.A38]) -> =COUNTIF($Q$3:$Q$11;"A") | E38: tdf#78840: case-insensitive
A39: of:=COUNTIF([.$Q$3:.$Q$11];"(?-i)abc") -> 1 | B39: 1 | C39: of:=ROUND([.A39];12)=ROUND([.B39];12) -> true | D39: of:=FORMULA([.A39]) -> =COUNTIF($Q$3:$Q$11;"(?-i)abc") | E39: tdf#78840: case-sensitive
A40: of:=COUNTIF([.$Q$3:.$Q$11];"(?-i)Abc") -> 2 | B40: 2 | C40: of:=ROUND([.A40];12)=ROUND([.B40];12) -> true | D40: of:=FORMULA([.A40]) -> =COUNTIF($Q$3:$Q$11;"(?-i)Abc") | E40: tdf#78840: case-sensitive
A41: of:=COUNTIF([.$Q$3:.$Q$11];"(?-i)A") -> 3 | B41: 3 | C41: of:=ROUND([.A41];12)=ROUND([.B41];12) -> true | D41: of:=FORMULA([.A41]) -> =COUNTIF($Q$3:$Q$11;"(?-i)A") | E41: tdf#78840: case-sensitive
A42: of:=COUNTIF([.$Q$3:.$Q$11];"a(?-i)B(?i)c") -> 2 | B42: 2 | C42: of:=ROUND([.A42];12)=ROUND([.B42];12) -> true | D42: of:=FORMULA([.A42]) -> =COUNTIF($Q$3:$Q$11;"a(?-i)B(?i)c") | E42: tdf#78840: case-sensitive
A43: of:=COUNTIF([.BM5:.BM9];0) -> 0 | B43: 0 | C43: of:=ROUND([.A43];12)=ROUND([.B43];12) -> true | D43: of:=FORMULA([.A43]) -> =COUNTIF(BM5:BM9,0) | E43: tdf#140014: crash
A55: of:=COUNTIF([.I53];[.I53]) -> 0 | B55: 1 | E55: A00#122187 | I55: ghf[fhsd
A56: of:=COUNTIF([.I54];[.I54]) -> 0 | B56: 1 | I56: fsdf(fdsd
A57: of:=COUNTIF([.I55];[.I55]) -> 0 | B57: 1 | I57: dfds)fgfgd
A58: of:=COUNTIF([.I56];[.I56]) -> 0 | B58: 1 | I58: =
A60: of:=COUNTIF([.F16:.F18];"<>7") -> 2 | E60: AOO#123925

Sheet: 'file:///home/zdenek/lodev/libreoffice/sc/qa/unit/data/functions/statistical/fods/function_based_test_Example.fods/function_based_test_Example_reference.fods'#Sheet2
H3: 4