Sheet: Sheet1
A1: COUNTIFS Function
A3: Result | B3: of:=AND([.B8:.B95]) -> true
A7: Sheet | B7: Result | C7: Description
A8: 1 | B8: of:=AND([Sheet2.C2:.C349]) -> true | C8: Simple COUNTIFS formulas with local references and values

Sheet: Sheet2
A1: Function | B1: Expected | C1: Correct | D1: FunctionString | E1: Comment | I1: 2000 | J1: 2006 | K1: >2006 | L1: apple | N1: search for | O1: 1999 | P1: 2002 | Q1: 1998 | R1: >=1999 | S1: >1999 | T1: <2001 | U1: >0 | V1: >=0 | W1: of:=0 -> 0 | X1: X | AA1: Salesperson | AB1: Exceeded Q1 quota | AC1: Exceeded Q2 quota | AD1: Exceeded Q3 quota | AF1: Data
A2: of:=COUNTIFS([.I1:.I10];2006) -> 1 | B2: 1 | C2: of:=ROUND([.A2];12)=ROUND([.B2];12) -> true | D2: of:=FORMULA([.A2]) -> =COUNTIFS(I1:I10,2006) | I2: 2001 | L2: pear | AA2: Davidoski | AB2: Yes | AC2: No | AD2: No | AF2: 1 | AG2: 2011-05-01
A3: of:=COUNTIFS([.I1:.I10];[.J1]) -> 1 | B3: 1 | C3: of:=ROUND([.A3];12)=ROUND([.B3];12) -> true | D3: of:=FORMULA([.A3]) -> =COUNTIFS(I1:I10,J1) | I3: 2002 | L3: pomelo | O3: 1999 | AA3: Burke | AB3: Yes | AC3: Yes | AD3: No | AF3: 2 | AG3: 2011-05-02
A4: of:=COUNTIFS([.I1:.I10];">=2006") -> 4 | B4: 4 | C4: of:=ROUND([.A4];12)=ROUND([.B4];12) -> true | D4: of:=FORMULA([.A4]) -> =COUNTIFS(I1:I10,">=2006") | I4: 2003 | L4: melon | O4: 2000 | AA4: Sundaram | AB4: Yes | AC4: Yes | AD4: Yes | AF4: 3 | AG4: 2011-05-03
A5: of:=COUNTIFS([.I1:.I10];"<"&[.J1]) -> 6 | B5: 6 | C5: of:=ROUND([.A5];12)=ROUND([.B5];12) -> true | D5: of:=FORMULA([.A5]) -> =COUNTIFS(I1:I10,"<"&J1) | F5: of:=[.G5] -> 0 | I5: 2004 | O5: of:=VALUE("0") -> 0 | AA5: Levitan | AB5: No | AC5: Yes | AD5: Yes | AF5: 4 | AG5: 2011-05-04
A6: of:=COUNTIFS([.I1:.I10];[.K1]) -> 3 | B6: 3 | C6: of:=ROUND([.A6];12)=ROUND([.B6];12) -> true | D6: of:=FORMULA([.A6]) -> =COUNTIFS(I1:I10,K1) | F6: of:="" ->  | I6: 2005 | O6: of:=VALUE("0") -> 0 | AF6: 5 | AG6: 2011-05-05
A7: of:=COUNTIFS([.L1:.L5]; ">=P") -> 2 | B7: 2 | C7: of:=ROUND([.A7];12)=ROUND([.B7];12) -> true | D7: of:=FORMULA([.A7]) -> =COUNTIFS(L1:L5, ">=P") | I7: 2006 | O7: of:=VALUE("0") -> 0 | AF7: 6 | AG7: 2011-05-06
A8: of:=COUNTIFS([.L1:.L8]; ".+") -> 4 | B8: 4 | C8: of:=ROUND([.A8];12)=ROUND([.B8];12) -> true | D8: of:=FORMULA([.A8]) -> =COUNTIFS(L1:L8, ".+") | I8: 2007 | O8: 2002
A9: of:=COUNTIFS([.$I$13:.$I$15];1) -> 0 | B9: 0 | C9: of:=ROUND([.A9];12)=ROUND([.B9];12) -> true | D9: of:=FORMULA([.A9]) -> =COUNTIFS($I$13:$I$15,1) | I9: 2008 | O9: 2001
A10: of:=COUNTIFS([.$I$13:.$I$15];0) -> 3 | B10: 3 | C10: of:=ROUND([.A10];12)=ROUND([.B10];12) -> true | D10: of:=FORMULA([.A10]) -> =COUNTIFS($I$13:$I$15,0) | I10: 2009 | O10: X
A11: of:=COUNTIFS([.$I$13:.$I$15];"") -> 3 | B11: 3 | C11: of:=ROUND([.A11];12)=ROUND([.B11];12) -> true | D11: of:=FORMULA([.A11]) -> =COUNTIFS($I$13:$I$15,"") | O11: 2002
A12: of:=COUNTIFS([.F12];[.F12]) -> 1 | B12: 1 | C12: of:=ROUND([.A12];12)=ROUND([.B12];12) -> true | D12: of:=FORMULA([.A12]) -> =COUNTIFS(F12,F12) | F12: dfdsf]fdf
A13: of:=COUNTIFS([.F13];[.F13]) -> 1 | B13: 1 | C13: of:=ROUND([.A13];12)=ROUND([.B13];12) -> true | D13: of:=FORMULA([.A13]) -> =COUNTIFS(F13,F13) | F13: fgdg{fg | I13: of:={||} -> 0
A14: of:=COUNTIFS([.F14];[.F14]) -> 1 | B14: 1 | C14: of:=ROUND([.A14];12)=ROUND([.B14];12) -> true | D14: of:=FORMULA([.A14]) -> =COUNTIFS(F14,F14) | F14: fgsdfg}dfds | I14: 0
A15: of:=COUNTIFS([.F20:.F22];"=0") -> 1 | B15: 1 | C15: of:=ROUND([.A15];12)=ROUND([.B15];12) -> true | D15: of:=FORMULA([.A15]) -> =COUNTIFS(F20:F22,"=0") | I15: 0
A16: of:=COUNTIFS(IF([.A2:.A3]=1;[.B2:.B3];[.C2:.C3]);2) -> 0 | B16: 0 | C16: of:=ROUND([.A16];12)=ROUND([.B16];12) -> true | D16: of:=FORMULA([.A16]) -> {=COUNTIFS(IF(A2:A3=1,B2:B3,C2:C3),2)}
A17: of:=COUNTIFS([.F24:.F28];[.F24:.F28]) -> 2 | B17: 2 | C17: of:=ROUND([.A17];12)=ROUND([.B17];12) -> true | D17: of:=FORMULA([.A17]) -> {=COUNTIFS(F24:F28,F24:F28)} | F17: 7 | I17: 2 | J17: of:=[.I17] -> 2 | N17: result
A18: 1 | B18: 1 | C18: of:=ROUND([.A18];12)=ROUND([.B18];12) -> true | D18: of:=FORMULA([.A18]) -> {=COUNTIFS(F24:F28,F24:F28)} | F18: 8 | I18: 3.5 | J18: of:=[.I18] -> 3.5
A19: 2 | B19: 2 | C19: of:=ROUND([.A19];12)=ROUND([.B19];12) -> true | D19: of:=FORMULA([.A19]) -> {=COUNTIFS(F24:F28,F24:F28)} | I19: 4 | J19: of:=[.I19] -> 4
A20: 1 | B20: 1 | C20: of:=ROUND([.A20];12)=ROUND([.B20];12) -> true | D20: of:=FORMULA([.A20]) -> {=COUNTIFS(F24:F28,F24:F28)} | F20: of:=1/0 -> 
A21: 1 | B21: 1 | C21: of:=ROUND([.A21];12)=ROUND([.B21];12) -> true | D21: of:=FORMULA([.A21]) -> {=COUNTIFS(F24:F28,F24:F28)} | F21: 0 | J21: of:=SMALL([.I17:.J19];4) -> 3.5
A22: of:=COUNTIFS([.O3:.O15];[.Q1]) -> 0 | B22: 0 | C22: of:=ROUND([.A22];12)=ROUND([.B22];12) -> true | D22: of:=FORMULA([.A22]) -> =COUNTIFS(O3:O15,Q1) | F22: 1
A23: of:=COUNTIFS([.O3:.O15];[.R1]) -> 5 | B23: 5 | C23: of:=ROUND([.A23];12)=ROUND([.B23];12) -> true | D23: of:=FORMULA([.A23]) -> =COUNTIFS(O3:O15,R1)
A24: of:=COUNTIFS([.O3:.O15];[.S1]) -> 4 | B24: 4 | C24: of:=ROUND([.A24];12)=ROUND([.B24];12) -> true | D24: of:=FORMULA([.A24]) -> =COUNTIFS(O3:O15,S1) | F24: Q
A25: of:=COUNTIFS([.O3:.O15];[.T1]) -> 5 | B25: 5 | C25: of:=ROUND([.A25];12)=ROUND([.B25];12) -> true | D25: of:=FORMULA([.A25]) -> =COUNTIFS(O3:O15,T1) | F25: R
A26: of:=COUNTIFS([.O3:.O15];[.U1]) -> 5 | B26: 5 | C26: of:=ROUND([.A26];12)=ROUND([.B26];12) -> true | D26: of:=FORMULA([.A26]) -> =COUNTIFS(O3:O15,U1) | F26: Q
A27: of:=COUNTIFS([.O3:.O15];[.V1]) -> 8 | B27: 8 | C27: of:=ROUND([.A27];12)=ROUND([.B27];12) -> true | D27: of:=FORMULA([.A27]) -> =COUNTIFS(O3:O15,V1) | F27: T
A28: of:=COUNTIFS([.O3:.O15];[.W1]) -> 3 | B28: 3 | C28: of:=ROUND([.A28];12)=ROUND([.B28];12) -> true | D28: of:=FORMULA([.A28]) -> =COUNTIFS(O3:O15,W1) | F28: U
A29: of:=COUNTIFS([.O3:.O15];[.X1]) -> 1 | B29: 1 | C29: of:=ROUND([.A29];12)=ROUND([.B29];12) -> true | D29: of:=FORMULA([.A29]) -> =COUNTIFS(O3:O15,X1)
A30: of:=COUNTIFS([.O3:.O15];[.Y1]) -> 3 | B30: 3 | C30: of:=ROUND([.A30];12)=ROUND([.B30];12) -> true | D30: of:=FORMULA([.A30]) -> =COUNTIFS(O3:O15,Y1) | I30: 1 | J30: of:=IF([.I30]=1;1;"") -> 1
A31: of:=COUNTIFS([.J30:.J35];"") -> 4 | B31: 4 | C31: of:=ROUND([.A31];12)=ROUND([.B31];12) -> true | D31: of:=FORMULA([.A31]) -> =COUNTIFS(J30:J35,"") | I31: 2 | J31: of:=IF([.I31]=1;1;"") -> 
A32: of:=COUNTIFS([.AB2:.AD2];"=Yes") -> 1 | B32: 1 | C32: of:=ROUND([.A32];12)=ROUND([.B32];12) -> true | D32: of:=FORMULA([.A32]) -> =COUNTIFS(AB2:AD2,"=Yes") | I32: 3 | J32: of:=IF([.I32]=1;1;"") -> 
A33: of:=COUNTIFS([.AB2:.AB5];"=Yes";[.AC2:.AC5];"=Yes") -> 2 | B33: 2 | C33: of:=ROUND([.A33];12)=ROUND([.B33];12) -> true | D33: of:=FORMULA([.A33]) -> =COUNTIFS(AB2:AB5,"=Yes",AC2:AC5,"=Yes") | I33: 1 | J33: of:=IF([.I33]=1;1;"") -> 1
A34: of:=COUNTIFS([.AB5:.AD5];"=Yes";[.AB3:.AD3];"=Yes") -> 1 | B34: 1 | C34: of:=ROUND([.A34];12)=ROUND([.B34];12) -> true | D34: of:=FORMULA([.A34]) -> =COUNTIFS(AB5:AD5,"=Yes",AB3:AD3,"=Yes") | I34: 2 | J34: of:=IF([.I34]=1;1;"") -> 
A35: of:=COUNTIFS([.AF2:.AF7];"<6";[.AF2:.AF7];">1") -> 4 | B35: 4 | C35: of:=ROUND([.A35];12)=ROUND([.B35];12) -> true | D35: of:=FORMULA([.A35]) -> =COUNTIFS(AF2:AF7,"<6",AF2:AF7,">1") | I35: 3 | J35: of:=IF([.I35]=1;1;"") -> 
A36: of:=COUNTIFS([.AF2:.AF7]; "<5";[.AG2:.AG7];"<5/3/2011") -> 2 | B36: 2 | C36: of:=ROUND([.A36];12)=ROUND([.B36];12) -> true | D36: of:=FORMULA([.A36]) -> =COUNTIFS(AF2:AF7, "<5",AG2:AG7,"<5/3/2011")
A37: of:=COUNTIFS([.AF2:.AF7]; "<" & [.AF6];[.AG2:.AG7];"<" & [.AG4]) -> 2 | B37: 2 | C37: of:=ROUND([.A37];12)=ROUND([.B37];12) -> true | D37: of:=FORMULA([.A37]) -> =COUNTIFS(AF2:AF7, "<" & AF6,AG2:AG7,"<" & AG4)
A38: of:=COUNTIFS([.$I$38:.$I$39];[.F38]) -> 1 | B38: 1 | C38: of:=ROUND([.A38];12)=ROUND([.B38];12) -> true | D38: of:=FORMULA([.A38]) -> =COUNTIFS(AF2:AF7, "<" & AF6,AG2:AG7,"<" & AG4) | E38: numbers entered as string | F38: 3 | I38: 3
A39: of:=COUNTIFS([.$I$38:.$I$39];[.F39]) -> 1 | B39: 0 | C39: of:=ROUND([.A39];12)=ROUND([.B39];12) -> true | D39: of:=FORMULA([.A39]) -> =COUNTIFS(AF2:AF7, "<" & AF6,AG2:AG7,"<" & AG4) | E39: numbers entered as string | F39: 2 | I39: 1

Sheet: 'file:///home/zdenek/Dokumenty/LO/sc-unit-test/Project%20Calc%20functions%20tests/fods/function_based_test_Example.fods/function_based_test_Example_reference.fods'#Sheet2
H3: 4