Sheet: Sheet1
A1: FORECAST.ETS.MULT Function
A3: Result | B3: of:=AND([.B8:.B95]) -> true
A7: Sheet | B7: Result | C7: Description
A8: 1 | B8: of:=AND([Sheet2.C2:.C349]) -> true | C8: Simple FORECAST.ETS.MULT formulas with local references and values

Sheet: Sheet2
A1: Function | B1: Expected | C1: Correct | D1: FunctionString | E1: Comment | M1: 1 | N1: 2 | P1: Known Y | Q1: Known X | S1: 2 | T1: 125.226808384339 | AL1: B | AM1: C | AO1: E | AQ1: 9 | AR1: periods | AX1: 1 | BB1: 1
A2: of:=ORG.LIBREOFFICE.FORECAST.ETS.MULT(6; [.N1:.N5]; [.M1:.M5]) -> 11.908196123559 | B2: 11.908196123559 | C2: of:=ROUND([.A2];12)=ROUND([.B2];12) -> true | D2: of:=FORMULA([.A2]) -> =FORECAST.ETS.MULT(6, N1:N5, M1:M5) | I2: https://bugs.documentfoundation.org/show_bug.cgi?id=94635 | M2: 2 | N2: 4 | P2: 6 | Q2: 20 | S2: 4 | T2: 118.933231648245 | V2: target | W2: 34 | AB2: 46 | AL2: of:=([.AM2]-1989.75)*4 -> 49 | AM2: 2002 | AV2: 34 | AX2: 2 | AZ2: 46 | BB2: 2
A3: of:=ORG.LIBREOFFICE.FORECAST.ETS.MULT(30;[.P2:.P6];[.Q2:.Q6]) ->  | B3: #VALUE! | C3: of:=ISERROR([.A3]) -> true | D3: of:=FORMULA([.A3]) -> =FORECAST.ETS.MULT(30,P2:P6,Q2:Q6) | M3: 3 | N3: 7 | P3: 7 | Q3: 28 | S3: 6 | T3: 105.954105316101 | V3: seasonality | W3: 4 | X3: 1 jaar | AB3: 12 | AF3: date | AG3: sales | AL3: 4 | AM3: 1 jaar | AV3: 4 | AW3: 1 jaar | AX3: 3 | AZ3: 12 | BA3: 1 jaar | BB3: 3 | BF3: sales
A4: of:=ORG.LIBREOFFICE.FORECAST.ETS.MULT([.S1:.S39];[.T1:.T39];[.S1:.S39]) -> 125.226808384339 | B4: 125.226808384339 | C4: of:=ROUND([.A4];12)=ROUND([.B4];12) -> true | D4: of:=FORMULA([.A4]) -> {=FORECAST.ETS.MULT(S1:S39,T1:T39,S1:S39)} | M4: 4 | N4: 8 | P4: 9 | Q4: 31 | S4: 4 | T4: 118.933231648245 | V4: datacompletion | W4: 1 | AB4: 1 | AE4: 1 | AF4: 2001-01-01 | AG4: 3240325 | AL4: 1 | AV4: 1 | AX4: 4 | AZ4: 1 | BB4: 4 | BD4: 1 | BF4: 3240325
A5: 118.933231648245 | B5: 118.933231648245 | C5: of:=ROUND([.A5];12)=ROUND([.B5];12) -> true | D5: of:=FORMULA([.A5]) -> {=FORECAST.ETS.MULT(S1:S39,T1:T39,S1:S39)} | M5: 5 | N5: 11 | P5: 15 | Q5: 38 | S5: 5 | T5: 111.549667344589 | V5: aggregation | W5: 1 | AB5: 1 | AE5: 2 | AF5: 2001-02-01 | AG5: 2741349 | AI5: 48.4 | AJ5: 1 | AL5: 1 | AV5: 1 | AX5: 5 | AZ5: 1 | BB5: 5 | BD5: 2 | BF5: 2741349 | BH5: 48.4 | BI5: 1
A6: 105.954105316101 | B6: 105.954105316101 | C6: of:=ROUND([.A6];12)=ROUND([.B6];12) -> true | D6: of:=FORMULA([.A6]) -> {=FORECAST.ETS.MULT(S1:S39,T1:T39,S1:S39)} | P6: 21 | Q6: 40 | S6: 6 | T6: 105.954105316101 | AE6: 3 | AF6: 2001-03-01 | AG6: 2987427 | AI6: 48.5 | AJ6: 2 | AQ6: 2 | AR6: 125.226808384339 | AX6: 6 | BB6: 6 | BD6: 3 | BF6: 2987427 | BH6: 48.5 | BI6: 2
A7: 118.933231648245 | B7: 118.933231648245 | C7: of:=ROUND([.A7];12)=ROUND([.B7];12) -> true | D7: of:=FORMULA([.A7]) -> {=FORECAST.ETS.MULT(S1:S39,T1:T39,S1:S39)} | S7: 7 | T7: 105.026989677408 | AE7: 4 | AF7: 2001-04-01 | AG7: 3456892 | AI7: 57.45 | AJ7: 3 | AL7: period | AM7: sales | AQ7: 4 | AR7: 118.933231648245 | AX7: 7 | BB7: 7 | BD7: 4 | BF7: 3456892 | BH7: 57.45 | BI7: 3
A8: 111.549667344589 | B8: 111.549667344589 | C8: of:=ROUND([.A8];12)=ROUND([.B8];12) -> true | D8: of:=FORMULA([.A8]) -> {=FORECAST.ETS.MULT(S1:S39,T1:T39,S1:S39)} | S8: 8 | T8: 109.479384966668 | V8: 2001-01-01 | W8: 1 | X8: 41.7 | AB8: 1 | AC8: 112 | AE8: 5 | AF8: 2001-05-01 | AG8: 3740738 | AI8: 64.95 | AJ8: 4 | AL8: 1 | AM8: 362 | AQ8: 6 | AR8: 105.954105316101 | AV8: 1 | AW8: 41.7 | AX8: 8 | AZ8: 1 | BA8: 112 | BB8: 8 | BD8: 5 | BF8: 3740738 | BH8: 64.95 | BI8: 4
A9: 105.954105316101 | B9: 105.954105316101 | C9: of:=ROUND([.A9];12)=ROUND([.B9];12) -> true | D9: of:=FORMULA([.A9]) -> {=FORECAST.ETS.MULT(S1:S39,T1:T39,S1:S39)} | S9: 9 | T9: 117.5 | V9: 2001-04-01 | W9: 2 | X9: 24 | AB9: 2 | AC9: 118 | AE9: 6 | AF9: 2001-06-01 | AG9: 3979178 | AI9: 62.55 | AJ9: 5 | AL9: 2 | AM9: 385 | AQ9: 4 | AR9: 118.933231648245 | AV9: 2 | AW9: 24 | AZ9: 2 | BA9: 118 | BD9: 6 | BF9: 3979178 | BH9: 62.55 | BI9: 5
A10: 105.026989677408 | B10: 105.026989677408 | C10: of:=ROUND([.A10];12)=ROUND([.B10];12) -> true | D10: of:=FORMULA([.A10]) -> {=FORECAST.ETS.MULT(S1:S39,T1:T39,S1:S39)} | S10: 10 | T10: 125.584893794301 | V10: 2001-07-01 | W10: 3 | X10: 32.3 | AB10: 3 | AC10: 132 | AE10: 7 | AF10: 2001-07-01 | AG10: 4160454 | AI10: 60.15 | AJ10: 6 | AL10: 3 | AM10: 432 | AQ10: 5 | AR10: 111.549667344589 | AV10: 3 | AW10: 32.3 | AZ10: 3 | BA10: 132 | BD10: 7 | BF10: 4160454 | BH10: 60.15 | BI10: 6
A11: 109.479384966668 | B11: 109.479384966668 | C11: of:=ROUND([.A11];12)=ROUND([.B11];12) -> true | D11: of:=FORMULA([.A11]) -> {=FORECAST.ETS.MULT(S1:S39,T1:T39,S1:S39)} | S11: 11 | T11: 130.169971873195 | V11: 2001-10-01 | W11: 4 | X11: 37.3 | AB11: 4 | AC11: 129 | AE11: 8 | AF11: 2001-08-01 | AG11: 4162013 | AI11: 69.25 | AJ11: 7 | AL11: 4 | AM11: 341 | AQ11: 6 | AR11: 105.954105316101 | AV11: 4 | AW11: 37.3 | AZ11: 4 | BA11: 129 | BD11: 8 | BF11: 4162013 | BH11: 69.25 | BI11: 7
A12: 117.5 | B12: 117.5 | C12: of:=ROUND([.A12];12)=ROUND([.B12];12) -> true | D12: of:=FORMULA([.A12]) -> {=FORECAST.ETS.MULT(S1:S39,T1:T39,S1:S39)} | S12: 12 | T12: 129.305702305035 | V12: 2002-01-01 | W12: 5 | X12: 46.2 | AB12: 5 | AC12: 121 | AE12: 9 | AF12: 2001-09-01 | AG12: 3809132 | AI12: 68.6 | AJ12: 8 | AL12: 5 | AM12: 382 | AQ12: 7 | AR12: 105.026989677408 | AV12: 5 | AW12: 46.2 | AZ12: 5 | BA12: 121 | BD12: 9 | BF12: 3809132 | BH12: 68.6 | BI12: 8
A13: 125.584893794301 | B13: 125.584893794301 | C13: of:=ROUND([.A13];12)=ROUND([.B13];12) -> true | D13: of:=FORMULA([.A13]) -> {=FORECAST.ETS.MULT(S1:S39,T1:T39,S1:S39)} | S13: 13 | T13: 123.587140712742 | V13: 2002-04-01 | W13: 6 | X13: 29.3 | AB13: 6 | AC13: 135 | AE13: 10 | AF13: 2001-10-01 | AG13: 3794419 | AI13: 65.05 | AJ13: 9 | AL13: 6 | AM13: 409 | AQ13: 8 | AR13: 109.479384966668 | AV13: 6 | AW13: 29.3 | AZ13: 6 | BA13: 135 | BD13: 10 | BF13: 3794419 | BH13: 65.05 | BI13: 9
A14: 130.169971873195 | B14: 130.169971873195 | C14: of:=ROUND([.A14];12)=ROUND([.B14];12) -> true | D14: of:=FORMULA([.A14]) -> {=FORECAST.ETS.MULT(S1:S39,T1:T39,S1:S39)} | S14: 14 | T14: 115.895758280092 | V14: 2002-07-01 | W14: 7 | X14: 36.5 | AB14: 7 | AC14: 148 | AE14: 11 | AF14: 2001-11-01 | AG14: 3719219 | AI14: 64.4 | AJ14: 10 | AL14: 7 | AM14: 498 | AQ14: 9 | AR14: 117.5 | AV14: 7 | AW14: 36.5 | AZ14: 7 | BA14: 148 | BD14: 11 | BF14: 3719219 | BH14: 64.4 | BI14: 10
A15: 129.305702305035 | B15: 129.305702305035 | C15: of:=ROUND([.A15];12)=ROUND([.B15];12) -> true | D15: of:=FORMULA([.A15]) -> {=FORECAST.ETS.MULT(S1:S39,T1:T39,S1:S39)} | S15: 15 | T15: 110.064393884398 | V15: 2002-10-01 | W15: 8 | X15: 43 | AB15: 8 | AC15: 148 | AE15: 12 | AF15: 2001-12-01 | AG15: 3812981 | AI15: 56.45 | AJ15: 11 | AL15: 8 | AM15: 387 | AQ15: 10 | AR15: 125.584893794301 | AV15: 8 | AW15: 43 | AZ15: 8 | BA15: 148 | BD15: 12 | BF15: 3812981 | BH15: 56.45 | BI15: 11
A16: 123.587140712742 | B16: 123.587140712742 | C16: of:=ROUND([.A16];12)=ROUND([.B16];12) -> true | D16: of:=FORMULA([.A16]) -> {=FORECAST.ETS.MULT(S1:S39,T1:T39,S1:S39)} | S16: 16 | T16: 109.083826188552 | V16: 2003-01-01 | W16: 9 | X16: 48.9 | AB16: 9 | AC16: 136 | AE16: 13 | AF16: of:=[.AF4]+365 -> 2002-01-01 | AG16: 3480451 | AI16: 48 | AJ16: 12 | AL16: 9 | AM16: 473 | AQ16: 11 | AR16: 130.169971873195 | AV16: 9 | AW16: 48.9 | AZ16: 9 | BA16: 136 | BD16: 13 | BF16: 3480451 | BH16: 48 | BI16: 12
A17: 115.895758280092 | B17: 115.895758280092 | C17: of:=ROUND([.A17];12)=ROUND([.B17];12) -> true | D17: of:=FORMULA([.A17]) -> {=FORECAST.ETS.MULT(S1:S39,T1:T39,S1:S39)} | S17: 17 | T17: 113.690130542309 | V17: 2003-04-01 | W17: 10 | X17: 31.2 | AB17: 10 | AC17: 119 | AE17: 14 | AF17: of:=[.AF5]+365 -> 2002-02-01 | AG17: 3183133 | AI17: 53.583 | AJ17: 13 | AL17: 10 | AM17: 513 | AQ17: 12 | AR17: 129.305702305035 | AV17: 10 | AW17: 31.2 | AZ17: 10 | BA17: 119 | BD17: 14 | BF17: 3183133 | BH17: 53.583 | BI17: 13
A18: 110.064393884398 | B18: 110.064393884398 | C18: of:=ROUND([.A18];12)=ROUND([.B18];12) -> true | D18: of:=FORMULA([.A18]) -> {=FORECAST.ETS.MULT(S1:S39,T1:T39,S1:S39)} | S18: 18 | T18: 122 | V18: 2003-07-01 | W18: 11 | X18: 37.7 | AB18: 11 | AC18: 104 | AE18: 15 | AF18: of:=[.AF6]+365 -> 2002-03-01 | AG18: 3764529 | AI18: 48.018 | AJ18: 14 | AL18: 11 | AM18: 582 | AQ18: 13 | AR18: 123.587140712742 | AV18: 11 | AW18: 37.7 | AZ18: 11 | BA18: 104 | BD18: 15 | BF18: 3764529 | BH18: 48.018 | BI18: 14
A19: 109.083826188552 | B19: 109.083826188552 | C19: of:=ROUND([.A19];12)=ROUND([.B19];12) -> true | D19: of:=FORMULA([.A19]) -> {=FORECAST.ETS.MULT(S1:S39,T1:T39,S1:S39)} | S19: 19 | T19: 130.37414821866 | V19: 2003-10-01 | W19: 12 | X19: 40.4 | AB19: 12 | AC19: 118 | AE19: 16 | AF19: of:=[.AF7]+365 -> 2002-04-01 | AG19: 3500189 | AI19: 62.116 | AJ19: 15 | AL19: 12 | AM19: 474 | AQ19: 14 | AR19: 115.895758280092 | AV19: 12 | AW19: 40.4 | AZ19: 12 | BA19: 118 | BD19: 16 | BF19: 3500189 | BH19: 62.116 | BI19: 15
A20: 113.690130542309 | B20: 113.690130542309 | C20: of:=ROUND([.A20];12)=ROUND([.B20];12) -> true | D20: of:=FORMULA([.A20]) -> {=FORECAST.ETS.MULT(S1:S39,T1:T39,S1:S39)} | S20: 20 | T20: 135.11313536205 | V20: 2004-01-01 | W20: 13 | X20: 51.2 | AB20: 13 | AC20: 115 | AE20: 17 | AF20: of:=[.AF8]+365 -> 2002-05-01 | AG20: 3389811 | AI20: 67.681 | AJ20: 16 | AL20: 13 | AM20: 544 | AQ20: 15 | AR20: 110.064393884398 | AV20: 13 | AW20: 51.2 | AZ20: 13 | BA20: 115 | BD20: 17 | BF20: 3389811 | BH20: 67.681 | BI20: 16
A21: 122 | B21: 122 | C21: of:=ROUND([.A21];12)=ROUND([.B21];12) -> true | D21: of:=FORMULA([.A21]) -> {=FORECAST.ETS.MULT(S1:S39,T1:T39,S1:S39)} | S21: 21 | T21: 134.195413736738 | V21: 2004-04-01 | W21: 14 | X21: 31.9 | AB21: 14 | AC21: 126 | AE21: 18 | AF21: of:=[.AF9]+365 -> 2002-06-01 | AG21: 4348789 | AI21: 66.78 | AJ21: 17 | AL21: 14 | AM21: 582 | AQ21: 16 | AR21: 109.083826188552 | AV21: 14 | AW21: 31.9 | AZ21: 14 | BA21: 126 | BD21: 18 | BF21: 4348789 | BH21: 66.78 | BI21: 17
A22: 130.37414821866 | B22: 130.37414821866 | C22: of:=ROUND([.A22];12)=ROUND([.B22];12) -> true | D22: of:=FORMULA([.A22]) -> {=FORECAST.ETS.MULT(S1:S39,T1:T39,S1:S39)} | S22: 22 | T22: 128.241049777238 | V22: 2004-07-01 | W22: 15 | X22: 41 | AB22: 15 | AC22: 141 | AE22: 19 | AF22: of:=[.AF10]+365 -> 2002-07-01 | AG22: 4442455 | AI22: 70.066 | AJ22: 18 | AL22: 15 | AM22: 681 | AO22: 1 | AQ22: 17 | AR22: 113.690130542309 | AV22: 15 | AW22: 41 | AZ22: 15 | BA22: 141 | BD22: 19 | BF22: 4442455 | BH22: 70.066 | BI22: 18
A23: 135.11313536205 | B23: 135.11313536205 | C23: of:=ROUND([.A23];12)=ROUND([.B23];12) -> true | D23: of:=FORMULA([.A23]) -> {=FORECAST.ETS.MULT(S1:S39,T1:T39,S1:S39)} | S23: 23 | T23: 120.241849215595 | V23: 2004-10-01 | W23: 16 | X23: 43.8 | AB23: 16 | AC23: 135 | AE23: 20 | AF23: of:=[.AF11]+365 -> 2002-08-01 | AG23: 4593383 | AI23: 71.073 | AJ23: 19 | AL23: 16 | AM23: 557 | AO23: 2 | AQ23: 18 | AR23: 122 | AV23: 16 | AW23: 43.8 | AZ23: 16 | BA23: 135 | BD23: 20 | BF23: 4593383 | BH23: 71.073 | BI23: 19
A24: 134.195413736738 | B24: 134.195413736738 | C24: of:=ROUND([.A24];12)=ROUND([.B24];12) -> true | D24: of:=FORMULA([.A24]) -> {=FORECAST.ETS.MULT(S1:S39,T1:T39,S1:S39)} | S24: 24 | T24: 114.174682452695 | V24: 2005-01-01 | W24: 17 | X24: 55.6 | AB24: 17 | AC24: 125 | AE24: 21 | AF24: of:=[.AF12]+365 -> 2002-09-01 | AG24: 4029783 | AI24: 76.691 | AJ24: 20 | AL24: 17 | AM24: 628 | AO24: 3 | AQ24: 19 | AR24: 130.37414821866 | AV24: 17 | AW24: 55.6 | AZ24: 17 | BA24: 125 | BD24: 21 | BF24: 4029783 | BH24: 76.691 | BI24: 20
A25: 128.241049777238 | B25: 128.241049777238 | C25: of:=ROUND([.A25];12)=ROUND([.B25];12) -> true | D25: of:=FORMULA([.A25]) -> {=FORECAST.ETS.MULT(S1:S39,T1:T39,S1:S39)} | S25: 25 | T25: 113.140662699697 | V25: 2005-04-01 | W25: 18 | X25: 33.9 | AB25: 18 | AC25: 149 | AE25: 22 | AF25: of:=[.AF13]+365 -> 2002-10-01 | AG25: 4211211 | AI25: 66.992 | AJ25: 21 | AL25: 18 | AM25: 707 | AO25: 4 | AQ25: 20 | AR25: 135.11313536205 | AV25: 18 | AW25: 33.9 | AZ25: 18 | BA25: 149 | BD25: 22 | BF25: 4211211 | BH25: 66.992 | BI25: 21
A26: 120.241849215595 | B26: 120.241849215595 | C26: of:=ROUND([.A26];12)=ROUND([.B26];12) -> true | D26: of:=FORMULA([.A26]) -> {=FORECAST.ETS.MULT(S1:S39,T1:T39,S1:S39)} | S26: 26 | T26: 117.90087611795 | V26: 2005-07-01 | W26: 19 | X26: 42.1 | AB26: 19 | AC26: 170 | AE26: 23 | AF26: of:=[.AF14]+365 -> 2002-11-01 | AG26: 3854682 | AI26: 61.533 | AJ26: 22 | AL26: 19 | AM26: 773 | AO26: 5 | AQ26: 21 | AR26: 134.195413736738 | AV26: 19 | AW26: 42.1 | AZ26: 19 | BA26: 170 | BD26: 23 | BF26: 3854682 | BH26: 61.533 | BI26: 22
A27: 114.174682452695 | B27: 114.174682452695 | C27: of:=ROUND([.A27];12)=ROUND([.B27];12) -> true | D27: of:=FORMULA([.A27]) -> {=FORECAST.ETS.MULT(S1:S39,T1:T39,S1:S39)} | S27: 27 | T27: 126.5 | V27: 2005-10-01 | W27: 20 | X27: 45.6 | AB27: 20 | AC27: 170 | AE27: 24 | AF27: of:=[.AF15]+365 -> 2002-12-01 | AG27: 3554831 | AI27: 62.275 | AJ27: 23 | AL27: 20 | AM27: 592 | AO27: 6 | AQ27: 22 | AR27: 128.241049777238 | AV27: 20 | AW27: 45.6 | AZ27: 20 | BA27: 170 | BD27: 24 | BF27: 3554831 | BH27: 62.275 | BI27: 23
A28: 113.140662699697 | B28: 113.140662699697 | C28: of:=ROUND([.A28];12)=ROUND([.B28];12) -> true | D28: of:=FORMULA([.A28]) -> {=FORECAST.ETS.MULT(S1:S39,T1:T39,S1:S39)} | S28: 28 | T28: 135.163402643019 | V28: 2006-01-01 | W28: 21 | X28: 59.8 | AB28: 21 | AC28: 158 | AE28: 25 | AF28: of:=[.AF16]+365 -> 2003-01-01 | AG28: 3488309 | AI28: 51.675 | AJ28: 24 | AL28: 21 | AM28: 627 | AO28: 7 | AQ28: 23 | AR28: 120.241849215595 | AV28: 21 | AW28: 59.8 | AZ28: 21 | BA28: 158 | BD28: 25 | BF28: 3488309 | BH28: 51.675 | BI28: 24
A29: 117.90087611795 | B29: 117.90087611795 | C29: of:=ROUND([.A29];12)=ROUND([.B29];12) -> true | D29: of:=FORMULA([.A29]) -> {=FORECAST.ETS.MULT(S1:S39,T1:T39,S1:S39)} | S29: 29 | T29: 140.056298850906 | V29: 2006-04-01 | W29: 22 | X29: 35.2 | AB29: 22 | AC29: 133 | AE29: 26 | AF29: of:=[.AF17]+365 -> 2003-02-01 | AG29: 3270444 | AI29: 60.146 | AJ29: 25 | AL29: 22 | AM29: 725 | AO29: 8 | AQ29: 24 | AR29: 114.174682452695 | AV29: 22 | AW29: 35.2 | AZ29: 22 | BA29: 133 | BD29: 26 | BF29: 3270444 | BH29: 60.146 | BI29: 25
A30: 126.5 | B30: 126.5 | C30: of:=ROUND([.A30];12)=ROUND([.B30];12) -> true | D30: of:=FORMULA([.A30]) -> {=FORECAST.ETS.MULT(S1:S39,T1:T39,S1:S39)} | S30: 30 | T30: 139.085125168441 | V30: 2006-07-01 | W30: 23 | X30: 44.3 | AB30: 23 | AC30: 114 | AE30: 27 | AF30: of:=[.AF18]+365 -> 2003-03-01 | AG30: 3709943 | AI30: 56.434 | AJ30: 26 | AL30: 23 | AM30: 854 | AQ30: 25 | AR30: 113.140662699697 | AV30: 23 | AW30: 44.3 | AZ30: 23 | BA30: 114 | BD30: 27 | BF30: 3709943 | BH30: 56.434 | BI30: 26
A31: 135.163402643019 | B31: 135.163402643019 | C31: of:=ROUND([.A31];12)=ROUND([.B31];12) -> true | D31: of:=FORMULA([.A31]) -> {=FORECAST.ETS.MULT(S1:S39,T1:T39,S1:S39)} | S31: 31 | T31: 132.894958841735 | V31: 2006-10-01 | W31: 24 | X31: 47.9 | AB31: 24 | AC31: 140 | AE31: 28 | AF31: of:=[.AF19]+365 -> 2003-04-01 | AG31: 3655530 | AI31: 67.222 | AJ31: 27 | AL31: 24 | AM31: 661 | AQ31: 26 | AR31: 117.90087611795 | AV31: 24 | AW31: 47.9 | AZ31: 24 | BA31: 140 | BD31: 28 | BF31: 3655530 | BH31: 67.222 | BI31: 27
A32: 140.056298850906 | B32: 140.056298850906 | C32: of:=ROUND([.A32];12)=ROUND([.B32];12) -> true | D32: of:=FORMULA([.A32]) -> {=FORECAST.ETS.MULT(S1:S39,T1:T39,S1:S39)} | S32: 32 | T32: 124.587940151099 | V32: 2007-01-01 | W32: 25 | AB32: 25 | AC32: 145 | AE32: 29 | AF32: of:=[.AF20]+365 -> 2003-05-01 | AG32: 4097990 | AI32: 70.76 | AJ32: 28 | AQ32: 27 | AR32: 126.5 | AZ32: 25 | BA32: 145 | BD32: 29 | BF32: 4097990 | BH32: 70.76 | BI32: 28
A33: 139.085125168441 | B33: 139.085125168441 | C33: of:=ROUND([.A33];12)=ROUND([.B33];12) -> true | D33: of:=FORMULA([.A33]) -> {=FORECAST.ETS.MULT(S1:S39,T1:T39,S1:S39)} | S33: 33 | T33: 118.284971020992 | V33: 2007-04-01 | W33: 26 | AB33: 26 | AC33: 150 | AE33: 30 | AF33: of:=[.AF21]+365 -> 2003-06-01 | AG33: 4472583 | AI33: 73.95 | AJ33: 29 | AQ33: 28 | AR33: 135.163402643019 | AT33: 1 | AZ33: 26 | BA33: 150 | BD33: 30 | BF33: 4472583 | BH33: 73.95 | BI33: 29
A34: 132.894958841735 | B34: 132.894958841735 | C34: of:=ROUND([.A34];12)=ROUND([.B34];12) -> true | D34: of:=FORMULA([.A34]) -> {=FORECAST.ETS.MULT(S1:S39,T1:T39,S1:S39)} | S34: 34 | T34: 117.197499210841 | V34: 2007-07-01 | W34: 27 | AB34: 27 | AC34: 178 | AE34: 31 | AF34: of:=[.AF22]+365 -> 2003-07-01 | AG34: 4531711 | AI34: 79.286 | AJ34: 30 | AQ34: 29 | AR34: 140.056298850906 | AT34: 2 | AZ34: 27 | BA34: 178 | BD34: 31 | BF34: 4531711 | BH34: 79.286 | BI34: 30
A35: 124.587940151099 | B35: 124.587940151099 | C35: of:=ROUND([.A35];12)=ROUND([.B35];12) -> true | D35: of:=FORMULA([.A35]) -> {=FORECAST.ETS.MULT(S1:S39,T1:T39,S1:S39)} | S35: 35 | T35: 122.111621693591 | V35: 2007-10-01 | W35: 28 | AB35: 28 | AC35: 163 | AE35: 32 | AF35: of:=[.AF23]+365 -> 2003-08-01 | AG35: 4504466 | AI35: 77.372 | AJ35: 31 | AQ35: 30 | AR35: 139.085125168441 | AT35: 3 | AZ35: 28 | BA35: 163 | BD35: 32 | BF35: 4504466 | BH35: 77.372 | BI35: 31
A36: 118.284971020992 | B36: 118.284971020992 | C36: of:=ROUND([.A36];12)=ROUND([.B36];12) -> true | D36: of:=FORMULA([.A36]) -> {=FORECAST.ETS.MULT(S1:S39,T1:T39,S1:S39)} | S36: 36 | T36: 131 | V36: 2008-01-01 | W36: 29 | AB36: 29 | AC36: 172 | AE36: 33 | AF36: of:=[.AF24]+365 -> 2003-09-01 | AG36: 4054338 | AI36: 79.808 | AJ36: 32 | AQ36: 31 | AR36: 132.894958841735 | AT36: 4 | AZ36: 29 | BA36: 172 | BD36: 33 | BF36: 4054338 | BH36: 79.808 | BI36: 32
A37: 117.197499210841 | B37: 117.197499210841 | C37: of:=ROUND([.A37];12)=ROUND([.B37];12) -> true | D37: of:=FORMULA([.A37]) -> {=FORECAST.ETS.MULT(S1:S39,T1:T39,S1:S39)} | S37: 37 | T37: 139.952657067378 | V37: 2008-04-01 | W37: 30 | AB37: 30 | AC37: 178 | AE37: 34 | AF37: of:=[.AF25]+365 -> 2003-10-01 | AI37: 71.978 | AJ37: 33 | AQ37: 32 | AR37: 124.587940151099 | AT37: 5 | AZ37: 30 | BA37: 178 | BD37: 34 | BH37: 71.978 | BI37: 33
A38: 122.111621693591 | B38: 122.111621693591 | C38: of:=ROUND([.A38];12)=ROUND([.B38];12) -> true | D38: of:=FORMULA([.A38]) -> {=FORECAST.ETS.MULT(S1:S39,T1:T39,S1:S39)} | S38: 38 | T38: 144.999462339761 | V38: 2008-07-01 | W38: 31 | AB38: 31 | AC38: 199 | AE38: 35 | AF38: of:=[.AF26]+365 -> 2003-11-01 | AI38: 70.702 | AJ38: 34 | AQ38: 33 | AR38: 118.284971020992 | AT38: 6 | AZ38: 31 | BA38: 199 | BD38: 35 | BH38: 70.702 | BI38: 34
A39: 131 | B39: 131 | C39: of:=ROUND([.A39];12)=ROUND([.B39];12) -> true | D39: of:=FORMULA([.A39]) -> {=FORECAST.ETS.MULT(S1:S39,T1:T39,S1:S39)} | S39: 39 | T39: 143.974836600144 | V39: 2008-10-01 | W39: 32 | AB39: 32 | AC39: 199 | AE39: 36 | AF39: of:=[.AF27]+365 -> 2003-12-01 | AI39: 65.946 | AJ39: 35 | AQ39: 34 | AR39: 117.197499210841 | AT39: 7 | AZ39: 32 | BA39: 199 | BD39: 36 | BH39: 65.946 | BI39: 35
A40: 139.952657067378 | B40: 139.952657067378 | C40: of:=ROUND([.A40];12)=ROUND([.B40];12) -> true | D40: of:=FORMULA([.A40]) -> {=FORECAST.ETS.MULT(S1:S39,T1:T39,S1:S39)} | V40: 2009-01-01 | W40: 33 | AB40: 33 | AC40: 184 | AE40: 37 | AF40: of:=[.AF28]+365 -> 2004-01-01 | AI40: 55.274 | AJ40: 36 | AQ40: 35 | AR40: 122.111621693591 | AT40: 8 | AZ40: 33 | BA40: 184 | BD40: 37 | BH40: 55.274 | BI40: 36
A41: 144.999462339761 | B41: 144.999462339761 | C41: of:=ROUND([.A41];12)=ROUND([.B41];12) -> true | D41: of:=FORMULA([.A41]) -> {=FORECAST.ETS.MULT(S1:S39,T1:T39,S1:S39)} | V41: 2009-04-01 | W41: 34 | AB41: 34 | AC41: 162 | AE41: 38 | AF41: of:=[.AF29]+365 -> 2004-02-01 | AI41: 61.08 | AJ41: 37 | AQ41: 36 | AR41: 131 | AZ41: 34 | BA41: 162 | BD41: 38 | BH41: 61.08 | BI41: 37
A42: 143.974836600144 | B42: 143.974836600144 | C42: of:=ROUND([.A42];12)=ROUND([.B42];12) -> true | D42: of:=FORMULA([.A42]) -> {=FORECAST.ETS.MULT(S1:S39,T1:T39,S1:S39)} | AB42: 35 | AC42: 146 | AE42: 39 | AF42: of:=[.AF30]+365 -> 2004-02-29 | AI42: 59.7 | AJ42: 38 | AQ42: 37 | AR42: 139.952657067378 | AZ42: 35 | BA42: 146 | BD42: 39 | BH42: 59.7 | BI42: 38
A43: of:=ORG.LIBREOFFICE.FORECAST.ETS.MULT(0;[.P2:.P6];[.Q2:.Q6]) ->  | B43: #NUM! | C43: of:=ISERROR([.A43]) -> true | D43: of:=FORMULA([.A43]) -> =FORECAST.ETS.MULT(0,P2:P6,Q2:Q6) | AB43: 36 | AC43: 166 | AE43: 40 | AF43: of:=[.AF31]+365 -> 2004-03-31 | AI43: 69.48 | AJ43: 39 | AQ43: 38 | AR43: 144.999462339761 | AZ43: 36 | BA43: 166 | BD43: 40 | BH43: 69.48 | BI43: 39
A44: of:=ORG.LIBREOFFICE.FORECAST.ETS.MULT(-30;[.P2:.P6];[.Q2:.Q6]) ->  | B44: #NUM! | C44: of:=ISERROR([.A44]) -> true | D44: of:=FORMULA([.A44]) -> =FORECAST.ETS.MULT(-30,P2:P6,Q2:Q6) | AB44: 37 | AE44: 41 | AF44: of:=[.AF32]+365 -> 2004-04-30 | AI44: 77.34 | AJ44: 40 | AQ44: 39 | AR44: 143.974836600144 | BD44: 41 | BH44: 77.34 | BI44: 40
A45: of:=ORG.LIBREOFFICE.FORECAST.ETS.MULT(8; {1;2;3}; {4;5;6}) -> 5 | B45: 5 | C45: of:=ROUND([.A45];12)=ROUND([.B45];12) -> true | D45: of:=FORMULA([.A45]) -> =FORECAST.ETS.MULT(8, {1,2,3}, {4,5,6}) | AB45: 38 | AE45: 42 | AF45: of:=[.AF33]+365 -> 2004-05-31 | AI45: 74.16 | AJ45: 41 | BD45: 42 | BH45: 74.16 | BI45: 41
A46: of:=ORG.LIBREOFFICE.FORECAST.ETS.MULT(7; {5.8;-1}; {2;-5}) ->  | B46: #VALUE! | C46: of:=ISERROR([.A46]) -> true | D46: of:=FORMULA([.A46]) -> =FORECAST.ETS.MULT(7, {5.8,-1}, {2,-5}) | AB46: 39 | AE46: 43 | AF46: of:=[.AF34]+365 -> 2004-06-30 | AI46: 83.04 | AJ46: 42 | BD46: 43 | BH46: 83.04 | BI46: 42
A47: of:=ORG.LIBREOFFICE.FORECAST.ETS.MULT(50; {-1;-2;-3;-4}; {10;20;30;40}) -> -5 | B47: -5 | C47: of:=ROUND([.A47];12)=ROUND([.B47];12) -> true | D47: of:=FORMULA([.A47]) -> =FORECAST.ETS.MULT(50, {-1,-2,-3,-4}, {10,20,30,40}) | AB47: 40 | AE47: 44 | AF47: of:=[.AF35]+365 -> 2004-07-31 | AI47: 80.16 | AJ47: 43 | BD47: 44 | BH47: 80.16 | BI47: 43
A48: of:=ORG.LIBREOFFICE.FORECAST.ETS.MULT([.V31:.V41];[.X8:.X31];[.V8:.V31];[.W3];[.W4];[.W5]) -> 47.9 | B48: 47.9 | C48: of:=ROUND([.A48];12)=ROUND([.B48];12) -> true | D48: of:=FORMULA([.A48]) -> {=FORECAST.ETS.MULT(V31:V41,X8:X31,V8:V31,W3,W4,W5)} | AB48: 41 | AE48: 45 | AF48: of:=[.AF36]+365 -> 2004-08-31 | AI48: 81.12 | AJ48: 44 | BD48: 45 | BH48: 81.12 | BI48: 44
A49: 61.9729295871504 | B49: 61.97292958715045 | C49: of:=ROUND([.A49];12)=ROUND([.B49];12) -> true | D49: of:=FORMULA([.A49]) -> {=FORECAST.ETS.MULT(V31:V41,X8:X31,V8:V31,W3,W4,W5)} | AB49: 42 | AE49: 46 | AF49: of:=[.AF37]+365 -> 2004-09-30 | AI49: 84.12 | AJ49: 45 | BD49: 46 | BH49: 84.12 | BI49: 45
A50: 36.8217963889502 | B50: 36.8217963889502 | C50: of:=ROUND([.A50];12)=ROUND([.B50];12) -> true | D50: of:=FORMULA([.A50]) -> {=FORECAST.ETS.MULT(V31:V41,X8:X31,V8:V31,W3,W4,W5)} | AB50: 43 | AE50: 47 | AF50: of:=[.AF38]+365 -> 2004-10-31 | AI50: 69 | AJ50: 46 | BD50: 47 | BH50: 69 | BI50: 46
A51: 46.4784787396254 | B51: 46.4784787396254 | C51: of:=ROUND([.A51];12)=ROUND([.B51];12) -> true | D51: of:=FORMULA([.A51]) -> {=FORECAST.ETS.MULT(V31:V41,X8:X31,V8:V31,W3,W4,W5)} | AB51: 44 | AE51: 48 | AF51: of:=[.AF39]+365 -> 2004-11-30 | AI51: 68.4 | AJ51: 47 | BD51: 48 | BH51: 68.4 | BI51: 47
A52: 50.5782852506606 | B52: 50.5782852506606 | C52: of:=ROUND([.A52];12)=ROUND([.B52];12) -> true | D52: of:=FORMULA([.A52]) -> {=FORECAST.ETS.MULT(V31:V41,X8:X31,V8:V31,W3,W4,W5)} | AB52: 45 | AE52: 49 | AF52: of:=[.AF40]+366 -> 2005-01-01 | AI52: 54.54 | AJ52: 48 | BD52: 49 | BH52: 54.54 | BI52: 48
A53: 65.1381523477569 | B53: 65.1381523477569 | C53: of:=ROUND([.A53];12)=ROUND([.B53];12) -> true | D53: of:=FORMULA([.A53]) -> {=FORECAST.ETS.MULT(V31:V41,X8:X31,V8:V31,W3,W4,W5)} | AB53: 46 | AE53: 50 | AF53: of:=[.AF41]+366 -> 2005-02-01 | AI53: 66.624 | AJ53: 49 | BD53: 50 | BH53: 66.624 | BI53: 49
A54: 38.6787327078871 | B54: 38.6787327078871 | C54: of:=ROUND([.A54];12)=ROUND([.B54];12) -> true | D54: of:=FORMULA([.A54]) -> {=FORECAST.ETS.MULT(V31:V41,X8:X31,V8:V31,W3,W4,W5)} | AB54: 47 | AE54: 51 | AF54: of:=[.AF42]+366 -> 2005-03-01 | AI54: 58.048 | AJ54: 50 | BD54: 51 | BH54: 58.048 | BI54: 50
A55: 48.7932216644061 | B55: 48.7932216644061 | C55: of:=ROUND([.A55];12)=ROUND([.B55];12) -> true | D55: of:=FORMULA([.A55]) -> {=FORECAST.ETS.MULT(V31:V41,X8:X31,V8:V31,W3,W4,W5)} | AB55: 48 | AE55: 52 | AF55: of:=[.AF43]+366 -> 2005-04-01 | AI55: 70.528 | AJ55: 51 | BD55: 52 | BH55: 70.528 | BI55: 51
A56: 53.0662321817619 | B56: 53.0662321817619 | C56: of:=ROUND([.A56];12)=ROUND([.B56];12) -> true | D56: of:=FORMULA([.A56]) -> {=FORECAST.ETS.MULT(V31:V41,X8:X31,V8:V31,W3,W4,W5)} | AB56: 49 | AE56: 53 | AF56: of:=[.AF44]+366 -> 2005-05-01 | AI56: 79.424 | AJ56: 52 | BD56: 53 | BH56: 79.424 | BI56: 52
A57: 68.3033751083634 | B57: 68.3033751083634 | C57: of:=ROUND([.A57];11)=ROUND([.B57];11) -> true | D57: of:=FORMULA([.A57]) -> {=FORECAST.ETS.MULT(V31:V41,X8:X31,V8:V31,W3,W4,W5)} | F57: of:=ORG.LIBREOFFICE.RAWSUBTRACT(ROUND([.B57];12);ROUND([.A57];12)) -> -0.00000000000099475983006414 | G57: of:=INT(-LOG(ABS(ORG.LIBREOFFICE.RAWSUBTRACT([.B57];[.A57])))-2) -> 11 | AB57: 50 | AE57: 54 | AF57: of:=[.AF45]+366 -> 2005-06-01 | AI57: 79.232 | AJ57: 53 | BD57: 54 | BH57: 79.232 | BI57: 53
A58: 40.535669026824 | B58: 40.535669026824 | C58: of:=ROUND([.A58];12)=ROUND([.B58];12) -> true | D58: of:=FORMULA([.A58]) -> {=FORECAST.ETS.MULT(V31:V41,X8:X31,V8:V31,W3,W4,W5)} | AB58: 51 | AE58: 55 | AF58: of:=[.AF46]+366 -> 2005-07-01 | AI58: 93.056 | AJ58: 54 | BD58: 55 | BH58: 93.056 | BI58: 54
A59: of:=ORG.LIBREOFFICE.FORECAST.ETS.MULT([.AB43:.AB70];[.AC8:.AC43];[.AB8:.AB43];[.AB3];[.AB4];[.AB5]) -> 166 | B59: 166 | C59: of:=ROUND([.A59];12)=ROUND([.B59];12) -> true | D59: of:=FORMULA([.A59]) -> {=FORECAST.ETS.MULT(AB43:AB70,AC8:AC43,AB8:AB43,AB3,AB4,AB5)} | AB59: 52 | AE59: 56 | AF59: of:=[.AF47]+366 -> 2005-08-01 | AI59: 93.76 | AJ59: 55 | BD59: 56 | BH59: 93.76 | BI59: 55
A60: 173.745949032818 | B60: 173.745949032818 | C60: of:=ROUND([.A60];12)=ROUND([.B60];12) -> true | D60: of:=FORMULA([.A60]) -> {=FORECAST.ETS.MULT(AB43:AB70,AC8:AC43,AB8:AB43,AB3,AB4,AB5)} | AB60: 53 | AE60: 57 | AF60: of:=[.AF48]+366 -> 2005-09-01 | AI60: 93.696 | AJ60: 56 | BD60: 57 | BH60: 93.696 | BI60: 56
A61: 183.787265957111 | B61: 183.787265957111 | C61: of:=ROUND([.A61];12)=ROUND([.B61];12) -> true | D61: of:=FORMULA([.A61]) -> {=FORECAST.ETS.MULT(AB43:AB70,AC8:AC43,AB8:AB43,AB3,AB4,AB5)} | AB61: 54 | AE61: 58 | AF61: of:=[.AF49]+366 -> 2005-10-01 | AI61: 94.08 | AJ61: 57 | BD61: 58 | BH61: 94.08 | BI61: 57
A62: 206.399165266807 | B62: 206.399165266807 | C62: of:=ROUND([.A62];12)=ROUND([.B62];12) -> true | D62: of:=FORMULA([.A62]) -> {=FORECAST.ETS.MULT(AB43:AB70,AC8:AC43,AB8:AB43,AB3,AB4,AB5)} | AB62: 55 | AE62: 59 | AF62: of:=[.AF50]+366 -> 2005-11-01 | AI62: 82.624 | AJ62: 58 | BD62: 59 | BH62: 82.624 | BI62: 58
A63: 202.483337817381 | B63: 202.483337817381 | C63: of:=ROUND([.A63];12)=ROUND([.B63];12) -> true | D63: of:=FORMULA([.A63]) -> {=FORECAST.ETS.MULT(AB43:AB70,AC8:AC43,AB8:AB43,AB3,AB4,AB5)} | AB63: 56 | AE63: 60 | AF63: of:=[.AF51]+366 -> 2005-12-01 | AI63: 75.776 | AJ63: 59 | BD63: 60 | BH63: 75.776 | BI63: 59
A64: 190.641123921525 | B64: 190.641123921525 | C64: of:=ROUND([.A64];12)=ROUND([.B64];12) -> true | D64: of:=FORMULA([.A64]) -> {=FORECAST.ETS.MULT(AB43:AB70,AC8:AC43,AB8:AB43,AB3,AB4,AB5)} | AB64: 57 | AI64: 58.048 | AJ64: 60 | BH64: 58.048 | BI64: 60
A65: 213.483211306267 | B65: 213.483211306267 | C65: of:=ROUND([.A65];12)=ROUND([.B65];12) -> true | D65: of:=FORMULA([.A65]) -> {=FORECAST.ETS.MULT(AB43:AB70,AC8:AC43,AB8:AB43,AB3,AB4,AB5)} | AB65: 58 | AJ65: 61 | BI65: 61
A66: 234.886744883615 | B66: 234.886744883615 | C66: of:=ROUND([.A66];12)=ROUND([.B66];12) -> true | D66: of:=FORMULA([.A66]) -> {=FORECAST.ETS.MULT(AB43:AB70,AC8:AC43,AB8:AB43,AB3,AB4,AB5)} | AB66: 59 | AJ66: 62 | BI66: 62
A67: 235.718895043652 | B67: 235.718895043652 | C67: of:=ROUND([.A67];12)=ROUND([.B67];12) -> true | D67: of:=FORMULA([.A67]) -> {=FORECAST.ETS.MULT(AB43:AB70,AC8:AC43,AB8:AB43,AB3,AB4,AB5)} | AB67: 60 | AJ67: 63 | BI67: 63
A68: 217.358909191697 | B68: 217.358909191697 | C68: of:=ROUND([.A68];12)=ROUND([.B68];12) -> true | D68: of:=FORMULA([.A68]) -> {=FORECAST.ETS.MULT(AB43:AB70,AC8:AC43,AB8:AB43,AB3,AB4,AB5)} | AB68: 61 | AJ68: 64 | BI68: 64
A69: 190.836835067215 | B69: 190.836835067215 | C69: of:=ROUND([.A69];12)=ROUND([.B69];12) -> true | D69: of:=FORMULA([.A69]) -> {=FORECAST.ETS.MULT(AB43:AB70,AC8:AC43,AB8:AB43,AB3,AB4,AB5)} | AB69: 62 | AJ69: 65 | BI69: 65
A70: 167.338929526706 | B70: 167.338929526706 | C70: of:=ROUND([.A70];12)=ROUND([.B70];12) -> true | D70: of:=FORMULA([.A70]) -> {=FORECAST.ETS.MULT(AB43:AB70,AC8:AC43,AB8:AB43,AB3,AB4,AB5)} | AB70: 63 | AJ70: 66 | BI70: 66
A71: 190.487537765425 | B71: 190.487537765425 | C71: of:=ROUND([.A71];12)=ROUND([.B71];12) -> true | D71: of:=FORMULA([.A71]) -> {=FORECAST.ETS.MULT(AB43:AB70,AC8:AC43,AB8:AB43,AB3,AB4,AB5)} | AJ71: 67 | BI71: 67
A72: 200.127359722618 | B72: 200.127359722618 | C72: of:=ROUND([.A72];12)=ROUND([.B72];12) -> true | D72: of:=FORMULA([.A72]) -> {=FORECAST.ETS.MULT(AB43:AB70,AC8:AC43,AB8:AB43,AB3,AB4,AB5)} | AJ72: 68 | BI72: 68
A73: 211.344649681028 | B73: 211.344649681028 | C73: of:=ROUND([.A73];12)=ROUND([.B73];12) -> true | D73: of:=FORMULA([.A73]) -> {=FORECAST.ETS.MULT(AB43:AB70,AC8:AC43,AB8:AB43,AB3,AB4,AB5)} | AJ73: 69 | BI73: 69
A74: 236.965090983393 | B74: 236.965090983393 | C74: of:=ROUND([.A74];12)=ROUND([.B74];12) -> true | D74: of:=FORMULA([.A74]) -> {=FORECAST.ETS.MULT(AB43:AB70,AC8:AC43,AB8:AB43,AB3,AB4,AB5)} | AJ74: 70 | BI74: 70
A75: 232.103818773717 | B75: 232.103818773717 | C75: of:=ROUND([.A75];12)=ROUND([.B75];12) -> true | D75: of:=FORMULA([.A75]) -> {=FORECAST.ETS.MULT(AB43:AB70,AC8:AC43,AB8:AB43,AB3,AB4,AB5)} | AJ75: 71 | BI75: 71
A76: 218.193378775663 | B76: 218.193378775663 | C76: of:=ROUND([.A76];12)=ROUND([.B76];12) -> true | D76: of:=FORMULA([.A76]) -> {=FORECAST.ETS.MULT(AB43:AB70,AC8:AC43,AB8:AB43,AB3,AB4,AB5)} | AJ76: 72 | BI76: 72
A77: 243.969532849646 | B77: 243.969532849646 | C77: of:=ROUND([.A77];12)=ROUND([.B77];12) -> true | D77: of:=FORMULA([.A77]) -> {=FORECAST.ETS.MULT(AB43:AB70,AC8:AC43,AB8:AB43,AB3,AB4,AB5)} | AJ77: 73 | BI77: 73
A78: 268.03510577085 | B78: 268.03510577085 | C78: of:=ROUND([.A78];12)=ROUND([.B78];12) -> true | D78: of:=FORMULA([.A78]) -> {=FORECAST.ETS.MULT(AB43:AB70,AC8:AC43,AB8:AB43,AB3,AB4,AB5)} | AJ78: 74 | BI78: 74
A79: 268.598021151221 | B79: 268.598021151221 | C79: of:=ROUND([.A79];11)=ROUND([.B79];11) -> true | D79: of:=FORMULA([.A79]) -> {=FORECAST.ETS.MULT(AB43:AB70,AC8:AC43,AB8:AB43,AB3,AB4,AB5)} | AJ79: 75 | BI79: 75
A80: 247.328741800136 | B80: 247.328741800136 | C80: of:=ROUND([.A80];12)=ROUND([.B80];12) -> true | D80: of:=FORMULA([.A80]) -> {=FORECAST.ETS.MULT(AB43:AB70,AC8:AC43,AB8:AB43,AB3,AB4,AB5)} | AJ80: 76 | BI80: 76
A81: 216.850852063095 | B81: 216.850852063095 | C81: of:=ROUND([.A81];12)=ROUND([.B81];12) -> true | D81: of:=FORMULA([.A81]) -> {=FORECAST.ETS.MULT(AB43:AB70,AC8:AC43,AB8:AB43,AB3,AB4,AB5)} | AJ81: 77 | BI81: 77
A82: 189.893605332791 | B82: 189.893605332791 | C82: of:=ROUND([.A82];12)=ROUND([.B82];12) -> true | D82: of:=FORMULA([.A82]) -> {=FORECAST.ETS.MULT(AB43:AB70,AC8:AC43,AB8:AB43,AB3,AB4,AB5)} | AJ82: 78 | BI82: 78
A83: 215.877108165921 | B83: 215.877108165921 | C83: of:=ROUND([.A83];12)=ROUND([.B83];12) -> true | D83: of:=FORMULA([.A83]) -> {=FORECAST.ETS.MULT(AB43:AB70,AC8:AC43,AB8:AB43,AB3,AB4,AB5)} | AJ83: 79 | BI83: 79
A84: 226.508770412417 | B84: 226.508770412417 | C84: of:=ROUND([.A84];12)=ROUND([.B84];12) -> true | D84: of:=FORMULA([.A84]) -> {=FORECAST.ETS.MULT(AB43:AB70,AC8:AC43,AB8:AB43,AB3,AB4,AB5)} | AJ84: 80 | BI84: 80
A85: 238.902033404945 | B85: 238.902033404945 | C85: of:=ROUND([.A85];12)=ROUND([.B85];12) -> true | D85: of:=FORMULA([.A85]) -> {=FORECAST.ETS.MULT(AB43:AB70,AC8:AC43,AB8:AB43,AB3,AB4,AB5)} | AJ85: 81 | BI85: 81
A86: 267.531016699980 | B86: 267.531016699980 | C86: of:=ROUND([.A86];12)=ROUND([.B86];12) -> true | D86: of:=FORMULA([.A86]) -> {=FORECAST.ETS.MULT(AB43:AB70,AC8:AC43,AB8:AB43,AB3,AB4,AB5)} | AJ86: 82 | BI86: 82
A87: of:=ORG.LIBREOFFICE.FORECAST.ETS.MULT([.AE36:.AE63];[.AG4:.AG36];[.AE4:.AE36];12;1;1) -> 4054338 | B87: 4054338 | C87: of:=ROUND([.A87];12)=ROUND([.B87];12) -> true | D87: of:=FORMULA([.A87]) -> {=FORECAST.ETS.MULT(AE36:AE63,AG4:AG36,AE4:AE36,12,1,1)} | AJ87: 83 | BI87: 83
A88: 4288601.49523545 | B88: 4288601.49523545 | C88: of:=ROUND([.A88];12)=ROUND([.B88];12) -> true | D88: of:=FORMULA([.A88]) -> {=FORECAST.ETS.MULT(AE36:AE63,AG4:AG36,AE4:AE36,12,1,1)} | AJ88: 84 | BI88: 84
A89: 4091199.55229487 | B89: 4091199.55229487 | C89: of:=ROUND([.A89];12)=ROUND([.B89];12) -> true | D89: of:=FORMULA([.A89]) -> {=FORECAST.ETS.MULT(AE36:AE63,AG4:AG36,AE4:AE36,12,1,1)} | AJ89: 85 | BI89: 85
A90: 4038561.97098737 | B90: 4038561.97098737 | C90: of:=ROUND([.A90];12)=ROUND([.B90];12) -> true | D90: of:=FORMULA([.A90]) -> {=FORECAST.ETS.MULT(AE36:AE63,AG4:AG36,AE4:AE36,12,1,1)} | AJ90: 86 | BI90: 86
A91: 3779986.30181304 | B91: 3779986.30181304 | C91: of:=ROUND([.A91];12)=ROUND([.B91];12) -> true | D91: of:=FORMULA([.A91]) -> {=FORECAST.ETS.MULT(AE36:AE63,AG4:AG36,AE4:AE36,12,1,1)} | AJ91: 87 | BI91: 87
A92: 3387827.28877104 | B92: 3387827.28877104 | C92: of:=ROUND([.A92];12)=ROUND([.B92];12) -> true | D92: of:=FORMULA([.A92]) -> {=FORECAST.ETS.MULT(AE36:AE63,AG4:AG36,AE4:AE36,12,1,1)} | AJ92: 88 | BI92: 88
A93: 3815736.59044792 | B93: 3815736.59044792 | C93: of:=ROUND([.A93];12)=ROUND([.B93];12) -> true | D93: of:=FORMULA([.A93]) -> {=FORECAST.ETS.MULT(AE36:AE63,AG4:AG36,AE4:AE36,12,1,1)} | AJ93: 89 | BI93: 89
A94: 3927934.74841799 | B94: 3927934.74841799 | C94: of:=ROUND([.A94];12)=ROUND([.B94];12) -> true | D94: of:=FORMULA([.A94]) -> {=FORECAST.ETS.MULT(AE36:AE63,AG4:AG36,AE4:AE36,12,1,1)} | AJ94: 90 | BI94: 90
A95: 4208549.03819637 | B95: 4208549.03819637 | C95: of:=ROUND([.A95];12)=ROUND([.B95];12) -> true | D95: of:=FORMULA([.A95]) -> {=FORECAST.ETS.MULT(AE36:AE63,AG4:AG36,AE4:AE36,12,1,1)} | AJ95: 91 | BI95: 91
A96: 4719235.05761799 | B96: 4719235.05761799 | C96: of:=ROUND([.A96];12)=ROUND([.B96];12) -> true | D96: of:=FORMULA([.A96]) -> {=FORECAST.ETS.MULT(AE36:AE63,AG4:AG36,AE4:AE36,12,1,1)} | AJ96: 92 | BI96: 92
A97: 4846987.32895276 | B97: 4846987.32895276 | C97: of:=ROUND([.A97];12)=ROUND([.B97];12) -> true | D97: of:=FORMULA([.A97]) -> {=FORECAST.ETS.MULT(AE36:AE63,AG4:AG36,AE4:AE36,12,1,1)} | AJ97: 93 | BI97: 93
A98: 4876844.61506186 | B98: 4876844.61506186 | C98: of:=ROUND([.A98];12)=ROUND([.B98];12) -> true | D98: of:=FORMULA([.A98]) -> {=FORECAST.ETS.MULT(AE36:AE63,AG4:AG36,AE4:AE36,12,1,1)} | AJ98: 94 | BI98: 94
A99: 4465507.06401322 | B99: 4465507.06401322 | C99: of:=ROUND([.A99];12)=ROUND([.B99];12) -> true | D99: of:=FORMULA([.A99]) -> {=FORECAST.ETS.MULT(AE36:AE63,AG4:AG36,AE4:AE36,12,1,1)} | AJ99: 95 | BI99: 95
A100: 4527918.73243619 | B100: 4527918.73243619 | C100: of:=ROUND([.A100];12)=ROUND([.B100];12) -> true | D100: of:=FORMULA([.A100]) -> {=FORECAST.ETS.MULT(AE36:AE63,AG4:AG36,AE4:AE36,12,1,1)} | AJ100: 96 | BI100: 96
A101: 4318444.40292735 | B101: 4318444.40292735 | C101: of:=ROUND([.A101];12)=ROUND([.B101];12) -> true | D101: of:=FORMULA([.A101]) -> {=FORECAST.ETS.MULT(AE36:AE63,AG4:AG36,AE4:AE36,12,1,1)}
A102: 4261849.53926211 | B102: 4261849.53926211 | C102: of:=ROUND([.A102];12)=ROUND([.B102];12) -> true | D102: of:=FORMULA([.A102]) -> {=FORECAST.ETS.MULT(AE36:AE63,AG4:AG36,AE4:AE36,12,1,1)}
A103: 3988019.019607 | B103: 3988019.019607 | C103: of:=ROUND([.A103];12)=ROUND([.B103];12) -> true | D103: of:=FORMULA([.A103]) -> {=FORECAST.ETS.MULT(AE36:AE63,AG4:AG36,AE4:AE36,12,1,1)}
A104: 3573426.20589779 | B104: 3573426.20589779 | C104: of:=ROUND([.A104];12)=ROUND([.B104];12) -> true | D104: of:=FORMULA([.A104]) -> {=FORECAST.ETS.MULT(AE36:AE63,AG4:AG36,AE4:AE36,12,1,1)}
A105: 4023828.1062791 | B105: 4023828.1062791 | C105: of:=ROUND([.A105];12)=ROUND([.B105];12) -> true | D105: of:=FORMULA([.A105]) -> {=FORECAST.ETS.MULT(AE36:AE63,AG4:AG36,AE4:AE36,12,1,1)}
A106: 4141175.90652158 | B106: 4141175.90652158 | C106: of:=ROUND([.A106];12)=ROUND([.B106];12) -> true | D106: of:=FORMULA([.A106]) -> {=FORECAST.ETS.MULT(AE36:AE63,AG4:AG36,AE4:AE36,12,1,1)}
A107: 4435995.31360509 | B107: 4435995.31360509 | C107: of:=ROUND([.A107];12)=ROUND([.B107];12) -> true | D107: of:=FORMULA([.A107]) -> {=FORECAST.ETS.MULT(AE36:AE63,AG4:AG36,AE4:AE36,12,1,1)}
A108: 4973137.29338817 | B108: 4973137.29338817 | C108: of:=ROUND([.A108];12)=ROUND([.B108];12) -> true | D108: of:=FORMULA([.A108]) -> {=FORECAST.ETS.MULT(AE36:AE63,AG4:AG36,AE4:AE36,12,1,1)}
A109: 5106598.87797539 | B109: 5106598.87797539 | C109: of:=ROUND([.A109];12)=ROUND([.B109];12) -> true | D109: of:=FORMULA([.A109]) -> {=FORECAST.ETS.MULT(AE36:AE63,AG4:AG36,AE4:AE36,12,1,1)}
A110: 5136894.64204166 | B110: 5136894.64204166 | C110: of:=ROUND([.A110];12)=ROUND([.B110];12) -> true | D110: of:=FORMULA([.A110]) -> {=FORECAST.ETS.MULT(AE36:AE63,AG4:AG36,AE4:AE36,12,1,1)}
A111: 4702569.7504895 | B111: 4702569.7504895 | C111: of:=ROUND([.A111];12)=ROUND([.B111];12) -> true | D111: of:=FORMULA([.A111]) -> {=FORECAST.ETS.MULT(AE36:AE63,AG4:AG36,AE4:AE36,12,1,1)}
A112: 4767235.96963692 | B112: 4767235.96963692 | C112: of:=ROUND([.A112];12)=ROUND([.B112];12) -> true | D112: of:=FORMULA([.A112]) -> {=FORECAST.ETS.MULT(AE36:AE63,AG4:AG36,AE4:AE36,12,1,1)}
A113: 4545689.25355982 | B113: 4545689.25355982 | C113: of:=ROUND([.A113];12)=ROUND([.B113];12) -> true | D113: of:=FORMULA([.A113]) -> {=FORECAST.ETS.MULT(AE36:AE63,AG4:AG36,AE4:AE36,12,1,1)}
A114: 4485137.10753685 | B114: 4485137.10753685 | C114: of:=ROUND([.A114];12)=ROUND([.B114];12) -> true | D114: of:=FORMULA([.A114]) -> {=FORECAST.ETS.MULT(AE36:AE63,AG4:AG36,AE4:AE36,12,1,1)}
A115: of:=ORG.LIBREOFFICE.FORECAST.ETS.MULT([.AJ64:.AJ100];[.AI5:.AI64];[.AJ5:.AJ64];12;1;1) -> 58.048 | B115: 58.048 | C115: of:=ROUND([.A115];12)=ROUND([.B115];12) -> true | D115: of:=FORMULA([.A115]) -> {=FORECAST.ETS.MULT(AJ64:AJ100,AI5:AI64,AJ5:AJ64,12,1,1)}
A116: 72.8878084393463 | B116: 72.8878084393463 | C116: of:=ROUND([.A116];12)=ROUND([.B116];12) -> true | D116: of:=FORMULA([.A116]) -> {=FORECAST.ETS.MULT(AJ64:AJ100,AI5:AI64,AJ5:AJ64,12,1,1)}
A117: 65.1161691604337 | B117: 65.1161691604337 | C117: of:=ROUND([.A117];12)=ROUND([.B117];12) -> true | D117: of:=FORMULA([.A117]) -> {=FORECAST.ETS.MULT(AJ64:AJ100,AI5:AI64,AJ5:AJ64,12,1,1)}
A118: 78.8999773389802 | B118: 78.8999773389802 | C118: of:=ROUND([.A118];12)=ROUND([.B118];12) -> true | D118: of:=FORMULA([.A118]) -> {=FORECAST.ETS.MULT(AJ64:AJ100,AI5:AI64,AJ5:AJ64,12,1,1)}
A119: 88.5042604116374 | B119: 88.5042604116374 | C119: of:=ROUND([.A119];12)=ROUND([.B119];12) -> true | D119: of:=FORMULA([.A119]) -> {=FORECAST.ETS.MULT(AJ64:AJ100,AI5:AI64,AJ5:AJ64,12,1,1)}
A120: 87.6933650074125 | B120: 87.6933650074125 | C120: of:=ROUND([.A120];11)=ROUND([.B120];11) -> true | D120: of:=FORMULA([.A120]) -> {=FORECAST.ETS.MULT(AJ64:AJ100,AI5:AI64,AJ5:AJ64,12,1,1)}
A121: 100.948503826912 | B121: 100.948503826912 | C121: of:=ROUND([.A121];12)=ROUND([.B121];12) -> true | D121: of:=FORMULA([.A121]) -> {=FORECAST.ETS.MULT(AJ64:AJ100,AI5:AI64,AJ5:AJ64,12,1,1)}
A122: 99.6314373472625 | B122: 99.6314373472625 | C122: of:=ROUND([.A122];11)=ROUND([.B122];11) -> true | D122: of:=FORMULA([.A122]) -> {=FORECAST.ETS.MULT(AJ64:AJ100,AI5:AI64,AJ5:AJ64,12,1,1)}
A123: 98.9096428541703 | B123: 98.9096428541703 | C123: of:=ROUND([.A123];12)=ROUND([.B123];12) -> true | D123: of:=FORMULA([.A123]) -> {=FORECAST.ETS.MULT(AJ64:AJ100,AI5:AI64,AJ5:AJ64,12,1,1)}
A124: 98.3876468889293 | B124: 98.3876468889293 | C124: of:=ROUND([.A124];12)=ROUND([.B124];12) -> true | D124: of:=FORMULA([.A124]) -> {=FORECAST.ETS.MULT(AJ64:AJ100,AI5:AI64,AJ5:AJ64,12,1,1)}
A125: 84.9640709913307 | B125: 84.9640709913307 | C125: of:=ROUND([.A125];12)=ROUND([.B125];12) -> true | D125: of:=FORMULA([.A125]) -> {=FORECAST.ETS.MULT(AJ64:AJ100,AI5:AI64,AJ5:AJ64,12,1,1)}
A126: 78.739015079783 | B126: 78.739015079783 | C126: of:=ROUND([.A126];12)=ROUND([.B126];12) -> true | D126: of:=FORMULA([.A126]) -> {=FORECAST.ETS.MULT(AJ64:AJ100,AI5:AI64,AJ5:AJ64,12,1,1)}
A127: 63.7346058009482 | B127: 63.7346058009482 | C127: of:=ROUND([.A127];12)=ROUND([.B127];12) -> true | D127: of:=FORMULA([.A127]) -> {=FORECAST.ETS.MULT(AJ64:AJ100,AI5:AI64,AJ5:AJ64,12,1,1)}
A128: 76.3548564418651 | B128: 76.3548564418651 | C128: of:=ROUND([.A128];12)=ROUND([.B128];12) -> true | D128: of:=FORMULA([.A128]) -> {=FORECAST.ETS.MULT(AJ64:AJ100,AI5:AI64,AJ5:AJ64,12,1,1)}
A129: 68.2013150391412 | B129: 68.2013150391412 | C129: of:=ROUND([.A129];12)=ROUND([.B129];12) -> true | D129: of:=FORMULA([.A129]) -> {=FORECAST.ETS.MULT(AJ64:AJ100,AI5:AI64,AJ5:AJ64,12,1,1)}
A130: 82.6234863486569 | B130: 82.6234863486569 | C130: of:=ROUND([.A130];12)=ROUND([.B130];12) -> true | D130: of:=FORMULA([.A130]) -> {=FORECAST.ETS.MULT(AJ64:AJ100,AI5:AI64,AJ5:AJ64,12,1,1)}
A131: 92.664660471513 | B131: 92.664660471513 | C131: of:=ROUND([.A131];12)=ROUND([.B131];12) -> true | D131: of:=FORMULA([.A131]) -> {=FORECAST.ETS.MULT(AJ64:AJ100,AI5:AI64,AJ5:AJ64,12,1,1)}
A132: 91.7995612636688 | B132: 91.7995612636688 | C132: of:=ROUND([.A132];12)=ROUND([.B132];12) -> true | D132: of:=FORMULA([.A132]) -> {=FORECAST.ETS.MULT(AJ64:AJ100,AI5:AI64,AJ5:AJ64,12,1,1)}
A133: 105.656992361035 | B133: 105.656992361035 | C133: of:=ROUND([.A133];12)=ROUND([.B133];12) -> true | D133: of:=FORMULA([.A133]) -> {=FORECAST.ETS.MULT(AJ64:AJ100,AI5:AI64,AJ5:AJ64,12,1,1)}
A134: 104.260502046929 | B134: 104.260502046929 | C134: of:=ROUND([.A134];12)=ROUND([.B134];12) -> true | D134: of:=FORMULA([.A134]) -> {=FORECAST.ETS.MULT(AJ64:AJ100,AI5:AI64,AJ5:AJ64,12,1,1)}
A135: 103.487447166156 | B135: 103.487447166156 | C135: of:=ROUND([.A135];12)=ROUND([.B135];12) -> true | D135: of:=FORMULA([.A135]) -> {=FORECAST.ETS.MULT(AJ64:AJ100,AI5:AI64,AJ5:AJ64,12,1,1)}
A136: 102.923796390283 | B136: 102.923796390283 | C136: of:=ROUND([.A136];12)=ROUND([.B136];12) -> true | D136: of:=FORMULA([.A136]) -> {=FORECAST.ETS.MULT(AJ64:AJ100,AI5:AI64,AJ5:AJ64,12,1,1)}
A137: 88.8663355112766 | B137: 88.8663355112766 | C137: of:=ROUND([.A137];12)=ROUND([.B137];12) -> true | D137: of:=FORMULA([.A137]) -> {=FORECAST.ETS.MULT(AJ64:AJ100,AI5:AI64,AJ5:AJ64,12,1,1)}
A138: 82.341584335951 | B138: 82.341584335951 | C138: of:=ROUND([.A138];12)=ROUND([.B138];12) -> true | D138: of:=FORMULA([.A138]) -> {=FORECAST.ETS.MULT(AJ64:AJ100,AI5:AI64,AJ5:AJ64,12,1,1)}
A139: 66.6395978382139 | B139: 66.6395978382139 | C139: of:=ROUND([.A139];12)=ROUND([.B139];12) -> true | D139: of:=FORMULA([.A139]) -> {=FORECAST.ETS.MULT(AJ64:AJ100,AI5:AI64,AJ5:AJ64,12,1,1)}
A140: 79.8219044443839 | B140: 79.8219044443839 | C140: of:=ROUND([.A140];12)=ROUND([.B140];12) -> true | D140: of:=FORMULA([.A140]) -> {=FORECAST.ETS.MULT(AJ64:AJ100,AI5:AI64,AJ5:AJ64,12,1,1)}
A141: 71.2864609178487 | B141: 71.2864609178487 | C141: of:=ROUND([.A141];12)=ROUND([.B141];12) -> true | D141: of:=FORMULA([.A141]) -> {=FORECAST.ETS.MULT(AJ64:AJ100,AI5:AI64,AJ5:AJ64,12,1,1)}
A142: 86.3469953583337 | B142: 86.3469953583337 | C142: of:=ROUND([.A142];12)=ROUND([.B142];12) -> true | D142: of:=FORMULA([.A142]) -> {=FORECAST.ETS.MULT(AJ64:AJ100,AI5:AI64,AJ5:AJ64,12,1,1)}
A143: 96.8250605313886 | B143: 96.8250605313886 | C143: of:=ROUND([.A143];12)=ROUND([.B143];12) -> true | D143: of:=FORMULA([.A143]) -> {=FORECAST.ETS.MULT(AJ64:AJ100,AI5:AI64,AJ5:AJ64,12,1,1)}
A144: 95.9057575199251 | B144: 95.9057575199251 | C144: of:=ROUND([.A144];12)=ROUND([.B144];12) -> true | D144: of:=FORMULA([.A144]) -> {=FORECAST.ETS.MULT(AJ64:AJ100,AI5:AI64,AJ5:AJ64,12,1,1)}
A145: 110.365480895159 | B145: 110.365480895159 | C145: of:=ROUND([.A145];12)=ROUND([.B145];12) -> true | D145: of:=FORMULA([.A145]) -> {=FORECAST.ETS.MULT(AJ64:AJ100,AI5:AI64,AJ5:AJ64,12,1,1)}
A146: 108.889566746596 | B146: 108.889566746596 | C146: of:=ROUND([.A146];12)=ROUND([.B146];12) -> true | D146: of:=FORMULA([.A146]) -> {=FORECAST.ETS.MULT(AJ64:AJ100,AI5:AI64,AJ5:AJ64,12,1,1)}
A147: 108.065251478142 | B147: 108.065251478142 | C147: of:=ROUND([.A147];12)=ROUND([.B147];12) -> true | D147: of:=FORMULA([.A147]) -> {=FORECAST.ETS.MULT(AJ64:AJ100,AI5:AI64,AJ5:AJ64,12,1,1)}
A148: 107.459945891637 | B148: 107.459945891637 | C148: of:=ROUND([.A148];12)=ROUND([.B148];12) -> true | D148: of:=FORMULA([.A148]) -> {=FORECAST.ETS.MULT(AJ64:AJ100,AI5:AI64,AJ5:AJ64,12,1,1)}
A149: 92.7686000312226 | B149: 92.7686000312226 | C149: of:=ROUND([.A149];12)=ROUND([.B149];12) -> true | D149: of:=FORMULA([.A149]) -> {=FORECAST.ETS.MULT(AJ64:AJ100,AI5:AI64,AJ5:AJ64,12,1,1)}
A150: 85.944153592119 | B150: 85.944153592119 | C150: of:=ROUND([.A150];12)=ROUND([.B150];12) -> true | D150: of:=FORMULA([.A150]) -> {=FORECAST.ETS.MULT(AJ64:AJ100,AI5:AI64,AJ5:AJ64,12,1,1)}
A151: 69.5445898754795 | B151: 69.5445898754795 | C151: of:=ROUND([.A151];11)=ROUND([.B151];11) -> true | D151: of:=FORMULA([.A151]) -> {=FORECAST.ETS.MULT(AJ64:AJ100,AI5:AI64,AJ5:AJ64,12,1,1)}
A152: of:=ORG.LIBREOFFICE.FORECAST.ETS.STAT.MULT([.AM8:.AM31];[.AL8:.AL31];[.AO22:.AO29];[.AL3];[.AL4];[.AL5]) -> 0.75 | B152: 0.75 | C152: of:=ROUND([.A152];12)=ROUND([.B152];12) -> true | D152: of:=FORMULA([.A152]) -> {=FORECAST.ETS.STAT.MULT(AM8:AM31,AL8:AL31,AO22:AO29,AL3,AL4,AL5)}
A153: 0.068359375 | B153: 0.068359375 | C153: of:=ROUND([.A153];12)=ROUND([.B153];12) -> true | D153: of:=FORMULA([.A153]) -> {=FORECAST.ETS.STAT.MULT(AM8:AM31,AL8:AL31,AO22:AO29,AL3,AL4,AL5)}
A154: 1 | B154: 1 | C154: of:=ROUND([.A154];12)=ROUND([.B154];12) -> true | D154: of:=FORMULA([.A154]) -> {=FORECAST.ETS.STAT.MULT(AM8:AM31,AL8:AL31,AO22:AO29,AL3,AL4,AL5)}
A155: 0.206559789330583 | B155: 0.206559789330583 | C155: of:=ROUND([.A155];12)=ROUND([.B155];12) -> true | D155: of:=FORMULA([.A155]) -> {=FORECAST.ETS.STAT.MULT(AM8:AM31,AL8:AL31,AO22:AO29,AL3,AL4,AL5)}
A156: 0.0298317373609026 | B156: 0.0298317373609026 | C156: of:=ROUND([.A156];12)=ROUND([.B156];12) -> true | D156: of:=FORMULA([.A156]) -> {=FORECAST.ETS.STAT.MULT(AM8:AM31,AL8:AL31,AO22:AO29,AL3,AL4,AL5)}
A157: 17.7641418824301 | B157: 17.7641418824301 | C157: of:=ROUND([.A157];12)=ROUND([.B157];12) -> true | D157: of:=FORMULA([.A157]) -> {=FORECAST.ETS.STAT.MULT(AM8:AM31,AL8:AL31,AO22:AO29,AL3,AL4,AL5)}
A158: 24.3772832609466 | B158: 24.3772832609466 | C158: of:=ROUND([.A158];12)=ROUND([.B158];12) -> true | D158: of:=FORMULA([.A158]) -> {=FORECAST.ETS.STAT.MULT(AM8:AM31,AL8:AL31,AO22:AO29,AL3,AL4,AL5)}
A159: 1 | B159: 1 | C159: of:=ROUND([.A159];12)=ROUND([.B159];12) -> true | D159: of:=FORMULA([.A159]) -> {=FORECAST.ETS.STAT.MULT(AM8:AM31,AL8:AL31,AO22:AO29,AL3,AL4,AL5)}
A160: of:=ORG.LIBREOFFICE.FORECAST.ETS.STAT.MULT([.$AR$6:.$AR$44];[.$AQ$6:.$AQ$44];[.AT33:.AT40];[.AQ1];1;1) -> 0.0625 | B160: 0.0625 | C160: of:=ROUND([.A160];12)=ROUND([.B160];12) -> true | D160: of:=FORMULA([.A160]) -> {=FORECAST.ETS.STAT.MULT($AR$6:$AR$44,$AQ$6:$AQ$44,AT33:AT40,AQ1,1,1)}
A161: 0.1787109375 | B161: 0.1787109375 | C161: of:=ROUND([.A161];12)=ROUND([.B161];12) -> true | D161: of:=FORMULA([.A161]) -> {=FORECAST.ETS.STAT.MULT($AR$6:$AR$44,$AQ$6:$AQ$44,AT33:AT40,AQ1,1,1)}
A162: 1 | B162: 1 | C162: of:=ROUND([.A162];12)=ROUND([.B162];12) -> true | D162: of:=FORMULA([.A162]) -> {=FORECAST.ETS.STAT.MULT($AR$6:$AR$44,$AQ$6:$AQ$44,AT33:AT40,AQ1,1,1)}
A163: 0.0323907123912786 | B163: 0.0323907123912786 | C163: of:=ROUND([.A163];12)=ROUND([.B163];12) -> true | D163: of:=FORMULA([.A163]) -> {=FORECAST.ETS.STAT.MULT($AR$6:$AR$44,$AQ$6:$AQ$44,AT33:AT40,AQ1,1,1)}
A164: 0.00137428390988724 | B164: 0.00137428390988724 | C164: of:=ROUND([.A164];12)=ROUND([.B164];12) -> true | D164: of:=FORMULA([.A164]) -> {=FORECAST.ETS.STAT.MULT($AR$6:$AR$44,$AQ$6:$AQ$44,AT33:AT40,AQ1,1,1)}
A165: 0.170847479986413 | B165: 0.170847479986413 | C165: of:=ROUND([.A165];12)=ROUND([.B165];12) -> true | D165: of:=FORMULA([.A165]) -> {=FORECAST.ETS.STAT.MULT($AR$6:$AR$44,$AQ$6:$AQ$44,AT33:AT40,AQ1,1,1)}
A166: 0.394116650892796 | B166: 0.394116650892796 | C166: of:=ROUND([.A166];12)=ROUND([.B166];12) -> true | D166: of:=FORMULA([.A166]) -> {=FORECAST.ETS.STAT.MULT($AR$6:$AR$44,$AQ$6:$AQ$44,AT33:AT40,AQ1,1,1)}
A167: 1 | B167: 1 | C167: of:=ROUND([.A167];12)=ROUND([.B167];12) -> true | D167: of:=FORMULA([.A167]) -> {=FORECAST.ETS.STAT.MULT($AR$6:$AR$44,$AQ$6:$AQ$44,AT33:AT40,AQ1,1,1)}
A168: of:=ORG.LIBREOFFICE.FORECAST.ETS.STAT.MULT([.AW$8:.AW$31];[.AV$8:.AV$31];[.AX1:.AX8];[.AV$3];[.AV$4];[.AV$5]) -> 0.46875 | B168: 0.46875 | C168: of:=ROUND([.A168];12)=ROUND([.B168];12) -> true | D168: of:=FORMULA([.A168]) -> {=FORECAST.ETS.STAT.MULT(AW$8:AW$31,AV$8:AV$31,AX1:AX8,AV$3,AV$4,AV$5)}
A169: 0.1279296875 | B169: 0.1279296875 | C169: of:=ROUND([.A169];12)=ROUND([.B169];12) -> true | D169: of:=FORMULA([.A169]) -> {=FORECAST.ETS.STAT.MULT(AW$8:AW$31,AV$8:AV$31,AX1:AX8,AV$3,AV$4,AV$5)}
A170: 1 | B170: 1 | C170: of:=ROUND([.A170];12)=ROUND([.B170];12) -> true | D170: of:=FORMULA([.A170]) -> {=FORECAST.ETS.STAT.MULT(AW$8:AW$31,AV$8:AV$31,AX1:AX8,AV$3,AV$4,AV$5)}
A171: 0.112662710030113 | B171: 0.112662710030113 | C171: of:=ROUND([.A171];12)=ROUND([.B171];12) -> true | D171: of:=FORMULA([.A171]) -> {=FORECAST.ETS.STAT.MULT(AW$8:AW$31,AV$8:AV$31,AX1:AX8,AV$3,AV$4,AV$5)}
A172: 0.0272031334882562 | B172: 0.0272031334882562 | C172: of:=ROUND([.A172];12)=ROUND([.B172];12) -> true | D172: of:=FORMULA([.A172]) -> {=FORECAST.ETS.STAT.MULT(AW$8:AW$31,AV$8:AV$31,AX1:AX8,AV$3,AV$4,AV$5)}
A173: 1.14864753907974 | B173: 1.14864753907974 | C173: of:=ROUND([.A173];12)=ROUND([.B173];12) -> true | D173: of:=FORMULA([.A173]) -> {=FORECAST.ETS.STAT.MULT(AW$8:AW$31,AV$8:AV$31,AX1:AX8,AV$3,AV$4,AV$5)}
A174: 1.7355926400562 | B174: 1.7355926400562 | C174: of:=ROUND([.A174];12)=ROUND([.B174];12) -> true | D174: of:=FORMULA([.A174]) -> {=FORECAST.ETS.STAT.MULT(AW$8:AW$31,AV$8:AV$31,AX1:AX8,AV$3,AV$4,AV$5)}
A175: 1 | B175: 1 | C175: of:=ROUND([.A175];12)=ROUND([.B175];12) -> true | D175: of:=FORMULA([.A175]) -> {=FORECAST.ETS.STAT.MULT(AW$8:AW$31,AV$8:AV$31,AX1:AX8,AV$3,AV$4,AV$5)}
A176: of:=ORG.LIBREOFFICE.FORECAST.ETS.STAT.MULT([.BA$8:.BA$43];[.AZ$8:.AZ$43];[.BB1:.BB8];[.AZ$3];[.AZ$4];[.AZ$5]) -> 0.51171875 | B176: 0.51171875 | C176: of:=ROUND([.A176];12)=ROUND([.B176];12) -> true | D176: of:=FORMULA([.A176]) -> {=FORECAST.ETS.STAT.MULT(BA$8:BA$43,AZ$8:AZ$43,BB1:BB8,AZ$3,AZ$4,AZ$5)}
A177: 0.0810546875 | B177: 0.0810546875 | C177: of:=ROUND([.A177];12)=ROUND([.B177];12) -> true | D177: of:=FORMULA([.A177]) -> {=FORECAST.ETS.STAT.MULT(BA$8:BA$43,AZ$8:AZ$43,BB1:BB8,AZ$3,AZ$4,AZ$5)}
A178: 0 | B178: 0 | C178: of:=ROUND([.A178];12)=ROUND([.B178];12) -> true | D178: of:=FORMULA([.A178]) -> {=FORECAST.ETS.STAT.MULT(BA$8:BA$43,AZ$8:AZ$43,BB1:BB8,AZ$3,AZ$4,AZ$5)}
A179: 0.243024634011384 | B179: 0.243024634011384 | C179: of:=ROUND([.A179];12)=ROUND([.B179];12) -> true | D179: of:=FORMULA([.A179]) -> {=FORECAST.ETS.STAT.MULT(BA$8:BA$43,AZ$8:AZ$43,BB1:BB8,AZ$3,AZ$4,AZ$5)}
A180: 0.0210523304820451 | B180: 0.0210523304820451 | C180: of:=ROUND([.A180];12)=ROUND([.B180];12) -> true | D180: of:=FORMULA([.A180]) -> {=FORECAST.ETS.STAT.MULT(BA$8:BA$43,AZ$8:AZ$43,BB1:BB8,AZ$3,AZ$4,AZ$5)}
A181: 3.17361580885454 | B181: 3.17361580885454 | C181: of:=ROUND([.A181];12)=ROUND([.B181];12) -> true | D181: of:=FORMULA([.A181]) -> {=FORECAST.ETS.STAT.MULT(BA$8:BA$43,AZ$8:AZ$43,BB1:BB8,AZ$3,AZ$4,AZ$5)}
A182: 5.03536471769304 | B182: 5.03536471769304 | C182: of:=ROUND([.A182];12)=ROUND([.B182];12) -> true | D182: of:=FORMULA([.A182]) -> {=FORECAST.ETS.STAT.MULT(BA$8:BA$43,AZ$8:AZ$43,BB1:BB8,AZ$3,AZ$4,AZ$5)}
A183: 1 | B183: 1 | C183: of:=ROUND([.A183];12)=ROUND([.B183];12) -> true | D183: of:=FORMULA([.A183]) -> {=FORECAST.ETS.STAT.MULT(BA$8:BA$43,AZ$8:AZ$43,BB1:BB8,AZ$3,AZ$4,AZ$5)}
A184: of:=ORG.LIBREOFFICE.FORECAST.ETS.MULT([.$BD$36:.$BD63];[.$BF$4:.$BF$36];[.$BD$4:.$BD$36];12;1;1) -> 4054338 | B184: 4054338 | C184: of:=ROUND([.A184];12)=ROUND([.B184];12) -> true | D184: of:=FORMULA([.A184]) -> {=FORECAST.ETS.MULT($BD$36:$BD63,$BF$4:$BF$36,$BD$4:$BD$36,12,1,1)}
A185: 4288601.49523545 | B185: 4288601.49523545 | C185: of:=ROUND([.A185];12)=ROUND([.B185];12) -> true | D185: of:=FORMULA([.A185]) -> {=FORECAST.ETS.MULT($BD$36:$BD63,$BF$4:$BF$36,$BD$4:$BD$36,12,1,1)}
A186: 4091199.55229487 | B186: 4091199.55229487 | C186: of:=ROUND([.A186];12)=ROUND([.B186];12) -> true | D186: of:=FORMULA([.A186]) -> {=FORECAST.ETS.MULT($BD$36:$BD63,$BF$4:$BF$36,$BD$4:$BD$36,12,1,1)}
A187: 4038561.97098737 | B187: 4038561.97098737 | C187: of:=ROUND([.A187];12)=ROUND([.B187];12) -> true | D187: of:=FORMULA([.A187]) -> {=FORECAST.ETS.MULT($BD$36:$BD63,$BF$4:$BF$36,$BD$4:$BD$36,12,1,1)}
A188: 3779986.30181304 | B188: 3779986.30181304 | C188: of:=ROUND([.A188];12)=ROUND([.B188];12) -> true | D188: of:=FORMULA([.A188]) -> {=FORECAST.ETS.MULT($BD$36:$BD63,$BF$4:$BF$36,$BD$4:$BD$36,12,1,1)}
A189: 3387827.28877104 | B189: 3387827.28877104 | C189: of:=ROUND([.A189];12)=ROUND([.B189];12) -> true | D189: of:=FORMULA([.A189]) -> {=FORECAST.ETS.MULT($BD$36:$BD63,$BF$4:$BF$36,$BD$4:$BD$36,12,1,1)}
A190: 3815736.59044792 | B190: 3815736.59044792 | C190: of:=ROUND([.A190];12)=ROUND([.B190];12) -> true | D190: of:=FORMULA([.A190]) -> {=FORECAST.ETS.MULT($BD$36:$BD63,$BF$4:$BF$36,$BD$4:$BD$36,12,1,1)}
A191: 3927934.74841799 | B191: 3927934.74841799 | C191: of:=ROUND([.A191];12)=ROUND([.B191];12) -> true | D191: of:=FORMULA([.A191]) -> {=FORECAST.ETS.MULT($BD$36:$BD63,$BF$4:$BF$36,$BD$4:$BD$36,12,1,1)}
A192: 4208549.03819637 | B192: 4208549.03819637 | C192: of:=ROUND([.A192];12)=ROUND([.B192];12) -> true | D192: of:=FORMULA([.A192]) -> {=FORECAST.ETS.MULT($BD$36:$BD63,$BF$4:$BF$36,$BD$4:$BD$36,12,1,1)}
A193: 4719235.05761799 | B193: 4719235.05761799 | C193: of:=ROUND([.A193];12)=ROUND([.B193];12) -> true | D193: of:=FORMULA([.A193]) -> {=FORECAST.ETS.MULT($BD$36:$BD63,$BF$4:$BF$36,$BD$4:$BD$36,12,1,1)}
A194: 4846987.32895276 | B194: 4846987.32895276 | C194: of:=ROUND([.A194];12)=ROUND([.B194];12) -> true | D194: of:=FORMULA([.A194]) -> {=FORECAST.ETS.MULT($BD$36:$BD63,$BF$4:$BF$36,$BD$4:$BD$36,12,1,1)}
A195: 4876844.61506186 | B195: 4876844.61506186 | C195: of:=ROUND([.A195];12)=ROUND([.B195];12) -> true | D195: of:=FORMULA([.A195]) -> {=FORECAST.ETS.MULT($BD$36:$BD63,$BF$4:$BF$36,$BD$4:$BD$36,12,1,1)}
A196: 4465507.06401322 | B196: 4465507.06401322 | C196: of:=ROUND([.A196];12)=ROUND([.B196];12) -> true | D196: of:=FORMULA([.A196]) -> {=FORECAST.ETS.MULT($BD$36:$BD63,$BF$4:$BF$36,$BD$4:$BD$36,12,1,1)}
A197: 4527918.73243619 | B197: 4527918.73243619 | C197: of:=ROUND([.A197];12)=ROUND([.B197];12) -> true | D197: of:=FORMULA([.A197]) -> {=FORECAST.ETS.MULT($BD$36:$BD63,$BF$4:$BF$36,$BD$4:$BD$36,12,1,1)}
A198: 4318444.40292735 | B198: 4318444.40292735 | C198: of:=ROUND([.A198];12)=ROUND([.B198];12) -> true | D198: of:=FORMULA([.A198]) -> {=FORECAST.ETS.MULT($BD$36:$BD63,$BF$4:$BF$36,$BD$4:$BD$36,12,1,1)}
A199: 4261849.53926211 | B199: 4261849.53926211 | C199: of:=ROUND([.A199];12)=ROUND([.B199];12) -> true | D199: of:=FORMULA([.A199]) -> {=FORECAST.ETS.MULT($BD$36:$BD63,$BF$4:$BF$36,$BD$4:$BD$36,12,1,1)}
A200: 3988019.019607 | B200: 3988019.019607 | C200: of:=ROUND([.A200];12)=ROUND([.B200];12) -> true | D200: of:=FORMULA([.A200]) -> {=FORECAST.ETS.MULT($BD$36:$BD63,$BF$4:$BF$36,$BD$4:$BD$36,12,1,1)}
A201: 3573426.20589779 | B201: 3573426.20589779 | C201: of:=ROUND([.A201];12)=ROUND([.B201];12) -> true | D201: of:=FORMULA([.A201]) -> {=FORECAST.ETS.MULT($BD$36:$BD63,$BF$4:$BF$36,$BD$4:$BD$36,12,1,1)}
A202: 4023828.1062791 | B202: 4023828.1062791 | C202: of:=ROUND([.A202];12)=ROUND([.B202];12) -> true | D202: of:=FORMULA([.A202]) -> {=FORECAST.ETS.MULT($BD$36:$BD63,$BF$4:$BF$36,$BD$4:$BD$36,12,1,1)}
A203: 4141175.90652158 | B203: 4141175.90652158 | C203: of:=ROUND([.A203];12)=ROUND([.B203];12) -> true | D203: of:=FORMULA([.A203]) -> {=FORECAST.ETS.MULT($BD$36:$BD63,$BF$4:$BF$36,$BD$4:$BD$36,12,1,1)}
A204: 4435995.31360509 | B204: 4435995.31360509 | C204: of:=ROUND([.A204];12)=ROUND([.B204];12) -> true | D204: of:=FORMULA([.A204]) -> {=FORECAST.ETS.MULT($BD$36:$BD63,$BF$4:$BF$36,$BD$4:$BD$36,12,1,1)}
A205: 4973137.29338817 | B205: 4973137.29338817 | C205: of:=ROUND([.A205];12)=ROUND([.B205];12) -> true | D205: of:=FORMULA([.A205]) -> {=FORECAST.ETS.MULT($BD$36:$BD63,$BF$4:$BF$36,$BD$4:$BD$36,12,1,1)}
A206: 5106598.87797539 | B206: 5106598.87797539 | C206: of:=ROUND([.A206];12)=ROUND([.B206];12) -> true | D206: of:=FORMULA([.A206]) -> {=FORECAST.ETS.MULT($BD$36:$BD63,$BF$4:$BF$36,$BD$4:$BD$36,12,1,1)}
A207: 5136894.64204166 | B207: 5136894.64204166 | C207: of:=ROUND([.A207];12)=ROUND([.B207];12) -> true | D207: of:=FORMULA([.A207]) -> {=FORECAST.ETS.MULT($BD$36:$BD63,$BF$4:$BF$36,$BD$4:$BD$36,12,1,1)}
A208: 4702569.7504895 | B208: 4702569.7504895 | C208: of:=ROUND([.A208];12)=ROUND([.B208];12) -> true | D208: of:=FORMULA([.A208]) -> {=FORECAST.ETS.MULT($BD$36:$BD63,$BF$4:$BF$36,$BD$4:$BD$36,12,1,1)}
A209: 4767235.96963692 | B209: 4767235.96963692 | C209: of:=ROUND([.A209];12)=ROUND([.B209];12) -> true | D209: of:=FORMULA([.A209]) -> {=FORECAST.ETS.MULT($BD$36:$BD63,$BF$4:$BF$36,$BD$4:$BD$36,12,1,1)}
A210: 4545689.25355982 | B210: 4545689.25355982 | C210: of:=ROUND([.A210];12)=ROUND([.B210];12) -> true | D210: of:=FORMULA([.A210]) -> {=FORECAST.ETS.MULT($BD$36:$BD63,$BF$4:$BF$36,$BD$4:$BD$36,12,1,1)}
A211: 4485137.10753685 | B211: 4485137.10753685 | C211: of:=ROUND([.A211];12)=ROUND([.B211];12) -> true | D211: of:=FORMULA([.A211]) -> {=FORECAST.ETS.MULT($BD$36:$BD63,$BF$4:$BF$36,$BD$4:$BD$36,12,1,1)}
A212: of:=ORG.LIBREOFFICE.FORECAST.ETS.MULT([.$BI$64:.$BI100];[.$BH$5:.$BH$64];[.$BI$5:.$BI$64];12;1;1) -> 58.048 | B212: 58.048 | C212: of:=ROUND([.A212];12)=ROUND([.B212];12) -> true | D212: of:=FORMULA([.A212]) -> {=FORECAST.ETS.MULT($BI$64:$BI100,$BH$5:$BH$64,$BI$5:$BI$64,12,1,1)}
A213: 72.8878084393463 | B213: 72.8878084393463 | C213: of:=ROUND([.A213];12)=ROUND([.B213];12) -> true | D213: of:=FORMULA([.A213]) -> {=FORECAST.ETS.MULT($BI$64:$BI100,$BH$5:$BH$64,$BI$5:$BI$64,12,1,1)}
A214: 65.1161691604337 | B214: 65.1161691604337 | C214: of:=ROUND([.A214];12)=ROUND([.B214];12) -> true | D214: of:=FORMULA([.A214]) -> {=FORECAST.ETS.MULT($BI$64:$BI100,$BH$5:$BH$64,$BI$5:$BI$64,12,1,1)}
A215: 78.8999773389802 | B215: 78.8999773389802 | C215: of:=ROUND([.A215];12)=ROUND([.B215];12) -> true | D215: of:=FORMULA([.A215]) -> {=FORECAST.ETS.MULT($BI$64:$BI100,$BH$5:$BH$64,$BI$5:$BI$64,12,1,1)}
A216: 88.5042604116374 | B216: 88.5042604116374 | C216: of:=ROUND([.A216];12)=ROUND([.B216];12) -> true | D216: of:=FORMULA([.A216]) -> {=FORECAST.ETS.MULT($BI$64:$BI100,$BH$5:$BH$64,$BI$5:$BI$64,12,1,1)}
A217: 87.6933650074125 | B217: 87.6933650074125 | C217: of:=ROUND([.A217];11)=ROUND([.B217];11) -> true | D217: of:=FORMULA([.A217]) -> {=FORECAST.ETS.MULT($BI$64:$BI100,$BH$5:$BH$64,$BI$5:$BI$64,12,1,1)}
A218: 100.948503826912 | B218: 100.948503826912 | C218: of:=ROUND([.A218];12)=ROUND([.B218];12) -> true | D218: of:=FORMULA([.A218]) -> {=FORECAST.ETS.MULT($BI$64:$BI100,$BH$5:$BH$64,$BI$5:$BI$64,12,1,1)}
A219: 99.6314373472625 | B219: 99.6314373472625 | C219: of:=ROUND([.A219];11)=ROUND([.B219];11) -> true | D219: of:=FORMULA([.A219]) -> {=FORECAST.ETS.MULT($BI$64:$BI100,$BH$5:$BH$64,$BI$5:$BI$64,12,1,1)}
A220: 98.9096428541703 | B220: 98.9096428541703 | C220: of:=ROUND([.A220];12)=ROUND([.B220];12) -> true | D220: of:=FORMULA([.A220]) -> {=FORECAST.ETS.MULT($BI$64:$BI100,$BH$5:$BH$64,$BI$5:$BI$64,12,1,1)}
A221: 98.3876468889293 | B221: 98.3876468889293 | C221: of:=ROUND([.A221];12)=ROUND([.B221];12) -> true | D221: of:=FORMULA([.A221]) -> {=FORECAST.ETS.MULT($BI$64:$BI100,$BH$5:$BH$64,$BI$5:$BI$64,12,1,1)}
A222: 84.9640709913307 | B222: 84.9640709913307 | C222: of:=ROUND([.A222];12)=ROUND([.B222];12) -> true | D222: of:=FORMULA([.A222]) -> {=FORECAST.ETS.MULT($BI$64:$BI100,$BH$5:$BH$64,$BI$5:$BI$64,12,1,1)}
A223: 78.739015079783 | B223: 78.739015079783 | C223: of:=ROUND([.A223];12)=ROUND([.B223];12) -> true | D223: of:=FORMULA([.A223]) -> {=FORECAST.ETS.MULT($BI$64:$BI100,$BH$5:$BH$64,$BI$5:$BI$64,12,1,1)}
A224: 63.7346058009482 | B224: 63.7346058009482 | C224: of:=ROUND([.A224];12)=ROUND([.B224];12) -> true | D224: of:=FORMULA([.A224]) -> {=FORECAST.ETS.MULT($BI$64:$BI100,$BH$5:$BH$64,$BI$5:$BI$64,12,1,1)}
A225: 76.3548564418651 | B225: 76.3548564418651 | C225: of:=ROUND([.A225];12)=ROUND([.B225];12) -> true | D225: of:=FORMULA([.A225]) -> {=FORECAST.ETS.MULT($BI$64:$BI100,$BH$5:$BH$64,$BI$5:$BI$64,12,1,1)}
A226: 68.2013150391412 | B226: 68.2013150391412 | C226: of:=ROUND([.A226];12)=ROUND([.B226];12) -> true | D226: of:=FORMULA([.A226]) -> {=FORECAST.ETS.MULT($BI$64:$BI100,$BH$5:$BH$64,$BI$5:$BI$64,12,1,1)}
A227: 82.6234863486569 | B227: 82.6234863486569 | C227: of:=ROUND([.A227];12)=ROUND([.B227];12) -> true | D227: of:=FORMULA([.A227]) -> {=FORECAST.ETS.MULT($BI$64:$BI100,$BH$5:$BH$64,$BI$5:$BI$64,12,1,1)}
A228: 92.664660471513 | B228: 92.664660471513 | C228: of:=ROUND([.A228];12)=ROUND([.B228];12) -> true | D228: of:=FORMULA([.A228]) -> {=FORECAST.ETS.MULT($BI$64:$BI100,$BH$5:$BH$64,$BI$5:$BI$64,12,1,1)}
A229: 91.7995612636688 | B229: 91.7995612636688 | C229: of:=ROUND([.A229];12)=ROUND([.B229];12) -> true | D229: of:=FORMULA([.A229]) -> {=FORECAST.ETS.MULT($BI$64:$BI100,$BH$5:$BH$64,$BI$5:$BI$64,12,1,1)}
A230: 105.656992361035 | B230: 105.656992361035 | C230: of:=ROUND([.A230];12)=ROUND([.B230];12) -> true | D230: of:=FORMULA([.A230]) -> {=FORECAST.ETS.MULT($BI$64:$BI100,$BH$5:$BH$64,$BI$5:$BI$64,12,1,1)}
A231: 104.260502046929 | B231: 104.260502046929 | C231: of:=ROUND([.A231];12)=ROUND([.B231];12) -> true | D231: of:=FORMULA([.A231]) -> {=FORECAST.ETS.MULT($BI$64:$BI100,$BH$5:$BH$64,$BI$5:$BI$64,12,1,1)}
A232: 103.487447166156 | B232: 103.487447166156 | C232: of:=ROUND([.A232];12)=ROUND([.B232];12) -> true | D232: of:=FORMULA([.A232]) -> {=FORECAST.ETS.MULT($BI$64:$BI100,$BH$5:$BH$64,$BI$5:$BI$64,12,1,1)}
A233: 102.923796390283 | B233: 102.923796390283 | C233: of:=ROUND([.A233];12)=ROUND([.B233];12) -> true | D233: of:=FORMULA([.A233]) -> {=FORECAST.ETS.MULT($BI$64:$BI100,$BH$5:$BH$64,$BI$5:$BI$64,12,1,1)}
A234: 88.8663355112766 | B234: 88.8663355112766 | C234: of:=ROUND([.A234];12)=ROUND([.B234];12) -> true | D234: of:=FORMULA([.A234]) -> {=FORECAST.ETS.MULT($BI$64:$BI100,$BH$5:$BH$64,$BI$5:$BI$64,12,1,1)}
A235: 82.341584335951 | B235: 82.341584335951 | C235: of:=ROUND([.A235];12)=ROUND([.B235];12) -> true | D235: of:=FORMULA([.A235]) -> {=FORECAST.ETS.MULT($BI$64:$BI100,$BH$5:$BH$64,$BI$5:$BI$64,12,1,1)}
A236: 66.6395978382139 | B236: 66.6395978382139 | C236: of:=ROUND([.A236];12)=ROUND([.B236];12) -> true | D236: of:=FORMULA([.A236]) -> {=FORECAST.ETS.MULT($BI$64:$BI100,$BH$5:$BH$64,$BI$5:$BI$64,12,1,1)}
A237: 79.8219044443839 | B237: 79.8219044443839 | C237: of:=ROUND([.A237];12)=ROUND([.B237];12) -> true | D237: of:=FORMULA([.A237]) -> {=FORECAST.ETS.MULT($BI$64:$BI100,$BH$5:$BH$64,$BI$5:$BI$64,12,1,1)}
A238: 71.2864609178487 | B238: 71.2864609178487 | C238: of:=ROUND([.A238];12)=ROUND([.B238];12) -> true | D238: of:=FORMULA([.A238]) -> {=FORECAST.ETS.MULT($BI$64:$BI100,$BH$5:$BH$64,$BI$5:$BI$64,12,1,1)}
A239: 86.3469953583337 | B239: 86.3469953583337 | C239: of:=ROUND([.A239];12)=ROUND([.B239];12) -> true | D239: of:=FORMULA([.A239]) -> {=FORECAST.ETS.MULT($BI$64:$BI100,$BH$5:$BH$64,$BI$5:$BI$64,12,1,1)}
A240: 96.8250605313886 | B240: 96.8250605313886 | C240: of:=ROUND([.A240];12)=ROUND([.B240];12) -> true | D240: of:=FORMULA([.A240]) -> {=FORECAST.ETS.MULT($BI$64:$BI100,$BH$5:$BH$64,$BI$5:$BI$64,12,1,1)}
A241: 95.9057575199251 | B241: 95.9057575199251 | C241: of:=ROUND([.A241];12)=ROUND([.B241];12) -> true | D241: of:=FORMULA([.A241]) -> {=FORECAST.ETS.MULT($BI$64:$BI100,$BH$5:$BH$64,$BI$5:$BI$64,12,1,1)}
A242: 110.365480895159 | B242: 110.365480895159 | C242: of:=ROUND([.A242];12)=ROUND([.B242];12) -> true | D242: of:=FORMULA([.A242]) -> {=FORECAST.ETS.MULT($BI$64:$BI100,$BH$5:$BH$64,$BI$5:$BI$64,12,1,1)}
A243: 108.889566746596 | B243: 108.889566746596 | C243: of:=ROUND([.A243];12)=ROUND([.B243];12) -> true | D243: of:=FORMULA([.A243]) -> {=FORECAST.ETS.MULT($BI$64:$BI100,$BH$5:$BH$64,$BI$5:$BI$64,12,1,1)}
A244: 108.065251478142 | B244: 108.065251478142 | C244: of:=ROUND([.A244];12)=ROUND([.B244];12) -> true | D244: of:=FORMULA([.A244]) -> {=FORECAST.ETS.MULT($BI$64:$BI100,$BH$5:$BH$64,$BI$5:$BI$64,12,1,1)}
A245: 107.459945891637 | B245: 107.459945891637 | C245: of:=ROUND([.A245];12)=ROUND([.B245];12) -> true | D245: of:=FORMULA([.A245]) -> {=FORECAST.ETS.MULT($BI$64:$BI100,$BH$5:$BH$64,$BI$5:$BI$64,12,1,1)}
A246: 92.7686000312226 | B246: 92.7686000312226 | C246: of:=ROUND([.A246];12)=ROUND([.B246];12) -> true | D246: of:=FORMULA([.A246]) -> {=FORECAST.ETS.MULT($BI$64:$BI100,$BH$5:$BH$64,$BI$5:$BI$64,12,1,1)}
A247: 85.944153592119 | B247: 85.944153592119 | C247: of:=ROUND([.A247];12)=ROUND([.B247];12) -> true | D247: of:=FORMULA([.A247]) -> {=FORECAST.ETS.MULT($BI$64:$BI100,$BH$5:$BH$64,$BI$5:$BI$64,12,1,1)}
A248: 69.5445898754795 | B248: 69.5445898754795 | C248: of:=ROUND([.A248];11)=ROUND([.B248];11) -> true | D248: of:=FORMULA([.A248]) -> {=FORECAST.ETS.MULT($BI$64:$BI100,$BH$5:$BH$64,$BI$5:$BI$64,12,1,1)}

Sheet: 'file:///build/zdenek/Dokumenty/LO/sc-unit-test/Project%20Calc%20functions%20tests/fods/forecast.ets.mult.fods/function_based_test_Example.fods/function_based_test_Example_reference.fods'#Sheet2
H3: 4