Sheet: Sheet1
A1: FORECAST.ETS.ADD Function
A3: Result | B3: of:=AND([.B8:.B95]) -> true
A7: Sheet | B7: Result | C7: Description
A8: 1 | B8: of:=AND([Sheet2.C2:.C349]) -> true | C8: Simple FORECAST.ETS.ADD formulas with local references and values

Sheet: Sheet2
A1: Function | B1: Expected | C1: Correct | D1: FunctionString | E1: Comment | M1: 1 | N1: 2 | P1: Known Y | Q1: Known X | S1: 2 | T1: 125.226808384339
A2: of:=COM.MICROSOFT.FORECAST.ETS(6; [.N1:.N5]; [.M1:.M5]) -> 12.5 | B2: 12.5 | C2: of:=ORG.LIBREOFFICE.ROUNDSIG([.A2];9)=ORG.LIBREOFFICE.ROUNDSIG([.B2];9) -> true | D2: of:=FORMULA([.A2]) -> =FORECAST.ETS.ADD(6, N1:N5, M1:M5) | E2: Check 5.3 | M2: 2 | N2: 4 | P2: 6 | Q2: 20 | S2: 4 | T2: 118.933231648245 | V2: target | W2: 34 | AB2: 46
A3: of:=COM.MICROSOFT.FORECAST.ETS(30;[.P2:.P6];[.Q2:.Q6]) ->  | B3: #VALUE! | C3: of:=ISERROR([.A3]) -> true | D3: of:=FORMULA([.A3]) -> =FORECAST.ETS.ADD(30,P2:P6,Q2:Q6) | M3: 3 | N3: 7 | P3: 7 | Q3: 28 | S3: 6 | T3: 105.954105316101 | V3: seasonality | W3: 4 | X3: 1 jaar | AB3: 12 | AF3: date | AG3: sales
A4: of:=COM.MICROSOFT.FORECAST.ETS([.S1:.S39];[.T1:.T39];[.S1:.S39]) -> 125.226808384339 | B4: 125.226808384339 | C4: of:=ORG.LIBREOFFICE.ROUNDSIG([.A4];9)=ORG.LIBREOFFICE.ROUNDSIG([.B4];9) -> true | D4: of:=FORMULA([.A4]) -> {=FORECAST.ETS.ADD(S1:S39,T1:T39,S1:S39)} | M4: 4 | N4: 8 | P4: 9 | Q4: 31 | S4: 4 | T4: 118.933231648245 | V4: datacompletion | W4: 1 | AB4: 1 | AE4: 1 | AF4: 2001-01-01 | AG4: 3240325
A5: 118.933231648245 | B5: 118.933231648245 | C5: of:=ORG.LIBREOFFICE.ROUNDSIG([.A5];9)=ORG.LIBREOFFICE.ROUNDSIG([.B5];9) -> true | D5: of:=FORMULA([.A5]) -> {=FORECAST.ETS.ADD(S1:S39,T1:T39,S1:S39)} | M5: 5 | N5: 11 | P5: 15 | Q5: 38 | S5: 5 | T5: 111.549667344589 | V5: aggregation | W5: 1 | AB5: 1 | AE5: 2 | AF5: 2001-02-01 | AG5: 2741349 | AI5: 48.4 | AJ5: 1
A6: 105.954105316101 | B6: 105.954105316101 | C6: of:=ORG.LIBREOFFICE.ROUNDSIG([.A6];9)=ORG.LIBREOFFICE.ROUNDSIG([.B6];9) -> true | D6: of:=FORMULA([.A6]) -> {=FORECAST.ETS.ADD(S1:S39,T1:T39,S1:S39)} | P6: 21 | Q6: 40 | S6: 6 | T6: 105.954105316101 | AE6: 3 | AF6: 2001-03-01 | AG6: 2987427 | AI6: 48.5 | AJ6: 2
A7: 118.933231648245 | B7: 118.933231648245 | C7: of:=ORG.LIBREOFFICE.ROUNDSIG([.A7];9)=ORG.LIBREOFFICE.ROUNDSIG([.B7];9) -> true | D7: of:=FORMULA([.A7]) -> {=FORECAST.ETS.ADD(S1:S39,T1:T39,S1:S39)} | S7: 7 | T7: 105.026989677408 | AE7: 4 | AF7: 2001-04-01 | AG7: 3456892 | AI7: 57.45 | AJ7: 3
A8: 111.549667344589 | B8: 111.549667344589 | C8: of:=ORG.LIBREOFFICE.ROUNDSIG([.A8];9)=ORG.LIBREOFFICE.ROUNDSIG([.B8];9) -> true | D8: of:=FORMULA([.A8]) -> {=FORECAST.ETS.ADD(S1:S39,T1:T39,S1:S39)} | S8: 8 | T8: 109.479384966668 | V8: 2001-01-01 | W8: 1 | X8: 41.7 | AB8: 1 | AC8: 112 | AE8: 5 | AF8: 2001-05-01 | AG8: 3740738 | AI8: 64.95 | AJ8: 4
A9: 105.954105316101 | B9: 105.954105316101 | C9: of:=ORG.LIBREOFFICE.ROUNDSIG([.A9];9)=ORG.LIBREOFFICE.ROUNDSIG([.B9];9) -> true | D9: of:=FORMULA([.A9]) -> {=FORECAST.ETS.ADD(S1:S39,T1:T39,S1:S39)} | S9: 9 | T9: 117.5 | V9: 2001-04-01 | W9: 2 | X9: 24 | AB9: 2 | AC9: 118 | AE9: 6 | AF9: 2001-06-01 | AG9: 3979178 | AI9: 62.55 | AJ9: 5
A10: 105.026989677408 | B10: 105.026989677408 | C10: of:=ORG.LIBREOFFICE.ROUNDSIG([.A10];9)=ORG.LIBREOFFICE.ROUNDSIG([.B10];9) -> true | D10: of:=FORMULA([.A10]) -> {=FORECAST.ETS.ADD(S1:S39,T1:T39,S1:S39)} | S10: 10 | T10: 125.584893794301 | V10: 2001-07-01 | W10: 3 | X10: 32.3 | AB10: 3 | AC10: 132 | AE10: 7 | AF10: 2001-07-01 | AG10: 4160454 | AI10: 60.15 | AJ10: 6
A11: 109.479384966668 | B11: 109.479384966668 | C11: of:=ORG.LIBREOFFICE.ROUNDSIG([.A11];9)=ORG.LIBREOFFICE.ROUNDSIG([.B11];9) -> true | D11: of:=FORMULA([.A11]) -> {=FORECAST.ETS.ADD(S1:S39,T1:T39,S1:S39)} | S11: 11 | T11: 130.169971873195 | V11: 2001-10-01 | W11: 4 | X11: 37.3 | AB11: 4 | AC11: 129 | AE11: 8 | AF11: 2001-08-01 | AG11: 4162013 | AI11: 69.25 | AJ11: 7
A12: 117.5 | B12: 117.5 | C12: of:=ORG.LIBREOFFICE.ROUNDSIG([.A12];9)=ORG.LIBREOFFICE.ROUNDSIG([.B12];9) -> true | D12: of:=FORMULA([.A12]) -> {=FORECAST.ETS.ADD(S1:S39,T1:T39,S1:S39)} | S12: 12 | T12: 129.305702305035 | V12: 2002-01-01 | W12: 5 | X12: 46.2 | AB12: 5 | AC12: 121 | AE12: 9 | AF12: 2001-09-01 | AG12: 3809132 | AI12: 68.6 | AJ12: 8
A13: 125.584893794301 | B13: 125.584893794301 | C13: of:=ORG.LIBREOFFICE.ROUNDSIG([.A13];9)=ORG.LIBREOFFICE.ROUNDSIG([.B13];9) -> true | D13: of:=FORMULA([.A13]) -> {=FORECAST.ETS.ADD(S1:S39,T1:T39,S1:S39)} | S13: 13 | T13: 123.587140712742 | V13: 2002-04-01 | W13: 6 | X13: 29.3 | AB13: 6 | AC13: 135 | AE13: 10 | AF13: 2001-10-01 | AG13: 3794419 | AI13: 65.05 | AJ13: 9
A14: 130.169971873195 | B14: 130.169971873195 | C14: of:=ORG.LIBREOFFICE.ROUNDSIG([.A14];9)=ORG.LIBREOFFICE.ROUNDSIG([.B14];9) -> true | D14: of:=FORMULA([.A14]) -> {=FORECAST.ETS.ADD(S1:S39,T1:T39,S1:S39)} | S14: 14 | T14: 115.895758280092 | V14: 2002-07-01 | W14: 7 | X14: 36.5 | AB14: 7 | AC14: 148 | AE14: 11 | AF14: 2001-11-01 | AG14: 3719219 | AI14: 64.4 | AJ14: 10
A15: 129.305702305035 | B15: 129.305702305035 | C15: of:=ORG.LIBREOFFICE.ROUNDSIG([.A15];9)=ORG.LIBREOFFICE.ROUNDSIG([.B15];9) -> true | D15: of:=FORMULA([.A15]) -> {=FORECAST.ETS.ADD(S1:S39,T1:T39,S1:S39)} | S15: 15 | T15: 110.064393884398 | V15: 2002-10-01 | W15: 8 | X15: 43 | AB15: 8 | AC15: 148 | AE15: 12 | AF15: 2001-12-01 | AG15: 3812981 | AI15: 56.45 | AJ15: 11
A16: 123.587140712742 | B16: 123.587140712742 | C16: of:=ORG.LIBREOFFICE.ROUNDSIG([.A16];9)=ORG.LIBREOFFICE.ROUNDSIG([.B16];9) -> true | D16: of:=FORMULA([.A16]) -> {=FORECAST.ETS.ADD(S1:S39,T1:T39,S1:S39)} | S16: 16 | T16: 109.083826188552 | V16: 2003-01-01 | W16: 9 | X16: 48.9 | AB16: 9 | AC16: 136 | AE16: 13 | AF16: of:=[.AF4]+365 -> 2002-01-01 | AG16: 3480451 | AI16: 48 | AJ16: 12
A17: 115.895758280092 | B17: 115.895758280092 | C17: of:=ORG.LIBREOFFICE.ROUNDSIG([.A17];9)=ORG.LIBREOFFICE.ROUNDSIG([.B17];9) -> true | D17: of:=FORMULA([.A17]) -> {=FORECAST.ETS.ADD(S1:S39,T1:T39,S1:S39)} | S17: 17 | T17: 113.690130542309 | V17: 2003-04-01 | W17: 10 | X17: 31.2 | AB17: 10 | AC17: 119 | AE17: 14 | AF17: of:=[.AF5]+365 -> 2002-02-01 | AG17: 3183133 | AI17: 53.583 | AJ17: 13
A18: 110.064393884398 | B18: 110.064393884398 | C18: of:=ORG.LIBREOFFICE.ROUNDSIG([.A18];9)=ORG.LIBREOFFICE.ROUNDSIG([.B18];9) -> true | D18: of:=FORMULA([.A18]) -> {=FORECAST.ETS.ADD(S1:S39,T1:T39,S1:S39)} | S18: 18 | T18: 122 | V18: 2003-07-01 | W18: 11 | X18: 37.7 | AB18: 11 | AC18: 104 | AE18: 15 | AF18: of:=[.AF6]+365 -> 2002-03-01 | AG18: 3764529 | AI18: 48.018 | AJ18: 14
A19: 109.083826188552 | B19: 109.083826188552 | C19: of:=ORG.LIBREOFFICE.ROUNDSIG([.A19];9)=ORG.LIBREOFFICE.ROUNDSIG([.B19];9) -> true | D19: of:=FORMULA([.A19]) -> {=FORECAST.ETS.ADD(S1:S39,T1:T39,S1:S39)} | S19: 19 | T19: 130.37414821866 | V19: 2003-10-01 | W19: 12 | X19: 40.4 | AB19: 12 | AC19: 118 | AE19: 16 | AF19: of:=[.AF7]+365 -> 2002-04-01 | AG19: 3500189 | AI19: 62.116 | AJ19: 15
A20: 113.690130542309 | B20: 113.690130542309 | C20: of:=ORG.LIBREOFFICE.ROUNDSIG([.A20];9)=ORG.LIBREOFFICE.ROUNDSIG([.B20];9) -> true | D20: of:=FORMULA([.A20]) -> {=FORECAST.ETS.ADD(S1:S39,T1:T39,S1:S39)} | S20: 20 | T20: 135.11313536205 | V20: 2004-01-01 | W20: 13 | X20: 51.2 | AB20: 13 | AC20: 115 | AE20: 17 | AF20: of:=[.AF8]+365 -> 2002-05-01 | AG20: 3389811 | AI20: 67.681 | AJ20: 16
A21: 122 | B21: 122 | C21: of:=ORG.LIBREOFFICE.ROUNDSIG([.A21];9)=ORG.LIBREOFFICE.ROUNDSIG([.B21];9) -> true | D21: of:=FORMULA([.A21]) -> {=FORECAST.ETS.ADD(S1:S39,T1:T39,S1:S39)} | S21: 21 | T21: 134.195413736738 | V21: 2004-04-01 | W21: 14 | X21: 31.9 | AB21: 14 | AC21: 126 | AE21: 18 | AF21: of:=[.AF9]+365 -> 2002-06-01 | AG21: 4348789 | AI21: 66.78 | AJ21: 17
A22: 130.37414821866 | B22: 130.37414821866 | C22: of:=ORG.LIBREOFFICE.ROUNDSIG([.A22];9)=ORG.LIBREOFFICE.ROUNDSIG([.B22];9) -> true | D22: of:=FORMULA([.A22]) -> {=FORECAST.ETS.ADD(S1:S39,T1:T39,S1:S39)} | S22: 22 | T22: 128.241049777238 | V22: 2004-07-01 | W22: 15 | X22: 41 | AB22: 15 | AC22: 141 | AE22: 19 | AF22: of:=[.AF10]+365 -> 2002-07-01 | AG22: 4442455 | AI22: 70.066 | AJ22: 18
A23: 135.11313536205 | B23: 135.11313536205 | C23: of:=ORG.LIBREOFFICE.ROUNDSIG([.A23];9)=ORG.LIBREOFFICE.ROUNDSIG([.B23];9) -> true | D23: of:=FORMULA([.A23]) -> {=FORECAST.ETS.ADD(S1:S39,T1:T39,S1:S39)} | S23: 23 | T23: 120.241849215595 | V23: 2004-10-01 | W23: 16 | X23: 43.8 | AB23: 16 | AC23: 135 | AE23: 20 | AF23: of:=[.AF11]+365 -> 2002-08-01 | AG23: 4593383 | AI23: 71.073 | AJ23: 19
A24: 134.195413736738 | B24: 134.195413736738 | C24: of:=ORG.LIBREOFFICE.ROUNDSIG([.A24];9)=ORG.LIBREOFFICE.ROUNDSIG([.B24];9) -> true | D24: of:=FORMULA([.A24]) -> {=FORECAST.ETS.ADD(S1:S39,T1:T39,S1:S39)} | S24: 24 | T24: 114.174682452695 | V24: 2005-01-01 | W24: 17 | X24: 55.6 | AB24: 17 | AC24: 125 | AE24: 21 | AF24: of:=[.AF12]+365 -> 2002-09-01 | AG24: 4029783 | AI24: 76.691 | AJ24: 20
A25: 128.241049777238 | B25: 128.241049777238 | C25: of:=ORG.LIBREOFFICE.ROUNDSIG([.A25];9)=ORG.LIBREOFFICE.ROUNDSIG([.B25];9) -> true | D25: of:=FORMULA([.A25]) -> {=FORECAST.ETS.ADD(S1:S39,T1:T39,S1:S39)} | S25: 25 | T25: 113.140662699697 | V25: 2005-04-01 | W25: 18 | X25: 33.9 | AB25: 18 | AC25: 149 | AE25: 22 | AF25: of:=[.AF13]+365 -> 2002-10-01 | AG25: 4211211 | AI25: 66.992 | AJ25: 21
A26: 120.241849215595 | B26: 120.241849215595 | C26: of:=ORG.LIBREOFFICE.ROUNDSIG([.A26];9)=ORG.LIBREOFFICE.ROUNDSIG([.B26];9) -> true | D26: of:=FORMULA([.A26]) -> {=FORECAST.ETS.ADD(S1:S39,T1:T39,S1:S39)} | S26: 26 | T26: 117.90087611795 | V26: 2005-07-01 | W26: 19 | X26: 42.1 | AB26: 19 | AC26: 170 | AE26: 23 | AF26: of:=[.AF14]+365 -> 2002-11-01 | AG26: 3854682 | AI26: 61.533 | AJ26: 22
A27: 114.174682452695 | B27: 114.174682452695 | C27: of:=ORG.LIBREOFFICE.ROUNDSIG([.A27];9)=ORG.LIBREOFFICE.ROUNDSIG([.B27];9) -> true | D27: of:=FORMULA([.A27]) -> {=FORECAST.ETS.ADD(S1:S39,T1:T39,S1:S39)} | S27: 27 | T27: 126.5 | V27: 2005-10-01 | W27: 20 | X27: 45.6 | AB27: 20 | AC27: 170 | AE27: 24 | AF27: of:=[.AF15]+365 -> 2002-12-01 | AG27: 3554831 | AI27: 62.275 | AJ27: 23
A28: 113.140662699697 | B28: 113.140662699697 | C28: of:=ORG.LIBREOFFICE.ROUNDSIG([.A28];9)=ORG.LIBREOFFICE.ROUNDSIG([.B28];9) -> true | D28: of:=FORMULA([.A28]) -> {=FORECAST.ETS.ADD(S1:S39,T1:T39,S1:S39)} | S28: 28 | T28: 135.163402643019 | V28: 2006-01-01 | W28: 21 | X28: 59.8 | AB28: 21 | AC28: 158 | AE28: 25 | AF28: of:=[.AF16]+365 -> 2003-01-01 | AG28: 3488309 | AI28: 51.675 | AJ28: 24
A29: 117.90087611795 | B29: 117.90087611795 | C29: of:=ORG.LIBREOFFICE.ROUNDSIG([.A29];9)=ORG.LIBREOFFICE.ROUNDSIG([.B29];9) -> true | D29: of:=FORMULA([.A29]) -> {=FORECAST.ETS.ADD(S1:S39,T1:T39,S1:S39)} | S29: 29 | T29: 140.056298850906 | V29: 2006-04-01 | W29: 22 | X29: 35.2 | AB29: 22 | AC29: 133 | AE29: 26 | AF29: of:=[.AF17]+365 -> 2003-02-01 | AG29: 3270444 | AI29: 60.146 | AJ29: 25
A30: 126.5 | B30: 126.5 | C30: of:=ORG.LIBREOFFICE.ROUNDSIG([.A30];9)=ORG.LIBREOFFICE.ROUNDSIG([.B30];9) -> true | D30: of:=FORMULA([.A30]) -> {=FORECAST.ETS.ADD(S1:S39,T1:T39,S1:S39)} | S30: 30 | T30: 139.085125168441 | V30: 2006-07-01 | W30: 23 | X30: 44.3 | AB30: 23 | AC30: 114 | AE30: 27 | AF30: of:=[.AF18]+365 -> 2003-03-01 | AG30: 3709943 | AI30: 56.434 | AJ30: 26
A31: 135.163402643019 | B31: 135.163402643019 | C31: of:=ORG.LIBREOFFICE.ROUNDSIG([.A31];9)=ORG.LIBREOFFICE.ROUNDSIG([.B31];9) -> true | D31: of:=FORMULA([.A31]) -> {=FORECAST.ETS.ADD(S1:S39,T1:T39,S1:S39)} | S31: 31 | T31: 132.894958841735 | V31: 2006-10-01 | W31: 24 | X31: 47.9 | AB31: 24 | AC31: 140 | AE31: 28 | AF31: of:=[.AF19]+365 -> 2003-04-01 | AG31: 3655530 | AI31: 67.222 | AJ31: 27
A32: 140.056298850906 | B32: 140.056298850906 | C32: of:=ORG.LIBREOFFICE.ROUNDSIG([.A32];9)=ORG.LIBREOFFICE.ROUNDSIG([.B32];9) -> true | D32: of:=FORMULA([.A32]) -> {=FORECAST.ETS.ADD(S1:S39,T1:T39,S1:S39)} | S32: 32 | T32: 124.587940151099 | V32: 2007-01-01 | W32: 25 | AB32: 25 | AC32: 145 | AE32: 29 | AF32: of:=[.AF20]+365 -> 2003-05-01 | AG32: 4097990 | AI32: 70.76 | AJ32: 28
A33: 139.085125168441 | B33: 139.085125168441 | C33: of:=ORG.LIBREOFFICE.ROUNDSIG([.A33];9)=ORG.LIBREOFFICE.ROUNDSIG([.B33];9) -> true | D33: of:=FORMULA([.A33]) -> {=FORECAST.ETS.ADD(S1:S39,T1:T39,S1:S39)} | S33: 33 | T33: 118.284971020992 | V33: 2007-04-01 | W33: 26 | AB33: 26 | AC33: 150 | AE33: 30 | AF33: of:=[.AF21]+365 -> 2003-06-01 | AG33: 4472583 | AI33: 73.95 | AJ33: 29
A34: 132.894958841735 | B34: 132.894958841735 | C34: of:=ORG.LIBREOFFICE.ROUNDSIG([.A34];9)=ORG.LIBREOFFICE.ROUNDSIG([.B34];9) -> true | D34: of:=FORMULA([.A34]) -> {=FORECAST.ETS.ADD(S1:S39,T1:T39,S1:S39)} | S34: 34 | T34: 117.197499210841 | V34: 2007-07-01 | W34: 27 | AB34: 27 | AC34: 178 | AE34: 31 | AF34: of:=[.AF22]+365 -> 2003-07-01 | AG34: 4531711 | AI34: 79.286 | AJ34: 30
A35: 124.587940151099 | B35: 124.587940151099 | C35: of:=ORG.LIBREOFFICE.ROUNDSIG([.A35];9)=ORG.LIBREOFFICE.ROUNDSIG([.B35];9) -> true | D35: of:=FORMULA([.A35]) -> {=FORECAST.ETS.ADD(S1:S39,T1:T39,S1:S39)} | S35: 35 | T35: 122.111621693591 | V35: 2007-10-01 | W35: 28 | AB35: 28 | AC35: 163 | AE35: 32 | AF35: of:=[.AF23]+365 -> 2003-08-01 | AG35: 4504466 | AI35: 77.372 | AJ35: 31
A36: 118.284971020992 | B36: 118.284971020992 | C36: of:=ORG.LIBREOFFICE.ROUNDSIG([.A36];9)=ORG.LIBREOFFICE.ROUNDSIG([.B36];9) -> true | D36: of:=FORMULA([.A36]) -> {=FORECAST.ETS.ADD(S1:S39,T1:T39,S1:S39)} | S36: 36 | T36: 131 | V36: 2008-01-01 | W36: 29 | AB36: 29 | AC36: 172 | AE36: 33 | AF36: of:=[.AF24]+365 -> 2003-09-01 | AG36: 4054338 | AI36: 79.808 | AJ36: 32
A37: 117.197499210841 | B37: 117.197499210841 | C37: of:=ORG.LIBREOFFICE.ROUNDSIG([.A37];9)=ORG.LIBREOFFICE.ROUNDSIG([.B37];9) -> true | D37: of:=FORMULA([.A37]) -> {=FORECAST.ETS.ADD(S1:S39,T1:T39,S1:S39)} | S37: 37 | T37: 139.952657067378 | V37: 2008-04-01 | W37: 30 | AB37: 30 | AC37: 178 | AE37: 34 | AF37: of:=[.AF25]+365 -> 2003-10-01 | AI37: 71.978 | AJ37: 33
A38: 122.111621693591 | B38: 122.111621693591 | C38: of:=ORG.LIBREOFFICE.ROUNDSIG([.A38];9)=ORG.LIBREOFFICE.ROUNDSIG([.B38];9) -> true | D38: of:=FORMULA([.A38]) -> {=FORECAST.ETS.ADD(S1:S39,T1:T39,S1:S39)} | S38: 38 | T38: 144.999462339761 | V38: 2008-07-01 | W38: 31 | AB38: 31 | AC38: 199 | AE38: 35 | AF38: of:=[.AF26]+365 -> 2003-11-01 | AI38: 70.702 | AJ38: 34
A39: 131 | B39: 131 | C39: of:=ORG.LIBREOFFICE.ROUNDSIG([.A39];9)=ORG.LIBREOFFICE.ROUNDSIG([.B39];9) -> true | D39: of:=FORMULA([.A39]) -> {=FORECAST.ETS.ADD(S1:S39,T1:T39,S1:S39)} | S39: 39 | T39: 143.974836600144 | V39: 2008-10-01 | W39: 32 | AB39: 32 | AC39: 199 | AE39: 36 | AF39: of:=[.AF27]+365 -> 2003-12-01 | AI39: 65.946 | AJ39: 35
A40: 139.952657067378 | B40: 139.952657067378 | C40: of:=ORG.LIBREOFFICE.ROUNDSIG([.A40];9)=ORG.LIBREOFFICE.ROUNDSIG([.B40];9) -> true | D40: of:=FORMULA([.A40]) -> {=FORECAST.ETS.ADD(S1:S39,T1:T39,S1:S39)} | V40: 2009-01-01 | W40: 33 | AB40: 33 | AC40: 184 | AE40: 37 | AF40: of:=[.AF28]+365 -> 2004-01-01 | AI40: 55.274 | AJ40: 36
A41: 144.999462339761 | B41: 144.999462339761 | C41: of:=ORG.LIBREOFFICE.ROUNDSIG([.A41];9)=ORG.LIBREOFFICE.ROUNDSIG([.B41];9) -> true | D41: of:=FORMULA([.A41]) -> {=FORECAST.ETS.ADD(S1:S39,T1:T39,S1:S39)} | V41: 2009-04-01 | W41: 34 | AB41: 34 | AC41: 162 | AE41: 38 | AF41: of:=[.AF29]+365 -> 2004-02-01 | AI41: 61.08 | AJ41: 37
A42: 143.974836600144 | B42: 143.974836600144 | C42: of:=ORG.LIBREOFFICE.ROUNDSIG([.A42];9)=ORG.LIBREOFFICE.ROUNDSIG([.B42];9) -> true | D42: of:=FORMULA([.A42]) -> {=FORECAST.ETS.ADD(S1:S39,T1:T39,S1:S39)} | AB42: 35 | AC42: 146 | AE42: 39 | AF42: of:=[.AF30]+365 -> 2004-02-29 | AI42: 59.7 | AJ42: 38
A43: of:=COM.MICROSOFT.FORECAST.ETS(0;[.P2:.P6];[.Q2:.Q6]) ->  | B43: #NUM! | C43: of:=ISERROR([.A43]) -> true | D43: of:=FORMULA([.A43]) -> =FORECAST.ETS.ADD(0,P2:P6,Q2:Q6) | AB43: 36 | AC43: 166 | AE43: 40 | AF43: of:=[.AF31]+365 -> 2004-03-31 | AI43: 69.48 | AJ43: 39
A44: of:=COM.MICROSOFT.FORECAST.ETS(-30;[.P2:.P6];[.Q2:.Q6]) ->  | B44: #NUM! | C44: of:=ISERROR([.A44]) -> true | D44: of:=FORMULA([.A44]) -> =FORECAST.ETS.ADD(-30,P2:P6,Q2:Q6) | AB44: 37 | AE44: 41 | AF44: of:=[.AF32]+365 -> 2004-04-30 | AI44: 77.34 | AJ44: 40
A45: of:=COM.MICROSOFT.FORECAST.ETS(8; {1;2;3}; {4;5;6}) -> 5 | B45: 5 | C45: of:=ORG.LIBREOFFICE.ROUNDSIG([.A45];9)=ORG.LIBREOFFICE.ROUNDSIG([.B45];9) -> true | D45: of:=FORMULA([.A45]) -> =FORECAST.ETS.ADD(8, {1,2,3}, {4,5,6}) | AB45: 38 | AE45: 42 | AF45: of:=[.AF33]+365 -> 2004-05-31 | AI45: 74.16 | AJ45: 41
A46: of:=COM.MICROSOFT.FORECAST.ETS(7; {5.8;-1}; {2;-5}) ->  | B46: #VALUE! | C46: of:=ISERROR([.A46]) -> true | D46: of:=FORMULA([.A46]) -> =FORECAST.ETS.ADD(7, {5.8,-1}, {2,-5}) | AB46: 39 | AE46: 43 | AF46: of:=[.AF34]+365 -> 2004-06-30 | AI46: 83.04 | AJ46: 42
A47: of:=COM.MICROSOFT.FORECAST.ETS(50; {-1;-2;-3;-4}; {10;20;30;40}) -> -5 | B47: -5 | C47: of:=ORG.LIBREOFFICE.ROUNDSIG([.A47];9)=ORG.LIBREOFFICE.ROUNDSIG([.B47];9) -> true | D47: of:=FORMULA([.A47]) -> =FORECAST.ETS.ADD(50, {-1,-2,-3,-4}, {10,20,30,40}) | E47: "Not a Number", but that shouldn't be the final result and indicates bad error handling. | AB47: 40 | AE47: 44 | AF47: of:=[.AF35]+365 -> 2004-07-31 | AI47: 80.16 | AJ47: 43
A48: of:=COM.MICROSOFT.FORECAST.ETS([.V31:.V41];[.X8:.X31];[.V8:.V31];[.W3];[.W4];[.W5]) -> 47.9 | B48: 47.9 | C48: of:=ORG.LIBREOFFICE.ROUNDSIG([.A48];9)=ORG.LIBREOFFICE.ROUNDSIG([.B48];9) -> true | D48: of:=FORMULA([.A48]) -> {=FORECAST.ETS.ADD(V31:V41,X8:X31,V8:V31,W3,W4,W5)} | E48: Problem seems to be caused by linear data for which the period length must be calculated. I changed the code to recognise linear data and switch from ETS to EDS, which is _much_ cheaper and returns an expected result (-5 in the above example). However, this is no longer compatible with Excel, which doesn't recognise this and returns #N/A. What to do, follow Excel or opt for the neater solution, resulting in a valid forecast? | AB48: 41 | AE48: 45 | AF48: of:=[.AF36]+365 -> 2004-08-31 | AI48: 81.12 | AJ48: 44
A49: 60.5496314322673 | B49: 60.5496314322673 | C49: of:=ORG.LIBREOFFICE.ROUNDSIG([.A49];9)=ORG.LIBREOFFICE.ROUNDSIG([.B49];9) -> true | D49: of:=FORMULA([.A49]) -> {=FORECAST.ETS.ADD(V31:V41,X8:X31,V8:V31,W3,W4,W5)} | AB49: 42 | AE49: 46 | AF49: of:=[.AF37]+365 -> 2004-09-30 | AI49: 84.12 | AJ49: 45
A50: 36.6603356411902 | B50: 36.6603356411902 | C50: of:=ORG.LIBREOFFICE.ROUNDSIG([.A50];9)=ORG.LIBREOFFICE.ROUNDSIG([.B50];9) -> true | D50: of:=FORMULA([.A50]) -> {=FORECAST.ETS.ADD(V31:V41,X8:X31,V8:V31,W3,W4,W5)} | AB50: 43 | AE50: 47 | AF50: of:=[.AF38]+365 -> 2004-10-31 | AI50: 69 | AJ50: 46
A51: 46.015291770592 | B51: 46.015291770592 | C51: of:=ORG.LIBREOFFICE.ROUNDSIG([.A51];9)=ORG.LIBREOFFICE.ROUNDSIG([.B51];9) -> true | D51: of:=FORMULA([.A51]) -> {=FORECAST.ETS.ADD(V31:V41,X8:X31,V8:V31,W3,W4,W5)} | AB51: 44 | AE51: 48 | AF51: of:=[.AF39]+365 -> 2004-11-30 | AI51: 68.4 | AJ51: 47
A52: 49.8968323640595 | B52: 49.8968323640595 | C52: of:=ORG.LIBREOFFICE.ROUNDSIG([.A52];9)=ORG.LIBREOFFICE.ROUNDSIG([.B52];9) -> true | D52: of:=FORMULA([.A52]) -> {=FORECAST.ETS.ADD(V31:V41,X8:X31,V8:V31,W3,W4,W5)} | AB52: 45 | AE52: 49 | AF52: of:=[.AF40]+366 -> 2005-01-01 | AI52: 54.54 | AJ52: 48
A53: 62.3855834572025 | B53: 62.3855834572025 | C53: of:=ORG.LIBREOFFICE.ROUNDSIG([.A53];9)=ORG.LIBREOFFICE.ROUNDSIG([.B53];9) -> true | D53: of:=FORMULA([.A53]) -> {=FORECAST.ETS.ADD(V31:V41,X8:X31,V8:V31,W3,W4,W5)} | AB53: 46 | AE53: 50 | AF53: of:=[.AF41]+366 -> 2005-02-01 | AI53: 66.624 | AJ53: 49
A54: 38.4962876661254 | B54: 38.4962876661254 | C54: of:=ORG.LIBREOFFICE.ROUNDSIG([.A54];9)=ORG.LIBREOFFICE.ROUNDSIG([.B54];9) -> true | D54: of:=FORMULA([.A54]) -> {=FORECAST.ETS.ADD(V31:V41,X8:X31,V8:V31,W3,W4,W5)} | AB54: 47 | AE54: 51 | AF54: of:=[.AF42]+366 -> 2005-03-01 | AI54: 58.048 | AJ54: 50
A55: 47.8512437955272 | B55: 47.8512437955272 | C55: of:=ORG.LIBREOFFICE.ROUNDSIG([.A55];9)=ORG.LIBREOFFICE.ROUNDSIG([.B55];9) -> true | D55: of:=FORMULA([.A55]) -> {=FORECAST.ETS.ADD(V31:V41,X8:X31,V8:V31,W3,W4,W5)} | AB55: 48 | AE55: 52 | AF55: of:=[.AF43]+366 -> 2005-04-01 | AI55: 70.528 | AJ55: 51
A56: 51.7327843889948 | B56: 51.7327843889948 | C56: of:=ORG.LIBREOFFICE.ROUNDSIG([.A56];9)=ORG.LIBREOFFICE.ROUNDSIG([.B56];9) -> true | D56: of:=FORMULA([.A56]) -> {=FORECAST.ETS.ADD(V31:V41,X8:X31,V8:V31,W3,W4,W5)} | AB56: 49 | AE56: 53 | AF56: of:=[.AF44]+366 -> 2005-05-01 | AI56: 79.424 | AJ56: 52
A57: 64.2215354821377 | B57: 64.2215354821377 | C57: of:=ORG.LIBREOFFICE.ROUNDSIG([.A57];9)=ORG.LIBREOFFICE.ROUNDSIG([.B57];9) -> true | D57: of:=FORMULA([.A57]) -> {=FORECAST.ETS.ADD(V31:V41,X8:X31,V8:V31,W3,W4,W5)} | AB57: 50 | AE57: 54 | AF57: of:=[.AF45]+366 -> 2005-06-01 | AI57: 79.232 | AJ57: 53
A58: 40.3322396910606 | B58: 40.3322396910606 | C58: of:=ORG.LIBREOFFICE.ROUNDSIG([.A58];9)=ORG.LIBREOFFICE.ROUNDSIG([.B58];9) -> true | D58: of:=FORMULA([.A58]) -> {=FORECAST.ETS.ADD(V31:V41,X8:X31,V8:V31,W3,W4,W5)} | AB58: 51 | AE58: 55 | AF58: of:=[.AF46]+366 -> 2005-07-01 | AI58: 93.056 | AJ58: 54
A59: of:=COM.MICROSOFT.FORECAST.ETS([.AB43:.AB70];[.AC8:.AC43];[.AB8:.AB43];[.AB3];[.AB4];[.AB5]) -> 166 | B59: 166 | C59: of:=ORG.LIBREOFFICE.ROUNDSIG([.A59];9)=ORG.LIBREOFFICE.ROUNDSIG([.B59];9) -> true | D59: of:=FORMULA([.A59]) -> {=FORECAST.ETS.ADD(AB43:AB70,AC8:AC43,AB8:AB43,AB3,AB4,AB5)} | AB59: 52 | AE59: 56 | AF59: of:=[.AF47]+366 -> 2005-08-01 | AI59: 93.76 | AJ59: 55
A60: 165.563797808596 | B60: 165.563797808596 | C60: of:=ORG.LIBREOFFICE.ROUNDSIG([.A60];9)=ORG.LIBREOFFICE.ROUNDSIG([.B60];9) -> true | D60: of:=FORMULA([.A60]) -> {=FORECAST.ETS.ADD(AB43:AB70,AC8:AC43,AB8:AB43,AB3,AB4,AB5)} | AB60: 53 | AE60: 57 | AF60: of:=[.AF48]+366 -> 2005-09-01 | AI60: 93.696 | AJ60: 56
A61: 174.139252403617 | B61: 174.139252403617 | C61: of:=ORG.LIBREOFFICE.ROUNDSIG([.A61];9)=ORG.LIBREOFFICE.ROUNDSIG([.B61];9) -> true | D61: of:=FORMULA([.A61]) -> {=FORECAST.ETS.ADD(AB43:AB70,AC8:AC43,AB8:AB43,AB3,AB4,AB5)} | AB61: 54 | AE61: 58 | AF61: of:=[.AF49]+366 -> 2005-10-01 | AI61: 94.08 | AJ61: 57
A62: 195.278082026658 | B62: 195.278082026658 | C62: of:=ORG.LIBREOFFICE.ROUNDSIG([.A62];9)=ORG.LIBREOFFICE.ROUNDSIG([.B62];9) -> true | D62: of:=FORMULA([.A62]) -> {=FORECAST.ETS.ADD(AB43:AB70,AC8:AC43,AB8:AB43,AB3,AB4,AB5)} | AB62: 55 | AE62: 59 | AF62: of:=[.AF50]+366 -> 2005-11-01 | AI62: 82.624 | AJ62: 58
A63: 185.339158243359 | B63: 185.339158243359 | C63: of:=ORG.LIBREOFFICE.ROUNDSIG([.A63];9)=ORG.LIBREOFFICE.ROUNDSIG([.B63];9) -> true | D63: of:=FORMULA([.A63]) -> {=FORECAST.ETS.ADD(AB43:AB70,AC8:AC43,AB8:AB43,AB3,AB4,AB5)} | AB63: 56 | AE63: 60 | AF63: of:=[.AF51]+366 -> 2005-12-01 | AI63: 75.776 | AJ63: 59
A64: 185.286794596348 | B64: 185.286794596348 | C64: of:=ORG.LIBREOFFICE.ROUNDSIG([.A64];9)=ORG.LIBREOFFICE.ROUNDSIG([.B64];9) -> true | D64: of:=FORMULA([.A64]) -> {=FORECAST.ETS.ADD(AB43:AB70,AC8:AC43,AB8:AB43,AB3,AB4,AB5)} | AB64: 57 | AI64: 58.048 | AJ64: 60
A65: 196.644723155341 | B65: 196.644723155341 | C65: of:=ORG.LIBREOFFICE.ROUNDSIG([.A65];9)=ORG.LIBREOFFICE.ROUNDSIG([.B65];9) -> true | D65: of:=FORMULA([.A65]) -> {=FORECAST.ETS.ADD(AB43:AB70,AC8:AC43,AB8:AB43,AB3,AB4,AB5)} | AB65: 58 | AJ65: 61
A66: 215.059081287518 | B66: 215.059081287518 | C66: of:=ORG.LIBREOFFICE.ROUNDSIG([.A66];9)=ORG.LIBREOFFICE.ROUNDSIG([.B66];9) -> true | D66: of:=FORMULA([.A66]) -> {=FORECAST.ETS.ADD(AB43:AB70,AC8:AC43,AB8:AB43,AB3,AB4,AB5)} | AB66: 59 | AJ66: 62
A67: 213.233880889475 | B67: 213.233880889475 | C67: of:=ORG.LIBREOFFICE.ROUNDSIG([.A67];9)=ORG.LIBREOFFICE.ROUNDSIG([.B67];9) -> true | D67: of:=FORMULA([.A67]) -> {=FORECAST.ETS.ADD(AB43:AB70,AC8:AC43,AB8:AB43,AB3,AB4,AB5)} | AB67: 60 | AJ67: 63
A68: 198.870060704206 | B68: 198.870060704206 | C68: of:=ORG.LIBREOFFICE.ROUNDSIG([.A68];9)=ORG.LIBREOFFICE.ROUNDSIG([.B68];9) -> true | D68: of:=FORMULA([.A68]) -> {=FORECAST.ETS.ADD(AB43:AB70,AC8:AC43,AB8:AB43,AB3,AB4,AB5)} | AB68: 61 | AJ68: 64
A69: 177.979089522812 | B69: 177.979089522812 | C69: of:=ORG.LIBREOFFICE.ROUNDSIG([.A69];9)=ORG.LIBREOFFICE.ROUNDSIG([.B69];9) -> true | D69: of:=FORMULA([.A69]) -> {=FORECAST.ETS.ADD(AB43:AB70,AC8:AC43,AB8:AB43,AB3,AB4,AB5)} | AB69: 62 | AJ69: 65
A70: 163.021991570337 | B70: 163.021991570337 | C70: of:=ORG.LIBREOFFICE.ROUNDSIG([.A70];9)=ORG.LIBREOFFICE.ROUNDSIG([.B70];9) -> true | D70: of:=FORMULA([.A70]) -> {=FORECAST.ETS.ADD(AB43:AB70,AC8:AC43,AB8:AB43,AB3,AB4,AB5)} | AB70: 63 | AJ70: 66
A71: 184.246477235911 | B71: 184.246477235911 | C71: of:=ORG.LIBREOFFICE.ROUNDSIG([.A71];9)=ORG.LIBREOFFICE.ROUNDSIG([.B71];9) -> true | D71: of:=FORMULA([.A71]) -> {=FORECAST.ETS.ADD(AB43:AB70,AC8:AC43,AB8:AB43,AB3,AB4,AB5)} | AJ71: 67
A72: 183.063925853482 | B72: 183.063925853482 | C72: of:=ORG.LIBREOFFICE.ROUNDSIG([.A72];9)=ORG.LIBREOFFICE.ROUNDSIG([.B72];9) -> true | D72: of:=FORMULA([.A72]) -> {=FORECAST.ETS.ADD(AB43:AB70,AC8:AC43,AB8:AB43,AB3,AB4,AB5)} | AJ72: 68
A73: 191.639380448504 | B73: 191.639380448504 | C73: of:=ORG.LIBREOFFICE.ROUNDSIG([.A73];9)=ORG.LIBREOFFICE.ROUNDSIG([.B73];9) -> true | D73: of:=FORMULA([.A73]) -> {=FORECAST.ETS.ADD(AB43:AB70,AC8:AC43,AB8:AB43,AB3,AB4,AB5)} | AJ73: 69
A74: 212.778210071544 | B74: 212.778210071544 | C74: of:=ORG.LIBREOFFICE.ROUNDSIG([.A74];9)=ORG.LIBREOFFICE.ROUNDSIG([.B74];9) -> true | D74: of:=FORMULA([.A74]) -> {=FORECAST.ETS.ADD(AB43:AB70,AC8:AC43,AB8:AB43,AB3,AB4,AB5)} | AJ74: 70
A75: 202.839286288246 | B75: 202.839286288246 | C75: of:=ORG.LIBREOFFICE.ROUNDSIG([.A75];9)=ORG.LIBREOFFICE.ROUNDSIG([.B75];9) -> true | D75: of:=FORMULA([.A75]) -> {=FORECAST.ETS.ADD(AB43:AB70,AC8:AC43,AB8:AB43,AB3,AB4,AB5)} | AJ75: 71
A76: 202.786922641234 | B76: 202.786922641234 | C76: of:=ORG.LIBREOFFICE.ROUNDSIG([.A76];9)=ORG.LIBREOFFICE.ROUNDSIG([.B76];9) -> true | D76: of:=FORMULA([.A76]) -> {=FORECAST.ETS.ADD(AB43:AB70,AC8:AC43,AB8:AB43,AB3,AB4,AB5)} | AJ76: 72
A77: 214.144851200228 | B77: 214.144851200228 | C77: of:=ORG.LIBREOFFICE.ROUNDSIG([.A77];9)=ORG.LIBREOFFICE.ROUNDSIG([.B77];9) -> true | D77: of:=FORMULA([.A77]) -> {=FORECAST.ETS.ADD(AB43:AB70,AC8:AC43,AB8:AB43,AB3,AB4,AB5)} | AJ77: 73
A78: 232.559209332405 | B78: 232.559209332405 | C78: of:=ORG.LIBREOFFICE.ROUNDSIG([.A78];9)=ORG.LIBREOFFICE.ROUNDSIG([.B78];9) -> true | D78: of:=FORMULA([.A78]) -> {=FORECAST.ETS.ADD(AB43:AB70,AC8:AC43,AB8:AB43,AB3,AB4,AB5)} | AJ78: 74
A79: 230.734008934362 | B79: 230.734008934362 | C79: of:=ORG.LIBREOFFICE.ROUNDSIG([.A79];9)=ORG.LIBREOFFICE.ROUNDSIG([.B79];9) -> true | D79: of:=FORMULA([.A79]) -> {=FORECAST.ETS.ADD(AB43:AB70,AC8:AC43,AB8:AB43,AB3,AB4,AB5)} | AJ79: 75
A80: 216.370188749093 | B80: 216.370188749093 | C80: of:=ORG.LIBREOFFICE.ROUNDSIG([.A80];9)=ORG.LIBREOFFICE.ROUNDSIG([.B80];9) -> true | D80: of:=FORMULA([.A80]) -> {=FORECAST.ETS.ADD(AB43:AB70,AC8:AC43,AB8:AB43,AB3,AB4,AB5)} | AJ80: 76
A81: 195.479217567699 | B81: 195.479217567699 | C81: of:=ORG.LIBREOFFICE.ROUNDSIG([.A81];9)=ORG.LIBREOFFICE.ROUNDSIG([.B81];9) -> true | D81: of:=FORMULA([.A81]) -> {=FORECAST.ETS.ADD(AB43:AB70,AC8:AC43,AB8:AB43,AB3,AB4,AB5)} | AJ81: 77
A82: 180.522119615224 | B82: 180.522119615224 | C82: of:=ORG.LIBREOFFICE.ROUNDSIG([.A82];9)=ORG.LIBREOFFICE.ROUNDSIG([.B82];9) -> true | D82: of:=FORMULA([.A82]) -> {=FORECAST.ETS.ADD(AB43:AB70,AC8:AC43,AB8:AB43,AB3,AB4,AB5)} | AJ82: 78
A83: 201.746605280797 | B83: 201.746605280797 | C83: of:=ORG.LIBREOFFICE.ROUNDSIG([.A83];9)=ORG.LIBREOFFICE.ROUNDSIG([.B83];9) -> true | D83: of:=FORMULA([.A83]) -> {=FORECAST.ETS.ADD(AB43:AB70,AC8:AC43,AB8:AB43,AB3,AB4,AB5)} | AJ83: 79
A84: 200.564053898369 | B84: 200.564053898369 | C84: of:=ORG.LIBREOFFICE.ROUNDSIG([.A84];9)=ORG.LIBREOFFICE.ROUNDSIG([.B84];9) -> true | D84: of:=FORMULA([.A84]) -> {=FORECAST.ETS.ADD(AB43:AB70,AC8:AC43,AB8:AB43,AB3,AB4,AB5)} | AJ84: 80
A85: 209.13950849339 | B85: 209.13950849339 | C85: of:=ORG.LIBREOFFICE.ROUNDSIG([.A85];9)=ORG.LIBREOFFICE.ROUNDSIG([.B85];9) -> true | D85: of:=FORMULA([.A85]) -> {=FORECAST.ETS.ADD(AB43:AB70,AC8:AC43,AB8:AB43,AB3,AB4,AB5)} | AJ85: 81
A86: 230.278338116431 | B86: 230.278338116431 | C86: of:=ORG.LIBREOFFICE.ROUNDSIG([.A86];9)=ORG.LIBREOFFICE.ROUNDSIG([.B86];9) -> true | D86: of:=FORMULA([.A86]) -> {=FORECAST.ETS.ADD(AB43:AB70,AC8:AC43,AB8:AB43,AB3,AB4,AB5)} | AJ86: 82
A87: of:=COM.MICROSOFT.FORECAST.ETS([.AE36:.AE63];[.AG4:.AG36];[.AE4:.AE36];12;1;1) -> 4054338 | B87: 4054338 | C87: of:=ORG.LIBREOFFICE.ROUNDSIG([.A87];9)=ORG.LIBREOFFICE.ROUNDSIG([.B87];9) -> true | D87: of:=FORMULA([.A87]) -> {=FORECAST.ETS.ADD(AE36:AE63,AG4:AG36,AE4:AE36,12,1,1)} | AJ87: 83
A88: 4299395.20860622 | B88: 4299395.20860622 | C88: of:=ORG.LIBREOFFICE.ROUNDSIG([.A88];9)=ORG.LIBREOFFICE.ROUNDSIG([.B88];9) -> true | D88: of:=FORMULA([.A88]) -> {=FORECAST.ETS.ADD(AE36:AE63,AG4:AG36,AE4:AE36,12,1,1)} | AJ88: 84
A89: 4132679.8845827 | B89: 4132679.8845827 | C89: of:=ORG.LIBREOFFICE.ROUNDSIG([.A89];9)=ORG.LIBREOFFICE.ROUNDSIG([.B89];9) -> true | D89: of:=FORMULA([.A89]) -> {=FORECAST.ETS.ADD(AE36:AE63,AG4:AG36,AE4:AE36,12,1,1)} | AJ89: 85
A90: 4100196.91382762 | B90: 4100196.91382762 | C90: of:=ORG.LIBREOFFICE.ROUNDSIG([.A90];9)=ORG.LIBREOFFICE.ROUNDSIG([.B90];9) -> true | D90: of:=FORMULA([.A90]) -> {=FORECAST.ETS.ADD(AE36:AE63,AG4:AG36,AE4:AE36,12,1,1)} | AJ90: 86
A91: 3855816.71930321 | B91: 3855816.71930321 | C91: of:=ORG.LIBREOFFICE.ROUNDSIG([.A91];9)=ORG.LIBREOFFICE.ROUNDSIG([.B91];9) -> true | D91: of:=FORMULA([.A91]) -> {=FORECAST.ETS.ADD(AE36:AE63,AG4:AG36,AE4:AE36,12,1,1)} | AJ91: 87
A92: 3487433.71978657 | B92: 3487433.71978657 | C92: of:=ORG.LIBREOFFICE.ROUNDSIG([.A92];9)=ORG.LIBREOFFICE.ROUNDSIG([.B92];9) -> true | D92: of:=FORMULA([.A92]) -> {=FORECAST.ETS.ADD(AE36:AE63,AG4:AG36,AE4:AE36,12,1,1)} | AJ92: 88
A93: 3868249.92342637 | B93: 3868249.92342637 | C93: of:=ORG.LIBREOFFICE.ROUNDSIG([.A93];9)=ORG.LIBREOFFICE.ROUNDSIG([.B93];9) -> true | D93: of:=FORMULA([.A93]) -> {=FORECAST.ETS.ADD(AE36:AE63,AG4:AG36,AE4:AE36,12,1,1)} | AJ93: 89
A94: 4006468.54357238 | B94: 4006468.54357238 | C94: of:=ORG.LIBREOFFICE.ROUNDSIG([.A94];9)=ORG.LIBREOFFICE.ROUNDSIG([.B94];9) -> true | D94: of:=FORMULA([.A94]) -> {=FORECAST.ETS.ADD(AE36:AE63,AG4:AG36,AE4:AE36,12,1,1)} | AJ94: 90
A95: 4256968.92405459 | B95: 4256968.92405459 | C95: of:=ORG.LIBREOFFICE.ROUNDSIG([.A95];9)=ORG.LIBREOFFICE.ROUNDSIG([.B95];9) -> true | D95: of:=FORMULA([.A95]) -> {=FORECAST.ETS.ADD(AE36:AE63,AG4:AG36,AE4:AE36,12,1,1)} | AJ95: 91
A96: 4698102.21412853 | B96: 4698102.21412853 | C96: of:=ORG.LIBREOFFICE.ROUNDSIG([.A96];9)=ORG.LIBREOFFICE.ROUNDSIG([.B96];9) -> true | D96: of:=FORMULA([.A96]) -> {=FORECAST.ETS.ADD(AE36:AE63,AG4:AG36,AE4:AE36,12,1,1)} | AJ96: 92
A97: 4820462.29017543 | B97: 4820462.29017543 | C97: of:=ORG.LIBREOFFICE.ROUNDSIG([.A97];9)=ORG.LIBREOFFICE.ROUNDSIG([.B97];9) -> true | D97: of:=FORMULA([.A97]) -> {=FORECAST.ETS.ADD(AE36:AE63,AG4:AG36,AE4:AE36,12,1,1)} | AJ97: 93
A98: 4845679.99679883 | B98: 4845679.99679883 | C98: of:=ORG.LIBREOFFICE.ROUNDSIG([.A98];9)=ORG.LIBREOFFICE.ROUNDSIG([.B98];9) -> true | D98: of:=FORMULA([.A98]) -> {=FORECAST.ETS.ADD(AE36:AE63,AG4:AG36,AE4:AE36,12,1,1)} | AJ98: 94
A99: 4479965.92570079 | B99: 4479965.92570079 | C99: of:=ORG.LIBREOFFICE.ROUNDSIG([.A99];9)=ORG.LIBREOFFICE.ROUNDSIG([.B99];9) -> true | D99: of:=FORMULA([.A99]) -> {=FORECAST.ETS.ADD(AE36:AE63,AG4:AG36,AE4:AE36,12,1,1)} | AJ99: 95
A100: 4528488.54193955 | B100: 4528488.54193955 | C100: of:=ORG.LIBREOFFICE.ROUNDSIG([.A100];9)=ORG.LIBREOFFICE.ROUNDSIG([.B100];9) -> true | D100: of:=FORMULA([.A100]) -> {=FORECAST.ETS.ADD(AE36:AE63,AG4:AG36,AE4:AE36,12,1,1)} | AJ100: 96
A101: 4361773.21791604 | B101: 4361773.21791604 | C101: of:=ORG.LIBREOFFICE.ROUNDSIG([.A101];9)=ORG.LIBREOFFICE.ROUNDSIG([.B101];9) -> true | D101: of:=FORMULA([.A101]) -> {=FORECAST.ETS.ADD(AE36:AE63,AG4:AG36,AE4:AE36,12,1,1)}
A102: 4329290.24716095 | B102: 4329290.24716095 | C102: of:=ORG.LIBREOFFICE.ROUNDSIG([.A102];9)=ORG.LIBREOFFICE.ROUNDSIG([.B102];9) -> true | D102: of:=FORMULA([.A102]) -> {=FORECAST.ETS.ADD(AE36:AE63,AG4:AG36,AE4:AE36,12,1,1)}
A103: 4084910.05263654 | B103: 4084910.05263654 | C103: of:=ORG.LIBREOFFICE.ROUNDSIG([.A103];9)=ORG.LIBREOFFICE.ROUNDSIG([.B103];9) -> true | D103: of:=FORMULA([.A103]) -> {=FORECAST.ETS.ADD(AE36:AE63,AG4:AG36,AE4:AE36,12,1,1)}
A104: 3716527.05311991 | B104: 3716527.05311991 | C104: of:=ORG.LIBREOFFICE.ROUNDSIG([.A104];9)=ORG.LIBREOFFICE.ROUNDSIG([.B104];9) -> true | D104: of:=FORMULA([.A104]) -> {=FORECAST.ETS.ADD(AE36:AE63,AG4:AG36,AE4:AE36,12,1,1)}
A105: 4097343.25675971 | B105: 4097343.25675971 | C105: of:=ORG.LIBREOFFICE.ROUNDSIG([.A105];9)=ORG.LIBREOFFICE.ROUNDSIG([.B105];9) -> true | D105: of:=FORMULA([.A105]) -> {=FORECAST.ETS.ADD(AE36:AE63,AG4:AG36,AE4:AE36,12,1,1)}
A106: 4235561.87690572 | B106: 4235561.87690572 | C106: of:=ORG.LIBREOFFICE.ROUNDSIG([.A106];9)=ORG.LIBREOFFICE.ROUNDSIG([.B106];9) -> true | D106: of:=FORMULA([.A106]) -> {=FORECAST.ETS.ADD(AE36:AE63,AG4:AG36,AE4:AE36,12,1,1)}
A107: 4486062.25738793 | B107: 4486062.25738793 | C107: of:=ORG.LIBREOFFICE.ROUNDSIG([.A107];9)=ORG.LIBREOFFICE.ROUNDSIG([.B107];9) -> true | D107: of:=FORMULA([.A107]) -> {=FORECAST.ETS.ADD(AE36:AE63,AG4:AG36,AE4:AE36,12,1,1)}
A108: 4927195.54746187 | B108: 4927195.54746187 | C108: of:=ORG.LIBREOFFICE.ROUNDSIG([.A108];9)=ORG.LIBREOFFICE.ROUNDSIG([.B108];9) -> true | D108: of:=FORMULA([.A108]) -> {=FORECAST.ETS.ADD(AE36:AE63,AG4:AG36,AE4:AE36,12,1,1)}
A109: 5049555.62350877 | B109: 5049555.62350877 | C109: of:=ORG.LIBREOFFICE.ROUNDSIG([.A109];9)=ORG.LIBREOFFICE.ROUNDSIG([.B109];9) -> true | D109: of:=FORMULA([.A109]) -> {=FORECAST.ETS.ADD(AE36:AE63,AG4:AG36,AE4:AE36,12,1,1)}
A110: 5074773.33013216 | B110: 5074773.33013216 | C110: of:=ORG.LIBREOFFICE.ROUNDSIG([.A110];9)=ORG.LIBREOFFICE.ROUNDSIG([.B110];9) -> true | D110: of:=FORMULA([.A110]) -> {=FORECAST.ETS.ADD(AE36:AE63,AG4:AG36,AE4:AE36,12,1,1)}
A111: 4709059.25903412 | B111: 4709059.25903412 | C111: of:=ORG.LIBREOFFICE.ROUNDSIG([.A111];9)=ORG.LIBREOFFICE.ROUNDSIG([.B111];9) -> true | D111: of:=FORMULA([.A111]) -> {=FORECAST.ETS.ADD(AE36:AE63,AG4:AG36,AE4:AE36,12,1,1)}
A112: 4757581.87527288 | B112: 4757581.87527288 | C112: of:=ORG.LIBREOFFICE.ROUNDSIG([.A112];9)=ORG.LIBREOFFICE.ROUNDSIG([.B112];9) -> true | D112: of:=FORMULA([.A112]) -> {=FORECAST.ETS.ADD(AE36:AE63,AG4:AG36,AE4:AE36,12,1,1)}
A113: 4590866.55124937 | B113: 4590866.55124937 | C113: of:=ORG.LIBREOFFICE.ROUNDSIG([.A113];9)=ORG.LIBREOFFICE.ROUNDSIG([.B113];9) -> true | D113: of:=FORMULA([.A113]) -> {=FORECAST.ETS.ADD(AE36:AE63,AG4:AG36,AE4:AE36,12,1,1)}
A114: 4558383.58049429 | B114: 4558383.58049429 | C114: of:=ORG.LIBREOFFICE.ROUNDSIG([.A114];9)=ORG.LIBREOFFICE.ROUNDSIG([.B114];9) -> true | D114: of:=FORMULA([.A114]) -> {=FORECAST.ETS.ADD(AE36:AE63,AG4:AG36,AE4:AE36,12,1,1)}
A115: of:=COM.MICROSOFT.FORECAST.ETS([.AJ64:.AJ100];[.AI5:.AI64];[.AJ5:.AJ64];12;1;1) -> 58.048 | B115: 58.048 | C115: of:=ORG.LIBREOFFICE.ROUNDSIG([.A115];9)=ORG.LIBREOFFICE.ROUNDSIG([.B115];9) -> true | D115: of:=FORMULA([.A115]) -> {=FORECAST.ETS.ADD(AJ64:AJ100,AI5:AI64,AJ5:AJ64,12,1,1)}
A116: 73.8271964689978 | B116: 73.8271964689978 | C116: of:=ORG.LIBREOFFICE.ROUNDSIG([.A116];9)=ORG.LIBREOFFICE.ROUNDSIG([.B116];9) -> true | D116: of:=FORMULA([.A116]) -> {=FORECAST.ETS.ADD(AJ64:AJ100,AI5:AI64,AJ5:AJ64,12,1,1)}
A117: 65.9998482820766 | B117: 65.9998482820766 | C117: of:=ORG.LIBREOFFICE.ROUNDSIG([.A117];9)=ORG.LIBREOFFICE.ROUNDSIG([.B117];9) -> true | D117: of:=FORMULA([.A117]) -> {=FORECAST.ETS.ADD(AJ64:AJ100,AI5:AI64,AJ5:AJ64,12,1,1)}
A118: 78.7673298175085 | B118: 78.7673298175085 | C118: of:=ORG.LIBREOFFICE.ROUNDSIG([.A118];9)=ORG.LIBREOFFICE.ROUNDSIG([.B118];9) -> true | D118: of:=FORMULA([.A118]) -> {=FORECAST.ETS.ADD(AJ64:AJ100,AI5:AI64,AJ5:AJ64,12,1,1)}
A119: 87.7119624164518 | B119: 87.7119624164518 | C119: of:=ORG.LIBREOFFICE.ROUNDSIG([.A119];9)=ORG.LIBREOFFICE.ROUNDSIG([.B119];9) -> true | D119: of:=FORMULA([.A119]) -> {=FORECAST.ETS.ADD(AJ64:AJ100,AI5:AI64,AJ5:AJ64,12,1,1)}
A120: 87.2147667931694 | B120: 87.2147667931694 | C120: of:=ORG.LIBREOFFICE.ROUNDSIG([.A120];9)=ORG.LIBREOFFICE.ROUNDSIG([.B120];9) -> true | D120: of:=FORMULA([.A120]) -> {=FORECAST.ETS.ADD(AJ64:AJ100,AI5:AI64,AJ5:AJ64,12,1,1)}
A121: 100.060313229535 | B121: 100.060313229535 | C121: of:=ORG.LIBREOFFICE.ROUNDSIG([.A121];9)=ORG.LIBREOFFICE.ROUNDSIG([.B121];9) -> true | D121: of:=FORMULA([.A121]) -> {=FORECAST.ETS.ADD(AJ64:AJ100,AI5:AI64,AJ5:AJ64,12,1,1)}
A122: 99.4195799467331 | B122: 99.4195799467331 | C122: of:=ORG.LIBREOFFICE.ROUNDSIG([.A122];9)=ORG.LIBREOFFICE.ROUNDSIG([.B122];9) -> true | D122: of:=FORMULA([.A122]) -> {=FORECAST.ETS.ADD(AJ64:AJ100,AI5:AI64,AJ5:AJ64,12,1,1)}
A123: 98.3758252309232 | B123: 98.3758252309232 | C123: of:=ORG.LIBREOFFICE.ROUNDSIG([.A123];9)=ORG.LIBREOFFICE.ROUNDSIG([.B123];9) -> true | D123: of:=FORMULA([.A123]) -> {=FORECAST.ETS.ADD(AJ64:AJ100,AI5:AI64,AJ5:AJ64,12,1,1)}
A124: 98.0950982126688 | B124: 98.0950982126688 | C124: of:=ORG.LIBREOFFICE.ROUNDSIG([.A124];9)=ORG.LIBREOFFICE.ROUNDSIG([.B124];9) -> true | D124: of:=FORMULA([.A124]) -> {=FORECAST.ETS.ADD(AJ64:AJ100,AI5:AI64,AJ5:AJ64,12,1,1)}
A125: 85.6547546297499 | B125: 85.6547546297499 | C125: of:=ORG.LIBREOFFICE.ROUNDSIG([.A125];9)=ORG.LIBREOFFICE.ROUNDSIG([.B125];9) -> true | D125: of:=FORMULA([.A125]) -> {=FORECAST.ETS.ADD(AJ64:AJ100,AI5:AI64,AJ5:AJ64,12,1,1)}
A126: 78.8518128530024 | B126: 78.8518128530024 | C126: of:=ORG.LIBREOFFICE.ROUNDSIG([.A126];9)=ORG.LIBREOFFICE.ROUNDSIG([.B126];9) -> true | D126: of:=FORMULA([.A126]) -> {=FORECAST.ETS.ADD(AJ64:AJ100,AI5:AI64,AJ5:AJ64,12,1,1)}
A127: 65.7936722790212 | B127: 65.7936722790212 | C127: of:=ORG.LIBREOFFICE.ROUNDSIG([.A127];9)=ORG.LIBREOFFICE.ROUNDSIG([.B127];9) -> true | D127: of:=FORMULA([.A127]) -> {=FORECAST.ETS.ADD(AJ64:AJ100,AI5:AI64,AJ5:AJ64,12,1,1)}
A128: 77.5549464689978 | B128: 77.5549464689978 | C128: of:=ORG.LIBREOFFICE.ROUNDSIG([.A128];9)=ORG.LIBREOFFICE.ROUNDSIG([.B128];9) -> true | D128: of:=FORMULA([.A128]) -> {=FORECAST.ETS.ADD(AJ64:AJ100,AI5:AI64,AJ5:AJ64,12,1,1)}
A129: 69.7275982820766 | B129: 69.7275982820766 | C129: of:=ORG.LIBREOFFICE.ROUNDSIG([.A129];9)=ORG.LIBREOFFICE.ROUNDSIG([.B129];9) -> true | D129: of:=FORMULA([.A129]) -> {=FORECAST.ETS.ADD(AJ64:AJ100,AI5:AI64,AJ5:AJ64,12,1,1)}
A130: 82.4950798175085 | B130: 82.4950798175085 | C130: of:=ORG.LIBREOFFICE.ROUNDSIG([.A130];9)=ORG.LIBREOFFICE.ROUNDSIG([.B130];9) -> true | D130: of:=FORMULA([.A130]) -> {=FORECAST.ETS.ADD(AJ64:AJ100,AI5:AI64,AJ5:AJ64,12,1,1)}
A131: 91.4397124164518 | B131: 91.4397124164518 | C131: of:=ORG.LIBREOFFICE.ROUNDSIG([.A131];9)=ORG.LIBREOFFICE.ROUNDSIG([.B131];9) -> true | D131: of:=FORMULA([.A131]) -> {=FORECAST.ETS.ADD(AJ64:AJ100,AI5:AI64,AJ5:AJ64,12,1,1)}
A132: 90.9425167931694 | B132: 90.9425167931694 | C132: of:=ORG.LIBREOFFICE.ROUNDSIG([.A132];9)=ORG.LIBREOFFICE.ROUNDSIG([.B132];9) -> true | D132: of:=FORMULA([.A132]) -> {=FORECAST.ETS.ADD(AJ64:AJ100,AI5:AI64,AJ5:AJ64,12,1,1)}
A133: 103.788063229535 | B133: 103.788063229535 | C133: of:=ORG.LIBREOFFICE.ROUNDSIG([.A133];9)=ORG.LIBREOFFICE.ROUNDSIG([.B133];9) -> true | D133: of:=FORMULA([.A133]) -> {=FORECAST.ETS.ADD(AJ64:AJ100,AI5:AI64,AJ5:AJ64,12,1,1)}
A134: 103.147329946733 | B134: 103.147329946733 | C134: of:=ORG.LIBREOFFICE.ROUNDSIG([.A134];9)=ORG.LIBREOFFICE.ROUNDSIG([.B134];9) -> true | D134: of:=FORMULA([.A134]) -> {=FORECAST.ETS.ADD(AJ64:AJ100,AI5:AI64,AJ5:AJ64,12,1,1)}
A135: 102.103575230923 | B135: 102.103575230923 | C135: of:=ORG.LIBREOFFICE.ROUNDSIG([.A135];9)=ORG.LIBREOFFICE.ROUNDSIG([.B135];9) -> true | D135: of:=FORMULA([.A135]) -> {=FORECAST.ETS.ADD(AJ64:AJ100,AI5:AI64,AJ5:AJ64,12,1,1)}
A136: 101.822848212669 | B136: 101.822848212669 | C136: of:=ORG.LIBREOFFICE.ROUNDSIG([.A136];9)=ORG.LIBREOFFICE.ROUNDSIG([.B136];9) -> true | D136: of:=FORMULA([.A136]) -> {=FORECAST.ETS.ADD(AJ64:AJ100,AI5:AI64,AJ5:AJ64,12,1,1)}
A137: 89.3825046297499 | B137: 89.3825046297499 | C137: of:=ORG.LIBREOFFICE.ROUNDSIG([.A137];9)=ORG.LIBREOFFICE.ROUNDSIG([.B137];9) -> true | D137: of:=FORMULA([.A137]) -> {=FORECAST.ETS.ADD(AJ64:AJ100,AI5:AI64,AJ5:AJ64,12,1,1)}
A138: 82.5795628530024 | B138: 82.5795628530024 | C138: of:=ORG.LIBREOFFICE.ROUNDSIG([.A138];9)=ORG.LIBREOFFICE.ROUNDSIG([.B138];9) -> true | D138: of:=FORMULA([.A138]) -> {=FORECAST.ETS.ADD(AJ64:AJ100,AI5:AI64,AJ5:AJ64,12,1,1)}
A139: 69.5214222790212 | B139: 69.5214222790212 | C139: of:=ORG.LIBREOFFICE.ROUNDSIG([.A139];9)=ORG.LIBREOFFICE.ROUNDSIG([.B139];9) -> true | D139: of:=FORMULA([.A139]) -> {=FORECAST.ETS.ADD(AJ64:AJ100,AI5:AI64,AJ5:AJ64,12,1,1)}
A140: 81.2826964689978 | B140: 81.2826964689978 | C140: of:=ORG.LIBREOFFICE.ROUNDSIG([.A140];9)=ORG.LIBREOFFICE.ROUNDSIG([.B140];9) -> true | D140: of:=FORMULA([.A140]) -> {=FORECAST.ETS.ADD(AJ64:AJ100,AI5:AI64,AJ5:AJ64,12,1,1)}
A141: 73.4553482820766 | B141: 73.4553482820766 | C141: of:=ORG.LIBREOFFICE.ROUNDSIG([.A141];9)=ORG.LIBREOFFICE.ROUNDSIG([.B141];9) -> true | D141: of:=FORMULA([.A141]) -> {=FORECAST.ETS.ADD(AJ64:AJ100,AI5:AI64,AJ5:AJ64,12,1,1)}
A142: 86.2228298175085 | B142: 86.2228298175085 | C142: of:=ORG.LIBREOFFICE.ROUNDSIG([.A142];9)=ORG.LIBREOFFICE.ROUNDSIG([.B142];9) -> true | D142: of:=FORMULA([.A142]) -> {=FORECAST.ETS.ADD(AJ64:AJ100,AI5:AI64,AJ5:AJ64,12,1,1)}
A143: 95.1674624164518 | B143: 95.1674624164518 | C143: of:=ORG.LIBREOFFICE.ROUNDSIG([.A143];9)=ORG.LIBREOFFICE.ROUNDSIG([.B143];9) -> true | D143: of:=FORMULA([.A143]) -> {=FORECAST.ETS.ADD(AJ64:AJ100,AI5:AI64,AJ5:AJ64,12,1,1)}
A144: 94.6702667931694 | B144: 94.6702667931694 | C144: of:=ORG.LIBREOFFICE.ROUNDSIG([.A144];9)=ORG.LIBREOFFICE.ROUNDSIG([.B144];9) -> true | D144: of:=FORMULA([.A144]) -> {=FORECAST.ETS.ADD(AJ64:AJ100,AI5:AI64,AJ5:AJ64,12,1,1)}
A145: 107.515813229535 | B145: 107.515813229535 | C145: of:=ORG.LIBREOFFICE.ROUNDSIG([.A145];9)=ORG.LIBREOFFICE.ROUNDSIG([.B145];9) -> true | D145: of:=FORMULA([.A145]) -> {=FORECAST.ETS.ADD(AJ64:AJ100,AI5:AI64,AJ5:AJ64,12,1,1)}
A146: 106.875079946733 | B146: 106.875079946733 | C146: of:=ORG.LIBREOFFICE.ROUNDSIG([.A146];9)=ORG.LIBREOFFICE.ROUNDSIG([.B146];9) -> true | D146: of:=FORMULA([.A146]) -> {=FORECAST.ETS.ADD(AJ64:AJ100,AI5:AI64,AJ5:AJ64,12,1,1)}
A147: 105.831325230923 | B147: 105.831325230923 | C147: of:=ORG.LIBREOFFICE.ROUNDSIG([.A147];9)=ORG.LIBREOFFICE.ROUNDSIG([.B147];9) -> true | D147: of:=FORMULA([.A147]) -> {=FORECAST.ETS.ADD(AJ64:AJ100,AI5:AI64,AJ5:AJ64,12,1,1)}
A148: 105.550598212669 | B148: 105.550598212669 | C148: of:=ORG.LIBREOFFICE.ROUNDSIG([.A148];9)=ORG.LIBREOFFICE.ROUNDSIG([.B148];9) -> true | D148: of:=FORMULA([.A148]) -> {=FORECAST.ETS.ADD(AJ64:AJ100,AI5:AI64,AJ5:AJ64,12,1,1)}
A149: 93.1102546297499 | B149: 93.1102546297499 | C149: of:=ORG.LIBREOFFICE.ROUNDSIG([.A149];9)=ORG.LIBREOFFICE.ROUNDSIG([.B149];9) -> true | D149: of:=FORMULA([.A149]) -> {=FORECAST.ETS.ADD(AJ64:AJ100,AI5:AI64,AJ5:AJ64,12,1,1)}
A150: 86.3073128530024 | B150: 86.3073128530024 | C150: of:=ORG.LIBREOFFICE.ROUNDSIG([.A150];9)=ORG.LIBREOFFICE.ROUNDSIG([.B150];9) -> true | D150: of:=FORMULA([.A150]) -> {=FORECAST.ETS.ADD(AJ64:AJ100,AI5:AI64,AJ5:AJ64,12,1,1)}
A151: 73.2491722790212 | B151: 73.2491722790212 | C151: of:=ORG.LIBREOFFICE.ROUNDSIG([.A151];9)=ORG.LIBREOFFICE.ROUNDSIG([.B151];9) -> true | D151: of:=FORMULA([.A151]) -> {=FORECAST.ETS.ADD(AJ64:AJ100,AI5:AI64,AJ5:AJ64,12,1,1)}

Sheet: 'file:///home/zdenek/Dokumenty/LO/sc-unit-test/Project%20Calc%20functions%20tests/fods/forecast.ets.add.fods/forecast.ets.add.fods/function_based_test_Example.fods/function_based_test_Example_reference.fods'#Sheet2
H3: 4