Sheet: Sheet1
A1: FORECAST Function
A3: Result | B3: of:=AND([.B8:.B95]) -> true
A7: Sheet | B7: Result | C7: Description
A8: 1 | B8: of:=AND([Sheet2.C2:.C349]) -> true | C8: Simple FORECAST formulas with local references and values

Sheet: Sheet2
A1: Function | B1: Expected | C1: Correct | D1: FunctionString | E1: Comment | J1: 3 | K1: 0.7 | M1: 1 | N1: 2 | P1: Known Y | Q1: Known X | S1: 2 | T1: 125.226808384339
A2: of:=FORECAST(6; [.N1:.N5]; [.M1:.M5]) -> 13 | B2: 13 | C2: of:=ROUND([.A2];12)=ROUND([.B2];12) -> true | D2: of:=FORMULA([.A2]) -> =FORECAST(6, N1:N5, M1:M5) | J2: 4 | K2: 0.3 | M2: 2 | N2: 4 | P2: 6 | Q2: 20 | S2: 4 | T2: 118.933231648245
A3: of:=FORECAST(30;[.P2:.P6];[.Q2:.Q6]) -> 10.6072530864198 | B3: 10.6072530864198 | C3: of:=ROUND([.A3];12)=ROUND([.B3];12) -> true | D3: of:=FORMULA([.A3]) -> =FORECAST(30,P2:P6,Q2:Q6) | M3: 3 | N3: 7 | P3: 7 | Q3: 28 | S3: 6 | T3: 105.954105316101
A4: of:=FORECAST([.S1:.S39];[.T1:.T39];[.S1:.S39]) -> 112.723528625461 | B4: 112.723528625461 | C4: of:=ROUND([.A4];12)=ROUND([.B4];12) -> true | D4: of:=FORMULA([.A4]) -> {=FORECAST(S1:S39,T1:T39,S1:S39)} | J4: of:=FORECAST([.J1:.J2];[.K1:.K2];[.J1:.J2]) ->  | K4: Eike, Winfried | M4: 4 | N4: 8 | P4: 9 | Q4: 31 | S4: 4 | T4: 118.933231648245
A5: 113.884297881556 | B5: 113.884297881556 | C5: of:=ROUND([.A5];12)=ROUND([.B5];12) -> true | D5: of:=FORMULA([.A5]) -> {=FORECAST(S1:S39,T1:T39,S1:S39)} | M5: 5 | N5: 11 | P5: 15 | Q5: 38 | S5: 5 | T5: 111.549667344589
A6: 115.045067137652 | B6: 115.045067137652 | C6: of:=ROUND([.A6];12)=ROUND([.B6];12) -> true | D6: of:=FORMULA([.A6]) -> {=FORECAST(S1:S39,T1:T39,S1:S39)} | P6: 21 | Q6: 40 | S6: 6 | T6: 105.954105316101
A7: 113.884297881556 | B7: 113.884297881556 | C7: of:=ROUND([.A7];12)=ROUND([.B7];12) -> true | D7: of:=FORMULA([.A7]) -> {=FORECAST(S1:S39,T1:T39,S1:S39)} | S7: 7 | T7: 105.026989677408
A8: 114.464682509604 | B8: 114.464682509604 | C8: of:=ROUND([.A8];12)=ROUND([.B8];12) -> true | D8: of:=FORMULA([.A8]) -> {=FORECAST(S1:S39,T1:T39,S1:S39)} | S8: 8 | T8: 109.479384966668
A9: 115.045067137652 | B9: 115.045067137652 | C9: of:=ROUND([.A9];12)=ROUND([.B9];12) -> true | D9: of:=FORMULA([.A9]) -> {=FORECAST(S1:S39,T1:T39,S1:S39)} | S9: 9 | T9: 117.5
A10: 115.6254517657 | B10: 115.6254517657 | C10: of:=ROUND([.A10];12)=ROUND([.B10];12) -> true | D10: of:=FORMULA([.A10]) -> {=FORECAST(S1:S39,T1:T39,S1:S39)} | S10: 10 | T10: 125.584893794301
A11: 116.205836393748 | B11: 116.205836393748 | C11: of:=ROUND([.A11];12)=ROUND([.B11];12) -> true | D11: of:=FORMULA([.A11]) -> {=FORECAST(S1:S39,T1:T39,S1:S39)} | S11: 11 | T11: 130.169971873195
A12: 116.786221021796 | B12: 116.786221021796 | C12: of:=ROUND([.A12];12)=ROUND([.B12];12) -> true | D12: of:=FORMULA([.A12]) -> {=FORECAST(S1:S39,T1:T39,S1:S39)} | S12: 12 | T12: 129.305702305035
A13: 117.366605649844 | B13: 117.366605649844 | C13: of:=ROUND([.A13];12)=ROUND([.B13];12) -> true | D13: of:=FORMULA([.A13]) -> {=FORECAST(S1:S39,T1:T39,S1:S39)} | S13: 13 | T13: 123.587140712742
A14: 117.946990277891 | B14: 117.946990277891 | C14: of:=ROUND([.A14];12)=ROUND([.B14];12) -> true | D14: of:=FORMULA([.A14]) -> {=FORECAST(S1:S39,T1:T39,S1:S39)} | S14: 14 | T14: 115.895758280092
A15: 118.527374905939 | B15: 118.527374905939 | C15: of:=ROUND([.A15];12)=ROUND([.B15];12) -> true | D15: of:=FORMULA([.A15]) -> {=FORECAST(S1:S39,T1:T39,S1:S39)} | S15: 15 | T15: 110.064393884398
A16: 119.107759533987 | B16: 119.107759533987 | C16: of:=ROUND([.A16];12)=ROUND([.B16];12) -> true | D16: of:=FORMULA([.A16]) -> {=FORECAST(S1:S39,T1:T39,S1:S39)} | S16: 16 | T16: 109.083826188552
A17: 119.688144162035 | B17: 119.688144162035 | C17: of:=ROUND([.A17];12)=ROUND([.B17];12) -> true | D17: of:=FORMULA([.A17]) -> {=FORECAST(S1:S39,T1:T39,S1:S39)} | S17: 17 | T17: 113.690130542309
A18: 120.268528790083 | B18: 120.268528790083 | C18: of:=ROUND([.A18];12)=ROUND([.B18];12) -> true | D18: of:=FORMULA([.A18]) -> {=FORECAST(S1:S39,T1:T39,S1:S39)} | S18: 18 | T18: 122
A19: 120.848913418131 | B19: 120.848913418131 | C19: of:=ROUND([.A19];12)=ROUND([.B19];12) -> true | D19: of:=FORMULA([.A19]) -> {=FORECAST(S1:S39,T1:T39,S1:S39)} | S19: 19 | T19: 130.37414821866
A20: 121.429298046179 | B20: 121.429298046179 | C20: of:=ROUND([.A20];12)=ROUND([.B20];12) -> true | D20: of:=FORMULA([.A20]) -> {=FORECAST(S1:S39,T1:T39,S1:S39)} | S20: 20 | T20: 135.11313536205
A21: 122.009682674226 | B21: 122.009682674226 | C21: of:=ROUND([.A21];12)=ROUND([.B21];12) -> true | D21: of:=FORMULA([.A21]) -> {=FORECAST(S1:S39,T1:T39,S1:S39)} | S21: 21 | T21: 134.195413736738
A22: 122.590067302274 | B22: 122.590067302274 | C22: of:=ROUND([.A22];12)=ROUND([.B22];12) -> true | D22: of:=FORMULA([.A22]) -> {=FORECAST(S1:S39,T1:T39,S1:S39)} | S22: 22 | T22: 128.241049777238
A23: 123.170451930322 | B23: 123.170451930322 | C23: of:=ROUND([.A23];12)=ROUND([.B23];12) -> true | D23: of:=FORMULA([.A23]) -> {=FORECAST(S1:S39,T1:T39,S1:S39)} | S23: 23 | T23: 120.241849215595
A24: 123.75083655837 | B24: 123.75083655837 | C24: of:=ROUND([.A24];12)=ROUND([.B24];12) -> true | D24: of:=FORMULA([.A24]) -> {=FORECAST(S1:S39,T1:T39,S1:S39)} | S24: 24 | T24: 114.174682452695
A25: 124.331221186418 | B25: 124.331221186418 | C25: of:=ROUND([.A25];12)=ROUND([.B25];12) -> true | D25: of:=FORMULA([.A25]) -> {=FORECAST(S1:S39,T1:T39,S1:S39)} | S25: 25 | T25: 113.140662699697
A26: 124.911605814466 | B26: 124.911605814466 | C26: of:=ROUND([.A26];12)=ROUND([.B26];12) -> true | D26: of:=FORMULA([.A26]) -> {=FORECAST(S1:S39,T1:T39,S1:S39)} | S26: 26 | T26: 117.90087611795
A27: 125.491990442514 | B27: 125.491990442514 | C27: of:=ROUND([.A27];12)=ROUND([.B27];12) -> true | D27: of:=FORMULA([.A27]) -> {=FORECAST(S1:S39,T1:T39,S1:S39)} | E27: Excel 125,491990442513000000 | S27: 27 | T27: 126.5
A28: 126.072375070561 | B28: 126.072375070561 | C28: of:=ROUND([.A28];12)=ROUND([.B28];12) -> true | D28: of:=FORMULA([.A28]) -> {=FORECAST(S1:S39,T1:T39,S1:S39)} | S28: 28 | T28: 135.163402643019
A29: 126.652759698609 | B29: 126.652759698609 | C29: of:=ROUND([.A29];12)=ROUND([.B29];12) -> true | D29: of:=FORMULA([.A29]) -> {=FORECAST(S1:S39,T1:T39,S1:S39)} | S29: 29 | T29: 140.056298850906
A30: 127.233144326657 | B30: 127.233144326657 | C30: of:=ROUND([.A30];12)=ROUND([.B30];12) -> true | D30: of:=FORMULA([.A30]) -> {=FORECAST(S1:S39,T1:T39,S1:S39)} | S30: 30 | T30: 139.085125168441
A31: 127.813528954705 | B31: 127.813528954705 | C31: of:=ROUND([.A31];12)=ROUND([.B31];12) -> true | D31: of:=FORMULA([.A31]) -> {=FORECAST(S1:S39,T1:T39,S1:S39)} | S31: 31 | T31: 132.894958841735
A32: 128.393913582753 | B32: 128.393913582753 | C32: of:=ROUND([.A32];12)=ROUND([.B32];12) -> true | D32: of:=FORMULA([.A32]) -> {=FORECAST(S1:S39,T1:T39,S1:S39)} | S32: 32 | T32: 124.587940151099
A33: 128.974298210801 | B33: 128.974298210801 | C33: of:=ROUND([.A33];12)=ROUND([.B33];12) -> true | D33: of:=FORMULA([.A33]) -> {=FORECAST(S1:S39,T1:T39,S1:S39)} | S33: 33 | T33: 118.284971020992
A34: 129.554682838849 | B34: 129.554682838849 | C34: of:=ROUND([.A34];12)=ROUND([.B34];12) -> true | D34: of:=FORMULA([.A34]) -> {=FORECAST(S1:S39,T1:T39,S1:S39)} | S34: 34 | T34: 117.197499210841
A35: 130.135067466896 | B35: 130.135067466896 | C35: of:=ROUND([.A35];12)=ROUND([.B35];12) -> true | D35: of:=FORMULA([.A35]) -> {=FORECAST(S1:S39,T1:T39,S1:S39)} | S35: 35 | T35: 122.111621693591
A36: 130.715452094944 | B36: 130.715452094944 | C36: of:=ROUND([.A36];12)=ROUND([.B36];12) -> true | D36: of:=FORMULA([.A36]) -> {=FORECAST(S1:S39,T1:T39,S1:S39)} | S36: 36 | T36: 131
A37: 131.295836722992 | B37: 131.295836722992 | C37: of:=ROUND([.A37];12)=ROUND([.B37];12) -> true | D37: of:=FORMULA([.A37]) -> {=FORECAST(S1:S39,T1:T39,S1:S39)} | S37: 37 | T37: 139.952657067378
A38: 131.87622135104 | B38: 131.87622135104 | C38: of:=ROUND([.A38];12)=ROUND([.B38];12) -> true | D38: of:=FORMULA([.A38]) -> {=FORECAST(S1:S39,T1:T39,S1:S39)} | S38: 38 | T38: 144.999462339761
A39: 132.456605979088 | B39: 132.456605979088 | C39: of:=ROUND([.A39];12)=ROUND([.B39];12) -> true | D39: of:=FORMULA([.A39]) -> {=FORECAST(S1:S39,T1:T39,S1:S39)} | S39: 39 | T39: 143.974836600144
A40: 133.036990607136 | B40: 133.036990607136 | C40: of:=ROUND([.A40];12)=ROUND([.B40];12) -> true | D40: of:=FORMULA([.A40]) -> {=FORECAST(S1:S39,T1:T39,S1:S39)}
A41: 133.617375235183 | B41: 133.617375235183 | C41: of:=ROUND([.A41];12)=ROUND([.B41];12) -> true | D41: of:=FORMULA([.A41]) -> {=FORECAST(S1:S39,T1:T39,S1:S39)}
A42: 134.197759863231 | B42: 134.197759863231 | C42: of:=ROUND([.A42];12)=ROUND([.B42];12) -> true | D42: of:=FORMULA([.A42]) -> {=FORECAST(S1:S39,T1:T39,S1:S39)}
A43: of:=FORECAST(0;[.P2:.P6];[.Q2:.Q6]) -> -10.6658950617284 | B43: -10.6658950617284 | C43: of:=ROUND([.A43];12)=ROUND([.B43];12) -> true | D43: of:=FORMULA([.A43]) -> =FORECAST(0,P2:P6,Q2:Q6)
A44: of:=FORECAST(-30;[.P2:.P6];[.Q2:.Q6]) -> -31.9390432098765 | B44: -31.9390432098765 | C44: of:=ROUND([.A44];12)=ROUND([.B44];12) -> true | D44: of:=FORMULA([.A44]) -> =FORECAST(-30,P2:P6,Q2:Q6)
A45: of:=FORECAST(8; {1;2;3}; {4;5;6}) -> 5 | B45: 5 | C45: of:=ROUND([.A45];12)=ROUND([.B45];12) -> true | D45: of:=FORMULA([.A45]) -> =FORECAST(8, {1,2,3}, {4,5,6})
A46: of:=FORECAST(7; {5.8;-1}; {2;-5}) -> 10.6571428571429 | B46: 10.6571428571429 | C46: of:=ROUND([.A46];12)=ROUND([.B46];12) -> true | D46: of:=FORMULA([.A46]) -> =FORECAST(7, {5.8,-1}, {2,-5})
A47: of:=FORECAST(50; {-1;-2;-3;-4}; {10;20;30;40}) -> -5 | B47: -5 | C47: of:=ROUND([.A47];12)=ROUND([.B47];12) -> true | D47: of:=FORMULA([.A47]) -> =FORECAST(50, {-1,-2,-3,-4}, {10,20,30,40})

Sheet: 'file:///home/zdenek/Dokumenty/LO/sc-unit-test/Project%20Calc%20functions%20tests/fods/function_based_test_Example.fods/function_based_test_Example_reference.fods'#Sheet2
H3: 4