Sheet: Sheet1
A1: Kahan Sum Function
A3: Result | B3: of:=[.B8] -> true
A7: Sheet | B7: Result | C7: Description
A8: 1 | B8: of:=[$Sheet2.B108] -> true | C8: Simple Kahan sum test with local references and values
B109: ZTEST Function
B111: Result | C111: true
B115: Sheet | C115: Result | D115: Description
B116: 1 | C116: true | D116: Simple ZTEST formulas with local references and values

Sheet: Sheet2
B2: SUM 1 | C2: SUM TRUE | D2: SUM 1 RAW | E2: SUM 2 | F2: SUM 2 RAW | H2: MATRIX DATA | K2: MATRIX DATA | O2: SUM3
B3: 1000000000000000 | C3: of:=IF(ABS([.B3])>1;0;[.B3]) -> 0 | D3: of:=[.B3] -> 1000000000000000 | E3: of:=IF(ABS([.B3])>1;[.B3]^9;[.B3]) -> 1E+135 | F3: of:=[.E3] -> 1E+135 | H3: of:=IF(ABS([.B3])>1;[.B3]^9;[.B3]) -> 1E+135 | I3: of:=IF(ABS([.B3])>1;[.B3]^9;[.B3]) -> 1E+135 | K3: of:=IF(ABS([.B3])>1;[.B3];[.B3]) -> 1000000000000000 | L3: of:=IF(ABS([.B3])>1;[.B3];[.B3]) -> 1000000000000000 | M3: of:=IF(ABS([.B3])>1;[.B3];[.B3]) -> 1000000000000000 | O3: 1000000000000000
B4: 0.1 | C4: of:=IF(ABS([.B4])>1;0;[.B4]) -> 0.1 | D4: of:=[.B4]+[.D3] -> 1E+015 | E4: of:=IF(ABS([.B4])>1;[.B4]^9;[.B4]) -> 0.1 | F4: of:=[.E4]+[.F3] -> 1E+135 | H4: of:=IF(ABS([.B4])>1;[.B4]^9;[.B4]) -> 0.1 | I4: of:=IF(ABS([.B4])>1;[.B4]^9;[.B4]) -> 0.1 | K4: of:=IF(ABS([.B4])>1;[.B4];[.B4]) -> 0.1 | L4: of:=IF(ABS([.B4])>1;[.B4];[.B4]) -> 0.1 | M4: of:=IF(ABS([.B4])>1;[.B4];[.B4]) -> 0.1 | O4: 1
B5: -1000000000000000 | C5: of:=IF(ABS([.B5])>1;0;[.B5]) -> 0 | D5: of:=[.B5]+[.D4] -> 0 | E5: of:=IF(ABS([.B5])>1;[.B5]^9;[.B5]) -> -1E+135 | F5: of:=[.E5]+[.F4] -> 0 | H5: of:=IF(ABS([.B5])>1;[.B5]^9;[.B5]) -> -1E+135 | I5: of:=IF(ABS([.B5])>1;[.B5]^9;[.B5]) -> -1E+135 | K5: of:=IF(ABS([.B5])>1;[.B5];[.B5]) -> -1000000000000000 | L5: of:=IF(ABS([.B5])>1;[.B5];[.B5]) -> -1000000000000000 | M5: of:=IF(ABS([.B5])>1;[.B5];[.B5]) -> -1000000000000000 | O5: 1E-015
B6: 0.1 | C6: of:=IF(ABS([.B6])>1;0;[.B6]) -> 0.1 | D6: of:=[.B6]+[.D5] -> 0.1 | E6: of:=IF(ABS([.B6])>1;[.B6]^9;[.B6]) -> 0.1 | F6: of:=[.E6]+[.F5] -> 0.1 | H6: of:=IF(ABS([.B6])>1;[.B6]^9;[.B6]) -> 0.1 | I6: of:=IF(ABS([.B6])>1;[.B6]^9;[.B6]) -> 0.1 | K6: of:=IF(ABS([.B6])>1;[.B6];[.B6]) -> 0.1 | L6: of:=IF(ABS([.B6])>1;[.B6];[.B6]) -> 0.1 | M6: of:=IF(ABS([.B6])>1;[.B6];[.B6]) -> 0.1 | O6: -1000000000000000
B7: 1000000000000000 | C7: of:=IF(ABS([.B7])>1;0;[.B7]) -> 0 | D7: of:=[.B7]+[.D6] -> 1E+015 | E7: of:=IF(ABS([.B7])>1;[.B7]^9;[.B7]) -> 1E+135 | F7: of:=[.E7]+[.F6] -> 1E+135 | H7: of:=IF(ABS([.B7])>1;[.B7]^9;[.B7]) -> 1E+135 | I7: of:=IF(ABS([.B7])>1;[.B7]^9;[.B7]) -> 1E+135 | K7: of:=IF(ABS([.B7])>1;[.B7];[.B7]) -> 1000000000000000 | L7: of:=IF(ABS([.B7])>1;[.B7];[.B7]) -> 1000000000000000 | M7: of:=IF(ABS([.B7])>1;[.B7];[.B7]) -> 1000000000000000 | O7: -1
B8: 0.1 | C8: of:=IF(ABS([.B8])>1;0;[.B8]) -> 0.1 | D8: of:=[.B8]+[.D7] -> 1E+015 | E8: of:=IF(ABS([.B8])>1;[.B8]^9;[.B8]) -> 0.1 | F8: of:=[.E8]+[.F7] -> 1E+135 | H8: of:=IF(ABS([.B8])>1;[.B8]^9;[.B8]) -> 0.1 | I8: of:=IF(ABS([.B8])>1;[.B8]^9;[.B8]) -> 0.1 | K8: of:=IF(ABS([.B8])>1;[.B8];[.B8]) -> 0.1 | L8: of:=IF(ABS([.B8])>1;[.B8];[.B8]) -> 0.1 | M8: of:=IF(ABS([.B8])>1;[.B8];[.B8]) -> 0.1 | O8: 1000000000000000
B9: -1000000000000000 | C9: of:=IF(ABS([.B9])>1;0;[.B9]) -> 0 | D9: of:=[.B9]+[.D8] -> 0 | E9: of:=IF(ABS([.B9])>1;[.B9]^9;[.B9]) -> -1E+135 | F9: of:=[.E9]+[.F8] -> 0 | H9: of:=IF(ABS([.B9])>1;[.B9]^9;[.B9]) -> -1E+135 | I9: of:=IF(ABS([.B9])>1;[.B9]^9;[.B9]) -> -1E+135 | K9: of:=IF(ABS([.B9])>1;[.B9];[.B9]) -> -1000000000000000 | L9: of:=IF(ABS([.B9])>1;[.B9];[.B9]) -> -1000000000000000 | M9: of:=IF(ABS([.B9])>1;[.B9];[.B9]) -> -1000000000000000 | O9: 1
B10: 0.1 | C10: of:=IF(ABS([.B10])>1;0;[.B10]) -> 0.1 | D10: of:=[.B10]+[.D9] -> 0.1 | E10: of:=IF(ABS([.B10])>1;[.B10]^9;[.B10]) -> 0.1 | F10: of:=[.E10]+[.F9] -> 0.1 | H10: of:=IF(ABS([.B10])>1;[.B10]^9;[.B10]) -> 0.1 | I10: of:=IF(ABS([.B10])>1;[.B10]^9;[.B10]) -> 0.1 | K10: of:=IF(ABS([.B10])>1;[.B10];[.B10]) -> 0.1 | L10: of:=IF(ABS([.B10])>1;[.B10];[.B10]) -> 0.1 | M10: of:=IF(ABS([.B10])>1;[.B10];[.B10]) -> 0.1 | O10: 1E-015
B11: 1000000000000000 | C11: of:=IF(ABS([.B11])>1;0;[.B11]) -> 0 | D11: of:=[.B11]+[.D10] -> 1E+015 | E11: of:=IF(ABS([.B11])>1;[.B11]^9;[.B11]) -> 1E+135 | F11: of:=[.E11]+[.F10] -> 1E+135 | H11: of:=IF(ABS([.B11])>1;[.B11]^9;[.B11]) -> 1E+135 | I11: of:=IF(ABS([.B11])>1;[.B11]^9;[.B11]) -> 1E+135 | K11: of:=IF(ABS([.B11])>1;[.B11];[.B11]) -> 1000000000000000 | L11: of:=IF(ABS([.B11])>1;[.B11];[.B11]) -> 1000000000000000 | M11: of:=IF(ABS([.B11])>1;[.B11];[.B11]) -> 1000000000000000 | O11: -1000000000000000
B12: 0.1 | C12: of:=IF(ABS([.B12])>1;0;[.B12]) -> 0.1 | D12: of:=[.B12]+[.D11] -> 1E+015 | E12: of:=IF(ABS([.B12])>1;[.B12]^9;[.B12]) -> 0.1 | F12: of:=[.E12]+[.F11] -> 1E+135 | H12: of:=IF(ABS([.B12])>1;[.B12]^9;[.B12]) -> 0.1 | I12: of:=IF(ABS([.B12])>1;[.B12]^9;[.B12]) -> 0.1 | K12: of:=IF(ABS([.B12])>1;[.B12];[.B12]) -> 0.1 | L12: of:=IF(ABS([.B12])>1;[.B12];[.B12]) -> 0.1 | M12: of:=IF(ABS([.B12])>1;[.B12];[.B12]) -> 0.1 | O12: -1
B13: -1000000000000000 | C13: of:=IF(ABS([.B13])>1;0;[.B13]) -> 0 | D13: of:=[.B13]+[.D12] -> 0 | E13: of:=IF(ABS([.B13])>1;[.B13]^9;[.B13]) -> -1E+135 | F13: of:=[.E13]+[.F12] -> 0 | H13: of:=IF(ABS([.B13])>1;[.B13]^9;[.B13]) -> -1E+135 | I13: of:=IF(ABS([.B13])>1;[.B13]^9;[.B13]) -> -1E+135 | K13: of:=IF(ABS([.B13])>1;[.B13];[.B13]) -> -1000000000000000 | L13: of:=IF(ABS([.B13])>1;[.B13];[.B13]) -> -1000000000000000 | M13: of:=IF(ABS([.B13])>1;[.B13];[.B13]) -> -1000000000000000 | O13: 1000000000000000
B14: 0.1 | C14: of:=IF(ABS([.B14])>1;0;[.B14]) -> 0.1 | D14: of:=[.B14]+[.D13] -> 0.1 | E14: of:=IF(ABS([.B14])>1;[.B14]^9;[.B14]) -> 0.1 | F14: of:=[.E14]+[.F13] -> 0.1 | H14: of:=IF(ABS([.B14])>1;[.B14]^9;[.B14]) -> 0.1 | I14: of:=IF(ABS([.B14])>1;[.B14]^9;[.B14]) -> 0.1 | K14: of:=IF(ABS([.B14])>1;[.B14];[.B14]) -> 0.1 | L14: of:=IF(ABS([.B14])>1;[.B14];[.B14]) -> 0.1 | M14: of:=IF(ABS([.B14])>1;[.B14];[.B14]) -> 0.1 | O14: 1
B15: 1000000000000000 | C15: of:=IF(ABS([.B15])>1;0;[.B15]) -> 0 | D15: of:=[.B15]+[.D14] -> 1E+015 | E15: of:=IF(ABS([.B15])>1;[.B15]^9;[.B15]) -> 1E+135 | F15: of:=[.E15]+[.F14] -> 1E+135 | H15: of:=IF(ABS([.B15])>1;[.B15]^9;[.B15]) -> 1E+135 | I15: of:=IF(ABS([.B15])>1;[.B15]^9;[.B15]) -> 1E+135 | K15: of:=IF(ABS([.B15])>1;[.B15];[.B15]) -> 1000000000000000 | L15: of:=IF(ABS([.B15])>1;[.B15];[.B15]) -> 1000000000000000 | M15: of:=IF(ABS([.B15])>1;[.B15];[.B15]) -> 1000000000000000 | O15: 1E-015
B16: 0.1 | C16: of:=IF(ABS([.B16])>1;0;[.B16]) -> 0.1 | D16: of:=[.B16]+[.D15] -> 1E+015 | E16: of:=IF(ABS([.B16])>1;[.B16]^9;[.B16]) -> 0.1 | F16: of:=[.E16]+[.F15] -> 1E+135 | H16: of:=IF(ABS([.B16])>1;[.B16]^9;[.B16]) -> 0.1 | I16: of:=IF(ABS([.B16])>1;[.B16]^9;[.B16]) -> 0.1 | K16: of:=IF(ABS([.B16])>1;[.B16];[.B16]) -> 0.1 | L16: of:=IF(ABS([.B16])>1;[.B16];[.B16]) -> 0.1 | M16: of:=IF(ABS([.B16])>1;[.B16];[.B16]) -> 0.1 | O16: -1000000000000000
B17: -1000000000000000 | C17: of:=IF(ABS([.B17])>1;0;[.B17]) -> 0 | D17: of:=[.B17]+[.D16] -> 0 | E17: of:=IF(ABS([.B17])>1;[.B17]^9;[.B17]) -> -1E+135 | F17: of:=[.E17]+[.F16] -> 0 | H17: of:=IF(ABS([.B17])>1;[.B17]^9;[.B17]) -> -1E+135 | I17: of:=IF(ABS([.B17])>1;[.B17]^9;[.B17]) -> -1E+135 | K17: of:=IF(ABS([.B17])>1;[.B17];[.B17]) -> -1000000000000000 | L17: of:=IF(ABS([.B17])>1;[.B17];[.B17]) -> -1000000000000000 | M17: of:=IF(ABS([.B17])>1;[.B17];[.B17]) -> -1000000000000000 | O17: -1
B18: 0.1 | C18: of:=IF(ABS([.B18])>1;0;[.B18]) -> 0.1 | D18: of:=[.B18]+[.D17] -> 0.1 | E18: of:=IF(ABS([.B18])>1;[.B18]^9;[.B18]) -> 0.1 | F18: of:=[.E18]+[.F17] -> 0.1 | H18: of:=IF(ABS([.B18])>1;[.B18]^9;[.B18]) -> 0.1 | I18: of:=IF(ABS([.B18])>1;[.B18]^9;[.B18]) -> 0.1 | K18: of:=IF(ABS([.B18])>1;[.B18];[.B18]) -> 0.1 | L18: of:=IF(ABS([.B18])>1;[.B18];[.B18]) -> 0.1 | M18: of:=IF(ABS([.B18])>1;[.B18];[.B18]) -> 0.1 | O18: 1000000000000000
B19: 1000000000000000 | C19: of:=IF(ABS([.B19])>1;0;[.B19]) -> 0 | D19: of:=[.B19]+[.D18] -> 1E+015 | E19: of:=IF(ABS([.B19])>1;[.B19]^9;[.B19]) -> 1E+135 | F19: of:=[.E19]+[.F18] -> 1E+135 | H19: of:=IF(ABS([.B19])>1;[.B19]^9;[.B19]) -> 1E+135 | I19: of:=IF(ABS([.B19])>1;[.B19]^9;[.B19]) -> 1E+135 | K19: of:=IF(ABS([.B19])>1;[.B19];[.B19]) -> 1000000000000000 | L19: of:=IF(ABS([.B19])>1;[.B19];[.B19]) -> 1000000000000000 | M19: of:=IF(ABS([.B19])>1;[.B19];[.B19]) -> 1000000000000000 | O19: 1
B20: 0.1 | C20: of:=IF(ABS([.B20])>1;0;[.B20]) -> 0.1 | D20: of:=[.B20]+[.D19] -> 1E+015 | E20: of:=IF(ABS([.B20])>1;[.B20]^9;[.B20]) -> 0.1 | F20: of:=[.E20]+[.F19] -> 1E+135 | H20: of:=IF(ABS([.B20])>1;[.B20]^9;[.B20]) -> 0.1 | I20: of:=IF(ABS([.B20])>1;[.B20]^9;[.B20]) -> 0.1 | K20: of:=IF(ABS([.B20])>1;[.B20];[.B20]) -> 0.1 | L20: of:=IF(ABS([.B20])>1;[.B20];[.B20]) -> 0.1 | M20: of:=IF(ABS([.B20])>1;[.B20];[.B20]) -> 0.1 | O20: 1E-015
B21: -1000000000000000 | C21: of:=IF(ABS([.B21])>1;0;[.B21]) -> 0 | D21: of:=[.B21]+[.D20] -> 0 | E21: of:=IF(ABS([.B21])>1;[.B21]^9;[.B21]) -> -1E+135 | F21: of:=[.E21]+[.F20] -> 0 | H21: of:=IF(ABS([.B21])>1;[.B21]^9;[.B21]) -> -1E+135 | I21: of:=IF(ABS([.B21])>1;[.B21]^9;[.B21]) -> -1E+135 | K21: of:=IF(ABS([.B21])>1;[.B21];[.B21]) -> -1000000000000000 | L21: of:=IF(ABS([.B21])>1;[.B21];[.B21]) -> -1000000000000000 | M21: of:=IF(ABS([.B21])>1;[.B21];[.B21]) -> -1000000000000000 | O21: -1000000000000000
B22: 0.1 | C22: of:=IF(ABS([.B22])>1;0;[.B22]) -> 0.1 | D22: of:=[.B22]+[.D21] -> 0.1 | E22: of:=IF(ABS([.B22])>1;[.B22]^9;[.B22]) -> 0.1 | F22: of:=[.E22]+[.F21] -> 0.1 | H22: of:=IF(ABS([.B22])>1;[.B22]^9;[.B22]) -> 0.1 | I22: of:=IF(ABS([.B22])>1;[.B22]^9;[.B22]) -> 0.1 | K22: of:=IF(ABS([.B22])>1;[.B22];[.B22]) -> 0.1 | L22: of:=IF(ABS([.B22])>1;[.B22];[.B22]) -> 0.1 | M22: of:=IF(ABS([.B22])>1;[.B22];[.B22]) -> 0.1 | O22: -1
B23: 1000000000000000 | C23: of:=IF(ABS([.B23])>1;0;[.B23]) -> 0 | D23: of:=[.B23]+[.D22] -> 1E+015 | E23: of:=IF(ABS([.B23])>1;[.B23]^9;[.B23]) -> 1E+135 | F23: of:=[.E23]+[.F22] -> 1E+135 | H23: of:=IF(ABS([.B23])>1;[.B23]^9;[.B23]) -> 1E+135 | I23: of:=IF(ABS([.B23])>1;[.B23]^9;[.B23]) -> 1E+135 | K23: of:=IF(ABS([.B23])>1;[.B23];[.B23]) -> 1000000000000000 | L23: of:=IF(ABS([.B23])>1;[.B23];[.B23]) -> 1000000000000000 | M23: of:=IF(ABS([.B23])>1;[.B23];[.B23]) -> 1000000000000000 | O23: 1000000000000000
B24: 0.1 | C24: of:=IF(ABS([.B24])>1;0;[.B24]) -> 0.1 | D24: of:=[.B24]+[.D23] -> 1E+015 | E24: of:=IF(ABS([.B24])>1;[.B24]^9;[.B24]) -> 0.1 | F24: of:=[.E24]+[.F23] -> 1E+135 | H24: of:=IF(ABS([.B24])>1;[.B24]^9;[.B24]) -> 0.1 | I24: of:=IF(ABS([.B24])>1;[.B24]^9;[.B24]) -> 0.1 | K24: of:=IF(ABS([.B24])>1;[.B24];[.B24]) -> 0.1 | L24: of:=IF(ABS([.B24])>1;[.B24];[.B24]) -> 0.1 | M24: of:=IF(ABS([.B24])>1;[.B24];[.B24]) -> 0.1 | O24: 1
B25: -1000000000000000 | C25: of:=IF(ABS([.B25])>1;0;[.B25]) -> 0 | D25: of:=[.B25]+[.D24] -> 0 | E25: of:=IF(ABS([.B25])>1;[.B25]^9;[.B25]) -> -1E+135 | F25: of:=[.E25]+[.F24] -> 0 | H25: of:=IF(ABS([.B25])>1;[.B25]^9;[.B25]) -> -1E+135 | I25: of:=IF(ABS([.B25])>1;[.B25]^9;[.B25]) -> -1E+135 | K25: of:=IF(ABS([.B25])>1;[.B25];[.B25]) -> -1000000000000000 | L25: of:=IF(ABS([.B25])>1;[.B25];[.B25]) -> -1000000000000000 | M25: of:=IF(ABS([.B25])>1;[.B25];[.B25]) -> -1000000000000000 | O25: 1E-015
B26: 0.1 | C26: of:=IF(ABS([.B26])>1;0;[.B26]) -> 0.1 | D26: of:=[.B26]+[.D25] -> 0.1 | E26: of:=IF(ABS([.B26])>1;[.B26]^9;[.B26]) -> 0.1 | F26: of:=[.E26]+[.F25] -> 0.1 | H26: of:=IF(ABS([.B26])>1;[.B26]^9;[.B26]) -> 0.1 | I26: of:=IF(ABS([.B26])>1;[.B26]^9;[.B26]) -> 0.1 | K26: of:=IF(ABS([.B26])>1;[.B26];[.B26]) -> 0.1 | L26: of:=IF(ABS([.B26])>1;[.B26];[.B26]) -> 0.1 | M26: of:=IF(ABS([.B26])>1;[.B26];[.B26]) -> 0.1 | O26: -1000000000000000
B27: 1000000000000000 | C27: of:=IF(ABS([.B27])>1;0;[.B27]) -> 0 | D27: of:=[.B27]+[.D26] -> 1E+015 | E27: of:=IF(ABS([.B27])>1;[.B27]^9;[.B27]) -> 1E+135 | F27: of:=[.E27]+[.F26] -> 1E+135 | H27: of:=IF(ABS([.B27])>1;[.B27]^9;[.B27]) -> 1E+135 | I27: of:=IF(ABS([.B27])>1;[.B27]^9;[.B27]) -> 1E+135 | K27: of:=IF(ABS([.B27])>1;[.B27];[.B27]) -> 1000000000000000 | L27: of:=IF(ABS([.B27])>1;[.B27];[.B27]) -> 1000000000000000 | M27: of:=IF(ABS([.B27])>1;[.B27];[.B27]) -> 1000000000000000 | O27: -1
B28: 0.1 | C28: of:=IF(ABS([.B28])>1;0;[.B28]) -> 0.1 | D28: of:=[.B28]+[.D27] -> 1E+015 | E28: of:=IF(ABS([.B28])>1;[.B28]^9;[.B28]) -> 0.1 | F28: of:=[.E28]+[.F27] -> 1E+135 | H28: of:=IF(ABS([.B28])>1;[.B28]^9;[.B28]) -> 0.1 | I28: of:=IF(ABS([.B28])>1;[.B28]^9;[.B28]) -> 0.1 | K28: of:=IF(ABS([.B28])>1;[.B28];[.B28]) -> 0.1 | L28: of:=IF(ABS([.B28])>1;[.B28];[.B28]) -> 0.1 | M28: of:=IF(ABS([.B28])>1;[.B28];[.B28]) -> 0.1 | O28: 1000000000000000
B29: -1000000000000000 | C29: of:=IF(ABS([.B29])>1;0;[.B29]) -> 0 | D29: of:=[.B29]+[.D28] -> 0 | E29: of:=IF(ABS([.B29])>1;[.B29]^9;[.B29]) -> -1E+135 | F29: of:=[.E29]+[.F28] -> 0 | H29: of:=IF(ABS([.B29])>1;[.B29]^9;[.B29]) -> -1E+135 | I29: of:=IF(ABS([.B29])>1;[.B29]^9;[.B29]) -> -1E+135 | K29: of:=IF(ABS([.B29])>1;[.B29];[.B29]) -> -1000000000000000 | L29: of:=IF(ABS([.B29])>1;[.B29];[.B29]) -> -1000000000000000 | M29: of:=IF(ABS([.B29])>1;[.B29];[.B29]) -> -1000000000000000 | O29: 1
B30: 0.1 | C30: of:=IF(ABS([.B30])>1;0;[.B30]) -> 0.1 | D30: of:=[.B30]+[.D29] -> 0.1 | E30: of:=IF(ABS([.B30])>1;[.B30]^9;[.B30]) -> 0.1 | F30: of:=[.E30]+[.F29] -> 0.1 | H30: of:=IF(ABS([.B30])>1;[.B30]^9;[.B30]) -> 0.1 | I30: of:=IF(ABS([.B30])>1;[.B30]^9;[.B30]) -> 0.1 | K30: of:=IF(ABS([.B30])>1;[.B30];[.B30]) -> 0.1 | L30: of:=IF(ABS([.B30])>1;[.B30];[.B30]) -> 0.1 | M30: of:=IF(ABS([.B30])>1;[.B30];[.B30]) -> 0.1 | O30: 1E-015
B31: 1000000000000000 | C31: of:=IF(ABS([.B31])>1;0;[.B31]) -> 0 | D31: of:=[.B31]+[.D30] -> 1E+015 | E31: of:=IF(ABS([.B31])>1;[.B31]^9;[.B31]) -> 1E+135 | F31: of:=[.E31]+[.F30] -> 1E+135 | H31: of:=IF(ABS([.B31])>1;[.B31]^9;[.B31]) -> 1E+135 | I31: of:=IF(ABS([.B31])>1;[.B31]^9;[.B31]) -> 1E+135 | K31: of:=IF(ABS([.B31])>1;[.B31];[.B31]) -> 1000000000000000 | L31: of:=IF(ABS([.B31])>1;[.B31];[.B31]) -> 1000000000000000 | M31: of:=IF(ABS([.B31])>1;[.B31];[.B31]) -> 1000000000000000 | O31: -1000000000000000
B32: 0.1 | C32: of:=IF(ABS([.B32])>1;0;[.B32]) -> 0.1 | D32: of:=[.B32]+[.D31] -> 1E+015 | E32: of:=IF(ABS([.B32])>1;[.B32]^9;[.B32]) -> 0.1 | F32: of:=[.E32]+[.F31] -> 1E+135 | H32: of:=IF(ABS([.B32])>1;[.B32]^9;[.B32]) -> 0.1 | I32: of:=IF(ABS([.B32])>1;[.B32]^9;[.B32]) -> 0.1 | K32: of:=IF(ABS([.B32])>1;[.B32];[.B32]) -> 0.1 | L32: of:=IF(ABS([.B32])>1;[.B32];[.B32]) -> 0.1 | M32: of:=IF(ABS([.B32])>1;[.B32];[.B32]) -> 0.1 | O32: -1
B33: -1000000000000000 | C33: of:=IF(ABS([.B33])>1;0;[.B33]) -> 0 | D33: of:=[.B33]+[.D32] -> 0 | E33: of:=IF(ABS([.B33])>1;[.B33]^9;[.B33]) -> -1E+135 | F33: of:=[.E33]+[.F32] -> 0 | H33: of:=IF(ABS([.B33])>1;[.B33]^9;[.B33]) -> -1E+135 | I33: of:=IF(ABS([.B33])>1;[.B33]^9;[.B33]) -> -1E+135 | K33: of:=IF(ABS([.B33])>1;[.B33];[.B33]) -> -1000000000000000 | L33: of:=IF(ABS([.B33])>1;[.B33];[.B33]) -> -1000000000000000 | M33: of:=IF(ABS([.B33])>1;[.B33];[.B33]) -> -1000000000000000 | O33: 1000000000000000
B34: 0.1 | C34: of:=IF(ABS([.B34])>1;0;[.B34]) -> 0.1 | D34: of:=[.B34]+[.D33] -> 0.1 | E34: of:=IF(ABS([.B34])>1;[.B34]^9;[.B34]) -> 0.1 | F34: of:=[.E34]+[.F33] -> 0.1 | H34: of:=IF(ABS([.B34])>1;[.B34]^9;[.B34]) -> 0.1 | I34: of:=IF(ABS([.B34])>1;[.B34]^9;[.B34]) -> 0.1 | K34: of:=IF(ABS([.B34])>1;[.B34];[.B34]) -> 0.1 | L34: of:=IF(ABS([.B34])>1;[.B34];[.B34]) -> 0.1 | M34: of:=IF(ABS([.B34])>1;[.B34];[.B34]) -> 0.1 | O34: 1
B35: 1000000000000000 | C35: of:=IF(ABS([.B35])>1;0;[.B35]) -> 0 | D35: of:=[.B35]+[.D34] -> 1E+015 | E35: of:=IF(ABS([.B35])>1;[.B35]^9;[.B35]) -> 1E+135 | F35: of:=[.E35]+[.F34] -> 1E+135 | H35: of:=IF(ABS([.B35])>1;[.B35]^9;[.B35]) -> 1E+135 | I35: of:=IF(ABS([.B35])>1;[.B35]^9;[.B35]) -> 1E+135 | K35: of:=IF(ABS([.B35])>1;[.B35];[.B35]) -> 1000000000000000 | L35: of:=IF(ABS([.B35])>1;[.B35];[.B35]) -> 1000000000000000 | M35: of:=IF(ABS([.B35])>1;[.B35];[.B35]) -> 1000000000000000 | O35: 1E-015
B36: 0.1 | C36: of:=IF(ABS([.B36])>1;0;[.B36]) -> 0.1 | D36: of:=[.B36]+[.D35] -> 1E+015 | E36: of:=IF(ABS([.B36])>1;[.B36]^9;[.B36]) -> 0.1 | F36: of:=[.E36]+[.F35] -> 1E+135 | H36: of:=IF(ABS([.B36])>1;[.B36]^9;[.B36]) -> 0.1 | I36: of:=IF(ABS([.B36])>1;[.B36]^9;[.B36]) -> 0.1 | K36: of:=IF(ABS([.B36])>1;[.B36];[.B36]) -> 0.1 | L36: of:=IF(ABS([.B36])>1;[.B36];[.B36]) -> 0.1 | M36: of:=IF(ABS([.B36])>1;[.B36];[.B36]) -> 0.1 | O36: -1000000000000000
B37: -1000000000000000 | C37: of:=IF(ABS([.B37])>1;0;[.B37]) -> 0 | D37: of:=[.B37]+[.D36] -> 0 | E37: of:=IF(ABS([.B37])>1;[.B37]^9;[.B37]) -> -1E+135 | F37: of:=[.E37]+[.F36] -> 0 | H37: of:=IF(ABS([.B37])>1;[.B37]^9;[.B37]) -> -1E+135 | I37: of:=IF(ABS([.B37])>1;[.B37]^9;[.B37]) -> -1E+135 | K37: of:=IF(ABS([.B37])>1;[.B37];[.B37]) -> -1000000000000000 | L37: of:=IF(ABS([.B37])>1;[.B37];[.B37]) -> -1000000000000000 | M37: of:=IF(ABS([.B37])>1;[.B37];[.B37]) -> -1000000000000000 | O37: -1
B38: 0.1 | C38: of:=IF(ABS([.B38])>1;0;[.B38]) -> 0.1 | D38: of:=[.B38]+[.D37] -> 0.1 | E38: of:=IF(ABS([.B38])>1;[.B38]^9;[.B38]) -> 0.1 | F38: of:=[.E38]+[.F37] -> 0.1 | H38: of:=IF(ABS([.B38])>1;[.B38]^9;[.B38]) -> 0.1 | I38: of:=IF(ABS([.B38])>1;[.B38]^9;[.B38]) -> 0.1 | K38: of:=IF(ABS([.B38])>1;[.B38];[.B38]) -> 0.1 | L38: of:=IF(ABS([.B38])>1;[.B38];[.B38]) -> 0.1 | M38: of:=IF(ABS([.B38])>1;[.B38];[.B38]) -> 0.1 | O38: 1000000000000000
B39: 1000000000000000 | C39: of:=IF(ABS([.B39])>1;0;[.B39]) -> 0 | D39: of:=[.B39]+[.D38] -> 1E+015 | E39: of:=IF(ABS([.B39])>1;[.B39]^9;[.B39]) -> 1E+135 | F39: of:=[.E39]+[.F38] -> 1E+135 | H39: of:=IF(ABS([.B39])>1;[.B39]^9;[.B39]) -> 1E+135 | I39: of:=IF(ABS([.B39])>1;[.B39]^9;[.B39]) -> 1E+135 | K39: of:=IF(ABS([.B39])>1;[.B39];[.B39]) -> 1000000000000000 | L39: of:=IF(ABS([.B39])>1;[.B39];[.B39]) -> 1000000000000000 | M39: of:=IF(ABS([.B39])>1;[.B39];[.B39]) -> 1000000000000000 | O39: 1
B40: 0.1 | C40: of:=IF(ABS([.B40])>1;0;[.B40]) -> 0.1 | D40: of:=[.B40]+[.D39] -> 1E+015 | E40: of:=IF(ABS([.B40])>1;[.B40]^9;[.B40]) -> 0.1 | F40: of:=[.E40]+[.F39] -> 1E+135 | H40: of:=IF(ABS([.B40])>1;[.B40]^9;[.B40]) -> 0.1 | I40: of:=IF(ABS([.B40])>1;[.B40]^9;[.B40]) -> 0.1 | K40: of:=IF(ABS([.B40])>1;[.B40];[.B40]) -> 0.1 | L40: of:=IF(ABS([.B40])>1;[.B40];[.B40]) -> 0.1 | M40: of:=IF(ABS([.B40])>1;[.B40];[.B40]) -> 0.1 | O40: 1E-015
B41: -1000000000000000 | C41: of:=IF(ABS([.B41])>1;0;[.B41]) -> 0 | D41: of:=[.B41]+[.D40] -> 0 | E41: of:=IF(ABS([.B41])>1;[.B41]^9;[.B41]) -> -1E+135 | F41: of:=[.E41]+[.F40] -> 0 | H41: of:=IF(ABS([.B41])>1;[.B41]^9;[.B41]) -> -1E+135 | I41: of:=IF(ABS([.B41])>1;[.B41]^9;[.B41]) -> -1E+135 | K41: of:=IF(ABS([.B41])>1;[.B41];[.B41]) -> -1000000000000000 | L41: of:=IF(ABS([.B41])>1;[.B41];[.B41]) -> -1000000000000000 | M41: of:=IF(ABS([.B41])>1;[.B41];[.B41]) -> -1000000000000000 | O41: -1000000000000000
B42: 0.1 | C42: of:=IF(ABS([.B42])>1;0;[.B42]) -> 0.1 | D42: of:=[.B42]+[.D41] -> 0.1 | E42: of:=IF(ABS([.B42])>1;[.B42]^9;[.B42]) -> 0.1 | F42: of:=[.E42]+[.F41] -> 0.1 | H42: of:=IF(ABS([.B42])>1;[.B42]^9;[.B42]) -> 0.1 | I42: of:=IF(ABS([.B42])>1;[.B42]^9;[.B42]) -> 0.1 | K42: of:=IF(ABS([.B42])>1;[.B42];[.B42]) -> 0.1 | L42: of:=IF(ABS([.B42])>1;[.B42];[.B42]) -> 0.1 | M42: of:=IF(ABS([.B42])>1;[.B42];[.B42]) -> 0.1 | O42: -1
B43: 1000000000000000 | C43: of:=IF(ABS([.B43])>1;0;[.B43]) -> 0 | D43: of:=[.B43]+[.D42] -> 1E+015 | E43: of:=IF(ABS([.B43])>1;[.B43]^9;[.B43]) -> 1E+135 | F43: of:=[.E43]+[.F42] -> 1E+135 | H43: of:=IF(ABS([.B43])>1;[.B43]^9;[.B43]) -> 1E+135 | I43: of:=IF(ABS([.B43])>1;[.B43]^9;[.B43]) -> 1E+135 | K43: of:=IF(ABS([.B43])>1;[.B43];[.B43]) -> 1000000000000000 | L43: of:=IF(ABS([.B43])>1;[.B43];[.B43]) -> 1000000000000000 | M43: of:=IF(ABS([.B43])>1;[.B43];[.B43]) -> 1000000000000000 | O43: 1000000000000000
B44: 0.1 | C44: of:=IF(ABS([.B44])>1;0;[.B44]) -> 0.1 | D44: of:=[.B44]+[.D43] -> 1E+015 | E44: of:=IF(ABS([.B44])>1;[.B44]^9;[.B44]) -> 0.1 | F44: of:=[.E44]+[.F43] -> 1E+135 | H44: of:=IF(ABS([.B44])>1;[.B44]^9;[.B44]) -> 0.1 | I44: of:=IF(ABS([.B44])>1;[.B44]^9;[.B44]) -> 0.1 | K44: of:=IF(ABS([.B44])>1;[.B44];[.B44]) -> 0.1 | L44: of:=IF(ABS([.B44])>1;[.B44];[.B44]) -> 0.1 | M44: of:=IF(ABS([.B44])>1;[.B44];[.B44]) -> 0.1 | O44: 1
B45: -1000000000000000 | C45: of:=IF(ABS([.B45])>1;0;[.B45]) -> 0 | D45: of:=[.B45]+[.D44] -> 0 | E45: of:=IF(ABS([.B45])>1;[.B45]^9;[.B45]) -> -1E+135 | F45: of:=[.E45]+[.F44] -> 0 | H45: of:=IF(ABS([.B45])>1;[.B45]^9;[.B45]) -> -1E+135 | I45: of:=IF(ABS([.B45])>1;[.B45]^9;[.B45]) -> -1E+135 | K45: of:=IF(ABS([.B45])>1;[.B45];[.B45]) -> -1000000000000000 | L45: of:=IF(ABS([.B45])>1;[.B45];[.B45]) -> -1000000000000000 | M45: of:=IF(ABS([.B45])>1;[.B45];[.B45]) -> -1000000000000000 | O45: 1E-015
B46: 0.1 | C46: of:=IF(ABS([.B46])>1;0;[.B46]) -> 0.1 | D46: of:=[.B46]+[.D45] -> 0.1 | E46: of:=IF(ABS([.B46])>1;[.B46]^9;[.B46]) -> 0.1 | F46: of:=[.E46]+[.F45] -> 0.1 | H46: of:=IF(ABS([.B46])>1;[.B46]^9;[.B46]) -> 0.1 | I46: of:=IF(ABS([.B46])>1;[.B46]^9;[.B46]) -> 0.1 | K46: of:=IF(ABS([.B46])>1;[.B46];[.B46]) -> 0.1 | L46: of:=IF(ABS([.B46])>1;[.B46];[.B46]) -> 0.1 | M46: of:=IF(ABS([.B46])>1;[.B46];[.B46]) -> 0.1 | O46: -1000000000000000
B47: 1000000000000000 | C47: of:=IF(ABS([.B47])>1;0;[.B47]) -> 0 | D47: of:=[.B47]+[.D46] -> 1E+015 | E47: of:=IF(ABS([.B47])>1;[.B47]^9;[.B47]) -> 1E+135 | F47: of:=[.E47]+[.F46] -> 1E+135 | H47: of:=IF(ABS([.B47])>1;[.B47]^9;[.B47]) -> 1E+135 | I47: of:=IF(ABS([.B47])>1;[.B47]^9;[.B47]) -> 1E+135 | K47: of:=IF(ABS([.B47])>1;[.B47];[.B47]) -> 1000000000000000 | L47: of:=IF(ABS([.B47])>1;[.B47];[.B47]) -> 1000000000000000 | M47: of:=IF(ABS([.B47])>1;[.B47];[.B47]) -> 1000000000000000 | O47: -1
B48: 0.1 | C48: of:=IF(ABS([.B48])>1;0;[.B48]) -> 0.1 | D48: of:=[.B48]+[.D47] -> 1E+015 | E48: of:=IF(ABS([.B48])>1;[.B48]^9;[.B48]) -> 0.1 | F48: of:=[.E48]+[.F47] -> 1E+135 | H48: of:=IF(ABS([.B48])>1;[.B48]^9;[.B48]) -> 0.1 | I48: of:=IF(ABS([.B48])>1;[.B48]^9;[.B48]) -> 0.1 | K48: of:=IF(ABS([.B48])>1;[.B48];[.B48]) -> 0.1 | L48: of:=IF(ABS([.B48])>1;[.B48];[.B48]) -> 0.1 | M48: of:=IF(ABS([.B48])>1;[.B48];[.B48]) -> 0.1 | O48: 1000000000000000
B49: -1000000000000000 | C49: of:=IF(ABS([.B49])>1;0;[.B49]) -> 0 | D49: of:=[.B49]+[.D48] -> 0 | E49: of:=IF(ABS([.B49])>1;[.B49]^9;[.B49]) -> -1E+135 | F49: of:=[.E49]+[.F48] -> 0 | H49: of:=IF(ABS([.B49])>1;[.B49]^9;[.B49]) -> -1E+135 | I49: of:=IF(ABS([.B49])>1;[.B49]^9;[.B49]) -> -1E+135 | K49: of:=IF(ABS([.B49])>1;[.B49];[.B49]) -> -1000000000000000 | L49: of:=IF(ABS([.B49])>1;[.B49];[.B49]) -> -1000000000000000 | M49: of:=IF(ABS([.B49])>1;[.B49];[.B49]) -> -1000000000000000 | O49: 1
B50: 0.1 | C50: of:=IF(ABS([.B50])>1;0;[.B50]) -> 0.1 | D50: of:=[.B50]+[.D49] -> 0.1 | E50: of:=IF(ABS([.B50])>1;[.B50]^9;[.B50]) -> 0.1 | F50: of:=[.E50]+[.F49] -> 0.1 | H50: of:=IF(ABS([.B50])>1;[.B50]^9;[.B50]) -> 0.1 | I50: of:=IF(ABS([.B50])>1;[.B50]^9;[.B50]) -> 0.1 | K50: of:=IF(ABS([.B50])>1;[.B50];[.B50]) -> 0.1 | L50: of:=IF(ABS([.B50])>1;[.B50];[.B50]) -> 0.1 | M50: of:=IF(ABS([.B50])>1;[.B50];[.B50]) -> 0.1 | O50: 1E-015
B51: 1000000000000000 | C51: of:=IF(ABS([.B51])>1;0;[.B51]) -> 0 | D51: of:=[.B51]+[.D50] -> 1E+015 | E51: of:=IF(ABS([.B51])>1;[.B51]^9;[.B51]) -> 1E+135 | F51: of:=[.E51]+[.F50] -> 1E+135 | H51: of:=IF(ABS([.B51])>1;[.B51]^9;[.B51]) -> 1E+135 | I51: of:=IF(ABS([.B51])>1;[.B51]^9;[.B51]) -> 1E+135 | K51: of:=IF(ABS([.B51])>1;[.B51];[.B51]) -> 1000000000000000 | L51: of:=IF(ABS([.B51])>1;[.B51];[.B51]) -> 1000000000000000 | M51: of:=IF(ABS([.B51])>1;[.B51];[.B51]) -> 1000000000000000 | O51: -1000000000000000
B52: 0.1 | C52: of:=IF(ABS([.B52])>1;0;[.B52]) -> 0.1 | D52: of:=[.B52]+[.D51] -> 1E+015 | E52: of:=IF(ABS([.B52])>1;[.B52]^9;[.B52]) -> 0.1 | F52: of:=[.E52]+[.F51] -> 1E+135 | H52: of:=IF(ABS([.B52])>1;[.B52]^9;[.B52]) -> 0.1 | I52: of:=IF(ABS([.B52])>1;[.B52]^9;[.B52]) -> 0.1 | K52: of:=IF(ABS([.B52])>1;[.B52];[.B52]) -> 0.1 | L52: of:=IF(ABS([.B52])>1;[.B52];[.B52]) -> 0.1 | M52: of:=IF(ABS([.B52])>1;[.B52];[.B52]) -> 0.1 | O52: -1
B53: -1000000000000000 | C53: of:=IF(ABS([.B53])>1;0;[.B53]) -> 0 | D53: of:=[.B53]+[.D52] -> 0 | E53: of:=IF(ABS([.B53])>1;[.B53]^9;[.B53]) -> -1E+135 | F53: of:=[.E53]+[.F52] -> 0 | H53: of:=IF(ABS([.B53])>1;[.B53]^9;[.B53]) -> -1E+135 | I53: of:=IF(ABS([.B53])>1;[.B53]^9;[.B53]) -> -1E+135 | K53: of:=IF(ABS([.B53])>1;[.B53];[.B53]) -> -1000000000000000 | L53: of:=IF(ABS([.B53])>1;[.B53];[.B53]) -> -1000000000000000 | M53: of:=IF(ABS([.B53])>1;[.B53];[.B53]) -> -1000000000000000 | O53: 1000000000000000
B54: 0.1 | C54: of:=IF(ABS([.B54])>1;0;[.B54]) -> 0.1 | D54: of:=[.B54]+[.D53] -> 0.1 | E54: of:=IF(ABS([.B54])>1;[.B54]^9;[.B54]) -> 0.1 | F54: of:=[.E54]+[.F53] -> 0.1 | H54: of:=IF(ABS([.B54])>1;[.B54]^9;[.B54]) -> 0.1 | I54: of:=IF(ABS([.B54])>1;[.B54]^9;[.B54]) -> 0.1 | K54: of:=IF(ABS([.B54])>1;[.B54];[.B54]) -> 0.1 | L54: of:=IF(ABS([.B54])>1;[.B54];[.B54]) -> 0.1 | M54: of:=IF(ABS([.B54])>1;[.B54];[.B54]) -> 0.1 | O54: 1
B55: 1000000000000000 | C55: of:=IF(ABS([.B55])>1;0;[.B55]) -> 0 | D55: of:=[.B55]+[.D54] -> 1E+015 | E55: of:=IF(ABS([.B55])>1;[.B55]^9;[.B55]) -> 1E+135 | F55: of:=[.E55]+[.F54] -> 1E+135 | H55: of:=IF(ABS([.B55])>1;[.B55]^9;[.B55]) -> 1E+135 | I55: of:=IF(ABS([.B55])>1;[.B55]^9;[.B55]) -> 1E+135 | K55: of:=IF(ABS([.B55])>1;[.B55];[.B55]) -> 1000000000000000 | L55: of:=IF(ABS([.B55])>1;[.B55];[.B55]) -> 1000000000000000 | M55: of:=IF(ABS([.B55])>1;[.B55];[.B55]) -> 1000000000000000 | O55: 1E-015
B56: 0.1 | C56: of:=IF(ABS([.B56])>1;0;[.B56]) -> 0.1 | D56: of:=[.B56]+[.D55] -> 1E+015 | E56: of:=IF(ABS([.B56])>1;[.B56]^9;[.B56]) -> 0.1 | F56: of:=[.E56]+[.F55] -> 1E+135 | H56: of:=IF(ABS([.B56])>1;[.B56]^9;[.B56]) -> 0.1 | I56: of:=IF(ABS([.B56])>1;[.B56]^9;[.B56]) -> 0.1 | K56: of:=IF(ABS([.B56])>1;[.B56];[.B56]) -> 0.1 | L56: of:=IF(ABS([.B56])>1;[.B56];[.B56]) -> 0.1 | M56: of:=IF(ABS([.B56])>1;[.B56];[.B56]) -> 0.1 | O56: -1000000000000000
B57: -1000000000000000 | C57: of:=IF(ABS([.B57])>1;0;[.B57]) -> 0 | D57: of:=[.B57]+[.D56] -> 0 | E57: of:=IF(ABS([.B57])>1;[.B57]^9;[.B57]) -> -1E+135 | F57: of:=[.E57]+[.F56] -> 0 | H57: of:=IF(ABS([.B57])>1;[.B57]^9;[.B57]) -> -1E+135 | I57: of:=IF(ABS([.B57])>1;[.B57]^9;[.B57]) -> -1E+135 | K57: of:=IF(ABS([.B57])>1;[.B57];[.B57]) -> -1000000000000000 | L57: of:=IF(ABS([.B57])>1;[.B57];[.B57]) -> -1000000000000000 | M57: of:=IF(ABS([.B57])>1;[.B57];[.B57]) -> -1000000000000000 | O57: -1
B58: 0.1 | C58: of:=IF(ABS([.B58])>1;0;[.B58]) -> 0.1 | D58: of:=[.B58]+[.D57] -> 0.1 | E58: of:=IF(ABS([.B58])>1;[.B58]^9;[.B58]) -> 0.1 | F58: of:=[.E58]+[.F57] -> 0.1 | H58: of:=IF(ABS([.B58])>1;[.B58]^9;[.B58]) -> 0.1 | I58: of:=IF(ABS([.B58])>1;[.B58]^9;[.B58]) -> 0.1 | K58: of:=IF(ABS([.B58])>1;[.B58];[.B58]) -> 0.1 | L58: of:=IF(ABS([.B58])>1;[.B58];[.B58]) -> 0.1 | M58: of:=IF(ABS([.B58])>1;[.B58];[.B58]) -> 0.1 | O58: 1000000000000000
B59: 1000000000000000 | C59: of:=IF(ABS([.B59])>1;0;[.B59]) -> 0 | D59: of:=[.B59]+[.D58] -> 1E+015 | E59: of:=IF(ABS([.B59])>1;[.B59]^9;[.B59]) -> 1E+135 | F59: of:=[.E59]+[.F58] -> 1E+135 | H59: of:=IF(ABS([.B59])>1;[.B59]^9;[.B59]) -> 1E+135 | I59: of:=IF(ABS([.B59])>1;[.B59]^9;[.B59]) -> 1E+135 | K59: of:=IF(ABS([.B59])>1;[.B59];[.B59]) -> 1000000000000000 | L59: of:=IF(ABS([.B59])>1;[.B59];[.B59]) -> 1000000000000000 | M59: of:=IF(ABS([.B59])>1;[.B59];[.B59]) -> 1000000000000000 | O59: 1
B60: 0.1 | C60: of:=IF(ABS([.B60])>1;0;[.B60]) -> 0.1 | D60: of:=[.B60]+[.D59] -> 1E+015 | E60: of:=IF(ABS([.B60])>1;[.B60]^9;[.B60]) -> 0.1 | F60: of:=[.E60]+[.F59] -> 1E+135 | H60: of:=IF(ABS([.B60])>1;[.B60]^9;[.B60]) -> 0.1 | I60: of:=IF(ABS([.B60])>1;[.B60]^9;[.B60]) -> 0.1 | K60: of:=IF(ABS([.B60])>1;[.B60];[.B60]) -> 0.1 | L60: of:=IF(ABS([.B60])>1;[.B60];[.B60]) -> 0.1 | M60: of:=IF(ABS([.B60])>1;[.B60];[.B60]) -> 0.1 | O60: 1E-015
B61: -1000000000000000 | C61: of:=IF(ABS([.B61])>1;0;[.B61]) -> 0 | D61: of:=[.B61]+[.D60] -> 0 | E61: of:=IF(ABS([.B61])>1;[.B61]^9;[.B61]) -> -1E+135 | F61: of:=[.E61]+[.F60] -> 0 | H61: of:=IF(ABS([.B61])>1;[.B61]^9;[.B61]) -> -1E+135 | I61: of:=IF(ABS([.B61])>1;[.B61]^9;[.B61]) -> -1E+135 | K61: of:=IF(ABS([.B61])>1;[.B61];[.B61]) -> -1000000000000000 | L61: of:=IF(ABS([.B61])>1;[.B61];[.B61]) -> -1000000000000000 | M61: of:=IF(ABS([.B61])>1;[.B61];[.B61]) -> -1000000000000000 | O61: -1000000000000000
B62: 0.1 | C62: of:=IF(ABS([.B62])>1;0;[.B62]) -> 0.1 | D62: of:=[.B62]+[.D61] -> 0.1 | E62: of:=IF(ABS([.B62])>1;[.B62]^9;[.B62]) -> 0.1 | F62: of:=[.E62]+[.F61] -> 0.1 | H62: of:=IF(ABS([.B62])>1;[.B62]^9;[.B62]) -> 0.1 | I62: of:=IF(ABS([.B62])>1;[.B62]^9;[.B62]) -> 0.1 | K62: of:=IF(ABS([.B62])>1;[.B62];[.B62]) -> 0.1 | L62: of:=IF(ABS([.B62])>1;[.B62];[.B62]) -> 0.1 | M62: of:=IF(ABS([.B62])>1;[.B62];[.B62]) -> 0.1 | O62: -1
B63: 1000000000000000 | C63: of:=IF(ABS([.B63])>1;0;[.B63]) -> 0 | D63: of:=[.B63]+[.D62] -> 1E+015 | E63: of:=IF(ABS([.B63])>1;[.B63]^9;[.B63]) -> 1E+135 | F63: of:=[.E63]+[.F62] -> 1E+135 | H63: of:=IF(ABS([.B63])>1;[.B63]^9;[.B63]) -> 1E+135 | I63: of:=IF(ABS([.B63])>1;[.B63]^9;[.B63]) -> 1E+135 | K63: of:=IF(ABS([.B63])>1;[.B63];[.B63]) -> 1000000000000000 | L63: of:=IF(ABS([.B63])>1;[.B63];[.B63]) -> 1000000000000000 | M63: of:=IF(ABS([.B63])>1;[.B63];[.B63]) -> 1000000000000000 | O63: 1000000000000000
B64: 0.1 | C64: of:=IF(ABS([.B64])>1;0;[.B64]) -> 0.1 | D64: of:=[.B64]+[.D63] -> 1E+015 | E64: of:=IF(ABS([.B64])>1;[.B64]^9;[.B64]) -> 0.1 | F64: of:=[.E64]+[.F63] -> 1E+135 | H64: of:=IF(ABS([.B64])>1;[.B64]^9;[.B64]) -> 0.1 | I64: of:=IF(ABS([.B64])>1;[.B64]^9;[.B64]) -> 0.1 | K64: of:=IF(ABS([.B64])>1;[.B64];[.B64]) -> 0.1 | L64: of:=IF(ABS([.B64])>1;[.B64];[.B64]) -> 0.1 | M64: of:=IF(ABS([.B64])>1;[.B64];[.B64]) -> 0.1 | O64: 1
B65: -1000000000000000 | C65: of:=IF(ABS([.B65])>1;0;[.B65]) -> 0 | D65: of:=[.B65]+[.D64] -> 0 | E65: of:=IF(ABS([.B65])>1;[.B65]^9;[.B65]) -> -1E+135 | F65: of:=[.E65]+[.F64] -> 0 | H65: of:=IF(ABS([.B65])>1;[.B65]^9;[.B65]) -> -1E+135 | I65: of:=IF(ABS([.B65])>1;[.B65]^9;[.B65]) -> -1E+135 | K65: of:=IF(ABS([.B65])>1;[.B65];[.B65]) -> -1000000000000000 | L65: of:=IF(ABS([.B65])>1;[.B65];[.B65]) -> -1000000000000000 | M65: of:=IF(ABS([.B65])>1;[.B65];[.B65]) -> -1000000000000000 | O65: 1E-015
B66: 0.1 | C66: of:=IF(ABS([.B66])>1;0;[.B66]) -> 0.1 | D66: of:=[.B66]+[.D65] -> 0.1 | E66: of:=IF(ABS([.B66])>1;[.B66]^9;[.B66]) -> 0.1 | F66: of:=[.E66]+[.F65] -> 0.1 | H66: of:=IF(ABS([.B66])>1;[.B66]^9;[.B66]) -> 0.1 | I66: of:=IF(ABS([.B66])>1;[.B66]^9;[.B66]) -> 0.1 | K66: of:=IF(ABS([.B66])>1;[.B66];[.B66]) -> 0.1 | L66: of:=IF(ABS([.B66])>1;[.B66];[.B66]) -> 0.1 | M66: of:=IF(ABS([.B66])>1;[.B66];[.B66]) -> 0.1 | O66: -1000000000000000
B67: 1000000000000000 | C67: of:=IF(ABS([.B67])>1;0;[.B67]) -> 0 | D67: of:=[.B67]+[.D66] -> 1E+015 | E67: of:=IF(ABS([.B67])>1;[.B67]^9;[.B67]) -> 1E+135 | F67: of:=[.E67]+[.F66] -> 1E+135 | H67: of:=IF(ABS([.B67])>1;[.B67]^9;[.B67]) -> 1E+135 | I67: of:=IF(ABS([.B67])>1;[.B67]^9;[.B67]) -> 1E+135 | K67: of:=IF(ABS([.B67])>1;[.B67];[.B67]) -> 1000000000000000 | L67: of:=IF(ABS([.B67])>1;[.B67];[.B67]) -> 1000000000000000 | M67: of:=IF(ABS([.B67])>1;[.B67];[.B67]) -> 1000000000000000 | O67: -1
B68: 0.1 | C68: of:=IF(ABS([.B68])>1;0;[.B68]) -> 0.1 | D68: of:=[.B68]+[.D67] -> 1E+015 | E68: of:=IF(ABS([.B68])>1;[.B68]^9;[.B68]) -> 0.1 | F68: of:=[.E68]+[.F67] -> 1E+135 | H68: of:=IF(ABS([.B68])>1;[.B68]^9;[.B68]) -> 0.1 | I68: of:=IF(ABS([.B68])>1;[.B68]^9;[.B68]) -> 0.1 | K68: of:=IF(ABS([.B68])>1;[.B68];[.B68]) -> 0.1 | L68: of:=IF(ABS([.B68])>1;[.B68];[.B68]) -> 0.1 | M68: of:=IF(ABS([.B68])>1;[.B68];[.B68]) -> 0.1 | O68: 1000000000000000
B69: -1000000000000000 | C69: of:=IF(ABS([.B69])>1;0;[.B69]) -> 0 | D69: of:=[.B69]+[.D68] -> 0 | E69: of:=IF(ABS([.B69])>1;[.B69]^9;[.B69]) -> -1E+135 | F69: of:=[.E69]+[.F68] -> 0 | H69: of:=IF(ABS([.B69])>1;[.B69]^9;[.B69]) -> -1E+135 | I69: of:=IF(ABS([.B69])>1;[.B69]^9;[.B69]) -> -1E+135 | K69: of:=IF(ABS([.B69])>1;[.B69];[.B69]) -> -1000000000000000 | L69: of:=IF(ABS([.B69])>1;[.B69];[.B69]) -> -1000000000000000 | M69: of:=IF(ABS([.B69])>1;[.B69];[.B69]) -> -1000000000000000 | O69: 1
B70: 0.1 | C70: of:=IF(ABS([.B70])>1;0;[.B70]) -> 0.1 | D70: of:=[.B70]+[.D69] -> 0.1 | E70: of:=IF(ABS([.B70])>1;[.B70]^9;[.B70]) -> 0.1 | F70: of:=[.E70]+[.F69] -> 0.1 | H70: of:=IF(ABS([.B70])>1;[.B70]^9;[.B70]) -> 0.1 | I70: of:=IF(ABS([.B70])>1;[.B70]^9;[.B70]) -> 0.1 | K70: of:=IF(ABS([.B70])>1;[.B70];[.B70]) -> 0.1 | L70: of:=IF(ABS([.B70])>1;[.B70];[.B70]) -> 0.1 | M70: of:=IF(ABS([.B70])>1;[.B70];[.B70]) -> 0.1 | O70: 1E-015
B71: 1000000000000000 | C71: of:=IF(ABS([.B71])>1;0;[.B71]) -> 0 | D71: of:=[.B71]+[.D70] -> 1E+015 | E71: of:=IF(ABS([.B71])>1;[.B71]^9;[.B71]) -> 1E+135 | F71: of:=[.E71]+[.F70] -> 1E+135 | H71: of:=IF(ABS([.B71])>1;[.B71]^9;[.B71]) -> 1E+135 | I71: of:=IF(ABS([.B71])>1;[.B71]^9;[.B71]) -> 1E+135 | K71: of:=IF(ABS([.B71])>1;[.B71];[.B71]) -> 1000000000000000 | L71: of:=IF(ABS([.B71])>1;[.B71];[.B71]) -> 1000000000000000 | M71: of:=IF(ABS([.B71])>1;[.B71];[.B71]) -> 1000000000000000 | O71: -1000000000000000
B72: 0.1 | C72: of:=IF(ABS([.B72])>1;0;[.B72]) -> 0.1 | D72: of:=[.B72]+[.D71] -> 1E+015 | E72: of:=IF(ABS([.B72])>1;[.B72]^9;[.B72]) -> 0.1 | F72: of:=[.E72]+[.F71] -> 1E+135 | H72: of:=IF(ABS([.B72])>1;[.B72]^9;[.B72]) -> 0.1 | I72: of:=IF(ABS([.B72])>1;[.B72]^9;[.B72]) -> 0.1 | K72: of:=IF(ABS([.B72])>1;[.B72];[.B72]) -> 0.1 | L72: of:=IF(ABS([.B72])>1;[.B72];[.B72]) -> 0.1 | M72: of:=IF(ABS([.B72])>1;[.B72];[.B72]) -> 0.1 | O72: -1
B73: -1000000000000000 | C73: of:=IF(ABS([.B73])>1;0;[.B73]) -> 0 | D73: of:=[.B73]+[.D72] -> 0 | E73: of:=IF(ABS([.B73])>1;[.B73]^9;[.B73]) -> -1E+135 | F73: of:=[.E73]+[.F72] -> 0 | H73: of:=IF(ABS([.B73])>1;[.B73]^9;[.B73]) -> -1E+135 | I73: of:=IF(ABS([.B73])>1;[.B73]^9;[.B73]) -> -1E+135 | K73: of:=IF(ABS([.B73])>1;[.B73];[.B73]) -> -1000000000000000 | L73: of:=IF(ABS([.B73])>1;[.B73];[.B73]) -> -1000000000000000 | M73: of:=IF(ABS([.B73])>1;[.B73];[.B73]) -> -1000000000000000 | O73: 1000000000000000
B74: 0.1 | C74: of:=IF(ABS([.B74])>1;0;[.B74]) -> 0.1 | D74: of:=[.B74]+[.D73] -> 0.1 | E74: of:=IF(ABS([.B74])>1;[.B74]^9;[.B74]) -> 0.1 | F74: of:=[.E74]+[.F73] -> 0.1 | H74: of:=IF(ABS([.B74])>1;[.B74]^9;[.B74]) -> 0.1 | I74: of:=IF(ABS([.B74])>1;[.B74]^9;[.B74]) -> 0.1 | K74: of:=IF(ABS([.B74])>1;[.B74];[.B74]) -> 0.1 | L74: of:=IF(ABS([.B74])>1;[.B74];[.B74]) -> 0.1 | M74: of:=IF(ABS([.B74])>1;[.B74];[.B74]) -> 0.1 | O74: 1
B75: 1000000000000000 | C75: of:=IF(ABS([.B75])>1;0;[.B75]) -> 0 | D75: of:=[.B75]+[.D74] -> 1E+015 | E75: of:=IF(ABS([.B75])>1;[.B75]^9;[.B75]) -> 1E+135 | F75: of:=[.E75]+[.F74] -> 1E+135 | H75: of:=IF(ABS([.B75])>1;[.B75]^9;[.B75]) -> 1E+135 | I75: of:=IF(ABS([.B75])>1;[.B75]^9;[.B75]) -> 1E+135 | K75: of:=IF(ABS([.B75])>1;[.B75];[.B75]) -> 1000000000000000 | L75: of:=IF(ABS([.B75])>1;[.B75];[.B75]) -> 1000000000000000 | M75: of:=IF(ABS([.B75])>1;[.B75];[.B75]) -> 1000000000000000 | O75: 1E-015
B76: 0.1 | C76: of:=IF(ABS([.B76])>1;0;[.B76]) -> 0.1 | D76: of:=[.B76]+[.D75] -> 1E+015 | E76: of:=IF(ABS([.B76])>1;[.B76]^9;[.B76]) -> 0.1 | F76: of:=[.E76]+[.F75] -> 1E+135 | H76: of:=IF(ABS([.B76])>1;[.B76]^9;[.B76]) -> 0.1 | I76: of:=IF(ABS([.B76])>1;[.B76]^9;[.B76]) -> 0.1 | K76: of:=IF(ABS([.B76])>1;[.B76];[.B76]) -> 0.1 | L76: of:=IF(ABS([.B76])>1;[.B76];[.B76]) -> 0.1 | M76: of:=IF(ABS([.B76])>1;[.B76];[.B76]) -> 0.1 | O76: -1000000000000000
B77: -1000000000000000 | C77: of:=IF(ABS([.B77])>1;0;[.B77]) -> 0 | D77: of:=[.B77]+[.D76] -> 0 | E77: of:=IF(ABS([.B77])>1;[.B77]^9;[.B77]) -> -1E+135 | F77: of:=[.E77]+[.F76] -> 0 | H77: of:=IF(ABS([.B77])>1;[.B77]^9;[.B77]) -> -1E+135 | I77: of:=IF(ABS([.B77])>1;[.B77]^9;[.B77]) -> -1E+135 | K77: of:=IF(ABS([.B77])>1;[.B77];[.B77]) -> -1000000000000000 | L77: of:=IF(ABS([.B77])>1;[.B77];[.B77]) -> -1000000000000000 | M77: of:=IF(ABS([.B77])>1;[.B77];[.B77]) -> -1000000000000000 | O77: -1
B78: 0.1 | C78: of:=IF(ABS([.B78])>1;0;[.B78]) -> 0.1 | D78: of:=[.B78]+[.D77] -> 0.1 | E78: of:=IF(ABS([.B78])>1;[.B78]^9;[.B78]) -> 0.1 | F78: of:=[.E78]+[.F77] -> 0.1 | H78: of:=IF(ABS([.B78])>1;[.B78]^9;[.B78]) -> 0.1 | I78: of:=IF(ABS([.B78])>1;[.B78]^9;[.B78]) -> 0.1 | K78: of:=IF(ABS([.B78])>1;[.B78];[.B78]) -> 0.1 | L78: of:=IF(ABS([.B78])>1;[.B78];[.B78]) -> 0.1 | M78: of:=IF(ABS([.B78])>1;[.B78];[.B78]) -> 0.1 | O78: 1000000000000000
B79: 1000000000000000 | C79: of:=IF(ABS([.B79])>1;0;[.B79]) -> 0 | D79: of:=[.B79]+[.D78] -> 1E+015 | E79: of:=IF(ABS([.B79])>1;[.B79]^9;[.B79]) -> 1E+135 | F79: of:=[.E79]+[.F78] -> 1E+135 | H79: of:=IF(ABS([.B79])>1;[.B79]^9;[.B79]) -> 1E+135 | I79: of:=IF(ABS([.B79])>1;[.B79]^9;[.B79]) -> 1E+135 | K79: of:=IF(ABS([.B79])>1;[.B79];[.B79]) -> 1000000000000000 | L79: of:=IF(ABS([.B79])>1;[.B79];[.B79]) -> 1000000000000000 | M79: of:=IF(ABS([.B79])>1;[.B79];[.B79]) -> 1000000000000000 | O79: 1
B80: 0.1 | C80: of:=IF(ABS([.B80])>1;0;[.B80]) -> 0.1 | D80: of:=[.B80]+[.D79] -> 1E+015 | E80: of:=IF(ABS([.B80])>1;[.B80]^9;[.B80]) -> 0.1 | F80: of:=[.E80]+[.F79] -> 1E+135 | H80: of:=IF(ABS([.B80])>1;[.B80]^9;[.B80]) -> 0.1 | I80: of:=IF(ABS([.B80])>1;[.B80]^9;[.B80]) -> 0.1 | K80: of:=IF(ABS([.B80])>1;[.B80];[.B80]) -> 0.1 | L80: of:=IF(ABS([.B80])>1;[.B80];[.B80]) -> 0.1 | M80: of:=IF(ABS([.B80])>1;[.B80];[.B80]) -> 0.1 | O80: 1E-015
B81: -1000000000000000 | C81: of:=IF(ABS([.B81])>1;0;[.B81]) -> 0 | D81: of:=[.B81]+[.D80] -> 0 | E81: of:=IF(ABS([.B81])>1;[.B81]^9;[.B81]) -> -1E+135 | F81: of:=[.E81]+[.F80] -> 0 | H81: of:=IF(ABS([.B81])>1;[.B81]^9;[.B81]) -> -1E+135 | I81: of:=IF(ABS([.B81])>1;[.B81]^9;[.B81]) -> -1E+135 | K81: of:=IF(ABS([.B81])>1;[.B81];[.B81]) -> -1000000000000000 | L81: of:=IF(ABS([.B81])>1;[.B81];[.B81]) -> -1000000000000000 | M81: of:=IF(ABS([.B81])>1;[.B81];[.B81]) -> -1000000000000000 | O81: -1000000000000000
B82: 0.1 | C82: of:=IF(ABS([.B82])>1;0;[.B82]) -> 0.1 | D82: of:=[.B82]+[.D81] -> 0.1 | E82: of:=IF(ABS([.B82])>1;[.B82]^9;[.B82]) -> 0.1 | F82: of:=[.E82]+[.F81] -> 0.1 | H82: of:=IF(ABS([.B82])>1;[.B82]^9;[.B82]) -> 0.1 | I82: of:=IF(ABS([.B82])>1;[.B82]^9;[.B82]) -> 0.1 | K82: of:=IF(ABS([.B82])>1;[.B82];[.B82]) -> 0.1 | L82: of:=IF(ABS([.B82])>1;[.B82];[.B82]) -> 0.1 | M82: of:=IF(ABS([.B82])>1;[.B82];[.B82]) -> 0.1 | O82: -1
B83: 1000000000000000 | C83: of:=IF(ABS([.B83])>1;0;[.B83]) -> 0 | D83: of:=[.B83]+[.D82] -> 1E+015 | E83: of:=IF(ABS([.B83])>1;[.B83]^9;[.B83]) -> 1E+135 | F83: of:=[.E83]+[.F82] -> 1E+135 | H83: of:=IF(ABS([.B83])>1;[.B83]^9;[.B83]) -> 1E+135 | I83: of:=IF(ABS([.B83])>1;[.B83]^9;[.B83]) -> 1E+135 | K83: of:=IF(ABS([.B83])>1;[.B83];[.B83]) -> 1000000000000000 | L83: of:=IF(ABS([.B83])>1;[.B83];[.B83]) -> 1000000000000000 | M83: of:=IF(ABS([.B83])>1;[.B83];[.B83]) -> 1000000000000000 | O83: 1000000000000000
B84: 0.1 | C84: of:=IF(ABS([.B84])>1;0;[.B84]) -> 0.1 | D84: of:=[.B84]+[.D83] -> 1E+015 | E84: of:=IF(ABS([.B84])>1;[.B84]^9;[.B84]) -> 0.1 | F84: of:=[.E84]+[.F83] -> 1E+135 | H84: of:=IF(ABS([.B84])>1;[.B84]^9;[.B84]) -> 0.1 | I84: of:=IF(ABS([.B84])>1;[.B84]^9;[.B84]) -> 0.1 | K84: of:=IF(ABS([.B84])>1;[.B84];[.B84]) -> 0.1 | L84: of:=IF(ABS([.B84])>1;[.B84];[.B84]) -> 0.1 | M84: of:=IF(ABS([.B84])>1;[.B84];[.B84]) -> 0.1 | O84: 1
B85: -1000000000000000 | C85: of:=IF(ABS([.B85])>1;0;[.B85]) -> 0 | D85: of:=[.B85]+[.D84] -> 0 | E85: of:=IF(ABS([.B85])>1;[.B85]^9;[.B85]) -> -1E+135 | F85: of:=[.E85]+[.F84] -> 0 | H85: of:=IF(ABS([.B85])>1;[.B85]^9;[.B85]) -> -1E+135 | I85: of:=IF(ABS([.B85])>1;[.B85]^9;[.B85]) -> -1E+135 | K85: of:=IF(ABS([.B85])>1;[.B85];[.B85]) -> -1000000000000000 | L85: of:=IF(ABS([.B85])>1;[.B85];[.B85]) -> -1000000000000000 | M85: of:=IF(ABS([.B85])>1;[.B85];[.B85]) -> -1000000000000000 | O85: 1E-015
B86: 0.1 | C86: of:=IF(ABS([.B86])>1;0;[.B86]) -> 0.1 | D86: of:=[.B86]+[.D85] -> 0.1 | E86: of:=IF(ABS([.B86])>1;[.B86]^9;[.B86]) -> 0.1 | F86: of:=[.E86]+[.F85] -> 0.1 | H86: of:=IF(ABS([.B86])>1;[.B86]^9;[.B86]) -> 0.1 | I86: of:=IF(ABS([.B86])>1;[.B86]^9;[.B86]) -> 0.1 | K86: of:=IF(ABS([.B86])>1;[.B86];[.B86]) -> 0.1 | L86: of:=IF(ABS([.B86])>1;[.B86];[.B86]) -> 0.1 | M86: of:=IF(ABS([.B86])>1;[.B86];[.B86]) -> 0.1 | O86: -1000000000000000
B87: 1000000000000000 | C87: of:=IF(ABS([.B87])>1;0;[.B87]) -> 0 | D87: of:=[.B87]+[.D86] -> 1E+015 | E87: of:=IF(ABS([.B87])>1;[.B87]^9;[.B87]) -> 1E+135 | F87: of:=[.E87]+[.F86] -> 1E+135 | H87: of:=IF(ABS([.B87])>1;[.B87]^9;[.B87]) -> 1E+135 | I87: of:=IF(ABS([.B87])>1;[.B87]^9;[.B87]) -> 1E+135 | K87: of:=IF(ABS([.B87])>1;[.B87];[.B87]) -> 1000000000000000 | L87: of:=IF(ABS([.B87])>1;[.B87];[.B87]) -> 1000000000000000 | M87: of:=IF(ABS([.B87])>1;[.B87];[.B87]) -> 1000000000000000 | O87: -1
B88: 0.1 | C88: of:=IF(ABS([.B88])>1;0;[.B88]) -> 0.1 | D88: of:=[.B88]+[.D87] -> 1E+015 | E88: of:=IF(ABS([.B88])>1;[.B88]^9;[.B88]) -> 0.1 | F88: of:=[.E88]+[.F87] -> 1E+135 | H88: of:=IF(ABS([.B88])>1;[.B88]^9;[.B88]) -> 0.1 | I88: of:=IF(ABS([.B88])>1;[.B88]^9;[.B88]) -> 0.1 | K88: of:=IF(ABS([.B88])>1;[.B88];[.B88]) -> 0.1 | L88: of:=IF(ABS([.B88])>1;[.B88];[.B88]) -> 0.1 | M88: of:=IF(ABS([.B88])>1;[.B88];[.B88]) -> 0.1 | O88: 1000000000000000
B89: -1000000000000000 | C89: of:=IF(ABS([.B89])>1;0;[.B89]) -> 0 | D89: of:=[.B89]+[.D88] -> 0 | E89: of:=IF(ABS([.B89])>1;[.B89]^9;[.B89]) -> -1E+135 | F89: of:=[.E89]+[.F88] -> 0 | H89: of:=IF(ABS([.B89])>1;[.B89]^9;[.B89]) -> -1E+135 | I89: of:=IF(ABS([.B89])>1;[.B89]^9;[.B89]) -> -1E+135 | K89: of:=IF(ABS([.B89])>1;[.B89];[.B89]) -> -1000000000000000 | L89: of:=IF(ABS([.B89])>1;[.B89];[.B89]) -> -1000000000000000 | M89: of:=IF(ABS([.B89])>1;[.B89];[.B89]) -> -1000000000000000 | O89: 1
B90: 0.1 | C90: of:=IF(ABS([.B90])>1;0;[.B90]) -> 0.1 | D90: of:=[.B90]+[.D89] -> 0.1 | E90: of:=IF(ABS([.B90])>1;[.B90]^9;[.B90]) -> 0.1 | F90: of:=[.E90]+[.F89] -> 0.1 | H90: of:=IF(ABS([.B90])>1;[.B90]^9;[.B90]) -> 0.1 | I90: of:=IF(ABS([.B90])>1;[.B90]^9;[.B90]) -> 0.1 | K90: of:=IF(ABS([.B90])>1;[.B90];[.B90]) -> 0.1 | L90: of:=IF(ABS([.B90])>1;[.B90];[.B90]) -> 0.1 | M90: of:=IF(ABS([.B90])>1;[.B90];[.B90]) -> 0.1 | O90: 1E-015
B91: 1000000000000000 | C91: of:=IF(ABS([.B91])>1;0;[.B91]) -> 0 | D91: of:=[.B91]+[.D90] -> 1E+015 | E91: of:=IF(ABS([.B91])>1;[.B91]^9;[.B91]) -> 1E+135 | F91: of:=[.E91]+[.F90] -> 1E+135 | H91: of:=IF(ABS([.B91])>1;[.B91]^9;[.B91]) -> 1E+135 | I91: of:=IF(ABS([.B91])>1;[.B91]^9;[.B91]) -> 1E+135 | K91: of:=IF(ABS([.B91])>1;[.B91];[.B91]) -> 1000000000000000 | L91: of:=IF(ABS([.B91])>1;[.B91];[.B91]) -> 1000000000000000 | M91: of:=IF(ABS([.B91])>1;[.B91];[.B91]) -> 1000000000000000 | O91: -1000000000000000
B92: 0.1 | C92: of:=IF(ABS([.B92])>1;0;[.B92]) -> 0.1 | D92: of:=[.B92]+[.D91] -> 1E+015 | E92: of:=IF(ABS([.B92])>1;[.B92]^9;[.B92]) -> 0.1 | F92: of:=[.E92]+[.F91] -> 1E+135 | H92: of:=IF(ABS([.B92])>1;[.B92]^9;[.B92]) -> 0.1 | I92: of:=IF(ABS([.B92])>1;[.B92]^9;[.B92]) -> 0.1 | K92: of:=IF(ABS([.B92])>1;[.B92];[.B92]) -> 0.1 | L92: of:=IF(ABS([.B92])>1;[.B92];[.B92]) -> 0.1 | M92: of:=IF(ABS([.B92])>1;[.B92];[.B92]) -> 0.1 | O92: -1
B93: -1000000000000000 | C93: of:=IF(ABS([.B93])>1;0;[.B93]) -> 0 | D93: of:=[.B93]+[.D92] -> 0 | E93: of:=IF(ABS([.B93])>1;[.B93]^9;[.B93]) -> -1E+135 | F93: of:=[.E93]+[.F92] -> 0 | H93: of:=IF(ABS([.B93])>1;[.B93]^9;[.B93]) -> -1E+135 | I93: of:=IF(ABS([.B93])>1;[.B93]^9;[.B93]) -> -1E+135 | K93: of:=IF(ABS([.B93])>1;[.B93];[.B93]) -> -1000000000000000 | L93: of:=IF(ABS([.B93])>1;[.B93];[.B93]) -> -1000000000000000 | M93: of:=IF(ABS([.B93])>1;[.B93];[.B93]) -> -1000000000000000 | O93: 1000000000000000
B94: 0.1 | C94: of:=IF(ABS([.B94])>1;0;[.B94]) -> 0.1 | D94: of:=[.B94]+[.D93] -> 0.1 | E94: of:=IF(ABS([.B94])>1;[.B94]^9;[.B94]) -> 0.1 | F94: of:=[.E94]+[.F93] -> 0.1 | H94: of:=IF(ABS([.B94])>1;[.B94]^9;[.B94]) -> 0.1 | I94: of:=IF(ABS([.B94])>1;[.B94]^9;[.B94]) -> 0.1 | K94: of:=IF(ABS([.B94])>1;[.B94];[.B94]) -> 0.1 | L94: of:=IF(ABS([.B94])>1;[.B94];[.B94]) -> 0.1 | M94: of:=IF(ABS([.B94])>1;[.B94];[.B94]) -> 0.1 | O94: 1
B95: 1000000000000000 | C95: of:=IF(ABS([.B95])>1;0;[.B95]) -> 0 | D95: of:=[.B95]+[.D94] -> 1E+015 | E95: of:=IF(ABS([.B95])>1;[.B95]^9;[.B95]) -> 1E+135 | F95: of:=[.E95]+[.F94] -> 1E+135 | H95: of:=IF(ABS([.B95])>1;[.B95]^9;[.B95]) -> 1E+135 | I95: of:=IF(ABS([.B95])>1;[.B95]^9;[.B95]) -> 1E+135 | K95: of:=IF(ABS([.B95])>1;[.B95];[.B95]) -> 1000000000000000 | L95: of:=IF(ABS([.B95])>1;[.B95];[.B95]) -> 1000000000000000 | M95: of:=IF(ABS([.B95])>1;[.B95];[.B95]) -> 1000000000000000 | O95: 1E-015
B96: 0.1 | C96: of:=IF(ABS([.B96])>1;0;[.B96]) -> 0.1 | D96: of:=[.B96]+[.D95] -> 1E+015 | E96: of:=IF(ABS([.B96])>1;[.B96]^9;[.B96]) -> 0.1 | F96: of:=[.E96]+[.F95] -> 1E+135 | H96: of:=IF(ABS([.B96])>1;[.B96]^9;[.B96]) -> 0.1 | I96: of:=IF(ABS([.B96])>1;[.B96]^9;[.B96]) -> 0.1 | K96: of:=IF(ABS([.B96])>1;[.B96];[.B96]) -> 0.1 | L96: of:=IF(ABS([.B96])>1;[.B96];[.B96]) -> 0.1 | M96: of:=IF(ABS([.B96])>1;[.B96];[.B96]) -> 0.1 | O96: -1000000000000000
B97: -1000000000000000 | C97: of:=IF(ABS([.B97])>1;0;[.B97]) -> 0 | D97: of:=[.B97]+[.D96] -> 0 | E97: of:=IF(ABS([.B97])>1;[.B97]^9;[.B97]) -> -1E+135 | F97: of:=[.E97]+[.F96] -> 0 | H97: of:=IF(ABS([.B97])>1;[.B97]^9;[.B97]) -> -1E+135 | I97: of:=IF(ABS([.B97])>1;[.B97]^9;[.B97]) -> -1E+135 | K97: of:=IF(ABS([.B97])>1;[.B97];[.B97]) -> -1000000000000000 | L97: of:=IF(ABS([.B97])>1;[.B97];[.B97]) -> -1000000000000000 | M97: of:=IF(ABS([.B97])>1;[.B97];[.B97]) -> -1000000000000000 | O97: -1
B98: 0.1 | C98: of:=IF(ABS([.B98])>1;0;[.B98]) -> 0.1 | D98: of:=[.B98]+[.D97] -> 0.1 | E98: of:=IF(ABS([.B98])>1;[.B98]^9;[.B98]) -> 0.1 | F98: of:=[.E98]+[.F97] -> 0.1 | H98: of:=IF(ABS([.B98])>1;[.B98]^9;[.B98]) -> 0.1 | I98: of:=IF(ABS([.B98])>1;[.B98]^9;[.B98]) -> 0.1 | K98: of:=IF(ABS([.B98])>1;[.B98];[.B98]) -> 0.1 | L98: of:=IF(ABS([.B98])>1;[.B98];[.B98]) -> 0.1 | M98: of:=IF(ABS([.B98])>1;[.B98];[.B98]) -> 0.1 | O98: 1000000000000000
B99: 1000000000000000 | C99: of:=IF(ABS([.B99])>1;0;[.B99]) -> 0 | D99: of:=[.B99]+[.D98] -> 1E+015 | E99: of:=IF(ABS([.B99])>1;[.B99]^9;[.B99]) -> 1E+135 | F99: of:=[.E99]+[.F98] -> 1E+135 | H99: of:=IF(ABS([.B99])>1;[.B99]^9;[.B99]) -> 1E+135 | I99: of:=IF(ABS([.B99])>1;[.B99]^9;[.B99]) -> 1E+135 | K99: of:=IF(ABS([.B99])>1;[.B99];[.B99]) -> 1000000000000000 | L99: of:=IF(ABS([.B99])>1;[.B99];[.B99]) -> 1000000000000000 | M99: of:=IF(ABS([.B99])>1;[.B99];[.B99]) -> 1000000000000000 | O99: 1
B100: 0.1 | C100: of:=IF(ABS([.B100])>1;0;[.B100]) -> 0.1 | D100: of:=[.B100]+[.D99] -> 1E+015 | E100: of:=IF(ABS([.B100])>1;[.B100]^9;[.B100]) -> 0.1 | F100: of:=[.E100]+[.F99] -> 1E+135 | H100: of:=IF(ABS([.B100])>1;[.B100]^9;[.B100]) -> 0.1 | I100: of:=IF(ABS([.B100])>1;[.B100]^9;[.B100]) -> 0.1 | K100: of:=IF(ABS([.B100])>1;[.B100];[.B100]) -> 0.1 | L100: of:=IF(ABS([.B100])>1;[.B100];[.B100]) -> 0.1 | M100: of:=IF(ABS([.B100])>1;[.B100];[.B100]) -> 0.1 | O100: 1E-015
B101: -1000000000000000 | C101: of:=IF(ABS([.B101])>1;0;[.B101]) -> 0 | D101: of:=[.B101]+[.D100] -> 0 | E101: of:=IF(ABS([.B101])>1;[.B101]^9;[.B101]) -> -1E+135 | F101: of:=[.E101]+[.F100] -> 0 | H101: of:=IF(ABS([.B101])>1;[.B101]^9;[.B101]) -> -1E+135 | I101: of:=IF(ABS([.B101])>1;[.B101]^9;[.B101]) -> -1E+135 | K101: of:=IF(ABS([.B101])>1;[.B101];[.B101]) -> -1000000000000000 | L101: of:=IF(ABS([.B101])>1;[.B101];[.B101]) -> -1000000000000000 | M101: of:=IF(ABS([.B101])>1;[.B101];[.B101]) -> -1000000000000000 | O101: -1000000000000000
B102: 0.1 | C102: of:=IF(ABS([.B102])>1;0;[.B102]) -> 0.1 | D102: of:=[.B102]+[.D101] -> 0.1 | E102: of:=IF(ABS([.B102])>1;[.B102]^9;[.B102]) -> 0.1 | F102: of:=[.E102]+[.F101] -> 0.1 | H102: of:=IF(ABS([.B102])>1;[.B102]^9;[.B102]) -> 0.1 | I102: of:=IF(ABS([.B102])>1;[.B102]^9;[.B102]) -> 0.1 | K102: of:=IF(ABS([.B102])>1;[.B102];[.B102]) -> 0.1 | L102: of:=IF(ABS([.B102])>1;[.B102];[.B102]) -> 0.1 | M102: of:=IF(ABS([.B102])>1;[.B102];[.B102]) -> 0.1 | O102: -1
A103: RESULT | B103: of:=SUM([.B3:.B102]) -> 5 | C103: of:=SUM([.C3:.C102]) -> 5 | D103: of:=[.D102] -> 0.1 | E103: of:=SUM([.E3:.E102]) -> 5 | F103: of:=[.F102] -> 0.1 | H103: of:=SUM([.H3:.H102]) -> 5 | I103: of:=SUM([.H3:.I102]) -> 10 | K103: of:=SUM([.K3:.K102]) -> 5 | L103: of:=SUM([.K3:.L102]) -> 10 | M103: of:=SUM([.K3:.M102]) -> 15 | O103: of:=SUM([.O3:.O102]) -> 1E-015
A104: EXPECTED | B104: 5 | C104: 5 | D104: 5 | E104: 5 | F104: 5 | H104: 5 | I104: 10 | K104: 5 | L104: 10 | M104: 15 | O104: of:=20*1E-015 -> 0.00000000000002
A105: FORMULA | B105: of:=FORMULA([.B103]) -> =SUM(B3:B102) | C105: of:=FORMULA([.C103]) -> =SUM(C3:C102) | D105: of:=FORMULA([.D103]) -> =D102 | E105: of:=FORMULA([.E103]) -> =SUM(E3:E102) | F105: of:=FORMULA([.F103]) -> =F102 | H105: of:=FORMULA([.H103]) -> =SUM(H3:H102) | I105: of:=FORMULA([.I103]) -> =SUM(H3:I102) | K105: of:=FORMULA([.K103]) -> =SUM(K3:K102) | L105: of:=FORMULA([.L103]) -> =SUM(K3:L102) | M105: of:=FORMULA([.M103]) -> =SUM(K3:M102) | O105: of:=FORMULA([.O103]) -> =SUM(O3:O102)
A106: CHECK | B106: of:=[.B103]=[.B104] -> true | C106: of:=[.C103]=[.C104] -> true | D106: of:=[.D103]=[.D104] -> false | E106: of:=[.E103]=[.E104] -> true | F106: of:=[.F103]=[.F104] -> false | H106: of:=[.H103]=[.H104] -> true | I106: of:=[.I103]=[.I104] -> true | K106: of:=[.K103]=[.K104] -> true | L106: of:=[.L103]=[.L104] -> true | M106: of:=[.M103]=[.M104] -> true | O106: of:=[.O103]=[.O104] -> false
A108: WORKS | B108: of:=AND([.B106];[.C106];[.E106];[.H106];[.I106];[.K106];[.L106];[.M106]) -> true