Sheet: Sheet1
A1: MAXIFS Function
A3: Result | B3: of:=AND([.B8:.B95]) -> true
A7: Sheet | B7: Result | C7: Description
A8: 1 | B8: of:=AND([Sheet2.C2:.C349]) -> true | C8: Simple MAXIFS formulas with local references and values

Sheet: Sheet2
A1: Function | B1: Expected | C1: Correct | D1: FunctionString | E1: Comment | I1: Data | K1: 4 | L1: 3.5 | M1: 1.2 | O1: Weight | P1: Grade | R1: Weight | S1: Grade | T1: Class | U1: Level | W1: Weight | X1: Grade | Y1: Class | Z1: Level | AB1: Weight | AC1: Grade | AE1: Weight | AF1: Grade | AG1: Class | AH1: Level | AJ1: Zone | AL1: x | AN1: y | AP1: z
A2: of:=COM.MICROSOFT.MAXIFS([.J30:.J35];[.K30:.K35];1) -> 91 | B2: 91 | C2: of:=ROUND([.A2];12)=ROUND([.B2];12) -> true | D2: of:=FORMULA([.A2]) -> =MAXIFS(J30:J35,K30:K35,1) | I2: 4 | J2: 3 | K2: 5 | L2: 3.6 | M2: 1.3 | O2: 10 | P2: b | R2: 10 | S2: b | T2: Business | U2: 100 | W2: 10 | X2: b | Y2: Business | Z2: 8 | AB2: 10 | AC2: b | AE2: 10 | AF2: b | AG2: Business | AH2: 100 | AJ2: Zone0 | AK2: x | AL2: 374.3 | AM2: y | AN2: -14.6 | AO2: z | AP2: 284.8 | AS2: Zone0
A3: of:=COM.MICROSOFT.MAXIFS([.O2:.O5];[.P3:.P6];"a") -> 10 | B3: 10 | C3: of:=ROUND([.A3];12)=ROUND([.B3];12) -> true | D3: of:=FORMULA([.A3]) -> =MAXIFS(O2:O5,P3:P6,"a") | E3: The criteria_range and max_range aren't aligned, but they are the same shape and size. | I3: 3.5 | K3: 6 | L3: 3.7 | M3: 1.4 | O3: 1 | P3: a | R3: 1 | S3: a | T3: Technical | U3: 100 | W3: 1 | X3: a | Y3: Technical | Z3: 8 | AB3: 1 | AC3: a | AE3: 1 | AF3: a | AG3: Technical | AH3: 100 | AJ3: Zone1 | AK3: x | AL3: -45.6 | AM3: y | AN3: -16.5 | AO3: z | AP3: 171.6 | AS3: Zone1
A4: of:=COM.MICROSOFT.MAXIFS([.R2:.R7];[.S2:.S7];"b";[.U2:.U7];">100") -> 50 | B4: 50 | C4: of:=ROUND([.A4];12)=ROUND([.B4];12) -> true | D4: of:=FORMULA([.A4]) -> =MAXIFS(R2:R7,S2:S7,"b",U2:U7,">100") | I4: 1.2 | K4: 7 | L4: 3.8 | M4: 1.5 | O4: 100 | P4: a | R4: 100 | S4: a | T4: Business | U4: 200 | W4: 100 | X4: a | Y4: Business | Z4: 8 | AB4: 100 | AC4: a | AE4: 100 | AF4: a | AG4: Business | AH4: 200 | AJ4: Zone2 | AK4: x | AL4: -130.6 | AM4: y | AN4: -10.7 | AO4: z | AP4: 1014.5 | AS4: Zone2
A5: of:=COM.MICROSOFT.MAXIFS([.W2:.W7];[.X2:.X7];"b";[.Z2:.Z7];[.W8]) -> 12 | B5: 12 | C5: of:=ROUND([.A5];12)=ROUND([.B5];12) -> true | D5: of:=FORMULA([.A5]) -> =MAXIFS(W2:W7,X2:X7,"b",Z2:Z7,W8) | K5: 8 | L5: 3.9 | M5: 1.6 | O5: 1 | P5: b | R5: 1 | S5: b | T5: Technical | U5: 300 | W5: 11 | X5: b | Y5: Technical | Z5: 0 | AB5: 1 | AC5: b | AE5: 1 | AF5: b | AG5: Technical | AH5: 300 | AJ5: Zone0 | AK5: x | AL5: 374.6 | AM5: y | AN5: -14.5 | AO5: z | AP5: 287.9
A6: of:=COM.MICROSOFT.MAXIFS([.AB2:.AB5];[.AC2:.AD6];"a") ->  | B6: error | C6: of:=ISERROR([.A6]) -> true | D6: of:=FORMULA([.A6]) -> =MAXIFS(AB2:AB5,AC2:AD6,"a") | I6: a | K6: 9 | L6: 4 | M6: 1.7 | O6: 1 | P6: a | R6: 1 | S6: a | T6: Technical | U6: 100 | W6: 1 | X6: a | Y6: Technical | Z6: 8 | AB6: 1 | AC6: a | AE6: 1 | AF6: a | AG6: Technical | AH6: 100 | AJ6: Zone1 | AK6: x | AL6: -44.2 | AM6: y | AN6: -16.4 | AO6: z | AP6: 176.4
A7: of:=COM.MICROSOFT.MAXIFS([.AE2:.AE6];[.AF2:.AF6];"a";[.AG2:.AG6];">200") -> 0 | B7: 0 | C7: of:=ROUND([.A7];12)=ROUND([.B7];12) -> true | D7: of:=FORMULA([.A7]) -> =MAXIFS(AE2:AE6,AF2:AF6,"a",AG2:AG6,">200") | K7: 10 | L7: 4.1 | M7: 1.8 | O7: 1 | P7: a | R7: 50 | S7: b | T7: Business | U7: 400 | W7: 12 | X7: b | Y7: Business | Z7: 0 | AB7: 1 | AC7: a | AE7: 1 | AF7: a | AG7: Business | AH7: 400 | AJ7: Zone2 | AK7: x | AL7: -131.1 | AM7: y | AN7: -10.7 | AO7: z | AP7: 1013.6
A8: of:=COM.MICROSOFT.MAXIFS([.AL$1:.AL$1048576];[.$AJ$1:.$AJ$1048576];"="&[.$AS2]) -> 374.7 | B8: 374.7 | C8: of:=ROUND([.A8];12)=ROUND([.B8];12) -> true | D8: of:=FORMULA([.A8]) -> =MAXIFS(AL:AL,$AJ:$AJ,"="&$AS2) | E8: Tdf#107892 | K8: 11 | L8: 4.2 | M8: 1.9 | AJ8: Zone0 | AK8: x | AL8: 374.5 | AM8: y | AN8: -14.6 | AO8: z | AP8: 286.9
A9: of:=COM.MICROSOFT.MAXIFS([.AL$1:.AL$1048576];[.$AJ$1:.$AJ$1048576];"="&[.$AS3]) -> -43.6 | B9: -43.6 | C9: of:=ROUND([.A9];12)=ROUND([.B9];12) -> true | D9: of:=FORMULA([.A9]) -> =MAXIFS(AL:AL,$AJ:$AJ,"="&$AS3) | AJ9: Zone1 | AK9: x | AL9: -44.2 | AM9: y | AN9: -16.4 | AO9: z | AP9: 176.4
A10: of:=COM.MICROSOFT.MAXIFS([.AL$1:.AL$1048576];[.$AJ$1:.$AJ$1048576];"="&[.$AS4]) -> -130.1 | B10: -130.1 | C10: of:=ROUND([.A10];12)=ROUND([.B10];12) -> true | D10: of:=FORMULA([.A10]) -> =MAXIFS(AL:AL,$AJ:$AJ,"="&$AS4) | AJ10: Zone2 | AK10: x | AL10: -131.6 | AM10: y | AN10: -10.7 | AO10: z | AP10: 1012.7
A11: of:=COM.MICROSOFT.MAXIFS([.AN$1:.AN$1048576];[.$AJ$1:.$AJ$1048576];"="&[.$AS2]) -> -14.5 | B11: -14.5 | C11: of:=ROUND([.A11];12)=ROUND([.B11];12) -> true | D11: of:=FORMULA([.A11]) -> =MAXIFS(AN:AN,$AJ:$AJ,"="&$AS2) | AJ11: Zone0 | AK11: x | AL11: 374.5 | AM11: y | AN11: -14.6 | AO11: z | AP11: 286.9
A12: of:=COM.MICROSOFT.MAXIFS([.AN$1:.AN$1048576];[.$AJ$1:.$AJ$1048576];"="&[.$AS3]) -> -16.4 | B12: -16.4 | C12: of:=ROUND([.A12];12)=ROUND([.B12];12) -> true | D12: of:=FORMULA([.A12]) -> =MAXIFS(AN:AN,$AJ:$AJ,"="&$AS3) | I12: a | AJ12: Zone1 | AK12: x | AL12: -44.7 | AM12: y | AN12: -16.4 | AO12: z | AP12: 174.5
A13: of:=COM.MICROSOFT.MAXIFS([.AN$1:.AN$1048576];[.$AJ$1:.$AJ$1048576];"="&[.$AS4]) -> -10.7 | B13: -10.7 | C13: of:=ROUND([.A13];12)=ROUND([.B13];12) -> true | D13: of:=FORMULA([.A13]) -> =MAXIFS(AN:AN,$AJ:$AJ,"="&$AS4) | I13: b | AJ13: Zone2 | AK13: x | AL13: -130.1 | AM13: y | AN13: -10.7 | AO13: z | AP13: 1015.4
A14: of:=COM.MICROSOFT.MAXIFS([.AP$1:.AP$1048576];[.$AJ$1:.$AJ$1048576];"="&[.$AS2]) -> 288.9 | B14: 288.9 | C14: of:=ROUND([.A14];12)=ROUND([.B14];12) -> true | D14: of:=FORMULA([.A14]) -> =MAXIFS(AP:AP,$AJ:$AJ,"="&$AS2) | I14: c | J14: 2009-04-12 | K14: 1 | M14: Date order is sorted ascending. | P14: 2009-06-01 | Q14: 100 | AJ14: Zone0 | AK14: x | AL14: 374.4 | AM14: y | AN14: -14.6 | AO14: z | AP14: 285.8
A15: of:=COM.MICROSOFT.MAXIFS([.AP$1:.AP$1048576];[.$AJ$1:.$AJ$1048576];"="&[.$AS3]) -> 178.3 | B15: 178.3 | C15: of:=ROUND([.A15];12)=ROUND([.B15];12) -> true | D15: of:=FORMULA([.A15]) -> =MAXIFS(AP:AP,$AJ:$AJ,"="&$AS3) | I15: -1 | J15: 2009-04-27 | K15: 28 | M15: 4 dates in May | P15: 2009-05-23 | Q15: 28 | AJ15: Zone1 | AK15: x | AL15: -44.5 | AM15: y | AN15: -16.4 | AO15: z | AP15: 175.4
A16: of:=COM.MICROSOFT.MAXIFS([.AP$1:.AP$1048576];[.$AJ$1:.$AJ$1048576];"="&[.$AS4]) -> 1015.4 | B16: 1015.4 | C16: of:=ROUND([.A16];12)=ROUND([.B16];12) -> true | D16: of:=FORMULA([.A16]) -> =MAXIFS(AP:AP,$AJ:$AJ,"="&$AS4) | J16: 2009-04-27 | K16: 46 | M16: Max function works, but | P16: 2009-05-20 | Q16: 49 | AJ16: Zone2 | AK16: x | AL16: -131.1 | AM16: y | AN16: -10.7 | AO16: z | AP16: 1013.6
A17: of:=COM.MICROSOFT.MAXIFS(ROW([.$J$2:.$J2]);[.$J$2:.$J2];3) -> 2 | B17: 2 | C17: of:=ROUND([.A17];12)=ROUND([.B17];12) -> true | D17: of:=FORMULA([.A17]) -> =MAXIFS(ROW($J$2:$J2),$J$2:$J2,3) | E17: tdf#119137 | J17: 2009-04-30 | K17: 74 | M17: Min does not. | P17: 2009-05-13 | Q17: 51 | AJ17: Zone0 | AK17: x | AL17: 374.4 | AM17: y | AN17: -14.6 | AO17: z | AP17: 285.8
J18: 2009-04-12 | K18: 6 | M18: 2009-04-12 | N18: 6 | P18: 2009-05-13 | Q18: 43 | AJ18: Zone1 | AK18: x | AL18: -44.5 | AM18: y | AN18: -16.4 | AO18: z | AP18: 175.4
J19: 2009-05-23 | K19: 28 | M19: 2009-04-12 | N19: 1 | P19: 2009-04-30 | Q19: 74 | AJ19: Zone2 | AK19: x | AL19: -131.1 | AM19: y | AN19: -10.7 | AO19: z | AP19: 1013.6
J20: 2009-05-13 | K20: 51 | M20: 2009-04-27 | N20: 28 | P20: 2009-04-27 | Q20: 28 | AJ20: Zone0 | AK20: x | AL20: 374.4 | AM20: y | AN20: -14.6 | AO20: z | AP20: 285.8
J21: 2009-05-13 | K21: 43 | M21: 2009-04-27 | N21: 46 | P21: 2009-04-27 | Q21: 46 | AJ21: Zone1 | AK21: x | AL21: -43.6 | AM21: y | AN21: -16.4 | AO21: z | AP21: 178.3
J22: 2009-05-20 | K22: 49 | M22: 2009-04-30 | N22: 74 | P22: 2009-04-12 | Q22: 6 | AJ22: Zone2 | AK22: x | AL22: -131.1 | AM22: y | AN22: -10.7 | AO22: z | AP22: 1013.6
J23: 2009-06-01 | K23: 100 | M23: 2009-05-13 | N23: 43 | P23: 2009-04-12 | Q23: 1 | AJ23: Zone0 | AK23: x | AL23: 374.4 | AM23: y | AN23: -14.6 | AO23: z | AP23: 285.8
M24: 2009-05-13 | N24: 51 | AJ24: Zone1 | AK24: x | AL24: -44.5 | AM24: y | AN24: -16.4 | AO24: z | AP24: 175.4
M25: 2009-05-20 | N25: 49 | AJ25: Zone2 | AK25: x | AL25: -130.6 | AM25: y | AN25: -10.7 | AO25: z | AP25: 1014.5
M26: 2009-05-23 | N26: 28 | AJ26: Zone0 | AK26: x | AL26: 374.6 | AM26: y | AN26: -14.5 | AO26: z | AP26: 287.9
M27: 2009-06-01 | N27: 100 | AJ27: Zone1 | AK27: x | AL27: -45 | AM27: y | AN27: -16.4 | AO27: z | AP27: 173.5
AJ28: Zone2 | AK28: x | AL28: -130.1 | AM28: y | AN28: -10.7 | AO28: z | AP28: 1015.4
J29: 89 | K29: 1 | AJ29: Zone0 | AK29: x | AL29: 374.6 | AM29: y | AN29: -14.5 | AO29: z | AP29: 287.9
J30: 93 | K30: 2 | AJ30: Zone1 | AK30: x | AL30: -45 | AM30: y | AN30: -16.4 | AO30: z | AP30: 173.5
J31: 96 | K31: 2 | AJ31: Zone2 | AK31: x | AL31: -130.1 | AM31: y | AN31: -10.7 | AO31: z | AP31: 1015.4
J32: 85 | K32: 3 | AJ32: Zone0 | AK32: x | AL32: 374.4 | AM32: y | AN32: -14.6 | AO32: z | AP32: 285.8
J33: 91 | K33: 1 | AJ33: Zone1 | AK33: x | AL33: -46.4 | AM33: y | AN33: -16.5 | AO33: z | AP33: 168.7
J34: 88 | K34: 1 | AJ34: Zone2 | AK34: x | AL34: -130.6 | AM34: y | AN34: -10.7 | AO34: z | AP34: 1014.5
AJ35: Zone0 | AK35: x | AL35: 374.4 | AM35: y | AN35: -14.6 | AO35: z | AP35: 285.8
AJ36: Zone1 | AK36: x | AL36: -43.9 | AM36: y | AN36: -16.4 | AO36: z | AP36: 177.4
AJ37: Zone2 | AK37: x | AL37: -130.6 | AM37: y | AN37: -10.7 | AO37: z | AP37: 1014.5
AJ38: Zone0 | AK38: x | AL38: 363.8 | AM38: y | AN38: -14.6 | AO38: z | AP38: 286.5
AJ39: Zone1 | AK39: x | AL39: -45 | AM39: y | AN39: -16.4 | AO39: z | AP39: 173.5
AJ40: Zone2 | AK40: x | AL40: -130.6 | AM40: y | AN40: -10.7 | AO40: z | AP40: 1014.5
AJ41: Zone0 | AK41: x | AL41: 374.6 | AM41: y | AN41: -14.5 | AO41: z | AP41: 287.9
AJ42: Zone1 | AK42: x | AL42: -43.9 | AM42: y | AN42: -16.4 | AO42: z | AP42: 177.4
AJ43: Zone2 | AK43: x | AL43: -130.6 | AM43: y | AN43: -10.7 | AO43: z | AP43: 1014.5
AJ44: Zone0 | AK44: x | AL44: 374.6 | AM44: y | AN44: -14.5 | AO44: z | AP44: 287.9
AJ45: Zone1 | AK45: x | AL45: -43.9 | AM45: y | AN45: -16.4 | AO45: z | AP45: 177.4
AJ46: Zone2 | AK46: x | AL46: -130.6 | AM46: y | AN46: -10.7 | AO46: z | AP46: 1014.5
AJ47: Zone0 | AK47: x | AL47: 374.6 | AM47: y | AN47: -14.5 | AO47: z | AP47: 287.9
AJ48: Zone1 | AK48: x | AL48: -45.9 | AM48: y | AN48: -16.5 | AO48: z | AP48: 170.6
AJ49: Zone2 | AK49: x | AL49: -130.6 | AM49: y | AN49: -10.7 | AO49: z | AP49: 1014.5
AJ50: Zone0 | AK50: x | AL50: 374.6 | AM50: y | AN50: -14.5 | AO50: z | AP50: 287.9
AJ51: Zone1 | AK51: x | AL51: -45.9 | AM51: y | AN51: -16.5 | AO51: z | AP51: 170.6
AJ52: Zone2 | AK52: x | AL52: -130.6 | AM52: y | AN52: -10.7 | AO52: z | AP52: 1014.5
AJ53: Zone0 | AK53: x | AL53: 374.7 | AM53: y | AN53: -14.5 | AO53: z | AP53: 288.9
AJ54: Zone1 | AK54: x | AL54: -43.9 | AM54: y | AN54: -16.4 | AO54: z | AP54: 177.4
AJ55: Zone2 | AK55: x | AL55: -131.1 | AM55: y | AN55: -10.7 | AO55: z | AP55: 1013.6