Sheet: Sheet1
A1: MEDIAN Function
A3: Result | B3: of:=AND([.B8:.B95]) -> true
A7: Sheet | B7: Result | C7: Description
A8: 1 | B8: of:=AND([Sheet2.C2:.C349]) -> true | C8: Simple MEDIAN formulas with local references and values

Sheet: Sheet2
A1: Function | B1: Expected | C1: Correct | D1: FunctionString | E1: Comment | G1: 1 | H1: 4 | I1: of:=[.H1]*-1 -> -4
A2: of:=MEDIAN([.G1:.G15]) -> 8 | B2: 8 | C2: of:=ROUND([.A2];12)=ROUND([.B2];12) -> true | D2: of:=FORMULA([.A2]) -> =MEDIAN(G1:G15) | G2: 2 | H2: 5 | I2: of:=[.H2]*-1 -> -5
A3: of:=MEDIAN([.H1:.H7]) -> 5 | B3: 5 | C3: of:=ROUND([.A3];12)=ROUND([.B3];12) -> true | D3: of:=FORMULA([.A3]) -> =MEDIAN(H1:H7) | G3: 3 | H3: 6 | I3: of:=[.H3]*-1 -> -6
A4: of:=MEDIAN({4;5;6;7;5;4;3}) -> 5 | B4: 5 | C4: of:=ROUND([.A4];12)=ROUND([.B4];12) -> true | D4: of:=FORMULA([.A4]) -> =MEDIAN({4,5,6,7,5,4,3}) | G4: 4 | H4: 7 | I4: of:=[.H4]*-1 -> -7
A5: of:=MEDIAN([.I1:.I7]) -> -5 | B5: -5 | C5: of:=ROUND([.A5];12)=ROUND([.B5];12) -> true | D5: of:=FORMULA([.A5]) -> =MEDIAN(I1:I7) | G5: 5 | H5: 5 | I5: of:=[.H5]*-1 -> -5
A6: of:=MEDIAN([.G22:.G25]) -> 5 | B6: 5 | C6: of:=ROUND([.A6];12)=ROUND([.B6];12) -> true | D6: of:=FORMULA([.A6]) -> =MEDIAN(G22:G25) | G6: 6 | H6: 4 | I6: of:=[.H6]*-1 -> -4
A7: of:=MEDIAN([.F29:.F38]) -> 9.5 | B7: 9.5 | C7: of:=ROUND([.A7];12)=ROUND([.B7];12) -> true | D7: of:=FORMULA([.A7]) -> {=MEDIAN(F29:F38)} | G7: 7 | H7: 3 | I7: of:=[.H7]*-1 -> -3
A8: of:=MEDIAN(IF([.F29:.F38]>0;[.F29:.F38])) -> 13 | B8: 13 | C8: of:=ROUND([.A8];12)=ROUND([.B8];12) -> true | D8: of:=FORMULA([.A8]) -> {=MEDIAN(IF(F29:F38>0,F29:F38))} | G8: 8
A9: of:=MEDIAN(IF([.G29:.G36]>0;[.G29:.G36])) -> 13 | B9: 13 | C9: of:=ROUND([.A9];12)=ROUND([.B9];12) -> true | D9: of:=FORMULA([.A9]) -> {=MEDIAN(IF(G29:G36>0,G29:G36))} | G9: 9
A10: of:=MEDIAN([.G29:.G36]) -> 13 | B10: 13 | C10: of:=ROUND([.A10];12)=ROUND([.B10];12) -> true | D10: of:=FORMULA([.A10]) -> {=MEDIAN(G29:G36)} | G10: 10
A11: of:=MEDIAN([.G40:.G49]) -> 42067 | B11: 42067 | C11: of:=ROUND([.A11];12)=ROUND([.B11];12) -> true | D11: of:=FORMULA([.A11]) -> {=MEDIAN(G40:G49)} | G11: 11
A12: of:=MEDIAN(IF([.G40:.G49]>0;[.G40:.G49])) -> 42067 | B12: 42067 | C12: of:=ROUND([.A12];12)=ROUND([.B12];12) -> true | D12: of:=FORMULA([.A12]) -> {=MEDIAN(IF(G40:G49>0,G40:G49))} | G12: 12
A13: of:=MEDIAN({"4-3-15"|"1-3-15"|"4-3-15"}) ->  | B13: #VALUE! | C13: of:=ISERROR([.A13]) -> true | D13: of:=FORMULA([.A13]) -> =MEDIAN({"4-3-15";"1-3-15";"4-3-15"}) | G13: 13
A14: of:=MEDIAN({DATE(2015|3|4)|DATE(2015|2|1)|DATE(2015|3|4)}) ->  | B14: Err:520 | C14: of:=ISERROR([.A14]) -> true | D14: of:=FORMULA([.A14]) -> =MEDIAN({DATE(2015;3;4);DATE(2015;2;1);DATE(2015;3;4)}) | G14: 14
A15: of:=MEDIAN() ->  | B15: Err:511 | C15: of:=ISERROR([.A15]) -> true | D15: of:=FORMULA([.A15]) -> =MEDIAN() | G15: 15
G22: 1
G23: 5
G24: 6
G25: a
H28: formula result | I28: expected result | J28: OK ? | K28: formula text
F29: 15 | G29: 15
F30: 2 | G30: 2 | I30: 9.5 | J30: of:=IF([.A7]=[.I30];TRUE();FALSE()) -> true | K30: of:=FORMULA([.A7]) -> {=MEDIAN(F29:F38)}
F31: 20 | G31: 20 | I31: 13 | J31: of:=IF([.A8]=[.I31];TRUE();FALSE()) -> true | K31: of:=FORMULA([.A8]) -> {=MEDIAN(IF(F29:F38>0,F29:F38))}
F32: 0 | G32: 7 | H32: of:=MIN(IF([.F29:.F38]>0;[.F29:.F38])) -> 2 | I32: 2 | J32: of:=IF([.H32]=[.I32];TRUE();FALSE()) -> true | K32: of:=FORMULA([.H32]) -> {=MIN(IF(F29:F38>0,F29:F38))}
F33: 7 | G33: 8 | H33: of:=AVERAGE(IF([.F29:.F38]>0;[.F29:.F38])) -> 13.125 | I33: 13.125 | J33: of:=IF([.H33]=[.I33];TRUE();FALSE()) -> true | K33: of:=FORMULA([.H33]) -> {=AVERAGE(IF(F29:F38>0,F29:F38))}
F34: 0 | G34: 25 | H34: of:=AVERAGE([.F29:.F38]) -> 10.5 | I34: 10.5 | J34: of:=IF([.H34]=[.I34];TRUE();FALSE()) -> true | K34: of:=FORMULA([.H34]) -> {=AVERAGE(F29:F38)}
F35: 8 | G35: 17 | I35: 13 | J35: of:=IF([.A9]=[.I35];TRUE();FALSE()) -> true | K35: of:=FORMULA([.A9]) -> {=MEDIAN(IF(G29:G36>0,G29:G36))}
F36: 25 | G36: 11 | I36: 13 | J36: of:=IF([.A10]=[.I36];TRUE();FALSE()) -> true | K36: of:=FORMULA([.A10]) -> {=MEDIAN(G29:G36)}
F37: 17
F38: 11
G40: 2015-03-04
G41: 2015-03-01 | I41: 42067 | J41: of:=IF([.A11]=[.I41];TRUE();FALSE()) -> true | K41: of:=FORMULA([.A11]) -> {=MEDIAN(G40:G49)}
G42: 2015-02-01 | I42: 42067 | J42: of:=IF([.A12]=[.I42];TRUE();FALSE()) -> true | K42: of:=FORMULA([.A12]) -> {=MEDIAN(IF(G40:G49>0,G40:G49))}
G43: 2015-07-12 | H43: of:=MIN(IF([.G40:.G49]>0;[.G40:.G49])) -> 42005 | I43: 42005 | J43: of:=IF([.H43]=[.I43];TRUE();FALSE()) -> true | K43: of:=FORMULA([.H43]) -> =MIN(IF(G40:G49>0,G40:G49))
H44: of:=AVERAGEIF([.G40:.G49];">0") -> 42122.8888888889 | I44: 42122.8888888889 | J44: of:=IF([.H44]=[.I44];TRUE();FALSE()) -> true | K44: of:=FORMULA([.H44]) -> =AVERAGEIF(G40:G49,">0")
G45: 2015-05-03 | H45: of:=AVERAGE([.G40:.G49]) -> 42122.8888888889 | I45: 42122.8888888889 | J45: of:=IF([.H45]=[.I45];TRUE();FALSE()) -> true | K45: of:=FORMULA([.H45]) -> =AVERAGE(G40:G49)
G46: 2015-02-09 | H46: of:=COM.MICROSOFT.MODE.MULT([.G40:.G49]) ->  | I46: - | J46: of:=IF([.H46]=[.I46];TRUE();FALSE()) ->  | K46: of:=FORMULA([.H46]) -> =MODE.MULT(G40:G49)
G47: 2015-01-01 | H47: of:=COM.MICROSOFT.MODE.MULT({"4-3-15"|"1-3-15"|"4-3-15"}) ->  | I47: - | J47: of:=IF([.H47]=[.I47];TRUE();FALSE()) ->  | K47: of:=FORMULA([.H47]) -> =MODE.MULT({"4-3-15";"1-3-15";"4-3-15"})
G48: 2015-10-12 | H48: of:=COM.MICROSOFT.MODE.MULT({DATE(2015|3|4)|DATE(2015|2|1)|DATE(2015|3|4)}) ->  | I48: - | J48: of:=IF([.H48]=[.I48];TRUE();FALSE()) ->  | K48: of:=FORMULA([.H48]) -> =MODE.MULT({DATE(2015;3;4);DATE(2015;2;1);DATE(2015;3;4)})
G49: 2015-09-30 | I49: - | J49: of:=IF([.A13]=[.I49];TRUE();FALSE()) ->  | K49: of:=FORMULA([.A13]) -> =MEDIAN({"4-3-15";"1-3-15";"4-3-15"})
I50: - | J50: of:=IF([.A14]=[.I50];TRUE();FALSE()) ->  | K50: of:=FORMULA([.A14]) -> =MEDIAN({DATE(2015;3;4);DATE(2015;2;1);DATE(2015;3;4)})

Sheet: 'file:///home/zdenek/Dokumenty/LO/sc-unit-test/Project%20Calc%20functions%20tests/fods/function_based_test_Example.fods/function_based_test_Example_reference.fods'#Sheet2
H3: 4