Sheet: Sheet1
A1: PERMUTATIONA Function
A3: Result | B3: of:=AND([.B8:.B95]) -> true
A7: Sheet | B7: Result | C7: Description
A8: 1 | B8: of:=AND([Sheet2.C2:.C341]) -> true | C8: Simple PERMUTATIONA formulas with local references and values

Sheet: Sheet2
A1: Function | B1: Expected | C1: Correct | D1: FunctionString | E1: Comment | I1: Data | K1: 100 | L1: 3
A2: of:=PERMUTATIONA(6;3) -> 216 | B2: 216 | C2: of:=ROUND([.A2];12)=ROUND([.B2];12) -> true | D2: of:=FORMULA([.A2]) -> =PERMUTATIONA(6,3) | I2: 100 | K2: 101 | L2: 4
A3: of:=PERMUTATIONA([.I2];[.I3]) -> 1000000 | B3: 1000000 | C3: of:=ROUND([.A3];12)=ROUND([.B3];12) -> true | D3: of:=FORMULA([.A3]) -> =PERMUTATIONA(I2,I3) | I3: 3 | K3: 102 | L3: 5
A4: of:=PERMUTATIONA(3;2) -> 9 | B4: 9 | C4: of:=ROUND([.A4];12)=ROUND([.B4];12) -> true | D4: of:=FORMULA([.A4]) -> =PERMUTATIONA(3,2)
A5: of:=PERMUTATIONA(10; 5) -> 100000 | B5: 100000 | C5: of:=ROUND([.A5];12)=ROUND([.B5];12) -> true | D5: of:=FORMULA([.A5]) -> =PERMUTATIONA(10, 5)
A6: of:=PERMUTATIONA(21; 5) -> 4084101 | B6: 4084101 | C6: of:=ROUND([.A6];12)=ROUND([.B6];12) -> true | D6: of:=FORMULA([.A6]) -> =PERMUTATIONA(21, 5)
A7: of:=PERMUTATIONA(4; 3) -> 64 | B7: 64 | C7: of:=ROUND([.A7];12)=ROUND([.B7];12) -> true | D7: of:=FORMULA([.A7]) -> =PERMUTATIONA(4, 3)
A8: of:=PERMUTATIONA([.K1:.K3];[.L1:.L3]) -> 1000000 | B8: 1000000 | C8: of:=ROUND([.A8];12)=ROUND([.B8];12) -> true | D8: of:=FORMULA([.A8]) -> {=PERMUTATIONA(K1:K3,L1:L3)}
A9: 104060401 | B9: 104060401 | C9: of:=ROUND([.A9];12)=ROUND([.B9];12) -> true | D9: of:=FORMULA([.A9]) -> {=PERMUTATIONA(K1:K3,L1:L3)}
A10: 11040808032 | B10: 11040808032 | C10: of:=ROUND([.A10];12)=ROUND([.B10];12) -> true | D10: of:=FORMULA([.A10]) -> {=PERMUTATIONA(K1:K3,L1:L3)}
A11: of:=PERMUTATIONA(0;3) -> 0 | B11: 0 | C11: of:=ROUND([.A11];12)=ROUND([.B11];12) -> true | D11: of:=FORMULA([.A11]) -> =PERMUTATIONA(0,3)
A12: of:=PERMUTATIONA(6;0) -> 1 | B12: 1 | C12: of:=ROUND([.A12];12)=ROUND([.B12];12) -> true | D12: of:=FORMULA([.A12]) -> =PERMUTATIONA(6,0)
A13: of:=PERMUTATIONA(6;13) -> 13060694016 | B13: 13060694016 | C13: of:=ROUND([.A13];12)=ROUND([.B13];12) -> true | D13: of:=FORMULA([.A13]) -> =PERMUTATIONA(6,13)
A14: of:=PERMUTATIONA(6;6) -> 46656 | B14: 46656 | C14: of:=ROUND([.A14];12)=ROUND([.B14];12) -> true | D14: of:=FORMULA([.A14]) -> =PERMUTATIONA(6,6)
A15: of:=PERMUTATIONA(0;0) -> 1 | B15: 1 | C15: of:=ROUND([.A15];12)=ROUND([.B15];12) -> true | D15: of:=FORMULA([.A15]) -> =PERMUTATIONA(0,0)
A16: of:=PERMUTATIONA(6.9;3.8) -> 216 | B16: 216 | C16: of:=ROUND([.A16];12)=ROUND([.B16];12) -> true | D16: of:=FORMULA([.A16]) -> =PERMUTATIONA(6.9,3.8)
A17: of:=PERMUTATIONA(-6;3) ->  | B17: error | C17: of:=ISERROR([.A17]) -> true | D17: of:=FORMULA([.A17]) -> =PERMUTATIONA(-6,3)
A18: of:=PERMUTATIONA(-6;-3) ->  | B18: error | C18: of:=ISERROR([.A18]) -> true | D18: of:=FORMULA([.A18]) -> =PERMUTATIONA(-6,-3)