Sheet: Sheet1
A1: POISSON Function
A3: Result | B3: of:=AND([.B8:.B95]) -> true
A7: Sheet | B7: Result | C7: Description
A8: 1 | B8: of:=AND([Sheet2.C2:.C841]) -> true | C8: Simple POISSON formulas with local references and values

Sheet: Sheet2
A1: Function | B1: Expected | C1: Correct | D1: FunctionString | E1: Comment | I1: Data | K1: k | L1: Poisson | N1: lambda | O1: 600 | U1: lambda | V1: 2000
A2: of:=POISSON(60;50;1) -> 0.927839820186743 | B2: 0.927839820186743 | C2: of:=ROUND([.A2];12)=ROUND([.B2];12) -> true | D2: of:=FORMULA([.A2]) -> =POISSON(60,50,1) | I2: 2 | K2: 0 | O2: probability mass function | R2: cumulative probability function | V2: probability mass function | Y2: cumulative probability function
A3: of:=POISSON([.I2];[.I3];1) -> 0.124652019483081 | B3: 0.124652019483081 | C3: of:=ROUND([.A3];12)=ROUND([.B3];12) -> true | D3: of:=FORMULA([.A3]) -> =POISSON(I2,I3,1) | I3: 5 | K3: 10 | N3: k | O3: poisson 0 | R3: poisson 1 | U3: k | V3: poisson 0 | Y3: poisson 1
A4: of:=POISSON([.I2];[.I3];0) -> 0.0842243374885683 | B4: 0.0842243374885683 | C4: of:=ROUND([.A4];12)=ROUND([.B4];12) -> true | D4: of:=FORMULA([.A4]) -> =POISSON(I2,I3,0) | I4: Formula | K4: 50 | N4: 0 | U4: 0
A5: of:=POISSON([.K2];[.L$14];1) -> 1.38389652673674E-087 | B5: 1.38389652673674E-087 | C5: of:=ROUND([.A5];12)=ROUND([.B5];12) -> true | D5: of:=FORMULA([.A5]) -> =POISSON(K2,L$14,1) | K5: 100 | N5: 1 | U5: 1
A6: of:=POISSON([.K3];[.L$14];1) -> 4.10958494344763E-071 | B6: 4.10958494344763E-071 | C6: of:=ROUND([.A6];12)=ROUND([.B6];12) -> true | D6: of:=FORMULA([.A6]) -> =POISSON(K3,L$14,1) | K6: 103 | N6: 2 | U6: 2
A7: of:=POISSON([.K4];[.L$14];1) -> 6.815847235588E-037 | B7: 6.815847235588E-037 | C7: of:=ROUND([.A7];12)=ROUND([.B7];12) -> true | D7: of:=FORMULA([.A7]) -> =POISSON(K4,L$14,1) | K7: 104 | N7: 3
A8: of:=POISSON([.K5];[.L$14];1) -> 3.72364121520168E-015 | B8: 3.72364121520168E-015 | C8: of:=ROUND([.A8];12)=ROUND([.B8];12) -> true | D8: of:=FORMULA([.A8]) -> =POISSON(K5,L$14,1) | K8: 110 | N8: 4
A9: of:=POISSON([.K6];[.L$14];1) -> 0.0000000000000289164740503264 | B9: 0.0000000000000289164740503264 | C9: of:=ROUND([.A9];12)=ROUND([.B9];12) -> true | D9: of:=FORMULA([.A9]) -> =POISSON(K6,L$14,1) | K9: 133 | N9: 5
A10: of:=POISSON([.K7];[.L$14];1) -> 0.0000000000000561702953605747 | B10: 0.0000000000000561702953605747 | C10: of:=ROUND([.A10];12)=ROUND([.B10];12) -> true | D10: of:=FORMULA([.A10]) -> =POISSON(K7,L$14,1) | K10: 134 | N10: 6
A11: of:=POISSON([.K8];[.L$14];1) -> 0.00000000000248128607783049 | B11: 0.00000000000248128607783049 | C11: of:=ROUND([.A11];12)=ROUND([.B11];12) -> true | D11: of:=FORMULA([.A11]) -> =POISSON(K8,L$14,1) | K11: 200 | N11: 7
A12: of:=POISSON([.K9];[.L$14];1) -> 0.000000294390018678411 | B12: 0.000000294390018678411 | C12: of:=ROUND([.A12];12)=ROUND([.B12];12) -> true | D12: of:=FORMULA([.A12]) -> =POISSON(K9,L$14,1) | K12: 250 | N12: 8
A13: of:=POISSON([.K10];[.L$14];1) -> 0.000000445616628385656 | B13: 0.000000445616628385656 | C13: of:=ROUND([.A13];12)=ROUND([.B13];12) -> true | D13: of:=FORMULA([.A13]) -> =POISSON(K10,L$14,1) | N13: 9
A14: of:=POISSON([.K11];[.L$14];1) -> 0.518794309678685 | B14: 0.518794309678685 | C14: of:=ROUND([.A14];12)=ROUND([.B14];12) -> true | D14: of:=FORMULA([.A14]) -> =POISSON(K11,L$14,1) | L14: 200 | N14: 10
A15: of:=POISSON([.K12];[.L$14];1) -> 0.999715378599712 | B15: 0.999715378599712 | C15: of:=ROUND([.A15];12)=ROUND([.B15];12) -> true | D15: of:=FORMULA([.A15]) -> =POISSON(K12,L$14,1) | N15: 11
A16: of:=POISSON([.N4];[.$O$1];FALSE()) -> 2.65039655300431E-261 | B16: 2.65039655300431E-261 | C16: of:=ROUND([.A16];12)=ROUND([.B16];12) -> true | D16: of:=FORMULA([.A16]) -> =POISSON(N4,$O$1,FALSE()) | N16: 12
A17: of:=POISSON([.N5];[.$O$1];FALSE()) -> 1.59023793180259E-258 | B17: 1.59023793180259E-258 | C17: of:=ROUND([.A17];12)=ROUND([.B17];12) -> true | D17: of:=FORMULA([.A17]) -> =POISSON(N5,$O$1,FALSE()) | N17: 13
A18: of:=POISSON([.N6];[.$O$1];FALSE()) -> 4.77071379540776E-256 | B18: 4.77071379540776E-256 | C18: of:=ROUND([.A18];12)=ROUND([.B18];12) -> true | D18: of:=FORMULA([.A18]) -> =POISSON(N6,$O$1,FALSE()) | N18: 14
A19: of:=POISSON([.N7];[.$O$1];FALSE()) -> 9.54142759081552E-254 | B19: 9.54142759081552E-254 | C19: of:=ROUND([.A19];12)=ROUND([.B19];12) -> true | D19: of:=FORMULA([.A19]) -> =POISSON(N7,$O$1,FALSE()) | N19: 15
A20: of:=POISSON([.N8];[.$O$1];FALSE()) -> 1.43121413862233E-251 | B20: 1.43121413862233E-251 | C20: of:=ROUND([.A20];12)=ROUND([.B20];12) -> true | D20: of:=FORMULA([.A20]) -> =POISSON(N8,$O$1,FALSE()) | N20: 16
A21: of:=POISSON([.N9];[.$O$1];FALSE()) -> 1.71745696634679E-249 | B21: 1.71745696634679E-249 | C21: of:=ROUND([.A21];12)=ROUND([.B21];12) -> true | D21: of:=FORMULA([.A21]) -> =POISSON(N9,$O$1,FALSE()) | N21: 17
A22: of:=POISSON([.N10];[.$O$1];FALSE()) -> 1.71745696634679E-247 | B22: 1.71745696634679E-247 | C22: of:=ROUND([.A22];12)=ROUND([.B22];12) -> true | D22: of:=FORMULA([.A22]) -> =POISSON(N10,$O$1,FALSE()) | N22: 18
A23: of:=POISSON([.N11];[.$O$1];FALSE()) -> 1.47210597115439E-245 | B23: 1.47210597115439E-245 | C23: of:=ROUND([.A23];12)=ROUND([.B23];12) -> true | D23: of:=FORMULA([.A23]) -> =POISSON(N11,$O$1,FALSE()) | N23: 19
A24: of:=POISSON([.N12];[.$O$1];FALSE()) -> 1.1040794783658E-243 | B24: 1.1040794783658E-243 | C24: of:=ROUND([.A24];12)=ROUND([.B24];12) -> true | D24: of:=FORMULA([.A24]) -> =POISSON(N12,$O$1,FALSE()) | N24: 20
A25: of:=POISSON([.N13];[.$O$1];FALSE()) -> 7.36052985577197E-242 | B25: 7.36052985577197E-242 | C25: of:=ROUND([.A25];12)=ROUND([.B25];12) -> true | D25: of:=FORMULA([.A25]) -> =POISSON(N13,$O$1,FALSE()) | N25: 21
A26: of:=POISSON([.N14];[.$O$1];FALSE()) -> 4.41631791346318E-240 | B26: 4.41631791346318E-240 | C26: of:=ROUND([.A26];12)=ROUND([.B26];12) -> true | D26: of:=FORMULA([.A26]) -> =POISSON(N14,$O$1,FALSE()) | N26: 22
A27: of:=POISSON([.N15];[.$O$1];FALSE()) -> 2.40890068007083E-238 | B27: 2.40890068007083E-238 | C27: of:=ROUND([.A27];12)=ROUND([.B27];12) -> true | D27: of:=FORMULA([.A27]) -> =POISSON(N15,$O$1,FALSE()) | N27: 23
A28: of:=POISSON([.N16];[.$O$1];FALSE()) -> 1.20445034003541E-236 | B28: 1.20445034003541E-236 | C28: of:=ROUND([.A28];12)=ROUND([.B28];12) -> true | D28: of:=FORMULA([.A28]) -> =POISSON(N16,$O$1,FALSE()) | N28: 24
A29: of:=POISSON([.N17];[.$O$1];FALSE()) -> 5.55900156939422E-235 | B29: 5.55900156939422E-235 | C29: of:=ROUND([.A29];12)=ROUND([.B29];12) -> true | D29: of:=FORMULA([.A29]) -> =POISSON(N17,$O$1,FALSE()) | N29: 25
A30: of:=POISSON([.N18];[.$O$1];FALSE()) -> 2.38242924402609E-233 | B30: 2.38242924402609E-233 | C30: of:=ROUND([.A30];12)=ROUND([.B30];12) -> true | D30: of:=FORMULA([.A30]) -> =POISSON(N18,$O$1,FALSE()) | N30: 26
A31: of:=POISSON([.N19];[.$O$1];FALSE()) -> 9.52971697610437E-232 | B31: 9.52971697610437E-232 | C31: of:=ROUND([.A31];12)=ROUND([.B31];12) -> true | D31: of:=FORMULA([.A31]) -> =POISSON(N19,$O$1,FALSE()) | N31: 27
A32: of:=POISSON([.N20];[.$O$1];FALSE()) -> 3.57364386603914E-230 | B32: 3.57364386603914E-230 | C32: of:=ROUND([.A32];12)=ROUND([.B32];12) -> true | D32: of:=FORMULA([.A32]) -> =POISSON(N20,$O$1,FALSE()) | N32: 28
A33: of:=POISSON([.N21];[.$O$1];FALSE()) -> 1.26128607036676E-228 | B33: 1.26128607036676E-228 | C33: of:=ROUND([.A33];12)=ROUND([.B33];12) -> true | D33: of:=FORMULA([.A33]) -> =POISSON(N21,$O$1,FALSE()) | N33: 29
A34: of:=POISSON([.N22];[.$O$1];FALSE()) -> 4.20428690122252E-227 | B34: 4.20428690122252E-227 | C34: of:=ROUND([.A34];12)=ROUND([.B34];12) -> true | D34: of:=FORMULA([.A34]) -> =POISSON(N22,$O$1,FALSE()) | N34: 30
A35: of:=POISSON([.N23];[.$O$1];FALSE()) -> 1.32766954775448E-225 | B35: 1.32766954775448E-225 | C35: of:=ROUND([.A35];12)=ROUND([.B35];12) -> true | D35: of:=FORMULA([.A35]) -> =POISSON(N23,$O$1,FALSE()) | N35: 31
A36: of:=POISSON([.N24];[.$O$1];FALSE()) -> 3.98300864326344E-224 | B36: 3.98300864326344E-224 | C36: of:=ROUND([.A36];12)=ROUND([.B36];12) -> true | D36: of:=FORMULA([.A36]) -> =POISSON(N24,$O$1,FALSE()) | N36: 32
A37: of:=POISSON([.N25];[.$O$1];FALSE()) -> 1.13800246950384E-222 | B37: 1.13800246950384E-222 | C37: of:=ROUND([.A37];12)=ROUND([.B37];12) -> true | D37: of:=FORMULA([.A37]) -> =POISSON(N25,$O$1,FALSE()) | N37: 33
A38: of:=POISSON([.N26];[.$O$1];FALSE()) -> 3.10364309864684E-221 | B38: 3.10364309864684E-221 | C38: of:=ROUND([.A38];12)=ROUND([.B38];12) -> true | D38: of:=FORMULA([.A38]) -> =POISSON(N26,$O$1,FALSE()) | N38: 34
A39: of:=POISSON([.N27];[.$O$1];FALSE()) -> 8.09646025733957E-220 | B39: 8.09646025733957E-220 | C39: of:=ROUND([.A39];12)=ROUND([.B39];12) -> true | D39: of:=FORMULA([.A39]) -> =POISSON(N27,$O$1,FALSE()) | N39: 35
A40: of:=POISSON([.N28];[.$O$1];FALSE()) -> 2.02411506433489E-218 | B40: 2.02411506433489E-218 | C40: of:=ROUND([.A40];12)=ROUND([.B40];12) -> true | D40: of:=FORMULA([.A40]) -> =POISSON(N28,$O$1,FALSE()) | N40: 36
A41: of:=POISSON([.N29];[.$O$1];FALSE()) -> 4.85787615440374E-217 | B41: 4.85787615440374E-217 | C41: of:=ROUND([.A41];12)=ROUND([.B41];12) -> true | D41: of:=FORMULA([.A41]) -> =POISSON(N29,$O$1,FALSE()) | N41: 37
A42: of:=POISSON([.N30];[.$O$1];FALSE()) -> 1.12104834332394E-215 | B42: 1.12104834332394E-215 | C42: of:=ROUND([.A42];12)=ROUND([.B42];12) -> true | D42: of:=FORMULA([.A42]) -> =POISSON(N30,$O$1,FALSE()) | N42: 38
A43: of:=POISSON([.N31];[.$O$1];FALSE()) -> 2.49121854071987E-214 | B43: 2.49121854071987E-214 | C43: of:=ROUND([.A43];12)=ROUND([.B43];12) -> true | D43: of:=FORMULA([.A43]) -> =POISSON(N31,$O$1,FALSE()) | N43: 39
A44: of:=POISSON([.N32];[.$O$1];FALSE()) -> 5.33832544439972E-213 | B44: 5.33832544439972E-213 | C44: of:=ROUND([.A44];12)=ROUND([.B44];12) -> true | D44: of:=FORMULA([.A44]) -> =POISSON(N32,$O$1,FALSE()) | N44: 40
A45: of:=POISSON([.N33];[.$O$1];FALSE()) -> 1.10448112642753E-211 | B45: 1.10448112642753E-211 | C45: of:=ROUND([.A45];12)=ROUND([.B45];12) -> true | D45: of:=FORMULA([.A45]) -> =POISSON(N33,$O$1,FALSE()) | N45: 41
A46: of:=POISSON([.N34];[.$O$1];FALSE()) -> 2.20896225285506E-210 | B46: 2.20896225285506E-210 | C46: of:=ROUND([.A46];12)=ROUND([.B46];12) -> true | D46: of:=FORMULA([.A46]) -> =POISSON(N34,$O$1,FALSE()) | N46: 42
A47: of:=POISSON([.N35];[.$O$1];FALSE()) -> 4.27541081197753E-209 | B47: 4.27541081197753E-209 | C47: of:=ROUND([.A47];12)=ROUND([.B47];12) -> true | D47: of:=FORMULA([.A47]) -> =POISSON(N35,$O$1,FALSE()) | N47: 43
A48: of:=POISSON([.N36];[.$O$1];FALSE()) -> 8.01639527245786E-208 | B48: 8.01639527245786E-208 | C48: of:=ROUND([.A48];12)=ROUND([.B48];12) -> true | D48: of:=FORMULA([.A48]) -> =POISSON(N36,$O$1,FALSE()) | N48: 44
A49: of:=POISSON([.N37];[.$O$1];FALSE()) -> 1.45752641317416E-206 | B49: 1.45752641317416E-206 | C49: of:=ROUND([.A49];12)=ROUND([.B49];12) -> true | D49: of:=FORMULA([.A49]) -> =POISSON(N37,$O$1,FALSE()) | N49: 45
A50: of:=POISSON([.N38];[.$O$1];FALSE()) -> 2.57210543501322E-205 | B50: 2.57210543501322E-205 | C50: of:=ROUND([.A50];12)=ROUND([.B50];12) -> true | D50: of:=FORMULA([.A50]) -> =POISSON(N38,$O$1,FALSE()) | N50: 46
A51: of:=POISSON([.N39];[.$O$1];FALSE()) -> 4.4093236028798E-204 | B51: 4.4093236028798E-204 | C51: of:=ROUND([.A51];12)=ROUND([.B51];12) -> true | D51: of:=FORMULA([.A51]) -> =POISSON(N39,$O$1,FALSE()) | N51: 47
A52: of:=POISSON([.N40];[.$O$1];FALSE()) -> 7.34887267146634E-203 | B52: 7.34887267146634E-203 | C52: of:=ROUND([.A52];12)=ROUND([.B52];12) -> true | D52: of:=FORMULA([.A52]) -> =POISSON(N40,$O$1,FALSE()) | N52: 48
A53: of:=POISSON([.N41];[.$O$1];FALSE()) -> 1.19170908185941E-201 | B53: 1.19170908185941E-201 | C53: of:=ROUND([.A53];12)=ROUND([.B53];12) -> true | D53: of:=FORMULA([.A53]) -> =POISSON(N41,$O$1,FALSE()) | N53: 49
A54: of:=POISSON([.N42];[.$O$1];FALSE()) -> 1.88164591872538E-200 | B54: 1.88164591872538E-200 | C54: of:=ROUND([.A54];12)=ROUND([.B54];12) -> true | D54: of:=FORMULA([.A54]) -> =POISSON(N42,$O$1,FALSE()) | N54: 50
A55: of:=POISSON([.N43];[.$O$1];FALSE()) -> 2.89483987496212E-199 | B55: 2.89483987496212E-199 | C55: of:=ROUND([.A55];12)=ROUND([.B55];12) -> true | D55: of:=FORMULA([.A55]) -> =POISSON(N43,$O$1,FALSE()) | N55: 51
A56: of:=POISSON([.N44];[.$O$1];FALSE()) -> 4.34225981244318E-198 | B56: 4.34225981244318E-198 | C56: of:=ROUND([.A56];12)=ROUND([.B56];12) -> true | D56: of:=FORMULA([.A56]) -> =POISSON(N44,$O$1,FALSE()) | N56: 52
A57: of:=POISSON([.N45];[.$O$1];FALSE()) -> 6.3545265547949E-197 | B57: 6.3545265547949E-197 | C57: of:=ROUND([.A57];12)=ROUND([.B57];12) -> true | D57: of:=FORMULA([.A57]) -> =POISSON(N45,$O$1,FALSE()) | N57: 53
A58: of:=POISSON([.N46];[.$O$1];FALSE()) -> 9.07789507827843E-196 | B58: 9.07789507827843E-196 | C58: of:=ROUND([.A58];12)=ROUND([.B58];12) -> true | D58: of:=FORMULA([.A58]) -> =POISSON(N46,$O$1,FALSE()) | N58: 54
A59: of:=POISSON([.N47];[.$O$1];FALSE()) -> 1.26668303417839E-194 | B59: 1.26668303417839E-194 | C59: of:=ROUND([.A59];12)=ROUND([.B59];12) -> true | D59: of:=FORMULA([.A59]) -> =POISSON(N47,$O$1,FALSE()) | N59: 55
A60: of:=POISSON([.N48];[.$O$1];FALSE()) -> 1.72729504660689E-193 | B60: 1.72729504660689E-193 | C60: of:=ROUND([.A60];12)=ROUND([.B60];12) -> true | D60: of:=FORMULA([.A60]) -> =POISSON(N48,$O$1,FALSE()) | N60: 56
A61: of:=POISSON([.N49];[.$O$1];FALSE()) -> 2.30306006214252E-192 | B61: 2.30306006214252E-192 | C61: of:=ROUND([.A61];12)=ROUND([.B61];12) -> true | D61: of:=FORMULA([.A61]) -> =POISSON(N49,$O$1,FALSE()) | N61: 57
A62: of:=POISSON([.N50];[.$O$1];FALSE()) -> 3.00399138540328E-191 | B62: 3.00399138540328E-191 | C62: of:=ROUND([.A62];12)=ROUND([.B62];12) -> true | D62: of:=FORMULA([.A62]) -> =POISSON(N50,$O$1,FALSE()) | N62: 58
A63: of:=POISSON([.N51];[.$O$1];FALSE()) -> 3.83488261966377E-190 | B63: 3.83488261966377E-190 | C63: of:=ROUND([.A63];12)=ROUND([.B63];12) -> true | D63: of:=FORMULA([.A63]) -> =POISSON(N51,$O$1,FALSE()) | N63: 59
A64: of:=POISSON([.N52];[.$O$1];FALSE()) -> 4.79360327457971E-189 | B64: 4.79360327457971E-189 | C64: of:=ROUND([.A64];12)=ROUND([.B64];12) -> true | D64: of:=FORMULA([.A64]) -> =POISSON(N52,$O$1,FALSE()) | N64: 60
A65: of:=POISSON([.N53];[.$O$1];FALSE()) -> 5.86971829540372E-188 | B65: 5.86971829540372E-188 | C65: of:=ROUND([.A65];12)=ROUND([.B65];12) -> true | D65: of:=FORMULA([.A65]) -> =POISSON(N53,$O$1,FALSE()) | N65: 61
A66: of:=POISSON([.N54];[.$O$1];FALSE()) -> 7.04366195448447E-187 | B66: 7.04366195448447E-187 | C66: of:=ROUND([.A66];12)=ROUND([.B66];12) -> true | D66: of:=FORMULA([.A66]) -> =POISSON(N54,$O$1,FALSE()) | N66: 62
A67: of:=POISSON([.N55];[.$O$1];FALSE()) -> 8.28666112292291E-186 | B67: 8.28666112292291E-186 | C67: of:=ROUND([.A67];12)=ROUND([.B67];12) -> true | D67: of:=FORMULA([.A67]) -> =POISSON(N55,$O$1,FALSE()) | N67: 63
A68: of:=POISSON([.N56];[.$O$1];FALSE()) -> 9.56153206491104E-185 | B68: 9.56153206491104E-185 | C68: of:=ROUND([.A68];12)=ROUND([.B68];12) -> true | D68: of:=FORMULA([.A68]) -> =POISSON(N56,$O$1,FALSE()) | N68: 64
A69: of:=POISSON([.N57];[.$O$1];FALSE()) -> 1.08243759225408E-183 | B69: 1.08243759225408E-183 | C69: of:=ROUND([.A69];12)=ROUND([.B69];12) -> true | D69: of:=FORMULA([.A69]) -> =POISSON(N57,$O$1,FALSE()) | N69: 65
A70: of:=POISSON([.N58];[.$O$1];FALSE()) -> 1.20270843583787E-182 | B70: 1.20270843583787E-182 | C70: of:=ROUND([.A70];12)=ROUND([.B70];12) -> true | D70: of:=FORMULA([.A70]) -> =POISSON(N58,$O$1,FALSE()) | N70: 66
A71: of:=POISSON([.N59];[.$O$1];FALSE()) -> 1.31204556636858E-181 | B71: 1.31204556636858E-181 | C71: of:=ROUND([.A71];12)=ROUND([.B71];12) -> true | D71: of:=FORMULA([.A71]) -> =POISSON(N59,$O$1,FALSE()) | N71: 67
A72: of:=POISSON([.N60];[.$O$1];FALSE()) -> 1.40576310682348E-180 | B72: 1.40576310682348E-180 | C72: of:=ROUND([.A72];12)=ROUND([.B72];12) -> true | D72: of:=FORMULA([.A72]) -> =POISSON(N60,$O$1,FALSE()) | N72: 68
A73: of:=POISSON([.N61];[.$O$1];FALSE()) -> 1.47975063876156E-179 | B73: 1.47975063876156E-179 | C73: of:=ROUND([.A73];12)=ROUND([.B73];12) -> true | D73: of:=FORMULA([.A73]) -> =POISSON(N61,$O$1,FALSE()) | N73: 69
A74: of:=POISSON([.N62];[.$O$1];FALSE()) -> 1.53077652285679E-178 | B74: 1.53077652285679E-178 | C74: of:=ROUND([.A74];12)=ROUND([.B74];12) -> true | D74: of:=FORMULA([.A74]) -> =POISSON(N62,$O$1,FALSE()) | N74: 70
A75: of:=POISSON([.N63];[.$O$1];FALSE()) -> 1.55672188765097E-177 | B75: 1.55672188765097E-177 | C75: of:=ROUND([.A75];12)=ROUND([.B75];12) -> true | D75: of:=FORMULA([.A75]) -> =POISSON(N63,$O$1,FALSE()) | N75: 71
A76: of:=POISSON([.N64];[.$O$1];FALSE()) -> 1.55672188765097E-176 | B76: 1.55672188765097E-176 | C76: of:=ROUND([.A76];12)=ROUND([.B76];12) -> true | D76: of:=FORMULA([.A76]) -> =POISSON(N64,$O$1,FALSE()) | N76: 72
A77: of:=POISSON([.N65];[.$O$1];FALSE()) -> 1.53120185670587E-175 | B77: 1.53120185670587E-175 | C77: of:=ROUND([.A77];12)=ROUND([.B77];12) -> true | D77: of:=FORMULA([.A77]) -> =POISSON(N65,$O$1,FALSE()) | N77: 73
A78: of:=POISSON([.N66];[.$O$1];FALSE()) -> 1.48180824842504E-174 | B78: 1.48180824842504E-174 | C78: of:=ROUND([.A78];12)=ROUND([.B78];12) -> true | D78: of:=FORMULA([.A78]) -> =POISSON(N66,$O$1,FALSE()) | N78: 74
A79: of:=POISSON([.N67];[.$O$1];FALSE()) -> 1.41124595088099E-173 | B79: 1.41124595088099E-173 | C79: of:=ROUND([.A79];12)=ROUND([.B79];12) -> true | D79: of:=FORMULA([.A79]) -> =POISSON(N67,$O$1,FALSE()) | N79: 75
A80: of:=POISSON([.N68];[.$O$1];FALSE()) -> 1.32304307895092E-172 | B80: 1.32304307895092E-172 | C80: of:=ROUND([.A80];12)=ROUND([.B80];12) -> true | D80: of:=FORMULA([.A80]) -> =POISSON(N68,$O$1,FALSE()) | N80: 76
A81: of:=POISSON([.N69];[.$O$1];FALSE()) -> 1.22127053441624E-171 | B81: 1.22127053441624E-171 | C81: of:=ROUND([.A81];12)=ROUND([.B81];12) -> true | D81: of:=FORMULA([.A81]) -> =POISSON(N69,$O$1,FALSE()) | N81: 77
A82: of:=POISSON([.N70];[.$O$1];FALSE()) -> 1.1102459403784E-170 | B82: 1.1102459403784E-170 | C82: of:=ROUND([.A82];12)=ROUND([.B82];12) -> true | D82: of:=FORMULA([.A82]) -> =POISSON(N70,$O$1,FALSE()) | N82: 78
A83: of:=POISSON([.N71];[.$O$1];FALSE()) -> 9.94250095861252E-170 | B83: 9.94250095861252E-170 | C83: of:=ROUND([.A83];12)=ROUND([.B83];12) -> true | D83: of:=FORMULA([.A83]) -> =POISSON(N71,$O$1,FALSE()) | N83: 79
A84: of:=POISSON([.N72];[.$O$1];FALSE()) -> 8.77279496348164E-169 | B84: 8.77279496348164E-169 | C84: of:=ROUND([.A84];12)=ROUND([.B84];12) -> true | D84: of:=FORMULA([.A84]) -> =POISSON(N72,$O$1,FALSE()) | N84: 80
A85: of:=POISSON([.N73];[.$O$1];FALSE()) -> 7.62851735954925E-168 | B85: 7.62851735954925E-168 | C85: of:=ROUND([.A85];12)=ROUND([.B85];12) -> true | D85: of:=FORMULA([.A85]) -> =POISSON(N73,$O$1,FALSE()) | N85: 81
A86: of:=POISSON([.N74];[.$O$1];FALSE()) -> 6.53872916532793E-167 | B86: 6.53872916532793E-167 | C86: of:=ROUND([.A86];12)=ROUND([.B86];12) -> true | D86: of:=FORMULA([.A86]) -> =POISSON(N74,$O$1,FALSE()) | N86: 82
A87: of:=POISSON([.N75];[.$O$1];FALSE()) -> 5.52568661858698E-166 | B87: 5.52568661858698E-166 | C87: of:=ROUND([.A87];12)=ROUND([.B87];12) -> true | D87: of:=FORMULA([.A87]) -> =POISSON(N75,$O$1,FALSE()) | N87: 83
A88: of:=POISSON([.N76];[.$O$1];FALSE()) -> 4.60473884882249E-165 | B88: 4.60473884882249E-165 | C88: of:=ROUND([.A88];12)=ROUND([.B88];12) -> true | D88: of:=FORMULA([.A88]) -> =POISSON(N76,$O$1,FALSE()) | N88: 84
A89: of:=POISSON([.N77];[.$O$1];FALSE()) -> 3.78471686204588E-164 | B89: 3.78471686204588E-164 | C89: of:=ROUND([.A89];12)=ROUND([.B89];12) -> true | D89: of:=FORMULA([.A89]) -> =POISSON(N77,$O$1,FALSE()) | N89: 85
A90: of:=POISSON([.N78];[.$O$1];FALSE()) -> 3.06868934760477E-163 | B90: 3.06868934760477E-163 | C90: of:=ROUND([.A90];12)=ROUND([.B90];12) -> true | D90: of:=FORMULA([.A90]) -> =POISSON(N78,$O$1,FALSE()) | N90: 86
A91: of:=POISSON([.N79];[.$O$1];FALSE()) -> 2.45495147808381E-162 | B91: 2.45495147808381E-162 | C91: of:=ROUND([.A91];12)=ROUND([.B91];12) -> true | D91: of:=FORMULA([.A91]) -> =POISSON(N79,$O$1,FALSE()) | N91: 87
A92: of:=POISSON([.N80];[.$O$1];FALSE()) -> 1.93811958796091E-161 | B92: 1.93811958796091E-161 | C92: of:=ROUND([.A92];12)=ROUND([.B92];12) -> true | D92: of:=FORMULA([.A92]) -> =POISSON(N80,$O$1,FALSE()) | N92: 88
A93: of:=POISSON([.N81];[.$O$1];FALSE()) -> 1.51022305555395E-160 | B93: 1.51022305555395E-160 | C93: of:=ROUND([.A93];12)=ROUND([.B93];12) -> true | D93: of:=FORMULA([.A93]) -> =POISSON(N81,$O$1,FALSE()) | N93: 89
A94: of:=POISSON([.N82];[.$O$1];FALSE()) -> 1.16171004273381E-159 | B94: 1.16171004273381E-159 | C94: of:=ROUND([.A94];12)=ROUND([.B94];12) -> true | D94: of:=FORMULA([.A94]) -> =POISSON(N82,$O$1,FALSE()) | N94: 90
A95: of:=POISSON([.N83];[.$O$1];FALSE()) -> 8.82311424861121E-159 | B95: 8.82311424861121E-159 | C95: of:=ROUND([.A95];12)=ROUND([.B95];12) -> true | D95: of:=FORMULA([.A95]) -> =POISSON(N83,$O$1,FALSE()) | N95: 91
A96: of:=POISSON([.N84];[.$O$1];FALSE()) -> 6.61733568645841E-158 | B96: 6.61733568645841E-158 | C96: of:=ROUND([.A96];12)=ROUND([.B96];12) -> true | D96: of:=FORMULA([.A96]) -> =POISSON(N84,$O$1,FALSE()) | N96: 92
A97: of:=POISSON([.N85];[.$O$1];FALSE()) -> 4.90173013811734E-157 | B97: 4.90173013811734E-157 | C97: of:=ROUND([.A97];12)=ROUND([.B97];12) -> true | D97: of:=FORMULA([.A97]) -> =POISSON(N85,$O$1,FALSE()) | N97: 93
A98: of:=POISSON([.N86];[.$O$1];FALSE()) -> 3.58663180837854E-156 | B98: 3.58663180837854E-156 | C98: of:=ROUND([.A98];12)=ROUND([.B98];12) -> true | D98: of:=FORMULA([.A98]) -> =POISSON(N86,$O$1,FALSE()) | N98: 94
A99: of:=POISSON([.N87];[.$O$1];FALSE()) -> 2.59274588557485E-155 | B99: 2.59274588557485E-155 | C99: of:=ROUND([.A99];12)=ROUND([.B99];12) -> true | D99: of:=FORMULA([.A99]) -> =POISSON(N87,$O$1,FALSE()) | N99: 95
A100: of:=POISSON([.N88];[.$O$1];FALSE()) -> 1.85196134683918E-154 | B100: 1.85196134683918E-154 | C100: of:=ROUND([.A100];12)=ROUND([.B100];12) -> true | D100: of:=FORMULA([.A100]) -> =POISSON(N88,$O$1,FALSE()) | N100: 96
A101: of:=POISSON([.N89];[.$O$1];FALSE()) -> 1.30726683306295E-153 | B101: 1.30726683306295E-153 | C101: of:=ROUND([.A101];12)=ROUND([.B101];12) -> true | D101: of:=FORMULA([.A101]) -> =POISSON(N89,$O$1,FALSE()) | N101: 97
A102: of:=POISSON([.N90];[.$O$1];FALSE()) -> 9.12046627718337E-153 | B102: 9.12046627718337E-153 | C102: of:=ROUND([.A102];12)=ROUND([.B102];12) -> true | D102: of:=FORMULA([.A102]) -> =POISSON(N90,$O$1,FALSE()) | N102: 98
A103: of:=POISSON([.N91];[.$O$1];FALSE()) -> 6.28997674288508E-152 | B103: 6.28997674288508E-152 | C103: of:=ROUND([.A103];12)=ROUND([.B103];12) -> true | D103: of:=FORMULA([.A103]) -> =POISSON(N91,$O$1,FALSE()) | N103: 99
A104: of:=POISSON([.N92];[.$O$1];FALSE()) -> 4.28862050651255E-151 | B104: 4.28862050651255E-151 | C104: of:=ROUND([.A104];12)=ROUND([.B104];12) -> true | D104: of:=FORMULA([.A104]) -> =POISSON(N92,$O$1,FALSE()) | N104: 100
A105: of:=POISSON([.N93];[.$O$1];FALSE()) -> 2.89120483585116E-150 | B105: 2.89120483585116E-150 | C105: of:=ROUND([.A105];12)=ROUND([.B105];12) -> true | D105: of:=FORMULA([.A105]) -> =POISSON(N93,$O$1,FALSE())
A106: of:=POISSON([.N94];[.$O$1];FALSE()) -> 1.92746989056744E-149 | B106: 1.92746989056744E-149 | C106: of:=ROUND([.A106];12)=ROUND([.B106];12) -> true | D106: of:=FORMULA([.A106]) -> =POISSON(N94,$O$1,FALSE())
A107: of:=POISSON([.N95];[.$O$1];FALSE()) -> 1.270859268506E-148 | B107: 1.270859268506E-148 | C107: of:=ROUND([.A107];12)=ROUND([.B107];12) -> true | D107: of:=FORMULA([.A107]) -> =POISSON(N95,$O$1,FALSE())
A108: of:=POISSON([.N96];[.$O$1];FALSE()) -> 8.28821262069133E-148 | B108: 8.28821262069133E-148 | C108: of:=ROUND([.A108];12)=ROUND([.B108];12) -> true | D108: of:=FORMULA([.A108]) -> =POISSON(N96,$O$1,FALSE())
A109: of:=POISSON([.N97];[.$O$1];FALSE()) -> 5.34723394883312E-147 | B109: 5.34723394883312E-147 | C109: of:=ROUND([.A109];12)=ROUND([.B109];12) -> true | D109: of:=FORMULA([.A109]) -> =POISSON(N97,$O$1,FALSE())
A110: of:=POISSON([.N98];[.$O$1];FALSE()) -> 3.41312805244667E-146 | B110: 3.41312805244667E-146 | C110: of:=ROUND([.A110];12)=ROUND([.B110];12) -> true | D110: of:=FORMULA([.A110]) -> =POISSON(N98,$O$1,FALSE())
A111: of:=POISSON([.N99];[.$O$1];FALSE()) -> 2.1556598225979E-145 | B111: 2.1556598225979E-145 | C111: of:=ROUND([.A111];12)=ROUND([.B111];12) -> true | D111: of:=FORMULA([.A111]) -> =POISSON(N99,$O$1,FALSE())
A112: of:=POISSON([.N100];[.$O$1];FALSE()) -> 1.34728738912369E-144 | B112: 1.34728738912369E-144 | C112: of:=ROUND([.A112];12)=ROUND([.B112];12) -> true | D112: of:=FORMULA([.A112]) -> =POISSON(N100,$O$1,FALSE())
A113: of:=POISSON([.N101];[.$O$1];FALSE()) -> 8.33373642756919E-144 | B113: 8.33373642756919E-144 | C113: of:=ROUND([.A113];12)=ROUND([.B113];12) -> true | D113: of:=FORMULA([.A113]) -> =POISSON(N101,$O$1,FALSE())
A114: of:=POISSON([.N102];[.$O$1];FALSE()) -> 5.10228760871583E-143 | B114: 5.10228760871583E-143 | C114: of:=ROUND([.A114];12)=ROUND([.B114];12) -> true | D114: of:=FORMULA([.A114]) -> =POISSON(N102,$O$1,FALSE())
A115: of:=POISSON([.N103];[.$O$1];FALSE()) -> 3.09229552043384E-142 | B115: 3.09229552043384E-142 | C115: of:=ROUND([.A115];12)=ROUND([.B115];12) -> true | D115: of:=FORMULA([.A115]) -> =POISSON(N103,$O$1,FALSE())
A116: of:=POISSON([.N104];[.$O$1];FALSE()) -> 1.8553773122603E-141 | B116: 1.8553773122603E-141 | C116: of:=ROUND([.A116];12)=ROUND([.B116];12) -> true | D116: of:=FORMULA([.A116]) -> =POISSON(N104,$O$1,FALSE())
A117: of:=POISSON([.N4];[.$O$1];TRUE()) -> 2.65039655300431E-261 | B117: 2.65039655300431E-261 | C117: of:=ROUND([.A117];12)=ROUND([.B117];12) -> true | D117: of:=FORMULA([.A117]) -> =POISSON(N4,$O$1,TRUE())
A118: of:=POISSON([.N5];[.$O$1];TRUE()) -> 1.59288832835559E-258 | B118: 1.59288832835559E-258 | C118: of:=ROUND([.A118];12)=ROUND([.B118];12) -> true | D118: of:=FORMULA([.A118]) -> =POISSON(N5,$O$1,TRUE())
A119: of:=POISSON([.N6];[.$O$1];TRUE()) -> 4.78664267869132E-256 | B119: 4.78664267869132E-256 | C119: of:=ROUND([.A119];12)=ROUND([.B119];12) -> true | D119: of:=FORMULA([.A119]) -> =POISSON(N6,$O$1,TRUE())
A120: of:=POISSON([.N7];[.$O$1];TRUE()) -> 9.58929401760243E-254 | B120: 9.58929401760243E-254 | C120: of:=ROUND([.A120];12)=ROUND([.B120];12) -> true | D120: of:=FORMULA([.A120]) -> =POISSON(N7,$O$1,TRUE())
A121: of:=POISSON([.N8];[.$O$1];TRUE()) -> 1.44080343263993E-251 | B121: 1.44080343263993E-251 | C121: of:=ROUND([.A121];12)=ROUND([.B121];12) -> true | D121: of:=FORMULA([.A121]) -> =POISSON(N8,$O$1,TRUE())
A122: of:=POISSON([.N9];[.$O$1];TRUE()) -> 1.73186500067319E-249 | B122: 1.73186500067319E-249 | C122: of:=ROUND([.A122];12)=ROUND([.B122];12) -> true | D122: of:=FORMULA([.A122]) -> =POISSON(N9,$O$1,TRUE())
A123: of:=POISSON([.N10];[.$O$1];TRUE()) -> 1.73477561635353E-247 | B123: 1.73477561635353E-247 | C123: of:=ROUND([.A123];12)=ROUND([.B123];12) -> true | D123: of:=FORMULA([.A123]) -> =POISSON(N10,$O$1,TRUE())
A124: of:=POISSON([.N11];[.$O$1];TRUE()) -> 1.48945372731793E-245 | B124: 1.48945372731793E-245 | C124: of:=ROUND([.A124];12)=ROUND([.B124];12) -> true | D124: of:=FORMULA([.A124]) -> =POISSON(N11,$O$1,TRUE())
A125: of:=POISSON([.N12];[.$O$1];TRUE()) -> 1.11897401563898E-243 | B125: 1.11897401563898E-243 | C125: of:=ROUND([.A125];12)=ROUND([.B125];12) -> true | D125: of:=FORMULA([.A125]) -> =POISSON(N12,$O$1,TRUE())
A126: of:=POISSON([.N13];[.$O$1];TRUE()) -> 7.47242725733587E-242 | B126: 7.47242725733587E-242 | C126: of:=ROUND([.A126];12)=ROUND([.B126];12) -> true | D126: of:=FORMULA([.A126]) -> =POISSON(N13,$O$1,TRUE())
A127: of:=POISSON([.N14];[.$O$1];TRUE()) -> 4.49104218603654E-240 | B127: 4.49104218603654E-240 | C127: of:=ROUND([.A127];12)=ROUND([.B127];12) -> true | D127: of:=FORMULA([.A127]) -> =POISSON(N14,$O$1,TRUE())
A128: of:=POISSON([.N15];[.$O$1];TRUE()) -> 2.45381110193119E-238 | B128: 2.45381110193119E-238 | C128: of:=ROUND([.A128];12)=ROUND([.B128];12) -> true | D128: of:=FORMULA([.A128]) -> =POISSON(N15,$O$1,TRUE())
A129: of:=POISSON([.N16];[.$O$1];TRUE()) -> 1.22898845105473E-236 | B129: 1.22898845105473E-236 | C129: of:=ROUND([.A129];12)=ROUND([.B129];12) -> true | D129: of:=FORMULA([.A129]) -> =POISSON(N16,$O$1,TRUE())
A130: of:=POISSON([.N17];[.$O$1];TRUE()) -> 5.68190041449969E-235 | B130: 5.68190041449969E-235 | C130: of:=ROUND([.A130];12)=ROUND([.B130];12) -> true | D130: of:=FORMULA([.A130]) -> =POISSON(N17,$O$1,TRUE())
A131: of:=POISSON([.N18];[.$O$1];TRUE()) -> 2.43924824817109E-233 | B131: 2.43924824817109E-233 | C131: of:=ROUND([.A131];12)=ROUND([.B131];12) -> true | D131: of:=FORMULA([.A131]) -> =POISSON(N18,$O$1,TRUE())
A132: of:=POISSON([.N19];[.$O$1];TRUE()) -> 9.77364180092148E-232 | B132: 9.77364180092148E-232 | C132: of:=ROUND([.A132];12)=ROUND([.B132];12) -> true | D132: of:=FORMULA([.A132]) -> =POISSON(N19,$O$1,TRUE())
A133: of:=POISSON([.N20];[.$O$1];TRUE()) -> 3.67138028404835E-230 | B133: 3.67138028404835E-230 | C133: of:=ROUND([.A133];12)=ROUND([.B133];12) -> true | D133: of:=FORMULA([.A133]) -> =POISSON(N20,$O$1,TRUE())
A134: of:=POISSON([.N21];[.$O$1];TRUE()) -> 1.29799987320724E-228 | B134: 1.29799987320724E-228 | C134: of:=ROUND([.A134];12)=ROUND([.B134];12) -> true | D134: of:=FORMULA([.A134]) -> =POISSON(N21,$O$1,TRUE())
A135: of:=POISSON([.N22];[.$O$1];TRUE()) -> 4.33408688854324E-227 | B135: 4.33408688854324E-227 | C135: of:=ROUND([.A135];12)=ROUND([.B135];12) -> true | D135: of:=FORMULA([.A135]) -> =POISSON(N22,$O$1,TRUE())
A136: of:=POISSON([.N23];[.$O$1];TRUE()) -> 1.37101041663991E-225 | B136: 1.37101041663991E-225 | C136: of:=ROUND([.A136];12)=ROUND([.B136];12) -> true | D136: of:=FORMULA([.A136]) -> =POISSON(N23,$O$1,TRUE())
A137: of:=POISSON([.N24];[.$O$1];TRUE()) -> 4.12010968492743E-224 | B137: 4.12010968492743E-224 | C137: of:=ROUND([.A137];12)=ROUND([.B137];12) -> true | D137: of:=FORMULA([.A137]) -> =POISSON(N24,$O$1,TRUE())
A138: of:=POISSON([.N25];[.$O$1];TRUE()) -> 1.17920356635311E-222 | B138: 1.17920356635311E-222 | C138: of:=ROUND([.A138];12)=ROUND([.B138];12) -> true | D138: of:=FORMULA([.A138]) -> =POISSON(N25,$O$1,TRUE())
A139: of:=POISSON([.N26];[.$O$1];TRUE()) -> 3.22156345528214E-221 | B139: 3.22156345528214E-221 | C139: of:=ROUND([.A139];12)=ROUND([.B139];12) -> true | D139: of:=FORMULA([.A139]) -> =POISSON(N26,$O$1,TRUE())
A140: of:=POISSON([.N27];[.$O$1];TRUE()) -> 8.41861660286778E-220 | B140: 8.41861660286778E-220 | C140: of:=ROUND([.A140];12)=ROUND([.B140];12) -> true | D140: of:=FORMULA([.A140]) -> =POISSON(N27,$O$1,TRUE())
A141: of:=POISSON([.N28];[.$O$1];TRUE()) -> 2.10830123036357E-218 | B141: 2.10830123036357E-218 | C141: of:=ROUND([.A141];12)=ROUND([.B141];12) -> true | D141: of:=FORMULA([.A141]) -> =POISSON(N28,$O$1,TRUE())
A142: of:=POISSON([.N29];[.$O$1];TRUE()) -> 5.0687062774401E-217 | B142: 5.0687062774401E-217 | C142: of:=ROUND([.A142];12)=ROUND([.B142];12) -> true | D142: of:=FORMULA([.A142]) -> =POISSON(N29,$O$1,TRUE())
A143: of:=POISSON([.N30];[.$O$1];TRUE()) -> 1.17173540609834E-215 | B143: 1.17173540609834E-215 | C143: of:=ROUND([.A143];12)=ROUND([.B143];12) -> true | D143: of:=FORMULA([.A143]) -> =POISSON(N30,$O$1,TRUE())
A144: of:=POISSON([.N31];[.$O$1];TRUE()) -> 2.6083920813297E-214 | B144: 2.6083920813297E-214 | C144: of:=ROUND([.A144];12)=ROUND([.B144];12) -> true | D144: of:=FORMULA([.A144]) -> =POISSON(N31,$O$1,TRUE())
A145: of:=POISSON([.N32];[.$O$1];TRUE()) -> 5.59916465253269E-213 | B145: 5.59916465253269E-213 | C145: of:=ROUND([.A145];12)=ROUND([.B145];12) -> true | D145: of:=FORMULA([.A145]) -> =POISSON(N32,$O$1,TRUE())
A146: of:=POISSON([.N33];[.$O$1];TRUE()) -> 1.16047277295285E-211 | B146: 1.16047277295285E-211 | C146: of:=ROUND([.A146];12)=ROUND([.B146];12) -> true | D146: of:=FORMULA([.A146]) -> =POISSON(N33,$O$1,TRUE())
A147: of:=POISSON([.N34];[.$O$1];TRUE()) -> 2.32500953015034E-210 | B147: 2.32500953015034E-210 | C147: of:=ROUND([.A147];12)=ROUND([.B147];12) -> true | D147: of:=FORMULA([.A147]) -> =POISSON(N34,$O$1,TRUE())
A148: of:=POISSON([.N35];[.$O$1];TRUE()) -> 4.50791176499256E-209 | B148: 4.50791176499256E-209 | C148: of:=ROUND([.A148];12)=ROUND([.B148];12) -> true | D148: of:=FORMULA([.A148]) -> =POISSON(N35,$O$1,TRUE())
A149: of:=POISSON([.N36];[.$O$1];TRUE()) -> 8.46718644895711E-208 | B149: 8.46718644895711E-208 | C149: of:=ROUND([.A149];12)=ROUND([.B149];12) -> true | D149: of:=FORMULA([.A149]) -> =POISSON(N36,$O$1,TRUE())
A150: of:=POISSON([.N37];[.$O$1];TRUE()) -> 1.54219827766373E-206 | B150: 1.54219827766373E-206 | C150: of:=ROUND([.A150];12)=ROUND([.B150];12) -> true | D150: of:=FORMULA([.A150]) -> =POISSON(N37,$O$1,TRUE())
A151: of:=POISSON([.N38];[.$O$1];TRUE()) -> 2.72632526277959E-205 | B151: 2.72632526277959E-205 | C151: of:=ROUND([.A151];12)=ROUND([.B151];12) -> true | D151: of:=FORMULA([.A151]) -> =POISSON(N38,$O$1,TRUE())
A152: of:=POISSON([.N39];[.$O$1];TRUE()) -> 4.68195612915776E-204 | B152: 4.68195612915776E-204 | C152: of:=ROUND([.A152];12)=ROUND([.B152];12) -> true | D152: of:=FORMULA([.A152]) -> =POISSON(N39,$O$1,TRUE())
A153: of:=POISSON([.N40];[.$O$1];TRUE()) -> 7.81706828438211E-203 | B153: 7.81706828438211E-203 | C153: of:=ROUND([.A153];12)=ROUND([.B153];12) -> true | D153: of:=FORMULA([.A153]) -> =POISSON(N40,$O$1,TRUE())
A154: of:=POISSON([.N41];[.$O$1];TRUE()) -> 1.26987976470323E-201 | B154: 1.26987976470323E-201 | C154: of:=ROUND([.A154];12)=ROUND([.B154];12) -> true | D154: of:=FORMULA([.A154]) -> =POISSON(N41,$O$1,TRUE())
A155: of:=POISSON([.N42];[.$O$1];TRUE()) -> 2.0086338951957E-200 | B155: 2.0086338951957E-200 | C155: of:=ROUND([.A155];12)=ROUND([.B155];12) -> true | D155: of:=FORMULA([.A155]) -> =POISSON(N42,$O$1,TRUE())
A156: of:=POISSON([.N43];[.$O$1];TRUE()) -> 3.09570326448169E-199 | B156: 3.09570326448169E-199 | C156: of:=ROUND([.A156];12)=ROUND([.B156];12) -> true | D156: of:=FORMULA([.A156]) -> =POISSON(N43,$O$1,TRUE())
A157: of:=POISSON([.N44];[.$O$1];TRUE()) -> 4.65183013889135E-198 | B157: 4.65183013889135E-198 | C157: of:=ROUND([.A157];12)=ROUND([.B157];12) -> true | D157: of:=FORMULA([.A157]) -> =POISSON(N44,$O$1,TRUE())
A158: of:=POISSON([.N45];[.$O$1];TRUE()) -> 6.81970956868403E-197 | B158: 6.81970956868403E-197 | C158: of:=ROUND([.A158];12)=ROUND([.B158];12) -> true | D158: of:=FORMULA([.A158]) -> =POISSON(N45,$O$1,TRUE())
A159: of:=POISSON([.N46];[.$O$1];TRUE()) -> 9.75986603514682E-196 | B159: 9.75986603514682E-196 | C159: of:=ROUND([.A159];12)=ROUND([.B159];12) -> true | D159: of:=FORMULA([.A159]) -> =POISSON(N46,$O$1,TRUE())
A160: of:=POISSON([.N47];[.$O$1];TRUE()) -> 1.36428169452985E-194 | B160: 1.36428169452985E-194 | C160: of:=ROUND([.A160];12)=ROUND([.B160];12) -> true | D160: of:=FORMULA([.A160]) -> =POISSON(N47,$O$1,TRUE())
A161: of:=POISSON([.N48];[.$O$1];TRUE()) -> 1.86372321605987E-193 | B161: 1.86372321605987E-193 | C161: of:=ROUND([.A161];12)=ROUND([.B161];12) -> true | D161: of:=FORMULA([.A161]) -> =POISSON(N48,$O$1,TRUE())
A162: of:=POISSON([.N49];[.$O$1];TRUE()) -> 2.4894323837485E-192 | B162: 2.4894323837485E-192 | C162: of:=ROUND([.A162];12)=ROUND([.B162];12) -> true | D162: of:=FORMULA([.A162]) -> =POISSON(N49,$O$1,TRUE())
A163: of:=POISSON([.N50];[.$O$1];TRUE()) -> 3.25293462377813E-191 | B163: 3.25293462377813E-191 | C163: of:=ROUND([.A163];12)=ROUND([.B163];12) -> true | D163: of:=FORMULA([.A163]) -> =POISSON(N50,$O$1,TRUE())
A164: of:=POISSON([.N51];[.$O$1];TRUE()) -> 4.16017608204158E-190 | B164: 4.16017608204158E-190 | C164: of:=ROUND([.A164];12)=ROUND([.B164];12) -> true | D164: of:=FORMULA([.A164]) -> =POISSON(N51,$O$1,TRUE())
A165: of:=POISSON([.N52];[.$O$1];TRUE()) -> 5.20962088278386E-189 | B165: 5.20962088278386E-189 | C165: of:=ROUND([.A165];12)=ROUND([.B165];12) -> true | D165: of:=FORMULA([.A165]) -> =POISSON(N52,$O$1,TRUE())
A166: of:=POISSON([.N53];[.$O$1];TRUE()) -> 6.39068038368211E-188 | B166: 6.39068038368211E-188 | C166: of:=ROUND([.A166];12)=ROUND([.B166];12) -> true | D166: of:=FORMULA([.A166]) -> =POISSON(N53,$O$1,TRUE())
A167: of:=POISSON([.N54];[.$O$1];TRUE()) -> 7.68272999285268E-187 | B167: 7.68272999285268E-187 | C167: of:=ROUND([.A167];12)=ROUND([.B167];12) -> true | D167: of:=FORMULA([.A167]) -> =POISSON(N54,$O$1,TRUE())
A168: of:=POISSON([.N55];[.$O$1];TRUE()) -> 9.05493412220817E-186 | B168: 9.05493412220817E-186 | C168: of:=ROUND([.A168];12)=ROUND([.B168];12) -> true | D168: of:=FORMULA([.A168]) -> =POISSON(N55,$O$1,TRUE())
A169: of:=POISSON([.N56];[.$O$1];TRUE()) -> 1.04670254771319E-184 | B169: 1.04670254771319E-184 | C169: of:=ROUND([.A169];12)=ROUND([.B169];12) -> true | D169: of:=FORMULA([.A169]) -> =POISSON(N56,$O$1,TRUE())
A170: of:=POISSON([.N57];[.$O$1];TRUE()) -> 1.1871078470254E-183 | B170: 1.1871078470254E-183 | C170: of:=ROUND([.A170];12)=ROUND([.B170];12) -> true | D170: of:=FORMULA([.A170]) -> =POISSON(N57,$O$1,TRUE())
A171: of:=POISSON([.N58];[.$O$1];TRUE()) -> 1.32141922054041E-182 | B171: 1.32141922054041E-182 | C171: of:=ROUND([.A171];12)=ROUND([.B171];12) -> true | D171: of:=FORMULA([.A171]) -> =POISSON(N58,$O$1,TRUE())
A172: of:=POISSON([.N59];[.$O$1];TRUE()) -> 1.44418748842262E-181 | B172: 1.44418748842262E-181 | C172: of:=ROUND([.A172];12)=ROUND([.B172];12) -> true | D172: of:=FORMULA([.A172]) -> =POISSON(N59,$O$1,TRUE())
A173: of:=POISSON([.N60];[.$O$1];TRUE()) -> 1.55018185566574E-180 | B173: 1.55018185566574E-180 | C173: of:=ROUND([.A173];12)=ROUND([.B173];12) -> true | D173: of:=FORMULA([.A173]) -> =POISSON(N60,$O$1,TRUE())
A174: of:=POISSON([.N61];[.$O$1];TRUE()) -> 1.63476882432813E-179 | B174: 1.63476882432813E-179 | C174: of:=ROUND([.A174];12)=ROUND([.B174];12) -> true | D174: of:=FORMULA([.A174]) -> =POISSON(N61,$O$1,TRUE())
A175: of:=POISSON([.N62];[.$O$1];TRUE()) -> 1.6942534052896E-178 | B175: 1.6942534052896E-178 | C175: of:=ROUND([.A175];12)=ROUND([.B175];12) -> true | D175: of:=FORMULA([.A175]) -> =POISSON(N62,$O$1,TRUE())
A176: of:=POISSON([.N63];[.$O$1];TRUE()) -> 1.72614722817993E-177 | B176: 1.72614722817993E-177 | C176: of:=ROUND([.A176];12)=ROUND([.B176];12) -> true | D176: of:=FORMULA([.A176]) -> =POISSON(N63,$O$1,TRUE())
A177: of:=POISSON([.N64];[.$O$1];TRUE()) -> 1.72933661046896E-176 | B177: 1.72933661046896E-176 | C177: of:=ROUND([.A177];12)=ROUND([.B177];12) -> true | D177: of:=FORMULA([.A177]) -> =POISSON(N64,$O$1,TRUE())
A178: of:=POISSON([.N65];[.$O$1];TRUE()) -> 1.70413551775277E-175 | B178: 1.70413551775277E-175 | C178: of:=ROUND([.A178];12)=ROUND([.B178];12) -> true | D178: of:=FORMULA([.A178]) -> =POISSON(N65,$O$1,TRUE())
A179: of:=POISSON([.N66];[.$O$1];TRUE()) -> 1.65222180020031E-174 | B179: 1.65222180020031E-174 | C179: of:=ROUND([.A179];12)=ROUND([.B179];12) -> true | D179: of:=FORMULA([.A179]) -> =POISSON(N66,$O$1,TRUE())
A180: of:=POISSON([.N67];[.$O$1];TRUE()) -> 1.57646813090102E-173 | B180: 1.57646813090102E-173 | C180: of:=ROUND([.A180];12)=ROUND([.B180];12) -> true | D180: of:=FORMULA([.A180]) -> =POISSON(N67,$O$1,TRUE())
A181: of:=POISSON([.N68];[.$O$1];TRUE()) -> 1.48068989204103E-172 | B181: 1.48068989204103E-172 | C181: of:=ROUND([.A181];12)=ROUND([.B181];12) -> true | D181: of:=FORMULA([.A181]) -> =POISSON(N68,$O$1,TRUE())
A182: of:=POISSON([.N69];[.$O$1];TRUE()) -> 1.36933952362034E-171 | B182: 1.36933952362034E-171 | C182: of:=ROUND([.A182];12)=ROUND([.B182];12) -> true | D182: of:=FORMULA([.A182]) -> =POISSON(N69,$O$1,TRUE())
A183: of:=POISSON([.N70];[.$O$1];TRUE()) -> 1.24717989274043E-170 | B183: 1.24717989274043E-170 | C183: of:=ROUND([.A183];12)=ROUND([.B183];12) -> true | D183: of:=FORMULA([.A183]) -> =POISSON(N70,$O$1,TRUE())
A184: of:=POISSON([.N71];[.$O$1];TRUE()) -> 1.11896808513529E-169 | B184: 1.11896808513529E-169 | C184: of:=ROUND([.A184];12)=ROUND([.B184];12) -> true | D184: of:=FORMULA([.A184]) -> =POISSON(N71,$O$1,TRUE())
A185: of:=POISSON([.N72];[.$O$1];TRUE()) -> 9.89176304861693E-169 | B185: 9.89176304861693E-169 | C185: of:=ROUND([.A185];12)=ROUND([.B185];12) -> true | D185: of:=FORMULA([.A185]) -> =POISSON(N72,$O$1,TRUE())
A186: of:=POISSON([.N73];[.$O$1];TRUE()) -> 8.61769366441094E-168 | B186: 8.61769366441094E-168 | C186: of:=ROUND([.A186];12)=ROUND([.B186];12) -> true | D186: of:=FORMULA([.A186]) -> =POISSON(N73,$O$1,TRUE())
A187: of:=POISSON([.N74];[.$O$1];TRUE()) -> 7.40049853176902E-167 | B187: 7.40049853176902E-167 | C187: of:=ROUND([.A187];12)=ROUND([.B187];12) -> true | D187: of:=FORMULA([.A187]) -> =POISSON(N74,$O$1,TRUE())
A188: of:=POISSON([.N75];[.$O$1];TRUE()) -> 6.26573647176388E-166 | B188: 6.26573647176388E-166 | C188: of:=ROUND([.A188];12)=ROUND([.B188];12) -> true | D188: of:=FORMULA([.A188]) -> =POISSON(N75,$O$1,TRUE())
A189: of:=POISSON([.N76];[.$O$1];TRUE()) -> 5.23131249599887E-165 | B189: 5.23131249599887E-165 | C189: of:=ROUND([.A189];12)=ROUND([.B189];12) -> true | D189: of:=FORMULA([.A189]) -> =POISSON(N76,$O$1,TRUE())
A190: of:=POISSON([.N77];[.$O$1];TRUE()) -> 4.30784811164576E-164 | B190: 4.30784811164576E-164 | C190: of:=ROUND([.A190];12)=ROUND([.B190];12) -> true | D190: of:=FORMULA([.A190]) -> =POISSON(N77,$O$1,TRUE())
A191: of:=POISSON([.N78];[.$O$1];TRUE()) -> 3.49947415876934E-163 | B191: 3.49947415876934E-163 | C191: of:=ROUND([.A191];12)=ROUND([.B191];12) -> true | D191: of:=FORMULA([.A191]) -> =POISSON(N78,$O$1,TRUE())
A192: of:=POISSON([.N79];[.$O$1];TRUE()) -> 2.80489889396075E-162 | B192: 2.80489889396075E-162 | C192: of:=ROUND([.A192];12)=ROUND([.B192];12) -> true | D192: of:=FORMULA([.A192]) -> =POISSON(N79,$O$1,TRUE())
A193: of:=POISSON([.N80];[.$O$1];TRUE()) -> 2.21860947735698E-161 | B193: 2.21860947735698E-161 | C193: of:=ROUND([.A193];12)=ROUND([.B193];12) -> true | D193: of:=FORMULA([.A193]) -> =POISSON(N80,$O$1,TRUE())
A194: of:=POISSON([.N81];[.$O$1];TRUE()) -> 1.73208400328965E-160 | B194: 1.73208400328965E-160 | C194: of:=ROUND([.A194];12)=ROUND([.B194];12) -> true | D194: of:=FORMULA([.A194]) -> =POISSON(N81,$O$1,TRUE())
A195: of:=POISSON([.N82];[.$O$1];TRUE()) -> 1.33491844306277E-159 | B195: 1.33491844306277E-159 | C195: of:=ROUND([.A195];12)=ROUND([.B195];12) -> true | D195: of:=FORMULA([.A195]) -> =POISSON(N82,$O$1,TRUE())
A196: of:=POISSON([.N83];[.$O$1];TRUE()) -> 1.0158032691674E-158 | B196: 1.0158032691674E-158 | C196: of:=ROUND([.A196];12)=ROUND([.B196];12) -> true | D196: of:=FORMULA([.A196]) -> =POISSON(N83,$O$1,TRUE())
A197: of:=POISSON([.N84];[.$O$1];TRUE()) -> 7.6331389556258E-158 | B197: 7.6331389556258E-158 | C197: of:=ROUND([.A197];12)=ROUND([.B197];12) -> true | D197: of:=FORMULA([.A197]) -> =POISSON(N84,$O$1,TRUE())
A198: of:=POISSON([.N85];[.$O$1];TRUE()) -> 5.66504403367992E-157 | B198: 5.66504403367992E-157 | C198: of:=ROUND([.A198];12)=ROUND([.B198];12) -> true | D198: of:=FORMULA([.A198]) -> =POISSON(N85,$O$1,TRUE())
A199: of:=POISSON([.N86];[.$O$1];TRUE()) -> 4.15313621174653E-156 | B199: 4.15313621174653E-156 | C199: of:=ROUND([.A199];12)=ROUND([.B199];12) -> true | D199: of:=FORMULA([.A199]) -> =POISSON(N86,$O$1,TRUE())
A200: of:=POISSON([.N87];[.$O$1];TRUE()) -> 3.0080595067495E-155 | B200: 3.0080595067495E-155 | C200: of:=ROUND([.A200];12)=ROUND([.B200];12) -> true | D200: of:=FORMULA([.A200]) -> =POISSON(N87,$O$1,TRUE())
A201: of:=POISSON([.N88];[.$O$1];TRUE()) -> 2.15276729751413E-154 | B201: 2.15276729751413E-154 | C201: of:=ROUND([.A201];12)=ROUND([.B201];12) -> true | D201: of:=FORMULA([.A201]) -> =POISSON(N88,$O$1,TRUE())
A202: of:=POISSON([.N89];[.$O$1];TRUE()) -> 1.52254356281436E-153 | B202: 1.52254356281436E-153 | C202: of:=ROUND([.A202];12)=ROUND([.B202];12) -> true | D202: of:=FORMULA([.A202]) -> =POISSON(N89,$O$1,TRUE())
A203: of:=POISSON([.N90];[.$O$1];TRUE()) -> 1.06430098399977E-152 | B203: 1.06430098399977E-152 | C203: of:=ROUND([.A203];12)=ROUND([.B203];12) -> true | D203: of:=FORMULA([.A203]) -> =POISSON(N90,$O$1,TRUE())
A204: of:=POISSON([.N91];[.$O$1];TRUE()) -> 7.35427772688485E-152 | B204: 7.35427772688485E-152 | C204: of:=ROUND([.A204];12)=ROUND([.B204];12) -> true | D204: of:=FORMULA([.A204]) -> =POISSON(N91,$O$1,TRUE())
A205: of:=POISSON([.N92];[.$O$1];TRUE()) -> 5.02404827920104E-151 | B205: 5.02404827920104E-151 | C205: of:=ROUND([.A205];12)=ROUND([.B205];12) -> true | D205: of:=FORMULA([.A205]) -> =POISSON(N92,$O$1,TRUE())
A206: of:=POISSON([.N93];[.$O$1];TRUE()) -> 3.39360966377126E-150 | B206: 3.39360966377126E-150 | C206: of:=ROUND([.A206];12)=ROUND([.B206];12) -> true | D206: of:=FORMULA([.A206]) -> =POISSON(N93,$O$1,TRUE())
A207: of:=POISSON([.N94];[.$O$1];TRUE()) -> 2.26683085694456E-149 | B207: 2.26683085694456E-149 | C207: of:=ROUND([.A207];12)=ROUND([.B207];12) -> true | D207: of:=FORMULA([.A207]) -> =POISSON(N94,$O$1,TRUE())
A208: of:=POISSON([.N95];[.$O$1];TRUE()) -> 1.49754235420046E-148 | B208: 1.49754235420046E-148 | C208: of:=ROUND([.A208];12)=ROUND([.B208];12) -> true | D208: of:=FORMULA([.A208]) -> =POISSON(N95,$O$1,TRUE())
A209: of:=POISSON([.N96];[.$O$1];TRUE()) -> 9.78575497489179E-148 | B209: 9.78575497489179E-148 | C209: of:=ROUND([.A209];12)=ROUND([.B209];12) -> true | D209: of:=FORMULA([.A209]) -> =POISSON(N96,$O$1,TRUE())
A210: of:=POISSON([.N97];[.$O$1];TRUE()) -> 6.32580944632229E-147 | B210: 6.32580944632229E-147 | C210: of:=ROUND([.A210];12)=ROUND([.B210];12) -> true | D210: of:=FORMULA([.A210]) -> =POISSON(N97,$O$1,TRUE())
A211: of:=POISSON([.N98];[.$O$1];TRUE()) -> 4.0457089970789E-146 | B211: 4.0457089970789E-146 | C211: of:=ROUND([.A211];12)=ROUND([.B211];12) -> true | D211: of:=FORMULA([.A211]) -> =POISSON(N98,$O$1,TRUE())
A212: of:=POISSON([.N99];[.$O$1];TRUE()) -> 2.56023072230579E-145 | B212: 2.56023072230579E-145 | C212: of:=ROUND([.A212];12)=ROUND([.B212];12) -> true | D212: of:=FORMULA([.A212]) -> =POISSON(N99,$O$1,TRUE())
A213: of:=POISSON([.N100];[.$O$1];TRUE()) -> 1.60331046135426E-144 | B213: 1.60331046135426E-144 | C213: of:=ROUND([.A213];12)=ROUND([.B213];12) -> true | D213: of:=FORMULA([.A213]) -> =POISSON(N100,$O$1,TRUE())
A214: of:=POISSON([.N101];[.$O$1];TRUE()) -> 9.93704688892345E-144 | B214: 9.93704688892345E-144 | C214: of:=ROUND([.A214];12)=ROUND([.B214];12) -> true | D214: of:=FORMULA([.A214]) -> =POISSON(N101,$O$1,TRUE())
A215: of:=POISSON([.N102];[.$O$1];TRUE()) -> 6.09599229760817E-143 | B215: 6.09599229760817E-143 | C215: of:=ROUND([.A215];12)=ROUND([.B215];12) -> true | D215: of:=FORMULA([.A215]) -> =POISSON(N102,$O$1,TRUE())
A216: of:=POISSON([.N103];[.$O$1];TRUE()) -> 3.70189475019465E-142 | B216: 3.70189475019465E-142 | C216: of:=ROUND([.A216];12)=ROUND([.B216];12) -> true | D216: of:=FORMULA([.A216]) -> =POISSON(N103,$O$1,TRUE())
A217: of:=POISSON([.N104];[.$O$1];TRUE()) -> 2.22556678727977E-141 | B217: 2.22556678727977E-141 | C217: of:=ROUND([.A217];12)=ROUND([.B217];12) -> true | D217: of:=FORMULA([.A217]) -> =POISSON(N104,$O$1,TRUE())
A218: of:=POISSON([.U4];[.$V$1];FALSE()) -> 0 | B218: 0 | C218: of:=ROUND([.A218];12)=ROUND([.B218];12) -> true | D218: of:=FORMULA([.A218]) -> =POISSON(U4,$V$1,FALSE())
A219: of:=POISSON([.U5];[.$V$1];FALSE()) -> 0 | B219: 0 | C219: of:=ROUND([.A219];12)=ROUND([.B219];12) -> true | D219: of:=FORMULA([.A219]) -> =POISSON(U5,$V$1,FALSE())
A220: of:=POISSON([.U6];[.$V$1];FALSE()) -> 0 | B220: 0 | C220: of:=ROUND([.A220];12)=ROUND([.B220];12) -> true | D220: of:=FORMULA([.A220]) -> =POISSON(U6,$V$1,FALSE())
A221: of:=POISSON([.U4];[.$V$1];TRUE()) -> 0 | B221: 0 | C221: of:=ROUND([.A221];12)=ROUND([.B221];12) -> true | D221: of:=FORMULA([.A221]) -> =POISSON(U4,$V$1,TRUE())
A222: of:=POISSON([.U5];[.$V$1];TRUE()) -> 0 | B222: 0 | C222: of:=ROUND([.A222];12)=ROUND([.B222];12) -> true | D222: of:=FORMULA([.A222]) -> =POISSON(U5,$V$1,TRUE())
A223: of:=POISSON([.U6];[.$V$1];TRUE()) -> 0 | B223: 0 | C223: of:=ROUND([.A223];12)=ROUND([.B223];12) -> true | D223: of:=FORMULA([.A223]) -> =POISSON(U6,$V$1,TRUE())
A224: of:=POISSON([.U552];[.$V$1];FALSE()) -> 0 | B224: 0 | C224: of:=ROUND([.A224];12)=ROUND([.B224];12) -> true | D224: of:=FORMULA([.A224]) -> =POISSON(U552,$V$1,FALSE())
A225: of:=POISSON([.U553];[.$V$1];FALSE()) -> 0 | B225: 0 | C225: of:=ROUND([.A225];12)=ROUND([.B225];12) -> true | D225: of:=FORMULA([.A225]) -> =POISSON(U553,$V$1,FALSE())
A226: of:=POISSON([.U554];[.$V$1];FALSE()) -> 0 | B226: 0 | C226: of:=ROUND([.A226];12)=ROUND([.B226];12) -> true | D226: of:=FORMULA([.A226]) -> =POISSON(U554,$V$1,FALSE())
A227: of:=POISSON([.U555];[.$V$1];FALSE()) -> 0 | B227: 0 | C227: of:=ROUND([.A227];12)=ROUND([.B227];12) -> true | D227: of:=FORMULA([.A227]) -> =POISSON(U555,$V$1,FALSE())
A228: of:=POISSON([.U556];[.$V$1];FALSE()) -> 0 | B228: 0 | C228: of:=ROUND([.A228];12)=ROUND([.B228];12) -> true | D228: of:=FORMULA([.A228]) -> =POISSON(U556,$V$1,FALSE())
A229: of:=POISSON([.U557];[.$V$1];FALSE()) -> 0 | B229: 0 | C229: of:=ROUND([.A229];12)=ROUND([.B229];12) -> true | D229: of:=FORMULA([.A229]) -> =POISSON(U557,$V$1,FALSE())
A230: of:=POISSON([.U558];[.$V$1];FALSE()) -> 0 | B230: 0 | C230: of:=ROUND([.A230];12)=ROUND([.B230];12) -> true | D230: of:=FORMULA([.A230]) -> =POISSON(U558,$V$1,FALSE())
A231: of:=POISSON([.U559];[.$V$1];FALSE()) -> 0 | B231: 0 | C231: of:=ROUND([.A231];12)=ROUND([.B231];12) -> true | D231: of:=FORMULA([.A231]) -> =POISSON(U559,$V$1,FALSE())
A232: of:=POISSON([.U560];[.$V$1];FALSE()) -> 0 | B232: 0 | C232: of:=ROUND([.A232];12)=ROUND([.B232];12) -> true | D232: of:=FORMULA([.A232]) -> =POISSON(U560,$V$1,FALSE())
A233: of:=POISSON([.U561];[.$V$1];FALSE()) -> 0 | B233: 0 | C233: of:=ROUND([.A233];12)=ROUND([.B233];12) -> true | D233: of:=FORMULA([.A233]) -> =POISSON(U561,$V$1,FALSE())
A234: of:=POISSON([.U562];[.$V$1];FALSE()) -> 0 | B234: 0 | C234: of:=ROUND([.A234];12)=ROUND([.B234];12) -> true | D234: of:=FORMULA([.A234]) -> =POISSON(U562,$V$1,FALSE())
A235: of:=POISSON([.U563];[.$V$1];FALSE()) -> 0 | B235: 0 | C235: of:=ROUND([.A235];12)=ROUND([.B235];12) -> true | D235: of:=FORMULA([.A235]) -> =POISSON(U563,$V$1,FALSE())
A236: of:=POISSON([.U564];[.$V$1];FALSE()) -> 0 | B236: 0 | C236: of:=ROUND([.A236];12)=ROUND([.B236];12) -> true | D236: of:=FORMULA([.A236]) -> =POISSON(U564,$V$1,FALSE())
A237: of:=POISSON([.U565];[.$V$1];FALSE()) -> 0 | B237: 0 | C237: of:=ROUND([.A237];12)=ROUND([.B237];12) -> true | D237: of:=FORMULA([.A237]) -> =POISSON(U565,$V$1,FALSE())
A238: of:=POISSON([.U566];[.$V$1];FALSE()) -> 0 | B238: 0 | C238: of:=ROUND([.A238];12)=ROUND([.B238];12) -> true | D238: of:=FORMULA([.A238]) -> =POISSON(U566,$V$1,FALSE())
A239: of:=POISSON([.U567];[.$V$1];FALSE()) -> 0 | B239: 0 | C239: of:=ROUND([.A239];12)=ROUND([.B239];12) -> true | D239: of:=FORMULA([.A239]) -> =POISSON(U567,$V$1,FALSE())
A240: of:=POISSON([.U568];[.$V$1];FALSE()) -> 0 | B240: 0 | C240: of:=ROUND([.A240];12)=ROUND([.B240];12) -> true | D240: of:=FORMULA([.A240]) -> =POISSON(U568,$V$1,FALSE())
A241: of:=POISSON([.U569];[.$V$1];FALSE()) -> 0 | B241: 0 | C241: of:=ROUND([.A241];12)=ROUND([.B241];12) -> true | D241: of:=FORMULA([.A241]) -> =POISSON(U569,$V$1,FALSE())
A242: of:=POISSON([.U570];[.$V$1];FALSE()) -> 0 | B242: 0 | C242: of:=ROUND([.A242];12)=ROUND([.B242];12) -> true | D242: of:=FORMULA([.A242]) -> =POISSON(U570,$V$1,FALSE())
A243: of:=POISSON([.U571];[.$V$1];FALSE()) -> 0 | B243: 0 | C243: of:=ROUND([.A243];12)=ROUND([.B243];12) -> true | D243: of:=FORMULA([.A243]) -> =POISSON(U571,$V$1,FALSE())
A244: of:=POISSON([.U572];[.$V$1];FALSE()) -> 0 | B244: 0 | C244: of:=ROUND([.A244];12)=ROUND([.B244];12) -> true | D244: of:=FORMULA([.A244]) -> =POISSON(U572,$V$1,FALSE())
A245: of:=POISSON([.U573];[.$V$1];FALSE()) -> 0 | B245: 0 | C245: of:=ROUND([.A245];12)=ROUND([.B245];12) -> true | D245: of:=FORMULA([.A245]) -> =POISSON(U573,$V$1,FALSE())
A246: of:=POISSON([.U574];[.$V$1];FALSE()) -> 0 | B246: 0 | C246: of:=ROUND([.A246];12)=ROUND([.B246];12) -> true | D246: of:=FORMULA([.A246]) -> =POISSON(U574,$V$1,FALSE())
A247: of:=POISSON([.U575];[.$V$1];FALSE()) -> 0 | B247: 0 | C247: of:=ROUND([.A247];12)=ROUND([.B247];12) -> true | D247: of:=FORMULA([.A247]) -> =POISSON(U575,$V$1,FALSE())
A248: of:=POISSON([.U576];[.$V$1];FALSE()) -> 0 | B248: 0 | C248: of:=ROUND([.A248];12)=ROUND([.B248];12) -> true | D248: of:=FORMULA([.A248]) -> =POISSON(U576,$V$1,FALSE())
A249: of:=POISSON([.U577];[.$V$1];FALSE()) -> 0 | B249: 0 | C249: of:=ROUND([.A249];12)=ROUND([.B249];12) -> true | D249: of:=FORMULA([.A249]) -> =POISSON(U577,$V$1,FALSE())
A250: of:=POISSON([.U578];[.$V$1];FALSE()) -> 0 | B250: 0 | C250: of:=ROUND([.A250];12)=ROUND([.B250];12) -> true | D250: of:=FORMULA([.A250]) -> =POISSON(U578,$V$1,FALSE())
A251: of:=POISSON([.U579];[.$V$1];FALSE()) -> 0 | B251: 0 | C251: of:=ROUND([.A251];12)=ROUND([.B251];12) -> true | D251: of:=FORMULA([.A251]) -> =POISSON(U579,$V$1,FALSE())
A252: of:=POISSON([.U580];[.$V$1];FALSE()) -> 0 | B252: 0 | C252: of:=ROUND([.A252];12)=ROUND([.B252];12) -> true | D252: of:=FORMULA([.A252]) -> =POISSON(U580,$V$1,FALSE())
A253: of:=POISSON([.U581];[.$V$1];FALSE()) -> 0 | B253: 0 | C253: of:=ROUND([.A253];12)=ROUND([.B253];12) -> true | D253: of:=FORMULA([.A253]) -> =POISSON(U581,$V$1,FALSE())
A254: of:=POISSON([.U582];[.$V$1];FALSE()) -> 0 | B254: 0 | C254: of:=ROUND([.A254];12)=ROUND([.B254];12) -> true | D254: of:=FORMULA([.A254]) -> =POISSON(U582,$V$1,FALSE())
A255: of:=POISSON([.U583];[.$V$1];FALSE()) -> 0 | B255: 0 | C255: of:=ROUND([.A255];12)=ROUND([.B255];12) -> true | D255: of:=FORMULA([.A255]) -> =POISSON(U583,$V$1,FALSE())
A256: of:=POISSON([.U584];[.$V$1];FALSE()) -> 2.13860504207216E-307 | B256: 2.13860504207216E-307 | C256: of:=ROUND([.A256];12)=ROUND([.B256];12) -> true | D256: of:=FORMULA([.A256]) -> =POISSON(U584,$V$1,FALSE())
A257: of:=POISSON([.U585];[.$V$1];FALSE()) -> 7.3618073737394E-307 | B257: 7.3618073737394E-307 | C257: of:=ROUND([.A257];12)=ROUND([.B257];12) -> true | D257: of:=FORMULA([.A257]) -> =POISSON(U585,$V$1,FALSE())
A258: of:=POISSON([.U586];[.$V$1];FALSE()) -> 2.52983071262586E-306 | B258: 2.52983071262586E-306 | C258: of:=ROUND([.A258];12)=ROUND([.B258];12) -> true | D258: of:=FORMULA([.A258]) -> =POISSON(U586,$V$1,FALSE())
A259: of:=POISSON([.U587];[.$V$1];FALSE()) -> 8.67866453731218E-306 | B259: 8.67866453731218E-306 | C259: of:=ROUND([.A259];12)=ROUND([.B259];12) -> true | D259: of:=FORMULA([.A259]) -> =POISSON(U587,$V$1,FALSE())
A260: of:=POISSON([.U588];[.$V$1];FALSE()) -> 2.97214538949098E-305 | B260: 2.97214538949098E-305 | C260: of:=ROUND([.A260];12)=ROUND([.B260];12) -> true | D260: of:=FORMULA([.A260]) -> =POISSON(U588,$V$1,FALSE())
A261: of:=POISSON([.U589];[.$V$1];FALSE()) -> 1.01611808187636E-304 | B261: 1.01611808187636E-304 | C261: of:=ROUND([.A261];12)=ROUND([.B261];12) -> true | D261: of:=FORMULA([.A261]) -> =POISSON(U589,$V$1,FALSE())
A262: of:=POISSON([.U590];[.$V$1];FALSE()) -> 3.46797980162611E-304 | B262: 3.46797980162611E-304 | C262: of:=ROUND([.A262];12)=ROUND([.B262];12) -> true | D262: of:=FORMULA([.A262]) -> =POISSON(U590,$V$1,FALSE())
A263: of:=POISSON([.U591];[.$V$1];FALSE()) -> 1.18159448096384E-303 | B263: 1.18159448096384E-303 | C263: of:=ROUND([.A263];12)=ROUND([.B263];12) -> true | D263: of:=FORMULA([.A263]) -> =POISSON(U591,$V$1,FALSE())
A264: of:=POISSON([.U592];[.$V$1];FALSE()) -> 4.01902884681354E-303 | B264: 4.01902884681354E-303 | C264: of:=ROUND([.A264];12)=ROUND([.B264];12) -> true | D264: of:=FORMULA([.A264]) -> =POISSON(U592,$V$1,FALSE())
A265: of:=POISSON([.U593];[.$V$1];FALSE()) -> 1.36469570350217E-302 | B265: 1.36469570350217E-302 | C265: of:=ROUND([.A265];12)=ROUND([.B265];12) -> true | D265: of:=FORMULA([.A265]) -> =POISSON(U593,$V$1,FALSE())
A266: of:=POISSON([.U594];[.$V$1];FALSE()) -> 4.62608713051705E-302 | B266: 4.62608713051705E-302 | C266: of:=ROUND([.A266];12)=ROUND([.B266];12) -> true | D266: of:=FORMULA([.A266]) -> =POISSON(U594,$V$1,FALSE())
A267: of:=POISSON([.U595];[.$V$1];FALSE()) -> 1.56551171929498E-301 | B267: 1.56551171929498E-301 | C267: of:=ROUND([.A267];12)=ROUND([.B267];12) -> true | D267: of:=FORMULA([.A267]) -> =POISSON(U595,$V$1,FALSE())
A268: of:=POISSON([.U596];[.$V$1];FALSE()) -> 5.28889094356169E-301 | B268: 5.28889094356169E-301 | C268: of:=ROUND([.A268];12)=ROUND([.B268];12) -> true | D268: of:=FORMULA([.A268]) -> =POISSON(U596,$V$1,FALSE())
A269: of:=POISSON([.U597];[.$V$1];FALSE()) -> 1.78377434858818E-300 | B269: 1.78377434858818E-300 | C269: of:=ROUND([.A269];12)=ROUND([.B269];12) -> true | D269: of:=FORMULA([.A269]) -> =POISSON(U597,$V$1,FALSE())
A270: of:=POISSON([.U598];[.$V$1];FALSE()) -> 6.00597423767105E-300 | B270: 6.00597423767105E-300 | C270: of:=ROUND([.A270];12)=ROUND([.B270];12) -> true | D270: of:=FORMULA([.A270]) -> =POISSON(U598,$V$1,FALSE())
A271: of:=POISSON([.U599];[.$V$1];FALSE()) -> 2.01881486980391E-299 | B271: 2.01881486980391E-299 | C271: of:=ROUND([.A271];12)=ROUND([.B271];12) -> true | D271: of:=FORMULA([.A271]) -> =POISSON(U599,$V$1,FALSE())
A272: of:=POISSON([.U600];[.$V$1];FALSE()) -> 6.77454654297043E-299 | B272: 6.77454654297043E-299 | C272: of:=ROUND([.A272];12)=ROUND([.B272];12) -> true | D272: of:=FORMULA([.A272]) -> =POISSON(U600,$V$1,FALSE())
A273: of:=POISSON([.U552];[.$V$1];TRUE()) -> 0 | B273: 0 | C273: of:=ROUND([.A273];12)=ROUND([.B273];12) -> true | D273: of:=FORMULA([.A273]) -> =POISSON(U552,$V$1,TRUE())
A274: of:=POISSON([.U553];[.$V$1];TRUE()) -> 0 | B274: 0 | C274: of:=ROUND([.A274];12)=ROUND([.B274];12) -> true | D274: of:=FORMULA([.A274]) -> =POISSON(U553,$V$1,TRUE())
A275: of:=POISSON([.U554];[.$V$1];TRUE()) -> 0 | B275: 0 | C275: of:=ROUND([.A275];12)=ROUND([.B275];12) -> true | D275: of:=FORMULA([.A275]) -> =POISSON(U554,$V$1,TRUE())
A276: of:=POISSON([.U555];[.$V$1];TRUE()) -> 0 | B276: 0 | C276: of:=ROUND([.A276];12)=ROUND([.B276];12) -> true | D276: of:=FORMULA([.A276]) -> =POISSON(U555,$V$1,TRUE())
A277: of:=POISSON([.U556];[.$V$1];TRUE()) -> 0 | B277: 0 | C277: of:=ROUND([.A277];12)=ROUND([.B277];12) -> true | D277: of:=FORMULA([.A277]) -> =POISSON(U556,$V$1,TRUE())
A278: of:=POISSON([.U557];[.$V$1];TRUE()) -> 0 | B278: 0 | C278: of:=ROUND([.A278];12)=ROUND([.B278];12) -> true | D278: of:=FORMULA([.A278]) -> =POISSON(U557,$V$1,TRUE())
A279: of:=POISSON([.U558];[.$V$1];TRUE()) -> 0 | B279: 0 | C279: of:=ROUND([.A279];12)=ROUND([.B279];12) -> true | D279: of:=FORMULA([.A279]) -> =POISSON(U558,$V$1,TRUE())
A280: of:=POISSON([.U559];[.$V$1];TRUE()) -> 0 | B280: 0 | C280: of:=ROUND([.A280];12)=ROUND([.B280];12) -> true | D280: of:=FORMULA([.A280]) -> =POISSON(U559,$V$1,TRUE())
A281: of:=POISSON([.U560];[.$V$1];TRUE()) -> 0 | B281: 0 | C281: of:=ROUND([.A281];12)=ROUND([.B281];12) -> true | D281: of:=FORMULA([.A281]) -> =POISSON(U560,$V$1,TRUE())
A282: of:=POISSON([.U561];[.$V$1];TRUE()) -> 0 | B282: 0 | C282: of:=ROUND([.A282];12)=ROUND([.B282];12) -> true | D282: of:=FORMULA([.A282]) -> =POISSON(U561,$V$1,TRUE())
A283: of:=POISSON([.U562];[.$V$1];TRUE()) -> 0 | B283: 0 | C283: of:=ROUND([.A283];12)=ROUND([.B283];12) -> true | D283: of:=FORMULA([.A283]) -> =POISSON(U562,$V$1,TRUE())
A284: of:=POISSON([.U563];[.$V$1];TRUE()) -> 0 | B284: 0 | C284: of:=ROUND([.A284];12)=ROUND([.B284];12) -> true | D284: of:=FORMULA([.A284]) -> =POISSON(U563,$V$1,TRUE())
A285: of:=POISSON([.U564];[.$V$1];TRUE()) -> 0 | B285: 0 | C285: of:=ROUND([.A285];12)=ROUND([.B285];12) -> true | D285: of:=FORMULA([.A285]) -> =POISSON(U564,$V$1,TRUE())
A286: of:=POISSON([.U565];[.$V$1];TRUE()) -> 0 | B286: 0 | C286: of:=ROUND([.A286];12)=ROUND([.B286];12) -> true | D286: of:=FORMULA([.A286]) -> =POISSON(U565,$V$1,TRUE())
A287: of:=POISSON([.U566];[.$V$1];TRUE()) -> 0 | B287: 0 | C287: of:=ROUND([.A287];12)=ROUND([.B287];12) -> true | D287: of:=FORMULA([.A287]) -> =POISSON(U566,$V$1,TRUE())
A288: of:=POISSON([.U567];[.$V$1];TRUE()) -> 0 | B288: 0 | C288: of:=ROUND([.A288];12)=ROUND([.B288];12) -> true | D288: of:=FORMULA([.A288]) -> =POISSON(U567,$V$1,TRUE())
A289: of:=POISSON([.U568];[.$V$1];TRUE()) -> 0 | B289: 0 | C289: of:=ROUND([.A289];12)=ROUND([.B289];12) -> true | D289: of:=FORMULA([.A289]) -> =POISSON(U568,$V$1,TRUE())
A290: of:=POISSON([.U569];[.$V$1];TRUE()) -> 0 | B290: 0 | C290: of:=ROUND([.A290];12)=ROUND([.B290];12) -> true | D290: of:=FORMULA([.A290]) -> =POISSON(U569,$V$1,TRUE())
A291: of:=POISSON([.U570];[.$V$1];TRUE()) -> 0 | B291: 0 | C291: of:=ROUND([.A291];12)=ROUND([.B291];12) -> true | D291: of:=FORMULA([.A291]) -> =POISSON(U570,$V$1,TRUE())
A292: of:=POISSON([.U571];[.$V$1];TRUE()) -> 0 | B292: 0 | C292: of:=ROUND([.A292];12)=ROUND([.B292];12) -> true | D292: of:=FORMULA([.A292]) -> =POISSON(U571,$V$1,TRUE())
A293: of:=POISSON([.U572];[.$V$1];TRUE()) -> 0 | B293: 0 | C293: of:=ROUND([.A293];12)=ROUND([.B293];12) -> true | D293: of:=FORMULA([.A293]) -> =POISSON(U572,$V$1,TRUE())
A294: of:=POISSON([.U573];[.$V$1];TRUE()) -> 0 | B294: 0 | C294: of:=ROUND([.A294];12)=ROUND([.B294];12) -> true | D294: of:=FORMULA([.A294]) -> =POISSON(U573,$V$1,TRUE())
A295: of:=POISSON([.U574];[.$V$1];TRUE()) -> 0 | B295: 0 | C295: of:=ROUND([.A295];12)=ROUND([.B295];12) -> true | D295: of:=FORMULA([.A295]) -> =POISSON(U574,$V$1,TRUE())
A296: of:=POISSON([.U575];[.$V$1];TRUE()) -> 0 | B296: 0 | C296: of:=ROUND([.A296];12)=ROUND([.B296];12) -> true | D296: of:=FORMULA([.A296]) -> =POISSON(U575,$V$1,TRUE())
A297: of:=POISSON([.U576];[.$V$1];TRUE()) -> 0 | B297: 0 | C297: of:=ROUND([.A297];12)=ROUND([.B297];12) -> true | D297: of:=FORMULA([.A297]) -> =POISSON(U576,$V$1,TRUE())
A298: of:=POISSON([.U577];[.$V$1];TRUE()) -> 0 | B298: 0 | C298: of:=ROUND([.A298];12)=ROUND([.B298];12) -> true | D298: of:=FORMULA([.A298]) -> =POISSON(U577,$V$1,TRUE())
A299: of:=POISSON([.U578];[.$V$1];TRUE()) -> 0 | B299: 0 | C299: of:=ROUND([.A299];12)=ROUND([.B299];12) -> true | D299: of:=FORMULA([.A299]) -> =POISSON(U578,$V$1,TRUE())
A300: of:=POISSON([.U579];[.$V$1];TRUE()) -> 0 | B300: 0 | C300: of:=ROUND([.A300];12)=ROUND([.B300];12) -> true | D300: of:=FORMULA([.A300]) -> =POISSON(U579,$V$1,TRUE())
A301: of:=POISSON([.U580];[.$V$1];TRUE()) -> 0 | B301: 0 | C301: of:=ROUND([.A301];12)=ROUND([.B301];12) -> true | D301: of:=FORMULA([.A301]) -> =POISSON(U580,$V$1,TRUE())
A302: of:=POISSON([.U581];[.$V$1];TRUE()) -> 0 | B302: 0 | C302: of:=ROUND([.A302];12)=ROUND([.B302];12) -> true | D302: of:=FORMULA([.A302]) -> =POISSON(U581,$V$1,TRUE())
A303: of:=POISSON([.U582];[.$V$1];TRUE()) -> 0 | B303: 0 | C303: of:=ROUND([.A303];12)=ROUND([.B303];12) -> true | D303: of:=FORMULA([.A303]) -> =POISSON(U582,$V$1,TRUE())
A304: of:=POISSON([.U583];[.$V$1];TRUE()) -> 0 | B304: 0 | C304: of:=ROUND([.A304];12)=ROUND([.B304];12) -> true | D304: of:=FORMULA([.A304]) -> =POISSON(U583,$V$1,TRUE())
A305: of:=POISSON([.U584];[.$V$1];TRUE()) -> 3.01125532820697E-307 | B305: 3.01125532820697E-307 | C305: of:=ROUND([.A305];12)=ROUND([.B305];12) -> true | D305: of:=FORMULA([.A305]) -> =POISSON(U584,$V$1,TRUE())
A306: of:=POISSON([.U585];[.$V$1];TRUE()) -> 1.03730627019498E-306 | B306: 1.03730627019498E-306 | C306: of:=ROUND([.A306];12)=ROUND([.B306];12) -> true | D306: of:=FORMULA([.A306]) -> =POISSON(U585,$V$1,TRUE())
A307: of:=POISSON([.U586];[.$V$1];TRUE()) -> 3.56713698282175E-306 | B307: 3.56713698282175E-306 | C307: of:=ROUND([.A307];12)=ROUND([.B307];12) -> true | D307: of:=FORMULA([.A307]) -> =POISSON(U586,$V$1,TRUE())
A308: of:=POISSON([.U587];[.$V$1];TRUE()) -> 1.22458015201371E-305 | B308: 1.22458015201371E-305 | C308: of:=ROUND([.A308];12)=ROUND([.B308];12) -> true | D308: of:=FORMULA([.A308]) -> =POISSON(U587,$V$1,TRUE())
A309: of:=POISSON([.U588];[.$V$1];TRUE()) -> 4.19672554150185E-305 | B309: 4.19672554150185E-305 | C309: of:=ROUND([.A309];12)=ROUND([.B309];12) -> true | D309: of:=FORMULA([.A309]) -> =POISSON(U588,$V$1,TRUE())
A310: of:=POISSON([.U589];[.$V$1];TRUE()) -> 1.43579063602682E-304 | B310: 1.43579063602682E-304 | C310: of:=ROUND([.A310];12)=ROUND([.B310];12) -> true | D310: of:=FORMULA([.A310]) -> =POISSON(U589,$V$1,TRUE())
A311: of:=POISSON([.U590];[.$V$1];TRUE()) -> 4.90377043765395E-304 | B311: 4.90377043765395E-304 | C311: of:=ROUND([.A311];12)=ROUND([.B311];12) -> true | D311: of:=FORMULA([.A311]) -> =POISSON(U590,$V$1,TRUE())
A312: of:=POISSON([.U591];[.$V$1];TRUE()) -> 1.67197152472841E-303 | B312: 1.67197152472841E-303 | C312: of:=ROUND([.A312];12)=ROUND([.B312];12) -> true | D312: of:=FORMULA([.A312]) -> =POISSON(U591,$V$1,TRUE())
A313: of:=POISSON([.U592];[.$V$1];TRUE()) -> 5.69100037154357E-303 | B313: 5.69100037154357E-303 | C313: of:=ROUND([.A313];12)=ROUND([.B313];12) -> true | D313: of:=FORMULA([.A313]) -> =POISSON(U592,$V$1,TRUE())
A314: of:=POISSON([.U593];[.$V$1];TRUE()) -> 1.93379574065693E-302 | B314: 1.93379574065693E-302 | C314: of:=ROUND([.A314];12)=ROUND([.B314];12) -> true | D314: of:=FORMULA([.A314]) -> =POISSON(U593,$V$1,TRUE())
A315: of:=POISSON([.U594];[.$V$1];TRUE()) -> 6.55988287117568E-302 | B315: 6.55988287117568E-302 | C315: of:=ROUND([.A315];12)=ROUND([.B315];12) -> true | D315: of:=FORMULA([.A315]) -> =POISSON(U594,$V$1,TRUE())
A316: of:=POISSON([.U595];[.$V$1];TRUE()) -> 2.22150000641088E-301 | B316: 2.22150000641088E-301 | C316: of:=ROUND([.A316];12)=ROUND([.B316];12) -> true | D316: of:=FORMULA([.A316]) -> =POISSON(U595,$V$1,TRUE())
A317: of:=POISSON([.U596];[.$V$1];TRUE()) -> 7.51039094997493E-301 | B317: 7.51039094997493E-301 | C317: of:=ROUND([.A317];12)=ROUND([.B317];12) -> true | D317: of:=FORMULA([.A317]) -> =POISSON(U596,$V$1,TRUE())
A318: of:=POISSON([.U597];[.$V$1];TRUE()) -> 2.53481344358645E-300 | B318: 2.53481344358645E-300 | C318: of:=ROUND([.A318];12)=ROUND([.B318];12) -> true | D318: of:=FORMULA([.A318]) -> =POISSON(U597,$V$1,TRUE())
A319: of:=POISSON([.U598];[.$V$1];TRUE()) -> 8.54078768125146E-300 | B319: 8.54078768125146E-300 | C319: of:=ROUND([.A319];12)=ROUND([.B319];12) -> true | D319: of:=FORMULA([.A319]) -> =POISSON(U598,$V$1,TRUE())
A320: of:=POISSON([.U599];[.$V$1];TRUE()) -> 2.87289363792972E-299 | B320: 2.87289363792972E-299 | C320: of:=ROUND([.A320];12)=ROUND([.B320];12) -> true | D320: of:=FORMULA([.A320]) -> =POISSON(U599,$V$1,TRUE())
A321: of:=POISSON([.U600];[.$V$1];TRUE()) -> 9.64744018090371E-299 | B321: 9.64744018090371E-299 | C321: of:=ROUND([.A321];12)=ROUND([.B321];12) -> true | D321: of:=FORMULA([.A321]) -> =POISSON(U600,$V$1,TRUE())
A322: of:=POISSON(150;120;0) -> 0.00101147619891597 | B322: 0.00101147619891597 | C322: of:=ROUND([.A322];12)=ROUND([.B322];12) -> true | D322: of:=FORMULA([.A322]) -> =POISSON(150,120,0)
A323: of:=POISSON(148;120;0) -> 0.00156989535040084 | B323: 0.00156989535040084 | C323: of:=ROUND([.A323];12)=ROUND([.B323];12) -> true | D323: of:=FORMULA([.A323]) -> =POISSON(148,120,0)
A324: of:=POISSON(0;120;0) -> 7.667648073722E-053 | B324: 7.667648073722E-053 | C324: of:=ROUND([.A324];12)=ROUND([.B324];12) -> true | D324: of:=FORMULA([.A324]) -> =POISSON(0,120,0)
A325: of:=POISSON(-1;120;0) ->  | B325: of:=err:502 ->  | C325: of:=ISERROR([.A325]) -> true | D325: of:=FORMULA([.A325]) -> =POISSON(-1,120,0)
A326: of:=POISSON(148;0;0) ->  | B326: of:=err:502 ->  | C326: of:=ISERROR([.A326]) -> true | D326: of:=FORMULA([.A326]) -> =POISSON(148,0,0) | E326: Constraints: l > 0
A327: of:=POISSON(148.9;120.9;0) -> 0.00192874041948952 | B327: 0.00192874041948952 | C327: of:=ROUND([.A327];12)=ROUND([.B327];12) -> true | D327: of:=FORMULA([.A327]) -> =POISSON(148.9,120.9,0)
A328: of:=POISSON(0;0;0) ->  | B328: of:=err:502 ->  | C328: of:=ISERROR([.A328]) -> true | D328: of:=FORMULA([.A328]) -> =POISSON(0,0,0)
A329: of:=POISSON(60;50;1) -> 0.927839820186743 | B329: 0.927839820186743 | C329: of:=ROUND([.A329];12)=ROUND([.B329];12) -> true | D329: of:=FORMULA([.A329]) -> =POISSON(60,50,1)
A330: of:=POISSON(60;50;) -> 0.0201048721456762 | B330: 0.0201048721456762 | C330: of:=ROUND([.A330];12)=ROUND([.B330];12) -> true | D330: of:=FORMULA([.A330]) -> =POISSON(60,50,)
U552: 548
U553: 549
U554: 550
U555: 551
U556: 552
U557: 553
U558: 554
U559: 555
U560: 556
U561: 557
U562: 558
U563: 559
U564: 560
U565: 561
U566: 562
U567: 563
U568: 564
U569: 565
U570: 566
U571: 567
U572: 568
U573: 569
U574: 570
U575: 571
U576: 572
U577: 573
U578: 574
U579: 575
U580: 576
U581: 577
U582: 578
U583: 579
U584: 580
U585: 581
U586: 582
U587: 583
U588: 584
U589: 585
U590: 586
U591: 587
U592: 588
U593: 589
U594: 590
U595: 591
U596: 592
U597: 593
U598: 594
U599: 595
U600: 596