Sheet: Sheet1
A1: RSQ Function
A3: Result | B3: of:=AND([.B8:.B95]) -> true
A7: Sheet | B7: Result | C7: Description
A8: 1 | B8: of:=AND([Sheet2.C2:.C841]) -> true | C8: Simple RSQ formulas with local references and values

Sheet: Sheet2
A1: Function | B1: Expected | C1: Correct | D1: FunctionString | E1: Comment | F1: 1 | G1: 5 | L1: Data | Y1: Day | Z1: Temp (F)
A2: of:=RSQ([.F1:.F11];[.G1:.G11]) -> 1 | B2: 1 | C2: of:=ROUND([.A2];12)=ROUND([.B2];12) -> true | D2: of:=FORMULA([.A2]) -> =RSQ(F1:F11,G1:G11) | F2: 2 | G2: 6 | L2: Known y | M2: Known x | Y2: 2011-01-07 | Z2: 89
A3: of:=RSQ([.I2:.I101];[.J2:.J101]) -> 0.996892319188432 | B3: 0.996892319188432 | C3: of:=ROUND([.A3];12)=ROUND([.B3];12) -> true | D3: of:=FORMULA([.A3]) -> =RSQ(I2:I101,J2:J101) | F3: 3 | G3: 7 | I3: 900000002 | J3: 899999998 | L3: 2 | M3: 6 | Y3: 2011-02-07 | Z3: 88
A4: of:=RSQ([.L3:.L9]; [.M3:.M9]) -> 0.0579501915708812 | B4: 0.0579501915708812 | C4: of:=ROUND([.A4];12)=ROUND([.B4];12) -> true | D4: of:=FORMULA([.A4]) -> =RSQ(L3:L9, M3:M9) | F4: 4 | G4: 8 | I4: 900000003 | J4: 899999997 | L4: 3 | M4: 5 | Y4: 2011-03-07 | Z4: 92
A5: of:=RSQ([.L4:.L10]; [.M4:.M10]) -> 0.0707602339181287 | B5: 0.0707602339181287 | C5: of:=ROUND([.A5];12)=ROUND([.B5];12) -> true | D5: of:=FORMULA([.A5]) -> =RSQ(L4:L10, M4:M10) | F5: 5 | G5: 9 | I5: 900000004 | J5: 899999996 | L5: 9 | M5: 11 | Y5: 2011-04-07 | Z5: 101
A6: of:=RSQ([.L1:.L11]; [.M1:.M11]) -> 0.0579501915708812 | B6: 0.0579501915708812 | C6: of:=ROUND([.A6];12)=ROUND([.B6];12) -> true | D6: of:=FORMULA([.A6]) -> =RSQ(L1:L11, M1:M11) | F6: 6 | G6: 10 | I6: 900000005 | J6: 899999995 | L6: 1 | M6: 7 | Y6: 2011-05-07 | Z6: 94
A7: of:=RSQ([.I1:.I5];[.J1:.J5]) -> 1 | B7: 1 | C7: of:=ROUND([.A7];12)=ROUND([.B7];12) -> true | D7: of:=FORMULA([.A7]) -> =RSQ(I1:I5,J1:J5) | F7: 7 | G7: 11 | I7: 900000015 | J7: 899999994 | L7: 8 | M7: 5 | Y7: 2011-06-07 | Z7: 97
A8: of:=RSQ([.I1:.I2];[.J1:.J2]) ->  | B8: of:=#VALUE! ->  | C8: of:=ISERROR([.A8]) -> true | D8: of:=FORMULA([.A8]) -> =RSQ(I1:I2,J1:J2) | F8: 8 | G8: 12 | I8: 900000007 | J8: 899999993 | L8: 7 | M8: 4 | Y8: 2011-07-07 | Z8: 95
A9: of:=RSQ([.L12:.L15];[.M12:.M15]) ->  | B9: of:=#DIV/0! ->  | C9: of:=ISERROR([.A9]) -> true | D9: of:=FORMULA([.A9]) -> =RSQ(L12:L15;M12:M15) | E9: tdf#94962 | F9: 9 | G9: 13 | I9: 900000008 | J9: 899999992 | L9: 5 | M9: 4
F10: 10 | G10: 14 | I10: 900000009 | J10: 899999991
F11: 11 | G11: 15 | I11: 900000010 | J11: 899999990
I12: 900000011 | J12: 899999989 | L12: 7.149E-166 | M12: 4.998E-163
I13: 900000012 | J13: 899999988 | L13: 3.963E-165 | M13: 6.232E-163
I14: 900000013 | J14: 899999987 | L14: 6.609E-165 | M14: 7.724E-163
I15: 900000014 | J15: 899999986 | L15: 3.056E-165 | M15: 4.955E-163
I16: 900000015 | J16: 899999985
I17: 900000016 | J17: 899999984
I18: 900000017 | J18: 899999983
I19: 900000018 | J19: 899999982
I20: 900000019 | J20: 899999981
I21: 900000020 | J21: 899999980
I22: 900000021 | J22: 899999979
I23: 900000022 | J23: 899999978
I24: 900000023 | J24: 899999977
I25: 900000024 | J25: 899999976
I26: 900000025 | J26: 899999975
I27: 900000026 | J27: 899999974
I28: 900000027 | J28: 899999960
I29: 900000028 | J29: 899999972
I30: 900000029 | J30: 899999971
I31: 900000030 | J31: 899999970
I32: 900000031 | J32: 899999969
I33: 900000032 | J33: 899999968
I34: 900000033 | J34: 899999967
I35: 900000034 | J35: 899999966
I36: 900000035 | J36: 899999965
I37: 900000036 | J37: 899999964
I38: 900000037 | J38: 899999963
I39: 900000038 | J39: 899999962
I40: 900000039 | J40: 899999961
I41: 900000040 | J41: 899999960
I42: 900000041 | J42: 899999959
I43: 900000042 | J43: 899999958
I44: 900000043 | J44: 899999957
I45: 900000044 | J45: 899999956
I46: 900000045 | J46: 899999955
I47: 900000046 | J47: 899999954
I48: 900000047 | J48: 899999953
I49: 900000048 | J49: 899999952
I50: 900000049 | J50: 899999951
I51: 900000050 | J51: 899999950
I52: 900000051 | J52: 899999949
I53: 900000052 | J53: 899999948
I54: 900000053 | J54: 899999947
I55: 900000054 | J55: 899999946
I56: 900000055 | J56: 899999945
I57: 900000056 | J57: 899999944
I58: 900000057 | J58: 899999943
I59: 900000058 | J59: 899999942
I60: 900000059 | J60: 899999941
I61: 900000060 | J61: 899999940
I62: 900000061 | J62: 899999939
I63: 900000062 | J63: 899999938
I64: 900000063 | J64: 899999937
I65: 900000064 | J65: 899999936
I66: 900000065 | J66: 899999935
I67: 900000066 | J67: 899999934
I68: 900000067 | J68: 899999933
I69: 900000068 | J69: 899999932
I70: 900000069 | J70: 899999931
I71: 900000070 | J71: 899999930
I72: 900000071 | J72: 899999929
I73: 900000072 | J73: 899999928
I74: 900000073 | J74: 899999927
I75: 900000074 | J75: 899999926
I76: 900000075 | J76: 899999925
I77: 900000076 | J77: 899999924
I78: 900000077 | J78: 899999923
I79: 900000078 | J79: 899999922
I80: 900000079 | J80: 899999921
I81: 900000080 | J81: 899999920
I82: 900000081 | J82: 899999919
I83: 900000082 | J83: 899999918
I84: 900000083 | J84: 899999917
I85: 900000084 | J85: 899999916
I86: 900000085 | J86: 899999915
I87: 900000086 | J87: 899999914
I88: 900000087 | J88: 899999913
I89: 900000088 | J89: 899999912
I90: 900000089 | J90: 899999911
I91: 900000090 | J91: 899999910
I92: 900000091 | J92: 899999909
I93: 900000092 | J93: 899999908
I94: 900000093 | J94: 899999907
I95: 900000094 | J95: 899999906
I96: 900000095 | J96: 899999905
I97: 900000096 | J97: 899999904
I98: 900000097 | J98: 899999903
I99: 900000098 | J99: 899999902
I100: 900000099 | J100: 899999901
I101: 900000100 | J101: 899999900