Sheet: Sheet1
A1: SLOPE Function
A3: Result | B3: of:=AND([.B8:.B95]) -> true
A7: Sheet | B7: Result | C7: Description
A8: 1 | B8: of:=AND([Sheet2.C2:.C841]) -> true | C8: Simple SLOPE formulas with local references and values

Sheet: Sheet2
A1: Function | B1: Expected | C1: Correct | D1: FunctionString | E1: Comment | F1: 1 | G1: 5 | L1: Data | O1: Data | R1: 0.8 | S1: 12.55 | T1: 44 | Y1: Day | Z1: Temp (F)
A2: of:=SLOPE([.F1:.F11];[.G1:.G11]) -> 1 | B2: 1 | C2: of:=ROUND([.A2];12)=ROUND([.B2];12) -> true | D2: of:=FORMULA([.A2]) -> =SLOPE(F1:F11,G1:G11) | E2: Check 5.4 | F2: 2 | G2: 6 | L2: Known y | M2: Known x | O2: 3 | R2: 1.8 | S2: 13.55 | T2: 6 | Y2: 2011-01-07 | Z2: 89
A3: of:=SLOPE([.I3:.I101];[.J3:.J101]) -> -0.996747555200848 | B3: -0.996747555200848 | C3: of:=ROUND([.A3];12)=ROUND([.B3];12) -> true | D3: of:=FORMULA([.A3]) -> =SLOPE(I3:I101,J3:J101) | F3: 3 | G3: 7 | H3: 7775543 | I3: 900000002 | J3: 899999998 | K3: 1212 | L3: 2 | M3: 6 | O3: 4 | R3: 2.8 | S3: 65 | T3: 46 | Y3: 2011-02-07 | Z3: 88
A4: of:=SLOPE([.L3:.L9];[.M3:.M9]) -> 0.305555555555556 | B4: 0.305555555555556 | C4: of:=ROUND([.A4];12)=ROUND([.B4];12) -> true | D4: of:=FORMULA([.A4]) -> =SLOPE(L3:L9,M3:M9) | F4: 4 | G4: 8 | H4: 7775544 | I4: 900000003 | J4: 899999997 | K4: 1213 | L4: 3 | M4: 5 | O4: 5 | R4: 3.8 | S4: 15.55 | T4: 5 | Y4: 2011-03-07 | Z4: 92
A5: of:=SLOPE([.R2:.R23];[.S2:.S23]) -> -0.0000322310164672783 | B5: -0.0000322310164672783 | C5: of:=ROUND([.A5];12)=ROUND([.B5];12) -> true | D5: of:=FORMULA([.A5]) -> =SLOPE(R2:R23,S2:S23) | F5: 5 | G5: 9 | H5: 7775545 | I5: 900000004 | J5: 899999996 | K5: 1214 | L5: 9 | M5: 11 | O5: 2 | R5: -4.8 | S5: 6 | T5: 4 | Y5: 2011-04-07 | Z5: 101
A6: of:=SLOPE([.S2:.S23];[.T2:.T23]) -> -6.20182682721303 | B6: -6.20182682721303 | C6: of:=ROUND([.A6];12)=ROUND([.B6];12) -> true | D6: of:=FORMULA([.A6]) -> =SLOPE(S2:S23,T2:T23) | F6: 6 | G6: 10 | H6: 7775546 | I6: 900000005 | J6: 899999995 | K6: 1215 | L6: 1 | M6: 7 | O6: 3 | R6: 5.8 | S6: 6 | T6: 2 | Y6: 2011-05-07 | Z6: 94
A7: of:=SLOPE([.R2:.R23];[.T2:.T23]) -> 0.0117754486639321 | B7: 0.0117754486639321 | C7: of:=ROUND([.A7];12)=ROUND([.B7];12) -> true | D7: of:=FORMULA([.A7]) -> =SLOPE(R2:R23,T2:T23) | F7: 7 | G7: 11 | H7: 7775547 | I7: 900000015 | J7: 899999994 | K7: 1216 | L7: 8 | M7: 5 | O7: 4 | R7: 6.8 | S7: 8 | T7: 5 | Y7: 2011-06-07 | Z7: 97
A8: of:=SLOPE([.F14];[.G14]) ->  | B8: of:#DIV/0! ->  | C8: of:=ISERROR([.A8]) -> true | D8: of:=FORMULA([.A8]) -> =SLOPE(F14,G14) | F8: 8 | G8: 12 | H8: 7775548 | I8: 900000007 | J8: 899999993 | K8: 1217 | L8: 7 | M8: 4 | O8: 5 | R8: 7.8 | S8: 9 | T8: 4 | Y8: 2011-07-07 | Z8: 95
A9: of:=SLOPE([.R2:.T11];[.R12:.T21]) -> -2.12972600228688 | B9: -2.12972600228688 | C9: of:=ROUND([.A9];12)=ROUND([.B9];12) -> true | D9: of:=FORMULA([.A9]) -> =SLOPE(R2:T11,R12:T21) | F9: 9 | G9: 13 | H9: 7775549 | I9: 900000008 | J9: 899999992 | K9: 1218 | L9: 5 | M9: 4 | O9: 6 | R9: 8.8 | S9: 45 | T9: 12
A10: of:=SLOPE([.I3:.I101];[.K3:.K101]) -> 0.994990723562152 | B10: 0.994990723562152 | C10: of:=ROUND([.A10];12)=ROUND([.B10];12) -> true | D10: of:=FORMULA([.A10]) -> =SLOPE(I3:I101,K3:K101) | F10: 10 | G10: 14 | H10: 7775550 | I10: 900000009 | J10: 899999991 | K10: 1219 | O10: 4 | R10: 9.8 | S10: 63521 | T10: 5
A11: of:=SLOPE([.J3:.J101];[.K3:.K101]) -> -0.996141001855288 | B11: -0.996141001855288 | C11: of:=ROUND([.A11];12)=ROUND([.B11];12) -> true | D11: of:=FORMULA([.A11]) -> =SLOPE(J3:J101,K3:K101) | F11: 11 | G11: 15 | H11: 7775551 | I11: 900000010 | J11: 899999990 | K11: 1220 | O11: 7 | R11: 10.8 | S11: 654 | T11: 9
A12: of:=SLOPE([.H3:.H101];[.I3:.I101]) -> 1.0040541368535 | B12: 1.0040541368535 | C12: of:=ROUND([.A12];12)=ROUND([.B12];12) -> true | D12: of:=FORMULA([.A12]) -> =SLOPE(H3:H101,I3:I101) | H12: 7775552 | I12: 900000011 | J12: 899999989 | K12: 1221 | R12: 11.8 | S12: 2 | T12: 1
A13: of:=SLOPE([.I3:.I101];[.H3:.H101]) -> 0.994990723562152 | B13: 0.994990723562152 | C13: of:=ROUND([.A13];12)=ROUND([.B13];12) -> true | D13: of:=FORMULA([.A13]) -> =SLOPE(I3:I101,H3:H101) | H13: 7775553 | I13: 900000012 | J13: 899999988 | K13: 1222 | R13: 12.8 | S13: 5 | T13: 4
A14: of:=SLOPE([.H3:.H101];[.J3:.J101]) -> -1.00179998934531 | B14: -1.00179998934531 | C14: of:=ROUND([.A14];12)=ROUND([.B14];12) -> true | D14: of:=FORMULA([.A14]) -> =SLOPE(H3:H101,J3:J101) | F14: 14.8333358764648 | G14: 14.8333358764648 | H14: 7775554 | I14: 900000013 | J14: 899999987 | K14: 1223 | R14: 13.8 | S14: 17 | T14: -1
A15: of:=SLOPE([.J3:.J101];[.H3:.H101]) -> -0.996141001855288 | B15: -0.996141001855288 | C15: of:=ROUND([.A15];12)=ROUND([.B15];12) -> true | D15: of:=FORMULA([.A15]) -> =SLOPE(J3:J101,H3:H101) | H15: 7775555 | I15: 900000014 | J15: 899999986 | K15: 1224 | R15: 14.8 | S15: 654 | T15: 2
A16: of:=SLOPE([.H3:.H101];[.K3:.K101]) -> 1 | B16: 1 | C16: of:=ROUND([.A16];12)=ROUND([.B16];12) -> true | D16: of:=FORMULA([.A16]) -> =SLOPE(H3:H101,K3:K101) | H16: 7775556 | I16: 900000015 | J16: 899999985 | K16: 1225 | R16: 15.8 | S16: 9 | T16: 654
A17: of:=SLOPE([.K3:.K101];[.H3:.H101]) -> 1 | B17: 1 | C17: of:=ROUND([.A17];12)=ROUND([.B17];12) -> true | D17: of:=FORMULA([.A17]) -> =SLOPE(K3:K101,H3:H101) | H17: 7775557 | I17: 900000016 | J17: 899999984 | K17: 1226 | R17: 16.8 | S17: 2 | T17: 2
H18: 7775558 | I18: 900000017 | J18: 899999983 | K18: 1227 | R18: 17.8 | S18: 29.55 | T18: 654
H19: 7775559 | I19: 900000018 | J19: 899999982 | K19: 1228 | R19: 18.8 | S19: 654 | T19: 2
H20: 7775560 | I20: 900000019 | J20: 899999981 | K20: 1229 | R20: 19.8 | S20: 54 | T20: 65
H21: 7775561 | I21: 900000020 | J21: 899999980 | K21: 1230 | R21: 20.8 | S21: 58 | T21: 6
H22: 7775562 | I22: 900000021 | J22: 899999979 | K22: 1231 | R22: 21.8 | S22: 56 | T22: 321
H23: 7775563 | I23: 900000022 | J23: 899999978 | K23: 1232 | R23: 22.8 | S23: 96 | T23: 5
H24: 7775564 | I24: 900000023 | J24: 899999977 | K24: 1233
H25: 7775565 | I25: 900000024 | J25: 899999976 | K25: 1234
H26: 7775566 | I26: 900000025 | J26: 899999975 | K26: 1235
H27: 7775567 | I27: 900000026 | J27: 899999974 | K27: 1236
H28: 7775568 | I28: 900000027 | J28: 899999960 | K28: 1237
H29: 7775569 | I29: 900000028 | J29: 899999972 | K29: 1238
H30: 7775570 | I30: 900000029 | J30: 899999971 | K30: 1239
H31: 7775571 | I31: 900000030 | J31: 899999970 | K31: 1240
H32: 7775572 | I32: 900000031 | J32: 899999969 | K32: 1241
H33: 7775573 | I33: 900000032 | J33: 899999968 | K33: 1242
H34: 7775574 | I34: 900000033 | J34: 899999967 | K34: 1243
H35: 7775575 | I35: 900000034 | J35: 899999966 | K35: 1244
H36: 7775576 | I36: 900000035 | J36: 899999965 | K36: 1245
H37: 7775577 | I37: 900000036 | J37: 899999964 | K37: 1246
H38: 7775578 | I38: 900000037 | J38: 899999963 | K38: 1247
H39: 7775579 | I39: 900000038 | J39: 899999962 | K39: 1248
H40: 7775580 | I40: 900000039 | J40: 899999961 | K40: 1249
H41: 7775581 | I41: 900000040 | J41: 899999960 | K41: 1250
H42: 7775582 | I42: 900000041 | J42: 899999959 | K42: 1251
H43: 7775583 | I43: 900000042 | J43: 899999958 | K43: 1252
H44: 7775584 | I44: 900000043 | J44: 899999957 | K44: 1253
H45: 7775585 | I45: 900000044 | J45: 899999956 | K45: 1254
H46: 7775586 | I46: 900000045 | J46: 899999955 | K46: 1255
H47: 7775587 | I47: 900000046 | J47: 899999954 | K47: 1256
H48: 7775588 | I48: 900000047 | J48: 899999953 | K48: 1257
H49: 7775589 | I49: 900000048 | J49: 899999952 | K49: 1258
H50: 7775590 | I50: 900000049 | J50: 899999951 | K50: 1259
H51: 7775591 | I51: 900000050 | J51: 899999950 | K51: 1260
H52: 7775592 | I52: 900000051 | J52: 899999949 | K52: 1261
H53: 7775593 | I53: 900000052 | J53: 899999948 | K53: 1262
H54: 7775594 | I54: 900000053 | J54: 899999947 | K54: 1263
H55: 7775595 | I55: 900000054 | J55: 899999946 | K55: 1264
H56: 7775596 | I56: 900000055 | J56: 899999945 | K56: 1265
H57: 7775597 | I57: 900000056 | J57: 899999944 | K57: 1266
H58: 7775598 | I58: 900000057 | J58: 899999943 | K58: 1267
H59: 7775599 | I59: 900000058 | J59: 899999942 | K59: 1268
H60: 7775600 | I60: 900000059 | J60: 899999941 | K60: 1269
H61: 7775601 | I61: 900000060 | J61: 899999940 | K61: 1270
H62: 7775602 | I62: 900000061 | J62: 899999939 | K62: 1271
H63: 7775603 | I63: 900000062 | J63: 899999938 | K63: 1272
H64: 7775604 | I64: 900000063 | J64: 899999937 | K64: 1273
H65: 7775605 | I65: 900000064 | J65: 899999936 | K65: 1274
H66: 7775606 | I66: 900000065 | J66: 899999935 | K66: 1275
H67: 7775607 | I67: 900000066 | J67: 899999934 | K67: 1276
H68: 7775608 | I68: 900000067 | J68: 899999933 | K68: 1277
H69: 7775609 | I69: 900000068 | J69: 899999932 | K69: 1278
H70: 7775610 | I70: 900000069 | J70: 899999931 | K70: 1279
H71: 7775611 | I71: 900000070 | J71: 899999930 | K71: 1280
H72: 7775612 | I72: 900000071 | J72: 899999929 | K72: 1281
H73: 7775613 | I73: 900000072 | J73: 899999928 | K73: 1282
H74: 7775614 | I74: 900000073 | J74: 899999927 | K74: 1283
H75: 7775615 | I75: 900000074 | J75: 899999926 | K75: 1284
H76: 7775616 | I76: 900000075 | J76: 899999925 | K76: 1285
H77: 7775617 | I77: 900000076 | J77: 899999924 | K77: 1286
H78: 7775618 | I78: 900000077 | J78: 899999923 | K78: 1287
H79: 7775619 | I79: 900000078 | J79: 899999922 | K79: 1288
H80: 7775620 | I80: 900000079 | J80: 899999921 | K80: 1289
H81: 7775621 | I81: 900000080 | J81: 899999920 | K81: 1290
H82: 7775622 | I82: 900000081 | J82: 899999919 | K82: 1291
H83: 7775623 | I83: 900000082 | J83: 899999918 | K83: 1292
H84: 7775624 | I84: 900000083 | J84: 899999917 | K84: 1293
H85: 7775625 | I85: 900000084 | J85: 899999916 | K85: 1294
H86: 7775626 | I86: 900000085 | J86: 899999915 | K86: 1295
H87: 7775627 | I87: 900000086 | J87: 899999914 | K87: 1296
H88: 7775628 | I88: 900000087 | J88: 899999913 | K88: 1297
H89: 7775629 | I89: 900000088 | J89: 899999912 | K89: 1298
H90: 7775630 | I90: 900000089 | J90: 899999911 | K90: 1299
H91: 7775631 | I91: 900000090 | J91: 899999910 | K91: 1300
H92: 7775632 | I92: 900000091 | J92: 899999909 | K92: 1301
H93: 7775633 | I93: 900000092 | J93: 899999908 | K93: 1302
H94: 7775634 | I94: 900000093 | J94: 899999907 | K94: 1303
H95: 7775635 | I95: 900000094 | J95: 899999906 | K95: 1304
H96: 7775636 | I96: 900000095 | J96: 899999905 | K96: 1305
H97: 7775637 | I97: 900000096 | J97: 899999904 | K97: 1306
H98: 7775638 | I98: 900000097 | J98: 899999903 | K98: 1307
H99: 7775639 | I99: 900000098 | J99: 899999902 | K99: 1308
H100: 7775640 | I100: 900000099 | J100: 899999901 | K100: 1309
H101: 7775641 | I101: 900000100 | J101: 899999900 | K101: 1310