Sheet: Sheet1
A1: STDEVPA Function
A3: Result | B3: of:=AND([.B8:.B95]) -> true
A7: Sheet | B7: Result | C7: Description
A8: 1 | B8: of:=AND([Sheet2.C2:.C841]) -> true | C8: Simple STDEVPA formulas with local references and values

Sheet: Sheet2
A1: Function | B1: Expected | C1: Correct | D1: FunctionString | E1: Comment | F1: 1 | G1: 5 | H1: 1E+030 | L1: Data | O1: Data | S1: 12.55 | T1: 44 | Y1: Day | Z1: Temp (F)
A2: of:=STDEVPA(2; 6; 4) -> 1.63299316185545 | B2: 1.63299316185545 | C2: of:=ORG.LIBREOFFICE.ROUNDSIG([.A2];15)=ORG.LIBREOFFICE.ROUNDSIG([.B2];15) -> true | D2: of:=FORMULA([.A2]) -> =STDEVPA(2, 6, 4) | F2: 2 | G2: 6 | H2: 1E+030 | L2: Known y | M2: Known x | O2: 3 | S2: 13.55 | T2: 6 | Y2: 2011-01-07 | Z2: 89
A3: of:=STDEVPA([.F1:.G14]) -> 4.04972501741921 | B3: 4.04972501741921 | C3: of:=ORG.LIBREOFFICE.ROUNDSIG([.A3];15)=ORG.LIBREOFFICE.ROUNDSIG([.B3];15) -> true | D3: of:=FORMULA([.A3]) -> =STDEVPA(F1:G14) | F3: 3 | G3: 7 | H3: 1E+030 | I3: 900000002 | J3: 899999998 | L3: 2 | M3: 6 | O3: 4 | P3: 1345 | S3: 65 | T3: 46 | Y3: 2011-02-07 | Z3: 88
A4: of:=STDEVPA([.I3:.J101]) -> 58.506579065081 | B4: 58.506579065081 | C4: of:=ORG.LIBREOFFICE.ROUNDSIG([.A4];15)=ORG.LIBREOFFICE.ROUNDSIG([.B4];15) -> true | D4: of:=FORMULA([.A4]) -> =STDEVPA(I3:J101) | F4: 4 | G4: 8 | I4: 900000003 | J4: 899999997 | L4: 3 | M4: 5 | O4: 5 | P4: 1301 | S4: 15.55 | T4: 5 | Y4: 2011-03-07 | Z4: 92
A5: of:=STDEVPA([.L3:.M9]) -> 2.63899331455874 | B5: 2.63899331455874 | C5: of:=ORG.LIBREOFFICE.ROUNDSIG([.A5];15)=ORG.LIBREOFFICE.ROUNDSIG([.B5];15) -> true | D5: of:=FORMULA([.A5]) -> =STDEVPA(L3:M9) | F5: 5 | G5: 9 | I5: 900000004 | J5: 899999996 | L5: 9 | M5: 11 | O5: 2 | P5: 1368 | S5: 6 | T5: 4 | Y5: 2011-04-07 | Z5: 101
A6: of:=STDEVPA([.O2:.O11]) -> 1.41774468787578 | B6: 1.41774468787578 | C6: of:=ORG.LIBREOFFICE.ROUNDSIG([.A6];15)=ORG.LIBREOFFICE.ROUNDSIG([.B6];15) -> true | D6: of:=FORMULA([.A6]) -> =STDEVPA(O2:O11) | F6: 6 | G6: 10 | I6: 900000005 | J6: 899999995 | L6: 1 | M6: 7 | O6: 3 | P6: 1322 | S6: 6 | T6: 2 | Y6: 2011-05-07 | Z6: 94
A7: of:=STDEVPA([.F1]) -> 0 | B7: 0 | C7: of:=ORG.LIBREOFFICE.ROUNDSIG([.A7];15)=ORG.LIBREOFFICE.ROUNDSIG([.B7];15) -> true | D7: of:=FORMULA([.A7]) -> =STDEVPA(F1) | F7: 7 | G7: 11 | I7: 900000015 | J7: 899999994 | L7: 8 | M7: 5 | O7: 4 | P7: 1310 | S7: 8 | T7: 5 | Y7: 2011-06-07 | Z7: 97
A8: of:=STDEVPA([.H1:.H3]) -> 0 | B8: 0 | C8: of:=ORG.LIBREOFFICE.ROUNDSIG([.A8];15)=ORG.LIBREOFFICE.ROUNDSIG([.B8];15) -> true | D8: of:=FORMULA([.A8]) -> =STDEVPA(H1:H3) | F8: 8 | G8: 12 | I8: 900000007 | J8: 899999993 | L8: 7 | M8: 4 | O8: 5 | P8: 1370 | S8: 9 | T8: 4 | Y8: 2011-07-07 | Z8: 95
A9: of:=STDEVPA("red";1;2) -> 0.816496580927726 | B9: 0.816496580927726 | C9: of:=ORG.LIBREOFFICE.ROUNDSIG([.A9];15)=ORG.LIBREOFFICE.ROUNDSIG([.B9];15) -> true | D9: of:=FORMULA([.A9]) -> =STDEVPA("red",1,2) | F9: 9 | G9: 13 | I9: 900000008 | J9: 899999992 | L9: 5 | M9: 4 | O9: 6 | P9: 1318 | S9: 45 | T9: 12
A10: of:=STDEVPA([.P3:.P12]) -> 26.0545581424825 | B10: 26.0545581424825 | C10: of:=ORG.LIBREOFFICE.ROUNDSIG([.A10];15)=ORG.LIBREOFFICE.ROUNDSIG([.B10];15) -> true | D10: of:=FORMULA([.A10]) -> =STDEVPA(P3:P12) | F10: 10 | G10: 14 | I10: 900000009 | J10: 899999991 | O10: 4 | P10: 1350 | S10: 63521 | T10: 5
A11: of:=STDEVPA([.F14:.G15]) -> 7.17538356723097 | B11: 7.17538356723097 | C11: of:=ORG.LIBREOFFICE.ROUNDSIG([.A11];15)=ORG.LIBREOFFICE.ROUNDSIG([.B11];15) -> true | D11: of:=FORMULA([.A11]) -> =STDEVPA(F14:G15) | F11: 11 | G11: 15 | I11: 900000010 | J11: 899999990 | O11: 7 | P11: 1303 | S11: 654 | T11: 9
A12: of:=STDEVPA(34.5; 2; 8.9; -4) -> 14.6711451495785 | B12: 14.6711451495785 | C12: of:=ORG.LIBREOFFICE.ROUNDSIG([.A12];15)=ORG.LIBREOFFICE.ROUNDSIG([.B12];15) -> true | D12: of:=FORMULA([.A12]) -> =STDEVPA(34.5, 2, 8.9, -4) | I12: 900000011 | J12: 899999989 | P12: 1299 | S12: 2 | T12: 1
A13: of:=STDEVPA("red";1;2;[.F18]) -> 0.707106781186548 | B13: 0.707106781186548 | C13: of:=ORG.LIBREOFFICE.ROUNDSIG([.A13];15)=ORG.LIBREOFFICE.ROUNDSIG([.B13];15) -> true | D13: of:=FORMULA([.A13]) -> =STDEVPA("red",1,2,F18) | I13: 900000012 | J13: 899999988 | S13: 5 | T13: 4
A14: of:=STDEVPA(range) -> 2.63899331455874 | B14: 2.63899331455874 | C14: of:=ORG.LIBREOFFICE.ROUNDSIG([.A14];15)=ORG.LIBREOFFICE.ROUNDSIG([.B14];15) -> true | D14: of:=FORMULA([.A14]) -> =STDEVPA(range) | F14: 14.8333358764648 | G14: 14.8333358764648 | I14: 900000013 | J14: 899999987 | R14: 27.46392 | S14: 17 | T14: -1
F15: a | G15: 1 | I15: 900000014 | J15: 899999986 | R15: 14.8 | S15: 654 | T15: 2
I16: 900000015 | J16: 899999985 | R16: 15.8 | S16: 9 | T16: 654
I17: 900000016 | J17: 899999984 | R17: 16.8 | S17: 2 | T17: 2
F18: of:=TRUE() -> true | I18: 900000017 | J18: 899999983 | R18: 17.8 | S18: 29.55 | T18: 654
I19: 900000018 | J19: 899999982 | R19: 18.8 | S19: 654 | T19: 2
I20: 900000019 | J20: 899999981 | R20: 19.8 | S20: 54 | T20: 65
I21: 900000020 | J21: 899999980 | R21: 20.8 | S21: 58 | T21: 6
I22: 900000021 | J22: 899999979 | R22: 21.8 | S22: 56 | T22: 321
I23: 900000022 | J23: 899999978 | R23: 22.8 | S23: 96 | T23: 5
I24: 900000023 | J24: 899999977
I25: 900000024 | J25: 899999976
I26: 900000025 | J26: 899999975
I27: 900000026 | J27: 899999974
I28: 900000027 | J28: 899999960
I29: 900000028 | J29: 899999972
I30: 900000029 | J30: 899999971
I31: 900000030 | J31: 899999970
I32: 900000031 | J32: 899999969
I33: 900000032 | J33: 899999968
I34: 900000033 | J34: 899999967
I35: 900000034 | J35: 899999966
I36: 900000035 | J36: 899999965
I37: 900000036 | J37: 899999964
I38: 900000037 | J38: 899999963
I39: 900000038 | J39: 899999962
I40: 900000039 | J40: 899999961
I41: 900000040 | J41: 899999960
I42: 900000041 | J42: 899999959
I43: 900000042 | J43: 899999958
I44: 900000043 | J44: 899999957
I45: 900000044 | J45: 899999956
I46: 900000045 | J46: 899999955
I47: 900000046 | J47: 899999954
I48: 900000047 | J48: 899999953
I49: 900000048 | J49: 899999952
I50: 900000049 | J50: 899999951
I51: 900000050 | J51: 899999950
I52: 900000051 | J52: 899999949
I53: 900000052 | J53: 899999948
I54: 900000053 | J54: 899999947
I55: 900000054 | J55: 899999946
I56: 900000055 | J56: 899999945
I57: 900000056 | J57: 899999944
I58: 900000057 | J58: 899999943
I59: 900000058 | J59: 899999942
I60: 900000059 | J60: 899999941
I61: 900000060 | J61: 899999940
I62: 900000061 | J62: 899999939
I63: 900000062 | J63: 899999938
I64: 900000063 | J64: 899999937
I65: 900000064 | J65: 899999936
I66: 900000065 | J66: 899999935
I67: 900000066 | J67: 899999934
I68: 900000067 | J68: 899999933
I69: 900000068 | J69: 899999932
I70: 900000069 | J70: 899999931
I71: 900000070 | J71: 899999930
I72: 900000071 | J72: 899999929
I73: 900000072 | J73: 899999928
I74: 900000073 | J74: 899999927
I75: 900000074 | J75: 899999926
I76: 900000075 | J76: 899999925
I77: 900000076 | J77: 899999924
I78: 900000077 | J78: 899999923
I79: 900000078 | J79: 899999922
I80: 900000079 | J80: 899999921
I81: 900000080 | J81: 899999920
I82: 900000081 | J82: 899999919
I83: 900000082 | J83: 899999918
I84: 900000083 | J84: 899999917
I85: 900000084 | J85: 899999916
I86: 900000085 | J86: 899999915
I87: 900000086 | J87: 899999914
I88: 900000087 | J88: 899999913
I89: 900000088 | J89: 899999912
I90: 900000089 | J90: 899999911
I91: 900000090 | J91: 899999910
I92: 900000091 | J92: 899999909
I93: 900000092 | J93: 899999908
I94: 900000093 | J94: 899999907
I95: 900000094 | J95: 899999906
I96: 900000095 | J96: 899999905
I97: 900000096 | J97: 899999904
I98: 900000097 | J98: 899999903
I99: 900000098 | J99: 899999902
I100: 900000099 | J100: 899999901
I101: 900000100 | J101: 899999900