Sheet: Sheet1
A1: VAR.S Function
A3: Result | B3: of:=AND([.B8:.B95]) -> true
A7: Sheet | B7: Result | C7: Description
A8: 1 | B8: of:=AND([Sheet2.C2:.C841]) -> true | C8: Simple VAR.S formulas with local references and values

Sheet: Sheet2
A1: Function | B1: Expected | C1: Correct | D1: FunctionString | E1: Comment | F1: 1 | G1: 10 | H1: 1 | I1: 0 | L1: Data | O1: Data | Q1: Data 1 | R1: Data 2 | T1: 0.402599231572822 | U1: 0.169946761336178 | W1: 8552665 | X1: 3074922 | Z1: Strength
A2: of:=COM.MICROSOFT.VAR.S([.F1:.F11]) -> 11 | B2: 11 | C2: of:=ROUND([.A2];12)=ROUND([.B2];12) -> true | D2: of:=FORMULA([.A2]) -> =VAR.S(F1:F11) | F2: 2 | G2: 11 | H2: 2 | I2: 0 | L2: Known y | M2: Known x | O2: 1.959999998 | Q2: 3 | R2: 6 | T2: 0.194342606933787 | U2: 0.553136259317398 | W2: 7481669 | X2: 8556813 | Z2: 1345
A3: of:=COM.MICROSOFT.VAR.S([.F1:.H11]) -> 28.875 | B3: 28.875 | C3: of:=ROUND([.A3];12)=ROUND([.B3];12) -> true | D3: of:=FORMULA([.A3]) -> =VAR.S(F1:H11) | F3: 3 | G3: 12 | H3: 3 | I3: 0 | L3: 2 | M3: 6 | O3: 60 | Q3: 4 | R3: 19 | T3: 0.400653343414888 | U3: 0.600289918482304 | W3: 2509284 | X3: 7408365 | Z3: 1301
A4: of:=COM.MICROSOFT.VAR.S([.I1:.I11]) -> 0 | B4: 0 | C4: of:=ROUND([.A4];12)=ROUND([.B4];12) -> true | D4: of:=FORMULA([.A4]) -> =VAR.S(I1:I11) | F4: 4 | G4: 13 | H4: 4 | I4: 0 | L4: 3 | M4: 5 | Q4: 5 | R4: 3 | T4: 0.166463582077995 | U4: 0.933991111814976 | W4: 4728052 | X4: 7078017 | Z4: 1368
A5: of:=COM.MICROSOFT.VAR.S([.H1:.I11]) -> 14.6666666666667 | B5: 14.6666666666667 | C5: of:=ROUND([.A5];12)=ROUND([.B5];12) -> true | D5: of:=FORMULA([.A5]) -> =VAR.S(H1:I11) | F5: 5 | G5: 14 | H5: 5 | I5: 0 | L5: 9 | M5: 11 | Q5: 8 | R5: 2 | T5: 0.0874699170235544 | U5: 0.263295787386596 | W5: 9492106 | X5: 4543035 | Z5: 1322
A6: of:=COM.MICROSOFT.VAR.S([.F1:.H15]) -> 11903796230.0349 | B6: 11903796230.0349 | C6: of:=ROUND([.A6];12)=ROUND([.B6];12) -> true | D6: of:=FORMULA([.A6]) -> =VAR.S(F1:H15) | F6: 6 | G6: 15 | H6: 6 | I6: 0 | L6: 1 | M6: 7 | Q6: 9 | R6: 14 | T6: 0.341886235401034 | U6: 0.61026608501561 | W6: 9190083 | X6: 7356869 | Z6: 1310
A7: of:=COM.MICROSOFT.VAR.S([.O2];[.O3]) -> 1684.32080011608 | B7: 1684.32080011608 | C7: of:=ROUND([.A7];12)=ROUND([.B7];12) -> true | D7: of:=FORMULA([.A7]) -> =VAR.S(O2,O3) | F7: 7 | G7: 16 | H7: 7 | I7: 0 | L7: 8 | M7: 5 | Q7: 1 | R7: 4 | T7: 0.946274813031778 | U7: 0.417558070970699 | W7: 3187739 | X7: 1005585 | Z7: 1370
A8: of:=COM.MICROSOFT.VAR.S([.T1:.U50]) -> 0.0948598612388292 | B8: 0.0948598612388292 | C8: of:=ROUND([.A8];12)=ROUND([.B8];12) -> true | D8: of:=FORMULA([.A8]) -> =VAR.S(T1:U50) | F8: 8 | G8: 17 | H8: 8 | I8: 0 | L8: 7 | M8: 4 | Q8: 2 | R8: 5 | T8: 0.984649823047221 | U8: 0.102857194375247 | W8: 8532672 | X8: 6939400 | Z8: 1318
A9: of:=COM.MICROSOFT.VAR.S({1;5;8;9;9;6;8;5;6}) -> 6.5 | B9: 6.5 | C9: of:=ROUND([.A9];12)=ROUND([.B9];12) -> true | D9: of:=FORMULA([.A9]) -> =VAR.S({1,5,8,9,9,6,8,5,6}) | F9: 9 | G9: 18 | H9: 9 | I9: 0 | L9: 5 | M9: 4 | Q9: 4 | R9: 17 | T9: 0.910959278000519 | U9: 0.79397261980921 | W9: 3341879 | X9: 4685642 | Z9: 1350
A10: of:=COM.MICROSOFT.VAR.S([.F1:.F11];[.G1:.G11]) -> 31.6904761904762 | B10: 31.6904761904762 | C10: of:=ROUND([.A10];12)=ROUND([.B10];12) -> true | D10: of:=FORMULA([.A10]) -> {=VAR.S(F1:F11,G1:G11)} | F10: 10 | G10: 19 | H10: 10 | I10: 0 | Q10: 5 | R10: 1 | T10: 0.730935096507892 | U10: 0.0627837025094777 | W10: 4908433 | X10: 2657984 | Z10: 1303
A11: of:=COM.MICROSOFT.VAR.S([.W1:.X50]) -> 7460126524549.32 | B11: 7460126524549.32 | C11: of:=ROUND([.A11];12)=ROUND([.B11];12) -> true | D11: of:=FORMULA([.A11]) -> =VAR.S(W1:X50) | F11: 11 | G11: 20 | H11: 11 | I11: 0 | T11: 0.208618188742548 | U11: 0.416508829686791 | W11: 3865741 | X11: 1501184 | Z11: 1299
A12: of:=COM.MICROSOFT.VAR.S([.L2:.M9]) -> 7.5 | B12: 7.5 | C12: of:=ROUND([.A12];12)=ROUND([.B12];12) -> true | D12: of:=FORMULA([.A12]) -> =VAR.S(L2:M9) | T12: 0.731778104091063 | U12: 0.00148327462375164 | W12: 2767869 | X12: 9437578
A13: of:=COM.MICROSOFT.VAR.S(34.5; 2; 8.9; -4) -> 286.99 | B13: 286.99 | C13: of:=ROUND([.A13];12)=ROUND([.B13];12) -> true | D13: of:=FORMULA([.A13]) -> =VAR.S(34.5, 2, 8.9, -4) | T13: 0.960519265849143 | U13: 0.986836141906679 | W13: 3938311 | X13: 6737575
A14: of:=COM.MICROSOFT.VAR.S(2; 6; 4) -> 4 | B14: 4 | C14: of:=ROUND([.A14];12)=ROUND([.B14];12) -> true | D14: of:=FORMULA([.A14]) -> =VAR.S(2, 6, 4) | T14: 0.176640923600644 | U14: 0.868845847435296 | W14: 5625009 | X14: 9873303
A15: of:=COM.MICROSOFT.VAR.S(5) ->  | B15: of:#DIV/0! ->  | C15: of:=ISERROR([.A15]) -> true | D15: of:=FORMULA([.A15]) -> =VAR.S(5) | F15: 654654 | G15: 654 | H15: 1 | T15: 0.47322227130644 | U15: 0.174563129432499 | W15: 7267618 | X15: 9079612
A16: of:=COM.MICROSOFT.VAR.S() ->  | B16: of:#DIV/0! ->  | C16: of:=ISERROR([.A16]) -> true | D16: of:=FORMULA([.A16]) -> =VAR.S() | T16: 0.111749193863943 | U16: 0.84864505729638 | W16: 9431548 | X16: 1847774
A17: of:=COM.MICROSOFT.VAR.S([.Z2:.Z11]) -> 754.266666666667 | B17: 754.266666666667 | C17: of:=ROUND([.A17];12)=ROUND([.B17];12) -> true | D17: of:=FORMULA([.A17]) -> =VAR.S(Z2:Z11) | T17: 0.370022197486833 | U17: 0.723300355952233 | W17: 3559141 | X17: 9009030
A18: of:=COM.MICROSOFT.VAR.S([.Z2:.Z11]) -> 754.266666666667 | B18: 754.266666666667 | C18: of:=ROUND([.A18];12)=ROUND([.B18];12) -> true | D18: of:=FORMULA([.A18]) -> =VAR.S(Z2:Z11) | T18: 0.120431510265917 | U18: 0.000142202246934176 | W18: 5945703 | X18: 7898957
A19: of:=COM.MICROSOFT.VAR.S([.F1];[.F3];[.F5];[.F8];[.F10];[.G1:.G4];[.H3:.H5];[.H7];[.I2:.I4];[.H9];[.H10]) -> 19.3235294117647 | B19: 19.3235294117647 | C19: of:=ROUND([.A19];12)=ROUND([.B19];12) -> true | D19: of:=FORMULA([.A19]) -> =VAR.S(F1,F3,F5,F8,F10,G1:G4,H3:H5,H7,I2:I4,H9,H10) | T19: 0.865659103030339 | U19: 0.632935213157907 | W19: 7984156 | X19: 4399157
T20: 0.541276043280959 | U20: 0.00164673151448369 | W20: 4432625 | X20: 9694088
T21: 0.900038912659511 | U21: 0.480235474649817 | W21: 8178174 | X21: 1036046
T22: 0.0852331160567701 | U22: 0.822807915043086 | W22: 3225044 | X22: 9994446
T23: 0.337206659838557 | U23: 0.882674962980673 | W23: 6541568 | X23: 8049474
T24: 0.854269005125389 | U24: 0.445781395072117 | W24: 1107357 | X24: 2602486
T25: 0.374721442349255 | U25: 0.927562230965123 | W25: 6963489 | X25: 8730810
T26: 0.114541406510398 | U26: 0.590035588946193 | W26: 6077068 | X26: 9310994
T27: 0.585630424786359 | U27: 0.828813797561452 | W27: 6451861 | X27: 7775444
T28: 0.490436446852982 | U28: 0.573860642267391 | W28: 6215359 | X28: 2272326
T29: 0.661826125346124 | U29: 0.390011037467048 | W29: 1185094 | X29: 6206128
T30: 0.90019579930231 | U30: 0.0125897352118045 | W30: 5466990 | X30: 5749957
T31: 0.190245887031779 | U31: 0.0778719519730657 | W31: 6251428 | X31: 8965550
T32: 0.079322624951601 | U32: 0.592421405483037 | W32: 4400517 | X32: 7338363
T33: 0.564420772949234 | U33: 0.163427012506872 | W33: 3506074 | X33: 4923325
T34: 0.53767328010872 | U34: 0.434568428434432 | W34: 3420161 | X34: 8046945
T35: 0.555512311169878 | U35: 0.707729241810739 | W35: 8550004 | X35: 8662156
T36: 0.738904951605946 | U36: 0.544847761048004 | W36: 4029164 | X36: 1913344
T37: 0.570837055100128 | U37: 0.962746524251998 | W37: 7606323 | X37: 1179514
T38: 0.806615271605551 | U38: 0.0734127666801214 | W38: 4726767 | X38: 7705044
T39: 0.547012639464811 | U39: 0.95261645084247 | W39: 3149183 | X39: 2390287
T40: 0.111656288150698 | U40: 0.807385856285691 | W40: 4826736 | X40: 9097683
T41: 0.690662265289575 | U41: 0.519585096277297 | W41: 7102886 | X41: 3930311
T42: 0.19111926923506 | U42: 0.682888984447345 | W42: 4544936 | X42: 1948888
T43: 0.353901885449886 | U43: 0.0328412540256977 | W43: 9516170 | X43: 4860706
T44: 0.375091741094366 | U44: 0.15249035647139 | W44: 4544808 | X44: 9528384
T45: 0.864874634193257 | U45: 0.724242072319612 | W45: 8098131 | X45: 2281210
T46: 0.0521850974764675 | U46: 0.0781809757463634 | W46: 9892488 | X46: 1132694
T47: 0.943212330807 | U47: 0.398327849339694 | W47: 8895316 | X47: 6201710
T48: 0.391606026794761 | U48: 0.100461794994771 | W48: 8124228 | X48: 1184235
T49: 0.0378217191901058 | U49: 0.152158367680386 | W49: 9924769 | X49: 1549788
T50: 0.206768939038739 | U50: 0.676331433933228 | W50: 4065477 | X50: 7033438