Sheet: Sheet1
A1: WEIBULL.DIST Function
A3: Result | B3: of:=AND([.B8:.B95]) -> true
A7: Sheet | B7: Result | C7: Description
A8: 1 | B8: of:=AND([Sheet2.C2:.C841]) -> true | C8: Simple WEIBULL.DIST formulas with local references and values

Sheet: Sheet2
A1: Function | B1: Expected | C1: Correct | D1: FunctionString | E1: Comment | F1: 1 | G1: 10 | H1: 1 | I1: 0 | L1: Data | O1: Data | Q1: Data 1 | R1: Data 2 | T1: 0.402599231572822 | U1: 0.169946761336178 | V1: 2
A2: of:=COM.MICROSOFT.WEIBULL.DIST(2;1;1;1) -> 0.864664716763387 | B2: 0.864664716763387 | C2: of:=ROUND([.A2];12)=ROUND([.B2];12) -> true | D2: of:=FORMULA([.A2]) -> =WEIBULL.DIST(2,1,1,1) | F2: 2 | G2: 11 | H2: 2 | I2: 0 | L2: Known y | M2: Known x | O2: 1.959999998 | P2: 0.400653343414888 | Q2: 3 | R2: 6 | T2: 0.194342606933787 | U2: 0.553136259317398 | V2: 3 | AB2: 105
A3: of:=COM.MICROSOFT.WEIBULL.DIST(2.5; 3; 4; 1) -> 0.216622535939182 | B3: 0.216622535939182 | C3: of:=ROUND([.A3];12)=ROUND([.B3];12) -> true | D3: of:=FORMULA([.A3]) -> =WEIBULL.DIST(2.5, 3, 4, 1) | F3: 3 | G3: 12 | H3: 3 | I3: 0 | L3: 2 | M3: 6 | O3: 60 | P3: 0.166463582077995 | Q3: 4 | R3: 19 | T3: 0.400653343414888 | U3: 0.600289918482304 | V3: 4 | AB3: 20
A4: of:=COM.MICROSOFT.WEIBULL.DIST(2.5; 3; 4; 0) -> 0.229505116424068 | B4: 0.229505116424068 | C4: of:=ROUND([.A4];12)=ROUND([.B4];12) -> true | D4: of:=FORMULA([.A4]) -> =WEIBULL.DIST(2.5, 3, 4, 0) | F4: 4 | G4: 13 | H4: 4 | I4: 0 | L4: 3 | M4: 5 | P4: 0.0874699170235544 | Q4: 5 | R4: 3 | T4: 0.166463582077995 | U4: 0.933991111814976 | AB4: 100
A5: of:=COM.MICROSOFT.WEIBULL.DIST([.AB2];[.AB3];[.AB4];1) -> 0.929581390069277 | B5: 0.929581390069277 | C5: of:=ROUND([.A5];12)=ROUND([.B5];12) -> true | D5: of:=FORMULA([.A5]) -> =WEIBULL.DIST(AB2,AB3,AB4,1) | F5: 5 | G5: 14 | H5: 5 | I5: 0 | L5: 9 | M5: 11 | P5: 0.341886235401034 | Q5: 8 | R5: 2 | T5: 0.0874699170235544 | U5: 0.263295787386596
A6: of:=COM.MICROSOFT.WEIBULL.DIST([.AB2];[.AB3];[.AB4];0) -> 0.0355888640245043 | B6: 0.0355888640245043 | C6: of:=ROUND([.A6];12)=ROUND([.B6];12) -> true | D6: of:=FORMULA([.A6]) -> =WEIBULL.DIST(AB2,AB3,AB4,0) | F6: 6 | G6: 15 | H6: 6 | I6: 0 | L6: 1 | M6: 7 | P6: 0.946274813031778 | Q6: 9 | R6: 14 | T6: 0.341886235401034 | U6: 0.61026608501561
A7: of:=COM.MICROSOFT.WEIBULL.DIST([.F1:.F11];[.G1:.G11];[.H1:.H11];1) -> 0.632120558828558 | B7: 0.632120558828558 | C7: of:=ROUND([.A7];12)=ROUND([.B7];12) -> true | D7: of:=FORMULA([.A7]) -> {=WEIBULL.DIST(F1:F11,G1:G11,H1:H11,1)} | F7: 7 | G7: 16 | H7: 7 | I7: 0 | L7: 8 | M7: 5 | P7: 0.984649823047221 | Q7: 1 | R7: 4 | T7: 0.946274813031778 | U7: 0.417558070970699
A8: 0.632120558828558 | B8: 0.632120558828558 | C8: of:=ROUND([.A8];12)=ROUND([.B8];12) -> true | D8: of:=FORMULA([.A8]) -> {=WEIBULL.DIST(F1:F11,G1:G11,H1:H11,1)} | F8: 8 | G8: 17 | H8: 8 | I8: 0 | L8: 7 | M8: 4 | P8: 0.910959278000519 | Q8: 2 | R8: 5 | T8: 0.984649823047221 | U8: 0.102857194375247
A9: 0.632120558828558 | B9: 0.632120558828558 | C9: of:=ROUND([.A9];12)=ROUND([.B9];12) -> true | D9: of:=FORMULA([.A9]) -> {=WEIBULL.DIST(F1:F11,G1:G11,H1:H11,1)} | F9: 9 | G9: 18 | H9: 9 | I9: 0 | L9: 5 | M9: 4 | P9: 0.730935096507892 | Q9: 4 | R9: 17 | T9: 0.910959278000519 | U9: 0.79397261980921
A10: 0.632120558828558 | B10: 0.632120558828558 | C10: of:=ROUND([.A10];12)=ROUND([.B10];12) -> true | D10: of:=FORMULA([.A10]) -> {=WEIBULL.DIST(F1:F11,G1:G11,H1:H11,1)} | F10: 10 | G10: 19 | H10: 10 | I10: 0 | P10: 1.40065334341489 | Q10: 5 | R10: 1 | T10: 0.730935096507892 | U10: 0.0627837025094777
A11: 0.632120558828558 | B11: 0.632120558828558 | C11: of:=ROUND([.A11];12)=ROUND([.B11];12) -> true | D11: of:=FORMULA([.A11]) -> {=WEIBULL.DIST(F1:F11,G1:G11,H1:H11,1)} | F11: 11 | G11: 20 | H11: 11 | I11: 0 | T11: 0.208618188742548 | U11: 0.416508829686791
A12: 0.632120558828558 | B12: 0.632120558828558 | C12: of:=ROUND([.A12];12)=ROUND([.B12];12) -> true | D12: of:=FORMULA([.A12]) -> {=WEIBULL.DIST(F1:F11,G1:G11,H1:H11,1)} | T12: 0.731778104091063 | U12: 0.00148327462375164
A13: 0.632120558828558 | B13: 0.632120558828558 | C13: of:=ROUND([.A13];12)=ROUND([.B13];12) -> true | D13: of:=FORMULA([.A13]) -> {=WEIBULL.DIST(F1:F11,G1:G11,H1:H11,1)} | T13: 0.960519265849143 | U13: 0.986836141906679
A14: 0.632120558828558 | B14: 0.632120558828558 | C14: of:=ROUND([.A14];12)=ROUND([.B14];12) -> true | D14: of:=FORMULA([.A14]) -> {=WEIBULL.DIST(F1:F11,G1:G11,H1:H11,1)} | T14: 0.176640923600644 | U14: 0.868845847435296
A15: 0.632120558828558 | B15: 0.632120558828558 | C15: of:=ROUND([.A15];12)=ROUND([.B15];12) -> true | D15: of:=FORMULA([.A15]) -> {=WEIBULL.DIST(F1:F11,G1:G11,H1:H11,1)} | F15: 654654 | G15: 654 | H15: 1 | T15: 0.47322227130644 | U15: 0.174563129432499
A16: 0.632120558828558 | B16: 0.632120558828558 | C16: of:=ROUND([.A16];12)=ROUND([.B16];12) -> true | D16: of:=FORMULA([.A16]) -> {=WEIBULL.DIST(F1:F11,G1:G11,H1:H11,1)} | T16: 0.111749193863943 | U16: 0.84864505729638
A17: 0.632120558828558 | B17: 0.632120558828558 | C17: of:=ROUND([.A17];12)=ROUND([.B17];12) -> true | D17: of:=FORMULA([.A17]) -> {=WEIBULL.DIST(F1:F11,G1:G11,H1:H11,1)} | T17: 0.370022197486833 | U17: 0.723300355952233
B18: of:#N/A ->  | C18: of:=ISERROR([.A18]) -> true | D18: of:=FORMULA([.A18]) -> {=WEIBULL.DIST(F1:F11,G1:G11,H1:H11,1)} | T18: 0.120431510265917 | U18: 0.000142202246934176
B19: of:#N/A ->  | C19: of:=ISERROR([.A19]) -> true | D19: of:=FORMULA([.A19]) -> {=WEIBULL.DIST(F1:F11,G1:G11,H1:H11,1)} | T19: 0.865659103030339 | U19: 0.632935213157907
B20: of:#N/A ->  | C20: of:=ISERROR([.A20]) -> true | D20: of:=FORMULA([.A20]) -> {=WEIBULL.DIST(F1:F11,G1:G11,H1:H11,1)} | T20: 0.541276043280959 | U20: 0.00164673151448369
A21: of:=COM.MICROSOFT.WEIBULL.DIST([.P2:.P10];[.Q2:.Q10];[.R2:.R10];1) -> 0.000297706219980154 | B21: 0.000297706219980154 | C21: of:=ROUND([.A21];12)=ROUND([.B21];12) -> true | D21: of:=FORMULA([.A21]) -> {=WEIBULL.DIST(P2:P10,Q2:Q10,R2:R10,1)} | T21: 0.900038912659511 | U21: 0.480235474649817
A22: 0.00000000589199733447288 | B22: 0.00000000589199733447288 | C22: of:=ROUND([.A22];12)=ROUND([.B22];12) -> true | D22: of:=FORMULA([.A22]) -> {=WEIBULL.DIST(P2:P10,Q2:Q10,R2:R10,1)} | T22: 0.0852331160567701 | U22: 0.822807915043086
A23: 0.0000000210711041948031 | B23: 0.0000000210711041948031 | C23: of:=ROUND([.A23];12)=ROUND([.B23];12) -> true | D23: of:=FORMULA([.A23]) -> {=WEIBULL.DIST(P2:P10,Q2:Q10,R2:R10,1)} | T23: 0.337206659838557 | U23: 0.882674962980673
A24: 0.000000729143158739731 | B24: 0.000000729143158739731 | C24: of:=ROUND([.A24];12)=ROUND([.B24];12) -> true | D24: of:=FORMULA([.A24]) -> {=WEIBULL.DIST(P2:P10,Q2:Q10,R2:R10,1)} | T24: 0.854269005125389 | U24: 0.445781395072117
A25: 0.0000000000294444468806887 | B25: 0.0000000000294444468806887 | C25: of:=ROUND([.A25];12)=ROUND([.B25];12) -> true | D25: of:=FORMULA([.A25]) -> {=WEIBULL.DIST(P2:P10,Q2:Q10,R2:R10,1)} | T25: 0.374721442349255 | U25: 0.927562230965123
A26: 0.218204792527608 | B26: 0.218204792527608 | C26: of:=ROUND([.A26];12)=ROUND([.B26];12) -> true | D26: of:=FORMULA([.A26]) -> {=WEIBULL.DIST(P2:P10,Q2:Q10,R2:R10,1)} | T26: 0.114541406510398 | U26: 0.590035588946193
A27: 0.0326490011035895 | B27: 0.0326490011035895 | C27: of:=ROUND([.A27];12)=ROUND([.B27];12) -> true | D27: of:=FORMULA([.A27]) -> {=WEIBULL.DIST(P2:P10,Q2:Q10,R2:R10,1)} | T27: 0.585630424786359 | U27: 0.828813797561452
A28: 0.00000341758113775459 | B28: 0.00000341758113775459 | C28: of:=ROUND([.A28];12)=ROUND([.B28];12) -> true | D28: of:=FORMULA([.A28]) -> {=WEIBULL.DIST(P2:P10,Q2:Q10,R2:R10,1)} | T28: 0.490436446852982 | U28: 0.573860642267391
A29: 0.995441679974298 | B29: 0.995441679974298 | C29: of:=ROUND([.A29];12)=ROUND([.B29];12) -> true | D29: of:=FORMULA([.A29]) -> {=WEIBULL.DIST(P2:P10,Q2:Q10,R2:R10,1)} | T29: 0.661826125346124 | U29: 0.390011037467048
A30: of:=COM.MICROSOFT.WEIBULL.DIST(0;1;1;1) -> 0 | B30: 0 | C30: of:=ROUND([.A30];12)=ROUND([.B30];12) -> true | D30: of:=FORMULA([.A30]) -> =WEIBULL.DIST(0,1,1,1) | T30: 0.90019579930231 | U30: 0.0125897352118045
A31: of:=COM.MICROSOFT.WEIBULL.DIST(-2;1;1;1) ->  | B31: of:#ERR502! ->  | C31: of:=ISERROR([.A31]) -> true | D31: of:=FORMULA([.A31]) -> =WEIBULL.DIST(-2,1,1,1) | T31: 0.190245887031779 | U31: 0.0778719519730657
A32: of:=COM.MICROSOFT.WEIBULL.DIST(2;0;1;1) ->  | B32: of:#ERR502! ->  | C32: of:=ISERROR([.A32]) -> true | D32: of:=FORMULA([.A32]) -> =WEIBULL.DIST(2,0,1,1) | T32: 0.079322624951601 | U32: 0.592421405483037
A33: of:=COM.MICROSOFT.WEIBULL.DIST(2;1;0;1) ->  | B33: of:#ERR502! ->  | C33: of:=ISERROR([.A33]) -> true | D33: of:=FORMULA([.A33]) -> =WEIBULL.DIST(2,1,0,1) | T33: 0.564420772949234 | U33: 0.163427012506872
A34: of:=COM.MICROSOFT.WEIBULL.DIST(2;1;-1;1) ->  | B34: of:#ERR502! ->  | C34: of:=ISERROR([.A34]) -> true | D34: of:=FORMULA([.A34]) -> =WEIBULL.DIST(2,1,-1,1) | T34: 0.53767328010872 | U34: 0.434568428434432
A35: of:=COM.MICROSOFT.WEIBULL.DIST(2;-1;1;1) ->  | B35: of:#ERR502! ->  | C35: of:=ISERROR([.A35]) -> true | D35: of:=FORMULA([.A35]) -> =WEIBULL.DIST(2,-1,1,1) | T35: 0.555512311169878 | U35: 0.707729241810739
A36: of:=COM.MICROSOFT.WEIBULL.DIST(2;1;1;-1) -> 0.864664716763387 | B36: 0.864664716763387 | C36: of:=ROUND([.A36];12)=ROUND([.B36];12) -> true | D36: of:=FORMULA([.A36]) -> =WEIBULL.DIST(2,1,1,-1) | T36: 0.738904951605946 | U36: 0.544847761048004
A37: of:=COM.MICROSOFT.WEIBULL.DIST(2;1;1;6) -> 0.864664716763387 | B37: 0.864664716763387 | C37: of:=ROUND([.A37];12)=ROUND([.B37];12) -> true | D37: of:=FORMULA([.A37]) -> =WEIBULL.DIST(2,1,1,6) | T37: 0.570837055100128 | U37: 0.962746524251998
T38: 0.806615271605551 | U38: 0.0734127666801214
T39: 0.547012639464811 | U39: 0.95261645084247
T40: 0.111656288150698 | U40: 0.807385856285691
T41: 0.690662265289575 | U41: 0.519585096277297
T42: 0.19111926923506 | U42: 0.682888984447345
T43: 0.353901885449886 | U43: 0.0328412540256977
T44: 0.375091741094366 | U44: 0.15249035647139
T45: 0.864874634193257 | U45: 0.724242072319612
T46: 0.0521850974764675 | U46: 0.0781809757463634
T47: 0.943212330807 | U47: 0.398327849339694
T48: 0.391606026794761 | U48: 0.100461794994771
T49: 0.0378217191901058 | U49: 0.152158367680386
T50: 0.206768939038739 | U50: 0.676331433933228