Sheet: Sheet1
A1: Z.TEST Function
A3: Result | B3: of:=AND([.B8:.B95]) -> true
A7: Sheet | B7: Result | C7: Description
A8: 1 | B8: of:=AND([Sheet2.C2:.C841]) -> true | C8: Simple Z.TEST formulas with local references and values

Sheet: Sheet2
A1: Function | B1: Expected | C1: Correct | D1: FunctionString | E1: Comment | F1: 0.08 | G1: 10 | H1: 1 | I1: 1.9 | O1: Data | Q1: Data 1 | R1: Data 2 | T1: 0.402599231572822 | U1: 2 | Y1: Data
A2: of:=COM.MICROSOFT.Z.TEST([.F1:.F11];[.G1];[.H2]) -> 1 | B2: 1 | C2: of:=ROUND([.A2];12)=ROUND([.B2];12) -> true | D2: of:=FORMULA([.A2]) -> =Z.TEST(F1:F11,G1,H2) | F2: 0.09 | G2: 11 | H2: 2 | I2: 2.9 | O2: 1.959999998 | P2: 0.400653343414888 | Q2: 3 | R2: 6 | T2: 0.194342606933787 | U2: 3 | W2: 58 | X2: 35 | Y2: 3 | AB2: 105
A3: of:=COM.MICROSOFT.Z.TEST([.F1:.G11];[.H6];[.I5]) -> 0.106721692449657 | B3: 0.106721692449657 | C3: of:=ROUND([.A3];12)=ROUND([.B3];12) -> true | D3: of:=FORMULA([.A3]) -> =Z.TEST(F1:G11,H6,I5) | F3: 0.1 | G3: 12 | H3: 3 | I3: 3.9 | L3: -0.2 | M3: 6 | O3: 60 | P3: 0.166463582077995 | Q3: 4 | R3: 19 | T3: 0.400653343414888 | U3: 4 | W3: 11 | X3: 25 | Y3: 6 | AB3: 20
A4: of:=COM.MICROSOFT.Z.TEST([.F3:.I9];[.H2];[.G10]) -> 0.0815698404975905 | B4: 0.0815698404975905 | C4: of:=ROUND([.A4];12)=ROUND([.B4];12) -> true | D4: of:=FORMULA([.A4]) -> =Z.TEST(F3:I9,H2,G10) | F4: 0.11 | G4: 13 | H4: 4 | I4: 4.9 | L4: 0.8 | M4: 5 | P4: 0.0874699170235544 | Q4: 5 | R4: 3 | T4: 0.166463582077995 | U4: 5 | W4: 10 | X4: 23 | Y4: 7 | AB4: 100
A5: of:=COM.MICROSOFT.Z.TEST([.F4:.I11];[.I2];[.G1]) -> 0.001527889995942 | B5: 0.001527889995942 | C5: of:=ROUND([.A5];12)=ROUND([.B5];12) -> true | D5: of:=FORMULA([.A5]) -> =Z.TEST(F4:I11,I2,G1) | F5: 0.12 | G5: 14 | H5: 5 | I5: 5.9 | L5: 1.8 | M5: 11 | P5: 0.341886235401034 | Q5: 8 | R5: 2 | T5: 0.0874699170235544 | U5: 6 | Y5: 8
A6: of:=COM.MICROSOFT.Z.TEST([.L3:.M9];[.I8];[.H9]) -> 0.969315585430299 | B6: 0.969315585430299 | C6: of:=ROUND([.A6];12)=ROUND([.B6];12) -> true | D6: of:=FORMULA([.A6]) -> =Z.TEST(L3:M9,I8,H9) | F6: 0.13 | G6: 15 | H6: 6 | I6: 6.9 | L6: 2.8 | M6: 7 | P6: 0.946274813031778 | Q6: 9 | R6: 14 | T6: 0.341886235401034 | U6: 7 | W6: 45.35 | X6: 47.65 | Y6: 6
A7: of:=COM.MICROSOFT.Z.TEST([.O2:.P10];[.M5];[.H6]) -> 0.996171942651607 | B7: 0.996171942651607 | C7: of:=ROUND([.A7];12)=ROUND([.B7];12) -> true | D7: of:=FORMULA([.A7]) -> =Z.TEST(O2:P10,M5,H6) | F7: 0.14 | G7: 16 | H7: 7 | I7: 7.9 | L7: 3.8 | M7: 5 | P7: 0.984649823047221 | Q7: 1 | R7: 4 | T7: 0.946274813031778 | U7: 8 | W7: 17.56 | X7: 18.44 | Y7: 5
A8: of:=COM.MICROSOFT.Z.TEST([.T1:.U14];[.W3];[.W6]) -> 0.775598866865391 | B8: 0.775598866865391 | C8: of:=ROUND([.A8];12)=ROUND([.B8];12) -> true | D8: of:=FORMULA([.A8]) -> =Z.TEST(T1:U14,W3,W6) | F8: 0.15 | G8: 17 | H8: 8 | I8: 8.9 | L8: 4.8 | M8: 4 | P8: 0.910959278000519 | Q8: 2 | R8: 5 | T8: 0.984649823047221 | U8: 9 | W8: 16.09 | X8: 16.91 | Y8: 4
A9: of:=COM.MICROSOFT.Z.TEST([.W2:.X8];[.AB2];[.AB3]) -> 1 | B9: 1 | C9: of:=ROUND([.A9];12)=ROUND([.B9];12) -> true | D9: of:=FORMULA([.A9]) -> =Z.TEST(W2:X8,AB2,AB3) | F9: 0.16 | G9: 18 | H9: 9 | I9: 9.9 | L9: 5.8 | M9: 4 | P9: 0.730935096507892 | Q9: 4 | R9: 17 | T9: 0.910959278000519 | U9: 10 | Y9: 2
A10: of:=COM.MICROSOFT.Z.TEST([.Y2:.Y11];4) -> 0.0905741968513638 | B10: 0.0905741968513638 | C10: of:=ROUND([.A10];12)=ROUND([.B10];12) -> true | D10: of:=FORMULA([.A10]) -> =Z.TEST(Y2:Y11,4) | F10: 0.17 | G10: 19 | H10: 10 | I10: 10.9 | P10: 1.40065334341489 | Q10: 5 | R10: 1 | T10: 0.730935096507892 | U10: 11 | Y10: 1
A11: of:=2*MIN(COM.MICROSOFT.Z.TEST([.Y2:.Y11];4);1-COM.MICROSOFT.Z.TEST([.Y2:.Y11];4)) -> 0.181148393702728 | B11: 0.181148393702728 | C11: of:=ROUND([.A11];12)=ROUND([.B11];12) -> true | D11: of:=FORMULA([.A11]) -> =2*MIN(Z.TEST(Y2:Y11,4),1-Z.TEST(Y2:Y11,4)) | F11: 0.18 | G11: 20 | H11: 11 | I11: 11.9 | T11: 0.208618188742548 | U11: 12 | Y11: 9
A12: of:=COM.MICROSOFT.Z.TEST([.Y2:.Y11];6) -> 0.86304338912953 | B12: 0.86304338912953 | C12: of:=ROUND([.A12];12)=ROUND([.B12];12) -> true | D12: of:=FORMULA([.A12]) -> =Z.TEST(Y2:Y11,6) | T12: 0.731778104091063 | U12: 13
A13: of:=2*MIN(COM.MICROSOFT.Z.TEST([.Y2:.Y11];6);1-COM.MICROSOFT.Z.TEST([.A2:.YY11];6)) -> 1.72608677825906 | B13: 1.72608677825906 | C13: of:=ROUND([.A13];12)=ROUND([.B13];12) -> true | D13: of:=FORMULA([.A13]) -> =2*MIN(Z.TEST(Y2:Y11,6),1-Z.TEST(A2:YY11,6)) | T13: 0.960519265849143 | U13: 14
A14: of:=COM.MICROSOFT.Z.TEST([.F3:.I9];[.H2]) -> 0.00000151051498603616 | B14: 0.00000151051498603616 | C14: of:=ROUND([.A14];12)=ROUND([.B14];12) -> true | D14: of:=FORMULA([.A14]) -> =Z.TEST(F3:I9,H2) | T14: 0.176640923600644 | U14: 15
A15: of:=COM.MICROSOFT.Z.TEST([.F1];[.G1];[.H1]) ->  | B15: of:#DIV/0! ->  | C15: of:=ISERROR([.A15]) -> true | D15: of:=FORMULA([.A15]) -> =Z.TEST(F1,G1,H1) | F15: 654654 | G15: 654 | H15: 1
A16: of:=COM.MICROSOFT.Z.TEST([.I19:.I23];20) -> 0.254717826485009 | B16: 0.254717826485009 | C16: of:=ROUND([.A16];12)=ROUND([.B16];12) -> true | D16: of:=FORMULA([.A16]) -> =Z.TEST(I19:I23,20)
A17: of:=COM.MICROSOFT.Z.TEST([.I19:.I23];20; STDEV([.I19:.I23])) -> 0.254717826485009 | B17: 0.254717826485009 | C17: of:=ROUND([.A17];12)=ROUND([.B17];12) -> true | D17: of:=FORMULA([.A17]) -> =Z.TEST(I19:I23,20, STDEV(I19:I23))
I19: 11.4
I20: 17.3
I21: 21.3
I22: 25.9
I23: 40.1