Sheet: Sheet1
A1: YEARFRAC Function
A3: Result | B3: of:=AND([.B8:.B95]) -> true
A7: Sheet | B7: Result | C7: Description
A8: 1 | B8: of:=AND([Sheet2.F2:.F100]) -> true | C8: Yearfrac formulas

Sheet: Sheet2
A1: Date 1 | B1: Date 2 | C1: Function | D1: Formula | E1: Expected Value | F1: Correct? | G1: Test purpose
F2: of:=AND([.F3:.F24]) -> 1 | G2: total of tests
A3: 2001-01-01T19:27:41 | B3: 2002-01-01T12:10:30 | C3: YEARFRAC(A3;B3;0) | D3: of:=YEARFRAC([.A3];[.B3];0) -> 1 | E3: 1 | F3: of:=[.D3]=[.E3] -> 1 | G3: YEARFRAC ignores the time portion of the date, truncating it
A4: 2002-01-01 | B4: 2001-01-01 | C4: YEARFRAC(A4;B4;0) | D4: of:=YEARFRAC([.A4];[.B4];0) -> 1 | E4: 1 | F4: of:=[.D4]=[.E4] -> 1 | G4: The order of the dates does not matter. Date 1 can be before or after Date 2
A5: 2000-01-01 | B5: 2000-01-01 | C5: YEARFRAC(A5;B5;0) | D5: of:=YEARFRAC([.A5];[.B5];0) -> 0 | E5: 0 | F5: of:=[.D5]=[.E5] -> 1 | G5: If the dates are equal, the result is 0
A6: 2002-01-01T19:27:41 | B6: 2002-01-01T12:10:30 | C6: YEARFRAC(A6;B6;0) | D6: of:=YEARFRAC([.A6];[.B6];0) -> 0 | E6: 0 | F6: of:=[.D6]=[.E6] -> 1 | G6: Again, ignore the time portion. If the dates are equal, the result is 0
A7: 2010-01-31 | B7: 2010-07-31 | C7: YEARFRAC(A7;B7;0) | D7: of:=YEARFRAC([.A7];[.B7];0) -> 0.5 | E7: 0.5 | F7: of:=[.D7]=[.E7] -> 1 | G7: both days-of-month are 31 → 180/360
A8: 2010-01-31 | B8: 2010-08-01 | C8: YEARFRAC(A8;B8;0) | D8: of:=YEARFRAC([.A8];[.B8];0) -> 0.502777777777778 | E8: 0.502777777777778 | F8: of:=[.D8]=[.E8] -> 1 | G8: date1's day-of-month is 31, but date2 is not → 181/360
A9: 2010-01-30 | B9: 2010-07-31 | C9: YEARFRAC(A9;B9;0) | D9: of:=YEARFRAC([.A9];[.B9];0) -> 0.5 | E9: 0.5 | F9: of:=[.D9]=[.E9] -> 1 | G9: date1's day-of-month is 30 and date2's is 31 → 180/360
A10: 2010-02-28 | B10: 2011-02-28 | C10: YEARFRAC(A10;B10;0) | D10: of:=YEARFRAC([.A10];[.B10];0) -> 1 | E10: 1 | F10: of:=[.D10]=[.E10] -> 1 | G10: both days are last day of February (non leap year) → 360/360
A11: 2000-02-29 | B11: 2008-02-29 | C11: YEARFRAC(A11;B11;0) | D11: of:=YEARFRAC([.A11];[.B11];0) -> 8 | E11: 8 | F11: of:=[.D11]=[.E11] -> 1 | G11: both days are last day of February (leap year) → 8 full years
A12: 2010-02-28 | B12: 2010-08-30 | C12: YEARFRAC(A12;B12;0) | D12: of:=YEARFRAC([.A12];[.B12];0) -> 0.5 | E12: 0.5 | F12: of:=[.D12]=[.E12] -> 1 | G12: date1 is last date of February (non leap year) → 180/360
A13: 2008-02-29 | B13: 2008-08-30 | C13: YEARFRAC(A13;B13;0) | D13: of:=YEARFRAC([.A13];[.B13];0) -> 0.5 | E13: 0.5 | F13: of:=[.D13]=[.E13] -> 1 | G13: date1 is last date of February (leap year) → 180/360
A14: 2001-01-01T19:27:41 | B14: 2002-01-01T12:10:30 | C14: YEARFRAC(A14;B14;1) | D14: of:=YEARFRAC([.A14];[.B14];1) -> 1 | E14: 1 | F14: of:=[.D14]=[.E14] -> 1 | G14: YEARFRAC ignores the time portion of the date, truncating it
A15: 2002-01-01 | B15: 2001-01-01 | C15: YEARFRAC(A15;B15;1) | D15: of:=YEARFRAC([.A15];[.B15];1) -> 1 | E15: 1 | F15: of:=[.D15]=[.E15] -> 1 | G15: The order of the dates does not matter. Date 1 can be before or after Date 2
A16: 2000-01-01 | B16: 2000-01-01 | C16: YEARFRAC(A16;B16;1) | D16: of:=YEARFRAC([.A16];[.B16];1) -> 0 | E16: 0 | F16: of:=[.D16]=[.E16] -> 1 | G16: If the dates are equal, the result is 0
A17: 2002-01-01T19:27:41 | B17: 2002-01-01T12:10:30 | C17: YEARFRAC(A17;B17;1) | D17: of:=YEARFRAC([.A17];[.B17];1) -> 0 | E17: 0 | F17: of:=[.D17]=[.E17] -> 1 | G17: Again, ignore the time portion. If the dates are equal, the result is 0
A18: 2002-01-31 | B18: 2003-05-01 | C18: YEARFRAC(A18;B18;1) | D18: of:=YEARFRAC([.A18];[.B18];1) -> 1.24657534246575 | E18: 1.24657534246575 | F18: of:=[.D18]=[.E18] -> 1 | G18: More than a year apart, no leap years → (365+90)/365
A19: 2008-01-31 | B19: 2009-05-01 | C19: YEARFRAC(A19;B19;1) | D19: of:=YEARFRAC([.A19];[.B19];1) -> 1.24760601915185 | E19: 1.24760601915185 | F19: of:=[.D19]=[.E19] -> 1 | G19: More than a year apart, with leap year → (366 + 90)( (366+365)/2)
A20: 2007-01-31 | B20: 2009-05-01 | C20: YEARFRAC(A20;B20;1) | D20: of:=YEARFRAC([.A20];[.B20];1) -> 2.24726277372263 | E20: 2.24726277372263 | F20: of:=[.D20]=[.E20] -> 1 | G20: Several years apart, with leap year → (365 + 366 + 90)( (365 + 366 + 365)/3)
A21: 2007-01-31 | B21: 2007-05-01 | C21: YEARFRAC(A21;B21;1) | D21: of:=YEARFRAC([.A21];[.B21];1) -> 0.246575342465753 | E21: 0.246575342465753 | F21: of:=[.D21]=[.E21] -> 1 | G21: In same year (not leap year) → 90/365
A22: 2008-01-31 | B22: 2008-05-01 | C22: YEARFRAC(A22;B22;1) | D22: of:=YEARFRAC([.A22];[.B22];1) -> 0.248633879781421 | E22: 0.248633879781421 | F22: of:=[.D22]=[.E22] -> 1 | G22: in same year (leap year) → 91/366
A23: 2007-12-15 | B23: 2008-03-14 | C23: YEARFRAC(A23;B23;1) | D23: of:=YEARFRAC([.A23];[.B23];1) -> 0.245901639344262 | E23: 0.245901639344262 | F23: of:=[.D23]=[.E23] -> 1 | G23: Less than a year, but February 29 is in range
A24: 2007-12-01 | B24: 2008-02-29 | C24: YEARFRAC(A24;B24;1) | D24: of:=YEARFRAC([.A24];[.B24];1) -> 0.245901639344262 | E24: 0.245901639344262 | F24: of:=[.D24]=[.E24] -> 1 | G24: Less than a year, but date 2 is February 29th
C25: YEARFRAC(A13;B13;3) | D25: of:=YEARFRAC([.A11];[.B11];3) -> 8.0054794520548 | E25: 8.0054794520548 | F25: of:=[.D25]=[.E25] -> 1 | G25: Base 3
C26: YEARFRAC(A24;B24;4) | D26: of:=YEARFRAC([.A22];[.B22];4) -> 0.252777777777778 | E26: 0.252777777777778 | F26: of:=[.D26]=[.E26] -> 1 | G26: Base 4
C27: YEARFRAC("2008-01-31";B24;0) | D27: of:=YEARFRAC("2008-01-31";[.B22];0) -> 0.252777777777778 | E27: 0.252777777777778 | F27: of:=[.D27]=[.E27] -> 1 | G27: date in “ “
C28: YEARFRAC(DATE(2008;1;31);B24;0) | D28: of:=YEARFRAC(DATE(2008;1;31);[.B22];0) -> 0.252777777777778 | E28: 0.252777777777778 | F28: of:=[.D28]=[.E28] -> 1 | G28: date as function DATE
C29: YEARFRAC(DATE(1958;3;1);DATE(1996;1;1);1) | D29: of:=YEARFRAC(DATE(1958;3;1);DATE(1996;1;1);1) -> 37.8364338364338 | E29: 37.8364338364338 | F29: of:=[.D29]=[.E29] -> 1 | G29: Bug 40100
C30: YEARFRAC(DATE(1958;3;1);DATE(1995;12;31);1) | D30: of:=YEARFRAC(DATE(1958;3;1);DATE(1995;12;31);1) -> 37.8357230348008 | E30: 37.8357230348008 | F30: of:=[.D30]=[.E30] -> 1
B31: of:=DATE(2008;2;29) -> 2008-02-29 | C31: YEARFRAC(A33;B26;1) | D31: of:=YEARFRAC([.A31];[.B24];1) -> 108.165617144137 | E31: 108.165617144137 | F31: of:=[.D31]=[.E31] -> 1 | G31: AOO bug 122543
C32: YEARFRAC(A33;yearFracDate;1) | D32: of:=YEARFRAC([.A31];yearFracDate;1) -> 108.165617144137 | E32: 108.165617144137 | F32: of:=[.D32]=[.E32] -> 1 | G32: yearFracDate name
C33: YEARFRAC(A5;B5) | D33: of:=YEARFRAC([.A3];[.B3]) -> 1 | E33: 1 | F33: of:=[.D33]=[.E33] -> 1 | G33: without 3rd argument
A34: 2003-02-28 | B34: 2004-02-29 | C34: =(B34-A34)/YEARFRAC(A34;B34;1) | D34: of:=([.B34]-[.A34])/YEARFRAC([.A34];[.B34];1) -> 365.5 | E34: 365.500000 | F34: of:=[.D34]=[.E34] -> 1 | G34: tdf69569, days in year
A35: 2003-02-28 | B35: 2004-02-28 | C35: =(B35-A35)/YEARFRAC(A35;B35;1) | D35: of:=([.B35]-[.A35])/YEARFRAC([.A35];[.B35];1) -> 365 | E35: 365.000000 | F35: of:=[.D35]=[.E35] -> 1 | G35: tdf69569, days in year
A36: 2004-02-28 | B36: 2005-02-28 | C36: =(B36-A36)/YEARFRAC(A36;B36;1) | D36: of:=([.B36]-[.A36])/YEARFRAC([.A36];[.B36];1) -> 366 | E36: 366.000000 | F36: of:=[.D36]=[.E36] -> 1 | G36: tdf69569, days in year
A37: 2016-01-01 | B37: 2016-01-31 | C37: =(B37-A37)/YEARFRAC(A37;B37;1) | D37: of:=([.B37]-[.A37])/YEARFRAC([.A37];[.B37];1) -> 366 | E37: 366.000000 | F37: of:=[.D37]=[.E37] -> 1 | G37: tdf69569, days in year
A38: 2016-01-01 | B38: 2017-01-01 | C38: =(B38-A38)/YEARFRAC(A38;B38;1) | D38: of:=([.B38]-[.A38])/YEARFRAC([.A38];[.B38];1) -> 366 | E38: 366.000000 | F38: of:=[.D38]=[.E38] -> 1 | G38: tdf69569, days in year
A39: 2016-01-31 | B39: 2017-01-01 | C39: =(B39-A39)/YEARFRAC(A39;B39;1) | D39: of:=([.B39]-[.A39])/YEARFRAC([.A39];[.B39];1) -> 366 | E39: 366.000000 | F39: of:=[.D39]=[.E39] -> 1 | G39: tdf69569, days in year
A40: 2016-01-31 | B40: 2017-01-31 | C40: =(B40-A40)/YEARFRAC(A40;B40;1) | D40: of:=([.B40]-[.A40])/YEARFRAC([.A40];[.B40];1) -> 366 | E40: 366.000000 | F40: of:=[.D40]=[.E40] -> 1 | G40: tdf69569, days in year
A41: 2016-02-29 | B41: 2016-05-01 | C41: =(B41-A41)/YEARFRAC(A41;B41;1) | D41: of:=([.B41]-[.A41])/YEARFRAC([.A41];[.B41];1) -> 366 | E41: 366.000000 | F41: of:=[.D41]=[.E41] -> 1 | G41: tdf69569, days in year
A42: 2016-04-30 | B42: 2016-09-01 | C42: =(B42-A42)/YEARFRAC(A42;B42;1) | D42: of:=([.B42]-[.A42])/YEARFRAC([.A42];[.B42];1) -> 366 | E42: 366.000000 | F42: of:=[.D42]=[.E42] -> 1 | G42: tdf69569, days in year
A43: 2016-11-30 | B43: 2017-09-29 | C43: =(B43-A43)/YEARFRAC(A43;B43;1) | D43: of:=([.B43]-[.A43])/YEARFRAC([.A43];[.B43];1) -> 365 | E43: 365.000000 | F43: of:=[.D43]=[.E43] -> 1 | G43: tdf69569, days in year