Sheet: Sheet1
A1: DCOUNTA Function
A3: Result | B3: of:=AND([.B8:.B95]) -> true
A7: Sheet | B7: Result | C7: Description
A8: 1 | B8: of:=AND([Sheet2.C2:.C100]) -> true | C8: Simple DCOUNTA formulas with local references and values

Sheet: Sheet2
A1: Function | B1: Expected | C1: Correct | D1: FunctionString | E1: Comment | J1: Name | K1: Grade | L1: Age | M1: Distance to School | N1: Weight
A2: of:=DCOUNTA([.J1:.N10];"Weight";[.J44:.N45]) -> 2 | B2: 2 | C2: of:=[.A2]=[.B2] -> true | D2: DCOUNTA(J1:N10;"Weight";J44:N45) | J2: Andy | K2: 3 | L2: 9 | M2: 150 | N2: 40
A3: of:=DCOUNTA([.J1:.N10];"Weight";[.J13:.N15]) -> 4 | B3: 4 | C3: of:=[.A3]=[.B3] -> true | D3: DCOUNTA(J1:N10;"Weight";J13:N15) | J3: Betty | K3: 4 | L3: 10 | M3: 1000 | N3: 42
A4: of:=DCOUNTA([.J1:.N10];"Weight";[.J17:.N18]) -> 2 | B4: 2 | C4: of:=[.A4]=[.B4] -> true | D4: DCOUNTA(J1:N10;"Weight";J17:N18) | J4: Clara | K4: 3 | L4: 10 | M4: 300 | N4: 51
A5: of:=DCOUNTA([.J1:.N10];"Weight";[.J20:.N21]) -> 5 | B5: 5 | C5: of:=[.A5]=[.B5] -> true | D5: DCOUNTA(J1:N10;"Weight";J20:N21) | J5: Daniel | K5: 5 | L5: 11 | M5: 1200 | N5: 48
A6: of:=DCOUNTA([.J1:.N10];"Weight";[.J56:.N57]) -> 2 | B6: 2 | C6: of:=[.A6]=[.B6] -> true | D6: DCOUNTA(J1:N10;"Weight";J56:N57) | J6: Eva | K6: 2 | L6: 8 | M6: 650 | N6: 33
A7: of:=DCOUNTA(database;"Weight";criteria) -> 9 | B7: 9 | C7: of:=[.A7]=[.B7] -> true | D7: DCOUNTA(database;"Weight";criteria) | J7: Frank | K7: 2 | L7: 7 | M7: 300 | N7: 42
A8: of:=DCOUNTA([.J1:.N10];;[.J41:.N42]) -> 2 | B8: 2 | C8: of:=[.A8]=[.B8] -> true | D8: of:=FORMULA([.A8]) -> =DCOUNTA(J1:N10,,J41:N42) | E8: Tdf#13353 | J8: Greta | K8: 1 | L8: 7 | M8: 200 | N8: 36
J9: Harry | K9: 3 | L9: 9 | M9: 1200 | N9: 44
J10: Irene | K10: 2 | L10: 8 | M10: 1000 | N10: 42
J13: Name | K13: Grade | L13: Age | M13: Distance to School | N13: Weight
L14: 9
L15: 10
J17: Name | K17: Grade | L17: Age | M17: Distance to School | N17: Weight
K18: 2 | L18: >7
J20: Name | K20: Grade | L20: Age | M20: Distance to School | N20: Weight
J21: >=E
J23: Name | K23: Grade | L23: Age | M23: Distance to School | N23: Weight
J24: Frank
J26: Name | K26: Grade | L26: Age | M26: Distance to School | N26: Weight
K27: 1
K28: 2
K29: 3
K30: 4
K31: 5
J33: Name | K33: Grade | L33: Age | M33: Distance to School | N33: Weight
K34: 1
K35: 2
K36: 3
J38: Name | K38: Grade | L38: Age | M38: Distance to School | N38: Weight
K39: 3
J41: Name | K41: Grade | L41: Age | M41: Distance to School | N41: Weight
L42: 10
J44: Name | K44: Grade | L44: Age | M44: Distance to School | N44: Weight
L45: 7
J47: Name | K47: Grade | L47: Age | M47: Distance to School | N47: Weight
L48: 8
J50: Name | K50: Grade | L50: Age | M50: Distance to School | N50: Weight
K51: 2
J53: Name | K53: Grade | L53: Age | M53: Distance to School | N53: Weight
L54: 9
J56: Name | K56: Grade | L56: Age | M56: Distance to School | N56: Weight
J57: [E-F].*
J59: Name | K59: Grade | L59: Age | M59: Distance to School | N59: Weight | O59: Age
L60: >0

Sheet: 'file:///home/zdenek/lodev/libreoffice/sc/qa/unit/data/functions/fods/function_based_test_Example.fods/function_based_test_Example_reference.fods'#Sheet2
H3: 4