Sheet: Sheet1
A1: DCOUNT Function
A3: Result | B3: of:=AND([.B8:.B95]) -> true
A7: Sheet | B7: Result | C7: Description
A8: 1 | B8: of:=AND([Sheet2.C2:.C100]) -> true | C8: Simple DCOUNT formulas with local references and values

Sheet: Sheet2
A1: Function | B1: Expected | C1: Correct | D1: FunctionString | E1: Comment | J1: Name | K1: Grade | L1: Age | M1: Distance to School | N1: Weight | Q1: data1 | R1: data2 | S1: AOO #65221 | W1: pet | X1: name | Y1: AOO #84168
A2: of:=DCOUNT([.J1:.N10];"Age";[.J23:.N24]) -> 1 | B2: 1 | C2: of:=[.A2]=[.B2] -> true | D2: DCOUNT(J1:N10;"Age";J23:N24) | J2: Andy | K2: 3 | L2: 9 | M2: 150 | N2: 40 | Q2: 1 | R2: 1 | W2: dog | X2: fido
A3: of:=DCOUNT([.J1:.N10];"Weight";[.J13:.N15]) -> 3 | B3: 3 | C3: of:=[.A3]=[.B3] -> true | D3: DCOUNT(J1:N10;"Weight";J13:N15) | J3: Betty | K3: 4 | L3: 10 | M3: 1000 | N3: 42 | R3: 2 | W3: cat | X3: meow
A4: of:=DCOUNT([.J1:.N11];"Weight";[.J17:.N19]) -> 4 | B4: 4 | C4: of:=[.A4]=[.B4] -> true | D4: DCOUNT(J1:N10;"Weight";J17:N18) | J4: Clara | K4: 3 | L4: 10 | M4: 300 | N4: 51 | Q4: of:="" ->  | R4: 4 | W4: dog | X4: rower
A5: of:=DCOUNT([.J1:.N11];"Weight";[.J20:.N21]) -> 2 | B5: 2 | C5: of:=[.A5]=[.B5] -> true | D5: DCOUNT(J1:N10;"Weight";J20:N21) | J5: Daniel | K5: 5 | L5: 11 | M5: 1200 | N5: 48 | Q5: of:=[.Q3] -> 0 | R5: 8
A6: of:=DCOUNT([.J1:.N11];"Weight";[.J56:.N57]) -> 3 | B6: 3 | C6: of:=[.A6]=[.B6] -> true | D6: DCOUNT(J1:N11;"Weight";J56:N57) | J6: Eva | K6: 2 | L6: 8 | M6: 650 | N6: 33 | Q6: of:=[.Q4] ->  | R6: 16 | W6: pet | X6: name
A7: of:=DCOUNT(database;"Weight";criteria) -> 2 | B7: 2 | C7: of:=[.A7]=[.B7] -> true | D7: DCOUNT(database;"Weight";criteria) | J7: Frank | K7: 2 | L7: 7 | M7: 300 | N7: 42 | Q7: 0 | R7: 32 | W7: dog
A8: of:=DCOUNT([.J1:.N11];"Age";[.J38:.N39]) -> 3 | B8: 3 | C8: of:=[.A8]=[.B8] -> true | D8: DCOUNT(J1:N11;"Age";J38:N39) | J8: Greta | K8: 1 | L8: 7 | M8: 200 | N8: 36 | Q8: of:=[.Q3]+[.Q5] -> 0 | R8: 64
A9: of:=DCOUNT([.J1:.N11];N(COLUMN([.A1:.B1]))+2;[.J38:.N39]) -> 3 | B9: 3 | C9: of:=[.A9]=[.B9] -> true | D9: DCOUNT(J1:N11;N(COLUMN(A1:B1))+2;J38:N39) | E9: AOO #114293 | J9: Harry | K9: 3 | L9: 9 | M9: 1200 | N9: 44 | W9: of:=DCOUNT([.W1:.X4];0;[.W6:.X7]) -> 2 | X9: should return 0
A10: of:=DCOUNT([.J1:.N11];COLUMN([.A1])+2;[.J38:.N39]) -> 3 | B10: 3 | C10: of:=[.A10]=[.B10] -> true | D10: DCOUNT(J1:N11;COLUMN(A1)+2;J38:N39) | J10: Irene | K10: 2 | L10: 13 | M10: 1000 | N10: 42 | X10: The 0 in DCOUNT and DCOUNTA is the same as a missing argument, and Excel for a missing argument in DCOUNT and DCOUNTA just returns the number of records that match criteria, not distinguishing between numeric and other for DCOUNT. This is different from the behavior if an actual field was specified where for DCOUNT only numeric content is counted.
A11: of:=DCOUNT([.J1:.N11];[.K8]+2;[.J38:.N39]) -> 3 | B11: 3 | C11: of:=[.A11]=[.B11] -> true | D11: DCOUNT(J1:N11;K8+2;J38:N39) | J11: of:="I"&[.J2]&[.J3] -> IAndyBetty | K11: 6 | L11: 15 | M11: 10000 | N11: 55
A12: of:=DCOUNT([.$Q$1:.$R$8];"data2";[.$Q$14:.$Q$15]) -> 3 | B12: 3 | C12: of:=[.A12]=[.B12] -> true | D12: DCOUNT($Q$1:$R$8;"data2";$Q$14:$Q$15) | E12: Criterion is reference to empty cell
A13: of:=DCOUNT([.$Q$1:.$R$8];"data2";[.$S$14:.$S$15]) -> 3 | B13: 3 | C13: of:=[.A13]=[.B13] -> true | D13: DCOUNT($Q$1:$R$8;"data2";$S$14:$S$15) | E13: Criterion is 0 | J13: Name | K13: Grade | L13: Age | M13: Distance to School | N13: Weight | Q13: criteria
A14: of:=DCOUNT([.$Q$1:.$R$8];"data2";[.$U$14:.$U$15]) -> 3 | B14: 3 | C14: of:=[.A14]=[.B14] -> true | D14: DCOUNT($Q$1:$R$8;"data2";$U$14:$U$15) | E14: Criterion is literal 0 | L14: 10 | Q14: data1 | R14: data1 | S14: data1 | T14: data1 | U14: data1 | V14: data1 | W14: data1 | X14: data1
A15: of:=DCOUNT([.$Q$1:.$R$8];"data2";[.$X$14:.$X$15]) -> 4 | B15: 4 | C15: of:=[.A15]=[.B15] -> true | D15: DCOUNT($Q$1:$R$8;"data2";$X$14:$X$15) | L15: 11 | Q15: of:=[.P15] -> 0 | R15: of:="" ->  | S15: of:=[.Q15] -> 0 | T15: of:=[.R15] ->  | U15: 0 | V15: <> | W15: = | X15: <>0
A16: of:=[AOO109200.B14] -> 1 | B16: 1 | C16: of:=[.A16]=[.B16] -> true | D16: AOO109200 : DCOUNT(Data;"Y";B12:B13) | E16: AOO #109200 | Q16: Criterion is reference to empty cell | R16: Criterion is empty string | S16: Criterion is 0 | T16: Criterion is empty string | U16: Criterion is literal 0
A17: of:=[AOO109200.C14] -> 1 | B17: 1 | C17: of:=[.A17]=[.B17] -> true | D17: AOO109200 : DCOUNT(Data;"Y";C12:C13) | E17: AOO #109200 | J17: Name | K17: Grade | L17: Age | M17: Distance to School | N17: Weight
A18: of:=DCOUNT([.J1:.N10];0;[.J23:.N24]) -> 1 | B18: 1 | C18: of:=[.A18]=[.B18] -> true | D18: DCOUNT(J1:N10;0;J23:N24) | E18: For the DatabaseField parameter you can enter a cell to specify the column, or enter the number 0 for the entire database. | K18: 2 | L18: >12
A19: of:=DCOUNT([.W1:.X4];2;[.W6:.X7]) -> 0 | B19: 0 | C19: of:=[.A19]=[.B19] -> true | D19: DCOUNT(W1:X4;2;W6:X7) | E19: only text | K19: 3
A20: of:=DCOUNT([.J1:.N10];;[.J23:.N24]) -> 1 | B20: 1 | C20: of:=[.A20]=[.B20] -> true | D20: DCOUNT(J1:N10;;J23:N24) | E20: Tdf#70806; Yes, ODFF doesn't allow it, but Excel in this case defaults the missing argument to 1, which we also do for interop. | J20: Name | K20: Grade | L20: Age | M20: Distance to School | N20: Weight
A21: of:=DCOUNT([.J1:.N11];;[.J41:.N42]) -> 2 | B21: 2 | C21: of:=[.A21]=[.B21] -> true | D21: of:=FORMULA([.A21]) -> =DCOUNT(J1:N11,,J41:N42) | E21: Tdf#13353 | J21: >=I
Q22: of:=DCOUNT([.J1:.N10];;[.J23:.N24]) -> 1 | R22: #Error | S22: of:=ISERROR([.Q22]) -> false | U22: Tdf#70806 | W22: Email to Eike,Winfried
J23: Name | K23: Grade | L23: Age | M23: Distance to School | N23: Weight
J24: Frank
J26: Name | K26: Grade | L26: Age | M26: Distance to School | N26: Weight
K27: 1
K28: 2
K29: 3
K30: 4
K31: 5
J33: Name | K33: Grade | L33: Age | M33: Distance to School | N33: Weight
K34: 1
K35: 2
K36: 3
J38: Name | K38: Grade | L38: Age | M38: Distance to School | N38: Weight
K39: 3
J41: Name | K41: Grade | L41: Age | M41: Distance to School | N41: Weight
L42: 10
J44: Name | K44: Grade | L44: Age | M44: Distance to School | N44: Weight
L45: 7
J47: Name | K47: Grade | L47: Age | M47: Distance to School | N47: Weight
L48: 8
J50: Name | K50: Grade | L50: Age | M50: Distance to School | N50: Weight
K51: 2
J53: Name | K53: Grade | L53: Age | M53: Distance to School | N53: Weight
L54: 9
J56: Name | K56: Grade | L56: Age | M56: Distance to School | N56: Weight
J57: [E,I].*
J59: Name | K59: Grade | L59: Age | M59: Distance to School | N59: Weight | O59: Age
L60: >12

Sheet: AOO109200
B1: AOO 109200
C5: Data
B6: X | C6: Y | D6: Z
B7: 1 | C7: 1 | D7: 1000000
B8: 10 | C8: 2 | D8: 10000000
B9: 100 | C9: 10000 | D9: 100000000
B12: X | C12: X
A13: 10 | B13: of:=[.A13] -> 10 | C13: 10
B14: of:=DCOUNT(Data;"Y";[.B12:.B13]) -> 1 | C14: of:=DCOUNT(Data;"Y";[.C12:.C13]) -> 1

Sheet: 'file:///home/zdenek/Dokumenty/LO/sc-unit-test/Project%20Calc%20functions%20tests/fods/function_based_test_Example.fods/function_based_test_Example_reference.fods'#Sheet2
H3: 4

Sheet: 'file:///home/zdenek/Dokumenty/LO/sc-unit-test/Project%20Calc%20functions%20tests/fods/Users/crhonekzde/AppData/Local/Temp/dsumcalc.ods'#AC Cashflow
A1: Interest Rate | B1: Bal Now
A2: 0 | B2: 1
A3: 0.0225 | B3: 2
A4: 0.017 | B4: 3
A5: 0.053 | B5: 4
A6: 0.0401 | B6: 5
A7: 0.0362 | B7: 6
A8: 0.065 | B8: 7
A9: 0.02 | B9: 8
A10: 0.031 | B10: 9
A11: 0.012 | B11: 10
A12: 0.021 | B12: 11
A13: 0.05 | B13: 12
A14: 0 | B14: 13
A15: 0.01 | B15: 14
A16: 0 | B16: 15