Sheet: Sheet1
A1: DSUM Function
A3: Result | B3: of:=AND([.B8:.B95]) -> true
A7: Sheet | B7: Result | C7: Description
A8: 1 | B8: of:=AND([Sheet2.C2:.C100]) -> true | C8: Simple DSUM formulas with local references and values

Sheet: Sheet2
A1: Function | B1: Expected | C1: Correct | D1: FunctionString | E1: Comment | J1: Name | K1: Grade | L1: Age | M1: Distance to School | N1: Weight | Q1: data1 | R1: data2 | S1: AOO #65221
A2: of:=DSUM([.J1:.N10];"Age";[.J23:.N24]) -> 7 | B2: 7 | C2: of:=[.A2]=[.B2] -> true | D2: DSUM(J1:N10;"Age";J23:N24) | J2: Andy | K2: 3 | L2: 9 | M2: 150 | N2: 40 | Q2: 1 | R2: 1
A3: of:=DSUM([.J1:.N10];"Weight";[.J13:.N15]) -> 141 | B3: 141 | C3: of:=[.A3]=[.B3] -> true | D3: DSUM(J1:N10;"Weight";J13:N15) | J3: Betty | K3: 4 | L3: 10 | M3: 1000 | N3: 42 | R3: 2
A4: of:=DSUM([.J1:.N11];"Weight";[.J17:.N19]) -> 177 | B4: 177 | C4: of:=[.A4]=[.B4] -> true | D4: DSUM(J1:N10;"Weight";J17:N18) | J4: Clara | K4: 3 | L4: 10 | M4: 300 | N4: 51 | Q4: of:="" ->  | R4: 4
A5: of:=DSUM([.J1:.N11];"Weight";[.J20:.N21]) -> 97 | B5: 97 | C5: of:=[.A5]=[.B5] -> true | D5: DSUM(J1:N10;"Weight";J20:N21) | J5: Daniel | K5: 5 | L5: 11 | M5: 1200 | N5: 48 | Q5: of:=[.Q3] -> 0 | R5: 8
A6: of:=DSUM([.J1:.N10];"Weight";[.J56:.N57]) -> 75 | B6: 75 | C6: of:=[.A6]=[.B6] -> true | D6: DSUM(J1:N10;"Weight";J56:N57) | J6: Eva | K6: 2 | L6: 8 | M6: 650 | N6: 33 | Q6: of:=[.Q4] ->  | R6: 16
A7: of:=DSUM(database;"Weight";criteria) -> 97 | B7: 97 | C7: of:=[.A7]=[.B7] -> true | D7: DSUM(database;"Weight";criteria) | J7: Frank | K7: 2 | L7: 7 | M7: 300 | N7: 42 | Q7: 0 | R7: 32
A8: of:=DSUM([.J1:.N11];"Age";[.J38:.N39]) -> 28 | B8: 28 | C8: of:=[.A8]=[.B8] -> true | D8: DSUM(J1:N11;"Age";J38:N39) | J8: Greta | K8: 1 | L8: 7 | M8: 200 | N8: 36 | Q8: of:=[.Q3]+[.Q5] -> 0 | R8: 64
A9: of:=DSUM([.J1:.N11];N(COLUMN([.A1:.B1]))+2;[.J38:.N39]) -> 28 | B9: 28 | C9: of:=[.A9]=[.B9] -> true | D9: DSUM(J1:N11;N(COLUMN(A1:B1))+2;J38:N39) | E9: AOO #114293 | J9: Harry | K9: 3 | L9: 9 | M9: 1200 | N9: 44
A10: of:=DSUM([.J1:.N11];COLUMN([.A1])+2;[.J38:.N39]) -> 28 | B10: 28 | C10: of:=[.A10]=[.B10] -> true | D10: DSUM(J1:N11;COLUMN(A1)+2;J38:N39) | J10: Irene | K10: 2 | L10: 13 | M10: 1000 | N10: 42
A11: of:=DSUM([.J1:.N11];[.K8]+2;[.J38:.N39]) -> 28 | B11: 28 | C11: of:=[.A11]=[.B11] -> true | D11: DSUM(J1:N11;K8+2;J38:N39) | J11: of:="I"&[.J2]&[.J3] -> IAndyBetty | K11: 6 | L11: 15 | M11: 10000 | N11: 55
A12: of:=DSUM([.$Q$1:.$R$8];"data2";[.$Q$14:.$Q$15]) -> 104 | B12: 104 | C12: of:=[.A12]=[.B12] -> true | D12: DSUM($Q$1:$R$8;"data2";$Q$14:$Q$15) | E12: Criterion is reference to empty cell
A13: of:=DSUM([.$Q$1:.$R$8];"data2";[.$S$14:.$S$15]) -> 104 | B13: 104 | C13: of:=[.A13]=[.B13] -> true | D13: DSUM($Q$1:$R$8;"data2";$S$14:$S$15) | E13: Criterion is 0 | J13: Name | K13: Grade | L13: Age | M13: Distance to School | N13: Weight | Q13: criteria
A14: of:=DSUM([.$Q$1:.$R$8];"data2";[.$U$14:.$U$15]) -> 104 | B14: 104 | C14: of:=[.A14]=[.B14] -> true | D14: DSUM($Q$1:$R$8;"data2";$U$14:$U$15) | E14: Criterion is literal 0 | L14: 10 | Q14: data1 | R14: data1 | S14: data1 | T14: data1 | U14: data1 | V14: data1 | W14: data1 | X14: data1
A15: of:=DSUM([.$Q$1:.$R$8];"data2";[.$X$14:.$X$15]) -> 23 | B15: 23 | C15: of:=[.A15]=[.B15] -> true | D15: DSUM($Q$1:$R$8;"data2";$X$14:$X$15) | L15: 11 | Q15: of:=[.P15] -> 0 | R15: of:="" ->  | S15: of:=[.Q15] -> 0 | T15: of:=[.R15] ->  | U15: 0 | V15: <> | W15: = | X15: <>0
A16: of:=[AOO109200.B14] -> 2 | B16: 2 | C16: of:=[.A16]=[.B16] -> true | D16: AOO109200 : DSUM(Data;"Y";B12:B13) | E16: AOO #109200 | Q16: Criterion is reference to empty cell | R16: Criterion is empty string | S16: Criterion is 0 | T16: Criterion is empty string | U16: Criterion is literal 0
A17: of:=[AOO109200.C14] -> 2 | B17: 2 | C17: of:=[.A17]=[.B17] -> true | D17: AOO109200 : DSUM(Data;"Y";C12:C13) | E17: AOO #109200 | J17: Name | K17: Grade | L17: Age | M17: Distance to School | N17: Weight
A18: of:=DSUM([.J1:.N10];0;[.J23:.N24]) ->  | B18: #VALUE! | C18: of:=ISERROR([.A18]) -> true | D18: DSUM(J1:N10;0;J23:N24) | E18: Bug #33910 | K18: 2 | L18: >12
A19: of:=[Interest.B20] -> 120 | B19: 120 | C19: of:=[.A19]=[.B19] -> true | D19: Interest.B20 | E19: BUG 72949 | K19: 3
J20: Name | K20: Grade | L20: Age | M20: Distance to School | N20: Weight
J21: >=I
J23: Name | K23: Grade | L23: Age | M23: Distance to School | N23: Weight
J24: Frank | Q24: of:=DSUM([.$Q$1:.$R$8];"data2";[.$R$14:.$R$15]) -> 127 | R24: 20 | S24: of:=[.Q24]=[.R24] -> false | T24: DSUM($Q$1:$R$8;"data2";$R$14:$R$15) | X24: The situation is completely wrecked, already Excel in itself isn't consistent in how it handles empty cell vs empty string when comparing D*() functions with how it is handled for the '=' or '<>' comparison operators. So yes, it is a bug, but even after 10 years I don't know how to correctly solve it other than mimicking te broken Excel behavior.
Q25: of:=DSUM([.$Q$1:.$R$8];"data2";[.$T$14:.$T$15]) -> 127 | R25: 20 | S25: of:=[.Q25]=[.R25] -> false | T25: DSUM($Q$1:$R$8;"data2";$T$14:$T$15)
J26: Name | K26: Grade | L26: Age | M26: Distance to School | N26: Weight | Q26: of:=DSUM([.$Q$1:.$R$8];"data2";[.$V$14:.$V$15]) -> 105 | R26: 125 | S26: of:=[.Q26]=[.R26] -> false
K27: 1 | Q27: of:=DSUM([.$Q$1:.$R$8];"data2";[.$W$14:.$W$15]) -> 22 | R27: 2 | S27: of:=[.Q27]=[.R27] -> false
K28: 2
K29: 3
K30: 4
K31: 5
J33: Name | K33: Grade | L33: Age | M33: Distance to School | N33: Weight
K34: 1
K35: 2
K36: 3
J38: Name | K38: Grade | L38: Age | M38: Distance to School | N38: Weight
K39: 3
J41: Name | K41: Grade | L41: Age | M41: Distance to School | N41: Weight
L42: 10
J44: Name | K44: Grade | L44: Age | M44: Distance to School | N44: Weight
L45: 7
J47: Name | K47: Grade | L47: Age | M47: Distance to School | N47: Weight
L48: 8
J50: Name | K50: Grade | L50: Age | M50: Distance to School | N50: Weight
K51: 2
J53: Name | K53: Grade | L53: Age | M53: Distance to School | N53: Weight
L54: 9
J56: Name | K56: Grade | L56: Age | M56: Distance to School | N56: Weight
J57: [E,I].*
J59: Name | K59: Grade | L59: Age | M59: Distance to School | N59: Weight | O59: Age
L60: >12

Sheet: AOO109200
B1: AOO 109200
C5: Data
B6: X | C6: Y | D6: Z
B7: 1 | C7: 1 | D7: 1000000
B8: 10 | C8: 2 | D8: 10000000
B9: 100 | C9: 10000 | D9: 100000000
B12: X | C12: X
A13: 10 | B13: of:=[.A13] -> 10 | C13: 10
B14: of:=DSUM(Data;"Y";[.B12:.B13]) -> 2 | C14: of:=DSUM(Data;"Y";[.C12:.C13]) -> 2

Sheet: Interest
A1: Values in Interest Rate ranges - come from AC Cashflow data | J1: BUG 72949
A3: Rate | B3: Balance | C3: Yearly Interest | E3: Interest Rate | F3: Interest Rate
A4: 0 | B4: of:=DSUM(Balances;"Bal Now";[.E3:.F4]) -> 29 | C4: of:=[.B4]*[.A4] -> 0 | E4: 0 | F4: 0 | H4: Interest Rate | I4: Interest Rate | J4: Interest Rate
A5: 0.005 | B5: of:=DSUM(Balances;"Bal Now";[.H4:.J5]) -> 0 | C5: of:=[.B5]*[.A4] -> 0 | H5: >0 | I5: >0 | J5: <=0,005 | K5: Interest Rate | L5: Interest Rate | M5: Interest Rate
A6: 0.01 | B6: of:=DSUM(Balances;"Bal Now";[.K5:.M6]) -> 14 | C6: of:=[.B6]*[.A5] -> 0.07 | K6: >,005 | L6: >,005 | M6: <=0,01 | N6: Interest Rate | O6: Interest Rate | P6: Interest Rate
A7: 0.015 | B7: of:=DSUM(Balances;"Bal Now";[.N6:.P7]) -> 10 | C7: of:=[.B7]*[.A6] -> 0.1 | N7: >0,01 | O7: >0,01 | P7: <=0,015 | Q7: Interest Rate | R7: Interest Rate | S7: Interest Rate
A8: 0.02 | B8: of:=DSUM(Balances;"Bal Now";[.Q7:.S8]) -> 11 | C8: of:=[.B8]*[.A7] -> 0.165 | E8: Interest Rate | F8: Interest Rate | G8: Interest Rate | Q8: >0,015 | R8: >0,015 | S8: <=0,02
A9: 0.025 | B9: of:=DSUM(Balances;"Bal Now";[.E8:.G9]) -> 13 | C9: of:=[.B9]*[.A8] -> 0.26 | E9: >0,02 | F9: >0,02 | G9: <=0,025 | H9: Interest Rate | I9: Interest Rate | J9: Interest Rate
A10: 0.03 | B10: of:=DSUM(Balances;"Bal Now";[.H9:.J10]) -> 0 | C10: of:=[.B10]*[.A9] -> 0 | H10: >0,025 | I10: >0,025 | J10: <=0,03 | K10: Interest Rate | L10: Interest Rate | M10: Interest Rate
A11: 0.035 | B11: of:=DSUM(Balances;"Bal Now";[.K10:.M11]) -> 9 | C11: of:=[.B11]*[.A10] -> 0.27 | K11: >0,03 | L11: >0,03 | M11: <=0,035 | N11: Interest Rate | O11: Interest Rate | P11: Interest Rate
A12: 0.04 | B12: of:=DSUM(Balances;"Bal Now";[.N11:.P12]) -> 6 | C12: of:=[.B12]*[.A11] -> 0.21 | N12: >0,035 | O12: >0,035 | P12: <=0,04 | Q12: Interest Rate | R12: Interest Rate | S12: Interest Rate
A13: 0.045 | B13: of:=DSUM(Balances;"Bal Now";[.Q12:.S13]) -> 5 | C13: of:=[.B13]*[.A12] -> 0.2 | E13: Interest Rate | F13: Interest Rate | G13: Interest Rate | Q13: >0,04 | R13: >0,04 | S13: <=0,045
A14: 0.05 | B14: of:=DSUM(Balances;"Bal Now";[.E13:.G14]) -> 12 | C14: of:=[.B14]*[.A13] -> 0.54 | E14: >0,045 | F14: >0,045 | G14: <=0,05 | H14: Interest Rate | I14: Interest Rate | J14: Interest Rate
A15: 0.055 | B15: of:=DSUM(Balances;"Bal Now";[.H14:.J15]) -> 4 | C15: of:=[.B15]*[.A14] -> 0.2 | H15: >0,05 | I15: >0,05 | J15: <=0,055 | K15: Interest Rate | L15: Interest Rate | M15: Interest Rate
A16: 0.06 | B16: of:=DSUM(Balances;"Bal Now";[.K15:.M16]) -> 0 | C16: of:=[.B16]*[.A15] -> 0 | K16: >0,055 | L16: >0,055 | M16: <=0,06 | N16: Interest Rate | O16: Interest Rate | P16: Interest Rate
A17: 0.065 | B17: of:=DSUM(Balances;"Bal Now";[.N16:.P17]) -> 7 | C17: of:=[.B17]*[.A16] -> 0.42 | N17: >0,06 | O17: >0,06 | P17: <=0,065 | Q17: Interest Rate | R17: Interest Rate | S17: Interest Rate
A18: 0.07 | B18: of:=DSUM(Balances;"Bal Now";[.Q17:.S18]) -> 0 | C18: of:=[.B18]*[.A17] -> 0 | E18: Interest Rate | F18: Interest Rate | G18: Interest Rate | Q18: >0,065 | R18: >0,065 | S18: <=0,07
A19: 1 | B19: of:=DSUM(Balances;"Bal Now";[.E18:.G19]) -> 0 | C19: of:=[.B19]*[.A18] -> 0 | E19: >0,07 | F19: >0,07 | G19: <=1
B20: of:=SUM([.B4:.B19]) -> 120 | C20: of:=SUM([.C4:.C19]) -> 2.435
A22: Average Interest | C22: of:=[.C20]/[.B20] -> 0.0202916666666667

Sheet: AC Cashflow
A1: Interest Rate | B1: Bal Now | D1: BUG 72949
A2: 0 | B2: 1
A3: 0.0225 | B3: 2
A4: 0.017 | B4: 3
A5: 0.053 | B5: 4
A6: 0.0401 | B6: 5
A7: 0.0362 | B7: 6
A8: 0.065 | B8: 7
A9: 0.02 | B9: 8
A10: 0.031 | B10: 9
A11: 0.012 | B11: 10
A12: 0.021 | B12: 11
A13: 0.05 | B13: 12
A14: 0 | B14: 13
A15: 0.01 | B15: 14
A16: 0 | B16: 15
A17: Total | B17: of:=SUM([.B2:.B16]) -> 120

Sheet: 'file:///home/zdenek/Dokumenty/LO/sc-unit-test/Project%20Calc%20functions%20tests/fods/function_based_test_Example.fods/function_based_test_Example_reference.fods'#Sheet2
H3: 4

Sheet: 'file:///home/zdenek/Dokumenty/LO/sc-unit-test/Project%20Calc%20functions%20tests/Users/crhonekzde/AppData/Local/Temp/dsumcalc.ods'#AC Cashflow
A1: Interest Rate | B1: Bal Now
A2: 0 | B2: 1
A3: 0.0225 | B3: 2
A4: 0.017 | B4: 3
A5: 0.053 | B5: 4
A6: 0.0401 | B6: 5
A7: 0.0362 | B7: 6
A8: 0.065 | B8: 7
A9: 0.02 | B9: 8
A10: 0.031 | B10: 9
A11: 0.012 | B11: 10
A12: 0.021 | B12: 11
A13: 0.05 | B13: 12
A14: 0 | B14: 13
A15: 0.01 | B15: 14
A16: 0 | B16: 15