Sheet: LOOKUP_test
A1: LOOKUP function | B1: test summary | C1: of:=AND([.C4:.C27]) -> true | D1: This test contains references to the sheet “Data” in file “lookup_source.fods”. Make sure the files “lookup_source.fods” and “lookup_target.fods” are placed in the same directory. | E1: of:=FORMULA([.C1]) -> =AND(C4:C27)
A3: Function | B3: Expected | C3: Correct | D3: Comment | E3: FunctionString
A4: of:=LOOKUP(0;['lookup_source.fods'#$Data.A3:.A8];['lookup_source.fods'#$Data.C3:.C8]) ->  | B4: of:=NA() ->  | C4: of:=AND(ISERROR([.A4]);ISNA([.B4])) -> true | D4: criterion smaller than smallest key | E4: of:=FORMULA([.A4]) -> =LOOKUP(0;'lookup_source.fods'#$Data.A3:A8;'lookup_source.fods'#$Data.C3:C8)
A5: of:=LOOKUP(5;['lookup_source.fods'#$Data.A3:.A8];['lookup_source.fods'#$Data.C3:.C8]) -> 11 | B5: 11 | C5: of:=[.A5]=[.B5] -> true | D5: criterion between keys, take lower | E5: of:=FORMULA([.A5]) -> =LOOKUP(5;'lookup_source.fods'#$Data.A3:A8;'lookup_source.fods'#$Data.C3:C8)
A6: of:=LOOKUP(10;['lookup_source.fods'#$Data.A3:.A8];['lookup_source.fods'#$Data.C3:.C8]) -> 22 | B6: 22 | C6: of:=[.A6]=[.B6] -> true | D6: exact match | E6: of:=FORMULA([.A6]) -> =LOOKUP(10;'lookup_source.fods'#$Data.A3:A8;'lookup_source.fods'#$Data.C3:C8)
A7: of:=LOOKUP("A";['lookup_source.fods'#$Data.A3:.A8];['lookup_source.fods'#$Data.C3:.C8]) ->  | B7: of:=NA() ->  | C7: of:=AND(ISERROR([.A7]);ISNA([.B7])) -> true | D7: criterion text, but match is number | E7: of:=FORMULA([.A7]) -> =LOOKUP("A";'lookup_source.fods'#$Data.A3:A8;'lookup_source.fods'#$Data.C3:C8)
A8: of:=LOOKUP("D";['lookup_source.fods'#$Data.A3:.A8];['lookup_source.fods'#$Data.C3:.C8]) -> 44 | B8: 44 | C8: of:=[.A8]=[.B8] -> true | D8: two exact matches, take upper | E8: of:=FORMULA([.A8]) -> =LOOKUP("D";'lookup_source.fods'#$Data.A3:A8;'lookup_source.fods'#$Data.C3:C8)
A9: of:=LOOKUP("W";['lookup_source.fods'#$Data.A3:.A8];['lookup_source.fods'#$Data.C3:.C4]) ->  | B9: of:=NA() ->  | C9: of:=AND(ISERROR([.A9]);ISNA([.B9])) -> true | D9: external result vector is not expanded | E9: of:=FORMULA([.A9]) -> =LOOKUP("W";'lookup_source.fods'#$Data.A3:A8;'lookup_source.fods'#$Data.C3:C4)
A10: of:=LOOKUP(0;['lookup_source.fods'#$Data.B11:.G11];['lookup_source.fods'#$Data.B13:.G13]) ->  | B10: of:=NA() ->  | C10: of:=AND(ISERROR([.A10]);ISNA([.A10])) -> true | D10: criterion smaller than smallest key | E10: of:=FORMULA([.A10]) -> =LOOKUP(0;'lookup_source.fods'#$Data.B11:G11;'lookup_source.fods'#$Data.B13:G13)
A11: of:=LOOKUP(5;['lookup_source.fods'#$Data.B11:.G11];['lookup_source.fods'#$Data.B13:.G13]) -> 11 | B11: 11 | C11: of:=[.A11]=[.B11] -> true | D11: criterion between keys, take lower | E11: of:=FORMULA([.A11]) -> =LOOKUP(5;'lookup_source.fods'#$Data.B11:G11;'lookup_source.fods'#$Data.B13:G13)
A12: of:=LOOKUP(10;['lookup_source.fods'#$Data.B11:.G11];['lookup_source.fods'#$Data.B13:.G13]) -> 22 | B12: 22 | C12: of:=[.A12]=[.B12] -> true | D12: exact match | E12: of:=FORMULA([.A12]) -> =LOOKUP(10;'lookup_source.fods'#$Data.B11:G11;'lookup_source.fods'#$Data.B13:G13)
A13: of:=LOOKUP("A";['lookup_source.fods'#$Data.B11:.G11];['lookup_source.fods'#$Data.B13:.G13]) ->  | B13: of:=NA() ->  | C13: of:=AND(ISERROR([.A13]);ISNA([.B13])) -> true | D13: criterion text, but match is number | E13: of:=FORMULA([.A13]) -> =LOOKUP("A";'lookup_source.fods'#$Data.B11:G11;'lookup_source.fods'#$Data.B13:G13)
A14: of:=LOOKUP("D";['lookup_source.fods'#$Data.B11:.G11];['lookup_source.fods'#$Data.B13:.G13]) -> 44 | B14: 44 | C14: of:=[.A14]=[.B14] -> true | D14: two exact matches, take upper | E14: of:=FORMULA([.A14]) -> =LOOKUP("D";'lookup_source.fods'#$Data.B11:G11;'lookup_source.fods'#$Data.B13:G13)
A15: of:=LOOKUP("W";['lookup_source.fods'#$Data.B11:.G11];['lookup_source.fods'#$Data.B13:.C13]) ->  | B15: of:=NA() ->  | C15: of:=AND(ISERROR([.A15]);ISNA([.B15])) -> true | D15: external result vector is not expanded | E15: of:=FORMULA([.A15]) -> =LOOKUP("W";'lookup_source.fods'#$Data.B11:G11;'lookup_source.fods'#$Data.B13:C13)
A16: of:=LOOKUP(0;['lookup_source.fods'#$Data.A17:.A22];['lookup_source.fods'#$Data.D16:.I16]) ->  | B16: of:=NA() ->  | C16: of:=AND(ISERROR([.A16]);ISNA([.B16])) -> true | D16: criterion smaller than smallest key | E16: of:=FORMULA([.A16]) -> =LOOKUP(0;'lookup_source.fods'#$Data.A17:A22;'lookup_source.fods'#$Data.D16:I16)
A17: of:=LOOKUP(5;['lookup_source.fods'#$Data.A17:.A22];['lookup_source.fods'#$Data.D16:.I16]) -> 11 | B17: 11 | C17: of:=[.A17]=[.B17] -> true | D17: criterion between keys, take lower | E17: of:=FORMULA([.A17]) -> =LOOKUP(5;'lookup_source.fods'#$Data.A17:A22;'lookup_source.fods'#$Data.D16:I16)
A18: of:=LOOKUP(10;['lookup_source.fods'#$Data.A17:.A22];['lookup_source.fods'#$Data.D16:.I16]) -> 22 | B18: 22 | C18: of:=[.A18]=[.B18] -> true | D18: exact match | E18: of:=FORMULA([.A18]) -> =LOOKUP(10;'lookup_source.fods'#$Data.A17:A22;'lookup_source.fods'#$Data.D16:I16)
A19: of:=LOOKUP("A";['lookup_source.fods'#$Data.A17:.A22];['lookup_source.fods'#$Data.D16:.H16]) ->  | B19: of:=NA() ->  | C19: of:=AND(ISERROR([.A19]);ISNA([.B19])) -> true | D19: criterion text, but match is number | E19: of:=FORMULA([.A19]) -> =LOOKUP("A";'lookup_source.fods'#$Data.A17:A22;'lookup_source.fods'#$Data.D16:H16)
A20: of:=LOOKUP("D";['lookup_source.fods'#$Data.A17:.A22];['lookup_source.fods'#$Data.D16:.I16]) -> 44 | B20: 44 | C20: of:=[.A20]=[.B20] -> true | D20: two exact matches, take upper | E20: of:=FORMULA([.A20]) -> =LOOKUP("D";'lookup_source.fods'#$Data.A17:A22;'lookup_source.fods'#$Data.D16:I16)
A21: of:=LOOKUP("W";['lookup_source.fods'#$Data.A17:.A22];['lookup_source.fods'#$Data.D16:.E16]) ->  | B21: of:=NA() ->  | C21: of:=AND(ISERROR([.A21]);ISNA([.B21])) -> true | D21: external result vector is not expanded | E21: of:=FORMULA([.A21]) -> =LOOKUP("W";'lookup_source.fods'#$Data.A17:A22;'lookup_source.fods'#$Data.D16:E16)
A22: of:=LOOKUP(0;['lookup_source.fods'#$Data.B25:.G25];['lookup_source.fods'#$Data.A28:.A33]) ->  | B22: of:=NA() ->  | C22: of:=AND(ISERROR([.A22]);ISNA([.A22])) -> true | D22: criterion smaller than smallest key | E22: of:=FORMULA([.A22]) -> =LOOKUP(0;'lookup_source.fods'#$Data.B25:G25;'lookup_source.fods'#$Data.A28:A33)
A23: of:=LOOKUP(5;['lookup_source.fods'#$Data.B25:.G25];['lookup_source.fods'#$Data.A28:.A33]) -> 11 | B23: 11 | C23: of:=[.A23]=[.B23] -> true | D23: criterion between keys, take lower | E23: of:=FORMULA([.A23]) -> =LOOKUP(5;'lookup_source.fods'#$Data.B25:G25;'lookup_source.fods'#$Data.A28:A33)
A24: of:=LOOKUP(10;['lookup_source.fods'#$Data.B25:.G25];['lookup_source.fods'#$Data.A28:.A33]) -> 22 | B24: 22 | C24: of:=[.A24]=[.B24] -> true | D24: exact match | E24: of:=FORMULA([.A24]) -> =LOOKUP(10;'lookup_source.fods'#$Data.B25:G25;'lookup_source.fods'#$Data.A28:A33)
A25: of:=LOOKUP("A";['lookup_source.fods'#$Data.B25:.G25];['lookup_source.fods'#$Data.A28:.A33]) ->  | B25: of:=NA() ->  | C25: of:=AND(ISERROR([.A25]);ISNA([.B25])) -> true | D25: criterion text, but match is number | E25: of:=FORMULA([.A25]) -> =LOOKUP("A";'lookup_source.fods'#$Data.B25:G25;'lookup_source.fods'#$Data.A28:A33)
A26: of:=LOOKUP("D";['lookup_source.fods'#$Data.B25:.G25];['lookup_source.fods'#$Data.A28:.A33]) -> 44 | B26: 44 | C26: of:=[.A26]=[.B26] -> true | D26: two exact matches, take upper | E26: of:=FORMULA([.A26]) -> =LOOKUP("D";'lookup_source.fods'#$Data.B25:G25;'lookup_source.fods'#$Data.A28:A33)
A27: of:=LOOKUP("W";['lookup_source.fods'#$Data.B25:.G25];['lookup_source.fods'#$Data.A28:.A29]) ->  | B27: of:=NA() ->  | C27: of:=AND(ISERROR([.A27]);ISNA([.B27])) -> true | D27: external result vector is not expanded | E27: of:=FORMULA([.A27]) -> =LOOKUP("W";'lookup_source.fods'#$Data.B25:G25;'lookup_source.fods'#$Data.A28:A29)

Sheet: 'lookup_target.fods/lookup_target.fods/lookup_target.fods/lookup_target.fods/lookup_target.fods/lookup_source.fods'#Data
A3: Result
A7: Sheet | C7: Description
A8: 2 | C8: Same formulas as in file “lookup_target.fods” but with local references
D11: D | E11: D | F11: T | G11: W
D13: 33 | E13: 44 | F13: 55 | G13: 66
D16: 11 | E16: 22 | F16: 33 | G16: 44 | H16: 55 | I16: 66
D25: D | E25: D | F25: T | G25: W

Sheet: 'lookup_target.fods/lookup_source.fods'#Data
A3: 3 | C3: 11
A4: 10 | C4: 22
A5: D | C5: 33
A6: D | C6: 44
A7: T | C7: 55
A8: W | C8: 66
B11: 3 | C11: 10 | D11: D | E11: D | F11: T | G11: W
B13: 11 | C13: 22 | D13: 33 | E13: 44 | F13: 55 | G13: 66
D16: 11 | E16: 22 | F16: 33 | G16: 44 | H16: 55 | I16: 66
A17: 3
A18: 10
A19: D
A20: D
A21: T
A22: W
B25: 3 | C25: 10 | D25: D | E25: D | F25: T | G25: W
A28: 11
A29: 22
A30: 33
A31: 44
A32: 55
A33: 66

Sheet: 'lookup_source.fods'#Data
A3: 3 | C3: 11
A4: 10 | C4: 22
A5: D | C5: 33
A6: D | C6: 44
A7: T | C7: 55
A8: W | C8: 66
B11: 3 | C11: 10 | D11: D | E11: D | F11: T | G11: W
B13: 11 | C13: 22 | D13: 33 | E13: 44 | F13: 55 | G13: 66
D16: 11 | E16: 22 | F16: 33 | G16: 44 | H16: 55 | I16: 66
A17: 3
A18: 10
A19: D
A20: D
A21: T
A22: W
B25: 3 | C25: 10 | D25: D | E25: D | F25: T | G25: W
A28: 11
A29: 22
A30: 33
A31: 44
A32: 55
A33: 66