Sheet: Feuille1
B1: Integer | E1: Thousand separator | H1: Fraction | K1: Fraction + Thousand separator | N1: Scientific | P1: Engineering
A2: Format | B2: of:="""format=""000000" -> "format="000000 | C2: of:="""format=""??????" -> "format="?????? | D2: of:="""format=""??0000" -> "format="??0000 | E2: of:="""format=""000,000" -> "format="000,000 | F2: of:="""format=""???,???" -> "format="???,??? | G2: of:="""format=""??0,000" -> "format="??0,000 | H2: of:="""format=""000 ?/?" -> "format="000 ?/? | I2: of:="""format=""??? ?/?" -> "format="??? ?/? | J2: of:="""format=""?00 ?/?" -> "format="?00 ?/? | K2: of:="""format=""0,000 ?/?" -> "format="0,000 ?/? | L2: of:="""format=""?,??? ?/?" -> "format="?,??? ?/? | M2: of:="""format=""?,?00 ?/?" -> "format="?,?00 ?/? | N2: of:="""format=""0E+00" -> "format="0E+00 | O2: of:="""format=""?E+00" -> "format="?E+00 | P2: of:="""format=""000E+00" -> "format="000E+00 | Q2: of:="""format=""???E+00" -> "format="???E+00 | R2: of:="""format=""?00E+00" -> "format="?00E+00
A3: 0.123456 | B3: of:=[.$A3] -> 0.123456 | C3: of:=[.$A3] -> 0.123456 | D3: of:=[.$A3] -> 0.123456 | E3: of:=[.$A3] -> 0.123456 | F3: of:=[.$A3] -> 0.123456 | G3: of:=[.$A3] -> 0.123456 | H3: of:=[.$A3] -> 0.123456 | I3: of:=[.$A3] -> 0.123456 | J3: of:=[.$A3] -> 0.123456 | K3: of:=[.$A3] -> 0.123456 | L3: of:=[.$A3] -> 0.123456 | M3: of:=[.$A3] -> 0.123456 | N3: of:=[.$A3] -> 0.123456 | O3: of:=[.$A3] -> 0.123456 | P3: of:=[.$A3] -> 0.123456 | Q3: of:=[.$A3] -> 0.123456 | R3: of:=[.$A3] -> 0.123456
A4: of:=[.A3]*10 -> 1.23456 | B4: of:=[.$A4] -> 1.23456 | C4: of:=[.$A4] -> 1.23456 | D4: of:=[.$A4] -> 1.23456 | E4: of:=[.$A4] -> 1.23456 | F4: of:=[.$A4] -> 1.23456 | G4: of:=[.$A4] -> 1.23456 | H4: of:=[.$A4] -> 1.23456 | I4: of:=[.$A4] -> 1.23456 | J4: of:=[.$A4] -> 1.23456 | K4: of:=[.$A4] -> 1.23456 | L4: of:=[.$A4] -> 1.23456 | M4: of:=[.$A4] -> 1.23456 | N4: of:=[.$A4] -> 1.23456 | O4: of:=[.$A4] -> 1.23456 | P4: of:=[.$A4] -> 1.23456 | Q4: of:=[.$A4] -> 1.23456 | R4: of:=[.$A4] -> 1.23456
A5: of:=[.A4]*10 -> 12.3456 | B5: of:=[.$A5] -> 12.3456 | C5: of:=[.$A5] -> 12.3456 | D5: of:=[.$A5] -> 12.3456 | E5: of:=[.$A5] -> 12.3456 | F5: of:=[.$A5] -> 12.3456 | G5: of:=[.$A5] -> 12.3456 | H5: of:=[.$A5] -> 12.3456 | I5: of:=[.$A5] -> 12.3456 | J5: of:=[.$A5] -> 12.3456 | K5: of:=[.$A5] -> 12.3456 | L5: of:=[.$A5] -> 12.3456 | M5: of:=[.$A5] -> 12.3456 | N5: of:=[.$A5] -> 12.3456 | O5: of:=[.$A5] -> 12.3456 | P5: of:=[.$A5] -> 12.3456 | Q5: of:=[.$A5] -> 12.3456 | R5: of:=[.$A5] -> 12.3456
A6: of:=[.A5]*10 -> 123.456 | B6: of:=[.$A6] -> 123.456 | C6: of:=[.$A6] -> 123.456 | D6: of:=[.$A6] -> 123.456 | E6: of:=[.$A6] -> 123.456 | F6: of:=[.$A6] -> 123.456 | G6: of:=[.$A6] -> 123.456 | H6: of:=[.$A6] -> 123.456 | I6: of:=[.$A6] -> 123.456 | J6: of:=[.$A6] -> 123.456 | K6: of:=[.$A6] -> 123.456 | L6: of:=[.$A6] -> 123.456 | M6: of:=[.$A6] -> 123.456 | N6: of:=[.$A6] -> 123.456 | O6: of:=[.$A6] -> 123.456 | P6: of:=[.$A6] -> 123.456 | Q6: of:=[.$A6] -> 123.456 | R6: of:=[.$A6] -> 123.456
A7: of:=[.A6]*10 -> 1234.56 | B7: of:=[.$A7] -> 1234.56 | C7: of:=[.$A7] -> 1234.56 | D7: of:=[.$A7] -> 1234.56 | E7: of:=[.$A7] -> 1234.56 | F7: of:=[.$A7] -> 1234.56 | G7: of:=[.$A7] -> 1234.56 | H7: of:=[.$A7] -> 1234.56 | I7: of:=[.$A7] -> 1234.56 | J7: of:=[.$A7] -> 1234.56 | K7: of:=[.$A7] -> 1234.56 | L7: of:=[.$A7] -> 1234.56 | M7: of:=[.$A7] -> 1234.56 | N7: of:=[.$A7] -> 1234.56 | O7: of:=[.$A7] -> 1234.56 | P7: of:=[.$A7] -> 1234.56 | Q7: of:=[.$A7] -> 1234.56 | R7: of:=[.$A7] -> 1234.56
A8: of:=[.A7]*10 -> 12345.6 | B8: of:=[.$A8] -> 12345.6 | C8: of:=[.$A8] -> 12345.6 | D8: of:=[.$A8] -> 12345.6 | E8: of:=[.$A8] -> 12345.6 | F8: of:=[.$A8] -> 12345.6 | G8: of:=[.$A8] -> 12345.6 | H8: of:=[.$A8] -> 12345.6 | I8: of:=[.$A8] -> 12345.6 | J8: of:=[.$A8] -> 12345.6 | K8: of:=[.$A8] -> 12345.6 | L8: of:=[.$A8] -> 12345.6 | M8: of:=[.$A8] -> 12345.6 | N8: of:=[.$A8] -> 12345.6 | O8: of:=[.$A8] -> 12345.6 | P8: of:=[.$A8] -> 12345.6 | Q8: of:=[.$A8] -> 12345.6 | R8: of:=[.$A8] -> 12345.6
A9: of:=[.A8]*10 -> 123456 | B9: of:=[.$A9] -> 123456 | C9: of:=[.$A9] -> 123456 | D9: of:=[.$A9] -> 123456 | E9: of:=[.$A9] -> 123456 | F9: of:=[.$A9] -> 123456 | G9: of:=[.$A9] -> 123456 | H9: of:=[.$A9] -> 123456 | I9: of:=[.$A9] -> 123456 | J9: of:=[.$A9] -> 123456 | K9: of:=[.$A9] -> 123456 | L9: of:=[.$A9] -> 123456 | M9: of:=[.$A9] -> 123456 | N9: of:=[.$A9] -> 123456 | O9: of:=[.$A9] -> 123456 | P9: of:=[.$A9] -> 123456 | Q9: of:=[.$A9] -> 123456 | R9: of:=[.$A9] -> 123456
A10: of:=[.A9]*10 -> 1234560 | B10: of:=[.$A10] -> 1234560 | C10: of:=[.$A10] -> 1234560 | D10: of:=[.$A10] -> 1234560 | E10: of:=[.$A10] -> 1234560 | F10: of:=[.$A10] -> 1234560 | G10: of:=[.$A10] -> 1234560 | H10: of:=[.$A10] -> 1234560 | I10: of:=[.$A10] -> 1234560 | J10: of:=[.$A10] -> 1234560 | K10: of:=[.$A10] -> 1234560 | L10: of:=[.$A10] -> 1234560 | M10: of:=[.$A10] -> 1234560 | N10: of:=[.$A10] -> 1234560 | O10: of:=[.$A10] -> 1234560 | P10: of:=[.$A10] -> 1234560 | Q10: of:=[.$A10] -> 1234560 | R10: of:=[.$A10] -> 1234560
A11: of:=[.A10]*10 -> 12345600 | B11: of:=[.$A11] -> 12345600 | C11: of:=[.$A11] -> 12345600 | D11: of:=[.$A11] -> 12345600 | E11: of:=[.$A11] -> 12345600 | F11: of:=[.$A11] -> 12345600 | G11: of:=[.$A11] -> 12345600 | H11: of:=[.$A11] -> 12345600 | I11: of:=[.$A11] -> 12345600 | J11: of:=[.$A11] -> 12345600 | K11: of:=[.$A11] -> 12345600 | L11: of:=[.$A11] -> 12345600 | M11: of:=[.$A11] -> 12345600 | N11: of:=[.$A11] -> 12345600 | O11: of:=[.$A11] -> 12345600 | P11: of:=[.$A11] -> 12345600 | Q11: of:=[.$A11] -> 12345600 | R11: of:=[.$A11] -> 12345600
A12: of:=-[.A3] -> -0.123456 | B12: of:=[.$A12] -> -0.123456 | C12: of:=[.$A12] -> -0.123456 | D12: of:=[.$A12] -> -0.123456 | E12: of:=[.$A12] -> -0.123456 | F12: of:=[.$A12] -> -0.123456 | G12: of:=[.$A12] -> -0.123456 | H12: of:=[.$A12] -> -0.123456 | I12: of:=[.$A12] -> -0.123456 | J12: of:=[.$A12] -> -0.123456 | K12: of:=[.$A12] -> -0.123456 | L12: of:=[.$A12] -> -0.123456 | M12: of:=[.$A12] -> -0.123456 | N12: of:=[.$A12] -> -0.123456 | O12: of:=[.$A12] -> -0.123456 | P12: of:=[.$A12] -> -0.123456 | Q12: of:=[.$A12] -> -0.123456 | R12: of:=[.$A12] -> -0.123456
A13: of:=[.A12]*10 -> -1.23456 | B13: of:=[.$A13] -> -1.23456 | C13: of:=[.$A13] -> -1.23456 | D13: of:=[.$A13] -> -1.23456 | E13: of:=[.$A13] -> -1.23456 | F13: of:=[.$A13] -> -1.23456 | G13: of:=[.$A13] -> -1.23456 | H13: of:=[.$A13] -> -1.23456 | I13: of:=[.$A13] -> -1.23456 | J13: of:=[.$A13] -> -1.23456 | K13: of:=[.$A13] -> -1.23456 | L13: of:=[.$A13] -> -1.23456 | M13: of:=[.$A13] -> -1.23456 | N13: of:=[.$A13] -> -1.23456 | O13: of:=[.$A13] -> -1.23456 | P13: of:=[.$A13] -> -1.23456 | Q13: of:=[.$A13] -> -1.23456 | R13: of:=[.$A13] -> -1.23456
A14: of:=[.A13]*10 -> -12.3456 | B14: of:=[.$A14] -> -12.3456 | C14: of:=[.$A14] -> -12.3456 | D14: of:=[.$A14] -> -12.3456 | E14: of:=[.$A14] -> -12.3456 | F14: of:=[.$A14] -> -12.3456 | G14: of:=[.$A14] -> -12.3456 | H14: of:=[.$A14] -> -12.3456 | I14: of:=[.$A14] -> -12.3456 | J14: of:=[.$A14] -> -12.3456 | K14: of:=[.$A14] -> -12.3456 | L14: of:=[.$A14] -> -12.3456 | M14: of:=[.$A14] -> -12.3456 | N14: of:=[.$A14] -> -12.3456 | O14: of:=[.$A14] -> -12.3456 | P14: of:=[.$A14] -> -12.3456 | Q14: of:=[.$A14] -> -12.3456 | R14: of:=[.$A14] -> -12.3456
A15: of:=[.A14]*10 -> -123.456 | B15: of:=[.$A15] -> -123.456 | C15: of:=[.$A15] -> -123.456 | D15: of:=[.$A15] -> -123.456 | E15: of:=[.$A15] -> -123.456 | F15: of:=[.$A15] -> -123.456 | G15: of:=[.$A15] -> -123.456 | H15: of:=[.$A15] -> -123.456 | I15: of:=[.$A15] -> -123.456 | J15: of:=[.$A15] -> -123.456 | K15: of:=[.$A15] -> -123.456 | L15: of:=[.$A15] -> -123.456 | M15: of:=[.$A15] -> -123.456 | N15: of:=[.$A15] -> -123.456 | O15: of:=[.$A15] -> -123.456 | P15: of:=[.$A15] -> -123.456 | Q15: of:=[.$A15] -> -123.456 | R15: of:=[.$A15] -> -123.456
A16: of:=[.A15]*10 -> -1234.56 | B16: of:=[.$A16] -> -1234.56 | C16: of:=[.$A16] -> -1234.56 | D16: of:=[.$A16] -> -1234.56 | E16: of:=[.$A16] -> -1234.56 | F16: of:=[.$A16] -> -1234.56 | G16: of:=[.$A16] -> -1234.56 | H16: of:=[.$A16] -> -1234.56 | I16: of:=[.$A16] -> -1234.56 | J16: of:=[.$A16] -> -1234.56 | K16: of:=[.$A16] -> -1234.56 | L16: of:=[.$A16] -> -1234.56 | M16: of:=[.$A16] -> -1234.56 | N16: of:=[.$A16] -> -1234.56 | O16: of:=[.$A16] -> -1234.56 | P16: of:=[.$A16] -> -1234.56 | Q16: of:=[.$A16] -> -1234.56 | R16: of:=[.$A16] -> -1234.56
A17: of:=[.A16]*10 -> -12345.6 | B17: of:=[.$A17] -> -12345.6 | C17: of:=[.$A17] -> -12345.6 | D17: of:=[.$A17] -> -12345.6 | E17: of:=[.$A17] -> -12345.6 | F17: of:=[.$A17] -> -12345.6 | G17: of:=[.$A17] -> -12345.6 | H17: of:=[.$A17] -> -12345.6 | I17: of:=[.$A17] -> -12345.6 | J17: of:=[.$A17] -> -12345.6 | K17: of:=[.$A17] -> -12345.6 | L17: of:=[.$A17] -> -12345.6 | M17: of:=[.$A17] -> -12345.6 | N17: of:=[.$A17] -> -12345.6 | O17: of:=[.$A17] -> -12345.6 | P17: of:=[.$A17] -> -12345.6 | Q17: of:=[.$A17] -> -12345.6 | R17: of:=[.$A17] -> -12345.6
A18: of:=[.A17]*10 -> -123456 | B18: of:=[.$A18] -> -123456 | C18: of:=[.$A18] -> -123456 | D18: of:=[.$A18] -> -123456 | E18: of:=[.$A18] -> -123456 | F18: of:=[.$A18] -> -123456 | G18: of:=[.$A18] -> -123456 | H18: of:=[.$A18] -> -123456 | I18: of:=[.$A18] -> -123456 | J18: of:=[.$A18] -> -123456 | K18: of:=[.$A18] -> -123456 | L18: of:=[.$A18] -> -123456 | M18: of:=[.$A18] -> -123456 | N18: of:=[.$A18] -> -123456 | O18: of:=[.$A18] -> -123456 | P18: of:=[.$A18] -> -123456 | Q18: of:=[.$A18] -> -123456 | R18: of:=[.$A18] -> -123456
A19: of:=[.A18]*10 -> -1234560 | B19: of:=[.$A19] -> -1234560 | C19: of:=[.$A19] -> -1234560 | D19: of:=[.$A19] -> -1234560 | E19: of:=[.$A19] -> -1234560 | F19: of:=[.$A19] -> -1234560 | G19: of:=[.$A19] -> -1234560 | H19: of:=[.$A19] -> -1234560 | I19: of:=[.$A19] -> -1234560 | J19: of:=[.$A19] -> -1234560 | K19: of:=[.$A19] -> -1234560 | L19: of:=[.$A19] -> -1234560 | M19: of:=[.$A19] -> -1234560 | N19: of:=[.$A19] -> -1234560 | O19: of:=[.$A19] -> -1234560 | P19: of:=[.$A19] -> -1234560 | Q19: of:=[.$A19] -> -1234560 | R19: of:=[.$A19] -> -1234560
A20: of:=[.A19]*10 -> -12345600 | B20: of:=[.$A20] -> -12345600 | C20: of:=[.$A20] -> -12345600 | D20: of:=[.$A20] -> -12345600 | E20: of:=[.$A20] -> -12345600 | F20: of:=[.$A20] -> -12345600 | G20: of:=[.$A20] -> -12345600 | H20: of:=[.$A20] -> -12345600 | I20: of:=[.$A20] -> -12345600 | J20: of:=[.$A20] -> -12345600 | K20: of:=[.$A20] -> -12345600 | L20: of:=[.$A20] -> -12345600 | M20: of:=[.$A20] -> -12345600 | N20: of:=[.$A20] -> -12345600 | O20: of:=[.$A20] -> -12345600 | P20: of:=[.$A20] -> -12345600 | Q20: of:=[.$A20] -> -12345600 | R20: of:=[.$A20] -> -12345600
A21: 0.2 | B21: of:=[.$A21] -> 0.2 | C21: of:=[.$A21] -> 0.2 | D21: of:=[.$A21] -> 0.2 | E21: of:=[.$A21] -> 0.2 | F21: of:=[.$A21] -> 0.2 | G21: of:=[.$A21] -> 0.2 | H21: of:=[.$A21] -> 0.2 | I21: of:=[.$A21] -> 0.2 | J21: of:=[.$A21] -> 0.2 | K21: of:=[.$A21] -> 0.2 | L21: of:=[.$A21] -> 0.2 | M21: of:=[.$A21] -> 0.2 | N21: of:=[.$A21] -> 0.2 | O21: of:=[.$A21] -> 0.2 | P21: of:=[.$A21] -> 0.2 | Q21: of:=[.$A21] -> 0.2 | R21: of:=[.$A21] -> 0.2
A22: of:=[.A21]*10 -> 2 | B22: of:=[.$A22] -> 2 | C22: of:=[.$A22] -> 2 | D22: of:=[.$A22] -> 2 | E22: of:=[.$A22] -> 2 | F22: of:=[.$A22] -> 2 | G22: of:=[.$A22] -> 2 | H22: of:=[.$A22] -> 2 | I22: of:=[.$A22] -> 2 | J22: of:=[.$A22] -> 2 | K22: of:=[.$A22] -> 2 | L22: of:=[.$A22] -> 2 | M22: of:=[.$A22] -> 2 | N22: of:=[.$A22] -> 2 | O22: of:=[.$A22] -> 2 | P22: of:=[.$A22] -> 2 | Q22: of:=[.$A22] -> 2 | R22: of:=[.$A22] -> 2
A23: of:=[.A22]*10 -> 20 | B23: of:=[.$A23] -> 20 | C23: of:=[.$A23] -> 20 | D23: of:=[.$A23] -> 20 | E23: of:=[.$A23] -> 20 | F23: of:=[.$A23] -> 20 | G23: of:=[.$A23] -> 20 | H23: of:=[.$A23] -> 20 | I23: of:=[.$A23] -> 20 | J23: of:=[.$A23] -> 20 | K23: of:=[.$A23] -> 20 | L23: of:=[.$A23] -> 20 | M23: of:=[.$A23] -> 20 | N23: of:=[.$A23] -> 20 | O23: of:=[.$A23] -> 20 | P23: of:=[.$A23] -> 20 | Q23: of:=[.$A23] -> 20 | R23: of:=[.$A23] -> 20
A24: of:=[.A23]*10 -> 200 | B24: of:=[.$A24] -> 200 | C24: of:=[.$A24] -> 200 | D24: of:=[.$A24] -> 200 | E24: of:=[.$A24] -> 200 | F24: of:=[.$A24] -> 200 | G24: of:=[.$A24] -> 200 | H24: of:=[.$A24] -> 200 | I24: of:=[.$A24] -> 200 | J24: of:=[.$A24] -> 200 | K24: of:=[.$A24] -> 200 | L24: of:=[.$A24] -> 200 | M24: of:=[.$A24] -> 200 | N24: of:=[.$A24] -> 200 | O24: of:=[.$A24] -> 200 | P24: of:=[.$A24] -> 200 | Q24: of:=[.$A24] -> 200 | R24: of:=[.$A24] -> 200
A25: of:=[.A24]*10 -> 2000 | B25: of:=[.$A25] -> 2000 | C25: of:=[.$A25] -> 2000 | D25: of:=[.$A25] -> 2000 | E25: of:=[.$A25] -> 2000 | F25: of:=[.$A25] -> 2000 | G25: of:=[.$A25] -> 2000 | H25: of:=[.$A25] -> 2000 | I25: of:=[.$A25] -> 2000 | J25: of:=[.$A25] -> 2000 | K25: of:=[.$A25] -> 2000 | L25: of:=[.$A25] -> 2000 | M25: of:=[.$A25] -> 2000 | N25: of:=[.$A25] -> 2000 | O25: of:=[.$A25] -> 2000 | P25: of:=[.$A25] -> 2000 | Q25: of:=[.$A25] -> 2000 | R25: of:=[.$A25] -> 2000
A26: of:=[.A25]*10 -> 20000 | B26: of:=[.$A26] -> 20000 | C26: of:=[.$A26] -> 20000 | D26: of:=[.$A26] -> 20000 | E26: of:=[.$A26] -> 20000 | F26: of:=[.$A26] -> 20000 | G26: of:=[.$A26] -> 20000 | H26: of:=[.$A26] -> 20000 | I26: of:=[.$A26] -> 20000 | J26: of:=[.$A26] -> 20000 | K26: of:=[.$A26] -> 20000 | L26: of:=[.$A26] -> 20000 | M26: of:=[.$A26] -> 20000 | N26: of:=[.$A26] -> 20000 | O26: of:=[.$A26] -> 20000 | P26: of:=[.$A26] -> 20000 | Q26: of:=[.$A26] -> 20000 | R26: of:=[.$A26] -> 20000
A27: of:=[.A26]*10 -> 200000 | B27: of:=[.$A27] -> 200000 | C27: of:=[.$A27] -> 200000 | D27: of:=[.$A27] -> 200000 | E27: of:=[.$A27] -> 200000 | F27: of:=[.$A27] -> 200000 | G27: of:=[.$A27] -> 200000 | H27: of:=[.$A27] -> 200000 | I27: of:=[.$A27] -> 200000 | J27: of:=[.$A27] -> 200000 | K27: of:=[.$A27] -> 200000 | L27: of:=[.$A27] -> 200000 | M27: of:=[.$A27] -> 200000 | N27: of:=[.$A27] -> 200000 | O27: of:=[.$A27] -> 200000 | P27: of:=[.$A27] -> 200000 | Q27: of:=[.$A27] -> 200000 | R27: of:=[.$A27] -> 200000
A28: of:=[.A27]*10 -> 2000000 | B28: of:=[.$A28] -> 2000000 | C28: of:=[.$A28] -> 2000000 | D28: of:=[.$A28] -> 2000000 | E28: of:=[.$A28] -> 2000000 | F28: of:=[.$A28] -> 2000000 | G28: of:=[.$A28] -> 2000000 | H28: of:=[.$A28] -> 2000000 | I28: of:=[.$A28] -> 2000000 | J28: of:=[.$A28] -> 2000000 | K28: of:=[.$A28] -> 2000000 | L28: of:=[.$A28] -> 2000000 | M28: of:=[.$A28] -> 2000000 | N28: of:=[.$A28] -> 2000000 | O28: of:=[.$A28] -> 2000000 | P28: of:=[.$A28] -> 2000000 | Q28: of:=[.$A28] -> 2000000 | R28: of:=[.$A28] -> 2000000
A29: of:=[.A28]*10 -> 20000000 | B29: of:=[.$A29] -> 20000000 | C29: of:=[.$A29] -> 20000000 | D29: of:=[.$A29] -> 20000000 | E29: of:=[.$A29] -> 20000000 | F29: of:=[.$A29] -> 20000000 | G29: of:=[.$A29] -> 20000000 | H29: of:=[.$A29] -> 20000000 | I29: of:=[.$A29] -> 20000000 | J29: of:=[.$A29] -> 20000000 | K29: of:=[.$A29] -> 20000000 | L29: of:=[.$A29] -> 20000000 | M29: of:=[.$A29] -> 20000000 | N29: of:=[.$A29] -> 20000000 | O29: of:=[.$A29] -> 20000000 | P29: of:=[.$A29] -> 20000000 | Q29: of:=[.$A29] -> 20000000 | R29: of:=[.$A29] -> 20000000
A30: of:=[.A29]*10 -> 200000000 | B30: of:=[.$A30] -> 200000000 | C30: of:=[.$A30] -> 200000000 | D30: of:=[.$A30] -> 200000000 | E30: of:=[.$A30] -> 200000000 | F30: of:=[.$A30] -> 200000000 | G30: of:=[.$A30] -> 200000000 | H30: of:=[.$A30] -> 200000000 | I30: of:=[.$A30] -> 200000000 | J30: of:=[.$A30] -> 200000000 | K30: of:=[.$A30] -> 200000000 | L30: of:=[.$A30] -> 200000000 | M30: of:=[.$A30] -> 200000000 | N30: of:=[.$A30] -> 200000000 | O30: of:=[.$A30] -> 200000000 | P30: of:=[.$A30] -> 200000000 | Q30: of:=[.$A30] -> 200000000 | R30: of:=[.$A30] -> 200000000